id,platform,platform_type,url,content_type,timestamp,scraper_module,text,raw_text,scrape_date,tokens
1989888051460673695,twitter,post,https://x.com/Suifong_DPX/status/1989888051460673695,text,2025-11-16T02:47:36.000Z,selenium_x_scraper_v1,โคตรจริง ขนาดเป็นผู้ชาย มาอ่านแล้วยังคิดว่าโคตรจริงเลยครับ,โคตรจริง ขนาดเป็นผู้ชาย มาอ่านแล้วยังคิดว่าโคตรจริงเลยครับ,2025-11-29 08:18:55,"['โคตร', 'จริง', ' ', 'ขนาด', 'เป็น', 'ผู้ชาย', ' ', 'มา', 'อ่าน', 'แล้ว', 'ยัง', 'คิด', 'ว่า', 'โคตร', 'จริง', 'เลย', 'ครับ']"
1990087405517599148,twitter,post,https://x.com/Toviv2/status/1990087405517599148,text,2025-11-16T15:59:46.000Z,selenium_x_scraper_v1,ผู้หญิงที่ได้ดีแล้วทิ้งผู้ชายก็เยอะ หรือมีคนรวยมาจีบก็ถีบหัวส่งผู้ก็มีแต่ไม่พูด แต่เลือกที่จะโจมตีผู้ชายฝ่ายเดียว งงนะ,ผู้หญิงที่ได้ดีแล้วทิ้งผู้ชายก็เยอะ หรือมีคนรวยมาจีบก็ถีบหัวส่งผู้ก็มีแต่ไม่พูด แต่เลือกที่จะโจมตีผู้ชายฝ่ายเดียว งงนะ,2025-11-29 08:18:55,"['ผู้หญิง', 'ที่', 'ได้', 'ดีแล้ว', 'ทิ้ง', 'ผู้ชาย', 'ก็', 'เยอะ', ' ', 'หรือ', 'มี', 'คนรวย', 'มา', 'จีบ', 'ก็', 'ถีบหัวส่ง', 'ผู้', 'ก็', 'มี', 'แต่', 'ไม่', 'พูด', ' ', 'แต่', 'เลือก', 'ที่จะ', 'โจมตี', 'ผู้ชาย', 'ฝ่าย', 'เดียว', ' ', 'งง', 'นะ']"
1989719011190608267,twitter,post,https://x.com/__somsri/status/1989719011190608267,text,2025-11-15T15:35:54.000Z,selenium_x_scraper_v1,แล้วถ้า ผญ ทำบ้างล่ะคะ จะโดนด่ามั้ย,แล้วถ้า ผญ ทำบ้างล่ะคะ จะโดนด่ามั้ย,2025-11-29 08:18:55,"['แล้ว', 'ถ้า', ' ', 'ผญ', ' ', 'ทำ', 'บ้าง', 'ล่ะ', 'คะ', ' ', 'จะ', 'โดน', 'ด่า', 'มั้ย']"
1989903088313127381,twitter,post,https://x.com/ToonyPoko/status/1989903088313127381,text,2025-11-16T03:47:21.000Z,selenium_x_scraper_v1,ในช่วงที่ทำให้เขาดีขึ้นเราเองก็อย่าหยุดพัฒนาตัวเองด้วยเช่นกันค่ะ รักเขาขนาดไหนก็อย่าลืมรักอนาคตตัวเอง,ในช่วงที่ทำให้เขาดีขึ้นเราเองก็อย่าหยุดพัฒนาตัวเองด้วยเช่นกันค่ะ รักเขาขนาดไหนก็อย่าลืมรักอนาคตตัวเอง,2025-11-29 08:18:55,"['ใน', 'ช่วง', 'ที่', 'ทำให้', 'เขา', 'ดีขึ้น', 'เรา', 'เอง', 'ก็', 'อย่า', 'หยุด', 'พัฒนา', 'ตัวเอง', 'ด้วย', 'เช่นกัน', 'ค่ะ', ' ', 'รัก', 'เขา', 'ขนาด', 'ไหน', 'ก็', 'อย่า', 'ลืม', 'รัก', 'อนาคต', 'ตัวเอง']"
1989635191791587642,twitter,post,https://x.com/benyajang/status/1989635191791587642,text,2025-11-15T10:02:50.000Z,selenium_x_scraper_v1,เค้าเบื่อรึเปล่าค่ะ,เค้าเบื่อรึเปล่าค่ะ,2025-11-29 08:18:55,"['เค้า', 'เบื่อ', 'รึเปล่า', 'ค่ะ']"
1989884132206547137,twitter,post,https://x.com/kkurtmack/status/1989884132206547137,text,2025-11-16T02:32:02.000Z,selenium_x_scraper_v1,ก็ไปเอาผัวแก่สิ จะคบคนรุ่นเดียวกับตัวเอง เพื่อ ?????,ก็ไปเอาผัวแก่สิ จะคบคนรุ่นเดียวกับตัวเอง เพื่อ ?????,2025-11-29 08:18:55,"['ก็', 'ไป', 'เอา', 'ผัว', 'แก่', 'สิ', ' ', 'จะ', 'คบ', 'คน', 'รุ่น', 'เดียว', 'กับ', 'ตัวเอง', ' ', 'เพื่อ', ' ', '?']"
1989903979992813740,twitter,post,https://x.com/RSricand50303/status/1989903979992813740,text,2025-11-16T03:50:54.000Z,selenium_x_scraper_v1,แค่เล่นชิล ๆ ก็มีความสุขเพิ่มทุกวัน   คลิกเลย ของดีบอกต่อไม่รอแล้วนะ ,แค่เล่นชิล ๆ ก็มีความสุขเพิ่มทุกวัน   คลิกเลย ของดีบอกต่อไม่รอแล้วนะ ,2025-11-29 08:18:55,"['แค่', 'เล่น', 'ชิล', ' ', 'ๆ', ' ', 'ก็', 'มีความสุข', 'เพิ่ม', 'ทุกวัน', ' ', 'คลิก', 'เลย', ' ', 'ของดี', 'บอกต่อ', 'ไม่', 'รอ', 'แล้ว', 'นะ']"
1989665384233152841,twitter,post,https://x.com/aleipmll_stu/status/1989665384233152841,text,2025-11-15T12:02:48.000Z,selenium_x_scraper_v1,ประโยคเชี่ยนี่อีกแล้วมันจริงตรงไหนวะ555555555555,ประโยคเชี่ยนี่อีกแล้วมันจริงตรงไหนวะ555555555555,2025-11-29 08:18:55,"['ประโยค', 'เชี่ย', 'นี่', 'อีกแล้ว', 'มัน', 'จริง', 'ตรงไหน', 'วะ', 'หัวเราะ']"
1989975687760060659,twitter,post,https://x.com/BryanMuscleMon/status/1989975687760060659,text,2025-11-16T08:35:50.000Z,selenium_x_scraper_v1,จริงครับ เศร้า,จริงครับ เศร้า,2025-11-29 08:18:55,"['จริง', 'ครับ', ' ', 'เศร้า']"
1989938312166162432,twitter,post,https://x.com/KraziiBeeRVP/status/1989938312166162432,text,2025-11-16T06:07:19.000Z,selenium_x_scraper_v1,ตอนแรกๆอยู่กันเพราะตัวเองไม่มีอะไรดีค่ะ ต่อมามีทุกอย่างแล้วจึงสามารถไปหาผู้หญิงที่ตัวเองต้องการมาตลอดได้ ก็แค่นั้นค่ะ,ตอนแรกๆอยู่กันเพราะตัวเองไม่มีอะไรดีค่ะ ต่อมามีทุกอย่างแล้วจึงสามารถไปหาผู้หญิงที่ตัวเองต้องการมาตลอดได้ ก็แค่นั้นค่ะ,2025-11-29 08:18:55,"['ตอนแรก', 'ๆ', 'อยู่', 'กัน', 'เพราะ', 'ตัวเอง', 'ไม่', 'มี', 'อะไร', 'ดี', 'ค่ะ', ' ', 'ต่อมา', 'มี', 'ทุกอย่าง', 'แล้วจึง', 'สามารถ', 'ไปหา', 'ผู้หญิง', 'ที่', 'ตัวเอง', 'ต้องการ', 'มา', 'ตลอด', 'ได้', ' ', 'ก็', 'แค่นั้น', 'ค่ะ']"
1989953877157056775,twitter,post,https://x.com/underdaseaaaaaa/status/1989953877157056775,text,2025-11-16T07:09:10.000Z,selenium_x_scraper_v1,อันนี้พูดในมุมผชหรือผญมันก็เหมือนกันมั้ยครับ ขนาดผญยังอยากคบคนที่เก่งเท่ากับหรือมากกว่าตัวเองเลย ไม่เกี่ยวว่าต้องเป็นเพศไหนหรอก แต่ถ้าเราไปปั้นใครเก่งขึ้นแล้วเรายังอยู่ที่เดิม มันก็ไปไม่รอดหรอกครับ,อันนี้พูดในมุมผชหรือผญมันก็เหมือนกันมั้ยครับ ขนาดผญยังอยากคบคนที่เก่งเท่ากับหรือมากกว่าตัวเองเลย ไม่เกี่ยวว่าต้องเป็นเพศไหนหรอก แต่ถ้าเราไปปั้นใครเก่งขึ้นแล้วเรายังอยู่ที่เดิม มันก็ไปไม่รอดหรอกครับ,2025-11-29 08:18:55,"['อันนี้', 'พูด', 'ใน', 'มุม', 'ผช', 'หรือ', 'ผญ', 'มัน', 'ก็', 'เหมือนกัน', 'มั้ย', 'ครับ', ' ', 'ขนาด', 'ผญ', 'ยัง', 'อยาก', 'คบ', 'คน', 'ที่', 'เก่ง', 'เท่ากับ', 'หรือ', 'มากกว่า', 'ตัวเอง', 'เลย', ' ', 'ไม่', 'เกี่ยว', 'ว่า', 'ต้อง', 'เป็น', 'เพศ', 'ไหน', 'หรอก', ' ', 'แต่', 'ถ้า', 'เรา', 'ไป', 'ปั้น', 'ใคร', 'เก่ง', 'ขึ้น', 'แล้ว', 'เรา', 'ยังอยู่', 'ที่', 'เดิม', ' ', 'มัน', 'ก็', 'ไป', 'ไม่', 'รอด', 'หรอก', 'ครับ']"
1989630178507862222,twitter,post,https://x.com/jajibiba/status/1989630178507862222,text,2025-11-15T09:42:54.000Z,selenium_x_scraper_v1,ตอนกำลังสร้างตัวมันคว้านางในฝันไม่ถึง เลยเลือกจีบผญที่แค่เอื้อมถึงก่อน พามันสร้างไป พอสำเร็จก็ไปคว้าเอานางในฝัน กุคนนึงเกลียดผชด่าผญหน้าเงิน gold diggerเพราะไม่ยอมสร้างไปด้วยกัน,ตอนกำลังสร้างตัวมันคว้านางในฝันไม่ถึง เลยเลือกจีบผญที่แค่เอื้อมถึงก่อน พามันสร้างไป พอสำเร็จก็ไปคว้าเอานางในฝัน กุคนนึงเกลียดผชด่าผญหน้าเงิน gold diggerเพราะไม่ยอมสร้างไปด้วยกัน,2025-11-29 08:18:55,"['ตอน', 'กำลัง', 'สร้างตัว', 'มัน', 'คว้า', 'นางใน', 'ฝัน', 'ไม่', 'ถึง', ' ', 'เลย', 'เลือก', 'จีบ', 'ผญ', 'ที่', 'แค่เอื้อม', 'ถึง', 'ก่อน', ' ', 'พา', 'มัน', 'สร้าง', 'ไป', ' ', 'พอ', 'สำเร็จ', 'ก็', 'ไป', 'คว้า', 'เอา', 'นางใน', 'ฝัน', ' ', 'กุ', 'คน', 'นึง', 'เกลียด', 'ผช', 'ด่า', 'ผญ', 'หน้า', 'เงิน', ' ', 'gold', ' ', 'digger', 'เพราะ', 'ไม่', 'ยอม', 'สร้าง', 'ไป', 'ด้วยกัน']"
1989861555018854781,twitter,post,https://x.com/2baddiesonetuk2/status/1989861555018854781,text,2025-11-16T01:02:19.000Z,selenium_x_scraper_v1,รอบตัวเยอะแยะ เกาะคอนเนคชั่นเมีย สมบัติบ้านเมีย ใช้แรงงานเมียช่วยสร้างตัว พอรวยหรือมีอำนาจปุ๊บก็ทิ้งเมีย แถมพวกนี้ชอบพุดเหมือนตัวเองself-made เก่งกล้าเสียละเกิน  กระจอกนัก,รอบตัวเยอะแยะ เกาะคอนเนคชั่นเมีย สมบัติบ้านเมีย ใช้แรงงานเมียช่วยสร้างตัว พอรวยหรือมีอำนาจปุ๊บก็ทิ้งเมีย แถมพวกนี้ชอบพุดเหมือนตัวเองself-made เก่งกล้าเสียละเกิน  กระจอกนัก,2025-11-29 08:18:55,"['รอบตัว', 'เยอะแยะ', ' ', 'เกาะ', 'คอนเนค', 'ชั่น', 'เมีย', ' ', 'สมบัติ', 'บ้าน', 'เมีย', ' ', 'ใช้', 'แรงงาน', 'เมีย', 'ช่วย', 'สร้างตัว', ' ', 'พอ', 'รวย', 'หรือ', 'มีอำนาจ', 'ปุ๊บ', 'ก็', 'ทิ้ง', 'เมีย', ' ', 'แถม', 'พวก', 'นี้', 'ชอบ', 'พุด', 'เหมือน', 'ตัวเอง', 'self', ' ', 'made', ' ', 'เก่งกล้า', 'เสีย', 'ละ', 'เกิน', ' ', 'กระจอก', 'นัก']"
1989976084427993429,twitter,post,https://x.com/lattemonth/status/1989976084427993429,text,2025-11-16T08:37:25.000Z,selenium_x_scraper_v1,อันนี้คิดว่าจริง แฟนเก่าคนนึงเราอยู่กับมันตั้งแต่ยังหางานไม่ได้ โอนเงินให้มันกินข้าว (ไม่ได้ขอ ให้เอง เห็นเงินในบัญชีมันละสงสาร) สรุปพอชีวิตกลับกัน มันได้งานดี เงินดีปุ๊บ นอกใจ กุหอบของกลับบ้าน โอนเงินให้กุ 300 (ที่บ้านมันฝากมาให้ น่าจะจำนวนเยอะกว่านี้ แต่มันให้แค่นี้) อุ ยุคมืด,อันนี้คิดว่าจริง แฟนเก่าคนนึงเราอยู่กับมันตั้งแต่ยังหางานไม่ได้ โอนเงินให้มันกินข้าว (ไม่ได้ขอ ให้เอง เห็นเงินในบัญชีมันละสงสาร) สรุปพอชีวิตกลับกัน มันได้งานดี เงินดีปุ๊บ นอกใจ กุหอบของกลับบ้าน โอนเงินให้กุ 300 (ที่บ้านมันฝากมาให้ น่าจะจำนวนเยอะกว่านี้ แต่มันให้แค่นี้) อุ ยุคมืด,2025-11-29 08:18:55,"['อันนี้', 'คิด', 'ว่า', 'จริง', ' ', 'แฟน', 'เก่า', 'คน', 'นึง', 'เรา', 'อยู่', 'กับ', 'มัน', 'ตั้งแต่', 'ยัง', 'หา', 'งาน', 'ไม่', 'ได้', ' ', 'โอน', 'เงิน', 'ให้', 'มัน', 'กินข้าว', ' ', 'ไม่', 'ได้', 'ขอ', ' ', 'ให้', 'เอง', ' ', 'เห็น', 'เงิน', 'ใน', 'บัญชี', 'มัน', 'ละ', 'สงสาร', ' ', 'สรุป', 'พอ', 'ชีวิต', 'กลับกัน', ' ', 'มัน', 'ได้', 'งาน', 'ดี', ' ', 'เงิน', 'ดี', 'ปุ๊บ', ' ', 'นอกใจ', ' ', 'กุ', 'หอบ', 'ของ', 'กลับบ้าน', ' ', 'โอน', 'เงิน', 'ให้', 'กุ', ' ', '300', ' ', 'ที่', 'บ้าน', 'มัน', 'ฝาก', 'มา', 'ให้', ' ', 'น่าจะ', 'จำนวน', 'เยอะ', 'กว่า', 'นี้', ' ', 'แต่', 'มัน', 'ให้', 'แค่นี้', ' ', 'อุ', ' ', 'ยุคมืด']"
1989690610865807452,twitter,post,https://x.com/xuli8a/status/1989690610865807452,text,2025-11-15T13:43:02.000Z,selenium_x_scraper_v1,นึกถึงมีมนี้,นึกถึงมีมนี้,2025-11-29 08:18:55,"['นึกถึง', 'มีม', 'นี้']"
1989774156901356025,twitter,post,https://x.com/ShutyuuRunn/status/1989774156901356025,text,2025-11-15T19:15:01.000Z,selenium_x_scraper_v1,ก็ฟีลหาอะไรที่มันสมฐานะ ในความรู้สึกเขาอะ ดั่งประโยคที่ว่า เลือกคนที่เอื้อมถึงก่อน ดอกฟ้าทั้งหลายมันเอื้อมไม่ถึง พอถึงเวลาที่เราพามันมาสูงแล้ว มันก็จะหันไปเอาดอกฟ้าที่มันเคยได้แต่มอง เพื่อให้ตัวเองรู้สึกว่าสูงส่งพอ ดูดีพอ เก่งพอที่จะเอื้อมดอกฟ้าได้แล้วงี้,ก็ฟีลหาอะไรที่มันสมฐานะ ในความรู้สึกเขาอะ ดั่งประโยคที่ว่า เลือกคนที่เอื้อมถึงก่อน ดอกฟ้าทั้งหลายมันเอื้อมไม่ถึง พอถึงเวลาที่เราพามันมาสูงแล้ว มันก็จะหันไปเอาดอกฟ้าที่มันเคยได้แต่มอง เพื่อให้ตัวเองรู้สึกว่าสูงส่งพอ ดูดีพอ เก่งพอที่จะเอื้อมดอกฟ้าได้แล้วงี้,2025-11-29 08:18:55,"['ก็', 'ฟี', 'ล', 'หา', 'อะไร', 'ที่', 'มัน', 'สมฐานะ', ' ', 'ใน', 'ความรู้สึก', 'เขา', 'อะ', ' ', 'ดั่ง', 'ประโยค', 'ที่ว่า', ' ', 'เลือก', 'คน', 'ที่', 'เอื้อม', 'ถึง', 'ก่อน', ' ', 'ดอกฟ้า', 'ทั้งหลาย', 'มัน', 'เอื้อม', 'ไม่', 'ถึง', ' ', 'พอ', 'ถึง', 'เวลา', 'ที่', 'เรา', 'พา', 'มัน', 'มา', 'สูง', 'แล้ว', ' ', 'มัน', 'ก็', 'จะ', 'หันไป', 'เอา', 'ดอกฟ้า', 'ที่', 'มัน', 'เคย', 'ได้', 'แต่', 'มอง', ' ', 'เพื่อให้', 'ตัวเอง', 'รู้สึก', 'ว่า', 'สูงส่ง', 'พอ', ' ', 'ดูดี', 'พอ', ' ', 'เก่ง', 'พอที่จะ', 'เอื้อม', 'ดอกฟ้า', 'ได้', 'แล้ว', 'งี้']"
1990094973140955303,twitter,post,https://x.com/jumjeemkpp/status/1990094973140955303,text,2025-11-16T16:29:50.000Z,selenium_x_scraper_v1,"คนรอบตัวที่เคยเจอมาคือ ผช ไม่เลือกคนที่สู้มาด้วยกันเพราะมันไม่เท่ เห็นด้านแย่ของตัวเองแล้วรู้สึกอาย เลยหาคนใหม่ แล้วส่วนมากคบแปปๆก็แต่งหรือเปิดตัวเลยงี้ 

แต่มีหลายคู่นะ วงการครูนี่แหละ สู้มาด้วยกันจนแต่งงานมีครอบครัว ศีลเสมอ ก็อบอุ่นใจดี ยินดีกับทุกๆคน","คนรอบตัวที่เคยเจอมาคือ ผช ไม่เลือกคนที่สู้มาด้วยกันเพราะมันไม่เท่ เห็นด้านแย่ของตัวเองแล้วรู้สึกอาย เลยหาคนใหม่ แล้วส่วนมากคบแปปๆก็แต่งหรือเปิดตัวเลยงี้ 

แต่มีหลายคู่นะ วงการครูนี่แหละ สู้มาด้วยกันจนแต่งงานมีครอบครัว ศีลเสมอ ก็อบอุ่นใจดี ยินดีกับทุกๆคน",2025-11-29 08:18:55,"['คน', 'รอบตัว', 'ที่', 'เคย', 'เจอ', 'มา', 'คือ', ' ', 'ผช', ' ', 'ไม่', 'เลือก', 'คน', 'ที่', 'สู้', 'มา', 'ด้วยกัน', 'เพราะ', 'มัน', 'ไม่', 'เท่', ' ', 'เห็น', 'ด้าน', 'แย่', 'ของ', 'ตัวเอง', 'แล้ว', 'รู้สึก', 'อาย', ' ', 'เลย', 'หา', 'คน', 'ใหม่', ' ', 'แล้ว', 'ส่วนมาก', 'คบ', 'แป', 'ปๆ', 'ก็', 'แต่ง', 'หรือ', 'เปิดตัว', 'เลย', 'งี้', ' ', 'แต่', 'มี', 'หลาย', 'คู่', 'นะ', ' ', 'วงการ', 'ครู', 'นี่แหละ', ' ', 'สู้', 'มา', 'ด้วยกัน', 'จน', 'แต่งงาน', 'มีครอบครัว', ' ', 'ศีล', 'เสมอ', ' ', 'ก็', 'อบอุ่น', 'ใจดี', ' ', 'ยินดี', 'กับ', 'ทุกๆ', 'คน']"
1989764880728297664,twitter,post,https://x.com/TeppuShinodu/status/1989764880728297664,text,2025-11-15T18:38:10.000Z,selenium_x_scraper_v1,นึกถึงนักร้องท่านหนึ่ง ที่ฟ้องแม่ของลูกตัวเองเลย,นึกถึงนักร้องท่านหนึ่ง ที่ฟ้องแม่ของลูกตัวเองเลย,2025-11-29 08:18:55,"['นึกถึง', 'นักร้อง', 'ท่าน', 'หนึ่ง', ' ', 'ที่', 'ฟ้อง', 'แม่', 'ของ', 'ลูก', 'ตัวเอง', 'เลย']"
1990048681387856160,twitter,post,https://x.com/love_roti/status/1990048681387856160,text,2025-11-16T13:25:53.000Z,selenium_x_scraper_v1,จริจ้า มันควรพยามดีด้วยตัวของมัน ไม่ดีก็เลิกจ้า เราไม่ใช่แม่ใคร ทำไมต้องทน หาพราทเนอร์ใช้ชีวิตด้วยกัน ไม่ได้หา case ดูแล เลือกก็เลือกดีๆไปเลยแฟนน่ะ อย่าไปเสียเวลาคิดว่าความรักจะเปลี่ยนอะไร มีจ้าแต่น้อยมาก รักตัวเองก่อนดีกว่า,จริจ้า มันควรพยามดีด้วยตัวของมัน ไม่ดีก็เลิกจ้า เราไม่ใช่แม่ใคร ทำไมต้องทน หาพราทเนอร์ใช้ชีวิตด้วยกัน ไม่ได้หา case ดูแล เลือกก็เลือกดีๆไปเลยแฟนน่ะ อย่าไปเสียเวลาคิดว่าความรักจะเปลี่ยนอะไร มีจ้าแต่น้อยมาก รักตัวเองก่อนดีกว่า,2025-11-29 08:18:55,"['จ', 'ริ', 'จ้า', ' ', 'มัน', 'ควร', 'พยาม', 'ดี', 'ด้วย', 'ตัว', 'ของ', 'มัน', ' ', 'ไม่', 'ดี', 'ก็', 'เลิก', 'จ้า', ' ', 'เรา', 'ไม่', 'ใช่', 'แม่', 'ใคร', ' ', 'ทำไม', 'ต้อง', 'ทน', ' ', 'หา', 'พ', 'รา', 'ทเนอร์', 'ใช้ชีวิต', 'ด้วยกัน', ' ', 'ไม่', 'ได้', 'หา', ' ', 'case', ' ', 'ดูแล', ' ', 'เลือก', 'ก็', 'เลือก', 'ดี', 'ๆ', 'ไป', 'เลย', 'แฟน', 'น่ะ', ' ', 'อย่า', 'ไป', 'เสียเวลา', 'คิด', 'ว่า', 'ความรัก', 'จะ', 'เปลี่ยน', 'อะไร', ' ', 'มี', 'จ้า', 'แต่', 'น้อย', 'มาก', ' ', 'รัก', 'ตัวเอง', 'ก่อน', 'ดีกว่า']"
