id,platform,platform_type,url,content_type,timestamp,scraper_module,text,raw_text,scrape_date,tokens
1972870467737534975,twitter,post,https://x.com/unitmqx/status/1972870467737534975,text,2025-09-30T03:45:48.000Z,selenium_x_scraper_v1,เข้าใจว่ากลัวแต่ก็กรุณารีบเดินเหอะ ไม่ใช่เดินทอดน่องอัด content บอกว่าผู้ชายอันตราย ถ้ามันอันตรายคุณก็ควรรีบออกมาจากตรงนั้นมั้ยละ เอาใจยากนะคือกูก็อยากแซง สรุปให้พวกกูทำไงนิให้แซงมั้ย หรือจะให้เอาไง,เข้าใจว่ากลัวแต่ก็กรุณารีบเดินเหอะ ไม่ใช่เดินทอดน่องอัด content บอกว่าผู้ชายอันตราย ถ้ามันอันตรายคุณก็ควรรีบออกมาจากตรงนั้นมั้ยละ เอาใจยากนะคือกูก็อยากแซง สรุปให้พวกกูทำไงนิให้แซงมั้ย หรือจะให้เอาไง,2025-11-08 17:05:14,"['เข้าใจ', 'ว่า', 'กลัว', 'แต่', 'ก็', 'กรุณา', 'รีบ', 'เดิน', 'เหอะ', ' ', 'ไม่', 'ใช่', 'เดินทอดน่อง', 'อัด', ' ', 'content', ' ', 'บอ', 'กว่า', 'ผู้ชาย', 'อันตราย', ' ', 'ถ้า', 'มัน', 'อันตราย', 'คุณ', 'ก็', 'ควร', 'รีบ', 'ออก', 'มาจาก', 'ตรงนั้น', 'มั้ย', 'ละ', ' ', 'เอาใจ', 'ยาก', 'นะ', 'คือ', 'กู', 'ก็', 'อยาก', 'แซง', ' ', 'สรุป', 'ให้', 'พวก', 'กู', 'ทำ', 'ไง', 'นิ', 'ให้', 'แซง', 'มั้ย', ' ', 'หรือ', 'จะ', 'ให้', 'เอา', 'ไง']"
1972365582730498273,twitter,post,https://x.com/hlngthng20/status/1972365582730498273,text,2025-09-28T18:19:34.000Z,selenium_x_scraper_v1,ความคิดผู้หญิงทุกวันนี้ น่ารังเกียดอะไรขนาดนี้ พวกมึงไม่ได้น่าพิศวาสขนาดที่ ต้องปรี้เข้าหาขนาดนั้น,ความคิดผู้หญิงทุกวันนี้ น่ารังเกียดอะไรขนาดนี้ พวกมึงไม่ได้น่าพิศวาสขนาดที่ ต้องปรี้เข้าหาขนาดนั้น,2025-11-08 17:05:14,"['ความคิด', 'ผู้หญิง', 'ทุกวันนี้', ' ', 'น่า', 'รัง', 'เกียด', 'อะไร', 'ขนาด', 'นี้', ' ', 'พวก', 'มึง', 'ไม่', 'ได้', 'น่า', 'พิศวาส', 'ขนาดที่', ' ', 'ต้อง', 'ป', 'รี้', 'เข้าหา', 'ขนาด', 'นั้น']"
1972690672902631547,twitter,post,https://x.com/gtfomeplease/status/1972690672902631547,text,2025-09-29T15:51:21.000Z,selenium_x_scraper_v1,เรามีเพื่อนผชกลุ่มใหญ่ๆ ละวันนึงเพื่อนของเพื่อนในกลุ่มมาแทงพูลด้วยกัน ละเพื่อนคนใหม่ดันมาคุยใกล้ๆเรามากไปละเริ่มพูดเรื่อยเปื่อย เพื่อนเรายังเดินมาบอกเลยว่าถ้าไม่ชอบคนนี้ ให้เดินออกมาเลย ผชหลายคน แค่ผญอยู่ใกล้ ยิ้มให้ ก็คิดว่ามีโอกาสอ่ะ ละนี่กลางคืน เปลี่ยว,เรามีเพื่อนผชกลุ่มใหญ่ๆ ละวันนึงเพื่อนของเพื่อนในกลุ่มมาแทงพูลด้วยกัน ละเพื่อนคนใหม่ดันมาคุยใกล้ๆเรามากไปละเริ่มพูดเรื่อยเปื่อย เพื่อนเรายังเดินมาบอกเลยว่าถ้าไม่ชอบคนนี้ ให้เดินออกมาเลย ผชหลายคน แค่ผญอยู่ใกล้ ยิ้มให้ ก็คิดว่ามีโอกาสอ่ะ ละนี่กลางคืน เปลี่ยว,2025-11-08 17:05:14,"['เรา', 'มี', 'เพื่อน', 'ผช', 'กลุ่ม', 'ใหญ่', 'ๆ', ' ', 'ละ', 'วัน', 'นึง', 'เพื่อน', 'ของ', 'เพื่อน', 'ใน', 'กลุ่ม', 'มา', 'แทง', 'พูล', 'ด้วยกัน', ' ', 'ละ', 'เพื่อน', 'คน', 'ใหม่', 'ดัน', 'มา', 'คุย', 'ใกล้', 'ๆ', 'เรา', 'มาก', 'ไป', 'ละ', 'เริ่ม', 'พูดเรื่อยเปื่อย', ' ', 'เพื่อน', 'เรา', 'ยัง', 'เดิน', 'มา', 'บอก', 'เลย', 'ว่า', 'ถ้า', 'ไม่', 'ชอบ', 'คน', 'นี้', ' ', 'ให้', 'เดิน', 'ออกมา', 'เลย', ' ', 'ผช', 'หลาย', 'คน', ' ', 'แค่', 'ผญ', 'อยู่', 'ใกล้', ' ', 'ยิ้ม', 'ให้', ' ', 'ก็', 'คิด', 'ว่า', 'มีโอกาส', 'อ่ะ', ' ', 'ละ', 'นี่', 'กลางคืน', ' ', 'เปลี่ยว']"
1973242012175577268,twitter,post,https://x.com/AbiasKT/status/1973242012175577268,text,2025-10-01T04:22:11.000Z,selenium_x_scraper_v1,ขอบคุณที่พ่อสอนต่อพี่ชายเสมอว่าต้องระวังการวางตัวเวลาอยู่ใกล้ผู้หญิง เพราะไม่ว่าจะเกิดหรือไม่เกิดอะไรขึ้นรอบข้างมักโทษฝ่ายหญิงก่อนเสมอ,ขอบคุณที่พ่อสอนต่อพี่ชายเสมอว่าต้องระวังการวางตัวเวลาอยู่ใกล้ผู้หญิง เพราะไม่ว่าจะเกิดหรือไม่เกิดอะไรขึ้นรอบข้างมักโทษฝ่ายหญิงก่อนเสมอ,2025-11-08 17:05:14,"['ขอบคุณ', 'ที่', 'พ่อ', 'สอน', 'ต่อ', 'พี่ชาย', 'เสมอ', 'ว่า', 'ต้อง', 'ระวัง', 'การ', 'วางตัว', 'เวลา', 'อยู่', 'ใกล้', 'ผู้หญิง', ' ', 'เพราะ', 'ไม่', 'ว่า', 'จะ', 'เกิด', 'หรือไม่', 'เกิด', 'อะไร', 'ขึ้น', 'รอบข้าง', 'มัก', 'โทษ', 'ฝ่าย', 'หญิง', 'ก่อน', 'เสมอ']"
1972852381433147509,twitter,post,https://x.com/belluccicony/status/1972852381433147509,text,2025-09-30T02:33:56.000Z,selenium_x_scraper_v1,เคยออกไปกลางคืนคนเดียวเจอผญ.เดินมาเป็นกลุ่มเหมือนจะเมาละมาพูดจาลวนลาม แถมเดินตาม เรากลัวมากกรณีนี้ผช.ทำไรได้บ้างครับ ทีหลังรบกวนผญ.เดินนำไปก่อนบ้างได้ไหม เพราะผมเคยเจอละกลัวเหมือนกัน,เคยออกไปกลางคืนคนเดียวเจอผญ.เดินมาเป็นกลุ่มเหมือนจะเมาละมาพูดจาลวนลาม แถมเดินตาม เรากลัวมากกรณีนี้ผช.ทำไรได้บ้างครับ ทีหลังรบกวนผญ.เดินนำไปก่อนบ้างได้ไหม เพราะผมเคยเจอละกลัวเหมือนกัน,2025-11-08 17:05:14,"['เคย', 'ออก', 'ไป', 'กลางคืน', 'คนเดียว', 'เจอ', 'ผญ.', 'เดิน', 'มา', 'เป็น', 'กลุ่ม', 'เหมือน', 'จะ', 'เมา', 'ละมา', 'พูดจา', 'ลวนลาม', ' ', 'แถม', 'เดินตาม', ' ', 'เรา', 'กลัว', 'มาก', 'กรณี', 'นี้', 'ผช.', 'ทำ', 'ไร', 'ได้', 'บ้าง', 'ครับ', ' ', 'ทีหลัง', 'รบกวน', 'ผญ.', 'เดิน', 'นำ', 'ไป', 'ก่อน', 'บ้าง', 'ได้', 'ไหม', ' ', 'เพราะ', 'ผม', 'เคย', 'เจอ', 'ละ', 'กลัว', 'เหมือนกัน']"
1972456847497195596,twitter,post,https://x.com/JUNE_JUNE7B/status/1972456847497195596,text,2025-09-29T00:22:13.000Z,selenium_x_scraper_v1,อย่างแรกน้องต้องรู้จักป้องกันตัวเองครับ อย่ารอให้คนอื่นมอบความปลอดภัยให้กับตัวเอง,อย่างแรกน้องต้องรู้จักป้องกันตัวเองครับ อย่ารอให้คนอื่นมอบความปลอดภัยให้กับตัวเอง,2025-11-08 17:05:14,"['อย่าง', 'แรก', 'น้อง', 'ต้อง', 'รู้จัก', 'ป้องกัน', 'ตัวเอง', 'ครับ', ' ', 'อย่า', 'รอ', 'ให้', 'คนอื่น', 'มอบ', 'ความปลอดภัย', 'ให้', 'กับ', 'ตัวเอง']"
1973047675932078285,twitter,post,https://x.com/Kunfong24/status/1973047675932078285,text,2025-09-30T15:29:58.000Z,selenium_x_scraper_v1,ถ้าเดินแบบเอามาแนบหรือซ้อนก็น่ากลัวเลย แต่ถ้าเค้าเดินเฉยๆแบบคนปกติเดิน แบบไม่ใช่เดินตาม เราว่ามันก็ปกติ แต่ไม่ผิดที่ระแวงเพราะ ผญ จะโดนกระทำมากกว่าผช เห็น จขพ บอกว่า ตรงทางที่เดินเป็นซอยเปลี่ยวมืดๆเค้าเลยกลัวก็สมเหตุสมผลนะ,ถ้าเดินแบบเอามาแนบหรือซ้อนก็น่ากลัวเลย แต่ถ้าเค้าเดินเฉยๆแบบคนปกติเดิน แบบไม่ใช่เดินตาม เราว่ามันก็ปกติ แต่ไม่ผิดที่ระแวงเพราะ ผญ จะโดนกระทำมากกว่าผช เห็น จขพ บอกว่า ตรงทางที่เดินเป็นซอยเปลี่ยวมืดๆเค้าเลยกลัวก็สมเหตุสมผลนะ,2025-11-08 17:05:14,"['ถ้า', 'เดิน', 'แบบ', 'เอา', 'มา', 'แนบ', 'หรือ', 'ซ้อน', 'ก็', 'น่ากลัว', 'เลย', ' ', 'แต่', 'ถ้า', 'เค้า', 'เดิน', 'เฉย', 'ๆ', 'แบบ', 'คน', 'ปกติ', 'เดิน', ' ', 'แบบ', 'ไม่', 'ใช่', 'เดินตาม', ' ', 'เรา', 'ว่า', 'มัน', 'ก็', 'ปกติ', ' ', 'แต่', 'ไม่', 'ผิดที่', 'ระแวง', 'เพราะ', ' ', 'ผญ', ' ', 'จะ', 'โดน', 'กระทำ', 'มากกว่า', 'ผช', ' ', 'เห็น', ' ', 'จขพ', ' ', 'บอ', 'กว่า', ' ', 'ตรง', 'ทาง', 'ที่', 'เดิน', 'เป็น', 'ซอย', 'เปลี่ยว', 'มืด', 'ๆ', 'เค้า', 'เลย', 'กลัว', 'ก็', 'สมเหตุสมผล', 'นะ']"
1972721341955707290,twitter,post,https://x.com/KiAi_p/status/1972721341955707290,text,2025-09-29T17:53:13.000Z,selenium_x_scraper_v1,ในคลิปก็บอกอยู่ว่าคนที่เป็นไม่ได้เป็นจะไปร้อนทำไม,ในคลิปก็บอกอยู่ว่าคนที่เป็นไม่ได้เป็นจะไปร้อนทำไม,2025-11-08 17:05:14,"['ใน', 'คลิป', 'ก็', 'บอก', 'อยู่', 'ว่า', 'คน', 'ที่', 'เป็น', 'ไม่', 'ได้', 'เป็น', 'จะ', 'ไป', 'ร้อน', 'ทำไม']"
1972474392497299734,twitter,post,https://x.com/drunkazeus/status/1972474392497299734,text,2025-09-29T01:31:56.000Z,selenium_x_scraper_v1,ข้ออ้าง108 เวลา แต่เสือกเรียกร้องเท่าเทียม,ข้ออ้าง108 เวลา แต่เสือกเรียกร้องเท่าเทียม,2025-11-08 17:05:14,"['ข้ออ้าง', '108', ' ', 'เวลา', ' ', 'แต่', 'เสือก', 'เรียกร้อง', 'เท่าเทียม']"
1972343658084249779,twitter,post,https://x.com/ywp_001/status/1972343658084249779,text,2025-09-28T16:52:27.000Z,selenium_x_scraper_v1,คือเข้าใจคนในคลิปเพราะอินี้เป็น55555 แต่ใดๆคือเวลาคนข้างหลังเดินเข้ามาใกล้จะแซงอ่ะ เราเดินฝั่งขวา คุณเดินซ้ายไปเลย แล้วจะแซงก็แซงโล้ด เจอแบบนั้นเราโล่งใจมากกว่าเดินตามห่างๆอีกเอาจริง,คือเข้าใจคนในคลิปเพราะอินี้เป็น55555 แต่ใดๆคือเวลาคนข้างหลังเดินเข้ามาใกล้จะแซงอ่ะ เราเดินฝั่งขวา คุณเดินซ้ายไปเลย แล้วจะแซงก็แซงโล้ด เจอแบบนั้นเราโล่งใจมากกว่าเดินตามห่างๆอีกเอาจริง,2025-11-08 17:05:14,"['คือ', 'เข้าใจ', 'คนใน', 'คลิป', 'เพราะ', 'อิ', 'นี้', 'เป็น', 'หัวเราะ', ' ', 'แต่', 'ใดๆ', 'คือ', 'เวลา', 'คน', 'ข้างหลัง', 'เดิน', 'เข้ามา', 'ใกล้', 'จะ', 'แซง', 'อ่ะ', ' ', 'เรา', 'เดิน', 'ฝั่ง', 'ขวา', ' ', 'คุณ', 'เดิน', 'ซ้าย', 'ไป', 'เลย', ' ', 'แล้', 'วจะ', 'แซง', 'ก็', 'แซง', 'โล้', 'ด', ' ', 'เจอ', 'แบบ', 'นั้น', 'เรา', 'โล่งใจ', 'มากกว่า', 'เดินตาม', 'ห่าง', 'ๆ', 'อีก', 'เอาจริง']"
1972631404141048107,twitter,post,https://x.com/thewisherrr/status/1972631404141048107,text,2025-09-29T11:55:51.000Z,selenium_x_scraper_v1,เคยยืนรอรถเมลล์แล้วมีไอ้เหี้ยที่ไหนไม่รู้เดินมาจับก้น มันสมควรแล้วที่ผญ จะระแวง,เคยยืนรอรถเมลล์แล้วมีไอ้เหี้ยที่ไหนไม่รู้เดินมาจับก้น มันสมควรแล้วที่ผญ จะระแวง,2025-11-08 17:05:14,"['เคย', 'ยืน', 'รอ', 'รถ', 'เมลล์', 'แล้ว', 'มี', 'ไอ้', 'เหี้ย', 'ที่ไหน', 'ไม่', 'รู้', 'เดิน', 'มา', 'จับ', 'ก้น', ' ', 'มัน', 'สมควร', 'แล้ว', 'ที่', 'ผญ', ' ', 'จะ', 'ระแวง']"
1972342575165296954,twitter,post,https://x.com/MM4472562311493/status/1972342575165296954,text,2025-09-28T16:48:08.000Z,selenium_x_scraper_v1,คือกูจะแซงมึงครับอีดอก สวยมาก,คือกูจะแซงมึงครับอีดอก สวยมาก,2025-11-08 17:05:14,"['คือ', 'กู', 'จะ', 'แซง', 'มึง', 'ครับ', 'อีดอก', ' ', 'สวย', 'มาก']"
1972566796126589325,twitter,post,https://x.com/Lucien_np/status/1972566796126589325,text,2025-09-29T07:39:07.000Z,selenium_x_scraper_v1,ตะกละพี่แปลกๆนะคะ ผญระแวงไม่ได้ผิดนะ เป็นผญเดินคนเดียวละมีผู้ชายเดินตามมันน่ากลัวนะ เป็นผชน่าจะคิดได้ ไม่น่าโง่,ตะกละพี่แปลกๆนะคะ ผญระแวงไม่ได้ผิดนะ เป็นผญเดินคนเดียวละมีผู้ชายเดินตามมันน่ากลัวนะ เป็นผชน่าจะคิดได้ ไม่น่าโง่,2025-11-08 17:05:14,"['ตะกละ', 'พี่', 'แปลก', 'ๆ', 'นะคะ', ' ', 'ผญ', 'ระแวง', 'ไม่', 'ได้', 'ผิด', 'นะ', ' ', 'เป็น', 'ผญ', 'เดิน', 'คนเดียว', 'ละ', 'มี', 'ผู้ชาย', 'เดินตาม', 'มัน', 'น่ากลัว', 'นะ', ' ', 'เป็น', 'ผช', 'น่าจะ', 'คิดได้', ' ', 'ไม่', 'น่า', 'โง่']"
1972979264883720362,twitter,post,https://x.com/BabyMuffinMoon/status/1972979264883720362,text,2025-09-30T10:58:07.000Z,selenium_x_scraper_v1,เปง ผช ทำไรก็ผิด ของแทร่,เปง ผช ทำไรก็ผิด ของแทร่,2025-11-08 17:05:14,"['เปง', ' ', 'ผช', ' ', 'ทำ', 'ไร', 'ก็', 'ผิด', ' ', 'ของ', 'แทร่']"
1972224520137388487,twitter,post,https://x.com/0HX38gvWaVTHrVp/status/1972224520137388487,text,2025-09-28T08:59:02.000Z,selenium_x_scraper_v1,สภาพ,สภาพ,2025-11-08 17:05:14,['สภาพ']
1972188619432775824,twitter,post,https://x.com/pin62051566/status/1972188619432775824,text,2025-09-28T06:36:23.000Z,selenium_x_scraper_v1,เวลา ดู True crime ก็จะหลอนหน่อย ๆ เคยเป็นเหมือนกัน  ยิ่งเดินในซอยมืด ๆ เป็นผู้ชายก็กลัว,เวลา ดู True crime ก็จะหลอนหน่อย ๆ เคยเป็นเหมือนกัน  ยิ่งเดินในซอยมืด ๆ เป็นผู้ชายก็กลัว,2025-11-08 17:05:14,"['เวลา', ' ', 'ดู', ' ', 'true', ' ', 'crime', ' ', 'ก็', 'จะ', 'หลอน', 'หน่อย', ' ', 'ๆ', ' ', 'เคย', 'เป็น', 'เหมือนกัน', ' ', 'ยิ่ง', 'เดิน', 'ใน', 'ซอย', 'มืด', ' ', 'ๆ', ' ', 'เป็น', 'ผู้ชาย', 'ก็', 'กลัว']"
1973092306015158763,twitter,post,https://x.com/Gg37817492/status/1973092306015158763,text,2025-09-30T18:27:18.000Z,selenium_x_scraper_v1,กูก็ไม่อยากเดินใกล้ผู้หญิงแบบมึงเหมือนกัน กูจะเครซี่,กูก็ไม่อยากเดินใกล้ผู้หญิงแบบมึงเหมือนกัน กูจะเครซี่,2025-11-08 17:05:14,"['กู', 'ก็', 'ไม่', 'อยาก', 'เดิน', 'ใกล้', 'ผู้หญิง', 'แบบ', 'มึง', 'เหมือนกัน', ' ', 'กู', 'จะ', 'เค', 'ร', 'ซี่']"
1973206685029470214,twitter,post,https://x.com/captain10711753/status/1973206685029470214,text,2025-10-01T02:01:48.000Z,selenium_x_scraper_v1,จริง พอจะเดินแซงแม่งเดินปิดมุม พอหามุมใหม่จะแซง แม่งเสือกใจตรงกัน สรุปมองกูด้วยสายตาหวาดกลัวคิดว่าเป็นโรคจิต,จริง พอจะเดินแซงแม่งเดินปิดมุม พอหามุมใหม่จะแซง แม่งเสือกใจตรงกัน สรุปมองกูด้วยสายตาหวาดกลัวคิดว่าเป็นโรคจิต,2025-11-08 17:05:14,"['จริง', ' ', 'พอ', 'จะ', 'เดิน', 'แซง', 'แม่', 'ง', 'เดิน', 'ปิด', 'มุม', ' ', 'พอ', 'หา', 'มุม', 'ใหม่', 'จะ', 'แซง', ' ', 'แม่', 'ง', 'เสือก', 'ใจตรงกัน', ' ', 'สรุป', 'มอง', 'กู', 'ด้วย', 'สายตา', 'หวาดกลัว', 'คิด', 'ว่า', 'เป็น', 'โรคจิต']"
1972507506430890461,twitter,post,https://x.com/nahm009/status/1972507506430890461,text,2025-09-29T03:43:31.000Z,selenium_x_scraper_v1,นี่เคยเดินกับสามีริมถนนตอนดึกๆ แล้วรถที่จอดอยู่ด้านหน้านู้น มันปิ๊บขึ้นมา แบบมีคนกดรีโมทปลดล็อก แล้วเราตกใจ ผู้ชายที่เดินตามมาด้านหลังเลยขอโทษขอโพย เพราะเขาเดินอยู่ด้านหลังแล้วกลัวเรา2 คนระแวงว่าใครเดินตามมามืดๆ เลยกดรีโมทรถว่า เออ จะไปที่รถนู่น กลายเป็นว่าเราตกใจเสียงรถแทน ,นี่เคยเดินกับสามีริมถนนตอนดึกๆ แล้วรถที่จอดอยู่ด้านหน้านู้น มันปิ๊บขึ้นมา แบบมีคนกดรีโมทปลดล็อก แล้วเราตกใจ ผู้ชายที่เดินตามมาด้านหลังเลยขอโทษขอโพย เพราะเขาเดินอยู่ด้านหลังแล้วกลัวเรา2 คนระแวงว่าใครเดินตามมามืดๆ เลยกดรีโมทรถว่า เออ จะไปที่รถนู่น กลายเป็นว่าเราตกใจเสียงรถแทน ,2025-11-08 17:05:14,"['นี่', 'เคย', 'เดิน', 'กับ', 'สามี', 'ริมถนน', 'ตอนดึก', 'ๆ', ' ', 'แล้ว', 'รถ', 'ที่', 'จอด', 'อยู่', 'ด้านหน้า', 'นู้น', ' ', 'มัน', 'ปิ๊บ', 'ขึ้น', 'มา', ' ', 'แบบ', 'มี', 'คน', 'กด', 'รีโมท', 'ปลดล็อก', ' ', 'แล้ว', 'เรา', 'ตกใจ', ' ', 'ผู้ชาย', 'ที่', 'เดิน', 'ตามมา', 'ด้านหลัง', 'เลย', 'ขอโทษ', 'ขอ', 'โพย', ' ', 'เพราะ', 'เขา', 'เดิน', 'อยู่', 'ด้านหลัง', 'แล้ว', 'กลัว', 'เรา', '2', ' ', 'คน', 'ระแวง', 'ว่า', 'ใคร', 'เดิน', 'ตามมา', 'มืด', 'ๆ', ' ', 'เลย', 'กด', 'รีโมท', 'รถ', 'ว่า', ' ', 'เออ', ' ', 'จะ', 'ไป', 'ที่', 'รถ', 'นู่น', ' ', 'กลายเป็น', 'ว่า', 'เรา', 'ตกใจ', 'เสียง', 'รถ', 'แทน']"
