id,platform,platform_type,url,content_type,timestamp,scraper_module,text,raw_text,scrape_date,tokens
1989676583393923473,twitter,post,https://x.com/mastersssoffa/status/1989676583393923473,text,2025-11-15T12:47:18.000Z,selenium_x_scraper_v1,ช่าย เงินเดือน 25k มึงยังไม่มีปัญญาพยายามจะมี ส้นตีนจริง,ช่าย เงินเดือน 25k มึงยังไม่มีปัญญาพยายามจะมี ส้นตีนจริง,2025-11-29 08:18:55,"['ช่าย', ' ', 'เงินเดือน', ' ', '25', 'k', ' ', 'มึง', 'ยัง', 'ไม่', 'มี', 'ปัญญา', 'พยายาม', 'จะ', 'มี', ' ', 'ส้นตีน', 'จริง']"
1990006856853668204,twitter,post,https://x.com/AriesWKx/status/1990006856853668204,text,2025-11-16T10:39:41.000Z,selenium_x_scraper_v1,"ผมไม่ดื่มแอลกอฮอลไม่สูบบุหรี่ พูดจาดีไม่พูดมึงกู ขยันทำงาน เลิกงานกลับบ้านไม่เที่ยวกลางคืน เป็นคนติดบ้าน มีบ้านทาว์นเฮ้าส์หลังเล็กๆอยู่กับน้องและอา ไม่มีรถยนต์มีแต่รถมอเตอร์ไซค์1คัน ไม่มีหนี้
สภาพร่างกายอ้วน ไม่ค่อยได้ออกกำลังกาย
แต่รายรับน้อยไป
ผมเข้าใจคุณนะทุกคนมีสิทธิตั้งสเปก","ผมไม่ดื่มแอลกอฮอลไม่สูบบุหรี่ พูดจาดีไม่พูดมึงกู ขยันทำงาน เลิกงานกลับบ้านไม่เที่ยวกลางคืน เป็นคนติดบ้าน มีบ้านทาว์นเฮ้าส์หลังเล็กๆอยู่กับน้องและอา ไม่มีรถยนต์มีแต่รถมอเตอร์ไซค์1คัน ไม่มีหนี้
สภาพร่างกายอ้วน ไม่ค่อยได้ออกกำลังกาย
แต่รายรับน้อยไป
ผมเข้าใจคุณนะทุกคนมีสิทธิตั้งสเปก",2025-11-29 08:18:55,"['ผม', 'ไม่', 'ดื่ม', 'แอล', 'กอ', 'ฮอล', 'ไม่', 'สูบบุหรี่', ' ', 'พูดจา', 'ดี', 'ไม่', 'พูด', 'มึง', 'กู', ' ', 'ขยัน', 'ทำงาน', ' ', 'เลิกงาน', 'กลับบ้าน', 'ไม่', 'เที่ยว', 'กลางคืน', ' ', 'เป็น', 'คน', 'ติด', 'บ้าน', ' ', 'มี', 'บ้าน', 'ทาว์นเฮ้าส์', 'หลัง', 'เล็ก', 'ๆ', 'อยู่', 'กับ', 'น้อง', 'และ', 'อา', ' ', 'ไม่', 'มี', 'รถยนต์', 'มี', 'แต่', 'รถมอเตอร์ไซค์', '1', 'คัน', ' ', 'ไม่', 'มี', 'หนี้', ' ', 'สภาพร่างกาย', 'อ้วน', ' ', 'ไม่ค่อย', 'ได้', 'ออกกำลังกาย', ' ', 'แต่', 'รายรับ', 'น้อย', 'ไป', ' ', 'ผม', 'เข้าใจ', 'คุณ', 'นะ', 'ทุกคน', 'มี', 'สิทธิ', 'ตั้ง', 'สเปก']"
1989886313081012518,twitter,post,https://x.com/wut_nuttawut/status/1989886313081012518,text,2025-11-16T02:40:41.000Z,selenium_x_scraper_v1,ประมาณว่าอยากได้เค้า แต่ตัวเองไม่ตรงสเป็คเค้าว่างั้นเถอะ ,ประมาณว่าอยากได้เค้า แต่ตัวเองไม่ตรงสเป็คเค้าว่างั้นเถอะ ,2025-11-29 08:18:55,"['ประมาณ', 'ว่า', 'อยากได้', 'เค้า', ' ', 'แต่', 'ตัวเอง', 'ไม่', 'ตรง', 'สเป็ค', 'เค้า', 'ว่า', 'งั้น', 'เถอะ']"
1990065725676159467,twitter,post,https://x.com/PLE_TAPPARAK/status/1990065725676159467,text,2025-11-16T14:33:37.000Z,selenium_x_scraper_v1,จริงผญเขาก็ดูไม่ได้คาดหวังอะไรมากเลยแค่ไม่อยากได้คนสร้างปัญหาหรือเพิ่มภาระส่วนเรื่องสูงกว่ามันแค่สเปกความชอบเราว่าถ้าข้อหลักๆผ่านเขาก็ไม่สนส่วนสูงเท่าไหร่หรอก,จริงผญเขาก็ดูไม่ได้คาดหวังอะไรมากเลยแค่ไม่อยากได้คนสร้างปัญหาหรือเพิ่มภาระส่วนเรื่องสูงกว่ามันแค่สเปกความชอบเราว่าถ้าข้อหลักๆผ่านเขาก็ไม่สนส่วนสูงเท่าไหร่หรอก,2025-11-29 08:18:55,"['จริง', 'ผญ', 'เขา', 'ก็', 'ดูไม่ได้', 'คาดหวัง', 'อะไร', 'มาก', 'เลย', 'แค่', 'ไม่', 'อยากได้', 'คน', 'สร้าง', 'ปัญหา', 'หรือ', 'เพิ่ม', 'ภาระ', 'ส่วน', 'เรื่อง', 'สูง', 'กว่า', 'มัน', 'แค่', 'สเปก', 'ความชอบ', 'เรา', 'ว่า', 'ถ้า', 'ข้อ', 'หลัก', 'ๆ', 'ผ่าน', 'เขา', 'ก็', 'ไม่', 'สน', 'ส่วนสูง', 'เท่าไหร่', 'หรอก']"
1989862336384176311,twitter,post,https://x.com/JJOkoch52471801/status/1989862336384176311,text,2025-11-16T01:05:25.000Z,selenium_x_scraper_v1,วัยรุ่นบุรีรัมย์ อมตะนคร บ่อวิน กระบะซิ่ง ตู้ทึบ รถคอกร้องไห้แล้วจั๊ฟ,วัยรุ่นบุรีรัมย์ อมตะนคร บ่อวิน กระบะซิ่ง ตู้ทึบ รถคอกร้องไห้แล้วจั๊ฟ,2025-11-29 08:18:55,"['วัยรุ่น', 'บุรีรัมย์', ' ', 'อมตะ', 'นคร', ' ', 'บ่อวิน', ' ', 'กระบะ', 'ซิ่ง', ' ', 'ตู้', 'ทึบ', ' ', 'รถ', 'คอก', 'ร้องไห้', 'แล้ว', 'จั๊ฟ']"
1989715795577114751,twitter,post,https://x.com/soottor154/status/1989715795577114751,text,2025-11-15T15:23:07.000Z,selenium_x_scraper_v1,แค่ผู้ชายไม่กี่คนที่ไปว่าไปด่าเขาไม่ใช่ผู้ชายทุกคนสักหน่อย อย่าหาเรื่องด่าเพศตรงข้ามแบบเหมารวม,แค่ผู้ชายไม่กี่คนที่ไปว่าไปด่าเขาไม่ใช่ผู้ชายทุกคนสักหน่อย อย่าหาเรื่องด่าเพศตรงข้ามแบบเหมารวม,2025-11-29 08:18:55,"['แค่', 'ผู้ชาย', 'ไม่', 'กี่', 'คน', 'ที่', 'ไป', 'ว่า', 'ไป', 'ด่า', 'เขา', 'ไม่', 'ใช่', 'ผู้ชาย', 'ทุกคน', 'สักหน่อย', ' ', 'อย่า', 'หาเรื่อง', 'ด่า', 'เพศตรงข้าม', 'แบบ', 'เหมา', 'รวม']"
1989700775959040056,twitter,post,https://x.com/aleipmll_stu/status/1989700775959040056,text,2025-11-15T14:23:26.000Z,selenium_x_scraper_v1,พวกพ่อมึงดิ,พวกพ่อมึงดิ,2025-11-29 08:18:55,"['พวก', 'พ่อ', 'มึง', 'ดิ']"
1989547880978194939,twitter,post,https://x.com/_kittycandies/status/1989547880978194939,text,2025-11-14T12:58:47.000Z,selenium_x_scraper_v1,ก็ผู้ชายไทยมันลูสเซอร์อ่า ขี้เกียจพัฒนาตัวเอง อยากได้ผู้หญิงรวยเลี้ยง ที่ชอบด่าผู้หญิงมีผัวรวยว่า gold digger จริงๆคืออิจฉาที่ผู้หญิงมี shortcut ในชีวิต เพราะวันก่อนเจอพวกมันแคปโพสต์ผู้หญิงเปย์แฟน คอมเมนต์มีแต่ “อยากได้แบบนี้” “หลุดคิวซี” “ตัวซีเคร็ท“ “อยากเจอแบบนี้บ้าง” ,ก็ผู้ชายไทยมันลูสเซอร์อ่า ขี้เกียจพัฒนาตัวเอง อยากได้ผู้หญิงรวยเลี้ยง ที่ชอบด่าผู้หญิงมีผัวรวยว่า gold digger จริงๆคืออิจฉาที่ผู้หญิงมี shortcut ในชีวิต เพราะวันก่อนเจอพวกมันแคปโพสต์ผู้หญิงเปย์แฟน คอมเมนต์มีแต่ “อยากได้แบบนี้” “หลุดคิวซี” “ตัวซีเคร็ท“ “อยากเจอแบบนี้บ้าง” ,2025-11-29 08:18:55,"['ก็', 'ผู้ชาย', 'ไทย', 'มัน', 'ลูส', 'เซอร์', 'อ่า', ' ', 'ขี้เกียจ', 'พัฒนา', 'ตัวเอง', ' ', 'อยากได้', 'ผู้หญิง', 'รวย', 'เลี้ยง', ' ', 'ที่', 'ชอบ', 'ด่า', 'ผู้หญิง', 'มี', 'ผัว', 'รวย', 'ว่า', ' ', 'gold', ' ', 'digger', ' ', 'จริงๆ', 'คือ', 'อิจฉา', 'ที่', 'ผู้หญิง', 'มี', ' ', 'shortcut', ' ', 'ใน', 'ชีวิต', ' ', 'เพราะ', 'วันก่อน', 'เจอ', 'พวก', 'มัน', 'แคป', 'โพสต์', 'ผู้หญิง', 'เปย์', 'แฟน', ' ', 'คอมเมนต์', 'มี', 'แต่', ' ', 'อยากได้', 'แบบนี้', ' ', 'หลุด', 'คิว', 'ซี', ' ', 'ตัว', 'ซี', 'เคร็ท', ' ', 'อยาก', 'เจอ', 'แบบนี้', 'บ้าง']"
1989886213315334269,twitter,post,https://x.com/suzyzisoo/status/1989886213315334269,text,2025-11-16T02:40:18.000Z,selenium_x_scraper_v1,,,2025-11-29 08:18:55,[]
1989887814859903460,twitter,post,https://x.com/_kittycandies/status/1989887814859903460,text,2025-11-16T02:46:40.000Z,selenium_x_scraper_v1,,,2025-11-29 08:18:55,[]
1990323925373645219,twitter,post,https://x.com/Mekuma07/status/1990323925373645219,text,2025-11-17T07:39:36.000Z,selenium_x_scraper_v1,จะให้เขามาใส่not allเองอะไร  ผู้ชายไทยบางคน หรือ ส่วนมากส่วนน้อยก็เขียนไปสิครับอันนี้ ผู้ชายไทยมัน…  อืมมันคือเหมารวมนะ,จะให้เขามาใส่not allเองอะไร  ผู้ชายไทยบางคน หรือ ส่วนมากส่วนน้อยก็เขียนไปสิครับอันนี้ ผู้ชายไทยมัน…  อืมมันคือเหมารวมนะ,2025-11-29 08:18:55,"['จะ', 'ให้', 'เขา', 'มา', 'ใส่', 'not', ' ', 'all', 'เอง', 'อะไร', ' ', 'ผู้ชาย', 'ไทย', 'บางคน', ' ', 'หรือ', ' ', 'ส่วนมาก', 'ส่วนน้อย', 'ก็', 'เขียน', 'ไป', 'สิ', 'ครับ', 'อันนี้', ' ', 'ผู้ชาย', 'ไทย', 'มัน', ' ', 'อืม', 'มัน', 'คือ', 'เหมา', 'รวม', 'นะ']"
1990388723070972071,twitter,post,https://x.com/_kittycandies/status/1990388723070972071,text,2025-11-17T11:57:05.000Z,selenium_x_scraper_v1,ถ้าใส่เองไม่ได้ก็รับไปเลยจ้า,ถ้าใส่เองไม่ได้ก็รับไปเลยจ้า,2025-11-29 08:18:55,"['ถ้า', 'ใส่', 'เอง', 'ไม่', 'ได้', 'ก็', 'รับ', 'ไป', 'เลย', 'จ้า']"
1990082846313120132,twitter,post,https://x.com/Augusto43958501/status/1990082846313120132,text,2025-11-16T15:41:39.000Z,selenium_x_scraper_v1,ผมก็คนไทยมีเมียเป็นฝรั่ง ผมหาเงินเลี้ยงเขาคนเดียวให้เขาไปเรียนต่ออยู่จีน แบบนี้เรียกลูสเซอร์ป่าวครับ อยากเจอผู้ชายแบบไหนก็เอาตัวเองไปอยู่ในสังคมแบบนั้นดิ ไปหาตามสังคมเรื้อนๆก็เจอแต่ลูสเซอร์แบบนั้นแหละ ไอคำพูดเหมารวมชายไทยควรเลิกพูดได้ละ,ผมก็คนไทยมีเมียเป็นฝรั่ง ผมหาเงินเลี้ยงเขาคนเดียวให้เขาไปเรียนต่ออยู่จีน แบบนี้เรียกลูสเซอร์ป่าวครับ อยากเจอผู้ชายแบบไหนก็เอาตัวเองไปอยู่ในสังคมแบบนั้นดิ ไปหาตามสังคมเรื้อนๆก็เจอแต่ลูสเซอร์แบบนั้นแหละ ไอคำพูดเหมารวมชายไทยควรเลิกพูดได้ละ,2025-11-29 08:18:55,"['ผม', 'ก็', 'คนไทย', 'มี', 'เมีย', 'เป็น', 'ฝรั่ง', ' ', 'ผม', 'หาเงิน', 'เลี้ยง', 'เขา', 'คนเดียว', 'ให้', 'เขา', 'ไป', 'เรียนต่อ', 'อยู่', 'จีน', ' ', 'แบบนี้', 'เรียก', 'ลูส', 'เซอร์', 'ป่าว', 'ครับ', ' ', 'อยาก', 'เจอ', 'ผู้ชาย', 'แบบ', 'ไหน', 'ก็', 'เอา', 'ตัวเอง', 'ไป', 'อยู่', 'ใน', 'สังคม', 'แบบ', 'นั้น', 'ดิ', ' ', 'ไปหา', 'ตาม', 'สังคม', 'เรื้อน', 'ๆ', 'ก็', 'เจอ', 'แต่', 'ลูส', 'เซอร์', 'แบบ', 'นั้นแหละ', ' ', 'ไอ', 'คำพูด', 'เหมา', 'รวม', 'ชาย', 'ไทย', 'ควร', 'เลิก', 'พูด', 'ได้', 'ละ']"
1990064417426575781,twitter,post,https://x.com/Mangesonn/status/1990064417426575781,text,2025-11-16T14:28:25.000Z,selenium_x_scraper_v1,ไม่เห็นแปลกเลย ผู้หญิงอยากได้ผู้ชายเปย์ ผู้ชายก็อยากมีผู้หญิงบ้างจะเป็นไรไป ผู้หญิงได้ผัวรวยเรียกวาสนา ผู้ชายได้เมียรวยเรียกแมงดา สภาพพพพพพ,ไม่เห็นแปลกเลย ผู้หญิงอยากได้ผู้ชายเปย์ ผู้ชายก็อยากมีผู้หญิงบ้างจะเป็นไรไป ผู้หญิงได้ผัวรวยเรียกวาสนา ผู้ชายได้เมียรวยเรียกแมงดา สภาพพพพพพ,2025-11-29 08:18:55,"['ไม่', 'เห็น', 'แปลก', 'เลย', ' ', 'ผู้หญิง', 'อยากได้', 'ผู้ชาย', 'เปย์', ' ', 'ผู้ชาย', 'ก็', 'อยาก', 'มี', 'ผู้หญิง', 'บ้าง', 'จะ', 'เป็นไรไป', ' ', 'ผู้หญิง', 'ได้', 'ผัว', 'รวย', 'เรียก', 'วาสนา', ' ', 'ผู้ชาย', 'ได้', 'เมีย', 'รวย', 'เรียก', 'แมงดา', ' ', 'สภาพ', 'พพพพพ']"
1990012307330793698,twitter,post,https://x.com/klinapichit/status/1990012307330793698,text,2025-11-16T11:01:21.000Z,selenium_x_scraper_v1,พวกขี้นินทาก็ ลูสเซอร์กันทั้งนั้น,พวกขี้นินทาก็ ลูสเซอร์กันทั้งนั้น,2025-11-29 08:18:55,"['พวก', 'ขี้', 'นินทา', 'ก็', ' ', 'ลูส', 'เซอร์', 'กัน', 'ทั้งนั้น']"
1989953857766707693,twitter,post,https://x.com/leakdays/status/1989953857766707693,text,2025-11-16T07:09:05.000Z,selenium_x_scraper_v1,ไม่ร่วม พ่อ แฟน พี่ น้อง(ถ้ามี) น้า อา ที่บ้านเนอ แด่ผชไอ้ขี้แพ้ ฮา,ไม่ร่วม พ่อ แฟน พี่ น้อง(ถ้ามี) น้า อา ที่บ้านเนอ แด่ผชไอ้ขี้แพ้ ฮา,2025-11-29 08:18:55,"['ไม่', 'ร่วม', ' ', 'พ่อ', ' ', 'แฟน', ' ', 'พี่', ' ', 'น้อง', ' ', 'ถ้า', 'มี', ' ', 'น้า', ' ', 'อา', ' ', 'ที่', 'บ้าน', 'เนอ', ' ', 'แด่', 'ผช', 'ไอ้', 'ขี้', 'แพ้', ' ', 'หัวเราะ']"
1990369709527797889,twitter,post,https://x.com/miraimirage/status/1990369709527797889,text,2025-11-17T10:41:32.000Z,selenium_x_scraper_v1,พวกให้ผู้หญิงเลี้ยง ก็แมงดาแหละ ส่วนผู้หญิงที่เกาะผู้ชายเลี้ยงก็ปลิงเหมือนกัน .... พวกทำงานหาเงินเองไม่เป็น,พวกให้ผู้หญิงเลี้ยง ก็แมงดาแหละ ส่วนผู้หญิงที่เกาะผู้ชายเลี้ยงก็ปลิงเหมือนกัน .... พวกทำงานหาเงินเองไม่เป็น,2025-11-29 08:18:55,"['พวก', 'ให้', 'ผู้หญิง', 'เลี้ยง', ' ', 'ก็', 'แมงดา', 'แหละ', ' ', 'ส่วน', 'ผู้หญิง', 'ที่', 'เกาะ', 'ผู้ชาย', 'เลี้ยง', 'ก็', 'ปลิง', 'เหมือนกัน', ' ', '...', ' ', 'พวก', 'ทำงาน', 'หาเงิน', 'เอง', 'ไม่', 'เป็น']"
1990305641857237066,twitter,post,https://x.com/__n4ck/status/1990305641857237066,text,2025-11-17T06:26:57.000Z,selenium_x_scraper_v1,“shortcut ในชีวิต” 55555555555 เคงับ,“shortcut ในชีวิต” 55555555555 เคงับ,2025-11-29 08:18:55,"['shortcut', ' ', 'ใน', 'ชีวิต', ' ', 'หัวเราะ', ' ', 'เค', 'งับ']"
1990436823836090428,twitter,post,https://x.com/SunflowerI00K/status/1990436823836090428,text,2025-11-17T15:08:13.000Z,selenium_x_scraper_v1,ตลกผู้ชายในนี้ว่ะแม่ง555555,ตลกผู้ชายในนี้ว่ะแม่ง555555,2025-11-29 08:18:55,"['ตลก', 'ผู้ชาย', 'ใน', 'นี้', 'ว่ะ', 'แม่', 'ง', 'หัวเราะ']"
1990012849775841400,twitter,post,https://x.com/carbro_maja/status/1990012849775841400,text,2025-11-16T11:03:30.000Z,selenium_x_scraper_v1,คือใครอยากจะได้คนมีปัญหาด้านการเงินไม่ต้องคิดเรื่องสูงหรือต่ำนะเอาแค่เรื่องเดียวก่อน,คือใครอยากจะได้คนมีปัญหาด้านการเงินไม่ต้องคิดเรื่องสูงหรือต่ำนะเอาแค่เรื่องเดียวก่อน,2025-11-29 08:18:55,"['คือ', 'ใคร', 'อยาก', 'จะ', 'ได้', 'คน', 'มีปัญหา', 'ด้าน', 'การเงิน', 'ไม่ต้อง', 'คิด', 'เรื่อง', 'สูง', 'หรือ', 'ต่ำ', 'นะ', 'เอา', 'แค่', 'เรื่อง', 'เดียว', 'ก่อน']"
1990324214310834643,twitter,post,https://x.com/Mekuma07/status/1990324214310834643,text,2025-11-17T07:40:45.000Z,selenium_x_scraper_v1,อีกอย่าง ผู้ชายไทยผู้หญิงไทยส่วนมาก สันดานไม่ได้ต่างกัน ขี้เกียจพัฒนาตัวเองทั้งนั้น ชอบด้อยค่าแต่คนอื่นดีแต่เพศตัวเอง ถุ้ย,อีกอย่าง ผู้ชายไทยผู้หญิงไทยส่วนมาก สันดานไม่ได้ต่างกัน ขี้เกียจพัฒนาตัวเองทั้งนั้น ชอบด้อยค่าแต่คนอื่นดีแต่เพศตัวเอง ถุ้ย,2025-11-29 08:18:55,"['อีก', 'อย่าง', ' ', 'ผู้ชาย', 'ไทย', 'ผู้หญิง', 'ไทย', 'ส่วนมาก', ' ', 'สันดาน', 'ไม่', 'ได้', 'ต่างกัน', ' ', 'ขี้เกียจ', 'พัฒนา', 'ตัวเอง', 'ทั้งนั้น', ' ', 'ชอบ', 'ด้อยค่า', 'แต่', 'คนอื่น', 'ดีแต่', 'เพศ', 'ตัวเอง', ' ', 'ถุ้ย']"
1990110128377606305,twitter,post,https://x.com/xttxxd/status/1990110128377606305,text,2025-11-16T17:30:03.000Z,selenium_x_scraper_v1,ข้อสุดท้ายกุเห็นแม่งก็พิมพ์หมดอะไม่ว่าจะเพศไหนทุกเพศก็มีดีเลวเหมือนกันเว้นว่าคุณจะอคติกับฝ่ายใดฝ่ายหนึ่งหรือมองข้ามฝ่ายใดฝ่ายหนึ่ง,ข้อสุดท้ายกุเห็นแม่งก็พิมพ์หมดอะไม่ว่าจะเพศไหนทุกเพศก็มีดีเลวเหมือนกันเว้นว่าคุณจะอคติกับฝ่ายใดฝ่ายหนึ่งหรือมองข้ามฝ่ายใดฝ่ายหนึ่ง,2025-11-29 08:18:55,"['ข้อ', 'สุดท้าย', 'กุ', 'เห็น', 'แม่', 'ง', 'ก็', 'พิมพ์', 'หมด', 'อะ', 'ไม่', 'ว่า', 'จะ', 'เพศ', 'ไหน', 'ทุก', 'เพศ', 'ก็', 'มี', 'ดี', 'เลว', 'เหมือนกัน', 'เว้น', 'ว่า', 'คุณ', 'จะ', 'อคติ', 'กับ', 'ฝ่ายใดฝ่ายหนึ่ง', 'หรือ', 'มองข้าม', 'ฝ่ายใดฝ่ายหนึ่ง']"
1990017785444081669,twitter,post,https://x.com/TirATanT/status/1990017785444081669,text,2025-11-16T11:23:07.000Z,selenium_x_scraper_v1,ตกQC อยากได้หลุดQCไปอีก,ตกQC อยากได้หลุดQCไปอีก,2025-11-29 08:18:55,"['ตก', 'qc', ' ', 'อยากได้', 'หลุด', 'qc', 'ไป', 'อีก']"
