id,platform,platform_type,url,content_type,timestamp,scraper_module,text,raw_text,scrape_date,tokens
1972605469463400727,twitter,post,https://x.com/LinyuYok/status/1972605469463400727,text,2025-09-29T10:12:47.000Z,selenium_x_scraper_v1,เพราะผู้ชายแค่โดนระแวง แต่ผู้หญิงส่วนใหญ่โดนฆ่าข่มขืนชิงทรัพย์ ความเสียหายที่เราเจอมันมากกว่ามาก การที่น้องเขาออกมาอัดคลิป มันคือการขอความร่วมมือ เพราะต่อให้เราระวังตัวแค่ไหน เราก็เป็นเหยื่ออยู่ดี ถ้าไม่เหนือบ่ากว่าแรงอะไร แค่เดินนำหน้าให้เราไม่กลัวก็พอ คงไม่ยากเกินไปนะคะ,เพราะผู้ชายแค่โดนระแวง แต่ผู้หญิงส่วนใหญ่โดนฆ่าข่มขืนชิงทรัพย์ ความเสียหายที่เราเจอมันมากกว่ามาก การที่น้องเขาออกมาอัดคลิป มันคือการขอความร่วมมือ เพราะต่อให้เราระวังตัวแค่ไหน เราก็เป็นเหยื่ออยู่ดี ถ้าไม่เหนือบ่ากว่าแรงอะไร แค่เดินนำหน้าให้เราไม่กลัวก็พอ คงไม่ยากเกินไปนะคะ,2025-11-08 17:05:14,"['เพราะ', 'ผู้ชาย', 'แค่', 'โดน', 'ระแวง', ' ', 'แต่', 'ผู้หญิง', 'ส่วนใหญ่', 'โดน', 'ฆ่า', 'ข่มขืน', 'ชิงทรัพย์', ' ', 'ความเสียหาย', 'ที่', 'เรา', 'เจอ', 'มัน', 'มากกว่า', 'มาก', ' ', 'การ', 'ที่', 'น้อง', 'เขา', 'ออกมา', 'อัด', 'คลิป', ' ', 'มัน', 'คือ', 'การ', 'ขอความร่วมมือ', ' ', 'เพราะ', 'ต่อให้', 'เรา', 'ระวังตัว', 'แค่', 'ไหน', ' ', 'เรา', 'ก็', 'เป็น', 'เหยื่อ', 'อยู่ดี', ' ', 'ถ้า', 'ไม่', 'เหนือ', 'บ่า', 'กว่า', 'แรง', 'อะไร', ' ', 'แค่', 'เดิน', 'นำหน้า', 'ให้', 'เรา', 'ไม่', 'กลัว', 'ก็', 'พอ', ' ', 'คง', 'ไม่', 'ยาก', 'เกินไป', 'นะคะ']"
1972358334495010818,twitter,post,https://x.com/khanramanuging/status/1972358334495010818,text,2025-09-28T17:50:46.000Z,selenium_x_scraper_v1,อันนี้ก็ถูกของนาง ถ้าเว้นระยะห่างไม่ได้ ให้รีบเดินแซงหน้าไปเลย ส่วนผู้หญิง ถ้าไม่อยากให้เขาตามหลังให้ชะลอความเร็วให้เขาแซงไปก่อน ค่อยเดินตาม บางคนเขาไม่ได้คิดอกุศลกับหล่อนหรอก,อันนี้ก็ถูกของนาง ถ้าเว้นระยะห่างไม่ได้ ให้รีบเดินแซงหน้าไปเลย ส่วนผู้หญิง ถ้าไม่อยากให้เขาตามหลังให้ชะลอความเร็วให้เขาแซงไปก่อน ค่อยเดินตาม บางคนเขาไม่ได้คิดอกุศลกับหล่อนหรอก,2025-11-08 17:05:14,"['อันนี้', 'ก็', 'ถูก', 'ของ', 'นาง', ' ', 'ถ้า', 'เว้น', 'ระยะห่าง', 'ไม่', 'ได้', ' ', 'ให้', 'รีบ', 'เดิน', 'แซง', 'หน้า', 'ไป', 'เลย', ' ', 'ส่วน', 'ผู้หญิง', ' ', 'ถ้า', 'ไม่', 'อยาก', 'ให้', 'เขา', 'ตามหลัง', 'ให้', 'ชะลอ', 'ความเร็ว', 'ให้', 'เขา', 'แซง', 'ไป', 'ก่อน', ' ', 'ค่อย', 'เดินตาม', ' ', 'บางคน', 'เขา', 'ไม่', 'ได้คิด', 'อกุศล', 'กับ', 'หล่อน', 'หรอก']"
1972546254111670286,twitter,post,https://x.com/shobo_4who/status/1972546254111670286,text,2025-09-29T06:17:29.000Z,selenium_x_scraper_v1,พวกผู้ชายที่เม้นหรือเมนชั่นในโพสต์นี้ทำให้กูรู้ว่าสมควรระแวงคนอย่างพวกแม่งต่อไป,พวกผู้ชายที่เม้นหรือเมนชั่นในโพสต์นี้ทำให้กูรู้ว่าสมควรระแวงคนอย่างพวกแม่งต่อไป,2025-11-08 17:05:14,"['พวก', 'ผู้ชาย', 'ที่', 'เม้น', 'หรือ', 'เมน', 'ชั่น', 'ใน', 'โพสต์', 'นี้', 'ทำให้', 'กู', 'รู้', 'ว่า', 'สมควร', 'ระแวง', 'คน', 'อย่าง', 'พวก', 'แม่', 'ง', 'ต่อไป']"
1972220799160553509,twitter,post,https://x.com/VkkMS5eBWAWIYxs/status/1972220799160553509,text,2025-09-28T08:44:15.000Z,selenium_x_scraper_v1,ลองแบบนี้มั้ยย ถือว่าเป็นการช่วยละกัน,ลองแบบนี้มั้ยย ถือว่าเป็นการช่วยละกัน,2025-11-08 17:05:14,"['ลอง', 'แบบนี้', 'มั้ย', 'ย', ' ', 'ถือว่า', 'เป็นการ', 'ช่วย', 'ละ', 'กัน']"
1972132708886413821,twitter,post,https://x.com/x32290418324111/status/1972132708886413821,text,2025-09-28T02:54:12.000Z,selenium_x_scraper_v1,ผู้หญิงที่เป็นภัยต่อผู้ชาย,ผู้หญิงที่เป็นภัยต่อผู้ชาย,2025-11-08 17:05:14,"['ผู้หญิง', 'ที่', 'เป็น', 'ภัย', 'ต่อ', 'ผู้ชาย']"
1972625398275195210,twitter,post,https://x.com/wgjkl1/status/1972625398275195210,text,2025-09-29T11:31:59.000Z,selenium_x_scraper_v1,ผู้ชายขี้แพ้ในทวิตกับเฟสคือไม่ต่างกันเลยดิ้นเหมือนถูกน้ำร้อนลวก แค่เป็นผู้หญิงเดินมืดๆค่ำๆมันก็น่ากลัวแล้ว เพราะไม่รู้อีกฝ่ายแค่เดินเฉยๆหรือมีอะไรแอบแฝง,ผู้ชายขี้แพ้ในทวิตกับเฟสคือไม่ต่างกันเลยดิ้นเหมือนถูกน้ำร้อนลวก แค่เป็นผู้หญิงเดินมืดๆค่ำๆมันก็น่ากลัวแล้ว เพราะไม่รู้อีกฝ่ายแค่เดินเฉยๆหรือมีอะไรแอบแฝง,2025-11-08 17:05:14,"['ผู้ชาย', 'ขี้', 'แพ้', 'ใน', 'ทวิ', 'ต', 'กับ', 'เฟส', 'คือ', 'ไม่', 'ต่างกัน', 'เลย', 'ดิ้น', 'เหมือน', 'ถูก', 'น้ำร้อน', 'ลวก', ' ', 'แค่', 'เป็น', 'ผู้หญิง', 'เดิน', 'มืด', 'ๆ', 'ค่ำ', 'ๆ', 'มัน', 'ก็', 'น่ากลัว', 'แล้ว', ' ', 'เพราะ', 'ไม่', 'รู้', 'อีก', 'ฝ่าย', 'แค่', 'เดิน', 'เฉย', 'ๆ', 'หรือ', 'มี', 'อะไร', 'แอบแฝง']"
1972489184121401770,twitter,post,https://x.com/NanNie_NaNnAn/status/1972489184121401770,text,2025-09-29T02:30:43.000Z,selenium_x_scraper_v1,ก็มันน่ากลัวแล้วก็น่าระแวงจริงๆนี่คะ แค่คุณพูดว่าขอทางหน่อยค้าบ ผญ.ก็ให้แซงแล้วไปก่อนเลย ผญ.จะได้รู้สึกไม่ระแวง,ก็มันน่ากลัวแล้วก็น่าระแวงจริงๆนี่คะ แค่คุณพูดว่าขอทางหน่อยค้าบ ผญ.ก็ให้แซงแล้วไปก่อนเลย ผญ.จะได้รู้สึกไม่ระแวง,2025-11-08 17:05:14,"['ก็', 'มัน', 'น่ากลัว', 'แล้วก็', 'น่า', 'ระแวง', 'จริงๆ', 'นี่', 'คะ', ' ', 'แค่', 'คุณ', 'พูดว่า', 'ขอทาง', 'หน่อย', 'ค้าบ', ' ', 'ผญ.', 'ก็', 'ให้', 'แซง', 'แล้วไป', 'ก่อน', 'เลย', ' ', 'ผญ.', 'จะ', 'ได้', 'รู้สึก', 'ไม่', 'ระแวง']"
1972146908048380061,twitter,post,https://x.com/JunePhatta/status/1972146908048380061,text,2025-09-28T03:50:38.000Z,selenium_x_scraper_v1,พบแล้วศูนย์กลางใหม่ของจักรวาล,พบแล้วศูนย์กลางใหม่ของจักรวาล,2025-11-08 17:05:14,"['พบ', 'แล้ว', 'ศูนย์กลาง', 'ใหม่', 'ของ', 'จักรวาล']"
1972545868416131139,twitter,post,https://x.com/BBbluesboy/status/1972545868416131139,text,2025-09-29T06:15:57.000Z,selenium_x_scraper_v1,บางทีไม่ใช่อันตรายแค่ผญ ผชก็อาจจะเป็นเหยื่อได้ ระวังตัวไว้ก็ดี สังคมมันควรจะปลอดภัยกว่านี้นะ,บางทีไม่ใช่อันตรายแค่ผญ ผชก็อาจจะเป็นเหยื่อได้ ระวังตัวไว้ก็ดี สังคมมันควรจะปลอดภัยกว่านี้นะ,2025-11-08 17:05:14,"['บางที', 'ไม่', 'ใช่', 'อันตราย', 'แค่', 'ผญ', ' ', 'ผช', 'ก็', 'อาจจะ', 'เป็น', 'เหยื่อ', 'ได้', ' ', 'ระวังตัว', 'ไว้', 'ก็ดี', ' ', 'สังคม', 'มัน', 'ควรจะ', 'ปลอดภัย', 'กว่า', 'นี้', 'นะ']"
1972926225682497792,twitter,post,https://x.com/llybunniry/status/1972926225682497792,text,2025-09-30T07:27:22.000Z,selenium_x_scraper_v1,ฟังผู้หญิงแล้วเคืองก็หัดฟังผู้ชายที่เขาเข้าใจผู้หญิงหน่อยนะ,ฟังผู้หญิงแล้วเคืองก็หัดฟังผู้ชายที่เขาเข้าใจผู้หญิงหน่อยนะ,2025-11-08 17:05:14,"['ฟัง', 'ผู้หญิง', 'แล้ว', 'เคือง', 'ก็', 'หัด', 'ฟัง', 'ผู้ชาย', 'ที่', 'เขา', 'เข้าใจ', 'ผู้หญิง', 'หน่อย', 'นะ']"
1972660798670733660,twitter,post,https://x.com/52hz_ihope/status/1972660798670733660,text,2025-09-29T13:52:39.000Z,selenium_x_scraper_v1,ขนาดเราเป็น ผญ เรายังไม่อยากเดินจี้ใครเลยค่ะ ถ้ารีบจริงๆ ก็คือจะเดินไวแล้วแซงให้เร็วที่สุด ไม่ให้จี้นานเกิน มันมีนะคนที่เดินจี้นานๆ อ่ะ ควรเว้นระยะด้วย มันเหมือนกดดันคนข้างหน้า บางคนเค้าก็กลัวด้วย จริงๆไม่ว่าจะ ช ญ ก็ควรมีมารยาทตรงนี้อ่ะ ถ้าเราไม่รีบก็หลีกทางให้คนข้างหลังได้แซง,ขนาดเราเป็น ผญ เรายังไม่อยากเดินจี้ใครเลยค่ะ ถ้ารีบจริงๆ ก็คือจะเดินไวแล้วแซงให้เร็วที่สุด ไม่ให้จี้นานเกิน มันมีนะคนที่เดินจี้นานๆ อ่ะ ควรเว้นระยะด้วย มันเหมือนกดดันคนข้างหน้า บางคนเค้าก็กลัวด้วย จริงๆไม่ว่าจะ ช ญ ก็ควรมีมารยาทตรงนี้อ่ะ ถ้าเราไม่รีบก็หลีกทางให้คนข้างหลังได้แซง,2025-11-08 17:05:14,"['ขนาด', 'เรา', 'เป็น', ' ', 'ผญ', ' ', 'เรา', 'ยัง', 'ไม่', 'อยาก', 'เดิน', 'จี้', 'ใคร', 'เลย', 'ค่ะ', ' ', 'ถ้า', 'รีบ', 'จริงๆ', ' ', 'ก็', 'คือ', 'จะ', 'เดิน', 'ไว', 'แล้ว', 'แซง', 'ให้', 'เร็ว', 'ที่สุด', ' ', 'ไม่', 'ให้', 'จี้', 'นาน', 'เกิน', ' ', 'มัน', 'มี', 'นะ', 'คน', 'ที่', 'เดิน', 'จี้', 'นานๆ', ' ', 'อ่ะ', ' ', 'ควร', 'เว้นระยะ', 'ด้วย', ' ', 'มัน', 'เหมือน', 'กดดัน', 'คน', 'ข้างหน้า', ' ', 'บางคน', 'เค้า', 'ก็', 'กลัว', 'ด้วย', ' ', 'จริงๆ', 'ไม่', 'ว่า', 'จะ', ' ', 'ช', ' ', 'ญ', ' ', 'ก็', 'ควร', 'มี', 'มารยาท', 'ตรงนี้', 'อ่ะ', ' ', 'ถ้า', 'เรา', 'ไม่', 'รีบ', 'ก็', 'หลีกทาง', 'ให้', 'คน', 'ข้างหลัง', 'ได้', 'แซง']"
1972197857064337771,twitter,post,https://x.com/AnupongKumdee/status/1972197857064337771,text,2025-09-28T07:13:05.000Z,selenium_x_scraper_v1,โหอีสัส หลงตัวเอง บ้านกูอยู่ตรงนั้น มึงดูดยาแล้วหลอนไม่เกี่ยวกับกู,โหอีสัส หลงตัวเอง บ้านกูอยู่ตรงนั้น มึงดูดยาแล้วหลอนไม่เกี่ยวกับกู,2025-11-08 17:05:14,"['โห', 'อี', 'สัส', ' ', 'หลงตัวเอง', ' ', 'บ้าน', 'กู', 'อยู่', 'ตรงนั้น', ' ', 'มึง', 'ดูด', 'ยา', 'แล้ว', 'หลอน', 'ไม่', 'เกี่ยวกับ', 'กู']"
1972197722737561795,twitter,post,https://x.com/SesthasitS/status/1972197722737561795,text,2025-09-28T07:12:33.000Z,selenium_x_scraper_v1,ถ้ากุเดินตามไม่โทรแจ้งตำรวจเลยเหลอวะ หน้ากุยิ่งทรงโจรอยู่ มีเคสเลิก ot ดึกเดินไปหาไรกินเสร็จเดินกลับบ้าน เจอสาวนางหนึ่งเหมือนกลัวบางทีก็อยากบอก สาวมึงอย่าสำคัญตัวเองผิด กุแค่รีบกลับบ้านกุปวดขี้อีดอก,ถ้ากุเดินตามไม่โทรแจ้งตำรวจเลยเหลอวะ หน้ากุยิ่งทรงโจรอยู่ มีเคสเลิก ot ดึกเดินไปหาไรกินเสร็จเดินกลับบ้าน เจอสาวนางหนึ่งเหมือนกลัวบางทีก็อยากบอก สาวมึงอย่าสำคัญตัวเองผิด กุแค่รีบกลับบ้านกุปวดขี้อีดอก,2025-11-08 17:05:14,"['ถ้า', 'กุ', 'เดินตาม', 'ไม่', 'โทร', 'แจ้งตำรวจ', 'เลย', 'เหลอ', 'วะ', ' ', 'หน้า', 'กุ', 'ยิ่ง', 'ทรง', 'โจร', 'อยู่', ' ', 'มี', 'เคส', 'เลิก', ' ', 'ot', ' ', 'ดึก', 'เดิน', 'ไปหา', 'ไร', 'กิน', 'เสร็จ', 'เดิน', 'กลับบ้าน', ' ', 'เจอ', 'สาว', 'นาง', 'หนึ่ง', 'เหมือน', 'กลัว', 'บางที', 'ก็', 'อยาก', 'บอก', ' ', 'สาว', 'มึง', 'อย่า', 'สำคัญ', 'ตัวเอง', 'ผิด', ' ', 'กุ', 'แค่', 'รีบ', 'กลับบ้าน', 'กุ', 'ปวด', 'ขี้', 'อีดอก']"
1972474573162795010,twitter,post,https://x.com/moonlight91951/status/1972474573162795010,text,2025-09-29T01:32:39.000Z,selenium_x_scraper_v1,"บางคนเดินจี้อยู่ได้ หลบให้แซงยังมองหน้าอีก
ไหนมอไซร์ ไหนจะฝาท่อ เดินแซงเดินจี้ต่างกันนะ","บางคนเดินจี้อยู่ได้ หลบให้แซงยังมองหน้าอีก
ไหนมอไซร์ ไหนจะฝาท่อ เดินแซงเดินจี้ต่างกันนะ",2025-11-08 17:05:14,"['บางคน', 'เดิน', 'จี้', 'อยู่', 'ได้', ' ', 'หลบ', 'ให้', 'แซง', 'ยัง', 'มองหน้า', 'อีก', ' ', 'ไหน', 'มอ', 'ไซ', 'ร์', ' ', 'ไหนจะ', 'ฝา', 'ท่อ', ' ', 'เดิน', 'แซง', 'เดิน', 'จี้', 'ต่างกัน', 'นะ']"
1972198215605969211,twitter,post,https://x.com/wa62352/status/1972198215605969211,text,2025-09-28T07:14:30.000Z,selenium_x_scraper_v1,นี่เป็นผญ.พึ่งเลิกงานมาใส่ฮู้ดปิดหัวสะพายกระเป๋าแล้วแวะเอาของแล้วเล่นกับแมว จังหวะที่ตะเดินออกแล้วมีผญ.อีกคนเดินอยุ่ข้างหน้าเขาก็หยุดเดินแล้วหันมามอง นี่คิดละในหัว ถ้ากุหยุดเดินบ้างแล้วทำเหมือนวิ่งเข้าใส่เจาจะกรี๊ดไหมวะ สุดท้ายก็เดินดุ่มๆแซงเขาไป ต้องเดินเข้าซอยอีก,นี่เป็นผญ.พึ่งเลิกงานมาใส่ฮู้ดปิดหัวสะพายกระเป๋าแล้วแวะเอาของแล้วเล่นกับแมว จังหวะที่ตะเดินออกแล้วมีผญ.อีกคนเดินอยุ่ข้างหน้าเขาก็หยุดเดินแล้วหันมามอง นี่คิดละในหัว ถ้ากุหยุดเดินบ้างแล้วทำเหมือนวิ่งเข้าใส่เจาจะกรี๊ดไหมวะ สุดท้ายก็เดินดุ่มๆแซงเขาไป ต้องเดินเข้าซอยอีก,2025-11-08 17:05:14,"['นี่', 'เป็น', 'ผญ.', 'พึ่ง', 'เลิกงาน', 'มา', 'ใส่', 'ฮู้', 'ด', 'ปิด', 'หัว', 'สะพาย', 'กระเป๋า', 'แล้ว', 'แวะ', 'เอา', 'ของ', 'แล้ว', 'เล่น', 'กับ', 'แมว', ' ', 'จังหวะ', 'ที่', 'ตะ', 'เดิน', 'ออก', 'แล้ว', 'มี', 'ผญ.', 'อีก', 'คน', 'เดิน', 'อยุ่', 'ข้างหน้า', 'เขา', 'ก็', 'หยุด', 'เดิน', 'แล้ว', 'หันมา', 'มอง', ' ', 'นี่', 'คิด', 'ละ', 'ใน', 'หัว', ' ', 'ถ้า', 'กุ', 'หยุด', 'เดิน', 'บ้าง', 'แล้ว', 'ทำ', 'เหมือน', 'วิ่ง', 'เข้าใส่', 'เจา', 'จะ', 'กรี๊ด', 'ไหม', 'วะ', ' ', 'สุดท้าย', 'ก็', 'เดิน', 'ดุ่มๆ', 'แซง', 'เขา', 'ไป', ' ', 'ต้อง', 'เดิน', 'เข้า', 'ซอย', 'อีก']"
1972189646076719286,twitter,post,https://x.com/FAvasaki/status/1972189646076719286,text,2025-09-28T06:40:27.000Z,selenium_x_scraper_v1,อย่าออกจากบ้านตอนกลางคืน แก้ที่ตัวเราก่อน,อย่าออกจากบ้านตอนกลางคืน แก้ที่ตัวเราก่อน,2025-11-08 17:05:14,"['อย่า', 'ออกจาก', 'บ้าน', 'ตอนกลางคืน', ' ', 'แก้', 'ที่', 'ตัวเรา', 'ก่อน']"
1972190576595685549,twitter,post,https://x.com/NaniWhatArai/status/1972190576595685549,text,2025-09-28T06:44:09.000Z,selenium_x_scraper_v1,กูเดินกูดีดี,กูเดินกูดีดี,2025-11-08 17:05:14,"['กู', 'เดิน', 'กู', 'ดี', 'ดี']"
1972174724391477292,twitter,post,https://x.com/kidsada_manadee/status/1972174724391477292,text,2025-09-28T05:41:10.000Z,selenium_x_scraper_v1,กูจะแซงมึงก็เดินเร็วหนีก็หาว่ากูตาม พอกูช้าเพราะรู้มึงกลัวก็หาว่ากูเดินตาม กูว่ามึงนั่งแกร๊ปเถอะอีดอกกูให้เงินค่ารถมึงก็ได้อย่าสำคัญตัวเองผิด,กูจะแซงมึงก็เดินเร็วหนีก็หาว่ากูตาม พอกูช้าเพราะรู้มึงกลัวก็หาว่ากูเดินตาม กูว่ามึงนั่งแกร๊ปเถอะอีดอกกูให้เงินค่ารถมึงก็ได้อย่าสำคัญตัวเองผิด,2025-11-08 17:05:14,"['กู', 'จะ', 'แซง', 'มึง', 'ก็', 'เดิน', 'เร็ว', 'หนี', 'ก็', 'หาว่า', 'กู', 'ตาม', ' ', 'พอ', 'กู', 'ช้า', 'เพราะ', 'รู้', 'มึง', 'กลัว', 'ก็', 'หาว่า', 'กู', 'เดินตาม', ' ', 'กู', 'ว่า', 'มึง', 'นั่ง', 'แก', 'ร๊ป', 'เถอะ', 'อีดอก', 'กู', 'ให้เงิน', 'ค่ารถ', 'มึง', 'ก็ได้', 'อย่า', 'สำคัญ', 'ตัวเอง', 'ผิด']"
