id,platform,platform_type,url,content_type,timestamp,scraper_module,text,raw_text,scrape_date,tokens
1630160738525544449,twitter,post,https://x.com/crta_me/status/1630160738525544449,text,2023-02-27T10:59:41.000Z,selenium_x_scraper_v1,สวัสดีครับผมชายแท้ครับ,สวัสดีครับผมชายแท้ครับ,2025-10-23 17:59:34,"['สวัสดี', 'ครับผม', 'ชาย', 'แท้', 'ครับ']"
1630160543226163201,twitter,post,https://x.com/crta_me/status/1630160543226163201,text,2023-02-27T10:58:55.000Z,selenium_x_scraper_v1,ครับชายแท้ผม ผมชายแท้สวัสดีครับ,ครับชายแท้ผม ผมชายแท้สวัสดีครับ,2025-10-23 17:59:34,"['ครับ', 'ชาย', 'แท้', 'ผม', ' ', 'ผม', 'ชาย', 'แท้', 'สวัสดี', 'ครับ']"
1630160421176098818,twitter,post,https://x.com/crta_me/status/1630160421176098818,text,2023-02-27T10:58:25.000Z,selenium_x_scraper_v1,ผมชายแท้เช่นกัน สวัสดีครับ,ผมชายแท้เช่นกัน สวัสดีครับ,2025-10-23 17:59:34,"['ผม', 'ชาย', 'แท้', 'เช่นกัน', ' ', 'สวัสดี', 'ครับ']"
1630160351139627010,twitter,post,https://x.com/crta_me/status/1630160351139627010,text,2023-02-27T10:58:09.000Z,selenium_x_scraper_v1,ไม่มีครับ แต่สวัสดีครับผมชายแท้เองครับ,ไม่มีครับ แต่สวัสดีครับผมชายแท้เองครับ,2025-10-23 17:59:34,"['ไม่', 'มี', 'ครับ', ' ', 'แต่', 'สวัสดี', 'ครับผม', 'ชาย', 'แท้', 'เอง', 'ครับ']"
1630160207186898944,twitter,post,https://x.com/crta_me/status/1630160207186898944,text,2023-02-27T10:57:34.000Z,selenium_x_scraper_v1,ยินดีที่ได้รู้จักครับผมชายแท้เหมือนกัน,ยินดีที่ได้รู้จักครับผมชายแท้เหมือนกัน,2025-10-23 17:59:34,"['ยินดี', 'ที่', 'ได้', 'รู้จัก', 'ครับผม', 'ชาย', 'แท้', 'เหมือนกัน']"
1630015311394267136,twitter,post,https://x.com/canuluvme_pls/status/1630015311394267136,text,2023-02-27T01:21:49.000Z,selenium_x_scraper_v1,โควทมากกว่ารี =,โควทมากกว่ารี =,2025-10-23 17:59:34,"['โค', 'วท', 'มากกว่า', 'รี']"
1630160088882368512,twitter,post,https://x.com/crta_me/status/1630160088882368512,text,2023-02-27T10:57:06.000Z,selenium_x_scraper_v1,โควท แปลว่าอะไรเหรอครับ ?,โควท แปลว่าอะไรเหรอครับ ?,2025-10-23 17:59:34,"['โค', 'วท', ' ', 'แปล', 'ว่า', 'อะไร', 'เหรอ', 'ครับ', ' ', '?']"
1630048424799379457,twitter,post,https://x.com/bq3yy/status/1630048424799379457,text,2023-02-27T03:33:23.000Z,selenium_x_scraper_v1,ทำไมเบียวจังครับ ถ้าได้รับการอบรมที่ดีจากครอบครัวพอคงไม่มาโพสอะไรปัญญาอ่อนแบบนี้หรอกคับ แง้ๆ,ทำไมเบียวจังครับ ถ้าได้รับการอบรมที่ดีจากครอบครัวพอคงไม่มาโพสอะไรปัญญาอ่อนแบบนี้หรอกคับ แง้ๆ,2025-10-23 17:59:34,"['ทำไม', 'เบียว', 'จัง', 'ครับ', ' ', 'ถ้า', 'ได้รับ', 'การอบรม', 'ที่', 'ดี', 'จาก', 'ครอบครัว', 'พอ', 'คง', 'ไม่', 'มา', 'โพส', 'อะไร', 'ปัญญาอ่อน', 'แบบนี้', 'หรอก', 'คับ', ' ', 'แง้ๆ']"
1630160005721899008,twitter,post,https://x.com/crta_me/status/1630160005721899008,text,2023-02-27T10:56:46.000Z,selenium_x_scraper_v1,ผมไม่ได้เบียวครับ แต่ผมเป็นชายแท้,ผมไม่ได้เบียวครับ แต่ผมเป็นชายแท้,2025-10-23 17:59:34,"['ผม', 'ไม่', 'ได้', 'เบียว', 'ครับ', ' ', 'แต่', 'ผม', 'เป็น', 'ชาย', 'แท้']"
1630059553797844993,twitter,post,https://x.com/loveteacher_law/status/1630059553797844993,text,2023-02-27T04:17:37.000Z,selenium_x_scraper_v1,อะไรอีกชายแท้,อะไรอีกชายแท้,2025-10-23 17:59:34,"['อะไร', 'อีก', 'ชาย', 'แท้']"
1630159928806772736,twitter,post,https://x.com/crta_me/status/1630159928806772736,text,2023-02-27T10:56:28.000Z,selenium_x_scraper_v1,สวัสดีครับผมชายแท้เอง,สวัสดีครับผมชายแท้เอง,2025-10-23 17:59:34,"['สวัสดี', 'ครับผม', 'ชาย', 'แท้', 'เอง']"
1630061782344830976,twitter,post,https://x.com/hwangvioleta/status/1630061782344830976,text,2023-02-27T04:26:28.000Z,selenium_x_scraper_v1,โอ้ย นี้คือตัวอย่างของผู้ที่การศึกษาเข้าถึงแต่ปฏิเสธการศึกษานะ,โอ้ย นี้คือตัวอย่างของผู้ที่การศึกษาเข้าถึงแต่ปฏิเสธการศึกษานะ,2025-10-23 17:59:34,"['โอ้ย', ' ', 'นี้', 'คือ', 'ตัวอย่าง', 'ของ', 'ผู้', 'ที่', 'การศึกษา', 'เข้าถึง', 'แต่', 'ปฏิเสธ', 'การศึกษา', 'นะ']"
1630061986414497792,twitter,post,https://x.com/nodnodifyoumw/status/1630061986414497792,text,2023-02-27T04:27:17.000Z,selenium_x_scraper_v1,โควทมากกว่ารีแปลว่าทัวร์ลงนะรู้ยัง อิพวกโง่,โควทมากกว่ารีแปลว่าทัวร์ลงนะรู้ยัง อิพวกโง่,2025-10-23 17:59:34,"['โค', 'วท', 'มากกว่า', 'รี', 'แปล', 'ว่า', 'ทัวร์', 'ลง', 'นะ', 'รู้', 'ยัง', ' ', 'อิ', 'พวก', 'โง่']"
1630159641643745280,twitter,post,https://x.com/crta_me/status/1630159641643745280,text,2023-02-27T10:55:20.000Z,selenium_x_scraper_v1,โควท ภาษาอะไรอะครับ ?,โควท ภาษาอะไรอะครับ ?,2025-10-23 17:59:34,"['โค', 'วท', ' ', 'ภาษา', 'อะไร', 'อะ', 'ครับ', ' ', '?']"
1630066840658669568,twitter,post,https://x.com/isbabynana/status/1630066840658669568,text,2023-02-27T04:46:34.000Z,selenium_x_scraper_v1,ทรงนี้ก็น่าจะพวกชายแท้กรุ๊ปเบียว,ทรงนี้ก็น่าจะพวกชายแท้กรุ๊ปเบียว,2025-10-23 17:59:34,"['ทรง', 'นี้', 'ก็', 'น่าจะ', 'พวก', 'ชาย', 'แท้', 'กรุ๊ป', 'เบียว']"
1630159513289650176,twitter,post,https://x.com/crta_me/status/1630159513289650176,text,2023-02-27T10:54:49.000Z,selenium_x_scraper_v1,สวัสดีครับผมชายแท้ แต่ผมไม่เบียวนะครับ,สวัสดีครับผมชายแท้ แต่ผมไม่เบียวนะครับ,2025-10-23 17:59:34,"['สวัสดี', 'ครับผม', 'ชาย', 'แท้', ' ', 'แต่', 'ผม', 'ไม่', 'เบียว', 'นะ', 'ครับ']"
1630080125638447105,twitter,post,https://x.com/64920j/status/1630080125638447105,text,2023-02-27T05:39:22.000Z,selenium_x_scraper_v1,ถ้าถามว่าชายแท้ไม่ดีตรงไหน ก็ตรงที่คุณพี่พิมพ์มานี่แหละจ้า คนดีๆที่ไหนจะพิมพ์ประโยคแบบนี้ออกมาคะ,ถ้าถามว่าชายแท้ไม่ดีตรงไหน ก็ตรงที่คุณพี่พิมพ์มานี่แหละจ้า คนดีๆที่ไหนจะพิมพ์ประโยคแบบนี้ออกมาคะ,2025-10-23 17:59:34,"['ถ้า', 'ถาม', 'ว่า', 'ชาย', 'แท้', 'ไม่', 'ดี', 'ตรงไหน', ' ', 'ก็', 'ตรง', 'ที่', 'คุณ', 'พี่', 'พิมพ์', 'มา', 'นี่แหละ', 'จ้า', ' ', 'คนดี', 'ๆ', 'ที่', 'ไหนจะ', 'พิมพ์', 'ประโยค', 'แบบนี้', 'ออกมา', 'คะ']"
1630159344238227456,twitter,post,https://x.com/crta_me/status/1630159344238227456,text,2023-02-27T10:54:09.000Z,selenium_x_scraper_v1,ก็พวกเขามาว่าผมเป็นชายแท้ก่อนนี่ครับ,ก็พวกเขามาว่าผมเป็นชายแท้ก่อนนี่ครับ,2025-10-23 17:59:34,"['ก็', 'พวกเขา', 'มา', 'ว่า', 'ผม', 'เป็น', 'ชาย', 'แท้', 'ก่อน', 'นี่', 'ครับ']"
1630159256258502656,twitter,post,https://x.com/crta_me/status/1630159256258502656,text,2023-02-27T10:53:48.000Z,selenium_x_scraper_v1,ผมอธิบายไม่ค่อยถูกด้วยสิ แต่ผมบอกได้อย่างนึง การรักตัวเองมันยากครับ,ผมอธิบายไม่ค่อยถูกด้วยสิ แต่ผมบอกได้อย่างนึง การรักตัวเองมันยากครับ,2025-10-23 17:59:34,"['ผม', 'อธิบาย', 'ไม่ค่อย', 'ถูก', 'ด้วย', 'สิ', ' ', 'แต่', 'ผม', 'บอก', 'ได้', 'อย่าง', 'นึง', ' ', 'การ', 'รัก', 'ตัวเอง', 'มัน', 'ยาก', 'ครับ']"
1630159099496390656,twitter,post,https://x.com/crta_me/status/1630159099496390656,text,2023-02-27T10:53:10.000Z,selenium_x_scraper_v1,L นี่คืออะไรเหรอครับ ?,L นี่คืออะไรเหรอครับ ?,2025-10-23 17:59:34,"['l', ' ', 'นี่', 'คือ', 'อะไร', 'เหรอ', 'ครับ', ' ', '?']"
1630090491072245761,twitter,post,https://x.com/loveteacher_law/status/1630090491072245761,text,2023-02-27T06:20:33.000Z,selenium_x_scraper_v1,กล้ามากนะ ถามตัวเองก่อนไหมว่าชายแท้ไม่ดีตรงไหนน่าจะได้คำตอบที่ดีที่สุดเพราะคำตอบมันก็อยู่ในตัวคุณนั่นแหละค่ะ ส่วนที่บอกว่าดีกว่าผิดเพดคือมาเอาไร บูดเนาะอย่าหาทำชีวิตจริงถามจริงใช้ชีวิตมายังไงถึงรอดมาจนถึงทุกวันนี้นึกว่าซากปรักหักพังตั้งแต่พุทธศักราช2450,กล้ามากนะ ถามตัวเองก่อนไหมว่าชายแท้ไม่ดีตรงไหนน่าจะได้คำตอบที่ดีที่สุดเพราะคำตอบมันก็อยู่ในตัวคุณนั่นแหละค่ะ ส่วนที่บอกว่าดีกว่าผิดเพดคือมาเอาไร บูดเนาะอย่าหาทำชีวิตจริงถามจริงใช้ชีวิตมายังไงถึงรอดมาจนถึงทุกวันนี้นึกว่าซากปรักหักพังตั้งแต่พุทธศักราช2450,2025-10-23 17:59:34,"['กล้า', 'มาก', 'นะ', ' ', 'ถาม', 'ตัวเอง', 'ก่อน', 'ไหม', 'ว่า', 'ชาย', 'แท้', 'ไม่', 'ดี', 'ตรงไหน', 'น่าจะ', 'ได้', 'คำตอบ', 'ที่', 'ดี', 'ที่สุด', 'เพราะ', 'คำตอบ', 'มัน', 'ก็', 'อยู่', 'ใน', 'ตัว', 'คุณ', 'นั่นแหละ', 'ค่ะ', ' ', 'ส่วน', 'ที่', 'บอ', 'กว่า', 'ดีกว่า', 'ผิด', 'เพ', 'ด', 'คือ', 'มา', 'เอา', 'ไร', ' ', 'บูด', 'เนาะ', 'อย่า', 'หา', 'ทำ', 'ชีวิตจริง', 'ถาม', 'จริง', 'ใช้ชีวิต', 'มา', 'ยังไง', 'ถึง', 'รอด', 'มา', 'จนถึง', 'ทุกวันนี้', 'นึก', 'ว่า', 'ซากปรักหักพัง', 'ตั้งแต่', 'พุทธศักราช', '2450']"
1630158873255641088,twitter,post,https://x.com/crta_me/status/1630158873255641088,text,2023-02-27T10:52:16.000Z,selenium_x_scraper_v1,ก็พี่บอกว่าผมเป็นชายแท้ ผมก็เลยบอกว่าอย่างน้อยก็ดีกว่าพวกผิดเพศไงครับ ตามเพศวิถีปกติเลย ผมผิดตรงไหน ?,ก็พี่บอกว่าผมเป็นชายแท้ ผมก็เลยบอกว่าอย่างน้อยก็ดีกว่าพวกผิดเพศไงครับ ตามเพศวิถีปกติเลย ผมผิดตรงไหน ?,2025-10-23 17:59:34,"['ก็', 'พี่', 'บอ', 'กว่า', 'ผม', 'เป็น', 'ชาย', 'แท้', ' ', 'ผม', 'ก็', 'เลย', 'บอ', 'กว่า', 'อย่าง', 'น้อย', 'ก็', 'ดีกว่า', 'พวก', 'ผิดเพศ', 'ไง', 'ครับ', ' ', 'ตาม', 'เพศ', 'วิถี', 'ปกติ', 'เลย', ' ', 'ผม', 'ผิด', 'ตรงไหน', ' ', '?']"
1630158569336373249,twitter,post,https://x.com/crta_me/status/1630158569336373249,text,2023-02-27T10:51:04.000Z,selenium_x_scraper_v1,ขอดูด้วยคนครับ,ขอดูด้วยคนครับ,2025-10-23 17:59:34,"['ขอ', 'ดู', 'ด้วย', 'คน', 'ครับ']"
1630158500549779456,twitter,post,https://x.com/crta_me/status/1630158500549779456,text,2023-02-27T10:50:48.000Z,selenium_x_scraper_v1,เพราะว่าการรักตัวเองมันยากครับ #ประเทศไทยทำมาจากหมูกรอบ,เพราะว่าการรักตัวเองมันยากครับ #ประเทศไทยทำมาจากหมูกรอบ,2025-10-23 17:59:34,"['เพราะ', 'ว่าการ', 'รัก', 'ตัวเอง', 'มัน', 'ยาก', 'ครับ', ' ', 'ประเทศ', 'ไทย', 'ทำ', 'มาจาก', 'หมูกรอบ']"
1630081239930789889,twitter,post,https://x.com/holysaturnalia/status/1630081239930789889,text,2023-02-27T05:43:47.000Z,selenium_x_scraper_v1,"Why you so obsessed with me, boy, I wanna know","Why you so obsessed with me, boy, I wanna know",2025-10-23 17:59:34,"['why', ' ', 'you', ' ', 'so', ' ', 'obsessed', ' ', 'with', ' ', 'me', ',', ' ', 'boy', ',', ' ', 'i', ' ', 'wanna', ' ', 'know']"
1630157968087085057,twitter,post,https://x.com/minorityhaters/status/1630157968087085057,text,2023-02-27T10:48:41.000Z,selenium_x_scraper_v1,ผมรักในหลวงครับ,ผมรักในหลวงครับ,2025-10-23 17:59:34,"['ผม', 'รัก', 'ในหลวง', 'ครับ']"
1630158348724338689,twitter,post,https://x.com/crta_me/status/1630158348724338689,text,2023-02-27T10:50:11.000Z,selenium_x_scraper_v1,ผมก็รักเหมือนกันครับ แต่จำเอาไว้นะครับ การรักตัวเองมันยากยิ่งกว่า,ผมก็รักเหมือนกันครับ แต่จำเอาไว้นะครับ การรักตัวเองมันยากยิ่งกว่า,2025-10-23 17:59:34,"['ผม', 'ก็', 'รัก', 'เหมือนกัน', 'ครับ', ' ', 'แต่', 'จำ', 'เอาไว้', 'นะ', 'ครับ', ' ', 'การ', 'รัก', 'ตัวเอง', 'มัน', 'ยาก', 'ยิ่งกว่า']"
1630127357993553922,twitter,post,https://x.com/FRIDAYDECEMBERP/status/1630127357993553922,text,2023-02-27T08:47:03.000Z,selenium_x_scraper_v1,เบียว ถามว่าตรงไหนก็ทุกตรง,เบียว ถามว่าตรงไหนก็ทุกตรง,2025-10-23 17:59:34,"['เบียว', ' ', 'ถาม', 'ว่า', 'ตรงไหน', 'ก็', 'ทุก', 'ตรง']"
1630158246140071936,twitter,post,https://x.com/crta_me/status/1630158246140071936,text,2023-02-27T10:49:47.000Z,selenium_x_scraper_v1,อธิบายหน่อยได้ไหมครับ ผมว่าคนที่เบียวเป็นหมูกรอบที่เบียวกว่าผมอีกนะ #รักตัวเองมันยาก,อธิบายหน่อยได้ไหมครับ ผมว่าคนที่เบียวเป็นหมูกรอบที่เบียวกว่าผมอีกนะ #รักตัวเองมันยาก,2025-10-23 17:59:34,"['อธิบาย', 'หน่อย', 'ได้', 'ไหม', 'ครับ', ' ', 'ผม', 'ว่า', 'คน', 'ที่', 'เบียว', 'เป็น', 'หมูกรอบ', 'ที่', 'เบียว', 'กว่า', 'ผม', 'อีก', 'นะ', ' ', 'รัก', 'ตัวเอง', 'มัน', 'ยาก']"
1630100666738941955,twitter,post,https://x.com/gloriousgoat_ix/status/1630100666738941955,text,2023-02-27T07:00:59.000Z,selenium_x_scraper_v1,เพื่อนน้องในคลิปเด็กเปรต #เกียมอุดม หรอ,เพื่อนน้องในคลิปเด็กเปรต #เกียมอุดม หรอ,2025-10-23 17:59:34,"['เพื่อน', 'น้อง', 'ใน', 'คลิป', 'เด็ก', 'เปรต', ' ', 'เกีย', 'ม', 'อุดม', ' ', 'หรอ']"
1630157916262260737,twitter,post,https://x.com/crta_me/status/1630157916262260737,text,2023-02-27T10:48:28.000Z,selenium_x_scraper_v1,มีอะไรรึเปล่าครับ #ผมชายแท้เองครับ,มีอะไรรึเปล่าครับ #ผมชายแท้เองครับ,2025-10-23 17:59:34,"['มี', 'อะไร', 'รึเปล่า', 'ครับ', ' ', 'ผม', 'ชาย', 'แท้', 'เอง', 'ครับ']"
1630157735462584321,twitter,post,https://x.com/crta_me/status/1630157735462584321,text,2023-02-27T10:47:45.000Z,selenium_x_scraper_v1,สวัสดีครับ ผมชายแท้เองครับ,สวัสดีครับ ผมชายแท้เองครับ,2025-10-23 17:59:34,"['สวัสดี', 'ครับ', ' ', 'ผม', 'ชาย', 'แท้', 'เอง', 'ครับ']"
1630156644289245184,twitter,post,https://x.com/minorityhaters/status/1630156644289245184,text,2023-02-27T10:43:25.000Z,selenium_x_scraper_v1,ผมรักในหลวงครับ,ผมรักในหลวงครับ,2025-10-23 17:59:34,"['ผม', 'รัก', 'ในหลวง', 'ครับ']"
1630157410567622656,twitter,post,https://x.com/crta_me/status/1630157410567622656,text,2023-02-27T10:46:28.000Z,selenium_x_scraper_v1,ผมก็รักเหมือนกันครับ แต่จำเอาไว้นะครับ การรักตัวเองมันยากยิ่งกว่า,ผมก็รักเหมือนกันครับ แต่จำเอาไว้นะครับ การรักตัวเองมันยากยิ่งกว่า,2025-10-23 17:59:34,"['ผม', 'ก็', 'รัก', 'เหมือนกัน', 'ครับ', ' ', 'แต่', 'จำ', 'เอาไว้', 'นะ', 'ครับ', ' ', 'การ', 'รัก', 'ตัวเอง', 'มัน', 'ยาก', 'ยิ่งกว่า']"
1630155451856986112,twitter,post,https://x.com/crta_me/status/1630155451856986112,text,2023-02-27T10:38:41.000Z,selenium_x_scraper_v1,ผมชายแท้เองครับ,ผมชายแท้เองครับ,2025-10-23 17:59:34,"['ผม', 'ชาย', 'แท้', 'เอง', 'ครับ']"
1630080283965030400,twitter,post,https://x.com/holysaturnalia/status/1630080283965030400,text,2023-02-27T05:39:59.000Z,selenium_x_scraper_v1,ไม่ได้นอกใจครับ เมื่อวานก็เพิ่งกินหมูกรอบครับ,ไม่ได้นอกใจครับ เมื่อวานก็เพิ่งกินหมูกรอบครับ,2025-10-23 17:59:34,"['ไม่', 'ได้', 'นอกใจ', 'ครับ', ' ', 'เมื่อวาน', 'ก็', 'เพิ่ง', 'กิน', 'หมูกรอบ', 'ครับ']"
1630081377050972160,twitter,post,https://x.com/crta_me/status/1630081377050972160,text,2023-02-27T05:44:20.000Z,selenium_x_scraper_v1,"ดีแล้วครับคนเราควรจะรักเดียวใจเดียว แต่อย่าลืมสิ่งที่สำคัญที่สุดไปนะครับ 
“รักตัวเองมันยาก”","ดีแล้วครับคนเราควรจะรักเดียวใจเดียว แต่อย่าลืมสิ่งที่สำคัญที่สุดไปนะครับ 
“รักตัวเองมันยาก”",2025-10-23 17:59:34,"['ดีแล้ว', 'ครับ', 'คนเรา', 'ควรจะ', 'รักเดียว', 'ใจเดียว', ' ', 'แต่', 'อย่า', 'ลืม', 'สิ่ง', 'ที่', 'สำคัญ', 'ที่สุด', 'ไป', 'นะ', 'ครับ', ' ', 'รัก', 'ตัวเอง', 'มัน', 'ยาก']"
1629511406180761601,twitter,post,https://x.com/holysaturnalia/status/1629511406180761601,text,2023-02-25T15:59:28.000Z,selenium_x_scraper_v1,มึงคิดว่าการรักตัวเองมันง่ายมากนักหรอ ไม่ใช่เด็กทุกคนที่เกิดมาในครอบครัวที่อบอุ่นจนได้รับความรักมากเพียงพอ และไม่ใช่ทุกคนที่จะได้เห็นพ่อแม่ผู้ปกครองปฏิบัติต่อกันด้วยความรัก คนบางคนเกิดมาไม่เคยโดนสอนให้รู้จักความรักเลยทั้งชีวิต เขาจะรักตัวเองได้ยังไง,มึงคิดว่าการรักตัวเองมันง่ายมากนักหรอ ไม่ใช่เด็กทุกคนที่เกิดมาในครอบครัวที่อบอุ่นจนได้รับความรักมากเพียงพอ และไม่ใช่ทุกคนที่จะได้เห็นพ่อแม่ผู้ปกครองปฏิบัติต่อกันด้วยความรัก คนบางคนเกิดมาไม่เคยโดนสอนให้รู้จักความรักเลยทั้งชีวิต เขาจะรักตัวเองได้ยังไง,2025-10-23 17:59:34,"['มึง', 'คิด', 'ว่าการ', 'รัก', 'ตัวเอง', 'มัน', 'ง่าย', 'มาก', 'นัก', 'หรอ', ' ', 'ไม่', 'ใช่', 'เด็ก', 'ทุกคน', 'ที่เกิด', 'มา', 'ใน', 'ครอบครัว', 'ที่', 'อบอุ่น', 'จน', 'ได้รับ', 'ความรัก', 'มาก', 'เพียงพอ', ' ', 'และ', 'ไม่', 'ใช่', 'ทุกคน', 'ที่จะ', 'ได้', 'เห็น', 'พ่อแม่', 'ผู้ปกครอง', 'ปฏิบัติ', 'ต่อกัน', 'ด้วย', 'ความรัก', ' ', 'คน', 'บางคน', 'เกิด', 'มา', 'ไม่', 'เคย', 'โดน', 'สอน', 'ให้', 'รู้จัก', 'ความรัก', 'เลย', 'ทั้ง', 'ชีวิต', ' ', 'เขา', 'จะ', 'รัก', 'ตัวเอง', 'ได้', 'ยังไง']"
