id,platform,platform_type,url,content_type,timestamp,scraper_module,text,raw_text,scrape_date,tokens
1988018230276091958,twitter,post,https://x.com/nopup6/status/1988018230276091958,text,2025-11-10T22:57:36.000Z,selenium_x_scraper_v1,ผญ. ปสด.เยอะครับ ในเฟมทวิตพอๆกัน เดือนก่อนที่ว่ามีผช.เดินตามในตอนดึกๆที่เปลี่ยว เว้นระยะห่างเกิน 5 ม. ก็หลอนหาว่าเป็นพวกสตอกเกอร์โรคจิตจะทำมิดีมิร้ายทั้งที่ไม่ใช่ ซึ่งก็ไม่ผิดที่จะระวังตัวไว้ แต่บางสถนก.พวกหล่อนก็มั้นหีมั่นแตดเกิน บางทีสายตาเราเหลือบไปมองก็หาว่าเหล่หม้อ อีดอก,ผญ. ปสด.เยอะครับ ในเฟมทวิตพอๆกัน เดือนก่อนที่ว่ามีผช.เดินตามในตอนดึกๆที่เปลี่ยว เว้นระยะห่างเกิน 5 ม. ก็หลอนหาว่าเป็นพวกสตอกเกอร์โรคจิตจะทำมิดีมิร้ายทั้งที่ไม่ใช่ ซึ่งก็ไม่ผิดที่จะระวังตัวไว้ แต่บางสถนก.พวกหล่อนก็มั้นหีมั่นแตดเกิน บางทีสายตาเราเหลือบไปมองก็หาว่าเหล่หม้อ อีดอก,2025-11-29 08:18:55,"['ผญ.', ' ', 'ปสด', '.', 'เยอะ', 'ครับ', ' ', 'ใน', 'เฟม', 'ทวิ', 'ตพอๆ', 'กัน', ' ', 'เดือนก่อน', 'ที่ว่า', 'มี', 'ผช.', 'เดินตาม', 'ใน', 'ตอนดึก', 'ๆ', 'ที่', 'เปลี่ยว', ' ', 'เว้น', 'ระยะห่าง', 'เกิน', ' ', '5', ' ', 'ม.', ' ', 'ก็', 'หลอน', 'หาว่า', 'เป็น', 'พวก', 'สต', 'อก', 'เกอร์', 'โรคจิต', 'จะ', 'ทำมิดีมิร้าย', 'ทั้งที่', 'ไม่', 'ใช่', ' ', 'ซึ่ง', 'ก็', 'ไม่', 'ผิด', 'ที่จะ', 'ระวังตัว', 'ไว้', ' ', 'แต่', 'บาง', 'สถน', 'ก.', 'พวก', 'หล่อน', 'ก็', 'มั้น', 'หี', 'มั่น', 'แตด', 'เกิน', ' ', 'บางที', 'สายตา', 'เรา', 'เหลือบ', 'ไป', 'มอง', 'ก็', 'หาว่า', 'เหล่', 'หม้อ', ' ', 'อีดอก']"
1988089081272955223,twitter,post,https://x.com/nakedsprings/status/1988089081272955223,text,2025-11-11T03:39:08.000Z,selenium_x_scraper_v1,"คราวหน้าลองด่า ""ใครจะหวังคุหคามห*คนอื่น แบบเปิดเผยอย่างพวกมึงละ"" แล้วคอยลีฟดูค่ะ","คราวหน้าลองด่า ""ใครจะหวังคุหคามห*คนอื่น แบบเปิดเผยอย่างพวกมึงละ"" แล้วคอยลีฟดูค่ะ",2025-11-29 08:18:55,"['คราวหน้า', 'ลอง', 'ด่า', ' ', 'ใคร', 'จะ', 'หวัง', 'คุ', 'ห', 'คาม', 'ห', ' ', 'คนอื่น', ' ', 'แบบ', 'เปิดเผย', 'อย่าง', 'พวก', 'มึง', 'ละ', ' ', 'แล้ว', 'คอย', 'ลี', 'ฟ', 'ดู', 'ค่ะ']"
1987810339682152797,twitter,post,https://x.com/Thaireactionvid/status/1987810339682152797/photo/1,text,2025-11-10T09:11:31.000Z,selenium_x_scraper_v1,ผมยากมาเล่าประสบการณ์ ons กับ สาวสอง สต รู้สึกว่าเค้าสวยเหมือนผู้หญิงมากๆ แต่ก็ไม่ได้คิดอะไรมากเพราะว่าปกติสาวสองก็คงอยากสวยเหมือนผู้หญิง ทุกอยากรู้สึกว่าเหมือนผู้หญิงมากจริงๆ แต่ก็ได้มีการคุยกันแล้ว เค้าเองก็ยืนยันว่าเป็นสาวสอง ไม่แน่ใจว่าต้นทางอาจจะเป็นคนที่ผม ons มาหรือป่าว,ผมยากมาเล่าประสบการณ์ ons กับ สาวสอง สต รู้สึกว่าเค้าสวยเหมือนผู้หญิงมากๆ แต่ก็ไม่ได้คิดอะไรมากเพราะว่าปกติสาวสองก็คงอยากสวยเหมือนผู้หญิง ทุกอยากรู้สึกว่าเหมือนผู้หญิงมากจริงๆ แต่ก็ได้มีการคุยกันแล้ว เค้าเองก็ยืนยันว่าเป็นสาวสอง ไม่แน่ใจว่าต้นทางอาจจะเป็นคนที่ผม ons มาหรือป่าว,2025-11-29 08:18:55,"['ผม', 'ยาก', 'มา', 'เล่า', 'ประสบการณ์', ' ', 'ons', ' ', 'กับ', ' ', 'สาว', 'สอง', ' ', 'สต', ' ', 'รู้สึก', 'ว่า', 'เค้า', 'สวย', 'เหมือน', 'ผู้หญิง', 'มาก', 'ๆ', ' ', 'แต่', 'ก็', 'ไม่', 'ได้คิด', 'อะไร', 'มาก', 'เพราะว่า', 'ปกติ', 'สาว', 'สอง', 'ก็', 'คง', 'อยาก', 'สวย', 'เหมือน', 'ผู้หญิง', ' ', 'ทุก', 'อยาก', 'รู้สึก', 'ว่า', 'เหมือน', 'ผู้หญิง', 'มาก', 'จริงๆ', ' ', 'แต่', 'ก็ได้', 'มี', 'การคุย', 'กัน', 'แล้ว', ' ', 'เค้า', 'เอง', 'ก็', 'ยืนยัน', 'ว่า', 'เป็นสาว', 'สอง', ' ', 'ไม่', 'แน่ใจ', 'ว่า', 'ต้นทาง', 'อาจจะ', 'เป็น', 'คน', 'ที่', 'ผม', ' ', 'ons', ' ', 'มา', 'หรือ', 'ป่าว']"
1988109798400016687,twitter,post,https://x.com/TanyaSuesanti/status/1988109798400016687,text,2025-11-11T05:01:27.000Z,selenium_x_scraper_v1,ตกลงก็คือ straight ทั้งคู่ แล้วหลอกกันเอง,ตกลงก็คือ straight ทั้งคู่ แล้วหลอกกันเอง,2025-11-29 08:18:55,"['ตกลง', 'ก็', 'คือ', ' ', 'straight', ' ', 'ทั้งคู่', ' ', 'แล้ว', 'หลอก', 'กันเอง']"
1988159929778401711,twitter,post,https://x.com/cinnamonization/status/1988159929778401711,text,2025-11-11T08:20:40.000Z,selenium_x_scraper_v1,เวลาคุณเจอหญิงที่คิดจริงจังสร้างครอบครัว คุณจะเล่าให้เธอฟังตั้งแต่แรกๆที่เดทกันมั้ย? ถ้าคำตอบคือไม่ ถามว่าแฟร์กับอีกฝ่ายมั้ย?,เวลาคุณเจอหญิงที่คิดจริงจังสร้างครอบครัว คุณจะเล่าให้เธอฟังตั้งแต่แรกๆที่เดทกันมั้ย? ถ้าคำตอบคือไม่ ถามว่าแฟร์กับอีกฝ่ายมั้ย?,2025-11-29 08:18:55,"['เวลา', 'คุณ', 'เจอ', 'หญิง', 'ที่', 'คิด', 'จริงจัง', 'สร้าง', 'ครอบครัว', ' ', 'คุณ', 'จะ', 'เล่า', 'ให้', 'เธอ', 'ฟัง', 'ตั้งแต่แรก', 'ๆ', 'ที่', 'เดท', 'กัน', 'มั้ย', '?', ' ', 'ถ้า', 'คำตอบ', 'คือ', 'ไม่', ' ', 'ถาม', 'ว่า', 'แฟร์', 'กับ', 'อีก', 'ฝ่าย', 'มั้ย', '?']"
1988200277854593442,twitter,post,https://x.com/BooBoojingjing/status/1988200277854593442,text,2025-11-11T11:00:59.000Z,selenium_x_scraper_v1,ถ้ามันแซ่บกับเซฟคงไม่น่ามีปัญหา เค้าไม่ได้คิดจะแต่งงานด้วยหรือคบเป็นแฟนนิ อาจจะแค่พลาด,ถ้ามันแซ่บกับเซฟคงไม่น่ามีปัญหา เค้าไม่ได้คิดจะแต่งงานด้วยหรือคบเป็นแฟนนิ อาจจะแค่พลาด,2025-11-29 08:18:55,"['ถ้า', 'มัน', 'แซ่บ', 'กับ', 'เซฟ', 'คง', 'ไม่', 'น่า', 'มีปัญหา', ' ', 'เค้า', 'ไม่', 'ได้คิด', 'จะ', 'แต่งงาน', 'ด้วย', 'หรือ', 'คบ', 'เป็น', 'แฟน', 'นิ', ' ', 'อาจจะ', 'แค่', 'พลาด']"
1988180757140181092,twitter,post,https://x.com/Watcharat745059/status/1988180757140181092,text,2025-11-11T09:43:25.000Z,selenium_x_scraper_v1,ขอเป็นเคสต่อไปคับ,ขอเป็นเคสต่อไปคับ,2025-11-29 08:18:55,"['ขอ', 'เป็น', 'เคส', 'ต่อไป', 'คับ']"
1987817537414004993,twitter,post,https://x.com/Thaireactionvid/status/1987817537414004993,text,2025-11-10T09:40:07.000Z,selenium_x_scraper_v1,อีเหี้ยมึงงง มีคนลงคลิปลมอุมลวยคุยในรีวิวช้อปปี้ กรรมการอึ้ง ร้านอึ้ง กูอึ้ง พวกผมยาวมันเล่นแอพส้มแล้ว,อีเหี้ยมึงงง มีคนลงคลิปลมอุมลวยคุยในรีวิวช้อปปี้ กรรมการอึ้ง ร้านอึ้ง กูอึ้ง พวกผมยาวมันเล่นแอพส้มแล้ว,2025-11-29 08:18:55,"['อี', 'เหี้ย', 'มึง', 'งง', ' ', 'มี', 'คน', 'ลง', 'คลิป', 'ลม', 'อุ', 'มล', 'วย', 'คุย', 'ใน', 'รีวิว', 'ช้อป', 'ปี้', ' ', 'กรรมการ', 'อึ้ง', ' ', 'ร้าน', 'อึ้ง', ' ', 'กู', 'อึ้ง', ' ', 'พวกผม', 'ยาว', 'มัน', 'เล่น', 'แอพ', 'ส้ม', 'แล้ว']"
1987818401574916144,twitter,post,https://x.com/Eaaaw/status/1987818401574916144,text,2025-11-10T09:43:33.000Z,selenium_x_scraper_v1,"ละครละไหม.... เกย์รุกไม่เยสาวสอง
เกย์รุกชอบจู๋ ไม่ได้ชอบกี
คนที่เยสาวสองคือชายแท้ 
พี่กะเทยที่มีแฟนคือแฟนเป็นชายแท้ทั้งนั่น","ละครละไหม.... เกย์รุกไม่เยสาวสอง
เกย์รุกชอบจู๋ ไม่ได้ชอบกี
คนที่เยสาวสองคือชายแท้ 
พี่กะเทยที่มีแฟนคือแฟนเป็นชายแท้ทั้งนั่น",2025-11-29 08:18:55,"['ละคร', 'ละ', 'ไห', 'ม.', '..', ' ', 'เกย์', 'รุก', 'ไม่', 'เย', 'สาว', 'สอง', ' ', 'เกย์', 'รุก', 'ชอบ', 'จู๋', ' ', 'ไม่', 'ได้', 'ชอบ', 'กี', ' ', 'คน', 'ที่', 'เย', 'สาว', 'สอง', 'คือ', 'ชาย', 'แท้', ' ', 'พี่', 'กะเทย', 'ที่', 'มี', 'แฟน', 'คือ', 'แฟน', 'เป็น', 'ชาย', 'แท้', 'ทั้ง', 'นั่น']"
1987882737496371430,twitter,post,https://x.com/Thaireactionvid/status/1987882737496371430,text,2025-11-10T13:59:12.000Z,selenium_x_scraper_v1,ลดาแหละหนูว่า แต่หลังๆก็มีฟีลเกย์อยากให้เลดยุดหลีหูอยู่บ้าง บางคนพอลองละชอบก็ไปเปนไบเลย,ลดาแหละหนูว่า แต่หลังๆก็มีฟีลเกย์อยากให้เลดยุดหลีหูอยู่บ้าง บางคนพอลองละชอบก็ไปเปนไบเลย,2025-11-29 08:18:55,"['ลดา', 'แหละ', 'หนู', 'ว่า', ' ', 'แต่', 'หลัง', 'ๆ', 'ก็', 'มี', 'ฟี', 'ล', 'เกย์', 'อยาก', 'ให้', 'เลด', 'ยุด', 'หลี', 'หู', 'อยู่', 'บ้าง', ' ', 'บางคน', 'พอ', 'ลอง', 'ละ', 'ชอบ', 'ก็', 'ไป', 'เปนไบ', 'เลย']"
1987862276880343077,twitter,post,https://x.com/Kawaaii13/status/1987862276880343077,text,2025-11-10T12:37:54.000Z,selenium_x_scraper_v1,อะไรใหม่ๆ พีคในพีค  เป็นความสัมพันธ์แบบเกิดคาดเดาจริงๆ ,อะไรใหม่ๆ พีคในพีค  เป็นความสัมพันธ์แบบเกิดคาดเดาจริงๆ ,2025-11-29 08:18:55,"['อะไร', 'ใหม่', 'ๆ', ' ', 'พีค', 'ใน', 'พีค', ' ', 'เป็น', 'ความสัมพันธ์', 'แบบ', 'เกิด', 'คาดเดา', 'จริงๆ']"
1987826479309435210,twitter,post,https://x.com/NattybabeHdy/status/1987826479309435210,text,2025-11-10T10:15:39.000Z,selenium_x_scraper_v1,เค้กปะ,เค้กปะ,2025-11-29 08:18:55,"['เค้ก', 'ปะ']"
1987868860620681512,twitter,post,https://x.com/cinnamonization/status/1987868860620681512,text,2025-11-10T13:04:03.000Z,selenium_x_scraper_v1,"น่าจะ โกหก แต่งเรื่อง สร้างเอนเกจเม้นท์

เพราะ ถ้าบอกว่า เป็นหญิงแท้ ถามว่าหญิงแท้ที่ไหนจะมี ครส ทางเพศกับเกย์ มันขัดแย้งกันอยู่แล้ว

ถ้าเป็นเรื่องจริง เธอคนนั้นก็ไม่ใช่หญิงแท้ แต่เป็นอะไร จะเรียกว่าอะไร ก็ว่ากันไป แต่ไม่ใช่หญิงแท้","น่าจะ โกหก แต่งเรื่อง สร้างเอนเกจเม้นท์

เพราะ ถ้าบอกว่า เป็นหญิงแท้ ถามว่าหญิงแท้ที่ไหนจะมี ครส ทางเพศกับเกย์ มันขัดแย้งกันอยู่แล้ว

ถ้าเป็นเรื่องจริง เธอคนนั้นก็ไม่ใช่หญิงแท้ แต่เป็นอะไร จะเรียกว่าอะไร ก็ว่ากันไป แต่ไม่ใช่หญิงแท้",2025-11-29 08:18:55,"['น่าจะ', ' ', 'โกหก', ' ', 'แต่งเรื่อง', ' ', 'สร้าง', 'เอน', 'เกจ', 'เม้นท์', ' ', 'เพราะ', ' ', 'ถ้า', 'บอ', 'กว่า', ' ', 'เป็น', 'หญิง', 'แท้', ' ', 'ถาม', 'ว่า', 'หญิง', 'แท้', 'ที่', 'ไหนจะ', 'มี', ' ', 'ครส', ' ', 'ทางเพศ', 'กับ', 'เกย์', ' ', 'มัน', 'ขัดแย้ง', 'กัน', 'อยู่แล้ว', ' ', 'ถ้า', 'เป็น', 'เรื่องจริง', ' ', 'เธอ', 'คน', 'นั้น', 'ก็', 'ไม่', 'ใช่', 'หญิง', 'แท้', ' ', 'แต่', 'เป็น', 'อะไร', ' ', 'จะ', 'เรียก', 'ว่า', 'อะไร', ' ', 'ก็', 'ว่า', 'กัน', 'ไป', ' ', 'แต่', 'ไม่', 'ใช่', 'หญิง', 'แท้']"
1987825567643889821,twitter,post,https://x.com/Caitoon911/status/1987825567643889821,text,2025-11-10T10:12:01.000Z,selenium_x_scraper_v1,"เราเป็นหญิง แท้ๆเลยนะ
งงนิดหน่อยแต่ไม่เข้าใจมากๆอ่ะ
นี่ไม่กินเกย์ ไม่ว่ารุกรับก็ไม่กินอ่ะ
มันจะไงนะ มันจะไอ้นั่นมั้ย","เราเป็นหญิง แท้ๆเลยนะ
งงนิดหน่อยแต่ไม่เข้าใจมากๆอ่ะ
นี่ไม่กินเกย์ ไม่ว่ารุกรับก็ไม่กินอ่ะ
มันจะไงนะ มันจะไอ้นั่นมั้ย",2025-11-29 08:18:55,"['เรา', 'เป็น', 'หญิง', ' ', 'แท้ๆ', 'เลย', 'นะ', ' ', 'งง', 'นิดหน่อย', 'แต่', 'ไม่', 'เข้าใจ', 'มาก', 'ๆ', 'อ่ะ', ' ', 'นี่', 'ไม่', 'กิน', 'เกย์', ' ', 'ไม่', 'ว่า', 'รุ', 'กรับ', 'ก็', 'ไม่', 'กิน', 'อ่ะ', ' ', 'มัน', 'จะ', 'ไง', 'นะ', ' ', 'มัน', 'จะ', 'ไอ้', 'นั่น', 'มั้ย']"
1987986697171464679,twitter,post,https://x.com/fernjoop/status/1987986697171464679,text,2025-11-10T20:52:18.000Z,selenium_x_scraper_v1,ทำไม่ลงระ ต้องมีตะหงิดบ้าง,ทำไม่ลงระ ต้องมีตะหงิดบ้าง,2025-11-29 08:18:55,"['ทำ', 'ไม่', 'ลง', 'ระ', ' ', 'ต้อง', 'มี', 'ตะหงิด', 'บ้าง']"
1988289935439470984,twitter,post,https://x.com/GjNatthaka22512/status/1988289935439470984,text,2025-11-11T16:57:15.000Z,selenium_x_scraper_v1,อี๋ทุกช่วง....,อี๋ทุกช่วง....,2025-11-29 08:18:55,"['อี๋', 'ทุก', 'ช่วง', '...']"
1987867658612859252,twitter,post,https://x.com/Liibra_Oct/status/1987867658612859252,text,2025-11-10T12:59:17.000Z,selenium_x_scraper_v1,"เรื่องแต่งใช่มั้ย เพราะเรื่องจริงคือจังไรนะ 

ถ้าสลับกันผช.หน้าสวยไปหลอกว่าเป็นทอมแล้วนัดเย็ด เลส/ดี้ แล้วมันใช้ได้มั้ย?","เรื่องแต่งใช่มั้ย เพราะเรื่องจริงคือจังไรนะ 

ถ้าสลับกันผช.หน้าสวยไปหลอกว่าเป็นทอมแล้วนัดเย็ด เลส/ดี้ แล้วมันใช้ได้มั้ย?",2025-11-29 08:18:55,"['เรื่อง', 'แต่ง', 'ใช่', 'มั้ย', ' ', 'เพราะ', 'เรื่องจริง', 'คือ', 'จังไร', 'นะ', ' ', 'ถ้า', 'สลับ', 'กัน', 'ผช.', 'หน้า', 'สวย', 'ไป', 'หลอ', 'กว่า', 'เป็น', 'ทอม', 'แล้ว', 'นัด', 'เย็ด', ' ', 'เลส', ' ', 'ดี้', ' ', 'แล้ว', 'มัน', 'ใช้ได้', 'มั้ย', '?']"
1987842823732031960,twitter,post,https://x.com/ParadaSi16/status/1987842823732031960,text,2025-11-10T11:20:36.000Z,selenium_x_scraper_v1,จริงดิ นี่เพิ่งรู้ว่าเกย์รุก สามารถเย็ดกะเทยผมยาวได้อ่ะ จริงป่ะ ถ้าจริงจะลองนัดดูบ้าง นี่คิดตลอดว่า เกย์รุก ไม่เอากะเทยเลย,จริงดิ นี่เพิ่งรู้ว่าเกย์รุก สามารถเย็ดกะเทยผมยาวได้อ่ะ จริงป่ะ ถ้าจริงจะลองนัดดูบ้าง นี่คิดตลอดว่า เกย์รุก ไม่เอากะเทยเลย,2025-11-29 08:18:55,"['จริง', 'ดิ', ' ', 'นี่', 'เพิ่ง', 'รู้', 'ว่า', 'เกย์', 'รุก', ' ', 'สามารถ', 'เย็ด', 'กะเทย', 'ผม', 'ยาว', 'ได้', 'อ่ะ', ' ', 'จริง', 'ป่ะ', ' ', 'ถ้า', 'จริง', 'จะ', 'ลอง', 'นัด', 'ดู', 'บ้าง', ' ', 'นี่', 'คิด', 'ตลอด', 'ว่า', ' ', 'เกย์', 'รุก', ' ', 'ไม่', 'เอา', 'กะเทย', 'เลย']"
1987884624870330694,twitter,post,https://x.com/SoulHunter9999/status/1987884624870330694,text,2025-11-10T14:06:42.000Z,selenium_x_scraper_v1,ผมชอบมองกะเทยสวยๆ แบบนี้ผม เข้าข่ายเป็นอะไรครับ,ผมชอบมองกะเทยสวยๆ แบบนี้ผม เข้าข่ายเป็นอะไรครับ,2025-11-29 08:18:55,"['ผม', 'ชอบ', 'มอง', 'กะเทย', 'สวย', 'ๆ', ' ', 'แบบนี้', 'ผม', ' ', 'เข้าข่าย', 'เป็น', 'อะไร', 'ครับ']"
1988060133201777132,twitter,post,https://x.com/jojosville/status/1988060133201777132,text,2025-11-11T01:44:06.000Z,selenium_x_scraper_v1,"แสดงว่าหน้าแมนมาก

น่าจะผิวดำ สิวบ้างรึเปล่า","แสดงว่าหน้าแมนมาก

น่าจะผิวดำ สิวบ้างรึเปล่า",2025-11-29 08:18:55,"['แสดงว่า', 'หน้า', 'แมน', 'มาก', ' ', 'น่าจะ', 'ผิวดำ', ' ', 'สิว', 'บ้าง', 'รึเปล่า']"
1988561942101844104,twitter,post,https://x.com/starrain1089919/status/1988561942101844104,text,2025-11-12T10:58:07.000Z,selenium_x_scraper_v1,บางคอมเม้นกุก็ไม่เข้าใจนะ คือเซ้กมันเป็นศิลปะ มันคือความสุขอีกอย่าง มันไม่ได้จำกัดว่าจะต้องมีเซ้กกับเพศไหนเป็นกฎ มันคืออิสระอะ เสียบกันได้ก็ถือว่าเซ้กละ มีความสุข ฟิน แค่นั้นคือจบ ในโลกของความเป็นจริงมีอะไรแบบนี้อีกหลายๆอย่างที่พวกคุนคาดไม่ถึงเยอะ อย่าอยู่แต่ในกะลาตัวเองเลยครับ,บางคอมเม้นกุก็ไม่เข้าใจนะ คือเซ้กมันเป็นศิลปะ มันคือความสุขอีกอย่าง มันไม่ได้จำกัดว่าจะต้องมีเซ้กกับเพศไหนเป็นกฎ มันคืออิสระอะ เสียบกันได้ก็ถือว่าเซ้กละ มีความสุข ฟิน แค่นั้นคือจบ ในโลกของความเป็นจริงมีอะไรแบบนี้อีกหลายๆอย่างที่พวกคุนคาดไม่ถึงเยอะ อย่าอยู่แต่ในกะลาตัวเองเลยครับ,2025-11-29 08:18:55,"['บาง', 'คอม', 'เม้น', 'กุ', 'ก็', 'ไม่', 'เข้าใจ', 'นะ', ' ', 'คือ', 'เซ้ก', 'มัน', 'เป็น', 'ศิลปะ', ' ', 'มัน', 'คือ', 'ความสุข', 'อีก', 'อย่าง', ' ', 'มัน', 'ไม่', 'ได้', 'จำกัด', 'ว่า', 'จะ', 'ต้อง', 'มี', 'เซ้ก', 'กับ', 'เพศ', 'ไหน', 'เป็น', 'กฎ', ' ', 'มัน', 'คือ', 'อิสระ', 'อะ', ' ', 'เสียบ', 'กัน', 'ได้', 'ก็', 'ถือว่า', 'เซ้ก', 'ละ', ' ', 'มีความสุข', ' ', 'ฟิน', ' ', 'แค่นั้น', 'คือ', 'จบ', ' ', 'ใน', 'โลก', 'ของ', 'ความเป็นจริง', 'มี', 'อะไร', 'แบบนี้', 'อีก', 'หลาย', 'ๆ', 'อย่าง', 'ที่', 'พวก', 'คุ', 'น', 'คาดไม่ถึง', 'เยอะ', ' ', 'อย่า', 'อยู่', 'แต่', 'ใน', 'กะลา', 'ตัวเอง', 'เลย', 'ครับ']"
