id,platform,platform_type,url,content_type,timestamp,scraper_module,text,raw_text,scrape_date,tokens
1955513604134015147,twitter,post,https://x.com/icouldseeyoubut/status/1955513604134015147,text,2025-08-13T06:15:49.000Z,selenium_x_scraper_v1,เรื่องคือผญต้มไข่สองฟองแล้วให้หลานกิน อีผชเลยบ่นว่าทำไมไม่เหลือให้มัน ละก็บ่นไม่หยุด ผญก็บอกว่าไข่มันต้มใหม่ได้นะ เดี๋ยวทำใหม่บลาๆแต่อีผชก็ยังบ่นไม่หยุด คลิปเต็มความยาว17นาทีผญเอามาลง คือบ่นไม่หยุด จะไปทำให้ใหม่ก็ไม่เอา บ่นอยู่นั่น ผญเดินกลับเข้าไปในห้องเพื่อนสงบสติอารมณ์ก็แล้ว,เรื่องคือผญต้มไข่สองฟองแล้วให้หลานกิน อีผชเลยบ่นว่าทำไมไม่เหลือให้มัน ละก็บ่นไม่หยุด ผญก็บอกว่าไข่มันต้มใหม่ได้นะ เดี๋ยวทำใหม่บลาๆแต่อีผชก็ยังบ่นไม่หยุด คลิปเต็มความยาว17นาทีผญเอามาลง คือบ่นไม่หยุด จะไปทำให้ใหม่ก็ไม่เอา บ่นอยู่นั่น ผญเดินกลับเข้าไปในห้องเพื่อนสงบสติอารมณ์ก็แล้ว,2025-11-08 17:05:14,"['เรื่อง', 'คือ', 'ผญ', 'ต้ม', 'ไข่', 'สอง', 'ฟอง', 'แล้ว', 'ให้', 'หลาน', 'กิน', ' ', 'อี', 'ผ', 'ชเล', 'ย', 'บ่นว่า', 'ทำไม', 'ไม่', 'เหลือ', 'ให้', 'มัน', ' ', 'ละ', 'ก็', 'บ่น', 'ไม่', 'หยุด', ' ', 'ผญ', 'ก็', 'บอ', 'กว่า', 'ไข่', 'มัน', 'ต้ม', 'ใหม่', 'ได้', 'นะ', ' ', 'เดี๋ยว', 'ทำ', 'ใหม่', 'บ', 'ลา', 'ๆ', 'แต่', 'อี', 'ผช', 'ก็', 'ยัง', 'บ่น', 'ไม่', 'หยุด', ' ', 'คลิป', 'เต็ม', 'ความ', 'ยาว', '17', 'นาที', 'ผญ', 'เอา', 'มา', 'ลง', ' ', 'คือ', 'บ่น', 'ไม่', 'หยุด', ' ', 'จะ', 'ไป', 'ทำให้', 'ใหม่', 'ก็', 'ไม่', 'เอา', ' ', 'บ่น', 'อยู่', 'นั่น', ' ', 'ผญ', 'เดิน', 'กลับ', 'เข้าไป', 'ใน', 'ห้อง', 'เพื่อน', 'สงบสติอารมณ์', 'ก็', 'แล้ว']"
1955514326988755081,twitter,post,https://x.com/icouldseeyoubut/status/1955514326988755081,text,2025-08-13T06:18:41.000Z,selenium_x_scraper_v1,จริงๆตามในคลิปเขาก็อธิบายหมดแหละ ไหนจะเรื่องทำร้ายร่างกายอีก แต่จั่วหัวมางี้แม่งต้องมีคนดูคลิปไม่จบแล้วก็ด่าผญอีก555555555555,จริงๆตามในคลิปเขาก็อธิบายหมดแหละ ไหนจะเรื่องทำร้ายร่างกายอีก แต่จั่วหัวมางี้แม่งต้องมีคนดูคลิปไม่จบแล้วก็ด่าผญอีก555555555555,2025-11-08 17:05:14,"['จริงๆ', 'ตาม', 'ใน', 'คลิป', 'เขา', 'ก็', 'อธิบาย', 'หมด', 'แหละ', ' ', 'ไหนจะ', 'เรื่อง', 'ทำร้ายร่างกาย', 'อีก', ' ', 'แต่', 'จั่ว', 'หัว', 'มา', 'งี้', 'แม่', 'ง', 'ต้อง', 'มี', 'คนดู', 'คลิป', 'ไม่', 'จบ', 'แล้วก็', 'ด่า', 'ผญ', 'อีก', 'หัวเราะ']"
1955840330982678855,twitter,post,https://x.com/crta_me/status/1955840330982678855,text,2025-08-14T03:54:07.000Z,selenium_x_scraper_v1,ผญสมควรโดนด่าทุกตรงค่ะ บาร์ต่ำมาก,ผญสมควรโดนด่าทุกตรงค่ะ บาร์ต่ำมาก,2025-11-08 17:05:14,"['ผญ', 'สมควร', 'โดน', 'ด่า', 'ทุก', 'ตรง', 'ค่ะ', ' ', 'บาร์', 'ต่ำ', 'มาก']"
1955513607535595682,twitter,post,https://x.com/icouldseeyoubut/status/1955513607535595682,text,2025-08-13T06:15:50.000Z,selenium_x_scraper_v1,มันก็ยังบ่นไม่หยุด ผญเลยอาละวาดตามคลิป คำถามคือ มึงคิดว่านี่เป็นเพราะเรื่องไข่ต้มจริงหรอ  แล้วคิดว่าผญต้องอดทนมากี่ครั้งแล้ว ?,มันก็ยังบ่นไม่หยุด ผญเลยอาละวาดตามคลิป คำถามคือ มึงคิดว่านี่เป็นเพราะเรื่องไข่ต้มจริงหรอ  แล้วคิดว่าผญต้องอดทนมากี่ครั้งแล้ว ?,2025-11-08 17:05:14,"['มัน', 'ก็', 'ยัง', 'บ่น', 'ไม่', 'หยุด', ' ', 'ผญ', 'เลย', 'อาละวาด', 'ตาม', 'คลิป', ' ', 'คำถาม', 'คือ', ' ', 'มึง', 'คิด', 'ว่า', 'นี่', 'เป็น', 'เพราะ', 'เรื่อง', 'ไข่ต้ม', 'จริง', 'หรอ', ' ', 'แล้ว', 'คิด', 'ว่า', 'ผญ', 'ต้อง', 'อดทน', 'มา', 'กี่', 'ครั้ง', 'แล้ว', ' ', '?']"
1955840178121269532,twitter,post,https://x.com/crta_me/status/1955840178121269532,text,2025-08-14T03:53:30.000Z,selenium_x_scraper_v1,ผู้ชายอดทนมาเยอะกว่าแน่นอนค่ะ แค่ต้มไข่ให้พอดีคน ยังทำไม่ได้เลยอะ คงสุดแล้วจริงๆ แต่แบบนี้ก็ดีเลิกๆไปหาเมียที่ไม่ปสด.แบบนี้,ผู้ชายอดทนมาเยอะกว่าแน่นอนค่ะ แค่ต้มไข่ให้พอดีคน ยังทำไม่ได้เลยอะ คงสุดแล้วจริงๆ แต่แบบนี้ก็ดีเลิกๆไปหาเมียที่ไม่ปสด.แบบนี้,2025-11-08 17:05:14,"['ผู้ชาย', 'อดทน', 'มา', 'เยอะ', 'กว่า', 'แน่นอน', 'ค่ะ', ' ', 'แค่', 'ต้ม', 'ไข่', 'ให้', 'พอดี', 'คน', ' ', 'ยัง', 'ทำ', 'ไม่', 'ได้', 'เลย', 'อะ', ' ', 'คง', 'สุด', 'แล้ว', 'จริงๆ', ' ', 'แต่', 'แบบนี้', 'ก็ดี', 'เลิก', 'ๆ', 'ไปหา', 'เมีย', 'ที่', 'ไม่', 'ปสด', '.', 'แบบนี้']"
1955764267250278616,twitter,post,https://x.com/ninnin_fomost/status/1955764267250278616,text,2025-08-13T22:51:52.000Z,selenium_x_scraper_v1,อัตราส่วนไรคะ งง ตลกอะ จะเถียงก้ให้มันชัดเจนได้มั้ยคะ กะเทยปลอม,อัตราส่วนไรคะ งง ตลกอะ จะเถียงก้ให้มันชัดเจนได้มั้ยคะ กะเทยปลอม,2025-11-08 17:05:14,"['อัตราส่วน', 'ไร', 'คะ', ' ', 'งง', ' ', 'ตลก', 'อะ', ' ', 'จะ', 'เถียง', 'ก้', 'ให้', 'มัน', 'ชัดเจน', 'ได้', 'มั้ย', 'คะ', ' ', 'กะเทย', 'ปลอม']"
1955839673575858623,twitter,post,https://x.com/crta_me/status/1955839673575858623,text,2025-08-14T03:51:30.000Z,selenium_x_scraper_v1,เถียงยังไง คุณก็ไม่เปลี่ยนชุดความคิดแปลกๆนี่ที่แสดงออกได้แค่ในทวิตอยู่แล้วนี่คะ,เถียงยังไง คุณก็ไม่เปลี่ยนชุดความคิดแปลกๆนี่ที่แสดงออกได้แค่ในทวิตอยู่แล้วนี่คะ,2025-11-08 17:05:14,"['เถียง', 'ยังไง', ' ', 'คุณ', 'ก็', 'ไม่', 'เปลี่ยน', 'ชุด', 'ความคิด', 'แปลก', 'ๆ', 'นี่', 'ที่', 'แสดงออก', 'ได้', 'แค่', 'ใน', 'ทวิ', 'ตอ', 'ยู่', 'แล้ว', 'นี่', 'คะ']"
1955477926818038006,twitter,post,https://x.com/tenshi_P1107/status/1955477926818038006,text,2025-08-13T03:54:03.000Z,selenium_x_scraper_v1,ชีวิตการทำงาน ถ้าเป็นผญหงิมๆหงอยๆเรียบร้อย ผชจะรังแกไม่เกรงใจและเอาเปรียบ แต่ออกเฟียสออกแรงแล้วเก่งด้วยพูดจาแมนๆ ผชจะเกรงใจไม่กล้ายุ่ง นี่จากประสบการณ์ของเพื่อนและตัวเอง,ชีวิตการทำงาน ถ้าเป็นผญหงิมๆหงอยๆเรียบร้อย ผชจะรังแกไม่เกรงใจและเอาเปรียบ แต่ออกเฟียสออกแรงแล้วเก่งด้วยพูดจาแมนๆ ผชจะเกรงใจไม่กล้ายุ่ง นี่จากประสบการณ์ของเพื่อนและตัวเอง,2025-11-08 17:05:14,"['ชีวิต', 'การทำงาน', ' ', 'ถ้า', 'เป็น', 'ผญ', 'หงิมๆ', 'หงอย', 'ๆ', 'เรียบร้อย', ' ', 'ผช', 'จะ', 'รังแก', 'ไม่', 'เกรงใจ', 'และ', 'เอาเปรียบ', ' ', 'แต่', 'ออก', 'เฟียส', 'ออกแรง', 'แล้ว', 'เก่ง', 'ด้วย', 'พูดจา', 'แมน', 'ๆ', ' ', 'ผช', 'จะ', 'เกรงใจ', 'ไม่', 'กล้า', 'ยุ่ง', ' ', 'นี่', 'จาก', 'ประสบการณ์', 'ของ', 'เพื่อน', 'และ', 'ตัวเอง']"
1955829466565108044,twitter,post,https://x.com/crta_me/status/1955829466565108044,text,2025-08-14T03:10:57.000Z,selenium_x_scraper_v1,ผู้ชายรับบทนางร้ายเวอร์,ผู้ชายรับบทนางร้ายเวอร์,2025-11-08 17:05:14,"['ผู้ชาย', 'รับบท', 'นาง', 'ร้าย', 'เวอร์']"
1955643930802004275,twitter,post,https://x.com/ninnin_fomost/status/1955643930802004275,text,2025-08-13T14:53:41.000Z,selenium_x_scraper_v1,เพราะฉะนั้นสิ่งที่ควรคือร่วมมือกันคะเนอะ 2 เพศนี้มันอยู่ด้วยกันได้อยู่และ ถ้าคุยดีๆอะ แต่มันก้มีคนแบบพี่นี่แหละค่ะ พอคนมันเริ่มเห็นด้วยเยอะๆ มันก้เลยเริ่มอยู่ด้วยกันไม่ใช่นิคะ ถ้าร่วมมือกันไม่ก้คุยดีๆ 2 เพศมันไม่ตีกันตายหรอก,เพราะฉะนั้นสิ่งที่ควรคือร่วมมือกันคะเนอะ 2 เพศนี้มันอยู่ด้วยกันได้อยู่และ ถ้าคุยดีๆอะ แต่มันก้มีคนแบบพี่นี่แหละค่ะ พอคนมันเริ่มเห็นด้วยเยอะๆ มันก้เลยเริ่มอยู่ด้วยกันไม่ใช่นิคะ ถ้าร่วมมือกันไม่ก้คุยดีๆ 2 เพศมันไม่ตีกันตายหรอก,2025-11-08 17:05:14,"['เพราะฉะนั้น', 'สิ่ง', 'ที่', 'ควร', 'คือ', 'ร่วมมือ', 'กัน', 'คะ', 'เนอะ', ' ', '2', ' ', 'เพศ', 'นี้', 'มัน', 'อยู่', 'ด้วยกัน', 'ได้', 'อยู่', 'และ', ' ', 'ถ้า', 'คุย', 'ดี', 'ๆ', 'อะ', ' ', 'แต่', 'มัน', 'ก้', 'มี', 'คน', 'แบบ', 'พี่', 'นี่แหละ', 'ค่ะ', ' ', 'พอ', 'คน', 'มัน', 'เริ่ม', 'เห็นด้วย', 'เยอะ', 'ๆ', ' ', 'มัน', 'ก้', 'เลย', 'เริ่ม', 'อยู่', 'ด้วยกัน', 'ไม่', 'ใช่', 'นิ', 'คะ', ' ', 'ถ้า', 'ร่วมมือ', 'กัน', 'ไม่', 'ก้', 'คุย', 'ดี', 'ๆ', ' ', '2', ' ', 'เพศ', 'มัน', 'ไม่', 'ตี', 'กัน', 'ตาย', 'หรอก']"
1955673811296415871,twitter,post,https://x.com/crta_me/status/1955673811296415871,text,2025-08-13T16:52:25.000Z,selenium_x_scraper_v1,มีแต่เห็นโพสด่าผู้ชายไปวันๆในทวิตอยู่นะคะ แต่สังเกตุไหมผู้ชายไม่ให้ค่าผู้หญิงแบบคุณพี่ด้วยซ้ำ,มีแต่เห็นโพสด่าผู้ชายไปวันๆในทวิตอยู่นะคะ แต่สังเกตุไหมผู้ชายไม่ให้ค่าผู้หญิงแบบคุณพี่ด้วยซ้ำ,2025-11-08 17:05:14,"['มี', 'แต่', 'เห็น', 'โพส', 'ด่า', 'ผู้ชาย', 'ไป', 'วัน', 'ๆ', 'ใน', 'ทวิ', 'ตอ', 'ยู่', 'นะคะ', ' ', 'แต่', 'สัง', 'เกตุ', 'ไหม', 'ผู้ชาย', 'ไม่', 'ให้', 'ค่า', 'ผู้หญิง', 'แบบ', 'คุณ', 'พี่', 'ด้วยซ้ำ']"
1955644324340961590,twitter,post,https://x.com/ninnin_fomost/status/1955644324340961590,text,2025-08-13T14:55:15.000Z,selenium_x_scraper_v1,ประวัติก้มีให้เห็น ผญ.ฉลาด แทนที่ ผช. จะโอโห้ เธอคนนี้เก่งจริงๆ น่าร่วมมือด้วย ดันเป็น เสียศักดิ์ศรีวะ จะมาฉลาดกว่าไม่ได้ ก้เป็นสะแบบนี้อะค่ะ ใครมันจะไปอยากอยู่กับชายแท้ แบบพวกพี่อะค่ะ,ประวัติก้มีให้เห็น ผญ.ฉลาด แทนที่ ผช. จะโอโห้ เธอคนนี้เก่งจริงๆ น่าร่วมมือด้วย ดันเป็น เสียศักดิ์ศรีวะ จะมาฉลาดกว่าไม่ได้ ก้เป็นสะแบบนี้อะค่ะ ใครมันจะไปอยากอยู่กับชายแท้ แบบพวกพี่อะค่ะ,2025-11-08 17:05:14,"['ประวัติ', 'ก้', 'มี', 'ให้', 'เห็น', ' ', 'ผญ.', 'ฉลาด', ' ', 'แทนที่', ' ', 'ผช.', ' ', 'จะ', 'โอ', 'โห้', ' ', 'เธอ', 'คน', 'นี้', 'เก่ง', 'จริงๆ', ' ', 'น่า', 'ร่วมมือ', 'ด้วย', ' ', 'ดัน', 'เป็น', ' ', 'เสียศักดิ์ศรี', 'วะ', ' ', 'จะ', 'มา', 'ฉลาด', 'กว่า', 'ไม่', 'ได้', ' ', 'ก้', 'เป็น', 'สะ', 'แบบนี้', 'อะ', 'ค่ะ', ' ', 'ใคร', 'มัน', 'จะ', 'ไป', 'อยาก', 'อยู่', 'กับ', 'ชาย', 'แท้', ' ', 'แบบ', 'พวก', 'พี่', 'อะ', 'ค่ะ']"
1955673399692554404,twitter,post,https://x.com/crta_me/status/1955673399692554404,text,2025-08-13T16:50:47.000Z,selenium_x_scraper_v1,แต่ก็เป็นความจริงไหมคะถ้าเทียบตามอัตราส่วนมันไม่โกหกหรอกค่ะ,แต่ก็เป็นความจริงไหมคะถ้าเทียบตามอัตราส่วนมันไม่โกหกหรอกค่ะ,2025-11-08 17:05:14,"['แต่', 'ก็', 'เป็น', 'ความจริง', 'ไหม', 'คะ', 'ถ้า', 'เทียบ', 'ตาม', 'อัตราส่วน', 'มัน', 'ไม่', 'โกหก', 'หรอก', 'ค่ะ']"
1955526754292076741,twitter,post,https://x.com/RavenChapel/status/1955526754292076741,text,2025-08-13T07:08:04.000Z,selenium_x_scraper_v1,แล้วไงคะ? คนในคอนโดเองก็ใช้ลิฟต์เหมือนกัน จะกี่คนแล้วมันจะทำไม แค่เพราะหวงหรอ ขอทราบเหตุผลที่คุณคิดแบบนี้ได้ไหมคะ เผื่อจะได้เข้าใจในมุมของคุณ,แล้วไงคะ? คนในคอนโดเองก็ใช้ลิฟต์เหมือนกัน จะกี่คนแล้วมันจะทำไม แค่เพราะหวงหรอ ขอทราบเหตุผลที่คุณคิดแบบนี้ได้ไหมคะ เผื่อจะได้เข้าใจในมุมของคุณ,2025-11-08 17:05:14,"['แล้ว', 'ไง', 'คะ', '?', ' ', 'คนใน', 'คอนโด', 'เอง', 'ก็', 'ใช้', 'ลิฟต์', 'เหมือนกัน', ' ', 'จะ', 'กี่', 'คน', 'แล้ว', 'มัน', 'จะ', 'ทำไม', ' ', 'แค่', 'เพราะ', 'หวง', 'หรอ', ' ', 'ขอ', 'ทราบ', 'เหตุผล', 'ที่', 'คุณ', 'คิด', 'แบบนี้', 'ได้', 'ไหม', 'คะ', ' ', 'เผื่อ', 'จะ', 'ได้', 'เข้าใจ', 'ใน', 'มุม', 'ของ', 'คุณ']"
1952937633187021287,twitter,post,https://x.com/crta_me/status/1952937633187021287,text,2025-08-06T03:39:50.000Z,selenium_x_scraper_v1,พูดความจริงนี่ผิดตรงไหนคะ,พูดความจริงนี่ผิดตรงไหนคะ,2025-11-08 17:05:14,"['พูดความจริง', 'นี่', 'ผิด', 'ตรงไหน', 'คะ']"
1950462364350120414,twitter,post,https://x.com/minilalabelle/status/1950462364350120414,text,2025-07-30T07:44:00.000Z,selenium_x_scraper_v1,ที่บ้านไม่มีควายค่ะแต่จะมาเป็นควายให้ก็ไม่ติดนะคะ คนเมืองกรุง,ที่บ้านไม่มีควายค่ะแต่จะมาเป็นควายให้ก็ไม่ติดนะคะ คนเมืองกรุง,2025-11-08 17:05:14,"['ที่', 'บ้าน', 'ไม่', 'มี', 'ควาย', 'ค่ะ', 'แต่', 'จะ', 'มา', 'เป็น', 'ควาย', 'ให้', 'ก็', 'ไม่', 'ติด', 'นะคะ', ' ', 'คน', 'เมืองกรุง']"
1950472381195321470,twitter,post,https://x.com/crta_me/status/1950472381195321470,text,2025-07-30T08:23:48.000Z,selenium_x_scraper_v1,เป็นคนอีสานรึเปล่าคะ ไม่แปลกใจ,เป็นคนอีสานรึเปล่าคะ ไม่แปลกใจ,2025-11-08 17:05:14,"['เป็น', 'คน', 'อีสาน', 'รึเปล่า', 'คะ', ' ', 'ไม่', 'แปลกใจ']"
1950455213023752444,twitter,post,https://x.com/lattelattexz/status/1950455213023752444,text,2025-07-30T07:15:35.000Z,selenium_x_scraper_v1,ฟินไรคะ คนที่แยกแยะไม่ออกคือน่าจะเป็นหนูนะลูก ฟิคเกก็อุค่ะ รับเข้าสมองจนมองการเปโดปกติหรอ เด็กจริงเด็กปลอมอะไรไม่เกี่ยวเนาะ เด็กก็คือเด็ก,ฟินไรคะ คนที่แยกแยะไม่ออกคือน่าจะเป็นหนูนะลูก ฟิคเกก็อุค่ะ รับเข้าสมองจนมองการเปโดปกติหรอ เด็กจริงเด็กปลอมอะไรไม่เกี่ยวเนาะ เด็กก็คือเด็ก,2025-11-08 17:05:14,"['ฟิน', 'ไร', 'คะ', ' ', 'คน', 'ที่', 'แยกแยะ', 'ไม่', 'ออก', 'คือ', 'น่าจะเป็น', 'หนู', 'นะ', 'ลูก', ' ', 'ฟิคเกก็อุ', 'ค่ะ', ' ', 'รับ', 'เข้า', 'สมอง', 'จน', 'มอง', 'การ', 'เป', 'โด', 'ปกติ', 'หรอ', ' ', 'เด็ก', 'จริง', 'เด็ก', 'ปลอม', 'อะไร', 'ไม่', 'เกี่ยว', 'เนาะ', ' ', 'เด็ก', 'ก็', 'คือ', 'เด็ก']"
1950459970421502084,twitter,post,https://x.com/crta_me/status/1950459970421502084,text,2025-07-30T07:34:29.000Z,selenium_x_scraper_v1,แต่ปลอมอะ ใครเสียหายจากความฟินของชั้นบางคะ,แต่ปลอมอะ ใครเสียหายจากความฟินของชั้นบางคะ,2025-11-08 17:05:14,"['แต่', 'ปลอม', 'อะ', ' ', 'ใคร', 'เสียหาย', 'จาก', 'ความ', 'ฟิน', 'ของ', 'ชั้น', 'บาง', 'คะ']"
1950448612531433784,twitter,post,https://x.com/_doublesxq/status/1950448612531433784,text,2025-07-30T06:49:21.000Z,selenium_x_scraper_v1,เอาจริงก้ไม่ควรนะ ต่อให้เปนนิยาย เหมือนสนับสนุนอาชญากรรมมั้ง,เอาจริงก้ไม่ควรนะ ต่อให้เปนนิยาย เหมือนสนับสนุนอาชญากรรมมั้ง,2025-11-08 17:05:14,"['เอาจริง', 'ก้', 'ไม่', 'ควร', 'นะ', ' ', 'ต่อให้', 'เปน', 'นิยาย', ' ', 'เหมือน', 'สนับสนุน', 'อาชญากรรม', 'มั้ง']"
1950459805555958211,twitter,post,https://x.com/crta_me/status/1950459805555958211,text,2025-07-30T07:33:50.000Z,selenium_x_scraper_v1,ถ้าดูหนังสงครามถือว่าสนับสนุนความรุนแรงไหมคะ,ถ้าดูหนังสงครามถือว่าสนับสนุนความรุนแรงไหมคะ,2025-11-08 17:05:14,"['ถ้า', 'ดู', 'หนังสงคราม', 'ถือว่า', 'สนับสนุน', 'ความรุนแรง', 'ไหม', 'คะ']"
1950094781868122507,twitter,post,https://x.com/crta_me/status/1950094781868122507,text,2025-07-29T07:23:21.000Z,selenium_x_scraper_v1,คุณพี่ยังรี เกะโจะ ดูดปากกันอยู่เลย ,คุณพี่ยังรี เกะโจะ ดูดปากกันอยู่เลย ,2025-11-08 17:05:14,"['คุณ', 'พี่', 'ยัง', 'รี', ' ', 'เกะ', 'โจะ', ' ', 'ดูด', 'ปาก', 'กัน', 'อยู่เลย']"
1950093724173693419,twitter,post,https://x.com/TaMa_09282/status/1950093724173693419,text,2025-07-29T07:19:09.000Z,selenium_x_scraper_v1,อืมยอมรับว่าเป็นเปโด อยู่อย่างงั้น,อืมยอมรับว่าเป็นเปโด อยู่อย่างงั้น,2025-11-08 17:05:14,"['อืม', 'ยอมรับ', 'ว่า', 'เป็น', 'เป', 'โด', ' ', 'อยู่', 'อย่าง', 'งั้น']"
