id,platform,platform_type,url,content_type,timestamp,scraper_module,text,raw_text,scrape_date,tokens
1940011296096768283,twitter,post,https://x.com/Tim8666/status/1940011296096768283,text,2025-07-01T11:35:11.000Z,selenium_x_scraper_v1,It fits well with your mom ass tho,It fits well with your mom ass tho,2025-10-23 17:59:34,"['it', ' ', 'fits', ' ', 'well', ' ', 'with', ' ', 'your', ' ', 'mom', ' ', 'ass', ' ', 'tho']"
1939976827390337422,twitter,post,https://x.com/ssexyreed/status/1939976827390337422,text,2025-07-01T09:18:13.000Z,selenium_x_scraper_v1,idgaf ur still corny byee,idgaf ur still corny byee,2025-10-23 17:59:34,"['idgaf', ' ', 'ur', ' ', 'still', ' ', 'corny', ' ', 'byee']"
1939982809042403602,twitter,post,https://x.com/Tim8666/status/1939982809042403602,text,2025-07-01T09:41:59.000Z,selenium_x_scraper_v1,And ur fucking cringe  probably ugly with dry vigina too,And ur fucking cringe  probably ugly with dry vigina too,2025-10-23 17:59:34,"['and', ' ', 'ur', ' ', 'fucking', ' ', 'cringe', ' ', 'probably', ' ', 'ugly', ' ', 'with', ' ', 'dry', ' ', 'vigina', ' ', 'too']"
1939936400985432481,twitter,post,https://x.com/Tim8666/status/1939936400985432481,text,2025-07-01T06:37:34.000Z,selenium_x_scraper_v1,Because these women virgina are dry as fuck in real life. They dont wanna see anyone happy.,Because these women virgina are dry as fuck in real life. They dont wanna see anyone happy.,2025-10-23 17:59:34,"['because', ' ', 'these', ' ', 'women', ' ', 'virgina', ' ', 'are', ' ', 'dry', ' ', 'as', ' ', 'fuck', ' ', 'in', ' ', 'real', ' ', 'life', '.', ' ', 'they', ' ', 'dont', ' ', 'wanna', ' ', 'see', ' ', 'anyone', ' ', 'happy', '.']"
1939559523540484400,twitter,post,https://x.com/ShitpostRock/status/1939559523540484400,text,2025-06-30T05:40:00.000Z,selenium_x_scraper_v1,A lot of women online have this weird tendency to call any woman who is simply nice to a men a “pick me”. It's like being nice to someone is only seen as a manipulation tactic to them,A lot of women online have this weird tendency to call any woman who is simply nice to a men a “pick me”. It's like being nice to someone is only seen as a manipulation tactic to them,2025-10-23 17:59:34,"['a', ' ', 'lot', ' ', 'of', ' ', 'women', ' ', 'online', ' ', 'have', ' ', 'this', ' ', 'weird', ' ', 'tendency', ' ', 'to', ' ', 'call', ' ', 'any', ' ', 'woman', ' ', 'who', ' ', 'is', ' ', 'simply', ' ', 'nice', ' ', 'to', ' ', 'a', ' ', 'men', ' ', 'a', ' ', 'pick', ' ', 'me', ' ', '.', ' ', 'it', ""'s"", ' ', 'like', ' ', 'being', ' ', 'nice', ' ', 'to', ' ', 'someone', ' ', 'is', ' ', 'only', ' ', 'seen', ' ', 'as', ' ', 'a', ' ', 'manipulation', ' ', 'tactic', ' ', 'to', ' ', 'them']"
1939929838569079189,twitter,post,https://x.com/Tim8666/status/1939929838569079189,text,2025-07-01T06:11:30.000Z,selenium_x_scraper_v1,สภาพน่าจัยังไม่จบ ม6 ถึงโง่เปนควายแบบนี้,สภาพน่าจัยังไม่จบ ม6 ถึงโง่เปนควายแบบนี้,2025-10-23 17:59:34,"['สภาพ', 'น่า', 'จัย', 'ัง', 'ไม่', 'จบ', ' ', 'ม', '6', ' ', 'ถึง', 'โง่', 'เปน', 'ควาย', 'แบบนี้']"
1939926243291304076,twitter,post,https://x.com/Tim8666/status/1939926243291304076,text,2025-07-01T05:57:13.000Z,selenium_x_scraper_v1,เค้าขอโทษคนพิการเพราะพวกมึงปะ อีเฟมทวิต,เค้าขอโทษคนพิการเพราะพวกมึงปะ อีเฟมทวิต,2025-10-23 17:59:34,"['เค้า', 'ขอโทษ', 'คนพิการ', 'เพราะ', 'พวก', 'มึง', 'ปะ', ' ', 'อี', 'เฟม', 'ทวิ', 'ต']"
1939114517729861726,twitter,post,https://x.com/kirawontmiss/status/1939114517729861726,text,2025-06-29T00:11:42.000Z,selenium_x_scraper_v1, ,︎ ︎,2025-10-23 17:59:34,[]
1939217156241031525,twitter,post,https://x.com/toadinthebowl/status/1939217156241031525,text,2025-06-29T06:59:33.000Z,selenium_x_scraper_v1,i think people need to understand that movies aren’t always about morally good things and that art is sometimes going to be provocative. if you can’t handle that i suggest not watching anything that requires any amount of media literacy and below surface level thoughts,i think people need to understand that movies aren’t always about morally good things and that art is sometimes going to be provocative. if you can’t handle that i suggest not watching anything that requires any amount of media literacy and below surface level thoughts,2025-10-23 17:59:34,"['i', ' ', 'think', ' ', 'people', ' ', 'need', ' ', 'to', ' ', 'understand', ' ', 'that', ' ', 'movies', ' ', 'aren', ' ', 't', ' ', 'always', ' ', 'about', ' ', 'morally', ' ', 'good', ' ', 'things', ' ', 'and', ' ', 'that', ' ', 'art', ' ', 'is', ' ', 'sometimes', ' ', 'going', ' ', 'to', ' ', 'be', ' ', 'provocative', '.', ' ', 'if', ' ', 'you', ' ', 'can', ' ', 't', ' ', 'handle', ' ', 'that', ' ', 'i', ' ', 'suggest', ' ', 'not', ' ', 'watching', ' ', 'anything', ' ', 'that', ' ', 'requires', ' ', 'any', ' ', 'amount', ' ', 'of', ' ', 'media', ' ', 'literacy', ' ', 'and', ' ', 'below', ' ', 'surface', ' ', 'level', ' ', 'thoughts']"
1938891210044682347,twitter,post,https://x.com/gyrgir3/status/1938891210044682347,text,2025-06-28T09:24:21.000Z,selenium_x_scraper_v1,"Why no one refers to Arabs as colonizers, oppressors, genociders, slavers or imperialists?","Why no one refers to Arabs as colonizers, oppressors, genociders, slavers or imperialists?",2025-10-23 17:59:34,"['why', ' ', 'no', ' ', 'one', ' ', 'refers', ' ', 'to', ' ', 'arabs', ' ', 'as', ' ', 'colonizers', ',', ' ', 'oppressors', ',', ' ', 'genociders', ',', ' ', 'slavers', ' ', 'or', ' ', 'imperialists', '?']"
1938826486032801971,twitter,post,https://x.com/ninbtc/status/1938826486032801971,text,2025-06-28T05:07:10.000Z,selenium_x_scraper_v1,พยายามหา ชื่อ สมชาย สมหมาย สมเกรียติ เพื่อ จะช่วย defend ให้ แต่ขอโทษ มีแต่สาวกไอ้เลาะ,พยายามหา ชื่อ สมชาย สมหมาย สมเกรียติ เพื่อ จะช่วย defend ให้ แต่ขอโทษ มีแต่สาวกไอ้เลาะ,2025-10-23 17:59:34,"['พยายาม', 'หา', ' ', 'ชื่อ', ' ', 'สม', 'ชาย', ' ', 'สมหมาย', ' ', 'สม', 'เกรีย', 'ติ', ' ', 'เพื่อ', ' ', 'จะ', 'ช่วย', ' ', 'defend', ' ', 'ให้', ' ', 'แต่', 'ขอโทษ', ' ', 'มี', 'แต่', 'สาวก', 'ไอ้', 'เลาะ']"
1938680818932818163,twitter,post,https://x.com/madd0gfromhell/status/1938680818932818163,text,2025-06-27T19:28:20.000Z,selenium_x_scraper_v1,มึงไม่มีไรทำแลวหรอ,มึงไม่มีไรทำแลวหรอ,2025-10-23 17:59:34,"['มึง', 'ไม่', 'มี', 'ไร', 'ทำ', 'แล', 'ว', 'หรอ']"
1938092296253411601,twitter,post,https://x.com/Tim8666/status/1938092296253411601,text,2025-06-26T04:29:46.000Z,selenium_x_scraper_v1,@pakyk_ ดีใจกับผชด้วยนะคะ หลุดติ่งแดกประสาทแดกได้,@pakyk_ ดีใจกับผชด้วยนะคะ หลุดติ่งแดกประสาทแดกได้,2025-10-23 17:59:34,"['ดีใจ', 'กับ', 'ผช', 'ด้วย', 'นะคะ', ' ', 'หลุด', 'ติ่ง', 'แดก', 'ประสาท', 'แดก', 'ได้']"
1937533726415814717,twitter,post,https://x.com/Q_idrama/status/1937533726415814717,text,2025-06-24T15:30:12.000Z,selenium_x_scraper_v1,คือกุไม่ได้เปนติ่ง เลยไม่ค่อยเกทนะ ว่าทำไมถึงให้ความสำคัญกับคนในจอมากกว่าคนข้างๆ ละคนอื่นๆ ก้สนับสนุนให้เลิกไปหาผชใหม่กันหมด https://x.com/pakyk_/status//pakyk_/status/1937442408666685779…,คือกุไม่ได้เปนติ่ง เลยไม่ค่อยเกทนะ ว่าทำไมถึงให้ความสำคัญกับคนในจอมากกว่าคนข้างๆ ละคนอื่นๆ ก้สนับสนุนให้เลิกไปหาผชใหม่กันหมด https://x.com/pakyk_/status//pakyk_/status/1937442408666685779…,2025-10-23 17:59:34,"['คือ', 'กุ', 'ไม่', 'ได้', 'เปน', 'ติ่ง', ' ', 'เลย', 'ไม่ค่อย', 'เกท', 'นะ', ' ', 'ว่า', 'ทำไม', 'ถึง', 'ให้ความสำคัญ', 'กับ', 'คนใน', 'จอ', 'มากกว่า', 'คน', 'ข้างๆ', ' ', 'ละ', 'คนอื่นๆ', ' ', 'ก้', 'สนับสนุน', 'ให้', 'เลิก', 'ไปหา', 'ผช', 'ใหม่', 'กัน', 'หมด']"
1929091482717196668,twitter,post,https://x.com/pakyk_/status/1929091482717196668,text,2025-06-01T08:23:44.000Z,selenium_x_scraper_v1,"หาแลกการ์ด Proxie Hotel

เรา : อองรี โชกุน
คุณ : พี่คิม ทั้งสองเวอร์เลยค่ะ

เดมมาได้เลยค่ะ
#PROXIE_พรุ่งนี้ค่อยเลิกได้ไหม #ตลาดนัดพ้อกสี #ตลาดนัดproxie","หาแลกการ์ด Proxie Hotel

เรา : อองรี โชกุน
คุณ : พี่คิม ทั้งสองเวอร์เลยค่ะ

เดมมาได้เลยค่ะ
#PROXIE_พรุ่งนี้ค่อยเลิกได้ไหม #ตลาดนัดพ้อกสี #ตลาดนัดproxie",2025-10-23 17:59:34,"['หา', 'แลก', 'การ์ด', ' ', 'proxie', ' ', 'hotel', ' ', 'เรา', ' ', 'ออง', 'รี', ' ', 'โชกุน', ' ', 'คุณ', ' ', 'พี่', 'คิม', ' ', 'ทั้งสอง', 'เวอร์', 'เลย', 'ค่ะ', ' ', 'เด', 'ม', 'มา', 'ได้', 'เลย', 'ค่ะ', ' ', 'พรุ่งนี้', 'ค่อย', 'เลิก', 'ได้', 'ไหม', ' ', 'ตลาดนัด', 'พ้อ', 'ก', 'สี', ' ', 'ตลาดนัด', 'proxie']"
1938092049485496612,twitter,post,https://x.com/Tim8666/status/1938092049485496612,text,2025-06-26T04:28:47.000Z,selenium_x_scraper_v1,ประสาทแดก แบบนี้อย่ามีผัว สงสารผช ดีลกับคนประสาทแดก,ประสาทแดก แบบนี้อย่ามีผัว สงสารผช ดีลกับคนประสาทแดก,2025-10-23 17:59:34,"['ประสาท', 'แดก', ' ', 'แบบนี้', 'อย่า', 'มี', 'ผัว', ' ', 'สงสาร', 'ผช', ' ', 'ดีล', 'กับ', 'คน', 'ประสาท', 'แดก']"
1937882008513810656,twitter,post,https://x.com/InsaneCope/status/1937882008513810656,text,2025-06-25T14:34:09.000Z,selenium_x_scraper_v1,,,2025-10-23 17:59:34,[]
1937758741954457888,twitter,post,https://x.com/kalaland13/status/1937758741954457888,text,2025-06-25T06:24:20.000Z,selenium_x_scraper_v1,แล้วย้ำว่านางเป็น single mom มีลูกแล้วคนนึงอายุ 7 ขวบ  แปลว่านางมีตั้งแต่20-21  พอมา27 ถ้าตั้งใจท้องกับเด็ก 18-19 เพื่อจะเอาสัญชาติอีกเนี่ยนะ ปวดหัวนะ คือจากตอนแรกอาจจะหวังย้ายประเทศให้ลูกด้วยปะ กลายเป็นสรุปลูกจะไม่มีพ่อทั้งสองคนเลยเหรอ สงสารเด็กอะ,แล้วย้ำว่านางเป็น single mom มีลูกแล้วคนนึงอายุ 7 ขวบ  แปลว่านางมีตั้งแต่20-21  พอมา27 ถ้าตั้งใจท้องกับเด็ก 18-19 เพื่อจะเอาสัญชาติอีกเนี่ยนะ ปวดหัวนะ คือจากตอนแรกอาจจะหวังย้ายประเทศให้ลูกด้วยปะ กลายเป็นสรุปลูกจะไม่มีพ่อทั้งสองคนเลยเหรอ สงสารเด็กอะ,2025-10-23 17:59:34,"['แล้ว', 'ย้ำ', 'ว่า', 'นาง', 'เป็น', ' ', 'single', ' ', 'mom', ' ', 'มีลูก', 'แล้ว', 'คน', 'นึง', 'อายุ', ' ', '7', ' ', 'ขวบ', ' ', 'แปล', 'ว่า', 'นาง', 'มี', 'ตั้งแต่', '20', ' ', '21', ' ', 'พอ', 'มา', '27', ' ', 'ถ้า', 'ตั้งใจ', 'ท้อง', 'กับ', 'เด็ก', ' ', '18', ' ', '19', ' ', 'เพื่อ', 'จะ', 'เอา', 'สัญชาติ', 'อีก', 'เนี่ย', 'นะ', ' ', 'ปวดหัว', 'นะ', ' ', 'คือ', 'จาก', 'ตอนแรก', 'อาจจะ', 'หวัง', 'ย้าย', 'ประเทศ', 'ให้', 'ลูก', 'ด้วย', 'ปะ', ' ', 'กลายเป็น', 'สรุป', 'ลูก', 'จะ', 'ไม่', 'มี', 'พ่อ', 'ทั้งสอง', 'คน', 'เลย', 'เหรอ', ' ', 'สงสาร', 'เด็ก', 'อะ']"
1938054904548819082,twitter,post,https://x.com/Tim8666/status/1938054904548819082,text,2025-06-26T02:01:11.000Z,selenium_x_scraper_v1,ไม่มีการถกเถียงเหี้ยไรวะ ทัวลงผชฉ่พตบอดอยุละปะ,ไม่มีการถกเถียงเหี้ยไรวะ ทัวลงผชฉ่พตบอดอยุละปะ,2025-10-23 17:59:34,"['ไม่', 'มี', 'การ', 'ถกเถียง', 'เหี้ย', 'ไร', 'วะ', ' ', 'ทัวลงผชฉ่พต', 'บอด', 'อ', 'ยุ', 'ละ', 'ปะ']"
1936431781194187040,twitter,post,https://x.com/MrVop/status/1936431781194187040,text,2025-06-21T14:31:28.000Z,selenium_x_scraper_v1,หญิงสาวชาวอิตาลีในปัจจุบันเริ่มทำตามหญิงสาวชาวฝรั่งเศสโดยการซื้อหมูมาเลี้ยงเป็นสัตว์เลี้ยง เพื่อที่ว่าผู้ชายมุสลิมจะได้ไม่เข้าใกล้เวลาพวกเธอออกไปนอกบ้าน,หญิงสาวชาวอิตาลีในปัจจุบันเริ่มทำตามหญิงสาวชาวฝรั่งเศสโดยการซื้อหมูมาเลี้ยงเป็นสัตว์เลี้ยง เพื่อที่ว่าผู้ชายมุสลิมจะได้ไม่เข้าใกล้เวลาพวกเธอออกไปนอกบ้าน,2025-10-23 17:59:34,"['หญิงสาว', 'ชาว', 'อิตาลี', 'ใน', 'ปัจจุบัน', 'เริ่ม', 'ทำตาม', 'หญิงสาว', 'ชาว', 'ฝรั่งเศส', 'โดย', 'การ', 'ซื้อ', 'หมู', 'มา', 'เลี้ยง', 'เป็น', 'สัตว์เลี้ยง', ' ', 'เพื่อ', 'ที่ว่า', 'ผู้ชาย', 'มุสลิม', 'จะ', 'ได้', 'ไม่', 'เข้าใกล้', 'เวลา', 'พวก', 'เธอ', 'ออก', 'ไป', 'นอกบ้าน']"
1936251412859830299,twitter,post,https://x.com/jn___skm/status/1936251412859830299,text,2025-06-21T02:34:45.000Z,selenium_x_scraper_v1,"ouch, when you think you're the main character but you actually don't lol","ouch, when you think you're the main character but you actually don't lol",2025-10-23 17:59:34,"['ouch', ',', ' ', 'when', ' ', 'you', ' ', 'think', ' ', 'you', ""'re"", ' ', 'the', ' ', 'main', ' ', 'character', ' ', 'but', ' ', 'you', ' ', 'actually', ' ', 'don', ""'t"", ' ', 'lol']"
1936626774059958722,twitter,post,https://x.com/Tim8666/status/1936626774059958722,text,2025-06-22T03:26:18.000Z,selenium_x_scraper_v1,You actually “dOn’T” ,You actually “dOn’T” ,2025-10-23 17:59:34,"['you', ' ', 'actually', ' ', 'don', ' ', 't']"
1936626467661816183,twitter,post,https://x.com/Tim8666/status/1936626467661816183,text,2025-06-22T03:25:05.000Z,selenium_x_scraper_v1,ทำไมกุเห็นด้วยกับต้นทางวะ ว่ามันไม่commonจริงๆ การที่มึงเห็นบนนิยาย ไม่ได้แปลว่ามึงใช้เป็นpaperอะ writingมันคนละ skill กับ reading ไม่งั้นคนทั่วไปค้าง อยู่6.5-7 หรอ ไม่ล้ำก็ไม่ได้แปลว่าอ่านนิยายแล้วใช้ได้อะ,ทำไมกุเห็นด้วยกับต้นทางวะ ว่ามันไม่commonจริงๆ การที่มึงเห็นบนนิยาย ไม่ได้แปลว่ามึงใช้เป็นpaperอะ writingมันคนละ skill กับ reading ไม่งั้นคนทั่วไปค้าง อยู่6.5-7 หรอ ไม่ล้ำก็ไม่ได้แปลว่าอ่านนิยายแล้วใช้ได้อะ,2025-10-23 17:59:34,"['ทำไม', 'กุ', 'เห็นด้วย', 'กับ', 'ต้นทาง', 'วะ', ' ', 'ว่า', 'มัน', 'ไม่', 'common', 'จริงๆ', ' ', 'การ', 'ที่', 'มึง', 'เห็น', 'บน', 'นิยาย', ' ', 'ไม่', 'ได้', 'แปล', 'ว่า', 'มึง', 'ใช้', 'เป็น', 'paper', 'อะ', ' ', 'writing', 'มัน', 'คนละ', ' ', 'skill', ' ', 'กับ', ' ', 'reading', ' ', 'ไม่งั้น', 'คน', 'ทั่วไป', 'ค้าง', ' ', 'อยู่', '6.5', ' ', '7', ' ', 'หรอ', ' ', 'ไม่', 'ล้ำ', 'ก็', 'ไม่', 'ได้', 'แปล', 'ว่า', 'อ่าน', 'นิยาย', 'แล้ว', 'ใช้ได้', 'อะ']"
1936609136906784939,twitter,post,https://x.com/Tim8666/status/1936609136906784939,text,2025-06-22T02:16:13.000Z,selenium_x_scraper_v1,สติ อีควาย เน้นโพสเฟียสๆอย่างเดียว ขยะ,สติ อีควาย เน้นโพสเฟียสๆอย่างเดียว ขยะ,2025-10-23 17:59:34,"['สติ', ' ', 'อี', 'ควาย', ' ', 'เน้น', 'โพส', 'เฟียสๆ', 'อย่าง', 'เดียว', ' ', 'ขยะ']"
1936292168219721773,twitter,post,https://x.com/taever3badc/status/1936292168219721773,text,2025-06-21T05:16:42.000Z,selenium_x_scraper_v1,อย่าไปเหมารวมว่าเด็กจุฬาเพี้ยนเลยลูก บางทีพวกที่เพี้ยนอาจจะเพี้ยนเพราะเคยเรียนเตรียม,อย่าไปเหมารวมว่าเด็กจุฬาเพี้ยนเลยลูก บางทีพวกที่เพี้ยนอาจจะเพี้ยนเพราะเคยเรียนเตรียม,2025-10-23 17:59:34,"['อย่า', 'ไป', 'เหมา', 'รวม', 'ว่า', 'เด็ก', 'จุฬา', 'เพี้ยน', 'เลย', 'ลูก', ' ', 'บางที', 'พวก', 'ที่', 'เพี้ยน', 'อาจจะ', 'เพี้ยน', 'เพราะ', 'เคย', 'เรียน', 'เตรียม']"
1936385070769840491,twitter,post,https://x.com/Tim8666/status/1936385070769840491,text,2025-06-21T11:25:51.000Z,selenium_x_scraper_v1,Braincells are clearly lacking among these bitches https://x.com/fallingskulls//fallingskulls/status/1936183997115117583…,Braincells are clearly lacking among these bitches https://x.com/fallingskulls//fallingskulls/status/1936183997115117583…,2025-10-23 17:59:34,"['braincells', ' ', 'are', ' ', 'clearly', ' ', 'lacking', ' ', 'among', ' ', 'these', ' ', 'bitches']"
1936038489470198266,twitter,post,https://x.com/Xiwminz/status/1936038489470198266,text,2025-06-20T12:28:40.000Z,selenium_x_scraper_v1,ผู้หญิงที่เกลียดผู้หญิงบ้านนอกอีกที  ,ผู้หญิงที่เกลียดผู้หญิงบ้านนอกอีกที  ,2025-10-23 17:59:34,"['ผู้หญิง', 'ที่', 'เกลียด', 'ผู้หญิง', 'บ้านนอก', 'อีกที']"
