id,platform,platform_type,url,content_type,timestamp,scraper_module,text,raw_text,scrape_date,tokens
1974380257965977970,twitter,post,https://x.com/eldhee_94/status/1974380257965977970,text,2025-10-04T07:45:10.000Z,selenium_x_scraper_v1,คบเพื่อน ผช แล้วไม่เจอว่ามันนินทาใครลับหลังก็แสดงว่าโชคดีเจอเพื่อนดีค่ะ เพื่อน ผญ ที่ไม่นินทาก็มีเหมือนกัน แต่แค่บางคนไม่ได้เอาตัวเองไปอยู่ สำหรับเราเจอ ผช ปากหมาปากแซ่บเยอะ อาจจะเพราะสังคมตอนเรียนมัน ผช เยอะ ปจบ ก็เฟดออก คบเอาสังคมพอสังเขป ไม่สุงสิง,คบเพื่อน ผช แล้วไม่เจอว่ามันนินทาใครลับหลังก็แสดงว่าโชคดีเจอเพื่อนดีค่ะ เพื่อน ผญ ที่ไม่นินทาก็มีเหมือนกัน แต่แค่บางคนไม่ได้เอาตัวเองไปอยู่ สำหรับเราเจอ ผช ปากหมาปากแซ่บเยอะ อาจจะเพราะสังคมตอนเรียนมัน ผช เยอะ ปจบ ก็เฟดออก คบเอาสังคมพอสังเขป ไม่สุงสิง,2025-11-08 17:05:14,"['คบ', 'เพื่อน', ' ', 'ผช', ' ', 'แล้ว', 'ไม่', 'เจอ', 'ว่า', 'มัน', 'นินทา', 'ใคร', 'ลับหลัง', 'ก็', 'แสดงว่า', 'โชคดี', 'เจอ', 'เพื่อน', 'ดี', 'ค่ะ', ' ', 'เพื่อน', ' ', 'ผญ', ' ', 'ที่', 'ไม่', 'นินทา', 'ก็', 'มี', 'เหมือนกัน', ' ', 'แต่', 'แค่', 'บางคน', 'ไม่', 'ได้', 'เอา', 'ตัวเอง', 'ไป', 'อยู่', ' ', 'สำหรับ', 'เรา', 'เจอ', ' ', 'ผช', ' ', 'ปากหมา', 'ปาก', 'แซ่บ', 'เยอะ', ' ', 'อาจจะ', 'เพราะ', 'สังคม', 'ตอน', 'เรียน', 'มัน', ' ', 'ผช', ' ', 'เยอะ', ' ', 'ปจบ', ' ', 'ก็', 'เฟด', 'ออก', ' ', 'คบ', 'เอา', 'สังคม', 'พอสังเขป', ' ', 'ไม่', 'สุงสิง']"
1974140264429256775,twitter,post,https://x.com/Romance_benten/status/1974140264429256775,text,2025-10-03T15:51:31.000Z,selenium_x_scraper_v1,คือทางนี้เจอแนวนี้เลย ผช ว่ากุเป็นคนที่ขี้นินทา คือไม่ว่าได้ว่าจริงจังแต่กุก็ช้อค เพราะลุคดูแรง และชอบคุยไปเรื่อยด้วยมั้ง และใช่ค่ะ ผญ ในที่ทำงานที่นังชอบคุยด้วยเป็นคนขาว ลุคน่ารัก และนังพูดว่าไม่มีเพื่อน ผญ เพราะชอบนินทา,คือทางนี้เจอแนวนี้เลย ผช ว่ากุเป็นคนที่ขี้นินทา คือไม่ว่าได้ว่าจริงจังแต่กุก็ช้อค เพราะลุคดูแรง และชอบคุยไปเรื่อยด้วยมั้ง และใช่ค่ะ ผญ ในที่ทำงานที่นังชอบคุยด้วยเป็นคนขาว ลุคน่ารัก และนังพูดว่าไม่มีเพื่อน ผญ เพราะชอบนินทา,2025-11-08 17:05:14,"['คือ', 'ทาง', 'นี้', 'เจอ', 'แนว', 'นี้', 'เลย', ' ', 'ผช', ' ', 'ว่า', 'กุ', 'เป็น', 'คน', 'ที่', 'ขี้', 'นินทา', ' ', 'คือ', 'ไม่', 'ว่า', 'ได้', 'ว่า', 'จริงจัง', 'แต่', 'กุ', 'ก็', 'ช้อค', ' ', 'เพราะ', 'ลุค', 'ดู', 'แรง', ' ', 'และ', 'ชอบ', 'คุย', 'ไป', 'เรื่อย', 'ด้วย', 'มั้ง', ' ', 'และ', 'ใช่', 'ค่ะ', ' ', 'ผญ', ' ', 'ใน', 'ที่ทำงาน', 'ที่', 'นัง', 'ชอบ', 'คุย', 'ด้วย', 'เป็น', 'คน', 'ขาว', ' ', 'ลุค', 'น่ารัก', ' ', 'และ', 'นัง', 'พูดว่า', 'ไม่', 'มี', 'เพื่อน', ' ', 'ผญ', ' ', 'เพราะ', 'ชอบ', 'นินทา']"
1974028349958991942,twitter,post,https://x.com/poetofheaven_/status/1974028349958991942,text,2025-10-03T08:26:48.000Z,selenium_x_scraper_v1,เพื่อนผชที่เคยหลวมตัวไปสนิท อุบาทว์จัด บูลลี่รูปร่างชาวบ้าน วิจารณ์ผู้หญิงเรียงตัว หลงตัวเอง คิดว่าผู้หญิงเปนเพศที่ต้องด้อยกว่าเห็นมครดีกว่าไม่ได้ มิหนำซ้ำมันพาเพื่อนครีบปี้ๆ ของมันมาร่วมวงทั้งที่ไม่ได้บอก (พยายามจะแมชเมคเก้อ) แบบไหนมันน่ากลัวกว่ากัน,เพื่อนผชที่เคยหลวมตัวไปสนิท อุบาทว์จัด บูลลี่รูปร่างชาวบ้าน วิจารณ์ผู้หญิงเรียงตัว หลงตัวเอง คิดว่าผู้หญิงเปนเพศที่ต้องด้อยกว่าเห็นมครดีกว่าไม่ได้ มิหนำซ้ำมันพาเพื่อนครีบปี้ๆ ของมันมาร่วมวงทั้งที่ไม่ได้บอก (พยายามจะแมชเมคเก้อ) แบบไหนมันน่ากลัวกว่ากัน,2025-11-08 17:05:14,"['เพื่อน', 'ผช', 'ที่', 'เคย', 'หลวมตัว', 'ไป', 'สนิท', ' ', 'อุบาทว์', 'จัด', ' ', 'บูล', 'ลี่', 'รูปร่าง', 'ชาวบ้าน', ' ', 'วิจารณ์', 'ผู้หญิง', 'เรียงตัว', ' ', 'หลงตัวเอง', ' ', 'คิด', 'ว่า', 'ผู้หญิง', 'เปน', 'เพศ', 'ที่', 'ต้อง', 'ด้อย', 'กว่า', 'เห็น', 'มค', 'รดี', 'กว่า', 'ไม่', 'ได้', ' ', 'มิหนำซ้ำ', 'มัน', 'พา', 'เพื่อน', 'ครีบ', 'ปี้', 'ๆ', ' ', 'ของ', 'มัน', 'มา', 'ร่วมวง', 'ทั้งที่', 'ไม่', 'ได้', 'บอก', ' ', 'พยายาม', 'จะ', 'แมช', 'เมค', 'เก้อ', ' ', 'แบบ', 'ไหน', 'มัน', 'น่ากลัว', 'กว่า', 'กัน']"
1974695780155035961,twitter,post,https://x.com/Nakkjan/status/1974695780155035961,text,2025-10-05T04:38:56.000Z,selenium_x_scraper_v1,"เคยอยู่ท่ามกลางแก๊งผู้ชายสมัยเรียน ตอนนั้นด้วยความจำเป็น นี่ต้องไปนั่งอยู่แก๊งผช.แทร้ อยู่ปีนึงได้คนที่บอกผช.แมนๆลุย ไม่นินทาคือไม่จริง

มันนั่งคุยกันเรื่องใต้สะดือ โดยมีกรุนั่งตรงนั้นทุกวัน จนมีชายคนนึงพูดว่า เกรงใจเพื่อนกุมหน่อยมั้ย กุก็เลยมองหน้าพวกมัน ละมันถึงเบาๆลง","เคยอยู่ท่ามกลางแก๊งผู้ชายสมัยเรียน ตอนนั้นด้วยความจำเป็น นี่ต้องไปนั่งอยู่แก๊งผช.แทร้ อยู่ปีนึงได้คนที่บอกผช.แมนๆลุย ไม่นินทาคือไม่จริง

มันนั่งคุยกันเรื่องใต้สะดือ โดยมีกรุนั่งตรงนั้นทุกวัน จนมีชายคนนึงพูดว่า เกรงใจเพื่อนกุมหน่อยมั้ย กุก็เลยมองหน้าพวกมัน ละมันถึงเบาๆลง",2025-11-08 17:05:14,"['เคย', 'อยู่', 'ท่ามกลาง', 'แก๊ง', 'ผู้ชาย', 'สมัย', 'เรียน', ' ', 'ตอนนั้น', 'ด้วย', 'ความจำเป็น', ' ', 'นี่', 'ต้อง', 'ไป', 'นั่ง', 'อยู่', 'แก๊ง', 'ผช.', 'แทร้', ' ', 'อยู่', 'ปี', 'นึง', 'ได้', 'คน', 'ที่', 'บอก', 'ผช.', 'แมน', 'ๆ', 'ลุย', ' ', 'ไม่', 'นินทา', 'คือ', 'ไม่', 'จริง', ' ', 'มัน', 'นั่ง', 'คุย', 'กัน', 'เรื่อง', 'ใต้สะดือ', ' ', 'โดย', 'มี', 'กรุ', 'นั่ง', 'ตรงนั้น', 'ทุกวัน', ' ', 'จน', 'มี', 'ชาย', 'คน', 'นึง', 'พูดว่า', ' ', 'เกรงใจ', 'เพื่อน', 'กุม', 'หน่อย', 'มั้ย', ' ', 'กุ', 'ก็', 'เลย', 'มองหน้า', 'พวก', 'มัน', ' ', 'ละ', 'มัน', 'ถึง', 'เบา', 'ๆลง']"
1974416278120185936,twitter,post,https://x.com/fl2ay/status/1974416278120185936,text,2025-10-04T10:08:18.000Z,selenium_x_scraper_v1,แฟนเก่า(ผู้ชาย) แทบไม่มีเพื่อนผู้ชายเลย เพื่อนสนิทผู้ชายก็ไม่มี มารู้ทีหลังว่ามีปมในอดีต คือถ้ารู้จักเผิน ๆ จะดูเป็นคนเพอร์เฟ็ค แต่พอเริ่มสนิทจะรู้ว่าไม่มี mental & emotional capacity เลย ไม่ว่าจะผู้หญิงหรือผู้ชาย ถ้าเพศเดียวกันไม่คบมึงควรเอ๊ะค่ะ อินี่มันต้องมีอะไรแปลก ๆ แหละ,แฟนเก่า(ผู้ชาย) แทบไม่มีเพื่อนผู้ชายเลย เพื่อนสนิทผู้ชายก็ไม่มี มารู้ทีหลังว่ามีปมในอดีต คือถ้ารู้จักเผิน ๆ จะดูเป็นคนเพอร์เฟ็ค แต่พอเริ่มสนิทจะรู้ว่าไม่มี mental & emotional capacity เลย ไม่ว่าจะผู้หญิงหรือผู้ชาย ถ้าเพศเดียวกันไม่คบมึงควรเอ๊ะค่ะ อินี่มันต้องมีอะไรแปลก ๆ แหละ,2025-11-08 17:05:14,"['แฟน', 'เก่า', ' ', 'ผู้ชาย', ' ', 'แทบ', 'ไม่', 'มี', 'เพื่อน', 'ผู้ชาย', 'เลย', ' ', 'เพื่อนสนิท', 'ผู้ชาย', 'ก็', 'ไม่', 'มี', ' ', 'มา', 'รู้', 'ทีหลัง', 'ว่า', 'มี', 'ปม', 'ใน', 'อดีต', ' ', 'คือ', 'ถ้า', 'รู้จัก', 'เผิน ๆ', ' ', 'จะ', 'ดู', 'เป็น', 'คน', 'เพอร์เฟ็ค', ' ', 'แต่', 'พอ', 'เริ่ม', 'สนิท', 'จะ', 'รู้', 'ว่า', 'ไม่', 'มี', ' ', 'mental', ' ', 'emotional', ' ', 'capacity', ' ', 'เลย', ' ', 'ไม่', 'ว่า', 'จะ', 'ผู้หญิง', 'หรือ', 'ผู้ชาย', ' ', 'ถ้า', 'เพศ', 'เดียวกัน', 'ไม่', 'คบ', 'มึง', 'ควร', 'เอ๊ะ', 'ค่ะ', ' ', 'อิ', 'นี่', 'มัน', 'ต้อง', 'มี', 'อะไร', 'แปลก ๆ', ' ', 'แหละ']"
1973955485872398661,twitter,post,https://x.com/Lightning_ligxt/status/1973955485872398661,text,2025-10-03T03:37:16.000Z,selenium_x_scraper_v1,เออ อีพวกแบบนี้คงไม่เคยเห็นเวลาวงผู้ชายมันนั่งคุยนั่งนินทากันอะ แต่ละคำเหี้ยกว่าผู้หญิงด่ากันเองหลายเท่า คำพูดคำจาแต่ละคำที่พูดถึงคนอื่นนี่รับแทบไม่ได้ โดยเฉพาะเวลามันพูดถึงผู้หญิงนะมึง หยาบคาย พูดจาแทะโลมจนนึกว่าสัตว์ที่ควบคุมตัวเองไม่ได้,เออ อีพวกแบบนี้คงไม่เคยเห็นเวลาวงผู้ชายมันนั่งคุยนั่งนินทากันอะ แต่ละคำเหี้ยกว่าผู้หญิงด่ากันเองหลายเท่า คำพูดคำจาแต่ละคำที่พูดถึงคนอื่นนี่รับแทบไม่ได้ โดยเฉพาะเวลามันพูดถึงผู้หญิงนะมึง หยาบคาย พูดจาแทะโลมจนนึกว่าสัตว์ที่ควบคุมตัวเองไม่ได้,2025-11-08 17:05:14,"['เออ', ' ', 'อี', 'พวก', 'แบบนี้', 'คง', 'ไม่', 'เคย', 'เห็น', 'เวลา', 'วง', 'ผู้ชาย', 'มัน', 'นั่ง', 'คุย', 'นั่ง', 'นินทา', 'กัน', 'อะ', ' ', 'แต่ละ', 'คำ', 'เหี้ย', 'กว่า', 'ผู้หญิง', 'ด่า', 'กันเอง', 'หลายเท่า', ' ', 'คำพูดคำจา', 'แต่ละ', 'คำ', 'ที่', 'พูดถึง', 'คนอื่น', 'นี่', 'รับ', 'แทบ', 'ไม่', 'ได้', ' ', 'โดยเฉพาะ', 'เวลา', 'มัน', 'พูดถึง', 'ผู้หญิง', 'นะ', 'มึง', ' ', 'หยาบคาย', ' ', 'พูดจา', 'แทะโลม', 'จน', 'นึก', 'ว่า', 'สัตว์', 'ที่', 'ควบคุม', 'ตัวเอง', 'ไม่', 'ได้']"
1974038343873929659,twitter,post,https://x.com/ao2doublemy/status/1974038343873929659,text,2025-10-03T09:06:31.000Z,selenium_x_scraper_v1,พวกเพื่อนผู้หญิงกลุ่มชั้นไม่นินทาใครเลย ด่ากันเองสนุกกว่า วันไหนไม่ได้ด่ากัน มันกินข้าวไม่อร่อย มันนอนไม่แซ่บ ชีวิตนี้เหมือนขาดหายอะไรไป,พวกเพื่อนผู้หญิงกลุ่มชั้นไม่นินทาใครเลย ด่ากันเองสนุกกว่า วันไหนไม่ได้ด่ากัน มันกินข้าวไม่อร่อย มันนอนไม่แซ่บ ชีวิตนี้เหมือนขาดหายอะไรไป,2025-11-08 17:05:14,"['พวก', 'เพื่อน', 'ผู้หญิง', 'กลุ่ม', 'ชั้น', 'ไม่', 'นินทา', 'ใคร', 'เลย', ' ', 'ด่า', 'กันเอง', 'สนุก', 'กว่า', ' ', 'วัน', 'ไหน', 'ไม่', 'ได้', 'ด่า', 'กัน', ' ', 'มัน', 'กินข้าว', 'ไม่', 'อร่อย', ' ', 'มัน', 'นอน', 'ไม่', 'แซ่บ', ' ', 'ชีวิต', 'นี้', 'เหมือน', 'ขาดหาย', 'อะไร', 'ไป']"
1974046402222366784,twitter,post,https://x.com/gellowgene/status/1974046402222366784,text,2025-10-03T09:38:32.000Z,selenium_x_scraper_v1,ตอนมัธยมเคยนั่งรอเพื่อน แถวกลุ่มแก๊ง ผช แล้วเวลา ผญ คนไหนเดินผ่านมันนินทาทุกคน หนักสุดคือเม้ากันว่า ผญ ที่เดินขาถ่างๆคือไม่ virgin แล้วขำคิกๆกัน,ตอนมัธยมเคยนั่งรอเพื่อน แถวกลุ่มแก๊ง ผช แล้วเวลา ผญ คนไหนเดินผ่านมันนินทาทุกคน หนักสุดคือเม้ากันว่า ผญ ที่เดินขาถ่างๆคือไม่ virgin แล้วขำคิกๆกัน,2025-11-08 17:05:14,"['ตอน', 'มัธยม', 'เคย', 'นั่ง', 'รอ', 'เพื่อน', ' ', 'แถว', 'กลุ่ม', 'แก๊ง', ' ', 'ผช', ' ', 'แล้ว', 'เวลา', ' ', 'ผญ', ' ', 'คน', 'ไหน', 'เดินผ่าน', 'มัน', 'นินทา', 'ทุกคน', ' ', 'หนัก', 'สุด', 'คือ', 'เม้า', 'กัน', 'ว่า', ' ', 'ผญ', ' ', 'ที่', 'เดิน', 'ขา', 'ถ่าง', 'ๆ', 'คือ', 'ไม่', ' ', 'virgin', ' ', 'แล้ว', 'ขำ', 'คิกๆ', 'กัน']"
1973967934101086683,twitter,post,https://x.com/Luthien_45/status/1973967934101086683,text,2025-10-03T04:26:44.000Z,selenium_x_scraper_v1,"เราคบเพื่อนผู้ชายไม่เคยนินทาเราไม่เหมือนเพื่อนผู้หญิง 
: มึงนั่งอยู่ตรงนั้นใครจะพูดให้มึงได้ยินสาว","เราคบเพื่อนผู้ชายไม่เคยนินทาเราไม่เหมือนเพื่อนผู้หญิง 
: มึงนั่งอยู่ตรงนั้นใครจะพูดให้มึงได้ยินสาว",2025-11-08 17:05:14,"['เรา', 'คบ', 'เพื่อน', 'ผู้ชาย', 'ไม่', 'เคย', 'นินทา', 'เรา', 'ไม่', 'เหมือน', 'เพื่อน', 'ผู้หญิง', ' ', 'มึง', 'นั่ง', 'อยู่', 'ตรงนั้น', 'ใคร', 'จะ', 'พูด', 'ให้', 'มึง', 'ได้ยิน', 'สาว']"
1974151883943260446,twitter,post,https://x.com/bb_peachxap/status/1974151883943260446,text,2025-10-03T16:37:41.000Z,selenium_x_scraper_v1,ตอน ม.ปลาย กุเดินผ่านกลุ่มผู้ชายที่อยู่คนล่ะห้อง กุได้ยินพวกมันนินทาเพื่อนผู้หญิงห้องกุว่า ตอแหลแล้วก็แรด เพราะเพื่อนผู้หญิงคนนั้นคุยกับผู้ชายห้องนั้น 2 คนพร้อมกัน,ตอน ม.ปลาย กุเดินผ่านกลุ่มผู้ชายที่อยู่คนล่ะห้อง กุได้ยินพวกมันนินทาเพื่อนผู้หญิงห้องกุว่า ตอแหลแล้วก็แรด เพราะเพื่อนผู้หญิงคนนั้นคุยกับผู้ชายห้องนั้น 2 คนพร้อมกัน,2025-11-08 17:05:14,"['ตอน', ' ', 'ม.', 'ปลาย', ' ', 'กุ', 'เดินผ่าน', 'กลุ่ม', 'ผู้ชาย', 'ที่อยู่', 'คน', 'ล่ะ', 'ห้อง', ' ', 'กุ', 'ได้ยิน', 'พวก', 'มัน', 'นินทา', 'เพื่อน', 'ผู้หญิง', 'ห้อง', 'กุ', 'ว่า', ' ', 'ตอแหล', 'แล้วก็', 'แรด', ' ', 'เพราะ', 'เพื่อน', 'ผู้หญิง', 'คน', 'นั้น', 'คุย', 'กับ', 'ผู้ชาย', 'ห้อง', 'นั้น', ' ', '2', ' ', 'คน', 'พร้อมกัน']"
1974023589658550677,twitter,post,https://x.com/m0png/status/1974023589658550677,text,2025-10-03T08:07:54.000Z,selenium_x_scraper_v1,เคยเจอเหมือนกัน สรุปนี่ไปคบ ทอม ตุ้ด เก เทย มีผญเป็นเพื่อนน้อยมากกก ชายมีบ้าง แต่ก็พอๆกับเพื่อนผญอ่ะ บางทีบางเรื่องที่พวกมันนินทากันเราไม่ค่อยอินอ่ะ เช่น คนนี้เลิกกับคนนี้แล้ว คนนี้กำลังจะคุยกับคนนี้ คนนี้ได้ผัวคนที่นั้นที่นี่ พอฟังแล้ว อ้อ แล้วทำไมวะ ไปยุ่งไรกะเขา,เคยเจอเหมือนกัน สรุปนี่ไปคบ ทอม ตุ้ด เก เทย มีผญเป็นเพื่อนน้อยมากกก ชายมีบ้าง แต่ก็พอๆกับเพื่อนผญอ่ะ บางทีบางเรื่องที่พวกมันนินทากันเราไม่ค่อยอินอ่ะ เช่น คนนี้เลิกกับคนนี้แล้ว คนนี้กำลังจะคุยกับคนนี้ คนนี้ได้ผัวคนที่นั้นที่นี่ พอฟังแล้ว อ้อ แล้วทำไมวะ ไปยุ่งไรกะเขา,2025-11-08 17:05:14,"['เคย', 'เจอ', 'เหมือนกัน', ' ', 'สรุป', 'นี่', 'ไป', 'คบ', ' ', 'ทอม', ' ', 'ตุ้ด', ' ', 'เก', ' ', 'เท', 'ย', ' ', 'มี', 'ผญ', 'เป็นเพื่อน', 'น้อย', 'มาก', 'กก', ' ', 'ชาย', 'มี', 'บ้าง', ' ', 'แต่', 'ก็', 'พอ', 'ๆ', 'กับ', 'เพื่อน', 'ผญ', 'อ่ะ', ' ', 'บางที', 'บาง', 'เรื่อง', 'ที่', 'พวก', 'มัน', 'นินทา', 'กัน', 'เรา', 'ไม่ค่อย', 'อิน', 'อ่ะ', ' ', 'เช่น', ' ', 'คน', 'นี้', 'เลิก', 'กับ', 'คน', 'นี้', 'แล้ว', ' ', 'คน', 'นี้', 'กำลังจะ', 'คุย', 'กับ', 'คน', 'นี้', ' ', 'คน', 'นี้', 'ได้', 'ผัว', 'คน', 'ที่', 'นั้น', 'ที่นี่', ' ', 'พอ', 'ฟัง', 'แล้ว', ' ', 'อ้อ', ' ', 'แล้ว', 'ทำไม', 'วะ', ' ', 'ไป', 'ยุ่ง', 'ไร', 'กะ', 'เขา']"
