id,platform,platform_type,url,content_type,timestamp,scraper_module,text,raw_text,scrape_date,tokens
1982438003856613390,twitter,post,https://x.com/akixxziak/status/1982438003856613390,text,2025-10-26T13:23:46.000Z,selenium_x_scraper_v1,"ใส่เสื้อกันหนาวลายดอกไม้ สีแดงๆ ไปโรงเรียน ครูเห็น ครูเอาไปพูดหน้าเสาธง ว่าจะใส่เสื้อกันหนาวมาโรงเรียนทำไม ลายสีแดง ลายดอกไม้ก็ใช่ว่าจะสวย กุนั่งงงเอ๋อแดกอยู่ แบบ อะไรวะ ครูข้องใจอะไร ก็ไปพูดหน้าเสาธงเฉย แทนที่จะพูดเตือนเด็กต่อหน้าแล้วจบ
อันนี้ประกาศให้รู้ทั้งโรงเรียนเลยมั้ง","ใส่เสื้อกันหนาวลายดอกไม้ สีแดงๆ ไปโรงเรียน ครูเห็น ครูเอาไปพูดหน้าเสาธง ว่าจะใส่เสื้อกันหนาวมาโรงเรียนทำไม ลายสีแดง ลายดอกไม้ก็ใช่ว่าจะสวย กุนั่งงงเอ๋อแดกอยู่ แบบ อะไรวะ ครูข้องใจอะไร ก็ไปพูดหน้าเสาธงเฉย แทนที่จะพูดเตือนเด็กต่อหน้าแล้วจบ
อันนี้ประกาศให้รู้ทั้งโรงเรียนเลยมั้ง",2025-11-29 08:18:55,"['ใส่', 'เสื้อกันหนาว', 'ลาย', 'ดอกไม้', ' ', 'สีแดง', 'ๆ', ' ', 'ไป', 'โรงเรียน', ' ', 'ครู', 'เห็น', ' ', 'ครู', 'เอา', 'ไป', 'พูด', 'หน้า', 'เสาธง', ' ', 'ว่า', 'จะ', 'ใส่', 'เสื้อกันหนาว', 'มา', 'โรงเรียน', 'ทำไม', ' ', 'ลาย', 'สีแดง', ' ', 'ลาย', 'ดอกไม้', 'ก็', 'ใช่', 'ว่า', 'จะ', 'สวย', ' ', 'กุ', 'นั่ง', 'งง', 'เอ๋อ', 'แดก', 'อยู่', ' ', 'แบบ', ' ', 'อะไร', 'วะ', ' ', 'ครู', 'ข้องใจ', 'อะไร', ' ', 'ก็', 'ไป', 'พูด', 'หน้า', 'เสาธง', 'เฉย', ' ', 'แทนที่จะ', 'พูด', 'เตือน', 'เด็ก', 'ต่อหน้า', 'แล้ว', 'จบ', ' ', 'อันนี้', 'ประกาศ', 'ให้', 'รู้', 'ทั้ง', 'โรงเรียน', 'เลย', 'มั้ง']"
1981954753182470551,twitter,post,https://x.com/beebie7442/status/1981954753182470551,text,2025-10-25T05:23:30.000Z,selenium_x_scraper_v1,"ตอนสมัยจารุณีเป็นนักร้อง เพลง #แจงแวง ดัง นี่กผ้ร้องเพลง แจงวงฟ้าแจ้งแจงแวง แจงแวงฟ้าแจ้งแจงแวง โดนครูเอ็ดให้เลิกร้อง เพราะบอกว่าเพลงมันแก่แดด มันดูยั่วยวน
นี่ก็ ห๊ะ อะไรนะ ยั่วยวนยังไงวะ งงมาก ทุกวันนี้ก็ยังงง","ตอนสมัยจารุณีเป็นนักร้อง เพลง #แจงแวง ดัง นี่กผ้ร้องเพลง แจงวงฟ้าแจ้งแจงแวง แจงแวงฟ้าแจ้งแจงแวง โดนครูเอ็ดให้เลิกร้อง เพราะบอกว่าเพลงมันแก่แดด มันดูยั่วยวน
นี่ก็ ห๊ะ อะไรนะ ยั่วยวนยังไงวะ งงมาก ทุกวันนี้ก็ยังงง",2025-11-29 08:18:55,"['ตอน', 'สมัย', 'จารุ', 'ณี', 'เป็น', 'นักร้อง', ' ', 'เพลง', ' ', 'แจง', 'แวง', ' ', 'ดัง', ' ', 'นี่', 'กผ้', 'ร้องเพลง', ' ', 'แจ', 'งวง', 'ฟ้า', 'แจ้ง', 'แจง', 'แวง', ' ', 'แจง', 'แวง', 'ฟ้า', 'แจ้ง', 'แจง', 'แวง', ' ', 'โดน', 'ครู', 'เอ็ด', 'ให้', 'เลิก', 'ร้อง', ' ', 'เพราะ', 'บอ', 'กว่า', 'เพลง', 'มัน', 'แก่แดด', ' ', 'มัน', 'ดู', 'ยั่วยวน', ' ', 'นี่', 'ก็', ' ', 'ห๊ะ', ' ', 'อะไร', 'นะ', ' ', 'ยั่วยวน', 'ยังไง', 'วะ', ' ', 'งง', 'มาก', ' ', 'ทุกวันนี้', 'ก็', 'ยัง', 'งง']"
1982400271209914525,twitter,post,https://x.com/mialovemyself/status/1982400271209914525,text,2025-10-26T10:53:50.000Z,selenium_x_scraper_v1,อมจุ๊ปปาจุ๊บโดนด่าว่าไม่เหมาะสมเพราะมันอมๆแบบแก้มตุ้ยๆ ถ้าอมลูกอมธรรมดาไม่โดนไร,อมจุ๊ปปาจุ๊บโดนด่าว่าไม่เหมาะสมเพราะมันอมๆแบบแก้มตุ้ยๆ ถ้าอมลูกอมธรรมดาไม่โดนไร,2025-11-29 08:18:55,"['อม', 'จุ๊ป', 'ปา', 'จุ๊บ', 'โดน', 'ด่าว่า', 'ไม่', 'เหมาะสม', 'เพราะ', 'มัน', 'อม', 'ๆ', 'แบบ', 'แก้ม', 'ตุ้ยๆ', ' ', 'ถ้า', 'อม', 'ลูกอม', 'ธรรมดา', 'ไม่', 'โดน', 'ไร']"
1981943961649566126,twitter,post,https://x.com/tyron_triston/status/1981943961649566126,text,2025-10-25T04:40:37.000Z,selenium_x_scraper_v1,โรงเรียนนี้ไม่มีนะ สอนให้พูดสุภาพ แต่เรื่องคำนี้ไม่มี ส่วนสุขศึกษาก็ไม่ได้สอน sex ed ชัดเจนมีความกระมิดกระเมี้ยน แต่เน้น trauma เปิดคลิปคลอดลูกให้ดูแทน…,โรงเรียนนี้ไม่มีนะ สอนให้พูดสุภาพ แต่เรื่องคำนี้ไม่มี ส่วนสุขศึกษาก็ไม่ได้สอน sex ed ชัดเจนมีความกระมิดกระเมี้ยน แต่เน้น trauma เปิดคลิปคลอดลูกให้ดูแทน…,2025-11-29 08:18:55,"['โรงเรียน', 'นี้', 'ไม่', 'มี', 'นะ', ' ', 'สอน', 'ให้', 'พูด', 'สุภาพ', ' ', 'แต่', 'เรื่อง', 'คำ', 'นี้', 'ไม่', 'มี', ' ', 'ส่วน', 'สุขศึกษา', 'ก็', 'ไม่', 'ได้', 'สอน', ' ', 'sex', ' ', 'ed', ' ', 'ชัดเจน', 'มี', 'ความ', 'กระมิดกระเมี้ยน', ' ', 'แต่', 'เน้น', ' ', 'trauma', ' ', 'เปิด', 'คลิป', 'คลอดลูก', 'ให้', 'ดู', 'แทน']"
1982439070581260300,twitter,post,https://x.com/jaja555666/status/1982439070581260300,text,2025-10-26T13:28:01.000Z,selenium_x_scraper_v1,คำว่า เอา กับ ยิ้ม ยังงงจนวันนี้ว่าทำไมถึงกลายเป็นคำด้านลบในแง่ทางเพศ,คำว่า เอา กับ ยิ้ม ยังงงจนวันนี้ว่าทำไมถึงกลายเป็นคำด้านลบในแง่ทางเพศ,2025-11-29 08:18:55,"['คำ', 'ว่า', ' ', 'เอา', ' ', 'กับ', ' ', 'ยิ้ม', ' ', 'ยัง', 'งง', 'จน', 'วันนี้', 'ว่า', 'ทำไม', 'ถึง', 'กลายเป็น', 'คำ', 'ด้าน', 'ลบ', 'ในแง่', 'ทางเพศ']"
1982030810581794831,twitter,post,https://x.com/29octoberx/status/1982030810581794831,text,2025-10-25T10:25:44.000Z,selenium_x_scraper_v1,เรียนหญิงล้วนเหมือนกันสาเหตุที่ไม่ให้เด็กไว้ผมยาวเพราะพอผมยาวต้องมัด พอมัดก็จะโชว์ให้เห็นต้นคอ เดี๋ยวผช.มีอารมณ์เลยต้องไว้สั้น จะรั่ว5555555555,เรียนหญิงล้วนเหมือนกันสาเหตุที่ไม่ให้เด็กไว้ผมยาวเพราะพอผมยาวต้องมัด พอมัดก็จะโชว์ให้เห็นต้นคอ เดี๋ยวผช.มีอารมณ์เลยต้องไว้สั้น จะรั่ว5555555555,2025-11-29 08:18:55,"['เรียน', 'หญิง', 'ล้วน', 'เหมือนกัน', 'สาเหตุ', 'ที่', 'ไม่', 'ให้', 'เด็ก', 'ไว้', 'ผม', 'ยาว', 'เพราะ', 'พอ', 'ผม', 'ยาว', 'ต้อง', 'มัด', ' ', 'พอ', 'มัด', 'ก็', 'จะ', 'โชว์', 'ให้', 'เห็น', 'ต้นคอ', ' ', 'เดี๋ยว', 'ผช.', 'มี', 'อารมณ์', 'เลย', 'ต้อง', 'ไว้', 'สั้น', ' ', 'จะ', 'รั่ว', 'หัวเราะ']"
1981997627991609376,twitter,post,https://x.com/_012l/status/1981997627991609376,text,2025-10-25T08:13:52.000Z,selenium_x_scraper_v1,"รับรู้มานานแล้วว่ามีคำอื่นใข้แทนได้ซึ่งสุภาพกว่าคำว่าเอา แล้วก็เคยเจอครูบอกคำว่า เอา ไม่สุภาพด้วย แต่ไม่เคยเห็นใครบอกว่าไม่สุภาพเพราะเกี่ยวกับกิจกรรมเข้าจังหวะ 

เอาจริงเราว่าคนที่ใช้คำว่าเอาในบริบททั่วไปก็ไม่มีใครคิดไปทางนั้นอะ","รับรู้มานานแล้วว่ามีคำอื่นใข้แทนได้ซึ่งสุภาพกว่าคำว่าเอา แล้วก็เคยเจอครูบอกคำว่า เอา ไม่สุภาพด้วย แต่ไม่เคยเห็นใครบอกว่าไม่สุภาพเพราะเกี่ยวกับกิจกรรมเข้าจังหวะ 

เอาจริงเราว่าคนที่ใช้คำว่าเอาในบริบททั่วไปก็ไม่มีใครคิดไปทางนั้นอะ",2025-11-29 08:18:55,"['รับรู้', 'มา', 'นาน', 'แล้ว', 'ว่า', 'มี', 'คำ', 'อื่น', 'ใข้', 'แทน', 'ได้', 'ซึ่ง', 'สุภาพ', 'กว่า', 'คำ', 'ว่า', 'เอา', ' ', 'แล้วก็', 'เคย', 'เจอ', 'ครู', 'บอก', 'คำ', 'ว่า', ' ', 'เอา', ' ', 'ไม่', 'สุภาพ', 'ด้วย', ' ', 'แต่', 'ไม่', 'เคย', 'เห็น', 'ใคร', 'บอ', 'กว่า', 'ไม่', 'สุภาพ', 'เพราะ', 'เกี่ยวกับ', 'กิจกรรมเข้าจังหวะ', ' ', 'เอาจริง', 'เรา', 'ว่า', 'คน', 'ที่', 'ใช้', 'คำ', 'ว่า', 'เอา', 'ใน', 'บริบท', 'ทั่วไป', 'ก็', 'ไม่', 'มี', 'ใคร', 'คิด', 'ไป', 'ทาง', 'นั้น', 'อะ']"
1981976455014973869,twitter,post,https://x.com/pmobmab/status/1981976455014973869,text,2025-10-25T06:49:44.000Z,selenium_x_scraper_v1,เคยโดนห้ามถือถุงกระดาษเพราะมิสบอกว่ามันจะเหมือนโสเภณี ชั้นห้ะ? ไม่รู้จริงเทจหรอกแต่แบบ ห้ะ? ใส่ชุดนักเรียนถือถุงกระดาษเอง,เคยโดนห้ามถือถุงกระดาษเพราะมิสบอกว่ามันจะเหมือนโสเภณี ชั้นห้ะ? ไม่รู้จริงเทจหรอกแต่แบบ ห้ะ? ใส่ชุดนักเรียนถือถุงกระดาษเอง,2025-11-29 08:18:55,"['เคย', 'โดน', 'ห้าม', 'ถือ', 'ถุงกระดาษ', 'เพราะ', 'มิส', 'บอ', 'กว่า', 'มัน', 'จะ', 'เหมือน', 'โสเภณี', ' ', 'ชั้น', 'ห้ะ', '?', ' ', 'ไม่', 'รู้', 'จริง', 'เท', 'จ', 'หรอก', 'แต่', 'แบบ', ' ', 'ห้ะ', '?', ' ', 'ใส่', 'ชุดนักเรียน', 'ถือ', 'ถุงกระดาษ', 'เอง']"
1982589883547079066,twitter,post,https://x.com/G_SarunyaA/status/1982589883547079066,text,2025-10-26T23:27:17.000Z,selenium_x_scraper_v1,"ปาร์ตี้วันปัจฉิม ผอ.เชิญวงดนตรีจากโรงเรียนชายล้วนมาขึ้นโชว์ สาว ๆ ก็เต้นแร้งเต้นกาตามฟีลลิ่ง
วันถัดมา หัวหน้าฝ่ายปกครองเทศนาว่า... เป็นกุลสตรีต้องสำรวมกิริยาต่อหน้าผู้ชาย

เฮลโล้ววว 
""ปาร์ตี้"" ส่งท้ายชีวิตนร.ม.6
อาจารย์ยังจะตีกรอบบังคับกัน","ปาร์ตี้วันปัจฉิม ผอ.เชิญวงดนตรีจากโรงเรียนชายล้วนมาขึ้นโชว์ สาว ๆ ก็เต้นแร้งเต้นกาตามฟีลลิ่ง
วันถัดมา หัวหน้าฝ่ายปกครองเทศนาว่า... เป็นกุลสตรีต้องสำรวมกิริยาต่อหน้าผู้ชาย

เฮลโล้ววว 
""ปาร์ตี้"" ส่งท้ายชีวิตนร.ม.6
อาจารย์ยังจะตีกรอบบังคับกัน",2025-11-29 08:18:55,"['ปาร์ตี้', 'วัน', 'ปัจฉิม', ' ', 'ผอ.', 'เชิญ', 'วงดนตรี', 'จาก', 'โรงเรียนชาย', 'ล้วน', 'มา', 'ขึ้น', 'โชว์', ' ', 'สาว', ' ', 'ๆ', ' ', 'ก็', 'เต้นแร้งเต้นกา', 'ตาม', 'ฟี', 'ลลิ่ง', ' ', 'วัน', 'ถัดมา', ' ', 'หัวหน้า', 'ฝ่ายปกครอง', 'เทศนา', 'ว่า', '...', ' ', 'เป็น', 'กุลสตรี', 'ต้อง', 'สำรวม', 'กิริยา', 'ต่อหน้า', 'ผู้ชาย', ' ', 'เฮ', 'ล', 'โล้', 'ววว', ' ', 'ปาร์ตี้', ' ', 'ส่งท้าย', 'ชีวิต', 'นร.', 'ม.', '6', ' ', 'อาจารย์', 'ยัง', 'จะ', 'ตี', 'กรอบ', 'บังคับ', 'กัน']"
1982252846801121708,twitter,post,https://x.com/natsunoyukihehe/status/1982252846801121708,text,2025-10-26T01:08:01.000Z,selenium_x_scraper_v1,รร ฉันเป็น ครูบอกให้ใข้คำว่า ประสงค์ แทน คำว่าเอา 555555555555,รร ฉันเป็น ครูบอกให้ใข้คำว่า ประสงค์ แทน คำว่าเอา 555555555555,2025-11-29 08:18:55,"['รร', ' ', 'ฉัน', 'เป็น', ' ', 'ครู', 'บอก', 'ให้', 'ใข้', 'คำ', 'ว่า', ' ', 'ประสงค์', ' ', 'แทน', ' ', 'คำ', 'ว่า', 'เอา', ' ', 'หัวเราะ']"
1982110285252165829,twitter,post,https://x.com/PurmInmytales/status/1982110285252165829,text,2025-10-25T15:41:32.000Z,selenium_x_scraper_v1,หญิงล้วนเหมือนกัน แต่โดนคำว่า 'เออ' บอกไม่สุภาพ ละบ่นๆๆยาวว แต่คือบริบทตอนนั้น นี่คุยกับเพื่อน ละอยู่ๆครูก็แทรกขึ้นมาคั่นบทสนทนานี่ ,หญิงล้วนเหมือนกัน แต่โดนคำว่า 'เออ' บอกไม่สุภาพ ละบ่นๆๆยาวว แต่คือบริบทตอนนั้น นี่คุยกับเพื่อน ละอยู่ๆครูก็แทรกขึ้นมาคั่นบทสนทนานี่ ,2025-11-29 08:18:55,"['หญิง', 'ล้วน', 'เหมือนกัน', ' ', 'แต่', 'โดน', 'คำ', 'ว่า', ' ', ""'"", 'เออ', ""'"", ' ', 'บอก', 'ไม่', 'สุภาพ', ' ', 'ละ', 'บ่น', 'ๆๆ', 'ยาว', 'ว', ' ', 'แต่', 'คือ', 'บริบท', 'ตอนนั้น', ' ', 'นี่', 'คุย', 'กับ', 'เพื่อน', ' ', 'ละ', 'อยู่', 'ๆ', 'ครู', 'ก็', 'แทรก', 'ขึ้น', 'มา', 'คั่น', 'บทสนทนา', 'นี่']"
1982376995217613006,twitter,post,https://x.com/myunsunshine/status/1982376995217613006,text,2025-10-26T09:21:21.000Z,selenium_x_scraper_v1,สะท้อนให้เห็นความคิดจิตใต้สำนึกของครูนั้นต่ำขนาดไหน ที่แปลความหมายคำได้ลบขนาดนี้,สะท้อนให้เห็นความคิดจิตใต้สำนึกของครูนั้นต่ำขนาดไหน ที่แปลความหมายคำได้ลบขนาดนี้,2025-11-29 08:18:55,"['สะท้อน', 'ให้', 'เห็น', 'ความคิด', 'จิตใต้สำนึก', 'ของ', 'ครู', 'นั้น', 'ต่ำ', 'ขนาด', 'ไหน', ' ', 'ที่', 'แปลความหมาย', 'คำ', 'ได้', 'ลบ', 'ขนาด', 'นี้']"
1981994388138918209,twitter,post,https://x.com/little_shiplost/status/1981994388138918209,text,2025-10-25T08:01:00.000Z,selenium_x_scraper_v1,ไม่เคยเจออ่า เจอแต่แต่งหน้าทำสวยเพราะอยากมีผัว (คนโดนไม่ใช้ฉันเพราะฉันไม่แต่งหน้า และจากตอนนั้นจนถึงตอนนี้ก็ไม่เคยมีผัวเลยยยย),ไม่เคยเจออ่า เจอแต่แต่งหน้าทำสวยเพราะอยากมีผัว (คนโดนไม่ใช้ฉันเพราะฉันไม่แต่งหน้า และจากตอนนั้นจนถึงตอนนี้ก็ไม่เคยมีผัวเลยยยย),2025-11-29 08:18:55,"['ไม่', 'เคย', 'เจอ', 'อ่า', ' ', 'เจอ', 'แต่', 'แต่งหน้า', 'ทำ', 'สวย', 'เพราะ', 'อยาก', 'มี', 'ผัว', ' ', 'คน', 'โดน', 'ไม่', 'ใช้', 'ฉัน', 'เพราะ', 'ฉัน', 'ไม่', 'แต่งหน้า', ' ', 'และ', 'จาก', 'ตอนนั้น', 'จนถึง', 'ตอนนี้', 'ก็', 'ไม่', 'เคย', 'มี', 'ผัว', 'เลย', 'ยยย']"
1981984882571219130,twitter,post,https://x.com/peonywine1/status/1981984882571219130,text,2025-10-25T07:23:14.000Z,selenium_x_scraper_v1,"ของเราหญิงล้วนเหมือนกันแต่ครูไม่อยากให้ใช้คำนี้เพราะคนละเหตุผล

ครูบอกว่า “เอา” จะฟังไม่เพราะเหมือนเราไปสั่งคนอื่น ถึงเป็นคนที่ขายของให้เรา ก็ควรสุภาพกับเค้า

พูดว่า “ขอ” “รบกวน” “นำ” จะน่าฟังกว่า ครูบอกว่าถ้าเราเป็นคนขายเราอยากฟังแบบไหนก็พูดแบบนั้น","ของเราหญิงล้วนเหมือนกันแต่ครูไม่อยากให้ใช้คำนี้เพราะคนละเหตุผล

ครูบอกว่า “เอา” จะฟังไม่เพราะเหมือนเราไปสั่งคนอื่น ถึงเป็นคนที่ขายของให้เรา ก็ควรสุภาพกับเค้า

พูดว่า “ขอ” “รบกวน” “นำ” จะน่าฟังกว่า ครูบอกว่าถ้าเราเป็นคนขายเราอยากฟังแบบไหนก็พูดแบบนั้น",2025-11-29 08:18:55,"['ของ', 'เรา', 'หญิง', 'ล้วน', 'เหมือนกัน', 'แต่', 'ครู', 'ไม่', 'อยาก', 'ให้', 'ใช้', 'คำ', 'นี้', 'เพราะ', 'คนละ', 'เหตุผล', ' ', 'ครู', 'บอ', 'กว่า', ' ', 'เอา', ' ', 'จะ', 'ฟัง', 'ไม่', 'เพราะ', 'เหมือน', 'เรา', 'ไป', 'สั่ง', 'คนอื่น', ' ', 'ถึง', 'เป็น', 'คน', 'ที่', 'ขายของ', 'ให้', 'เรา', ' ', 'ก็', 'ควร', 'สุภาพ', 'กับ', 'เค้า', ' ', 'พูดว่า', ' ', 'ขอ', ' ', 'รบกวน', ' ', 'นำ', ' ', 'จะ', 'น่าฟัง', 'กว่า', ' ', 'ครู', 'บอ', 'กว่า', 'ถ้า', 'เรา', 'เป็น', 'คน', 'ขาย', 'เรา', 'อยาก', 'ฟัง', 'แบบ', 'ไหน', 'ก็', 'พูด', 'แบบ', 'นั้น']"
1982142383002161466,twitter,post,https://x.com/jaoyingbellaa/status/1982142383002161466,text,2025-10-25T17:49:05.000Z,selenium_x_scraper_v1,ตอนนั้นนี่ฟุบรอเข้าเรียนอยู่ริมทางเดินหน้าห้อง ครูเดินมาด่าเสียงดังใหญ่โตว่าเป็นผญห้ามนอนไปทั่ว ผญที่นอนได้ทุกที่คือผญขายตัว กุแบบห๊า กุแค่ง่วง,ตอนนั้นนี่ฟุบรอเข้าเรียนอยู่ริมทางเดินหน้าห้อง ครูเดินมาด่าเสียงดังใหญ่โตว่าเป็นผญห้ามนอนไปทั่ว ผญที่นอนได้ทุกที่คือผญขายตัว กุแบบห๊า กุแค่ง่วง,2025-11-29 08:18:55,"['ตอนนั้น', 'นี่', 'ฟุบ', 'รอ', 'เข้าเรียน', 'อยู่', 'ริม', 'ทาง', 'เดินหน้า', 'ห้อง', ' ', 'ครู', 'เดิน', 'มา', 'ด่า', 'เสียงดัง', 'ใหญ่โต', 'ว่า', 'เป็น', 'ผญ', 'ห้าม', 'นอน', 'ไป', 'ทั่ว', ' ', 'ผญ', 'ที่นอน', 'ได้', 'ทุกที่', 'คือ', 'ผญ', 'ขายตัว', ' ', 'กุ', 'แบบ', 'ห๊า', ' ', 'กุ', 'แค่', 'ง่วง']"
