id,platform,platform_type,url,content_type,timestamp,scraper_module,text,raw_text,scrape_date,tokens
1950094275183513699,twitter,post,https://x.com/crta_me/status/1950094275183513699,text,2025-07-29T07:21:20.000Z,selenium_x_scraper_v1,ไม่เคยบอกว่าเป็นค่ะ มีแต่พวกคุณน้องนั่นแหละชอบมาแซะมาด่าความชอบคนอื่น ทั้งๆที่ไม่ได้ใครเดือนร้อนด้วยซ้ำ,ไม่เคยบอกว่าเป็นค่ะ มีแต่พวกคุณน้องนั่นแหละชอบมาแซะมาด่าความชอบคนอื่น ทั้งๆที่ไม่ได้ใครเดือนร้อนด้วยซ้ำ,2025-11-08 17:05:14,"['ไม่', 'เคย', 'บอ', 'กว่า', 'เป็น', 'ค่ะ', ' ', 'มี', 'แต่', 'พวกคุณ', 'น้อง', 'นั่นแหละ', 'ชอบ', 'มา', 'แซะ', 'มา', 'ด่า', 'ความชอบ', 'คนอื่น', ' ', 'ทั้งๆ', 'ที่', 'ไม่', 'ได้', 'ใคร', 'เดือนร้อน', 'ด้วยซ้ำ']"
1950092668387913728,twitter,post,https://x.com/TaMa_09282/status/1950092668387913728,text,2025-07-29T07:14:57.000Z,selenium_x_scraper_v1,ไม่ได้เพราะทำด้วยใจ ไม่ต้องมียศเพราะการเตือนสติคนเป็นสิ่งที่มีประโยชน์กว่าดีเฟ้นไห้เปโดแน่นอน,ไม่ได้เพราะทำด้วยใจ ไม่ต้องมียศเพราะการเตือนสติคนเป็นสิ่งที่มีประโยชน์กว่าดีเฟ้นไห้เปโดแน่นอน,2025-11-08 17:05:14,"['ไม่', 'ได้', 'เพราะ', 'ทำ', 'ด้วยใจ', ' ', 'ไม่ต้อง', 'มี', 'ยศ', 'เพราะ', 'การเตือนสติ', 'คน', 'เป็น', 'สิ่ง', 'ที่', 'มีประโยชน์', 'กว่า', 'ดี', 'เฟ้น', 'ไห้', 'เป', 'โด', 'แน่นอน']"
1950093899634037218,twitter,post,https://x.com/crta_me/status/1950093899634037218,text,2025-07-29T07:19:51.000Z,selenium_x_scraper_v1,ถ้าเอาตระกะของคุณน้องคือชอบอะไร = สนับสนุนสิ่งนั้น คนดูJohn wick ก็เท่ากับสนับสนุนฆา*กรเหรอคะ ,ถ้าเอาตระกะของคุณน้องคือชอบอะไร = สนับสนุนสิ่งนั้น คนดูJohn wick ก็เท่ากับสนับสนุนฆา*กรเหรอคะ ,2025-11-08 17:05:14,"['ถ้า', 'เอา', 'ตระ', 'กะ', 'ของ', 'คุณ', 'น้อง', 'คือ', 'ชอบ', 'อะไร', ' ', 'สนับสนุน', 'สิ่ง', 'นั้น', ' ', 'คนดู', 'john', ' ', 'wick', ' ', 'ก็', 'เท่ากับ', 'สนับสนุน', 'ฆา', ' ', 'กร', 'เหรอ', 'คะ']"
1950092390678606189,twitter,post,https://x.com/TaMa_09282/status/1950092390678606189,text,2025-07-29T07:13:51.000Z,selenium_x_scraper_v1,ครับ อุบาทว์มากครับไม่ว่ายังไงก็ตาม เปโดควรตายไห้หมดโลก อยู่ไปรกโลกป่าวๆ สงสารเด็ก,ครับ อุบาทว์มากครับไม่ว่ายังไงก็ตาม เปโดควรตายไห้หมดโลก อยู่ไปรกโลกป่าวๆ สงสารเด็ก,2025-11-08 17:05:14,"['ครับ', ' ', 'อุบาทว์', 'มาก', 'ครับ', 'ไม่', 'ว่า', 'ยังไง', 'ก็ตาม', ' ', 'เป', 'โด', 'ควร', 'ตาย', 'ไห้', 'หมด', 'โลก', ' ', 'อยู่', 'ไป', 'รกโลก', 'ป่าว', 'ๆ', ' ', 'สงสาร', 'เด็ก']"
1950093227643621675,twitter,post,https://x.com/crta_me/status/1950093227643621675,text,2025-07-29T07:17:11.000Z,selenium_x_scraper_v1,แค่ชอบอ่านนิยายไล่เราไปตุยเลยเหรอคะ  ทุกวันนี้เจอเด็กจริงๆนี่เดินหนีนะ,แค่ชอบอ่านนิยายไล่เราไปตุยเลยเหรอคะ  ทุกวันนี้เจอเด็กจริงๆนี่เดินหนีนะ,2025-11-08 17:05:14,"['แค่', 'ชอบ', 'อ่าน', 'นิยาย', 'ไล่', 'เรา', 'ไป', 'ตุ', 'ย', 'เลย', 'เหรอ', 'คะ', ' ', 'ทุกวันนี้', 'เจอ', 'เด็ก', 'จริงๆ', 'นี่', 'เดิน', 'หนี', 'นะ']"
1950089739211514035,twitter,post,https://x.com/imbobnotbob/status/1950089739211514035,text,2025-07-29T07:03:19.000Z,selenium_x_scraper_v1,พวกเปโดมันก้เริ่มเสพจากอะไรแบบนี้จนมันกลายเป็นความชอบไง หรือไม่จิง,พวกเปโดมันก้เริ่มเสพจากอะไรแบบนี้จนมันกลายเป็นความชอบไง หรือไม่จิง,2025-11-08 17:05:14,"['พวก', 'เป', 'โด', 'มัน', 'ก้', 'เริ่ม', 'เสพ', 'จาก', 'อะไร', 'แบบนี้', 'จน', 'มัน', 'กลายเป็น', 'ความชอบ', 'ไง', ' ', 'หรือไม่', 'จิง']"
1950092792610369651,twitter,post,https://x.com/crta_me/status/1950092792610369651,text,2025-07-29T07:15:27.000Z,selenium_x_scraper_v1,ลุงแก่ๆชอบหลอกเด็กเราว่าเขาก็ไม่นั่งอ่านฟิตหมาเด็กนะคะ คนจะเลวมันก็เลวอะ ยังงี้คนดูซูปเปอร์แมนไม่ปล่อยเลเซอร์กันหมดแล้วเหรอบ,ลุงแก่ๆชอบหลอกเด็กเราว่าเขาก็ไม่นั่งอ่านฟิตหมาเด็กนะคะ คนจะเลวมันก็เลวอะ ยังงี้คนดูซูปเปอร์แมนไม่ปล่อยเลเซอร์กันหมดแล้วเหรอบ,2025-11-08 17:05:14,"['ลุง', 'แก่ๆ', 'ชอบ', 'หลอก', 'เด็ก', 'เรา', 'ว่า', 'เขา', 'ก็', 'ไม่', 'นั่ง', 'อ่าน', 'ฟิต', 'หมา', 'เด็ก', 'นะคะ', ' ', 'คน', 'จะ', 'เลว', 'มัน', 'ก็', 'เลว', 'อะ', ' ', 'ยังงี้', 'คนดู', 'ซู', 'ป', 'เปอร์', 'แมน', 'ไม่', 'ปล่อย', 'เลเซอร์', 'กัน', 'หมด', 'แล้ว', 'เห', 'รอบ']"
1950092367450529826,twitter,post,https://x.com/crta_me/status/1950092367450529826,text,2025-07-29T07:13:46.000Z,selenium_x_scraper_v1,วิชานี้ได้หน่วยกิตไหมค้าเตง ตำรวจทวิต,วิชานี้ได้หน่วยกิตไหมค้าเตง ตำรวจทวิต,2025-11-08 17:05:14,"['วิชา', 'นี้', 'ได้', 'หน่วยกิต', 'ไหม', 'ค้า', 'เต', 'ง', ' ', 'ตำรวจ', 'ทวิ', 'ต']"
1950089276311674966,twitter,post,https://x.com/TaMa_09282/status/1950089276311674966,text,2025-07-29T07:01:29.000Z,selenium_x_scraper_v1,พี่รึป่าวที่เข้าใจผิดเกี่ยวมัน คำว่า หมาเด็กอะ จริงมันคือการอธิบายนิสัยคนๆนั้นไม่ใช่หรอที่ว่าไทป์หมาเด็ก หมาเด็กไม่ได้หมายถึงชอบ เด็กต่ำกว่า18นะ,พี่รึป่าวที่เข้าใจผิดเกี่ยวมัน คำว่า หมาเด็กอะ จริงมันคือการอธิบายนิสัยคนๆนั้นไม่ใช่หรอที่ว่าไทป์หมาเด็ก หมาเด็กไม่ได้หมายถึงชอบ เด็กต่ำกว่า18นะ,2025-11-08 17:05:14,"['พี่', 'รึ', 'ป่าว', 'ที่', 'เข้าใจผิด', 'เกี่ยว', 'มัน', ' ', 'คำ', 'ว่า', ' ', 'หมา', 'เด็ก', 'อะ', ' ', 'จริง', 'มัน', 'คือ', 'การอธิบาย', 'นิสัย', 'คน', 'ๆ', 'นั้น', 'ไม่', 'ใช่', 'หรอ', 'ที่ว่า', 'ไท', 'ป์', 'หมา', 'เด็ก', ' ', 'หมา', 'เด็ก', 'ไม่', 'ได้', 'หมายถึง', 'ชอบ', ' ', 'เด็ก', 'ต่ำกว่า', '18', 'นะ']"
1950092027980374506,twitter,post,https://x.com/crta_me/status/1950092027980374506,text,2025-07-29T07:12:25.000Z,selenium_x_scraper_v1,เราก็ชอบหมดแหละค่ะจะอายุเท่าไหร่ ก็มันนิยายอะ หมาเด็กก็คือหมาเด็กขี้อ้อน,เราก็ชอบหมดแหละค่ะจะอายุเท่าไหร่ ก็มันนิยายอะ หมาเด็กก็คือหมาเด็กขี้อ้อน,2025-11-08 17:05:14,"['เรา', 'ก็', 'ชอบ', 'หมด', 'แหละ', 'ค่ะ', 'จะ', 'อายุ', 'เท่าไหร่', ' ', 'ก็', 'มัน', 'นิยาย', 'อะ', ' ', 'หมา', 'เด็ก', 'ก็', 'คือ', 'หมา', 'เด็ก', 'ขี้อ้อน']"
1949496431724593403,twitter,post,https://x.com/GojiJung158/status/1949496431724593403,text,2025-07-27T15:45:43.000Z,selenium_x_scraper_v1,ในฐานะสาววาย คิดว่าทุกอันที่ว่ามาก็สมควรแล้ว สมองไหลมาทั้งปี โดนเตือนสติบ้างก็ดี ,ในฐานะสาววาย คิดว่าทุกอันที่ว่ามาก็สมควรแล้ว สมองไหลมาทั้งปี โดนเตือนสติบ้างก็ดี ,2025-11-08 17:05:14,"['ใน', 'ฐานะ', 'สาว', 'วาย', ' ', 'คิด', 'ว่า', 'ทุก', 'อัน', 'ที่ว่า', 'มา', 'ก็', 'สมควร', 'แล้ว', ' ', 'สมองไหล', 'มา', 'ทั้งปี', ' ', 'โดน', 'เตือนสติ', 'บ้าง', 'ก็ดี']"
1950089594516754744,twitter,post,https://x.com/crta_me/status/1950089594516754744,text,2025-07-29T07:02:44.000Z,selenium_x_scraper_v1,อ่านสนุกๆไม่ได้เลยเหรอคะ มันแบ่งต้องเหยียดขนาดนี้เลย ?,อ่านสนุกๆไม่ได้เลยเหรอคะ มันแบ่งต้องเหยียดขนาดนี้เลย ?,2025-11-08 17:05:14,"['อ่าน', 'สนุก', 'ๆ', 'ไม่', 'ได้', 'เลย', 'เหรอ', 'คะ', ' ', 'มัน', 'แบ่ง', 'ต้อง', 'เหยียด', 'ขนาด', 'นี้', 'เลย', ' ', '?']"
1950041547975659815,twitter,post,https://x.com/crta_me/status/1950041547975659815,text,2025-07-29T03:51:49.000Z,selenium_x_scraper_v1,เปโดคนไหนค้าาระบุชื่อทีค้า แค่ชอบหมาเด็กในฟิคเอง,เปโดคนไหนค้าาระบุชื่อทีค้า แค่ชอบหมาเด็กในฟิคเอง,2025-11-08 17:05:14,"['เป', 'โด', 'คน', 'ไหน', 'ค้า', 'า', 'ระบุชื่อ', 'ที', 'ค้า', ' ', 'แค่', 'ชอบ', 'หมา', 'เด็ก', 'ใน', 'ฟิค', 'เอง']"
1949994303872508136,twitter,post,https://x.com/threemeloti/status/1949994303872508136,text,2025-07-29T00:44:05.000Z,selenium_x_scraper_v1,ปกติของพวกเปโดมันก็จะฟินกับอะไรแบบนี้แล้วไล่คนอื่นแยกแยะแหละค่ะ,ปกติของพวกเปโดมันก็จะฟินกับอะไรแบบนี้แล้วไล่คนอื่นแยกแยะแหละค่ะ,2025-11-08 17:05:14,"['ปกติ', 'ของ', 'พวก', 'เป', 'โด', 'มัน', 'ก็', 'จะ', 'ฟิน', 'กับ', 'อะไร', 'แบบนี้', 'แล้ว', 'ไล่', 'คนอื่น', 'แยกแยะ', 'แหละ', 'ค่ะ']"
1950039203271590015,twitter,post,https://x.com/crta_me/status/1950039203271590015,text,2025-07-29T03:42:30.000Z,selenium_x_scraper_v1,ถ้านี่ดูหนังสงครามแล้วฟินถือว่าหนูเป็นมาโซไหมคะ,ถ้านี่ดูหนังสงครามแล้วฟินถือว่าหนูเป็นมาโซไหมคะ,2025-11-08 17:05:14,"['ถ้า', 'นี่', 'ดู', 'หนังสงคราม', 'แล้ว', 'ฟิน', 'ถือว่า', 'หนู', 'เป็นมา', 'โซ', 'ไหม', 'คะ']"
1949990365177795060,twitter,post,https://x.com/crta_me/status/1949990365177795060,text,2025-07-29T00:28:26.000Z,selenium_x_scraper_v1,ไม่อ้วกนะคะฟิน ว่าแต่พี่ไม่อายเหรอที่แยกความจริงกับเรื่องแต่งไม่ออก เด็กจริงมันอุอะ แต่ในฟิคเก,ไม่อ้วกนะคะฟิน ว่าแต่พี่ไม่อายเหรอที่แยกความจริงกับเรื่องแต่งไม่ออก เด็กจริงมันอุอะ แต่ในฟิคเก,2025-11-08 17:05:14,"['ไม่', 'อ้วก', 'นะคะ', 'ฟิน', ' ', 'ว่าแต่', 'พี่', 'ไม่', 'อาย', 'เหรอ', 'ที่', 'แยก', 'ความจริง', 'กับ', 'เรื่อง', 'แต่ง', 'ไม่', 'ออก', ' ', 'เด็ก', 'จริง', 'มัน', 'อุ', 'อะ', ' ', 'แต่', 'ใน', 'ฟิค', 'เก']"
1950038951818895628,twitter,post,https://x.com/crta_me/status/1950038951818895628,text,2025-07-29T03:41:30.000Z,selenium_x_scraper_v1,แช่งให้โลกแตกเลยค่ะแกก็มันฟินให้ทำไง,แช่งให้โลกแตกเลยค่ะแกก็มันฟินให้ทำไง,2025-11-08 17:05:14,"['แช่ง', 'ให้', 'โลก', 'แตก', 'เลย', 'ค่ะ', 'แกก็มันฟิน', 'ให้', 'ทำ', 'ไง']"
1949420694607183942,twitter,post,https://x.com/imtaecnat/status/1949420694607183942,text,2025-07-27T10:44:46.000Z,selenium_x_scraper_v1,ว่าก้ว่าเหอะ กุกลัวอะ รสแปลกๆเหมือนกำลังจะย้อนกลับไปจุดเดิม,ว่าก้ว่าเหอะ กุกลัวอะ รสแปลกๆเหมือนกำลังจะย้อนกลับไปจุดเดิม,2025-11-08 17:05:14,"['ว่า', 'ก้', 'ว่า', 'เหอะ', ' ', 'กุ', 'กลัว', 'อะ', ' ', 'รส', 'แปลก', 'ๆ', 'เหมือน', 'กำลังจะ', 'ย้อนกลับ', 'ไป', 'จุด', 'เดิม']"
1949528611792535704,twitter,post,https://x.com/imtaecnat/status/1949528611792535704,text,2025-07-27T17:53:36.000Z,selenium_x_scraper_v1,สลิ่มคลั่งชาติเดิมๆเริ่มกลับมาแสดงตัวเหมือนรอเวลาเรียกแค่นั้นแหละ ขอร้องล่ะ ไม่เอาแบบเดิมอีกแล้ว กลัวจะย้อนไปสมัยต้องยืนในโรงหนัง ต้องหยุดทุกครั้งที่เพลงชาติขี้น ไม่งั้นโดนตบ,สลิ่มคลั่งชาติเดิมๆเริ่มกลับมาแสดงตัวเหมือนรอเวลาเรียกแค่นั้นแหละ ขอร้องล่ะ ไม่เอาแบบเดิมอีกแล้ว กลัวจะย้อนไปสมัยต้องยืนในโรงหนัง ต้องหยุดทุกครั้งที่เพลงชาติขี้น ไม่งั้นโดนตบ,2025-11-08 17:05:14,"['สลิ่ม', 'คลั่ง', 'ชาติ', 'เดิม', 'ๆ', 'เริ่ม', 'กลับมา', 'แสดงตัว', 'เหมือน', 'รอเวลา', 'เรียก', 'แค่', 'นั้นแหละ', ' ', 'ขอร้อง', 'ล่ะ', ' ', 'ไม่', 'เอา', 'แบบ', 'เดิม', 'อีกแล้ว', ' ', 'กลัว', 'จะ', 'ย้อน', 'ไป', 'สมัย', 'ต้อง', 'ยืน', 'ใน', 'โรงหนัง', ' ', 'ต้อง', 'หยุด', 'ทุกครั้งที่', 'เพลงชาติ', 'ขี้', 'น', ' ', 'ไม่งั้น', 'โดน', 'ตบ']"
1949640214252814717,twitter,post,https://x.com/crta_me/status/1949640214252814717,text,2025-07-28T01:17:04.000Z,selenium_x_scraper_v1,ดีกว่าพวกสามกีบนะคะ วันๆไม่ช่วยอะไรประเทศเล่น x  ไปวันๆพิพม์ฉ่ำ ตินู้นตินี่ มีแต่คนที่คุณว่านี่แหละออกไปช่วยประเทศ,ดีกว่าพวกสามกีบนะคะ วันๆไม่ช่วยอะไรประเทศเล่น x  ไปวันๆพิพม์ฉ่ำ ตินู้นตินี่ มีแต่คนที่คุณว่านี่แหละออกไปช่วยประเทศ,2025-11-08 17:05:14,"['ดีกว่า', 'พวก', 'สาม', 'กีบ', 'นะคะ', ' ', 'วัน', 'ๆ', 'ไม่', 'ช่วย', 'อะไร', 'ประเทศ', 'เล่น', ' ', 'x', ' ', 'ไป', 'วัน', 'ๆพิพม์', 'ฉ่ำ', ' ', 'ติ', 'นู้น', 'ติ', 'นี่', ' ', 'มี', 'แต่', 'คน', 'ที่', 'คุณ', 'ว่า', 'นี่แหละ', 'ออก', 'ไป', 'ช่วย', 'ประเทศ']"
1945331284890550278,twitter,post,https://x.com/crta_me/status/1945331284890550278,text,2025-07-16T03:54:55.000Z,selenium_x_scraper_v1,นิสัยนี้นี่ผู้หญิงไปแล้ว90เปอ อาศัยเงินผู้ชายแต่ชอบโพสอวดรวย แอ๊บเป็นตัวมัมให้คนมาเยินยอ,นิสัยนี้นี่ผู้หญิงไปแล้ว90เปอ อาศัยเงินผู้ชายแต่ชอบโพสอวดรวย แอ๊บเป็นตัวมัมให้คนมาเยินยอ,2025-11-08 17:05:14,"['นิสัย', 'นี้', 'นี่', 'ผู้หญิง', 'ไป', 'แล้ว', '90', 'เปอ', ' ', 'อาศัย', 'เงิน', 'ผู้ชาย', 'แต่', 'ชอบ', 'โพส', 'อวดรวย', ' ', 'แอ๊บ', 'เป็นตัว', 'มัม', 'ให้', 'คน', 'มา', 'เยินยอ']"
1945330752826266012,twitter,post,https://x.com/crta_me/status/1945330752826266012,text,2025-07-16T03:52:48.000Z,selenium_x_scraper_v1,ผู้หญิงสมัยอยู่ได้ด้วยการพึงผู้ชาย ขนาดจะขายของยังต้องแวะมาด่าผู้ชายให้คนมาใจตัวเองอยู่เลย ทำแอ๊บเป็นตัวมัมตัวเฟียส,ผู้หญิงสมัยอยู่ได้ด้วยการพึงผู้ชาย ขนาดจะขายของยังต้องแวะมาด่าผู้ชายให้คนมาใจตัวเองอยู่เลย ทำแอ๊บเป็นตัวมัมตัวเฟียส,2025-11-08 17:05:14,"['ผู้หญิง', 'สมัย', 'อยู่', 'ได้', 'ด้วย', 'การ', 'พึง', 'ผู้ชาย', ' ', 'ขนาด', 'จะ', 'ขายของ', 'ยัง', 'ต้อง', 'แวะ', 'มา', 'ด่า', 'ผู้ชาย', 'ให้', 'คน', 'มา', 'ใจ', 'ตัวเอง', 'อยู่เลย', ' ', 'ทำ', 'แอ๊บ', 'เป็นตัว', 'มัม', 'ตัว', 'เฟียส']"
1945036666789314630,twitter,post,https://x.com/nammonxxxx/status/1945036666789314630,text,2025-07-15T08:24:13.000Z,selenium_x_scraper_v1,นี่ก็เคยโดนนอกใจ เลยเข้าใจ ความที่นอนสะดุ้งตื่นทุกคืน ฝันร้ายเกี่ยวกับเรื่องที่พบเจอมา คิดมากระแวงจนทำงานไม่ได้  โคตรเข้าใจคนที่โดนจริงๆอ่ะ ว่ามันทรมานยังไง เวลาเห็นข่าวแบบนี้ได้แต่ถามตัวเองว่า ยังต้องมีผู้หญิงอีกกี่คนที่ต้องทรอม่า แพนิค เพราะโดนนอกใจอ่ะ #onlymonday,นี่ก็เคยโดนนอกใจ เลยเข้าใจ ความที่นอนสะดุ้งตื่นทุกคืน ฝันร้ายเกี่ยวกับเรื่องที่พบเจอมา คิดมากระแวงจนทำงานไม่ได้  โคตรเข้าใจคนที่โดนจริงๆอ่ะ ว่ามันทรมานยังไง เวลาเห็นข่าวแบบนี้ได้แต่ถามตัวเองว่า ยังต้องมีผู้หญิงอีกกี่คนที่ต้องทรอม่า แพนิค เพราะโดนนอกใจอ่ะ #onlymonday,2025-11-08 17:05:14,"['นี่', 'ก็', 'เคย', 'โดน', 'นอกใจ', ' ', 'เลย', 'เข้าใจ', ' ', 'ความ', 'ที่นอน', 'สะดุ้งตื่น', 'ทุกคืน', ' ', 'ฝันร้าย', 'เกี่ยวกับ', 'เรื่อง', 'ที่', 'พบ', 'เจอ', 'มา', ' ', 'คิดมาก', 'ระแวง', 'จน', 'ทำงาน', 'ไม่', 'ได้', ' ', 'โคตร', 'เข้าใจ', 'คน', 'ที่', 'โดน', 'จริงๆ', 'อ่ะ', ' ', 'ว่า', 'มัน', 'ทรมาน', 'ยังไง', ' ', 'เวลา', 'เห็น', 'ข่าว', 'แบบนี้', 'ได้', 'แต่', 'ถาม', 'ตัวเอง', 'ว่า', ' ', 'ยัง', 'ต้อง', 'มี', 'ผู้หญิง', 'อีก', 'กี่', 'คน', 'ที่', 'ต้อง', 'ทรอ', 'ม่า', ' ', 'แพ', 'นิค', ' ', 'เพราะ', 'โดน', 'นอกใจ', 'อ่ะ']"
1945328894477009189,twitter,post,https://x.com/crta_me/status/1945328894477009189,text,2025-07-16T03:45:25.000Z,selenium_x_scraper_v1,ถ้าไม่สุดจริงๆผู้ชายเขาก็ไม่นอกใจหรอกค่ะ เขาคงทรมานมากๆมากกว่าคนโดนนอกใจด้วยซ้ำ,ถ้าไม่สุดจริงๆผู้ชายเขาก็ไม่นอกใจหรอกค่ะ เขาคงทรมานมากๆมากกว่าคนโดนนอกใจด้วยซ้ำ,2025-11-08 17:05:14,"['ถ้า', 'ไม่', 'สุด', 'จริงๆ', 'ผู้ชาย', 'เขา', 'ก็', 'ไม่', 'นอกใจ', 'หรอก', 'ค่ะ', ' ', 'เขา', 'คง', 'ทรมาน', 'มาก', 'ๆ', 'มากกว่า', 'คน', 'โดน', 'นอกใจ', 'ด้วยซ้ำ']"
