id,platform,platform_type,url,content_type,timestamp,scraper_module,text,raw_text,scrape_date,tokens
1980294975658311823,twitter,post,https://x.com/Chuwiduwha/status/1980294975658311823,text,2025-10-20T15:28:08.000Z,selenium_x_scraper_v1,"แต่ตัวเองพูดเองนี่ว่าคนปกติที่ไหนแต่งโป๊?? แสดงว่าจะโป๊ในไหนก็ไม่ปกตินิ5555555555

หรือจะหมายถึงถ่ายลงนิตยสารไรงี้?? โอ้ย อันนั้นยิ่งสาธารณะป้ะ? วางขายแบบโฉ่งฉ่าง จัดทงจัดท่าไรงี้ มันต่างไรกะเจนิส? เจนิสชีก็ใส่ไปงาน ชีแค่ต้องนั่งวิน","แต่ตัวเองพูดเองนี่ว่าคนปกติที่ไหนแต่งโป๊?? แสดงว่าจะโป๊ในไหนก็ไม่ปกตินิ5555555555

หรือจะหมายถึงถ่ายลงนิตยสารไรงี้?? โอ้ย อันนั้นยิ่งสาธารณะป้ะ? วางขายแบบโฉ่งฉ่าง จัดทงจัดท่าไรงี้ มันต่างไรกะเจนิส? เจนิสชีก็ใส่ไปงาน ชีแค่ต้องนั่งวิน",2025-11-29 08:18:55,"['แต่', 'ตัวเอง', 'พูด', 'เอง', 'นี่', 'ว่า', 'คน', 'ปกติ', 'ที่ไหน', 'แต่ง', 'โป๊', '?', ' ', 'แสดงว่า', 'จะ', 'โป๊', 'ใน', 'ไหน', 'ก็', 'ไม่', 'ปกติ', 'นิ', 'หัวเราะ', ' ', 'หรือ', 'จะ', 'หมายถึง', 'ถ่าย', 'ลง', 'นิตยสาร', 'ไร', 'งี้', '?', ' ', 'โอ้ย', ' ', 'อันนั้น', 'ยิ่ง', 'สาธารณะ', 'ป้ะ', '?', ' ', 'วางขาย', 'แบบ', 'โฉ่งฉ่าง', ' ', 'จัด', 'ทง', 'จัดท่า', 'ไร', 'งี้', ' ', 'มัน', 'ต่าง', 'ไร', 'กะ', 'เจ', 'นิ', 'ส', '?', ' ', 'เจ', 'นิ', 'ส', 'ชี', 'ก็', 'ใส่', 'ไป', 'งาน', ' ', 'ชี', 'แค่', 'ต้อง', 'นั่ง', 'วิน']"
1980295794558402680,twitter,post,https://x.com/thekingofotaku/status/1980295794558402680,text,2025-10-20T15:31:24.000Z,selenium_x_scraper_v1,"แล้วหนังสือมันสาธารณะไงวะ?
ไม่จ่ายไม่ได้เห็นน่ะโว้ย","แล้วหนังสือมันสาธารณะไงวะ?
ไม่จ่ายไม่ได้เห็นน่ะโว้ย",2025-11-29 08:18:55,"['แล้ว', 'หนังสือ', 'มัน', 'สาธารณะ', 'ไง', 'วะ', '?', ' ', 'ไม่', 'จ่าย', 'ไม่', 'ได้', 'เห็น', 'น่ะ', 'โว้ย']"
1980297528135594076,twitter,post,https://x.com/Chuwiduwha/status/1980297528135594076,text,2025-10-20T15:38:17.000Z,selenium_x_scraper_v1,เคยเห็นออฟฟิเชี่ยลโปรโมทพวกหนังสือแนวนี้ไหม คิดว่าเขาเอาตัวอย่างอะไรมาดึงให้คนซื้อ? แล้วคิดว่าเขาโพสต์ภาพตัวอย่างในไหน? เนี่ย ขนาดเสิร์ชแค่นี้ยังเจอภาพแบบไม่ต้องมีหนังสือในมือเลย ไม่สาธารณะเลยดิ,เคยเห็นออฟฟิเชี่ยลโปรโมทพวกหนังสือแนวนี้ไหม คิดว่าเขาเอาตัวอย่างอะไรมาดึงให้คนซื้อ? แล้วคิดว่าเขาโพสต์ภาพตัวอย่างในไหน? เนี่ย ขนาดเสิร์ชแค่นี้ยังเจอภาพแบบไม่ต้องมีหนังสือในมือเลย ไม่สาธารณะเลยดิ,2025-11-29 08:18:55,"['เคย', 'เห็น', 'ออฟ', 'ฟิเชี่ยล', 'โปรโมท', 'พวก', 'หนังสือ', 'แนว', 'นี้', 'ไหม', ' ', 'คิด', 'ว่า', 'เขา', 'เอา', 'ตัวอย่าง', 'อะไร', 'มา', 'ดึง', 'ให้', 'คนซื้อ', '?', ' ', 'แล้ว', 'คิด', 'ว่า', 'เขา', 'โพสต์', 'ภาพ', 'ตัวอย่าง', 'ใน', 'ไหน', '?', ' ', 'เนี่ย', ' ', 'ขนาด', 'เสิร์ช', 'แค่นี้', 'ยัง', 'เจอ', 'ภาพ', 'แบบ', 'ไม่ต้อง', 'มี', 'หนังสือ', 'ใน', 'มือ', 'เลย', ' ', 'ไม่', 'สาธารณะ', 'เลย', 'ดิ']"
1980195072890306872,twitter,post,https://x.com/Ijaehsul/status/1980195072890306872,text,2025-10-20T08:51:10.000Z,selenium_x_scraper_v1,แล้วมึงเคยอายตัวเองไหมวะ,แล้วมึงเคยอายตัวเองไหมวะ,2025-11-29 08:18:55,"['แล้ว', 'มึง', 'เคย', 'อาย', 'ตัวเอง', 'ไหม', 'วะ']"
1980196314093854770,twitter,post,https://x.com/thekingofotaku/status/1980196314093854770,text,2025-10-20T08:56:06.000Z,selenium_x_scraper_v1,"ถ้าผิดก็อาย 
มีใครเกิดมาไม่เคยผิดวะ?","ถ้าผิดก็อาย 
มีใครเกิดมาไม่เคยผิดวะ?",2025-11-29 08:18:55,"['ถ้า', 'ผิด', 'ก็', 'อาย', ' ', 'มี', 'ใคร', 'เกิด', 'มา', 'ไม่', 'เคย', 'ผิด', 'วะ', '?']"
1980150127605244171,twitter,post,https://x.com/praiiv1/status/1980150127605244171,text,2025-10-20T05:52:34.000Z,selenium_x_scraper_v1,ตลก เค้าจะแต่งตัวยังไงก็เรื่องของเค้า พ่อแม่จะอายไม่อายก็ไม่ต้องไปสาระแน ตัวเองยังคุกตามศิลปินอยู่เลย,ตลก เค้าจะแต่งตัวยังไงก็เรื่องของเค้า พ่อแม่จะอายไม่อายก็ไม่ต้องไปสาระแน ตัวเองยังคุกตามศิลปินอยู่เลย,2025-11-29 08:18:55,"['ตลก', ' ', 'เค้า', 'จะ', 'แต่งตัว', 'ยังไง', 'ก็', 'เรื่อง', 'ของ', 'เค้า', ' ', 'พ่อแม่', 'จะ', 'อาย', 'ไม่', 'อาย', 'ก็', 'ไม่ต้อง', 'ไป', 'สาระแน', ' ', 'ตัวเอง', 'ยัง', 'คุก', 'ตาม', 'ศิลปิน', 'อยู่เลย']"
1980150625938952580,twitter,post,https://x.com/thekingofotaku/status/1980150625938952580,text,2025-10-20T05:54:33.000Z,selenium_x_scraper_v1,กูคุกคามไงวะ?,กูคุกคามไงวะ?,2025-11-29 08:18:55,"['กู', 'คุกคาม', 'ไง', 'วะ', '?']"
1980688962403655719,twitter,post,https://x.com/cxegg45/status/1980688962403655719,text,2025-10-21T17:33:42.000Z,selenium_x_scraper_v1,ไม่นับความคิดจากโอตาคุเหม็นเปรี้ยวกูนใส่2Dครับ,ไม่นับความคิดจากโอตาคุเหม็นเปรี้ยวกูนใส่2Dครับ,2025-11-29 08:18:55,"['ไม่', 'นับ', 'ความคิด', 'จาก', 'โอ', 'ตา', 'คุ', 'เหม็นเปรี้ยว', 'กูน', 'ใส่', '2', 'd', 'ครับ']"
1980689131547373893,twitter,post,https://x.com/thekingofotaku/status/1980689131547373893,text,2025-10-21T17:34:23.000Z,selenium_x_scraper_v1,เรื่องของมึง,เรื่องของมึง,2025-11-29 08:18:55,"['เรื่อง', 'ของ', 'มึง']"
1980205525150400639,twitter,post,https://x.com/makamakamee/status/1980205525150400639,text,2025-10-20T09:32:42.000Z,selenium_x_scraper_v1,ไปยุ่งเรื่องของคนอื่นเนอะ รู้ได้ไงพ่อแม่คนอื่นจะอายอย่าหัวโบราณให้มันมาก,ไปยุ่งเรื่องของคนอื่นเนอะ รู้ได้ไงพ่อแม่คนอื่นจะอายอย่าหัวโบราณให้มันมาก,2025-11-29 08:18:55,"['ไป', 'ยุ่ง', 'เรื่อง', 'ของ', 'คนอื่น', 'เนอะ', ' ', 'รู้', 'ได้', 'ไง', 'พ่อแม่', 'คนอื่น', 'จะ', 'อาย', 'อย่า', 'หัวโบราณ', 'ให้', 'มัน', 'มาก']"
1980206809727246533,twitter,post,https://x.com/thekingofotaku/status/1980206809727246533,text,2025-10-20T09:37:48.000Z,selenium_x_scraper_v1,อ่าน,อ่าน,2025-11-29 08:18:55,['อ่าน']
1979881335163662681,twitter,post,https://x.com/nattypectothek/status/1979881335163662681,text,2025-10-19T12:04:29.000Z,selenium_x_scraper_v1,ผู้หญิงทุกคนบนโลกใบนี้ มีสิทธิ์ที่จะแต่งตัวแบบไหนก็ได้ให้เหมาะสมกับกาลเทศะ บ้านไหนมีลูกชาย หรือมีผัวที่ไม่ให้เกียรติลูกสาวคนอื่น ก็สมควรสั่งสอนหน่อยนะว่า ผช.ทุกคนไม่ควรคุกคามทางเพศผญ.ไม่ว่าจะด้วยวิธีใดๆทั้งสิ้น,ผู้หญิงทุกคนบนโลกใบนี้ มีสิทธิ์ที่จะแต่งตัวแบบไหนก็ได้ให้เหมาะสมกับกาลเทศะ บ้านไหนมีลูกชาย หรือมีผัวที่ไม่ให้เกียรติลูกสาวคนอื่น ก็สมควรสั่งสอนหน่อยนะว่า ผช.ทุกคนไม่ควรคุกคามทางเพศผญ.ไม่ว่าจะด้วยวิธีใดๆทั้งสิ้น,2025-11-29 08:18:55,"['ผู้หญิง', 'ทุกคน', 'บน', 'โลก', 'ใบ', 'นี้', ' ', 'มีสิทธิ์', 'ที่จะ', 'แต่งตัว', 'แบบ', 'ไหน', 'ก็ได้', 'ให้', 'เหมาะสม', 'กับ', 'กาลเทศะ', ' ', 'บ้าน', 'ไหน', 'มี', 'ลูกชาย', ' ', 'หรือ', 'มี', 'ผัว', 'ที่', 'ไม่', 'ให้เกียรติ', 'ลูกสาว', 'คนอื่น', ' ', 'ก็', 'สมควร', 'สั่งสอน', 'หน่อย', 'นะ', 'ว่า', ' ', 'ผช.', 'ทุกคน', 'ไม่', 'ควร', 'คุกคาม', 'ทางเพศ', 'ผญ.', 'ไม่', 'ว่า', 'จะ', 'ด้วย', 'วิธี', 'ใดๆ', 'ทั้งสิ้น']"
1980109011996561617,twitter,post,https://x.com/bearxmee/status/1980109011996561617,text,2025-10-20T03:09:11.000Z,selenium_x_scraper_v1,ชอบผู้หญิงนมหย่ายๆๆคัพ E แล้วยังกระแดะสำเร็จความใคร่ทางศิลธรรมแบบแปลกๆ ถ้านี่มีลูกชายละตั้งไบโอโซเชียลว่า ชอบผู้หญิงนมหย่ายๆๆคัพ E นี่ก็อายเหมือนกันจ้า ลูกหื่นกาม รักแร้เหม็นเปรี้ยว,ชอบผู้หญิงนมหย่ายๆๆคัพ E แล้วยังกระแดะสำเร็จความใคร่ทางศิลธรรมแบบแปลกๆ ถ้านี่มีลูกชายละตั้งไบโอโซเชียลว่า ชอบผู้หญิงนมหย่ายๆๆคัพ E นี่ก็อายเหมือนกันจ้า ลูกหื่นกาม รักแร้เหม็นเปรี้ยว,2025-11-29 08:18:55,"['ชอบ', 'ผู้หญิง', 'นม', 'หย่า', 'ยๆๆ', 'คัพ', ' ', 'e', ' ', 'แล้ว', 'ยัง', 'กระแดะ', 'สำเร็จความใคร่', 'ทาง', 'ศิล', 'ธรรม', 'แบบ', 'แปลก', 'ๆ', ' ', 'ถ้า', 'นี่', 'มี', 'ลูกชาย', 'ละ', 'ตั้ง', 'ไบโอ', 'โซเชียล', 'ว่า', ' ', 'ชอบ', 'ผู้หญิง', 'นม', 'หย่า', 'ยๆๆ', 'คัพ', ' ', 'e', ' ', 'นี่', 'ก็', 'อาย', 'เหมือนกัน', 'จ้า', ' ', 'ลูก', 'หื่น', 'กาม', ' ', 'รักแร้', 'เหม็นเปรี้ยว']"
1980072642674872561,twitter,post,https://x.com/MJ87948261/status/1980072642674872561,text,2025-10-20T00:44:40.000Z,selenium_x_scraper_v1,อันนี้คือไร เปรี้ยวอธิบายที,อันนี้คือไร เปรี้ยวอธิบายที,2025-11-29 08:18:55,"['อันนี้', 'คือ', 'ไร', ' ', 'เปรี้ยว', 'อธิบาย', 'ที']"
1979952766132064606,twitter,post,https://x.com/LOWSUGA55601229/status/1979952766132064606,text,2025-10-19T16:48:19.000Z,selenium_x_scraper_v1,ครับพี่ชายแท้ผู้รักสาว 2D ชอบผู้หญิงนมหย่ายๆๆๆ คัพE โคตรซิกม่าโคตรเดลต้าโคตรแกมม่าเลยครับ,ครับพี่ชายแท้ผู้รักสาว 2D ชอบผู้หญิงนมหย่ายๆๆๆ คัพE โคตรซิกม่าโคตรเดลต้าโคตรแกมม่าเลยครับ,2025-11-29 08:18:55,"['ครับ', 'พี่ชาย', 'แท้', 'ผู้', 'รัก', 'สาว', ' ', '2', 'd', ' ', 'ชอบ', 'ผู้หญิง', 'นม', 'หย่า', 'ยๆๆๆ', ' ', 'คัพ', 'e', ' ', 'โคตร', 'ซิก', 'ม่า', 'โคตร', 'เดลต้า', 'โคตร', 'แกมม่า', 'เลย', 'ครับ']"
1980008973106634856,twitter,post,https://x.com/SStayAAway/status/1980008973106634856,text,2025-10-19T20:31:40.000Z,selenium_x_scraper_v1,มึงเหมาะกับคำนี้มาก,มึงเหมาะกับคำนี้มาก,2025-11-29 08:18:55,"['มึง', 'เหมาะกับ', 'คำ', 'นี้', 'มาก']"
1979937128218841581,twitter,post,https://x.com/gwwbank/status/1979937128218841581,text,2025-10-19T15:46:11.000Z,selenium_x_scraper_v1,"โลก มืงยังอยู่ในกะลา อยู่เลย ใช่มั้ย 
เค้าจะใส่เสื้อ สั้นแค่ไหน บางแค่ไหน ถ้าตราบใด มันยังไม่เห็นนม เห็นหี ยังถือว่า ไม่อนาจาร และเป็นสิทธิของเค้า คนอื่นไม่ต้อง ไปเสือกห่วงเค้า เก็บไว้ห่วง คนในครอบครัวมืงจ่ะ ( ถ้าคนในครอบครัวมืงยอมให้ห่วงนะ ) 
เค้าโตมาขนาดนี้แล้ว ดูแลตนเองได้","โลก มืงยังอยู่ในกะลา อยู่เลย ใช่มั้ย 
เค้าจะใส่เสื้อ สั้นแค่ไหน บางแค่ไหน ถ้าตราบใด มันยังไม่เห็นนม เห็นหี ยังถือว่า ไม่อนาจาร และเป็นสิทธิของเค้า คนอื่นไม่ต้อง ไปเสือกห่วงเค้า เก็บไว้ห่วง คนในครอบครัวมืงจ่ะ ( ถ้าคนในครอบครัวมืงยอมให้ห่วงนะ ) 
เค้าโตมาขนาดนี้แล้ว ดูแลตนเองได้",2025-11-29 08:18:55,"['โลก', ' ', 'มืง', 'ยังอยู่', 'ใน', 'กะลา', ' ', 'อยู่เลย', ' ', 'ใช่', 'มั้ย', ' ', 'เค้า', 'จะ', 'ใส่', 'เสื้อ', ' ', 'สั้น', 'แค่', 'ไหน', ' ', 'บาง', 'แค่', 'ไหน', ' ', 'ถ้า', 'ตราบใด', ' ', 'มัน', 'ยัง', 'ไม่', 'เห็น', 'นม', ' ', 'เห็น', 'หี', ' ', 'ยัง', 'ถือว่า', ' ', 'ไม่', 'อนาจาร', ' ', 'และ', 'เป็น', 'สิทธิ', 'ของ', 'เค้า', ' ', 'คนอื่น', 'ไม่ต้อง', ' ', 'ไป', 'เสือก', 'ห่วง', 'เค้า', ' ', 'เก็บ', 'ไว้', 'ห่วง', ' ', 'คนใน', 'ครอบครัว', 'มืงจ่ะ', ' ', 'ถ้า', 'คนใน', 'ครอบครัว', 'มืง', 'ยอมให้', 'ห่วง', 'นะ', ' ', 'เค้า', 'โตมา', 'ขนาด', 'นี้', 'แล้ว', ' ', 'ดูแล', 'ตนเอง', 'ได้']"
1979868293298286948,twitter,post,https://x.com/LeeLazjkzo10336/status/1979868293298286948,text,2025-10-19T11:12:39.000Z,selenium_x_scraper_v1,เต็มป่ะ ไอ้โอตาคุตัวเหม็น,เต็มป่ะ ไอ้โอตาคุตัวเหม็น,2025-11-29 08:18:55,"['เต็ม', 'ป่ะ', ' ', 'ไอ้', 'โอ', 'ตา', 'คุ', 'ตัว', 'เหม็น']"
1979871051984322665,twitter,post,https://x.com/f3020111/status/1979871051984322665,text,2025-10-19T11:23:37.000Z,selenium_x_scraper_v1,เขาจะทำอะไรก็ให้เขาทำเถอะ กูเชื่อว่าคนเรามีวุฒิภาวะพอจะแยกแยะได้ เขาถึงบอกตลอดว่าควรมีวิจารณญาณในการรับชมสื่ออยู่เสมอ ส่วนมึงก็กลับไปอยู่โลกเบียวๆของมึงเถอะ อย่าออกมาเพ้อเจ้อแถวนี้เลย ถ้าป่วยก็ลองไปหาหมอ อย่ามาทำตัวหัวควยอยู่แถวนี้,เขาจะทำอะไรก็ให้เขาทำเถอะ กูเชื่อว่าคนเรามีวุฒิภาวะพอจะแยกแยะได้ เขาถึงบอกตลอดว่าควรมีวิจารณญาณในการรับชมสื่ออยู่เสมอ ส่วนมึงก็กลับไปอยู่โลกเบียวๆของมึงเถอะ อย่าออกมาเพ้อเจ้อแถวนี้เลย ถ้าป่วยก็ลองไปหาหมอ อย่ามาทำตัวหัวควยอยู่แถวนี้,2025-11-29 08:18:55,"['เขา', 'จะ', 'ทำ', 'อะไร', 'ก็', 'ให้', 'เขา', 'ทำ', 'เถอะ', ' ', 'กู', 'เชื่อ', 'ว่า', 'คนเรา', 'มี', 'วุฒิภาวะ', 'พอ', 'จะ', 'แยกแยะ', 'ได้', ' ', 'เขา', 'ถึง', 'บอก', 'ตลอด', 'ว่า', 'ควร', 'มี', 'วิจารณญาณ', 'ใน', 'การ', 'รับ', 'ชม', 'สื่อ', 'อยู่', 'เสมอ', ' ', 'ส่วน', 'มึง', 'ก็', 'กลับ', 'ไป', 'อยู่', 'โลก', 'เบียวๆ', 'ของ', 'มึง', 'เถอะ', ' ', 'อย่า', 'ออกมา', 'เพ้อเจ้อ', 'แถว', 'นี้', 'เลย', ' ', 'ถ้า', 'ป่วย', 'ก็', 'ลอง', 'ไปหา', 'หมอ', ' ', 'อย่า', 'มา', 'ทำตัว', 'หัว', 'ควย', 'อยู่', 'แถว', 'นี้']"
1979887868157059361,twitter,post,https://x.com/XalFa3381/status/1979887868157059361,text,2025-10-19T12:30:26.000Z,selenium_x_scraper_v1,สาระเนอะอีดอก สมองเนี่ยไม่ได้กลั้นออกมาเลยใช่ไหม ถึงได้มีแต่ความคิดที่มีแต่ขี้เนอะอีนอกคอก,สาระเนอะอีดอก สมองเนี่ยไม่ได้กลั้นออกมาเลยใช่ไหม ถึงได้มีแต่ความคิดที่มีแต่ขี้เนอะอีนอกคอก,2025-11-29 08:18:55,"['สาระ', 'เนอะ', 'อีดอก', ' ', 'สมอง', 'เนี่ย', 'ไม่', 'ได้', 'กลั้น', 'ออกมา', 'เลย', 'ใช่ไหม', ' ', 'ถึง', 'ได้', 'มี', 'แต่', 'ความคิด', 'ที่', 'มี', 'แต่', 'ขี้', 'เนอะ', 'อี', 'นอกคอก']"
1980209871665664189,twitter,post,https://x.com/deadwhiteflower/status/1980209871665664189,text,2025-10-20T09:49:58.000Z,selenium_x_scraper_v1,สาระแนจริงๆอีโอตาคุเหม็นเปรี้ยว ควบคุมควยตัวเองไม่ได้เสือกมาโทษคนอื่น ตรรกะชายแท้เห็นแก่ตัว สมองควายๆ อีสัส ใช้ชีวิตอยู่หลังเขาเหรอถึงไม่รู้ว่าการแต่งตัวแบบนี้มันปกติ คนเราสามารถชื่นชมการแต่งตัวคนอื่นได้โดยไม่ส่อไปทางเพศ แต่ในแอพฟ้ามีแต่สถุลๆ อุบาทว์,สาระแนจริงๆอีโอตาคุเหม็นเปรี้ยว ควบคุมควยตัวเองไม่ได้เสือกมาโทษคนอื่น ตรรกะชายแท้เห็นแก่ตัว สมองควายๆ อีสัส ใช้ชีวิตอยู่หลังเขาเหรอถึงไม่รู้ว่าการแต่งตัวแบบนี้มันปกติ คนเราสามารถชื่นชมการแต่งตัวคนอื่นได้โดยไม่ส่อไปทางเพศ แต่ในแอพฟ้ามีแต่สถุลๆ อุบาทว์,2025-11-29 08:18:55,"['สาระแน', 'จริงๆ', 'อี', 'โอ', 'ตา', 'คุ', 'เหม็นเปรี้ยว', ' ', 'ควบคุม', 'ควย', 'ตัวเอง', 'ไม่', 'ได้', 'เสือก', 'มา', 'โทษ', 'คนอื่น', ' ', 'ตรรกะ', 'ชาย', 'แท้', 'เห็นแก่ตัว', ' ', 'สมอง', 'ควาย', 'ๆ', ' ', 'อี', 'สัส', ' ', 'ใช้ชีวิต', 'อยู่', 'หลังเขา', 'เหรอ', 'ถึง', 'ไม่', 'รู้', 'ว่าการ', 'แต่งตัว', 'แบบนี้', 'มัน', 'ปกติ', ' ', 'คนเรา', 'สามารถ', 'ชื่นชม', 'การ', 'แต่งตัว', 'คนอื่น', 'ได้', 'โดย', 'ไม่', 'ส่อ', 'ไป', 'ทางเพศ', ' ', 'แต่', 'ใน', 'แอพ', 'ฟ้า', 'มี', 'แต่', 'สถุล', 'ๆ', ' ', 'อุบาทว์']"
1980050751209849170,twitter,post,https://x.com/maomao66280613/status/1980050751209849170,text,2025-10-19T23:17:41.000Z,selenium_x_scraper_v1,ดูจากการตอบกลับแล้วมีความคิดวิปริตสมเป็นพวก โอตาคุ,ดูจากการตอบกลับแล้วมีความคิดวิปริตสมเป็นพวก โอตาคุ,2025-11-29 08:18:55,"['ดู', 'จาก', 'การ', 'ตอบกลับ', 'แล้ว', 'มี', 'ความคิด', 'วิปริต', 'สม', 'เป็น', 'พวก', ' ', 'โอ', 'ตา', 'คุ']"
