id,platform,platform_type,url,content_type,timestamp,scraper_module,text,raw_text,scrape_date,tokens
1958073464557875530,twitter,post,https://x.com/coreleeone/status/1958073464557875530,text,2025-08-20T07:47:47.000Z,selenium_x_scraper_v1,ปลาวาฬจะเกยตื้นที่ใครอ่า,ปลาวาฬจะเกยตื้นที่ใครอ่า,2025-11-08 17:05:14,"['ปลาวาฬ', 'จะ', 'เกย', 'ตื้น', 'ที่', 'ใคร', 'อ่า']"
1958118247855001922,twitter,post,https://x.com/nolopo3265/status/1958118247855001922,text,2025-08-20T10:45:45.000Z,selenium_x_scraper_v1,วาสนาผมนิล่ะครับ เดี๋ยวรอน้องเขาเรียนจบจะให้แม่ไปขอ,วาสนาผมนิล่ะครับ เดี๋ยวรอน้องเขาเรียนจบจะให้แม่ไปขอ,2025-11-08 17:05:14,"['วาสนา', 'ผม', 'นิ', 'ล่ะ', 'ครับ', ' ', 'เดี๋ยว', 'รอ', 'น้อง', 'เขา', 'เรียนจบ', 'จะ', 'ให้', 'แม่', 'ไป', 'ขอ']"
1957545563458793779,twitter,post,https://x.com/skinsmonkey/status/1957545563458793779,text,2025-08-18T20:50:06.000Z,selenium_x_scraper_v1,A 76-year-old streamer pulled off an ACE in CS2 ,A 76-year-old streamer pulled off an ACE in CS2 ,2025-11-08 17:05:14,"['a', ' ', '76', ' ', 'year', ' ', 'old', ' ', 'streamer', ' ', 'pulled', ' ', 'off', ' ', 'an', ' ', 'ace', ' ', 'in', ' ', 'cs', '2']"
1958009898823795164,twitter,post,https://x.com/nolopo3265/status/1958009898823795164,text,2025-08-20T03:35:12.000Z,selenium_x_scraper_v1,เผลอๆมีรอบ2,เผลอๆมีรอบ2,2025-11-08 17:05:14,"['เผลอ', 'ๆ', 'มี', 'รอบ', '2']"
1957988804482199989,twitter,post,https://x.com/ApitsAdA_hiend/status/1957988804482199989,text,2025-08-20T02:11:23.000Z,selenium_x_scraper_v1,"ตามบ้านนอกเอเย่นเขาจะเรียกว่า""คอก""ที่มาจากคำว่า""ม้า""น่ะค่ะ","ตามบ้านนอกเอเย่นเขาจะเรียกว่า""คอก""ที่มาจากคำว่า""ม้า""น่ะค่ะ",2025-11-08 17:05:14,"['ตาม', 'บ้านนอก', 'เอ', 'เย่น', 'เขา', 'จะ', 'เรียก', 'ว่า', ' ', 'คอก', ' ', 'ที่', 'มาจาก', 'คำ', 'ว่า', ' ', 'ม้า', ' ', 'น่ะ', 'ค่ะ']"
1957994913804480848,twitter,post,https://x.com/nolopo3265/status/1957994913804480848,text,2025-08-20T02:35:39.000Z,selenium_x_scraper_v1,อ๋อ สมัยนี้เขาไม่ดูดกันละครับม้ามันเชย เดี๋ยวนี้เขาดูดม้าลายกัน,อ๋อ สมัยนี้เขาไม่ดูดกันละครับม้ามันเชย เดี๋ยวนี้เขาดูดม้าลายกัน,2025-11-08 17:05:14,"['อ๋อ', ' ', 'สมัยนี้', 'เขา', 'ไม่', 'ดูด', 'กัน', 'ละ', 'ครับ', 'ม้า', 'มัน', 'เชย', ' ', 'เดี๋ยวนี้', 'เขา', 'ดูด', 'ม้าลาย', 'กัน']"
1957975179746738486,twitter,post,https://x.com/nolopo3265/status/1957975179746738486,text,2025-08-20T01:17:14.000Z,selenium_x_scraper_v1,สาวก นะครับน้องโฟตาเย็น,สาวก นะครับน้องโฟตาเย็น,2025-11-08 17:05:14,"['สาวก', ' ', 'นะ', 'ครับ', 'น้อง', 'โฟ', 'ตา', 'เย็น']"
1957460981845787061,twitter,post,https://x.com/Thaireactionvid/status/1957460981845787061,text,2025-08-18T15:14:00.000Z,selenium_x_scraper_v1,อีดอกตัดจริง ไม่ใช่ตัวแสดงเวอร์  พวกนอกใจมันต้องโดน,อีดอกตัดจริง ไม่ใช่ตัวแสดงเวอร์  พวกนอกใจมันต้องโดน,2025-11-08 17:05:14,"['อีดอก', 'ตัด', 'จริง', ' ', 'ไม่', 'ใช่', 'ตัวแสดง', 'เวอร์', ' ', 'พวก', 'นอกใจ', 'มัน', 'ต้อง', 'โดน']"
1957701300931408217,twitter,post,https://x.com/eclairsssy/status/1957701300931408217,text,2025-08-19T07:08:57.000Z,selenium_x_scraper_v1,อันนี้สงสัยน้า ม่ายได้จาเข้าข้างอีผช ละถ้าโดนตัดเขาจะทำไงต่อ ทำท่อฉี่แบบใหม่หรอคะ แบบไม่ใช่ทั้งจิ๋มและจู๋,อันนี้สงสัยน้า ม่ายได้จาเข้าข้างอีผช ละถ้าโดนตัดเขาจะทำไงต่อ ทำท่อฉี่แบบใหม่หรอคะ แบบไม่ใช่ทั้งจิ๋มและจู๋,2025-11-08 17:05:14,"['อันนี้', 'สงสัย', 'น้า', ' ', 'ม่าย', 'ได้', 'จา', 'เข้าข้าง', 'อี', 'ผช', ' ', 'ละ', 'ถ้า', 'โดน', 'ตัด', 'เขา', 'จะ', 'ทำ', 'ไง', 'ต่อ', ' ', 'ทำ', 'ท่อ', 'ฉี่', 'แบบ', 'ใหม่', 'หรอ', 'คะ', ' ', 'แบบ', 'ไม่', 'ใช่', 'ทั้ง', 'จิ๋ม', 'และ', 'จู๋']"
1957947997679153342,twitter,post,https://x.com/nolopo3265/status/1957947997679153342,text,2025-08-19T23:29:14.000Z,selenium_x_scraper_v1,ไปเป็นขันทีครับ,ไปเป็นขันทีครับ,2025-11-08 17:05:14,"['ไป', 'เป็น', 'ขันที', 'ครับ']"
1957739166487441890,twitter,post,https://x.com/Skyboyz15/status/1957739166487441890,text,2025-08-19T09:39:24.000Z,selenium_x_scraper_v1,"กลับไปซะ 
ภาพนายทหารหญิงไทยชี้นี้วออกคำสั่งให้ทหารเขมรถอยกลับไปยังที่ตั้งที่ช่องอานม้าฝั่งเขมร เพราะโวยวายไม่หยุด และมีอาการที่สงบลงหลังจากนั้นไม่นาน 
#ทหารไทย #ทหารหญิง #ทหารกัมพูชา
#TruthFromThailand #ไทยกัมพูชา
#ชายแดนไทยกัมพูชา #ช่องอานม้า","กลับไปซะ 
ภาพนายทหารหญิงไทยชี้นี้วออกคำสั่งให้ทหารเขมรถอยกลับไปยังที่ตั้งที่ช่องอานม้าฝั่งเขมร เพราะโวยวายไม่หยุด และมีอาการที่สงบลงหลังจากนั้นไม่นาน 
#ทหารไทย #ทหารหญิง #ทหารกัมพูชา
#TruthFromThailand #ไทยกัมพูชา
#ชายแดนไทยกัมพูชา #ช่องอานม้า",2025-11-08 17:05:14,"['กลับ', 'ไป', 'ซะ', ' ', 'ภาพ', 'นายทหาร', 'หญิง', 'ไทย', 'ชี้', 'นี้', 'วอ', 'อก', 'คำสั่ง', 'ให้', 'ทหาร', 'เขมร', 'ถอยกลับ', 'ไป', 'ยัง', 'ที่ตั้ง', 'ที่', 'ช่อง', 'อานม้า', 'ฝั่ง', 'เขมร', ' ', 'เพราะ', 'โวยวาย', 'ไม่', 'หยุด', ' ', 'และ', 'มี', 'อาการ', 'ที่', 'สงบ', 'ลง', 'หลังจากนั้น', 'ไม่', 'นาน', ' ', 'ทหาร', 'ไทย', ' ', 'ทหาร', 'หญิง', ' ', 'ทหาร', 'กัมพูชา', ' ', 'ไทย', 'กัมพูชา', ' ', 'ชายแดน', 'ไทย', 'กัมพูชา', ' ', 'ช่อง', 'อานม้า']"
1957917088292671704,twitter,post,https://x.com/nolopo3265/status/1957917088292671704,text,2025-08-19T21:26:24.000Z,selenium_x_scraper_v1,ทำไมไม่เอามะกอกสับหัวมันสักทีหมั่นไส้ว่ะ,ทำไมไม่เอามะกอกสับหัวมันสักทีหมั่นไส้ว่ะ,2025-11-08 17:05:14,"['ทำไม', 'ไม่', 'เอา', 'มะกอก', 'สับ', 'หัวมัน', 'สักที', 'หมั่นไส้', 'ว่ะ']"
1957483576527818960,twitter,post,https://x.com/Catter65422769/status/1957483576527818960,text,2025-08-18T16:43:47.000Z,selenium_x_scraper_v1,"ปืนไทย คชสีห์ MOD2020 และ SAN9 

สำนักงานปลัดกระทรวงกลาโหม ร่วมกับ กองทัพไทย จะจัดการทดสอบการใช้อาวุธทางยุทธวิธีด้วยปืน MOD2020 ขนาด 5.56X45 มม. และปืนพก 9 มม. แบบ SAN9 ที่ประเทศไทยพัฒนาขึ้นเอง ในวันอังคารที่ 9 กันยายนนี้ ระหว่างเวลา 08.00 - 17.00 น.","ปืนไทย คชสีห์ MOD2020 และ SAN9 

สำนักงานปลัดกระทรวงกลาโหม ร่วมกับ กองทัพไทย จะจัดการทดสอบการใช้อาวุธทางยุทธวิธีด้วยปืน MOD2020 ขนาด 5.56X45 มม. และปืนพก 9 มม. แบบ SAN9 ที่ประเทศไทยพัฒนาขึ้นเอง ในวันอังคารที่ 9 กันยายนนี้ ระหว่างเวลา 08.00 - 17.00 น.",2025-11-08 17:05:14,"['ปืน', 'ไทย', ' ', 'คชสีห์', ' ', 'mod', '2020', ' ', 'และ', ' ', 'san', '9', ' ', 'สำนักงานปลัดกระทรวง', 'กลาโหม', ' ', 'ร่วมกับ', ' ', 'กองทัพ', 'ไทย', ' ', 'จะ', 'จัดการ', 'ทดสอบ', 'การ', 'ใช้', 'อาวุธ', 'ทาง', 'ยุทธวิธี', 'ด้วย', 'ปืน', ' ', 'mod', '2020', ' ', 'ขนาด', ' ', '5.56', 'x', '45', ' ', 'มม.', ' ', 'และ', 'ปืนพก', ' ', '9', ' ', 'มม.', ' ', 'แบบ', ' ', 'san', '9', ' ', 'ที่', 'ประเทศ', 'ไทย', 'พัฒนา', 'ขึ้น', 'เอง', ' ', 'ใน', 'วัน', 'อังคาร', 'ที่', ' ', '9', ' ', 'กันยายน', 'นี้', ' ', 'ระหว่าง', 'เวลา', ' ', '08.00', ' ', '17.00', ' ', 'น.']"
1957186436127752232,twitter,post,https://x.com/nolopo3265/status/1957186436127752232,text,2025-08-17T21:03:03.000Z,selenium_x_scraper_v1,เกือบจะซึ้งแล้ว เห็นอย่างที่ผมเห็นใช่มั้ย,เกือบจะซึ้งแล้ว เห็นอย่างที่ผมเห็นใช่มั้ย,2025-11-08 17:05:14,"['เกือบจะ', 'ซึ้ง', 'แล้ว', ' ', 'เห็น', 'อย่าง', 'ที่', 'ผม', 'เห็น', 'ใช่', 'มั้ย']"
1957707454634160310,twitter,post,https://x.com/coreleeone/status/1957707454634160310,text,2025-08-19T07:33:24.000Z,selenium_x_scraper_v1,คุยปลาวาฬกันคับ,คุยปลาวาฬกันคับ,2025-11-08 17:05:14,"['คุย', 'ปลาวาฬ', 'กัน', 'คับ']"
1957708771851170037,twitter,post,https://x.com/nolopo3265/status/1957708771851170037,text,2025-08-19T07:38:38.000Z,selenium_x_scraper_v1,น่ารักจริงครับน้องปลาวาฬ,น่ารักจริงครับน้องปลาวาฬ,2025-11-08 17:05:14,"['น่า', 'รักจริง', 'ครับ', 'น้อง', 'ปลาวาฬ']"
1957705853789958211,twitter,post,https://x.com/nolopo3265/status/1957705853789958211,text,2025-08-19T07:27:02.000Z,selenium_x_scraper_v1,ฮิ้ววว~,ฮิ้ววว~,2025-11-08 17:05:14,['ฮิ้ววว']
1957475722949439825,twitter,post,https://x.com/coreleeone/status/1957475722949439825,text,2025-08-18T16:12:35.000Z,selenium_x_scraper_v1,Dmได้ไหมคับท่าน,Dmได้ไหมคับท่าน,2025-11-08 17:05:14,"['dm', 'ได้', 'ไหม', 'คับ', 'ท่าน']"
1957609760150417857,twitter,post,https://x.com/nolopo3265/status/1957609760150417857,text,2025-08-19T01:05:12.000Z,selenium_x_scraper_v1,ครับว่า,ครับว่า,2025-11-08 17:05:14,"['ครับ', 'ว่า']"
1957364279449153919,twitter,post,https://x.com/coreleeone/status/1957364279449153919,text,2025-08-18T08:49:44.000Z,selenium_x_scraper_v1,ขาวเนียนจัดคนนี้ที่สุด,ขาวเนียนจัดคนนี้ที่สุด,2025-11-08 17:05:14,"['ขาว', 'เนียน', 'จัด', 'คน', 'นี้', 'ที่สุด']"
1957475991254974875,twitter,post,https://x.com/coreleeone/status/1957475991254974875,text,2025-08-18T16:13:39.000Z,selenium_x_scraper_v1,แม่เริงดุหวงลูกสาวนะค้าบบบบ,แม่เริงดุหวงลูกสาวนะค้าบบบบ,2025-11-08 17:05:14,"['แม่', 'เริง', 'ดุ', 'หวง', 'ลูก', 'สาวนะ', 'ค้าบ', 'บบบ']"
1957479995242406387,twitter,post,https://x.com/nolopo3265/status/1957479995242406387,text,2025-08-18T16:29:33.000Z,selenium_x_scraper_v1,แม่อย่างดุ555,แม่อย่างดุ555,2025-11-08 17:05:14,"['แม่', 'อย่าง', 'ดุ', 'หัวเราะ']"
1957474387059421678,twitter,post,https://x.com/nolopo3265/status/1957474387059421678,text,2025-08-18T16:07:16.000Z,selenium_x_scraper_v1,เดี๋ยวมันก็งอกออกมาใหม่เหมือนหางจิ้งจกอ่ะ,เดี๋ยวมันก็งอกออกมาใหม่เหมือนหางจิ้งจกอ่ะ,2025-11-08 17:05:14,"['เดี๋ยว', 'มัน', 'ก็', 'งอก', 'ออกมา', 'ใหม่', 'เหมือน', 'หาง', 'จิ้งจก', 'อ่ะ']"
1957026943645409302,twitter,post,https://x.com/happymonreturn/status/1957026943645409302,text,2025-08-17T10:29:17.000Z,selenium_x_scraper_v1,เค้ก,เค้ก,2025-11-08 17:05:14,['เค้ก']
1957467284617810038,twitter,post,https://x.com/nolopo3265/status/1957467284617810038,text,2025-08-18T15:39:03.000Z,selenium_x_scraper_v1,ตาฮักขนาด,ตาฮักขนาด,2025-11-08 17:05:14,"['ตา', 'ฮัก', 'ขนาด']"
1957418138515234943,twitter,post,https://x.com/nolopo3265/status/1957418138515234943,text,2025-08-18T12:23:45.000Z,selenium_x_scraper_v1,เรื่องนี้ก็สนุก ไอ้เด็กผู้หญิงอ่ะชื่อข้าวเหนียว จะไปตามหาหมาชื่อหมูปิ้ง แล้วชวนไอ้คนใส่แว่นไปตาหาหมาปรากฏว่าหลงทาง เลยไปขอข้าววัดกิน อยู่วัดเป็นปีเลยนะ แล้วเกิดวันหนึ่งมีผู้ใหญ่ใจดีจะไปรับเลี้ยงแต่ที่จริงแล้วเป็นรถตู้จับเด็ก ไปหาดูเอาชื่อเรื่องข้าวเหนียวหมูปิ้ง,เรื่องนี้ก็สนุก ไอ้เด็กผู้หญิงอ่ะชื่อข้าวเหนียว จะไปตามหาหมาชื่อหมูปิ้ง แล้วชวนไอ้คนใส่แว่นไปตาหาหมาปรากฏว่าหลงทาง เลยไปขอข้าววัดกิน อยู่วัดเป็นปีเลยนะ แล้วเกิดวันหนึ่งมีผู้ใหญ่ใจดีจะไปรับเลี้ยงแต่ที่จริงแล้วเป็นรถตู้จับเด็ก ไปหาดูเอาชื่อเรื่องข้าวเหนียวหมูปิ้ง,2025-11-08 17:05:14,"['เรื่อง', 'นี้', 'ก็', 'สนุก', ' ', 'ไอ้', 'เด็กผู้หญิง', 'อ่ะ', 'ชื่อ', 'ข้าวเหนียว', ' ', 'จะ', 'ไป', 'ตามหา', 'หมา', 'ชื่อ', 'หมู', 'ปิ้ง', ' ', 'แล้ว', 'ชวน', 'ไอ้', 'คน', 'ใส่', 'แว่น', 'ไป', 'ตา', 'หา', 'หมา', 'ปรากฏ', 'ว่า', 'หลงทาง', ' ', 'เลย', 'ไป', 'ขอ', 'ข้าว', 'วัด', 'กิน', ' ', 'อยู่', 'วัด', 'เป็น', 'ปี', 'เลย', 'นะ', ' ', 'แล้ว', 'เกิด', 'วันหนึ่ง', 'มี', 'ผู้ใหญ่', 'ใจดี', 'จะ', 'ไป', 'รับ', 'เลี้ยง', 'แต่', 'ที่จริง', 'แล้ว', 'เป็น', 'รถตู้', 'จับ', 'เด็ก', ' ', 'ไปหา', 'ดู', 'เอา', 'ชื่อเรื่อง', 'ข้าวเหนียว', 'หมู', 'ปิ้ง']"
1957461534684467668,twitter,post,https://x.com/nolopo3265/status/1957461534684467668,text,2025-08-18T15:16:12.000Z,selenium_x_scraper_v1,แอ่น ไม่ใช่ข้าวเหนียวหมูปิ้ง แอ่น แอ่น,แอ่น ไม่ใช่ข้าวเหนียวหมูปิ้ง แอ่น แอ่น,2025-11-08 17:05:14,"['แอ่น', ' ', 'ไม่', 'ใช่', 'ข้าวเหนียว', 'หมู', 'ปิ้ง', ' ', 'แอ่น', ' ', 'แอ่น']"
1957456476944965880,twitter,post,https://x.com/nolopo3265/status/1957456476944965880,text,2025-08-18T14:56:06.000Z,selenium_x_scraper_v1,ถ้าสมมุติว่าพี่จีบน้องวาฬไม่ติด งั้นพี่ขอจีบแม่น้องวาฬแทนได้มั้ย,ถ้าสมมุติว่าพี่จีบน้องวาฬไม่ติด งั้นพี่ขอจีบแม่น้องวาฬแทนได้มั้ย,2025-11-08 17:05:14,"['ถ้า', 'สมมุติ', 'ว่า', 'พี่', 'จีบ', 'น้อง', 'วาฬ', 'ไม่', 'ติด', ' ', 'งั้น', 'พี่', 'ขอ', 'จีบ', 'แม่', 'น้อง', 'วาฬ', 'แทน', 'ได้', 'มั้ย']"
1956772386935890307,twitter,post,https://x.com/chuchuziiz/status/1956772386935890307,text,2025-08-16T17:37:46.000Z,selenium_x_scraper_v1,จานนี้กี่บาท อยากกินทุกวัน แต่โปรตีนบ้านเราทำไมมันแพงจังวะ,จานนี้กี่บาท อยากกินทุกวัน แต่โปรตีนบ้านเราทำไมมันแพงจังวะ,2025-11-08 17:05:14,"['จาน', 'นี้', 'กี่', 'บาท', ' ', 'อยาก', 'กิน', 'ทุกวัน', ' ', 'แต่', 'โปรตีน', 'บ้าน', 'เรา', 'ทำไม', 'มัน', 'แพง', 'จัง', 'วะ']"
1973373667867549778,twitter,post,https://x.com/starkilla00/status/1973373667867549778,text,2025-10-02T11:05:13.000Z,selenium_x_scraper_v1,เราไม่คบเพื่อนผู้หญิงอ่ะค่ะ เพราะเพื่อนผู้หญิงมีแต่ชอบนินทา เราไม่ใช่คนแบบนั้น เราแมนๆ ลุยไปชอบพูดตรงๆ * bruhhh am not like the other girls เพราะสันดานมึงเหี้ยหรือเปล่าผญด้วยกันเลยดูออก บางทีผช มันก็นินทา เจ็บกว่าชะนีอีก555555 ประเภทที่ชอบพุดกดผญด้วยกันเองกุเกลียดชห https://x.com/starkilla00/st/starkilla00/status/1973373667867549778…,เราไม่คบเพื่อนผู้หญิงอ่ะค่ะ เพราะเพื่อนผู้หญิงมีแต่ชอบนินทา เราไม่ใช่คนแบบนั้น เราแมนๆ ลุยไปชอบพูดตรงๆ * bruhhh am not like the other girls เพราะสันดานมึงเหี้ยหรือเปล่าผญด้วยกันเลยดูออก บางทีผช มันก็นินทา เจ็บกว่าชะนีอีก555555 ประเภทที่ชอบพุดกดผญด้วยกันเองกุเกลียดชห https://x.com/starkilla00/st/starkilla00/status/1973373667867549778…,2025-11-08 17:05:14,"['เรา', 'ไม่', 'คบ', 'เพื่อน', 'ผู้หญิง', 'อ่ะ', 'ค่ะ', ' ', 'เพราะ', 'เพื่อน', 'ผู้หญิง', 'มี', 'แต่', 'ชอบ', 'นินทา', ' ', 'เรา', 'ไม่', 'ใช่', 'คน', 'แบบ', 'นั้น', ' ', 'เรา', 'แมน', 'ๆ', ' ', 'ลุย', 'ไป', 'ชอบ', 'พูดตรงๆ', ' ', 'bruhhh', ' ', 'am', ' ', 'not', ' ', 'like', ' ', 'the', ' ', 'other', ' ', 'girls', ' ', 'เพราะ', 'สันดาน', 'มึง', 'เหี้ย', 'หรือเปล่า', 'ผญ', 'ด้วยกัน', 'เลย', 'ดูออก', ' ', 'บางที', 'ผช', ' ', 'มัน', 'ก็', 'นินทา', ' ', 'เจ็บ', 'กว่า', 'ชะนี', 'อีก', 'หัวเราะ', ' ', 'ประเภท', 'ที่', 'ชอบ', 'พุด', 'กด', 'ผญ', 'ด้วย', 'กันเอง', 'กุ', 'เกลียด', 'ชห']"
1973989448703750480,twitter,post,https://x.com/16Svgdelulu/status/1973989448703750480,text,2025-10-03T05:52:14.000Z,selenium_x_scraper_v1,"พ้อยหลักของทวิตนี้คือเจาะจงไปที่ผญ ที่ยัง ใช้คำพูดเหล่านี้กดผญด้วยกันเอง อย่า normalize พฤติกรรมเหล่านี้  การที่เราจะคบเพื่อนผช มันไม่มีอะไรผิดตราบใดที่เราไม่เอาคำพูดเหล่านี้ไปกดผญอีกที** 
ยังไงทุกแวดวงสังคมล้วนมีการนินทากันเกิดขึ้น","พ้อยหลักของทวิตนี้คือเจาะจงไปที่ผญ ที่ยัง ใช้คำพูดเหล่านี้กดผญด้วยกันเอง อย่า normalize พฤติกรรมเหล่านี้  การที่เราจะคบเพื่อนผช มันไม่มีอะไรผิดตราบใดที่เราไม่เอาคำพูดเหล่านี้ไปกดผญอีกที** 
ยังไงทุกแวดวงสังคมล้วนมีการนินทากันเกิดขึ้น",2025-11-08 17:05:14,"['พ้อ', 'ย', 'หลัก', 'ของ', 'ทวิ', 'ต', 'นี้', 'คือ', 'เจาะจง', 'ไป', 'ที่', 'ผญ', ' ', 'ที่', 'ยัง', ' ', 'ใช้', 'คำพูด', 'เหล่านี้', 'กด', 'ผญ', 'ด้วย', 'กันเอง', ' ', 'อย่า', ' ', 'normalize', ' ', 'พฤติกรรม', 'เหล่านี้', ' ', 'การ', 'ที่', 'เรา', 'จะ', 'คบ', 'เพื่อน', 'ผช', ' ', 'มัน', 'ไม่', 'มี', 'อะไร', 'ผิด', 'ตราบใดที่', 'เรา', 'ไม่', 'เอา', 'คำพูด', 'เหล่านี้', 'ไป', 'กด', 'ผญ', 'อีกที', ' ', 'ยังไง', 'ทุก', 'แวด', 'วงสังคม', 'ล้วน', 'มี', 'การนินทา', 'กัน', 'เกิดขึ้น']"
1973994247784186030,twitter,post,https://x.com/ume_noto/status/1973994247784186030,text,2025-10-03T06:11:18.000Z,selenium_x_scraper_v1,นี่คือลักษณะของ pick me girl ป่ะ เห็นเเล้วอยากจะเบะปาก,นี่คือลักษณะของ pick me girl ป่ะ เห็นเเล้วอยากจะเบะปาก,2025-11-08 17:05:14,"['นี่', 'คือ', 'ลักษณะ', 'ของ', ' ', 'pick', ' ', 'me', ' ', 'girl', ' ', 'ป่ะ', ' ', 'เห็น', 'เเล้ว', 'อยาก', 'จะ', 'เบะ', 'ปาก']"
