id,platform,platform_type,url,content_type,timestamp,scraper_module,text,raw_text,scrape_date,tokens
1976221539625587102,twitter,post,https://x.com/16Svgdelulu/status/1976221539625587102,text,2025-10-09T09:41:46.000Z,selenium_x_scraper_v1,55555555555555665666666555555555555555555555555555555555555555555555666666&65555555555555555555555555555555555555555555555555555555555555555555555555555555555555555555556555555555655566666666655555,55555555555555665666666555555555555555555555555555555555555555555555666666&65555555555555555555555555555555555555555555555555555555555555555555555555555555555555555555556555555555655566666666655555,2025-10-23 17:59:34,"['หัวเราะ', 'หัวเราะ', 'หัวเราะ', 'หัวเราะ', ' ', '6', 'หัวเราะ', '6', 'หัวเราะ', '6', 'หัวเราะ', 'หัวเราะ', 'หัวเราะ']"
1976222351604973627,twitter,post,https://x.com/jxl0089x/status/1976222351604973627,text,2025-10-09T09:44:59.000Z,selenium_x_scraper_v1,"ชอบอะดิ้
ขอคะแนน ความสร้างสรรค์ ในการด่าหน่อย55555","ชอบอะดิ้
ขอคะแนน ความสร้างสรรค์ ในการด่าหน่อย55555",2025-10-23 17:59:34,"['ชอบ', 'อะ', 'ดิ้', ' ', 'ขอ', 'คะแนน', ' ', 'ความ', 'สร้างสรรค์', ' ', 'ใน', 'การ', 'ด่า', 'หน่อย', 'หัวเราะ']"
1976222236936896817,twitter,post,https://x.com/jxl0089x/status/1976222236936896817,text,2025-10-09T09:44:32.000Z,selenium_x_scraper_v1,หน้าเหี้ยแบบไหน สาวกรี๊ด งง,หน้าเหี้ยแบบไหน สาวกรี๊ด งง,2025-10-23 17:59:34,"['หน้า', 'เหี้ย', 'แบบ', 'ไหน', ' ', 'สาว', 'กรี๊ด', ' ', 'งง']"
1976221485078585688,twitter,post,https://x.com/atomicnum16/status/1976221485078585688,text,2025-10-09T09:41:33.000Z,selenium_x_scraper_v1,ก็เพราะถือหางเปนองครักษ์พิทักษ์กระจู๋ กันแบบนี้ไง เลยมีแต่ความคิดแปลกๆ กับกลุ่มแปลกๆเตมเฟสไปหมด ทำไมเพศเดียวกันจะด่ากันไม่ได้,ก็เพราะถือหางเปนองครักษ์พิทักษ์กระจู๋ กันแบบนี้ไง เลยมีแต่ความคิดแปลกๆ กับกลุ่มแปลกๆเตมเฟสไปหมด ทำไมเพศเดียวกันจะด่ากันไม่ได้,2025-10-23 17:59:34,"['ก็', 'เพราะ', 'ถือหาง', 'เป', 'นอง', 'ค', 'รักษ์', 'พิทักษ์', 'กระ', 'จู๋', ' ', 'กัน', 'แบบนี้', 'ไง', ' ', 'เลย', 'มี', 'แต่', 'ความคิด', 'แปลก', 'ๆ', ' ', 'กับ', 'กลุ่ม', 'แปลก', 'ๆ', 'เต', 'ม', 'เฟส', 'ไป', 'หมด', ' ', 'ทำไม', 'เพศ', 'เดียวกัน', 'จะ', 'ด่า', 'กัน', 'ไม่', 'ได้']"
1976222069999403324,twitter,post,https://x.com/jxl0089x/status/1976222069999403324,text,2025-10-09T09:43:52.000Z,selenium_x_scraper_v1,"คนในเฟส ก็ด่า คนในทวิต เพี้ยน
1-1","คนในเฟส ก็ด่า คนในทวิต เพี้ยน
1-1",2025-10-23 17:59:34,"['คนใน', 'เฟส', ' ', 'ก็', 'ด่า', ' ', 'คนใน', 'ทวิ', 'ต', ' ', 'เพี้ยน', ' ', '1', ' ', '1']"
1976221937430036902,twitter,post,https://x.com/jxl0089x/status/1976221937430036902,text,2025-10-09T09:43:20.000Z,selenium_x_scraper_v1,ชนะมาหมดละ เลยอยากมาทะเลาะกับเฟมทวิต,ชนะมาหมดละ เลยอยากมาทะเลาะกับเฟมทวิต,2025-10-23 17:59:34,"['ชนะ', 'มา', 'หมด', 'ละ', ' ', 'เลย', 'อยาก', 'มา', 'ทะเลาะ', 'กับ', 'เฟม', 'ทวิ', 'ต']"
1976221191137525950,twitter,post,https://x.com/bll6er/status/1976221191137525950,text,2025-10-09T09:40:23.000Z,selenium_x_scraper_v1,ได้ยินเสียงเพล้งค่ะ เหมือนคนหน้าแตก,ได้ยินเสียงเพล้งค่ะ เหมือนคนหน้าแตก,2025-10-23 17:59:34,"['ได้ยิน', 'เสียง', 'เพ', 'ล้ง', 'ค่ะ', ' ', 'เหมือน', 'คน', 'หน้าแตก']"
1976221729749172306,twitter,post,https://x.com/jxl0089x/status/1976221729749172306,text,2025-10-09T09:42:31.000Z,selenium_x_scraper_v1,"ไม่ใช่เกย์นะ ไม่เหยียดเกย์เหมือนคุณด้วย
คำพูดน่าเกลียด แต่ฟินวะ ผญทำได้แบบนี่ป่าว5555","ไม่ใช่เกย์นะ ไม่เหยียดเกย์เหมือนคุณด้วย
คำพูดน่าเกลียด แต่ฟินวะ ผญทำได้แบบนี่ป่าว5555",2025-10-23 17:59:34,"['ไม่', 'ใช่', 'เกย์', 'นะ', ' ', 'ไม่', 'เหยียด', 'เกย์', 'เหมือน', 'คุณ', 'ด้วย', ' ', 'คำพูด', 'น่าเกลียด', ' ', 'แต่', 'ฟิน', 'วะ', ' ', 'ผญ', 'ทำได้', 'แบบ', 'นี่', 'ป่าว', 'หัวเราะ']"
1976220399290700033,twitter,post,https://x.com/annoyedmonday/status/1976220399290700033,text,2025-10-09T09:37:14.000Z,selenium_x_scraper_v1,ก็เห็รมีด่ามึงอยู่นะน้อง คิดว่าผชมีควยไว้ใช้แทนสมองเหมือนมึงหมดติอาว,ก็เห็รมีด่ามึงอยู่นะน้อง คิดว่าผชมีควยไว้ใช้แทนสมองเหมือนมึงหมดติอาว,2025-10-23 17:59:34,"['ก็', 'เห็ร', 'มี', 'ด่า', 'มึง', 'อยู่', 'นะ', 'น้อง', ' ', 'คิด', 'ว่า', 'ผช', 'มี', 'ควย', 'ไว้', 'ใช้', 'แทน', 'สมอง', 'เหมือน', 'มึง', 'หมด', 'ติ', 'อาว']"
1976221353578725747,twitter,post,https://x.com/jxl0089x/status/1976221353578725747,text,2025-10-09T09:41:01.000Z,selenium_x_scraper_v1,ค้าบๆ จะเชื่อฟังครับพี่ชาย,ค้าบๆ จะเชื่อฟังครับพี่ชาย,2025-10-23 17:59:34,"['ค้าบ', 'ๆ', ' ', 'จะ', 'เชื่อฟัง', 'ครับ', 'พี่ชาย']"
1976220543188861408,twitter,post,https://x.com/jxl0089x/status/1976220543188861408,text,2025-10-09T09:37:48.000Z,selenium_x_scraper_v1,coz i'm a good boy broo lol,coz i'm a good boy broo lol,2025-10-23 17:59:34,"['coz', ' ', 'i', ""'m"", ' ', 'a', ' ', 'good', ' ', 'boy', ' ', 'broo', ' ', 'lol']"
1976219886788751542,twitter,post,https://x.com/mublin007/status/1976219886788751542,text,2025-10-09T09:35:12.000Z,selenium_x_scraper_v1,ค่ะอิกาเทย,ค่ะอิกาเทย,2025-10-23 17:59:34,"['ค่ะ', 'อิ', 'กา', 'เท', 'ย']"
1976219800520229356,twitter,post,https://x.com/jxl0089x/status/1976219800520229356,text,2025-10-09T09:34:51.000Z,selenium_x_scraper_v1,"กุจะรั่ววว พิมไรวะ 5555
กุไม่ต้องล่อหรอก แม่งเอามาให้กุล่อเอง","กุจะรั่ววว พิมไรวะ 5555
กุไม่ต้องล่อหรอก แม่งเอามาให้กุล่อเอง",2025-10-23 17:59:34,"['กุ', 'จะ', 'รั่ว', 'วว', ' ', 'พิม', 'ไร', 'วะ', ' ', 'หัวเราะ', ' ', 'กุ', 'ไม่ต้อง', 'ล่อ', 'หรอก', ' ', 'แม่', 'ง', 'เอา', 'มา', 'ให้', 'กุ', 'ล่อ', 'เอง']"
1976204739651272942,twitter,post,https://x.com/thousandfibe/status/1976204739651272942,text,2025-10-09T08:35:00.000Z,selenium_x_scraper_v1,555555555556555555555555 คิกคิก โคตรฮา,555555555556555555555555 คิกคิก โคตรฮา,2025-10-23 17:59:34,"['หัวเราะ', '6', 'หัวเราะ', ' ', 'คิก', 'คิก', ' ', 'โคตร', 'หัวเราะ']"
1976219057595744349,twitter,post,https://x.com/thousandfibe/status/1976219057595744349,text,2025-10-09T09:31:54.000Z,selenium_x_scraper_v1,"แล้ว? ต้องกังวล ต้องกลัวไหมเนี่ย 
เออเอาเถอะ 5555555555555555","แล้ว? ต้องกังวล ต้องกลัวไหมเนี่ย 
เออเอาเถอะ 5555555555555555",2025-10-23 17:59:34,"['แล้ว', '?', ' ', 'ต้อง', 'กังวล', ' ', 'ต้อง', 'กลัว', 'ไหม', 'เนี่ย', ' ', 'เออ', 'เอาเถอะ', ' ', 'หัวเราะ']"
1976219424710668758,twitter,post,https://x.com/jxl0089x/status/1976219424710668758,text,2025-10-09T09:33:21.000Z,selenium_x_scraper_v1,น่ากังวลสิ คุณพี่ คือ end user อาจจะไม่เสว5555,น่ากังวลสิ คุณพี่ คือ end user อาจจะไม่เสว5555,2025-10-23 17:59:34,"['น่า', 'กังวล', 'สิ', ' ', 'คุณ', 'พี่', ' ', 'คือ', ' ', 'end', ' ', 'user', ' ', 'อาจจะ', 'ไม่', 'เส', 'ว', 'หัวเราะ']"
