id,platform,platform_type,url,content_type,timestamp,scraper_module,text,raw_text,scrape_date,tokens
1989983829579436311,twitter,post,https://x.com/zhouu8888/status/1989983829579436311,text,2025-11-16T09:08:11.000Z,selenium_x_scraper_v1,พูดแบบโลกสวยไปเถอะครับ ผู้หญิงที่คิดว่าไม่ต้องแต่งก็ได้ แต่สุดท้ายพออายุเยอะแล้วไม่มีใครเลือกก็โทษผู้ชายอยู่ดี,พูดแบบโลกสวยไปเถอะครับ ผู้หญิงที่คิดว่าไม่ต้องแต่งก็ได้ แต่สุดท้ายพออายุเยอะแล้วไม่มีใครเลือกก็โทษผู้ชายอยู่ดี,2025-11-29 08:18:55,"['พูด', 'แบบ', 'โลก', 'สวย', 'ไป', 'เถอะ', 'ครับ', ' ', 'ผู้หญิง', 'ที่', 'คิด', 'ว่า', 'ไม่ต้อง', 'แต่ง', 'ก็ได้', ' ', 'แต่', 'สุดท้าย', 'พอ', 'อายุ', 'เยอะ', 'แล้ว', 'ไม่', 'มี', 'ใคร', 'เลือก', 'ก็', 'โทษ', 'ผู้ชาย', 'อยู่ดี']"
1989999965436076083,twitter,post,https://x.com/dmdewz/status/1989999965436076083,text,2025-11-16T10:12:18.000Z,selenium_x_scraper_v1,ผู้ชายไม่ลองโทษตัวเองดูบ้างเหรอครับ ว่าทำไมผู้หญิงเขาถึงไม่อยากแต่งงานด้วย เพราะนิสัยขี้แพ้แบบนี้รึเปล่าครับ ,ผู้ชายไม่ลองโทษตัวเองดูบ้างเหรอครับ ว่าทำไมผู้หญิงเขาถึงไม่อยากแต่งงานด้วย เพราะนิสัยขี้แพ้แบบนี้รึเปล่าครับ ,2025-11-29 08:18:55,"['ผู้ชาย', 'ไม่', 'ลอง', 'โทษ', 'ตัวเอง', 'ดู', 'บ้าง', 'เหรอ', 'ครับ', ' ', 'ว่า', 'ทำไม', 'ผู้หญิง', 'เขา', 'ถึง', 'ไม่', 'อยาก', 'แต่งงาน', 'ด้วย', ' ', 'เพราะ', 'นิสัย', 'ขี้', 'แพ้', 'แบบนี้', 'รึเปล่า', 'ครับ']"
1990038385466192308,twitter,post,https://x.com/KhemintraM6483/status/1990038385466192308,text,2025-11-16T12:44:58.000Z,selenium_x_scraper_v1,แล้วทำไมชีวิตผู้หญิงทุกคนต้องแต่งงานในเมื่อเราเป็นได้มากกว่าเมียหรือแม่ใครสักคน,แล้วทำไมชีวิตผู้หญิงทุกคนต้องแต่งงานในเมื่อเราเป็นได้มากกว่าเมียหรือแม่ใครสักคน,2025-11-29 08:18:55,"['แล้ว', 'ทำไม', 'ชีวิต', 'ผู้หญิง', 'ทุกคน', 'ต้อง', 'แต่งงาน', 'ใน', 'เมื่อ', 'เรา', 'เป็นได้', 'มากกว่า', 'เมีย', 'หรือ', 'แม่', 'ใคร', 'สัก', 'คน']"
1990039878852345893,twitter,post,https://x.com/RwiNth55270/status/1990039878852345893,text,2025-11-16T12:50:54.000Z,selenium_x_scraper_v1,อยากรู้ว่าผู้ชายที่บอกแต่งงานกับคนที่มีลูกได้ถึงจะจริงจังเวลาเลิกกันนี่รับผิดชอบลูกกันแค่ไหนปัญหาสังคมส่วนหนึ่งมาจากเลิกกันก้อทิ้งลูกกันเยอะมากและผู้ชายที่เคยพูดอยากมีลูกนี่พร้อมรับผิดชอบตลอดมั้ยบางคนไม่มีลูกเขาก้อรักกันดีไม่สร้างภาระให้สังคมด้วย,อยากรู้ว่าผู้ชายที่บอกแต่งงานกับคนที่มีลูกได้ถึงจะจริงจังเวลาเลิกกันนี่รับผิดชอบลูกกันแค่ไหนปัญหาสังคมส่วนหนึ่งมาจากเลิกกันก้อทิ้งลูกกันเยอะมากและผู้ชายที่เคยพูดอยากมีลูกนี่พร้อมรับผิดชอบตลอดมั้ยบางคนไม่มีลูกเขาก้อรักกันดีไม่สร้างภาระให้สังคมด้วย,2025-11-29 08:18:55,"['อยากรู้', 'ว่า', 'ผู้ชาย', 'ที่', 'บอก', 'แต่งงาน', 'กับ', 'คน', 'ที่', 'มีลูก', 'ได้', 'ถึง', 'จะ', 'จริงจัง', 'เวลา', 'เลิกกัน', 'นี่', 'รับผิดชอบ', 'ลูก', 'กัน', 'แค่', 'ไหน', 'ปัญหาสังคม', 'ส่วนหนึ่ง', 'มาจาก', 'เลิกกัน', 'ก้อ', 'ทิ้ง', 'ลูก', 'กัน', 'เยอะ', 'มาก', 'และ', 'ผู้ชาย', 'ที่', 'เคย', 'พูด', 'อยาก', 'มีลูก', 'นี่', 'พร้อม', 'รับผิดชอบ', 'ตลอด', 'มั้ย', 'บางคน', 'ไม่', 'มีลูก', 'เขา', 'ก้อ', 'รัก', 'กัน', 'ดี', 'ไม่', 'สร้าง', 'ภาระ', 'ให้', 'สังคม', 'ด้วย']"
1990048016179605562,twitter,post,https://x.com/PremiereConsu/status/1990048016179605562,text,2025-11-16T13:23:15.000Z,selenium_x_scraper_v1,"ตั้งแต่เราทำงานที่แรก บ.อินเตอร์ หน.ผญ.เยอะมาก แล้วค่อดเก่งทุกคน
ก็ไม่แต่งงาน/แต่งแต่ไม่มีลูก เลี้ยงหมาแมวแทน เงินเหลือค่อดเยอะ ทุกหยุดยาวจะเที่ยวยุโรป/ดำน้ำ
กินใช้สุขสบายมาก ช้อปกระจุย
ชีวิตพวกนางค่อดจะแฮปปี้อ่ะ ไอดอลมาก
แฟนพวกนางรวย&เก่งมาก
เอาจริงก็เสียดายคนระดับนี้แต่ไม่มีลูก","ตั้งแต่เราทำงานที่แรก บ.อินเตอร์ หน.ผญ.เยอะมาก แล้วค่อดเก่งทุกคน
ก็ไม่แต่งงาน/แต่งแต่ไม่มีลูก เลี้ยงหมาแมวแทน เงินเหลือค่อดเยอะ ทุกหยุดยาวจะเที่ยวยุโรป/ดำน้ำ
กินใช้สุขสบายมาก ช้อปกระจุย
ชีวิตพวกนางค่อดจะแฮปปี้อ่ะ ไอดอลมาก
แฟนพวกนางรวย&เก่งมาก
เอาจริงก็เสียดายคนระดับนี้แต่ไม่มีลูก",2025-11-29 08:18:55,"['ตั้งแต่', 'เรา', 'ทำงาน', 'ที่', 'แรก', ' ', 'บ.', 'อินเตอร์', ' ', 'หน.', 'ผญ.', 'เยอะ', 'มาก', ' ', 'แล้ว', 'ค่อ', 'ด', 'เก่ง', 'ทุกคน', ' ', 'ก็', 'ไม่', 'แต่งงาน', ' ', 'แต่ง', 'แต่', 'ไม่', 'มีลูก', ' ', 'เลี้ยง', 'หมา', 'แมว', 'แทน', ' ', 'เงิน', 'เหลือ', 'ค่อ', 'ด', 'เยอะ', ' ', 'ทุก', 'หยุด', 'ยา', 'วจะ', 'เที่ยว', 'ยุโรป', ' ', 'ดำน้ำ', ' ', 'กิน', 'ใช้', 'สุขสบาย', 'มาก', ' ', 'ช้อป', 'กระจุย', ' ', 'ชีวิต', 'พวก', 'นาง', 'ค่อ', 'ด', 'จะ', 'แฮปปี้', 'อ่ะ', ' ', 'ไอดอล', 'มาก', ' ', 'แฟน', 'พวก', 'นาง', 'รวย', ' ', 'เก่ง', 'มาก', ' ', 'เอาจริง', 'ก็', 'เสียดาย', 'คน', 'ระดับ', 'นี้', 'แต่', 'ไม่', 'มีลูก']"
1990066290833412118,twitter,post,https://x.com/DekRap140624/status/1990066290833412118,text,2025-11-16T14:35:52.000Z,selenium_x_scraper_v1,ผมจะไม่เอาคอมเม้นนี้มาตัดสินผู้ชายทุกคนว่าเขาคิดแบบนี้ แต่ผมขออย่าให้มีผู้หญิงคนไหนได้คบกับผู้ชายที่มีความคิดแบบนี้นะครับ,ผมจะไม่เอาคอมเม้นนี้มาตัดสินผู้ชายทุกคนว่าเขาคิดแบบนี้ แต่ผมขออย่าให้มีผู้หญิงคนไหนได้คบกับผู้ชายที่มีความคิดแบบนี้นะครับ,2025-11-29 08:18:55,"['ผม', 'จะ', 'ไม่', 'เอา', 'คอม', 'เม้น', 'นี้', 'มา', 'ตัดสิน', 'ผู้ชาย', 'ทุกคน', 'ว่า', 'เขา', 'คิด', 'แบบนี้', ' ', 'แต่', 'ผม', 'ขอ', 'อย่า', 'ให้', 'มี', 'ผู้หญิง', 'คน', 'ไหน', 'ได้', 'คบ', 'กับ', 'ผู้ชาย', 'ที่', 'มี', 'ความคิด', 'แบบนี้', 'นะ', 'ครับ']"
1990056440967647398,twitter,post,https://x.com/MarkMuseum/status/1990056440967647398,text,2025-11-16T13:56:43.000Z,selenium_x_scraper_v1,มันหลงมาจากยุคไหนวะนั่น ไอพวกนี้คือพวกที่โดนเพลงสามสิบยังแจ๋วฝังหัวอะ คิดว่าผู้หญิงถ้าขึ้นเลข 3 แล้วคือแก่ มึงบ้าแล้วว ผู้หญิงส่วนใหญ่เพิ่งจะดูเป็นสาวสวยเต็มที่จริงๆ หลังขึ้นเลข 3 แล้วด้วยซ้ำ,มันหลงมาจากยุคไหนวะนั่น ไอพวกนี้คือพวกที่โดนเพลงสามสิบยังแจ๋วฝังหัวอะ คิดว่าผู้หญิงถ้าขึ้นเลข 3 แล้วคือแก่ มึงบ้าแล้วว ผู้หญิงส่วนใหญ่เพิ่งจะดูเป็นสาวสวยเต็มที่จริงๆ หลังขึ้นเลข 3 แล้วด้วยซ้ำ,2025-11-29 08:18:55,"['มัน', 'หลง', 'มาจาก', 'ยุค', 'ไหน', 'วะ', 'นั่น', ' ', 'ไอ', 'พวก', 'นี้', 'คือ', 'พวก', 'ที่', 'โดน', 'เพลง', 'สามสิบ', 'ยัง', 'แจ๋ว', 'ฝังหัว', 'อะ', ' ', 'คิด', 'ว่า', 'ผู้หญิง', 'ถ้า', 'ขึ้น', 'เลข', ' ', '3', ' ', 'แล้ว', 'คือ', 'แก่', ' ', 'มึง', 'บ้า', 'แล้ว', 'ว', ' ', 'ผู้หญิง', 'ส่วนใหญ่', 'เพิ่งจะ', 'ดู', 'เป็นสาว', 'สวย', 'เต็มที่', 'จริงๆ', ' ', 'หลัง', 'ขึ้น', 'เลข', ' ', '3', ' ', 'แล้ว', 'ด้วยซ้ำ']"
1990094842136019161,twitter,post,https://x.com/Error404ssssss/status/1990094842136019161,text,2025-11-16T16:29:19.000Z,selenium_x_scraper_v1,ตลกอ่ะ ที่ผช บางคนยังคิดว่าการแต่งงาน มีสามี มีลูกคือเป้าหมายในชีวิตของผญ ไม่ว่าเหมารวมนะเพราะผช ดีๆที่มีสมองก็ยังมีอีกมาก เพียงแต่บางคนก็เกินเยียวยา อีกอย่างแต่งไม่แต่งผญเขาก็เลือกเอง ห่วงตัวเองเหอะ สรนแต่เรื่องชาวบ้าน,ตลกอ่ะ ที่ผช บางคนยังคิดว่าการแต่งงาน มีสามี มีลูกคือเป้าหมายในชีวิตของผญ ไม่ว่าเหมารวมนะเพราะผช ดีๆที่มีสมองก็ยังมีอีกมาก เพียงแต่บางคนก็เกินเยียวยา อีกอย่างแต่งไม่แต่งผญเขาก็เลือกเอง ห่วงตัวเองเหอะ สรนแต่เรื่องชาวบ้าน,2025-11-29 08:18:55,"['ตลก', 'อ่ะ', ' ', 'ที่', 'ผช', ' ', 'บางคน', 'ยัง', 'คิด', 'ว่าการ', 'แต่งงาน', ' ', 'มี', 'สามี', ' ', 'มีลูก', 'คือ', 'เป้าหมาย', 'ใน', 'ชีวิต', 'ของ', 'ผญ', ' ', 'ไม่', 'ว่า', 'เหมา', 'รวม', 'นะ', 'เพราะ', 'ผช', ' ', 'ดี', 'ๆ', 'ที่', 'มี', 'สมอง', 'ก็', 'ยังมี', 'อีก', 'มาก', ' ', 'เพียงแต่', 'บางคน', 'ก็', 'เกิน', 'เยียวยา', ' ', 'อีก', 'อย่าง', 'แต่ง', 'ไม่', 'แต่ง', 'ผญ', 'เขา', 'ก็', 'เลือก', 'เอง', ' ', 'ห่วง', 'ตัวเอง', 'เหอะ', ' ', 'สร', 'น', 'แต่', 'เรื่อง', 'ชาวบ้าน']"
1990056792974647354,twitter,post,https://x.com/U_Tiger32/status/1990056792974647354,text,2025-11-16T13:58:07.000Z,selenium_x_scraper_v1,"อะไรทำให้เขาคิดอย่างนี้นะ คือ 35 แล้วยังไม่แต่ง บางทีอาจจะยังไม่เจอคนที่คลิ๊กจริงๆก็ได้ รีบแต่งรีบมีลูกสุดท้ายมันไม่คลิก พอลูกโตแล้วก็หย่ากันมีเยอะแยะไป

ปล ผมเป็นผู้ชาย","อะไรทำให้เขาคิดอย่างนี้นะ คือ 35 แล้วยังไม่แต่ง บางทีอาจจะยังไม่เจอคนที่คลิ๊กจริงๆก็ได้ รีบแต่งรีบมีลูกสุดท้ายมันไม่คลิก พอลูกโตแล้วก็หย่ากันมีเยอะแยะไป

ปล ผมเป็นผู้ชาย",2025-11-29 08:18:55,"['อะไร', 'ทำให้', 'เขา', 'คิด', 'อย่างนี้', 'นะ', ' ', 'คือ', ' ', '35', ' ', 'แล้ว', 'ยัง', 'ไม่', 'แต่ง', ' ', 'บางที', 'อาจจะ', 'ยัง', 'ไม่', 'เจอ', 'คน', 'ที่', 'คลิ๊ก', 'จริงๆ', 'ก็ได้', ' ', 'รีบ', 'แต่ง', 'รีบ', 'มีลูก', 'สุดท้าย', 'มัน', 'ไม่', 'คลิก', ' ', 'พอ', 'ลูก', 'โต', 'แล้วก็', 'หย่ากัน', 'มี', 'เยอะแยะ', 'ไป', ' ', 'ปล', ' ', 'ผม', 'เป็น', 'ผู้ชาย']"
1990026927676194918,twitter,post,https://x.com/akethorng/status/1990026927676194918,text,2025-11-16T11:59:27.000Z,selenium_x_scraper_v1, ขอบคุณที่พูดแทนใจค่ะ , ขอบคุณที่พูดแทนใจค่ะ ,2025-11-29 08:18:55,"['ขอบคุณ', 'ที่', 'พูด', 'แทน', 'ใจ', 'ค่ะ']"
1990053740469186625,twitter,post,https://x.com/Kit556397878116/status/1990053740469186625,text,2025-11-16T13:45:59.000Z,selenium_x_scraper_v1,"มันก็มีทุกแบบนะแหละ
แต่การจะคิดมีลูกไหม ถ้าฝ่ายใด 35+ ก็ต้องคิดหนักเรื่องมีลูก ทั้งความพิการและสุขภาพของลูก การแท้ง การตกเลือดขณะคลอด การเลี้ยงดูจนเรียนจบ ป ตรี พ่อแม่ไหวไหม
คนที่คิดว่าแต่งโดยไม่มีลูก/คนอยากมีลูก/คนอยากโสด/คนหาคู่ไม่ได้ มีทุกแบบ อย่าเอาความคิดตัวเองไปตัดสินใคร","มันก็มีทุกแบบนะแหละ
แต่การจะคิดมีลูกไหม ถ้าฝ่ายใด 35+ ก็ต้องคิดหนักเรื่องมีลูก ทั้งความพิการและสุขภาพของลูก การแท้ง การตกเลือดขณะคลอด การเลี้ยงดูจนเรียนจบ ป ตรี พ่อแม่ไหวไหม
คนที่คิดว่าแต่งโดยไม่มีลูก/คนอยากมีลูก/คนอยากโสด/คนหาคู่ไม่ได้ มีทุกแบบ อย่าเอาความคิดตัวเองไปตัดสินใคร",2025-11-29 08:18:55,"['มัน', 'ก็', 'มี', 'ทุก', 'แบบ', 'นะ', 'แหละ', ' ', 'แต่', 'การ', 'จะ', 'คิด', 'มีลูก', 'ไหม', ' ', 'ถ้า', 'ฝ่าย', 'ใด', ' ', '35', ' ', 'ก็', 'ต้อง', 'คิดหนัก', 'เรื่อง', 'มีลูก', ' ', 'ทั้ง', 'ความ', 'พิการ', 'และ', 'สุขภาพ', 'ของ', 'ลูก', ' ', 'การ', 'แท้ง', ' ', 'การตกเลือด', 'ขณะ', 'คลอด', ' ', 'การ', 'เลี้ยงดู', 'จน', 'เรียนจบ', ' ', 'ป', ' ', 'ตรี', ' ', 'พ่อแม่', 'ไหว', 'ไหม', ' ', 'คน', 'ที่', 'คิด', 'ว่า', 'แต่ง', 'โดย', 'ไม่', 'มีลูก', ' ', 'คน', 'อยาก', 'มีลูก', ' ', 'คน', 'อยาก', 'โสด', ' ', 'คน', 'หาคู่', 'ไม่', 'ได้', ' ', 'มี', 'ทุก', 'แบบ', ' ', 'อย่า', 'เอา', 'ความคิด', 'ตัวเอง', 'ไป', 'ตัดสิน', 'ใคร']"
1990081565532029263,twitter,post,https://x.com/SunAnnalise/status/1990081565532029263,text,2025-11-16T15:36:33.000Z,selenium_x_scraper_v1,มันก็มีคนเหี้ยทั้งสองฝ่ายนะ จะแบกกันไปเพื่ออะไร เลิกหาเหตุผลให้อีกฝ่ายสูงกว่าได้แล้ว ปยอ,มันก็มีคนเหี้ยทั้งสองฝ่ายนะ จะแบกกันไปเพื่ออะไร เลิกหาเหตุผลให้อีกฝ่ายสูงกว่าได้แล้ว ปยอ,2025-11-29 08:18:55,"['มัน', 'ก็', 'มี', 'คน', 'เหี้ย', 'ทั้งสองฝ่าย', 'นะ', ' ', 'จะ', 'แบก', 'กัน', 'ไป', 'เพื่อ', 'อะไร', ' ', 'เลิก', 'หา', 'เหตุผล', 'ให้', 'อีก', 'ฝ่าย', 'สูง', 'กว่า', 'ได้', 'แล้ว', ' ', 'ปยอ']"
1990047823925313688,twitter,post,https://x.com/Opallthestrange/status/1990047823925313688,text,2025-11-16T13:22:29.000Z,selenium_x_scraper_v1,โหยยย กราบค่ะ  ถ้าชายไทยส่วนมากคิดได้แบบคุณคงดีไม่น้อยเลย,โหยยย กราบค่ะ  ถ้าชายไทยส่วนมากคิดได้แบบคุณคงดีไม่น้อยเลย,2025-11-29 08:18:55,"['โหย', 'ยย', ' ', 'กราบ', 'ค่ะ', ' ', 'ถ้า', 'ชาย', 'ไทย', 'ส่วนมาก', 'คิดได้', 'แบบ', 'คุณ', 'คง', 'ดี', 'ไม่', 'น้อย', 'เลย']"
1990263156216889442,twitter,post,https://x.com/Begoodoneee/status/1990263156216889442,text,2025-11-17T03:38:08.000Z,selenium_x_scraper_v1,ทำไมเขาคิดว่าผู้หญิงอยากเป็นเครื่องผลิตลูกแบบนั้นล่ะค๊า จะมีลูกคนนึงผู้หญิงใช้ร่างกายยับเยินมาก บางคนที่อยากเลี้ยงลูกเองก็ต้องหยุดทำงาน รายได้มาจากไหนอีก ถ้าไม่ได้วางแผนมีเงินก้อนใช้ยาวๆ เพื่อหยุดเลี้ยงลูกได้คนนึงจนโต แบมือขอสามีก็ไม่โอเคอีก มันหลายปัจจัยมากมาย สู้ไม่มีดีกว่า,ทำไมเขาคิดว่าผู้หญิงอยากเป็นเครื่องผลิตลูกแบบนั้นล่ะค๊า จะมีลูกคนนึงผู้หญิงใช้ร่างกายยับเยินมาก บางคนที่อยากเลี้ยงลูกเองก็ต้องหยุดทำงาน รายได้มาจากไหนอีก ถ้าไม่ได้วางแผนมีเงินก้อนใช้ยาวๆ เพื่อหยุดเลี้ยงลูกได้คนนึงจนโต แบมือขอสามีก็ไม่โอเคอีก มันหลายปัจจัยมากมาย สู้ไม่มีดีกว่า,2025-11-29 08:18:55,"['ทำไม', 'เขา', 'คิด', 'ว่า', 'ผู้หญิง', 'อยาก', 'เป็น', 'เครื่อง', 'ผลิต', 'ลูก', 'แบบ', 'นั้น', 'ล่ะ', 'ค๊า', ' ', 'จะ', 'มีลูก', 'คน', 'นึง', 'ผู้หญิง', 'ใช้', 'ร่างกาย', 'ยับเยิน', 'มาก', ' ', 'บางคน', 'ที่', 'อยาก', 'เลี้ยงลูก', 'เอง', 'ก็', 'ต้อง', 'หยุด', 'ทำงาน', ' ', 'รายได้', 'มาจาก', 'ไหน', 'อีก', ' ', 'ถ้า', 'ไม่', 'ได้', 'วางแผน', 'มี', 'เงินก้อน', 'ใช้', 'ยาว', 'ๆ', ' ', 'เพื่อ', 'หยุด', 'เลี้ยงลูก', 'ได้', 'คน', 'นึง', 'จน', 'โต', ' ', 'แบมือ', 'ขอ', 'สามี', 'ก็', 'ไม่', 'โอเค', 'อีก', ' ', 'มัน', 'หลาย', 'ปัจจัย', 'มากมาย', ' ', 'สู้', 'ไม่', 'มี', 'ดีกว่า']"
1990178160764444803,twitter,post,https://x.com/Hk25270Beiy/status/1990178160764444803,text,2025-11-16T22:00:23.000Z,selenium_x_scraper_v1,ว่าตามธรรมชาติ ไม่พูดเรื่องศีลธรรม ใช่ ผู้หญิง35ขึ้นไปเริ่มมีลูกยากแล้ว มีโอกาสครรภ์เป็นพิษและแท้งง่ายกว่า,ว่าตามธรรมชาติ ไม่พูดเรื่องศีลธรรม ใช่ ผู้หญิง35ขึ้นไปเริ่มมีลูกยากแล้ว มีโอกาสครรภ์เป็นพิษและแท้งง่ายกว่า,2025-11-29 08:18:55,"['ว่า', 'ตาม', 'ธรรมชาติ', ' ', 'ไม่', 'พูด', 'เรื่อง', 'ศีลธรรม', ' ', 'ใช่', ' ', 'ผู้หญิง', '35', 'ขึ้นไป', 'เริ่ม', 'มีลูก', 'ยาก', 'แล้ว', ' ', 'มีโอกาส', 'ครรภ์', 'เป็นพิษ', 'และ', 'แท้ง', 'ง่าย', 'กว่า']"
