id,platform,platform_type,url,content_type,timestamp,scraper_module,text,raw_text,scrape_date,tokens
1979643862189752829,twitter,post,https://x.com/InTheNCha/status/1979643862189752829,text,2025-10-18T20:20:51.000Z,selenium_x_scraper_v1,แอร์ไม่รับแล้วใครรับ ไม่จัดการความเรียบร้อย จะอุ่นอาหารเสิร์ฟอย่างเดียว? https://x.com/grfld_sr/statu/grfld_sr/status/1979241434583830561…,แอร์ไม่รับแล้วใครรับ ไม่จัดการความเรียบร้อย จะอุ่นอาหารเสิร์ฟอย่างเดียว? https://x.com/grfld_sr/statu/grfld_sr/status/1979241434583830561…,2025-10-23 17:59:34,"['แอร์', 'ไม่', 'รับ', 'แล้ว', 'ใคร', 'รับ', ' ', 'ไม่', 'จัดการ', 'ความ', 'เรียบร้อย', ' ', 'จะ', 'อุ่น', 'อาหาร', 'เสิร์ฟ', 'อย่าง', 'เดียว', '?']"
1979787958766252465,twitter,post,https://x.com/Tim8666/status/1979787958766252465,text,2025-10-19T05:53:26.000Z,selenium_x_scraper_v1,แล้วคนฉลาดที่ไหนเขียน python ว่า phython ก่อนด่าอะไรใคร เช็คสิ่งที่ตัวเองพิมพ์ วันสองวันก่อนหน่อยมั้ย มันดูโง่ดักดานสุดๆเลย,แล้วคนฉลาดที่ไหนเขียน python ว่า phython ก่อนด่าอะไรใคร เช็คสิ่งที่ตัวเองพิมพ์ วันสองวันก่อนหน่อยมั้ย มันดูโง่ดักดานสุดๆเลย,2025-10-23 17:59:34,"['แล้ว', 'คน', 'ฉลาด', 'ที่ไหน', 'เขียน', ' ', 'python', ' ', 'ว่า', ' ', 'phython', ' ', 'ก่อน', 'ด่า', 'อะไร', 'ใคร', ' ', 'เช็ค', 'สิ่ง', 'ที่', 'ตัวเอง', 'พิมพ์', ' ', 'วัน', 'สอง', 'วันก่อน', 'หน่อย', 'มั้ย', ' ', 'มัน', 'ดู', 'โง่', 'ดักดาน', 'สุด', 'ๆ', 'เลย']"
1979653812186157111,twitter,post,https://x.com/MilaLovesJoe/status/1979653812186157111,text,2025-10-18T21:00:23.000Z,selenium_x_scraper_v1,"Two LEGAL immigrants face off against one “protestor”

I love facts and logic.","Two LEGAL immigrants face off against one “protestor”

I love facts and logic.",2025-10-23 17:59:34,"['two', ' ', 'legal', ' ', 'immigrants', ' ', 'face', ' ', 'off', ' ', 'against', ' ', 'one', ' ', 'protestor', ' ', 'i', ' ', 'love', ' ', 'facts', ' ', 'and', ' ', 'logic', '.']"
1979602362751910356,twitter,post,https://x.com/Prudence3rd/status/1979602362751910356,text,2025-10-18T17:35:57.000Z,selenium_x_scraper_v1,อ๋อ อีนี่ที่ดูรูปร่างคนได้จากข้อมือ ฮา,อ๋อ อีนี่ที่ดูรูปร่างคนได้จากข้อมือ ฮา,2025-10-23 17:59:34,"['อ๋อ', ' ', 'อี', 'นี่', 'ที่', 'ดู', 'รูปร่าง', 'คน', 'ได้', 'จาก', 'ข้อมือ', ' ', 'หัวเราะ']"
1979774953882009757,twitter,post,https://x.com/Prudence3rd/status/1979774953882009757,text,2025-10-19T05:01:46.000Z,selenium_x_scraper_v1,มึงโง่เลเวลเดียวกับติ่งเกาห**เลยจ้า,มึงโง่เลเวลเดียวกับติ่งเกาห**เลยจ้า,2025-10-23 17:59:34,"['มึง', 'โง่', 'เล', 'เวล', 'เดียว', 'กับ', 'ติ่ง', 'เกา', 'ห', ' ', 'เลย', 'จ้า']"
1979780569044336919,twitter,post,https://x.com/Tim8666/status/1979780569044336919,text,2025-10-19T05:24:04.000Z,selenium_x_scraper_v1,กุไม่โง่เท่ามึงแน่ๆจ้า,กุไม่โง่เท่ามึงแน่ๆจ้า,2025-10-23 17:59:34,"['กุ', 'ไม่', 'โง่', 'เท่า', 'มึง', 'แน่ๆ', 'จ้า']"
1979774690332926312,twitter,post,https://x.com/Tim8666/status/1979774690332926312,text,2025-10-19T05:00:43.000Z,selenium_x_scraper_v1,ธงปาเลสไตล์ไปไหนหมด,ธงปาเลสไตล์ไปไหนหมด,2025-10-23 17:59:34,"['ธง', 'ปา', 'เล', 'สไตล์', 'ไป', 'ไหน', 'หมด']"
1979718437149786126,twitter,post,https://x.com/NongNokheetad/status/1979718437149786126,text,2025-10-19T01:17:11.000Z,selenium_x_scraper_v1,Woke ฟรีปาเลสไตน์ตายกันหมดแล้ว,Woke ฟรีปาเลสไตน์ตายกันหมดแล้ว,2025-10-23 17:59:34,"['woke', ' ', 'ฟรี', 'ปาเลสไตน์', 'ตาย', 'กัน', 'หมด', 'แล้ว']"
1979716635788456276,twitter,post,https://x.com/SleeplessBKKNew/status/1979716635788456276,text,2025-10-19T01:10:01.000Z,selenium_x_scraper_v1,"เนื่องจากสื่อกระแสหลักไม่ยอมเสนอข่าวกลุ่มฮามาสไล่ฆ่าชาวบ้านในกาซา กงสุลอิสราเอลในนิวยอร์ก เลยซื้อโฆษณากลางไทม์สแควร์ เพื่อเปิดคลิปกลุ่มฮามาสกำลังไล่ประหารชีวิตชาวปาเลสไตน์ในกาซากันเองให้ชาวอเมริกันดู

ทางกงสุลใหญ่ที่ชื่อ Ofir Akunis ออกมาบอกว่า ""ฮามาสกำลังฆ่าคนปาเลสไตน์เป็นสิบๆ","เนื่องจากสื่อกระแสหลักไม่ยอมเสนอข่าวกลุ่มฮามาสไล่ฆ่าชาวบ้านในกาซา กงสุลอิสราเอลในนิวยอร์ก เลยซื้อโฆษณากลางไทม์สแควร์ เพื่อเปิดคลิปกลุ่มฮามาสกำลังไล่ประหารชีวิตชาวปาเลสไตน์ในกาซากันเองให้ชาวอเมริกันดู

ทางกงสุลใหญ่ที่ชื่อ Ofir Akunis ออกมาบอกว่า ""ฮามาสกำลังฆ่าคนปาเลสไตน์เป็นสิบๆ",2025-10-23 17:59:34,"['เนื่องจาก', 'สื่อ', 'กระแส', 'หลัก', 'ไม่', 'ยอม', 'เสนอ', 'ข่าว', 'กลุ่ม', 'หัวเราะ', 'มาส', 'ไล่', 'ฆ่า', 'ชาวบ้าน', 'ใน', 'กาซา', ' ', 'กงสุล', 'อิสราเอล', 'ใน', 'นิวยอร์ก', ' ', 'เลย', 'ซื้อ', 'โฆษณา', 'กลาง', 'ไทม์', 'สแควร์', ' ', 'เพื่อ', 'เปิด', 'คลิป', 'กลุ่ม', 'หัวเราะ', 'มาส', 'กำลัง', 'ไล่', 'ประหารชีวิต', 'ชาว', 'ปาเลสไตน์', 'ใน', 'กาซา', 'กันเอง', 'ให้', 'ชาว', 'อเมริกัน', 'ดู', ' ', 'ทาง', 'กงสุลใหญ่', 'ที่', 'ชื่อ', ' ', 'ofir', ' ', 'akunis', ' ', 'ออกมา', 'บอ', 'กว่า', ' ', 'หัวเราะ', 'มาส', 'กำลัง', 'ฆ่า', 'คน', 'ปาเลสไตน์', 'เป็นสิบๆ']"
1979556788950499778,twitter,post,https://x.com/PositivFuturist/status/1979556788950499778,text,2025-10-18T14:34:51.000Z,selenium_x_scraper_v1,"Chinese eat them.
Muslims are terrified of them.
Leftist streamers electrocute them.","Chinese eat them.
Muslims are terrified of them.
Leftist streamers electrocute them.",2025-10-23 17:59:34,"['chinese', ' ', 'eat', ' ', 'them', '.', ' ', 'muslims', ' ', 'are', ' ', 'terrified', ' ', 'of', ' ', 'them', '.', ' ', 'leftist', ' ', 'streamers', ' ', 'electrocute', ' ', 'them', '.']"
1979772248610467918,twitter,post,https://x.com/Tim8666/status/1979772248610467918,text,2025-10-19T04:51:01.000Z,selenium_x_scraper_v1,คนอ้วนทุกคน = ตัวแม่ according to fem ทวิต,คนอ้วนทุกคน = ตัวแม่ according to fem ทวิต,2025-10-23 17:59:34,"['คน', 'อ้วน', 'ทุกคน', ' ', 'ตัว', 'แม่', ' ', 'according', ' ', 'to', ' ', 'fem', ' ', 'ทวิ', 'ต']"
1979473535065325678,twitter,post,https://x.com/mansohui/status/1979473535065325678,text,2025-10-18T09:04:02.000Z,selenium_x_scraper_v1,มีคนฟิน แสดงว่าไม่เคยเห็นโปรปาเลสตีกันเอง 555555555,มีคนฟิน แสดงว่าไม่เคยเห็นโปรปาเลสตีกันเอง 555555555,2025-10-23 17:59:34,"['มี', 'คน', 'ฟิน', ' ', 'แสดงว่า', 'ไม่', 'เคย', 'เห็น', 'โปร', 'ปา', 'เล', 'สตี', 'กันเอง', ' ', 'หัวเราะ']"
1979440476416872758,twitter,post,https://x.com/Lovekylie792256/status/1979440476416872758,text,2025-10-18T06:52:40.000Z,selenium_x_scraper_v1,ก้ดีแล้วไง สะท้อนว่าเค้าไม่ได้โง่ที่ไหลตามกันทุกเรื่องแบบโว้ค,ก้ดีแล้วไง สะท้อนว่าเค้าไม่ได้โง่ที่ไหลตามกันทุกเรื่องแบบโว้ค,2025-10-23 17:59:34,"['ก้', 'ดีแล้ว', 'ไง', ' ', 'สะท้อน', 'ว่า', 'เค้า', 'ไม่', 'ได้', 'โง่', 'ที่', 'ไหล', 'ตาม', 'กัน', 'ทุก', 'เรื่อง', 'แบบ', 'โว้ค']"
1979542523254382689,twitter,post,https://x.com/nongmuleene/status/1979542523254382689,text,2025-10-18T13:38:10.000Z,selenium_x_scraper_v1,ไม่เข้าใจผู้ชายอะ ถ้าไม่รักไม่ชอบตั้งแต่แรกจะเข้าหาเพราะเงินอย่างเดียวหรอ มันแบบเพื่อไรวะแกละชีมิ้กก็เคยโดนแบบนี้ ตอนนี้มากะทิอีกคือชายแท้เปนโรคไรอะ,ไม่เข้าใจผู้ชายอะ ถ้าไม่รักไม่ชอบตั้งแต่แรกจะเข้าหาเพราะเงินอย่างเดียวหรอ มันแบบเพื่อไรวะแกละชีมิ้กก็เคยโดนแบบนี้ ตอนนี้มากะทิอีกคือชายแท้เปนโรคไรอะ,2025-10-23 17:59:34,"['ไม่', 'เข้าใจ', 'ผู้ชาย', 'อะ', ' ', 'ถ้า', 'ไม่', 'รัก', 'ไม่', 'ชอบ', 'ตั้งแต่แรก', 'จะ', 'เข้าหา', 'เพราะ', 'เงิน', 'อย่าง', 'เดียว', 'หรอ', ' ', 'มัน', 'แบบ', 'เพื่อ', 'ไร', 'วะ', 'แกละ', 'ชี', 'มิ้ก', 'ก็', 'เคย', 'โดน', 'แบบนี้', ' ', 'ตอนนี้', 'มา', 'กะทิ', 'อีก', 'คือ', 'ชาย', 'แท้', 'เปน', 'โรค', 'ไร', 'อะ']"
1979613580111786330,twitter,post,https://x.com/Tim8666/status/1979613580111786330,text,2025-10-18T18:20:31.000Z,selenium_x_scraper_v1,พฤติกรรมนี้มันไม่ได้แพร่หลายในผญหรอ งง ถามเหมือนโดนฝ่ายเดียว,พฤติกรรมนี้มันไม่ได้แพร่หลายในผญหรอ งง ถามเหมือนโดนฝ่ายเดียว,2025-10-23 17:59:34,"['พฤติกรรม', 'นี้', 'มัน', 'ไม่', 'ได้', 'แพร่หลาย', 'ใน', 'ผญ', 'หรอ', ' ', 'งง', ' ', 'ถาม', 'เหมือน', 'โดน', 'ฝ่าย', 'เดียว']"
1979599444963438754,twitter,post,https://x.com/chocolawoopy/status/1979599444963438754,text,2025-10-18T17:24:21.000Z,selenium_x_scraper_v1,ก็ไม่เข้าใจว่าทำไมต้องอคติกับการใช้ชีวิตคนอื่น อ้างสี่อ้างแปดแล้วบอกหวังดี เขาไม่ได้ขอคำแนะนำจากใครด้วยซ้ำ ไว้ถ้าเขาขอจะไปบอกก็ไม่มีใครว่านะ คือเขาอยู่ของเขาดี ๆ ด้วยซ้ำ แต่มีคนบางประเภทเอาเขาไปว่าเสีย ๆ หาย ๆ เพื่อกลบปมด้อยตัวเอง ก็น่าตลกดีเหมือนกัน,ก็ไม่เข้าใจว่าทำไมต้องอคติกับการใช้ชีวิตคนอื่น อ้างสี่อ้างแปดแล้วบอกหวังดี เขาไม่ได้ขอคำแนะนำจากใครด้วยซ้ำ ไว้ถ้าเขาขอจะไปบอกก็ไม่มีใครว่านะ คือเขาอยู่ของเขาดี ๆ ด้วยซ้ำ แต่มีคนบางประเภทเอาเขาไปว่าเสีย ๆ หาย ๆ เพื่อกลบปมด้อยตัวเอง ก็น่าตลกดีเหมือนกัน,2025-10-23 17:59:34,"['ก็', 'ไม่', 'เข้าใจ', 'ว่า', 'ทำไม', 'ต้อง', 'อคติ', 'กับ', 'การ', 'ใช้ชีวิต', 'คนอื่น', ' ', 'อ้าง', 'สี่', 'อ้าง', 'แปด', 'แล้ว', 'บอก', 'หวังดี', ' ', 'เขา', 'ไม่', 'ได้', 'ขอ', 'คำแนะนำ', 'จาก', 'ใคร', 'ด้วยซ้ำ', ' ', 'ไว้', 'ถ้า', 'เขา', 'ขอ', 'จะ', 'ไป', 'บอก', 'ก็', 'ไม่', 'มี', 'ใคร', 'ว่า', 'นะ', ' ', 'คือ', 'เขา', 'อยู่', 'ของ', 'เขา', 'ดี ๆ', ' ', 'ด้วยซ้ำ', ' ', 'แต่', 'มี', 'คน', 'บาง', 'ประเภท', 'เอา', 'เขา', 'ไป', 'ว่า', 'เสีย', ' ', 'ๆ', ' ', 'หาย', ' ', 'ๆ', ' ', 'เพื่อ', 'กลบ', 'ปมด้อย', 'ตัวเอง', ' ', 'ก็', 'น่า', 'ตลก', 'ดี', 'เหมือนกัน']"
1979613359315337230,twitter,post,https://x.com/Tim8666/status/1979613359315337230,text,2025-10-18T18:19:38.000Z,selenium_x_scraper_v1,I’m not reading all that จ้า,I’m not reading all that จ้า,2025-10-23 17:59:34,"['i', ' ', 'm', ' ', 'not', ' ', 'reading', ' ', 'all', ' ', 'that', ' ', 'จ้า']"
1979613212283932987,twitter,post,https://x.com/Tim8666/status/1979613212283932987,text,2025-10-18T18:19:03.000Z,selenium_x_scraper_v1,ไม่มีอะไรโง่เท่าติ่งเกาหลีละจ้า,ไม่มีอะไรโง่เท่าติ่งเกาหลีละจ้า,2025-10-23 17:59:34,"['ไม่', 'มี', 'อะไร', 'โง่', 'เท่า', 'ติ่ง', 'เกาหลี', 'ละ', 'จ้า']"
1979587408812515352,twitter,post,https://x.com/buck_nd/status/1979587408812515352,text,2025-10-18T16:36:31.000Z,selenium_x_scraper_v1,แอคนี้อีกแล้วหรอ,แอคนี้อีกแล้วหรอ,2025-10-23 17:59:34,"['แอ', 'ค', 'นี้', 'อีกแล้ว', 'หรอ']"
1979597481748160815,twitter,post,https://x.com/Tim8666/status/1979597481748160815,text,2025-10-18T17:16:33.000Z,selenium_x_scraper_v1,ไปฟ้องแม่มึงยัง อีติ่ง,ไปฟ้องแม่มึงยัง อีติ่ง,2025-10-23 17:59:34,"['ไป', 'ฟ้อง', 'แม่', 'มึง', 'ยัง', ' ', 'อี', 'ติ่ง']"
1979587811222356167,twitter,post,https://x.com/chocolawoopy/status/1979587811222356167,text,2025-10-18T16:38:07.000Z,selenium_x_scraper_v1,แล้วมันเรื่องของใคร ตัวเองมีปมขนาดไหนกันถึงได้ทำตัวตัดความมั่นใจคนอื่นเขา แล้วในภาพก็ไม่ได้แต่งตัวเยอะอะไรด้วย เพี้ยนป้ะ,แล้วมันเรื่องของใคร ตัวเองมีปมขนาดไหนกันถึงได้ทำตัวตัดความมั่นใจคนอื่นเขา แล้วในภาพก็ไม่ได้แต่งตัวเยอะอะไรด้วย เพี้ยนป้ะ,2025-10-23 17:59:34,"['แล้ว', 'มัน', 'เรื่อง', 'ของ', 'ใคร', ' ', 'ตัวเอง', 'มี', 'ปม', 'ขนาด', 'ไหน', 'กัน', 'ถึง', 'ได้', 'ทำตัว', 'ตัด', 'ความมั่นใจ', 'คนอื่น', 'เขา', ' ', 'แล้ว', 'ใน', 'ภาพ', 'ก็', 'ไม่', 'ได้', 'แต่งตัว', 'เยอะ', 'อะไร', 'ด้วย', ' ', 'เพี้ยน', 'ป้ะ']"
1979596742191694306,twitter,post,https://x.com/Tim8666/status/1979596742191694306,text,2025-10-18T17:13:37.000Z,selenium_x_scraper_v1,แล้งมันเรื่องของใคร? ใข่ชีวิตอยุ่ร่วมกับคนอื่น กาละเทศะ time and place เนอะ ถ้าคนอื่นรุ้สึกแล้วเตือนหลายๆคนบางทีต้องกลับมาคิด ไม่ใช่ว่าตัเองเป็นแม่เพราะมีเด็กเปรตบนทวิตอวย,แล้งมันเรื่องของใคร? ใข่ชีวิตอยุ่ร่วมกับคนอื่น กาละเทศะ time and place เนอะ ถ้าคนอื่นรุ้สึกแล้วเตือนหลายๆคนบางทีต้องกลับมาคิด ไม่ใช่ว่าตัเองเป็นแม่เพราะมีเด็กเปรตบนทวิตอวย,2025-10-23 17:59:34,"['แล้ง', 'มัน', 'เรื่อง', 'ของ', 'ใคร', '?', ' ', 'ใข่', 'ชี', 'วิ', 'ตอ', 'ยุ่', 'ร่วมกับ', 'คนอื่น', ' ', 'กา', 'ละ', 'เทศะ', ' ', 'time', ' ', 'and', ' ', 'place', ' ', 'เนอะ', ' ', 'ถ้า', 'คนอื่น', 'รุ้', 'สึก', 'แล้ว', 'เตือน', 'หลาย', 'ๆคน', 'บางที', 'ต้อง', 'กลับมา', 'คิด', ' ', 'ไม่', 'ใช่', 'ว่า', 'ตั', 'เอง', 'เป็น', 'แม่', 'เพราะ', 'มี', 'เด็ก', 'เปรต', 'บน', 'ทวิ', 'ตอ', 'วย']"
1979503023849460081,twitter,post,https://x.com/Tim8666/status/1979503023849460081,text,2025-10-18T11:01:12.000Z,selenium_x_scraper_v1,"ผชแท้ เตือน = เหยียดเพศ
เกย์เตือน = เกย์ก็ผชคนนึงที่ มีความ misogyny 
ผญเตือน = pick me, internalized misogyny ทำตัวเอาใจผช

สรุปคือไม่มีใครเตือนมึงได้ เพราะสังคมทวิตเตอร์พวกแบบนี้เป็นตัวแม่ อีสัส เปลือยไปสยามให้มันจบๆเถอะ55555","ผชแท้ เตือน = เหยียดเพศ
เกย์เตือน = เกย์ก็ผชคนนึงที่ มีความ misogyny 
ผญเตือน = pick me, internalized misogyny ทำตัวเอาใจผช

สรุปคือไม่มีใครเตือนมึงได้ เพราะสังคมทวิตเตอร์พวกแบบนี้เป็นตัวแม่ อีสัส เปลือยไปสยามให้มันจบๆเถอะ55555",2025-10-23 17:59:34,"['ผช', 'แท้', ' ', 'เตือน', ' ', 'เหยียด', 'เพศ', ' ', 'เกย์', 'เตือน', ' ', 'เกย์', 'ก็', 'ผชคน', 'นึง', 'ที่', ' ', 'มี', 'ความ', ' ', 'misogyny', ' ', 'ผญ', 'เตือน', ' ', 'pick', ' ', 'me', ',', ' ', 'internalized', ' ', 'misogyny', ' ', 'ทำตัว', 'เอาใจ', 'ผช', ' ', 'สรุป', 'คือ', 'ไม่', 'มี', 'ใคร', 'เตือน', 'มึง', 'ได้', ' ', 'เพราะ', 'สังคม', 'ทวิตเตอร์', 'พวก', 'แบบนี้', 'เป็นตัว', 'แม่', ' ', 'อี', 'สัส', ' ', 'เปลือย', 'ไป', 'สยาม', 'ให้', 'มัน', 'จบ', 'ๆ', 'เถอะ', 'หัวเราะ']"
1979030836600070638,twitter,post,https://x.com/Tim8666/status/1979030836600070638,text,2025-10-17T03:44:54.000Z,selenium_x_scraper_v1,เจบมากเลย แงๆๆๆ ร้อวไห้อยุจ้า,เจบมากเลย แงๆๆๆ ร้อวไห้อยุจ้า,2025-10-23 17:59:34,"['เจ', 'บ', 'มาก', 'เลย', ' ', 'แง', 'ๆๆๆ', ' ', 'ร้อว', 'ไห้', 'อ', 'ยุ', 'จ้า']"
1979007634058399895,twitter,post,https://x.com/68rain_bow/status/1979007634058399895,text,2025-10-17T02:12:42.000Z,selenium_x_scraper_v1,เลสเหี้ยไรไอโง่ จะด่าก็ด่าให้ถูกหน่อยแทนที่กุจะโกรธกุขำแทนละ ตัวตลกสังคม,เลสเหี้ยไรไอโง่ จะด่าก็ด่าให้ถูกหน่อยแทนที่กุจะโกรธกุขำแทนละ ตัวตลกสังคม,2025-10-23 17:59:34,"['เลส', 'เหี้ย', 'ไร', 'ไอ', 'โง่', ' ', 'จะ', 'ด่า', 'ก็', 'ด่า', 'ให้', 'ถูก', 'หน่อย', 'แทนที่', 'กุ', 'จะ', 'โกรธ', 'กุ', 'ขำ', 'แทน', 'ละ', ' ', 'ตัวตลก', 'สังคม']"
1979023647856603425,twitter,post,https://x.com/Tim8666/status/1979023647856603425,text,2025-10-17T03:16:20.000Z,selenium_x_scraper_v1,ทอมมอมหรอ อุกว่าเดิม,ทอมมอมหรอ อุกว่าเดิม,2025-10-23 17:59:34,"['ทอม', 'มอม', 'หรอ', ' ', 'อุ', 'กว่า', 'เดิม']"
1978782449875243124,twitter,post,https://x.com/CrunchAlias/status/1978782449875243124,text,2025-10-16T11:17:54.000Z,selenium_x_scraper_v1,"""Lesbian"" is not a gender.","""Lesbian"" is not a gender.",2025-10-23 17:59:34,"['lesbian', ' ', 'is', ' ', 'not', ' ', 'a', ' ', 'gender', '.']"
1722129345274417241,twitter,post,https://x.com/yyadaa2000/status/1722129345274417241,text,2023-11-08T05:50:06.000Z,selenium_x_scraper_v1,,,2025-10-23 17:59:34,[]
1978843267656507884,twitter,post,https://x.com/Just_cat_talk/status/1978843267656507884,text,2025-10-16T15:19:34.000Z,selenium_x_scraper_v1,I don't understand thai.. but please be kind to my girl namtan tipnaree na ka~~ love you ,I don't understand thai.. but please be kind to my girl namtan tipnaree na ka~~ love you ,2025-10-23 17:59:34,"['i', ' ', 'don', ""'t"", ' ', 'understand', ' ', 'thai', '..', ' ', 'but', ' ', 'please', ' ', 'be', ' ', 'kind', ' ', 'to', ' ', 'my', ' ', 'girl', ' ', 'namtan', ' ', 'tipnaree', ' ', 'na', ' ', 'ka', ' ', 'love', ' ', 'you']"
1979002085912743986,twitter,post,https://x.com/Tim8666/status/1979002085912743986,text,2025-10-17T01:50:40.000Z,selenium_x_scraper_v1,No. This bitch is mean as fuck. Wake up,No. This bitch is mean as fuck. Wake up,2025-10-23 17:59:34,"['no', '.', ' ', 'this', ' ', 'bitch', ' ', 'is', ' ', 'mean', ' ', 'as', ' ', 'fuck', '.', ' ', 'wake', ' ', 'up']"
1978977521992634882,twitter,post,https://x.com/68rain_bow/status/1978977521992634882,text,2025-10-17T00:13:03.000Z,selenium_x_scraper_v1,ฝันหรอ55555กระจอกอย่างงี้ไม่น่าไปไหนไกลเกินหน้าบ้าน,ฝันหรอ55555กระจอกอย่างงี้ไม่น่าไปไหนไกลเกินหน้าบ้าน,2025-10-23 17:59:34,"['ฝัน', 'หรอ', 'หัวเราะ', 'กระจอก', 'อย่างงี้', 'ไม่', 'น่า', 'ไป', 'ไหน', 'ไกล', 'เกิน', 'หน้าบ้าน']"
