id,platform,platform_type,url,content_type,timestamp,scraper_module,text,raw_text,scrape_date,tokens
1980540960682701179,twitter,post,https://x.com/thekingofotaku/status/1980540960682701179,text,2025-10-21T07:45:36.000Z,selenium_x_scraper_v1,"มึงต้องจ่ายเงิน ซื้อ photobook มันไม่ได้ง่ายขนาดนั้น
อีกอย่างเขามีทีมงาน กองถ่าย ไปถ่ายที่ไม่มีคน 
ไม่ใช่นึกจะใส่บิกินี่เดินกลางสยาม 

มึงบ้าป่ะเนี่ย

จะแถให้การแต่งตัวโป๊ในที่สาธารณะถูกให้ได้","มึงต้องจ่ายเงิน ซื้อ photobook มันไม่ได้ง่ายขนาดนั้น
อีกอย่างเขามีทีมงาน กองถ่าย ไปถ่ายที่ไม่มีคน 
ไม่ใช่นึกจะใส่บิกินี่เดินกลางสยาม 

มึงบ้าป่ะเนี่ย

จะแถให้การแต่งตัวโป๊ในที่สาธารณะถูกให้ได้",2025-11-29 08:18:55,"['มึง', 'ต้อง', 'จ่าย', 'เงิน', ' ', 'ซื้อ', ' ', 'photobook', ' ', 'มัน', 'ไม่', 'ได้', 'ง่าย', 'ขนาด', 'นั้น', ' ', 'อีก', 'อย่าง', 'เขา', 'มี', 'ทีมงาน', ' ', 'กอง', 'ถ่าย', ' ', 'ไป', 'ถ่าย', 'ที่', 'ไม่', 'มี', 'คน', ' ', 'ไม่', 'ใช่', 'นึก', 'จะ', 'ใส่', 'บิกินี่', 'เดิน', 'กลาง', 'สยาม', ' ', 'มึง', 'บ้า', 'ป่ะ', 'เนี่ย', ' ', 'จะ', 'แถ', 'ให้การ', 'แต่งตัว', 'โป๊', 'ใน', 'ที่สาธารณะ', 'ถูก', 'ให้ได้']"
1980536357245317275,twitter,post,https://x.com/G__r4l/status/1980536357245317275,text,2025-10-21T07:27:18.000Z,selenium_x_scraper_v1,พึ่งบอกว่าครอบครัวใครครอบครัวมัน อันนี้เมาอะไรมาหรอคะ ดาราใช่คนสอนเด็กเป็นหลักหรอ เป็นผู้ปกครองอบรมเด็กหรอคะ ก็ไม่นะ,พึ่งบอกว่าครอบครัวใครครอบครัวมัน อันนี้เมาอะไรมาหรอคะ ดาราใช่คนสอนเด็กเป็นหลักหรอ เป็นผู้ปกครองอบรมเด็กหรอคะ ก็ไม่นะ,2025-11-29 08:18:55,"['พึ่ง', 'บอ', 'กว่า', 'ครอบครัว', 'ใคร', 'ครอบครัว', 'มัน', ' ', 'อันนี้', 'เมา', 'อะไร', 'มา', 'หรอ', 'คะ', ' ', 'ดารา', 'ใช่', 'คน', 'สอน', 'เด็ก', 'เป็นหลัก', 'หรอ', ' ', 'เป็น', 'ผู้ปกครอง', 'อบรม', 'เด็ก', 'หรอ', 'คะ', ' ', 'ก็', 'ไม่', 'นะ']"
1980538455341064407,twitter,post,https://x.com/thekingofotaku/status/1980538455341064407,text,2025-10-21T07:35:39.000Z,selenium_x_scraper_v1,"ดาราไม่ใช่บุคคลสาธารณะที่เป็นคนของสังคมเหรอ

เวลาได้ชื่อเสียงก็อ้างเป็นคนแบบอย่างของสังคม

เวลาแบบนี้ก็ปัดความรับผิดชอบบอกไม่ใช่แบบอย่างจองสังคม
เด็กมันทำเองได้เหรอ ผลักภาระให้พ่อแม่ต้องคอยห้ามปราม 

แต่เด็กก็อ้างว่าดาราทำได้ ทำไมหนูทำไม่ได้

เห็นม่ะ นี่แหละความเดือดร้อนไม่ต้องแถ","ดาราไม่ใช่บุคคลสาธารณะที่เป็นคนของสังคมเหรอ

เวลาได้ชื่อเสียงก็อ้างเป็นคนแบบอย่างของสังคม

เวลาแบบนี้ก็ปัดความรับผิดชอบบอกไม่ใช่แบบอย่างจองสังคม
เด็กมันทำเองได้เหรอ ผลักภาระให้พ่อแม่ต้องคอยห้ามปราม 

แต่เด็กก็อ้างว่าดาราทำได้ ทำไมหนูทำไม่ได้

เห็นม่ะ นี่แหละความเดือดร้อนไม่ต้องแถ",2025-11-29 08:18:55,"['ดารา', 'ไม่', 'ใช่', 'บุคคล', 'สาธารณะ', 'ที่', 'เป็น', 'คน', 'ของ', 'สังคม', 'เหรอ', ' ', 'เวลา', 'ได้', 'ชื่อเสียง', 'ก็', 'อ้าง', 'เป็น', 'คน', 'แบบอย่าง', 'ของ', 'สังคม', ' ', 'เวลา', 'แบบนี้', 'ก็', 'ปัด', 'ความรับผิดชอบ', 'บอก', 'ไม่', 'ใช่', 'แบบอย่าง', 'จอง', 'สังคม', ' ', 'เด็ก', 'มัน', 'ทำ', 'เอง', 'ได้', 'เหรอ', ' ', 'ผลักภาระ', 'ให้', 'พ่อแม่', 'ต้อง', 'คอย', 'ห้ามปราม', ' ', 'แต่', 'เด็ก', 'ก็', 'อ้างว่า', 'ดารา', 'ทำได้', ' ', 'ทำไม', 'หนู', 'ทำ', 'ไม่', 'ได้', ' ', 'เห็น', 'ม่ะ', ' ', 'นี่แหละ', 'ความเดือดร้อน', 'ไม่ต้อง', 'แถ']"
1980537169031885116,twitter,post,https://x.com/G__r4l/status/1980537169031885116,text,2025-10-21T07:30:32.000Z,selenium_x_scraper_v1,ก็นั่นไงคะ คำว่าไม่รู้ แค่นั้นก็รู้ได้แล้วค่ะว่าพี่ไม่ฟังความเห็นหรือแนวคิดอื่นอ่ะค่ะ แล้วก็ลงรูปนี้ไปกี่เมนชั่นกี่โควตแล้วค่ะ ลงแต่รูปเดิมๆเหมือนไม่มีคนอื่นให้แคปมาลงตัวอย่างเลยค่ะ,ก็นั่นไงคะ คำว่าไม่รู้ แค่นั้นก็รู้ได้แล้วค่ะว่าพี่ไม่ฟังความเห็นหรือแนวคิดอื่นอ่ะค่ะ แล้วก็ลงรูปนี้ไปกี่เมนชั่นกี่โควตแล้วค่ะ ลงแต่รูปเดิมๆเหมือนไม่มีคนอื่นให้แคปมาลงตัวอย่างเลยค่ะ,2025-11-29 08:18:55,"['ก็', 'นั่นไง', 'คะ', ' ', 'คำ', 'ว่า', 'ไม่', 'รู้', ' ', 'แค่นั้น', 'ก็', 'รู้', 'ได้', 'แล้ว', 'ค่ะ', 'ว่า', 'พี่', 'ไม่', 'ฟัง', 'ความเห็น', 'หรือ', 'แนวคิด', 'อื่น', 'อ่ะ', 'ค่ะ', ' ', 'แล้วก็', 'ลง', 'รูป', 'นี้', 'ไป', 'กี่', 'เมน', 'ชั่น', 'กี่', 'โค', 'วต', 'แล้ว', 'ค่ะ', ' ', 'ลง', 'แต่', 'รูป', 'เดิม', 'ๆ', 'เหมือน', 'ไม่', 'มี', 'คนอื่น', 'ให้', 'แคป', 'มา', 'ลง', 'ตัวอย่าง', 'เลย', 'ค่ะ']"
1980537953190596617,twitter,post,https://x.com/thekingofotaku/status/1980537953190596617,text,2025-10-21T07:33:39.000Z,selenium_x_scraper_v1,"ไม่รู้หมายความว่า
ไม่รู้ทำไมพ่อแม่บ้างบ้านไม่อายที่ลูกแต่งตัวโป๊ในที่สาธารณะไง","ไม่รู้หมายความว่า
ไม่รู้ทำไมพ่อแม่บ้างบ้านไม่อายที่ลูกแต่งตัวโป๊ในที่สาธารณะไง",2025-11-29 08:18:55,"['ไม่', 'รู้', 'หมายความว่า', ' ', 'ไม่', 'รู้', 'ทำไม', 'พ่อแม่', 'บ้าง', 'บ้าน', 'ไม่', 'อาย', 'ที่', 'ลูก', 'แต่งตัว', 'โป๊', 'ใน', 'ที่สาธารณะ', 'ไง']"
1980535111847428433,twitter,post,https://x.com/G__r4l/status/1980535111847428433,text,2025-10-21T07:22:21.000Z,selenium_x_scraper_v1,ก็ครอบครัวใครครอบครัวมันอ่าค่ะ ง่ายแค่นี้เอง ,ก็ครอบครัวใครครอบครัวมันอ่าค่ะ ง่ายแค่นี้เอง ,2025-11-29 08:18:55,"['ก็', 'ครอบครัว', 'ใคร', 'ครอบครัว', 'มัน', 'อ่า', 'ค่ะ', ' ', 'ง่าย', 'แค่นี้', 'เอง']"
1980509227027468429,twitter,post,https://x.com/thekingofotaku/status/1980509227027468429,text,2025-10-21T05:39:30.000Z,selenium_x_scraper_v1,"ราชาโอตาคุ
ชายผู้นั่งบนบัลลังก์
และปกครองอาณาจักรของเหล่าโอตาคุ

ถ้าราชาไม่สู้เพื่อประชาชนโอตาคุ
แล้วจะกล้าเรียกตัวเองว่าราชาโอตาคุได้ไง","ราชาโอตาคุ
ชายผู้นั่งบนบัลลังก์
และปกครองอาณาจักรของเหล่าโอตาคุ

ถ้าราชาไม่สู้เพื่อประชาชนโอตาคุ
แล้วจะกล้าเรียกตัวเองว่าราชาโอตาคุได้ไง",2025-11-29 08:18:55,"['ราชา', 'โอ', 'ตา', 'คุ', ' ', 'ชาย', 'ผู้', 'นั่ง', 'บน', 'บัลลังก์', ' ', 'และ', 'ปกครอง', 'อาณาจักร', 'ของ', 'เหล่า', 'โอ', 'ตา', 'คุ', ' ', 'ถ้า', 'ราชา', 'ไม่', 'สู้', 'เพื่อ', 'ประชาชน', 'โอ', 'ตา', 'คุ', ' ', 'แล้', 'วจะ', 'กล้า', 'เรียก', 'ตัวเอง', 'ว่า', 'ราชา', 'โอ', 'ตา', 'คุ', 'ได้', 'ไง']"
1980503799925281203,twitter,post,https://x.com/kanospon11/status/1980503799925281203,text,2025-10-21T05:17:56.000Z,selenium_x_scraper_v1,"แล้วกูคุกคามยังไง?
แค่อยากเห็นบิกินี่?","แล้วกูคุกคามยังไง?
แค่อยากเห็นบิกินี่?",2025-11-29 08:18:55,"['แล้ว', 'กู', 'คุกคาม', 'ยังไง', '?', ' ', 'แค่', 'อยาก', 'เห็น', 'บิกินี่', '?']"
1980506895481024710,twitter,post,https://x.com/kanospon11/status/1980506895481024710,text,2025-10-21T05:30:14.000Z,selenium_x_scraper_v1,ก้ใช่ไงคะ ของมึงจะไปมีได้ไง เล็กเหมือนหัมเอ้ยหัว,ก้ใช่ไงคะ ของมึงจะไปมีได้ไง เล็กเหมือนหัมเอ้ยหัว,2025-11-29 08:18:55,"['ก้', 'ใช่', 'ไง', 'คะ', ' ', 'ของ', 'มึง', 'จะ', 'ไป', 'มี', 'ได้', 'ไง', ' ', 'เล็ก', 'เหมือน', 'หัม', 'เอ้ย', 'หัว']"
1980507818718560751,twitter,post,https://x.com/thekingofotaku/status/1980507818718560751,text,2025-10-21T05:33:54.000Z,selenium_x_scraper_v1,ไม่เคยเห็นอย่ามโน,ไม่เคยเห็นอย่ามโน,2025-11-29 08:18:55,"['ไม่', 'เคย', 'เห็น', 'อย่า', 'มโน']"
1980506944059387912,twitter,post,https://x.com/thekingofotaku/status/1980506944059387912,text,2025-10-21T05:30:26.000Z,selenium_x_scraper_v1,เด็กเปรตๆแบบพวกมึงมาสอนกู?,เด็กเปรตๆแบบพวกมึงมาสอนกู?,2025-11-29 08:18:55,"['เด็ก', 'เปรต', 'ๆ', 'แบบ', 'พวก', 'มึง', 'มา', 'สอน', 'กู', '?']"
1980505017946956004,twitter,post,https://x.com/kanospon11/status/1980505017946956004,text,2025-10-21T05:22:46.000Z,selenium_x_scraper_v1,,,2025-11-29 08:18:55,[]
1980505592851755212,twitter,post,https://x.com/thekingofotaku/status/1980505592851755212,text,2025-10-21T05:25:04.000Z,selenium_x_scraper_v1,น่าจะของมึง,น่าจะของมึง,2025-11-29 08:18:55,"['น่าจะ', 'ของ', 'มึง']"
1980505535716938160,twitter,post,https://x.com/thekingofotaku/status/1980505535716938160,text,2025-10-21T05:24:50.000Z,selenium_x_scraper_v1,"แต่เรากำลังถกประเด็นเจนิส
จะลากคนอื่นมาทำไม?","แต่เรากำลังถกประเด็นเจนิส
จะลากคนอื่นมาทำไม?",2025-11-29 08:18:55,"['แต่', 'เรา', 'กำลัง', 'ถก', 'ประเด็น', 'เจ', 'นิ', 'ส', ' ', 'จะ', 'ลาก', 'คนอื่น', 'มา', 'ทำไม', '?']"
1980504763021312504,twitter,post,https://x.com/kanospon11/status/1980504763021312504,text,2025-10-21T05:21:46.000Z,selenium_x_scraper_v1,จะเหี้ยจะหล่อจะดีแด่มาจากไหนมองเฉยๆใครจะมาด่ามึง แต่ถ้ามองแล้วคุกคามเอาไปทำเรื่องที่ไม่ดีอันนี้อะไม่มีใครสั่งสอน อีกอย่างใครจะแต่งตัวอะไรยังไงก็ได้ มันไปแต่งบนหัวมึงหร๊อ ก็ไม่ แล้วจะไปสลนกับการแต่งตัวของคนอื่นทำไม แล้วมีสิทอะไรไปบอกให้คนอื่นแต่งตัวเพื่อสนองนี้ดตัวเองหรอควัฟเพ่,จะเหี้ยจะหล่อจะดีแด่มาจากไหนมองเฉยๆใครจะมาด่ามึง แต่ถ้ามองแล้วคุกคามเอาไปทำเรื่องที่ไม่ดีอันนี้อะไม่มีใครสั่งสอน อีกอย่างใครจะแต่งตัวอะไรยังไงก็ได้ มันไปแต่งบนหัวมึงหร๊อ ก็ไม่ แล้วจะไปสลนกับการแต่งตัวของคนอื่นทำไม แล้วมีสิทอะไรไปบอกให้คนอื่นแต่งตัวเพื่อสนองนี้ดตัวเองหรอควัฟเพ่,2025-11-29 08:18:55,"['จะ', 'เหี้ย', 'จะ', 'หล่อ', 'จะ', 'ดี', 'แด่', 'มาจาก', 'ไหน', 'มอง', 'เฉย', 'ๆ', 'ใคร', 'จะ', 'มา', 'ด่า', 'มึง', ' ', 'แต่', 'ถ้า', 'มอง', 'แล้ว', 'คุกคาม', 'เอา', 'ไป', 'ทำ', 'เรื่อง', 'ที่', 'ไม่', 'ดี', 'อันนี้', 'อะ', 'ไม่', 'มี', 'ใคร', 'สั่งสอน', ' ', 'อีก', 'อย่าง', 'ใคร', 'จะ', 'แต่งตัว', 'อะไร', 'ยังไง', 'ก็ได้', ' ', 'มัน', 'ไป', 'แต่ง', 'บน', 'หัว', 'มึง', 'หร๊อ', ' ', 'ก็', 'ไม่', ' ', 'แล้', 'วจะ', 'ไป', 'สลน', 'กับ', 'การ', 'แต่งตัว', 'ของ', 'คนอื่น', 'ทำไม', ' ', 'แล้ว', 'มี', 'สิ', 'ท', 'อะไร', 'ไป', 'บอก', 'ให้', 'คนอื่น', 'แต่งตัว', 'เพื่อ', 'สนอง', 'นี้', 'ด', 'ตัวเอง', 'หรอ', 'ควัฟ', 'เพ่']"
1980505407048315103,twitter,post,https://x.com/thekingofotaku/status/1980505407048315103,text,2025-10-21T05:24:19.000Z,selenium_x_scraper_v1,"แล้วมองแล้วคุกคามเป็นยังไงครับ
 มองแบบไหน
ไม่ใช่อคติตัวเอง
ที่จะชี้ว่าใครคนไหนคุกคาม ไม่คุกคามไม่ใช่เหรอ","แล้วมองแล้วคุกคามเป็นยังไงครับ
 มองแบบไหน
ไม่ใช่อคติตัวเอง
ที่จะชี้ว่าใครคนไหนคุกคาม ไม่คุกคามไม่ใช่เหรอ",2025-11-29 08:18:55,"['แล้ว', 'มอง', 'แล้ว', 'คุกคาม', 'เป็น', 'ยังไง', 'ครับ', ' ', 'มอง', 'แบบ', 'ไหน', ' ', 'ไม่', 'ใช่', 'อคติ', 'ตัวเอง', ' ', 'ที่จะ', 'ชี้', 'ว่า', 'ใคร', 'คน', 'ไหน', 'คุกคาม', ' ', 'ไม่', 'คุกคาม', 'ไม่', 'ใช่', 'เหรอ']"
1980504126426607778,twitter,post,https://x.com/thekingofotaku/status/1980504126426607778,text,2025-10-21T05:19:14.000Z,selenium_x_scraper_v1,ก็ใช่อยากเห็นมิวสิคใส่บิกินี่,ก็ใช่อยากเห็นมิวสิคใส่บิกินี่,2025-11-29 08:18:55,"['ก็', 'ใช่', 'อยาก', 'เห็น', 'มิวสิค', 'ใส่', 'บิกินี่']"
1980497551066567015,twitter,post,https://x.com/miokopls/status/1980497551066567015,text,2025-10-21T04:53:06.000Z,selenium_x_scraper_v1,แถอะไรไม่ใส่หมวกกันน๊อคคือผิดก็ว่าไปตามผิด แต่นี่พูดถึงเรื่องแต่งตัวโป๊เพราะมันไม่ได้ผิดไม่ได้แก้ผ้าโชว์ใครแค่แต่งโป๊,แถอะไรไม่ใส่หมวกกันน๊อคคือผิดก็ว่าไปตามผิด แต่นี่พูดถึงเรื่องแต่งตัวโป๊เพราะมันไม่ได้ผิดไม่ได้แก้ผ้าโชว์ใครแค่แต่งโป๊,2025-11-29 08:18:55,"['แถ', 'อะไร', 'ไม่', 'ใส่', 'หมวก', 'กัน', 'น๊อค', 'คือ', 'ผิด', 'ก็', 'ว่า', 'ไป', 'ตาม', 'ผิด', ' ', 'แต่', 'นี่', 'พูดถึง', 'เรื่อง', 'แต่งตัว', 'โป๊', 'เพราะ', 'มัน', 'ไม่', 'ได้', 'ผิด', 'ไม่', 'ได้', 'แก้ผ้า', 'โชว์', 'ใคร', 'แค่', 'แต่ง', 'โป๊']"
1980503937926197482,twitter,post,https://x.com/thekingofotaku/status/1980503937926197482,text,2025-10-21T05:18:29.000Z,selenium_x_scraper_v1,แต่งโป๊ก็ผิด เผยเรือนร่างร่างกาย,แต่งโป๊ก็ผิด เผยเรือนร่างร่างกาย,2025-11-29 08:18:55,"['แต่ง', 'โป๊', 'ก็', 'ผิด', ' ', 'เผย', 'เรือนร่าง', 'ร่างกาย']"
1980502918622245273,twitter,post,https://x.com/kanospon11/status/1980502918622245273,text,2025-10-21T05:14:26.000Z,selenium_x_scraper_v1,สรุปไม่ได้ขึ้นอยู่กับเรื่องศีลธรรมหรือการสั่งสอนของพ่อให้เซฟลูกตัวเอง แต่ขึ้นอยู่กับหน้าตาคนขอดูสินะ แบบนี้ลูกพี่โชจู๋จะไม่อายหรอที่ได้ความเล็กมาจากพ่อ อีกอย่างกูขอดูจู๋กับพี่มึงขอดูบิกีนี่มันก็คือการสนองนี้ดตัวเองโดยการเซ็กชวลคนอื่นปะ มันคือการไม่ให้เกียรติคนอื่นไง งงไร,สรุปไม่ได้ขึ้นอยู่กับเรื่องศีลธรรมหรือการสั่งสอนของพ่อให้เซฟลูกตัวเอง แต่ขึ้นอยู่กับหน้าตาคนขอดูสินะ แบบนี้ลูกพี่โชจู๋จะไม่อายหรอที่ได้ความเล็กมาจากพ่อ อีกอย่างกูขอดูจู๋กับพี่มึงขอดูบิกีนี่มันก็คือการสนองนี้ดตัวเองโดยการเซ็กชวลคนอื่นปะ มันคือการไม่ให้เกียรติคนอื่นไง งงไร,2025-11-29 08:18:55,"['สรุป', 'ไม่', 'ได้', 'ขึ้นอยู่กับ', 'เรื่อง', 'ศีลธรรม', 'หรือ', 'การ', 'สั่งสอน', 'ของ', 'พ่อ', 'ให้', 'เซฟ', 'ลูก', 'ตัวเอง', ' ', 'แต่', 'ขึ้นอยู่กับ', 'หน้าตา', 'คน', 'ขอ', 'ดู', 'สิ', 'นะ', ' ', 'แบบนี้', 'ลูกพี่', 'โช', 'จู๋', 'จะ', 'ไม่', 'อาย', 'หรอ', 'ที่', 'ได้ความ', 'เล็ก', 'มาจาก', 'พ่อ', ' ', 'อีก', 'อย่าง', 'กู', 'ขอ', 'ดู', 'จู๋', 'กับ', 'พี่', 'มึง', 'ขอ', 'ดู', 'บิ', 'กี', 'นี่', 'มัน', 'ก็', 'คือ', 'การสนอง', 'นี้', 'ด', 'ตัวเอง', 'โดย', 'การ', 'เซ็กชวล', 'คนอื่น', 'ปะ', ' ', 'มัน', 'คือ', 'การ', 'ไม่', 'ให้เกียรติ', 'คนอื่น', 'ไง', ' ', 'งง', 'ไร']"
1980503746670129217,twitter,post,https://x.com/thekingofotaku/status/1980503746670129217,text,2025-10-21T05:17:43.000Z,selenium_x_scraper_v1,"ใช่ก็เหมือนผู้หญิง จะแต่งตัวโป๊ให้ผู้ชายหล่อๆดู แต่ถ้าผู้ชายหน้าเหี้ยมอง
ก็จะว่าคุกคาม

จริงไหม","ใช่ก็เหมือนผู้หญิง จะแต่งตัวโป๊ให้ผู้ชายหล่อๆดู แต่ถ้าผู้ชายหน้าเหี้ยมอง
ก็จะว่าคุกคาม

จริงไหม",2025-11-29 08:18:55,"['ใช่', 'ก็', 'เหมือน', 'ผู้หญิง', ' ', 'จะ', 'แต่งตัว', 'โป๊', 'ให้', 'ผู้ชาย', 'หล่อ', 'ๆ', 'ดู', ' ', 'แต่', 'ถ้า', 'ผู้ชาย', 'หน้าเหี้ยม', 'อง', ' ', 'ก็', 'จะ', 'ว่า', 'คุกคาม', ' ', 'จริง', 'ไหม']"
1980278495780729149,twitter,post,https://x.com/Baworndet24761/status/1980278495780729149,text,2025-10-20T14:22:39.000Z,selenium_x_scraper_v1,ฐานเสียงของรัชนก,ฐานเสียงของรัชนก,2025-11-29 08:18:55,"['ฐาน', 'เสียง', 'ของ', 'รัช', 'นก']"
1980503172818038918,twitter,post,https://x.com/thekingofotaku/status/1980503172818038918,text,2025-10-21T05:15:27.000Z,selenium_x_scraper_v1,,,2025-11-29 08:18:55,[]
