id,platform,platform_type,url,content_type,timestamp,scraper_module,text,raw_text,scrape_date,tokens
1985142607270613147,twitter,post,https://x.com/HawkJetman/status/1985142607270613147,text,2025-11-03T00:30:54.000Z,selenium_x_scraper_v1,คนเขียนพาดหัวเกิด พศ ไหนว่ะ คำโบราณ ชห สะท้อนทัศนคติแย่ๆด้วยซ้ำ,คนเขียนพาดหัวเกิด พศ ไหนว่ะ คำโบราณ ชห สะท้อนทัศนคติแย่ๆด้วยซ้ำ,2025-11-29 08:18:55,"['คนเขียน', 'พาดหัว', 'เกิด', ' ', 'พศ', ' ', 'ไหน', 'ว่ะ', ' ', 'คำ', 'โบราณ', ' ', 'ชห', ' ', 'สะท้อน', 'ทัศนคติ', 'แย่', 'ๆ', 'ด้วยซ้ำ']"
1984972930787487750,twitter,post,https://x.com/Dt5Kx/status/1984972930787487750,text,2025-11-02T13:16:40.000Z,selenium_x_scraper_v1,"LGBTQ+ ไม่ใช่ประเด็นของคดี แต่สะท้อนทัศนคติของผู้บังคับใช้กฎหมาย
คดี “ปาร์ตี้เหมืองทอง” ควรเป็นแค่คดียาเสพติด แต่กลับถูกเล่าให้กลายเป็นเรื่องเพศ
เพราะเจ้าหน้าที่เลือกขยี้ว่าใครเป็นใคร มากกว่าจะพูดถึงปัญหายา
เพศไม่ใช่อาชญากรรม  และอคติไม่ใช่เครื่องมือของความยุติธรรม.","LGBTQ+ ไม่ใช่ประเด็นของคดี แต่สะท้อนทัศนคติของผู้บังคับใช้กฎหมาย
คดี “ปาร์ตี้เหมืองทอง” ควรเป็นแค่คดียาเสพติด แต่กลับถูกเล่าให้กลายเป็นเรื่องเพศ
เพราะเจ้าหน้าที่เลือกขยี้ว่าใครเป็นใคร มากกว่าจะพูดถึงปัญหายา
เพศไม่ใช่อาชญากรรม  และอคติไม่ใช่เครื่องมือของความยุติธรรม.",2025-11-29 08:18:55,"['lgbtq', ' ', 'ไม่', 'ใช่', 'ประเด็น', 'ของ', 'คดี', ' ', 'แต่', 'สะท้อน', 'ทัศนคติ', 'ของ', 'ผู้', 'บังคับใช้', 'กฎหมาย', ' ', 'คดี', ' ', 'ปาร์ตี้', 'เหมือง', 'ทอง', ' ', 'ควร', 'เป็น', 'แค่', 'คดี', 'ยาเสพติด', ' ', 'แต่กลับ', 'ถูก', 'เล่า', 'ให้', 'กลาย', 'เป็นเรื่อง', 'เพศ', ' ', 'เพราะ', 'เจ้าหน้าที่', 'เลือก', 'ขยี้', 'ว่า', 'ใคร', 'เป็น', 'ใคร', ' ', 'มากกว่า', 'จะ', 'พูดถึง', 'ปัญหา', 'ยา', ' ', 'เพศ', 'ไม่', 'ใช่', 'อาชญากรรม', ' ', 'และ', 'อคติ', 'ไม่', 'ใช่', 'เครื่องมือ', 'ของ', 'ความยุติธรรม', '.']"
1985196111246786853,twitter,post,https://x.com/lovekasuma/status/1985196111246786853,text,2025-11-03T04:03:30.000Z,selenium_x_scraper_v1,"ภาพถือถุงยางมันคือสัญลักษณ์ของการเย้ยหยัน gay men ตรงๆนั่นแหละล้อไปกับพาดหัวขุดทอง

แล้วลักษณะการเหยียดของชายแท้เบียวพวกนี้เหมือนกันหมดนะทั้งล้อคนดำ ล้อมุสลิม ออกมาทรงนี้หมด

ก็ฝากถึงพวกเก้งกะเทยที่ชอบด่า pc โปรเสรีบุลลี่ เวลาสังคมที้ชายแท้นำมัน non-pc ใส่น่ะน่ากลัวยังไง","ภาพถือถุงยางมันคือสัญลักษณ์ของการเย้ยหยัน gay men ตรงๆนั่นแหละล้อไปกับพาดหัวขุดทอง

แล้วลักษณะการเหยียดของชายแท้เบียวพวกนี้เหมือนกันหมดนะทั้งล้อคนดำ ล้อมุสลิม ออกมาทรงนี้หมด

ก็ฝากถึงพวกเก้งกะเทยที่ชอบด่า pc โปรเสรีบุลลี่ เวลาสังคมที้ชายแท้นำมัน non-pc ใส่น่ะน่ากลัวยังไง",2025-11-29 08:18:55,"['ภาพ', 'ถือ', 'ถุงยาง', 'มัน', 'คือ', 'สัญลักษณ์', 'ของ', 'การเย้ยหยัน', ' ', 'gay', ' ', 'men', ' ', 'ตรงๆ', 'นั่นแหละ', 'ล้อ', 'ไป', 'กับ', 'พาดหัว', 'ขุด', 'ทอง', ' ', 'แล้ว', 'ลักษณะ', 'การ', 'เหยียด', 'ของ', 'ชาย', 'แท้', 'เบียว', 'พวก', 'นี้', 'เหมือนกัน', 'หมด', 'นะ', 'ทั้ง', 'ล้อ', 'คน', 'ดำ', ' ', 'ล้อ', 'มุสลิม', ' ', 'ออกมา', 'ทรง', 'นี้', 'หมด', ' ', 'ก็', 'ฝาก', 'ถึง', 'พวก', 'เก้ง', 'กะเทย', 'ที่', 'ชอบ', 'ด่า', ' ', 'pc', ' ', 'โปร', 'เสรี', 'บุ', 'ล', 'ลี่', ' ', 'เวลา', 'สังคม', 'ที้', 'ชาย', 'แท้', 'นำ', 'มัน', ' ', 'non', ' ', 'pc', ' ', 'ใส่', 'น่ะ', 'น่ากลัว', 'ยังไง']"
1985000766718046522,twitter,post,https://x.com/LeowithMR/status/1985000766718046522,text,2025-11-02T15:07:16.000Z,selenium_x_scraper_v1,เอาจริง ๆ เกลียดทุกข่าวที่พอเวลามีคนทำผิดขึ้นมา แล้วขึ้นพาดหัวข่าวเลยว่า LGBTQ+ เหมือนตั้งใจทำให้คนเหยียดมากกว่าเดิมอะ นี่เปิด TikTok เจอคลิปพี่ผู้หญิงบอกว่าประเทศเราเปิดเรื่องการเป็นเกย์มาก ๆ จนฝรั่งอิจฉาเลย แต่พอไถไปอีก 2 - 3 คลิป เจอคลิปพาดหัวข่าวนี้เลย สังคมแม่งโคตรย้อนแย้งอะ,เอาจริง ๆ เกลียดทุกข่าวที่พอเวลามีคนทำผิดขึ้นมา แล้วขึ้นพาดหัวข่าวเลยว่า LGBTQ+ เหมือนตั้งใจทำให้คนเหยียดมากกว่าเดิมอะ นี่เปิด TikTok เจอคลิปพี่ผู้หญิงบอกว่าประเทศเราเปิดเรื่องการเป็นเกย์มาก ๆ จนฝรั่งอิจฉาเลย แต่พอไถไปอีก 2 - 3 คลิป เจอคลิปพาดหัวข่าวนี้เลย สังคมแม่งโคตรย้อนแย้งอะ,2025-11-29 08:18:55,"['เอา', 'จริง ๆ', ' ', 'เกลียด', 'ทุก', 'ข่าว', 'ที่', 'พอ', 'เวลา', 'มี', 'คน', 'ทำผิด', 'ขึ้น', 'มา', ' ', 'แล้ว', 'ขึ้น', 'พาดหัวข่าว', 'เลย', 'ว่า', ' ', 'lgbtq', ' ', 'เหมือน', 'ตั้งใจ', 'ทำให้', 'คน', 'เหยียด', 'มากกว่า', 'เดิม', 'อะ', ' ', 'นี่', 'เปิด', ' ', 'tiktok', ' ', 'เจอ', 'คลิป', 'พี่', 'ผู้หญิง', 'บอ', 'กว่า', 'ประเทศ', 'เรา', 'เปิด', 'เรื่อง', 'การ', 'เป็น', 'เกย์', 'มาก', ' ', 'ๆ', ' ', 'จน', 'ฝรั่ง', 'อิจฉา', 'เลย', ' ', 'แต่', 'พอ', 'ไถ', 'ไป', 'อีก', ' ', '2', ' ', '3', ' ', 'คลิป', ' ', 'เจอ', 'คลิป', 'พาดหัวข่าว', 'นี้', 'เลย', ' ', 'สังคม', 'แม่', 'ง', 'โคตร', 'ย้อน', 'แย้ง', 'อะ']"
1985247951686635610,twitter,post,https://x.com/sssoybad/status/1985247951686635610,text,2025-11-03T07:29:30.000Z,selenium_x_scraper_v1,นอกจากการตั้งชื่อแล้ว ขอยกให้ภาพโชว์ถุงยาง อีก1 ที่เลี่ยสุดๆ,นอกจากการตั้งชื่อแล้ว ขอยกให้ภาพโชว์ถุงยาง อีก1 ที่เลี่ยสุดๆ,2025-11-29 08:18:55,"['นอกจาก', 'การ', 'ตั้งชื่อ', 'แล้ว', ' ', 'ขอ', 'ยก', 'ให้', 'ภาพ', 'โชว์', 'ถุงยาง', ' ', 'อีก', '1', ' ', 'ที่', 'เลี่ย', 'สุด', 'ๆ']"
1984961877986996289,twitter,post,https://x.com/Goodstuff420th/status/1984961877986996289,text,2025-11-02T12:32:45.000Z,selenium_x_scraper_v1,"เมื่อค่านิยมมันฝังลึก
พอด่าไปก็จะเถียงกลับมาว่า
ก็ผมเป็นคนดีย์ อุตส่าห์บุกจับ อุตส่าห์ทำข่าวยาเสพติด
ซึ่งมัน""ไม่เกี่ยวโว้ย""!!
ผิดก็คือผิด ไม่เกี่ยวกับเรื่องเหยียด

ชาวบ้านเค้าด่าค่านิยมเหยียด ไม่ได้ด่าการทำความดีย์","เมื่อค่านิยมมันฝังลึก
พอด่าไปก็จะเถียงกลับมาว่า
ก็ผมเป็นคนดีย์ อุตส่าห์บุกจับ อุตส่าห์ทำข่าวยาเสพติด
ซึ่งมัน""ไม่เกี่ยวโว้ย""!!
ผิดก็คือผิด ไม่เกี่ยวกับเรื่องเหยียด

ชาวบ้านเค้าด่าค่านิยมเหยียด ไม่ได้ด่าการทำความดีย์",2025-11-29 08:18:55,"['เมื่อ', 'ค่านิยม', 'มัน', 'ฝัง', 'ลึก', ' ', 'พอ', 'ด่า', 'ไป', 'ก็', 'จะ', 'เถียง', 'กลับมา', 'ว่า', ' ', 'ก็', 'ผม', 'เป็น', 'คน', 'ดีย์', ' ', 'อุตส่าห์', 'บุก', 'จับ', ' ', 'อุตส่าห์', 'ทำ', 'ข่าว', 'ยาเสพติด', ' ', 'ซึ่ง', 'มัน', ' ', 'ไม่', 'เกี่ยว', 'โว้ย', ' ', '!', ' ', 'ผิด', 'ก็', 'คือ', 'ผิด', ' ', 'ไม่', 'เกี่ยวกับ', 'เรื่อง', 'เหยียด', ' ', 'ชาวบ้าน', 'เค้า', 'ด่า', 'ค่านิยม', 'เหยียด', ' ', 'ไม่', 'ได้', 'ด่า', 'การ', 'ทำความ', 'ดีย์']"
1985249316337021258,twitter,post,https://x.com/Feliko_Ph/status/1985249316337021258,text,2025-11-03T07:34:55.000Z,selenium_x_scraper_v1,เจตนาคือเหยียดแหละ จะจับปาตี้ยามันไม่เกี่ยวกับเพศป่ะ แล้วรูปที่ชูถุงยางคืออะไร จะเหยียดการใช้ถุงยางเหรอ ได้ซีนแล้วแต่ซีนแย่มาก,เจตนาคือเหยียดแหละ จะจับปาตี้ยามันไม่เกี่ยวกับเพศป่ะ แล้วรูปที่ชูถุงยางคืออะไร จะเหยียดการใช้ถุงยางเหรอ ได้ซีนแล้วแต่ซีนแย่มาก,2025-11-29 08:18:55,"['เจตนา', 'คือ', 'เหยียด', 'แหละ', ' ', 'จะ', 'จับ', 'ปา', 'ตี้', 'ยา', 'มัน', 'ไม่', 'เกี่ยวกับ', 'เพศ', 'ป่ะ', ' ', 'แล้ว', 'รูป', 'ที่', 'ชู', 'ถุงยาง', 'คือ', 'อะไร', ' ', 'จะ', 'เหยียด', 'การ', 'ใช้', 'ถุงยาง', 'เหรอ', ' ', 'ได้', 'ซีน', 'แล้วแต่', 'ซีน', 'แย่มาก']"
1985017779255398780,twitter,post,https://x.com/ririlovemycats/status/1985017779255398780,text,2025-11-02T16:14:53.000Z,selenium_x_scraper_v1,ในขณะที่หลายๆประเทศเพิ่งชื่นชมคนไทยหลายๆคน ที่ยอมรับความหลากหลายทางเพศ แต่สื่อไทยเป็นแบบนี้เสมอ ทำไมไม่ไปโฟกัสที่เรื่องยา แต่พาดหัวไม่มีเกี่ยวกับยาเสพติดสักนิด,ในขณะที่หลายๆประเทศเพิ่งชื่นชมคนไทยหลายๆคน ที่ยอมรับความหลากหลายทางเพศ แต่สื่อไทยเป็นแบบนี้เสมอ ทำไมไม่ไปโฟกัสที่เรื่องยา แต่พาดหัวไม่มีเกี่ยวกับยาเสพติดสักนิด,2025-11-29 08:18:55,"['ในขณะที่', 'หลาย', 'ๆ', 'ประเทศ', 'เพิ่ง', 'ชื่นชม', 'คนไทย', 'หลาย', 'ๆคน', ' ', 'ที่ยอมรับ', 'ความหลากหลาย', 'ทางเพศ', ' ', 'แต่', 'สื่อ', 'ไทย', 'เป็น', 'แบบนี้', 'เสมอ', ' ', 'ทำไม', 'ไม่', 'ไป', 'โฟกัส', 'ที่', 'เรื่อง', 'ยา', ' ', 'แต่', 'พาดหัว', 'ไม่', 'มี', 'เกี่ยวกับ', 'ยาเสพติด', 'สักนิด']"
1984979998462390683,twitter,post,https://x.com/MiuniblueG/status/1984979998462390683,text,2025-11-02T13:44:45.000Z,selenium_x_scraper_v1,ทั้งตำรวจกับสื่อแทนที่จะไปโฟกัสเรื่องยาดันพาดหัวเล่นประเด็นเรื่องเพศรสนิยม โชว์ถุงยางอีกทำทำไมใส่ถุงยางก็ดีแล้วมั้ย ประเทศที่ถูกมองว่าเปิดรับเพศหลากหลายมีสมรสเท่าเทียมแต่หลายคนกลับสวนทางอยากวิวัฒนาการย้อนกลับ มันดูดักดานมั้ยนี่?,ทั้งตำรวจกับสื่อแทนที่จะไปโฟกัสเรื่องยาดันพาดหัวเล่นประเด็นเรื่องเพศรสนิยม โชว์ถุงยางอีกทำทำไมใส่ถุงยางก็ดีแล้วมั้ย ประเทศที่ถูกมองว่าเปิดรับเพศหลากหลายมีสมรสเท่าเทียมแต่หลายคนกลับสวนทางอยากวิวัฒนาการย้อนกลับ มันดูดักดานมั้ยนี่?,2025-11-29 08:18:55,"['ทั้ง', 'ตำรวจ', 'กับ', 'สื่อ', 'แทนที่จะ', 'ไป', 'โฟกัส', 'เรื่อง', 'ยา', 'ดัน', 'พาดหัว', 'เล่น', 'ประเด็น', 'เรื่อง', 'เพศ', 'รสนิยม', ' ', 'โชว์', 'ถุงยาง', 'อีก', 'ทำ', 'ทำไม', 'ใส่', 'ถุงยาง', 'ก็', 'ดีแล้ว', 'มั้ย', ' ', 'ประเทศ', 'ที่', 'ถูก', 'มองว่า', 'เปิดรับ', 'เพศ', 'หลากหลาย', 'มี', 'สมรส', 'เท่าเทียม', 'แต่', 'หลาย', 'คน', 'กลับ', 'สวนทาง', 'อยาก', 'วิวัฒนาการ', 'ย้อนกลับ', ' ', 'มัน', 'ดู', 'ดักดาน', 'มั้ย', 'นี่', '?']"
1985539717203705939,twitter,post,https://x.com/Naivenotreally/status/1985539717203705939,text,2025-11-04T02:48:52.000Z,selenium_x_scraper_v1,อ่านในเมนชั่นแล้วแบบ เดี๋ยวนี้คนจาก FB ttหันมาเล่นทวิตเยอะขึ้นเหรอ ความคิดเหยียด LQBTQ+ แบบสุดโต่งมาก ไม่เรียกขุดเหมืองทอง เรียกปาร์ตี้เซกส์หมู่แทนก็ได้ ละบางคนบอกเค้าแพร่ HIV ในมือนั่นก็ถุงยางป่ะ คู่ ญ ช มันไม่แพร่เหรอ ประสาท,อ่านในเมนชั่นแล้วแบบ เดี๋ยวนี้คนจาก FB ttหันมาเล่นทวิตเยอะขึ้นเหรอ ความคิดเหยียด LQBTQ+ แบบสุดโต่งมาก ไม่เรียกขุดเหมืองทอง เรียกปาร์ตี้เซกส์หมู่แทนก็ได้ ละบางคนบอกเค้าแพร่ HIV ในมือนั่นก็ถุงยางป่ะ คู่ ญ ช มันไม่แพร่เหรอ ประสาท,2025-11-29 08:18:55,"['อ่าน', 'ใน', 'เมน', 'ชั่น', 'แล้ว', 'แบบ', ' ', 'เดี๋ยวนี้', 'คน', 'จาก', ' ', 'fb', ' ', 'tt', 'หันมา', 'เล่น', 'ทวิ', 'ต', 'เยอะ', 'ขึ้น', 'เหรอ', ' ', 'ความคิด', 'เหยียด', ' ', 'lqbtq', ' ', 'แบบ', 'สุดโต่ง', 'มาก', ' ', 'ไม่', 'เรียก', 'ขุด', 'เหมือง', 'ทอง', ' ', 'เรียก', 'ปาร์ตี้', 'เซกส์', 'หมู่', 'แทน', 'ก็ได้', ' ', 'ละ', 'บางคน', 'บอก', 'เค้า', 'แพร่', ' ', 'hiv', ' ', 'ใน', 'มือ', 'นั่น', 'ก็', 'ถุงยาง', 'ป่ะ', ' ', 'คู่', ' ', 'ญ', ' ', 'ช', ' ', 'มัน', 'ไม่', 'แพร่', 'เหรอ', ' ', 'ประสาท']"
1984959376684470547,twitter,post,https://x.com/annn341582/status/1984959376684470547,text,2025-11-02T12:22:48.000Z,selenium_x_scraper_v1,เอาหน้าคนเขียนข่าวมาดู เนี่ย สื่อมันมีส่วนสำคัญในการผลิตซ้ำความเกลียดชังมากกกกก,เอาหน้าคนเขียนข่าวมาดู เนี่ย สื่อมันมีส่วนสำคัญในการผลิตซ้ำความเกลียดชังมากกกกก,2025-11-29 08:18:55,"['เอาหน้า', 'คนเขียนข่าว', 'มา', 'ดู', ' ', 'เนี่ย', ' ', 'สื่อ', 'มัน', 'มี', 'ส่วนสำคัญ', 'ใน', 'การผลิต', 'ซ้ำ', 'ความเกลียดชัง', 'มาก', 'กก', 'กก']"
1985016643832135755,twitter,post,https://x.com/Nongkowsuai/status/1985016643832135755,text,2025-11-02T16:10:22.000Z,selenium_x_scraper_v1,ละพาดหัวได้อุบาทว์มาก ขุดทอง นึกว่ายุค 254x กลิ่นแก่+โฮโมโฟบหึ่งมาก,ละพาดหัวได้อุบาทว์มาก ขุดทอง นึกว่ายุค 254x กลิ่นแก่+โฮโมโฟบหึ่งมาก,2025-11-29 08:18:55,"['ละ', 'พาดหัว', 'ได้', 'อุบาทว์', 'มาก', ' ', 'ขุด', 'ทอง', ' ', 'นึก', 'ว่า', 'ยุค', ' ', '254', 'x', ' ', 'กลิ่น', 'แก่', ' ', 'โฮ', 'โม', 'โฟบ', 'หึ่ง', 'มาก']"
1985917044798443629,twitter,post,https://x.com/Juhwangmin_/status/1985917044798443629,text,2025-11-05T03:48:14.000Z,selenium_x_scraper_v1,แล้วทำไมพาดหัวข่าว เอาเพศมาตั้งพาดหัว แต่ไม่เมนชั่นถึงยาที่ใช้เลย งง,แล้วทำไมพาดหัวข่าว เอาเพศมาตั้งพาดหัว แต่ไม่เมนชั่นถึงยาที่ใช้เลย งง,2025-11-29 08:18:55,"['แล้ว', 'ทำไม', 'พาดหัวข่าว', ' ', 'เอา', 'เพศ', 'มา', 'ตั้ง', 'พาดหัว', ' ', 'แต่', 'ไม่', 'เมน', 'ชั่น', 'ถึง', 'ยา', 'ที่', 'ใช้', 'เลย', ' ', 'งง']"
1985010737992098190,twitter,post,https://x.com/ongmunmu/status/1985010737992098190,text,2025-11-02T15:46:54.000Z,selenium_x_scraper_v1,ตำรวจไม่มีปัญญาจับ scammer พ่อค้ายา เลยเบี่ยงประเด็นปะ,ตำรวจไม่มีปัญญาจับ scammer พ่อค้ายา เลยเบี่ยงประเด็นปะ,2025-11-29 08:18:55,"['ตำรวจ', 'ไม่', 'มี', 'ปัญญา', 'จับ', ' ', 'scammer', ' ', 'พ่อค้า', 'ยา', ' ', 'เลย', 'เบี่ยงประเด็น', 'ปะ']"
1985111921612423381,twitter,post,https://x.com/daphnegjp13_d/status/1985111921612423381,text,2025-11-02T22:28:58.000Z,selenium_x_scraper_v1,#วันนี้ชายแท้ทำอะไร ไม่พาดหัวข่าวแบบนี้บ้างวะ ข่าวเหี้ยๆ95.9999% เป็นชายแท้ โดยเฉพาะสงคราม ตีเมีย ฆ่าเมีย ทะเลาะวิวาท ข่มขืน,#วันนี้ชายแท้ทำอะไร ไม่พาดหัวข่าวแบบนี้บ้างวะ ข่าวเหี้ยๆ95.9999% เป็นชายแท้ โดยเฉพาะสงคราม ตีเมีย ฆ่าเมีย ทะเลาะวิวาท ข่มขืน,2025-11-29 08:18:55,"['วันนี้', 'ชาย', 'แท้', 'ทำ', 'อะไร', ' ', 'ไม่', 'พาดหัวข่าว', 'แบบนี้', 'บ้าง', 'วะ', ' ', 'ข่าว', 'เหี้ย', 'ๆ', '95.9999', ' ', 'เป็น', 'ชาย', 'แท้', ' ', 'โดยเฉพาะ', 'สงคราม', ' ', 'ตี', 'เมีย', ' ', 'ฆ่า', 'เมีย', ' ', 'ทะเลาะวิวาท', ' ', 'ข่มขืน']"
1985056440034435333,twitter,post,https://x.com/park120816/status/1985056440034435333,text,2025-11-02T18:48:30.000Z,selenium_x_scraper_v1,อยากน้อยเขา ก็ ใส่ถุง ดีกว่า ชายแท้ บางตัวแหละวะ แม่เยด,อยากน้อยเขา ก็ ใส่ถุง ดีกว่า ชายแท้ บางตัวแหละวะ แม่เยด,2025-11-29 08:18:55,"['อยาก', 'น้อย', 'เขา', ' ', 'ก็', ' ', 'ใส่', 'ถุง', ' ', 'ดีกว่า', ' ', 'ชาย', 'แท้', ' ', 'บาง', 'ตัว', 'แหละ', 'วะ', ' ', 'แม่', 'เย', 'ด']"
