id,platform,platform_type,url,content_type,timestamp,scraper_module,text,raw_text,scrape_date,tokens
1981183593780240476,twitter,post,https://x.com/cumkom/status/1981183593780240476,text,2025-10-23T02:19:12.000Z,selenium_x_scraper_v1,นายกผู้หญิงก็ไม่ช่วยให้สังคมญี่ปุ่นดีขึ้นหรอ,นายกผู้หญิงก็ไม่ช่วยให้สังคมญี่ปุ่นดีขึ้นหรอ,2025-11-29 08:18:55,"['นายก', 'ผู้หญิง', 'ก็', 'ไม่', 'ช่วย', 'ให้', 'สังคม', 'ญี่ปุ่น', 'ดีขึ้น', 'หรอ']"
1980928726553821459,twitter,post,https://x.com/cataddicted041/status/1980928726553821459,text,2025-10-22T09:26:26.000Z,selenium_x_scraper_v1,แทตเชอร์แห่งประเทศเกาะงี้?,แทตเชอร์แห่งประเทศเกาะงี้?,2025-11-29 08:18:55,"['แทตเชอร์', 'แห่ง', 'ประเทศ', 'เกาะ', 'งี้', '?']"
1980849265535758480,twitter,post,https://x.com/b__jkkhl/status/1980849265535758480,text,2025-10-22T04:10:41.000Z,selenium_x_scraper_v1,แต่ได้ยินว่านางซัพพอร์ตและยอมรับการมีอยู่ของชาวอุยกูร์ด้วย เลยแบบ  ยังไงดี,แต่ได้ยินว่านางซัพพอร์ตและยอมรับการมีอยู่ของชาวอุยกูร์ด้วย เลยแบบ  ยังไงดี,2025-11-29 08:18:55,"['แต่', 'ได้ยิน', 'ว่า', 'นาง', 'ซัพพอร์ต', 'และ', 'ยอมรับ', 'การ', 'มี', 'อยู่', 'ของ', 'ชาว', 'อุยกูร์', 'ด้วย', ' ', 'เลย', 'แบบ', ' ', 'ยังไง', 'ดี']"
1980848570501845215,twitter,post,https://x.com/thoutest/status/1980848570501845215,text,2025-10-22T04:07:56.000Z,selenium_x_scraper_v1,กุไม่แปลกใจละทำไมได้เป็นนายกหญิงคนแรกของประเทศนี้55555555555เกือบดี,กุไม่แปลกใจละทำไมได้เป็นนายกหญิงคนแรกของประเทศนี้55555555555เกือบดี,2025-11-29 08:18:55,"['กุ', 'ไม่', 'แปลกใจ', 'ละ', 'ทำไม', 'ได้', 'เป็น', 'นายก', 'หญิง', 'คน', 'แรก', 'ของ', 'ประเทศ', 'นี้', 'หัวเราะ', 'เกือบ', 'ดี']"
1981030074066317686,twitter,post,https://x.com/fewwfaye/status/1981030074066317686,text,2025-10-22T16:09:10.000Z,selenium_x_scraper_v1,เอาผู้ญที่อวยชายเป็นใหญ่มาช่วยส่งเสียงแทนไงชายแท้ เวลาทำไรเอื้อพวกมันจะได้ง่ายขึ้น,เอาผู้ญที่อวยชายเป็นใหญ่มาช่วยส่งเสียงแทนไงชายแท้ เวลาทำไรเอื้อพวกมันจะได้ง่ายขึ้น,2025-11-29 08:18:55,"['เอา', 'ผู้', 'ญ', 'ที่', 'อวย', 'ชาย', 'เป็นใหญ่', 'มา', 'ช่วย', 'ส่งเสียง', 'แทน', 'ไง', 'ชาย', 'แท้', ' ', 'เวลา', 'ทำ', 'ไร', 'เอื้อ', 'พวก', 'มัน', 'จะ', 'ได้', 'ง่าย', 'ขึ้น']"
1980920086933442932,twitter,post,https://x.com/mnwxtch/status/1980920086933442932,text,2025-10-22T08:52:07.000Z,selenium_x_scraper_v1,แต่ผัวใช้นามสกุลชีเพราะเป่ายิ้งฉุบแพ้,แต่ผัวใช้นามสกุลชีเพราะเป่ายิ้งฉุบแพ้,2025-11-29 08:18:55,"['แต่', 'ผัว', 'ใช้', 'นามสกุล', 'ชี', 'เพราะ', 'เป่ายิ้งฉุบ', 'แพ้']"
1980902054022508953,twitter,post,https://x.com/eqzem224/status/1980902054022508953,text,2025-10-22T07:40:27.000Z,selenium_x_scraper_v1,อายุ64,อายุ64,2025-11-29 08:18:55,"['อายุ', '64']"
1981271493012312381,twitter,post,https://x.com/dimensiondemo/status/1981271493012312381,text,2025-10-23T08:08:28.000Z,selenium_x_scraper_v1,โลกทวิตเตอร์มีบรรทัดฐานแบบนี้เท่าเทียมกันโคตร วันนึงถูกอวย วันต่อมาจะถูกแหก ชอบมาก ไม่นึกว่าจะอยู่แค่ในประเทศด้วย ลามไปทุกประเทศ ทุกสังคมจริง วันก่อนทะเลแมสก็ยังโดนแหกมาแล้วเลย,โลกทวิตเตอร์มีบรรทัดฐานแบบนี้เท่าเทียมกันโคตร วันนึงถูกอวย วันต่อมาจะถูกแหก ชอบมาก ไม่นึกว่าจะอยู่แค่ในประเทศด้วย ลามไปทุกประเทศ ทุกสังคมจริง วันก่อนทะเลแมสก็ยังโดนแหกมาแล้วเลย,2025-11-29 08:18:55,"['โลก', 'ทวิตเตอร์', 'มี', 'บรรทัดฐาน', 'แบบนี้', 'เท่าเทียมกัน', 'โคตร', ' ', 'วัน', 'นึง', 'ถูก', 'อวย', ' ', 'วัน', 'ต่อมา', 'จะ', 'ถูก', 'แหก', ' ', 'ชอบ', 'มาก', ' ', 'ไม่', 'นึก', 'ว่า', 'จะ', 'อยู่', 'แค่', 'ในประเทศ', 'ด้วย', ' ', 'ลาม', 'ไป', 'ทุก', 'ประเทศ', ' ', 'ทุก', 'สังคม', 'จริง', ' ', 'วันก่อน', 'ทะเล', 'แมส', 'ก็', 'ยัง', 'โดน', 'แหก', 'มา', 'แล้ว', 'เลย']"
1980872980076056701,twitter,post,https://x.com/kawailnaa_1984/status/1980872980076056701,text,2025-10-22T05:44:55.000Z,selenium_x_scraper_v1,ก็สมเป็นนิฮงจิน,ก็สมเป็นนิฮงจิน,2025-11-29 08:18:55,"['ก็', 'สม', 'เป็น', 'นิ', 'ฮง', 'จิน']"
1981314087499026930,twitter,post,https://x.com/aom_sriwilai/status/1981314087499026930,text,2025-10-23T10:57:44.000Z,selenium_x_scraper_v1,ตัวอย่างที่เหมาะของปิตาธิปไตยญี่ปุ่นมาก,ตัวอย่างที่เหมาะของปิตาธิปไตยญี่ปุ่นมาก,2025-11-29 08:18:55,"['ตัวอย่าง', 'ที่', 'เหมาะ', 'ของ', 'ปิตาธิปไตย', 'ญี่ปุ่น', 'มาก']"
1981011764981666030,twitter,post,https://x.com/U_oneandonly/status/1981011764981666030,text,2025-10-22T14:56:24.000Z,selenium_x_scraper_v1,แล้วชีมาเป็นนายกทำไม ไม่ไปอยู่ก้นครัวเป็นเมียใครซักคนล่ะ,แล้วชีมาเป็นนายกทำไม ไม่ไปอยู่ก้นครัวเป็นเมียใครซักคนล่ะ,2025-11-29 08:18:55,"['แล้ว', 'ชี', 'มา', 'เป็น', 'นายก', 'ทำไม', ' ', 'ไม่', 'ไป', 'อยู่', 'ก้นครัว', 'เป็น', 'เมีย', 'ใคร', 'ซัก', 'คน', 'ล่ะ']"
1980937134518476934,twitter,post,https://x.com/2moveintogether/status/1980937134518476934,text,2025-10-22T09:59:51.000Z,selenium_x_scraper_v1,ไม่ยอมรับเรื่องญี่ปุ่นบุกจีนสมัยยุค 1930s? อุบาทว์,ไม่ยอมรับเรื่องญี่ปุ่นบุกจีนสมัยยุค 1930s? อุบาทว์,2025-11-29 08:18:55,"['ไม่', 'ยอมรับ', 'เรื่อง', 'ญี่ปุ่น', 'บุก', 'จีน', 'สมัย', 'ยุค', ' ', '1930', 's', '?', ' ', 'อุบาทว์']"
1981295587283915169,twitter,post,https://x.com/reenter111/status/1981295587283915169,text,2025-10-23T09:44:13.000Z,selenium_x_scraper_v1,ผญแต่เป็นปิตา lowest of the low,ผญแต่เป็นปิตา lowest of the low,2025-11-29 08:18:55,"['ผญ', 'แต่', 'เป็น', 'ปิตา', ' ', 'lowest', ' ', 'of', ' ', 'the', ' ', 'low']"
1980954241083769162,twitter,post,https://x.com/payunnne/status/1980954241083769162,text,2025-10-22T11:07:50.000Z,selenium_x_scraper_v1,ถ้านางไม่ปิตาก็คงไม่ได้รับการยอมรับจนถึงจุดนี้ปะ,ถ้านางไม่ปิตาก็คงไม่ได้รับการยอมรับจนถึงจุดนี้ปะ,2025-11-29 08:18:55,"['ถ้า', 'นาง', 'ไม่', 'ปิตา', 'ก็', 'คง', 'ไม่', 'ได้รับ', 'การ', 'ยอมรับ', 'จนถึง', 'จุด', 'นี้', 'ปะ']"
1980874958957052001,twitter,post,https://x.com/getyouthemoonn/status/1980874958957052001,text,2025-10-22T05:52:47.000Z,selenium_x_scraper_v1,กุอ่านเชี้ยไรอยู่วะเนี่ย,กุอ่านเชี้ยไรอยู่วะเนี่ย,2025-11-29 08:18:55,"['กุ', 'อ่าน', 'เชี้ย', 'ไร', 'อยู่', 'วะ', 'เนี่ย']"
1980838151158657536,twitter,post,https://x.com/yummiicat/status/1980838151158657536,text,2025-10-22T03:26:32.000Z,selenium_x_scraper_v1,นายกหญิงแท้   มาก,นายกหญิงแท้   มาก,2025-11-29 08:18:55,"['นายก', 'หญิง', 'แท้', ' ', 'มาก']"
1980888178744860982,twitter,post,https://x.com/_mhr_ing95/status/1980888178744860982,text,2025-10-22T06:45:19.000Z,selenium_x_scraper_v1,นายกหญิงฝั่งขวาสุดโต่ง,นายกหญิงฝั่งขวาสุดโต่ง,2025-11-29 08:18:55,"['นายก', 'หญิง', 'ฝั่ง', 'ขวา', 'สุดโต่ง']"
1980901972997001369,twitter,post,https://x.com/onewish001/status/1980901972997001369,text,2025-10-22T07:40:08.000Z,selenium_x_scraper_v1,ก็สมกับที่มีไอดอลเป็นมาร์กาเร็ต แทตเชอร์,ก็สมกับที่มีไอดอลเป็นมาร์กาเร็ต แทตเชอร์,2025-11-29 08:18:55,"['ก็', 'สม', 'กับ', 'ที่', 'มี', 'ไอดอล', 'เป็น', 'มาร์กาเร็ต', ' ', 'แทตเชอร์']"
1980939125185458256,twitter,post,https://x.com/benz_mercedez/status/1980939125185458256,text,2025-10-22T10:07:46.000Z,selenium_x_scraper_v1,มิน่าทำไมถึงมีกระแสคนญี่ปุ่นชอบ ครบจบ,มิน่าทำไมถึงมีกระแสคนญี่ปุ่นชอบ ครบจบ,2025-11-29 08:18:55,"['มิน่า', 'ทำไม', 'ถึง', 'มี', 'กระแส', 'คนญี่ปุ่น', 'ชอบ', ' ', 'ครบ', 'จบ']"
1981221034188816482,twitter,post,https://x.com/IndigoDust_/status/1981221034188816482,text,2025-10-23T04:47:58.000Z,selenium_x_scraper_v1,ถ้าแนวคิดปิตาฝังหัวขนาดนี้แล้วส่วนไหนในจิตที่ทำให้ฝ่าออกมาเล่นการเมืองจนเป็นนายกได้วะ?,ถ้าแนวคิดปิตาฝังหัวขนาดนี้แล้วส่วนไหนในจิตที่ทำให้ฝ่าออกมาเล่นการเมืองจนเป็นนายกได้วะ?,2025-11-29 08:18:55,"['ถ้า', 'แนวคิด', 'ปิตา', 'ฝังหัว', 'ขนาด', 'นี้', 'แล้ว', 'ส่วน', 'ไหน', 'ใน', 'จิต', 'ที่', 'ทำให้', 'ฝ่า', 'ออกมา', 'เล่นการเมือง', 'จน', 'เป็น', 'นายก', 'ได้', 'วะ', '?']"
1980994791606481192,twitter,post,https://x.com/nepobabybougie/status/1980994791606481192,text,2025-10-22T13:48:58.000Z,selenium_x_scraper_v1,รอบหน้า CDP จะพลิกชนะปะ แต่คงไม่น่า คนญปเคยให้โอกาสแล้วเจ๊งกว่าเดิม,รอบหน้า CDP จะพลิกชนะปะ แต่คงไม่น่า คนญปเคยให้โอกาสแล้วเจ๊งกว่าเดิม,2025-11-29 08:18:55,"['รอบ', 'หน้า', ' ', 'cdp', ' ', 'จะ', 'พลิก', 'ชนะ', 'ปะ', ' ', 'แต่', 'คง', 'ไม่', 'น่า', ' ', 'คน', 'ญป', 'เคย', 'ให้โอกาส', 'แล้ว', 'เจ๊ง', 'กว่า', 'เดิม']"
1981180533360251000,twitter,post,https://x.com/nothingelse_23/status/1981180533360251000,text,2025-10-23T02:07:02.000Z,selenium_x_scraper_v1,อ่อ จะได้เป็นนายกต้องหัวปิตา นางอาจจะเล่นเกมหักมุมป๊าว,อ่อ จะได้เป็นนายกต้องหัวปิตา นางอาจจะเล่นเกมหักมุมป๊าว,2025-11-29 08:18:55,"['อ่อ', ' ', 'จะ', 'ได้', 'เป็น', 'นายก', 'ต้อง', 'หัว', 'ปิตา', ' ', 'นาง', 'อาจจะ', 'เล่น', 'เกม', 'หักมุม', 'ป๊าว']"
1980917792347128085,twitter,post,https://x.com/gpinkupanter/status/1980917792347128085,text,2025-10-22T08:43:00.000Z,selenium_x_scraper_v1,เหตุผลที่ชนะ ครองใจชายแท้,เหตุผลที่ชนะ ครองใจชายแท้,2025-11-29 08:18:55,"['เหตุผล', 'ที่', 'ชนะ', ' ', 'ครองใจ', 'ชาย', 'แท้']"
1980872622750703765,twitter,post,https://x.com/IntLaphas/status/1980872622750703765,text,2025-10-22T05:43:30.000Z,selenium_x_scraper_v1,เพราะอนุรักษนิยมขนาดนี้ เขาเลยดันขึ้นมา ไม่งั้นแม้แต่ฝันอาจจะยังไม่ได้,เพราะอนุรักษนิยมขนาดนี้ เขาเลยดันขึ้นมา ไม่งั้นแม้แต่ฝันอาจจะยังไม่ได้,2025-11-29 08:18:55,"['เพราะ', 'อนุรักษนิยม', 'ขนาด', 'นี้', ' ', 'เขา', 'เลย', 'ดัน', 'ขึ้น', 'มา', ' ', 'ไม่งั้น', 'แม้แต่', 'ฝัน', 'อาจจะ', 'ยัง', 'ไม่', 'ได้']"
1981146039467069882,twitter,post,https://x.com/Chuwiduwha/status/1981146039467069882,text,2025-10-22T23:49:58.000Z,selenium_x_scraper_v1,เอาเหอะ เป็นแบบนี้เดี๋ยวอัตราคนเกิดก็น้อยลงเรื่อย ๆ เองแหล่ะ,เอาเหอะ เป็นแบบนี้เดี๋ยวอัตราคนเกิดก็น้อยลงเรื่อย ๆ เองแหล่ะ,2025-11-29 08:18:55,"['เอา', 'เหอะ', ' ', 'เป็น', 'แบบนี้', 'เดี๋ยว', 'อัตรา', 'คน', 'เกิด', 'ก็', 'น้อยลง', 'เรื่อย ๆ', ' ', 'เอง', 'แห', 'ล่ะ']"
1980989494267609493,twitter,post,https://x.com/wuyuemeigui/status/1980989494267609493,text,2025-10-22T13:27:55.000Z,selenium_x_scraper_v1,"ตอนยกพลขึ้นฝั่งไทยที่ประจวบก็ทำเหี้ยไว้เยอะ

แต่คนไทยรู้สึกเรื่องมันซอฟท์เพราะ …………..

","ตอนยกพลขึ้นฝั่งไทยที่ประจวบก็ทำเหี้ยไว้เยอะ

แต่คนไทยรู้สึกเรื่องมันซอฟท์เพราะ …………..

",2025-11-29 08:18:55,"['ตอน', 'ยกพล', 'ขึ้นฝั่ง', 'ไทย', 'ที่', 'ประจวบ', 'ก็', 'ทำ', 'เหี้ย', 'ไว้', 'เยอะ', ' ', 'แต่', 'คนไทย', 'รู้สึก', 'เรื่อง', 'มัน', 'ซอฟท์', 'เพราะ', ' ', '..']"
1980908916885344521,twitter,post,https://x.com/ultrapup/status/1980908916885344521,text,2025-10-22T08:07:43.000Z,selenium_x_scraper_v1,ชีขวาจัดเด้อ,ชีขวาจัดเด้อ,2025-11-29 08:18:55,"['ชี', 'ขวาจัด', 'เด้อ']"
1980860190909145185,twitter,post,https://x.com/mamameenyjung/status/1980860190909145185,text,2025-10-22T04:54:06.000Z,selenium_x_scraper_v1,แต่ตัวเองได้เป็นนายกนะ ย้อนแย้งอะไรนิ,แต่ตัวเองได้เป็นนายกนะ ย้อนแย้งอะไรนิ,2025-11-29 08:18:55,"['แต่', 'ตัวเอง', 'ได้', 'เป็น', 'นา', 'ยกนะ', ' ', 'ย้อน', 'แย้ง', 'อะไร', 'นิ']"
1980852910071378266,twitter,post,https://x.com/bababochan/status/1980852910071378266,text,2025-10-22T04:25:10.000Z,selenium_x_scraper_v1,เลยได้เสียงจากผู้ชายเยอะรึเปึ,เลยได้เสียงจากผู้ชายเยอะรึเปึ,2025-11-29 08:18:55,"['เลย', 'ได้', 'เสียง', 'จาก', 'ผู้ชาย', 'เยอะ', 'รึ', 'เปึ']"
1980874673400549592,twitter,post,https://x.com/ppawitraa/status/1980874673400549592,text,2025-10-22T05:51:39.000Z,selenium_x_scraper_v1,aka หญิงแท้,aka หญิงแท้,2025-11-29 08:18:55,"['aka', ' ', 'หญิง', 'แท้']"
1980900025132847426,twitter,post,https://x.com/sadenbyclub/status/1980900025132847426,text,2025-10-22T07:32:23.000Z,selenium_x_scraper_v1,ชั้นอยากรู้ว่าพอชีกลับจากสภา เข้าครัวทำกับข้าวให้ลูกผัวด้วยป่ะ,ชั้นอยากรู้ว่าพอชีกลับจากสภา เข้าครัวทำกับข้าวให้ลูกผัวด้วยป่ะ,2025-11-29 08:18:55,"['ชั้น', 'อยากรู้', 'ว่า', 'พอ', 'ชี', 'กลับ', 'จาก', 'สภา', ' ', 'เข้าครัว', 'ทำกับข้าว', 'ให้', 'ลูก', 'ผัว', 'ด้วย', 'ป่ะ']"
1980853132717617399,twitter,post,https://x.com/enlqblue/status/1980853132717617399,text,2025-10-22T04:26:03.000Z,selenium_x_scraper_v1,ไม่งั้นจะทะลุชายแท้ขึ้นมายังไงอะคับคิดว่า ,ไม่งั้นจะทะลุชายแท้ขึ้นมายังไงอะคับคิดว่า ,2025-11-29 08:18:55,"['ไม่งั้น', 'จะ', 'ทะลุ', 'ชาย', 'แท้', 'ขึ้น', 'มา', 'ยังไง', 'อะ', 'คับ', 'คิด', 'ว่า']"
1981028039816282486,twitter,post,https://x.com/sunshine_yw11/status/1981028039816282486,text,2025-10-22T16:01:05.000Z,selenium_x_scraper_v1,ไปเที่ยวญป เปิดทีวีเจอแต่หน้าชี all day,ไปเที่ยวญป เปิดทีวีเจอแต่หน้าชี all day,2025-11-29 08:18:55,"['ไปเที่ยว', 'ญป', ' ', 'เปิด', 'ทีวี', 'เจอ', 'แต่', 'หน้า', 'ชี', ' ', 'all', ' ', 'day']"
1981479695041646679,twitter,post,https://x.com/jaysonthan/status/1981479695041646679,text,2025-10-23T21:55:48.000Z,selenium_x_scraper_v1,Trump เวอชั่น ผู้หญิง แบบ อียุนซอกยอล แบบเกาหลีสุดๆ อุบาด,Trump เวอชั่น ผู้หญิง แบบ อียุนซอกยอล แบบเกาหลีสุดๆ อุบาด,2025-11-29 08:18:55,"['trump', ' ', 'เวอชั่น', ' ', 'ผู้หญิง', ' ', 'แบบ', ' ', 'อี', 'ยุ', 'น', 'ซอก', 'ยอ', 'ล', ' ', 'แบบ', 'เกาหลี', 'สุด', 'ๆ', ' ', 'อุ', 'บาด']"
1980977766947512717,twitter,post,https://x.com/habibi_4198/status/1980977766947512717,text,2025-10-22T12:41:19.000Z,selenium_x_scraper_v1,ก็เลยได้เปนนายกรึป่าวนะ ,ก็เลยได้เปนนายกรึป่าวนะ ,2025-11-29 08:18:55,"['ก็', 'เลย', 'ได้', 'เปน', 'นายก', 'รึ', 'ป่าว', 'นะ']"
1980955595059671115,twitter,post,https://x.com/jansel3980/status/1980955595059671115,text,2025-10-22T11:13:12.000Z,selenium_x_scraper_v1,ฮ่ะๆ เมกาสาขาสอง,ฮ่ะๆ เมกาสาขาสอง,2025-11-29 08:18:55,"['ฮ่ะ', 'ๆ', ' ', 'เม', 'กา', 'สาขา', 'สอง']"
1981304419657666612,twitter,post,https://x.com/PumaPraew2/status/1981304419657666612,text,2025-10-23T10:19:19.000Z,selenium_x_scraper_v1,พี่ที่ทำงานชั้นเห็นข่าวนี้แล้วถามว่า นี่ญี่ปุ่นเขากลับมาเป็นแบบนั้นอีกแล้วเหรอ นี่แบบขำ ไม่รู้จะต่อต้านต่างชาติอะไรด้วยไหม แล้วชนะมาแบบนี้รู้เลยคนในชาติเป็นยังไง,พี่ที่ทำงานชั้นเห็นข่าวนี้แล้วถามว่า นี่ญี่ปุ่นเขากลับมาเป็นแบบนั้นอีกแล้วเหรอ นี่แบบขำ ไม่รู้จะต่อต้านต่างชาติอะไรด้วยไหม แล้วชนะมาแบบนี้รู้เลยคนในชาติเป็นยังไง,2025-11-29 08:18:55,"['พี่', 'ที่ทำงาน', 'ชั้น', 'เห็น', 'ข่าว', 'นี้', 'แล้ว', 'ถาม', 'ว่า', ' ', 'นี่', 'ญี่ปุ่น', 'เขา', 'กลับมา', 'เป็น', 'แบบ', 'นั้น', 'อีกแล้ว', 'เหรอ', ' ', 'นี่', 'แบบ', 'ขำ', ' ', 'ไม่', 'รู้', 'จะ', 'ต่อต้าน', 'ต่างชาติ', 'อะไร', 'ด้วย', 'ไหม', ' ', 'แล้ว', 'ชนะ', 'มา', 'แบบนี้', 'รู้', 'เลย', 'คนใน', 'ชาติ', 'เป็น', 'ยังไง']"
1981228647525863858,twitter,post,https://x.com/killer__kai/status/1981228647525863858,text,2025-10-23T05:18:13.000Z,selenium_x_scraper_v1,มันส์แน่สมัยที่ขวาจัดเรืองอำนาจ  โลกจะเป็นยังไงต่อไป คัมมิ่งซูน,มันส์แน่สมัยที่ขวาจัดเรืองอำนาจ  โลกจะเป็นยังไงต่อไป คัมมิ่งซูน,2025-11-29 08:18:55,"['มันส์', 'แน่', 'สมัย', 'ที่', 'ขวาจัด', 'เรืองอำนาจ', ' ', 'โลก', 'จะ', 'เป็น', 'ยังไง', 'ต่อไป', ' ', 'คัม', 'มิ่ง', 'ซู', 'น']"
1980859692068090342,twitter,post,https://x.com/Tigerminors/status/1980859692068090342,text,2025-10-22T04:52:07.000Z,selenium_x_scraper_v1,ละคนแบบนี้ได้เป็นนายกได้ไงก่อน,ละคนแบบนี้ได้เป็นนายกได้ไงก่อน,2025-11-29 08:18:55,"['ละ', 'คน', 'แบบนี้', 'ได้', 'เป็น', 'นายก', 'ได้', 'ไง', 'ก่อน']"
1980989300130144260,twitter,post,https://x.com/PPPONY_15/status/1980989300130144260,text,2025-10-22T13:27:08.000Z,selenium_x_scraper_v1,อีทรัมป์ 2,อีทรัมป์ 2,2025-11-29 08:18:55,"['อี', 'ทรัมป์', ' ', '2']"
