id,platform,platform_type,url,content_type,timestamp,scraper_module,text,raw_text,scrape_date,tokens
1979001907214458980,twitter,post,https://x.com/Tim8666/status/1979001907214458980,text,2025-10-17T01:49:57.000Z,selenium_x_scraper_v1,แล้วเลสเบี่ยนเป็นเหี้ยไรถึงปัญญาอ่อนแบบนี้ทุกตัว,แล้วเลสเบี่ยนเป็นเหี้ยไรถึงปัญญาอ่อนแบบนี้ทุกตัว,2025-10-23 17:59:34,"['แล้ว', 'เลสเบี่ยน', 'เป็น', 'เหี้ย', 'ไร', 'ถึง', 'ปัญญาอ่อน', 'แบบนี้', 'ทุก', 'ตัว']"
1978882145272700947,twitter,post,https://x.com/68rain_bow/status/1978882145272700947,text,2025-10-16T17:54:03.000Z,selenium_x_scraper_v1,โชว์โง่ชิบหาย5555 มึงลองไปขอทานเก็บเงินแล้วออกนอกประเทศบ้างนะจะได้รู้ว่าเจ้าของภาษาเขาใช้กันยังโคตรหลากหลาย เข้าใจว่าชีวิตต่ำด้อยโอกาาถึงขนาดที่ไม่รับรู้โลกภายนอกเลยต้องกลบปมตัวเองให้ดูเหมือนมีความรู้,โชว์โง่ชิบหาย5555 มึงลองไปขอทานเก็บเงินแล้วออกนอกประเทศบ้างนะจะได้รู้ว่าเจ้าของภาษาเขาใช้กันยังโคตรหลากหลาย เข้าใจว่าชีวิตต่ำด้อยโอกาาถึงขนาดที่ไม่รับรู้โลกภายนอกเลยต้องกลบปมตัวเองให้ดูเหมือนมีความรู้,2025-10-23 17:59:34,"['โชว์', 'โง่', 'ชิบหาย', 'หัวเราะ', ' ', 'มึง', 'ลอง', 'ไป', 'ขอทาน', 'เก็บ', 'เงิน', 'แล้ว', 'ออก', 'นอก', 'ประเทศ', 'บ้าง', 'นะ', 'จะ', 'ได้', 'รู้', 'ว่า', 'เจ้าของภาษา', 'เขา', 'ใช้', 'กัน', 'ยัง', 'โคตร', 'หลากหลาย', ' ', 'เข้าใจ', 'ว่า', 'ชีวิต', 'ต่ำ', 'ด้อย', 'โอ', 'กา', 'า', 'ถึง', 'ขนาดที่', 'ไม่', 'รับรู้', 'โลก', 'ภายนอก', 'เลย', 'ต้อง', 'กลบ', 'ปม', 'ตัวเอง', 'ให้', 'ดูเหมือน', 'มีความรู้']"
1978886976267764179,twitter,post,https://x.com/Tim8666/status/1978886976267764179,text,2025-10-16T18:13:15.000Z,selenium_x_scraper_v1,กุไปต่างประเทศเยอะกว่ามึงแน่นอนอีเบียว สอนตัวมึงเองกับแม่มึงเถอะ โง่,กุไปต่างประเทศเยอะกว่ามึงแน่นอนอีเบียว สอนตัวมึงเองกับแม่มึงเถอะ โง่,2025-10-23 17:59:34,"['กุ', 'ไป', 'ต่างประเทศ', 'เยอะ', 'กว่า', 'มึง', 'แน่นอน', 'อี', 'เบียว', ' ', 'สอน', 'ตัว', 'มึง', 'เอง', 'กับ', 'แม่', 'มึง', 'เถอะ', ' ', 'โง่']"
1978758325815677071,twitter,post,https://x.com/BEBEE_303/status/1978758325815677071,text,2025-10-16T09:42:03.000Z,selenium_x_scraper_v1,ไม่ผิดจ้าาาา ,ไม่ผิดจ้าาาา ,2025-10-23 17:59:34,"['ไม่', 'ผิด', 'จ้า', 'าาา']"
1978728281018081287,twitter,post,https://x.com/Ravenmelonia/status/1978728281018081287,text,2025-10-16T07:42:39.000Z,selenium_x_scraper_v1,เออๆ คราวถามสมองตัวเองที่จบตรีควบโท ที่ไม่มีฐานธิสิสในระบบธรรมศาสตร์ ให้ฟังหน่อยแล้วกันว่า ไล่อังคณาทำไม จะยกเลิกสิทธิมนุษยชนทำไม คือบอกว่าจะเอาหน่วยไปสกัดกันทำไม ทำไมไม่ตื่นตัวตั้งแต่เรื่องวันเฉลิม แถมเผลอๆก็คือทำวิเคราะห์ IS ให้จบๆไป อ.ก็พยายามเข็นๆแหละ ขี้เกียจให้เรียนต่อ,เออๆ คราวถามสมองตัวเองที่จบตรีควบโท ที่ไม่มีฐานธิสิสในระบบธรรมศาสตร์ ให้ฟังหน่อยแล้วกันว่า ไล่อังคณาทำไม จะยกเลิกสิทธิมนุษยชนทำไม คือบอกว่าจะเอาหน่วยไปสกัดกันทำไม ทำไมไม่ตื่นตัวตั้งแต่เรื่องวันเฉลิม แถมเผลอๆก็คือทำวิเคราะห์ IS ให้จบๆไป อ.ก็พยายามเข็นๆแหละ ขี้เกียจให้เรียนต่อ,2025-10-23 17:59:34,"['เออ', 'ๆ', ' ', 'คราว', 'ถาม', 'สมอง', 'ตัวเอง', 'ที่', 'จบ', 'ตรี', 'ควบ', 'โท', ' ', 'ที่', 'ไม่', 'มี', 'ฐาน', 'ธิ', 'สิ', 'ส', 'ใน', 'ระบบ', 'ธรรมศาสตร์', ' ', 'ให้', 'ฟัง', 'หน่อย', 'แล้วกัน', 'ว่า', ' ', 'ไล่', 'อังคณา', 'ทำไม', ' ', 'จะ', 'ยกเลิก', 'สิทธิมนุษยชน', 'ทำไม', ' ', 'คือ', 'บอ', 'กว่า', 'จะ', 'เอา', 'หน่วย', 'ไป', 'สกัด', 'กัน', 'ทำไม', ' ', 'ทำไม', 'ไม่', 'ตื่นตัว', 'ตั้งแต่', 'เรื่อง', 'วัน', 'เฉลิม', ' ', 'แถม', 'เผลอ', 'ๆ', 'ก็', 'คือ', 'ทำ', 'วิเคราะห์', ' ', 'is', ' ', 'ให้', 'จบ', 'ๆ', 'ไป', ' ', 'อ.', 'ก็', 'พยายาม', 'เข็น', 'ๆ', 'แหละ', ' ', 'ขี้เกียจ', 'ให้', 'เรียนต่อ']"
1978782241342771298,twitter,post,https://x.com/dxxino_/status/1978782241342771298,text,2025-10-16T11:17:04.000Z,selenium_x_scraper_v1,ถามเอไอ,ถามเอไอ,2025-10-23 17:59:34,"['ถาม', 'เอ', 'ไอ']"
1978811987736825868,twitter,post,https://x.com/Tim8666/status/1978811987736825868,text,2025-10-16T13:15:17.000Z,selenium_x_scraper_v1,อันนี้โง่มั้ย เค้าทำเพื่อproveว่า ธีสิทมีจริงๆในฐานข้อมูล และ เอไอหาเจอ มึงเปนไรอีเบียว,อันนี้โง่มั้ย เค้าทำเพื่อproveว่า ธีสิทมีจริงๆในฐานข้อมูล และ เอไอหาเจอ มึงเปนไรอีเบียว,2025-10-23 17:59:34,"['อันนี้', 'โง่', 'มั้ย', ' ', 'เค้า', 'ทำ', 'เพื่อ', 'prove', 'ว่า', ' ', 'ธี', 'สิ', 'ท', 'มี', 'จริงๆ', 'ใน', 'ฐานข้อมูล', ' ', 'และ', ' ', 'เอ', 'ไอ', 'หา', 'เจอ', ' ', 'มึง', 'เปน', 'ไร', 'อี', 'เบียว']"
1978808547321242004,twitter,post,https://x.com/Kurokero_/status/1978808547321242004,text,2025-10-16T13:01:36.000Z,selenium_x_scraper_v1,พี่โกรธไรขนาดนั้นอ่ะ พี่โอเครึเปล่านิ,พี่โกรธไรขนาดนั้นอ่ะ พี่โอเครึเปล่านิ,2025-10-23 17:59:34,"['พี่', 'โกรธ', 'ไร', 'ขนาด', 'นั้น', 'อ่ะ', ' ', 'พี่', 'โอเค', 'รึเปล่า', 'นิ']"
1978809434517184920,twitter,post,https://x.com/Tim8666/status/1978809434517184920,text,2025-10-16T13:05:08.000Z,selenium_x_scraper_v1,5555555 หงุดหงิดจ้า ประเด็นนี้น่าจะสองปีละ เถียงกันไม่จบ,5555555 หงุดหงิดจ้า ประเด็นนี้น่าจะสองปีละ เถียงกันไม่จบ,2025-10-23 17:59:34,"['หัวเราะ', ' ', 'หงุดหงิด', 'จ้า', ' ', 'ประเด็น', 'นี้', 'น่าจะ', 'สอง', 'ปี', 'ละ', ' ', 'เถียง', 'กัน', 'ไม่', 'จบ']"
1978802067142738083,twitter,post,https://x.com/Tim8666/status/1978802067142738083,text,2025-10-16T12:35:51.000Z,selenium_x_scraper_v1,แล้ว16-17 บ้านพ่อมีงเปโด ภาคผู้เยาว์อะใช่ แต่เอาโรคมาเรียกมั่วๆ มันเหมือนคนปัญญาอ่อน,แล้ว16-17 บ้านพ่อมีงเปโด ภาคผู้เยาว์อะใช่ แต่เอาโรคมาเรียกมั่วๆ มันเหมือนคนปัญญาอ่อน,2025-10-23 17:59:34,"['แล้ว', '16', ' ', '17', ' ', 'บ้าน', 'พ่อ', 'มี', 'งเป', 'โด', ' ', 'ภาค', 'ผู้เยาว์', 'อะ', 'ใช่', ' ', 'แต่', 'เอา', 'โรค', 'มา', 'เรียก', 'มั่ว', 'ๆ', ' ', 'มัน', 'เหมือน', 'คนปัญญาอ่อน']"
1978727627461472527,twitter,post,https://x.com/Tim8666/status/1978727627461472527,text,2025-10-16T07:40:04.000Z,selenium_x_scraper_v1,อายุไม่น่าเกิน 20 สภาพนี่,อายุไม่น่าเกิน 20 สภาพนี่,2025-10-23 17:59:34,"['อายุ', 'ไม่', 'น่า', 'เกิน', ' ', '20', ' ', 'สภาพ', 'นี่']"
1978712113125409046,twitter,post,https://x.com/Tim8666/status/1978712113125409046,text,2025-10-16T06:38:25.000Z,selenium_x_scraper_v1,ย้ายไปอยู่ตะเขบชายแดนเร็ว พวกproเขมร,ย้ายไปอยู่ตะเขบชายแดนเร็ว พวกproเขมร,2025-10-23 17:59:34,"['ย้าย', 'ไป', 'อยู่', 'ตะ', 'เข', 'บ', 'ชายแดน', 'เร็ว', ' ', 'พวก', 'pro', 'เขมร']"
1978450067422900662,twitter,post,https://x.com/imaveirdo/status/1978450067422900662,text,2025-10-15T13:17:08.000Z,selenium_x_scraper_v1,แกร้ปด่าอุ๊งอิ๊งให้ฟังตลอดทาง อยากให้ 1 ดาวละบอกกุเปนควายแดง,แกร้ปด่าอุ๊งอิ๊งให้ฟังตลอดทาง อยากให้ 1 ดาวละบอกกุเปนควายแดง,2025-10-23 17:59:34,"['แก', 'ร้ป', 'ด่า', 'อุ๊งอิ๊ง', 'ให้', 'ฟัง', 'ตลอดทาง', ' ', 'อยาก', 'ให้', ' ', '1', ' ', 'ดาว', 'ละ', 'บอก', 'กุ', 'เปน', 'ควาย', 'แดง']"
1978650498606694646,twitter,post,https://x.com/Tim8666/status/1978650498606694646,text,2025-10-16T02:33:35.000Z,selenium_x_scraper_v1,มึงไม่สมเพชตัวเองบ้างหรอวะอีโวค ตลก,มึงไม่สมเพชตัวเองบ้างหรอวะอีโวค ตลก,2025-10-23 17:59:34,"['มึง', 'ไม่', 'สมเพช', 'ตัวเอง', 'บ้าง', 'หรอ', 'วะ', 'อี', 'โว', 'ค', ' ', 'ตลก']"
