id,platform,platform_type,url,content_type,timestamp,scraper_module,text,raw_text,scrape_date,tokens
1975370122908008858,twitter,post,https://x.com/jxl0089x/status/1975370122908008858,text,2025-10-07T01:18:32.000Z,selenium_x_scraper_v1,กุจะบอกว่า ถ้ากุมีลูกชาย คือ อยากทำไรก็ทำ อยากเยสใครก็เยส 55555,กุจะบอกว่า ถ้ากุมีลูกชาย คือ อยากทำไรก็ทำ อยากเยสใครก็เยส 55555,2025-10-23 17:59:34,"['กุ', 'จะ', 'บอ', 'กว่า', ' ', 'ถ้า', 'กุ', 'มี', 'ลูกชาย', ' ', 'คือ', ' ', 'อยาก', 'ทำ', 'ไร', 'ก็', 'ทำ', ' ', 'อยาก', 'เย', 'ส', 'ใคร', 'ก็', 'เย', 'ส', ' ', 'หัวเราะ']"
1975234085040890061,twitter,post,https://x.com/mt_tamammooo/status/1975234085040890061,text,2025-10-06T16:17:58.000Z,selenium_x_scraper_v1,เพ้อไรอะ55 มโนเอาว่าเฟมทวิตไม่สวยเลยทำให้ผชทรีตไม่ดี พอยกตัวอย่างว่าดาราสวยยังมีผชทรีตไม่ดีเลยโยงอะไรเพ้อเจ้อ ก็มาแถไม่ยกตย.ดาราจะไม่รู้จัก เออๆ555,เพ้อไรอะ55 มโนเอาว่าเฟมทวิตไม่สวยเลยทำให้ผชทรีตไม่ดี พอยกตัวอย่างว่าดาราสวยยังมีผชทรีตไม่ดีเลยโยงอะไรเพ้อเจ้อ ก็มาแถไม่ยกตย.ดาราจะไม่รู้จัก เออๆ555,2025-10-23 17:59:34,"['เพ้อ', 'ไร', 'อะ', '55', ' ', 'มโน', 'เอา', 'ว่า', 'เฟม', 'ทวิ', 'ต', 'ไม่', 'สวย', 'เลย', 'ทำให้', 'ผชท', 'รีต', 'ไม่', 'ดี', ' ', 'พอ', 'ยกตัว', 'อย่างว่า', 'ดารา', 'สวย', 'ยังมี', 'ผชท', 'รีต', 'ไม่', 'ดี', 'เลย', 'โยง', 'อะไร', 'เพ้อเจ้อ', ' ', 'ก็', 'มา', 'แถ', 'ไม่', 'ยก', 'ตย', '.', 'ดารา', 'จะ', 'ไม่', 'รู้จัก', ' ', 'เออ', 'ๆ', 'หัวเราะ']"
1975230904227561787,twitter,post,https://x.com/jxl0089x/status/1975230904227561787,text,2025-10-06T16:05:20.000Z,selenium_x_scraper_v1,"ไม่คิดว่าเป็นเพราะตัวผญ บ้างหรอ ที่ทำให้ผช มันเปลี่ยนไป  บางคนงี่เง่าเอาแต่ใจขึ้น 
ส่วนพี่น่าจะเด็ดพอที่จะมัดใจแฟนได้ครับ","ไม่คิดว่าเป็นเพราะตัวผญ บ้างหรอ ที่ทำให้ผช มันเปลี่ยนไป  บางคนงี่เง่าเอาแต่ใจขึ้น 
ส่วนพี่น่าจะเด็ดพอที่จะมัดใจแฟนได้ครับ",2025-10-23 17:59:34,"['ไม่', 'คิด', 'ว่า', 'เป็น', 'เพราะ', 'ตัว', 'ผญ', ' ', 'บ้าง', 'หรอ', ' ', 'ที่', 'ทำให้', 'ผช', ' ', 'มัน', 'เปลี่ยนไป', ' ', 'บาง', 'คนงี่เง่า', 'เอาแต่ใจ', 'ขึ้น', ' ', 'ส่วน', 'พี่', 'น่าจะ', 'เด็ด', 'พอที่จะ', 'มัด', 'ใจ', 'แฟน', 'ได้', 'ครับ']"
1975230195176198431,twitter,post,https://x.com/mt_tamammooo/status/1975230195176198431,text,2025-10-06T16:02:31.000Z,selenium_x_scraper_v1,พูดถึงตัวอย่างคือกลุ่มดาราผญ แฟนจะดีไม่ดี ก็ต้องสวยทุกคนอยู่แล้วมั้ยถึงเป็นดาราได้อะ สักแต่จะสวน555555,พูดถึงตัวอย่างคือกลุ่มดาราผญ แฟนจะดีไม่ดี ก็ต้องสวยทุกคนอยู่แล้วมั้ยถึงเป็นดาราได้อะ สักแต่จะสวน555555,2025-10-23 17:59:34,"['พูดถึง', 'ตัวอย่าง', 'คือ', 'กลุ่ม', 'ดารา', 'ผญ', ' ', 'แฟน', 'จะ', 'ดีไม่ดี', ' ', 'ก็', 'ต้อง', 'สวย', 'ทุกคน', 'อยู่แล้ว', 'มั้ย', 'ถึง', 'เป็น', 'ดารา', 'ได้', 'อะ', ' ', 'สัก', 'แต่', 'จะ', 'สวน', 'หัวเราะ']"
1975230649952027032,twitter,post,https://x.com/jxl0089x/status/1975230649952027032,text,2025-10-06T16:04:19.000Z,selenium_x_scraper_v1,แล้วถ้าไม่ยกตัวอย่าง ดารา มึงจะรู้จักมั้ยละ555,แล้วถ้าไม่ยกตัวอย่าง ดารา มึงจะรู้จักมั้ยละ555,2025-10-23 17:59:34,"['แล้ว', 'ถ้า', 'ไม่', 'ยกตัวอย่าง', ' ', 'ดารา', ' ', 'มึง', 'จะ', 'รู้จัก', 'มั้ย', 'ละ', 'หัวเราะ']"
1975230501469433863,twitter,post,https://x.com/jxl0089x/status/1975230501469433863,text,2025-10-06T16:03:44.000Z,selenium_x_scraper_v1,หน้า เฟมทวิต ครับ ,หน้า เฟมทวิต ครับ ,2025-10-23 17:59:34,"['หน้า', ' ', 'เฟม', 'ทวิ', 'ต', ' ', 'ครับ']"
1975219962856996937,twitter,post,https://x.com/npkrxs/status/1975219962856996937,text,2025-10-06T15:21:51.000Z,selenium_x_scraper_v1,“ผญ สวยทุกคน” well right ก็ผญสวยทุกคนอยู่แล้ว ตัวแปรเลยเป็นผช 555,“ผญ สวยทุกคน” well right ก็ผญสวยทุกคนอยู่แล้ว ตัวแปรเลยเป็นผช 555,2025-10-23 17:59:34,"['ผญ', ' ', 'สวย', 'ทุกคน', ' ', 'well', ' ', 'right', ' ', 'ก็', 'ผญ', 'สวย', 'ทุกคน', 'อยู่แล้ว', ' ', 'ตัวแปร', 'เลย', 'เป็น', 'ผช', ' ', 'หัวเราะ']"
1975230407378686346,twitter,post,https://x.com/jxl0089x/status/1975230407378686346,text,2025-10-06T16:03:21.000Z,selenium_x_scraper_v1,ทุกคนสวยในแบบของตัวเอง ประมาณนี้ป้ะ555555555 โครตปลอบใจกันเอง,ทุกคนสวยในแบบของตัวเอง ประมาณนี้ป้ะ555555555 โครตปลอบใจกันเอง,2025-10-23 17:59:34,"['ทุก', 'คนสวย', 'ใน', 'แบบ', 'ของ', 'ตัวเอง', ' ', 'ประมาณ', 'นี้', 'ป้ะ', 'หัวเราะ', ' ', 'โค', 'รต', 'ปลอบใจ', 'กันเอง']"
1975094459395420488,twitter,post,https://x.com/mt_tamammooo/status/1975094459395420488,text,2025-10-06T07:03:09.000Z,selenium_x_scraper_v1,ผญสวยโดนผชtreatเหี้ยเยอะแยะดูอย่างดาราสิ เห็นจะมีแต่ผชloserนะ ประเภทหน้าก็ไม่ดี เงินก็ไม่มี สันดานยังเสีย ที่มีปมว่าทำไมผญไม่เลือกเลยมาแซะเฟมทวิตหน่ะ,ผญสวยโดนผชtreatเหี้ยเยอะแยะดูอย่างดาราสิ เห็นจะมีแต่ผชloserนะ ประเภทหน้าก็ไม่ดี เงินก็ไม่มี สันดานยังเสีย ที่มีปมว่าทำไมผญไม่เลือกเลยมาแซะเฟมทวิตหน่ะ,2025-10-23 17:59:34,"['ผญ', 'สวย', 'โดน', 'ผช', 'treat', 'เหี้ย', 'เยอะแยะ', 'ดู', 'อย่าง', 'ดารา', 'สิ', ' ', 'เห็นจะ', 'มี', 'แต่', 'ผช', 'loser', 'นะ', ' ', 'ประเภท', 'หน้า', 'ก็', 'ไม่', 'ดี', ' ', 'เงิน', 'ก็', 'ไม่', 'มี', ' ', 'สันดาน', 'ยัง', 'เสีย', ' ', 'ที่', 'มี', 'ปม', 'ว่า', 'ทำไม', 'ผญ', 'ไม่', 'เลือก', 'เลย', 'มา', 'แซะ', 'เฟม', 'ทวิ', 'ตห', 'น่ะ']"
1975200880258646284,twitter,post,https://x.com/jxl0089x/status/1975200880258646284,text,2025-10-06T14:06:01.000Z,selenium_x_scraper_v1,คราวนี้ลองดูคู่ที่รักกันดีหน่อยครับ ผญ สวยทุกคน555 ส่วนพวกไม่สวย ให่มันอยู่ในทวิตนี่แหละ,คราวนี้ลองดูคู่ที่รักกันดีหน่อยครับ ผญ สวยทุกคน555 ส่วนพวกไม่สวย ให่มันอยู่ในทวิตนี่แหละ,2025-10-23 17:59:34,"['คราวนี้', 'ลองดู', 'คู่', 'ที่รัก', 'กัน', 'ดี', 'หน่อย', 'ครับ', ' ', 'ผญ', ' ', 'สวย', 'ทุกคน', 'หัวเราะ', ' ', 'ส่วน', 'พวก', 'ไม่', 'สวย', ' ', 'ให่', 'มัน', 'อยู่', 'ใน', 'ทวิ', 'ต', 'นี่แหละ']"
1975173322968367269,twitter,post,https://x.com/jxl0089x/status/1975173322968367269,text,2025-10-06T12:16:31.000Z,selenium_x_scraper_v1,@UsamimiasU ไม่ได้สนใจนะ ลูกจะเป็นคนดีหรือป่าว just use of life son fuck them all ,@UsamimiasU ไม่ได้สนใจนะ ลูกจะเป็นคนดีหรือป่าว just use of life son fuck them all ,2025-10-23 17:59:34,"['ไม่', 'ได้', 'สนใจ', 'นะ', ' ', 'ลูก', 'จะ', 'เป็น', 'คนดี', 'หรือ', 'ป่าว', ' ', 'just', ' ', 'use', ' ', 'of', ' ', 'life', ' ', 'son', ' ', 'fuck', ' ', 'them', ' ', 'all']"
1975164628964405349,twitter,post,https://x.com/mmwaifu/status/1975164628964405349,text,2025-10-06T11:41:58.000Z,selenium_x_scraper_v1,5555555555โสเภณีดิสคอร์ดตกงาน คิดได้ไงคะ,5555555555โสเภณีดิสคอร์ดตกงาน คิดได้ไงคะ,2025-10-23 17:59:34,"['หัวเราะ', 'โสเภณี', 'ดิส', 'คอร์ด', 'ตกงาน', ' ', 'คิดได้', 'ไง', 'คะ']"
1975172917198790944,twitter,post,https://x.com/jxl0089x/status/1975172917198790944,text,2025-10-06T12:14:55.000Z,selenium_x_scraper_v1,"แล้วเค้า บล๊อค ผม ทำไมนะ เจ๊คนนั้น 
ผมไม่ได้เกี่ยวข้องอะไรกับ พวกโสภณีย์ดิสคอร์ท อะไรอยู่ละ","แล้วเค้า บล๊อค ผม ทำไมนะ เจ๊คนนั้น 
ผมไม่ได้เกี่ยวข้องอะไรกับ พวกโสภณีย์ดิสคอร์ท อะไรอยู่ละ",2025-10-23 17:59:34,"['แล้ว', 'เค้า', ' ', 'บล๊อค', ' ', 'ผม', ' ', 'ทำไม', 'นะ', ' ', 'เจ๊', 'คน', 'นั้น', ' ', 'ผม', 'ไม่', 'ได้', 'เกี่ยวข้อง', 'อะไร', 'กับ', ' ', 'พวก', 'โสภ', 'ณีย์', 'ดิส', 'คอร์ท', ' ', 'อะไร', 'อยู่', 'ละ']"
1975163558649295126,twitter,post,https://x.com/pinkslayyy/status/1975163558649295126,text,2025-10-06T11:37:43.000Z,selenium_x_scraper_v1,อ่ออันนี้ถอดบทเรียนแล้ว? ทำไมสภาพยังเป็นขยะเปียกเต็มบ้านเต็มเมือง ฮา,อ่ออันนี้ถอดบทเรียนแล้ว? ทำไมสภาพยังเป็นขยะเปียกเต็มบ้านเต็มเมือง ฮา,2025-10-23 17:59:34,"['อ่อ', 'อันนี้', 'ถอด', 'บทเรียน', 'แล้ว', '?', ' ', 'ทำไม', 'สภาพ', 'ยัง', 'เป็น', 'ขยะ', 'เปียก', 'เต็มบ้านเต็มเมือง', ' ', 'หัวเราะ']"
1975172557121921406,twitter,post,https://x.com/jxl0089x/status/1975172557121921406,text,2025-10-06T12:13:29.000Z,selenium_x_scraper_v1,"ก็เห็นผญ รณรงค์กันทุกวัน ว่าอย่าคบผช red flag อย่างนู้นอย่างนี้ 
แต่ก็งง ทำไมยังมีผู้หญิงโดนอยู่ ","ก็เห็นผญ รณรงค์กันทุกวัน ว่าอย่าคบผช red flag อย่างนู้นอย่างนี้ 
แต่ก็งง ทำไมยังมีผู้หญิงโดนอยู่ ",2025-10-23 17:59:34,"['ก็', 'เห็น', 'ผญ', ' ', 'รณรงค์', 'กัน', 'ทุกวัน', ' ', 'ว่า', 'อย่า', 'คบ', 'ผช', ' ', 'red', ' ', 'flag', ' ', 'อย่าง', 'นู้น', 'อย่างนี้', ' ', 'แต่', 'ก็', 'งง', ' ', 'ทำไม', 'ยังมี', 'ผู้หญิง', 'โดน', 'อยู่']"
1975050011168960717,twitter,post,https://x.com/maymxxnn/status/1975050011168960717,text,2025-10-06T04:06:31.000Z,selenium_x_scraper_v1,สาเหตุเกิดจากผช แต่บอกเป็นบทเรียนผู้หญิง อะไร,สาเหตุเกิดจากผช แต่บอกเป็นบทเรียนผู้หญิง อะไร,2025-10-23 17:59:34,"['สาเหตุ', 'เกิด', 'จาก', 'ผช', ' ', 'แต่', 'บอก', 'เป็น', 'บทเรียน', 'ผู้หญิง', ' ', 'อะไร']"
1975101709203730696,twitter,post,https://x.com/jxl0089x/status/1975101709203730696,text,2025-10-06T07:31:57.000Z,selenium_x_scraper_v1,เค้าบอกอยู่ ถอดบทเรียน เรื่องการเลือกคู่ไง ,เค้าบอกอยู่ ถอดบทเรียน เรื่องการเลือกคู่ไง ,2025-10-23 17:59:34,"['เค้า', 'บอก', 'อยู่', ' ', 'ถอด', 'บทเรียน', ' ', 'เรื่อง', 'การ', 'เลือกคู่', 'ไง']"
1975089777566527859,twitter,post,https://x.com/M_JRJKJ/status/1975089777566527859,text,2025-10-06T06:44:33.000Z,selenium_x_scraper_v1,Coming from an incel like you?,Coming from an incel like you?,2025-10-23 17:59:34,"['coming', ' ', 'from', ' ', 'an', ' ', 'incel', ' ', 'like', ' ', 'you', '?']"
1975095411024318606,twitter,post,https://x.com/jxl0089x/status/1975095411024318606,text,2025-10-06T07:06:56.000Z,selenium_x_scraper_v1,"Haha I'm not an incel, I actually have a gf and she's not the feminist type. So I can hate all feminist ","Haha I'm not an incel, I actually have a gf and she's not the feminist type. So I can hate all feminist ",2025-10-23 17:59:34,"['หัวเราะ', ' ', 'i', ""'m"", ' ', 'not', ' ', 'an', ' ', 'incel', ',', ' ', 'i', ' ', 'actually', ' ', 'have', ' ', 'a', ' ', 'gf', ' ', 'and', ' ', 'she', ""'s"", ' ', 'not', ' ', 'the', ' ', 'feminist', ' ', 'type', '.', ' ', 'so', ' ', 'i', ' ', 'can', ' ', 'hate', ' ', 'all', ' ', 'feminist']"
1974907829049008491,twitter,post,https://x.com/Egea_banumlai/status/1974907829049008491,text,2025-10-05T18:41:33.000Z,selenium_x_scraper_v1,ปล่อยให้มันตายไปเลยไม่ต้องไปใส่ใจ อีอัปรีย์จันไร ตายโหงตายห่าทั้งทีทำไมไม่ตายห่าที่บ้านมึงคะ อีแม่เย็ด สร้างความเดือดร้อนให้คนอื่น  เค้าไม่ได้อยากเห็นสภาพศพอันน่าสมเพชเหมือนหมาข้างถนนของมึง เดือดร้อนคนอื่นต้องมาเก็บศพต้องมาทำความสะอาด เสนียดจัญไรแบบมึงอีก,ปล่อยให้มันตายไปเลยไม่ต้องไปใส่ใจ อีอัปรีย์จันไร ตายโหงตายห่าทั้งทีทำไมไม่ตายห่าที่บ้านมึงคะ อีแม่เย็ด สร้างความเดือดร้อนให้คนอื่น  เค้าไม่ได้อยากเห็นสภาพศพอันน่าสมเพชเหมือนหมาข้างถนนของมึง เดือดร้อนคนอื่นต้องมาเก็บศพต้องมาทำความสะอาด เสนียดจัญไรแบบมึงอีก,2025-10-23 17:59:34,"['ปล่อย', 'ให้', 'มัน', 'ตาย', 'ไป', 'เลย', 'ไม่ต้อง', 'ไป', 'ใส่ใจ', ' ', 'อี', 'อัปรีย์', 'จัน', 'ไร', ' ', 'ตายโหง', 'ตายห่า', 'ทั้งที', 'ทำไม', 'ไม่', 'ตายห่า', 'ที่', 'บ้าน', 'มึง', 'คะ', ' ', 'อี', 'แม่', 'เย็ด', ' ', 'สร้าง', 'ความเดือดร้อน', 'ให้', 'คนอื่น', ' ', 'เค้า', 'ไม่', 'ได้', 'อยาก', 'เห็น', 'สภาพ', 'ศพ', 'อัน', 'น่าสมเพช', 'เหมือน', 'หมา', 'ข้าง', 'ถนน', 'ของ', 'มึง', ' ', 'เดือดร้อน', 'คนอื่น', 'ต้อง', 'มา', 'เก็บ', 'ศพ', 'ต้อง', 'มา', 'ทำความสะอาด', ' ', 'เสนียดจัญไร', 'แบบ', 'มึง', 'อีก']"
1975051791093117138,twitter,post,https://x.com/jxl0089x/status/1975051791093117138,text,2025-10-06T04:13:36.000Z,selenium_x_scraper_v1,5555555555,5555555555,2025-10-23 17:59:34,['หัวเราะ']
1974467395986288909,twitter,post,https://x.com/jolypmuayris/status/1974467395986288909,text,2025-10-04T13:31:25.000Z,selenium_x_scraper_v1,เรื่องของมึงค่ะอันนั้น,เรื่องของมึงค่ะอันนั้น,2025-10-23 17:59:34,"['เรื่อง', 'ของ', 'มึง', 'ค่ะ', 'อันนั้น']"
1974736288776593568,twitter,post,https://x.com/jxl0089x/status/1974736288776593568,text,2025-10-05T07:19:54.000Z,selenium_x_scraper_v1,หยาบคายชิบ,หยาบคายชิบ,2025-10-23 17:59:34,"['หยาบคาย', 'ชิบ']"
1974456035311280195,twitter,post,https://x.com/jolypmuayris/status/1974456035311280195,text,2025-10-04T12:46:17.000Z,selenium_x_scraper_v1,กุถึงบอกไงว่าน่าสนุก ว๊าย55555555,กุถึงบอกไงว่าน่าสนุก ว๊าย55555555,2025-10-23 17:59:34,"['กุ', 'ถึง', 'บอก', 'ไง', 'ว่า', 'น่าสนุก', ' ', 'ว๊าย', 'หัวเราะ']"
1974465438559134034,twitter,post,https://x.com/jxl0089x/status/1974465438559134034,text,2025-10-04T13:23:39.000Z,selenium_x_scraper_v1,เหอะ ถึงกุโดน ก้ไม่ใครรู้หรอก,เหอะ ถึงกุโดน ก้ไม่ใครรู้หรอก,2025-10-23 17:59:34,"['เหอะ', ' ', 'ถึง', 'กุ', 'โดน', ' ', 'ก้', 'ไม่', 'ใคร', 'รู้', 'หรอก']"
1974452835560669552,twitter,post,https://x.com/jolypmuayris/status/1974452835560669552,text,2025-10-04T12:33:34.000Z,selenium_x_scraper_v1,สมน้ำหน้า กุบอกแล้วพวกชายแท้ต้องโดนแบบนี้ โคตรสนุก555555555,สมน้ำหน้า กุบอกแล้วพวกชายแท้ต้องโดนแบบนี้ โคตรสนุก555555555,2025-10-23 17:59:34,"['สมน้ำหน้า', ' ', 'กุ', 'บอก', 'แล้ว', 'พวก', 'ชาย', 'แท้', 'ต้อง', 'โดน', 'แบบนี้', ' ', 'โคตร', 'สนุก', 'หัวเราะ']"
1974453724665020682,twitter,post,https://x.com/jxl0089x/status/1974453724665020682,text,2025-10-04T12:37:06.000Z,selenium_x_scraper_v1,"ไม่มีทางอ่ะ น่าอายชิบหายย
หยุดยัดเยียดให้กุเถอะ","ไม่มีทางอ่ะ น่าอายชิบหายย
หยุดยัดเยียดให้กุเถอะ",2025-10-23 17:59:34,"['ไม่', 'มีทาง', 'อ่ะ', ' ', 'น่าอาย', 'ชิบหาย', 'ย', ' ', 'หยุด', 'ยัดเยียด', 'ให้', 'กุ', 'เถอะ']"
1974443453783372031,twitter,post,https://x.com/jolypmuayris/status/1974443453783372031,text,2025-10-04T11:56:17.000Z,selenium_x_scraper_v1,ก็มึงเหมาะไง งงไร,ก็มึงเหมาะไง งงไร,2025-10-23 17:59:34,"['ก็', 'มึง', 'เหมาะ', 'ไง', ' ', 'งง', 'ไร']"
1974446596214641135,twitter,post,https://x.com/jxl0089x/status/1974446596214641135,text,2025-10-04T12:08:46.000Z,selenium_x_scraper_v1,"กุหยี๋
อย่าเอาแบบอย่างคนนี้","กุหยี๋
อย่าเอาแบบอย่างคนนี้",2025-10-23 17:59:34,"['กุ', 'หยี๋', ' ', 'อย่า', 'เอา', 'แบบอย่าง', 'คน', 'นี้']"
1974395056149996006,twitter,post,https://x.com/charlottekingpf/status/1974395056149996006,text,2025-10-04T08:43:58.000Z,selenium_x_scraper_v1,ถึงผมจะสันดานหมา แต่ผมไม่ใช่ภาระสังคมนะจั๊ฟ,ถึงผมจะสันดานหมา แต่ผมไม่ใช่ภาระสังคมนะจั๊ฟ,2025-10-23 17:59:34,"['ถึง', 'ผม', 'จะ', 'สันดาน', 'หมา', ' ', 'แต่', 'ผม', 'ไม่', 'ใช่', 'ภาระ', 'สังคม', 'นะ', 'จั๊ฟ']"
1974403003009691987,twitter,post,https://x.com/jxl0089x/status/1974403003009691987,text,2025-10-04T09:15:33.000Z,selenium_x_scraper_v1,ดีชั่วรุ้หมด แต่อดไม่ได้ ,ดีชั่วรุ้หมด แต่อดไม่ได้ ,2025-10-23 17:59:34,"['ดี', 'ชั่ว', 'รุ้', 'หมด', ' ', 'แต่', 'อด', 'ไม่', 'ได้']"
1974388226891858004,twitter,post,https://x.com/jolypmuayris/status/1974388226891858004,text,2025-10-04T08:16:50.000Z,selenium_x_scraper_v1,หรอคะ จริงๆนี่คิดว่าคุณรู้แล้วน้า ลองนึกดูดีๆ55555,หรอคะ จริงๆนี่คิดว่าคุณรู้แล้วน้า ลองนึกดูดีๆ55555,2025-10-23 17:59:34,"['หรอ', 'คะ', ' ', 'จริงๆ', 'นี่', 'คิด', 'ว่า', 'คุณ', 'รู้', 'แล้ว', 'น้า', ' ', 'ลอง', 'นึก', 'ดูดี', 'ๆ', 'หัวเราะ']"
1974402911041200348,twitter,post,https://x.com/jxl0089x/status/1974402911041200348,text,2025-10-04T09:15:11.000Z,selenium_x_scraper_v1,ไม่อ่ะ ชอบเป็นชายแท้ สบายใจดี5555,ไม่อ่ะ ชอบเป็นชายแท้ สบายใจดี5555,2025-10-23 17:59:34,"['ไม่', 'อ่ะ', ' ', 'ชอบ', 'เป็น', 'ชาย', 'แท้', ' ', 'สบาย', 'ใจดี', 'หัวเราะ']"
1974384687020925276,twitter,post,https://x.com/jolypmuayris/status/1974384687020925276,text,2025-10-04T08:02:46.000Z,selenium_x_scraper_v1,ขอบคุณที่รู้ตัวว่าตัวเองเป็นภาระของสังคมนะคะ,ขอบคุณที่รู้ตัวว่าตัวเองเป็นภาระของสังคมนะคะ,2025-10-23 17:59:34,"['ขอบคุณ', 'ที่', 'รู้ตัว', 'ว่า', 'ตัวเอง', 'เป็น', 'ภาระ', 'ของ', 'สังคม', 'นะคะ']"
