id,platform,platform_type,url,content_type,timestamp,scraper_module,text,raw_text,scrape_date,tokens
1985164322382008555,twitter,post,https://x.com/FeimZi/status/1985164322382008555,text,2025-11-03T01:57:11.000Z,selenium_x_scraper_v1,"ปาร์ตี้""เซ็ก""ของวงการนี้เล่นยากันเป็นปกติ ประวัติมันมีนับไม่ถ้วน ตำรวจมันเก็บสถิติตลอดมันรู้ ว่าได้แน่ๆ ถ้าตำรวจมันจะเอาผลงานด้านนี้ เจาะของฝั่งเกย์ยังไงก็เจอยา100% แต่ถ้ามันไปฝั่งชญต้องลุ้น ถ้าไม่เจอเตรียมโดนสวนด้วย","ปาร์ตี้""เซ็ก""ของวงการนี้เล่นยากันเป็นปกติ ประวัติมันมีนับไม่ถ้วน ตำรวจมันเก็บสถิติตลอดมันรู้ ว่าได้แน่ๆ ถ้าตำรวจมันจะเอาผลงานด้านนี้ เจาะของฝั่งเกย์ยังไงก็เจอยา100% แต่ถ้ามันไปฝั่งชญต้องลุ้น ถ้าไม่เจอเตรียมโดนสวนด้วย",2025-11-29 08:18:55,"['ปาร์ตี้', ' ', 'เซ็ก', ' ', 'ของ', 'วงการ', 'นี้', 'เล่น', 'ยา', 'กัน', 'เป็นปกติ', ' ', 'ประวัติ', 'มัน', 'มี', 'นับไม่ถ้วน', ' ', 'ตำรวจ', 'มัน', 'เก็บ', 'สถิติ', 'ตลอด', 'มัน', 'รู้', ' ', 'ว่า', 'ได้', 'แน่ๆ', ' ', 'ถ้า', 'ตำรวจ', 'มัน', 'จะ', 'เอา', 'ผลงาน', 'ด้าน', 'นี้', ' ', 'เจาะ', 'ของ', 'ฝั่ง', 'เกย์', 'ยังไง', 'ก็', 'เจอ', 'ยา', '100', ' ', 'แต่', 'ถ้า', 'มัน', 'ไป', 'ฝั่ง', 'ชญ', 'ต้อง', 'ลุ้น', ' ', 'ถ้า', 'ไม่', 'เจอ', 'เตรียม', 'โดน', 'สวน', 'ด้วย']"
1985007424953331824,twitter,post,https://x.com/OkYessssss/status/1985007424953331824,text,2025-11-02T15:33:44.000Z,selenium_x_scraper_v1,เก่งเเต่จับคนเย็ดกัน,เก่งเเต่จับคนเย็ดกัน,2025-11-29 08:18:55,"['เก่ง', 'เเต่', 'จับ', 'คน', 'เย็ด', 'กัน']"
1985518821525028960,twitter,post,https://x.com/ZzzYakuza/status/1985518821525028960,text,2025-11-04T01:25:50.000Z,selenium_x_scraper_v1,แหล่งเพาะพันธุ์hivชัดๆ,แหล่งเพาะพันธุ์hivชัดๆ,2025-11-29 08:18:55,"['แหล่ง', 'เพาะพันธุ์', 'hiv', 'ชัด', 'ๆ']"
1985231393950237102,twitter,post,https://x.com/EamChard/status/1985231393950237102,text,2025-11-03T06:23:42.000Z,selenium_x_scraper_v1,กลุ่มท้องไม่เคยผูก,กลุ่มท้องไม่เคยผูก,2025-11-29 08:18:55,"['กลุ่ม', 'ท้อง', 'ไม่', 'เคย', 'ผูก']"
1984989963860201638,twitter,post,https://x.com/Labulabuu22/status/1984989963860201638,text,2025-11-02T14:24:21.000Z,selenium_x_scraper_v1,ส่วนยาของกลางเดี๋ยววนกลับมาขายต่อยึดแล้วขายวนไปป่าว ,ส่วนยาของกลางเดี๋ยววนกลับมาขายต่อยึดแล้วขายวนไปป่าว ,2025-11-29 08:18:55,"['ส่วน', 'ยา', 'ของกลาง', 'เดี๋ยว', 'วน', 'กลับมา', 'ขายต่อ', 'ยึด', 'แล้ว', 'ขา', 'ยวน', 'ไป', 'ป่าว']"
1985258504698138979,twitter,post,https://x.com/BANANABAR5/status/1985258504698138979,text,2025-11-03T08:11:26.000Z,selenium_x_scraper_v1,อ่อเออ กูก็ว่าเหมืองทองอะไร คำนี้ควรเลิกใช้ได้ล่ะค่ะคนที่ยังใช้อยู่คือแก่มากนะ แก่เเบบใกล้ลงโรงอะ,อ่อเออ กูก็ว่าเหมืองทองอะไร คำนี้ควรเลิกใช้ได้ล่ะค่ะคนที่ยังใช้อยู่คือแก่มากนะ แก่เเบบใกล้ลงโรงอะ,2025-11-29 08:18:55,"['อ่อ', 'เออ', ' ', 'กู', 'ก็', 'ว่า', 'เหมือง', 'ทอง', 'อะไร', ' ', 'คำ', 'นี้', 'ควร', 'เลิก', 'ใช้ได้', 'ล่ะ', 'ค่ะ', 'คน', 'ที่', 'ยัง', 'ใช้', 'อยู่', 'คือ', 'แก่', 'มาก', 'นะ', ' ', 'แก่', 'เเบบ', 'ใกล้', 'ลงโรง', 'อะ']"
1985085251153191282,twitter,post,https://x.com/rockyroll770363/status/1985085251153191282,text,2025-11-02T20:42:59.000Z,selenium_x_scraper_v1,"ยกตัวอย่างที่ถูกใจถูกต้องให้ดูหน่อยครับ เอาคลิปและรูปที่ตร.มี
จงยกตัวอย่างการพาดหัวข่าวแบบสังคมตอแหลรับได้หน่อยครับ","ยกตัวอย่างที่ถูกใจถูกต้องให้ดูหน่อยครับ เอาคลิปและรูปที่ตร.มี
จงยกตัวอย่างการพาดหัวข่าวแบบสังคมตอแหลรับได้หน่อยครับ",2025-11-29 08:18:55,"['ยกตัวอย่าง', 'ที่', 'ถูกใจ', 'ถูกต้อง', 'ให้', 'ดู', 'หน่อย', 'ครับ', ' ', 'เอา', 'คลิป', 'และ', 'รูป', 'ที่', 'ตร.', 'มี', ' ', 'จง', 'ยกตัวอย่าง', 'การ', 'พาดหัวข่าว', 'แบบ', 'สังคม', 'ตอแหล', 'รับได้', 'หน่อย', 'ครับ']"
1985278499633188923,twitter,post,https://x.com/ZzzYakuza/status/1985278499633188923,text,2025-11-03T09:30:53.000Z,selenium_x_scraper_v1,แหล่งเพาะพันธุ์hiv,แหล่งเพาะพันธุ์hiv,2025-11-29 08:18:55,"['แหล่ง', 'เพาะพันธุ์', 'hiv']"
1985219610883637405,twitter,post,https://x.com/EvillQueen82/status/1985219610883637405,text,2025-11-03T05:36:53.000Z,selenium_x_scraper_v1,อ่านละงง ตกลงข่าวจับยา หรือ sex,อ่านละงง ตกลงข่าวจับยา หรือ sex,2025-11-29 08:18:55,"['อ่าน', 'ละ', 'งง', ' ', 'ตก', 'ลงข่าว', 'จับ', 'ยา', ' ', 'หรือ', ' ', 'sex']"
1985243397339435080,twitter,post,https://x.com/teesumoto/status/1985243397339435080,text,2025-11-03T07:11:24.000Z,selenium_x_scraper_v1,จะให้เรียกอะไร ปาร์ตี้ เกย์ ชายรักชาย รักร่วมเพศหรา ,จะให้เรียกอะไร ปาร์ตี้ เกย์ ชายรักชาย รักร่วมเพศหรา ,2025-11-29 08:18:55,"['จะ', 'ให้', 'เรียก', 'อะไร', ' ', 'ปาร์ตี้', ' ', 'เกย์', ' ', 'ชาย', 'รัก', 'ชาย', ' ', 'รักร่วมเพศ', 'หรา']"
1985158455217561927,twitter,post,https://x.com/KaliYugasurfer5/status/1985158455217561927,text,2025-11-03T01:33:52.000Z,selenium_x_scraper_v1,"ffffff  aaaaaa.     ggggggg gggggg
f.                      a.    g.           g g.        g
ffff.    aaaaaa.     ggggggg gggggg
f.         a.          a.                  g             g
f.         aaaaaaa.  ggggggg gggggg
oooo  ttttt
o.    o.     t
oooo      t","ffffff  aaaaaa.     ggggggg gggggg
f.                      a.    g.           g g.        g
ffff.    aaaaaa.     ggggggg gggggg
f.         a.          a.                  g             g
f.         aaaaaaa.  ggggggg gggggg
oooo  ttttt
o.    o.     t
oooo      t",2025-11-29 08:18:55,"['ffffff', ' ', 'aaaaaa', '.', ' ', 'ggggggg', ' ', 'gggggg', ' ', 'f', '.', ' ', 'a', '.', ' ', 'g', '.', ' ', 'g', ' ', 'g', '.', ' ', 'g', ' ', 'ffff', '.', ' ', 'aaaaaa', '.', ' ', 'ggggggg', ' ', 'gggggg', ' ', 'f', '.', ' ', 'a', '.', ' ', 'a', '.', ' ', 'g', ' ', 'g', ' ', 'f', '.', ' ', 'aaaaaaa', '.', ' ', 'ggggggg', ' ', 'gggggg', ' ', 'oooo', ' ', 'ttttt', ' ', 'o', '.', ' ', 'o', '.', ' ', 't', ' ', 'oooo', ' ', 't']"
1985252349120848003,twitter,post,https://x.com/bkkk888/status/1985252349120848003,text,2025-11-03T07:46:58.000Z,selenium_x_scraper_v1,เราก็งง  ขุดเหมืองทองตั้งนาน  กว่าจะนึกออก,เราก็งง  ขุดเหมืองทองตั้งนาน  กว่าจะนึกออก,2025-11-29 08:18:55,"['เรา', 'ก็', 'งง', ' ', 'ขุด', 'เหมือง', 'ทอง', 'ตั้ง', 'นาน', ' ', 'กว่า', 'จะ', 'นึกออก']"
1985515626723754393,twitter,post,https://x.com/toy_12124/status/1985515626723754393,text,2025-11-04T01:13:09.000Z,selenium_x_scraper_v1,มันคือความจริง พวกเกย์มันเยดตูดเล่นยากัน จะมาแยกไรก่อน,มันคือความจริง พวกเกย์มันเยดตูดเล่นยากัน จะมาแยกไรก่อน,2025-11-29 08:18:55,"['มัน', 'คือ', 'ความจริง', ' ', 'พวก', 'เกย์', 'มัน', 'เย', 'ด', 'ตูด', 'เล่น', 'ยา', 'กัน', ' ', 'จะ', 'มา', 'แยก', 'ไร', 'ก่อน']"
1985240759369638298,twitter,post,https://x.com/Esasloonoo/status/1985240759369638298,text,2025-11-03T07:00:55.000Z,selenium_x_scraper_v1,แล้วจะชูถุงยางทำไม รณรงค์เลิกใช้ถุงยางหรอ 5555,แล้วจะชูถุงยางทำไม รณรงค์เลิกใช้ถุงยางหรอ 5555,2025-11-29 08:18:55,"['แล้', 'วจะ', 'ชู', 'ถุงยาง', 'ทำไม', ' ', 'รณรงค์', 'เลิกใช้', 'ถุงยาง', 'หรอ', ' ', 'หัวเราะ']"
1985060613060808963,twitter,post,https://x.com/surachai2020/status/1985060613060808963,text,2025-11-02T19:05:05.000Z,selenium_x_scraper_v1,แจะๆ,แจะๆ,2025-11-29 08:18:55,"['แจะ', 'ๆ']"
1985028802133868812,twitter,post,https://x.com/LOWE1168262/status/1985028802133868812,text,2025-11-02T16:58:41.000Z,selenium_x_scraper_v1,"จะดู คุณภาพ พลเมือง ประเทศไหน

ดูที่ พลเมือง เสพ สื่อ ประเภทใด

อนึ่ง กรู สงสัย อยู่รูป ...

เต่าเรือ มรึงเป็นเหี้ยอาราย ต้องไปชูถุงยาง แบบนั้น ...","จะดู คุณภาพ พลเมือง ประเทศไหน

ดูที่ พลเมือง เสพ สื่อ ประเภทใด

อนึ่ง กรู สงสัย อยู่รูป ...

เต่าเรือ มรึงเป็นเหี้ยอาราย ต้องไปชูถุงยาง แบบนั้น ...",2025-11-29 08:18:55,"['จะ', 'ดู', ' ', 'คุณภาพ', ' ', 'พลเมือง', ' ', 'ประเทศ', 'ไหน', ' ', 'ดู', 'ที่', ' ', 'พลเมือง', ' ', 'เสพ', ' ', 'สื่อ', ' ', 'ประเภท', 'ใด', ' ', 'อนึ่ง', ' ', 'กรู', ' ', 'สงสัย', ' ', 'อยู่', 'รูป', ' ', '...', ' ', 'เต่า', 'เรือ', ' ', 'มรึง', 'เป็น', 'เหี้ย', 'อา', 'ราย', ' ', 'ต้อง', 'ไป', 'ชู', 'ถุงยาง', ' ', 'แบบ', 'นั้น', ' ', '...']"
1985053723346026807,twitter,post,https://x.com/Ktfineman/status/1985053723346026807,text,2025-11-02T18:37:42.000Z,selenium_x_scraper_v1,งั้นแยกชื่อมาเลยครับว่าในกลุ่มนั้นคนไหนไม่เล่นยาคนไหนไม่lgbt,งั้นแยกชื่อมาเลยครับว่าในกลุ่มนั้นคนไหนไม่เล่นยาคนไหนไม่lgbt,2025-11-29 08:18:55,"['งั้น', 'แยก', 'ชื่อ', 'มา', 'เลย', 'ครับ', 'ว่า', 'ใน', 'กลุ่ม', 'นั้น', 'คน', 'ไหน', 'ไม่', 'เล่น', 'ยา', 'คน', 'ไหน', 'ไม่', 'lgbt']"
1985129433980887131,twitter,post,https://x.com/kitiphngskhwwn1/status/1985129433980887131,text,2025-11-02T23:38:33.000Z,selenium_x_scraper_v1,ส่วนใหญ่พวกกระเทย,ส่วนใหญ่พวกกระเทย,2025-11-29 08:18:55,"['ส่วนใหญ่', 'พวก', 'กระ', 'เท', 'ย']"
1985183410286104787,twitter,post,https://x.com/Momotaro16352/status/1985183410286104787,text,2025-11-03T03:13:02.000Z,selenium_x_scraper_v1,ต้องยอมรับความจริงนะหนูๆ,ต้องยอมรับความจริงนะหนูๆ,2025-11-29 08:18:55,"['ต้อง', 'ยอมรับ', 'ความจริง', 'นะ', 'หนู', 'ๆ']"
1985183273979674812,twitter,post,https://x.com/Momotaro16352/status/1985183273979674812,text,2025-11-03T03:12:30.000Z,selenium_x_scraper_v1,ก็เยกันเอากันเมามันส์จนลืมพักยกไปล้างบ้างจนขี้เลอะติดเตียง #จากคนเคยตี้มาก่อนกาล,ก็เยกันเอากันเมามันส์จนลืมพักยกไปล้างบ้างจนขี้เลอะติดเตียง #จากคนเคยตี้มาก่อนกาล,2025-11-29 08:18:55,"['ก็', 'เย', 'กันเอา', 'กัน', 'เมา', 'มันส์', 'จน', 'ลืม', 'พัก', 'ยก', 'ไป', 'ล้าง', 'บ้าง', 'จน', 'ขี้', 'เลอะ', 'ติด', 'เตียง', ' ', 'จาก', 'คน', 'เคย', 'ตี้', 'มา', 'ก่อน', 'กาล']"
1984969096258314346,twitter,post,https://x.com/amp_x_mode/status/1984969096258314346,text,2025-11-02T13:01:26.000Z,selenium_x_scraper_v1,"พาดหัวแบบจงใขจขายข่าวแต่ลืมจรรยาบรรณไว้ที่มกหาลัย เผลอๆคนที่เขียนข่าวก็ใช่ว่าจะเรียนจบมหาลัยด้วยซ้ำ

แต่ก็นะ จะได้แบนสื่อได้ถูกแหล่ง จะได้ไม่ต้องเห็นข่าวอีก","พาดหัวแบบจงใขจขายข่าวแต่ลืมจรรยาบรรณไว้ที่มกหาลัย เผลอๆคนที่เขียนข่าวก็ใช่ว่าจะเรียนจบมหาลัยด้วยซ้ำ

แต่ก็นะ จะได้แบนสื่อได้ถูกแหล่ง จะได้ไม่ต้องเห็นข่าวอีก",2025-11-29 08:18:55,"['พาดหัว', 'แบบ', 'จง', 'ใขจ', 'ขาย', 'ข่าว', 'แต่', 'ลืม', 'จรรยาบรรณ', 'ไว้', 'ที่', 'มก', 'หา', 'ลัย', ' ', 'เผลอ', 'ๆคน', 'ที่', 'เขียน', 'ข่าว', 'ก็', 'ใช่', 'ว่า', 'จะ', 'เรียนจบ', 'มหาลัย', 'ด้วยซ้ำ', ' ', 'แต่', 'ก็', 'นะ', ' ', 'จะ', 'ได้', 'แบน', 'สื่อ', 'ได้', 'ถูก', 'แหล่ง', ' ', 'จะ', 'ได้', 'ไม่ต้อง', 'เห็น', 'ข่าว', 'อีก']"
1984985226553262185,twitter,post,https://x.com/Iamkevins18/status/1984985226553262185,text,2025-11-02T14:05:31.000Z,selenium_x_scraper_v1,อีกอันนึงคือ การมี sexกันด้วยความยินยอมและใช้ถุงยางด้วยมันเป็นเรื่องที่ดีนะ ทำไมตำรวจต้องหยิบถุงยางโชว์ เหมือนเป็นของกลางว่าทำผิด สรุปใส่ถุงยางเยสกันมันผิดกฏหมายหรอ เคสนี้จับยาเสพติดไม่ใช่หรอ,อีกอันนึงคือ การมี sexกันด้วยความยินยอมและใช้ถุงยางด้วยมันเป็นเรื่องที่ดีนะ ทำไมตำรวจต้องหยิบถุงยางโชว์ เหมือนเป็นของกลางว่าทำผิด สรุปใส่ถุงยางเยสกันมันผิดกฏหมายหรอ เคสนี้จับยาเสพติดไม่ใช่หรอ,2025-11-29 08:18:55,"['อีก', 'อัน', 'นึง', 'คือ', ' ', 'การ', 'มี', ' ', 'sex', 'กัน', 'ด้วย', 'ความยินยอม', 'และ', 'ใช้', 'ถุงยาง', 'ด้วย', 'มัน', 'เป็นเรื่อง', 'ที่', 'ดี', 'นะ', ' ', 'ทำไม', 'ตำรวจ', 'ต้อง', 'หยิบ', 'ถุงยาง', 'โชว์', ' ', 'เหมือน', 'เป็น', 'ของกลาง', 'ว่า', 'ทำผิด', ' ', 'สรุป', 'ใส่', 'ถุงยาง', 'เย', 'ส', 'กัน', 'มัน', 'ผิดก', 'ฏ', 'หมาย', 'หรอ', ' ', 'เคส', 'นี้', 'จับ', 'ยาเสพติด', 'ไม่', 'ใช่', 'หรอ']"
1985091325499416842,twitter,post,https://x.com/kaelyntem/status/1985091325499416842,text,2025-11-02T21:07:07.000Z,selenium_x_scraper_v1,แทนทีจะโชว์สารเสพติด แต่โชว์ถุงยาง ถุงยางผิดกดหมายสินะ เก่งจริงๆ,แทนทีจะโชว์สารเสพติด แต่โชว์ถุงยาง ถุงยางผิดกดหมายสินะ เก่งจริงๆ,2025-11-29 08:18:55,"['แทน', 'ที', 'จะ', 'โชว์', 'สารเสพติด', ' ', 'แต่', 'โชว์', 'ถุงยาง', ' ', 'ถุงยาง', 'ผิด', 'กด', 'หมาย', 'สิ', 'นะ', ' ', 'เก่ง', 'จริงๆ']"
1985006985662873789,twitter,post,https://x.com/GOALMAXTH/status/1985006985662873789,text,2025-11-02T15:31:59.000Z,selenium_x_scraper_v1,เบื่อแจ๊ะมาก,เบื่อแจ๊ะมาก,2025-11-29 08:18:55,"['เบื่อ', 'แจ๊ะ', 'มาก']"
1985220275194212376,twitter,post,https://x.com/lalindabangkok/status/1985220275194212376,text,2025-11-03T05:39:31.000Z,selenium_x_scraper_v1,คนเขียนข่าว เขารู้บ้างไหมว่ามันคือคำเหยียด ของชายแท้บางคน ไม่ควรนำมาใช้พาดหัวข่าวแบบนี้,คนเขียนข่าว เขารู้บ้างไหมว่ามันคือคำเหยียด ของชายแท้บางคน ไม่ควรนำมาใช้พาดหัวข่าวแบบนี้,2025-11-29 08:18:55,"['คนเขียนข่าว', ' ', 'เขา', 'รู้', 'บ้าง', 'ไหม', 'ว่า', 'มัน', 'คือ', 'คำ', 'เหยียด', ' ', 'ของ', 'ชาย', 'แท้', 'บางคน', ' ', 'ไม่', 'ควร', 'นำมาใช้', 'พาดหัวข่าว', 'แบบนี้']"
1985265905929253228,twitter,post,https://x.com/sexinkan/status/1985265905929253228,text,2025-11-03T08:40:51.000Z,selenium_x_scraper_v1,"ก็เหมือน ผู้ชาย กับ การพนันบอลแหละ
ผู้ชายแทบทุกคน พนันบอล
เวลาพูดแบบนี้ ผู้ชาย ก็โมโห","ก็เหมือน ผู้ชาย กับ การพนันบอลแหละ
ผู้ชายแทบทุกคน พนันบอล
เวลาพูดแบบนี้ ผู้ชาย ก็โมโห",2025-11-29 08:18:55,"['ก็', 'เหมือน', ' ', 'ผู้ชาย', ' ', 'กับ', ' ', 'การพนัน', 'บอล', 'แหละ', ' ', 'ผู้ชาย', 'แทบ', 'ทุกคน', ' ', 'พนัน', 'บอล', ' ', 'เวลา', 'พูด', 'แบบนี้', ' ', 'ผู้ชาย', ' ', 'ก็', 'โมโห']"
1984927964660981808,twitter,post,https://x.com/teetykunn/status/1984927964660981808,text,2025-11-02T10:17:59.000Z,selenium_x_scraper_v1,พาดหัวได้เหี้ยมาก ชายแท้มากเลยดิ,พาดหัวได้เหี้ยมาก ชายแท้มากเลยดิ,2025-11-29 08:18:55,"['พาดหัว', 'ได้', 'เหี้ย', 'มาก', ' ', 'ชาย', 'แท้', 'มาก', 'เลย', 'ดิ']"
1985231619205283899,twitter,post,https://x.com/YsakNa64341/status/1985231619205283899,text,2025-11-03T06:24:36.000Z,selenium_x_scraper_v1,ถือถุงยางถ่ายรูปสองมือออกสื่อเพื่อ........กูงงกับทั้งสื่อทั้งตำรวจ สื่ออะไร,ถือถุงยางถ่ายรูปสองมือออกสื่อเพื่อ........กูงงกับทั้งสื่อทั้งตำรวจ สื่ออะไร,2025-11-29 08:18:55,"['ถือ', 'ถุงยาง', 'ถ่ายรูป', 'สอง', 'มือ', 'ออก', 'สื่อ', 'เพื่อ', '...', 'กู', 'งง', 'กับ', 'ทั้ง', 'สื่อ', 'ทั้ง', 'ตำรวจ', ' ', 'สื่อ', 'อะไร']"
1985268579403784368,twitter,post,https://x.com/5ynQdxeUfGzqXPc/status/1985268579403784368,text,2025-11-03T08:51:28.000Z,selenium_x_scraper_v1,ฟ้องพวกมันคืนได้ป่ะ ข้อหาทำให้เสื่อมเสีย ไปเยดบนหัวเเม่พวกมึงหรอ ไอ ห,ฟ้องพวกมันคืนได้ป่ะ ข้อหาทำให้เสื่อมเสีย ไปเยดบนหัวเเม่พวกมึงหรอ ไอ ห,2025-11-29 08:18:55,"['ฟ้อง', 'พวก', 'มัน', 'คืน', 'ได้', 'ป่ะ', ' ', 'ข้อหา', 'ทำให้', 'เสื่อมเสีย', ' ', 'ไป', 'เย', 'ดบน', 'หัว', 'เเม่', 'พวก', 'มึง', 'หรอ', ' ', 'ไอ', ' ', 'ห']"
1985154668914503864,twitter,post,https://x.com/HeySenseix/status/1985154668914503864,text,2025-11-03T01:18:50.000Z,selenium_x_scraper_v1,เหยียดสุดๆ,เหยียดสุดๆ,2025-11-29 08:18:55,"['เหยียด', 'สุด', 'ๆ']"
1984981094400467435,twitter,post,https://x.com/jack1167399/status/1984981094400467435,text,2025-11-02T13:49:06.000Z,selenium_x_scraper_v1,อยากจะมั่วเย็ดก็มั่วไปแต่เอายาเสพติดมาเองก็สมควร,อยากจะมั่วเย็ดก็มั่วไปแต่เอายาเสพติดมาเองก็สมควร,2025-11-29 08:18:55,"['อยาก', 'จะ', 'มั่ว', 'เย็ด', 'ก็', 'มั่ว', 'ไป', 'แต่', 'เอา', 'ยาเสพติด', 'มา', 'เอง', 'ก็', 'สมควร']"
1985126137362817510,twitter,post,https://x.com/JayB86286Tha/status/1985126137362817510,text,2025-11-02T23:25:27.000Z,selenium_x_scraper_v1,ในคลิป ก็ตะคอก ใช้น้ำเสียงแบบรังเกรียจ,ในคลิป ก็ตะคอก ใช้น้ำเสียงแบบรังเกรียจ,2025-11-29 08:18:55,"['ใน', 'คลิป', ' ', 'ก็', 'ตะคอก', ' ', 'ใช้', 'น้ำเสียง', 'แบบ', 'รัง', 'เกรียจ']"
