id,platform,platform_type,url,content_type,timestamp,scraper_module,text,raw_text,scrape_date,tokens
1980252330491785428,twitter,post,https://x.com/thekingofotaku/status/1980252330491785428,text,2025-10-20T12:38:41.000Z,selenium_x_scraper_v1,"ไม่ยังไง 
ถ้าไม่ออกมาโวยวาย
ก็จบ
อยากใส่นั้นเป็นสิทธิของเจนิส
แต่จะเกิดอะไรขึ้นอย่าโวยวาย
มีอะไรที่ไม่ต้องแลก
อยากจะแต่งตัวโป๊โดยไม่คิดว่าจะมีอะไรแลกเปลี่ยนงั้นเหรอ เพ้อเจ้อ
การโดนคุกคามนั้นล่ะคือราคาที่ต้องจ่าย","ไม่ยังไง 
ถ้าไม่ออกมาโวยวาย
ก็จบ
อยากใส่นั้นเป็นสิทธิของเจนิส
แต่จะเกิดอะไรขึ้นอย่าโวยวาย
มีอะไรที่ไม่ต้องแลก
อยากจะแต่งตัวโป๊โดยไม่คิดว่าจะมีอะไรแลกเปลี่ยนงั้นเหรอ เพ้อเจ้อ
การโดนคุกคามนั้นล่ะคือราคาที่ต้องจ่าย",2025-11-29 08:18:55,"['ไม่', 'ยังไง', ' ', 'ถ้า', 'ไม่', 'ออกมา', 'โวยวาย', ' ', 'ก็', 'จบ', ' ', 'อยาก', 'ใส่', 'นั้น', 'เป็น', 'สิทธิ', 'ของ', 'เจ', 'นิ', 'ส', ' ', 'แต่', 'จะ', 'เกิด', 'อะไร', 'ขึ้น', 'อย่า', 'โวยวาย', ' ', 'มี', 'อะไร', 'ที่', 'ไม่ต้อง', 'แลก', ' ', 'อยาก', 'จะ', 'แต่งตัว', 'โป๊', 'โดย', 'ไม่', 'คิด', 'ว่า', 'จะ', 'มี', 'อะไร', 'แลกเปลี่ยน', 'งั้น', 'เหรอ', ' ', 'เพ้อเจ้อ', ' ', 'การ', 'โดน', 'คุกคาม', 'นั้น', 'ล่ะ', 'คือ', 'รา', 'คาที่', 'ต้อง', 'จ่าย']"
1980253467408245159,twitter,post,https://x.com/num_nim54/status/1980253467408245159,text,2025-10-20T12:43:12.000Z,selenium_x_scraper_v1,เต็มป่ะเขาจะใส่ไงก็เรื่องของเขาคนที่ไปคุกคามเขาคือคนไม่ปกติจ้ะ ละที่เขาออกมาปกป้องตัวเองนี้ผิดหรอ,เต็มป่ะเขาจะใส่ไงก็เรื่องของเขาคนที่ไปคุกคามเขาคือคนไม่ปกติจ้ะ ละที่เขาออกมาปกป้องตัวเองนี้ผิดหรอ,2025-11-29 08:18:55,"['เต็ม', 'ป่ะ', 'เขา', 'จะ', 'ใส่', 'ไง', 'ก็', 'เรื่อง', 'ของ', 'เขา', 'คน', 'ที่', 'ไป', 'คุกคาม', 'เขา', 'คือ', 'คน', 'ไม่', 'ปกติ', 'จ้ะ', ' ', 'ละ', 'ที่', 'เขา', 'ออกมา', 'ปกป้อง', 'ตัวเอง', 'นี้', 'ผิด', 'หรอ']"
1980254356252623291,twitter,post,https://x.com/thekingofotaku/status/1980254356252623291,text,2025-10-20T12:46:44.000Z,selenium_x_scraper_v1,คนปกติที่ไหนเขาแต่งตัวโป๊วะ,คนปกติที่ไหนเขาแต่งตัวโป๊วะ,2025-11-29 08:18:55,"['คน', 'ปกติ', 'ที่ไหน', 'เขา', 'แต่งตัว', 'โป๊', 'วะ']"
1980005659312857309,twitter,post,https://x.com/PhbKml/status/1980005659312857309,text,2025-10-19T20:18:30.000Z,selenium_x_scraper_v1,เขามั่นคงพอและเขามีความคิดและสติที่ดีพอ เขาโตแล้วไม่ต้องให้ใครมาอาย เขาโตพอที่จะคิดได้ค่ะ และอีกอย่างการแต่งตัวของเขาก็ไม่ได้ส่งผลกระทบให้ใครตายนะคะ เลิกเอาความคิดชายเป็นใหญ่  เลิกอีโก้ ถ้ายังติดอยู่ในวงจรความคิดแบบพวกผู้ชายหำหดหนังดูอนิเมะโป๊ก็กลับไปเอากางเกงในแม่มาใส่เถอะค่ะ,เขามั่นคงพอและเขามีความคิดและสติที่ดีพอ เขาโตแล้วไม่ต้องให้ใครมาอาย เขาโตพอที่จะคิดได้ค่ะ และอีกอย่างการแต่งตัวของเขาก็ไม่ได้ส่งผลกระทบให้ใครตายนะคะ เลิกเอาความคิดชายเป็นใหญ่  เลิกอีโก้ ถ้ายังติดอยู่ในวงจรความคิดแบบพวกผู้ชายหำหดหนังดูอนิเมะโป๊ก็กลับไปเอากางเกงในแม่มาใส่เถอะค่ะ,2025-11-29 08:18:55,"['เขา', 'มั่นคง', 'พอ', 'และ', 'เขา', 'มี', 'ความคิด', 'และ', 'สติ', 'ที่', 'ดี', 'พอ', ' ', 'เขา', 'โต', 'แล้ว', 'ไม่ต้อง', 'ให้', 'ใคร', 'มา', 'อาย', ' ', 'เขา', 'โต', 'พอที่จะ', 'คิดได้', 'ค่ะ', ' ', 'และ', 'อีก', 'อย่าง', 'การ', 'แต่งตัว', 'ของ', 'เขา', 'ก็', 'ไม่', 'ได้', 'ส่ง', 'ผลกระทบ', 'ให้', 'ใคร', 'ตาย', 'นะคะ', ' ', 'เลิก', 'เอา', 'ความคิด', 'ชาย', 'เป็นใหญ่', ' ', 'เลิก', 'อี', 'โก้', ' ', 'ถ้า', 'ยัง', 'ติด', 'อยู่', 'ใน', 'วงจร', 'ความคิด', 'แบบ', 'พวก', 'ผู้ชาย', 'หำ', 'หด', 'หนัง', 'ดู', 'อนิเมะ', 'โป๊', 'ก็', 'กลับ', 'ไป', 'เอา', 'กางเกงใน', 'แม่', 'มา', 'ใส่', 'เถอะ', 'ค่ะ']"
1980007198739837210,twitter,post,https://x.com/thekingofotaku/status/1980007198739837210,text,2025-10-19T20:24:37.000Z,selenium_x_scraper_v1,"แล้วลูกสาวบ้านอื่นล่ะ
พ่อแม่เขาก็หวงไม่อยากให้แต่งโป๊
พ่นไปเรื่อย","แล้วลูกสาวบ้านอื่นล่ะ
พ่อแม่เขาก็หวงไม่อยากให้แต่งโป๊
พ่นไปเรื่อย",2025-11-29 08:18:55,"['แล้ว', 'ลูกสาว', 'บ้าน', 'อื่น', 'ล่ะ', ' ', 'พ่อแม่', 'เขา', 'ก็', 'หวง', 'ไม่', 'อยาก', 'ให้', 'แต่ง', 'โป๊', ' ', 'พ่น', 'ไป', 'เรื่อย']"
1979871801175155150,twitter,post,https://x.com/_pppppppp_07/status/1979871801175155150,text,2025-10-19T11:26:36.000Z,selenium_x_scraper_v1,เลียนแบบดารามั้ยไม่รู้ที่รู้ๆถ้าคนนั้นเด็กผปคก็ต้องดูแลลูกหลานค่ะ การแต่งตัวคนเราไม่เหมือนกันอย่าตัดสิน พ่อแม่ทุกคนก็ไม่ได้เหมือนกันที่จะมาอายสมัยไหนละ ถามตัวเองเถอะเดือดร้อนอะไรงง ก็เขาไปงานกลางคืนจะให้ใส่ผ้าถุงไปหราาาางง55656,เลียนแบบดารามั้ยไม่รู้ที่รู้ๆถ้าคนนั้นเด็กผปคก็ต้องดูแลลูกหลานค่ะ การแต่งตัวคนเราไม่เหมือนกันอย่าตัดสิน พ่อแม่ทุกคนก็ไม่ได้เหมือนกันที่จะมาอายสมัยไหนละ ถามตัวเองเถอะเดือดร้อนอะไรงง ก็เขาไปงานกลางคืนจะให้ใส่ผ้าถุงไปหราาาางง55656,2025-11-29 08:18:55,"['เลียนแบบ', 'ดารา', 'มั้ย', 'ไม่', 'รู้', 'ที่', 'รู้', 'ๆ', 'ถ้า', 'คน', 'นั้น', 'เด็ก', 'ผปค', 'ก็', 'ต้อง', 'ดูแล', 'ลูกหลาน', 'ค่ะ', ' ', 'การ', 'แต่งตัว', 'คนเรา', 'ไม่', 'เหมือนกัน', 'อย่า', 'ตัดสิน', ' ', 'พ่อแม่', 'ทุกคน', 'ก็', 'ไม่', 'ได้', 'เหมือนกัน', 'ที่จะ', 'มา', 'อาย', 'สมัย', 'ไหน', 'ละ', ' ', 'ถาม', 'ตัวเอง', 'เถอะ', 'เดือดร้อน', 'อะไร', 'งง', ' ', 'ก็', 'เขา', 'ไป', 'งาน', 'กลางคืน', 'จะ', 'ให้', 'ใส่', 'ผ้าถุง', 'ไป', 'หรา', 'าาางง', 'หัวเราะ']"
1979872494757797963,twitter,post,https://x.com/thekingofotaku/status/1979872494757797963,text,2025-10-19T11:29:21.000Z,selenium_x_scraper_v1,"อ้างยุคสมัยอีกล่ะ
ก็ไม่ใช่ว่า 
ที่ทุกวันนี้เป็นยังงี้
ก็เพราะคนอ้างยุคสมันจนกู่ไม่กลับกันไม่ใช่เหรอ","อ้างยุคสมัยอีกล่ะ
ก็ไม่ใช่ว่า 
ที่ทุกวันนี้เป็นยังงี้
ก็เพราะคนอ้างยุคสมันจนกู่ไม่กลับกันไม่ใช่เหรอ",2025-11-29 08:18:55,"['อ้าง', 'ยุคสมัย', 'อีก', 'ล่ะ', ' ', 'ก็', 'ไม่', 'ใช่', 'ว่า', ' ', 'ที่', 'ทุกวันนี้', 'เป็น', 'ยังงี้', ' ', 'ก็', 'เพราะ', 'คน', 'อ้าง', 'ยุค', 'สมัน', 'จน', 'กู่ไม่กลับ', 'กัน', 'ไม่', 'ใช่', 'เหรอ']"
1980165982942548464,twitter,post,https://x.com/kongchaowat2543/status/1980165982942548464,text,2025-10-20T06:55:34.000Z,selenium_x_scraper_v1,อี๋~~~ โอตะคุเหม็นเปรี้ยว น่าเกลียด ว๊ายยยยยย แอคนี้ก็น่าจะไม่ชอบอาบน้ำกลิ่นตัวเหม็นเปรี้ยวนี่แหละ  ,อี๋~~~ โอตะคุเหม็นเปรี้ยว น่าเกลียด ว๊ายยยยยย แอคนี้ก็น่าจะไม่ชอบอาบน้ำกลิ่นตัวเหม็นเปรี้ยวนี่แหละ  ,2025-11-29 08:18:55,"['อี๋', ' ', 'โอ', 'ตะ', 'คุ', 'เหม็นเปรี้ยว', ' ', 'น่าเกลียด', ' ', 'ว๊ายยยยยย', ' ', 'แอ', 'ค', 'นี้', 'ก็', 'น่าจะ', 'ไม่', 'ชอบ', 'อาบน้ำ', 'กลิ่นตัว', 'เหม็นเปรี้ยว', 'นี่แหละ']"
1980261851025084744,twitter,post,https://x.com/thekingofotaku/status/1980261851025084744,text,2025-10-20T13:16:31.000Z,selenium_x_scraper_v1,"ก็กูบอกแล้วพ่อแม่เจนิสไม่อาย

แต่พ่อแม่คนอื่นเขาอายที่จะมีลูกสาวแต่งตัวโป๊ตามเจนิสในที่สาธารณะ

ลุกสาวใครใครก็รักป่ะวะ
ใครอยากเห็นลูกสาวตัวเองโป๊ในที่สาธารณะกันทุกบ้านทุกครอบครัว
บางบ้านเขาไม่อยากเห็นก็มี
เข้าใจไรยากวะ
จะบิดสารกูเพื่อ?


ปล.นี่กูต้องพิมซ้ำกี่รอบวะ","ก็กูบอกแล้วพ่อแม่เจนิสไม่อาย

แต่พ่อแม่คนอื่นเขาอายที่จะมีลูกสาวแต่งตัวโป๊ตามเจนิสในที่สาธารณะ

ลุกสาวใครใครก็รักป่ะวะ
ใครอยากเห็นลูกสาวตัวเองโป๊ในที่สาธารณะกันทุกบ้านทุกครอบครัว
บางบ้านเขาไม่อยากเห็นก็มี
เข้าใจไรยากวะ
จะบิดสารกูเพื่อ?


ปล.นี่กูต้องพิมซ้ำกี่รอบวะ",2025-11-29 08:18:55,"['ก็', 'กู', 'บอก', 'แล้ว', 'พ่อแม่', 'เจ', 'นิ', 'ส', 'ไม่', 'อาย', ' ', 'แต่', 'พ่อแม่', 'คนอื่น', 'เขา', 'อาย', 'ที่จะ', 'มี', 'ลูกสาว', 'แต่งตัว', 'โป๊', 'ตาม', 'เจ', 'นิ', 'ส', 'ใน', 'ที่สาธารณะ', ' ', 'ลุก', 'สาว', 'ใคร', 'ใคร', 'ก็', 'รัก', 'ป่ะ', 'วะ', ' ', 'ใคร', 'อยาก', 'เห็น', 'ลูกสาว', 'ตัวเอง', 'โป๊', 'ใน', 'ที่สาธารณะ', 'กัน', 'ทุก', 'บ้าน', 'ทุก', 'ครอบครัว', ' ', 'บาง', 'บ้าน', 'เขา', 'ไม่', 'อยาก', 'เห็น', 'ก็', 'มี', ' ', 'เข้าใจ', 'ไร', 'ยาก', 'วะ', ' ', 'จะ', 'บิด', 'สาร', 'กู', 'เพื่อ', '?', ' ', 'ปล.', 'นี่', 'กู', 'ต้อง', 'พิม', 'ซ้ำ', 'กี่', 'รอบ', 'วะ']"
1980171908785275276,twitter,post,https://x.com/sosadsad55/status/1980171908785275276,text,2025-10-20T07:19:07.000Z,selenium_x_scraper_v1,มันไม่ใช่อายไม่อาย แต่ประเด็นคือไปสาระแนกับการแต่งตัวของชาวบ้านเขาทำไม,มันไม่ใช่อายไม่อาย แต่ประเด็นคือไปสาระแนกับการแต่งตัวของชาวบ้านเขาทำไม,2025-11-29 08:18:55,"['มัน', 'ไม่', 'ใช่', 'อาย', 'ไม่', 'อาย', ' ', 'แต่', 'ประเด็น', 'คือ', 'ไป', 'สาระแน', 'กับ', 'การ', 'แต่งตัว', 'ของ', 'ชาวบ้าน', 'เขา', 'ทำไม']"
1980172722249556215,twitter,post,https://x.com/thekingofotaku/status/1980172722249556215,text,2025-10-20T07:22:21.000Z,selenium_x_scraper_v1,"แล้วแต่งตัวโป๊ในที่สาธารณะทำไหม
ทุกคนก็มีสิทธิ์มองและวิจารณ์คนแต่งตัวโป๊ป่ะวะ","แล้วแต่งตัวโป๊ในที่สาธารณะทำไหม
ทุกคนก็มีสิทธิ์มองและวิจารณ์คนแต่งตัวโป๊ป่ะวะ",2025-11-29 08:18:55,"['แล้ว', 'แต่งตัว', 'โป๊', 'ใน', 'ที่สาธารณะ', 'ทำ', 'ไหม', ' ', 'ทุกคน', 'ก็', 'มีสิทธิ์', 'มอง', 'และ', 'วิจารณ์', 'คน', 'แต่งตัว', 'โป๊', 'ป่ะ', 'วะ']"
1980421868101493235,twitter,post,https://x.com/notthing_bout2u/status/1980421868101493235,text,2025-10-20T23:52:22.000Z,selenium_x_scraper_v1,อ่านแล้วรุ้สึกว่า ลูกสาวบ้านไหนก็เลี้ยงกันเองดิ จะต้องให้คนอื่นเป็นแบบอย่างตลอดเลยหรอคนในครอบครัวไร้ความสามารถในการสั่งสอนหรือพูดคุยขนาดนั้นเลยหรอ วิจารณญาณเป็นสิ่งที่ครอบครัวไม่สามารถให้แก่เด็กสาวในบ้านเลยสินะ,อ่านแล้วรุ้สึกว่า ลูกสาวบ้านไหนก็เลี้ยงกันเองดิ จะต้องให้คนอื่นเป็นแบบอย่างตลอดเลยหรอคนในครอบครัวไร้ความสามารถในการสั่งสอนหรือพูดคุยขนาดนั้นเลยหรอ วิจารณญาณเป็นสิ่งที่ครอบครัวไม่สามารถให้แก่เด็กสาวในบ้านเลยสินะ,2025-11-29 08:18:55,"['อ่าน', 'แล้ว', 'รุ้', 'สึก', 'ว่า', ' ', 'ลูกสาว', 'บ้าน', 'ไหน', 'ก็', 'เลี้ยง', 'กันเอง', 'ดิ', ' ', 'จะ', 'ต้อง', 'ให้', 'คนอื่น', 'เป็น', 'แบบอย่าง', 'ตลอด', 'เลย', 'หรอ', 'คนใน', 'ครอบครัว', 'ไร้ความสามารถ', 'ใน', 'การ', 'สั่งสอน', 'หรือ', 'พูดคุย', 'ขนาด', 'นั้น', 'เลย', 'หรอ', ' ', 'วิจารณญาณ', 'เป็น', 'สิ่ง', 'ที่', 'ครอบครัว', 'ไม่', 'สามารถ', 'ให้', 'แก่', 'เด็กสาว', 'ใน', 'บ้าน', 'เลย', 'สิ', 'นะ']"
1980499160798490920,twitter,post,https://x.com/thekingofotaku/status/1980499160798490920,text,2025-10-21T04:59:30.000Z,selenium_x_scraper_v1,"ช่าย
คนที่อบรมสั่งสอนดีๆก็มี
","ช่าย
คนที่อบรมสั่งสอนดีๆก็มี
",2025-11-29 08:18:55,"['ช่าย', ' ', 'คน', 'ที่', 'อบรมสั่งสอน', 'ดี', 'ๆ', 'ก็', 'มี']"
1980158738066731176,twitter,post,https://x.com/Chuwiduwha/status/1980158738066731176,text,2025-10-20T06:26:47.000Z,selenium_x_scraper_v1,คั้บ  x.com/thekingofotaku…,คั้บ  x.com/thekingofotaku…,2025-11-29 08:18:55,"['คั้บ', ' ', 'x', '.com', ' ', 'thekingofotaku']"
1980159189017378999,twitter,post,https://x.com/thekingofotaku/status/1980159189017378999,text,2025-10-20T06:28:34.000Z,selenium_x_scraper_v1,"เออ แล้วไง มิวสิคมันถ่ายบิกินี่ลง photobook นู่น
คงไม่ใส่บิกินี่ไปนั่งวินมอไซค์หรอก","เออ แล้วไง มิวสิคมันถ่ายบิกินี่ลง photobook นู่น
คงไม่ใส่บิกินี่ไปนั่งวินมอไซค์หรอก",2025-11-29 08:18:55,"['เออ', ' ', 'แล้ว', 'ไง', ' ', 'มิวสิค', 'มัน', 'ถ่าย', 'บิกินี่', 'ลง', ' ', 'photobook', ' ', 'นู่น', ' ', 'คง', 'ไม่', 'ใส่', 'บิกินี่', 'ไป', 'นั่ง', 'วิน', 'มอไซค์', 'หรอก']"
1980290749708296311,twitter,post,https://x.com/Chuwiduwha/status/1980290749708296311,text,2025-10-20T15:11:21.000Z,selenium_x_scraper_v1,พี่ว่ามิวสิคทำไม ;-; https://x.com/thekingofotaku/status/1980254356252623291?s=46&t=piEqNWkB8C4m5eHrGe9xeA…,พี่ว่ามิวสิคทำไม ;-; https://x.com/thekingofotaku/status/1980254356252623291?s=46&t=piEqNWkB8C4m5eHrGe9xeA…,2025-11-29 08:18:55,"['พี่', 'ว่า', 'มิวสิค', 'ทำไม']"
1980291582634102811,twitter,post,https://x.com/Chuwiduwha/status/1980291582634102811,text,2025-10-20T15:14:39.000Z,selenium_x_scraper_v1,"ไม่สิ ต้องเป็น ‘พี่ส่งเสริมให้มิวสิคเป็นคนไม่ปกติทำไม ;-;’ ไปว่าคนอื่นแต่ตัวเองก็ปากว่าตาขยิบอยากเสพรูปบิกินี่เมนตัวเองเหมือนกัน 

ไม่คิดดิว่าแม่มิวสิคมาเห็นเขาจะว่าลูกสาวไหม? พ่อแม่มิวสิคจะอายแทรกแผ่นดินไหม??","ไม่สิ ต้องเป็น ‘พี่ส่งเสริมให้มิวสิคเป็นคนไม่ปกติทำไม ;-;’ ไปว่าคนอื่นแต่ตัวเองก็ปากว่าตาขยิบอยากเสพรูปบิกินี่เมนตัวเองเหมือนกัน 

ไม่คิดดิว่าแม่มิวสิคมาเห็นเขาจะว่าลูกสาวไหม? พ่อแม่มิวสิคจะอายแทรกแผ่นดินไหม??",2025-11-29 08:18:55,"['ไม่', 'สิ', ' ', 'ต้อง', 'เป็น', ' ', 'พี่', 'ส่งเสริม', 'ให้', 'มิวสิค', 'เป็น', 'คน', 'ไม่', 'ปกติ', 'ทำไม', ' ', 'ไป', 'ว่า', 'คนอื่น', 'แต่', 'ตัวเอง', 'ก็', 'ปากว่าตาขยิบ', 'อยาก', 'เสพ', 'รูป', 'บิกินี่', 'เมน', 'ตัวเอง', 'เหมือนกัน', ' ', 'ไม่', 'คิด', 'ดิ', 'ว่า', 'แม่', 'มิวสิค', 'มา', 'เห็น', 'เขา', 'จะ', 'ว่า', 'ลูกสาว', 'ไหม', '?', ' ', 'พ่อแม่', 'มิวสิค', 'จะ', 'อาย', 'แทรกแผ่นดิน', 'ไหม', '?']"
1980292821178515733,twitter,post,https://x.com/thekingofotaku/status/1980292821178515733,text,2025-10-20T15:19:35.000Z,selenium_x_scraper_v1,"กูยุยงให้มิวสิคไปแต่งโป๊ในที่สาธารณะ
เหรอ ไม่น่ะ?ไม่น่าใช่
อย่ามาใส่ความกัน","กูยุยงให้มิวสิคไปแต่งโป๊ในที่สาธารณะ
เหรอ ไม่น่ะ?ไม่น่าใช่
อย่ามาใส่ความกัน",2025-11-29 08:18:55,"['กู', 'ยุยง', 'ให้', 'มิวสิค', 'ไป', 'แต่ง', 'โป๊', 'ใน', 'ที่สาธารณะ', ' ', 'เหรอ', ' ', 'ไม่', 'น่ะ', '?', 'ไม่', 'น่า', 'ใช่', ' ', 'อย่า', 'มา', 'ใส่ความ', 'กัน']"
