id,platform,platform_type,url,content_type,timestamp,scraper_module,text,raw_text,scrape_date,tokens
1980347990612275306,twitter,post,https://x.com/hansofia18/status/1980347990612275306,text,2025-10-20T18:58:48.000Z,selenium_x_scraper_v1,คิดว่าด่าแล้วกูจะเฟลก็ฝันไปเหอะ ยิ่งด่ากูยิ่งมั่น มึงเป็นบ้าหรอ กูทักว่าเค้าแต่งโป๊เฉยๆ พวกมึงอะว่ากูนมเล็กเอย แฟชั่นกูประหลาดเอย กุเป็นตำรวจร้านเตี๋ยวเอย กุไม่รีดผ้ามั่งแหละ อย่าฮาเกินได้ป่ะ 5555,คิดว่าด่าแล้วกูจะเฟลก็ฝันไปเหอะ ยิ่งด่ากูยิ่งมั่น มึงเป็นบ้าหรอ กูทักว่าเค้าแต่งโป๊เฉยๆ พวกมึงอะว่ากูนมเล็กเอย แฟชั่นกูประหลาดเอย กุเป็นตำรวจร้านเตี๋ยวเอย กุไม่รีดผ้ามั่งแหละ อย่าฮาเกินได้ป่ะ 5555,2025-10-23 17:59:34,"['คิด', 'ว่า', 'ด่า', 'แล้ว', 'กู', 'จะ', 'เฟล', 'ก็', 'ฝัน', 'ไป', 'เหอะ', ' ', 'ยิ่ง', 'ด่า', 'กู', 'ยิ่ง', 'มั่น', ' ', 'มึง', 'เป็นบ้า', 'หรอ', ' ', 'กู', 'ทัก', 'ว่า', 'เค้า', 'แต่ง', 'โป๊', 'เฉย', 'ๆ', ' ', 'พวก', 'มึง', 'อะ', 'ว่า', 'กู', 'นม', 'เล็ก', 'เอย', ' ', 'แฟชั่น', 'กู', 'ประหลาด', 'เอย', ' ', 'กุ', 'เป็น', 'ตำรวจ', 'ร้าน', 'เตี๋ยว', 'เอย', ' ', 'กุ', 'ไม่', 'รีดผ้า', 'มั่ง', 'แหละ', ' ', 'อย่า', 'หัวเราะ', 'เกิน', 'ได้', 'ป่ะ', ' ', 'หัวเราะ']"
1980508304964219262,twitter,post,https://x.com/BryanMuscleMon/status/1980508304964219262,text,2025-10-21T05:35:50.000Z,selenium_x_scraper_v1,สภาพประชากรทัวร์รอบนี้,สภาพประชากรทัวร์รอบนี้,2025-10-23 17:59:34,"['สภาพ', 'ประชากร', 'ทัวร์', 'รอบ', 'นี้']"
1980509908509626440,twitter,post,https://x.com/Tim8666/status/1980509908509626440,text,2025-10-21T05:42:12.000Z,selenium_x_scraper_v1,55555 หายใจไม่ออกเลยคับ แงง,55555 หายใจไม่ออกเลยคับ แงง,2025-10-23 17:59:34,"['หัวเราะ', ' ', 'หายใจไม่ออก', 'เลย', 'คับ', ' ', 'แง', 'ง']"
1980379687940751750,twitter,post,https://x.com/hansofia18/status/1980379687940751750,text,2025-10-20T21:04:45.000Z,selenium_x_scraper_v1,เอาแต่พูดว่าใส่อะไรก็โป๊ๆๆๆๆ แต่พอกูบอกว่าเออก็โป๊จริง ตุ้มกูโดนแขวนเลย,เอาแต่พูดว่าใส่อะไรก็โป๊ๆๆๆๆ แต่พอกูบอกว่าเออก็โป๊จริง ตุ้มกูโดนแขวนเลย,2025-10-23 17:59:34,"['เอาแต่', 'พูดว่า', 'ใส่', 'อะไร', 'ก็', 'โป๊', 'ๆๆๆๆ', ' ', 'แต่', 'พอ', 'กู', 'บอ', 'กว่า', 'เออ', 'ก็', 'โป๊', 'จริง', ' ', 'ตุ้ม', 'กู', 'โดน', 'แขวน', 'เลย']"
1980399281086599646,twitter,post,https://x.com/babebluerubybae/status/1980399281086599646,text,2025-10-20T22:22:37.000Z,selenium_x_scraper_v1,ก็เพราะใส่อะไรมันก็ดูโป๊ไง เลยไม่อยากให้คนมาชี้หน้าด่ามาวิจารณ์ว่าโป๊ ทั้งๆที่ใส่ปกติเหมือนคนอื่น อยากให้คนอื่นเข้าใจตัวเอง ตัวเองเข้าใจเห็นใจคนอื่นยัง,ก็เพราะใส่อะไรมันก็ดูโป๊ไง เลยไม่อยากให้คนมาชี้หน้าด่ามาวิจารณ์ว่าโป๊ ทั้งๆที่ใส่ปกติเหมือนคนอื่น อยากให้คนอื่นเข้าใจตัวเอง ตัวเองเข้าใจเห็นใจคนอื่นยัง,2025-10-23 17:59:34,"['ก็', 'เพราะ', 'ใส่', 'อะไร', 'มัน', 'ก็', 'ดู', 'โป๊', 'ไง', ' ', 'เลย', 'ไม่', 'อยาก', 'ให้', 'คน', 'มา', 'ชี้หน้า', 'ด่า', 'มา', 'วิจารณ์', 'ว่า', 'โป๊', ' ', 'ทั้งๆ', 'ที่', 'ใส่', 'ปกติ', 'เหมือน', 'คนอื่น', ' ', 'อยาก', 'ให้', 'คนอื่น', 'เข้าใจ', 'ตัวเอง', ' ', 'ตัวเอง', 'เข้าใจ', 'เห็นใจ', 'คนอื่น', 'ยัง']"
1980509813802180779,twitter,post,https://x.com/Tim8666/status/1980509813802180779,text,2025-10-21T05:41:50.000Z,selenium_x_scraper_v1,Top fan เม้นทุกโพสเลย,Top fan เม้นทุกโพสเลย,2025-10-23 17:59:34,"['top', ' ', 'fan', ' ', 'เม้น', 'ทุก', 'โพส', 'เลย']"
1980471737759461851,twitter,post,https://x.com/CbnDBgCEpK56771/status/1980471737759461851,text,2025-10-21T03:10:32.000Z,selenium_x_scraper_v1,กูงงสังคมผญ.ในทวิต ว่ะแชท กดผญ.สเตรทมาก,กูงงสังคมผญ.ในทวิต ว่ะแชท กดผญ.สเตรทมาก,2025-10-23 17:59:34,"['กู', 'งง', 'สังคม', 'ผญ.', 'ใน', 'ทวิ', 'ต', ' ', 'ว่ะ', 'แชท', ' ', 'กด', 'ผญ.', 'ส', 'เต', 'รท', 'มาก']"
1979867017273593993,twitter,post,https://x.com/hansofia18/status/1979867017273593993,text,2025-10-19T11:07:35.000Z,selenium_x_scraper_v1,ชั้นขออยู่ข้างพี่เกย์นะคะ ขออภัยค่ะแต่นี่ว่าโป๊จริง ไม่ค่อยมีใครแต่งตัวประมาณนี้ไปกินเต๋วอะค่ะเลยแปลกตานิดนึง ถ้าชุดนี้อยู่ริมทะเลเราก็จะว่าปกติค่ะ,ชั้นขออยู่ข้างพี่เกย์นะคะ ขออภัยค่ะแต่นี่ว่าโป๊จริง ไม่ค่อยมีใครแต่งตัวประมาณนี้ไปกินเต๋วอะค่ะเลยแปลกตานิดนึง ถ้าชุดนี้อยู่ริมทะเลเราก็จะว่าปกติค่ะ,2025-10-23 17:59:34,"['ชั้น', 'ขอ', 'อยู่', 'ข้าง', 'พี่', 'เกย์', 'นะคะ', ' ', 'ขออภัย', 'ค่ะ', 'แต่', 'นี่', 'ว่า', 'โป๊', 'จริง', ' ', 'ไม่ค่อย', 'มี', 'ใคร', 'แต่งตัว', 'ประมาณ', 'นี้', 'ไป', 'กิน', 'เต๋ว', 'อะ', 'ค่ะ', 'เลย', 'แปลกตา', 'นิดนึง', ' ', 'ถ้า', 'ชุด', 'นี้', 'อยู่', 'ริมทะเล', 'เรา', 'ก็', 'จะ', 'ว่า', 'ปกติ', 'ค่ะ']"
1980264781778215364,twitter,post,https://x.com/wendyxworks/status/1980264781778215364,text,2025-10-20T13:28:10.000Z,selenium_x_scraper_v1,งง จขทว.แค่บอกว่าชุดโป๊(opinion) แปลกตา ไม่ได้บอกว่าใส่ไม่ได้มั้ยอะ ในค.คิดเขามันโป๊(อาจจะเพราะแหวกถึงกลาง)แค่นั้น size doesn't matter  ละคนมาโควทเพราะนมเล็กเลยไม่โป๊ะอะไรกันง่ะ its too reveal for her=โป๊ แค่นี้เอง คือไม่ได้ด่าอะไรเลย เดือดกันปุดๆ อะไร ไม่เก้ท,งง จขทว.แค่บอกว่าชุดโป๊(opinion) แปลกตา ไม่ได้บอกว่าใส่ไม่ได้มั้ยอะ ในค.คิดเขามันโป๊(อาจจะเพราะแหวกถึงกลาง)แค่นั้น size doesn't matter  ละคนมาโควทเพราะนมเล็กเลยไม่โป๊ะอะไรกันง่ะ its too reveal for her=โป๊ แค่นี้เอง คือไม่ได้ด่าอะไรเลย เดือดกันปุดๆ อะไร ไม่เก้ท,2025-10-23 17:59:34,"['งง', ' ', 'จขทว', '.', 'แค่', 'บอ', 'กว่า', 'ชุด', 'โป๊', ' ', 'opinion', ' ', 'แปลกตา', ' ', 'ไม่', 'ได้', 'บอ', 'กว่า', 'ใส่', 'ไม่', 'ได้', 'มั้ย', 'อะ', ' ', 'ใน', 'ค', '.', 'คิด', 'เขา', 'มัน', 'โป๊', ' ', 'อาจจะ', 'เพราะ', 'แหวก', 'ถึง', 'กลาง', ' ', 'แค่นั้น', ' ', 'size', ' ', 'doesn', ""'t"", ' ', 'matter', ' ', 'ละ', 'คน', 'มา', 'โค', 'วท', 'เพราะ', 'นม', 'เล็ก', 'เลย', 'ไม่', 'โป๊ะ', 'อะไร', 'กัน', 'ง่ะ', ' ', 'its', ' ', 'too', ' ', 'reveal', ' ', 'for', ' ', 'her', ' ', 'โป๊', ' ', 'แค่นี้', 'เอง', ' ', 'คือ', 'ไม่', 'ได้', 'ด่า', 'อะไร', 'เลย', ' ', 'เดือด', 'กัน', 'ปุด', 'ๆ', ' ', 'อะไร', ' ', 'ไม่', 'เก้', 'ท']"
1980485847100379525,twitter,post,https://x.com/Tim8666/status/1980485847100379525,text,2025-10-21T04:06:36.000Z,selenium_x_scraper_v1,ระวังทัวลงนะค้าบ คนในทวิตยิ่งโง่อยุ่,ระวังทัวลงนะค้าบ คนในทวิตยิ่งโง่อยุ่,2025-10-23 17:59:34,"['ระวัง', 'ทัวลง', 'นะ', 'ค้าบ', ' ', 'คนใน', 'ทวิ', 'ต', 'ยิ่ง', 'โง่', 'อยุ่']"
1979839074585502147,twitter,post,https://x.com/renajanh/status/1979839074585502147,text,2025-10-19T09:16:33.000Z,selenium_x_scraper_v1,ไม่ว่าเพศไหน เกย์ ตุ๊ด กะเทย ชายแท้ เลส ทอม ดี้ เตือนดีเขาไม่ว่าจ้า แต่ดูพวกมึงเตือนสิคะอีดอกจิก เตือนในแง่ไหน จะใส่เสื้อผ้าควยไรก็เรื่องของเขาค่ะอิสะเหล่อ มึงดูเรื่องที่มึงเตือนด้วยจ้ามันใช่เรื่องไหมอีโง่,ไม่ว่าเพศไหน เกย์ ตุ๊ด กะเทย ชายแท้ เลส ทอม ดี้ เตือนดีเขาไม่ว่าจ้า แต่ดูพวกมึงเตือนสิคะอีดอกจิก เตือนในแง่ไหน จะใส่เสื้อผ้าควยไรก็เรื่องของเขาค่ะอิสะเหล่อ มึงดูเรื่องที่มึงเตือนด้วยจ้ามันใช่เรื่องไหมอีโง่,2025-10-23 17:59:34,"['ไม่', 'ว่า', 'เพศ', 'ไหน', ' ', 'เกย์', ' ', 'ตุ๊ด', ' ', 'กะเทย', ' ', 'ชาย', 'แท้', ' ', 'เลส', ' ', 'ทอม', ' ', 'ดี้', ' ', 'เตือน', 'ดี', 'เขา', 'ไม่', 'ว่า', 'จ้า', ' ', 'แต่', 'ดู', 'พวก', 'มึง', 'เตือน', 'สิ', 'คะ', 'อี', 'ดอกจิก', ' ', 'เตือน', 'ในแง่', 'ไหน', ' ', 'จะ', 'ใส่', 'เสื้อผ้า', 'ควย', 'ไร', 'ก็', 'เรื่อง', 'ของ', 'เขา', 'ค่ะ', 'อิ', 'สะเหล่อ', ' ', 'มึง', 'ดู', 'เรื่อง', 'ที่', 'มึง', 'เตือน', 'ด้วย', 'จ้า', 'มัน', 'ใช่', 'เรื่อง', 'ไหม', 'อี', 'โง่']"
1979840687450505613,twitter,post,https://x.com/renajanh/status/1979840687450505613,text,2025-10-19T09:22:58.000Z,selenium_x_scraper_v1,พวกที่มันสะเหล่อกับการแต่งตัวนี่มันมีเยอะ กูรำคาญจนอยากแช่งมันตายห่า ตัวกูความคิดใคร มึงอยากจะใส่อะไรก็เรื่องของมึงเลยจ้า แต่อย่าเอาความคิดโง่ ๆ มายัดใส่สมองคนอื่นค่ะ มึงจะใส่เสื้อมิดชิดแสดงถึงความเรียบร้อยนั่นก็เรื่องของมึง จะใส่กางเกงในสีอะไรลายอะไรก็เรื่องของมึงอีดอกจิก,พวกที่มันสะเหล่อกับการแต่งตัวนี่มันมีเยอะ กูรำคาญจนอยากแช่งมันตายห่า ตัวกูความคิดใคร มึงอยากจะใส่อะไรก็เรื่องของมึงเลยจ้า แต่อย่าเอาความคิดโง่ ๆ มายัดใส่สมองคนอื่นค่ะ มึงจะใส่เสื้อมิดชิดแสดงถึงความเรียบร้อยนั่นก็เรื่องของมึง จะใส่กางเกงในสีอะไรลายอะไรก็เรื่องของมึงอีดอกจิก,2025-10-23 17:59:34,"['พวก', 'ที่', 'มัน', 'สะเหล่อ', 'กับ', 'การ', 'แต่งตัว', 'นี่', 'มัน', 'มี', 'เยอะ', ' ', 'กู', 'รำคาญ', 'จน', 'อยาก', 'แช่ง', 'มัน', 'ตายห่า', ' ', 'ตัว', 'กู', 'ความคิด', 'ใคร', ' ', 'มึง', 'อยาก', 'จะ', 'ใส่', 'อะไร', 'ก็', 'เรื่อง', 'ของ', 'มึง', 'เลย', 'จ้า', ' ', 'แต่', 'อย่า', 'เอา', 'ความคิด', 'โง่', ' ', 'ๆ', ' ', 'มา', 'ยัด', 'ใส่', 'สมอง', 'คนอื่น', 'ค่ะ', ' ', 'มึง', 'จะ', 'ใส่', 'เสื้อ', 'มิดชิด', 'แสดงถึง', 'ความ', 'เรียบร้อย', 'นั่น', 'ก็', 'เรื่อง', 'ของ', 'มึง', ' ', 'จะ', 'ใส่', 'กางเกงใน', 'สี', 'อะไร', 'ลาย', 'อะไร', 'ก็', 'เรื่อง', 'ของ', 'มึง', 'อี', 'ดอกจิก']"
1980462719905198303,twitter,post,https://x.com/Tim8666/status/1980462719905198303,text,2025-10-21T02:34:42.000Z,selenium_x_scraper_v1,ทอมมอม,ทอมมอม,2025-10-23 17:59:34,"['ทอม', 'มอม']"
1980092873690550369,twitter,post,https://x.com/hansofia18/status/1980092873690550369,text,2025-10-20T02:05:04.000Z,selenium_x_scraper_v1,ต่างตรงที่ชั้นกินข้าวที่ร้านริมทะเลอะดิ,ต่างตรงที่ชั้นกินข้าวที่ร้านริมทะเลอะดิ,2025-10-23 17:59:34,"['ต่าง', 'ตรง', 'ที่', 'ชั้น', 'กินข้าว', 'ที่', 'ร้าน', 'ริมทะเล', 'อะดิ']"
1979654005891461358,twitter,post,https://x.com/hoodwild_/status/1979654005891461358,text,2025-10-18T21:01:09.000Z,selenium_x_scraper_v1,"I thought it’s a joke when he took that stance, boy didn't disappoint his master","I thought it’s a joke when he took that stance, boy didn't disappoint his master",2025-10-23 17:59:34,"['i', ' ', 'thought', ' ', 'it', ' ', 's', ' ', 'a', ' ', 'joke', ' ', 'when', ' ', 'he', ' ', 'took', ' ', 'that', ' ', 'stance', ',', ' ', 'boy', ' ', 'didn', ""'t"", ' ', 'disappoint', ' ', 'his', ' ', 'master']"
1980167239749054555,twitter,post,https://x.com/Tim8666/status/1980167239749054555,text,2025-10-20T07:00:34.000Z,selenium_x_scraper_v1,Lesbian,Lesbian,2025-10-23 17:59:34,['lesbian']
1980016701602189414,twitter,post,https://x.com/dexxybaba/status/1980016701602189414,text,2025-10-19T21:02:23.000Z,selenium_x_scraper_v1,"What does he mean by 'he's 14'? 

Since when did being 14 excuse verbally abusing people? Or in other cases even assault or stealing from B&M? 

Moreso, the video isn't complete... When don't even have evidence of what happened before the altercation...

Hmmm","What does he mean by 'he's 14'? 

Since when did being 14 excuse verbally abusing people? Or in other cases even assault or stealing from B&M? 

Moreso, the video isn't complete... When don't even have evidence of what happened before the altercation...

Hmmm",2025-10-23 17:59:34,"['what', ' ', 'does', ' ', 'he', ' ', 'mean', ' ', 'by', ' ', ""'he's"", ' ', '14', ""'?"", ' ', 'since', ' ', 'when', ' ', 'did', ' ', 'being', ' ', '14', ' ', 'excuse', ' ', 'verbally', ' ', 'abusing', ' ', 'people', '?', ' ', 'or', ' ', 'in', ' ', 'other', ' ', 'cases', ' ', 'even', ' ', 'assault', ' ', 'or', ' ', 'stealing', ' ', 'from', ' ', 'b', ' ', 'm', '?', ' ', 'moreso', ',', ' ', 'the', ' ', 'video', ' ', 'isn', ""'t"", ' ', 'complete', '...', ' ', 'when', ' ', 'don', ""'t"", ' ', 'even', ' ', 'have', ' ', 'evidence', ' ', 'of', ' ', 'what', ' ', 'happened', ' ', 'before', ' ', 'the', ' ', 'altercation', '...', ' ', 'hmmm']"
1979905629973094780,twitter,post,https://x.com/Janet_sm145/status/1979905629973094780,text,2025-10-19T13:41:01.000Z,selenium_x_scraper_v1,This had me like ,This had me like ,2025-10-23 17:59:34,"['this', ' ', 'had', ' ', 'me', ' ', 'like']"
1979766608156602516,twitter,post,https://x.com/wonblnk/status/1979766608156602516,text,2025-10-19T04:28:36.000Z,selenium_x_scraper_v1,Prank privacy car level 99999999 ,Prank privacy car level 99999999 ,2025-10-23 17:59:34,"['prank', ' ', 'privacy', ' ', 'car', ' ', 'level', ' ', 'หัวเราะ']"
1964715062725411116,twitter,post,https://x.com/chaleenajaja/status/1964715062725411116,text,2025-09-07T15:39:08.000Z,selenium_x_scraper_v1,พิส้มหล่อเลยอ่ะ,พิส้มหล่อเลยอ่ะ,2025-10-23 17:59:34,"['พิ', 'ส้ม', 'หล่อ', 'เลย', 'อ่ะ']"
1979819693616877886,twitter,post,https://x.com/stancadite_/status/1979819693616877886,text,2025-10-19T07:59:32.000Z,selenium_x_scraper_v1,"You can't be a muslim and a feminist. Religion(s) goes against the core values of feminism. Nope, you cannot justify it in anyway.","You can't be a muslim and a feminist. Religion(s) goes against the core values of feminism. Nope, you cannot justify it in anyway.",2025-10-23 17:59:34,"['you', ' ', 'can', ""'t"", ' ', 'be', ' ', 'a', ' ', 'muslim', ' ', 'and', ' ', 'a', ' ', 'feminist', '.', ' ', 'religion', ' ', 's', ' ', 'goes', ' ', 'against', ' ', 'the', ' ', 'core', ' ', 'values', ' ', 'of', ' ', 'feminism', '.', ' ', 'nope', ',', ' ', 'you', ' ', 'cannot', ' ', 'justify', ' ', 'it', ' ', 'in', ' ', 'anyway', '.']"
1980067337660494155,twitter,post,https://x.com/nickshirleyy/status/1980067337660494155,text,2025-10-20T00:23:35.000Z,selenium_x_scraper_v1,"This is a must watch  
Protester couple can’t agree on the topic of deportation of ILLEGAL migrants 

I fear I just ended their relationship","This is a must watch  
Protester couple can’t agree on the topic of deportation of ILLEGAL migrants 

I fear I just ended their relationship",2025-10-23 17:59:34,"['this', ' ', 'is', ' ', 'a', ' ', 'must', ' ', 'watch', ' ', 'protester', ' ', 'couple', ' ', 'can', ' ', 't', ' ', 'agree', ' ', 'on', ' ', 'the', ' ', 'topic', ' ', 'of', ' ', 'deportation', ' ', 'of', ' ', 'illegal', ' ', 'migrants', ' ', 'i', ' ', 'fear', ' ', 'i', ' ', 'just', ' ', 'ended', ' ', 'their', ' ', 'relationship']"
1979922449522389037,twitter,post,https://x.com/Enjuabc/status/1979922449522389037,text,2025-10-19T14:47:51.000Z,selenium_x_scraper_v1,RIP ครับ ,RIP ครับ ,2025-10-23 17:59:34,"['rip', ' ', 'ครับ']"
1979822013289308270,twitter,post,https://x.com/RupertLowe10/status/1979822013289308270,text,2025-10-19T08:08:45.000Z,selenium_x_scraper_v1,I am very in favour of banning the burqa.,I am very in favour of banning the burqa.,2025-10-23 17:59:34,"['i', ' ', 'am', ' ', 'very', ' ', 'in', ' ', 'favour', ' ', 'of', ' ', 'banning', ' ', 'the', ' ', 'burqa', '.']"
1979896832806490125,twitter,post,https://x.com/SleeplessBKKNew/status/1979896832806490125,text,2025-10-19T13:06:04.000Z,selenium_x_scraper_v1,"วันนี้ฮามาสคืนศพคนงานไทยที่เป็นตัวประกันกลับมาหนึ่งคน
ไม่มี สส. แสดงความเสียใจกับญาติคนงานไทย ไม่มีการประนามผู้ก่อการร้ายที่ฆ่าคนบริสุทธิ มึแต่ สส.ที่ออกมาหลั่งน้ำตาให้ชาวปาเลสไตน์ คุณคิดว่าเพราะอะไร??? ผมนึกยังไงก็นึกเหตุผลไม่ออก
ถ้าคุณมีเหตุผลดีๆที่อธิบายพฤติกรรมของ","วันนี้ฮามาสคืนศพคนงานไทยที่เป็นตัวประกันกลับมาหนึ่งคน
ไม่มี สส. แสดงความเสียใจกับญาติคนงานไทย ไม่มีการประนามผู้ก่อการร้ายที่ฆ่าคนบริสุทธิ มึแต่ สส.ที่ออกมาหลั่งน้ำตาให้ชาวปาเลสไตน์ คุณคิดว่าเพราะอะไร??? ผมนึกยังไงก็นึกเหตุผลไม่ออก
ถ้าคุณมีเหตุผลดีๆที่อธิบายพฤติกรรมของ",2025-10-23 17:59:34,"['วันนี้', 'หัวเราะ', 'มาส', 'คืน', 'ศพ', 'คนงาน', 'ไทย', 'ที่', 'เป็น', 'ตัวประกัน', 'กลับมา', 'หนึ่ง', 'คน', ' ', 'ไม่', 'มี', ' ', 'สส.', ' ', 'แสดง', 'ความเสียใจ', 'กับ', 'ญาติ', 'คนงาน', 'ไทย', ' ', 'ไม่', 'มี', 'การ', 'ประ', 'นาม', 'ผู้ก่อการร้าย', 'ที่', 'ฆ่า', 'คน', 'บ', 'ริ', 'สุทธิ', ' ', 'มึ', 'แต่', ' ', 'สส.', 'ที่', 'ออกมา', 'หลั่ง', 'น้ำตา', 'ให้', 'ชาว', 'ปาเลสไตน์', ' ', 'คุณ', 'คิด', 'ว่า', 'เพราะอะไร', '?', ' ', 'ผม', 'นึก', 'ยังไง', 'ก็', 'นึก', 'เหตุผล', 'ไม่', 'ออก', ' ', 'ถ้า', 'คุณ', 'มีเหตุผล', 'ดี', 'ๆ', 'ที่', 'อธิบาย', 'พฤติกรรม', 'ของ']"
1979892354917298363,twitter,post,https://x.com/NongNokheetad/status/1979892354917298363,text,2025-10-19T12:48:16.000Z,selenium_x_scraper_v1,แล้วเค้าไม่กดดันฮามาสให้ฟรีปาเลสไตน์หน่อยเหรอ ??,แล้วเค้าไม่กดดันฮามาสให้ฟรีปาเลสไตน์หน่อยเหรอ ??,2025-10-23 17:59:34,"['แล้ว', 'เค้า', 'ไม่', 'กดดัน', 'หัวเราะ', 'มาส', 'ให้', 'ฟรี', 'ปาเลสไตน์', 'หน่อย', 'เหรอ', ' ', '?']"
1979911932095107430,twitter,post,https://x.com/Tim8666/status/1979911932095107430,text,2025-10-19T14:06:04.000Z,selenium_x_scraper_v1,พวกธงปาเลสไตล์ ตายห่าหมดแล่ว,พวกธงปาเลสไตล์ ตายห่าหมดแล่ว,2025-10-23 17:59:34,"['พวก', 'ธง', 'ปา', 'เล', 'สไตล์', ' ', 'ตายห่า', 'หมด', 'แล่', 'ว']"
