id,platform,platform_type,url,content_type,timestamp,scraper_module,text,raw_text,scrape_date,tokens
1980849335534567561,twitter,post,https://x.com/toeyokohama17/status/1980849335534567561,text,2025-10-22T04:10:58.000Z,selenium_x_scraper_v1,นี่ว่าไม่แปลกเลย ด้วยอายุเขาคือคนเจน babyboom ที่อยู่ในสังคมปิตาและมาจากพรรคอนุรักษ์นิยม ถ้าจะเป็น antifem ก็ยิ่งไม่แปลก แถบ east asia ผู้หญิงที่เป็น antifem ก็มีเยอะ เจนใหม่ก็ยังมี ด้วยระบบที่มันฝังรากลึก แต่การที่ผู้หญิงได้ขึ้นเป็นนายก ก็มองให้เป็น movement เริ่มต้นที่ดีละกัน,นี่ว่าไม่แปลกเลย ด้วยอายุเขาคือคนเจน babyboom ที่อยู่ในสังคมปิตาและมาจากพรรคอนุรักษ์นิยม ถ้าจะเป็น antifem ก็ยิ่งไม่แปลก แถบ east asia ผู้หญิงที่เป็น antifem ก็มีเยอะ เจนใหม่ก็ยังมี ด้วยระบบที่มันฝังรากลึก แต่การที่ผู้หญิงได้ขึ้นเป็นนายก ก็มองให้เป็น movement เริ่มต้นที่ดีละกัน,2025-11-29 08:18:55,"['นี่', 'ว่า', 'ไม่', 'แปลก', 'เลย', ' ', 'ด้วย', 'อายุ', 'เขา', 'คือ', 'คน', 'เจน', ' ', 'babyboom', ' ', 'ที่อยู่', 'ใน', 'สังคม', 'ปิตา', 'และ', 'มาจาก', 'พรรค', 'อนุรักษ์นิยม', ' ', 'ถ้า', 'จะ', 'เป็น', ' ', 'antifem', ' ', 'ก็', 'ยิ่ง', 'ไม่', 'แปลก', ' ', 'แถบ', ' ', 'east', ' ', 'asia', ' ', 'ผู้หญิง', 'ที่', 'เป็น', ' ', 'antifem', ' ', 'ก็', 'มี', 'เยอะ', ' ', 'เจน', 'ใหม่', 'ก็', 'ยังมี', ' ', 'ด้วย', 'ระบบ', 'ที่', 'มัน', 'ฝังราก', 'ลึก', ' ', 'แต่', 'การ', 'ที่', 'ผู้หญิง', 'ได้', 'ขึ้น', 'เป็น', 'นายก', ' ', 'ก็', 'มอง', 'ให้', 'เป็น', ' ', 'movement', ' ', 'เริ่มต้น', 'ที่', 'ดีละ', 'กัน']"
1980935479844593716,twitter,post,https://x.com/sabjustsab/status/1980935479844593716,text,2025-10-22T09:53:17.000Z,selenium_x_scraper_v1,ถ้าไม่เสนอแนวคิดนี้ เดาว่าพวกชายจัดไม่ยอมแน่นอน+ตอนนี้สถานการณ์ในประเทศแย่สุดๆ ก็โยนให้ผู้หญิงไปเลย,ถ้าไม่เสนอแนวคิดนี้ เดาว่าพวกชายจัดไม่ยอมแน่นอน+ตอนนี้สถานการณ์ในประเทศแย่สุดๆ ก็โยนให้ผู้หญิงไปเลย,2025-11-29 08:18:55,"['ถ้า', 'ไม่', 'เสนอ', 'แนวคิด', 'นี้', ' ', 'เดา', 'ว่า', 'พวก', 'ชาย', 'จัด', 'ไม่', 'ยอม', 'แน่นอน', ' ', 'ตอนนี้', 'สถานการณ์', 'ในประเทศ', 'แย่', 'สุด', 'ๆ', ' ', 'ก็', 'โยน', 'ให้', 'ผู้หญิง', 'ไป', 'เลย']"
1981612489482936683,twitter,post,https://x.com/RosieAdeline105/status/1981612489482936683,text,2025-10-24T06:43:28.000Z,selenium_x_scraper_v1,ไดโนเสาร์เพศเมียสายพันธุ์ญี่ปุ่น,ไดโนเสาร์เพศเมียสายพันธุ์ญี่ปุ่น,2025-11-29 08:18:55,"['ไดโนเสาร์', 'เพศ', 'เมีย', 'สายพันธุ์', 'ญี่ปุ่น']"
1980926501517431289,twitter,post,https://x.com/pjnnnn_/status/1980926501517431289,text,2025-10-22T09:17:36.000Z,selenium_x_scraper_v1,ปิตาธิปไตยจึงไม่ใช่แค่เพศ แต่เป็นเครื่องมือทางสังคม,ปิตาธิปไตยจึงไม่ใช่แค่เพศ แต่เป็นเครื่องมือทางสังคม,2025-11-29 08:18:55,"['ปิตาธิปไตย', 'จึง', 'ไม่', 'ใช่', 'แค่', 'เพศ', ' ', 'แต่', 'เป็น', 'เครื่องมือ', 'ทางสังคม']"
1980862778677354824,twitter,post,https://x.com/PHAIiWA18/status/1980862778677354824,text,2025-10-22T05:04:23.000Z,selenium_x_scraper_v1,ไดโนเสาร์ในรัฐบาลญี่ปุ่นก็ประมาณเท่าไทยนี่แหละ ถ้าไม่อนุรักษ์นิยมก็ไม่ได้ขึ้นเป็นนายกหรอก,ไดโนเสาร์ในรัฐบาลญี่ปุ่นก็ประมาณเท่าไทยนี่แหละ ถ้าไม่อนุรักษ์นิยมก็ไม่ได้ขึ้นเป็นนายกหรอก,2025-11-29 08:18:55,"['ไดโนเสาร์', 'ใน', 'รัฐบาล', 'ญี่ปุ่น', 'ก็', 'ประมาณ', 'เท่า', 'ไทย', 'นี่แหละ', ' ', 'ถ้า', 'ไม่', 'อนุรักษ์นิยม', 'ก็', 'ไม่', 'ได้', 'ขึ้น', 'เป็น', 'นายก', 'หรอก']"
1980948730040943044,twitter,post,https://x.com/TINExBLINK/status/1980948730040943044,text,2025-10-22T10:45:56.000Z,selenium_x_scraper_v1,ไม่แปลกนางชาตินิยมสุดโต่ง ดำเนินนโยบายดั้งเดิม ไม่มีอะไรที่แปลกใหม่ การขับผู้อพยพออกไปก็คือแนวคิดปิดประเทศแต่เน้นไปที่เชื้อชาติของตัวบุคคล,ไม่แปลกนางชาตินิยมสุดโต่ง ดำเนินนโยบายดั้งเดิม ไม่มีอะไรที่แปลกใหม่ การขับผู้อพยพออกไปก็คือแนวคิดปิดประเทศแต่เน้นไปที่เชื้อชาติของตัวบุคคล,2025-11-29 08:18:55,"['ไม่', 'แปลก', 'นาง', 'ชาตินิยม', 'สุดโต่ง', ' ', 'ดำเนิน', 'นโยบาย', 'ดั้งเดิม', ' ', 'ไม่', 'มี', 'อะไร', 'ที่', 'แปลกใหม่', ' ', 'การขับ', 'ผู้อพยพ', 'ออก', 'ไป', 'ก็', 'คือ', 'แนวคิด', 'ปิด', 'ประเทศ', 'แต่', 'เน้น', 'ไป', 'ที่', 'เชื้อชาติ', 'ของ', 'ตัว', 'บุคคล']"
1980963076456505459,twitter,post,https://x.com/me_nu0210/status/1980963076456505459,text,2025-10-22T11:42:56.000Z,selenium_x_scraper_v1,ไปอ่านประวัติมาคือ pick me woman มาก,ไปอ่านประวัติมาคือ pick me woman มาก,2025-11-29 08:18:55,"['ไป', 'อ่าน', 'ประวัติ', 'มา', 'คือ', ' ', 'pick', ' ', 'me', ' ', 'woman', ' ', 'มาก']"
1981167997227323747,twitter,post,https://x.com/secret_tulipjj/status/1981167997227323747,text,2025-10-23T01:17:13.000Z,selenium_x_scraper_v1,ชีสนับสนุนผญ.อยู่นะ เรื่องการตั้งครรภ์น่ะ:face_with_bags_under_eyes: ขอบคุณสำหรับการเป็นนายกหญิงคนแรกของประเทศญป.ที่มูฟเม้นต์นั้น....,ชีสนับสนุนผญ.อยู่นะ เรื่องการตั้งครรภ์น่ะ🫩 ขอบคุณสำหรับการเป็นนายกหญิงคนแรกของประเทศญป.ที่มูฟเม้นต์นั้น....,2025-11-29 08:18:55,"['ชี', 'สนับสนุน', 'ผญ.', 'อยู่', 'นะ', ' ', 'เรื่อง', 'การ', 'ตั้งครรภ์', 'น่ะ', ' ', 'face', ' ', 'with', ' ', 'bags', ' ', 'under', ' ', 'eyes', ' ', 'ขอบคุณ', 'สำหรับ', 'การ', 'เป็น', 'นายก', 'หญิง', 'คน', 'แรก', 'ของ', 'ประเทศ', 'ญ', 'ป.', 'ที่', 'มูฟเม้นต์', 'นั้น', '...']"
1980874650549879137,twitter,post,https://x.com/bbbbeta2/status/1980874650549879137,text,2025-10-22T05:51:34.000Z,selenium_x_scraper_v1,"LDP นี่ตั้งแต่ญี่ปุ่นมีการเลือกตั้ง แพ้แค่ 1-2 ครั้งเองมั้ย ลงใยฝนนามพรรคLDP การันตีชนะไปละ 90% อยู่ที่ว่าได้เสียงมากหรือน้อย ต้องจับมือกับพรรคไหนบ้างงี้

เคยดูคลิปสัมคนญี่ปุ่นว่าจะไปเลือกตั้งมั้ย

เหมือนหนุ่มสาวในเมืองบอกเลือกก็ไม่มีอะไรเปลี่ยน แต่คนแก่ส่วนมากไปเพราะเป็นหน้าที่","LDP นี่ตั้งแต่ญี่ปุ่นมีการเลือกตั้ง แพ้แค่ 1-2 ครั้งเองมั้ย ลงใยฝนนามพรรคLDP การันตีชนะไปละ 90% อยู่ที่ว่าได้เสียงมากหรือน้อย ต้องจับมือกับพรรคไหนบ้างงี้

เคยดูคลิปสัมคนญี่ปุ่นว่าจะไปเลือกตั้งมั้ย

เหมือนหนุ่มสาวในเมืองบอกเลือกก็ไม่มีอะไรเปลี่ยน แต่คนแก่ส่วนมากไปเพราะเป็นหน้าที่",2025-11-29 08:18:55,"['ldp', ' ', 'นี่', 'ตั้งแต่', 'ญี่ปุ่น', 'มี', 'การเลือกตั้ง', ' ', 'แพ้', 'แค่', ' ', '1', ' ', '2', ' ', 'ครั้ง', 'เอง', 'มั้ย', ' ', 'ลง', 'ใย', 'ฝน', 'นาม', 'พรรค', 'ldp', ' ', 'การันตี', 'ชนะ', 'ไป', 'ละ', ' ', '90', ' ', 'อยู่', 'ที่ว่า', 'ได้', 'เสียง', 'มาก', 'หรือ', 'น้อย', ' ', 'ต้อง', 'จับมือ', 'กับ', 'พรรค', 'ไหน', 'บ้าง', 'งี้', ' ', 'เคย', 'ดู', 'คลิป', 'สัม', 'คนญี่ปุ่น', 'ว่า', 'จะ', 'ไป', 'เลือกตั้ง', 'มั้ย', ' ', 'เหมือน', 'หนุ่มสาว', 'ใน', 'เมือง', 'บอก', 'เลือก', 'ก็', 'ไม่', 'มี', 'อะไร', 'เปลี่ยน', ' ', 'แต่', 'คนแก่', 'ส่วนมาก', 'ไป', 'เพราะ', 'เป็น', 'หน้าที่']"
1980933350929117638,twitter,post,https://x.com/koalamarchtaeil/status/1980933350929117638,text,2025-10-22T09:44:49.000Z,selenium_x_scraper_v1,แต่ให้ผัวใช้นามสกุลตัวเองนะ ย้องแย้ง,แต่ให้ผัวใช้นามสกุลตัวเองนะ ย้องแย้ง,2025-11-29 08:18:55,"['แต่', 'ให้', 'ผัว', 'ใช้', 'นามสกุล', 'ตัวเอง', 'นะ', ' ', 'ย้อง', 'แย้ง']"
1980916618474701033,twitter,post,https://x.com/FeiZV/status/1980916618474701033,text,2025-10-22T08:38:20.000Z,selenium_x_scraper_v1,"Margaret Thatcher but Asian 

LOL","Margaret Thatcher but Asian 

LOL",2025-11-29 08:18:55,"['margaret', ' ', 'thatcher', ' ', 'but', ' ', 'asian', ' ', 'lol']"
1981542453896499416,twitter,post,https://x.com/THEHEARTOFJACK/status/1981542453896499416,text,2025-10-24T02:05:10.000Z,selenium_x_scraper_v1,อรืม ก็ว่าอิประเทศนี้เป็นได้ไงผู้หญิงได้ตำแหน่งนี้ อรืมๆ,อรืม ก็ว่าอิประเทศนี้เป็นได้ไงผู้หญิงได้ตำแหน่งนี้ อรืมๆ,2025-11-29 08:18:55,"['อรืม', ' ', 'ก็', 'ว่า', 'อิ', 'ประเทศ', 'นี้', 'เป็นได้', 'ไง', 'ผู้หญิง', 'ได้', 'ตำแหน่ง', 'นี้', ' ', 'อรืมๆ']"
1980859881507942794,twitter,post,https://x.com/pbria_/status/1980859881507942794,text,2025-10-22T04:52:53.000Z,selenium_x_scraper_v1,ย้อนแย้งมั้ย แต่ผัวนางใช้นามสกุลนางนะ,ย้อนแย้งมั้ย แต่ผัวนางใช้นามสกุลนางนะ,2025-11-29 08:18:55,"['ย้อน', 'แย้ง', 'มั้ย', ' ', 'แต่', 'ผัว', 'นาง', 'ใช้', 'นามสกุล', 'นาง', 'นะ']"
1980848225600078043,twitter,post,https://x.com/howishesocute/status/1980848225600078043,text,2025-10-22T04:06:34.000Z,selenium_x_scraper_v1,คนนี้ด้วยไหมที่คิดว่าคนควรทำงานเป็นวัวเป็นควาย (อันนี้ไม่แน่ใจนะได้ยินมาเฉยๆๆ55),คนนี้ด้วยไหมที่คิดว่าคนควรทำงานเป็นวัวเป็นควาย (อันนี้ไม่แน่ใจนะได้ยินมาเฉยๆๆ55),2025-11-29 08:18:55,"['คน', 'นี้', 'ด้วย', 'ไหม', 'ที่', 'คิด', 'ว่า', 'คน', 'ควร', 'ทำงาน', 'เป็น', 'วัว', 'เป็น', 'ควาย', ' ', 'อันนี้', 'ไม่', 'แน่ใจ', 'นะ', 'ได้ยิน', 'มา', 'เฉย', 'ๆๆ', '55']"
1981381572462035112,twitter,post,https://x.com/0mn1as/status/1981381572462035112,text,2025-10-23T15:25:53.000Z,selenium_x_scraper_v1,ก็ว่าอยู่ทำไมเห็นแต่ผุ้หญิงแซ้ดที่ได้นางมา,ก็ว่าอยู่ทำไมเห็นแต่ผุ้หญิงแซ้ดที่ได้นางมา,2025-11-29 08:18:55,"['ก็', 'ว่า', 'อยู่', 'ทำไม', 'เห็น', 'แต่', 'ผุ้', 'หญิง', 'แซ้ด', 'ที่', 'ได้', 'นาง', 'มา']"
1980966187962904929,twitter,post,https://x.com/iiigreenz/status/1980966187962904929,text,2025-10-22T11:55:18.000Z,selenium_x_scraper_v1,"ตอนกินข้าว ชวนเพื่อนญี่ปุ่นในคลาสคุย เป็นผู้พิพากษาหญิงจากโตเกียว บอกไม่ชอบนายกคนนี้เพราะอะไรยังไม่ทันได้discuss ถามเพื่อนอีกคนเป็นทนายผู้ชายจากโตเกียว บอกว่าดี ในที่สุดก็มีคนที่ตั้งใจแก้ปัญหาค่าเงินเยน

ฉันผู้ไม่รู้ข้อมูลอื่นฟังแค่นี้ก็คิดว่าแปลกๆนะ ","ตอนกินข้าว ชวนเพื่อนญี่ปุ่นในคลาสคุย เป็นผู้พิพากษาหญิงจากโตเกียว บอกไม่ชอบนายกคนนี้เพราะอะไรยังไม่ทันได้discuss ถามเพื่อนอีกคนเป็นทนายผู้ชายจากโตเกียว บอกว่าดี ในที่สุดก็มีคนที่ตั้งใจแก้ปัญหาค่าเงินเยน

ฉันผู้ไม่รู้ข้อมูลอื่นฟังแค่นี้ก็คิดว่าแปลกๆนะ ",2025-11-29 08:18:55,"['ตอน', 'กินข้าว', ' ', 'ชวน', 'เพื่อน', 'ญี่ปุ่น', 'ใน', 'คลาส', 'คุย', ' ', 'เป็น', 'ผู้พิพากษา', 'หญิง', 'จาก', 'โตเกียว', ' ', 'บอก', 'ไม่', 'ชอบ', 'นายก', 'คน', 'นี้', 'เพราะอะไร', 'ยัง', 'ไม่', 'ทัน', 'ได้', 'discuss', ' ', 'ถาม', 'เพื่อน', 'อีก', 'คน', 'เป็น', 'ทนาย', 'ผู้ชาย', 'จาก', 'โตเกียว', ' ', 'บอ', 'กว่า', 'ดี', ' ', 'ในที่สุด', 'ก็', 'มี', 'คน', 'ที่', 'ตั้งใจ', 'แก้ปัญหา', 'ค่าเงิน', 'เยน', ' ', 'ฉัน', 'ผู้', 'ไม่', 'รู้', 'ข้อมูล', 'อื่น', 'ฟัง', 'แค่นี้', 'ก็', 'คิด', 'ว่า', 'แปลก', 'ๆ', 'นะ']"
1980990176395685970,twitter,post,https://x.com/Apen_Dx/status/1980990176395685970,text,2025-10-22T13:30:37.000Z,selenium_x_scraper_v1,นายกหญิง แต่ต่อต้านสมรสเท่าเทียม ต่อต้านการให้เจ้าหญิงมาสืบทอดราชบัลลังก์ ต่อต้านภรรยามีสิทธิ์ใช้นามสกุลเดิม แล้วได้ยินแว่วๆ ว่านางไม่ยอมรับเรื่องญี่ปุ่นบุกจีนสมัยยุค 1930s ด้วย x.com/Reiriesz/statu…,นายกหญิง แต่ต่อต้านสมรสเท่าเทียม ต่อต้านการให้เจ้าหญิงมาสืบทอดราชบัลลังก์ ต่อต้านภรรยามีสิทธิ์ใช้นามสกุลเดิม แล้วได้ยินแว่วๆ ว่านางไม่ยอมรับเรื่องญี่ปุ่นบุกจีนสมัยยุค 1930s ด้วย x.com/Reiriesz/statu…,2025-11-29 08:18:55,"['นายก', 'หญิง', ' ', 'แต่', 'ต่อต้าน', 'สมรส', 'เท่าเทียม', ' ', 'ต่อต้าน', 'การ', 'ให้', 'เจ้าหญิง', 'มา', 'สืบทอด', 'ราชบัลลังก์', ' ', 'ต่อต้าน', 'ภรรยา', 'มีสิทธิ์', 'ใช้', 'นามสกุล', 'เดิม', ' ', 'แล้ว', 'ได้ยิน', 'แว่ว', 'ๆ', ' ', 'ว่า', 'นาง', 'ไม่', 'ยอมรับ', 'เรื่อง', 'ญี่ปุ่น', 'บุก', 'จีน', 'สมัย', 'ยุค', ' ', '1930', 's', ' ', 'ด้วย', ' ', 'x', '.com', ' ', 'reiriesz', ' ', 'statu']"
1981449876878872776,twitter,post,https://x.com/Paew_PJ/status/1981449876878872776,text,2025-10-23T19:57:18.000Z,selenium_x_scraper_v1,อ่านโควทละหดหู่จัง นี่ว่ารถไฟสายมรณะบ้านเราหดหู่แล้วเจอของจีนละพอเลยแต่ก็แปลกว่าทำไมไทยไม่ให้เราเรียนรู้ความโหดเหี้ยมของญี่ปุ่นที่ทำกับเราทำไมถึงเอาแต่ปลูกฝังความเกลียดชังเรื่องสงครามไทย-พม่า,อ่านโควทละหดหู่จัง นี่ว่ารถไฟสายมรณะบ้านเราหดหู่แล้วเจอของจีนละพอเลยแต่ก็แปลกว่าทำไมไทยไม่ให้เราเรียนรู้ความโหดเหี้ยมของญี่ปุ่นที่ทำกับเราทำไมถึงเอาแต่ปลูกฝังความเกลียดชังเรื่องสงครามไทย-พม่า,2025-11-29 08:18:55,"['อ่าน', 'โค', 'วท', 'ละ', 'หดหู่', 'จัง', ' ', 'นี่', 'ว่า', 'รถไฟ', 'สาย', 'มรณะ', 'บ้าน', 'เรา', 'หดหู่', 'แล้ว', 'เจอ', 'ของ', 'จีน', 'ละ', 'พอ', 'เลย', 'แต่', 'ก็', 'แปล', 'กว่า', 'ทำไม', 'ไทย', 'ไม่', 'ให้', 'เรา', 'เรียนรู้', 'ความโหดเหี้ยม', 'ของ', 'ญี่ปุ่น', 'ที่', 'ทำ', 'กับ', 'เรา', 'ทำไม', 'ถึง', 'เอาแต่', 'ปลูกฝัง', 'ความเกลียดชัง', 'เรื่อง', 'สงคราม', 'ไทย', ' ', 'พม่า']"
1981190442726412535,twitter,post,https://x.com/papayalate/status/1981190442726412535,text,2025-10-23T02:46:24.000Z,selenium_x_scraper_v1,อันสุดท้ายกุให้อุบาทสุด มึงไปทำระยำกับคนปทเขาตั้งเท่าไหร่ สาระแนจะไม่ยอมรับ,อันสุดท้ายกุให้อุบาทสุด มึงไปทำระยำกับคนปทเขาตั้งเท่าไหร่ สาระแนจะไม่ยอมรับ,2025-11-29 08:18:55,"['อัน', 'สุดท้าย', 'กุ', 'ให้', 'อุบาท', 'สุด', ' ', 'มึง', 'ไป', 'ทำ', 'ระยำ', 'กับ', 'คน', 'ปท', 'เขา', 'ตั้ง', 'เท่าไหร่', ' ', 'สาระแน', 'จะ', 'ไม่', 'ยอมรับ']"
1981241475221639360,twitter,post,https://x.com/Tiramisuyoo/status/1981241475221639360,text,2025-10-23T06:09:12.000Z,selenium_x_scraper_v1,คนญปมองว่านโยบายส่งผู้อพยพกลับประเทศ ณ ตอนนี้สำคัญมากกว่าสิ่งอื่นใดละมั้งนะ,คนญปมองว่านโยบายส่งผู้อพยพกลับประเทศ ณ ตอนนี้สำคัญมากกว่าสิ่งอื่นใดละมั้งนะ,2025-11-29 08:18:55,"['คน', 'ญป', 'มองว่า', 'นโยบาย', 'ส่ง', 'ผู้อพยพ', 'กลับ', 'ประเทศ', ' ', 'ณ', ' ', 'ตอนนี้', 'สำคัญ', 'มากกว่า', 'สิ่ง', 'อื่น', 'ใด', 'ละ', 'มั้ง', 'นะ']"
1980920433777299856,twitter,post,https://x.com/unfroggetable5/status/1980920433777299856,text,2025-10-22T08:53:29.000Z,selenium_x_scraper_v1, อ่านชีวิตส่วนตัวเขาแล้วขัดกับแนวคิดที่บอกว่าเขาถืออยู่นะ ไม่ใช่ว่าเขาแกล้งเอนข้างอนุรักษ์เพื่อให้ได้มีสิทธิ์ขึ้นตำแหน่งในพรรคเหรอ, อ่านชีวิตส่วนตัวเขาแล้วขัดกับแนวคิดที่บอกว่าเขาถืออยู่นะ ไม่ใช่ว่าเขาแกล้งเอนข้างอนุรักษ์เพื่อให้ได้มีสิทธิ์ขึ้นตำแหน่งในพรรคเหรอ,2025-11-29 08:18:55,"['อ่าน', 'ชีวิต', 'ส่วนตัว', 'เขา', 'แล้ว', 'ขัด', 'กับ', 'แนวคิด', 'ที่', 'บอ', 'กว่า', 'เขา', 'ถือ', 'อยู่', 'นะ', ' ', 'ไม่', 'ใช่', 'ว่า', 'เขา', 'แกล้ง', 'เอน', 'ข้าง', 'อนุรักษ์', 'เพื่อ', 'ให้ได้', 'มีสิทธิ์', 'ขึ้น', 'ตำแหน่ง', 'ใน', 'พรรค', 'เหรอ']"
