id,platform,platform_type,url,content_type,timestamp,scraper_module,text,raw_text,scrape_date,tokens
1982006397626912817,twitter,post,https://x.com/belsrc_/status/1982006397626912817,text,2025-10-25T08:48:43.000Z,selenium_x_scraper_v1,โรงเรียนนี่ผญนั่งตักกันโดนเข้าห้องปกครองเรื่องชู้สาว กุงงมาก55555555555555,โรงเรียนนี่ผญนั่งตักกันโดนเข้าห้องปกครองเรื่องชู้สาว กุงงมาก55555555555555,2025-11-29 08:18:55,"['โรงเรียน', 'นี่', 'ผญ', 'นั่ง', 'ตัก', 'กัน', 'โดน', 'เข้า', 'ห้อง', 'ปกครอง', 'เรื่อง', 'ชู้สาว', ' ', 'กุ', 'งง', 'มาก', 'หัวเราะ']"
1981956587251237273,twitter,post,https://x.com/Kkwgnpk/status/1981956587251237273,text,2025-10-25T05:30:48.000Z,selenium_x_scraper_v1,ทำไมความคิดผูกอยู่แต่กับเรื่องเย็ดๆ แต่ทำเป็นรีบไม่ได้ แต่เอาคำธรรมดาๆไปผูกกับเรื่องเย็ดหมดเลย เป็นไรวะ,ทำไมความคิดผูกอยู่แต่กับเรื่องเย็ดๆ แต่ทำเป็นรีบไม่ได้ แต่เอาคำธรรมดาๆไปผูกกับเรื่องเย็ดหมดเลย เป็นไรวะ,2025-11-29 08:18:55,"['ทำไม', 'ความคิด', 'ผูก', 'อยู่', 'แต่', 'กับ', 'เรื่อง', 'เย็ด', 'ๆ', ' ', 'แต่', 'ทำเป็น', 'รีบ', 'ไม่', 'ได้', ' ', 'แต่', 'เอา', 'คำ', 'ธรรมดาๆ', 'ไป', 'ผูก', 'กับ', 'เรื่อง', 'เย็ด', 'หมด', 'เลย', ' ', 'เป็นไร', 'วะ']"
1981968718545469524,twitter,post,https://x.com/leejijii027/status/1981968718545469524,text,2025-10-25T06:19:00.000Z,selenium_x_scraper_v1,นี่โดนให้ใช้คำว่ารับแทน,นี่โดนให้ใช้คำว่ารับแทน,2025-11-29 08:18:55,"['นี่', 'โดน', 'ให้', 'ใช้', 'คำ', 'ว่า', 'รับ', 'แทน']"
1982168013236326442,twitter,post,https://x.com/Piggy_BooBuu/status/1982168013236326442,text,2025-10-25T19:30:55.000Z,selenium_x_scraper_v1,"อีดอก ประสาท
เอาเอาเอาเอาเอาเอาเอาเอาเอาเอาเอาเอาเอาเอาเอาเอาเอาเอาเอาเอาเอาเอาเอาเอาเอาเอาเอาเอาเอาเอาเอาเอาเอาเอาเอาเอาเอาเอาเอาเอาเอาเอาเอาเอาเอาเอาเอาเอาเอาเอาเอาเอาเอาเอาเอาเอาเอาเอาเอาเอาเอาเอาเอาเอาเอาเอาเอาเอาเอาเอาเอาเอาเอาเอาเอาเอาเอาเอาเอาเอาเอาเอาเอาเอาเอาเอาเอาเอาเอา","อีดอก ประสาท
เอาเอาเอาเอาเอาเอาเอาเอาเอาเอาเอาเอาเอาเอาเอาเอาเอาเอาเอาเอาเอาเอาเอาเอาเอาเอาเอาเอาเอาเอาเอาเอาเอาเอาเอาเอาเอาเอาเอาเอาเอาเอาเอาเอาเอาเอาเอาเอาเอาเอาเอาเอาเอาเอาเอาเอาเอาเอาเอาเอาเอาเอาเอาเอาเอาเอาเอาเอาเอาเอาเอาเอาเอาเอาเอาเอาเอาเอาเอาเอาเอาเอาเอาเอาเอาเอาเอาเอาเอา",2025-11-29 08:18:55,"['อีดอก', ' ', 'ประสาท', ' ', 'เอา', 'เอา', 'เอา', 'เอา', 'เอา', 'เอา', 'เอา', 'เอา', 'เอา', 'เอา', 'เอา', 'เอา', 'เอา', 'เอา', 'เอา', 'เอา', 'เอา', 'เอา', 'เอา', 'เอา', 'เอา', 'เอา', 'เอา', 'เอา', 'เอา', 'เอา', 'เอา', 'เอา', 'เอา', 'เอา', 'เอา', 'เอา', 'เอา', 'เอา', 'เอา', 'เอา', 'เอา', 'เอา', 'เอา', 'เอา', 'เอา', 'เอา', 'เอา', 'เอา', 'เอา', 'เอา', 'เอา', 'เอา', 'เอา', 'เอา', 'เอา', 'เอา', 'เอา', 'เอา', 'เอา', 'เอา', 'เอา', 'เอา', 'เอา', 'เอา', 'เอา', 'เอา', 'เอา', 'เอา', 'เอา', 'เอา', 'เอา', 'เอา', 'เอา', 'เอา', 'เอา', 'เอา', 'เอา', 'เอา', 'เอา', 'เอา', 'เอา', 'เอา', 'เอา', 'เอา', 'เอา', 'เอา', 'เอา', 'เอา', 'เอา', 'เอา', 'เอา', 'เอา', 'เอา']"
1982036357452370269,twitter,post,https://x.com/daydream24_07/status/1982036357452370269,text,2025-10-25T10:47:46.000Z,selenium_x_scraper_v1,โรงเรียนเราก็บอกว่าไม่ให้ใช้คำว่าผ้าพันคอ(ยุวกาชาติ) ให้เรียกผ้าผูกคอ,โรงเรียนเราก็บอกว่าไม่ให้ใช้คำว่าผ้าพันคอ(ยุวกาชาติ) ให้เรียกผ้าผูกคอ,2025-11-29 08:18:55,"['โรงเรียน', 'เรา', 'ก็', 'บอ', 'กว่า', 'ไม่', 'ให้', 'ใช้', 'คำ', 'ว่า', 'ผ้าพันคอ', ' ', 'ยุว', 'กา', 'ชาติ', ' ', 'ให้', 'เรียก', 'ผ้า', 'ผูก', 'คอ']"
1981936413475283388,twitter,post,https://x.com/onur_rxm/status/1981936413475283388,text,2025-10-25T04:10:38.000Z,selenium_x_scraper_v1,กรุจารั่ว สิ่งนี้มันเกิดขึ้นบนโลกจริงหรือ,กรุจารั่ว สิ่งนี้มันเกิดขึ้นบนโลกจริงหรือ,2025-11-29 08:18:55,"['กรุ', 'จา', 'รั่ว', ' ', 'สิ่ง', 'นี้', 'มัน', 'เกิดขึ้น', 'บน', 'โลก', 'จริง', 'หรือ']"
1982399065196503077,twitter,post,https://x.com/JustRead275/status/1982399065196503077,text,2025-10-26T10:49:02.000Z,selenium_x_scraper_v1,เป็นครูที่เอาแต่ใจจัง,เป็นครูที่เอาแต่ใจจัง,2025-11-29 08:18:55,"['เป็น', 'ครู', 'ที่', 'เอาแต่ใจ', 'จัง']"
1981967035065377061,twitter,post,https://x.com/itsmillenjul/status/1981967035065377061,text,2025-10-25T06:12:18.000Z,selenium_x_scraper_v1,ให้อยู่เทียร์เดียวกันกับ ห้ามพูดCUMแบค,ให้อยู่เทียร์เดียวกันกับ ห้ามพูดCUMแบค,2025-11-29 08:18:55,"['ให้', 'อยู่', 'เทียร์', 'เดียวกัน', 'กับ', ' ', 'ห้าม', 'พูด', 'cum', 'แบ', 'ค']"
1982730251055829220,twitter,post,https://x.com/Kazunishi_Key/status/1982730251055829220,text,2025-10-27T08:45:03.000Z,selenium_x_scraper_v1,มีด้วยหรออออ หรือไม่เคยใส่ใจ  @NarisBlyce เพื่อนสาววว~ .....เราเคยโดนห้ามพูดแบบนี้มั้ยย,มีด้วยหรออออ หรือไม่เคยใส่ใจ  @NarisBlyce เพื่อนสาววว~ .....เราเคยโดนห้ามพูดแบบนี้มั้ยย,2025-11-29 08:18:55,"['มี', 'ด้วย', 'หรอ', 'ออ', 'อ', ' ', 'หรือไม่', 'เคย', 'ใส่ใจ', ' ', 'เพื่อน', 'สาว', 'วว', ' ', '...', 'เรา', 'เคย', 'โดน', 'ห้าม', 'พูด', 'แบบนี้', 'มั้ย', 'ย']"
1982204283006169432,twitter,post,https://x.com/kkswift13/status/1982204283006169432,text,2025-10-25T21:55:03.000Z,selenium_x_scraper_v1,เอา ที่หมายถึงกิจกรรมทางเพศเป็นความหมายโดยนัยขึ้นอยู่กับบริบทการใช้ อิครูออกแนวเพี้ยนเกิน,เอา ที่หมายถึงกิจกรรมทางเพศเป็นความหมายโดยนัยขึ้นอยู่กับบริบทการใช้ อิครูออกแนวเพี้ยนเกิน,2025-11-29 08:18:55,"['เอา', ' ', 'ที่', 'หมายถึง', 'กิจกรรม', 'ทางเพศ', 'เป็น', 'ความหมาย', 'โดยนัย', 'ขึ้นอยู่กับ', 'บริบท', 'การ', 'ใช้', ' ', 'อิ', 'ครู', 'ออก', 'แนว', 'เพี้ยน', 'เกิน']"
1982479234380796234,twitter,post,https://x.com/userseur/status/1982479234380796234,text,2025-10-26T16:07:36.000Z,selenium_x_scraper_v1,อะไรของมัน,อะไรของมัน,2025-11-29 08:18:55,"['อะไร', 'ของ', 'มัน']"
1981940611482529917,twitter,post,https://x.com/barneydinosuar/status/1981940611482529917,text,2025-10-25T04:27:19.000Z,selenium_x_scraper_v1,มหัศจรรย์มาก,มหัศจรรย์มาก,2025-11-29 08:18:55,"['มหัศจรรย์', 'มาก']"
1981991844587471138,twitter,post,https://x.com/hmrxrpr/status/1981991844587471138,text,2025-10-25T07:50:54.000Z,selenium_x_scraper_v1,กรุในสมัยเรียนอัสสัม,กรุในสมัยเรียนอัสสัม,2025-11-29 08:18:55,"['กรุ', 'ใน', 'สมัย', 'เรียน', 'อัสสัม']"
1981976137095164171,twitter,post,https://x.com/iinaampri/status/1981976137095164171,text,2025-10-25T06:48:29.000Z,selenium_x_scraper_v1,ล่าสุดแม่กุห้ามพูดคำว่า ขายความสวย ต่อหน้าผู้ชาย เพราะมันแปลว่ากะหรี่ เออ คนละยุคจริง สมัยนี้จะฟิลแบบสวยแพงอะ,ล่าสุดแม่กุห้ามพูดคำว่า ขายความสวย ต่อหน้าผู้ชาย เพราะมันแปลว่ากะหรี่ เออ คนละยุคจริง สมัยนี้จะฟิลแบบสวยแพงอะ,2025-11-29 08:18:55,"['ล่าสุด', 'แม่', 'กุ', 'ห้าม', 'พูด', 'คำ', 'ว่า', ' ', 'ขาย', 'ความ', 'สวย', ' ', 'ต่อหน้า', 'ผู้ชาย', ' ', 'เพราะ', 'มัน', 'แปล', 'ว่า', 'กะหรี่', ' ', 'เออ', ' ', 'คนละ', 'ยุค', 'จริง', ' ', 'สมัยนี้', 'จะ', 'ฟิล', 'แบบ', 'สวย', 'แพง', 'อะ']"
1982189918345470429,twitter,post,https://x.com/Seekshivi/status/1982189918345470429,text,2025-10-25T20:57:58.000Z,selenium_x_scraper_v1,นี่ว่าครูหมกมุ่นเองรึเปล่า คนปกติเขาไม่คิดแบบนั้นมั้ย,นี่ว่าครูหมกมุ่นเองรึเปล่า คนปกติเขาไม่คิดแบบนั้นมั้ย,2025-11-29 08:18:55,"['นี่', 'ว่า', 'ครู', 'หมกมุ่น', 'เอง', 'รึเปล่า', ' ', 'คน', 'ปกติ', 'เขา', 'ไม่', 'คิด', 'แบบ', 'นั้น', 'มั้ย']"
1982057773983801620,twitter,post,https://x.com/Harry_ThePeace/status/1982057773983801620,text,2025-10-25T12:12:52.000Z,selenium_x_scraper_v1,สมัยชั้นครูสอนอิ๊งบอกห้ามใช้คำว่า hot ,สมัยชั้นครูสอนอิ๊งบอกห้ามใช้คำว่า hot ,2025-11-29 08:18:55,"['สมัย', 'ชั้นครู', 'สอน', 'อิ๊ง', 'บอก', 'ห้าม', 'ใช้', 'คำ', 'ว่า', ' ', 'hot']"
1981987895943811205,twitter,post,https://x.com/OpaL_MeliimeldA/status/1981987895943811205,text,2025-10-25T07:35:12.000Z,selenium_x_scraper_v1,หื้ออออ ทำไมคุณครูไม่ดูบริบทของคำเลยอ่าาาาาาาาาาาาาาาาาาาาาาาาาาาาาาาาา,หื้ออออ ทำไมคุณครูไม่ดูบริบทของคำเลยอ่าาาาาาาาาาาาาาาาาาาาาาาาาาาาาาาาา,2025-11-29 08:18:55,"['หื้อ', 'ออ', 'อ', ' ', 'ทำไม', 'คุณครู', 'ไม่', 'ดู', 'บริบท', 'ของ', 'คำ', 'เลย', 'อ่า', 'าาาาาาาาาาาาาาาาาาาาาาาาาาาาาาาา']"
1982316458941231171,twitter,post,https://x.com/lo5tnf0und/status/1982316458941231171,text,2025-10-26T05:20:48.000Z,selenium_x_scraper_v1,เรียนหญิงล้วน เพื่อนยืนกอดกันรอเข้าแถวตรงสนาม ฝ่ายปกครองเห็นเลยเรียกขึ้นไปกอดกันโชว์ทุกคนบนเวที :face_with_bags_under_eyes:,เรียนหญิงล้วน เพื่อนยืนกอดกันรอเข้าแถวตรงสนาม ฝ่ายปกครองเห็นเลยเรียกขึ้นไปกอดกันโชว์ทุกคนบนเวที 🫩,2025-11-29 08:18:55,"['เรียน', 'หญิง', 'ล้วน', ' ', 'เพื่อน', 'ยืน', 'กอด', 'กัน', 'รอ', 'เข้าแถว', 'ตรง', 'สนาม', ' ', 'ฝ่ายปกครอง', 'เห็น', 'เลย', 'เรียก', 'ขึ้นไป', 'กอด', 'กัน', 'โชว์', 'ทุกคน', 'บน', 'เวที', ' ', 'face', ' ', 'with', ' ', 'bags', ' ', 'under', ' ', 'eyes']"
1982111910410777023,twitter,post,https://x.com/ballwpvn/status/1982111910410777023,text,2025-10-25T15:47:59.000Z,selenium_x_scraper_v1,อยู่หญิงล้วนมาไม่เจอแฮะ โชคดี,อยู่หญิงล้วนมาไม่เจอแฮะ โชคดี,2025-11-29 08:18:55,"['อยู่', 'หญิง', 'ล้วน', 'มา', 'ไม่', 'เจอ', 'แฮะ', ' ', 'โชคดี']"
1982449306901885192,twitter,post,https://x.com/TwinkleBenja/status/1982449306901885192,text,2025-10-26T14:08:41.000Z,selenium_x_scraper_v1,โรงเรียนประจำโบราณๆก็โดน นี้ว่าเป็นที่ครูอะที่หัวโบณาณแล้วคิดเยอะเอง,โรงเรียนประจำโบราณๆก็โดน นี้ว่าเป็นที่ครูอะที่หัวโบณาณแล้วคิดเยอะเอง,2025-11-29 08:18:55,"['โรงเรียนประจำ', 'โบราณ', 'ๆ', 'ก็', 'โดน', ' ', 'นี้', 'ว่า', 'เป็นที่', 'ครู', 'อะ', 'ที่', 'หัว', 'โบ', 'ณาณ', 'แล้ว', 'คิด', 'เยอะ', 'เอง']"
1982057005792813237,twitter,post,https://x.com/wombaaaat/status/1982057005792813237,text,2025-10-25T12:09:49.000Z,selenium_x_scraper_v1,ผิดที่ผู้บัญญัติคำ,ผิดที่ผู้บัญญัติคำ,2025-11-29 08:18:55,"['ผิดที่', 'ผู้', 'บัญญัติ', 'คำ']"
1982018302357725381,twitter,post,https://x.com/charcoalmoon/status/1982018302357725381,text,2025-10-25T09:36:02.000Z,selenium_x_scraper_v1,ห้ามอ่าน yet ว่าเย้ด,ห้ามอ่าน yet ว่าเย้ด,2025-11-29 08:18:55,"['ห้าม', 'อ่าน', ' ', 'yet', ' ', 'ว่า', 'เย้', 'ด']"
1982079827109986771,twitter,post,https://x.com/sallusummer/status/1982079827109986771,text,2025-10-25T13:40:30.000Z,selenium_x_scraper_v1,อย่าเอาคนบ้าแล้วโง่มาเป็นครู,อย่าเอาคนบ้าแล้วโง่มาเป็นครู,2025-11-29 08:18:55,"['อย่า', 'เอา', 'คนบ้า', 'แล้ว', 'โง่', 'มา', 'เป็น', 'ครู']"
1981950025799475306,twitter,post,https://x.com/takeitslow94_/status/1981950025799475306,text,2025-10-25T05:04:43.000Z,selenium_x_scraper_v1,หญิงล้วนปสดสุดๆ ขอบคุณตัวเองที่เติบโตมาได้ขนาดนี้นะ,หญิงล้วนปสดสุดๆ ขอบคุณตัวเองที่เติบโตมาได้ขนาดนี้นะ,2025-11-29 08:18:55,"['หญิง', 'ล้วน', 'ปสด', 'สุด', 'ๆ', ' ', 'ขอบคุณ', 'ตัวเอง', 'ที่', 'เติบ', 'โตมา', 'ได้ขนาด', 'นี้', 'นะ']"
1982042518905917944,twitter,post,https://x.com/gp79134496/status/1982042518905917944,text,2025-10-25T11:12:15.000Z,selenium_x_scraper_v1,รรนี่ก็ไม่ให้พูดคำว่าเอา ชีให้ใช่คำว่า ขอ กับคำว่ารับ,รรนี่ก็ไม่ให้พูดคำว่าเอา ชีให้ใช่คำว่า ขอ กับคำว่ารับ,2025-11-29 08:18:55,"['รร', 'นี่', 'ก็', 'ไม่', 'ให้', 'พูด', 'คำ', 'ว่า', 'เอา', ' ', 'ชี', 'ให้', 'ใช่', 'คำ', 'ว่า', ' ', 'ขอ', ' ', 'กับ', 'คำ', 'ว่า', 'รับ']"
1982334488387653937,twitter,post,https://x.com/thefox_iv/status/1982334488387653937,text,2025-10-26T06:32:26.000Z,selenium_x_scraper_v1,คนที่นึกถึงความหมายนั้น ในตอนที่ใช้ในช่วงเวลาอื่นนอกจากนั้นนี่ต้องหมกมุ่นนึกถึงเรื่องนั้นประมาณนึงมั้ย หรือยังไง ,คนที่นึกถึงความหมายนั้น ในตอนที่ใช้ในช่วงเวลาอื่นนอกจากนั้นนี่ต้องหมกมุ่นนึกถึงเรื่องนั้นประมาณนึงมั้ย หรือยังไง ,2025-11-29 08:18:55,"['คน', 'ที่', 'นึกถึง', 'ความหมาย', 'นั้น', ' ', 'ใน', 'ตอนที่', 'ใช้', 'ใน', 'ช่วงเวลา', 'อื่น', 'นอกจากนั้น', 'นี่', 'ต้อง', 'หมกมุ่น', 'นึกถึง', 'เรื่อง', 'นั้น', 'ประมาณ', 'นึง', 'มั้ย', ' ', 'หรือ', 'ยังไง']"
1981979487899398571,twitter,post,https://x.com/realtmm1133/status/1981979487899398571,text,2025-10-25T07:01:47.000Z,selenium_x_scraper_v1,อีครูพวกนี้มันเต็มปะ,อีครูพวกนี้มันเต็มปะ,2025-11-29 08:18:55,"['อี', 'ครู', 'พวก', 'นี้', 'มัน', 'เต็ม', 'ปะ']"
1981974390406570321,twitter,post,https://x.com/bbitchyx92/status/1981974390406570321,text,2025-10-25T06:41:32.000Z,selenium_x_scraper_v1,หญิงล้วนเราไม่มีค่ะ 555555555555 หญิงล้วนเรานี่เหมือนลิงลพกันหมด,หญิงล้วนเราไม่มีค่ะ 555555555555 หญิงล้วนเรานี่เหมือนลิงลพกันหมด,2025-11-29 08:18:55,"['หญิง', 'ล้วน', 'เรา', 'ไม่', 'มี', 'ค่ะ', ' ', 'หัวเราะ', ' ', 'หญิง', 'ล้วน', 'เรา', 'นี่', 'เหมือน', 'ลิง', 'ลพ', 'กัน', 'หมด']"
1981937798191239330,twitter,post,https://x.com/CharleslotteB/status/1981937798191239330,text,2025-10-25T04:16:08.000Z,selenium_x_scraper_v1,ใช้ไปเถอะครับ บริบทมันไม่ได้แปลกขนาดนั้นเลย,ใช้ไปเถอะครับ บริบทมันไม่ได้แปลกขนาดนั้นเลย,2025-11-29 08:18:55,"['ใช้', 'ไป', 'เถอะ', 'ครับ', ' ', 'บริบท', 'มัน', 'ไม่', 'ได้', 'แปลก', 'ขนาด', 'นั้น', 'เลย']"
1982488835184525402,twitter,post,https://x.com/TonnamPakee/status/1982488835184525402,text,2025-10-26T16:45:45.000Z,selenium_x_scraper_v1,มีใครคิดว่ากุจะเน้ดน้ำโซดาหรอ,มีใครคิดว่ากุจะเน้ดน้ำโซดาหรอ,2025-11-29 08:18:55,"['มี', 'ใคร', 'คิด', 'ว่า', 'กุ', 'จะ', 'เน้ด', 'น้ำ', 'โซดา', 'หรอ']"
1981940188705325116,twitter,post,https://x.com/c_calloncal/status/1981940188705325116,text,2025-10-25T04:25:38.000Z,selenium_x_scraper_v1,ไม่ใช่รร.ชั้นละ1 แต่ก็มีเรื่องเพี้ยนๆ อื่นยุบ้าง,ไม่ใช่รร.ชั้นละ1 แต่ก็มีเรื่องเพี้ยนๆ อื่นยุบ้าง,2025-11-29 08:18:55,"['ไม่', 'ใช่', 'รร.', 'ชั้น', 'ละ', '1', ' ', 'แต่', 'ก็', 'มีเรื่อง', 'เพี้ยน', 'ๆ', ' ', 'อื่น', 'ยุ', 'บ้าง']"
1982000695248371805,twitter,post,https://x.com/imyourjinni/status/1982000695248371805,text,2025-10-25T08:26:04.000Z,selenium_x_scraper_v1,ญล้วนเหมือนกัน เหตุผลนี้เลย ตอนนั้นเลยล้อกันสนุก 55555,ญล้วนเหมือนกัน เหตุผลนี้เลย ตอนนั้นเลยล้อกันสนุก 55555,2025-11-29 08:18:55,"['ญ', 'ล้วน', 'เหมือนกัน', ' ', 'เหตุผล', 'นี้', 'เลย', ' ', 'ตอนนั้น', 'เลย', 'ล้อ', 'กัน', 'สนุก', ' ', 'หัวเราะ']"
1981977988775493972,twitter,post,https://x.com/zppnj9/status/1981977988775493972,text,2025-10-25T06:55:50.000Z,selenium_x_scraper_v1,เฉลยเลยใครหมกหมุ่นกว่าเด็กสมัยนี้ที่ชอบว่ากัน,เฉลยเลยใครหมกหมุ่นกว่าเด็กสมัยนี้ที่ชอบว่ากัน,2025-11-29 08:18:55,"['เฉลย', 'เลย', 'ใคร', 'หมกหมุ่น', 'กว่า', 'เด็ก', 'สมัยนี้', 'ที่', 'ชอบ', 'ว่า', 'กัน']"
1981940323589976178,twitter,post,https://x.com/Amimm_Pich/status/1981940323589976178,text,2025-10-25T04:26:10.000Z,selenium_x_scraper_v1,อันนี้ครูหมกมุ่นเองละ,อันนี้ครูหมกมุ่นเองละ,2025-11-29 08:18:55,"['อันนี้', 'ครู', 'หมกมุ่น', 'เอง', 'ละ']"
1981952757226787110,twitter,post,https://x.com/PON_JIPQN/status/1981952757226787110,text,2025-10-25T05:15:34.000Z,selenium_x_scraper_v1,กลับกันถ้าผช.เล่นมุขอุบาทพูดๆเอาๆๆๆใส่ดลายเป็นแค่เรื่องตลก,กลับกันถ้าผช.เล่นมุขอุบาทพูดๆเอาๆๆๆใส่ดลายเป็นแค่เรื่องตลก,2025-11-29 08:18:55,"['กลับกัน', 'ถ้า', 'ผช.', 'เล่น', 'มุข', 'อุบาท', 'พูด', 'ๆ', 'เอา', 'ๆๆๆ', 'ใส่', 'ด', 'ลาย', 'เป็น', 'แค่', 'เรื่องตลก']"
1981965636587917421,twitter,post,https://x.com/2actartsmartdog/status/1981965636587917421,text,2025-10-25T06:06:45.000Z,selenium_x_scraper_v1,เมื่อคิดให้ดีโลกนี้ประหลาด,เมื่อคิดให้ดีโลกนี้ประหลาด,2025-11-29 08:18:55,"['เมื่อ', 'คิด', 'ให้', 'ดี', 'โลก', 'นี้', 'ประหลาด']"
