id,platform,platform_type,url,content_type,timestamp,scraper_module,text,raw_text,scrape_date,tokens
1987502054068408495,twitter,post,https://x.com/doy_koo/status/1987502054068408495,text,2025-11-09T12:46:30.000Z,selenium_x_scraper_v1,ใครไม่ซื้อก็ปล่อยผ่านไม่น่าจะถูกนะ คุณเป็นสื่อ เป็น นสด ต้องคิดด้วยว่าสิ่งที่ทำมันมี effects ต่อสังคมยังไง จรรยาบรรณอ่ะ,ใครไม่ซื้อก็ปล่อยผ่านไม่น่าจะถูกนะ คุณเป็นสื่อ เป็น นสด ต้องคิดด้วยว่าสิ่งที่ทำมันมี effects ต่อสังคมยังไง จรรยาบรรณอ่ะ,2025-11-29 08:18:55,"['ใคร', 'ไม่', 'ซื้อ', 'ก็', 'ปล่อย', 'ผ่าน', 'ไม่', 'น่าจะ', 'ถูก', 'นะ', ' ', 'คุณ', 'เป็น', 'สื่อ', ' ', 'เป็น', ' ', 'นสด', ' ', 'ต้อง', 'คิด', 'ด้วยว่า', 'สิ่ง', 'ที่', 'ทำ', 'มัน', 'มี', ' ', 'effects', ' ', 'ต่อ', 'สังคม', 'ยังไง', ' ', 'จรรยาบรรณ', 'อ่ะ']"
1987495642361672152,twitter,post,https://x.com/J33DS00D/status/1987495642361672152,text,2025-11-09T12:21:01.000Z,selenium_x_scraper_v1,หากินกับอัตลักษณ์คนอื่นแล้วบอกให้ช่างมัน :face_with_bags_under_eyes:,หากินกับอัตลักษณ์คนอื่นแล้วบอกให้ช่างมัน 🫩,2025-11-29 08:18:55,"['หากิน', 'กับ', 'อัตลักษณ์', 'คนอื่น', 'แล้ว', 'บอก', 'ให้', 'ช่างมัน', ' ', 'face', ' ', 'with', ' ', 'bags', ' ', 'under', ' ', 'eyes']"
1987464052516487208,twitter,post,https://x.com/rabby_bizx/status/1987464052516487208,text,2025-11-09T10:15:30.000Z,selenium_x_scraper_v1,เห็นยังว่ามันสนใจคอมมูเควียที่ได้รับผลกระทบกันที่ไหน ทั้ง ๆ ที่เอาอัตลักษณ์ชาวบ้านมาหากิน จะเอาแต่ความสุขตัวเองบนความทุกข์คนอื่น,เห็นยังว่ามันสนใจคอมมูเควียที่ได้รับผลกระทบกันที่ไหน ทั้ง ๆ ที่เอาอัตลักษณ์ชาวบ้านมาหากิน จะเอาแต่ความสุขตัวเองบนความทุกข์คนอื่น,2025-11-29 08:18:55,"['เห็น', 'ยัง', 'ว่า', 'มัน', 'สนใจ', 'คอม', 'มูเควีย', 'ที่', 'ได้รับ', 'ผลกระทบ', 'กัน', 'ที่ไหน', ' ', 'ทั้ง ๆ ที่', 'เอา', 'อัตลักษณ์', 'ชาวบ้าน', 'มา', 'หากิน', ' ', 'จะ', 'เอาแต่', 'ความสุข', 'ตัวเอง', 'บน', 'ความทุกข์', 'คนอื่น']"
1987658517235511374,twitter,post,https://x.com/CrtlAlt_Del/status/1987658517235511374,text,2025-11-09T23:08:14.000Z,selenium_x_scraper_v1,สมที่เขาว่าสาววายสมองไหล,สมที่เขาว่าสาววายสมองไหล,2025-11-29 08:18:55,"['สม', 'ที่', 'เขา', 'ว่า', 'สาว', 'วาย', 'สมองไหล']"
1987657246831251493,twitter,post,https://x.com/bluebirdprkbgm/status/1987657246831251493,text,2025-11-09T23:03:11.000Z,selenium_x_scraper_v1,นี่ก็จะฟินอย่างเดียวเลย,นี่ก็จะฟินอย่างเดียวเลย,2025-11-29 08:18:55,"['นี่', 'ก็', 'จะ', 'ฟิน', 'อย่าง', 'เดียว', 'เลย']"
1987471329386541212,twitter,post,https://x.com/_fishnchip_/status/1987471329386541212,text,2025-11-09T10:44:25.000Z,selenium_x_scraper_v1,อยากเปนตำรวจสังคมตามบอกทุกคู่ที่แอคนี้ติ่งว่าควายเบทจนแอคนี้อกแตกงะ,อยากเปนตำรวจสังคมตามบอกทุกคู่ที่แอคนี้ติ่งว่าควายเบทจนแอคนี้อกแตกงะ,2025-11-29 08:18:55,"['อยาก', 'เปน', 'ตำรวจ', 'สังคม', 'ตาม', 'บอก', 'ทุก', 'คู่', 'ที่', 'แอ', 'ค', 'นี้', 'ติ่ง', 'ว่า', 'ควาย', 'เบทจน', 'แอ', 'ค', 'นี้', 'อกแตก', 'งะ']"
1987460692040175945,twitter,post,https://x.com/Lin49lll/status/1987460692040175945,text,2025-11-09T10:02:08.000Z,selenium_x_scraper_v1,Girl…what?,Girl…what?,2025-11-29 08:18:55,"['girl', ' ', 'what', '?']"
1987487771796324721,twitter,post,https://x.com/wasseryharp/status/1987487771796324721,text,2025-11-09T11:49:45.000Z,selenium_x_scraper_v1,มันเริ่มจาก ผกก ทีมงาน นักแสดง ไม่มีวิจารณญาณเลยป่ะ?,มันเริ่มจาก ผกก ทีมงาน นักแสดง ไม่มีวิจารณญาณเลยป่ะ?,2025-11-29 08:18:55,"['มัน', 'เริ่ม', 'จาก', ' ', 'ผก', 'ก', ' ', 'ทีมงาน', ' ', 'นักแสดง', ' ', 'ไม่', 'มี', 'วิจารณญาณ', 'เลย', 'ป่ะ', '?']"
1987498858470138248,twitter,post,https://x.com/kw6735212855621/status/1987498858470138248,text,2025-11-09T12:33:48.000Z,selenium_x_scraper_v1,ก็ด่าพวกเพี้ยนๆในเวลาว่างๆมันสนุกดี จะเดินผ่านทำไมล่ะ,ก็ด่าพวกเพี้ยนๆในเวลาว่างๆมันสนุกดี จะเดินผ่านทำไมล่ะ,2025-11-29 08:18:55,"['ก็', 'ด่า', 'พวก', 'เพี้ยน', 'ๆ', 'ใน', 'เวลาว่าง', 'ๆ', 'มัน', 'สนุก', 'ดี', ' ', 'จะ', 'เดินผ่าน', 'ทำไม', 'ล่ะ']"
1987503384837189984,twitter,post,https://x.com/yuyeeyeeyu46/status/1987503384837189984,text,2025-11-09T12:51:47.000Z,selenium_x_scraper_v1,นึกถึงทวิตคนเบื้องหลังค่ายส้ม,นึกถึงทวิตคนเบื้องหลังค่ายส้ม,2025-11-29 08:18:55,"['นึกถึง', 'ทวิ', 'ตคน', 'เบื้องหลัง', 'ค่าย', 'ส้ม']"
1987488892916998531,twitter,post,https://x.com/01_penh/status/1987488892916998531,text,2025-11-09T11:54:12.000Z,selenium_x_scraper_v1,55555,55555,2025-11-29 08:18:55,['หัวเราะ']
1987450832120639641,twitter,post,https://x.com/unpaindebonheur/status/1987450832120639641,text,2025-11-09T09:22:58.000Z,selenium_x_scraper_v1,โลกแตกได้ยัง,โลกแตกได้ยัง,2025-11-29 08:18:55,"['โลก', 'แตก', 'ได้', 'ยัง']"
1987568256534872480,twitter,post,https://x.com/Ur3a3a/status/1987568256534872480,text,2025-11-09T17:09:34.000Z,selenium_x_scraper_v1,"1. เค้าอยู่ใน circle นั้น
2. ผู้ชายธงแดงรู้วิธีทรีตผู้หญิง 5555","1. เค้าอยู่ใน circle นั้น
2. ผู้ชายธงแดงรู้วิธีทรีตผู้หญิง 5555",2025-11-29 08:18:55,"['1', '.', ' ', 'เค้า', 'อยู่', 'ใน', ' ', 'circle', ' ', 'นั้น', ' ', '2', '.', ' ', 'ผู้', 'ชายธง', 'แดง', 'รู้', 'วิธี', 'ท', 'รีต', 'ผู้หญิง', ' ', 'หัวเราะ']"
1987586742837510166,twitter,post,https://x.com/rubychan_xz/status/1987586742837510166,text,2025-11-09T18:23:01.000Z,selenium_x_scraper_v1,พวกนักร้องนักดนตรี คนพวกนี้คารมณ์ดี ตลกธรรมชาติ อยู่ด้วยตลกมากกว่าเครียด เอาใจเก่ง หล่อ เฟรนลี่เข้ากับคนรอบข้างเราง่าย,พวกนักร้องนักดนตรี คนพวกนี้คารมณ์ดี ตลกธรรมชาติ อยู่ด้วยตลกมากกว่าเครียด เอาใจเก่ง หล่อ เฟรนลี่เข้ากับคนรอบข้างเราง่าย,2025-11-29 08:18:55,"['พวก', 'นักร้อง', 'นักดนตรี', ' ', 'คน', 'พวก', 'นี้', 'คา', 'รมณ์', 'ดี', ' ', 'ตลก', 'ธรรมชาติ', ' ', 'อยู่', 'ด้วย', 'ตลก', 'มากกว่า', 'เครียด', ' ', 'เอาใจ', 'เก่ง', ' ', 'หล่อ', ' ', 'เฟรน', 'ลี่', 'เข้ากับ', 'คน', 'รอบข้าง', 'เรา', 'ง่าย']"
1987699042101629208,twitter,post,https://x.com/nannyniniloveDD/status/1987699042101629208,text,2025-11-10T01:49:15.000Z,selenium_x_scraper_v1,พูดถึงดีกรีผู้ชายก็พอตัวอยู่นะ ผลงานก็ระดับนึงอยู่ก็ต้องยอมรับว่านางยังอยู่ในเกณฑ์ที่มีความสามารถและมีเงิน ซึ่งถ้ามองจากลุคภายนอกฮีก็ยังได้อยู่คือมันไม่ใช่ทุกคนที่จะรู้สึกอี๋กับเรื่องอดีตที่ผ่านมาอะ แต่กุอี๋,พูดถึงดีกรีผู้ชายก็พอตัวอยู่นะ ผลงานก็ระดับนึงอยู่ก็ต้องยอมรับว่านางยังอยู่ในเกณฑ์ที่มีความสามารถและมีเงิน ซึ่งถ้ามองจากลุคภายนอกฮีก็ยังได้อยู่คือมันไม่ใช่ทุกคนที่จะรู้สึกอี๋กับเรื่องอดีตที่ผ่านมาอะ แต่กุอี๋,2025-11-29 08:18:55,"['พูดถึง', 'ดีกรี', 'ผู้ชาย', 'ก็', 'พอตัว', 'อยู่', 'นะ', ' ', 'ผลงาน', 'ก็', 'ระดับ', 'นึง', 'อยู่', 'ก็', 'ต้อง', 'ยอมรับ', 'ว่า', 'นาง', 'ยัง', 'อยู่ในเกณฑ์', 'ที่', 'มี', 'ความสามารถ', 'และ', 'มีเงิน', ' ', 'ซึ่ง', 'ถ้า', 'มอง', 'จาก', 'ลุค', 'ภายนอก', 'ฮี', 'ก็', 'ยัง', 'ได้', 'อยู่', 'คือ', 'มัน', 'ไม่', 'ใช่', 'ทุกคน', 'ที่จะ', 'รู้สึก', 'อี๋', 'กับ', 'เรื่อง', 'อดีต', 'ที่ผ่านมา', 'อะ', ' ', 'แต่', 'กุ', 'อี๋']"
1987602567300518220,twitter,post,https://x.com/Makenz_aholiC/status/1987602567300518220,text,2025-11-09T19:25:54.000Z,selenium_x_scraper_v1,แกงค์เขาเวลาทำงานมีคอนเสิร์ต ออกงาน ปาร์ตี้ ดีเจ มันไม่ได้มีแค่งานอันเดอร์กราวด์ ร้านเหล้าหรือเฟส พวกนี้รับงานปาร์ตี้ของพวกอัพเปอร์คลาสกันตลอดด้วย อาจป็นสาเหตุหนึ่งที่คลุกคลีกับคนระดับพวกนี้ คอนเนคชั่นกันเป็นทอด ๆ คนรวยอยู่กับสังคมคนรวยมันจูนกันเองอยู่ละล่ะ นิสัยอะไรก็อีกเรื่อง,แกงค์เขาเวลาทำงานมีคอนเสิร์ต ออกงาน ปาร์ตี้ ดีเจ มันไม่ได้มีแค่งานอันเดอร์กราวด์ ร้านเหล้าหรือเฟส พวกนี้รับงานปาร์ตี้ของพวกอัพเปอร์คลาสกันตลอดด้วย อาจป็นสาเหตุหนึ่งที่คลุกคลีกับคนระดับพวกนี้ คอนเนคชั่นกันเป็นทอด ๆ คนรวยอยู่กับสังคมคนรวยมันจูนกันเองอยู่ละล่ะ นิสัยอะไรก็อีกเรื่อง,2025-11-29 08:18:55,"['แกงค์', 'เขา', 'เวลาทำงาน', 'มี', 'คอนเสิร์ต', ' ', 'ออกงาน', ' ', 'ปาร์ตี้', ' ', 'ดีเจ', ' ', 'มัน', 'ไม่', 'ได้', 'มี', 'แค่', 'งาน', 'อันเดอร์', 'กราวด์', ' ', 'ร้านเหล้า', 'หรือ', 'เฟส', ' ', 'พวก', 'นี้', 'รับงาน', 'ปาร์ตี้', 'ของ', 'พวก', 'อัพ', 'เปอร์', 'คลาส', 'กัน', 'ตลอด', 'ด้วย', ' ', 'อาจ', 'ป็น', 'สาเหตุ', 'หนึ่ง', 'ที่', 'คลุกคลี', 'กับ', 'คน', 'ระดับ', 'พวก', 'นี้', ' ', 'คอนเนค', 'ชั่น', 'กัน', 'เป็น', 'ทอด', ' ', 'ๆ', ' ', 'คนรวย', 'อยู่', 'กับ', 'สังคม', 'คนรวย', 'มัน', 'จูน', 'กันเอง', 'อยู่', 'ละ', 'ล่ะ', ' ', 'นิสัย', 'อะไร', 'ก็', 'อีก', 'เรื่อง']"
1987606639143448670,twitter,post,https://x.com/sogoodtobesad/status/1987606639143448670,text,2025-11-09T19:42:05.000Z,selenium_x_scraper_v1,"จากใจคนเคยคุยกับดีเจในคลับ
Love bombing เก่ง ทุ่มหนัก(ในช่วงแรก) อะไรก็เธอค้าบ เธออยากให้เค้าเปิดเพลงอะไรเค้าจะเปิดให้เธอคนเดียวเลย เนี่ยสาวมายืนหน้าบูทเยอะมากแต่เค้าคิดถึงเธอคนเดียว สวมบทเสือร้ายที่กลายเป็นไอต้าวแมวน้อยของเธอคนเดียว กุแพ้ยับบบบบ 555555555","จากใจคนเคยคุยกับดีเจในคลับ
Love bombing เก่ง ทุ่มหนัก(ในช่วงแรก) อะไรก็เธอค้าบ เธออยากให้เค้าเปิดเพลงอะไรเค้าจะเปิดให้เธอคนเดียวเลย เนี่ยสาวมายืนหน้าบูทเยอะมากแต่เค้าคิดถึงเธอคนเดียว สวมบทเสือร้ายที่กลายเป็นไอต้าวแมวน้อยของเธอคนเดียว กุแพ้ยับบบบบ 555555555",2025-11-29 08:18:55,"['จาก', 'ใจ', 'คน', 'เคย', 'คุย', 'กับ', 'ดีเจ', 'ใน', 'คลับ', ' ', 'love', ' ', 'bombing', ' ', 'เก่ง', ' ', 'ทุ่ม', 'หนัก', ' ', 'ใน', 'ช่วงแรก', ' ', 'อะไร', 'ก็', 'เธอ', 'ค้าบ', ' ', 'เธอ', 'อยาก', 'ให้', 'เค้า', 'เปิด', 'เพลง', 'อะไร', 'เค้า', 'จะ', 'เปิด', 'ให้', 'เธอ', 'คนเดียว', 'เลย', ' ', 'เนี่ย', 'สาว', 'มา', 'ยืน', 'หน้า', 'บูท', 'เยอะ', 'มาก', 'แต่', 'เค้า', 'คิดถึง', 'เธอ', 'คนเดียว', ' ', 'สวมบท', 'เสือ', 'ร้าย', 'ที่', 'กลายเป็น', 'ไอ', 'ต้าว', 'แมว', 'น้อย', 'ของ', 'เธอ', 'คนเดียว', ' ', 'กุ', 'แพ้', 'ยับ', 'บบบบ', ' ', 'หัวเราะ']"
1987600002051661910,twitter,post,https://x.com/EveyouryvesYves/status/1987600002051661910,text,2025-11-09T19:15:42.000Z,selenium_x_scraper_v1,พวกคนเจ้าชู้bad boyมันรู้ว่าผู้หญิงชอบคำพูดแบบไหน ทำยังไงให้ผู้หญิงรู้สึกดี จะตามจีบจนกว่าจะได้มา ทำตัวว่ารักเธอมาก ผญที่หัวอ่อนจะตามไม่ทัน ว้าวbad boyหยุดที่เรา ประทับใจ จบโดนผชทิ้ง,พวกคนเจ้าชู้bad boyมันรู้ว่าผู้หญิงชอบคำพูดแบบไหน ทำยังไงให้ผู้หญิงรู้สึกดี จะตามจีบจนกว่าจะได้มา ทำตัวว่ารักเธอมาก ผญที่หัวอ่อนจะตามไม่ทัน ว้าวbad boyหยุดที่เรา ประทับใจ จบโดนผชทิ้ง,2025-11-29 08:18:55,"['พวก', 'คนเจ้าชู้', 'bad', ' ', 'boy', 'มัน', 'รู้', 'ว่า', 'ผู้หญิง', 'ชอบ', 'คำพูด', 'แบบ', 'ไหน', ' ', 'ทำ', 'ยังไง', 'ให้', 'ผู้หญิง', 'รู้สึก', 'ดี', ' ', 'จะ', 'ตาม', 'จีบ', 'จนกว่า', 'จะ', 'ได้มา', ' ', 'ทำตัว', 'ว่า', 'รัก', 'เธอ', 'มาก', ' ', 'ผญ', 'ที่', 'หัวอ่อน', 'จะ', 'ตาม', 'ไม่', 'ทัน', ' ', 'ว้าว', 'bad', ' ', 'boy', 'หยุด', 'ที่', 'เรา', ' ', 'ประทับใจ', ' ', 'จบ', 'โดน', 'ผช', 'ทิ้ง']"
1987582860828856570,twitter,post,https://x.com/Fluffykiromu/status/1987582860828856570,text,2025-11-09T18:07:36.000Z,selenium_x_scraper_v1,คนพวกนี้รู้วิธีทรีตผู้หญิง หล่อ มีหน้ามีตา แค่นั้นแหละ I CAN FIX HIM,คนพวกนี้รู้วิธีทรีตผู้หญิง หล่อ มีหน้ามีตา แค่นั้นแหละ I CAN FIX HIM,2025-11-29 08:18:55,"['คน', 'พวก', 'นี้', 'รู้', 'วิธี', 'ท', 'รีต', 'ผู้หญิง', ' ', 'หล่อ', ' ', 'มีหน้ามีตา', ' ', 'แค่', 'นั้นแหละ', ' ', 'i', ' ', 'can', ' ', 'fix', ' ', 'him']"
1987702179831202030,twitter,post,https://x.com/wat_kele/status/1987702179831202030,text,2025-11-10T02:01:44.000Z,selenium_x_scraper_v1,เอาจริงผู้หญิงหลายคนก็ชอบผู้ชายทรงนี้ ไม่ต้องถึงพวกไฮโซหรอก คนอย่างเราๆเห็นเจ็บกันมาเยอะละ กับคำว่าไอแคนฟิกฮิม,เอาจริงผู้หญิงหลายคนก็ชอบผู้ชายทรงนี้ ไม่ต้องถึงพวกไฮโซหรอก คนอย่างเราๆเห็นเจ็บกันมาเยอะละ กับคำว่าไอแคนฟิกฮิม,2025-11-29 08:18:55,"['เอาจริง', 'ผู้หญิง', 'หลาย', 'คน', 'ก็', 'ชอบ', 'ผู้ชาย', 'ทรง', 'นี้', ' ', 'ไม่ต้อง', 'ถึง', 'พวก', 'ไฮโซ', 'หรอก', ' ', 'คน', 'อย่าง', 'เรา', 'ๆ', 'เห็น', 'เจ็บ', 'กัน', 'มา', 'เยอะ', 'ละ', ' ', 'กับ', 'คำ', 'ว่า', 'ไอ', 'แคน', 'ฟิก', 'ฮิ', 'ม']"
1987593134386368552,twitter,post,https://x.com/Ally222222_/status/1987593134386368552,text,2025-11-09T18:48:25.000Z,selenium_x_scraper_v1,ตานางหวานมาก ยิ้มกรุ่มกริ่มเก่ง จ้อง ผญ 10คนต้องมีสัก6-7คนเลยแระที่เคลิ้ม ยังไม่รวมคารมอีกนะ,ตานางหวานมาก ยิ้มกรุ่มกริ่มเก่ง จ้อง ผญ 10คนต้องมีสัก6-7คนเลยแระที่เคลิ้ม ยังไม่รวมคารมอีกนะ,2025-11-29 08:18:55,"['ตา', 'นาง', 'หวาน', 'มาก', ' ', 'ยิ้ม', 'กรุ่ม', 'กริ่ม', 'เก่ง', ' ', 'จ้อง', ' ', 'ผญ', ' ', '10', 'คน', 'ต้อง', 'มี', 'สัก', '6', ' ', '7', 'คน', 'เลย', 'แระ', 'ที่', 'เคลิ้ม', ' ', 'ยัง', 'ไม่', 'รวม', 'คารม', 'อีก', 'นะ']"
1987600869655969899,twitter,post,https://x.com/doofreeeee/status/1987600869655969899,text,2025-11-09T19:19:09.000Z,selenium_x_scraper_v1,เคยได้ยินประโยคว่า “คารมเป็นต่อ รูปหล่อเป็นรอง” ไหม แต่นี่เขาก็มีทั้งคารมและหน้าตาก็ไม่ได้ขี้เหร่,เคยได้ยินประโยคว่า “คารมเป็นต่อ รูปหล่อเป็นรอง” ไหม แต่นี่เขาก็มีทั้งคารมและหน้าตาก็ไม่ได้ขี้เหร่,2025-11-29 08:18:55,"['เคย', 'ได้ยิน', 'ประโยค', 'ว่า', ' ', 'คารม', 'เป็นต่อ', ' ', 'รูปหล่อ', 'เป็นรอง', ' ', 'ไหม', ' ', 'แต่', 'นี่', 'เขา', 'ก็', 'มี', 'ทั้ง', 'คารม', 'และ', 'หน้าตา', 'ก็', 'ไม่', 'ได้', 'ขี้เหร่']"
1987829138552713704,twitter,post,https://x.com/naninami65775/status/1987829138552713704,text,2025-11-10T10:26:13.000Z,selenium_x_scraper_v1,ด่าผู้หญิงในผับด้วยนี่คนนี้,ด่าผู้หญิงในผับด้วยนี่คนนี้,2025-11-29 08:18:55,"['ด่า', 'ผู้หญิง', 'ใน', 'ผับ', 'ด้วย', 'นี่', 'คน', 'นี้']"
1987707355908452745,twitter,post,https://x.com/toyoil23/status/1987707355908452745,text,2025-11-10T02:22:18.000Z,selenium_x_scraper_v1,รวย,รวย,2025-11-29 08:18:55,['รวย']
