id,platform,platform_type,url,content_type,timestamp,scraper_module,text,raw_text,scrape_date,tokens
1980903127491703165,twitter,post,https://x.com/thekingofotaku/status/1980903127491703165,text,2025-10-22T07:44:43.000Z,selenium_x_scraper_v1,"เออ 
ในเมื่อพูดดีๆไม่ฟัง
พวกมึงก็ต้องใช้ไม้เรียวเท่านั้น","เออ 
ในเมื่อพูดดีๆไม่ฟัง
พวกมึงก็ต้องใช้ไม้เรียวเท่านั้น",2025-11-29 08:18:55,"['เออ', ' ', 'ใน', 'เมื่อ', 'พูด', 'ดี', 'ๆ', 'ไม่', 'ฟัง', ' ', 'พวก', 'มึง', 'ก็', 'ต้อง', 'ใช้', 'ไม้เรียว', 'เท่านั้น']"
1980901954412015938,twitter,post,https://x.com/ru5fax_/status/1980901954412015938,text,2025-10-22T07:40:03.000Z,selenium_x_scraper_v1,มึงควรไปเขียนวิพากษ์และสำนึกผิดกับงานเขียนบัดซบของตัวเองที่ทำร้ายจิตใจคนอ่านคนอื่นๆแบบนั้น เอาจริงดิ มึงไม่รู้สึกสงสารและไม่รู้สึกผิดเลย??? น่าแปลกใจที่ระบบการศึกษาที่มึงผ่านมาไม่ได้สอนให้มึงมีมโนธรรมสำนึก มนุษยธรรม และความเห็นใจเพื่อนมนุษย์เลย,มึงควรไปเขียนวิพากษ์และสำนึกผิดกับงานเขียนบัดซบของตัวเองที่ทำร้ายจิตใจคนอ่านคนอื่นๆแบบนั้น เอาจริงดิ มึงไม่รู้สึกสงสารและไม่รู้สึกผิดเลย??? น่าแปลกใจที่ระบบการศึกษาที่มึงผ่านมาไม่ได้สอนให้มึงมีมโนธรรมสำนึก มนุษยธรรม และความเห็นใจเพื่อนมนุษย์เลย,2025-11-29 08:18:55,"['มึง', 'ควร', 'ไป', 'เขียน', 'วิพากษ์', 'และ', 'สำนึกผิด', 'กับ', 'งานเขียน', 'บัดซบ', 'ของ', 'ตัวเอง', 'ที่', 'ทำร้าย', 'จิตใจ', 'คนอ่าน', 'คนอื่นๆ', 'แบบ', 'นั้น', ' ', 'เอาจริง', 'ดิ', ' ', 'มึง', 'ไม่', 'รู้สึก', 'สงสาร', 'และ', 'ไม่', 'รู้สึก', 'ผิด', 'เลย', '?', ' ', 'น่าแปลกใจ', 'ที่', 'ระบบ', 'การศึกษา', 'ที่', 'มึง', 'ผ่าน', 'มา', 'ไม่', 'ได้', 'สอน', 'ให้', 'มึง', 'มีมโนธรรม', 'สำนึก', ' ', 'มนุษยธรรม', ' ', 'และ', 'ความเห็นใจ', 'เพื่อนมนุษย์', 'เลย']"
1980902675437990069,twitter,post,https://x.com/thekingofotaku/status/1980902675437990069,text,2025-10-22T07:42:55.000Z,selenium_x_scraper_v1,"เพื่อ?
มันเป็นสิทธิของกู 
อย่าเสร่อ","เพื่อ?
มันเป็นสิทธิของกู 
อย่าเสร่อ",2025-11-29 08:18:55,"['เพื่อ', '?', ' ', 'มัน', 'เป็น', 'สิทธิ', 'ของ', 'กู', ' ', 'อย่า', 'เสร่อ']"
1980901460755067372,twitter,post,https://x.com/ru5fax_/status/1980901460755067372,text,2025-10-22T07:38:06.000Z,selenium_x_scraper_v1,มึงกำลังเหมารวมlgbtq+ทั้งหมด?? เห้ย ความเห็นใจมันต้องมีให้มนุษย์ด้วยกันอยู่แล้ว กูสงสารฝรั่งที่ถูกหลอกได้ แล้วมึงหละ สงสารlgbtq+ ที่ต้องมาอ่านแนวคิดที่ทำลายจิตใจเขาขนาดนี้ มึงสงสารเขาบ้างไหมวะ?,มึงกำลังเหมารวมlgbtq+ทั้งหมด?? เห้ย ความเห็นใจมันต้องมีให้มนุษย์ด้วยกันอยู่แล้ว กูสงสารฝรั่งที่ถูกหลอกได้ แล้วมึงหละ สงสารlgbtq+ ที่ต้องมาอ่านแนวคิดที่ทำลายจิตใจเขาขนาดนี้ มึงสงสารเขาบ้างไหมวะ?,2025-11-29 08:18:55,"['มึง', 'กำลัง', 'เหมา', 'รวม', 'lgbtq', ' ', 'ทั้งหมด', '?', ' ', 'เห้ย', ' ', 'ความเห็นใจ', 'มัน', 'ต้อง', 'มี', 'ให้', 'มนุษย์', 'ด้วยกัน', 'อยู่แล้ว', ' ', 'กู', 'สงสาร', 'ฝรั่ง', 'ที่', 'ถูก', 'หลอก', 'ได้', ' ', 'แล้ว', 'มึง', 'หละ', ' ', 'สงสาร', 'lgbtq', ' ', 'ที่', 'ต้อง', 'มา', 'อ่าน', 'แนวคิด', 'ที่', 'ทำลาย', 'จิตใจ', 'เขา', 'ขนาด', 'นี้', ' ', 'มึง', 'สงสาร', 'เขา', 'บ้าง', 'ไหม', 'วะ', '?']"
1980902536640098780,twitter,post,https://x.com/thekingofotaku/status/1980902536640098780,text,2025-10-22T07:42:22.000Z,selenium_x_scraper_v1,"ช่วยไม่ได้ กูไม่ได้ใจดีขนาดนั้น 
หมดความอดทนกับพวกมึงแล้ว","ช่วยไม่ได้ กูไม่ได้ใจดีขนาดนั้น 
หมดความอดทนกับพวกมึงแล้ว",2025-11-29 08:18:55,"['ช่วยไม่ได้', ' ', 'กู', 'ไม่', 'ได้', 'ใจดี', 'ขนาด', 'นั้น', ' ', 'หมด', 'ความอดทน', 'กับ', 'พวก', 'มึง', 'แล้ว']"
1980892783377535434,twitter,post,https://x.com/ru5fax_/status/1980892783377535434,text,2025-10-22T07:03:37.000Z,selenium_x_scraper_v1,มึงไม่ใช่ มึงเป็นไก่งวงที่ไม่ฉลาดเสียเท่าไหร่,มึงไม่ใช่ มึงเป็นไก่งวงที่ไม่ฉลาดเสียเท่าไหร่,2025-11-29 08:18:55,"['มึง', 'ไม่', 'ใช่', ' ', 'มึง', 'เป็น', 'ไก่งวง', 'ที่', 'ไม่', 'ฉลาด', 'เสีย', 'เท่าไหร่']"
1980892987803787489,twitter,post,https://x.com/thekingofotaku/status/1980892987803787489,text,2025-10-22T07:04:26.000Z,selenium_x_scraper_v1,"ไก่งวง?
มึงด่าคนฝรั่งเศส ที่โคตรลิเบอรัลว่าไม่ฉลาด?","ไก่งวง?
มึงด่าคนฝรั่งเศส ที่โคตรลิเบอรัลว่าไม่ฉลาด?",2025-11-29 08:18:55,"['ไก่งวง', '?', ' ', 'มึง', 'ด่า', 'คน', 'ฝรั่งเศส', ' ', 'ที่', 'โคตร', 'ลิเบอรัล', 'ว่า', 'ไม่', 'ฉลาด', '?']"
1980588250881515680,twitter,post,https://x.com/EJanNews/status/1980588250881515680,text,2025-10-21T10:53:31.000Z,selenium_x_scraper_v1,"“ฮุนเซน” ไม่ปลื้ม อินฟลูฯ เขมร ทำคอนเทนต์เผาสินค้าไทย 
หลังจากเห็นคลิปคอนเทนต์ดังกล่าว สมเด็จฯ ฮุน เซน ประธานวุฒิสภากัมพูชา ก็ได้โพสต์ข้อความในเฟซบุ๊ก “Samdech Hun Sen of Cambodia” วานนี้ (20 ต.ค.68) ระบุว่า…

“ผมเพิ่งดูวิดีโอของกลุ่มที่นำโดยคุณ Ko1","“ฮุนเซน” ไม่ปลื้ม อินฟลูฯ เขมร ทำคอนเทนต์เผาสินค้าไทย 
หลังจากเห็นคลิปคอนเทนต์ดังกล่าว สมเด็จฯ ฮุน เซน ประธานวุฒิสภากัมพูชา ก็ได้โพสต์ข้อความในเฟซบุ๊ก “Samdech Hun Sen of Cambodia” วานนี้ (20 ต.ค.68) ระบุว่า…

“ผมเพิ่งดูวิดีโอของกลุ่มที่นำโดยคุณ Ko1",2025-11-29 08:18:55,"['ฮุนเซน', ' ', 'ไม่', 'ปลื้ม', ' ', 'อิน', 'ฟลูฯ', ' ', 'เขมร', ' ', 'ทำ', 'คอนเทนต์', 'เผา', 'สินค้า', 'ไทย', ' ', 'หลังจาก', 'เห็น', 'คลิป', 'คอนเทนต์', 'ดังกล่าว', ' ', 'สมเด็จฯ', ' ', 'ฮุน เซน', ' ', 'ประธาน', 'วุฒิสภา', 'กัมพูชา', ' ', 'ก็ได้', 'โพสต์', 'ข้อ', 'ความใน', 'เฟซบุ๊ก', ' ', 'samdech', ' ', 'hun', ' ', 'sen', ' ', 'of', ' ', 'cambodia', ' ', 'วาน', 'นี้', ' ', '20', ' ', 'ต.ค.', '68', ' ', 'ระบุ', 'ว่า', ' ', 'ผม', 'เพิ่ง', 'ดู', 'วิดีโอ', 'ของ', 'กลุ่ม', 'ที่', 'นำ', 'โดย', 'คุณ', ' ', 'ko', '1']"
1980892712376393947,twitter,post,https://x.com/thekingofotaku/status/1980892712376393947,text,2025-10-22T07:03:20.000Z,selenium_x_scraper_v1,"ฮุนเซนมันก็พูดถูก ถูกต้องในตรรกะ
แต่ประชาชนกัมพูชามันโง่น่ะดีแล้ว
ปล่อยให้มันโง่ไป","ฮุนเซนมันก็พูดถูก ถูกต้องในตรรกะ
แต่ประชาชนกัมพูชามันโง่น่ะดีแล้ว
ปล่อยให้มันโง่ไป",2025-11-29 08:18:55,"['ฮุนเซน', 'มัน', 'ก็', 'พูด', 'ถูก', ' ', 'ถูกต้อง', 'ใน', 'ตรรกะ', ' ', 'แต่', 'ประชาชน', 'กัมพูชา', 'มัน', 'โง่', 'น่ะ', 'ดีแล้ว', ' ', 'ปล่อย', 'ให้', 'มัน', 'โง่', 'ไป']"
1980891289198707074,twitter,post,https://x.com/ru5fax_/status/1980891289198707074,text,2025-10-22T06:57:41.000Z,selenium_x_scraper_v1,กูคือประชาชน ที่จะต่อสู้กับพวกขวาจัดหน้าโง่ล้าสมัยแบบมึง,กูคือประชาชน ที่จะต่อสู้กับพวกขวาจัดหน้าโง่ล้าสมัยแบบมึง,2025-11-29 08:18:55,"['กู', 'คือ', 'ประชาชน', ' ', 'ที่จะ', 'ต่อสู้', 'กับ', 'พวก', 'ขวาจัด', 'หน้า', 'โง่', 'ล้าสมัย', 'แบบ', 'มึง']"
1980891838035947609,twitter,post,https://x.com/thekingofotaku/status/1980891838035947609,text,2025-10-22T06:59:52.000Z,selenium_x_scraper_v1,"แล้วคนอื่นไม่ใช่ประชาชนเหรอวะ
มีมึงคนเดียวหรือไง
ยังไม่รู้ตัวคนเริ่ม turn ขวากันแล้ว","แล้วคนอื่นไม่ใช่ประชาชนเหรอวะ
มีมึงคนเดียวหรือไง
ยังไม่รู้ตัวคนเริ่ม turn ขวากันแล้ว",2025-11-29 08:18:55,"['แล้ว', 'คนอื่น', 'ไม่', 'ใช่', 'ประชาชน', 'เหรอ', 'วะ', ' ', 'มี', 'มึง', 'คนเดียว', 'หรือไง', ' ', 'ยัง', 'ไม่', 'รู้ตัว', 'คน', 'เริ่ม', ' ', 'turn', ' ', 'ขวา', 'กัน', 'แล้ว']"
1980467765292228854,twitter,post,https://x.com/molyjolybii/status/1980467765292228854,text,2025-10-21T02:54:45.000Z,selenium_x_scraper_v1,ไม่รุ้สึกแปกหรอว่าที่ตรรกะตัวเองไม่เหมือนคนส่วนใหญ่ เป็นกุกุคงรุ้ว่าควรจัดการที่ความคิดตัวเองนะ,ไม่รุ้สึกแปกหรอว่าที่ตรรกะตัวเองไม่เหมือนคนส่วนใหญ่ เป็นกุกุคงรุ้ว่าควรจัดการที่ความคิดตัวเองนะ,2025-11-29 08:18:55,"['ไม่', 'รุ้', 'สึก', 'แป', 'กห', 'รอ', 'ว่าที่', 'ตรรกะ', 'ตัวเอง', 'ไม่', 'เหมือน', 'คน', 'ส่วนใหญ่', ' ', 'เป็น', 'กุ', 'กุ', 'คง', 'รุ้', 'ว่า', 'ควร', 'จัดการ', 'ที่', 'ความคิด', 'ตัวเอง', 'นะ']"
1980860703797047369,twitter,post,https://x.com/molyjolybii/status/1980860703797047369,text,2025-10-22T04:56:09.000Z,selenium_x_scraper_v1,กุแพ้ตรงไหนงง ใครกันแน่ไล่ตอบทุกคนเลย ตลกอะ สู้ๆนะลุง,กุแพ้ตรงไหนงง ใครกันแน่ไล่ตอบทุกคนเลย ตลกอะ สู้ๆนะลุง,2025-11-29 08:18:55,"['กุ', 'แพ้', 'ตรงไหน', 'งง', ' ', 'ใคร', 'กัน', 'แน่', 'ไล่', 'ตอบ', 'ทุกคน', 'เลย', ' ', 'ตลก', 'อะ', ' ', 'สู้', 'ๆ', 'นะ', 'ลุง']"
1980862420190150867,twitter,post,https://x.com/thekingofotaku/status/1980862420190150867,text,2025-10-22T05:02:58.000Z,selenium_x_scraper_v1,อยากกระทืบพวกเฟมทวิตสมองเพี้ยนมีไรป่ะ,อยากกระทืบพวกเฟมทวิตสมองเพี้ยนมีไรป่ะ,2025-11-29 08:18:55,"['อยาก', 'กระทืบ', 'พวก', 'เฟม', 'ทวิ', 'ต', 'สมอง', 'เพี้ยน', 'มี', 'ไร', 'ป่ะ']"
1980635908031541412,twitter,post,https://x.com/ekongengdotcom/status/1980635908031541412,text,2025-10-21T14:02:53.000Z,selenium_x_scraper_v1,ถึงไม่ใส่ไปข้างนอกแต่มาโพสให้มึงดูไม่นับว่าเป็นสาธารณะหรา,ถึงไม่ใส่ไปข้างนอกแต่มาโพสให้มึงดูไม่นับว่าเป็นสาธารณะหรา,2025-11-29 08:18:55,"['ถึง', 'ไม่', 'ใส่', 'ไป', 'ข้างนอก', 'แต่', 'มา', 'โพส', 'ให้', 'มึง', 'ดู', 'ไม่', 'นับว่า', 'เป็น', 'สาธารณะ', 'หรา']"
1980637023791894993,twitter,post,https://x.com/thekingofotaku/status/1980637023791894993,text,2025-10-21T14:07:19.000Z,selenium_x_scraper_v1,"ไม่นับ
เพราะโพสให้กูดูคนเดียว
มันจะเป็นสาธารณะได้ไงวะ?
ถามอะไรโง่ๆ","ไม่นับ
เพราะโพสให้กูดูคนเดียว
มันจะเป็นสาธารณะได้ไงวะ?
ถามอะไรโง่ๆ",2025-11-29 08:18:55,"['ไม่', 'นับ', ' ', 'เพราะ', 'โพส', 'ให้', 'กู', 'ดู', 'คนเดียว', ' ', 'มัน', 'จะ', 'เป็น', 'สาธารณะ', 'ได้', 'ไง', 'วะ', '?', ' ', 'ถาม', 'อะไร', 'โง่', 'ๆ']"
1980602988600365403,twitter,post,https://x.com/vnomenon/status/1980602988600365403,text,2025-10-21T11:52:04.000Z,selenium_x_scraper_v1,,,2025-11-29 08:18:55,[]
1980617562590503354,twitter,post,https://x.com/RohanCSGupta/status/1980617562590503354,text,2025-10-21T12:49:59.000Z,selenium_x_scraper_v1,"@thekingofotaku 

เป็นอย่างที่คิดจริงๆว่า พวกมันจ้องไปที่ รธน. หมวด 1-2 กันอยู่  มาตรา 112 เป็นแค่การโยนหินถามทาง","@thekingofotaku 

เป็นอย่างที่คิดจริงๆว่า พวกมันจ้องไปที่ รธน. หมวด 1-2 กันอยู่  มาตรา 112 เป็นแค่การโยนหินถามทาง",2025-11-29 08:18:55,"['เป็น', 'อย่าง', 'ที่', 'คิด', 'จริงๆ', 'ว่า', ' ', 'พวก', 'มัน', 'จ้อง', 'ไป', 'ที่', ' ', 'รธน.', ' ', 'หมวด', ' ', '1', ' ', '2', ' ', 'กัน', 'อยู่', ' ', 'มาตรา', ' ', '112', ' ', 'เป็น', 'แค่', 'การโยน', 'หิน', 'ถาม', 'ทาง']"
1980619754500239763,twitter,post,https://x.com/RohanCSGupta/status/1980619754500239763,text,2025-10-21T12:58:42.000Z,selenium_x_scraper_v1,กลัวไทยจะกลายเป็นแบบพม่า ถ้าพรรคนั้นครองอำนาจแล้วมือเติบ แต่ในขณะเดียวกันนักการเมืองไทยในพรรคอนุรักษ์นิยม มันก็เทา-ดำ กันหลายคนจนไม่น่าไว้วางใจครับ,กลัวไทยจะกลายเป็นแบบพม่า ถ้าพรรคนั้นครองอำนาจแล้วมือเติบ แต่ในขณะเดียวกันนักการเมืองไทยในพรรคอนุรักษ์นิยม มันก็เทา-ดำ กันหลายคนจนไม่น่าไว้วางใจครับ,2025-11-29 08:18:55,"['กลัว', 'ไทย', 'จะ', 'กลายเป็น', 'แบบ', 'พม่า', ' ', 'ถ้า', 'พรรค', 'นั้น', 'ครองอำนาจ', 'แล้ว', 'มือเติบ', ' ', 'แต่', 'ในขณะเดียวกัน', 'นักการเมือง', 'ไทย', 'ใน', 'พรรค', 'อนุรักษ์นิยม', ' ', 'มัน', 'ก็', 'เทา', ' ', 'ดำ', ' ', 'กัน', 'หลาย', 'คนจน', 'ไม่', 'น่าไว้วางใจ', 'ครับ']"
1980622465891201065,twitter,post,https://x.com/thekingofotaku/status/1980622465891201065,text,2025-10-21T13:09:28.000Z,selenium_x_scraper_v1,"https://x.com/Unrulycat2511/status/1980606633421218012?t=__XLxpRWUJ2M9PD0bk9rfA&s=19…

เท่าที่ดูแผนสำรองมีอยู่น่ะครับ
ฝ่ายคุมอำนาจในไทย วางแผนได้ดีอยู้ครับ
ไม่ค่อยน่ากังวลเท่าไรครับ","https://x.com/Unrulycat2511/status/1980606633421218012?t=__XLxpRWUJ2M9PD0bk9rfA&s=19…

เท่าที่ดูแผนสำรองมีอยู่น่ะครับ
ฝ่ายคุมอำนาจในไทย วางแผนได้ดีอยู้ครับ
ไม่ค่อยน่ากังวลเท่าไรครับ",2025-11-29 08:18:55,"['เท่าที่', 'ดู', 'แผน', 'สำรอง', 'มี', 'อยู่', 'น่ะ', 'ครับ', ' ', 'ฝ่าย', 'คุม', 'อำนาจ', 'ใน', 'ไทย', ' ', 'วางแผน', 'ได้ดี', 'อยู้', 'ครับ', ' ', 'ไม่ค่อย', 'น่า', 'กังวล', 'เท่าไร', 'ครับ']"
1980606633421218012,twitter,post,https://x.com/Unrulycat2511/status/1980606633421218012,text,2025-10-21T12:06:33.000Z,selenium_x_scraper_v1,"วางแผนให้ สว.เขี่ยร่าง ""เพื่อไทย"" ออกเพื่อจะฟาดร่างพรรคส้มให้เดี้ยงเรื่องขัดคำวินิจฉัยศาลรัฐธรรมนูญ 

ตลกสุดคือ ""ควายส้ม"" จับมือกับพวกพิทักษ์รัฐธรรมนูญ 60 สุดจิตสุดใจ เพื่อหวังให้มาแก้รัฐธรรมนูญ","วางแผนให้ สว.เขี่ยร่าง ""เพื่อไทย"" ออกเพื่อจะฟาดร่างพรรคส้มให้เดี้ยงเรื่องขัดคำวินิจฉัยศาลรัฐธรรมนูญ 

ตลกสุดคือ ""ควายส้ม"" จับมือกับพวกพิทักษ์รัฐธรรมนูญ 60 สุดจิตสุดใจ เพื่อหวังให้มาแก้รัฐธรรมนูญ",2025-11-29 08:18:55,"['วางแผน', 'ให้', ' ', 'สว', '.', 'เขี่ย', 'ร่าง', ' ', 'เพื่อ', 'ไทย', ' ', 'ออก', 'เพื่อ', 'จะ', 'ฟาด', 'ร่าง', 'พรรค', 'ส้ม', 'ให้', 'เดี้ยง', 'เรื่อง', 'ขัด', 'คำวินิจฉัย', 'ศาลรัฐธรรมนูญ', ' ', 'ตลก', 'สุด', 'คือ', ' ', 'ควาย', 'ส้ม', ' ', 'จับมือ', 'กับ', 'พวก', 'พิทักษ์', 'รัฐธรรมนูญ', ' ', '60', ' ', 'สุดจิต', 'สุดใจ', ' ', 'เพื่อ', 'หวัง', 'ให้', 'มา', 'แก้', 'รัฐธรรมนูญ']"
1980622233287684347,twitter,post,https://x.com/thekingofotaku/status/1980622233287684347,text,2025-10-21T13:08:33.000Z,selenium_x_scraper_v1,"แผนนี้ใช้ได้ 
ของฝั่งขวา แยบยลดี 
ให้ผ่าน","แผนนี้ใช้ได้ 
ของฝั่งขวา แยบยลดี 
ให้ผ่าน",2025-11-29 08:18:55,"['แผน', 'นี้', 'ใช้ได้', ' ', 'ของ', 'ฝั่ง', 'ขวา', ' ', 'แยบยล', 'ดี', ' ', 'ให้', 'ผ่าน']"
1980572530307133594,twitter,post,https://x.com/notthing_bout2u/status/1980572530307133594,text,2025-10-21T09:51:03.000Z,selenium_x_scraper_v1,ก็ลูกใครลูกมันไง เขาเป็นลูกมึงหรอถึงได้มาทุกข์ใจดิ้นเร่าๆๆ,ก็ลูกใครลูกมันไง เขาเป็นลูกมึงหรอถึงได้มาทุกข์ใจดิ้นเร่าๆๆ,2025-11-29 08:18:55,"['ก็', 'ลูก', 'ใคร', 'ลูก', 'มัน', 'ไง', ' ', 'เขา', 'เป็น', 'ลูก', 'มึง', 'หรอ', 'ถึง', 'ได้มา', 'ทุกข์ใจ', 'ดิ้น', 'เร่า', 'ๆๆ']"
1980572834088071453,twitter,post,https://x.com/thekingofotaku/status/1980572834088071453,text,2025-10-21T09:52:15.000Z,selenium_x_scraper_v1,"คนเปิดประเด็นเรื่องครอบครัว ลูกสาวน้องสาว
คือเจนิส
ถ้าโดนย้อนตรรกะอย่างอแง","คนเปิดประเด็นเรื่องครอบครัว ลูกสาวน้องสาว
คือเจนิส
ถ้าโดนย้อนตรรกะอย่างอแง",2025-11-29 08:18:55,"['คน', 'เปิด', 'ประเด็น', 'เรื่อง', 'ครอบครัว', ' ', 'ลูกสาว', 'น้องสาว', ' ', 'คือ', 'เจ', 'นิ', 'ส', ' ', 'ถ้า', 'โดน', 'ย้อน', 'ตรรกะ', 'อย่า', 'งอแง']"
