id,platform,platform_type,url,content_type,timestamp,scraper_module,text,raw_text,scrape_date,tokens
1980900667222020523,twitter,post,https://x.com/taliaaawestt/status/1980900667222020523,text,2025-10-22T07:34:57.000Z,selenium_x_scraper_v1,"Very interesting take on this, I definitely think you are right but it they do spark debate.","Very interesting take on this, I definitely think you are right but it they do spark debate.",2025-11-29 08:18:55,"['very', ' ', 'interesting', ' ', 'take', ' ', 'on', ' ', 'this', ',', ' ', 'i', ' ', 'definitely', ' ', 'think', ' ', 'you', ' ', 'are', ' ', 'right', ' ', 'but', ' ', 'it', ' ', 'they', ' ', 'do', ' ', 'spark', ' ', 'debate', '.']"
1981218326618788036,twitter,post,https://x.com/pnvich2/status/1981218326618788036,text,2025-10-23T04:37:12.000Z,selenium_x_scraper_v1,ไหนๆก็ไหนๆแล้ว ขอพูดเรื่องการกลืนชาติและวัฒนธรรมของชนพื้นเมือง Ainu ที่ถูก รุกรานจนหมดสิ้น ถูกบังคับให้เปลี่ยนวิถีชีวิต เสียที่ดิน ถูกกลืนวัฒนธรรม จน ปจบ ไม่มีชนพื้นเมือง Ainu เหลืออยู่ อีกชนพื้นเมืองนึงก็คือ Ryukyuan ดูรายละเอียดในคลิป,ไหนๆก็ไหนๆแล้ว ขอพูดเรื่องการกลืนชาติและวัฒนธรรมของชนพื้นเมือง Ainu ที่ถูก รุกรานจนหมดสิ้น ถูกบังคับให้เปลี่ยนวิถีชีวิต เสียที่ดิน ถูกกลืนวัฒนธรรม จน ปจบ ไม่มีชนพื้นเมือง Ainu เหลืออยู่ อีกชนพื้นเมืองนึงก็คือ Ryukyuan ดูรายละเอียดในคลิป,2025-11-29 08:18:55,"['ไหน', 'ๆ', 'ก็', 'ไหน', 'ๆ', 'แล้ว', ' ', 'ขอ', 'พูด', 'เรื่อง', 'การกลืน', 'ชาติ', 'และ', 'วัฒนธรรม', 'ของ', 'ชนพื้นเมือง', ' ', 'ainu', ' ', 'ที่', 'ถูก', ' ', 'รุกราน', 'จน', 'หมดสิ้น', ' ', 'ถูก', 'บังคับ', 'ให้', 'เปลี่ยน', 'วิถีชีวิต', ' ', 'เสีย', 'ที่ดิน', ' ', 'ถูก', 'กลืน', 'วัฒนธรรม', ' ', 'จน', ' ', 'ปจบ', ' ', 'ไม่', 'มี', 'ชนพื้นเมือง', ' ', 'ainu', ' ', 'เหลืออยู่', ' ', 'อีก', 'ชนพื้นเมือง', 'นึง', 'ก็', 'คือ', ' ', 'ryukyuan', ' ', 'ดู', 'รายละเอียด', 'ใน', 'คลิป']"
1980870603050741841,twitter,post,https://x.com/backpackertoon/status/1980870603050741841,text,2025-10-22T05:35:29.000Z,selenium_x_scraper_v1,ถ้าใครเคยไป พิพิธภัณฑ์นานกิง ตอนนั้นหลายปี ทุกคนเข้าฟรี ญี่ปุ่นเสียเงิน จีนแค้นมาก ประจานญี่ปุ่น เรื่องข่มขืน และเคยจัดให้คบเพลิงโอลิมปิกผ่านนานกิง เพื่อประจานซ้ำๆๆ และมีแต่ตัวเลข 3 แสน,ถ้าใครเคยไป พิพิธภัณฑ์นานกิง ตอนนั้นหลายปี ทุกคนเข้าฟรี ญี่ปุ่นเสียเงิน จีนแค้นมาก ประจานญี่ปุ่น เรื่องข่มขืน และเคยจัดให้คบเพลิงโอลิมปิกผ่านนานกิง เพื่อประจานซ้ำๆๆ และมีแต่ตัวเลข 3 แสน,2025-11-29 08:18:55,"['ถ้า', 'ใคร', 'เคย', 'ไป', ' ', 'พิพิธภัณฑ์', 'นาน', 'กิง', ' ', 'ตอนนั้น', 'หลาย', 'ปี', ' ', 'ทุกคน', 'เข้า', 'ฟรี', ' ', 'ญี่ปุ่น', 'เสียเงิน', ' ', 'จีน', 'แค้น', 'มาก', ' ', 'ประจาน', 'ญี่ปุ่น', ' ', 'เรื่อง', 'ข่มขืน', ' ', 'และ', 'เคย', 'จัด', 'ให้', 'คบเพลิง', 'โอลิมปิก', 'ผ่าน', 'นาน', 'กิง', ' ', 'เพื่อ', 'ประจาน', 'ซ้ำๆ', 'ๆ', ' ', 'และ', 'มี', 'แต่', 'ตัวเลข', ' ', '3', ' ', 'แสน']"
1981261960063963306,twitter,post,https://x.com/nin1no/status/1981261960063963306,text,2025-10-23T07:30:36.000Z,selenium_x_scraper_v1,ชั้นไม่ชอบจีนก็จริง แต่เรื่องที่ญี่ปุ่นทำเรื่องอุบาดไว้กับจีนมันก็เรื่องจริง คนจีนในประวัติศาสตร์เจ็บปวดจริง ทุกวันนี้นิยายบางเรื่องยังพูดถึงเรื่องนี้ใส่มาเลย ฮีแค้นจริงจัง (แต่นิยายจีนก็สาปส่งญป.ตลอดแหละ),ชั้นไม่ชอบจีนก็จริง แต่เรื่องที่ญี่ปุ่นทำเรื่องอุบาดไว้กับจีนมันก็เรื่องจริง คนจีนในประวัติศาสตร์เจ็บปวดจริง ทุกวันนี้นิยายบางเรื่องยังพูดถึงเรื่องนี้ใส่มาเลย ฮีแค้นจริงจัง (แต่นิยายจีนก็สาปส่งญป.ตลอดแหละ),2025-11-29 08:18:55,"['ชั้น', 'ไม่', 'ชอบ', 'จีน', 'ก็', 'จริง', ' ', 'แต่', 'เรื่อง', 'ที่', 'ญี่ปุ่น', 'ทำ', 'เรื่อง', 'อุ', 'บาด', 'ไว้', 'กับ', 'จีน', 'มัน', 'ก็', 'เรื่องจริง', ' ', 'คนจีน', 'ใน', 'ประวัติศาสตร์', 'เจ็บปวด', 'จริง', ' ', 'ทุกวันนี้', 'นิยาย', 'บาง', 'เรื่อง', 'ยัง', 'พูดถึง', 'เรื่อง', 'นี้', 'ใส่', 'มา', 'เลย', ' ', 'ฮี', 'แค้น', 'จริงจัง', ' ', 'แต่', 'นิยาย', 'จีน', 'ก็', 'สาปส่ง', 'ญ', 'ป.', 'ตลอด', 'แหละ']"
1981137634891321569,twitter,post,https://x.com/SahaiKrittitee/status/1981137634891321569,text,2025-10-22T23:16:34.000Z,selenium_x_scraper_v1,"Woke ไทยพากันดิ้นพล่านหลังญี่ปุ่นได้นายกสตรีที่เป็นสายอนุรักษ์นิยม-ชาตินิยม

ไม่ชอบไม่ว่ากัน แต่อย่างน้อยเขาก็ Move on เรื่องภัยจักรวรรดินิยมจีน และผู้อพยพ ไม่เหมือนรัฐบาลสายกลางตลอด 5 ปีที่ผ่านมา","Woke ไทยพากันดิ้นพล่านหลังญี่ปุ่นได้นายกสตรีที่เป็นสายอนุรักษ์นิยม-ชาตินิยม

ไม่ชอบไม่ว่ากัน แต่อย่างน้อยเขาก็ Move on เรื่องภัยจักรวรรดินิยมจีน และผู้อพยพ ไม่เหมือนรัฐบาลสายกลางตลอด 5 ปีที่ผ่านมา",2025-11-29 08:18:55,"['woke', ' ', 'ไทย', 'พา', 'กัน', 'ดิ้น', 'พล่าน', 'หลัง', 'ญี่ปุ่น', 'ได้', 'นายก', 'สตรี', 'ที่', 'เป็น', 'สาย', 'อนุรักษ์นิยม', ' ', 'ชาตินิยม', ' ', 'ไม่', 'ชอบ', 'ไม่', 'ว่า', 'กัน', ' ', 'แต่', 'อย่าง', 'น้อย', 'เขา', 'ก็', ' ', 'move', ' ', 'on', ' ', 'เรื่อง', 'ภัย', 'จักรวรรดินิยม', 'จีน', ' ', 'และ', 'ผู้อพยพ', ' ', 'ไม่', 'เหมือน', 'รัฐบาล', 'สายกลาง', 'ตลอด', ' ', '5', ' ', 'ปี', 'ที่ผ่านมา']"
1981134884623307148,twitter,post,https://x.com/EllaMelb/status/1981134884623307148,text,2025-10-22T23:05:38.000Z,selenium_x_scraper_v1,สันดานญี่ปุ่นบูชาปิตาเต็มขั้น โดนกดจนมองว่าต้องทำตัวอวยผู้ชายถึงจะมีหน้ามีตาได้,สันดานญี่ปุ่นบูชาปิตาเต็มขั้น โดนกดจนมองว่าต้องทำตัวอวยผู้ชายถึงจะมีหน้ามีตาได้,2025-11-29 08:18:55,"['สันดาน', 'ญี่ปุ่น', 'บูชา', 'ปิตา', 'เต็ม', 'ขั้น', ' ', 'โดน', 'กด', 'จน', 'มองว่า', 'ต้อง', 'ทำตัว', 'อวย', 'ผู้ชาย', 'ถึง', 'จะ', 'มีหน้ามีตา', 'ได้']"
1980948881832915329,twitter,post,https://x.com/Xrberuz/status/1980948881832915329,text,2025-10-22T10:46:32.000Z,selenium_x_scraper_v1,"ถ้าลองดูประเทศอื่นๆ จะเห็นว่าผู้นำฝ่ายขวา-ขวาจัดในตอนนี้ ก็มีหลายคนที่เป็นผู้หญิง ไม่จำเป็นต้องเป็นผู้ชายเสมอไป

ซึ่ง ideology ไม่ใช่สิ่งที่สามารถ stigmatized ให้กับเพศใดเพศหนึ่งได้ ถึงแม้การเรียกร้องสิทธิที่ไม่เท่าเทียมอาจจะเริ่มจากผู้หญิงด้วยกันเอง

มันอยู่ที่สังคมกับผลประโยชน์","ถ้าลองดูประเทศอื่นๆ จะเห็นว่าผู้นำฝ่ายขวา-ขวาจัดในตอนนี้ ก็มีหลายคนที่เป็นผู้หญิง ไม่จำเป็นต้องเป็นผู้ชายเสมอไป

ซึ่ง ideology ไม่ใช่สิ่งที่สามารถ stigmatized ให้กับเพศใดเพศหนึ่งได้ ถึงแม้การเรียกร้องสิทธิที่ไม่เท่าเทียมอาจจะเริ่มจากผู้หญิงด้วยกันเอง

มันอยู่ที่สังคมกับผลประโยชน์",2025-11-29 08:18:55,"['ถ้า', 'ลองดู', 'ประเทศ', 'อื่นๆ', ' ', 'จะ', 'เห็น', 'ว่า', 'ผู้นำ', 'ฝ่ายขวา', ' ', 'ขวาจัด', 'ใน', 'ตอนนี้', ' ', 'ก็', 'มี', 'หลาย', 'คน', 'ที่', 'เป็น', 'ผู้หญิง', ' ', 'ไม่', 'จำเป็นต้อง', 'เป็น', 'ผู้ชาย', 'เสมอไป', ' ', 'ซึ่ง', ' ', 'ideology', ' ', 'ไม่', 'ใช่', 'สิ่ง', 'ที่', 'สามารถ', ' ', 'stigmatized', ' ', 'ให้', 'กับ', 'เพศ', 'ใด', 'เพศ', 'หนึ่ง', 'ได้', ' ', 'ถึงแม้', 'การ', 'เรียกร้อง', 'สิทธิ', 'ที่', 'ไม่', 'เท่าเทียม', 'อาจจะ', 'เริ่ม', 'จาก', 'ผู้หญิง', 'ด้วย', 'กันเอง', ' ', 'มัน', 'อยู่', 'ที่', 'สังคม', 'กับ', 'ผลประโยชน์']"
1980850621239685158,twitter,post,https://x.com/cookysugar/status/1980850621239685158,text,2025-10-22T04:16:05.000Z,selenium_x_scraper_v1,แต่ตัวเองใช้นามสกุลเดิมแล้วให้สามีแต่งเข้า(สามีเป็นคนเปลี่ยนนามสกุล),แต่ตัวเองใช้นามสกุลเดิมแล้วให้สามีแต่งเข้า(สามีเป็นคนเปลี่ยนนามสกุล),2025-11-29 08:18:55,"['แต่', 'ตัวเอง', 'ใช้', 'นามสกุล', 'เดิม', 'แล้ว', 'ให้', 'สามี', 'แต่ง', 'เข้า', ' ', 'สามี', 'เป็น', 'คน', 'เปลี่ยน', 'นามสกุล']"
1980855566756159552,twitter,post,https://x.com/lialionu/status/1980855566756159552,text,2025-10-22T04:35:44.000Z,selenium_x_scraper_v1,กุก็ยังงงจนถึงทุกวันนี้ว่าทำไมผญถึงใช้นามสกุลเดิมไม่ได้ มันก็แค่นามสกุลปะ,กุก็ยังงงจนถึงทุกวันนี้ว่าทำไมผญถึงใช้นามสกุลเดิมไม่ได้ มันก็แค่นามสกุลปะ,2025-11-29 08:18:55,"['กุ', 'ก็', 'ยัง', 'งง', 'จนถึง', 'ทุกวันนี้', 'ว่า', 'ทำไม', 'ผญ', 'ถึง', 'ใช้', 'นามสกุล', 'เดิม', 'ไม่', 'ได้', ' ', 'มัน', 'ก็', 'แค่', 'นามสกุล', 'ปะ']"
1981040290132644142,twitter,post,https://x.com/junnevip/status/1981040290132644142,text,2025-10-22T16:49:45.000Z,selenium_x_scraper_v1,"เดี๋ยว นางใช้นามสกุลตัวเอง ผัวนางก็เคยเกือบเปลี่ยนมาใช้นามสกุลนาง

ส่วนเรื่องอื่นหาหลักฐานไม่เจอ ชาวทวิตเตี้ยนอย่าเพิ่งไหลตาม คนอยากจะด่ามันเอาสารอะไรมาบิดด่าได้ทั้งนั้น","เดี๋ยว นางใช้นามสกุลตัวเอง ผัวนางก็เคยเกือบเปลี่ยนมาใช้นามสกุลนาง

ส่วนเรื่องอื่นหาหลักฐานไม่เจอ ชาวทวิตเตี้ยนอย่าเพิ่งไหลตาม คนอยากจะด่ามันเอาสารอะไรมาบิดด่าได้ทั้งนั้น",2025-11-29 08:18:55,"['เดี๋ยว', ' ', 'นาง', 'ใช้', 'นามสกุล', 'ตัวเอง', ' ', 'ผัว', 'นาง', 'ก็', 'เคย', 'เกือบ', 'เปลี่ยน', 'มา', 'ใช้', 'นามสกุล', 'นาง', ' ', 'ส่วน', 'เรื่อง', 'อื่น', 'หา', 'หลักฐาน', 'ไม่', 'เจอ', ' ', 'ชาว', 'ทวิ', 'ต', 'เตี้ย', 'นอ', 'ย่า', 'เพิ่ง', 'ไหล', 'ตาม', ' ', 'คน', 'อยาก', 'จะ', 'ด่า', 'มัน', 'เอา', 'สาร', 'อะไร', 'มา', 'บิด', 'ด่า', 'ได้', 'ทั้งนั้น']"
1981353000536068464,twitter,post,https://x.com/eldhee_94/status/1981353000536068464,text,2025-10-23T13:32:21.000Z,selenium_x_scraper_v1,ก้สังคมมันปิตาจ๋าอ่ะ ปรับแบบดุ้งเลยน่าจะตีอกชกหัวกันยุ แล้วคนบ้านเขาความปิตามันครอบเขามาตั้งนานครอบโดยที่แบบว่า ผญ ใน ปท เค้าเองก้ไม่ได้แแกมาเรียกร้องอะไรมาก ออกแนวยอมรับด้วยซ้ำ คือปัผญหาฝังรากสุด อย่างเรื่องการแต่งงานชั้นให้เลยว่ามันคือดิวตี้ชองคนชาติเขา,ก้สังคมมันปิตาจ๋าอ่ะ ปรับแบบดุ้งเลยน่าจะตีอกชกหัวกันยุ แล้วคนบ้านเขาความปิตามันครอบเขามาตั้งนานครอบโดยที่แบบว่า ผญ ใน ปท เค้าเองก้ไม่ได้แแกมาเรียกร้องอะไรมาก ออกแนวยอมรับด้วยซ้ำ คือปัผญหาฝังรากสุด อย่างเรื่องการแต่งงานชั้นให้เลยว่ามันคือดิวตี้ชองคนชาติเขา,2025-11-29 08:18:55,"['ก้', 'สังคม', 'มัน', 'ปิตา', 'จ๋า', 'อ่ะ', ' ', 'ปรับ', 'แบบ', 'ดุ้ง', 'เลย', 'น่าจะ', 'ตี', 'อก', 'ชกหัว', 'กัน', 'ยุ', ' ', 'แล้ว', 'คน', 'บ้าน', 'เขา', 'ความ', 'ปิตา', 'มัน', 'ครอบ', 'เขา', 'มา', 'ตั้ง', 'นาน', 'ครอบ', 'โดยที่', 'แบบ', 'ว่า', ' ', 'ผญ', ' ', 'ใน', ' ', 'ปท', ' ', 'เค้า', 'เอง', 'ก้', 'ไม่', 'ได้', 'แ', 'แก', 'มา', 'เรียกร้อง', 'อะไร', 'มาก', ' ', 'ออก', 'แนว', 'ยอมรับ', 'ด้วยซ้ำ', ' ', 'คือ', 'ปัผญ', 'หา', 'ฝังราก', 'สุด', ' ', 'อย่าง', 'เรื่อง', 'การ', 'แต่งงาน', 'ชั้น', 'ให้', 'เลย', 'ว่า', 'มัน', 'คือ', 'ดิ', 'วตี้', 'ชอง', 'คน', 'ชาติ', 'เขา']"
1980902591447081451,twitter,post,https://x.com/mignon982/status/1980902591447081451,text,2025-10-22T07:42:35.000Z,selenium_x_scraper_v1,ชีเป็นสายเดียวกับอาเบะเลย อยากแก้มาตรา 9 อยากให้ญี่ปุ่นมีกองทัพ ซึ่งนี่อะนำความขัดแย้งมาสู่เอเชียตะวันออกมากๆ เพราะ จีน เกาหลีเป็นประเทศที่ได้รับผลกระทบจากสงครามโลกครั้งที่ 2 ซึ่งมาโดยตรงจากกองทัพทหารญี่ปุ่น ถ้าชีมาแบบ Abe ที่อยากให้ญี่ปุ่นมีกองทัพ แรงต้านจะมาจากทั้งภูมิภาค,ชีเป็นสายเดียวกับอาเบะเลย อยากแก้มาตรา 9 อยากให้ญี่ปุ่นมีกองทัพ ซึ่งนี่อะนำความขัดแย้งมาสู่เอเชียตะวันออกมากๆ เพราะ จีน เกาหลีเป็นประเทศที่ได้รับผลกระทบจากสงครามโลกครั้งที่ 2 ซึ่งมาโดยตรงจากกองทัพทหารญี่ปุ่น ถ้าชีมาแบบ Abe ที่อยากให้ญี่ปุ่นมีกองทัพ แรงต้านจะมาจากทั้งภูมิภาค,2025-11-29 08:18:55,"['ชี', 'เป็น', 'สาย', 'เดียว', 'กับ', 'อา', 'เบะ', 'เลย', ' ', 'อยาก', 'แก้', 'มาตรา', ' ', '9', ' ', 'อยาก', 'ให้', 'ญี่ปุ่น', 'มี', 'กองทัพ', ' ', 'ซึ่ง', 'นี่', 'อะ', 'นำ', 'ความขัดแย้ง', 'มาสู่', 'เอเชีย', 'ตะวันออก', 'มาก', 'ๆ', ' ', 'เพราะ', ' ', 'จีน', ' ', 'เกาหลี', 'เป็น', 'ประเทศ', 'ที่', 'ได้รับ', 'ผลกระทบ', 'จาก', 'สงครามโลก', 'ครั้ง', 'ที่', ' ', '2', ' ', 'ซึ่ง', 'มา', 'โดยตรง', 'จาก', 'กองทัพ', 'ทหาร', 'ญี่ปุ่น', ' ', 'ถ้า', 'ชี', 'มา', 'แบบ', ' ', 'abe', ' ', 'ที่', 'อยาก', 'ให้', 'ญี่ปุ่น', 'มี', 'กองทัพ', ' ', 'แรง', 'ต้าน', 'จะ', 'มาจาก', 'ทั้ง', 'ภูมิภาค']"
1980894315397390747,twitter,post,https://x.com/tenshi_P1107/status/1980894315397390747,text,2025-10-22T07:09:42.000Z,selenium_x_scraper_v1,ผู้หญิงที่ไม่เคารพสิทธิเสรีภาพของตนเองหรือหญิงอื่น ก็เท่ากับว่ายอมรับตัวเองจะเป็นได้แค่เครื่องผลิตลูกก็เท่านั้น ทำไมเป็นผญสืบทอดบัลลังไม่ได้ หรือ แม้แต่ภาคธุรกิจ ทำไมสืบทอดธุรกิจไม่ได้ ปัญหาคือผชมันกลัวหมดความสำคัญเพราะตัวเองเคยกดเขามาตลอด,ผู้หญิงที่ไม่เคารพสิทธิเสรีภาพของตนเองหรือหญิงอื่น ก็เท่ากับว่ายอมรับตัวเองจะเป็นได้แค่เครื่องผลิตลูกก็เท่านั้น ทำไมเป็นผญสืบทอดบัลลังไม่ได้ หรือ แม้แต่ภาคธุรกิจ ทำไมสืบทอดธุรกิจไม่ได้ ปัญหาคือผชมันกลัวหมดความสำคัญเพราะตัวเองเคยกดเขามาตลอด,2025-11-29 08:18:55,"['ผู้หญิง', 'ที่', 'ไม่', 'เคารพ', 'สิทธิ', 'เสรีภาพ', 'ของ', 'ตนเอง', 'หรือ', 'หญิง', 'อื่น', ' ', 'ก็', 'เท่ากับ', 'ว่า', 'ยอมรับ', 'ตัวเอง', 'จะ', 'เป็นได้', 'แค่', 'เครื่อง', 'ผลิต', 'ลูก', 'ก็', 'เท่านั้น', ' ', 'ทำไม', 'เป็น', 'ผญ', 'สืบทอด', 'บัล', 'ลัง', 'ไม่', 'ได้', ' ', 'หรือ', ' ', 'แม้แต่', 'ภาค', 'ธุรกิจ', ' ', 'ทำไม', 'สืบทอด', 'ธุรกิจ', 'ไม่', 'ได้', ' ', 'ปัญหา', 'คือ', 'ผ', 'ชมัน', 'กลัว', 'หมด', 'ความสำคัญ', 'เพราะ', 'ตัวเอง', 'เคย', 'กด', 'เขา', 'มา', 'ตลอด']"
