id,platform,platform_type,url,content_type,timestamp,scraper_module,text,raw_text,scrape_date,tokens
1986418283525120283,twitter,post,https://x.com/wendyxworks/status/1986418283525120283,text,2025-11-06T12:59:59.000Z,selenium_x_scraper_v1,ฉลาดมาทุกเรื่อง/ทำงานเก่ง ทรีตคนอื่นดี/พึ่งตัวเองได้ เอาตัวรอดเก่ง แต่พอมีแฟนเหี้ย/ปรับตัวจนเสียตัวตนกลายเปนโดนตีตราว่าเปนคนโง่/คนฉลาดไม่จริงเลย อะไรวะ55555555555 คนเรามันก้โง่ตอนมีความรักกันได้ทั้งนั้นปะ emotional นำมาเหนๆ จะตัดสินว่าใครฉลาดจิง/ไม่จิงจากเรื่องนี้ จะดีรึหว่า,ฉลาดมาทุกเรื่อง/ทำงานเก่ง ทรีตคนอื่นดี/พึ่งตัวเองได้ เอาตัวรอดเก่ง แต่พอมีแฟนเหี้ย/ปรับตัวจนเสียตัวตนกลายเปนโดนตีตราว่าเปนคนโง่/คนฉลาดไม่จริงเลย อะไรวะ55555555555 คนเรามันก้โง่ตอนมีความรักกันได้ทั้งนั้นปะ emotional นำมาเหนๆ จะตัดสินว่าใครฉลาดจิง/ไม่จิงจากเรื่องนี้ จะดีรึหว่า,2025-11-29 08:18:55,"['ฉลาด', 'มา', 'ทุก', 'เรื่อง', ' ', 'ทำงาน', 'เก่ง', ' ', 'ท', 'รีต', 'คนอื่น', 'ดี', ' ', 'พึ่งตัวเอง', 'ได้', ' ', 'เอาตัวรอด', 'เก่ง', ' ', 'แต่', 'พอ', 'มี', 'แฟน', 'เหี้ย', ' ', 'ปรับตัว', 'จน', 'เสีย', 'ตัวตน', 'กลาย', 'เปน', 'โดน', 'ตีตรา', 'ว่า', 'เปน', 'คนโง่', ' ', 'คน', 'ฉลาด', 'ไม่', 'จริง', 'เลย', ' ', 'อะไร', 'วะ', 'หัวเราะ', ' ', 'คนเรา', 'มัน', 'ก้', 'โง่', 'ตอน', 'มี', 'ความรัก', 'กัน', 'ได้', 'ทั้งนั้น', 'ปะ', ' ', 'emotional', ' ', 'นำมา', 'เห', 'นๆ', ' ', 'จะ', 'ตัดสิน', 'ว่า', 'ใคร', 'ฉลาด', 'จิง', ' ', 'ไม่', 'จิง', 'จาก', 'เรื่อง', 'นี้', ' ', 'จะ', 'ดี', 'รึ', 'หว่า']"
1986466027077775395,twitter,post,https://x.com/ssath00/status/1986466027077775395,text,2025-11-06T16:09:42.000Z,selenium_x_scraper_v1,มันไม่ใช่เรื่องฉลาดไม่ฉลาดอะ มันคือความ secure ในตัวเองแล้วก็คสพกับคนรอบตัวในวัยเด็ก attachment style ตั่งต่าง ทรอม่ามันเป็นกันง่ายมาก แบบโดนเพื่อนกีดกันออกจากกลุ่มก็ทำให้เป็นคน anxious ในคสพโรแมนติกได้แล้ว ทั้งนี้เกี่ยวกับ diathesis (ปัจจัยที่มีก่อนจะเจอเหตุการณ์พวกนี้)ด้วย,มันไม่ใช่เรื่องฉลาดไม่ฉลาดอะ มันคือความ secure ในตัวเองแล้วก็คสพกับคนรอบตัวในวัยเด็ก attachment style ตั่งต่าง ทรอม่ามันเป็นกันง่ายมาก แบบโดนเพื่อนกีดกันออกจากกลุ่มก็ทำให้เป็นคน anxious ในคสพโรแมนติกได้แล้ว ทั้งนี้เกี่ยวกับ diathesis (ปัจจัยที่มีก่อนจะเจอเหตุการณ์พวกนี้)ด้วย,2025-11-29 08:18:55,"['มัน', 'ไม่', 'ใช่', 'เรื่อง', 'ฉลาด', 'ไม่', 'ฉลาด', 'อะ', ' ', 'มัน', 'คือ', 'ความ', ' ', 'secure', ' ', 'ใน', 'ตัวเอง', 'แล้วก็', 'คสพ', 'กับ', 'คน', 'รอบตัว', 'ใน', 'วัยเด็ก', ' ', 'attachment', ' ', 'style', ' ', 'ตั่ง', 'ต่าง', ' ', 'ทรอ', 'ม่า', 'มัน', 'เป็น', 'กัน', 'ง่าย', 'มาก', ' ', 'แบบ', 'โดน', 'เพื่อน', 'กีดกัน', 'ออกจาก', 'กลุ่ม', 'ก็', 'ทำให้', 'เป็น', 'คน', ' ', 'anxious', ' ', 'ใน', 'คสพ', 'โรแมนติก', 'ได้', 'แล้ว', ' ', 'ทั้งนี้', 'เกี่ยวกับ', ' ', 'diathesis', ' ', 'ปัจจัย', 'ที่', 'มี', 'ก่อน', 'จะ', 'เจอ', 'เหตุการณ์', 'พวก', 'นี้', ' ', 'ด้วย']"
1986644840105570735,twitter,post,https://x.com/maewpeehbah/status/1986644840105570735,text,2025-11-07T04:00:14.000Z,selenium_x_scraper_v1,ถ้าฉลาดหมายถึง iq วัดไม่ได้ แต่ถ้า eq ก็คงจะพูดได้อะว่าคนที่ worked on กับตัวเองมาแล้วจะไม่อยู่ใน toxic relationship เพราะ peace of mind คือคุณค่าสูงสุดที่จะมอบให้คสพ,ถ้าฉลาดหมายถึง iq วัดไม่ได้ แต่ถ้า eq ก็คงจะพูดได้อะว่าคนที่ worked on กับตัวเองมาแล้วจะไม่อยู่ใน toxic relationship เพราะ peace of mind คือคุณค่าสูงสุดที่จะมอบให้คสพ,2025-11-29 08:18:55,"['ถ้า', 'ฉลาด', 'หมายถึง', ' ', 'iq', ' ', 'วัด', 'ไม่', 'ได้', ' ', 'แต่', 'ถ้า', ' ', 'eq', ' ', 'ก็', 'คงจะ', 'พูด', 'ได้', 'อะ', 'ว่า', 'คน', 'ที่', ' ', 'worked', ' ', 'on', ' ', 'กับ', 'ตัวเอง', 'มา', 'แล้', 'วจะ', 'ไม่', 'อยู่', 'ใน', ' ', 'toxic', ' ', 'relationship', ' ', 'เพราะ', ' ', 'peace', ' ', 'of', ' ', 'mind', ' ', 'คือ', 'คุณ', 'ค่าสูงสุด', 'ที่จะ', 'มอบให้', 'คสพ']"
1986647066857406492,twitter,post,https://x.com/yellotomyfellow/status/1986647066857406492,text,2025-11-07T04:09:05.000Z,selenium_x_scraper_v1,ฉลาดแค่ไหน ก็แพ้ปมในใจได้ทั้งนั้น จริง ๆ บางคนอาจจะ self esteem ต่ำมาก มี issues ในครอบครัวมากก่อน ตอนโสดเลยพยานยามสร้างเกราะป้องกันให้ตัวเองดูแข็งแกร่ง เพราะไม่รู้ว่าจะไปพึ่งใคร พอมีคนมาทำดีด้วย มา gastlight มันเหมือนได้พรจากสวรรค์อะ,ฉลาดแค่ไหน ก็แพ้ปมในใจได้ทั้งนั้น จริง ๆ บางคนอาจจะ self esteem ต่ำมาก มี issues ในครอบครัวมากก่อน ตอนโสดเลยพยานยามสร้างเกราะป้องกันให้ตัวเองดูแข็งแกร่ง เพราะไม่รู้ว่าจะไปพึ่งใคร พอมีคนมาทำดีด้วย มา gastlight มันเหมือนได้พรจากสวรรค์อะ,2025-11-29 08:18:55,"['ฉลาด', 'แค่', 'ไหน', ' ', 'ก็', 'แพ้', 'ปม', 'ใน', 'ใจ', 'ได้', 'ทั้งนั้น', ' ', 'จริง ๆ', ' ', 'บางคน', 'อาจจะ', ' ', 'self', ' ', 'esteem', ' ', 'ต่ำ', 'มาก', ' ', 'มี', ' ', 'issues', ' ', 'ใน', 'ครอบครัว', 'มาก', 'ก่อน', ' ', 'ตอน', 'โสด', 'เลย', 'พยาน', 'ยาม', 'สร้าง', 'เกราะ', 'ป้องกัน', 'ให้', 'ตัวเอง', 'ดู', 'แข็งแกร่ง', ' ', 'เพราะ', 'ไม่', 'รู้', 'ว่า', 'จะ', 'ไป', 'พึ่ง', 'ใคร', ' ', 'พอ', 'มี', 'คน', 'มา', 'ทำดี', 'ด้วย', ' ', 'มา', ' ', 'gastlight', ' ', 'มัน', 'เหมือน', 'ได้', 'พร', 'จาก', 'สวรรค์', 'อะ']"
1986463909138846048,twitter,post,https://x.com/tryfuckingbest/status/1986463909138846048,text,2025-11-06T16:01:17.000Z,selenium_x_scraper_v1,เรื่องความรักนี่ ความฉลาดโง่นี่วัดไม่ได้เลย มันซับซ้อนมากๆ หากใครเกิดมาโชคดีจิตใจเข้มแข็งพอที่จะตัดได้ก็ดี บางคนความรักนี้อาจจะเป็นครั้งแรกครั้งเดียวที่มีคนมาดีด้วยเลยยอมมีไว้ก็ได้ พูดยากนะ,เรื่องความรักนี่ ความฉลาดโง่นี่วัดไม่ได้เลย มันซับซ้อนมากๆ หากใครเกิดมาโชคดีจิตใจเข้มแข็งพอที่จะตัดได้ก็ดี บางคนความรักนี้อาจจะเป็นครั้งแรกครั้งเดียวที่มีคนมาดีด้วยเลยยอมมีไว้ก็ได้ พูดยากนะ,2025-11-29 08:18:55,"['เรื่อง', 'ความรัก', 'นี่', ' ', 'ความ', 'ฉลาด', 'โง่', 'นี่', 'วัด', 'ไม่', 'ได้', 'เลย', ' ', 'มัน', 'ซับซ้อน', 'มาก', 'ๆ', ' ', 'หาก', 'ใคร', 'เกิด', 'มา', 'โชคดี', 'จิตใจ', 'เข้มแข็ง', 'พอที่จะ', 'ตัด', 'ได้', 'ก็ดี', ' ', 'บางคน', 'ความรัก', 'นี้', 'อาจจะ', 'เป็นครั้งแรก', 'ครั้ง', 'เดียว', 'ที่', 'มี', 'คน', 'มา', 'ดี', 'ด้วย', 'เลย', 'ยอม', 'มี', 'ไว้', 'ก็ได้', ' ', 'พูด', 'ยาก', 'นะ']"
1986722583199502514,twitter,post,https://x.com/nekosama_des/status/1986722583199502514,text,2025-11-07T09:09:10.000Z,selenium_x_scraper_v1,ผมที่พยายามไล่แฟนพี่ชายไปให้ไปจากคนผี ๆ คนนี้เถอะ และใช่ เค้าไม่ยอมไปสักทีเพียงเพราะรอให้เค้าเปลี่ยนแปลง ซึ่งมันไม่เปลี่ยน ผมรู้จักพี่ผมยังไม่ดีพอเลย จริงที่มันรักครอบครัว แต่มันทำคนอื่นเดือดร้อนก็ไม่ไหว พ่อแม่แบกหลังหัก สุดท้ายกลายเป็นห่วงพี่ชายคนโตของบ้าน กุลอยลำละ,ผมที่พยายามไล่แฟนพี่ชายไปให้ไปจากคนผี ๆ คนนี้เถอะ และใช่ เค้าไม่ยอมไปสักทีเพียงเพราะรอให้เค้าเปลี่ยนแปลง ซึ่งมันไม่เปลี่ยน ผมรู้จักพี่ผมยังไม่ดีพอเลย จริงที่มันรักครอบครัว แต่มันทำคนอื่นเดือดร้อนก็ไม่ไหว พ่อแม่แบกหลังหัก สุดท้ายกลายเป็นห่วงพี่ชายคนโตของบ้าน กุลอยลำละ,2025-11-29 08:18:55,"['ผม', 'ที่', 'พยายาม', 'ไล่', 'แฟน', 'พี่ชาย', 'ไป', 'ให้', 'ไป', 'จาก', 'คน', 'ผี', ' ', 'ๆ', ' ', 'คน', 'นี้', 'เถอะ', ' ', 'และ', 'ใช่', ' ', 'เค้า', 'ไม่', 'ยอม', 'ไป', 'สักที', 'เพียง', 'เพราะ', 'รอ', 'ให้', 'เค้า', 'เปลี่ยนแปลง', ' ', 'ซึ่ง', 'มัน', 'ไม่', 'เปลี่ยน', ' ', 'ผม', 'รู้จัก', 'พี่', 'ผม', 'ยัง', 'ไม่', 'ดี', 'พอ', 'เลย', ' ', 'จริง', 'ที่', 'มัน', 'รัก', 'ครอบครัว', ' ', 'แต่', 'มัน', 'ทำ', 'คนอื่น', 'เดือดร้อน', 'ก็', 'ไม่', 'ไหว', ' ', 'พ่อแม่', 'แบก', 'หลัง', 'หัก', ' ', 'สุดท้าย', 'กลาย', 'เป็นห่วง', 'พี่ชาย', 'คนโต', 'ของ', 'บ้าน', ' ', 'กุ', 'ลอยลำ', 'ละ']"
1986676044737413403,twitter,post,https://x.com/Casia27/status/1986676044737413403,text,2025-11-07T06:04:14.000Z,selenium_x_scraper_v1,จริงๆเป็นมนุษย์เองรึเปล่าที่romanticize ความรักว่ามีแล้วต้องช่วยกันพัฒนาตัวตนของกันและกัน ในเมื่อความจริงความรักเป็นสิ่งที่ถูกนิยามขึ้น จริงๆมันคือการหลั่งฮอร์โมนเพื่อเป็นแรงจูงใจให้สืบเผ่าพันธุ์เหมือนที่สัตว์มีฤดูผสมพันธุ์,จริงๆเป็นมนุษย์เองรึเปล่าที่romanticize ความรักว่ามีแล้วต้องช่วยกันพัฒนาตัวตนของกันและกัน ในเมื่อความจริงความรักเป็นสิ่งที่ถูกนิยามขึ้น จริงๆมันคือการหลั่งฮอร์โมนเพื่อเป็นแรงจูงใจให้สืบเผ่าพันธุ์เหมือนที่สัตว์มีฤดูผสมพันธุ์,2025-11-29 08:18:55,"['จริงๆ', 'เป็น', 'มนุษย์', 'เอง', 'รึเปล่า', 'ที่', 'romanticize', ' ', 'ความรัก', 'ว่า', 'มี', 'แล้ว', 'ต้อง', 'ช่วยกัน', 'พัฒนา', 'ตัวตน', 'ของ', 'กันและกัน', ' ', 'ใน', 'เมื่อ', 'ความจริง', 'ความรัก', 'เป็น', 'สิ่ง', 'ที่', 'ถูก', 'นิยาม', 'ขึ้น', ' ', 'จริงๆ', 'มัน', 'คือ', 'การ', 'หลั่ง', 'ฮอร์โมน', 'เพื่อ', 'เป็น', 'แรงจูงใจ', 'ให้', 'สืบ', 'เผ่าพันธุ์', 'เหมือน', 'ที่', 'สัตว์', 'มี', 'ฤดู', 'ผสมพันธุ์']"
1986411226617012674,twitter,post,https://x.com/callmeeGRANDE/status/1986411226617012674,text,2025-11-06T12:31:56.000Z,selenium_x_scraper_v1,เก่งมาจากไหนก่โง่ได้เรื่องความรักนะ มันไม่ใช่ rational เลยอ่ะ เลยไม่เคยเชื่อlove guruสักคน จบ,เก่งมาจากไหนก่โง่ได้เรื่องความรักนะ มันไม่ใช่ rational เลยอ่ะ เลยไม่เคยเชื่อlove guruสักคน จบ,2025-11-29 08:18:55,"['เก่ง', 'มาจาก', 'ไหน', 'ก่', 'โง่', 'ได้เรื่อง', 'ความรัก', 'นะ', ' ', 'มัน', 'ไม่', 'ใช่', ' ', 'rational', ' ', 'เลย', 'อ่ะ', ' ', 'เลย', 'ไม่', 'เคย', 'เชื่อ', 'love', ' ', 'guru', 'สัก', 'คน', ' ', 'จบ']"
1986429756993331657,twitter,post,https://x.com/foreverko1025/status/1986429756993331657,text,2025-11-06T13:45:34.000Z,selenium_x_scraper_v1,แฟนคนแรก(ที่คบจริงจัง)เราได้เป็นตัวเองเต็มที่ มีความสุข รู้สึกได้ถึงความรักจริงๆ พากันกินเที่ยวฉ่ำๆ แฟนคนที่2 แรกๆดีมาก พอคบกันแล้วรู้สึกกดดัน เหมือนทำอะไรก็ไม่ได้ดั่งใจเค้าเลย เครียด น้ำหนักลด ไม่เป็นตัวของตัวเอง พยายามจนดูไร้ค่า สุดท้ายเค้าไม่รัก 555555555,แฟนคนแรก(ที่คบจริงจัง)เราได้เป็นตัวเองเต็มที่ มีความสุข รู้สึกได้ถึงความรักจริงๆ พากันกินเที่ยวฉ่ำๆ แฟนคนที่2 แรกๆดีมาก พอคบกันแล้วรู้สึกกดดัน เหมือนทำอะไรก็ไม่ได้ดั่งใจเค้าเลย เครียด น้ำหนักลด ไม่เป็นตัวของตัวเอง พยายามจนดูไร้ค่า สุดท้ายเค้าไม่รัก 555555555,2025-11-29 08:18:55,"['แฟน', 'คน', 'แรก', ' ', 'ที่', 'คบ', 'จริงจัง', ' ', 'เรา', 'ได้', 'เป็น', 'ตัวเอง', 'เต็มที่', ' ', 'มีความสุข', ' ', 'รู้สึก', 'ได้', 'ถึง', 'ความรัก', 'จริงๆ', ' ', 'พา', 'กัน', 'กิน', 'เที่ยว', 'ฉ่ำ', 'ๆ', ' ', 'แฟน', 'คน', 'ที่', '2', ' ', 'แรก', 'ๆ', 'ดีมาก', ' ', 'พอ', 'คบ', 'กัน', 'แล้ว', 'รู้สึก', 'กดดัน', ' ', 'เหมือน', 'ทำ', 'อะไร', 'ก็', 'ไม่', 'ได้', 'ดั่ง', 'ใจ', 'เค้า', 'เลย', ' ', 'เครียด', ' ', 'น้ำหนัก', 'ลด', ' ', 'ไม่', 'เป็นตัวของตัวเอง', ' ', 'พยายาม', 'จน', 'ดู', 'ไร้ค่า', ' ', 'สุดท้าย', 'เค้า', 'ไม่', 'รัก', ' ', 'หัวเราะ']"
1986434040300490904,twitter,post,https://x.com/couldUlovemepls/status/1986434040300490904,text,2025-11-06T14:02:36.000Z,selenium_x_scraper_v1,เคยลองพยายามจะถอดสมองแล้วแต่ทำไม่ได้จริงเพราะอีโก้สูงเท่าฟ้าฟีลเหมือนไปยืนที่หน้าผาใจพร้อมโดดแต่สมองบอกมึงอย่าทำตัวน่าสมเพช เลยยังไม่เคยไปสุดกับความรักสักทีกั๊กเผื่อใจไว้ตลอด แล้วตอนที่ยังคิดไม่ได้ว่านี่คือการรักตัวเองดันไปอิจฉาคนที่ทุ่มสุดตัวกับความรักคิดว่าเขาค่ตเท่มาตลอด,เคยลองพยายามจะถอดสมองแล้วแต่ทำไม่ได้จริงเพราะอีโก้สูงเท่าฟ้าฟีลเหมือนไปยืนที่หน้าผาใจพร้อมโดดแต่สมองบอกมึงอย่าทำตัวน่าสมเพช เลยยังไม่เคยไปสุดกับความรักสักทีกั๊กเผื่อใจไว้ตลอด แล้วตอนที่ยังคิดไม่ได้ว่านี่คือการรักตัวเองดันไปอิจฉาคนที่ทุ่มสุดตัวกับความรักคิดว่าเขาค่ตเท่มาตลอด,2025-11-29 08:18:55,"['เคย', 'ลอง', 'พยายาม', 'จะ', 'ถอด', 'สมอง', 'แล้วแต่', 'ทำ', 'ไม่', 'ได้', 'จริง', 'เพราะ', 'อี', 'โก้', 'สูง', 'เท่า', 'ฟ้า', 'ฟี', 'ล', 'เหมือน', 'ไป', 'ยืน', 'ที่', 'หน้าผา', 'ใจ', 'พร้อม', 'โดด', 'แต่', 'สมอง', 'บอก', 'มึง', 'อย่า', 'ทำตัว', 'น่าสมเพช', ' ', 'เลย', 'ยัง', 'ไม่', 'เคย', 'ไป', 'สุด', 'กับ', 'ความรัก', 'สักที', 'กั๊ก', 'เผื่อ', 'ใจ', 'ไว้', 'ตลอด', ' ', 'แล้ว', 'ตอนที่', 'ยัง', 'คิด', 'ไม่', 'ได้', 'ว่า', 'นี่', 'คือ', 'การ', 'รัก', 'ตัวเอง', 'ดัน', 'ไป', 'อิจฉา', 'คน', 'ที่', 'ทุ่ม', 'สุดตัว', 'กับ', 'ความรัก', 'คิด', 'ว่า', 'เขา', 'ค่ต', 'เท่', 'มา', 'ตลอด']"
1986675037131448453,twitter,post,https://x.com/IPoR1/status/1986675037131448453,text,2025-11-07T06:00:14.000Z,selenium_x_scraper_v1,"ขอนอกเรื่อง เหมือนหมอดูชอบพูดว่า เวลาขอเนื้อคู่กับสิ่งศักดิ์สิทธิ์ ถ้ายังไม่ถึงเวลา ท่านก็ไม่ให้ เพราะเราต้องผ่านการ healing childhood trauma ก่อน, ผ่าน dark  night of the soul แล้วนี่ก็รู้สึกแบบนั้นจริงๆนะ บางช่วงจังหวะเราก็ไม่พร้อมจะมีความรักหรอก จนกว่าจะ healing","ขอนอกเรื่อง เหมือนหมอดูชอบพูดว่า เวลาขอเนื้อคู่กับสิ่งศักดิ์สิทธิ์ ถ้ายังไม่ถึงเวลา ท่านก็ไม่ให้ เพราะเราต้องผ่านการ healing childhood trauma ก่อน, ผ่าน dark  night of the soul แล้วนี่ก็รู้สึกแบบนั้นจริงๆนะ บางช่วงจังหวะเราก็ไม่พร้อมจะมีความรักหรอก จนกว่าจะ healing",2025-11-29 08:18:55,"['ขอ', 'นอกเรื่อง', ' ', 'เหมือน', 'หมอดู', 'ชอบ', 'พูดว่า', ' ', 'เวลา', 'ขอ', 'เนื้อคู่', 'กับ', 'สิ่งศักดิ์สิทธิ์', ' ', 'ถ้า', 'ยัง', 'ไม่', 'ถึง', 'เวลา', ' ', 'ท่าน', 'ก็', 'ไม่', 'ให้', ' ', 'เพราะ', 'เรา', 'ต้อง', 'ผ่าน', 'การ', ' ', 'healing', ' ', 'childhood', ' ', 'trauma', ' ', 'ก่อน', ',', ' ', 'ผ่าน', ' ', 'dark', ' ', 'night', ' ', 'of', ' ', 'the', ' ', 'soul', ' ', 'แล้ว', 'นี่', 'ก็', 'รู้สึก', 'แบบ', 'นั้น', 'จริงๆ', 'นะ', ' ', 'บาง', 'ช่วง', 'จังหวะ', 'เรา', 'ก็', 'ไม่', 'พร้อม', 'จะ', 'มี', 'ความรัก', 'หรอก', ' ', 'จนกว่า', 'จะ', ' ', 'healing']"
