id,platform,platform_type,url,content_type,timestamp,scraper_module,text,raw_text,scrape_date,tokens
1976560306936836452,twitter,post,https://x.com/Nalynn656/status/1976560306936836452,text,2025-10-10T08:07:54.000Z,selenium_x_scraper_v1,นิ้วเล็กมากอ่ะ,นิ้วเล็กมากอ่ะ,2025-10-23 17:59:34,"['นิ้ว', 'เล็ก', 'มาก', 'อ่ะ']"
1980107536704618826,twitter,post,https://x.com/tempolyn/status/1980107536704618826,text,2025-10-20T03:03:20.000Z,selenium_x_scraper_v1,ยี้ไอแห้งมือสาก,ยี้ไอแห้งมือสาก,2025-10-23 17:59:34,"['ยี้', 'ไอ', 'แห้ง', 'มือ', 'สาก']"
1976595369636348025,twitter,post,https://x.com/luckyseyo/status/1976595369636348025,text,2025-10-10T10:27:14.000Z,selenium_x_scraper_v1,พยายามเบ่งกล้ามนิ้ว555555555,พยายามเบ่งกล้ามนิ้ว555555555,2025-10-23 17:59:34,"['พยายาม', 'เบ่ง', 'กล้าม', 'นิ้ว', 'หัวเราะ']"
1979695232372670616,twitter,post,https://x.com/figntdafagbitch/status/1979695232372670616,text,2025-10-18T23:44:59.000Z,selenium_x_scraper_v1,อ่านโควทอันนี้มาสังคมทวิตโหดจริง อุส่าโชว์มือเท่ๆให้ดู แม่งมาขำอะไรกัน,อ่านโควทอันนี้มาสังคมทวิตโหดจริง อุส่าโชว์มือเท่ๆให้ดู แม่งมาขำอะไรกัน,2025-10-23 17:59:34,"['อ่าน', 'โค', 'วท', 'อันนี้', 'มา', 'สังคม', 'ทวิ', 'ต', 'โหด', 'จริง', ' ', 'อุ', 'ส่า', 'โชว์', 'มือ', 'เท่', 'ๆ', 'ให้', 'ดู', ' ', 'แม่', 'ง', 'มา', 'ขำ', 'อะไร', 'กัน']"
1976482320237650018,twitter,post,https://x.com/lordnuad/status/1976482320237650018,text,2025-10-10T02:58:01.000Z,selenium_x_scraper_v1,นึกว่าตีนไก่,นึกว่าตีนไก่,2025-10-23 17:59:34,"['นึก', 'ว่า', 'ตีน', 'ไก่']"
1960911962562273560,twitter,post,https://x.com/Tim8666/status/1960911962562273560,text,2025-08-28T03:46:58.000Z,selenium_x_scraper_v1,"if you’re offended by what i say, imagine what i’m thinking","if you’re offended by what i say, imagine what i’m thinking",2025-10-23 17:59:34,"['if', ' ', 'you', ' ', 're', ' ', 'offended', ' ', 'by', ' ', 'what', ' ', 'i', ' ', 'say', ',', ' ', 'imagine', ' ', 'what', ' ', 'i', ' ', 'm', ' ', 'thinking']"
1981420025111331036,twitter,post,https://x.com/Tim8666/status/1981420025111331036,text,2025-10-23T17:58:41.000Z,selenium_x_scraper_v1,การเรียกทุกคน ที่ไม่เห็นด้วยกับตัวเองว่าชายแท้ คือสัญญานของมนุษย์ IQต่ำ,การเรียกทุกคน ที่ไม่เห็นด้วยกับตัวเองว่าชายแท้ คือสัญญานของมนุษย์ IQต่ำ,2025-10-23 17:59:34,"['การ', 'เรียก', 'ทุกคน', ' ', 'ที่', 'ไม่', 'เห็นด้วย', 'กับ', 'ตัวเอง', 'ว่า', 'ชาย', 'แท้', ' ', 'คือ', 'สัญญา', 'นข', 'อง', 'มนุษย์', ' ', 'iq', 'ต่ำ']"
1981173306347966793,twitter,post,https://x.com/VanChotimont/status/1981173306347966793,text,2025-10-23T01:38:19.000Z,selenium_x_scraper_v1,มันเป็น linguistic dominance / linguistic power play: การใช้อำนาจกดทับทางภาษาอย่างนึงอะ ยกตัวเองว่าฉลาดกว่าฝ่ายตรงข้าม สิ่งที่ชั้นพูด สมองโง่ ๆ อย่างแกไม่มีทางเข้าใจหรอก แล้วภาษาก็มักจะเวอร์ ๆ กว่าปกติด้วย,มันเป็น linguistic dominance / linguistic power play: การใช้อำนาจกดทับทางภาษาอย่างนึงอะ ยกตัวเองว่าฉลาดกว่าฝ่ายตรงข้าม สิ่งที่ชั้นพูด สมองโง่ ๆ อย่างแกไม่มีทางเข้าใจหรอก แล้วภาษาก็มักจะเวอร์ ๆ กว่าปกติด้วย,2025-10-23 17:59:34,"['มัน', 'เป็น', ' ', 'linguistic', ' ', 'dominance', ' ', 'linguistic', ' ', 'power', ' ', 'play', ' ', 'การ', 'ใช้อำนาจ', 'กด', 'ทับ', 'ทาง', 'ภาษา', 'อย่าง', 'นึง', 'อะ', ' ', 'ยก', 'ตัวเอง', 'ว่า', 'ฉลาด', 'กว่า', 'ฝ่ายตรงข้าม', ' ', 'สิ่ง', 'ที่', 'ชั้น', 'พูด', ' ', 'สมอง', 'โง่', ' ', 'ๆ', ' ', 'อย่าง', 'แก', 'ไม่', 'มีทาง', 'เข้าใจ', 'หรอก', ' ', 'แล้ว', 'ภาษา', 'ก็', 'มักจะ', 'เวอร์', ' ', 'ๆ', ' ', 'กว่า', 'ปกติ', 'ด้วย']"
1981237233148641630,twitter,post,https://x.com/richtobegal/status/1981237233148641630,text,2025-10-23T05:52:20.000Z,selenium_x_scraper_v1,,,2025-10-23 17:59:34,[]
1981332487919063448,twitter,post,https://x.com/Tim8666/status/1981332487919063448,text,2025-10-23T12:10:51.000Z,selenium_x_scraper_v1,แอคนี้ ดูมีปัญหากับกุจังเนาะ55555,แอคนี้ ดูมีปัญหากับกุจังเนาะ55555,2025-10-23 17:59:34,"['แอ', 'ค', 'นี้', ' ', 'ดู', 'มีปัญหา', 'กับ', 'กุ', 'จัง', 'เนาะ', 'หัวเราะ']"
1980869419736924327,twitter,post,https://x.com/Tim8666/status/1980869419736924327,text,2025-10-22T05:30:47.000Z,selenium_x_scraper_v1,เด็ก ม บูรพา มันโง่แบบนี้ทุกคนมั้ยคับ,เด็ก ม บูรพา มันโง่แบบนี้ทุกคนมั้ยคับ,2025-10-23 17:59:34,"['เด็ก', ' ', 'ม', ' ', 'บูรพา', ' ', 'มัน', 'โง่', 'แบบนี้', 'ทุกคน', 'มั้ย', 'คับ']"
1980559501658059227,twitter,post,https://x.com/drunkasalord73/status/1980559501658059227,text,2025-10-21T08:59:16.000Z,selenium_x_scraper_v1,"คืออันนี้สงสัยเฉยๆ ว่าเราต้องเห็นทุกทวีตที่แมสเลยเหรอ? ก็ไม่จำเป็นมั้ยนะ 
คนชมมีเยอะอยู่นะ ตราบใดที่เค้าไม่ได้มาด่าเราตรงๆ ก็ไม่เห็นจำเป็นต้องใส่ใจเสียงเล็กเสียงจ้อยอ่ะค่ะ เค้าก็ทวีตของเค้าเฉยๆ นี่อ่านก็ไม่รู้หรอกว่าใครคิดว่าชีบ่นคนในยิมด้วยซ้ำ เพราะนี่ก็ไม่ได้เห็นทุกทวีตที่แมส","คืออันนี้สงสัยเฉยๆ ว่าเราต้องเห็นทุกทวีตที่แมสเลยเหรอ? ก็ไม่จำเป็นมั้ยนะ 
คนชมมีเยอะอยู่นะ ตราบใดที่เค้าไม่ได้มาด่าเราตรงๆ ก็ไม่เห็นจำเป็นต้องใส่ใจเสียงเล็กเสียงจ้อยอ่ะค่ะ เค้าก็ทวีตของเค้าเฉยๆ นี่อ่านก็ไม่รู้หรอกว่าใครคิดว่าชีบ่นคนในยิมด้วยซ้ำ เพราะนี่ก็ไม่ได้เห็นทุกทวีตที่แมส",2025-10-23 17:59:34,"['คือ', 'อันนี้', 'สงสัย', 'เฉย', 'ๆ', ' ', 'ว่า', 'เรา', 'ต้อง', 'เห็น', 'ทุก', 'ทวีต', 'ที่', 'แมส', 'เลย', 'เหรอ', '?', ' ', 'ก็', 'ไม่', 'จำเป็น', 'มั้ย', 'นะ', ' ', 'คน', 'ชม', 'มี', 'เยอะ', 'อยู่', 'นะ', ' ', 'ตราบใดที่', 'เค้า', 'ไม่', 'ได้มา', 'ด่า', 'เรา', 'ตรงๆ', ' ', 'ก็', 'ไม่', 'เห็น', 'จำเป็นต้อง', 'ใส่ใจ', 'เสียง', 'เล็ก', 'เสียง', 'จ้อย', 'อ่ะ', 'ค่ะ', ' ', 'เค้า', 'ก็', 'ทวีต', 'ของ', 'เค้า', 'เฉย', 'ๆ', ' ', 'นี่', 'อ่าน', 'ก็', 'ไม่', 'รู้', 'หรอ', 'กว่า', 'ใคร', 'คิด', 'ว่า', 'ชี', 'บ่น', 'คนใน', 'ยิม', 'ด้วยซ้ำ', ' ', 'เพราะ', 'นี่', 'ก็', 'ไม่', 'ได้', 'เห็น', 'ทุก', 'ทวีต', 'ที่', 'แมส']"
1980487874199056621,twitter,post,https://x.com/itsknxm/status/1980487874199056621,text,2025-10-21T04:14:39.000Z,selenium_x_scraper_v1,"แต่ก็รีทวิตชายแท้ที่ด่าคุณเฟิร์นฉ่ำ โกรธเขาแหละ อยากด่าแต่ไม่กล้าด่าเอง55555555555555555 And now mentioning about my body? What’s wrong with that? English doesn’t make you any better boo. If you want to express yourself in English, then do it in the first place. I can read ","แต่ก็รีทวิตชายแท้ที่ด่าคุณเฟิร์นฉ่ำ โกรธเขาแหละ อยากด่าแต่ไม่กล้าด่าเอง55555555555555555 And now mentioning about my body? What’s wrong with that? English doesn’t make you any better boo. If you want to express yourself in English, then do it in the first place. I can read ",2025-10-23 17:59:34,"['แต่', 'ก็', 'รี', 'ทวิ', 'ต', 'ชาย', 'แท้', 'ที่', 'ด่า', 'คุณ', 'เฟิร์น', 'ฉ่ำ', ' ', 'โกรธ', 'เขา', 'แหละ', ' ', 'อยาก', 'ด่า', 'แต่', 'ไม่', 'กล้า', 'ด่า', 'เอง', 'หัวเราะ', ' ', 'and', ' ', 'now', ' ', 'mentioning', ' ', 'about', ' ', 'my', ' ', 'body', '?', ' ', 'what', ' ', 's', ' ', 'wrong', ' ', 'with', ' ', 'that', '?', ' ', 'english', ' ', 'doesn', ' ', 't', ' ', 'make', ' ', 'you', ' ', 'any', ' ', 'better', ' ', 'boo', '.', ' ', 'if', ' ', 'you', ' ', 'want', ' ', 'to', ' ', 'express', ' ', 'yourself', ' ', 'in', ' ', 'english', ',', ' ', 'then', ' ', 'do', ' ', 'it', ' ', 'in', ' ', 'the', ' ', 'first', ' ', 'place', '.', ' ', 'i', ' ', 'can', ' ', 'read']"
1980851941812150526,twitter,post,https://x.com/Tim8666/status/1980851941812150526,text,2025-10-22T04:21:20.000Z,selenium_x_scraper_v1,Is ชายแท้ in the room with us?,Is ชายแท้ in the room with us?,2025-10-23 17:59:34,"['is', ' ', 'ชาย', 'แท้', ' ', 'in', ' ', 'the', ' ', 'room', ' ', 'with', ' ', 'us', '?']"
1980288742729584870,twitter,post,https://x.com/Vegetab2728/status/1980288742729584870,text,2025-10-20T15:03:22.000Z,selenium_x_scraper_v1,"- อะไรที่ทำให้คิดว่าฉันกับเพื่อนหมายถึงคุณค่ะ ? มี keyword อะไรที่เฉพาะเจาะจงถึงคุณคนเดียวนะ อยากทราบค่ะเห็นแคปไปแขวนขนาดนี้
- X มี function ให้โควทได้นะคะ ถ้ามั่นใจว่าหมายถึงคุณจริงๆ โควทต่อได้เลยค่ะ","- อะไรที่ทำให้คิดว่าฉันกับเพื่อนหมายถึงคุณค่ะ ? มี keyword อะไรที่เฉพาะเจาะจงถึงคุณคนเดียวนะ อยากทราบค่ะเห็นแคปไปแขวนขนาดนี้
- X มี function ให้โควทได้นะคะ ถ้ามั่นใจว่าหมายถึงคุณจริงๆ โควทต่อได้เลยค่ะ",2025-10-23 17:59:34,"['อะไร', 'ที่', 'ทำให้', 'คิด', 'ว่า', 'ฉัน', 'กับ', 'เพื่อน', 'หมายถึง', 'คุณ', 'ค่ะ', ' ', '?', ' ', 'มี', ' ', 'keyword', ' ', 'อะไร', 'ที่', 'เฉพาะเจาะจง', 'ถึง', 'คุณ', 'คนเดียว', 'นะ', ' ', 'อยาก', 'ทราบ', 'ค่ะ', 'เห็น', 'แคป', 'ไป', 'แขวน', 'ขนาด', 'นี้', ' ', 'x', ' ', 'มี', ' ', 'function', ' ', 'ให้', 'โค', 'วท', 'ได้', 'นะคะ', ' ', 'ถ้า', 'มั่นใจ', 'ว่า', 'หมายถึง', 'คุณ', 'จริงๆ', ' ', 'โค', 'วท', 'ต่อ', 'ได้', 'เลย', 'ค่ะ']"
1980200237261304167,twitter,post,https://x.com/Eig_Banphot/status/1980200237261304167,text,2025-10-20T09:11:41.000Z,selenium_x_scraper_v1," หุ้นเวียดนามร่วงแรงสุดในรอบครึ่งปี หวั่นวิกฤตสินเชื่อกลับมาอีกครั้ง
.
ตลาดหุ้นเวียดนามดิ่งลงกว่า 5.5% ในวันจันทร์ (20 ต.ค.) ซึ่งเป็นการร่วงแรงที่สุดในรอบ 6 เดือน หลังมีรายงานว่ารัฐบาลตรวจสอบบริษัทออกพันธบัตร 67 แห่ง และพบการ “ทำผิดหลายรายการ” เช่น ใช้เงินไม่ตรงวัตถุประสงค์"," หุ้นเวียดนามร่วงแรงสุดในรอบครึ่งปี หวั่นวิกฤตสินเชื่อกลับมาอีกครั้ง
.
ตลาดหุ้นเวียดนามดิ่งลงกว่า 5.5% ในวันจันทร์ (20 ต.ค.) ซึ่งเป็นการร่วงแรงที่สุดในรอบ 6 เดือน หลังมีรายงานว่ารัฐบาลตรวจสอบบริษัทออกพันธบัตร 67 แห่ง และพบการ “ทำผิดหลายรายการ” เช่น ใช้เงินไม่ตรงวัตถุประสงค์",2025-10-23 17:59:34,"['หุ้น', 'เวียดนาม', 'ร่วง', 'แรง', 'สุด', 'ใน', 'รอบ', 'ครึ่ง', 'ปี', ' ', 'หวั่น', 'วิกฤต', 'สินเชื่อ', 'กลับมา', 'อีกครั้ง', ' ', '.', ' ', 'ตลาดหุ้น', 'เวียดนาม', 'ดิ่ง', 'ลง', 'กว่า', ' ', '5.5', ' ', 'ใน', 'วัน', 'จันทร์', ' ', '20', ' ', 'ต.ค.', ' ', 'ซึ่ง', 'เป็น', 'การร่วง', 'แรง', 'ที่สุด', 'ใน', 'รอบ', ' ', '6', ' ', 'เดือน', ' ', 'หลัง', 'มี', 'รายงาน', 'ว่า', 'รัฐบาล', 'ตรวจสอบ', 'บริษัท', 'ออก', 'พันธบัตร', ' ', '67', ' ', 'แห่ง', ' ', 'และ', 'พบ', 'การ', ' ', 'ทำผิด', 'หลาย', 'รายการ', ' ', 'เช่น', ' ', 'ใช้', 'เงิน', 'ไม่', 'ตรง', 'วัตถุประสงค์']"
1980068119600324899,twitter,post,https://x.com/BrianEastwood_X/status/1980068119600324899,text,2025-10-20T00:26:42.000Z,selenium_x_scraper_v1,She’s been terminated! Keep using your voice patriots!,She’s been terminated! Keep using your voice patriots!,2025-10-23 17:59:34,"['she', ' ', 's', ' ', 'been', ' ', 'terminated', '!', ' ', 'keep', ' ', 'using', ' ', 'your', ' ', 'voice', ' ', 'patriots', '!']"
1980543148389724338,twitter,post,https://x.com/Tim8666/status/1980543148389724338,text,2025-10-21T07:54:17.000Z,selenium_x_scraper_v1,เป็นการขอดูควยที่ตลกที่สุดในชีวิต แงๆ,เป็นการขอดูควยที่ตลกที่สุดในชีวิต แงๆ,2025-10-23 17:59:34,"['เป็นการ', 'ขอ', 'ดู', 'ควย', 'ที่', 'ตลก', 'ที่สุด', 'ใน', 'ชีวิต', ' ', 'แง', 'ๆ']"
1979913236242690123,twitter,post,https://x.com/realtmm1133/status/1979913236242690123,text,2025-10-19T14:11:15.000Z,selenium_x_scraper_v1,มันไม่ใช่โป๊ไม่โป๊ แต่ประเด็นมันคือไปสาระแนกับการแต่งตัวของชาวบ้านเขาทำไม,มันไม่ใช่โป๊ไม่โป๊ แต่ประเด็นมันคือไปสาระแนกับการแต่งตัวของชาวบ้านเขาทำไม,2025-10-23 17:59:34,"['มัน', 'ไม่', 'ใช่', 'โป๊', 'ไม่', 'โป๊', ' ', 'แต่', 'ประเด็น', 'มัน', 'คือ', 'ไป', 'สาระแน', 'กับ', 'การ', 'แต่งตัว', 'ของ', 'ชาวบ้าน', 'เขา', 'ทำไม']"
1980535035943100740,twitter,post,https://x.com/XalFa3381/status/1980535035943100740,text,2025-10-21T07:22:03.000Z,selenium_x_scraper_v1,ก็มึงเม้นตลกอะ55555 เหมือนอีแก่หน้าเกลียดชั้นต่ำอะมึง,ก็มึงเม้นตลกอะ55555 เหมือนอีแก่หน้าเกลียดชั้นต่ำอะมึง,2025-10-23 17:59:34,"['ก็', 'มึง', 'เม้น', 'ตลก', 'อะ', 'หัวเราะ', ' ', 'เหมือน', 'อีแก่', 'หน้า', 'เกลียด', 'ชั้นต่ำ', 'อะ', 'มึง']"
1980537774643306836,twitter,post,https://x.com/Tim8666/status/1980537774643306836,text,2025-10-21T07:32:56.000Z,selenium_x_scraper_v1,ยังไม่ถึง30เลยจ้า ถ้ากุแก่มึงคงตายแล้ว,ยังไม่ถึง30เลยจ้า ถ้ากุแก่มึงคงตายแล้ว,2025-10-23 17:59:34,"['ยัง', 'ไม่', 'ถึง', '30', 'เลย', 'จ้า', ' ', 'ถ้า', 'กุ', 'แก่', 'มึง', 'คง', 'ตาย', 'แล้ว']"
1980529966480851007,twitter,post,https://x.com/babebluerubybae/status/1980529966480851007,text,2025-10-21T07:01:55.000Z,selenium_x_scraper_v1,ไม่มีหลักฐานขอปัดว่าควยเล็กเท่าไส้กรอกแดงตราแหลมทอง,ไม่มีหลักฐานขอปัดว่าควยเล็กเท่าไส้กรอกแดงตราแหลมทอง,2025-10-23 17:59:34,"['ไม่', 'มี', 'หลักฐาน', 'ขอ', 'ปัด', 'ว่า', 'ควย', 'เล็ก', 'เท่า', 'ไส้กรอก', 'แดง', 'ตรา', 'แหลมทอง']"
1980532161465004259,twitter,post,https://x.com/Tim8666/status/1980532161465004259,text,2025-10-21T07:10:38.000Z,selenium_x_scraper_v1,จะหลอกดูควย ก็เนียน กว่านี้ อิอิ,จะหลอกดูควย ก็เนียน กว่านี้ อิอิ,2025-10-23 17:59:34,"['จะ', 'หลอก', 'ดู', 'ควย', ' ', 'ก็', 'เนียน', ' ', 'กว่า', 'นี้', ' ', 'อิอิ']"
1980479738520170522,twitter,post,https://x.com/XalFa3381/status/1980479738520170522,text,2025-10-21T03:42:19.000Z,selenium_x_scraper_v1,แต่เราก็ไม่ต้องไปสาระแนก็ได้นะคะ มันเสือกอะค่ะ หรือไม่จริงเอ่ย?,แต่เราก็ไม่ต้องไปสาระแนก็ได้นะคะ มันเสือกอะค่ะ หรือไม่จริงเอ่ย?,2025-10-23 17:59:34,"['แต่', 'เรา', 'ก็', 'ไม่ต้อง', 'ไป', 'สาระแน', 'ก็ได้', 'นะคะ', ' ', 'มัน', 'เสือก', 'อะ', 'ค่ะ', ' ', 'หรือไม่', 'จริง', 'เอ่ย', '?']"
1980527897032229244,twitter,post,https://x.com/Tim8666/status/1980527897032229244,text,2025-10-21T06:53:41.000Z,selenium_x_scraper_v1,แล้วมึงเสือกอะไรเม้นกุเอ่ย กุตอบใต้โพสต์แม่มึงมั้ย,แล้วมึงเสือกอะไรเม้นกุเอ่ย กุตอบใต้โพสต์แม่มึงมั้ย,2025-10-23 17:59:34,"['แล้ว', 'มึง', 'เสือก', 'อะไร', 'เม้น', 'กุ', 'เอ่ย', ' ', 'กุ', 'ตอบ', 'ใต้', 'โพสต์', 'แม่', 'มึง', 'มั้ย']"
1980485708822487247,twitter,post,https://x.com/Tim8666/status/1980485708822487247,text,2025-10-21T04:06:03.000Z,selenium_x_scraper_v1,แอคนี้ อ้วนตัวแตกแน่ๆ,แอคนี้ อ้วนตัวแตกแน่ๆ,2025-10-23 17:59:34,"['แอ', 'ค', 'นี้', ' ', 'อ้วน', 'ตัว', 'แตก', 'แน่ๆ']"
1980526033087656349,twitter,post,https://x.com/babebluerubybae/status/1980526033087656349,text,2025-10-21T06:46:17.000Z,selenium_x_scraper_v1,ถ้าชั้นอ้วนมันก็ลดได้ แต่มึงควยเล็กมันทำให้ใหญ่ไม่ได้นะรู้ยัง,ถ้าชั้นอ้วนมันก็ลดได้ แต่มึงควยเล็กมันทำให้ใหญ่ไม่ได้นะรู้ยัง,2025-10-23 17:59:34,"['ถ้า', 'ชั้น', 'อ้วน', 'มัน', 'ก็', 'ลด', 'ได้', ' ', 'แต่', 'มึง', 'ควย', 'เล็ก', 'มัน', 'ทำให้', 'ใหญ่', 'ไม่', 'ได้', 'นะ', 'รู้', 'ยัง']"
1980526778470002956,twitter,post,https://x.com/Tim8666/status/1980526778470002956,text,2025-10-21T06:49:15.000Z,selenium_x_scraper_v1,ไม่เล็กแน่นอน ที่สำคัญยาวมาก แต่ไม่เย็ดหมาจ้า,ไม่เล็กแน่นอน ที่สำคัญยาวมาก แต่ไม่เย็ดหมาจ้า,2025-10-23 17:59:34,"['ไม่', 'เล็ก', 'แน่นอน', ' ', 'ที่', 'สำคัญ', 'ยาว', 'มาก', ' ', 'แต่', 'ไม่', 'เย็ด', 'หมา', 'จ้า']"
