id,platform,platform_type,url,content_type,timestamp,scraper_module,text,raw_text,scrape_date,tokens
1987179278078038190,twitter,post,https://x.com/dl_flower/status/1987179278078038190,text,2025-11-08T15:23:54.000Z,selenium_x_scraper_v1,เหมือนเพื่อนคนนึงที่ชอบมาเล่าว่าแฟน ปสด แต่ลืมเล่าว่าตัวเองเคยไปเที่ยวละนอกใจ,เหมือนเพื่อนคนนึงที่ชอบมาเล่าว่าแฟน ปสด แต่ลืมเล่าว่าตัวเองเคยไปเที่ยวละนอกใจ,2025-11-29 08:18:55,"['เหมือน', 'เพื่อน', 'คน', 'นึง', 'ที่', 'ชอบ', 'มา', 'เล่า', 'ว่า', 'แฟน', ' ', 'ปสด', ' ', 'แต่', 'ลืม', 'เล่า', 'ว่า', 'ตัวเอง', 'เคย', 'ไปเที่ยว', 'ละ', 'นอกใจ']"
1986886069217046644,twitter,post,https://x.com/Park_Pna/status/1986886069217046644,text,2025-11-07T19:58:48.000Z,selenium_x_scraper_v1,ละบางคนมีแต่เพื่อนเหี้ยๆ ให้ท้ายกันเอง อืมเอาเถอะนะ เกินจะเยียวยา,ละบางคนมีแต่เพื่อนเหี้ยๆ ให้ท้ายกันเอง อืมเอาเถอะนะ เกินจะเยียวยา,2025-11-29 08:18:55,"['ละ', 'บางคน', 'มี', 'แต่', 'เพื่อน', 'เหี้ย', 'ๆ', ' ', 'ให้ท้าย', 'กันเอง', ' ', 'อืม', 'เอาเถอะ', 'นะ', ' ', 'เกิน', 'จะ', 'เยียวยา']"
1986760730255974563,twitter,post,https://x.com/justinkku/status/1986760730255974563,text,2025-11-07T11:40:44.000Z,selenium_x_scraper_v1,จริงเล่าว่าแฟนเก่างี่เง่านั่นนี่อิดอกตอนนี้กุรู้ละ,จริงเล่าว่าแฟนเก่างี่เง่านั่นนี่อิดอกตอนนี้กุรู้ละ,2025-11-29 08:18:55,"['จริง', 'เล่า', 'ว่า', 'แฟน', 'เก่า', 'งี่เง่า', 'นั่น', 'นี่', 'อิด', 'อก', 'ตอนนี้', 'กุ', 'รู้', 'ละ']"
1986805636911464529,twitter,post,https://x.com/applegreenslice/status/1986805636911464529,text,2025-11-07T14:39:11.000Z,selenium_x_scraper_v1,จริง ถ้าอยู่ดีๆคนเราจะประสาทแดกทำไม ถ้าไม่มีสาเหตุ,จริง ถ้าอยู่ดีๆคนเราจะประสาทแดกทำไม ถ้าไม่มีสาเหตุ,2025-11-29 08:18:55,"['จริง', ' ', 'ถ้า', 'อยู่ดีๆ', 'คนเรา', 'จะ', 'ประสาท', 'แดก', 'ทำไม', ' ', 'ถ้า', 'ไม่', 'มี', 'สาเหตุ']"
1986677746882519183,twitter,post,https://x.com/babejornor/status/1986677746882519183,text,2025-11-07T06:11:00.000Z,selenium_x_scraper_v1,เพราะผชพวกนี้ไม่เคยมองว่าตัวเองเป็นตัวสาเหตุเลย,เพราะผชพวกนี้ไม่เคยมองว่าตัวเองเป็นตัวสาเหตุเลย,2025-11-29 08:18:55,"['เพราะ', 'ผช', 'พวก', 'นี้', 'ไม่', 'เคย', 'มองว่า', 'ตัวเอง', 'เป็นตัว', 'สาเหตุ', 'เลย']"
1987075388011594129,twitter,post,https://x.com/cigcharist/status/1987075388011594129,text,2025-11-08T08:31:05.000Z,selenium_x_scraper_v1,เออจริง,เออจริง,2025-11-29 08:18:55,"['เออ', 'จริง']"
1986626074676273449,twitter,post,https://x.com/bbitchyx92/status/1986626074676273449,text,2025-11-07T02:45:40.000Z,selenium_x_scraper_v1,จริงค่า บอกเราจู้จี้จุกจิกน่ารำคาญ ไม่ให้สเปซเลย เช็คทรศอยู่ได้ ตัดภาพมาที่ก่อนหน้านั้นเราให้สเปซเต็มที่ มันไปนัดเย็ดมากับคนทำแอคล็อค คนในทวิต คนคุยเก่า โห่ อิควาย ดีแต่กับมึงเนอะ เริ่ดที่สุดแล้ว ขี้เปียก,จริงค่า บอกเราจู้จี้จุกจิกน่ารำคาญ ไม่ให้สเปซเลย เช็คทรศอยู่ได้ ตัดภาพมาที่ก่อนหน้านั้นเราให้สเปซเต็มที่ มันไปนัดเย็ดมากับคนทำแอคล็อค คนในทวิต คนคุยเก่า โห่ อิควาย ดีแต่กับมึงเนอะ เริ่ดที่สุดแล้ว ขี้เปียก,2025-11-29 08:18:55,"['จริง', 'ค่า', ' ', 'บอก', 'เรา', 'จู้จี้จุกจิก', 'น่ารำคาญ', ' ', 'ไม่', 'ให้', 'สเปซ', 'เลย', ' ', 'เช็ค', 'ทร', 'ศอ', 'ยู่', 'ได้', ' ', 'ตัด', 'ภาพ', 'มา', 'ที่', 'ก่อนหน้า', 'นั้น', 'เรา', 'ให้', 'สเปซ', 'เต็มที่', ' ', 'มัน', 'ไป', 'นัด', 'เย็ด', 'มา', 'กับ', 'คน', 'ทำ', 'แอ', 'ค', 'ล็อค', ' ', 'คนใน', 'ทวิ', 'ต', ' ', 'คน', 'คุย', 'เก่า', ' ', 'โห่', ' ', 'อิ', 'ควาย', ' ', 'ดีแต่', 'กับ', 'มึง', 'เนอะ', ' ', 'เริ่ด', 'ที่สุด', 'แล้ว', ' ', 'ขี้', 'เปียก']"
1986625047948374227,twitter,post,https://x.com/KeriynChay/status/1986625047948374227,text,2025-11-07T02:41:35.000Z,selenium_x_scraper_v1,@ta_nontawat,@ta_nontawat,2025-11-29 08:18:55,[]
1986627616863121821,twitter,post,https://x.com/bialykatz/status/1986627616863121821,text,2025-11-07T02:51:48.000Z,selenium_x_scraper_v1,ถูกค้าบ,ถูกค้าบ,2025-11-29 08:18:55,"['ถูก', 'ค้าบ']"
1987137162920485176,twitter,post,https://x.com/aprilapearl/status/1987137162920485176,text,2025-11-08T12:36:33.000Z,selenium_x_scraper_v1,เออ ทำไมมึงไม่มองตัวเองวะ,เออ ทำไมมึงไม่มองตัวเองวะ,2025-11-29 08:18:55,"['เออ', ' ', 'ทำไม', 'มึง', 'ไม่', 'มอง', 'ตัวเอง', 'วะ']"
1986736396946858247,twitter,post,https://x.com/ZenyeaJ/status/1986736396946858247,text,2025-11-07T10:04:03.000Z,selenium_x_scraper_v1,จิง,จิง,2025-11-29 08:18:55,['จิง']
1986994379610030588,twitter,post,https://x.com/bacon1hamcheese/status/1986994379610030588,text,2025-11-08T03:09:11.000Z,selenium_x_scraper_v1,เรื่องขี้บ่นเนี่ย มันมีคนขี้บ่นจริงๆกับคนที่ต้องพูดซ้ำๆต้องบ่น เพราะคนที่อยู่ด้วยต้องคอยจี้ ไม่งั้นไม่ได้ ไม่ใช่แค่คนถูกบ่นที่เบื่อ คนบ่นก็เซ็ง,เรื่องขี้บ่นเนี่ย มันมีคนขี้บ่นจริงๆกับคนที่ต้องพูดซ้ำๆต้องบ่น เพราะคนที่อยู่ด้วยต้องคอยจี้ ไม่งั้นไม่ได้ ไม่ใช่แค่คนถูกบ่นที่เบื่อ คนบ่นก็เซ็ง,2025-11-29 08:18:55,"['เรื่อง', 'ขี้บ่น', 'เนี่ย', ' ', 'มัน', 'มี', 'คนขี้บ่น', 'จริงๆ', 'กับ', 'คน', 'ที่', 'ต้อง', 'พูด', 'ซ้ำๆ', 'ต้อง', 'บ่น', ' ', 'เพราะ', 'คน', 'ที่อยู่', 'ด้วย', 'ต้อง', 'คอย', 'จี้', ' ', 'ไม่งั้น', 'ไม่', 'ได้', ' ', 'ไม่', 'ใช่', 'แค่', 'คน', 'ถูก', 'บ่น', 'ที่', 'เบื่อ', ' ', 'คน', 'บ่น', 'ก็', 'เซ็ง']"
1987076528128340192,twitter,post,https://x.com/A3018w/status/1987076528128340192,text,2025-11-08T08:35:37.000Z,selenium_x_scraper_v1,เรื่องพูดซ้ำนี่จริงค่ะ หงุดหงิดมาก ทั้งๆที่เป็นเรื่องง่ายๆ แล้วก็ถามซ้ำๆอยู่อย่างงั้น เหมือนสิ่งพูดไปไม่ได้เข้าหัวอะไรเลย,เรื่องพูดซ้ำนี่จริงค่ะ หงุดหงิดมาก ทั้งๆที่เป็นเรื่องง่ายๆ แล้วก็ถามซ้ำๆอยู่อย่างงั้น เหมือนสิ่งพูดไปไม่ได้เข้าหัวอะไรเลย,2025-11-29 08:18:55,"['เรื่อง', 'พูด', 'ซ้ำ', 'นี่', 'จริง', 'ค่ะ', ' ', 'หงุดหงิด', 'มาก', ' ', 'ทั้งๆ', 'ที่', 'เป็นเรื่อง', 'ง่ายๆ', ' ', 'แล้วก็', 'ถาม', 'ซ้ำๆ', 'อยู่', 'อย่าง', 'งั้น', ' ', 'เหมือน', 'สิ่ง', 'พูด', 'ไป', 'ไม่', 'ได้', 'เข้า', 'หัว', 'อะไร', 'เลย']"
1987392906953670754,twitter,post,https://x.com/l_kkkai/status/1987392906953670754,text,2025-11-09T05:32:47.000Z,selenium_x_scraper_v1,อย่าพูดเรื่องจริงค่ะ เดี๋ยวชายแท้รับไม่ได้,อย่าพูดเรื่องจริงค่ะ เดี๋ยวชายแท้รับไม่ได้,2025-11-29 08:18:55,"['อย่า', 'พูด', 'เรื่องจริง', 'ค่ะ', ' ', 'เดี๋ยว', 'ชาย', 'แท้', 'รับ', 'ไม่', 'ได้']"
1987386078932967877,twitter,post,https://x.com/guide2112/status/1987386078932967877,text,2025-11-09T05:05:39.000Z,selenium_x_scraper_v1,บางคนก็ประสาทจริงนะ คือเขามีแผลใจจากคนเก่าของเก่า แต่ลงกับคนใหม่เฉยเลย  ไม่น่าไปฉุดเขาขึ้นมาจากหลุมเขาเลย ตัวเองลงหลุมแทนไปเล๊ย,บางคนก็ประสาทจริงนะ คือเขามีแผลใจจากคนเก่าของเก่า แต่ลงกับคนใหม่เฉยเลย  ไม่น่าไปฉุดเขาขึ้นมาจากหลุมเขาเลย ตัวเองลงหลุมแทนไปเล๊ย,2025-11-29 08:18:55,"['บางคน', 'ก็', 'ประสาท', 'จริง', 'นะ', ' ', 'คือ', 'เขา', 'มี', 'แผลใจ', 'จาก', 'คน', 'เก่า', 'ของเก่า', ' ', 'แต่', 'ลง', 'กับ', 'คน', 'ใหม่', 'เฉย', 'เลย', ' ', 'ไม่', 'น่า', 'ไป', 'ฉุด', 'เขา', 'ขึ้น', 'มาจาก', 'หลุม', 'เขา', 'เลย', ' ', 'ตัวเอง', 'ลง', 'หลุม', 'แทน', 'ไป', 'เล๊ย']"
1987027516520022505,twitter,post,https://x.com/NeopolitanBL/status/1987027516520022505,text,2025-11-08T05:20:51.000Z,selenium_x_scraper_v1,จำได้ว่ามีประเทศนึงจะออก กม ตรวจ dna หลังคลอดว่าเป็นพ่อแม่จริงไหม แต่เหมืงนจะมีปหเพราะกลุ่มนึงหาว่าไม่เชื่อใจ,จำได้ว่ามีประเทศนึงจะออก กม ตรวจ dna หลังคลอดว่าเป็นพ่อแม่จริงไหม แต่เหมืงนจะมีปหเพราะกลุ่มนึงหาว่าไม่เชื่อใจ,2025-11-29 08:18:55,"['จำได้', 'ว่า', 'มี', 'ประเทศ', 'นึง', 'จะ', 'ออก', ' ', 'กม', ' ', 'ตรวจ', ' ', 'dna', ' ', 'หลัง', 'คลอด', 'ว่า', 'เป็น', 'พ่อแม่', 'จริง', 'ไหม', ' ', 'แต่', 'เห', 'มืงน', 'จะ', 'มี', 'ปห', 'เพราะ', 'กลุ่ม', 'นึง', 'หาว่า', 'ไม่', 'เชื่อใจ']"
1986823883778081241,twitter,post,https://x.com/nevtelentn/status/1986823883778081241,text,2025-11-07T15:51:41.000Z,selenium_x_scraper_v1,เราไม่ได้คุยกับเพื่อนนาน ตอนคุยกันก็คุยสารทุกข์สุกดิบ แล้วเพื่อนก็เล่าให้ฟังเหมือนกันว่าก่อนหน้านี้ คุยหรือคบกับผู้หญิงคนนึงนี่แหละ แต่แยกย้ายกันไปแล้ว เพราะผู้หญิง ปสด. ก็เลยถามว่าทำไมอะ สุดท้ายก็คือความผิดของเพื่อนนี่แหละที่ทำให้เขาเป็นแบบนั้น,เราไม่ได้คุยกับเพื่อนนาน ตอนคุยกันก็คุยสารทุกข์สุกดิบ แล้วเพื่อนก็เล่าให้ฟังเหมือนกันว่าก่อนหน้านี้ คุยหรือคบกับผู้หญิงคนนึงนี่แหละ แต่แยกย้ายกันไปแล้ว เพราะผู้หญิง ปสด. ก็เลยถามว่าทำไมอะ สุดท้ายก็คือความผิดของเพื่อนนี่แหละที่ทำให้เขาเป็นแบบนั้น,2025-11-29 08:18:55,"['เรา', 'ไม่', 'ได้', 'คุย', 'กับ', 'เพื่อน', 'นาน', ' ', 'ตอน', 'คุย', 'กัน', 'ก็', 'คุย', 'สารทุกข์สุกดิบ', ' ', 'แล้ว', 'เพื่อน', 'ก็', 'เล่า', 'ให้', 'ฟัง', 'เหมือนกัน', 'ว่า', 'ก่อนหน้านี้', ' ', 'คุย', 'หรือ', 'คบ', 'กับ', 'ผู้หญิง', 'คน', 'นึง', 'นี่แหละ', ' ', 'แต่', 'แยกย้าย', 'กัน', 'ไป', 'แล้ว', ' ', 'เพราะ', 'ผู้หญิง', ' ', 'ปสด', '.', ' ', 'ก็', 'เลย', 'ถาม', 'ว่า', 'ทำไม', 'อะ', ' ', 'สุดท้าย', 'ก็', 'คือ', 'ความผิด', 'ของ', 'เพื่อน', 'นี่แหละ', 'ที่', 'ทำให้', 'เขา', 'เป็น', 'แบบ', 'นั้น']"
1986656099211354338,twitter,post,https://x.com/bacon1hamcheese/status/1986656099211354338,text,2025-11-07T04:44:58.000Z,selenium_x_scraper_v1,ทุกการ ปสด มีสาเหตุ,ทุกการ ปสด มีสาเหตุ,2025-11-29 08:18:55,"['ทุก', 'การ', ' ', 'ปสด', ' ', 'มี', 'สาเหตุ']"
1986692093922931042,twitter,post,https://x.com/Tanyanisar/status/1986692093922931042,text,2025-11-07T07:08:00.000Z,selenium_x_scraper_v1,บางคนตอบไม่แบบไม่คิด ไม่เงียบเลยค่ะ ไม่รู้ตัวว่าเป็นเหตุเลย,บางคนตอบไม่แบบไม่คิด ไม่เงียบเลยค่ะ ไม่รู้ตัวว่าเป็นเหตุเลย,2025-11-29 08:18:55,"['บางคน', 'ตอบ', 'ไม่', 'แบบ', 'ไม่', 'คิด', ' ', 'ไม่', 'เงียบ', 'เลย', 'ค่ะ', ' ', 'ไม่', 'รู้ตัว', 'ว่า', 'เป็น', 'เหตุ', 'เลย']"
1986723200605245684,twitter,post,https://x.com/Rainne_NJ/status/1986723200605245684,text,2025-11-07T09:11:37.000Z,selenium_x_scraper_v1,นี่ยังดีที่เค้ายังมีคนรอบข้างดีๆแบบคุณ สำหรับเราเพื่อนเค้า ที่ทำงานเค้าด่าเราทุกคน โดยไม่ดูอีตัวปัญหาเลย,นี่ยังดีที่เค้ายังมีคนรอบข้างดีๆแบบคุณ สำหรับเราเพื่อนเค้า ที่ทำงานเค้าด่าเราทุกคน โดยไม่ดูอีตัวปัญหาเลย,2025-11-29 08:18:55,"['นี่', 'ยัง', 'ดี', 'ที่', 'เค้า', 'ยังมี', 'คน', 'รอบข้าง', 'ดี', 'ๆ', 'แบบ', 'คุณ', ' ', 'สำหรับ', 'เรา', 'เพื่อน', 'เค้า', ' ', 'ที่ทำงาน', 'เค้า', 'ด่า', 'เรา', 'ทุกคน', ' ', 'โดย', 'ไม่', 'ดู', 'อี', 'ตัวปัญหา', 'เลย']"
1986779977334104413,twitter,post,https://x.com/BluephoenixJame/status/1986779977334104413,text,2025-11-07T12:57:13.000Z,selenium_x_scraper_v1,ทุกเรื่องเล่าตัวเองจะเป็นฝ่ายดีเสมอ ทั้งผู้หญิงผู้ชาย,ทุกเรื่องเล่าตัวเองจะเป็นฝ่ายดีเสมอ ทั้งผู้หญิงผู้ชาย,2025-11-29 08:18:55,"['ทุก', 'เรื่องเล่า', 'ตัวเอง', 'จะ', 'เป็น', 'ฝ่าย', 'ดี', 'เสมอ', ' ', 'ทั้ง', 'ผู้หญิง', 'ผู้ชาย']"
1987023315807182913,twitter,post,https://x.com/chacha52351/status/1987023315807182913,text,2025-11-08T05:04:10.000Z,selenium_x_scraper_v1,"ผู้ชายเงียบแปลว่าคิดอยู่ ไม่ได้แปลว่ายอมรับผิด
ไม่ได้เข้าข้างใคร แต่อยากให้ปรับความเข้าใจให้ถูกต้อง","ผู้ชายเงียบแปลว่าคิดอยู่ ไม่ได้แปลว่ายอมรับผิด
ไม่ได้เข้าข้างใคร แต่อยากให้ปรับความเข้าใจให้ถูกต้อง",2025-11-29 08:18:55,"['ผู้ชาย', 'เงียบ', 'แปล', 'ว่า', 'คิด', 'อยู่', ' ', 'ไม่', 'ได้', 'แปล', 'ว่า', 'ยอมรับผิด', ' ', 'ไม่', 'ได้', 'เข้าข้าง', 'ใคร', ' ', 'แต่', 'อยาก', 'ให้', 'ปรับความเข้าใจ', 'ให้', 'ถูกต้อง']"
1987438584924958811,twitter,post,https://x.com/A14027Autumn/status/1987438584924958811,text,2025-11-09T08:34:18.000Z,selenium_x_scraper_v1,可到付,可到付,2025-11-29 08:18:55,[]
1986716329836167468,twitter,post,https://x.com/NeopolitanBL/status/1986716329836167468,text,2025-11-07T08:44:19.000Z,selenium_x_scraper_v1,ทุกการ ปสด มีสาเหตฺ ส่วนนึงก็มาจากฝ่าย ช แต่อีกส่วนก็มาจากฝ่าย ญ เช่นกัน,ทุกการ ปสด มีสาเหตฺ ส่วนนึงก็มาจากฝ่าย ช แต่อีกส่วนก็มาจากฝ่าย ญ เช่นกัน,2025-11-29 08:18:55,"['ทุก', 'การ', ' ', 'ปสด', ' ', 'มี', 'สา', 'เห', 'ตฺ', ' ', 'ส่วน', 'นึง', 'ก็', 'มาจาก', 'ฝ่าย', ' ', 'ช', ' ', 'แต่', 'อีก', 'ส่วน', 'ก็', 'มาจาก', 'ฝ่าย', ' ', 'ญ', ' ', 'เช่นกัน']"
1986432193313579508,twitter,post,https://x.com/sunx05717159/status/1986432193313579508,text,2025-11-06T13:55:15.000Z,selenium_x_scraper_v1,เวลาเดทใครสักคนอ่ะมันคือ we date our trauma childhood ของกันละกัน เลยคิดว่ามันไม่ได้เกี่ยวว่าโง่หรือฉลาดอ่ะดูตัดสินกันไปหน่อย,เวลาเดทใครสักคนอ่ะมันคือ we date our trauma childhood ของกันละกัน เลยคิดว่ามันไม่ได้เกี่ยวว่าโง่หรือฉลาดอ่ะดูตัดสินกันไปหน่อย,2025-11-29 08:18:55,"['เวลา', 'เดท', 'ใคร', 'สัก', 'คน', 'อ่ะ', 'มัน', 'คือ', ' ', 'we', ' ', 'date', ' ', 'our', ' ', 'trauma', ' ', 'childhood', ' ', 'ของ', 'กัน', 'ละ', 'กัน', ' ', 'เลย', 'คิด', 'ว่า', 'มัน', 'ไม่', 'ได้', 'เกี่ยว', 'ว่า', 'โง่', 'หรือ', 'ฉลาด', 'อ่ะ', 'ดู', 'ตัดสิน', 'กัน', 'ไป', 'หน่อย']"
1986445069466149127,twitter,post,https://x.com/hotmimi2025/status/1986445069466149127,text,2025-11-06T14:46:25.000Z,selenium_x_scraper_v1,เราว่าไม่เกี่ยวกับความฉลาดเท่าไหร่ ขึ้นอยู่กับหลายปัจจัยและทรอม่าวัยเด็ก บางคนมี secure attachment ก็รักตัวเองได้ดี แต่บางคนที่เคยขาดความมั่นคงทางใจ กลัวการถูกทิ้ง พวก anxious นั่นเอง พอมีความสัมพันธ์เลยเผลอยอมทุกอย่าง,เราว่าไม่เกี่ยวกับความฉลาดเท่าไหร่ ขึ้นอยู่กับหลายปัจจัยและทรอม่าวัยเด็ก บางคนมี secure attachment ก็รักตัวเองได้ดี แต่บางคนที่เคยขาดความมั่นคงทางใจ กลัวการถูกทิ้ง พวก anxious นั่นเอง พอมีความสัมพันธ์เลยเผลอยอมทุกอย่าง,2025-11-29 08:18:55,"['เรา', 'ว่า', 'ไม่', 'เกี่ยวกับ', 'ความ', 'ฉลาด', 'เท่าไหร่', ' ', 'ขึ้นอยู่กับ', 'หลาย', 'ปัจจัย', 'และ', 'ทรอ', 'ม่า', 'วัยเด็ก', ' ', 'บางคน', 'มี', ' ', 'secure', ' ', 'attachment', ' ', 'ก็', 'รัก', 'ตัวเอง', 'ได้ดี', ' ', 'แต่', 'บางคน', 'ที่', 'เคย', 'ขาด', 'ความมั่นคง', 'ทางใจ', ' ', 'กลัว', 'การ', 'ถูก', 'ทิ้ง', ' ', 'พวก', ' ', 'anxious', ' ', 'นั่นเอง', ' ', 'พอ', 'มี', 'ความสัมพันธ์', 'เลย', 'เผลอ', 'ยอม', 'ทุกอย่าง']"
1986424156334834143,twitter,post,https://x.com/PuangSad/status/1986424156334834143,text,2025-11-06T13:23:19.000Z,selenium_x_scraper_v1,ไม่ใช่ฉลาดไม่จริง แต่โดนแกสไลท์ ซึ่งทุกคนมีสิทธิโดน,ไม่ใช่ฉลาดไม่จริง แต่โดนแกสไลท์ ซึ่งทุกคนมีสิทธิโดน,2025-11-29 08:18:55,"['ไม่', 'ใช่', 'ฉลาด', 'ไม่', 'จริง', ' ', 'แต่', 'โดน', 'แก', 'ส', 'ไลท์', ' ', 'ซึ่ง', 'ทุกคน', 'มี', 'สิทธิ', 'โดน']"
