id,platform,platform_type,url,content_type,timestamp,scraper_module,text,raw_text,scrape_date,tokens
1985995670906716371,twitter,post,https://x.com/jaymineyxx/status/1985995670906716371,text,2025-11-05T09:00:40.000Z,selenium_x_scraper_v1,เห็นเมื่อเช้าเหมือนกัน ช้อค,เห็นเมื่อเช้าเหมือนกัน ช้อค,2025-11-29 08:18:55,"['เห็น', 'เมื่อเช้า', 'เหมือนกัน', ' ', 'ช้อค']"
1985984602188759073,twitter,post,https://x.com/_miwbee/status/1985984602188759073,text,2025-11-05T08:16:41.000Z,selenium_x_scraper_v1,ไม่ได้ตามเหมือนกัน มันขึ้นฟีดมาเมื่อวาน อ่านละกดบล็อคอย่างไว ,ไม่ได้ตามเหมือนกัน มันขึ้นฟีดมาเมื่อวาน อ่านละกดบล็อคอย่างไว ,2025-11-29 08:18:55,"['ไม่', 'ได้', 'ตาม', 'เหมือนกัน', ' ', 'มัน', 'ขึ้น', 'ฟีด', 'มา', 'เมื่อวาน', ' ', 'อ่าน', 'ละ', 'กด', 'บล็อค', 'อย่าง', 'ไว']"
1986051752853131471,twitter,post,https://x.com/destinytuaperd/status/1986051752853131471,text,2025-11-05T12:43:31.000Z,selenium_x_scraper_v1,แล้วเพจรีวิวหนัง ชอบมีแต่คอมเม้นต์ชายแท้เว่อๆ,แล้วเพจรีวิวหนัง ชอบมีแต่คอมเม้นต์ชายแท้เว่อๆ,2025-11-29 08:18:55,"['แล้ว', 'เพจ', 'รีวิว', 'หนัง', ' ', 'ชอบ', 'มี', 'แต่', 'คอมเม้นต์', 'ชาย', 'แท้', 'เว่อ', 'ๆ']"
1985984557431271764,twitter,post,https://x.com/Najwitzchild/status/1985984557431271764,text,2025-11-05T08:16:30.000Z,selenium_x_scraper_v1,ตัวเจ้าของเพจก็มีลูกสาว งง ทุกวันนี้ยังเล่นทุกแบบนี้อยู่อีก,ตัวเจ้าของเพจก็มีลูกสาว งง ทุกวันนี้ยังเล่นทุกแบบนี้อยู่อีก,2025-11-29 08:18:55,"['ตัว', 'เจ้าของ', 'เพจ', 'ก็', 'มี', 'ลูกสาว', ' ', 'งง', ' ', 'ทุกวันนี้', 'ยัง', 'เล่น', 'ทุก', 'แบบนี้', 'อยู่', 'อีก']"
1985983000539222124,twitter,post,https://x.com/khunlom/status/1985983000539222124,text,2025-11-05T08:10:19.000Z,selenium_x_scraper_v1,ต่ำ,ต่ำ,2025-11-29 08:18:55,['ต่ำ']
1986007253858791508,twitter,post,https://x.com/aoikotori/status/1986007253858791508,text,2025-11-05T09:46:42.000Z,selenium_x_scraper_v1,เพจนี้มันชายแท้ ไม่เคยตามแต่ก็ชอบขึ้นฟีดเหมือนกัน หลายโพสคือแบบ...,เพจนี้มันชายแท้ ไม่เคยตามแต่ก็ชอบขึ้นฟีดเหมือนกัน หลายโพสคือแบบ...,2025-11-29 08:18:55,"['เพจ', 'นี้', 'มัน', 'ชาย', 'แท้', ' ', 'ไม่', 'เคย', 'ตามแต่', 'ก็', 'ชอบ', 'ขึ้น', 'ฟีด', 'เหมือนกัน', ' ', 'หลาย', 'โพส', 'คือ', 'แบ', 'บ.', '..']"
1986059194349539613,twitter,post,https://x.com/tryonmydream/status/1986059194349539613,text,2025-11-05T13:13:05.000Z,selenium_x_scraper_v1,เอ่อ,เอ่อ,2025-11-29 08:18:55,['เอ่อ']
1985971725369295061,twitter,post,https://x.com/HiddlePim/status/1985971725369295061,text,2025-11-05T07:25:31.000Z,selenium_x_scraper_v1,เพจนี้อีกแล้ว ล้มไม่เคยลุก 555555555,เพจนี้อีกแล้ว ล้มไม่เคยลุก 555555555,2025-11-29 08:18:55,"['เพจ', 'นี้', 'อีกแล้ว', ' ', 'ล้ม', 'ไม่', 'เคย', 'ลุก', ' ', 'หัวเราะ']"
1985680645985796331,twitter,post,https://x.com/gellowgene/status/1985680645985796331/photo/1,text,2025-11-04T12:08:52.000Z,selenium_x_scraper_v1,เพจหนังคนติดตามหลักแสน โพสถึงหนังใหม่ของเจนนิเฟอร์ ลอว์เรนซ์ แล้วในคอมเม้นเค้าเขียนว่า ‘ลูกชายคนแรกคลอดปี 2022 ได้กลับมาเล่นหนังแป๊ปๆก็เสือกแตกในจนท้องอีก’ สมัยนั้นยังไม่มีสวัสดิการลาคลอดเหรอ เค้าถึงเหมือนไม่มีใครสั่งสอนอ่ะ,เพจหนังคนติดตามหลักแสน โพสถึงหนังใหม่ของเจนนิเฟอร์ ลอว์เรนซ์ แล้วในคอมเม้นเค้าเขียนว่า ‘ลูกชายคนแรกคลอดปี 2022 ได้กลับมาเล่นหนังแป๊ปๆก็เสือกแตกในจนท้องอีก’ สมัยนั้นยังไม่มีสวัสดิการลาคลอดเหรอ เค้าถึงเหมือนไม่มีใครสั่งสอนอ่ะ,2025-11-29 08:18:55,"['เพจ', 'หนัง', 'คน', 'ติดตาม', 'หลัก', 'แสน', ' ', 'โพส', 'ถึง', 'หนัง', 'ใหม่', 'ของ', 'เจนนิเฟอร์', ' ', 'ลอว์เรนซ์', ' ', 'แล้ว', 'ใน', 'คอม', 'เม้น', 'เค้า', 'เขียน', 'ว่า', ' ', 'ลูกชาย', 'คน', 'แรก', 'คลอด', 'ปี', ' ', '2022', ' ', 'ได้', 'กลับมา', 'เล่น', 'หนัง', 'แป๊ปๆ', 'ก็', 'เสือก', 'แตก', 'ใน', 'จน', 'ท้อง', 'อีก', ' ', 'สมัย', 'นั้น', 'ยัง', 'ไม่', 'มี', 'สวัสดิการ', 'ลาคลอด', 'เหรอ', ' ', 'เค้า', 'ถึง', 'เหมือน', 'ไม่', 'มี', 'ใคร', 'สั่งสอน', 'อ่ะ']"
1985907660362047798,twitter,post,https://x.com/gellowgene/status/1985907660362047798,text,2025-11-05T03:10:57.000Z,selenium_x_scraper_v1,ต้องบอกว่าไม่ได้ตามเพจนี้ แต่มันขึ้น feed มา และนี่ชอบเจนนิเฟอร์ ลอว์เรนซ์ เลยหยุดอ่าน และเจอสิ่งนี้,ต้องบอกว่าไม่ได้ตามเพจนี้ แต่มันขึ้น feed มา และนี่ชอบเจนนิเฟอร์ ลอว์เรนซ์ เลยหยุดอ่าน และเจอสิ่งนี้,2025-11-29 08:18:55,"['ต้อง', 'บอก', 'ว่าไม่ได้', 'ตาม', 'เพจ', 'นี้', ' ', 'แต่', 'มัน', 'ขึ้น', ' ', 'feed', ' ', 'มา', ' ', 'และ', 'นี่', 'ชอบ', 'เจนนิเฟอร์', ' ', 'ลอว์เรนซ์', ' ', 'เลย', 'หยุด', 'อ่าน', ' ', 'และ', 'เจอ', 'สิ่ง', 'นี้']"
1985929636052942998,twitter,post,https://x.com/Nina_Phanita/status/1985929636052942998,text,2025-11-05T04:38:16.000Z,selenium_x_scraper_v1,แอดมินเพจมารยาทการสื่อสารสถุนมากเลยค่ะ ไม่รู้จะใช้คำไหนอธิบายนอกจาก สถุน จริงๆ ความคิดที่พิมพ์ออกสาธารณะต่ำตมมากอะ งงว่าทำเพจได้ไง ,แอดมินเพจมารยาทการสื่อสารสถุนมากเลยค่ะ ไม่รู้จะใช้คำไหนอธิบายนอกจาก สถุน จริงๆ ความคิดที่พิมพ์ออกสาธารณะต่ำตมมากอะ งงว่าทำเพจได้ไง ,2025-11-29 08:18:55,"['แอดมิน', 'เพจ', 'มารยาท', 'การ', 'สื่อ', 'สา', 'รส', 'ถุน', 'มาก', 'เลย', 'ค่ะ', ' ', 'ไม่', 'รู้', 'จะ', 'ใช้', 'คำ', 'ไหน', 'อธิบาย', 'นอกจาก', ' ', 'ส', 'ถุน', ' ', 'จริงๆ', ' ', 'ความคิด', 'ที่', 'พิมพ์', 'ออก', 'สาธารณะ', 'ต่ำ', 'ตม', 'มาก', 'อะ', ' ', 'งง', 'ว่า', 'ทำ', 'เพจ', 'ได้', 'ไง']"
1985960372525031756,twitter,post,https://x.com/VeronaDream/status/1985960372525031756,text,2025-11-05T06:40:24.000Z,selenium_x_scraper_v1,"ความคิดระยำมากครับ 
ชีวิตเค้า เค้าหาเงินได้จนใช้ไม่หมดแล้ว
เค้าจะมีลูกกี่คนก็ไม่หนักหัวมันนะ

ส่วนตัวมันเองน่ะ 
“พ่อแม่โง่ คุณภาพต่ำแต่เสือกแตกในจนได้ขยะสังคมแบบมันมาเนี่ยแหละ”","ความคิดระยำมากครับ 
ชีวิตเค้า เค้าหาเงินได้จนใช้ไม่หมดแล้ว
เค้าจะมีลูกกี่คนก็ไม่หนักหัวมันนะ

ส่วนตัวมันเองน่ะ 
“พ่อแม่โง่ คุณภาพต่ำแต่เสือกแตกในจนได้ขยะสังคมแบบมันมาเนี่ยแหละ”",2025-11-29 08:18:55,"['ความคิด', 'ระยำ', 'มาก', 'ครับ', ' ', 'ชีวิต', 'เค้า', ' ', 'เค้า', 'หา', 'เงินได้', 'จน', 'ใช้', 'ไม่', 'หมด', 'แล้ว', ' ', 'เค้า', 'จะ', 'มีลูก', 'กี่', 'คน', 'ก็', 'ไม่', 'หนัก', 'หัวมัน', 'นะ', ' ', 'ส่วนตัว', 'มัน', 'เอง', 'น่ะ', ' ', 'พ่อแม่', 'โง่', ' ', 'คุณภาพต่ำ', 'แต่', 'เสือก', 'แตก', 'ใน', 'จนได้', 'ขยะสังคม', 'แบบ', 'มัน', 'มา', 'เนี่ย', 'แหละ']"
1985966490974339411,twitter,post,https://x.com/Napoli294/status/1985966490974339411,text,2025-11-05T07:04:43.000Z,selenium_x_scraper_v1,แอดมินเคยเอาภาพสาวไทยใหญ่เสื้อขาวกางเกงยีนส์  แต่งตัวเรียบร้อยปกติ โพสต์สมัครเป็นพี่เลี้ยงเด็กแล้วปล่อยให้ลูกเพจคอมเม้นท์แซวคุกคามทางเพศสนุกสนาน  โดยสาวที่โดนแขวนนั้นไม่ได้ทำไรผิดเลย เพียงแค่เค้าหน้าตาดีหางานสุจริตทำเท่านั้น แถมเจ้าของเพจมีลูกสาว.. เลิกติดตามเลย สถุลเกิน,แอดมินเคยเอาภาพสาวไทยใหญ่เสื้อขาวกางเกงยีนส์  แต่งตัวเรียบร้อยปกติ โพสต์สมัครเป็นพี่เลี้ยงเด็กแล้วปล่อยให้ลูกเพจคอมเม้นท์แซวคุกคามทางเพศสนุกสนาน  โดยสาวที่โดนแขวนนั้นไม่ได้ทำไรผิดเลย เพียงแค่เค้าหน้าตาดีหางานสุจริตทำเท่านั้น แถมเจ้าของเพจมีลูกสาว.. เลิกติดตามเลย สถุลเกิน,2025-11-29 08:18:55,"['แอดมิน', 'เคย', 'เอา', 'ภาพ', 'สาว', 'ไทยใหญ่', 'เสื้อ', 'ขาว', 'กางเกง', 'ยีนส์', ' ', 'แต่งตัว', 'เรียบร้อย', 'ปกติ', ' ', 'โพสต์', 'สมัคร', 'เป็น', 'พี่', 'เลี้ยงเด็ก', 'แล้ว', 'ปล่อย', 'ให้', 'ลูก', 'เพจ', 'คอมเม้นท์', 'แซว', 'คุกคาม', 'ทางเพศ', 'สนุกสนาน', ' ', 'โดย', 'สาว', 'ที่', 'โดน', 'แขวน', 'นั้น', 'ไม่', 'ได้', 'ทำ', 'ไร', 'ผิด', 'เลย', ' ', 'เพียงแค่', 'เค้า', 'หน้าตา', 'ดี', 'หา', 'งาน', 'สุจริต', 'ทำ', 'เท่านั้น', ' ', 'แถม', 'เจ้าของ', 'เพจ', 'มี', 'ลูกสาว', '..', ' ', 'เลิก', 'ติดตาม', 'เลย', ' ', 'สถุล', 'เกิน']"
1985977474610786579,twitter,post,https://x.com/HusberToro/status/1985977474610786579,text,2025-11-05T07:48:22.000Z,selenium_x_scraper_v1,ตั๋วร้อนเป็นแบบนี้มานานแล้วครับ โพสหาเอนเกจอย่างเดียว ถ้าเคสไหนหนักๆก็โพสขอโทษไปทีนึง เป็นเพจที่ใช้โควต้าขอโทษต่อปีเยอะที่สุดแล้ว ลูกเพจก็คุณภาพพอกัน บล็อคทิ้งเป็นทางเลือกที่ดีที่สุด,ตั๋วร้อนเป็นแบบนี้มานานแล้วครับ โพสหาเอนเกจอย่างเดียว ถ้าเคสไหนหนักๆก็โพสขอโทษไปทีนึง เป็นเพจที่ใช้โควต้าขอโทษต่อปีเยอะที่สุดแล้ว ลูกเพจก็คุณภาพพอกัน บล็อคทิ้งเป็นทางเลือกที่ดีที่สุด,2025-11-29 08:18:55,"['ตั๋ว', 'ร้อน', 'เป็น', 'แบบนี้', 'มา', 'นาน', 'แล้ว', 'ครับ', ' ', 'โพส', 'หา', 'เอน', 'เกจ', 'อย่าง', 'เดียว', ' ', 'ถ้า', 'เคส', 'ไหน', 'หนัก', 'ๆ', 'ก็', 'โพส', 'ขอโทษ', 'ไป', 'ที', 'นึง', ' ', 'เป็น', 'เพจ', 'ที่', 'ใช้', 'โควต้า', 'ขอโทษ', 'ต่อ', 'ปี', 'เยอะ', 'ที่สุด', 'แล้ว', ' ', 'ลูก', 'เพจ', 'ก็', 'คุณภาพ', 'พอกัน', ' ', 'บล็อค', 'ทิ้ง', 'เป็น', 'ทางเลือก', 'ที่', 'ดี', 'ที่สุด']"
1986020208407191790,twitter,post,https://x.com/Aobaob69/status/1986020208407191790,text,2025-11-05T10:38:10.000Z,selenium_x_scraper_v1,เพจนี้มันต่ำตมมาตลอดและ เน้นสร้างเอ็นเกจเชิงคุกคามทางเพศตลอดอยู่แล้ว แล้วติไม่ได้ใครเม้นเตือนหน่อยจะโดนลูกเพจถล่มว่าเป็นอาหวังพร้อมโดนเจ้าของเพจประชด,เพจนี้มันต่ำตมมาตลอดและ เน้นสร้างเอ็นเกจเชิงคุกคามทางเพศตลอดอยู่แล้ว แล้วติไม่ได้ใครเม้นเตือนหน่อยจะโดนลูกเพจถล่มว่าเป็นอาหวังพร้อมโดนเจ้าของเพจประชด,2025-11-29 08:18:55,"['เพจ', 'นี้', 'มัน', 'ต่ำ', 'ตม', 'มา', 'ตลอด', 'และ', ' ', 'เน้น', 'สร้าง', 'เอ็น', 'เกจ', 'เชิง', 'คุกคาม', 'ทางเพศ', 'ตลอด', 'อยู่แล้ว', ' ', 'แล้ว', 'ติ', 'ไม่', 'ได้', 'ใคร', 'เม้น', 'เตือน', 'หน่อย', 'จะ', 'โดน', 'ลูก', 'เพจ', 'ถล่ม', 'ว่า', 'เป็น', 'อา', 'หวัง', 'พร้อม', 'โดน', 'เจ้าของ', 'เพจ', 'ประชด']"
1985957711876694201,twitter,post,https://x.com/Realkuma33/status/1985957711876694201,text,2025-11-05T06:29:50.000Z,selenium_x_scraper_v1,คือได้แรงอวยจากลูกเพจ ที่มีคติที่ว่าถ่อยแล้วเท่ เป็นมานานจนเคยชิน สมัยไม่ดังเป็นอย่าง ตอนนี้ดังแล้วเป็นอีกอย่าง,คือได้แรงอวยจากลูกเพจ ที่มีคติที่ว่าถ่อยแล้วเท่ เป็นมานานจนเคยชิน สมัยไม่ดังเป็นอย่าง ตอนนี้ดังแล้วเป็นอีกอย่าง,2025-11-29 08:18:55,"['คือ', 'ได้แรง', 'อวย', 'จาก', 'ลูก', 'เพจ', ' ', 'ที่', 'มี', 'คติ', 'ที่ว่า', 'ถ่อย', 'แล้ว', 'เท่', ' ', 'เป็นมา', 'นาน', 'จน', 'เคยชิน', ' ', 'สมัย', 'ไม่', 'ดัง', 'เป็น', 'อย่าง', ' ', 'ตอนนี้', 'ดัง', 'แล้ว', 'เป็น', 'อีก', 'อย่าง']"
1986039156825538924,twitter,post,https://x.com/Q_flure222/status/1986039156825538924,text,2025-11-05T11:53:28.000Z,selenium_x_scraper_v1,เพจนี้สุดยอดของความเถื่อน แล้วลูกเพจก็เหมือนกันเลย เป็นพวกผู้ชายที่เม้นคุกคามทางเพศ เหยียดเพศ ที่สุดของความต่ำตม,เพจนี้สุดยอดของความเถื่อน แล้วลูกเพจก็เหมือนกันเลย เป็นพวกผู้ชายที่เม้นคุกคามทางเพศ เหยียดเพศ ที่สุดของความต่ำตม,2025-11-29 08:18:55,"['เพจ', 'นี้', 'สุดยอด', 'ของ', 'ความ', 'เถื่อน', ' ', 'แล้ว', 'ลูก', 'เพจ', 'ก็', 'เหมือนกัน', 'เลย', ' ', 'เป็น', 'พวก', 'ผู้ชาย', 'ที่', 'เม้น', 'คุกคาม', 'ทางเพศ', ' ', 'เหยียด', 'เพศ', ' ', 'ที่สุด', 'ของ', 'ความต่ำ', 'ตม']"
1985966890846732590,twitter,post,https://x.com/FullpowerFamily/status/1985966890846732590,text,2025-11-05T07:06:18.000Z,selenium_x_scraper_v1,เป็นการแสดงความเห็นที่แย่มากๆ สะท้อนถึงทัศนคติที่ไม่ควรคบหาติดตามเกี่ยวข้องใดๆทั้งสิ้น,เป็นการแสดงความเห็นที่แย่มากๆ สะท้อนถึงทัศนคติที่ไม่ควรคบหาติดตามเกี่ยวข้องใดๆทั้งสิ้น,2025-11-29 08:18:55,"['เป็น', 'การแสดง', 'ความเห็น', 'ที่', 'แย่มาก', 'ๆ', ' ', 'สะท้อน', 'ถึง', 'ทัศนคติ', 'ที่', 'ไม่', 'ควร', 'คบหา', 'ติดตาม', 'เกี่ยวข้อง', 'ใดๆ', 'ทั้งสิ้น']"
1986031533401178297,twitter,post,https://x.com/indygolfz/status/1986031533401178297,text,2025-11-05T11:23:10.000Z,selenium_x_scraper_v1,"เขาเป็นญาติพี่น้องเป็นลูกหรือไงไอตั๋ว ?
เจนนิเฟอร์เกิด 1990 ตอนท้อง 2022 ก็อายุ 30+ ละ
ตอนนี้อายุ 35 ทำไม นักแสดงไม่ต้องมีลูกมีผัวหรือไง?
ตรรกะส้นทีนแบบมิง ไม่น่าเกิดมาเป็นคนเลยไอตั๋ว","เขาเป็นญาติพี่น้องเป็นลูกหรือไงไอตั๋ว ?
เจนนิเฟอร์เกิด 1990 ตอนท้อง 2022 ก็อายุ 30+ ละ
ตอนนี้อายุ 35 ทำไม นักแสดงไม่ต้องมีลูกมีผัวหรือไง?
ตรรกะส้นทีนแบบมิง ไม่น่าเกิดมาเป็นคนเลยไอตั๋ว",2025-11-29 08:18:55,"['เขา', 'เป็น', 'ญาติพี่น้อง', 'เป็น', 'ลูก', 'หรือไง', 'ไอ', 'ตั๋ว', ' ', '?', ' ', 'เจนนิเฟอร์', 'เกิด', ' ', '1990', ' ', 'ตอน', 'ท้อง', ' ', '2022', ' ', 'ก็', 'อายุ', ' ', '30', ' ', 'ละ', ' ', 'ตอนนี้', 'อายุ', ' ', '35', ' ', 'ทำไม', ' ', 'นักแสดง', 'ไม่ต้อง', 'มีลูก', 'มี', 'ผัว', 'หรือไง', '?', ' ', 'ตรรกะ', 'ส้น', 'ทีน', 'แบ', 'บมิ', 'ง', ' ', 'ไม่', 'น่า', 'เกิด', 'มา', 'เป็น', 'คน', 'เลย', 'ไอ', 'ตั๋ว']"
1986091290237567237,twitter,post,https://x.com/Maximumkkk/status/1986091290237567237,text,2025-11-05T15:20:38.000Z,selenium_x_scraper_v1,เคยอ่านโพสต์นี้ แสดงว่าไม่ใช่แค่เราคนเดียวที่รู้สึกว่าคำพูดมันแรงเกินไปมากจริงๆ,เคยอ่านโพสต์นี้ แสดงว่าไม่ใช่แค่เราคนเดียวที่รู้สึกว่าคำพูดมันแรงเกินไปมากจริงๆ,2025-11-29 08:18:55,"['เคย', 'อ่าน', 'โพสต์', 'นี้', ' ', 'แสดงว่า', 'ไม่', 'ใช่', 'แค่', 'เรา', 'คนเดียว', 'ที่', 'รู้สึก', 'ว่า', 'คำพูด', 'มัน', 'แรง', 'เกินไป', 'มาก', 'จริงๆ']"
1986030549987918220,twitter,post,https://x.com/SundayRRiley/status/1986030549987918220,text,2025-11-05T11:19:16.000Z,selenium_x_scraper_v1,อ๋อ อีเพจนี้ คนในเฟซเขาเกลียดมันกันมากค่ะ,อ๋อ อีเพจนี้ คนในเฟซเขาเกลียดมันกันมากค่ะ,2025-11-29 08:18:55,"['อ๋อ', ' ', 'อี', 'เพจ', 'นี้', ' ', 'คนใน', 'เฟซ', 'เขา', 'เกลียด', 'มัน', 'กัน', 'มาก', 'ค่ะ']"
1986071051508543529,twitter,post,https://x.com/darkelf5/status/1986071051508543529,text,2025-11-05T14:00:12.000Z,selenium_x_scraper_v1,เพจนี้มันก็จะตลาดล่างอยู่อะนะ,เพจนี้มันก็จะตลาดล่างอยู่อะนะ,2025-11-29 08:18:55,"['เพจ', 'นี้', 'มัน', 'ก็', 'จะ', 'ตลาด', 'ล่าง', 'อยู่', 'อะนะ']"
1985945137223254165,twitter,post,https://x.com/butterfact69/status/1985945137223254165,text,2025-11-05T05:39:52.000Z,selenium_x_scraper_v1,เป็นอีกหนึ่งเพจที่ดังแต่.... เลเวลเดียวกับหนังฝังมุกอะ,เป็นอีกหนึ่งเพจที่ดังแต่.... เลเวลเดียวกับหนังฝังมุกอะ,2025-11-29 08:18:55,"['เป็น', 'อีก', 'หนึ่ง', 'เพจ', 'ที่', 'ดัง', 'แต่', '...', ' ', 'เล', 'เวล', 'เดียว', 'กับ', 'หนัง', 'ฝัง', 'มุก', 'อะ']"
