id,platform,platform_type,url,content_type,timestamp,scraper_module,text,raw_text,scrape_date,tokens
1988086816575312350,twitter,post,https://x.com/CW93SKZOO/status/1988086816575312350,text,2025-11-11T03:30:08.000Z,selenium_x_scraper_v1,"ชายกับชาย ในศาสนาอิสลามมันผิดไม่ใช่เหรอ 
หรือมีข้อไหนที่ทำผิดให้เป็นไม่ผิดได้ แต่อย่างน้อยมันก็ดีกว่าการที่ ไปหาที่แก้เง่นด้วยการเยะกับแพะ แบ้แบ้ อ่ะ  อันนั้นรับไม่ได้จริงๆ","ชายกับชาย ในศาสนาอิสลามมันผิดไม่ใช่เหรอ 
หรือมีข้อไหนที่ทำผิดให้เป็นไม่ผิดได้ แต่อย่างน้อยมันก็ดีกว่าการที่ ไปหาที่แก้เง่นด้วยการเยะกับแพะ แบ้แบ้ อ่ะ  อันนั้นรับไม่ได้จริงๆ",2025-11-29 08:18:55,"['ชาย', 'กับ', 'ชาย', ' ', 'ใน', 'ศาสนาอิสลาม', 'มัน', 'ผิด', 'ไม่', 'ใช่', 'เหรอ', ' ', 'หรือ', 'มี', 'ข้อ', 'ไหน', 'ที่', 'ทำผิด', 'ให้', 'เป็น', 'ไม่', 'ผิด', 'ได้', ' ', 'แต่', 'อย่าง', 'น้อย', 'มัน', 'ก็', 'ดีกว่า', 'การ', 'ที่', ' ', 'ไปหา', 'ที่', 'แก้', 'เง่น', 'ด้วย', 'การ', 'เยะ', 'กับ', 'แพะ', ' ', 'แบ้', 'แบ้', ' ', 'อ่ะ', ' ', 'อันนั้น', 'รับ', 'ไม่', 'ได้', 'จริงๆ']"
1987966502163935282,twitter,post,https://x.com/AlohaLunlanla/status/1987966502163935282,text,2025-11-10T19:32:03.000Z,selenium_x_scraper_v1,มิน่า  เห็นพวกนักท่องเที่ยวหน้าแขก ออฟน้องเทยไทยเสมอๆแถวนานา,มิน่า  เห็นพวกนักท่องเที่ยวหน้าแขก ออฟน้องเทยไทยเสมอๆแถวนานา,2025-11-29 08:18:55,"['มิน่า', ' ', 'เห็น', 'พวก', 'นักท่องเที่ยว', 'หน้า', 'แขก', ' ', 'ออฟ', 'น้อง', 'เท', 'ย', 'ไทย', 'เสมอๆ', 'แถว', 'นานา']"
1988359184547803416,twitter,post,https://x.com/0SQG097Qf0xz8zh/status/1988359184547803416,text,2025-11-11T21:32:26.000Z,selenium_x_scraper_v1,อ้าว นึกว่าผู้หญิง กดดูเพราังะน้องเค้าสวยมาก หน้าคมหุ่นดี,อ้าว นึกว่าผู้หญิง กดดูเพราังะน้องเค้าสวยมาก หน้าคมหุ่นดี,2025-11-29 08:18:55,"['อ้าว', ' ', 'นึก', 'ว่า', 'ผู้หญิง', ' ', 'กด', 'ดู', 'เพรา', 'ั', 'งะ', 'น้อง', 'เค้า', 'สวย', 'มาก', ' ', 'หน้า', 'คม', 'หุ่นดี']"
1988234668903461129,twitter,post,https://x.com/CullLove24554/status/1988234668903461129,text,2025-11-11T13:17:39.000Z,selenium_x_scraper_v1,คนก่อตั้งศาสนาต้องเป็นเกแหละ เอื้อให้ตัวเองมาก,คนก่อตั้งศาสนาต้องเป็นเกแหละ เอื้อให้ตัวเองมาก,2025-11-29 08:18:55,"['คน', 'ก่อตั้ง', 'ศาสนา', 'ต้อง', 'เป็น', 'เก', 'แหละ', ' ', 'เอื้อ', 'ให้', 'ตัวเอง', 'มาก']"
1988238608063418530,twitter,post,https://x.com/waintawaros/status/1988238608063418530,text,2025-11-11T13:33:18.000Z,selenium_x_scraper_v1,ค้าขายxxxเด็ก แม้แต่กฎหมายยังทำอะไรไม่ได้เมื่อเจอประเพณีวัฒธรรมบางพื้นที่และกฎศาสนา นี่โตแล้วนะ เด็กน้อยกว่านี้ก็มี,ค้าขายxxxเด็ก แม้แต่กฎหมายยังทำอะไรไม่ได้เมื่อเจอประเพณีวัฒธรรมบางพื้นที่และกฎศาสนา นี่โตแล้วนะ เด็กน้อยกว่านี้ก็มี,2025-11-29 08:18:55,"['ค้าขาย', 'xxx', 'เด็ก', ' ', 'แม้แต่', 'กฎหมาย', 'ยัง', 'ทำ', 'อะไร', 'ไม่', 'ได้', 'เมื่อ', 'เจอ', 'ประเพณี', 'วัฒ', 'ธรรม', 'บาง', 'พื้นที่', 'และ', 'กฎ', 'ศาสนา', ' ', 'นี่', 'โต', 'แล้ว', 'นะ', ' ', 'เด็ก', 'น้อยกว่า', 'นี้', 'ก็', 'มี']"
1988182905743700260,twitter,post,https://x.com/kapukapi/status/1988182905743700260,text,2025-11-11T09:51:58.000Z,selenium_x_scraper_v1,สวยเฉย ,สวยเฉย ,2025-11-29 08:18:55,"['สวย', 'เฉย']"
1988104319590429187,twitter,post,https://x.com/TanyaSuesanti/status/1988104319590429187,text,2025-11-11T04:39:41.000Z,selenium_x_scraper_v1,Sick!,Sick!,2025-11-29 08:18:55,"['sick', '!']"
1987930149057417637,twitter,post,https://x.com/suripol252121/status/1987930149057417637,text,2025-11-10T17:07:36.000Z,selenium_x_scraper_v1,โรคจิตสุดๆ,โรคจิตสุดๆ,2025-11-29 08:18:55,"['โรคจิต', 'สุด', 'ๆ']"
1988119669191098878,twitter,post,https://x.com/worldismyname/status/1988119669191098878,text,2025-11-11T05:40:41.000Z,selenium_x_scraper_v1,แล้วไอ้คนพวกนี้มันยี้พวกรักร่วมเพศ แต่จับโน้นจับนี่เด็กผู้ชายฉ่ำ งงนะ แล้วบางตัวคือไปล่วงละเมิดเขาด้วย งงกับคนพวกนี้อ่ะ,แล้วไอ้คนพวกนี้มันยี้พวกรักร่วมเพศ แต่จับโน้นจับนี่เด็กผู้ชายฉ่ำ งงนะ แล้วบางตัวคือไปล่วงละเมิดเขาด้วย งงกับคนพวกนี้อ่ะ,2025-11-29 08:18:55,"['แล้ว', 'ไอ้', 'คน', 'พวก', 'นี้', 'มัน', 'ยี้', 'พวก', 'รักร่วมเพศ', ' ', 'แต่', 'จับ', 'โน้น', 'จับ', 'นี่', 'เด็กผู้ชาย', 'ฉ่ำ', ' ', 'งง', 'นะ', ' ', 'แล้ว', 'บาง', 'ตัว', 'คือ', 'ไป', 'ล่วงละเมิด', 'เขา', 'ด้วย', ' ', 'งง', 'กับ', 'คน', 'พวก', 'นี้', 'อ่ะ']"
1988137176014745839,twitter,post,https://x.com/ireireiiii/status/1988137176014745839,text,2025-11-11T06:50:15.000Z,selenium_x_scraper_v1,อิผชอัฟกาทรีทผญเหี้ยมากด้วย ช่างทาสีที่บ้านแม่งปากหมาใส่นี่ตอนอยู่คนเดียว ละปกตินี่ไม่ค่อยเถียงใคร แต่วันนั้นอารมณ์ไม่ดีเลยสวนไป ละโทรเรียกแฟนมาคุย พอแฟนนี่มาดันพูดจาดีเฉย กุแบบอิสัสนี่ จ้างมาให้ทำงานไม่ใช่ให้มายืนด่าเจ้าของบ้าน,อิผชอัฟกาทรีทผญเหี้ยมากด้วย ช่างทาสีที่บ้านแม่งปากหมาใส่นี่ตอนอยู่คนเดียว ละปกตินี่ไม่ค่อยเถียงใคร แต่วันนั้นอารมณ์ไม่ดีเลยสวนไป ละโทรเรียกแฟนมาคุย พอแฟนนี่มาดันพูดจาดีเฉย กุแบบอิสัสนี่ จ้างมาให้ทำงานไม่ใช่ให้มายืนด่าเจ้าของบ้าน,2025-11-29 08:18:55,"['อิผชอัฟ', 'กา', 'ท', 'รี', 'ทผญ', 'เหี้ย', 'มาก', 'ด้วย', ' ', 'ช่างทาสี', 'ที่', 'บ้าน', 'แม่', 'ง', 'ปากหมา', 'ใส่', 'นี่', 'ตอน', 'อยู่', 'คนเดียว', ' ', 'ละ', 'ปกติ', 'นี่', 'ไม่ค่อย', 'เถียง', 'ใคร', ' ', 'แต่', 'วันนั้น', 'อารมณ์ไม่ดี', 'เลย', 'สวน', 'ไป', ' ', 'ละ', 'โทร', 'เรียก', 'แฟน', 'มา', 'คุย', ' ', 'พอ', 'แฟน', 'นี่', 'มา', 'ดัน', 'พูดจา', 'ดี', 'เฉย', ' ', 'กุ', 'แบบ', 'อิสัส', 'นี่', ' ', 'จ้าง', 'มา', 'ให้', 'ทำงาน', 'ไม่', 'ใช่', 'ให้', 'มา', 'ยืน', 'ด่า', 'เจ้าของบ้าน']"
1988029073717895428,twitter,post,https://x.com/PhaSyam23446/status/1988029073717895428,text,2025-11-10T23:40:41.000Z,selenium_x_scraper_v1,มา ชา อัลเลาะห์,มา ชา อัลเลาะห์,2025-11-29 08:18:55,"['มา', ' ', 'ชา', ' ', 'อัลเลาะห์']"
1988465603192254975,twitter,post,https://x.com/ThwalCit35878/status/1988465603192254975,text,2025-11-12T04:35:18.000Z,selenium_x_scraper_v1,แต่กะเกลียดเกย์ ???,แต่กะเกลียดเกย์ ???,2025-11-29 08:18:55,"['แต่', 'กะ', 'เกลียด', 'เกย์', ' ', '?']"
1988120840861565115,twitter,post,https://x.com/TarillT/status/1988120840861565115,text,2025-11-11T05:45:20.000Z,selenium_x_scraper_v1,ความเลี่ยงบาลี่ แล้วเด็กจนๆเหล่านี้ทานยาคุมปะเนี่ย,ความเลี่ยงบาลี่ แล้วเด็กจนๆเหล่านี้ทานยาคุมปะเนี่ย,2025-11-29 08:18:55,"['ความ', 'เลี่ยง', 'บา', 'ลี่', ' ', 'แล้ว', 'เด็ก', 'จน', 'ๆ', 'เหล่านี้', 'ทาน', 'ยาคุม', 'ปะ', 'เนี่ย']"
1987966252430880905,twitter,post,https://x.com/chrome9699/status/1987966252430880905,text,2025-11-10T19:31:03.000Z,selenium_x_scraper_v1,ครีปปี้,ครีปปี้,2025-11-29 08:18:55,"['ค', 'รี', 'ป', 'ปี้']"
1988129449146298761,twitter,post,https://x.com/bibillyhills7/status/1988129449146298761,text,2025-11-11T06:19:32.000Z,selenium_x_scraper_v1,อัฟกานิสถานไม่มีเกย์,อัฟกานิสถานไม่มีเกย์,2025-11-29 08:18:55,"['อัฟกานิสถาน', 'ไม่', 'มี', 'เกย์']"
1987857767869329650,twitter,post,https://x.com/drnov123/status/1987857767869329650,text,2025-11-10T12:19:59.000Z,selenium_x_scraper_v1,ก็แสดงว่าไม่ต่อต้านLGTVQ,ก็แสดงว่าไม่ต่อต้านLGTVQ,2025-11-29 08:18:55,"['ก็', 'แสดงว่า', 'ไม่', 'ต่อต้าน', 'lgtvq']"
1988209410469228577,twitter,post,https://x.com/beaver_lll/status/1988209410469228577,text,2025-11-11T11:37:17.000Z,selenium_x_scraper_v1,แน่คือทำทุกวิถีทางสนองความต้องการของชาย,แน่คือทำทุกวิถีทางสนองความต้องการของชาย,2025-11-29 08:18:55,"['แน่', 'คือ', 'ทำ', 'ทุก', 'วิถีทาง', 'สนองความต้องการ', 'ของ', 'ชาย']"
1988171600697717078,twitter,post,https://x.com/WN7171/status/1988171600697717078,text,2025-11-11T09:07:02.000Z,selenium_x_scraper_v1,เหมือนมันจะมีหนังเรื่องนึงที่เพื่อนตัวเอกเป็นนักเต้นแบบนี้ น่าจะชื่อเรื่อง Kite Runner ถ้าจำไม่ผิดนะคะ,เหมือนมันจะมีหนังเรื่องนึงที่เพื่อนตัวเอกเป็นนักเต้นแบบนี้ น่าจะชื่อเรื่อง Kite Runner ถ้าจำไม่ผิดนะคะ,2025-11-29 08:18:55,"['เหมือน', 'มัน', 'จะ', 'มี', 'หนัง', 'เรื่อง', 'นึง', 'ที่', 'เพื่อน', 'ตัวเอก', 'เป็น', 'นัก', 'เต้น', 'แบบนี้', ' ', 'น่าจะ', 'ชื่อเรื่อง', ' ', 'kite', ' ', 'runner', ' ', 'ถ้า', 'จำ', 'ไม่', 'ผิด', 'นะคะ']"
1988131969088307265,twitter,post,https://x.com/Khimhun30/status/1988131969088307265,text,2025-11-11T06:29:33.000Z,selenium_x_scraper_v1,ตับๆๆ55๕,ตับๆๆ55๕,2025-11-29 08:18:55,"['ตับ', 'ๆๆ', '55๕']"
1988335809951576325,twitter,post,https://x.com/Tt56295934/status/1988335809951576325,text,2025-11-11T19:59:33.000Z,selenium_x_scraper_v1,เพิ่งดูสารคดีเกี่ยวกับฝรั่งหาเมียเอเชีย มันเลือกคนไม่รู้อิ้งละไม่นานแต่งเลย(คุยกันไม่รู้เรื่องแต่ล่ามแปล) พวกนี้อยากรู้สึกว่าตัวเองเหนือกว่าให้ผู้หญิงคอยพึ่ง กับกระทู้ใน reddit เป็นฝรั่งมาอยู่ไทยบอกอยู่มาหลายปีละ แต่ไม่อยากและไม่คิดจะเรียนภาษาไทยเพราะอยากโดนทรีตแบบนักท่องเที่ยว,เพิ่งดูสารคดีเกี่ยวกับฝรั่งหาเมียเอเชีย มันเลือกคนไม่รู้อิ้งละไม่นานแต่งเลย(คุยกันไม่รู้เรื่องแต่ล่ามแปล) พวกนี้อยากรู้สึกว่าตัวเองเหนือกว่าให้ผู้หญิงคอยพึ่ง กับกระทู้ใน reddit เป็นฝรั่งมาอยู่ไทยบอกอยู่มาหลายปีละ แต่ไม่อยากและไม่คิดจะเรียนภาษาไทยเพราะอยากโดนทรีตแบบนักท่องเที่ยว,2025-11-29 08:18:55,"['เพิ่ง', 'ดู', 'สารคดี', 'เกี่ยวกับ', 'ฝรั่ง', 'หา', 'เมีย', 'เอเชีย', ' ', 'มัน', 'เลือก', 'คน', 'ไม่', 'รู้', 'อิ้ง', 'ละ', 'ไม่', 'นาน', 'แต่ง', 'เลย', ' ', 'คุย', 'กัน', 'ไม่', 'รู้เรื่อง', 'แต่', 'ล่าม', 'แปล', ' ', 'พวก', 'นี้', 'อยาก', 'รู้สึก', 'ว่า', 'ตัวเอง', 'เหนือกว่า', 'ให้', 'ผู้หญิง', 'คอย', 'พึ่ง', ' ', 'กับ', 'กระทู้', 'ใน', ' ', 'reddit', ' ', 'เป็น', 'ฝรั่ง', 'มา', 'อยู่', 'ไทย', 'บอก', 'อยู่', 'มา', 'หลาย', 'ปี', 'ละ', ' ', 'แต่', 'ไม่', 'อยาก', 'และ', 'ไม่', 'คิด', 'จะ', 'เรียน', 'ภาษาไทย', 'เพราะ', 'อยาก', 'โด', 'นท', 'รีต', 'แบบ', 'นักท่องเที่ยว']"
1988226384058265747,twitter,post,https://x.com/waiwisery/status/1988226384058265747,text,2025-11-11T12:44:44.000Z,selenium_x_scraper_v1,เคยเจอแบบกับคนไทยนี่เถียงคอเป็นเอ็น เรื่องมาก แต่กับแฟนฝรั่งนี่ไม่เถียงเลย อะไรก็ได้หมด เชื่อฟังสุด,เคยเจอแบบกับคนไทยนี่เถียงคอเป็นเอ็น เรื่องมาก แต่กับแฟนฝรั่งนี่ไม่เถียงเลย อะไรก็ได้หมด เชื่อฟังสุด,2025-11-29 08:18:55,"['เคย', 'เจอ', 'แบบ', 'กับ', 'คนไทย', 'นี่', 'เถียง', 'คอเป็นเอ็น', ' ', 'เรื่องมาก', ' ', 'แต่', 'กับ', 'แฟน', 'ฝรั่ง', 'นี่', 'ไม่', 'เถียง', 'เลย', ' ', 'อะไร', 'ก็ได้', 'หมด', ' ', 'เชื่อฟัง', 'สุด']"
1988343664033296725,twitter,post,https://x.com/CcZee_/status/1988343664033296725,text,2025-11-11T20:30:45.000Z,selenium_x_scraper_v1,อยากจะบอกผญไทยบางคนที่เดินสายต่างชาติเหมือนกันว่าที่เขาเลือกคุณไม่ได้แปลว่าคุณสวย แต่เขามองว่าคุณคอนโทรลง่าย เพราะงั้นช่วยมีมาตรฐานในการเลือกคู่ต่างชาติหน่อยเถอะ ไม่ใช่ว่าสักแต่เอามาเป็นผัวเพราะสัญชาติอย่างเดียว…,อยากจะบอกผญไทยบางคนที่เดินสายต่างชาติเหมือนกันว่าที่เขาเลือกคุณไม่ได้แปลว่าคุณสวย แต่เขามองว่าคุณคอนโทรลง่าย เพราะงั้นช่วยมีมาตรฐานในการเลือกคู่ต่างชาติหน่อยเถอะ ไม่ใช่ว่าสักแต่เอามาเป็นผัวเพราะสัญชาติอย่างเดียว…,2025-11-29 08:18:55,"['อยาก', 'จะ', 'บอก', 'ผญ', 'ไทย', 'บางคน', 'ที่', 'เดินสาย', 'ต่างชาติ', 'เหมือนกัน', 'ว่าที่', 'เขา', 'เลือก', 'คุณ', 'ไม่', 'ได้', 'แปล', 'ว่า', 'คุณ', 'สวย', ' ', 'แต่', 'เขา', 'มองว่า', 'คุณ', 'คอนโทรล', 'ง่าย', ' ', 'เพราะ', 'งั้น', 'ช่วย', 'มี', 'มาตรฐาน', 'ใน', 'การ', 'เลือกคู่', 'ต่างชาติ', 'หน่อย', 'เถอะ', ' ', 'ไม่', 'ใช่', 'ว่า', 'สัก', 'แต่', 'เอา', 'มา', 'เป็น', 'ผัว', 'เพราะ', 'สัญชาติ', 'อย่าง', 'เดียว']"
1988341678437011897,twitter,post,https://x.com/YYminusone/status/1988341678437011897,text,2025-11-11T20:22:52.000Z,selenium_x_scraper_v1,ละเคยเจอจริงๆ นี่ทำพาร์ทไทม์ร้านอาหารไทยในอังกิด เจอจริงๆเมียคนไทยผัวฝรั่ง แต่เมียคือเงียบเหมือนเป็นใบ้ จะสั่งจะกินอะไรต้องประซิบขอผัวก่อน แล้วผัวเป็นคนสั่งให้ ทั้งที่ปกติลูกค้าคนไทยเจอคนไทยด้วยกันจะชอบพูดคุยกะพนง.มากๆ,ละเคยเจอจริงๆ นี่ทำพาร์ทไทม์ร้านอาหารไทยในอังกิด เจอจริงๆเมียคนไทยผัวฝรั่ง แต่เมียคือเงียบเหมือนเป็นใบ้ จะสั่งจะกินอะไรต้องประซิบขอผัวก่อน แล้วผัวเป็นคนสั่งให้ ทั้งที่ปกติลูกค้าคนไทยเจอคนไทยด้วยกันจะชอบพูดคุยกะพนง.มากๆ,2025-11-29 08:18:55,"['ละ', 'เคย', 'เจอ', 'จริงๆ', ' ', 'นี่', 'ทำ', 'พาร์ทไทม์', 'ร้านอาหาร', 'ไทย', 'ใน', 'อังกิด', ' ', 'เจอ', 'จริงๆ', 'เมีย', 'คนไทย', 'ผัว', 'ฝรั่ง', ' ', 'แต่', 'เมีย', 'คือ', 'เงียบ', 'เหมือน', 'เป็น', 'ใบ้', ' ', 'จะ', 'สั่ง', 'จะ', 'กิน', 'อะไร', 'ต้อง', 'ประ', 'ซิบ', 'ขอ', 'ผัว', 'ก่อน', ' ', 'แล้ว', 'ผัว', 'เป็น', 'คน', 'สั่ง', 'ให้', ' ', 'ทั้งที่', 'ปกติ', 'ลูกค้า', 'คนไทย', 'เจอ', 'คนไทย', 'ด้วยกัน', 'จะ', 'ชอบ', 'พูดคุย', 'กะ', 'พน', 'ง', '.', 'มาก', 'ๆ']"
1988331693611298948,twitter,post,https://x.com/ntthaya/status/1988331693611298948,text,2025-11-11T19:43:11.000Z,selenium_x_scraper_v1,ขอร้องพวกหาผัวฝรั่งช่วยมีปากมีเสียงมั่งเหอะ มึงทนแม่งได้แต่มันเดือดร้อนคนอื่น แล้วพอมึงยอมมัน มันคิดว่าผญไทยต้องเป็นแบบนั้นหมด เลยคิดว่าจะสามารถพูดจาแย่ๆกับคนอื่นได้ (เพราะมันพูดเป็นปกติก่ะมึง)ให้ชีวิตตัวเองทุเรศคนเดียวพอ ถ้าให้ผัวทำตัวดีๆกับคนอื่นไม่ได้ ไม่ต้องออกไปไหน,ขอร้องพวกหาผัวฝรั่งช่วยมีปากมีเสียงมั่งเหอะ มึงทนแม่งได้แต่มันเดือดร้อนคนอื่น แล้วพอมึงยอมมัน มันคิดว่าผญไทยต้องเป็นแบบนั้นหมด เลยคิดว่าจะสามารถพูดจาแย่ๆกับคนอื่นได้ (เพราะมันพูดเป็นปกติก่ะมึง)ให้ชีวิตตัวเองทุเรศคนเดียวพอ ถ้าให้ผัวทำตัวดีๆกับคนอื่นไม่ได้ ไม่ต้องออกไปไหน,2025-11-29 08:18:55,"['ขอร้อง', 'พวก', 'หา', 'ผัว', 'ฝรั่ง', 'ช่วย', 'มีปากมีเสียง', 'มั่ง', 'เหอะ', ' ', 'มึง', 'ทน', 'แม่', 'ง', 'ได้', 'แต่', 'มัน', 'เดือดร้อน', 'คนอื่น', ' ', 'แล้ว', 'พอ', 'มึง', 'ยอม', 'มัน', ' ', 'มัน', 'คิด', 'ว่า', 'ผญ', 'ไทย', 'ต้อง', 'เป็น', 'แบบ', 'นั้น', 'หมด', ' ', 'เลย', 'คิด', 'ว่า', 'จะ', 'สามารถ', 'พูดจา', 'แย่', 'ๆ', 'กับ', 'คนอื่น', 'ได้', ' ', 'เพราะ', 'มัน', 'พูด', 'เป็นปกติ', 'ก่ะ', 'มึง', ' ', 'ให้', 'ชีวิต', 'ตัวเอง', 'ทุเรศ', 'คนเดียว', 'พอ', ' ', 'ถ้า', 'ให้', 'ผัว', 'ทำ', 'ตัวดี', 'ๆ', 'กับ', 'คนอื่น', 'ไม่', 'ได้', ' ', 'ไม่ต้อง', 'ออก', 'ไป', 'ไหน']"
