id,platform,platform_type,url,content_type,timestamp,scraper_module,text,raw_text,scrape_date,tokens
1974632647734550593,twitter,post,https://x.com/anatasiav1/status/1974632647734550593,text,2025-10-05T00:28:04.000Z,selenium_x_scraper_v1,พื้นฐานและสัญชาตญาณของมนุษย์ถือเป็นเรื่องปกติมากที่จะนินทากันและมันถูกนับเป็นทักษะเอาตัวรอดที่มนุษย์ใช้มานานหลายยุคสมัยแล้ว เพราะมนุษย์เป็น “สัตว์สังคม” ดังนั้นทั้งชายและหญิง “นินทา” เหมือนกัน ไม่มีใครหรือเพศไหนนินทามากหรือน้อยกว่าเป็นพิเศษ,พื้นฐานและสัญชาตญาณของมนุษย์ถือเป็นเรื่องปกติมากที่จะนินทากันและมันถูกนับเป็นทักษะเอาตัวรอดที่มนุษย์ใช้มานานหลายยุคสมัยแล้ว เพราะมนุษย์เป็น “สัตว์สังคม” ดังนั้นทั้งชายและหญิง “นินทา” เหมือนกัน ไม่มีใครหรือเพศไหนนินทามากหรือน้อยกว่าเป็นพิเศษ,2025-11-08 17:05:14,"['พื้นฐาน', 'และ', 'สัญชาตญาณ', 'ของ', 'มนุษย์', 'ถือ', 'เป็นเรื่อง', 'ปกติ', 'มาก', 'ที่จะ', 'นินทา', 'กัน', 'และ', 'มัน', 'ถูก', 'นับ', 'เป็น', 'ทักษะ', 'เอาตัวรอด', 'ที่', 'มนุษย์', 'ใช้', 'มา', 'นาน', 'หลาย', 'ยุคสมัย', 'แล้ว', ' ', 'เพราะ', 'มนุษย์', 'เป็น', ' ', 'สัตว์', 'สังคม', ' ', 'ดังนั้น', 'ทั้ง', 'ชาย', 'และ', 'หญิง', ' ', 'นินทา', ' ', 'เหมือนกัน', ' ', 'ไม่', 'มี', 'ใคร', 'หรือ', 'เพศ', 'ไหน', 'นินทา', 'มาก', 'หรือ', 'น้อยกว่า', 'เป็นพิเศษ']"
1974003105667698813,twitter,post,https://x.com/primmyprimary/status/1974003105667698813,text,2025-10-03T06:46:30.000Z,selenium_x_scraper_v1,เพื่อนผญตอนมัธยมพูดแบบนี้ว่าเพื่อนชายนางไม่นินทา พอนางเดินออกไป ผชที่นางพูดว่าไม่นนินทาก็เริ่มนินทานาง5555555 กุโครตขำ,เพื่อนผญตอนมัธยมพูดแบบนี้ว่าเพื่อนชายนางไม่นินทา พอนางเดินออกไป ผชที่นางพูดว่าไม่นนินทาก็เริ่มนินทานาง5555555 กุโครตขำ,2025-11-08 17:05:14,"['เพื่อน', 'ผญ', 'ตอน', 'มัธยม', 'พูด', 'แบบนี้', 'ว่า', 'เพื่อนชาย', 'นาง', 'ไม่', 'นินทา', ' ', 'พอ', 'นาง', 'เดิน', 'ออก', 'ไป', ' ', 'ผช', 'ที่', 'นาง', 'พูดว่า', 'ไม่', 'น', 'นินทา', 'ก็', 'เริ่ม', 'นินทา', 'นาง', 'หัวเราะ', ' ', 'กุ', 'โค', 'รต', 'ขำ']"
1973984892473209305,twitter,post,https://x.com/naerngchx/status/1973984892473209305,text,2025-10-03T05:34:07.000Z,selenium_x_scraper_v1,ยอมรับเหอะว่าบางทีผญบางคนก็แย่จริงๆ ส่วนตัวกุเกิดมาถ้าไม่นิสัยเสียก็นิสัยดีก็ชอบยืมเงิน+เอาเปรียบอะ แล้วแต่คนด้วยมั้ง ผชขี้นินทราจริงแต่เท่าที่กุคบมา เรื่องที่มันนินทราไม่เคยวาร์ปไปกลุ่มอื่น แต่กับผญไม่รอดหรอก รู้คนเดียวรู้ทั้งกลุ่ม รู้ทั้งกลุ่มรู้ทั้งมอ เอาอะไรไปไว้ใจอะอีดอก,ยอมรับเหอะว่าบางทีผญบางคนก็แย่จริงๆ ส่วนตัวกุเกิดมาถ้าไม่นิสัยเสียก็นิสัยดีก็ชอบยืมเงิน+เอาเปรียบอะ แล้วแต่คนด้วยมั้ง ผชขี้นินทราจริงแต่เท่าที่กุคบมา เรื่องที่มันนินทราไม่เคยวาร์ปไปกลุ่มอื่น แต่กับผญไม่รอดหรอก รู้คนเดียวรู้ทั้งกลุ่ม รู้ทั้งกลุ่มรู้ทั้งมอ เอาอะไรไปไว้ใจอะอีดอก,2025-11-08 17:05:14,"['ยอมรับ', 'เหอะ', 'ว่า', 'บางที', 'ผญ', 'บางคน', 'ก็', 'แย่', 'จริงๆ', ' ', 'ส่วนตัว', 'กุ', 'เกิด', 'มา', 'ถ้า', 'ไม่', 'นิสัยเสีย', 'ก็', 'นิสัย', 'ดี', 'ก็', 'ชอบ', 'ยืม', 'เงิน', ' ', 'เอาเปรียบ', 'อะ', ' ', 'แล้วแต่', 'คน', 'ด้วย', 'มั้ง', ' ', 'ผช', 'ขี้', 'นิ', 'นท', 'รา', 'จริง', 'แต่', 'เท่าที่', 'กุ', 'คบ', 'มา', ' ', 'เรื่อง', 'ที่', 'มัน', 'นิ', 'นท', 'รา', 'ไม่', 'เคย', 'วาร์ป', 'ไป', 'กลุ่ม', 'อื่น', ' ', 'แต่', 'กับ', 'ผญ', 'ไม่', 'รอด', 'หรอก', ' ', 'รู้', 'คนเดียว', 'รู้', 'ทั้ง', 'กลุ่ม', ' ', 'รู้', 'ทั้ง', 'กลุ่ม', 'รู้', 'ทั้ง', 'มอ', ' ', 'เอา', 'อะไร', 'ไป', 'ไว้ใจ', 'อะ', 'อีดอก']"
1974409484308279788,twitter,post,https://x.com/Naruedon02/status/1974409484308279788,text,2025-10-04T09:41:18.000Z,selenium_x_scraper_v1,"ประเด็นผู้ชายไม่ขี้เม้า มันวนมาทุกปีเลยนะ 
ได้แต่ภาวนาว่า ไม่ต้องมีผู้หญิงคนไหน ไปเป็นหัวข้อในวงนินทาของผู้ชายก็แล้วกัน
เพราะเคยได้ฟังแล้ว กลัวมาก ไม่กล้ามีแฟน มีหลัว กลัวเจอแตงโม","ประเด็นผู้ชายไม่ขี้เม้า มันวนมาทุกปีเลยนะ 
ได้แต่ภาวนาว่า ไม่ต้องมีผู้หญิงคนไหน ไปเป็นหัวข้อในวงนินทาของผู้ชายก็แล้วกัน
เพราะเคยได้ฟังแล้ว กลัวมาก ไม่กล้ามีแฟน มีหลัว กลัวเจอแตงโม",2025-11-08 17:05:14,"['ประเด็น', 'ผู้ชาย', 'ไม่', 'ขี้', 'เม้า', ' ', 'มัน', 'วน', 'มา', 'ทุกปี', 'เลย', 'นะ', ' ', 'ได้', 'แต่', 'ภาวนา', 'ว่า', ' ', 'ไม่ต้อง', 'มี', 'ผู้หญิง', 'คน', 'ไหน', ' ', 'ไป', 'เป็น', 'หัวข้อ', 'ใน', 'วง', 'นินทา', 'ของ', 'ผู้ชาย', 'ก็แล้วกัน', ' ', 'เพราะ', 'เคย', 'ได้', 'ฟัง', 'แล้ว', ' ', 'กลัว', 'มาก', ' ', 'ไม่', 'กล้า', 'มี', 'แฟน', ' ', 'มี', 'หลัว', ' ', 'กลัว', 'เจอ', 'แตงโม']"
1974005951125454890,twitter,post,https://x.com/hihilovelyme/status/1974005951125454890,text,2025-10-03T06:57:48.000Z,selenium_x_scraper_v1,อีผชนี่บางคนป้อดกว่าผญอีก นินทาฉ่ำกว่า แต่พอถึงคราวก็หายหัว btw ไม่มีใครประเสริฐแบบใสสะอาด 100% หรอก เอาดีบางสิ่งบางอย่างที่คนมันนินทาก็มาจากนิสัยที่ไม่น่ารักรึป่าว ก็ดูตัวเองกันด้วยค่ะ,อีผชนี่บางคนป้อดกว่าผญอีก นินทาฉ่ำกว่า แต่พอถึงคราวก็หายหัว btw ไม่มีใครประเสริฐแบบใสสะอาด 100% หรอก เอาดีบางสิ่งบางอย่างที่คนมันนินทาก็มาจากนิสัยที่ไม่น่ารักรึป่าว ก็ดูตัวเองกันด้วยค่ะ,2025-11-08 17:05:14,"['อี', 'ผช', 'นี่', 'บางคน', 'ป้อ', 'ดก', 'ว่า', 'ผญ', 'อีก', ' ', 'นินทา', 'ฉ่ำ', 'กว่า', ' ', 'แต่', 'พอ', 'ถึงคราว', 'ก็', 'หายหัว', ' ', 'btw', ' ', 'ไม่', 'มี', 'ใคร', 'ประเสริฐ', 'แบบ', 'ใส', 'สะอาด', ' ', '100', ' ', 'หรอก', ' ', 'เอา', 'ดี', 'บางสิ่งบางอย่าง', 'ที่', 'คน', 'มัน', 'นินทา', 'ก็', 'มาจาก', 'นิสัย', 'ที่', 'ไม่', 'น่ารัก', 'รึ', 'ป่าว', ' ', 'ก็', 'ดู', 'ตัวเอง', 'กัน', 'ด้วย', 'ค่ะ']"
1974362489447170099,twitter,post,https://x.com/Chaba249/status/1974362489447170099,text,2025-10-04T06:34:34.000Z,selenium_x_scraper_v1,เธอค่ะ ผู้ชายขี้เม้า และนินทาเก่งมากๆๆๆๆๆเธอ จากคนที่เป็นหญิง 1 เดียวที่คอยขับรถให้หลัวกับเพื่อนๆตอนไปดื่ม,เธอค่ะ ผู้ชายขี้เม้า และนินทาเก่งมากๆๆๆๆๆเธอ จากคนที่เป็นหญิง 1 เดียวที่คอยขับรถให้หลัวกับเพื่อนๆตอนไปดื่ม,2025-11-08 17:05:14,"['เธอ', 'ค่ะ', ' ', 'ผู้ชาย', 'ขี้', 'เม้า', ' ', 'และ', 'นินทา', 'เก่ง', 'มาก', 'ๆๆๆๆๆ', 'เธอ', ' ', 'จาก', 'คน', 'ที่', 'เป็น', 'หญิง', ' ', '1', ' ', 'เดียว', 'ที่', 'คอย', 'ขับรถ', 'ให้', 'หลัว', 'กับ', 'เพื่อน', 'ๆ', 'ตอน', 'ไป', 'ดื่ม']"
1974503093686649260,twitter,post,https://x.com/salmamilk/status/1974503093686649260,text,2025-10-04T15:53:16.000Z,selenium_x_scraper_v1,ผู้หญิงขี้นินทานั้นเรื่องปกติแต่ตราบใดที่ผู้ชายนินทาปากแต่ละคนนี้สุดยอด บางคนไม่พูดก็คือไม่พูดแต่อย่าให้พูดคือเจ็บจิ๊ด,ผู้หญิงขี้นินทานั้นเรื่องปกติแต่ตราบใดที่ผู้ชายนินทาปากแต่ละคนนี้สุดยอด บางคนไม่พูดก็คือไม่พูดแต่อย่าให้พูดคือเจ็บจิ๊ด,2025-11-08 17:05:14,"['ผู้หญิง', 'ขี้', 'นินทา', 'นั้น', 'เรื่อง', 'ปกติ', 'แต่', 'ตราบใดที่', 'ผู้ชาย', 'นินทา', 'ปาก', 'แต่ละคน', 'นี้', 'สุดยอด', ' ', 'บางคน', 'ไม่', 'พูด', 'ก็', 'คือ', 'ไม่', 'พูด', 'แต่', 'อย่า', 'ให้', 'พูด', 'คือ', 'เจ็บ', 'จิ๊ด']"
1973987652811829300,twitter,post,https://x.com/MagzMx/status/1973987652811829300,text,2025-10-03T05:45:06.000Z,selenium_x_scraper_v1,เพื่อน ผญ ในชีวิตน้อยมากแบบนับคนได้ เคยเจอประสบการณ์ตอนเรียน เพื่อน ผญ กลุ่มเดียวกันสนิทกันมา 3 ปี นินทาเราแบบแรงมาก แต่เราอยู่ในห้องล็อคเกอร์ที่พวกเค้าไม่เห็น ทำ ปจ จบเราไม่ใส่ชื่อเลย ทำส่งคนเดียว แบบแจ้ง อ. แล้วด้วยว่าพวกเค้าไม่ช่วยทำ พอเรียนจบก็แยกย้ายเลิกคบหมด,เพื่อน ผญ ในชีวิตน้อยมากแบบนับคนได้ เคยเจอประสบการณ์ตอนเรียน เพื่อน ผญ กลุ่มเดียวกันสนิทกันมา 3 ปี นินทาเราแบบแรงมาก แต่เราอยู่ในห้องล็อคเกอร์ที่พวกเค้าไม่เห็น ทำ ปจ จบเราไม่ใส่ชื่อเลย ทำส่งคนเดียว แบบแจ้ง อ. แล้วด้วยว่าพวกเค้าไม่ช่วยทำ พอเรียนจบก็แยกย้ายเลิกคบหมด,2025-11-08 17:05:14,"['เพื่อน', ' ', 'ผญ', ' ', 'ใน', 'ชีวิต', 'น้อย', 'มาก', 'แบบ', 'นับ', 'คน', 'ได้', ' ', 'เคย', 'เจอ', 'ประสบการณ์', 'ตอน', 'เรียน', ' ', 'เพื่อน', ' ', 'ผญ', ' ', 'กลุ่ม', 'เดียวกัน', 'สนิท', 'กัน', 'มา', ' ', '3', ' ', 'ปี', ' ', 'นินทา', 'เรา', 'แบ', 'บแรง', 'มาก', ' ', 'แต่', 'เรา', 'อยู่', 'ใน', 'ห้อง', 'ล็อคเกอร์', 'ที่', 'พวก', 'เค้า', 'ไม่', 'เห็น', ' ', 'ทำ', ' ', 'ปจ', ' ', 'จบ', 'เรา', 'ไม่', 'ใส่', 'ชื่อ', 'เลย', ' ', 'ทำ', 'ส่ง', 'คนเดียว', ' ', 'แบบ', 'แจ้ง', ' ', 'อ.', ' ', 'แล้ว', 'ด้วยว่า', 'พวก', 'เค้า', 'ไม่', 'ช่วย', 'ทำ', ' ', 'พอ', 'เรียนจบ', 'ก็', 'แยกย้าย', 'เลิกคบ', 'หมด']"
1974160728585282013,twitter,post,https://x.com/myJRN_/status/1974160728585282013,text,2025-10-03T17:12:50.000Z,selenium_x_scraper_v1,ในฐานะที่เรียนโรงเรียนที่เคยเป็นชายล้วนมาก่อน (ปจบ.เป็นสห แต่ผชก็เยอะกว่าอยู่ดี) และจบวิศวะมา ทำงานเป็นวิศวกร บอกเลยว่า ผช.ก็นินทาเหมือนกันค่ะ มันไม่ได้อยู่ที่เพศ มันอยู่ที่สันดาน,ในฐานะที่เรียนโรงเรียนที่เคยเป็นชายล้วนมาก่อน (ปจบ.เป็นสห แต่ผชก็เยอะกว่าอยู่ดี) และจบวิศวะมา ทำงานเป็นวิศวกร บอกเลยว่า ผช.ก็นินทาเหมือนกันค่ะ มันไม่ได้อยู่ที่เพศ มันอยู่ที่สันดาน,2025-11-08 17:05:14,"['ใน', 'ฐานะ', 'ที่', 'เรียน', 'โรงเรียน', 'ที่', 'เคย', 'เป็น', 'ชาย', 'ล้วน', 'มา', 'ก่อน', ' ', 'ปจ', 'บ.', 'เป็น', 'สห', ' ', 'แต่', 'ผช', 'ก็', 'เยอะ', 'กว่า', 'อยู่ดี', ' ', 'และ', 'จบ', 'วิศวะ', 'มา', ' ', 'ทำงาน', 'เป็น', 'วิศวกร', ' ', 'บอก', 'เลย', 'ว่า', ' ', 'ผช.', 'ก็', 'นินทา', 'เหมือนกัน', 'ค่ะ', ' ', 'มัน', 'ไม่', 'ได้', 'อยู่', 'ที่', 'เพศ', ' ', 'มัน', 'อยู่', 'ที่', 'สันดาน']"
1974394983357775963,twitter,post,https://x.com/fortr06/status/1974394983357775963,text,2025-10-04T08:43:41.000Z,selenium_x_scraper_v1,เพื่อนกลุ่มมัดยมนี่ผู้หญิงล้วนไม่นินทาใครเลยจจ เวลาเจอกันคุยแต่เรื่องตัวเองกัน ปรึกษาปัญหาล้านแปดกัน มีแต่กุที่ชอบเสือกเรื่องชาวบ้านคนเดียว มีแอบนอยนิดนึงที่พวกนางอินโทรเวิดกัน ทักไปคุยตอบ แต่มันไม่ทักมาก่อนเลย,เพื่อนกลุ่มมัดยมนี่ผู้หญิงล้วนไม่นินทาใครเลยจจ เวลาเจอกันคุยแต่เรื่องตัวเองกัน ปรึกษาปัญหาล้านแปดกัน มีแต่กุที่ชอบเสือกเรื่องชาวบ้านคนเดียว มีแอบนอยนิดนึงที่พวกนางอินโทรเวิดกัน ทักไปคุยตอบ แต่มันไม่ทักมาก่อนเลย,2025-11-08 17:05:14,"['เพื่อน', 'กลุ่ม', 'มัด', 'ยม', 'นี่', 'ผู้หญิง', 'ล้วน', 'ไม่', 'นินทา', 'ใคร', 'เลย', 'จจ', ' ', 'เวลา', 'เจอกัน', 'คุย', 'แต่', 'เรื่อง', 'ตัวเอง', 'กัน', ' ', 'ปรึกษา', 'ปัญหา', 'ล้าน', 'แปด', 'กัน', ' ', 'มี', 'แต่', 'กุ', 'ที่', 'ชอบ', 'เสือก', 'เรื่อง', 'ชาวบ้าน', 'คนเดียว', ' ', 'มี', 'แอ', 'บน', 'อย', 'นิดนึง', 'ที่', 'พวก', 'นาง', 'อิน', 'โทร', 'เวิด', 'กัน', ' ', 'ทัก', 'ไป', 'คุย', 'ตอบ', ' ', 'แต่', 'มัน', 'ไม่', 'ทัก', 'มา', 'ก่อน', 'เลย']"
1974404086465544400,twitter,post,https://x.com/PatSRy_Ch/status/1974404086465544400,text,2025-10-04T09:19:51.000Z,selenium_x_scraper_v1,"เคยมีเพื่อนคนนึงชีชอบพูดแบบนี้ แต่นางก็เป็นหัวข้อเม้าของ ผญ จริง นางเลยเน้นสนิทกับ ผช แบบนี้

แต่คือ ผช มันก็เอานางมาเม้าอะ แรงกว่า ผญ ด้วย","เคยมีเพื่อนคนนึงชีชอบพูดแบบนี้ แต่นางก็เป็นหัวข้อเม้าของ ผญ จริง นางเลยเน้นสนิทกับ ผช แบบนี้

แต่คือ ผช มันก็เอานางมาเม้าอะ แรงกว่า ผญ ด้วย",2025-11-08 17:05:14,"['เคย', 'มี', 'เพื่อน', 'คน', 'นึง', 'ชี', 'ชอบ', 'พูด', 'แบบนี้', ' ', 'แต่', 'นาง', 'ก็', 'เป็น', 'หัวข้อ', 'เม้า', 'ของ', ' ', 'ผญ', ' ', 'จริง', ' ', 'นาง', 'เลย', 'เน้น', 'สนิท', 'กับ', ' ', 'ผช', ' ', 'แบบนี้', ' ', 'แต่', 'คือ', ' ', 'ผช', ' ', 'มัน', 'ก็', 'เอา', 'นาง', 'มา', 'เม้า', 'อะ', ' ', 'แรง', 'กว่า', ' ', 'ผญ', ' ', 'ด้วย']"
1974346517709480368,twitter,post,https://x.com/KKing1827/status/1974346517709480368,text,2025-10-04T05:31:06.000Z,selenium_x_scraper_v1,จริง555 เมื่อก่อนก็เคยคิดว่าพวกผู้ชายไม่จับกลุามนินทากันเพราะไม่เคยได้ยินพวกมันพูด จนกระทั่งครั้งหนึ่งมีโอกาสไปร่วมวงได้ยินเปิดปากแต่ละคำคือช็อกอะ แม่งนินทาหลักกว่าผู้หญิงทุกคน เห็นดูนิ่งๆ ไม่สนใจใครแต่เวลานินทาคือฉ่ำมาก มุมมองเปลี่ยนทันที,จริง555 เมื่อก่อนก็เคยคิดว่าพวกผู้ชายไม่จับกลุามนินทากันเพราะไม่เคยได้ยินพวกมันพูด จนกระทั่งครั้งหนึ่งมีโอกาสไปร่วมวงได้ยินเปิดปากแต่ละคำคือช็อกอะ แม่งนินทาหลักกว่าผู้หญิงทุกคน เห็นดูนิ่งๆ ไม่สนใจใครแต่เวลานินทาคือฉ่ำมาก มุมมองเปลี่ยนทันที,2025-11-08 17:05:14,"['จริง', 'หัวเราะ', ' ', 'เมื่อก่อน', 'ก็', 'เคย', 'คิด', 'ว่า', 'พวก', 'ผู้ชาย', 'ไม่', 'จับ', 'ก', 'ลุ', 'าม', 'นินทา', 'กัน', 'เพราะ', 'ไม่', 'เคย', 'ได้ยิน', 'พวก', 'มัน', 'พูด', ' ', 'จนกระทั่ง', 'ครั้งหนึ่ง', 'มีโอกาส', 'ไป', 'ร่วมวง', 'ได้ยิน', 'เปิดปาก', 'แต่ละ', 'คำ', 'คือ', 'ช็อก', 'อะ', ' ', 'แม่', 'ง', 'นินทา', 'หลัก', 'กว่า', 'ผู้หญิง', 'ทุกคน', ' ', 'เห็น', 'ดู', 'นิ่ง', 'ๆ', ' ', 'ไม่', 'สนใจ', 'ใคร', 'แต่', 'เวลา', 'นินทา', 'คือ', 'ฉ่ำ', 'มาก', ' ', 'มุมมอง', 'เปลี่ยน', 'ทันที']"
