id,platform,platform_type,url,content_type,timestamp,scraper_module,text,raw_text,scrape_date,tokens
1986103085127942175,twitter,post,https://x.com/Valleybiskp/status/1986103085127942175,text,2025-11-05T16:07:30.000Z,selenium_x_scraper_v1,ขนาดเพจนี้มันศูนย์รวมชายแท้ แต่เม้นในโพสต์ล่าสุดคือโดนด่ายับ อุบาทว์ขนาดนี้ทำไมคนโพสต์คิดไม่ได้ ตัวเองมีลูกสาวด้วยนะ หัวควยจริงๆ,ขนาดเพจนี้มันศูนย์รวมชายแท้ แต่เม้นในโพสต์ล่าสุดคือโดนด่ายับ อุบาทว์ขนาดนี้ทำไมคนโพสต์คิดไม่ได้ ตัวเองมีลูกสาวด้วยนะ หัวควยจริงๆ,2025-11-29 08:18:55,"['ขนาด', 'เพจ', 'นี้', 'มัน', 'ศูนย์รวม', 'ชาย', 'แท้', ' ', 'แต่', 'เม้น', 'ใน', 'โพสต์', 'ล่าสุด', 'คือ', 'โดน', 'ด่า', 'ยับ', ' ', 'อุบาทว์', 'ขนาด', 'นี้', 'ทำไม', 'คน', 'โพสต์', 'คิด', 'ไม่', 'ได้', ' ', 'ตัวเอง', 'มี', 'ลูกสาว', 'ด้วย', 'นะ', ' ', 'หัว', 'ควย', 'จริงๆ']"
1985910317965275508,twitter,post,https://x.com/choxc911/status/1985910317965275508,text,2025-11-05T03:21:30.000Z,selenium_x_scraper_v1,อิเพจนี้หลายเรื่องหลายทีละ,อิเพจนี้หลายเรื่องหลายทีละ,2025-11-29 08:18:55,"['อิ', 'เพจ', 'นี้', 'หลาย', 'เรื่อง', 'หลาย', 'ทีละ']"
1985984733881470998,twitter,post,https://x.com/JhatesLG/status/1985984733881470998,text,2025-11-05T08:17:13.000Z,selenium_x_scraper_v1,ไม่ใช่คาร์แรคเตอร์คนเหี้ยนะ เพราะตัวจริงก็เหี้ยเลย มีแต่คนเอือม,ไม่ใช่คาร์แรคเตอร์คนเหี้ยนะ เพราะตัวจริงก็เหี้ยเลย มีแต่คนเอือม,2025-11-29 08:18:55,"['ไม่', 'ใช่', 'คาร์', 'แร', 'คเตอร์คน', 'เหี้ย', 'นะ', ' ', 'เพราะ', 'ตัวจริง', 'ก็', 'เหี้ย', 'เลย', ' ', 'มี', 'แต่', 'คน', 'เอือม']"
1986001046393782451,twitter,post,https://x.com/boyfilotimo/status/1986001046393782451,text,2025-11-05T09:22:02.000Z,selenium_x_scraper_v1,ตั๋วร้อนคุ้นๆนะ ใช่อันเดียวกันกับตั๋วร้อนป๊อปคอร์นชีสที่เคยมีดราม่ามั้ยอ่ะ,ตั๋วร้อนคุ้นๆนะ ใช่อันเดียวกันกับตั๋วร้อนป๊อปคอร์นชีสที่เคยมีดราม่ามั้ยอ่ะ,2025-11-29 08:18:55,"['ตั๋ว', 'ร้อน', 'คุ้นๆ', 'นะ', ' ', 'ใช่', 'อัน', 'เดียวกัน', 'กับ', 'ตั๋ว', 'ร้อน', 'ป๊อปคอร์น', 'ชีส', 'ที่', 'เคย', 'มี', 'ดราม่า', 'มั้ย', 'อ่ะ']"
1986017618566996028,twitter,post,https://x.com/Nekolili32/status/1986017618566996028,text,2025-11-05T10:27:53.000Z,selenium_x_scraper_v1,ก็อีตั๋ว,ก็อีตั๋ว,2025-11-29 08:18:55,"['ก็', 'อี', 'ตั๋ว']"
1985916474041720963,twitter,post,https://x.com/dearwisteria/status/1985916474041720963,text,2025-11-05T03:45:58.000Z,selenium_x_scraper_v1,เหมือนจะลบเม้นหนีไปแล้ว หาไม่เจอ โคตรขี้ขลาด 55555 สันดานต่ำทั้งทีก็กล้าๆหน่อยพี่,เหมือนจะลบเม้นหนีไปแล้ว หาไม่เจอ โคตรขี้ขลาด 55555 สันดานต่ำทั้งทีก็กล้าๆหน่อยพี่,2025-11-29 08:18:55,"['เหมือน', 'จะ', 'ลบ', 'เม้น', 'หนี', 'ไป', 'แล้ว', ' ', 'หาไม่', 'เจอ', ' ', 'โคตร', 'ขี้ขลาด', ' ', 'หัวเราะ', ' ', 'สันดาน', 'ต่ำ', 'ทั้งที', 'ก็', 'กล้า', 'ๆ', 'หน่อย', 'พี่']"
1985859603696140697,twitter,post,https://x.com/Lightning_ligxt/status/1985859603696140697,text,2025-11-04T23:59:59.000Z,selenium_x_scraper_v1,อ๋อเพจนี้เคยเห็น SH กางเกงในนักร้อง k-pop เกิวกรุ๊ปวงนึง นานมากแล้ว เล่นกันสนุกปากกับลูกเพจชายแทร่คุณภาพต่ำ ไม่นึกว่าจะไม่พัฒนาขึ้นเลย,อ๋อเพจนี้เคยเห็น SH กางเกงในนักร้อง k-pop เกิวกรุ๊ปวงนึง นานมากแล้ว เล่นกันสนุกปากกับลูกเพจชายแทร่คุณภาพต่ำ ไม่นึกว่าจะไม่พัฒนาขึ้นเลย,2025-11-29 08:18:55,"['อ๋อ', 'เพจ', 'นี้', 'เคย', 'เห็น', ' ', 'sh', ' ', 'กางเกงใน', 'นักร้อง', ' ', 'k', ' ', 'pop', ' ', 'เกิว', 'กรุ๊ป', 'วง', 'นึง', ' ', 'นาน', 'มาก', 'แล้ว', ' ', 'เล่น', 'กัน', 'สนุกปาก', 'กับ', 'ลูก', 'เพจ', 'ชาย', 'แทร่', 'คุณภาพต่ำ', ' ', 'ไม่', 'นึก', 'ว่า', 'จะ', 'ไม่', 'พัฒนา', 'ขึ้น', 'เลย']"
1985839524476297562,twitter,post,https://x.com/Arie5377678/status/1985839524476297562,text,2025-11-04T22:40:12.000Z,selenium_x_scraper_v1,อินี่มันก็ทำทุเรศแบบนี้ประจำ เอาดาราผู้หญิงมาให้ลูกเพจแทะโลม,อินี่มันก็ทำทุเรศแบบนี้ประจำ เอาดาราผู้หญิงมาให้ลูกเพจแทะโลม,2025-11-29 08:18:55,"['อิ', 'นี่', 'มัน', 'ก็', 'ทำ', 'ทุเรศ', 'แบบนี้', 'ประจำ', ' ', 'เอา', 'ดารา', 'ผู้หญิง', 'มา', 'ให้', 'ลูก', 'เพจ', 'แทะโลม']"
1985915709957042358,twitter,post,https://x.com/fiudesu/status/1985915709957042358,text,2025-11-05T03:42:56.000Z,selenium_x_scraper_v1,ในชีวิตจริงก็ลองให้มันไปพูดกับคนไม่รู้จักดู อาจจะโดนกระทืบตาย,ในชีวิตจริงก็ลองให้มันไปพูดกับคนไม่รู้จักดู อาจจะโดนกระทืบตาย,2025-11-29 08:18:55,"['ใน', 'ชีวิตจริง', 'ก็', 'ลอง', 'ให้', 'มัน', 'ไป', 'พูด', 'กับ', 'คน', 'ไม่', 'รู้จัก', 'ดู', ' ', 'อาจจะ', 'โดน', 'กระทืบ', 'ตาย']"
1986007875844788230,twitter,post,https://x.com/phumtah/status/1986007875844788230,text,2025-11-05T09:49:10.000Z,selenium_x_scraper_v1,กรณีนี้สามารถพูดคำว่า ทุเรศ ได้เลย,กรณีนี้สามารถพูดคำว่า ทุเรศ ได้เลย,2025-11-29 08:18:55,"['กรณี', 'นี้', 'สามารถ', 'พูด', 'คำ', 'ว่า', ' ', 'ทุเรศ', ' ', 'ได้', 'เลย']"
1986039263146749986,twitter,post,https://x.com/brzderlacuze/status/1986039263146749986,text,2025-11-05T11:53:53.000Z,selenium_x_scraper_v1,วงการรีวิวหนังรู้กันอีตั๋วนี่ตัวดี ตัวชอบแทงสวนกระแส ถ่อยต่ำยังไงก็ได้ขอให้ได้แสงพอ หิวแสงมากที่สุด รีวิวขี้ๆ อุบาทว์ๆ,วงการรีวิวหนังรู้กันอีตั๋วนี่ตัวดี ตัวชอบแทงสวนกระแส ถ่อยต่ำยังไงก็ได้ขอให้ได้แสงพอ หิวแสงมากที่สุด รีวิวขี้ๆ อุบาทว์ๆ,2025-11-29 08:18:55,"['วงการ', 'รีวิว', 'หนัง', 'รู้กัน', 'อี', 'ตั๋ว', 'นี่', 'ตัวดี', ' ', 'ตัว', 'ชอบ', 'แทง', 'สวนกระแส', ' ', 'ถ่อย', 'ต่ำ', 'ยังไง', 'ก็ได้', 'ขอ', 'ให้ได้', 'แสง', 'พอ', ' ', 'หิว', 'แสง', 'มาก', 'ที่สุด', ' ', 'รีวิว', 'ขี้', 'ๆ', ' ', 'อุบาทว์', 'ๆ']"
1986031496407490735,twitter,post,https://x.com/yungenethelast/status/1986031496407490735,text,2025-11-05T11:23:02.000Z,selenium_x_scraper_v1,ละเดี๋ยวอีเพจชั้นต่ำพวกนี้มันรู้ว่าโดนทัวร์ลงในทวิตก็เอาไปเมคฟันต่อในเพจอีก ไม่รู้สึกรู้สาไรหรอก โคตรรำคาญ ถ้าสมองจะคิดกันได้แค่นี้อะ เลิกเป็นเพจหนังเถอะ,ละเดี๋ยวอีเพจชั้นต่ำพวกนี้มันรู้ว่าโดนทัวร์ลงในทวิตก็เอาไปเมคฟันต่อในเพจอีก ไม่รู้สึกรู้สาไรหรอก โคตรรำคาญ ถ้าสมองจะคิดกันได้แค่นี้อะ เลิกเป็นเพจหนังเถอะ,2025-11-29 08:18:55,"['ละ', 'เดี๋ยว', 'อี', 'เพจ', 'ชั้นต่ำ', 'พวก', 'นี้', 'มัน', 'รู้', 'ว่า', 'โดน', 'ทัวร์', 'ลง', 'ใน', 'ทวิ', 'ต', 'ก็', 'เอา', 'ไป', 'เมค', 'ฟัน', 'ต่อ', 'ใน', 'เพจ', 'อีก', ' ', 'ไม่', 'รู้สึกรู้สา', 'ไร', 'หรอก', ' ', 'โคตร', 'รำคาญ', ' ', 'ถ้า', 'สมอง', 'จะ', 'คิด', 'กัน', 'ได้', 'แค่นี้', 'อะ', ' ', 'เลิก', 'เป็น', 'เพจ', 'หนัง', 'เถอะ']"
1985908705444221156,twitter,post,https://x.com/ecignowad/status/1985908705444221156,text,2025-11-05T03:15:06.000Z,selenium_x_scraper_v1,ก็ชอบลงรูปดาราใส่ชุดที่ค่อนข้างเปิดเผยเวลามีข่าว/ประเด็นอะไร ซึ่งบางทีรูปก็ไม่ได้เกี่ยวข้องกับประเด็นนั้นๆ,ก็ชอบลงรูปดาราใส่ชุดที่ค่อนข้างเปิดเผยเวลามีข่าว/ประเด็นอะไร ซึ่งบางทีรูปก็ไม่ได้เกี่ยวข้องกับประเด็นนั้นๆ,2025-11-29 08:18:55,"['ก็', 'ชอบ', 'ลง', 'รูป', 'ดารา', 'ใส่', 'ชุด', 'ที่', 'ค่อนข้าง', 'เปิดเผย', 'เวลา', 'มี', 'ข่าว', ' ', 'ประเด็น', 'อะไร', ' ', 'ซึ่ง', 'บางที', 'รูป', 'ก็', 'ไม่', 'ได้', 'เกี่ยวข้อง', 'กับ', 'ประเด็น', 'นั้นๆ']"
1985978411832262934,twitter,post,https://x.com/immelisse/status/1985978411832262934,text,2025-11-05T07:52:05.000Z,selenium_x_scraper_v1,,,2025-11-29 08:18:55,[]
1985913896558019015,twitter,post,https://x.com/Safariiz/status/1985913896558019015,text,2025-11-05T03:35:44.000Z,selenium_x_scraper_v1,เพจหนังก็งี้ บางเพจแอดมินเป็นผู้หญิงก็ยังshนสด.เหมือนกัน ,เพจหนังก็งี้ บางเพจแอดมินเป็นผู้หญิงก็ยังshนสด.เหมือนกัน ,2025-11-29 08:18:55,"['เพจ', 'หนัง', 'ก็', 'งี้', ' ', 'บาง', 'เพจ', 'แอดมิน', 'เป็น', 'ผู้หญิง', 'ก็', 'ยัง', 'sh', 'นสด', '.', 'เหมือนกัน']"
1985922852672159889,twitter,post,https://x.com/thestone2544/status/1985922852672159889,text,2025-11-05T04:11:19.000Z,selenium_x_scraper_v1,ละเพจที่มันเขียนถึงดำศวรปะ  อาย,ละเพจที่มันเขียนถึงดำศวรปะ  อาย,2025-11-29 08:18:55,"['ละ', 'เพจ', 'ที่', 'มัน', 'เขียน', 'ถึง', 'ดำ', 'ศวร', 'ปะ', ' ', 'อาย']"
1986082575656657134,twitter,post,https://x.com/jolietargaryen/status/1986082575656657134,text,2025-11-05T14:46:00.000Z,selenium_x_scraper_v1,Getting real low.,Getting real low.,2025-11-29 08:18:55,"['getting', ' ', 'real', ' ', 'low', '.']"
1985968002320515456,twitter,post,https://x.com/mj_noiraurouge/status/1985968002320515456,text,2025-11-05T07:10:43.000Z,selenium_x_scraper_v1,"รู้สึกแปลกๆตั้งแต่เห็นคำว่า ""คงปิดอู่แล้ว"" คือมาสาระแนอะไรกับมดลูกคนอื่นหรอ","รู้สึกแปลกๆตั้งแต่เห็นคำว่า ""คงปิดอู่แล้ว"" คือมาสาระแนอะไรกับมดลูกคนอื่นหรอ",2025-11-29 08:18:55,"['รู้สึก', 'แปลก', 'ๆ', 'ตั้งแต่', 'เห็น', 'คำ', 'ว่า', ' ', 'คง', 'ปิด', 'อู่', 'แล้ว', ' ', 'คือ', 'มา', 'สาระแน', 'อะไร', 'กับ', 'มดลูก', 'คนอื่น', 'หรอ']"
1986029840684949521,twitter,post,https://x.com/ccpc3D/status/1986029840684949521,text,2025-11-05T11:16:27.000Z,selenium_x_scraper_v1,น้ำตั๋วทัวร์ลง 555,น้ำตั๋วทัวร์ลง 555,2025-11-29 08:18:55,"['น้ำ', 'ตั๋ว', 'ทัวร์', 'ลง', ' ', 'หัวเราะ']"
1986036912239542394,twitter,post,https://x.com/bbbbzz12366/status/1986036912239542394,text,2025-11-05T11:44:33.000Z,selenium_x_scraper_v1,อนาคตตอนลูกสาวพี่แกท้อง หวังว่าพี่แกจะไปเม้นอะไรแบบนี้ในโพสลูกสาวตัวเองนะ,อนาคตตอนลูกสาวพี่แกท้อง หวังว่าพี่แกจะไปเม้นอะไรแบบนี้ในโพสลูกสาวตัวเองนะ,2025-11-29 08:18:55,"['อนาคต', 'ตอน', 'ลูกสาว', 'พี่', 'แก', 'ท้อง', ' ', 'หวัง', 'ว่า', 'พี่', 'แก', 'จะ', 'ไป', 'เม้น', 'อะไร', 'แบบนี้', 'ใน', 'โพส', 'ลูกสาว', 'ตัวเอง', 'นะ']"
1985941744706601084,twitter,post,https://x.com/thursdaycomic/status/1985941744706601084,text,2025-11-05T05:26:23.000Z,selenium_x_scraper_v1,แอดมินเพจนี้เค้าโตมายังไงถึงได้พิมพ์อะไรแบบนี้ได้หน้าตาเฉย,แอดมินเพจนี้เค้าโตมายังไงถึงได้พิมพ์อะไรแบบนี้ได้หน้าตาเฉย,2025-11-29 08:18:55,"['แอดมิน', 'เพจ', 'นี้', 'เค้า', 'โตมา', 'ยังไง', 'ถึง', 'ได้', 'พิมพ์', 'อะไร', 'แบบนี้', 'ได้', 'หน้าตาเฉย']"
1985992941647831455,twitter,post,https://x.com/9RANDiL0QU3NT/status/1985992941647831455,text,2025-11-05T08:49:49.000Z,selenium_x_scraper_v1,เพจหนังเปนไรชอบมีแต่เหี้นไรแบบนี้,เพจหนังเปนไรชอบมีแต่เหี้นไรแบบนี้,2025-11-29 08:18:55,"['เพจ', 'หนัง', 'เปน', 'ไร', 'ชอบ', 'มี', 'แต่', 'เห', 'ี้น', 'ไร', 'แบบนี้']"
1986010760586444864,twitter,post,https://x.com/tmdpd2765/status/1986010760586444864,text,2025-11-05T10:00:38.000Z,selenium_x_scraper_v1,ไม่ซื้ออะไรจากเพจนี้ทั้งนั้น แม้แต่อันที่ชงใบดำ เพราะยังไงมายเซ็ทก็MFอยุ่ดี,ไม่ซื้ออะไรจากเพจนี้ทั้งนั้น แม้แต่อันที่ชงใบดำ เพราะยังไงมายเซ็ทก็MFอยุ่ดี,2025-11-29 08:18:55,"['ไม่', 'ซื้อ', 'อะไร', 'จาก', 'เพจ', 'นี้', 'ทั้งนั้น', ' ', 'แม้แต่', 'อัน', 'ที่', 'ชง', 'ใบดำ', ' ', 'เพราะ', 'ยังไง', 'มาย', 'เซ็ท', 'ก็', 'mf', 'อยุ่', 'ดี']"
1985910596290953648,twitter,post,https://x.com/JulieLunie/status/1985910596290953648,text,2025-11-05T03:22:37.000Z,selenium_x_scraper_v1,นี่ว่าจุดประสงค์เขาไม่ได้อยากวิเคราะห์ว่าดาราญ.เสียปย.ด้านหน้าที่การงานแค่ไหนจากการตั้งครรภ์หรอก แค่อยากเล่นมุกใต้สะดือลวนลามดาราทางข้อเขียนสนองนี้ดตัวเองและเรียกเอนเกจเมนต์แข่งกับเพจหนังอื่น+อัลกอริทึ่มfbเท่านั้นแหละ ได้ทั้งลค.กลุ่มบุฮี้ๆชอบงานเขียนแตกในกับคนเข้าไปส่องแล้วด่า,นี่ว่าจุดประสงค์เขาไม่ได้อยากวิเคราะห์ว่าดาราญ.เสียปย.ด้านหน้าที่การงานแค่ไหนจากการตั้งครรภ์หรอก แค่อยากเล่นมุกใต้สะดือลวนลามดาราทางข้อเขียนสนองนี้ดตัวเองและเรียกเอนเกจเมนต์แข่งกับเพจหนังอื่น+อัลกอริทึ่มfbเท่านั้นแหละ ได้ทั้งลค.กลุ่มบุฮี้ๆชอบงานเขียนแตกในกับคนเข้าไปส่องแล้วด่า,2025-11-29 08:18:55,"['นี่', 'ว่า', 'จุดประสงค์', 'เขา', 'ไม่', 'ได้', 'อยาก', 'วิเคราะห์', 'ว่า', 'ดา', 'ราญ', '.', 'เสีย', 'ปย', '.', 'ด้าน', 'หน้าที่', 'การงาน', 'แค่', 'ไหน', 'จาก', 'การ', 'ตั้งครรภ์', 'หรอก', ' ', 'แค่', 'อยาก', 'เล่น', 'มุก', 'ใต้สะดือ', 'ลวนลาม', 'ดารา', 'ทาง', 'ข้อเขียน', 'สนอง', 'นี้', 'ด', 'ตัวเอง', 'และ', 'เรียก', 'เอน', 'เกจ', 'เมนต์', 'แข่ง', 'กับ', 'เพจ', 'หนัง', 'อื่น', ' ', 'อัลก', 'อริ', 'ทึ่ม', 'fb', 'เท่า', 'นั้นแหละ', ' ', 'ได้', 'ทั้ง', 'ลค', '.', 'กลุ่ม', 'บุ', 'ฮี้', 'ๆ', 'ชอบ', 'งานเขียน', 'แตก', 'ใน', 'กับ', 'คน', 'เข้าไป', 'ส่อง', 'แล้ว', 'ด่า']"
1986082190023938133,twitter,post,https://x.com/nm__area223/status/1986082190023938133,text,2025-11-05T14:44:28.000Z,selenium_x_scraper_v1,ตอนแรกเอาทวิตนี้ไปแขวน กะให้ลูกเพจรุมด่าแหละ แต่รอบนี้คดีพลิก แม้แต่ลูกเพจยังรับไม่ได้ ยอดฟอลลด เลยต้องลบโพสทิ้งแล้วขอโทษรอบสอง,ตอนแรกเอาทวิตนี้ไปแขวน กะให้ลูกเพจรุมด่าแหละ แต่รอบนี้คดีพลิก แม้แต่ลูกเพจยังรับไม่ได้ ยอดฟอลลด เลยต้องลบโพสทิ้งแล้วขอโทษรอบสอง,2025-11-29 08:18:55,"['ตอนแรก', 'เอา', 'ทวิ', 'ต', 'นี้', 'ไป', 'แขวน', ' ', 'กะ', 'ให้', 'ลูก', 'เพจ', 'รุม', 'ด่า', 'แหละ', ' ', 'แต่', 'รอบ', 'นี้', 'คดี', 'พลิก', ' ', 'แม้แต่', 'ลูก', 'เพจ', 'ยัง', 'รับ', 'ไม่', 'ได้', ' ', 'ยอด', 'ฟอ', 'ลลด', ' ', 'เลย', 'ต้อง', 'ลบ', 'โพส', 'ทิ้ง', 'แล้ว', 'ขอโทษ', 'รอบ', 'สอง']"
1985980283808858131,twitter,post,https://x.com/airz_2206/status/1985980283808858131,text,2025-11-05T07:59:32.000Z,selenium_x_scraper_v1,อ๋อออ เพจนี้ หึหึ!!!!,อ๋อออ เพจนี้ หึหึ!!!!,2025-11-29 08:18:55,"['อ๋อ', 'ออ', ' ', 'เพจ', 'นี้', ' ', 'หึหึ', '!']"
1985921660437086678,twitter,post,https://x.com/knabknab888/status/1985921660437086678,text,2025-11-05T04:06:35.000Z,selenium_x_scraper_v1,รอบก่อนก็ดราม่าซื้อตั๋วหนังไปดูโรงเด็ก แล้วตัวเองมาบ่นเด็กเล่นเสียงดัง บ่นผู้ปกครองเด็กไม่อบรมลูก,รอบก่อนก็ดราม่าซื้อตั๋วหนังไปดูโรงเด็ก แล้วตัวเองมาบ่นเด็กเล่นเสียงดัง บ่นผู้ปกครองเด็กไม่อบรมลูก,2025-11-29 08:18:55,"['รอบ', 'ก่อน', 'ก็', 'ดราม่า', 'ซื้อ', 'ตั๋วหนัง', 'ไปดู', 'โรง', 'เด็ก', ' ', 'แล้ว', 'ตัวเอง', 'มา', 'บ่น', 'เด็ก', 'เล่น', 'เสียงดัง', ' ', 'บ่น', 'ผู้ปกครอง', 'เด็ก', 'ไม่', 'อบรม', 'ลูก']"
1985740939890155797,twitter,post,https://x.com/bibillyhills7/status/1985740939890155797,text,2025-11-04T16:08:28.000Z,selenium_x_scraper_v1,ช็อค เพจหนังสามารถพิมแบบนี่ได้ด้วยเหรอ,ช็อค เพจหนังสามารถพิมแบบนี่ได้ด้วยเหรอ,2025-11-29 08:18:55,"['ช็อค', ' ', 'เพจ', 'หนัง', 'สามารถ', 'พิม', 'แบบ', 'นี่', 'ได้', 'ด้วย', 'เหรอ']"
1985945330517754101,twitter,post,https://x.com/_217612/status/1985945330517754101,text,2025-11-05T05:40:38.000Z,selenium_x_scraper_v1,ละใช้คำว่าปิดอู่อ่ะ,ละใช้คำว่าปิดอู่อ่ะ,2025-11-29 08:18:55,"['ละ', 'ใช้', 'คำ', 'ว่า', 'ปิด', 'อู่', 'อ่ะ']"
1985905154819047770,twitter,post,https://x.com/letsstayinourpj/status/1985905154819047770,text,2025-11-05T03:00:59.000Z,selenium_x_scraper_v1,อีบ้า,อีบ้า,2025-11-29 08:18:55,"['อี', 'บ้า']"
1985991990539145698,twitter,post,https://x.com/_Jovian7/status/1985991990539145698,text,2025-11-05T08:46:03.000Z,selenium_x_scraper_v1,ก็เพจหนังอะ,ก็เพจหนังอะ,2025-11-29 08:18:55,"['ก็', 'เพจ', 'หนัง', 'อะ']"
