id,platform,platform_type,url,content_type,timestamp,scraper_module,text,raw_text,scrape_date,tokens
1989340422683189271,twitter,post,https://x.com/sunday77529983/status/1989340422683189271,text,2025-11-14T14:31:31.000Z,selenium_x_scraper_v1,เคสนี้ หน่วยงานรัฐของลาวต้องเข้าไปดูแล้ว สงสารลูกที่เกิดมามาก กลัวว่าลูกๆก็จะโดนขายไปเหมือนกัน กลับเข้าสู่วงจรแบบเดิม,เคสนี้ หน่วยงานรัฐของลาวต้องเข้าไปดูแล้ว สงสารลูกที่เกิดมามาก กลัวว่าลูกๆก็จะโดนขายไปเหมือนกัน กลับเข้าสู่วงจรแบบเดิม,2025-11-29 08:18:55,"['เคส', 'นี้', ' ', 'หน่วยงานรัฐ', 'ของ', 'ลาว', 'ต้อง', 'เข้า', 'ไปดู', 'แล้ว', ' ', 'สงสาร', 'ลูก', 'ที่เกิด', 'มา', 'มาก', ' ', 'กลัว', 'ว่า', 'ลูก', 'ๆ', 'ก็', 'จะ', 'โดน', 'ขาย', 'ไป', 'เหมือนกัน', ' ', 'กลับ', 'เข้าสู่', 'วงจร', 'แบบ', 'เดิม']"
1989389716161233231,twitter,post,https://x.com/Aa2003zx6/status/1989389716161233231,text,2025-11-14T17:47:24.000Z,selenium_x_scraper_v1,แรกๆก็สงสารเเต่เจ้าของช่องเขาสร้างบ้านซื้อของให้จนขีวิตเขาดีขึ้นมากๆครับลองติดตามดู,แรกๆก็สงสารเเต่เจ้าของช่องเขาสร้างบ้านซื้อของให้จนขีวิตเขาดีขึ้นมากๆครับลองติดตามดู,2025-11-29 08:18:55,"['แรก', 'ๆ', 'ก็', 'สงสาร', 'เเต่', 'เจ้าของ', 'ช่องเขา', 'สร้างบ้าน', 'ซื้อ', 'ของ', 'ให้', 'จน', 'ขี', 'วิ', 'ต', 'เขา', 'ดีขึ้น', 'มาก', 'ๆ', 'ครับ', 'ลอง', 'ติดตาม', 'ดู']"
1989483413552992368,twitter,post,https://x.com/CompxxxEnt123/status/1989483413552992368,text,2025-11-14T23:59:43.000Z,selenium_x_scraper_v1,เราอย่าไปคิดแทนเค้า เค้าอาจจะสงบสุข แล้วเป็นชีวิตเค้าแล้วก็ได้ อย่างน้อยก็มีครอบครัว,เราอย่าไปคิดแทนเค้า เค้าอาจจะสงบสุข แล้วเป็นชีวิตเค้าแล้วก็ได้ อย่างน้อยก็มีครอบครัว,2025-11-29 08:18:55,"['เรา', 'อย่า', 'ไป', 'คิด', 'แทน', 'เค้า', ' ', 'เค้า', 'อาจจะ', 'สงบสุข', ' ', 'แล้ว', 'เป็น', 'ชีวิต', 'เค้า', 'แล้ว', 'ก็ได้', ' ', 'อย่าง', 'น้อย', 'ก็', 'มีครอบครัว']"
1989887424055710066,twitter,post,https://x.com/ilisayou/status/1989887424055710066,text,2025-11-16T02:45:06.000Z,selenium_x_scraper_v1,สงสารเขามาก นี่ดูคลิปได้ไม่ถึง5นาทีกดออก ทนดูไม่ได้,สงสารเขามาก นี่ดูคลิปได้ไม่ถึง5นาทีกดออก ทนดูไม่ได้,2025-11-29 08:18:55,"['สงสาร', 'เขา', 'มาก', ' ', 'นี่', 'ดู', 'คลิป', 'ได้', 'ไม่', 'ถึง', '5', 'นาที', 'กด', 'ออก', ' ', 'ทน', 'ดูไม่ได้']"
1989336934884487526,twitter,post,https://x.com/Piyapat9999/status/1989336934884487526,text,2025-11-14T14:17:40.000Z,selenium_x_scraper_v1,โคตรหดหู่มาก ชีวิตคนๆหนึ่งต้องมาเจออะไรแบบนี้ กุขอไม่เกิดดีกว่า,โคตรหดหู่มาก ชีวิตคนๆหนึ่งต้องมาเจออะไรแบบนี้ กุขอไม่เกิดดีกว่า,2025-11-29 08:18:55,"['โคตร', 'หดหู่', 'มาก', ' ', 'ชีวิต', 'คน', 'ๆ', 'หนึ่ง', 'ต้อง', 'มา', 'เจอ', 'อะไร', 'แบบนี้', ' ', 'กุ', 'ขอ', 'ไม่', 'เกิด', 'ดีกว่า']"
1989703066602672145,twitter,post,https://x.com/Teangmo_mo/status/1989703066602672145,text,2025-11-15T14:32:32.000Z,selenium_x_scraper_v1,เราอาจมองว่าไม่สมควร ไม่เหมาะสม ไม่พอใจในสิ่งที่เขาทำ แต่เข้าใจสังคมของแต่ละพื้นที่ และพฤติกรรม ความรู้ของพวกเขาด้วย (ได้แต่สงสาร),เราอาจมองว่าไม่สมควร ไม่เหมาะสม ไม่พอใจในสิ่งที่เขาทำ แต่เข้าใจสังคมของแต่ละพื้นที่ และพฤติกรรม ความรู้ของพวกเขาด้วย (ได้แต่สงสาร),2025-11-29 08:18:55,"['เรา', 'อาจ', 'มองว่า', 'ไม่', 'สมควร', ' ', 'ไม่', 'เหมาะสม', ' ', 'ไม่', 'พอใจ', 'ใน', 'สิ่ง', 'ที่', 'เขา', 'ทำ', ' ', 'แต่', 'เข้าใจ', 'สังคม', 'ของ', 'แต่ละ', 'พื้นที่', ' ', 'และ', 'พฤติกรรม', ' ', 'ความรู้', 'ของ', 'พวกเขา', 'ด้วย', ' ', 'ได้', 'แต่', 'สงสาร']"
1989621730151972921,twitter,post,https://x.com/vE4l3FhTyCHmSQW/status/1989621730151972921,text,2025-11-15T09:09:20.000Z,selenium_x_scraper_v1,ใช่เหรอ 8-9 ขวบยังไม่มีประจำเดือนเลยนะ,ใช่เหรอ 8-9 ขวบยังไม่มีประจำเดือนเลยนะ,2025-11-29 08:18:55,"['ใช่', 'เหรอ', ' ', '8', ' ', '9', ' ', 'ขวบ', 'ยัง', 'ไม่', 'มี', 'ประจำเดือน', 'เลย', 'นะ']"
1989339507880243354,twitter,post,https://x.com/MR_S_PS/status/1989339507880243354,text,2025-11-14T14:27:53.000Z,selenium_x_scraper_v1,หดหู่มาก แต่ทำไงได้ คนละประเทศกัน และยากไปกว่านั้นก็คือกฎหมายบ้านเมืองเขามันก็ไม่ได้ครอบคลุมหรือเข้าถึงประชาชนทุกคนขนาดนั้นน่ะ ประเทศลาวยังไม่พัฒนา,หดหู่มาก แต่ทำไงได้ คนละประเทศกัน และยากไปกว่านั้นก็คือกฎหมายบ้านเมืองเขามันก็ไม่ได้ครอบคลุมหรือเข้าถึงประชาชนทุกคนขนาดนั้นน่ะ ประเทศลาวยังไม่พัฒนา,2025-11-29 08:18:55,"['หดหู่', 'มาก', ' ', 'แต่', 'ทำ', 'ไง', 'ได้', ' ', 'คนละ', 'ประเทศ', 'กัน', ' ', 'และ', 'ยาก', 'ไป', 'กว่า', 'นั้น', 'ก็', 'คือ', 'กฎหมาย', 'บ้านเมือง', 'เขา', 'มัน', 'ก็', 'ไม่', 'ได้', 'ครอบคลุม', 'หรือ', 'เข้าถึง', 'ประชาชน', 'ทุกคน', 'ขนาด', 'นั้น', 'น่ะ', ' ', 'ประเทศ', 'ลาว', 'ยัง', 'ไม่', 'พัฒนา']"
1989346395359445199,twitter,post,https://x.com/iruktomato/status/1989346395359445199,text,2025-11-14T14:55:15.000Z,selenium_x_scraper_v1,ไอเหี้ยยยยยยย,ไอเหี้ยยยยยยย,2025-11-29 08:18:55,"['ไอ', 'เหี้ย', 'ยยยยยย']"
1989573806080626954,twitter,post,https://x.com/lopergrand/status/1989573806080626954,text,2025-11-15T05:58:54.000Z,selenium_x_scraper_v1,ละ ท้องไเ้ละหรอ 8 ขวบ!!!!!!?,ละ ท้องไเ้ละหรอ 8 ขวบ!!!!!!?,2025-11-29 08:18:55,"['ละ', ' ', 'ท้อง', 'ไเ้', 'ละ', 'หรอ', ' ', '8', ' ', 'ขวบ', '?']"
1989277584476217670,twitter,post,https://x.com/lolitascak3/status/1989277584476217670,text,2025-11-14T10:21:49.000Z,selenium_x_scraper_v1,"โฉมหน้าอีเปโด ชื่อเกิ่ง วันๆ ขี้โม้ ขี้เกียจทำงาน เมียไม่ทำกับข้าวให้กินมันก็ไม่รู้จักหาเอง เมียต้องซักกางเกงเลอะขี้ให้ ครบสูตรความอุบาท

ผญชื่อหลอยนะ คนดูเรียกนางหลอย","โฉมหน้าอีเปโด ชื่อเกิ่ง วันๆ ขี้โม้ ขี้เกียจทำงาน เมียไม่ทำกับข้าวให้กินมันก็ไม่รู้จักหาเอง เมียต้องซักกางเกงเลอะขี้ให้ ครบสูตรความอุบาท

ผญชื่อหลอยนะ คนดูเรียกนางหลอย",2025-11-29 08:18:55,"['โฉมหน้า', 'อี', 'เป', 'โด', ' ', 'ชื่อ', 'เกิ่ง', ' ', 'วัน', 'ๆ', ' ', 'ขี้โม้', ' ', 'ขี้เกียจ', 'ทำงาน', ' ', 'เมีย', 'ไม่', 'ทำกับข้าว', 'ให้', 'กิน', 'มัน', 'ก็', 'ไม่', 'รู้จัก', 'หา', 'เอง', ' ', 'เมีย', 'ต้อง', 'ซัก', 'กางเกง', 'เลอะ', 'ขี้', 'ให้', ' ', 'ครบ', 'สูตร', 'ความ', 'อุบาท', ' ', 'ผญ', 'ชื่อ', 'หลอ', 'ย', 'นะ', ' ', 'คนดู', 'เรียก', 'นาง', 'หลอ', 'ย']"
1989307979825332694,twitter,post,https://x.com/lolitascak3/status/1989307979825332694,text,2025-11-14T12:22:36.000Z,selenium_x_scraper_v1,ต้นทาง,ต้นทาง,2025-11-29 08:18:55,['ต้นทาง']
1989280361592066506,twitter,post,https://x.com/AnuganP/status/1989280361592066506,text,2025-11-14T10:32:51.000Z,selenium_x_scraper_v1,ในฐานะที่มีลูกสาว เรื่องราวแบบนี้โคตรหดหู่ใจเลย วัยเยาว์ที่มีค่าถูกพรากไปในเวลาแสนสั้น ยังไม่ทันได้ค้นพบตัวตนและเดินตามหาความฝันของตัวเองเลย เหมือนถูกขโมยชีวิต,ในฐานะที่มีลูกสาว เรื่องราวแบบนี้โคตรหดหู่ใจเลย วัยเยาว์ที่มีค่าถูกพรากไปในเวลาแสนสั้น ยังไม่ทันได้ค้นพบตัวตนและเดินตามหาความฝันของตัวเองเลย เหมือนถูกขโมยชีวิต,2025-11-29 08:18:55,"['ใน', 'ฐานะ', 'ที่', 'มี', 'ลูกสาว', ' ', 'เรื่องราว', 'แบบนี้', 'โคตร', 'หดหู่ใจ', 'เลย', ' ', 'วัยเยาว์', 'ที่', 'มีค่า', 'ถูก', 'พราก', 'ไป', 'ใน', 'เวลา', 'แสน', 'สั้น', ' ', 'ยัง', 'ไม่', 'ทัน', 'ได้', 'ค้นพบ', 'ตัวตน', 'และ', 'เดิน', 'ตามหา', 'ความฝัน', 'ของ', 'ตัวเอง', 'เลย', ' ', 'เหมือน', 'ถูก', 'ขโมย', 'ชีวิต']"
1989278133670072471,twitter,post,https://x.com/Lady____BP/status/1989278133670072471,text,2025-11-14T10:24:00.000Z,selenium_x_scraper_v1,"อึ้งแรก ผัว 50 / เมีย 12
อึ้งสอง มีลูกแล้ว
อึ้งสาม ลูก 2 คน

คำถามคือคนแรกนี่ลูกของน้องหรือลูกใคร?
8-9 ขวบยังไม่น่าจะมีปจด.ไหมนะ เพิ่งจะป.3-ป.4 เอง

สมัยก่อนเพื่อนในชั้นเรียนที่มี ปจด.เร็วสุดคือ ป.5 ซึ่งมี 2-3 คน แล้วทั้งหมดเป็นคนตัวสูง แบบหุ่นโตกว่าเพื่อน","อึ้งแรก ผัว 50 / เมีย 12
อึ้งสอง มีลูกแล้ว
อึ้งสาม ลูก 2 คน

คำถามคือคนแรกนี่ลูกของน้องหรือลูกใคร?
8-9 ขวบยังไม่น่าจะมีปจด.ไหมนะ เพิ่งจะป.3-ป.4 เอง

สมัยก่อนเพื่อนในชั้นเรียนที่มี ปจด.เร็วสุดคือ ป.5 ซึ่งมี 2-3 คน แล้วทั้งหมดเป็นคนตัวสูง แบบหุ่นโตกว่าเพื่อน",2025-11-29 08:18:55,"['อึ้ง', 'แรก', ' ', 'ผัว', ' ', '50', ' ', 'เมีย', ' ', '12', ' ', 'อึ้ง', 'สอง', ' ', 'มีลูก', 'แล้ว', ' ', 'อึ้ง', 'สาม', ' ', 'ลูก', ' ', '2', ' ', 'คน', ' ', 'คำถาม', 'คือ', 'คน', 'แรก', 'นี่', 'ลูก', 'ของ', 'น้อง', 'หรือ', 'ลูก', 'ใคร', '?', ' ', '8', ' ', '9', ' ', 'ขวบ', 'ยัง', 'ไม่', 'น่าจะ', 'มี', 'ปจด', '.', 'ไหม', 'นะ', ' ', 'เพิ่งจะ', 'ป.', '3', ' ', 'ป.', '4', ' ', 'เอง', ' ', 'สมัย', 'ก่อนเพื่อน', 'ใน', 'ชั้นเรียน', 'ที่', 'มี', ' ', 'ปจด', '.', 'เร็ว', 'สุด', 'คือ', ' ', 'ป.', '5', ' ', 'ซึ่ง', 'มี', ' ', '2', ' ', '3', ' ', 'คน', ' ', 'แล้ว', 'ทั้งหมด', 'เป็น', 'คน', 'ตัว', 'สูง', ' ', 'แบบ', 'หุ่น', 'โต', 'กว่าเพื่อน']"
1989312010148827279,twitter,post,https://x.com/MN09006958/status/1989312010148827279,text,2025-11-14T12:38:37.000Z,selenium_x_scraper_v1,เคยเข้าไปดู น้องผญ.พ่อแม่เสีย แล้วอารมณ์เหมือนไม่มีที่อยู่ ผัวก็ให้ที่อยู่พร้อมทำเมีย สงสารน้องนะคะ แล้วบางคลิปน้องไม่ไหวป่วยแต่ผัวก็จะมีพสพ.กับน้องให้ได้เลยค่ะ อันนี้ในคลิปเหมือนมีการพูดอยู่ เจ้าของคลิปก็บอกกับทางผัวว่าน้องป่วยอยู่ สงสารน้องมากค่ะ สภาพความเป็นอยู่ใดๆเกินคำบรรยาย,เคยเข้าไปดู น้องผญ.พ่อแม่เสีย แล้วอารมณ์เหมือนไม่มีที่อยู่ ผัวก็ให้ที่อยู่พร้อมทำเมีย สงสารน้องนะคะ แล้วบางคลิปน้องไม่ไหวป่วยแต่ผัวก็จะมีพสพ.กับน้องให้ได้เลยค่ะ อันนี้ในคลิปเหมือนมีการพูดอยู่ เจ้าของคลิปก็บอกกับทางผัวว่าน้องป่วยอยู่ สงสารน้องมากค่ะ สภาพความเป็นอยู่ใดๆเกินคำบรรยาย,2025-11-29 08:18:55,"['เคย', 'เข้า', 'ไปดู', ' ', 'น้อง', 'ผญ.', 'พ่อแม่', 'เสีย', ' ', 'แล้ว', 'อารมณ์', 'เหมือน', 'ไม่', 'มี', 'ที่อยู่', ' ', 'ผัว', 'ก็', 'ให้', 'ที่อยู่', 'พร้อม', 'ทำ', 'เมีย', ' ', 'สงสาร', 'น้อง', 'นะคะ', ' ', 'แล้ว', 'บาง', 'คลิป', 'น้อง', 'ไม่', 'ไหว', 'ป่วย', 'แต่', 'ผัว', 'ก็', 'จะ', 'มี', 'พสพ', '.', 'กับ', 'น้อง', 'ให้ได้', 'เลย', 'ค่ะ', ' ', 'อันนี้', 'ใน', 'คลิป', 'เหมือน', 'มี', 'การ', 'พูด', 'อยู่', ' ', 'เจ้าของ', 'คลิป', 'ก็', 'บอก', 'กับ', 'ทาง', 'ผัว', 'ว่า', 'น้อง', 'ป่วย', 'อยู่', ' ', 'สงสาร', 'น้อง', 'มาก', 'ค่ะ', ' ', 'สภาพ', 'ความเป็นอยู่', 'ใดๆ', 'เกิน', 'คำบรรยาย']"
1989283967997206935,twitter,post,https://x.com/Caitoon911/status/1989283967997206935,text,2025-11-14T10:47:11.000Z,selenium_x_scraper_v1,"แล้วน้องหน้าแก่อย่างไวอ่ะ
อายุผิวพรรณเกินอายุจริง
เพราะเป็นแม่เร็วเกินป่ะ","แล้วน้องหน้าแก่อย่างไวอ่ะ
อายุผิวพรรณเกินอายุจริง
เพราะเป็นแม่เร็วเกินป่ะ",2025-11-29 08:18:55,"['แล้ว', 'น้อง', 'หน้าแก่', 'อย่าง', 'ไว', 'อ่ะ', ' ', 'อายุ', 'ผิวพรรณ', 'เกิน', 'อายุ', 'จริง', ' ', 'เพราะ', 'เป็น', 'แม่', 'เร็ว', 'เกิน', 'ป่ะ']"
1989272327675355458,twitter,post,https://x.com/Pong_Constantin/status/1989272327675355458,text,2025-11-14T10:00:56.000Z,selenium_x_scraper_v1,สปปล. ห่างไกล ตร.มากผมเจอหลายคลิปเลย บางบ้านผช. มาขข.แล้วหนีไปก็มีไม่ไปแจ้งความไม่ไปอะไรทั้งนั้นโคตรน่าสงสาร,สปปล. ห่างไกล ตร.มากผมเจอหลายคลิปเลย บางบ้านผช. มาขข.แล้วหนีไปก็มีไม่ไปแจ้งความไม่ไปอะไรทั้งนั้นโคตรน่าสงสาร,2025-11-29 08:18:55,"['สป', 'ปล.', ' ', 'ห่างไกล', ' ', 'ตร.', 'มาก', 'ผม', 'เจอ', 'หลาย', 'คลิป', 'เลย', ' ', 'บาง', 'บ้าน', 'ผช.', ' ', 'มา', 'ขข', '.', 'แล้ว', 'หนี', 'ไป', 'ก็', 'มี', 'ไม่', 'ไป', 'แจ้งความ', 'ไม่', 'ไป', 'อะไร', 'ทั้งนั้น', 'โคตร', 'น่าสงสาร']"
1989275244876698011,twitter,post,https://x.com/plaeplaza/status/1989275244876698011,text,2025-11-14T10:12:31.000Z,selenium_x_scraper_v1,อุมาก กฎหมายประเทศเค้ามันก็น่าจะมีคุ้มครองผู้เยาว์นะ ไม่มีใครแจ้งตำรวจเลยเหรอ,อุมาก กฎหมายประเทศเค้ามันก็น่าจะมีคุ้มครองผู้เยาว์นะ ไม่มีใครแจ้งตำรวจเลยเหรอ,2025-11-29 08:18:55,"['อุ', 'มาก', ' ', 'กฎหมาย', 'ประเทศ', 'เค้า', 'มัน', 'ก็', 'น่าจะ', 'มี', 'คุ้มครอง', 'ผู้เยาว์', 'นะ', ' ', 'ไม่', 'มี', 'ใคร', 'แจ้งตำรวจ', 'เลย', 'เหรอ']"
1989689239496188332,twitter,post,https://x.com/fernjoop/status/1989689239496188332,text,2025-11-15T13:37:35.000Z,selenium_x_scraper_v1,กูว่าเอากันก่อนมี เมน อีกนะ ใครบ้าที่ไหนเอาเด็ก,กูว่าเอากันก่อนมี เมน อีกนะ ใครบ้าที่ไหนเอาเด็ก,2025-11-29 08:18:55,"['กู', 'ว่า', 'เอา', 'กัน', 'ก่อน', 'มี', ' ', 'เมน', ' ', 'อีก', 'นะ', ' ', 'ใคร', 'บ้า', 'ที่ไหน', 'เอา', 'เด็ก']"
1989311673241423907,twitter,post,https://x.com/orchidmello/status/1989311673241423907,text,2025-11-14T12:37:17.000Z,selenium_x_scraper_v1,ในที่สุดก็มีคนเจอเรื่องนี้ซักที เห็นขึ้นแนะนำมาบ่อยในยูทูปเลี้ยหู้สุดๆ,ในที่สุดก็มีคนเจอเรื่องนี้ซักที เห็นขึ้นแนะนำมาบ่อยในยูทูปเลี้ยหู้สุดๆ,2025-11-29 08:18:55,"['ในที่สุด', 'ก็', 'มี', 'คน', 'เจอ', 'เรื่อง', 'นี้', 'ซัก', 'ที', ' ', 'เห็น', 'ขึ้น', 'แนะ', 'นำมา', 'บ่อย', 'ใน', 'ยู', 'ทู', 'ปเลี้ยหู้', 'สุด', 'ๆ']"
1989315778160795960,twitter,post,https://x.com/MI32956387/status/1989315778160795960,text,2025-11-14T12:53:35.000Z,selenium_x_scraper_v1,มันจเอาลูกทำเมียอีกไหม แม่เด็กไม่รู้อะไรหนนอกแบบนี้,มันจเอาลูกทำเมียอีกไหม แม่เด็กไม่รู้อะไรหนนอกแบบนี้,2025-11-29 08:18:55,"['มัน', 'จ', 'เอา', 'ลูก', 'ทำ', 'เมีย', 'อีก', 'ไหม', ' ', 'แม่', 'เด็ก', 'ไม่', 'รู้', 'อะไร', 'หน', 'นอก', 'แบบนี้']"
1989290296837111834,twitter,post,https://x.com/llit_srisu18058/status/1989290296837111834,text,2025-11-14T11:12:20.000Z,selenium_x_scraper_v1,มีพสพตอนอายุ8ขวบนี่ใส่เข้าไปได้ด้วยหรอมันจะเจ็บแค่ใหนอ่ะ ขนาดนี่มีตอนอายุ19ยังเจ็บชิบหายเจ็บจนต้องร้องขอชีวิต,มีพสพตอนอายุ8ขวบนี่ใส่เข้าไปได้ด้วยหรอมันจะเจ็บแค่ใหนอ่ะ ขนาดนี่มีตอนอายุ19ยังเจ็บชิบหายเจ็บจนต้องร้องขอชีวิต,2025-11-29 08:18:55,"['มี', 'พสพ', 'ตอน', 'อายุ', '8', 'ขวบ', 'นี่', 'ใส่', 'เข้าไป', 'ได้', 'ด้วย', 'หรอ', 'มัน', 'จะ', 'เจ็บ', 'แค่', 'ใหน', 'อ่ะ', ' ', 'ขนาด', 'นี่', 'มี', 'ตอน', 'อายุ', '19', 'ยัง', 'เจ็บ', 'ชิบหาย', 'เจ็บ', 'จน', 'ต้อง', 'ร้องขอ', 'ชีวิต']"
