id,platform,platform_type,url,content_type,timestamp,scraper_module,text,raw_text,scrape_date,tokens
1986961025468670388,twitter,post,https://x.com/imipprw/status/1986961025468670388,text,2025-11-08T00:56:39.000Z,selenium_x_scraper_v1,เราเสียตัวตนไปหมดสิ้นจากความรักรอบล่าสุด ประกอบกลับมาลำบากมากๆ ทั้งๆที่ก่อนหน้าจะมีเขาเราใช้ชีวิตคนเดียวได้ดีสุดๆ ขายวิญญาณให้ซาตานรึไงนะ,เราเสียตัวตนไปหมดสิ้นจากความรักรอบล่าสุด ประกอบกลับมาลำบากมากๆ ทั้งๆที่ก่อนหน้าจะมีเขาเราใช้ชีวิตคนเดียวได้ดีสุดๆ ขายวิญญาณให้ซาตานรึไงนะ,2025-11-29 08:18:55,"['เรา', 'เสีย', 'ตัวตน', 'ไป', 'หมดสิ้น', 'จาก', 'ความรัก', 'รอบ', 'ล่าสุด', ' ', 'ประกอบ', 'กลับมา', 'ลำบาก', 'มาก', 'ๆ', ' ', 'ทั้งๆ', 'ที่', 'ก่อนหน้า', 'จะ', 'มี', 'เขา', 'เรา', 'ใช้ชีวิต', 'คนเดียว', 'ได้ดี', 'สุด', 'ๆ', ' ', 'ขาย', 'วิญญาณ', 'ให้', 'ซาตาน', 'รึ', 'ไง', 'นะ']"
1986780623907037449,twitter,post,https://x.com/yellowhowrblue/status/1986780623907037449,text,2025-11-07T12:59:47.000Z,selenium_x_scraper_v1,คสพ.ที่น่ากลัวที่สุด ไม่ได้คสพ.ที่ดูออกว่ามีแต่toxicนะ แต่มันเป็นคสพ.ที่ดีผสมกับtoxicปนกัน มันทำให้เราออกมาไม่ได้สักที แบบพอจะออกๆก็นึกถึงมุมดีๆ ชักกะเย่อกับตัวเองไปวันๆ,คสพ.ที่น่ากลัวที่สุด ไม่ได้คสพ.ที่ดูออกว่ามีแต่toxicนะ แต่มันเป็นคสพ.ที่ดีผสมกับtoxicปนกัน มันทำให้เราออกมาไม่ได้สักที แบบพอจะออกๆก็นึกถึงมุมดีๆ ชักกะเย่อกับตัวเองไปวันๆ,2025-11-29 08:18:55,"['คสพ', '.', 'ที่', 'น่ากลัว', 'ที่สุด', ' ', 'ไม่', 'ได้', 'คสพ', '.', 'ที่', 'ดูออก', 'ว่า', 'มี', 'แต่', 'toxic', 'นะ', ' ', 'แต่', 'มัน', 'เป็น', 'คสพ', '.', 'ที่', 'ดี', 'ผสม', 'กับ', 'toxic', 'ปน', 'กัน', ' ', 'มัน', 'ทำให้', 'เรา', 'ออกมา', 'ไม่', 'ได้', 'สักที', ' ', 'แบบ', 'พอ', 'จะ', 'ออก', 'ๆ', 'ก็', 'นึกถึง', 'มุ', 'มดี', 'ๆ', ' ', 'ชักกะเย่อ', 'กับ', 'ตัวเอง', 'ไป', 'วัน', 'ๆ']"
1986430256019087755,twitter,post,https://x.com/A1S2D3F4G5149GK/status/1986430256019087755,text,2025-11-06T13:47:33.000Z,selenium_x_scraper_v1,โดนแฟนทำลายความมั่นใจ gaslighting/manipulating เปล่าคะ,โดนแฟนทำลายความมั่นใจ gaslighting/manipulating เปล่าคะ,2025-11-29 08:18:55,"['โดน', 'แฟน', 'ทำลาย', 'ความมั่นใจ', ' ', 'gaslighting', ' ', 'manipulating', ' ', 'เปล่า', 'คะ']"
1986877397338329443,twitter,post,https://x.com/chadasand/status/1986877397338329443,text,2025-11-07T19:24:20.000Z,selenium_x_scraper_v1,นี่กุปรับตัวเอง หรือเป็นตัวเองมากขึ้นก็ไม่รู้อีสัส สันดานที่แบบใช้กับแฟนได้คนเดียวจริงจริง,นี่กุปรับตัวเอง หรือเป็นตัวเองมากขึ้นก็ไม่รู้อีสัส สันดานที่แบบใช้กับแฟนได้คนเดียวจริงจริง,2025-11-29 08:18:55,"['นี่', 'กุ', 'ปรับ', 'ตัวเอง', ' ', 'หรือ', 'เป็น', 'ตัวเอง', 'มากขึ้น', 'ก็', 'ไม่', 'รู้', 'อี', 'สัส', ' ', 'สันดาน', 'ที่', 'แบบ', 'ใช้กับ', 'แฟน', 'ได้', 'คนเดียว', 'จริง', 'จริง']"
1986681855295562165,twitter,post,https://x.com/mercys0ng/status/1986681855295562165,text,2025-11-07T06:27:19.000Z,selenium_x_scraper_v1,เพื่อนชั้นก็พูดแบบนี้ว่าชั้นมีแฟนละโง่ แต่ชั้นได้ความรักที่ดีจากแฟนเยอะแยะถึงจะมีไร้สมองไปบ้างแต่อีคนเตือนนี่หนักเลยคนคุยเก่าไปมีเมียใหม่สองคนละก็ยังวนกลับไปเย้กกัน ส่องไอจีดขาจนจะเปนประสาท ตามแก้ปัญหาให้เขา พอถึงคราวตัวเองบ้าง โง่กว่าเพื่อนอีก,เพื่อนชั้นก็พูดแบบนี้ว่าชั้นมีแฟนละโง่ แต่ชั้นได้ความรักที่ดีจากแฟนเยอะแยะถึงจะมีไร้สมองไปบ้างแต่อีคนเตือนนี่หนักเลยคนคุยเก่าไปมีเมียใหม่สองคนละก็ยังวนกลับไปเย้กกัน ส่องไอจีดขาจนจะเปนประสาท ตามแก้ปัญหาให้เขา พอถึงคราวตัวเองบ้าง โง่กว่าเพื่อนอีก,2025-11-29 08:18:55,"['เพื่อน', 'ชั้น', 'ก็', 'พูด', 'แบบนี้', 'ว่า', 'ชั้น', 'มี', 'แฟน', 'ละ', 'โง่', ' ', 'แต่', 'ชั้น', 'ได้', 'ความรัก', 'ที่', 'ดี', 'จาก', 'แฟน', 'เยอะแยะ', 'ถึง', 'จะ', 'มี', 'ไร้', 'สมอง', 'ไป', 'บ้าง', 'แต่', 'อี', 'คน', 'เตือน', 'นี่', 'หนัก', 'เลย', 'คน', 'คุย', 'เก่า', 'ไป', 'มี', 'เมีย', 'ใหม่', 'สอง', 'คนละ', 'ก็', 'ยัง', 'วน', 'กลับ', 'ไป', 'เย้', 'ก', 'กัน', ' ', 'ส่อง', 'ไอ', 'จี', 'ด', 'ขา', 'จน', 'จะ', 'เปน', 'ประสาท', ' ', 'ตาม', 'แก้ปัญหา', 'ให้', 'เขา', ' ', 'พอ', 'ถึงคราว', 'ตัวเอง', 'บ้าง', ' ', 'โง่', 'กว่าเพื่อน', 'อีก']"
1986962484658643423,twitter,post,https://x.com/vievenhobs/status/1986962484658643423,text,2025-11-08T01:02:26.000Z,selenium_x_scraper_v1,เป็นคนหนึ่งที่มีสติเสมือนในความสัมพันธ์และเพื่อนก็มักจะชมว่ากูเก่งแล้วก็มีเพื่อนมาปรึกษาเสมอไม่ว่าจะยามโสดหรือมีคู่ จะบอกว่าอาจจะไม่เกี่ยวกับความฉลาดแต่ดูได้ว่าใคร“มีสติ” จริงๆ,เป็นคนหนึ่งที่มีสติเสมือนในความสัมพันธ์และเพื่อนก็มักจะชมว่ากูเก่งแล้วก็มีเพื่อนมาปรึกษาเสมอไม่ว่าจะยามโสดหรือมีคู่ จะบอกว่าอาจจะไม่เกี่ยวกับความฉลาดแต่ดูได้ว่าใคร“มีสติ” จริงๆ,2025-11-29 08:18:55,"['เป็น', 'คน', 'หนึ่ง', 'ที่', 'มีสติ', 'เสมือน', 'ใน', 'ความสัมพันธ์', 'และ', 'เพื่อน', 'ก็', 'มักจะ', 'ชม', 'ว่า', 'กู', 'เก่ง', 'แล้วก็', 'มี', 'เพื่อน', 'มา', 'ปรึกษา', 'เสมอ', 'ไม่', 'ว่า', 'จะ', 'ยาม', 'โสด', 'หรือ', 'มี', 'คู่', ' ', 'จะ', 'บอ', 'กว่า', 'อาจจะ', 'ไม่', 'เกี่ยวกับ', 'ความ', 'ฉลาด', 'แต่', 'ดู', 'ได้', 'ว่า', 'ใคร', ' ', 'มีสติ', ' ', 'จริงๆ']"
1986843814057943349,twitter,post,https://x.com/yainosko/status/1986843814057943349,text,2025-11-07T17:10:53.000Z,selenium_x_scraper_v1,นี่ชอบตัวเองตอนโสด เพราะแฟนคนล่าสุดเล่นไว้หนักมาก เราชิลกับเขาทุกอย่าง ให้อิสระ ไม่วุ่นวาย ทำหน้าที่แฟนที่ดีคนหนึ่งเท่าที่จะทำได้ ผลคือมันแอบไปคุยกับเพื่อนในกลุ่มเรา แล้วหลังจากนั้นก็เป็นบ้า ระแวงมันทุกอย่าง ขนาดเลิกกันแล้ว ยังต้องพักฟื้นตัวเองอีกสองสามปีกว่าจะเข้าที่เข้าทาง,นี่ชอบตัวเองตอนโสด เพราะแฟนคนล่าสุดเล่นไว้หนักมาก เราชิลกับเขาทุกอย่าง ให้อิสระ ไม่วุ่นวาย ทำหน้าที่แฟนที่ดีคนหนึ่งเท่าที่จะทำได้ ผลคือมันแอบไปคุยกับเพื่อนในกลุ่มเรา แล้วหลังจากนั้นก็เป็นบ้า ระแวงมันทุกอย่าง ขนาดเลิกกันแล้ว ยังต้องพักฟื้นตัวเองอีกสองสามปีกว่าจะเข้าที่เข้าทาง,2025-11-29 08:18:55,"['นี่', 'ชอบ', 'ตัวเอง', 'ตอน', 'โสด', ' ', 'เพราะ', 'แฟน', 'คน', 'ล่าสุด', 'เล่น', 'ไว้', 'หนัก', 'มาก', ' ', 'เรา', 'ชิล', 'กับ', 'เขา', 'ทุกอย่าง', ' ', 'ให้', 'อิสระ', ' ', 'ไม่', 'วุ่นวาย', ' ', 'ทำหน้าที่', 'แฟน', 'ที่', 'ดี', 'คน', 'หนึ่ง', 'เท่า', 'ที่จะ', 'ทำได้', ' ', 'ผล', 'คือ', 'มัน', 'แอบ', 'ไป', 'คุย', 'กับ', 'เพื่อน', 'ใน', 'กลุ่ม', 'เรา', ' ', 'แล้ว', 'หลังจากนั้น', 'ก็', 'เป็นบ้า', ' ', 'ระแวง', 'มัน', 'ทุกอย่าง', ' ', 'ขนาด', 'เลิกกัน', 'แล้ว', ' ', 'ยัง', 'ต้อง', 'พักฟื้น', 'ตัวเอง', 'อีก', 'สอง', 'สาม', 'ปี', 'กว่า', 'จะ', 'เข้าที่เข้าทาง']"
1986673829947843037,twitter,post,https://x.com/mymayindecem/status/1986673829947843037,text,2025-11-07T05:55:26.000Z,selenium_x_scraper_v1,กุเองเลย ตอนโสดแม่งเจ๋ง รักตัวเองคสพ.แบบนี้ๆๆอะไรที่ทำให้แย่จะตัดหมดๆ พอเอาเข้าจริงกุโง่มากทั้งยอมทั้งรักษาจนไม่เหลือความเป็นตัวเองเลย,กุเองเลย ตอนโสดแม่งเจ๋ง รักตัวเองคสพ.แบบนี้ๆๆอะไรที่ทำให้แย่จะตัดหมดๆ พอเอาเข้าจริงกุโง่มากทั้งยอมทั้งรักษาจนไม่เหลือความเป็นตัวเองเลย,2025-11-29 08:18:55,"['กุ', 'เอง', 'เลย', ' ', 'ตอน', 'โสด', 'แม่', 'ง', 'เจ๋ง', ' ', 'รัก', 'ตัวเอง', 'คสพ', '.', 'แบบนี้', 'ๆๆ', 'อะไร', 'ที่', 'ทำให้', 'แย่', 'จะ', 'ตัด', 'หมด', 'ๆ', ' ', 'พอ', 'เอา', 'เข้า', 'จริง', 'กุ', 'โง่', 'มาก', 'ทั้ง', 'ยอม', 'ทั้ง', 'รักษา', 'จน', 'ไม่', 'เหลือ', 'ความ', 'เป็น', 'ตัวเอง', 'เลย']"
1986452351113400333,twitter,post,https://x.com/NYXTii/status/1986452351113400333,text,2025-11-06T15:15:21.000Z,selenium_x_scraper_v1,กลายเปนคนฉลาดไม่จริงเฉย 55555,กลายเปนคนฉลาดไม่จริงเฉย 55555,2025-11-29 08:18:55,"['กลาย', 'เปนคน', 'ฉลาด', 'ไม่', 'จริง', 'เฉย', ' ', 'หัวเราะ']"
1986697545889030190,twitter,post,https://x.com/purrjurr/status/1986697545889030190,text,2025-11-07T07:29:40.000Z,selenium_x_scraper_v1,"เวลาเราเดทกับใครสักคน สำหรับคนที่ยังไม่หายดีคือการรักษาแผลตัวเองด้วยยาขนานแรงอะ เราจะเลือกสิ่งที่ทำร้ายเราจนคุ้นเคย ลองดูได้เลยว่าถ้าเลือกแฟนแบบไหน ประมาณ 6-70% ที่บ้านเขาก็ทรีตเขาแบบนั้น
เขาไม่ได้โง่ลง เขาแค่กลับไปหาพื้นที่ปลอดภัย(ที่ไม่ใช่ของจริง)เฉยๆ
โง่ไหมไม่รู้แต่แผลเปิดอยู่","เวลาเราเดทกับใครสักคน สำหรับคนที่ยังไม่หายดีคือการรักษาแผลตัวเองด้วยยาขนานแรงอะ เราจะเลือกสิ่งที่ทำร้ายเราจนคุ้นเคย ลองดูได้เลยว่าถ้าเลือกแฟนแบบไหน ประมาณ 6-70% ที่บ้านเขาก็ทรีตเขาแบบนั้น
เขาไม่ได้โง่ลง เขาแค่กลับไปหาพื้นที่ปลอดภัย(ที่ไม่ใช่ของจริง)เฉยๆ
โง่ไหมไม่รู้แต่แผลเปิดอยู่",2025-11-29 08:18:55,"['เวลา', 'เรา', 'เดท', 'กับ', 'ใคร', 'สัก', 'คน', ' ', 'สำหรับ', 'คน', 'ที่', 'ยัง', 'ไม่', 'หาย', 'ดี', 'คือ', 'การรักษา', 'แผล', 'ตัวเอง', 'ด้วย', 'ยา', 'ขนาน', 'แรง', 'อะ', ' ', 'เรา', 'จะ', 'เลือก', 'สิ่ง', 'ที่', 'ทำร้าย', 'เรา', 'จน', 'คุ้นเคย', ' ', 'ลองดู', 'ได้', 'เลย', 'ว่า', 'ถ้า', 'เลือก', 'แฟน', 'แบบ', 'ไหน', ' ', 'ประมาณ', ' ', '6', ' ', '70', ' ', 'ที่', 'บ้าน', 'เขา', 'ก็', 'ท', 'รีต', 'เขา', 'แบบ', 'นั้น', ' ', 'เขา', 'ไม่', 'ได้', 'โง่', 'ลง', ' ', 'เขา', 'แค่', 'กลับ', 'ไปหา', 'พื้นที่', 'ปลอดภัย', ' ', 'ที่', 'ไม่', 'ใช่', 'ของจริง', ' ', 'เฉย', 'ๆ', ' ', 'โง่', 'ไหม', 'ไม่', 'รู้', 'แต่', 'แผล', 'เปิด', 'อยู่']"
1986820228316311872,twitter,post,https://x.com/Khunnanaa/status/1986820228316311872,text,2025-11-07T15:37:10.000Z,selenium_x_scraper_v1,อันนี้ตอนมีแฟนคือใช้ชีวิตสุดจัดเแทบจะหมือนเดิมกับตอนโสด มีปรับบ้างแต่น้อยมากเพื่อนยังคือที่หนึ่ง ก็ละเลยทำเค้าเสียใจ สุดท้ายก็โดนบอกเลิกจบ ถ้าตอนนั้นปรับคนละครึ่งทางคงจะดี ตอนนี้ไม่กล้ามีใครเลย กลัวเราจะทำตัวแย่อีกในฐานะแฟนก็แย่เอาเรื่อง,อันนี้ตอนมีแฟนคือใช้ชีวิตสุดจัดเแทบจะหมือนเดิมกับตอนโสด มีปรับบ้างแต่น้อยมากเพื่อนยังคือที่หนึ่ง ก็ละเลยทำเค้าเสียใจ สุดท้ายก็โดนบอกเลิกจบ ถ้าตอนนั้นปรับคนละครึ่งทางคงจะดี ตอนนี้ไม่กล้ามีใครเลย กลัวเราจะทำตัวแย่อีกในฐานะแฟนก็แย่เอาเรื่อง,2025-11-29 08:18:55,"['อันนี้', 'ตอน', 'มี', 'แฟน', 'คือ', 'ใช้ชีวิต', 'สุด', 'จัด', 'เ', 'แทบจะ', 'ห', 'มือ', 'น', 'เดิม', 'กับ', 'ตอน', 'โสด', ' ', 'มี', 'ปรับ', 'บ้าง', 'แต่', 'น้อย', 'มาก', 'เพื่อน', 'ยัง', 'คือ', 'ที่หนึ่ง', ' ', 'ก็', 'ละเลย', 'ทำ', 'เค้า', 'เสียใจ', ' ', 'สุดท้าย', 'ก็', 'โดน', 'บอกเลิก', 'จบ', ' ', 'ถ้า', 'ตอนนั้น', 'ปรับ', 'คนละ', 'ครึ่งทาง', 'คงจะ', 'ดี', ' ', 'ตอนนี้', 'ไม่', 'กล้า', 'มี', 'ใคร', 'เลย', ' ', 'กลัว', 'เรา', 'จะ', 'ทำตัว', 'แย่', 'อีก', 'ใน', 'ฐานะ', 'แฟน', 'ก็', 'แย่', 'เอาเรื่อง']"
1986683362854216047,twitter,post,https://x.com/211ratio/status/1986683362854216047,text,2025-11-07T06:33:19.000Z,selenium_x_scraper_v1,เมื่อคุณเป็นมนุษย์เศรษฐกิจที่สามารถเอาทุกสิ่งทุกอย่างมาตัดสินคนอื่นได้,เมื่อคุณเป็นมนุษย์เศรษฐกิจที่สามารถเอาทุกสิ่งทุกอย่างมาตัดสินคนอื่นได้,2025-11-29 08:18:55,"['เมื่อ', 'คุณ', 'เป็น', 'มนุษย์', 'เศรษฐกิจ', 'ที่', 'สามารถ', 'เอา', 'ทุกสิ่งทุกอย่าง', 'มา', 'ตัดสิน', 'คนอื่น', 'ได้']"
1986492830232313969,twitter,post,https://x.com/quennybeen/status/1986492830232313969,text,2025-11-06T17:56:12.000Z,selenium_x_scraper_v1,ยิ่งรักครั้งแรก รักวัยรุ่น ชั้นโคตรจะปล่อยอารมณ์นำพา ระหว่างทางก็โคตรมีความสุขแต่ปลายทางเหมือนจะเอากูให้ตายอ่ะท้อกสิ้กจัดๆ,ยิ่งรักครั้งแรก รักวัยรุ่น ชั้นโคตรจะปล่อยอารมณ์นำพา ระหว่างทางก็โคตรมีความสุขแต่ปลายทางเหมือนจะเอากูให้ตายอ่ะท้อกสิ้กจัดๆ,2025-11-29 08:18:55,"['ยิ่ง', 'รัก', 'ครั้งแรก', ' ', 'รัก', 'วัยรุ่น', ' ', 'ชั้น', 'โคตร', 'จะ', 'ปล่อยอารมณ์', 'นำพา', ' ', 'ระหว่างทาง', 'ก็', 'โคตร', 'มีความสุข', 'แต่', 'ปลายทาง', 'เหมือน', 'จะ', 'เอา', 'กู', 'ให้', 'ตาย', 'อ่ะ', 'ท้อ', 'กสิ้ก', 'จัด', 'ๆ']"
1986624735430717724,twitter,post,https://x.com/sowonsone/status/1986624735430717724,text,2025-11-07T02:40:21.000Z,selenium_x_scraper_v1,มีเพื่อนคนนึงตอนมีแฟนนะดูฉลาดมากข่มแฟนบลาๆ พอเลิกกันแม่งตัดพ้อทุกอย่างในชีวิตจนน่ารำคาญ55555,มีเพื่อนคนนึงตอนมีแฟนนะดูฉลาดมากข่มแฟนบลาๆ พอเลิกกันแม่งตัดพ้อทุกอย่างในชีวิตจนน่ารำคาญ55555,2025-11-29 08:18:55,"['มี', 'เพื่อน', 'คน', 'นึง', 'ตอน', 'มี', 'แฟน', 'นะ', 'ดู', 'ฉลาด', 'มาก', 'ข่ม', 'แฟน', 'บ', 'ลา', 'ๆ', ' ', 'พอ', 'เลิกกัน', 'แม่', 'ง', 'ตัดพ้อ', 'ทุกอย่าง', 'ใน', 'ชีวิต', 'จน', 'น่ารำคาญ', 'หัวเราะ']"
1986610611606986994,twitter,post,https://x.com/nonggiiiiiiig/status/1986610611606986994,text,2025-11-07T01:44:13.000Z,selenium_x_scraper_v1,ทุกวันนี้พูดกับเพื่อนตอนอกหักกับจะมูฟไปใหม่เสมอว่า เอาจริง ไม่ว่าเพศไหน คบกับใคร เวลามีความรักมันต้องดีขึ้น เป็นตัวเองในแบบที่ดีขึ้น ส่งเสริมกันและกันโดยเฉพาะในด้านจิตใจ ความเข้าใจ ไม่ใช่คบแล้วมานั่ง หึง หวง ประสาทแดก นอยไรไม่รู้ เพ้อเจ้อ  การมีแฟน/คู่ชีวิต,ทุกวันนี้พูดกับเพื่อนตอนอกหักกับจะมูฟไปใหม่เสมอว่า เอาจริง ไม่ว่าเพศไหน คบกับใคร เวลามีความรักมันต้องดีขึ้น เป็นตัวเองในแบบที่ดีขึ้น ส่งเสริมกันและกันโดยเฉพาะในด้านจิตใจ ความเข้าใจ ไม่ใช่คบแล้วมานั่ง หึง หวง ประสาทแดก นอยไรไม่รู้ เพ้อเจ้อ  การมีแฟน/คู่ชีวิต,2025-11-29 08:18:55,"['ทุกวันนี้', 'พูด', 'กับ', 'เพื่อน', 'ตอน', 'อกหัก', 'กับ', 'จะ', 'มูฟ', 'ไป', 'ใหม่', 'เสมอ', 'ว่า', ' ', 'เอาจริง', ' ', 'ไม่', 'ว่า', 'เพศ', 'ไหน', ' ', 'คบ', 'กับ', 'ใคร', ' ', 'เวลา', 'มี', 'ความรัก', 'มัน', 'ต้อง', 'ดีขึ้น', ' ', 'เป็น', 'ตัวเอง', 'ใน', 'แบบ', 'ที่', 'ดีขึ้น', ' ', 'ส่งเสริม', 'กันและกัน', 'โดยเฉพาะ', 'ใน', 'ด้าน', 'จิตใจ', ' ', 'ความเข้าใจ', ' ', 'ไม่', 'ใช่', 'คบ', 'แล้ว', 'มา', 'นั่ง', ' ', 'หึง', ' ', 'หวง', ' ', 'ประสาท', 'แดก', ' ', 'นอ', 'ย', 'ไร', 'ไม่', 'รู้', ' ', 'เพ้อเจ้อ', ' ', 'การ', 'มี', 'แฟน', ' ', 'คู่ชีวิต']"
