id,platform,platform_type,url,content_type,timestamp,scraper_module,text,raw_text,scrape_date,tokens
1703901660983230751,twitter,post,https://x.com/LilacSky1995/status/1703901660983230751,text,2023-09-18T22:39:47.000Z,selenium_x_scraper_v1,ข่าว #เบียร์เดอะวอยซ์ ยิ่งตอกย้ำ patriarchy ในสังคมไทย หลายคนคือตรรกะชายแท้เว่อร์ ขอวาร์ปไม่พอ บางคนลามไปว่าเค้าว่าเปลี่ยนแฟนบ่อย คือถ้าผู้ชายเปลี่ยนบ่อย เรียกแบดบอย แต่ถ้าผู้หญิงทำบ้างจะโดนมองในแง่ลบทันที คือไรอะ? มีหำก็เหมือนได้เป็นเจ้าของโลกทั้งใบหรอ? หำเด้อไม่ใช่สมอง สติ!,ข่าว #เบียร์เดอะวอยซ์ ยิ่งตอกย้ำ patriarchy ในสังคมไทย หลายคนคือตรรกะชายแท้เว่อร์ ขอวาร์ปไม่พอ บางคนลามไปว่าเค้าว่าเปลี่ยนแฟนบ่อย คือถ้าผู้ชายเปลี่ยนบ่อย เรียกแบดบอย แต่ถ้าผู้หญิงทำบ้างจะโดนมองในแง่ลบทันที คือไรอะ? มีหำก็เหมือนได้เป็นเจ้าของโลกทั้งใบหรอ? หำเด้อไม่ใช่สมอง สติ!,2025-11-08 17:05:14,"['ข่าว', ' ', 'เบียร์', 'เดอะ', 'วอยซ์', ' ', 'ยิ่ง', 'ตอกย้ำ', ' ', 'patriarchy', ' ', 'ใน', 'สังคม', 'ไทย', ' ', 'หลาย', 'คน', 'คือ', 'ตรรกะ', 'ชาย', 'แท้', 'เว่อร์', ' ', 'ขอ', 'วาร์ป', 'ไม่', 'พอ', ' ', 'บางคน', 'ลาม', 'ไป', 'ว่า', 'เค้า', 'ว่า', 'เปลี่ยน', 'แฟน', 'บ่อย', ' ', 'คือ', 'ถ้า', 'ผู้ชาย', 'เปลี่ยน', 'บ่อย', ' ', 'เรียก', 'แบด', 'บอย', ' ', 'แต่', 'ถ้า', 'ผู้หญิง', 'ทำ', 'บ้าง', 'จะ', 'โดน', 'มอง', 'ในแง่', 'ลบ', 'ทันที', ' ', 'คือ', 'ไร', 'อะ', '?', ' ', 'มี', 'หำ', 'ก็', 'เหมือน', 'ได้', 'เป็นเจ้าของ', 'โลก', 'ทั้ง', 'ใบ', 'หรอ', '?', ' ', 'หำ', 'เด้อ', 'ไม่', 'ใช่', 'สมอง', ' ', 'สติ', '!']"
1704012451992526920,twitter,post,https://x.com/LilacSky1995/status/1704012451992526920,text,2023-09-19T06:00:02.000Z,selenium_x_scraper_v1,เรามองว่าอย่าคิดแทนเขาค่ะ ชีวิตเขาเลือกเอง เขามีวิธีดีลกับคนรอบตัวของเขาเอง แล้วในอนาคต เด็กยุคนั้นเขาคงจะเปิดกว้างกว่าคนยุคเราในหลาย ๆ ด้าน อาชีพที่เคยมี ที่เคยถูกยกว่าเป็น high skill ก็อาจจะหายไปก็ได้ค่ะ,เรามองว่าอย่าคิดแทนเขาค่ะ ชีวิตเขาเลือกเอง เขามีวิธีดีลกับคนรอบตัวของเขาเอง แล้วในอนาคต เด็กยุคนั้นเขาคงจะเปิดกว้างกว่าคนยุคเราในหลาย ๆ ด้าน อาชีพที่เคยมี ที่เคยถูกยกว่าเป็น high skill ก็อาจจะหายไปก็ได้ค่ะ,2025-11-08 17:05:14,"['เรา', 'มองว่า', 'อย่า', 'คิด', 'แทน', 'เขา', 'ค่ะ', ' ', 'ชีวิต', 'เขา', 'เลือก', 'เอง', ' ', 'เขา', 'มี', 'วิธี', 'ดีล', 'กับ', 'คน', 'รอบตัว', 'ของ', 'เขา', 'เอง', ' ', 'แล้ว', 'ในอนาคต', ' ', 'เด็ก', 'ยุค', 'นั้น', 'เขา', 'คงจะ', 'เปิดกว้าง', 'กว่า', 'คน', 'ยุค', 'เรา', 'ใน', 'หลาย', ' ', 'ๆ', ' ', 'ด้าน', ' ', 'อาชีพ', 'ที่', 'เคย', 'มี', ' ', 'ที่', 'เคย', 'ถูก', 'ยก', 'ว่า', 'เป็น', ' ', 'high', ' ', 'skill', ' ', 'ก็', 'อาจจะ', 'หาย', 'ไป', 'ก็ได้', 'ค่ะ']"
1704024440244478198,twitter,post,https://x.com/crta_me/status/1704024440244478198,text,2023-09-19T06:47:40.000Z,selenium_x_scraper_v1,ก็คือจะยัดเยียดให้เด็กรับให้ได้ใช่ไหมครับ ? ในเมื่อมันเป็นงานที่ไม่มีเกียร์ ไม่มีศักดิ์ศรี แถมผิดยังกฏหมาย ณ ปัจจุบันด้วย อยากไปคิดแทนเด็กเลยครับ ว่าเขาจะรับได้ เป็นผู้หญิงด้วยกันก็ควรจะเตือนกันบ้าง ว่าอย่าทำตัวเองเป็นวัตถุทางเพศ,ก็คือจะยัดเยียดให้เด็กรับให้ได้ใช่ไหมครับ ? ในเมื่อมันเป็นงานที่ไม่มีเกียร์ ไม่มีศักดิ์ศรี แถมผิดยังกฏหมาย ณ ปัจจุบันด้วย อยากไปคิดแทนเด็กเลยครับ ว่าเขาจะรับได้ เป็นผู้หญิงด้วยกันก็ควรจะเตือนกันบ้าง ว่าอย่าทำตัวเองเป็นวัตถุทางเพศ,2025-11-08 17:05:14,"['ก็', 'คือ', 'จะ', 'ยัดเยียด', 'ให้', 'เด็ก', 'รับ', 'ให้ได้', 'ใช่ไหม', 'ครับ', ' ', '?', ' ', 'ใน', 'เมื่อ', 'มัน', 'เป็นงาน', 'ที่', 'ไม่', 'มี', 'เกียร์', ' ', 'ไม่', 'มีศักดิ์ศรี', ' ', 'แถม', 'ผิด', 'ยัง', 'กฏ', 'หมาย', ' ', 'ณ', ' ', 'ปัจจุบัน', 'ด้วย', ' ', 'อยาก', 'ไป', 'คิด', 'แทน', 'เด็ก', 'เลย', 'ครับ', ' ', 'ว่า', 'เขา', 'จะ', 'รับได้', ' ', 'เป็น', 'ผู้หญิง', 'ด้วยกัน', 'ก็', 'ควรจะ', 'เตือน', 'กัน', 'บ้าง', ' ', 'ว่า', 'อย่า', 'ทำ', 'ตัวเอง', 'เป็น', 'วัตถุ', 'ทางเพศ']"
1670000949853847552,twitter,post,https://x.com/KojimaTsukumi/status/1670000949853847552,text,2023-06-17T09:30:28.000Z,selenium_x_scraper_v1,เหลือ 2 งับ จะหมดแย้วววว ~ จะเอาไปซ่อมคอมอีกแล้ว ถ้ามันตุบอีกก็คงเครื่องใหม่ละ ขิตไวเกินนนนน ,เหลือ 2 งับ จะหมดแย้วววว ~ จะเอาไปซ่อมคอมอีกแล้ว ถ้ามันตุบอีกก็คงเครื่องใหม่ละ ขิตไวเกินนนนน ,2025-11-08 17:05:14,"['เหลือ', ' ', '2', ' ', 'งับ', ' ', 'จะ', 'หมด', 'แย้', 'วววว', ' ', 'จะ', 'เอา', 'ไป', 'ซ่อม', 'คอม', 'อีกแล้ว', ' ', 'ถ้า', 'มัน', 'ตุบ', 'อีก', 'ก็', 'คง', 'เครื่อง', 'ใหม่', 'ละ', ' ', 'ขิต', 'ไว', 'เกิน', 'นนนน']"
1670148704345681921,twitter,post,https://x.com/crta_me/status/1670148704345681921,text,2023-06-17T19:17:35.000Z,selenium_x_scraper_v1,ทำไมถึงไม่ทำงานสุจริตอะครับ พ่อแม่ไม่เสียใจเหรอ,ทำไมถึงไม่ทำงานสุจริตอะครับ พ่อแม่ไม่เสียใจเหรอ,2025-11-08 17:05:14,"['ทำไม', 'ถึง', 'ไม่', 'ทำงาน', 'สุจริต', 'อะ', 'ครับ', ' ', 'พ่อแม่', 'ไม่', 'เสียใจ', 'เหรอ']"
1661653204449492992,twitter,post,https://x.com/crta_me/status/1661653204449492992,text,2023-05-25T08:39:30.000Z,selenium_x_scraper_v1,ผมจะแจ้งตำรวจ,ผมจะแจ้งตำรวจ,2025-11-08 17:05:14,"['ผม', 'จะ', 'แจ้งตำรวจ']"
1661651912377397249,twitter,post,https://x.com/crta_me/status/1661651912377397249,text,2023-05-25T08:34:22.000Z,selenium_x_scraper_v1,ทำงานไร้ศักศรีแบบนี้แถมผิดกฏหมาย ไม่สงสารพ่อแม่เหรอครับ,ทำงานไร้ศักศรีแบบนี้แถมผิดกฏหมาย ไม่สงสารพ่อแม่เหรอครับ,2025-11-08 17:05:14,"['ทำงาน', 'ไร้', 'ศัก', 'ศรี', 'แบบนี้', 'แถม', 'ผิดก', 'ฏ', 'หมาย', ' ', 'ไม่', 'สงสาร', 'พ่อแม่', 'เหรอ', 'ครับ']"
1660576611811610624,twitter,post,https://x.com/crta_me/status/1660576611811610624,text,2023-05-22T09:21:30.000Z,selenium_x_scraper_v1,ไม่สงสารพ่อแม่เหรอครับลูกมาทำงานไม่มีศักดิ์ศรีแบบนี้ แถมผิดกฏหมายด้วย,ไม่สงสารพ่อแม่เหรอครับลูกมาทำงานไม่มีศักดิ์ศรีแบบนี้ แถมผิดกฏหมายด้วย,2025-11-08 17:05:14,"['ไม่', 'สงสาร', 'พ่อแม่', 'เหรอ', 'ครับ', 'ลูก', 'มา', 'ทำงาน', 'ไม่', 'มีศักดิ์ศรี', 'แบบนี้', ' ', 'แถม', 'ผิดก', 'ฏ', 'หมาย', 'ด้วย']"
1640791779149742081,twitter,post,https://x.com/crta_me/status/1640791779149742081,text,2023-03-28T19:03:39.000Z,selenium_x_scraper_v1,เด็กเลวพ่อแม่ไม่สั่งสอน,เด็กเลวพ่อแม่ไม่สั่งสอน,2025-11-08 17:05:14,"['เด็ก', 'เลว', 'พ่อแม่', 'ไม่', 'สั่งสอน']"
1640724793132711940,twitter,post,https://x.com/darkerkuro/status/1640724793132711940,text,2023-03-28T14:37:28.000Z,selenium_x_scraper_v1,คุณจะไม่เห็นด้วยกับการพ่นสีก็ได้ แต่ถ้ามันเกิดกรณีที่เจ้าหน้ารัฐทำเกินกว่าเหตุขนาดนี้ วิ่งเข้าชาร์จ ไม่ให้ทนายเข้าพบ โดยที่ตัวคนกระทำก็ไม่ได้ขัดขืนอะไรเลย คุณควรตั้งคำถามกับการกระทำของรัฐมากกว่ามั้ยอะ,คุณจะไม่เห็นด้วยกับการพ่นสีก็ได้ แต่ถ้ามันเกิดกรณีที่เจ้าหน้ารัฐทำเกินกว่าเหตุขนาดนี้ วิ่งเข้าชาร์จ ไม่ให้ทนายเข้าพบ โดยที่ตัวคนกระทำก็ไม่ได้ขัดขืนอะไรเลย คุณควรตั้งคำถามกับการกระทำของรัฐมากกว่ามั้ยอะ,2025-11-08 17:05:14,"['คุณ', 'จะ', 'ไม่', 'เห็นด้วย', 'กับ', 'การพ่น', 'สี', 'ก็ได้', ' ', 'แต่', 'ถ้า', 'มัน', 'เกิด', 'กรณี', 'ที่', 'เจ้าหน้า', 'รัฐ', 'ทำ', 'เกิน', 'กว่า', 'เหตุ', 'ขนาด', 'นี้', ' ', 'วิ่ง', 'เข้า', 'ชาร์จ', ' ', 'ไม่', 'ให้', 'ทนาย', 'เข้าพบ', ' ', 'โดยที่', 'ตัว', 'คน', 'กระทำ', 'ก็', 'ไม่', 'ได้', 'ขัดขืน', 'อะไร', 'เลย', ' ', 'คุณ', 'ควร', 'ตั้งคำถาม', 'กับ', 'การกระทำ', 'ของ', 'รัฐ', 'มากกว่า', 'มั้ย', 'อะ']"
1640791382611881985,twitter,post,https://x.com/crta_me/status/1640791382611881985,text,2023-03-28T19:02:04.000Z,selenium_x_scraper_v1,ไอ้เวรนั่นสมควรโดนมากกว่านั้นด้วยซ้ำ น่าตบกระบาลตบซักที,ไอ้เวรนั่นสมควรโดนมากกว่านั้นด้วยซ้ำ น่าตบกระบาลตบซักที,2025-11-08 17:05:14,"['ไอ้เวร', 'นั่น', 'สมควร', 'โดน', 'มากกว่า', 'นั้น', 'ด้วยซ้ำ', ' ', 'น่า', 'ตบ', 'กระบาล', 'ตบ', 'ซัก', 'ที']"
1640790628153065472,twitter,post,https://x.com/crta_me/status/1640790628153065472,text,2023-03-28T18:59:04.000Z,selenium_x_scraper_v1,ลองให้มันไปพ่นบ้านคุณดูไหมละ,ลองให้มันไปพ่นบ้านคุณดูไหมละ,2025-11-08 17:05:14,"['ลอง', 'ให้', 'มัน', 'ไป', 'พ่น', 'บ้าน', 'คุณ', 'ดู', 'ไห', 'มละ']"
1639344285400145921,twitter,post,https://x.com/nowwizzz/status/1639344285400145921,text,2023-03-24T19:11:49.000Z,selenium_x_scraper_v1,คือตอนเค้าตายใหม่ๆมีแต่คนปลอบกูว่า เค้ารักเราแหละ แต่ไม่แสดงออก เปิดชื่อผู้รับผลประโยชน์ประกันปุ๊บ เงียบกริบบ,คือตอนเค้าตายใหม่ๆมีแต่คนปลอบกูว่า เค้ารักเราแหละ แต่ไม่แสดงออก เปิดชื่อผู้รับผลประโยชน์ประกันปุ๊บ เงียบกริบบ,2025-11-08 17:05:14,"['คือ', 'ตอน', 'เค้า', 'ตาย', 'ใหม่', 'ๆ', 'มี', 'แต่', 'คน', 'ปลอบ', 'กู', 'ว่า', ' ', 'เค้า', 'รัก', 'เรา', 'แหละ', ' ', 'แต่', 'ไม่', 'แสดงออก', ' ', 'เปิด', 'ชื่อ', 'ผู้รับ', 'ผลประโยชน์', 'ประกัน', 'ปุ๊บ', ' ', 'เงียบกริบ', 'บ']"
1639831002817384448,twitter,post,https://x.com/crta_me/status/1639831002817384448,text,2023-03-26T03:25:52.000Z,selenium_x_scraper_v1,รักพ่อเพราะเงินเหรอครับ,รักพ่อเพราะเงินเหรอครับ,2025-11-08 17:05:14,"['รัก', 'พ่อ', 'เพราะ', 'เงิน', 'เหรอ', 'ครับ']"
1639070021644087296,twitter,post,https://x.com/KYOsTom/status/1639070021644087296,text,2023-03-24T01:02:00.000Z,selenium_x_scraper_v1,"[Vtuber]Hi-light การสารภาพบาปของเซียล่าต่อคุณเอิร์น @EarniesHime 
เป็นความลับที่ห้ามบอกใคร ใครรู้ก็เหยียบไว้นะ @UminoCiala 
Hi-light Link: https://youtu.be/JqagTaHeiNU
#Vtuber #Pixela #CialaAra #vtuberTH #thai #meme #Ciala #Unino #Legend","[Vtuber]Hi-light การสารภาพบาปของเซียล่าต่อคุณเอิร์น @EarniesHime 
เป็นความลับที่ห้ามบอกใคร ใครรู้ก็เหยียบไว้นะ @UminoCiala 
Hi-light Link: https://youtu.be/JqagTaHeiNU
#Vtuber #Pixela #CialaAra #vtuberTH #thai #meme #Ciala #Unino #Legend",2025-11-08 17:05:14,"['vtuber', ' ', 'hi', ' ', 'light', ' ', 'การ', 'สารภาพบาป', 'ของ', 'เซีย', 'ล่า', 'ต่อ', 'คุณ', 'เอิร์น', ' ', 'เป็นความลับ', 'ที่', 'ห้าม', 'บอก', 'ใคร', ' ', 'ใคร', 'รู้', 'ก็', 'เหยียบ', 'ไว้', 'นะ', ' ', 'hi', ' ', 'light', ' ', 'link']"
1639252239931043842,twitter,post,https://x.com/crta_me/status/1639252239931043842,text,2023-03-24T13:06:04.000Z,selenium_x_scraper_v1,ไม่อยากให้รู้แล้วจะเล่าให้ฟังทำไมครับ ? ย้อนแย้งจัง,ไม่อยากให้รู้แล้วจะเล่าให้ฟังทำไมครับ ? ย้อนแย้งจัง,2025-11-08 17:05:14,"['ไม่', 'อยาก', 'ให้', 'รู้', 'แล้', 'วจะ', 'เล่า', 'ให้', 'ฟัง', 'ทำไม', 'ครับ', ' ', '?', ' ', 'ย้อน', 'แย้ง', 'จัง']"
1637772214992007169,twitter,post,https://x.com/Wichan64610488/status/1637772214992007169,text,2023-03-20T11:04:59.000Z,selenium_x_scraper_v1,หาข้อมูลแจ้งเรื่องคนเลวได้และ รบกวนช่วยกันทำ ช่วยกันส่งหลักฐาน ต้องให้ติดคุก https://tcsd.go.th/%e0%b9%81%e0%b8%88%e0%b9%89%e0%b8%87%e0%b9%80%e0%b8%9a%e0%b8%b2%e0%b8%b0%e0%b9%81%e0%b8%aa/…,หาข้อมูลแจ้งเรื่องคนเลวได้และ รบกวนช่วยกันทำ ช่วยกันส่งหลักฐาน ต้องให้ติดคุก https://tcsd.go.th/%e0%b9%81%e0%b8%88%e0%b9%89%e0%b8%87%e0%b9%80%e0%b8%9a%e0%b8%b2%e0%b8%b0%e0%b9%81%e0%b8%aa/…,2025-11-08 17:05:14,"['หา', 'ข้อมูล', 'แจ้ง', 'เรื่อง', 'คนเลว', 'ได้', 'และ', ' ', 'รบกวน', 'ช่วยกัน', 'ทำ', ' ', 'ช่วยกัน', 'ส่ง', 'หลักฐาน', ' ', 'ต้อง', 'ให้', 'ติดคุก']"
1637917612935114752,twitter,post,https://x.com/crta_me/status/1637917612935114752,text,2023-03-20T20:42:44.000Z,selenium_x_scraper_v1,ผมยินดีช่วย,ผมยินดีช่วย,2025-11-08 17:05:14,"['ผม', 'ยินดี', 'ช่วย']"
1637917538226163712,twitter,post,https://x.com/crta_me/status/1637917538226163712,text,2023-03-20T20:42:26.000Z,selenium_x_scraper_v1,แล้วต้องส่งชื่อพี่กับเพื่อนๆลงไปด้วยไหมครับ,แล้วต้องส่งชื่อพี่กับเพื่อนๆลงไปด้วยไหมครับ,2025-11-08 17:05:14,"['แล้ว', 'ต้อง', 'ส่ง', 'ชื่อ', 'พี่', 'กับ', 'เพื่อน', 'ๆลง', 'ไป', 'ด้วย', 'ไหม', 'ครับ']"
1637914459367948288,twitter,post,https://x.com/crta_me/status/1637914459367948288,text,2023-03-20T20:30:12.000Z,selenium_x_scraper_v1,ตัวเองยังทำผิดกฎหมายอยู่เลย แต่แหกปากเรียกร้องความถูกต้อง xaxaxaxa,ตัวเองยังทำผิดกฎหมายอยู่เลย แต่แหกปากเรียกร้องความถูกต้อง xaxaxaxa,2025-11-08 17:05:14,"['ตัวเอง', 'ยัง', 'ทำผิดกฎหมาย', 'อยู่เลย', ' ', 'แต่', 'แหกปาก', 'เรียกร้อง', 'ความถูกต้อง', ' ', 'xaxaxaxa']"
1637914200424189952,twitter,post,https://x.com/crta_me/status/1637914200424189952,text,2023-03-20T20:29:11.000Z,selenium_x_scraper_v1,ขายคลิปโป็ในonly fan ไม่ผิดกฎหมายหรอครับ,ขายคลิปโป็ในonly fan ไม่ผิดกฎหมายหรอครับ,2025-11-08 17:05:14,"['ขาย', 'คลิป', 'โป', '็', 'ใน', 'only', ' ', 'fan', ' ', 'ไม่', 'ผิดกฎหมาย', 'หรอ', 'ครับ']"
1635238677097111553,twitter,post,https://x.com/karenkawaii251/status/1635238677097111553,text,2023-03-13T11:17:36.000Z,selenium_x_scraper_v1,โธ่เอ้ย ยังไม่จบด้วยซ้ำ ยังไม่มีอะไรเป็นชิ้นเป็นอัน ใช้เงินพ่อแม่อยู่ป่าวเอ่ย ไปทำผลงานมาก่อนเนอะ ค่อยมาไล่เม้นด่าชาวบ้าน เอาให้ได้ทุกแอคเลยนะ ,โธ่เอ้ย ยังไม่จบด้วยซ้ำ ยังไม่มีอะไรเป็นชิ้นเป็นอัน ใช้เงินพ่อแม่อยู่ป่าวเอ่ย ไปทำผลงานมาก่อนเนอะ ค่อยมาไล่เม้นด่าชาวบ้าน เอาให้ได้ทุกแอคเลยนะ ,2025-11-08 17:05:14,"['โธ่', 'เอ้ย', ' ', 'ยัง', 'ไม่', 'จบ', 'ด้วยซ้ำ', ' ', 'ยัง', 'ไม่', 'มี', 'อะไร', 'เป็นชิ้นเป็นอัน', ' ', 'ใช้', 'เงิน', 'พ่อแม่', 'อยู่', 'ป่าว', 'เอ่ย', ' ', 'ไป', 'ทำ', 'ผลงาน', 'มา', 'ก่อน', 'เนอะ', ' ', 'ค่อย', 'มา', 'ไล่', 'เม้น', 'ด่า', 'ชาวบ้าน', ' ', 'เอา', 'ให้ได้', 'ทุก', 'แอ', 'ค', 'เลย', 'นะ']"
1635254787754315776,twitter,post,https://x.com/crta_me/status/1635254787754315776,text,2023-03-13T12:21:37.000Z,selenium_x_scraper_v1,เอาจริงๆผมไม่ได้ด่านะแค่มาเตือนว่าผิดกคเฉยๆ ที่ด่าผมด่าไอ้พวกเอาเงินมาจ่ายให้พวก low skill worker คุณภาพต่ำๆน่ะครับ เข้าใจให้ถูกด้วย,เอาจริงๆผมไม่ได้ด่านะแค่มาเตือนว่าผิดกคเฉยๆ ที่ด่าผมด่าไอ้พวกเอาเงินมาจ่ายให้พวก low skill worker คุณภาพต่ำๆน่ะครับ เข้าใจให้ถูกด้วย,2025-11-08 17:05:14,"['เอา', 'จริงๆ', 'ผม', 'ไม่', 'ได้', 'ด่า', 'นะ', 'แค่', 'มา', 'เตือน', 'ว่า', 'ผิด', 'กค', 'เฉย', 'ๆ', ' ', 'ที่', 'ด่า', 'ผม', 'ด่า', 'ไอ้', 'พวก', 'เอา', 'เงิน', 'มา', 'จ่าย', 'ให้', 'พวก', ' ', 'low', ' ', 'skill', ' ', 'worker', ' ', 'คุณภาพต่ำ', 'ๆ', 'น่ะ', 'ครับ', ' ', 'เข้าใจ', 'ให้', 'ถูก', 'ด้วย']"
