id,platform,platform_type,url,content_type,timestamp,scraper_module,text,raw_text,scrape_date,tokens
1980570064148652340,twitter,post,https://x.com/Fortythousand2/status/1980570064148652340,text,2025-10-21T09:41:15.000Z,selenium_x_scraper_v1,สงสารคนแต่งที่แทบจะเคี้ยวแนวคิดใส่ปากให้แล้วแต่พี่ก็ยังย่อยมันไม่ได้ กฎการแลกเปลี่ยนที่เท่าเทียมคืออะไรลองย้อนกลับไปอ่านแล้วถามตัวเองใหม่อีกครั้งเถอะ,สงสารคนแต่งที่แทบจะเคี้ยวแนวคิดใส่ปากให้แล้วแต่พี่ก็ยังย่อยมันไม่ได้ กฎการแลกเปลี่ยนที่เท่าเทียมคืออะไรลองย้อนกลับไปอ่านแล้วถามตัวเองใหม่อีกครั้งเถอะ,2025-11-29 08:18:55,"['สงสาร', 'คน', 'แต่ง', 'ที่', 'แทบจะ', 'เคี้ยว', 'แนวคิด', 'ใส่', 'ปาก', 'ให้', 'แล้วแต่', 'พี่', 'ก็', 'ยัง', 'ย่อย', 'มัน', 'ไม่', 'ได้', ' ', 'กฎ', 'การ', 'แลกเปลี่ยน', 'ที่', 'เท่าเทียม', 'คือ', 'อะไร', 'ลอง', 'ย้อนกลับ', 'ไป', 'อ่าน', 'แล้ว', 'ถาม', 'ตัวเอง', 'ใหม่', 'อีกครั้ง', 'เถอะ']"
1980571778717200760,twitter,post,https://x.com/thekingofotaku/status/1980571778717200760,text,2025-10-21T09:48:03.000Z,selenium_x_scraper_v1,"มันก็เหมือนกับที่สองพี่น้องสูญเสียร่างกายเพื่อคืนชีพแม่ที่ไม่สมบูรณ์

ถ้าอยากแต่งตัวโป๊ได้เสรีทุกที่
แล้วไม่คิดจะแลกอะไรเลยเหรอ

การถูกคุกคามคือราคาที่ต้องจ่าย

มันสมเหตุสมผลแล้ว
ในกฏแห่งแลกเปลี่ยนที่เท่าเทียม

ทุกอย่างมีสิ่งที่ต้องแลกเพื่อให้ได้มา

ไม่ต้องแถ","มันก็เหมือนกับที่สองพี่น้องสูญเสียร่างกายเพื่อคืนชีพแม่ที่ไม่สมบูรณ์

ถ้าอยากแต่งตัวโป๊ได้เสรีทุกที่
แล้วไม่คิดจะแลกอะไรเลยเหรอ

การถูกคุกคามคือราคาที่ต้องจ่าย

มันสมเหตุสมผลแล้ว
ในกฏแห่งแลกเปลี่ยนที่เท่าเทียม

ทุกอย่างมีสิ่งที่ต้องแลกเพื่อให้ได้มา

ไม่ต้องแถ",2025-11-29 08:18:55,"['มัน', 'ก็', 'เหมือนกับ', 'ที่สอง', 'พี่น้อง', 'สูญเสีย', 'ร่างกาย', 'เพื่อ', 'คืนชีพ', 'แม่', 'ที่', 'ไม่', 'สมบูรณ์', ' ', 'ถ้า', 'อยาก', 'แต่งตัว', 'โป๊', 'ได้', 'เสรี', 'ทุกที่', ' ', 'แล้ว', 'ไม่', 'คิด', 'จะ', 'แลก', 'อะไร', 'เลย', 'เหรอ', ' ', 'การ', 'ถูก', 'คุกคาม', 'คือ', 'รา', 'คาที่', 'ต้อง', 'จ่าย', ' ', 'มัน', 'สมเหตุสมผล', 'แล้ว', ' ', 'ใน', 'กฏ', 'แห่ง', 'แลกเปลี่ยน', 'ที่', 'เท่าเทียม', ' ', 'ทุกอย่าง', 'มี', 'สิ่ง', 'ที่', 'ต้อง', 'แลก', 'เพื่อให้', 'ได้มา', ' ', 'ไม่ต้อง', 'แถ']"
1980524245869543866,twitter,post,https://x.com/political_drama/status/1980524245869543866,text,2025-10-21T06:39:11.000Z,selenium_x_scraper_v1,"สังคมดีได้ โดยไม่ต้องหากินกับคำคมกลวงๆของนิ้วกลม 

นิ้วกลางกล่าวไว้
แฮ่
55555555555555555555555555555555555555555555555555555555555555555555555","สังคมดีได้ โดยไม่ต้องหากินกับคำคมกลวงๆของนิ้วกลม 

นิ้วกลางกล่าวไว้
แฮ่
55555555555555555555555555555555555555555555555555555555555555555555555",2025-11-29 08:18:55,"['สังค', 'มดี', 'ได้', ' ', 'โดย', 'ไม่ต้อง', 'หากิน', 'กับ', 'คำคม', 'กลวง', 'ๆ', 'ของ', 'นิ้ว', 'กลม', ' ', 'นิ้วกลาง', 'กล่าว', 'ไว้', ' ', 'แฮ่', ' ', 'หัวเราะ']"
1980566028007690325,twitter,post,https://x.com/thekingofotaku/status/1980566028007690325,text,2025-10-21T09:25:12.000Z,selenium_x_scraper_v1,"เบื่อพวกสร้างแต่วาทะกรรมจริงๆ
แรกๆใหม่ๆคนคงอินแต่ตอนนี้มั่นใจมีแต่คนรำคาญพวกพูดหล่อๆ แต่ไม่ลงมือทำ
ดีแต่เอาตีนราน้ำ","เบื่อพวกสร้างแต่วาทะกรรมจริงๆ
แรกๆใหม่ๆคนคงอินแต่ตอนนี้มั่นใจมีแต่คนรำคาญพวกพูดหล่อๆ แต่ไม่ลงมือทำ
ดีแต่เอาตีนราน้ำ",2025-11-29 08:18:55,"['เบื่อ', 'พวก', 'สร้าง', 'แต่', 'วาทะ', 'กรรม', 'จริงๆ', ' ', 'แรก', 'ๆ', 'ใหม่', 'ๆคนคง', 'อิน', 'แต่', 'ตอนนี้', 'มั่นใจ', 'มี', 'แต่', 'คน', 'รำคาญ', 'พวก', 'พูด', 'หล่อ', 'ๆ', ' ', 'แต่', 'ไม่', 'ลงมือทำ', ' ', 'ดีแต่', 'เอา', 'ตีน', 'ราน้ำ']"
1980559161118388521,twitter,post,https://x.com/notthing_bout2u/status/1980559161118388521,text,2025-10-21T08:57:55.000Z,selenium_x_scraper_v1,มึงตอบแพลตเทิร์มเดิมๆอ่ะ ไม่มีไรจะเถียงใหม่ๆบ้างอ่อ กุงงอ่า มึงจะยื่นพื้นอะไรขนาดนั้น เถียงไรไม่ได้มึงก้แปะคอมเม้นเฟสบุ๊คอ่ะ ตลกอ่ะ,มึงตอบแพลตเทิร์มเดิมๆอ่ะ ไม่มีไรจะเถียงใหม่ๆบ้างอ่อ กุงงอ่า มึงจะยื่นพื้นอะไรขนาดนั้น เถียงไรไม่ได้มึงก้แปะคอมเม้นเฟสบุ๊คอ่ะ ตลกอ่ะ,2025-11-29 08:18:55,"['มึง', 'ตอบ', 'แพ', 'ลตเทิร์ม', 'เดิม', 'ๆ', 'อ่ะ', ' ', 'ไม่', 'มี', 'ไร', 'จะ', 'เถียง', 'ใหม่', 'ๆ', 'บ้าง', 'อ่อ', ' ', 'กุ', 'งง', 'อ่า', ' ', 'มึง', 'จะ', 'ยื่น', 'พื้น', 'อะไร', 'ขนาด', 'นั้น', ' ', 'เถียง', 'ไร', 'ไม่', 'ได้', 'มึง', 'ก้', 'แปะ', 'คอม', 'เม้น', 'เฟส', 'บุ๊ค', 'อ่ะ', ' ', 'ตลก', 'อ่ะ']"
1980562934276452807,twitter,post,https://x.com/thekingofotaku/status/1980562934276452807,text,2025-10-21T09:12:55.000Z,selenium_x_scraper_v1,"ก็มึงพ่นแต่เรื่องเดิมๆ 
จะให้กูตอบแบบไหน?
มึงบ้าป่ะ","ก็มึงพ่นแต่เรื่องเดิมๆ 
จะให้กูตอบแบบไหน?
มึงบ้าป่ะ",2025-11-29 08:18:55,"['ก็', 'มึง', 'พ่น', 'แต่', 'เรื่อง', 'เดิม', 'ๆ', ' ', 'จะ', 'ให้', 'กู', 'ตอบ', 'แบบ', 'ไหน', '?', ' ', 'มึง', 'บ้า', 'ป่ะ']"
1980559516120018971,twitter,post,https://x.com/notthing_bout2u/status/1980559516120018971,text,2025-10-21T08:59:20.000Z,selenium_x_scraper_v1,อุอ่ะ นี่มีคนรอบข้างคอยเตือนป่ะเนี่ย หรือวันๆอยู่กับสาว2Dนมโตปลอมๆ,อุอ่ะ นี่มีคนรอบข้างคอยเตือนป่ะเนี่ย หรือวันๆอยู่กับสาว2Dนมโตปลอมๆ,2025-11-29 08:18:55,"['อุ', 'อ่ะ', ' ', 'นี่', 'มี', 'คน', 'รอบข้าง', 'คอย', 'เตือน', 'ป่ะ', 'เนี่ย', ' ', 'หรือ', 'วัน', 'ๆ', 'อยู่', 'กับ', 'สาว', '2', 'd', 'นม', 'โต', 'ปลอม', 'ๆ']"
1980562809659486392,twitter,post,https://x.com/thekingofotaku/status/1980562809659486392,text,2025-10-21T09:12:25.000Z,selenium_x_scraper_v1,สาว 2D ผิดไรวะ?,สาว 2D ผิดไรวะ?,2025-11-29 08:18:55,"['สาว', ' ', '2', 'd', ' ', 'ผิด', 'ไร', 'วะ', '?']"
1980559670441046375,twitter,post,https://x.com/notthing_bout2u/status/1980559670441046375,text,2025-10-21T08:59:57.000Z,selenium_x_scraper_v1,พูดได้มั้ยคะพิ่จิ้ เย็ดกันเองก็สอนกันเองค่ะ ลูกใครลูกมันเนอะ,พูดได้มั้ยคะพิ่จิ้ เย็ดกันเองก็สอนกันเองค่ะ ลูกใครลูกมันเนอะ,2025-11-29 08:18:55,"['พูด', 'ได้', 'มั้ย', 'คะ', 'พิ่จิ้', ' ', 'เย็ด', 'กันเอง', 'ก็', 'สอน', 'กันเอง', 'ค่ะ', ' ', 'ลูก', 'ใคร', 'ลูก', 'มัน', 'เนอะ']"
1980562688922341702,twitter,post,https://x.com/thekingofotaku/status/1980562688922341702,text,2025-10-21T09:11:56.000Z,selenium_x_scraper_v1,"เขาถึงห้ามไม่ให้แต่งตัวออกนอกบ้านไง
มึงเข้าใจหัวอกพ่อแม่ ที่มีคนมีชื่อเสียงชักนำในทางที่ผิดยัง","เขาถึงห้ามไม่ให้แต่งตัวออกนอกบ้านไง
มึงเข้าใจหัวอกพ่อแม่ ที่มีคนมีชื่อเสียงชักนำในทางที่ผิดยัง",2025-11-29 08:18:55,"['เขา', 'ถึง', 'ห้ามไม่ให้', 'แต่งตัว', 'ออก', 'นอกบ้าน', 'ไง', ' ', 'มึง', 'เข้าใจ', 'หัวอก', 'พ่อแม่', ' ', 'ที่', 'มี', 'คน', 'มีชื่อเสียง', 'ชักนำ', 'ใน', 'ทาง', 'ที่', 'ผิด', 'ยัง']"
1980558801343508504,twitter,post,https://x.com/notthing_bout2u/status/1980558801343508504,text,2025-10-21T08:56:29.000Z,selenium_x_scraper_v1,กูป้องกันตัวกันเป็นปกติเพราะมีผู้ชายที่อยากคุกคามลูกชาวบ้านแบบมึงเนี่ยแหละ,กูป้องกันตัวกันเป็นปกติเพราะมีผู้ชายที่อยากคุกคามลูกชาวบ้านแบบมึงเนี่ยแหละ,2025-11-29 08:18:55,"['กู', 'ป้องกันตัว', 'กัน', 'เป็นปกติ', 'เพราะ', 'มี', 'ผู้ชาย', 'ที่', 'อยาก', 'คุกคาม', 'ลูก', 'ชาวบ้าน', 'แบบ', 'มึง', 'เนี่ย', 'แหละ']"
1980559050074124556,twitter,post,https://x.com/thekingofotaku/status/1980559050074124556,text,2025-10-21T08:57:29.000Z,selenium_x_scraper_v1,"ถูกต้อง
ทำไปดิ
การป้องกันตัวเองเป็นเรื่องของมึง","ถูกต้อง
ทำไปดิ
การป้องกันตัวเองเป็นเรื่องของมึง",2025-11-29 08:18:55,"['ถูกต้อง', ' ', 'ทำ', 'ไป', 'ดิ', ' ', 'การป้องกัน', 'ตัวเอง', 'เป็นเรื่อง', 'ของ', 'มึง']"
1980558295237816429,twitter,post,https://x.com/notthing_bout2u/status/1980558295237816429,text,2025-10-21T08:54:29.000Z,selenium_x_scraper_v1,ปัญหามันอยู่ในหัวมึง เรื่องของคนอื่น มึงเป็นไรมากป่ะเนี่ย เดือดร้อนแทนพ่อแม่เขาเนี่ย กูเริ่มงงแล้ว มีเพื่อนป่ะเนี่ย,ปัญหามันอยู่ในหัวมึง เรื่องของคนอื่น มึงเป็นไรมากป่ะเนี่ย เดือดร้อนแทนพ่อแม่เขาเนี่ย กูเริ่มงงแล้ว มีเพื่อนป่ะเนี่ย,2025-11-29 08:18:55,"['ปัญหา', 'มัน', 'อยู่', 'ใน', 'หัว', 'มึง', ' ', 'เรื่อง', 'ของ', 'คนอื่น', ' ', 'มึง', 'เป็นไร', 'มาก', 'ป่ะ', 'เนี่ย', ' ', 'เดือดร้อน', 'แทน', 'พ่อแม่', 'เขา', 'เนี่ย', ' ', 'กู', 'เริ่ม', 'งง', 'แล้ว', ' ', 'มี', 'เพื่อน', 'ป่ะ', 'เนี่ย']"
1980558900815614227,twitter,post,https://x.com/thekingofotaku/status/1980558900815614227,text,2025-10-21T08:56:53.000Z,selenium_x_scraper_v1,"ปัญหาที่ดารามึงก่อ
ด้วยการแต่งตัวโป๊ในที่สาธารณะกำลังทำให้เยาวชนเลียนแบบ
และพ่อแม่หลายครอบครัวต้องคอยดูแลลูกสาวของเขา

มึงยังคิดว่าเป็นปัญหาของคนอื่นอีก
เหรอ","ปัญหาที่ดารามึงก่อ
ด้วยการแต่งตัวโป๊ในที่สาธารณะกำลังทำให้เยาวชนเลียนแบบ
และพ่อแม่หลายครอบครัวต้องคอยดูแลลูกสาวของเขา

มึงยังคิดว่าเป็นปัญหาของคนอื่นอีก
เหรอ",2025-11-29 08:18:55,"['ปัญหา', 'ที่', 'ดารา', 'มึง', 'ก่อ', ' ', 'ด้วย', 'การ', 'แต่งตัว', 'โป๊', 'ใน', 'ที่สาธารณะ', 'กำลัง', 'ทำให้', 'เยาวชน', 'เลียนแบบ', ' ', 'และ', 'พ่อแม่', 'หลาย', 'ครอบครัว', 'ต้อง', 'คอย', 'ดูแล', 'ลูกสาว', 'ของ', 'เขา', ' ', 'มึง', 'ยัง', 'คิด', 'ว่า', 'เป็นปัญหา', 'ของ', 'คนอื่น', 'อีก', ' ', 'เหรอ']"
1980556902393344456,twitter,post,https://x.com/notthing_bout2u/status/1980556902393344456,text,2025-10-21T08:48:57.000Z,selenium_x_scraper_v1,สมแล้วที่ดูเหมือนมีแต่หัวไว้บนคอนะคะ ดูไม่ค่อยมีอะไรเลยค่ะ ปาร์ตี้อยู่หน้าห้องนอนกุมั้ง พูดไรโง่ๆ เคยออกไปกินเหล้าเข้าสังคมมั้ยคะ หรือว่าอยู่แต่หลังจอ ถึงไม่รู้ว่าต้องเดินทางน่ะ,สมแล้วที่ดูเหมือนมีแต่หัวไว้บนคอนะคะ ดูไม่ค่อยมีอะไรเลยค่ะ ปาร์ตี้อยู่หน้าห้องนอนกุมั้ง พูดไรโง่ๆ เคยออกไปกินเหล้าเข้าสังคมมั้ยคะ หรือว่าอยู่แต่หลังจอ ถึงไม่รู้ว่าต้องเดินทางน่ะ,2025-11-29 08:18:55,"['สม', 'แล้ว', 'ที่', 'ดูเหมือน', 'มี', 'แต่', 'หัว', 'ไว้', 'บน', 'คอ', 'นะคะ', ' ', 'ดู', 'ไม่ค่อย', 'มี', 'อะไร', 'เลย', 'ค่ะ', ' ', 'ปาร์ตี้', 'อยู่', 'หน้า', 'ห้องนอน', 'กุ', 'มั้ง', ' ', 'พูด', 'ไร', 'โง่', 'ๆ', ' ', 'เคย', 'ออก', 'ไป', 'กิน', 'เหล้า', 'เข้าสังคม', 'มั้ย', 'คะ', ' ', 'หรือว่า', 'อยู่', 'แต่', 'หลัง', 'จอ', ' ', 'ถึง', 'ไม่', 'รู้', 'ว่า', 'ต้อง', 'เดินทาง', 'น่ะ']"
1980543792265719861,twitter,post,https://x.com/thekingofotaku/status/1980543792265719861,text,2025-10-21T07:56:51.000Z,selenium_x_scraper_v1,"มั่นหน้า 
สังคมตีกลับตัดสินมานานแล้วยังไม่รู้ตัว
นี่กูแคปมาบางส่วนน่ะ ยังมีอีกเยอะ
อยู่แต่ในกะลา X เฟมทวิตติ่งเกาหลี 
ก็คิดว่าคนส่วนใหญ่
กูขำ","มั่นหน้า 
สังคมตีกลับตัดสินมานานแล้วยังไม่รู้ตัว
นี่กูแคปมาบางส่วนน่ะ ยังมีอีกเยอะ
อยู่แต่ในกะลา X เฟมทวิตติ่งเกาหลี 
ก็คิดว่าคนส่วนใหญ่
กูขำ",2025-11-29 08:18:55,"['มั่น', 'หน้า', ' ', 'สังคม', 'ตีกลับ', 'ตัดสิน', 'มา', 'นาน', 'แล้ว', 'ยัง', 'ไม่', 'รู้ตัว', ' ', 'นี่', 'กู', 'แคป', 'มา', 'บางส่วน', 'น่ะ', ' ', 'ยังมี', 'อีก', 'เยอะ', ' ', 'อยู่', 'แต่', 'ใน', 'กะลา', ' ', 'x', ' ', 'เฟม', 'ทวิ', 'ต', 'ติ่ง', 'เกาหลี', ' ', 'ก็', 'คิด', 'ว่า', 'คน', 'ส่วนใหญ่', ' ', 'กู', 'ขำ']"
1980540347609661872,twitter,post,https://x.com/G__r4l/status/1980540347609661872,text,2025-10-21T07:43:10.000Z,selenium_x_scraper_v1,เราเคยบอกหรอว่าดาราเป็นแบบอย่างของสังคม  แย้งกับใครช่วยดูคนแย้งด้วยค่ะ อย่าสักแต่ปิดหูปิดตายกคนอื่นมาโต้ค่ะ ,เราเคยบอกหรอว่าดาราเป็นแบบอย่างของสังคม  แย้งกับใครช่วยดูคนแย้งด้วยค่ะ อย่าสักแต่ปิดหูปิดตายกคนอื่นมาโต้ค่ะ ,2025-11-29 08:18:55,"['เรา', 'เคย', 'บอก', 'หรอ', 'ว่า', 'ดารา', 'เป็น', 'แบบอย่าง', 'ของ', 'สังคม', ' ', 'แย้ง', 'กับ', 'ใคร', 'ช่วย', 'ดู', 'คน', 'แย้ง', 'ด้วย', 'ค่ะ', ' ', 'อย่า', 'สัก', 'แต่', 'ปิดหูปิดตา', 'ยก', 'คนอื่น', 'มา', 'โต้', 'ค่ะ']"
1980540659108040996,twitter,post,https://x.com/G__r4l/status/1980540659108040996,text,2025-10-21T07:44:24.000Z,selenium_x_scraper_v1,แล้วก็คนแถคือใครให้พูดใหม่นะคะ แทบจะยืนอยู่จุดนั้นคนเดียวแล้วค่ะ คนเห็นด้วยเป็นส่วนน้อย สังคมตัดสินพี่แล้วนะ,แล้วก็คนแถคือใครให้พูดใหม่นะคะ แทบจะยืนอยู่จุดนั้นคนเดียวแล้วค่ะ คนเห็นด้วยเป็นส่วนน้อย สังคมตัดสินพี่แล้วนะ,2025-11-29 08:18:55,"['แล้วก็', 'คน', 'แถ', 'คือ', 'ใคร', 'ให้', 'พูด', 'ใหม่', 'นะคะ', ' ', 'แทบจะ', 'ยืน', 'อยู่', 'จุด', 'นั้น', 'คนเดียว', 'แล้ว', 'ค่ะ', ' ', 'คน', 'เห็นด้วย', 'เป็น', 'ส่วนน้อย', ' ', 'สังคม', 'ตัดสิน', 'พี่', 'แล้ว', 'นะ']"
1980541574254850410,twitter,post,https://x.com/thekingofotaku/status/1980541574254850410,text,2025-10-21T07:48:02.000Z,selenium_x_scraper_v1,"มึงแน่ใจ
","มึงแน่ใจ
",2025-11-29 08:18:55,"['มึง', 'แน่ใจ']"
1980541346424455496,twitter,post,https://x.com/thekingofotaku/status/1980541346424455496,text,2025-10-21T07:47:08.000Z,selenium_x_scraper_v1,"Common sense ที่คนทั้งโลกเข้าใจ
มึงไม่น่าแถ ถ้าไม่อยากเป็นแบบอย่างสังคม ก็เลิกเป็นดาราเถอะ","Common sense ที่คนทั้งโลกเข้าใจ
มึงไม่น่าแถ ถ้าไม่อยากเป็นแบบอย่างสังคม ก็เลิกเป็นดาราเถอะ",2025-11-29 08:18:55,"['common', ' ', 'sense', ' ', 'ที่', 'คน', 'ทั้งโลก', 'เข้าใจ', ' ', 'มึง', 'ไม่', 'น่า', 'แถ', ' ', 'ถ้า', 'ไม่', 'อยาก', 'เป็น', 'แบบอย่าง', 'สังคม', ' ', 'ก็', 'เลิก', 'เป็น', 'ดารา', 'เถอะ']"
1980539495071313991,twitter,post,https://x.com/G__r4l/status/1980539495071313991,text,2025-10-21T07:39:46.000Z,selenium_x_scraper_v1,ก็เรื่องของเค้าค่ะ แค่นั้นอ่า พี่นี่ก็อยากสอดเรื่องคนอื่นจัง ทีตัวเองอยากเห็นเมนใส่ชุดว่ายน้ำคืออะไรคะ55555 อ้างว่าไม่ใช่ที่สาธารณะ แต่สื่อก็สาธาณะนะคะ เข้าถึงง่ายกว่าพื้นที่อีก,ก็เรื่องของเค้าค่ะ แค่นั้นอ่า พี่นี่ก็อยากสอดเรื่องคนอื่นจัง ทีตัวเองอยากเห็นเมนใส่ชุดว่ายน้ำคืออะไรคะ55555 อ้างว่าไม่ใช่ที่สาธารณะ แต่สื่อก็สาธาณะนะคะ เข้าถึงง่ายกว่าพื้นที่อีก,2025-11-29 08:18:55,"['ก็', 'เรื่อง', 'ของ', 'เค้า', 'ค่ะ', ' ', 'แค่นั้น', 'อ่า', ' ', 'พี่', 'นี่', 'ก็', 'อยาก', 'สอด', 'เรื่อง', 'คนอื่น', 'จัง', ' ', 'ที', 'ตัวเอง', 'อยาก', 'เห็น', 'เมน', 'ใส่', 'ชุดว่ายน้ำ', 'คือ', 'อะไร', 'คะ', 'หัวเราะ', ' ', 'อ้างว่า', 'ไม่', 'ใช่', 'ที่สาธารณะ', ' ', 'แต่', 'สื่อ', 'ก็', 'สา', 'ธาณะ', 'นะคะ', ' ', 'เข้าถึง', 'ง่าย', 'กว่า', 'พื้นที่', 'อีก']"
