id,platform,platform_type,url,content_type,timestamp,scraper_module,text,raw_text,scrape_date,tokens
1981976721869230146,twitter,post,https://x.com/LEOONE38/status/1981976721869230146,text,2025-10-25T06:50:48.000Z,selenium_x_scraper_v1,มันมีจริงๆเหรอคำพูดแบบนี้กับครูสมัยปัจจุบัน เห็นครูเป็นอินฟลูกันเกือบครึ่งประเทศ,มันมีจริงๆเหรอคำพูดแบบนี้กับครูสมัยปัจจุบัน เห็นครูเป็นอินฟลูกันเกือบครึ่งประเทศ,2025-11-29 08:18:55,"['มัน', 'มี', 'จริงๆ', 'เหรอ', 'คำพูด', 'แบบนี้', 'กับ', 'ครู', 'สมัยปัจจุบัน', ' ', 'เห็น', 'ครู', 'เป็น', 'อิน', 'ฟลู', 'กัน', 'เกือบ', 'ครึ่ง', 'ประเทศ']"
1981979415316984249,twitter,post,https://x.com/nakedsprings/status/1981979415316984249,text,2025-10-25T07:01:30.000Z,selenium_x_scraper_v1,อีครูนี้แหละตัวแปลตั้งต้น การปลูกฝังเรื่องหมกมุ่นในหัวเด็ก,อีครูนี้แหละตัวแปลตั้งต้น การปลูกฝังเรื่องหมกมุ่นในหัวเด็ก,2025-11-29 08:18:55,"['อี', 'ครู', 'นี้แหละ', 'ตัว', 'แปล', 'ตั้งต้น', ' ', 'การ', 'ปลูกฝัง', 'เรื่อง', 'หมกมุ่น', 'ใน', 'หัว', 'เด็ก']"
1982161032979116402,twitter,post,https://x.com/saxeii/status/1982161032979116402,text,2025-10-25T19:03:11.000Z,selenium_x_scraper_v1,เคยโดนอาจารย์ตอนมัธยมบอกว่า ห้ามหวีผมในที่สาธารณะหรือที่อื่นนอกจาห้องน้ำเพราะ คนที่หวีผมนอกห้องน้ำคือ กะxี่ งงเป็นไก่ตาแตก,เคยโดนอาจารย์ตอนมัธยมบอกว่า ห้ามหวีผมในที่สาธารณะหรือที่อื่นนอกจาห้องน้ำเพราะ คนที่หวีผมนอกห้องน้ำคือ กะxี่ งงเป็นไก่ตาแตก,2025-11-29 08:18:55,"['เคย', 'โดน', 'อาจารย์', 'ตอน', 'มัธยม', 'บอ', 'กว่า', ' ', 'ห้าม', 'หวี', 'ผม', 'ใน', 'ที่สาธารณะ', 'หรือ', 'ที่อื่น', 'นอก', 'จา', 'ห้องน้ำ', 'เพราะ', ' ', 'คน', 'ที่', 'หวี', 'ผม', 'นอก', 'ห้องน้ำ', 'คือ', ' ', 'กะ', 'x', 'ี่', ' ', 'งงเป็นไก่ตาแตก']"
1981951597153604078,twitter,post,https://x.com/smith_nicha/status/1981951597153604078,text,2025-10-25T05:10:58.000Z,selenium_x_scraper_v1,สงสัยครูเป็นฝรั่งจากยุควิคตอเรีย,สงสัยครูเป็นฝรั่งจากยุควิคตอเรีย,2025-11-29 08:18:55,"['สงสัย', 'ครู', 'เป็น', 'ฝรั่ง', 'จาก', 'ยุค', 'วิคตอเรีย']"
1982022804649427349,twitter,post,https://x.com/BodyKad/status/1982022804649427349,text,2025-10-25T09:53:55.000Z,selenium_x_scraper_v1,ญล้วนเหมือนกัน เชคกระโปรงแบบให้นั่งคุกเข่า กระโปรงลอยจากพื้นคือสั้น ละนี่อ้วนขึ้นมากๆครูบอกไปตัดกระโปรงมาใช่มั้ย จับใส่โจงกระเบน ชอบเลยวิ่งเล่นได้เต็มที่ จบที่ห้องปกครอง ผญวิ่งไล่จับมันไม่งาม ,ญล้วนเหมือนกัน เชคกระโปรงแบบให้นั่งคุกเข่า กระโปรงลอยจากพื้นคือสั้น ละนี่อ้วนขึ้นมากๆครูบอกไปตัดกระโปรงมาใช่มั้ย จับใส่โจงกระเบน ชอบเลยวิ่งเล่นได้เต็มที่ จบที่ห้องปกครอง ผญวิ่งไล่จับมันไม่งาม ,2025-11-29 08:18:55,"['ญ', 'ล้วน', 'เหมือนกัน', ' ', 'เชค', 'กระโปรง', 'แบบ', 'ให้', 'นั่งคุกเข่า', ' ', 'กระโปรง', 'ลอย', 'จาก', 'พื้น', 'คือ', 'สั้น', ' ', 'ละ', 'นี่', 'อ้วน', 'ขึ้น', 'มาก', 'ๆ', 'ครู', 'บอก', 'ไป', 'ตัด', 'กระโปรง', 'มา', 'ใช่', 'มั้ย', ' ', 'จับ', 'ใส่', 'โจงกระเบน', ' ', 'ชอบ', 'เลย', 'วิ่งเล่น', 'ได้', 'เต็มที่', ' ', 'จบ', 'ที่', 'ห้อง', 'ปกครอง', ' ', 'ผญ', 'วิ่งไล่', 'จับ', 'มัน', 'ไม่', 'งาม']"
1982124703163801995,twitter,post,https://x.com/Painworry/status/1982124703163801995,text,2025-10-25T16:38:49.000Z,selenium_x_scraper_v1,เทสครูเก่ามาก,เทสครูเก่ามาก,2025-11-29 08:18:55,"['เท', 'ส', 'ครู', 'เก่า', 'มาก']"
1982255789604733267,twitter,post,https://x.com/MissileXeqiu/status/1982255789604733267,text,2025-10-26T01:19:43.000Z,selenium_x_scraper_v1,โรงเรียนหญิงล้วนย่านจุติเกินแก,โรงเรียนหญิงล้วนย่านจุติเกินแก,2025-11-29 08:18:55,"['โรงเรียนหญิง', 'ล้วน', 'ย่าน', 'จุติ', 'เกิน', 'แก']"
1981956595757220265,twitter,post,https://x.com/inkky43/status/1981956595757220265,text,2025-10-25T05:30:50.000Z,selenium_x_scraper_v1,รร ย่านพัฒนาการมั้ยงับ,รร ย่านพัฒนาการมั้ยงับ,2025-11-29 08:18:55,"['รร', ' ', 'ย่าน', 'พัฒนาการ', 'มั้ย', 'งับ']"
1982199930572734903,twitter,post,https://x.com/DarknightAngely/status/1982199930572734903,text,2025-10-25T21:37:45.000Z,selenium_x_scraper_v1,รร.เรา ชญ. ก็มีแบบนี้ แต่หลังจากด่ายึดถุงเท้านะ ให้เดินเท้าเปล่าทั้งวัน,รร.เรา ชญ. ก็มีแบบนี้ แต่หลังจากด่ายึดถุงเท้านะ ให้เดินเท้าเปล่าทั้งวัน,2025-11-29 08:18:55,"['รร.', 'เรา', ' ', 'ชญ', '.', ' ', 'ก็', 'มี', 'แบบนี้', ' ', 'แต่', 'หลังจาก', 'ด่า', 'ยึด', 'ถุงเท้า', 'นะ', ' ', 'ให้', 'เดิน', 'เท้าเปล่า', 'ทั้งวัน']"
1982095598489878598,twitter,post,https://x.com/pspanacea/status/1982095598489878598,text,2025-10-25T14:43:10.000Z,selenium_x_scraper_v1,ชั้นเรียนภาษาอังกฤษ ไม่ให้ออกเสียง yet ให้ออกเสียงว่าเจ้ท เพราะออก y จะเป็นคำหยาบ ตอนนั้นยังไม่รุด้วยซ้ำว่าเย้ดแปลว่าไร  กลับบ้านถามแม่ แม่ด่าครูซะ ประสาท คนละภาษา จากเด็กไม่สนใจก้มาสงสัย,ชั้นเรียนภาษาอังกฤษ ไม่ให้ออกเสียง yet ให้ออกเสียงว่าเจ้ท เพราะออก y จะเป็นคำหยาบ ตอนนั้นยังไม่รุด้วยซ้ำว่าเย้ดแปลว่าไร  กลับบ้านถามแม่ แม่ด่าครูซะ ประสาท คนละภาษา จากเด็กไม่สนใจก้มาสงสัย,2025-11-29 08:18:55,"['ชั้นเรียน', 'ภาษาอังกฤษ', ' ', 'ไม่', 'ให้', 'ออกเสียง', ' ', 'yet', ' ', 'ให้', 'ออกเสียง', 'ว่า', 'เจ้', 'ท', ' ', 'เพราะ', 'ออก', ' ', 'y', ' ', 'จะ', 'เป็น', 'คำหยาบ', ' ', 'ตอนนั้น', 'ยัง', 'ไม่', 'รุ', 'ด้วยซ้ำ', 'ว่า', 'เย้', 'ด', 'แปล', 'ว่า', 'ไร', ' ', 'กลับบ้าน', 'ถาม', 'แม่', ' ', 'แม่', 'ด่า', 'ครู', 'ซะ', ' ', 'ประสาท', ' ', 'คนละ', 'ภาษา', ' ', 'จาก', 'เด็ก', 'ไม่', 'สนใจ', 'ก้', 'มา', 'สงสัย']"
1982118070404698530,twitter,post,https://x.com/hydrenyearna/status/1982118070404698530,text,2025-10-25T16:12:28.000Z,selenium_x_scraper_v1,เอาล่ะ รบกวนเพจดังต่างๆช่วยหาข้อมูลเรื่องคนเจนก่อนกับการหมกมุ่งเรื่องทางเพศด้วยค่ะ ตอนเด็กเราก็เจอบ่อยพูดอะไรไปพวกผู้ใหญ่ก็หัวเราะคิกคัก ทำหน้าแบบรู้กัน สมองมีแต่เรื่อง 18+ จะสื่อไปทางเพศอย่างเดียว ปกป้องไมเนอร์จากผู้ใหญ่ที่หมกมุ่นจนเกินไปด้วย ขยะแขยงมาก,เอาล่ะ รบกวนเพจดังต่างๆช่วยหาข้อมูลเรื่องคนเจนก่อนกับการหมกมุ่งเรื่องทางเพศด้วยค่ะ ตอนเด็กเราก็เจอบ่อยพูดอะไรไปพวกผู้ใหญ่ก็หัวเราะคิกคัก ทำหน้าแบบรู้กัน สมองมีแต่เรื่อง 18+ จะสื่อไปทางเพศอย่างเดียว ปกป้องไมเนอร์จากผู้ใหญ่ที่หมกมุ่นจนเกินไปด้วย ขยะแขยงมาก,2025-11-29 08:18:55,"['เอาล่ะ', ' ', 'รบกวน', 'เพจ', 'ดัง', 'ต่างๆ', 'ช่วย', 'หา', 'ข้อมูล', 'เรื่อง', 'คน', 'เจน', 'ก่อน', 'กับ', 'การ', 'หมก', 'มุ่ง', 'เรื่อง', 'ทางเพศ', 'ด้วย', 'ค่ะ', ' ', 'ตอน', 'เด็ก', 'เรา', 'ก็', 'เจอ', 'บ่อย', 'พูด', 'อะไร', 'ไป', 'พวก', 'ผู้ใหญ่', 'ก็', 'หัวเราะ', 'คิกคัก', ' ', 'ทำ', 'หน้า', 'แบบ', 'รู้กัน', ' ', 'สมอง', 'มี', 'แต่', 'เรื่อง', ' ', '18', ' ', 'จะ', 'สื่อ', 'ไป', 'ทางเพศ', 'อย่าง', 'เดียว', ' ', 'ปกป้อง', 'ไมเนอร์', 'จาก', 'ผู้ใหญ่', 'ที่', 'หมกมุ่น', 'จน', 'เกินไป', 'ด้วย', ' ', 'ขยะแขยง', 'มาก']"
1982240907370852717,twitter,post,https://x.com/s_wlu9094/status/1982240907370852717,text,2025-10-26T00:20:35.000Z,selenium_x_scraper_v1,รร.นี่เป็นสห มีคนนึงบอก ผญ.อย่ามัดผมสูง ให้มัดต่ำ อย่าโชว์คอให้ผช.เห็น มันไม่เหมาะสมให้มัดต่ำ ละปล่อยผมไม่ได้ด้วยนะเพราะไม่สุภาพ  จะเครซี่เลยว่ะ,รร.นี่เป็นสห มีคนนึงบอก ผญ.อย่ามัดผมสูง ให้มัดต่ำ อย่าโชว์คอให้ผช.เห็น มันไม่เหมาะสมให้มัดต่ำ ละปล่อยผมไม่ได้ด้วยนะเพราะไม่สุภาพ  จะเครซี่เลยว่ะ,2025-11-29 08:18:55,"['รร.', 'นี่', 'เป็น', 'สห', ' ', 'มี', 'คน', 'นึง', 'บอก', ' ', 'ผญ.', 'อย่า', 'มัด', 'ผม', 'สูง', ' ', 'ให้', 'มัด', 'ต่ำ', ' ', 'อย่า', 'โชว์', 'คอ', 'ให้', 'ผช.', 'เห็น', ' ', 'มัน', 'ไม่', 'เหมาะสม', 'ให้', 'มัด', 'ต่ำ', ' ', 'ละ', 'ปล่อย', 'ผม', 'ไม่', 'ได้', 'ด้วย', 'นะ', 'เพราะ', 'ไม่', 'สุภาพ', ' ', 'จะ', 'เค', 'ร', 'ซี่', 'เลย', 'ว่ะ']"
1981984792431517784,twitter,post,https://x.com/Daisy_1998S/status/1981984792431517784,text,2025-10-25T07:22:52.000Z,selenium_x_scraper_v1,ส่วนของนี่ตอนเรียนมัธยมปชายเป็นนักวิ่งของโรงเรียนเลยต้องพกชุดพละกับชุดซ้อมมาเปลี่ยนบ่อย แล้วจะมีเสื้อวอร์มแขนยาว ครูผู้ชายฝ่ายกิจการนักเรียนขี่มอไซต์มาตะโกนใส่  “มึงใส่เสื้อแขนยาวมาหาพ่อมึงเหรอหน้าร้อน มึงท้องรึไง”  แล้วคือที่สนามบอลใกล้ๆที่ซ้อมวิ่งนักเรียนเป็นร้อยพากันมองกุหมด,ส่วนของนี่ตอนเรียนมัธยมปชายเป็นนักวิ่งของโรงเรียนเลยต้องพกชุดพละกับชุดซ้อมมาเปลี่ยนบ่อย แล้วจะมีเสื้อวอร์มแขนยาว ครูผู้ชายฝ่ายกิจการนักเรียนขี่มอไซต์มาตะโกนใส่  “มึงใส่เสื้อแขนยาวมาหาพ่อมึงเหรอหน้าร้อน มึงท้องรึไง”  แล้วคือที่สนามบอลใกล้ๆที่ซ้อมวิ่งนักเรียนเป็นร้อยพากันมองกุหมด,2025-11-29 08:18:55,"['ส่วน', 'ของ', 'นี่', 'ตอน', 'เรียน', 'มัธยม', 'ป', 'ชาย', 'เป็น', 'นัก', 'วิ่ง', 'ของ', 'โรงเรียน', 'เลย', 'ต้อง', 'พก', 'ชุด', 'พละ', 'กับ', 'ชุด', 'ซ้อม', 'มา', 'เปลี่ยน', 'บ่อย', ' ', 'แล้', 'วจะ', 'มี', 'เสื้อ', 'วอร์ม', 'แขน', 'ยาว', ' ', 'ครู', 'ผู้ชาย', 'ฝ่าย', 'กิจการ', 'นักเรียน', 'ขี่', 'มอ', 'ไซต์', 'มา', 'ตะโกน', 'ใส่', ' ', 'มึง', 'ใส่', 'เสื้อแขนยาว', 'มาหา', 'พ่อ', 'มึง', 'เหรอ', 'หน้าร้อน', ' ', 'มึง', 'ท้อง', 'รึ', 'ไง', ' ', 'แล้ว', 'คือ', 'ที่', 'สนาม', 'บอล', 'ใกล้', 'ๆ', 'ที่', 'ซ้อม', 'วิ่ง', 'นักเรียน', 'เป็น', 'ร้อย', 'พา', 'กัน', 'มอง', 'กุ', 'หมด']"
1981942238457590136,twitter,post,https://x.com/Gidhartha/status/1981942238457590136,text,2025-10-25T04:33:47.000Z,selenium_x_scraper_v1,รร.หญิงล้วนนี่ไม่เป็น แถมวิชาสุขศึกษายังสอนให้เด็กซื้อถุงยางแล้วสอนวิธีใส่กับควยปลอมด้วย ซึ่งเป็นเรื่องราวเมื่อ 20 กว่าปีที่แล้ว เป็นยุคนี้อาจเสียงแตกเพราะคนสอนเป็นครูผู้ชาย ส่วนห้องไหนเรียนกับครูผู้หญิงจะไม่ได้เรียนอะไรพวกนี้,รร.หญิงล้วนนี่ไม่เป็น แถมวิชาสุขศึกษายังสอนให้เด็กซื้อถุงยางแล้วสอนวิธีใส่กับควยปลอมด้วย ซึ่งเป็นเรื่องราวเมื่อ 20 กว่าปีที่แล้ว เป็นยุคนี้อาจเสียงแตกเพราะคนสอนเป็นครูผู้ชาย ส่วนห้องไหนเรียนกับครูผู้หญิงจะไม่ได้เรียนอะไรพวกนี้,2025-11-29 08:18:55,"['รร.', 'หญิง', 'ล้วน', 'นี่', 'ไม่', 'เป็น', ' ', 'แถม', 'วิชา', 'สุขศึกษา', 'ยัง', 'สอน', 'ให้', 'เด็ก', 'ซื้อ', 'ถุงยาง', 'แล้ว', 'สอน', 'วิธี', 'ใส่', 'กับ', 'ควย', 'ปลอม', 'ด้วย', ' ', 'ซึ่ง', 'เป็น', 'เรื่องราว', 'เมื่อ', ' ', '20', ' ', 'กว่า', 'ปี', 'ที่แล้ว', ' ', 'เป็น', 'ยุค', 'นี้', 'อาจ', 'เสียงแตก', 'เพราะ', 'คน', 'สอน', 'เป็น', 'ครู', 'ผู้ชาย', ' ', 'ส่วน', 'ห้อง', 'ไหน', 'เรียน', 'กับ', 'ครู', 'ผู้หญิง', 'จะ', 'ไม่', 'ได้', 'เรียน', 'อะไร', 'พวก', 'นี้']"
1982128017758695773,twitter,post,https://x.com/PadyaV2/status/1982128017758695773,text,2025-10-25T16:52:00.000Z,selenium_x_scraper_v1,ปกติเวลาไปซื้อของจะไม่รับถุงอยู่แล้ว มีครั้งนึงไปซื้อผักบอกแม่ค้าว่า ‘ไม่ต้องใส่ถุงค่ะ’ อีผชที่ยืนข้าง ๆ มันหันไปพูดกับเพื่อนว่า ‘เขาบอกไม่ต้องใส่ถุงว่ะ’ แล้วหัวเราะคิกคักกัน สันดานเนาะ,ปกติเวลาไปซื้อของจะไม่รับถุงอยู่แล้ว มีครั้งนึงไปซื้อผักบอกแม่ค้าว่า ‘ไม่ต้องใส่ถุงค่ะ’ อีผชที่ยืนข้าง ๆ มันหันไปพูดกับเพื่อนว่า ‘เขาบอกไม่ต้องใส่ถุงว่ะ’ แล้วหัวเราะคิกคักกัน สันดานเนาะ,2025-11-29 08:18:55,"['ปกติ', 'เวลา', 'ไป', 'ซื้อ', 'ของ', 'จะ', 'ไม่', 'รับ', 'ถุง', 'อยู่แล้ว', ' ', 'มี', 'ครั้ง', 'นึง', 'ไป', 'ซื้อ', 'ผัก', 'บอก', 'แม่ค้า', 'ว่า', ' ', 'ไม่ต้อง', 'ใส่', 'ถุง', 'ค่ะ', ' ', 'อี', 'ผช', 'ที่', 'ยืน', 'ข้าง ๆ', ' ', 'มัน', 'หันไป', 'พูด', 'กับ', 'เพื่อน', 'ว่า', ' ', 'เขา', 'บอก', 'ไม่ต้อง', 'ใส่', 'ถุง', 'ว่ะ', ' ', 'แล้ว', 'หัวเราะ', 'คิกคัก', 'กัน', ' ', 'สันดาน', 'เนาะ']"
1981946842054283410,twitter,post,https://x.com/gracezillla_/status/1981946842054283410,text,2025-10-25T04:52:04.000Z,selenium_x_scraper_v1,ตอนฉันมอหนึ่ง ไม่รู้จักคำสองแง่สองง่ามใดๆทั้งสิ้น เค้าให้พันวอกเกิ้ลเนตรนารีเอง นี่พูดว่า มันยัดไม่เข้า โดนครูว่าว่าพูดไม่สุภาพ นี่ก็งง มองตาเพื่อนสายตาว่างเปล่า แล้วพอพูดอีกครั้ง เค้าก็ว่าเราอีก มันคาใจมาก โตมาก้ยังไม่เข้าใจอยู่ดี 5555 แต่คิดว่าครูคิดว่าเราพูดว่า เyด ป่ะ,ตอนฉันมอหนึ่ง ไม่รู้จักคำสองแง่สองง่ามใดๆทั้งสิ้น เค้าให้พันวอกเกิ้ลเนตรนารีเอง นี่พูดว่า มันยัดไม่เข้า โดนครูว่าว่าพูดไม่สุภาพ นี่ก็งง มองตาเพื่อนสายตาว่างเปล่า แล้วพอพูดอีกครั้ง เค้าก็ว่าเราอีก มันคาใจมาก โตมาก้ยังไม่เข้าใจอยู่ดี 5555 แต่คิดว่าครูคิดว่าเราพูดว่า เyด ป่ะ,2025-11-29 08:18:55,"['ตอน', 'ฉัน', 'มอ', 'หนึ่ง', ' ', 'ไม่', 'รู้จัก', 'คำ', 'สองแง่สองง่าม', 'ใดๆ', 'ทั้งสิ้น', ' ', 'เค้า', 'ให้', 'พัน', 'วอก', 'เกิ้ล', 'เนตรนารี', 'เอง', ' ', 'นี่', 'พูดว่า', ' ', 'มัน', 'ยัด', 'ไม่', 'เข้า', ' ', 'โดน', 'ครู', 'ว่า', 'ว่า', 'พูด', 'ไม่', 'สุภาพ', ' ', 'นี่', 'ก็', 'งง', ' ', 'มอง', 'ตา', 'เพื่อน', 'สายตา', 'ว่างเปล่า', ' ', 'แล้ว', 'พอ', 'พูด', 'อีกครั้ง', ' ', 'เค้า', 'ก็', 'ว่า', 'เรา', 'อีก', ' ', 'มัน', 'คาใจ', 'มาก', ' ', 'โตมา', 'ก้', 'ยัง', 'ไม่', 'เข้าใจ', 'อยู่ดี', ' ', 'หัวเราะ', ' ', 'แต่', 'คิด', 'ว่า', 'ครู', 'คิด', 'ว่า', 'เรา', 'พูดว่า', ' ', 'เ', 'y', 'ด', ' ', 'ป่ะ']"
