id,platform,platform_type,url,content_type,timestamp,scraper_module,text,raw_text,scrape_date,tokens
1989911600376193247,twitter,post,https://x.com/tenshi_P1107/status/1989911600376193247,text,2025-11-16T04:21:10.000Z,selenium_x_scraper_v1,สินสอดคืออีกหนึ่งสิ่งที่แสดงถึงวัฒนธรรมชายเป็นใหญ่ จ่ายเพื่อซื้อตัวลูกสาวเขามา เป็นภรรยา เอาเข้าบ้าน กลืนนามสกุลเมีย ลูก แค่จ่ายสินสอดไม่กี่บาท ส่งเสริมตระกูลผช ควรจะยกเลิกวัฒนธรรมนี้ไปซะ ผญแต่งงานก็ไม่ใช่สมบัติสิ่งของ ของใครทั้งนั้น ทั้งคำนำหน้าทั้งนามสกุล ไม่จำเป็นต้องเปลี่ยน,สินสอดคืออีกหนึ่งสิ่งที่แสดงถึงวัฒนธรรมชายเป็นใหญ่ จ่ายเพื่อซื้อตัวลูกสาวเขามา เป็นภรรยา เอาเข้าบ้าน กลืนนามสกุลเมีย ลูก แค่จ่ายสินสอดไม่กี่บาท ส่งเสริมตระกูลผช ควรจะยกเลิกวัฒนธรรมนี้ไปซะ ผญแต่งงานก็ไม่ใช่สมบัติสิ่งของ ของใครทั้งนั้น ทั้งคำนำหน้าทั้งนามสกุล ไม่จำเป็นต้องเปลี่ยน,2025-11-29 08:18:55,"['สินสอด', 'คือ', 'อีก', 'หนึ่ง', 'สิ่ง', 'ที่', 'แสดงถึง', 'วัฒนธรรม', 'ชาย', 'เป็นใหญ่', ' ', 'จ่าย', 'เพื่อ', 'ซื้อ', 'ตัว', 'ลูกสาว', 'เขา', 'มา', ' ', 'เป็น', 'ภรรยา', ' ', 'เอา', 'เข้า', 'บ้าน', ' ', 'กลืน', 'นามสกุล', 'เมีย', ' ', 'ลูก', ' ', 'แค่', 'จ่าย', 'สินสอด', 'ไม่', 'กี่', 'บาท', ' ', 'ส่งเสริม', 'ตระกูล', 'ผช', ' ', 'ควรจะ', 'ยกเลิก', 'วัฒนธรรม', 'นี้', 'ไป', 'ซะ', ' ', 'ผญ', 'แต่งงาน', 'ก็', 'ไม่', 'ใช่', 'สมบัติ', 'สิ่งของ', ' ', 'ของ', 'ใคร', 'ทั้งนั้น', ' ', 'ทั้ง', 'คำนำหน้า', 'ทั้ง', 'นามสกุล', ' ', 'ไม่', 'จำเป็นต้อง', 'เปลี่ยน']"
1989926353240813818,twitter,post,https://x.com/twistatwita/status/1989926353240813818,text,2025-11-16T05:19:48.000Z,selenium_x_scraper_v1,Interesting point of view,Interesting point of view,2025-11-29 08:18:55,"['interesting', ' ', 'point', ' ', 'of', ' ', 'view']"
1990224234829025684,twitter,post,https://x.com/RainyAfternnoon/status/1990224234829025684,text,2025-11-17T01:03:28.000Z,selenium_x_scraper_v1,อุบาทว์มาก 555555 คือกูตลก บางปีคนก็ด่าท้อกซิกแมสคิวลีน ถัดมาอีกปีมีคอนเท้นแบมินิมัมปริ้นเซสทรีทเม้น คือกูเข้าใจนะว่าเรื่องแบบนี้มันปัจเจก แล้วแต่คนมันจะคบกันแหละ แต่จะบอกว่ามันเลือกเดินสองทางบ่ได้นะอะไรแบบนี้ อยากจะคอนเซอเวทีฟก็ต้องไปทางนึง อยากจะลิเบอรัลก็ไปอีกทาง,อุบาทว์มาก 555555 คือกูตลก บางปีคนก็ด่าท้อกซิกแมสคิวลีน ถัดมาอีกปีมีคอนเท้นแบมินิมัมปริ้นเซสทรีทเม้น คือกูเข้าใจนะว่าเรื่องแบบนี้มันปัจเจก แล้วแต่คนมันจะคบกันแหละ แต่จะบอกว่ามันเลือกเดินสองทางบ่ได้นะอะไรแบบนี้ อยากจะคอนเซอเวทีฟก็ต้องไปทางนึง อยากจะลิเบอรัลก็ไปอีกทาง,2025-11-29 08:18:55,"['อุบาทว์', 'มาก', ' ', 'หัวเราะ', ' ', 'คือ', 'กู', 'ตลก', ' ', 'บาง', 'ปี', 'คน', 'ก็', 'ด่า', 'ท้อ', 'ก', 'ซิก', 'แมส', 'คิว', 'ลี', 'น', ' ', 'ถัดมา', 'อีก', 'ปี', 'มี', 'คอน', 'เท้น', 'แบ', 'มินิ', 'มัมป', 'ริ้น', 'เซ', 'สท', 'รี', 'ท', 'เม้น', ' ', 'คือ', 'กู', 'เข้าใจ', 'นะ', 'ว่า', 'เรื่อง', 'แบบนี้', 'มัน', 'ปัจเจก', ' ', 'แล้วแต่', 'คน', 'มัน', 'จะ', 'คบ', 'กัน', 'แหละ', ' ', 'แต่', 'จะ', 'บอ', 'กว่า', 'มัน', 'เลือก', 'เดิน', 'สอง', 'ทาง', 'บ่', 'ได้', 'นะ', 'อะไร', 'แบบนี้', ' ', 'อยาก', 'จะ', 'คอน', 'เซ', 'อ', 'เวที', 'ฟ', 'ก็', 'ต้อง', 'ไป', 'ทาง', 'นึง', ' ', 'อยาก', 'จะ', 'ลิเบอรัล', 'ก็', 'ไป', 'อีก', 'ทาง']"
1990081296421343699,twitter,post,https://x.com/merliahahahaha/status/1990081296421343699,text,2025-11-16T15:35:29.000Z,selenium_x_scraper_v1,เรื่องแบบนี้มันต้องช่วยกัน ถ้ารักกันจริง ไม่ใช่ไปคิดว่าอีกฝ่ายไม่รักเรา เลยจ่ายไม่ได้ (ผญ หลายคนเป็นอยู่นะ แค่ไม่ยอมรับ) ส่วนตัวก็คุยกะแฟนว่าช่วยกันหา สินสอดที่ได้มาไม่ได้ให้ครอบครัวฝ่ายใดยึดนะ เอาไว้เป็นทุนเป็นเงินของครอบครัวไปเลย,เรื่องแบบนี้มันต้องช่วยกัน ถ้ารักกันจริง ไม่ใช่ไปคิดว่าอีกฝ่ายไม่รักเรา เลยจ่ายไม่ได้ (ผญ หลายคนเป็นอยู่นะ แค่ไม่ยอมรับ) ส่วนตัวก็คุยกะแฟนว่าช่วยกันหา สินสอดที่ได้มาไม่ได้ให้ครอบครัวฝ่ายใดยึดนะ เอาไว้เป็นทุนเป็นเงินของครอบครัวไปเลย,2025-11-29 08:18:55,"['เรื่อง', 'แบบนี้', 'มัน', 'ต้อง', 'ช่วยกัน', ' ', 'ถ้า', 'รัก', 'กัน', 'จริง', ' ', 'ไม่', 'ใช่', 'ไป', 'คิด', 'ว่า', 'อีก', 'ฝ่าย', 'ไม่', 'รัก', 'เรา', ' ', 'เลย', 'จ่าย', 'ไม่', 'ได้', ' ', 'ผญ', ' ', 'หลาย', 'คน', 'เป็นอยู่', 'นะ', ' ', 'แค่', 'ไม่', 'ยอมรับ', ' ', 'ส่วนตัว', 'ก็', 'คุย', 'กะ', 'แฟน', 'ว่า', 'ช่วยกัน', 'หา', ' ', 'สินสอด', 'ที่', 'ได้มา', 'ไม่', 'ได้', 'ให้', 'ครอบครัว', 'ฝ่าย', 'ใด', 'ยึด', 'นะ', ' ', 'เอาไว้', 'เป็น', 'ทุน', 'เป็น', 'เงิน', 'ของ', 'ครอบครัว', 'ไป', 'เลย']"
1990294139746058540,twitter,post,https://x.com/missnight__/status/1990294139746058540,text,2025-11-17T05:41:15.000Z,selenium_x_scraper_v1,สินสอดจะมีก็ดี ไม่มีก็ได้ แต่ถ้ามีไม่ควรเรียกเยอะจนเป็นภาระหนี้สินต้องไปหยิบยืม ญาตินี่ผู้ชายคบกับแฟนมาหลายปี แต่เกือบไม่ได้แต่งเพราะฝ่ายบ้านผู้หญิงเรียกเยอะมาก(รวมทอง+เงินเกือบล้าน) วันไปขอพ่อแม่ผู้ชายบอกถ้าเขาไม่ตกลงที่เงิน1แสนก็ขับรถกลับบ้าน แล้วมันมีแบบเรียกเผื่อต่อด้วยนะ,สินสอดจะมีก็ดี ไม่มีก็ได้ แต่ถ้ามีไม่ควรเรียกเยอะจนเป็นภาระหนี้สินต้องไปหยิบยืม ญาตินี่ผู้ชายคบกับแฟนมาหลายปี แต่เกือบไม่ได้แต่งเพราะฝ่ายบ้านผู้หญิงเรียกเยอะมาก(รวมทอง+เงินเกือบล้าน) วันไปขอพ่อแม่ผู้ชายบอกถ้าเขาไม่ตกลงที่เงิน1แสนก็ขับรถกลับบ้าน แล้วมันมีแบบเรียกเผื่อต่อด้วยนะ,2025-11-29 08:18:55,"['สินสอด', 'จะ', 'มี', 'ก็ดี', ' ', 'ไม่', 'มี', 'ก็ได้', ' ', 'แต่', 'ถ้า', 'มี', 'ไม่', 'ควร', 'เรียก', 'เยอะ', 'จน', 'เป็น', 'ภาระ', 'หนี้สิน', 'ต้อง', 'ไป', 'หยิบยืม', ' ', 'ญาติ', 'นี่', 'ผู้ชาย', 'คบ', 'กับ', 'แฟน', 'มา', 'หลาย', 'ปี', ' ', 'แต่', 'เกือบ', 'ไม่', 'ได้', 'แต่ง', 'เพราะ', 'ฝ่าย', 'บ้าน', 'ผู้หญิง', 'เรียก', 'เยอะ', 'มาก', ' ', 'รวม', 'ทอง', ' ', 'เงิน', 'เกือบ', 'ล้าน', ' ', 'วัน', 'ไป', 'ขอ', 'พ่อแม่', 'ผู้ชาย', 'บอก', 'ถ้า', 'เขา', 'ไม่', 'ตกลง', 'ที่', 'เงิน', '1', 'แสน', 'ก็', 'ขับรถ', 'กลับบ้าน', ' ', 'แล้ว', 'มัน', 'มี', 'แบบ', 'เรียก', 'เผื่อ', 'ต่อ', 'ด้วย', 'นะ']"
1989908753081413920,twitter,post,https://x.com/peakland121/status/1989908753081413920,text,2025-11-16T04:09:52.000Z,selenium_x_scraper_v1,ถ้าอยากได้การซัพพอร์ตให้เลือกคนที่ซัพพอร์ตเราได้ อย่าไปเลือกพวกกัดก้อนเกลือกิน,ถ้าอยากได้การซัพพอร์ตให้เลือกคนที่ซัพพอร์ตเราได้ อย่าไปเลือกพวกกัดก้อนเกลือกิน,2025-11-29 08:18:55,"['ถ้า', 'อยาก', 'ได้การ', 'ซัพพอร์ต', 'ให้', 'เลือก', 'คน', 'ที่', 'ซัพพอร์ต', 'เรา', 'ได้', ' ', 'อย่า', 'ไป', 'เลือก', 'พวก', 'กัดก้อนเกลือกิน']"
1990236438487855321,twitter,post,https://x.com/Pleum_psk/status/1990236438487855321,text,2025-11-17T01:51:58.000Z,selenium_x_scraper_v1,เพื่อนมีแฟนเป็นคนใต้ เคยถามเรื่องจะแต่งก็มีเล่ามาว่าสินสอดฝั่งนู้นจะนิยมเป็นทอง คำถามคือถ้าสินสอดทอง 5 บาท ในยุคที่ทองหกหมื่น ไหนจะต้องไปจัดงานแต่ง 2 รอบ กทมรอบนึง จัดที่บ้านนู้นรอบนึง จะเอาเงินไหนไปแต่งวะ,เพื่อนมีแฟนเป็นคนใต้ เคยถามเรื่องจะแต่งก็มีเล่ามาว่าสินสอดฝั่งนู้นจะนิยมเป็นทอง คำถามคือถ้าสินสอดทอง 5 บาท ในยุคที่ทองหกหมื่น ไหนจะต้องไปจัดงานแต่ง 2 รอบ กทมรอบนึง จัดที่บ้านนู้นรอบนึง จะเอาเงินไหนไปแต่งวะ,2025-11-29 08:18:55,"['เพื่อน', 'มี', 'แฟน', 'เป็น', 'คนใต้', ' ', 'เคย', 'ถาม', 'เรื่อง', 'จะ', 'แต่ง', 'ก็', 'มี', 'เล่า', 'มา', 'ว่า', 'สินสอด', 'ฝั่ง', 'นู้น', 'จะ', 'นิยม', 'เป็น', 'ทอง', ' ', 'คำถาม', 'คือ', 'ถ้า', 'สินสอด', 'ทอง', ' ', '5', ' ', 'บาท', ' ', 'ใน', 'ยุค', 'ที่', 'ทอง', 'หก', 'หมื่น', ' ', 'ไหนจะ', 'ต้อง', 'ไป', 'จัด', 'งานแต่ง', ' ', '2', ' ', 'รอบ', ' ', 'กทม', 'รอบ', 'นึง', ' ', 'จัด', 'ที่', 'บ้าน', 'นู้น', 'รอบ', 'นึง', ' ', 'จะ', 'เอา', 'เงิน', 'ไหน', 'ไป', 'แต่ง', 'วะ']"
1989925129909145947,twitter,post,https://x.com/wannabeurgirlxo/status/1989925129909145947,text,2025-11-16T05:14:56.000Z,selenium_x_scraper_v1,อันนี้จริงแบบมากๆเลยครับ ยิ่งเราแต่งตัวบอยๆ สังคมจะคาดหวังให้เราทรีตสาวเหมือนสเตรทอ่ะ ทั้งที่ก็ผญเหมือนกัน,อันนี้จริงแบบมากๆเลยครับ ยิ่งเราแต่งตัวบอยๆ สังคมจะคาดหวังให้เราทรีตสาวเหมือนสเตรทอ่ะ ทั้งที่ก็ผญเหมือนกัน,2025-11-29 08:18:55,"['อันนี้', 'จริง', 'แบบ', 'มาก', 'ๆ', 'เลย', 'ครับ', ' ', 'ยิ่ง', 'เรา', 'แต่งตัว', 'บอย', 'ๆ', ' ', 'สังคม', 'จะ', 'คาดหวัง', 'ให้', 'เรา', 'ท', 'รีต', 'สาว', 'เหมือน', 'ส', 'เต', 'รท', 'อ่ะ', ' ', 'ทั้งที่', 'ก็', 'ผญ', 'เหมือนกัน']"
1989946466820108744,twitter,post,https://x.com/miramikao/status/1989946466820108744,text,2025-11-16T06:39:43.000Z,selenium_x_scraper_v1,ใช่มั้ยคะ คสพ.ญญ.ยังไม่รอดพ้นปิตา,ใช่มั้ยคะ คสพ.ญญ.ยังไม่รอดพ้นปิตา,2025-11-29 08:18:55,"['ใช่', 'มั้ย', 'คะ', ' ', 'คสพ', '.', 'ญญ', '.', 'ยัง', 'ไม่', 'รอดพ้น', 'ปิตา']"
1990278863327572223,twitter,post,https://x.com/sasanont/status/1990278863327572223,text,2025-11-17T04:40:33.000Z,selenium_x_scraper_v1,นี่คบพี่สาวคนสวย พี่สาวคนสวยนี่มัดมือชกเขาจะจ่ายเองให้ตลอดทุกอย่างอะ,นี่คบพี่สาวคนสวย พี่สาวคนสวยนี่มัดมือชกเขาจะจ่ายเองให้ตลอดทุกอย่างอะ,2025-11-29 08:18:55,"['นี่', 'คบ', 'พี่สาว', 'คนสวย', ' ', 'พี่สาว', 'คนสวย', 'นี่', 'มัดมือชก', 'เขา', 'จะ', 'จ่าย', 'เอง', 'ให้', 'ตลอด', 'ทุกอย่าง', 'อะ']"
1990530002451149137,twitter,post,https://x.com/donttouchhhme/status/1990530002451149137,text,2025-11-17T21:18:29.000Z,selenium_x_scraper_v1,จริงค่ะ เคยมีแฟนเป็นทอม ไปไหนให้เราออกเงินก่อนตลอด แล้วก็ติดเงินเราเป็นพันทั้งที่ตอนนั้นเราเป็นแค่เด็กม.ปลายที่อยู่หอนอก,จริงค่ะ เคยมีแฟนเป็นทอม ไปไหนให้เราออกเงินก่อนตลอด แล้วก็ติดเงินเราเป็นพันทั้งที่ตอนนั้นเราเป็นแค่เด็กม.ปลายที่อยู่หอนอก,2025-11-29 08:18:55,"['จริง', 'ค่ะ', ' ', 'เคย', 'มี', 'แฟน', 'เป็น', 'ทอม', ' ', 'ไป', 'ไหน', 'ให้', 'เรา', 'ออก', 'เงิน', 'ก่อน', 'ตลอด', ' ', 'แล้วก็', 'ติดเงิน', 'เรา', 'เป็น', 'พัน', 'ทั้งที่', 'ตอนนั้น', 'เรา', 'เป็น', 'แค่', 'เด็ก', 'ม.', 'ปลาย', 'ที่อยู่', 'หอ', 'นอก']"
1990522416217670062,twitter,post,https://x.com/NutPainyahiko/status/1990522416217670062,text,2025-11-17T20:48:20.000Z,selenium_x_scraper_v1,ติดหล่มอีสานกุบอกเลย หลายพื้นที่ในไทยผู้หญิงต้องเอาเงินเอาทรัพย์สินมาวางทบให้คู่สมรส ยกเว้นอีสาน ที่มันจะเอาของอีกฝ่ายอย่างเดียว,ติดหล่มอีสานกุบอกเลย หลายพื้นที่ในไทยผู้หญิงต้องเอาเงินเอาทรัพย์สินมาวางทบให้คู่สมรส ยกเว้นอีสาน ที่มันจะเอาของอีกฝ่ายอย่างเดียว,2025-11-29 08:18:55,"['ติดหล่ม', 'อีสาน', 'กุ', 'บอก', 'เลย', ' ', 'หลาย', 'พื้นที่', 'ใน', 'ไทย', 'ผู้หญิง', 'ต้อง', 'เอา', 'เงิน', 'เอา', 'ทรัพย์สิน', 'มา', 'วาง', 'ทบ', 'ให้', 'คู่สมรส', ' ', 'ยกเว้น', 'อีสาน', ' ', 'ที่', 'มัน', 'จะ', 'เอา', 'ของ', 'อีก', 'ฝ่าย', 'อย่าง', 'เดียว']"
1990248903250497732,twitter,post,https://x.com/Startwalk2/status/1990248903250497732,text,2025-11-17T02:41:30.000Z,selenium_x_scraper_v1,จริง เจอแบบนี้เลย โคตรสงสารตัวเองเลย,จริง เจอแบบนี้เลย โคตรสงสารตัวเองเลย,2025-11-29 08:18:55,"['จริง', ' ', 'เจอ', 'แบบนี้', 'เลย', ' ', 'โคตร', 'สงสาร', 'ตัวเอง', 'เลย']"
1989672064622751916,twitter,post,https://x.com/inn_nice/status/1989672064622751916,text,2025-11-15T12:29:21.000Z,selenium_x_scraper_v1,อันนี้คือแมสไหมอ่ะ ขึ้นเตือนตลอดเลย,อันนี้คือแมสไหมอ่ะ ขึ้นเตือนตลอดเลย,2025-11-29 08:18:55,"['อันนี้', 'คือ', 'แมส', 'ไหม', 'อ่ะ', ' ', 'ขึ้น', 'เตือน', 'ตลอด', 'เลย']"
1989666521665384522,twitter,post,https://x.com/pla_mako/status/1989666521665384522,text,2025-11-15T12:07:19.000Z,selenium_x_scraper_v1,อาจจะใช่หรือเปล่าไม่รู้ ส่วนตัวเราคิดว่า เขาก็ทำให้เราเป็นคนที่ดีขึ้นกว่าเดิม และทำให้เราได้เจอคนที่ดีกว่าเขาเหมือนกัน ประมาณว่าเรากับเขามาเพื่อเป็นบทเรียนให้กันและกัน ต้องจบบทเรียนกับเขา และเติบโตจากบทเรียนนั้น เพื่อเจอคนที่ใช่กว่าค่ะ,อาจจะใช่หรือเปล่าไม่รู้ ส่วนตัวเราคิดว่า เขาก็ทำให้เราเป็นคนที่ดีขึ้นกว่าเดิม และทำให้เราได้เจอคนที่ดีกว่าเขาเหมือนกัน ประมาณว่าเรากับเขามาเพื่อเป็นบทเรียนให้กันและกัน ต้องจบบทเรียนกับเขา และเติบโตจากบทเรียนนั้น เพื่อเจอคนที่ใช่กว่าค่ะ,2025-11-29 08:18:55,"['อาจจะ', 'ใช่', 'หรือเปล่า', 'ไม่', 'รู้', ' ', 'ส่วน', 'ตัวเรา', 'คิด', 'ว่า', ' ', 'เขา', 'ก็', 'ทำให้', 'เรา', 'เป็น', 'คน', 'ที่', 'ดีขึ้น', 'กว่า', 'เดิม', ' ', 'และ', 'ทำให้', 'เรา', 'ได้', 'เจอ', 'คน', 'ที่', 'ดีกว่า', 'เขา', 'เหมือนกัน', ' ', 'ประมาณ', 'ว่า', 'เรา', 'กับ', 'เขา', 'มา', 'เพื่อ', 'เป็น', 'บทเรียน', 'ให้', 'กันและกัน', ' ', 'ต้อง', 'จบ', 'บทเรียน', 'กับ', 'เขา', ' ', 'และ', 'เติบโต', 'จาก', 'บทเรียน', 'นั้น', ' ', 'เพื่อ', 'เจอ', 'คน', 'ที่', 'ใช่', 'กว่า', 'ค่ะ']"
1989672818091671728,twitter,post,https://x.com/inn_nice/status/1989672818091671728,text,2025-11-15T12:32:20.000Z,selenium_x_scraper_v1,ถ้าใน คสพ มันจบแบบนั้นก็ดีค่ะ แต่ส่วนใหญ่ที่เจอ ผช ไปได้ดี แล้วทิ้งอีกคนไว้แบบไม่เหลือเยื่อใย เพราะ ผญ ส่วนใหญ่คนทุ่มทั้งเวลา เงิน อนาคตให้กับ ผช ที่รัก,ถ้าใน คสพ มันจบแบบนั้นก็ดีค่ะ แต่ส่วนใหญ่ที่เจอ ผช ไปได้ดี แล้วทิ้งอีกคนไว้แบบไม่เหลือเยื่อใย เพราะ ผญ ส่วนใหญ่คนทุ่มทั้งเวลา เงิน อนาคตให้กับ ผช ที่รัก,2025-11-29 08:18:55,"['ถ้า', 'ใน', ' ', 'คสพ', ' ', 'มัน', 'จบ', 'แบบ', 'นั้น', 'ก็ดี', 'ค่ะ', ' ', 'แต่', 'ส่วนใหญ่', 'ที่', 'เจอ', ' ', 'ผช', ' ', 'ไป', 'ได้ดี', ' ', 'แล้ว', 'ทิ้ง', 'อีก', 'คน', 'ไว้', 'แบบ', 'ไม่', 'เหลือ', 'เยื่อใย', ' ', 'เพราะ', ' ', 'ผญ', ' ', 'ส่วนใหญ่', 'คน', 'ทุ่ม', 'ทั้ง', 'เวลา', ' ', 'เงิน', ' ', 'อนาคต', 'ให้', 'กับ', ' ', 'ผช', ' ', 'ที่รัก']"
