id,platform,platform_type,url,content_type,timestamp,scraper_module,text,raw_text,scrape_date,tokens
1989879094302158983,twitter,post,https://x.com/chomnard13/status/1989879094302158983,text,2025-11-16T02:12:00.000Z,selenium_x_scraper_v1,"สมัยนี้ป.ตรีบางสาย อย่างสายวิชาชีพเงินเดือนเริ่มต้นแบบ new เลยก็ 22-23k++ แล้วจ้า เฉพาะเงินเดือนนะไม่รวม OT หรือเงินเสริมอื่นๆ
เพราะงั้นตั้งสเปค 25k นี่ยังถือว่าต่ำไปด้วยซ้ำเหอะ","สมัยนี้ป.ตรีบางสาย อย่างสายวิชาชีพเงินเดือนเริ่มต้นแบบ new เลยก็ 22-23k++ แล้วจ้า เฉพาะเงินเดือนนะไม่รวม OT หรือเงินเสริมอื่นๆ
เพราะงั้นตั้งสเปค 25k นี่ยังถือว่าต่ำไปด้วยซ้ำเหอะ",2025-11-29 08:18:55,"['สมัยนี้', 'ป.', 'ตรี', 'บาง', 'สาย', ' ', 'อย่าง', 'สาย', 'วิชาชีพ', 'เงินเดือน', 'เริ่ม', 'ต้นแบบ', ' ', 'new', ' ', 'เลย', 'ก็', ' ', '22', ' ', '23', 'k', ' ', 'แล้ว', 'จ้า', ' ', 'เฉพาะ', 'เงินเดือน', 'นะ', 'ไม่', 'รวม', ' ', 'ot', ' ', 'หรือ', 'เงิน', 'เสริม', 'อื่นๆ', ' ', 'เพราะ', 'งั้น', 'ตั้ง', 'สเปค', ' ', '25', 'k', ' ', 'นี่', 'ยัง', 'ถือว่า', 'ต่ำ', 'ไป', 'ด้วยซ้ำ', 'เหอะ']"
1989742362768326862,twitter,post,https://x.com/Pmilecutecute/status/1989742362768326862,text,2025-11-15T17:08:41.000Z,selenium_x_scraper_v1,25 นี่เดือนชนเดือนละนะ ดูค่าครองชีพ ปจบ ด้วย,25 นี่เดือนชนเดือนละนะ ดูค่าครองชีพ ปจบ ด้วย,2025-11-29 08:18:55,"['25', ' ', 'นี่', 'เดือน', 'ชน', 'เดือน', 'ละ', 'นะ', ' ', 'ดู', 'ค่าครองชีพ', ' ', 'ปจบ', ' ', 'ด้วย']"
1989766808715628948,twitter,post,https://x.com/tapple1806/status/1989766808715628948,text,2025-11-15T18:45:49.000Z,selenium_x_scraper_v1,แล้วแต่ละคนคิดว่าอิเงินเดือน25kนี่คือ เงินเดือนสูง????  ก็คงสูงประมาณนึงแหละถ้าได้ตอนอายุไม่เกิน23 แต่ถึงขั้นถามว่า คิดว่าคน25kนี่เค้าจะเอาเหรอ โอ้ คิดไรอยู่ แล้วคนถามอายุเท่าไหร่น่ะ loserชิบหาย...,แล้วแต่ละคนคิดว่าอิเงินเดือน25kนี่คือ เงินเดือนสูง????  ก็คงสูงประมาณนึงแหละถ้าได้ตอนอายุไม่เกิน23 แต่ถึงขั้นถามว่า คิดว่าคน25kนี่เค้าจะเอาเหรอ โอ้ คิดไรอยู่ แล้วคนถามอายุเท่าไหร่น่ะ loserชิบหาย...,2025-11-29 08:18:55,"['แล้ว', 'แต่ละคน', 'คิด', 'ว่า', 'อิ', 'เงินเดือน', '25', 'k', 'นี่', 'คือ', ' ', 'เงินเดือน', 'สูง', '?', ' ', 'ก็', 'คง', 'สูง', 'ประมาณ', 'นึง', 'แหละ', 'ถ้า', 'ได้', 'ตอน', 'อายุ', 'ไม่', 'เกิน', '23', ' ', 'แต่', 'ถึงขั้น', 'ถาม', 'ว่า', ' ', 'คิด', 'ว่า', 'คน', '25', 'k', 'นี่', 'เค้า', 'จะ', 'เอา', 'เหรอ', ' ', 'โอ้', ' ', 'คิด', 'ไร', 'อยู่', ' ', 'แล้ว', 'คน', 'ถาม', 'อายุ', 'เท่าไหร่', 'น่ะ', ' ', 'loser', 'ชิบหาย', '...']"
1989855648604143952,twitter,post,https://x.com/FullpowerFamily/status/1989855648604143952,text,2025-11-16T00:38:51.000Z,selenium_x_scraper_v1,ผู้ชายในเฟสมีแบบนี้เยอะมากแปลกจริงๆครับ,ผู้ชายในเฟสมีแบบนี้เยอะมากแปลกจริงๆครับ,2025-11-29 08:18:55,"['ผู้ชาย', 'ใน', 'เฟส', 'มี', 'แบบนี้', 'เยอะ', 'มาก', 'แปลก', 'จริงๆ', 'ครับ']"
1989703357024375114,twitter,post,https://x.com/jarujuning/status/1989703357024375114,text,2025-11-15T14:33:41.000Z,selenium_x_scraper_v1,เงินเดือน 25000 ไม่ได้รวยนะ ยิ่งในกทม.,เงินเดือน 25000 ไม่ได้รวยนะ ยิ่งในกทม.,2025-11-29 08:18:55,"['เงินเดือน', ' ', 'หัวเราะ', ' ', 'ไม่', 'ได้', 'รวย', 'นะ', ' ', 'ยิ่ง', 'ใน', 'กทม.']"
1989727894323827166,twitter,post,https://x.com/chompoo_queen/status/1989727894323827166,text,2025-11-15T16:11:12.000Z,selenium_x_scraper_v1,ข้าราชการ ต่างจังหวัด ก็ 25000 กันทั้งนั้นแล้วนะ,ข้าราชการ ต่างจังหวัด ก็ 25000 กันทั้งนั้นแล้วนะ,2025-11-29 08:18:55,"['ข้าราชการ', ' ', 'ต่างจังหวัด', ' ', 'ก็', ' ', 'หัวเราะ', ' ', 'กัน', 'ทั้งนั้น', 'แล้ว', 'นะ']"
1989887100297384443,twitter,post,https://x.com/wut_nuttawut/status/1989887100297384443,text,2025-11-16T02:43:49.000Z,selenium_x_scraper_v1,จริงมาก,จริงมาก,2025-11-29 08:18:55,"['จริง', 'มาก']"
1989949782757183987,twitter,post,https://x.com/tweetymaywipwip/status/1989949782757183987,text,2025-11-16T06:52:54.000Z,selenium_x_scraper_v1,"ผญ.คนนี้มีแนวโน้มได้แฟนเงินเงินมากกว่า25,000 บาทแน่ๆ","ผญ.คนนี้มีแนวโน้มได้แฟนเงินเงินมากกว่า25,000 บาทแน่ๆ",2025-11-29 08:18:55,"['ผญ.', 'คน', 'นี้', 'มีแนวโน้ม', 'ได้', 'แฟน', 'เงิน', 'เงิน', 'มากกว่า', '25,000', ' ', 'บาท', 'แน่ๆ']"
1990246934238675098,twitter,post,https://x.com/TT3060905159563/status/1990246934238675098,text,2025-11-17T02:33:40.000Z,selenium_x_scraper_v1,พวก ผช ตกเกรดก็งี้แหละ,พวก ผช ตกเกรดก็งี้แหละ,2025-11-29 08:18:55,"['พวก', ' ', 'ผช', ' ', 'ตก', 'เกรด', 'ก็', 'งี้', 'แหละ']"
1989878219865293135,twitter,post,https://x.com/attana0022/status/1989878219865293135,text,2025-11-16T02:08:32.000Z,selenium_x_scraper_v1,"คนรวยที่ใหนเงินเดือน 25,000 เอาใหนมารวยก่อน ค่าบ้าน ค่าน้ำค่าไฟ ค่าโทรศัพท์ ค่าน้ำมันรถ ใดๆ เหลือให้กินข้าวกี่ตังกัน 25,000 แบบไม่มีหนี้คือพอเลี้ยงตัวเองได้ แบบไม่เป็นภาระคู่ชีวิตแค่นั้น แต่ถ้ามีคชจ.เพิ่มเติมแบบต้องส่งที่บ้าน ผ่อนบ้าน ผ่อนรถ นี่คือน่าจะไม่พอใช้ละ","คนรวยที่ใหนเงินเดือน 25,000 เอาใหนมารวยก่อน ค่าบ้าน ค่าน้ำค่าไฟ ค่าโทรศัพท์ ค่าน้ำมันรถ ใดๆ เหลือให้กินข้าวกี่ตังกัน 25,000 แบบไม่มีหนี้คือพอเลี้ยงตัวเองได้ แบบไม่เป็นภาระคู่ชีวิตแค่นั้น แต่ถ้ามีคชจ.เพิ่มเติมแบบต้องส่งที่บ้าน ผ่อนบ้าน ผ่อนรถ นี่คือน่าจะไม่พอใช้ละ",2025-11-29 08:18:55,"['คนรวย', 'ที่', 'ใหน', 'เงินเดือน', ' ', '25,000', ' ', 'เอา', 'ใหน', 'มา', 'รวย', 'ก่อน', ' ', 'ค่า', 'บ้าน', ' ', 'ค่าน้ำค่าไฟ', ' ', 'ค่าโทรศัพท์', ' ', 'ค่า', 'น้ำมันรถ', ' ', 'ใดๆ', ' ', 'เหลือ', 'ให้', 'กินข้าว', 'กี่', 'ตัง', 'กัน', ' ', '25,000', ' ', 'แบบ', 'ไม่', 'มี', 'หนี้', 'คือ', 'พอ', 'เลี้ยง', 'ตัวเอง', 'ได้', ' ', 'แบบ', 'ไม่', 'เป็น', 'ภาระ', 'คู่ชีวิต', 'แค่นั้น', ' ', 'แต่', 'ถ้า', 'มี', 'คช', 'จ.', 'เพิ่มเติม', 'แบบ', 'ต้อง', 'ส่ง', 'ที่', 'บ้าน', ' ', 'ผ่อน', 'บ้าน', ' ', 'ผ่อน', 'รถ', ' ', 'นี่', 'คือ', 'น่าจะ', 'ไม่', 'พอใช้', 'ละ']"
1989904957525660018,twitter,post,https://x.com/sportero25/status/1989904957525660018,text,2025-11-16T03:54:47.000Z,selenium_x_scraper_v1,เดียวนี้คนโสดถึงเยอะ  ผู้ชายก็เอากันเอง เข้าใจกันมากกว่า ช่วยกันคนละไม้คนละมือสร้างชีวิตไปกันไป  เมื่อความคิดไม่ตรงกัน ก็ไม่จำเป็นต้องไปด้วยกัน เป็นเรื่องธรรมชาติ,เดียวนี้คนโสดถึงเยอะ  ผู้ชายก็เอากันเอง เข้าใจกันมากกว่า ช่วยกันคนละไม้คนละมือสร้างชีวิตไปกันไป  เมื่อความคิดไม่ตรงกัน ก็ไม่จำเป็นต้องไปด้วยกัน เป็นเรื่องธรรมชาติ,2025-11-29 08:18:55,"['เดียว', 'นี้', 'คนโสด', 'ถึง', 'เยอะ', ' ', 'ผู้ชาย', 'ก็', 'เอา', 'กันเอง', ' ', 'เข้าใจ', 'กัน', 'มากกว่า', ' ', 'ช่วยกัน', 'คนละไม้คนละมือ', 'สร้าง', 'ชีวิต', 'ไป', 'กัน', 'ไป', ' ', 'เมื่อ', 'ความคิด', 'ไม่', 'ตรงกัน', ' ', 'ก็', 'ไม่', 'จำเป็นต้อง', 'ไป', 'ด้วยกัน', ' ', 'เป็นเรื่อง', 'ธรรมชาติ']"
1989847081042022461,twitter,post,https://x.com/Lifejust_aDream/status/1989847081042022461,text,2025-11-16T00:04:48.000Z,selenium_x_scraper_v1,หาเดือนนึงได้ 7แสนถึง 1 ล้าน ยังไม่เคยคิดว่าตัวเองรวยเลย  สำหรับผมรวยหมายถึง มีอิสระภาพทางการเงินมากกว่า,หาเดือนนึงได้ 7แสนถึง 1 ล้าน ยังไม่เคยคิดว่าตัวเองรวยเลย  สำหรับผมรวยหมายถึง มีอิสระภาพทางการเงินมากกว่า,2025-11-29 08:18:55,"['หา', 'เดือน', 'นึง', 'ได้', ' ', '7', 'แสน', 'ถึง', ' ', '1', ' ', 'ล้าน', ' ', 'ยัง', 'ไม่', 'เคย', 'คิด', 'ว่า', 'ตัวเอง', 'รวย', 'เลย', ' ', 'สำหรับ', 'ผม', 'รวย', 'หมายถึง', ' ', 'มีอิสระ', 'ภาพ', 'ทางการเงิน', 'มากกว่า']"
1990069757165687219,twitter,post,https://x.com/JynX79771139/status/1990069757165687219,text,2025-11-16T14:49:38.000Z,selenium_x_scraper_v1,"ผมว่าบอกกันแบบนี้ง่ายดีนะ ผมชอบด้วย เราจะได้รู้ตัวเองว่าคู่ควรกับเป้าหมายของเค้าไหม
ผมชอบผู้หญิงที่บอกเราตรงๆได้ อยากกินอะไร ทำอะไรก็บอกมาตรงๆเลย ผมยินดีทำให้อย่างเต็มที่แน่นอน","ผมว่าบอกกันแบบนี้ง่ายดีนะ ผมชอบด้วย เราจะได้รู้ตัวเองว่าคู่ควรกับเป้าหมายของเค้าไหม
ผมชอบผู้หญิงที่บอกเราตรงๆได้ อยากกินอะไร ทำอะไรก็บอกมาตรงๆเลย ผมยินดีทำให้อย่างเต็มที่แน่นอน",2025-11-29 08:18:55,"['ผม', 'ว่า', 'บอก', 'กัน', 'แบบนี้', 'ง่าย', 'ดี', 'นะ', ' ', 'ผม', 'ชอบ', 'ด้วย', ' ', 'เรา', 'จะ', 'ได้', 'รู้', 'ตัวเอง', 'ว่า', 'คู่ควร', 'กับ', 'เป้าหมาย', 'ของ', 'เค้า', 'ไหม', ' ', 'ผม', 'ชอบ', 'ผู้หญิง', 'ที่', 'บอก', 'เรา', 'ตรงๆ', 'ได้', ' ', 'อยาก', 'กิน', 'อะไร', ' ', 'ทำ', 'อะไร', 'ก็', 'บอก', 'มา', 'ตรงๆ', 'เลย', ' ', 'ผม', 'ยินดี', 'ทำให้', 'อย่าง', 'เต็มที่', 'แน่นอน']"
1989574487130738913,twitter,post,https://x.com/godbewithmepls/status/1989574487130738913,text,2025-11-14T12:58:47.000Z,selenium_x_scraper_v1,ตั้งเป้าหาเงินเดือนแค่ 25k กับไม่กินเหล้าสูบบุหรี่ ไม่มีปห.การเงิน (คือหาสเปคต่ำกว่าที่ตัวเองทำได้ด้วยซ้ำ) โดนรุมด่าว่าหัวสูง โอ้ยตายอีพวกชายไทย พวกมึงนี่มันชั้นต่ำลูซเซ้อจริงๆเนาะ,ตั้งเป้าหาเงินเดือนแค่ 25k กับไม่กินเหล้าสูบบุหรี่ ไม่มีปห.การเงิน (คือหาสเปคต่ำกว่าที่ตัวเองทำได้ด้วยซ้ำ) โดนรุมด่าว่าหัวสูง โอ้ยตายอีพวกชายไทย พวกมึงนี่มันชั้นต่ำลูซเซ้อจริงๆเนาะ,2025-11-29 08:18:55,"['ตั้งเป้า', 'หา', 'เงินเดือน', 'แค่', ' ', '25', 'k', ' ', 'กับ', 'ไม่', 'กิน', 'เหล้า', 'สูบบุหรี่', ' ', 'ไม่', 'มี', 'ปห', '.', 'การเงิน', ' ', 'คือ', 'หา', 'สเปค', 'ต่ำกว่า', 'ที่', 'ตัวเอง', 'ทำได้', 'ด้วยซ้ำ', ' ', 'โดน', 'รุม', 'ด่าว่า', 'หัวสูง', ' ', 'โอ้ย', 'ตาย', 'อี', 'พวก', 'ชาย', 'ไทย', ' ', 'พวก', 'มึง', 'นี่', 'มัน', 'ชั้นต่ำ', 'ลูซเซ้อ', 'จริงๆ', 'เนาะ']"
1989737800779141354,twitter,post,https://x.com/NKate365/status/1989737800779141354,text,2025-11-15T16:50:33.000Z,selenium_x_scraper_v1,"ทัศนคติพวกนี้น่าจะเป็นอีกสาเหตุให้ผู้หญิงไทยอยากแต่งงานสร้างครอบครัวน้อยลง และไม่อยากมีลูก
อีกนัยหนึ่งมีผู้ชายไทยจำนวนมากคุณสมบัติไม่ถึงมาตรฐานที่จำเป็นต่อการมีครอบครัวมีภรรยาและลูก","ทัศนคติพวกนี้น่าจะเป็นอีกสาเหตุให้ผู้หญิงไทยอยากแต่งงานสร้างครอบครัวน้อยลง และไม่อยากมีลูก
อีกนัยหนึ่งมีผู้ชายไทยจำนวนมากคุณสมบัติไม่ถึงมาตรฐานที่จำเป็นต่อการมีครอบครัวมีภรรยาและลูก",2025-11-29 08:18:55,"['ทัศนคติ', 'พวก', 'นี้', 'น่าจะเป็น', 'อีก', 'สาเหตุ', 'ให้', 'ผู้หญิง', 'ไทย', 'อยาก', 'แต่งงาน', 'สร้าง', 'ครอบครัว', 'น้อยลง', ' ', 'และ', 'ไม่', 'อยาก', 'มีลูก', ' ', 'อีกนัยหนึ่ง', 'มี', 'ผู้ชาย', 'ไทย', 'จำนวนมาก', 'คุณสมบัติ', 'ไม่', 'ถึง', 'มาตรฐาน', 'ที่', 'จำ', 'เป็นต่อ', 'การ', 'มีครอบครัว', 'มี', 'ภรรยา', 'และ', 'ลูก']"
1989796294559469844,twitter,post,https://x.com/am_isomeone/status/1989796294559469844,text,2025-11-15T20:42:59.000Z,selenium_x_scraper_v1,"งงมาก ขอคนดูดี รักครอบครัว เรียนจบ ไม่ติดยา = หัวสูง

ไอ้คนที่ด่าว่าเค้าหัวสูงนี่คงเป็นพวกหน้าเงือกไม่พอ ยังเจ้าชู้ ซ้อมลูกเมีย เรียนไม่จบ และติดยาด้วยสินะ…","งงมาก ขอคนดูดี รักครอบครัว เรียนจบ ไม่ติดยา = หัวสูง

ไอ้คนที่ด่าว่าเค้าหัวสูงนี่คงเป็นพวกหน้าเงือกไม่พอ ยังเจ้าชู้ ซ้อมลูกเมีย เรียนไม่จบ และติดยาด้วยสินะ…",2025-11-29 08:18:55,"['งง', 'มาก', ' ', 'ขอ', 'คน', 'ดูดี', ' ', 'รัก', 'ครอบครัว', ' ', 'เรียนจบ', ' ', 'ไม่', 'ติดยา', ' ', 'หัวสูง', ' ', 'ไอ้', 'คน', 'ที่', 'ด่าว่า', 'เค้า', 'หัวสูง', 'นี่', 'คง', 'เป็น', 'พวก', 'หน้า', 'เงือก', 'ไม่', 'พอ', ' ', 'ยัง', 'เจ้าชู้', ' ', 'ซ้อม', 'ลูก', 'เมีย', ' ', 'เรียน', 'ไม่', 'จบ', ' ', 'และ', 'ติดยา', 'ด้วย', 'สิ', 'นะ']"
1989728156170031458,twitter,post,https://x.com/knuddelkmeow/status/1989728156170031458,text,2025-11-15T16:12:14.000Z,selenium_x_scraper_v1,ใส่not all ไม่เป็นกันหรอชายไทย,ใส่not all ไม่เป็นกันหรอชายไทย,2025-11-29 08:18:55,"['ใส่', 'not', ' ', 'all', ' ', 'ไม่', 'เป็น', 'กัน', 'หรอ', 'ชาย', 'ไทย']"
1989712117508051109,twitter,post,https://x.com/mamiluv_u/status/1989712117508051109,text,2025-11-15T15:08:30.000Z,selenium_x_scraper_v1,หัวหน้ายามตึกที่ทำงานก็เงินเดือนประมาณ25k แต่แกอายุ50+แล้วยังเช่าบ้านอยู่เลย รวยแล้วหรอ,หัวหน้ายามตึกที่ทำงานก็เงินเดือนประมาณ25k แต่แกอายุ50+แล้วยังเช่าบ้านอยู่เลย รวยแล้วหรอ,2025-11-29 08:18:55,"['หัวหน้า', 'ยาม', 'ตึก', 'ที่ทำงาน', 'ก็', 'เงินเดือน', 'ประมาณ', '25', 'k', ' ', 'แต่', 'แก', 'อายุ', '50', ' ', 'แล้ว', 'ยัง', 'เช่าบ้าน', 'อยู่เลย', ' ', 'รวย', 'แล้ว', 'หรอ']"
1989716474571694150,twitter,post,https://x.com/Kit556397878116/status/1989716474571694150,text,2025-11-15T15:25:49.000Z,selenium_x_scraper_v1,อย่าเพิ่งด่สเหมาสิครับ อย่างน้อยๆ ก็มีชายไทย หลายคน ที่งงกับคนที่ด่า และ คิดว่า เขาตส่งเกณฑ์ได้สมเหตุสมผล,อย่าเพิ่งด่สเหมาสิครับ อย่างน้อยๆ ก็มีชายไทย หลายคน ที่งงกับคนที่ด่า และ คิดว่า เขาตส่งเกณฑ์ได้สมเหตุสมผล,2025-11-29 08:18:55,"['อย่า', 'เพิ่ง', 'ด่ส', 'เหมา', 'สิ', 'ครับ', ' ', 'อย่าง', 'น้อย', 'ๆ', ' ', 'ก็', 'มี', 'ชาย', 'ไทย', ' ', 'หลาย', 'คน', ' ', 'ที่', 'งง', 'กับ', 'คน', 'ที่', 'ด่า', ' ', 'และ', ' ', 'คิด', 'ว่า', ' ', 'เขา', 'ต', 'ส่ง', 'เกณฑ์', 'ได้', 'สมเหตุสมผล']"
1989756689906896913,twitter,post,https://x.com/PongLnwZa009/status/1989756689906896913,text,2025-11-15T18:05:37.000Z,selenium_x_scraper_v1,คนละสังคม มันก็ยึดถือแนวคิดค่านิยมคนละแบบ กูยังเห็นพวกมึงรุมด่าตอน ผช. เค้าตั้งสเปคหา ผญ. ทำแกงส้มเป็น อยู่เลยนะ ในสังคมเค้า ผญ. ทำงานบ้านไม่เป็นก็ loser ไง จะไปทำกับข้าวให้ลูกให้ผัวกินได้ไงในอนาคต เหมือนสังคมพวกมีงก็คาดหวังให้ ผช. ต้องเงินเดือนเยอะกว่า เพื่อมาแบกคุณภาพชีวิตบ้าน,คนละสังคม มันก็ยึดถือแนวคิดค่านิยมคนละแบบ กูยังเห็นพวกมึงรุมด่าตอน ผช. เค้าตั้งสเปคหา ผญ. ทำแกงส้มเป็น อยู่เลยนะ ในสังคมเค้า ผญ. ทำงานบ้านไม่เป็นก็ loser ไง จะไปทำกับข้าวให้ลูกให้ผัวกินได้ไงในอนาคต เหมือนสังคมพวกมีงก็คาดหวังให้ ผช. ต้องเงินเดือนเยอะกว่า เพื่อมาแบกคุณภาพชีวิตบ้าน,2025-11-29 08:18:55,"['คนละ', 'สังคม', ' ', 'มัน', 'ก็', 'ยึดถือ', 'แนวคิด', 'ค่านิยม', 'คนละ', 'แบบ', ' ', 'กู', 'ยัง', 'เห็น', 'พวก', 'มึง', 'รุม', 'ด่า', 'ตอน', ' ', 'ผช.', ' ', 'เค้า', 'ตั้ง', 'สเปค', 'หา', ' ', 'ผญ.', ' ', 'ทำ', 'แกงส้ม', 'เป็น', ' ', 'อยู่เลย', 'นะ', ' ', 'ใน', 'สังคม', 'เค้า', ' ', 'ผญ.', ' ', 'ทำงานบ้าน', 'ไม่', 'เป็น', 'ก็', ' ', 'loser', ' ', 'ไง', ' ', 'จะ', 'ไป', 'ทำกับข้าว', 'ให้', 'ลูก', 'ให้', 'ผัว', 'กิน', 'ได้', 'ไง', 'ในอนาคต', ' ', 'เหมือน', 'สังคม', 'พวก', 'มี', 'ง', 'ก็', 'คาดหวัง', 'ให้', ' ', 'ผช.', ' ', 'ต้อง', 'เงินเดือน', 'เยอะ', 'กว่า', ' ', 'เพื่อ', 'มา', 'แบก', 'คุณภาพชีวิต', 'บ้าน']"
