id,platform,platform_type,url,content_type,timestamp,scraper_module,text,raw_text,scrape_date,tokens
1989677292105470138,twitter,post,https://x.com/pegasusna/status/1989677292105470138,text,2025-11-15T12:50:07.000Z,selenium_x_scraper_v1,คนสร้างมาด้วยกันส่วนมากจะโปรไฟล์ระดับเดียวกันหรือใกล้เคียงกันเริ่มจากระดับธรรมดา บางคนติดลบ พอสร้างตัวได้ ฐานะเพิ่มขึ้น ระดับดีขึ้น ก้อเริ่มมองหาผู้หญิงระดับเดียวกันแต่ไม่ได้มองผู้หญิงที่สร้างตัวหรือฐานะมาด้วยกันเพราะเห็นคนใหม่ดีกว่า สวยกว่า  ง่ายๆคือ ตอนนี้สามารถเอื้อมถึงได้แล้ว,คนสร้างมาด้วยกันส่วนมากจะโปรไฟล์ระดับเดียวกันหรือใกล้เคียงกันเริ่มจากระดับธรรมดา บางคนติดลบ พอสร้างตัวได้ ฐานะเพิ่มขึ้น ระดับดีขึ้น ก้อเริ่มมองหาผู้หญิงระดับเดียวกันแต่ไม่ได้มองผู้หญิงที่สร้างตัวหรือฐานะมาด้วยกันเพราะเห็นคนใหม่ดีกว่า สวยกว่า  ง่ายๆคือ ตอนนี้สามารถเอื้อมถึงได้แล้ว,2025-11-29 08:18:55,"['คน', 'สร้าง', 'มา', 'ด้วยกัน', 'ส่วนมาก', 'จะ', 'โปรไฟล์', 'ระดับ', 'เดียวกัน', 'หรือ', 'ใกล้เคียง', 'กัน', 'เริ่ม', 'จาก', 'ระดับ', 'ธรรมดา', ' ', 'บางคน', 'ติดลบ', ' ', 'พอ', 'สร้างตัว', 'ได้', ' ', 'ฐานะ', 'เพิ่มขึ้น', ' ', 'ระดับ', 'ดีขึ้น', ' ', 'ก้อ', 'เริ่ม', 'มองหา', 'ผู้หญิง', 'ระดับ', 'เดียวกัน', 'แต่', 'ไม่', 'ได้', 'มอง', 'ผู้หญิง', 'ที่', 'สร้างตัว', 'หรือ', 'ฐานะ', 'มา', 'ด้วยกัน', 'เพราะ', 'เห็น', 'คน', 'ใหม่', 'ดีกว่า', ' ', 'สวย', 'กว่า', ' ', 'ง่ายๆ', 'คือ', ' ', 'ตอนนี้', 'สามารถ', 'เอื้อม', 'ถึง', 'ได้', 'แล้ว']"
1989637091354186115,twitter,post,https://x.com/HoneyBee1382/status/1989637091354186115,text,2025-11-15T10:10:22.000Z,selenium_x_scraper_v1,ความจริง90%ที่เจอกับคนใกล้ตัว เห็นแบบนี้ตั้งแต่รุ่นพ่อแม่จนมาสังคมการทำงานนี่ล่ะ ชัดเจน,ความจริง90%ที่เจอกับคนใกล้ตัว เห็นแบบนี้ตั้งแต่รุ่นพ่อแม่จนมาสังคมการทำงานนี่ล่ะ ชัดเจน,2025-11-29 08:18:55,"['ความจริง', '90', ' ', 'ที่', 'เจอ', 'กับ', 'คน', 'ใกล้', 'ตัว', ' ', 'เห็น', 'แบบนี้', 'ตั้งแต่', 'รุ่น', 'พ่อแม่', 'จน', 'มา', 'สังคม', 'การทำงาน', 'นี่', 'ล่ะ', ' ', 'ชัดเจน']"
1989694222845243410,twitter,post,https://x.com/Niti_fx/status/1989694222845243410,text,2025-11-15T13:57:24.000Z,selenium_x_scraper_v1,ผู้หญิงก็มี เจอกับตัวเอง คบแรกๆผู้หญิงไม่ได้มีตำแหน่งอะไรเลย เราเกือบซัพพอร์ตทุกอย่างทั้งงานและงานบ้าน ซัพพอร์ตหนี้บ้านแฟน   พอแฟนได้เลื่อนตำแหน่ง เราจับได้แฟนคุยกับคนอื่นคนนั้นอายุเยอะกว่า กลับมาคุยกับเลิกกับเรา สุดท้ายกูเสียเครดิตหนี้เสีย สอนให้รู้ว่าอย่าลืมรักตัวเองมาก,ผู้หญิงก็มี เจอกับตัวเอง คบแรกๆผู้หญิงไม่ได้มีตำแหน่งอะไรเลย เราเกือบซัพพอร์ตทุกอย่างทั้งงานและงานบ้าน ซัพพอร์ตหนี้บ้านแฟน   พอแฟนได้เลื่อนตำแหน่ง เราจับได้แฟนคุยกับคนอื่นคนนั้นอายุเยอะกว่า กลับมาคุยกับเลิกกับเรา สุดท้ายกูเสียเครดิตหนี้เสีย สอนให้รู้ว่าอย่าลืมรักตัวเองมาก,2025-11-29 08:18:55,"['ผู้หญิง', 'ก็', 'มี', ' ', 'เจอ', 'กับ', 'ตัวเอง', ' ', 'คบ', 'แรก', 'ๆ', 'ผู้หญิง', 'ไม่', 'ได้', 'มี', 'ตำแหน่ง', 'อะไร', 'เลย', ' ', 'เรา', 'เกือบ', 'ซัพพอร์ต', 'ทุกอย่าง', 'ทั้ง', 'งาน', 'และ', 'งานบ้าน', ' ', 'ซัพพอร์ต', 'หนี้', 'บ้าน', 'แฟน', ' ', 'พอ', 'แฟน', 'ได้', 'เลื่อนตำแหน่ง', ' ', 'เรา', 'จับได้', 'แฟน', 'คุย', 'กับ', 'คนอื่น', 'คน', 'นั้น', 'อายุ', 'เยอะ', 'กว่า', ' ', 'กลับมา', 'คุย', 'กับ', 'เลิก', 'กับ', 'เรา', ' ', 'สุดท้าย', 'กู', 'เสีย', 'เครดิต', 'หนี้เสีย', ' ', 'สอน', 'ให้', 'รู้', 'ว่า', 'อย่า', 'ลืม', 'รัก', 'ตัวเอง', 'มาก']"
1989753490965737932,twitter,post,https://x.com/0SQG097Qf0xz8zh/status/1989753490965737932,text,2025-11-15T17:52:54.000Z,selenium_x_scraper_v1,"อยู่ที่สันดานล้วนๆ คนที่พร้อมถีบหัวส่งเมียที่สู้กันมาก็เยอะ พอเจอของใหม่ ก็อ้างสารพัดเหตุผลที่จะไป
ส่วนคนที่ยังไงก็อยู่ เค้าก็จะอยู่ บางคนยิ่งรักเมียมากขึ้นด้วย","อยู่ที่สันดานล้วนๆ คนที่พร้อมถีบหัวส่งเมียที่สู้กันมาก็เยอะ พอเจอของใหม่ ก็อ้างสารพัดเหตุผลที่จะไป
ส่วนคนที่ยังไงก็อยู่ เค้าก็จะอยู่ บางคนยิ่งรักเมียมากขึ้นด้วย",2025-11-29 08:18:55,"['อยู่', 'ที่', 'สันดาน', 'ล้วน', 'ๆ', ' ', 'คน', 'ที่', 'พร้อม', 'ถีบหัวส่ง', 'เมีย', 'ที่', 'สู้', 'กัน', 'มา', 'ก็', 'เยอะ', ' ', 'พอ', 'เจอ', 'ของ', 'ใหม่', ' ', 'ก็', 'อ้าง', 'สารพัด', 'เหตุผล', 'ที่จะ', 'ไป', ' ', 'ส่วน', 'คน', 'ที่', 'ยังไง', 'ก็', 'อยู่', ' ', 'เค้า', 'ก็', 'จะ', 'อยู่', ' ', 'บางคน', 'ยิ่ง', 'รัก', 'เมีย', 'มากขึ้น', 'ด้วย']"
1989687420858896813,twitter,post,https://x.com/PremiereConsu/status/1989687420858896813,text,2025-11-15T13:30:22.000Z,selenium_x_scraper_v1,"ค่อดใช่ค่ะ เป๊ะเลย
เงินเดือนขึ้น ตน.ไม่ได้แปลว่าดีแล้ว นิสัย&ค.สามารถแย่เหมือนเดิม แค่ย้ายอัพเงินเฉยๆเดี๋ยวก็ตันเพราะไม่ได้เก่งจริง
ทิ้งภรรยาลูกแบบไร้เยื่อใยเลย
ปกติก็ไม่ได้สนใจมากอยู่แล้ว แค่จ่ายค่าเทอมแบบเสียไมไ่ด้เฉยๆ
ไปหาผญใหม่ระดับเดียวกัน ที่คิดว่าเดี๋ยวเค้าก็รู้เองว่าฮีบ้ง","ค่อดใช่ค่ะ เป๊ะเลย
เงินเดือนขึ้น ตน.ไม่ได้แปลว่าดีแล้ว นิสัย&ค.สามารถแย่เหมือนเดิม แค่ย้ายอัพเงินเฉยๆเดี๋ยวก็ตันเพราะไม่ได้เก่งจริง
ทิ้งภรรยาลูกแบบไร้เยื่อใยเลย
ปกติก็ไม่ได้สนใจมากอยู่แล้ว แค่จ่ายค่าเทอมแบบเสียไมไ่ด้เฉยๆ
ไปหาผญใหม่ระดับเดียวกัน ที่คิดว่าเดี๋ยวเค้าก็รู้เองว่าฮีบ้ง",2025-11-29 08:18:55,"['ค่อ', 'ด', 'ใช่', 'ค่ะ', ' ', 'เป๊ะ', 'เลย', ' ', 'เงิน', 'เดือนขึ้น', ' ', 'ตน', '.', 'ไม่', 'ได้', 'แปล', 'ว่า', 'ดีแล้ว', ' ', 'นิสัย', ' ', 'ค', '.', 'สามารถ', 'แย่', 'เหมือนเดิม', ' ', 'แค่', 'ย้าย', 'อัพ', 'เงิน', 'เฉย', 'ๆ', 'เดี๋ยว', 'ก็', 'ตัน', 'เพราะ', 'ไม่', 'ได้', 'เก่ง', 'จริง', ' ', 'ทิ้ง', 'ภรรยา', 'ลูก', 'แบบ', 'ไร้', 'เยื่อใย', 'เลย', ' ', 'ปกติ', 'ก็', 'ไม่', 'ได้', 'สนใจ', 'มาก', 'อยู่แล้ว', ' ', 'แค่', 'จ่าย', 'ค่า', 'เทอม', 'แบบ', 'เสีย', 'ไมไ่ด้', 'เฉย', 'ๆ', ' ', 'ไปหา', 'ผญ', 'ใหม่', 'ระดับ', 'เดียวกัน', ' ', 'ที่', 'คิด', 'ว่า', 'เดี๋ยว', 'เค้า', 'ก็', 'รู้', 'เอง', 'ว่า', 'ฮี', 'บ้ง']"
1989677616727822484,twitter,post,https://x.com/pegasusna/status/1989677616727822484,text,2025-11-15T12:51:24.000Z,selenium_x_scraper_v1,ประโยคที่ง่ายแต่เป็นเรื่องจริง คือ ผู้ชายเริ่มจากร้อยถึงศูนย์ แต่ผู้หญิงเริ่มจากศูนย์ถึงร้อย,ประโยคที่ง่ายแต่เป็นเรื่องจริง คือ ผู้ชายเริ่มจากร้อยถึงศูนย์ แต่ผู้หญิงเริ่มจากศูนย์ถึงร้อย,2025-11-29 08:18:55,"['ประโยค', 'ที่', 'ง่าย', 'แต่', 'เป็น', 'เรื่องจริง', ' ', 'คือ', ' ', 'ผู้ชาย', 'เริ่ม', 'จาก', 'ร้อย', 'ถึง', 'ศูนย์', ' ', 'แต่', 'ผู้หญิง', 'เริ่ม', 'จาก', 'ศูนย์', 'ถึง', 'ร้อย']"
1989928733025923391,twitter,post,https://x.com/forstarryhearts/status/1989928733025923391,text,2025-11-16T05:29:15.000Z,selenium_x_scraper_v1,มันไม่ใช่ว่าพออีกฝ่ายดีขึ้นเก่งขึ้นแล้วจะไป มันต้องดีขึ้นกันทั้งคู่ ค.สัมพันธ์ถึงไปรอด อย่างที่เค้าบอกแหละ ศีลเสมอกัน ถ้าวันใดวันนึงเติบโตไม่เท่ากัน อีกฝ่ายไม่พัฒนาไม่โตขึ้นเลย ค.สัมพันธ์มันก็ไม่รอด,มันไม่ใช่ว่าพออีกฝ่ายดีขึ้นเก่งขึ้นแล้วจะไป มันต้องดีขึ้นกันทั้งคู่ ค.สัมพันธ์ถึงไปรอด อย่างที่เค้าบอกแหละ ศีลเสมอกัน ถ้าวันใดวันนึงเติบโตไม่เท่ากัน อีกฝ่ายไม่พัฒนาไม่โตขึ้นเลย ค.สัมพันธ์มันก็ไม่รอด,2025-11-29 08:18:55,"['มัน', 'ไม่', 'ใช่', 'ว่า', 'พอ', 'อีก', 'ฝ่าย', 'ดีขึ้น', 'เก่ง', 'ขึ้น', 'แล้', 'วจะ', 'ไป', ' ', 'มัน', 'ต้อง', 'ดีขึ้น', 'กัน', 'ทั้งคู่', ' ', 'ค', '.', 'สัมพันธ์', 'ถึง', 'ไป', 'รอด', ' ', 'อย่าง', 'ที่', 'เค้า', 'บอก', 'แหละ', ' ', 'ศีล', 'เสมอกัน', ' ', 'ถ้า', 'วันใด', 'วัน', 'นึง', 'เติบโต', 'ไม่', 'เท่ากัน', ' ', 'อีก', 'ฝ่าย', 'ไม่', 'พัฒนา', 'ไม่', 'โต', 'ขึ้น', 'เลย', ' ', 'ค', '.', 'สัมพันธ์', 'มัน', 'ก็', 'ไม่', 'รอด']"
1989749457513255130,twitter,post,https://x.com/Zophear/status/1989749457513255130,text,2025-11-15T17:36:53.000Z,selenium_x_scraper_v1,ถามว่ามีมั้ยคนที่ยังอยู่ด้วยกัน มีนะคะ ส่วนตัวนับถือความรักแบบนี้มากๆเพราะน้อยจริงๆ เห็นที่ไปรอด %เยอะหน่อยจะเป็นผู้ชายที่ค่อนข้างด้อยกว่าฝ่ายญ. แต่ไม่การันตีอีกเพราะคู่ชีวิตดูกันหลัก 20-30 ปี ยังเลิก ก็นั่นแหละ,ถามว่ามีมั้ยคนที่ยังอยู่ด้วยกัน มีนะคะ ส่วนตัวนับถือความรักแบบนี้มากๆเพราะน้อยจริงๆ เห็นที่ไปรอด %เยอะหน่อยจะเป็นผู้ชายที่ค่อนข้างด้อยกว่าฝ่ายญ. แต่ไม่การันตีอีกเพราะคู่ชีวิตดูกันหลัก 20-30 ปี ยังเลิก ก็นั่นแหละ,2025-11-29 08:18:55,"['ถาม', 'ว่า', 'มี', 'มั้ย', 'คน', 'ที่', 'ยังอยู่', 'ด้วยกัน', ' ', 'มี', 'นะคะ', ' ', 'ส่วนตัว', 'นับถือ', 'ความรัก', 'แบบนี้', 'มาก', 'ๆ', 'เพราะ', 'น้อย', 'จริงๆ', ' ', 'เห็น', 'ที่', 'ไป', 'รอด', ' ', 'เยอะ', 'หน่อย', 'จะ', 'เป็น', 'ผู้ชาย', 'ที่', 'ค่อนข้าง', 'ด้อย', 'กว่า', 'ฝ่าย', 'ญ', '.', ' ', 'แต่', 'ไม่', 'การันตี', 'อีก', 'เพราะ', 'คู่ชีวิต', 'ดู', 'กัน', 'หลัก', ' ', '20', ' ', '30', ' ', 'ปี', ' ', 'ยัง', 'เลิก', ' ', 'ก็', 'นั่นแหละ']"
1989870974712647937,twitter,post,https://x.com/Odette07973255/status/1989870974712647937,text,2025-11-16T01:39:45.000Z,selenium_x_scraper_v1,จริงค่ะ นี่น่าจะเป็นอีกเหตุผลนึงที่ผู้ใหญ่มักบอกว่า ถ้าทำได้อย่าเพิ่งมีแฟนในวัยเรียน เด็กวัยรุ่นหลายคนทุ่มเทให้กับความรักมากเหลือเกิน ยอมสละทุกอย่างเพื่อความรัก สุดท้ายเลิกรากันแถมตัวเองเสียโอกาสดี ๆ ไปมหาศาล วัยรุ่นเป็นช่วงวางรากฐานด้านอาชีพ/วุฒิการศึกษา พลิกนิดเดียวชีวิตเปลี่ยน,จริงค่ะ นี่น่าจะเป็นอีกเหตุผลนึงที่ผู้ใหญ่มักบอกว่า ถ้าทำได้อย่าเพิ่งมีแฟนในวัยเรียน เด็กวัยรุ่นหลายคนทุ่มเทให้กับความรักมากเหลือเกิน ยอมสละทุกอย่างเพื่อความรัก สุดท้ายเลิกรากันแถมตัวเองเสียโอกาสดี ๆ ไปมหาศาล วัยรุ่นเป็นช่วงวางรากฐานด้านอาชีพ/วุฒิการศึกษา พลิกนิดเดียวชีวิตเปลี่ยน,2025-11-29 08:18:55,"['จริง', 'ค่ะ', ' ', 'นี่', 'น่าจะเป็น', 'อีก', 'เหตุผล', 'นึง', 'ที่', 'ผู้ใหญ่', 'มัก', 'บอ', 'กว่า', ' ', 'ถ้า', 'ทำได้', 'อย่า', 'เพิ่ง', 'มี', 'แฟน', 'ใน', 'วัยเรียน', ' ', 'เด็กวัยรุ่น', 'หลาย', 'คน', 'ทุ่มเท', 'ให้', 'กับ', 'ความรัก', 'มาก', 'เหลือเกิน', ' ', 'ยอม', 'สละ', 'ทุกอย่าง', 'เพื่อ', 'ความรัก', ' ', 'สุดท้าย', 'เลิกรา', 'กัน', 'แถม', 'ตัวเอง', 'เสียโอกาส', 'ดี ๆ', ' ', 'ไป', 'มหาศาล', ' ', 'วัยรุ่น', 'เป็นช่วง', 'วางรากฐาน', 'ด้าน', 'อาชีพ', ' ', 'วุฒิการศึกษา', ' ', 'พลิก', 'นิดเดียว', 'ชีวิต', 'เปลี่ยน']"
1989793215126606241,twitter,post,https://x.com/NipaJju1987/status/1989793215126606241,text,2025-11-15T20:30:45.000Z,selenium_x_scraper_v1,พูดง่ายๆคือพอเอื้อมถึงคนสูงกว่าก็ไปดีกว่า,พูดง่ายๆคือพอเอื้อมถึงคนสูงกว่าก็ไปดีกว่า,2025-11-29 08:18:55,"['พูด', 'ง่ายๆ', 'คือ', 'พอ', 'เอื้อม', 'ถึง', 'คน', 'สูง', 'กว่า', 'ก็', 'ไป', 'ดีกว่า']"
1989687919276106037,twitter,post,https://x.com/M_10024/status/1989687919276106037,text,2025-11-15T13:32:21.000Z,selenium_x_scraper_v1,ไม่รู้จริงไม่จริงนะ แต่นี่โดนแบบนี้เลย 5555555,ไม่รู้จริงไม่จริงนะ แต่นี่โดนแบบนี้เลย 5555555,2025-11-29 08:18:55,"['ไม่', 'รู้', 'จริง', 'ไม่', 'จริง', 'นะ', ' ', 'แต่', 'นี่', 'โดน', 'แบบนี้', 'เลย', ' ', 'หัวเราะ']"
1989913595640254654,twitter,post,https://x.com/etajosealvalone/status/1989913595640254654,text,2025-11-16T04:29:06.000Z,selenium_x_scraper_v1,ดูผู้ชายให้ดูตอนเขามีเงิน,ดูผู้ชายให้ดูตอนเขามีเงิน,2025-11-29 08:18:55,"['ดู', 'ผู้ชาย', 'ให้', 'ดู', 'ตอน', 'เขา', 'มีเงิน']"
1990027968639533152,twitter,post,https://x.com/bunniiz_33/status/1990027968639533152,text,2025-11-16T12:03:35.000Z,selenium_x_scraper_v1,จากปสก. ไม่ใช่ว่ามันไม่ตื่นเต้น แต่มันไม่อยากทนอยุ่กับคนที่เก่งกว่าอีกแล้ว,จากปสก. ไม่ใช่ว่ามันไม่ตื่นเต้น แต่มันไม่อยากทนอยุ่กับคนที่เก่งกว่าอีกแล้ว,2025-11-29 08:18:55,"['จาก', 'ปส', 'ก.', ' ', 'ไม่', 'ใช่', 'ว่า', 'มัน', 'ไม่', 'ตื่นเต้น', ' ', 'แต่', 'มัน', 'ไม่', 'อยาก', 'ทน', 'อยุ่', 'กับ', 'คน', 'ที่', 'เก่ง', 'กว่า', 'อีกแล้ว']"
1989849639848481272,twitter,post,https://x.com/VeeriaU5223/status/1989849639848481272,text,2025-11-16T00:14:58.000Z,selenium_x_scraper_v1,โดยส่วนตัวคิดว่า สด.ออก ล่ะ คนที่อบอุ่นใจดีจริงๆ เขาก็ไม่ทิ้ง ต้องพยายามดูมากๆตอนเลือกล่ะมั้ง นั่นแหละ ส่วนใหญ่ที่ดูออกมากๆมักไม่มีแฟนหรือคบคุยกันไม่นาน555,โดยส่วนตัวคิดว่า สด.ออก ล่ะ คนที่อบอุ่นใจดีจริงๆ เขาก็ไม่ทิ้ง ต้องพยายามดูมากๆตอนเลือกล่ะมั้ง นั่นแหละ ส่วนใหญ่ที่ดูออกมากๆมักไม่มีแฟนหรือคบคุยกันไม่นาน555,2025-11-29 08:18:55,"['โดยส่วนตัว', 'คิด', 'ว่า', ' ', 'สด', '.', 'ออก', ' ', 'ล่ะ', ' ', 'คน', 'ที่', 'อบอุ่น', 'ใจดี', 'จริงๆ', ' ', 'เขา', 'ก็', 'ไม่', 'ทิ้ง', ' ', 'ต้อง', 'พยายาม', 'ดู', 'มาก', 'ๆ', 'ตอน', 'เลือก', 'ล่ะ', 'มั้ง', ' ', 'นั่นแหละ', ' ', 'ส่วนใหญ่', 'ที่', 'ดูออก', 'มาก', 'ๆ', 'มัก', 'ไม่', 'มี', 'แฟน', 'หรือ', 'คบ', 'คุย', 'กัน', 'ไม่', 'นาน', 'หัวเราะ']"
1989856502036008980,twitter,post,https://x.com/mcwavechip/status/1989856502036008980,text,2025-11-16T00:42:14.000Z,selenium_x_scraper_v1,ผญ.ก็เป็น นี่พึ่งเจอมาสดๆร้อนๆ คู่ญญ,ผญ.ก็เป็น นี่พึ่งเจอมาสดๆร้อนๆ คู่ญญ,2025-11-29 08:18:55,"['ผญ.', 'ก็', 'เป็น', ' ', 'นี่', 'พึ่ง', 'เจอ', 'มา', 'สดๆ', 'ร้อน', 'ๆ', ' ', 'คู่', 'ญญ']"
1989962353899966642,twitter,post,https://x.com/Tarrus78548134/status/1989962353899966642,text,2025-11-16T07:42:51.000Z,selenium_x_scraper_v1,สงสัยว่าผญ.และผช.ก็โตไปด้วยกัน ไม่รักกันแล้วก็เลิกป่ะ ทำไมกลายเป็นผญ.เสียเปรียบ?,สงสัยว่าผญ.และผช.ก็โตไปด้วยกัน ไม่รักกันแล้วก็เลิกป่ะ ทำไมกลายเป็นผญ.เสียเปรียบ?,2025-11-29 08:18:55,"['สงสัย', 'ว่า', 'ผญ.', 'และ', 'ผช.', 'ก็', 'โต', 'ไป', 'ด้วยกัน', ' ', 'ไม่', 'รัก', 'กัน', 'แล้วก็', 'เลิก', 'ป่ะ', ' ', 'ทำไม', 'กลายเป็น', 'ผญ.', 'เสียเปรียบ', '?']"
