id,platform,platform_type,url,content_type,timestamp,scraper_module,text,raw_text,scrape_date,tokens
1986351523115507911,twitter,post,https://x.com/Care_Bunny/status/1986351523115507911,text,2025-11-06T08:34:42.000Z,selenium_x_scraper_v1,เพจนี้ ชายแทร่สันดานนี้เลย คนด่าเป็นหมื่นเปนแสนก็หน้าหนา แนะนำให้กดรีพอตแล้วบล็อคไปค่ะ เราบล็อคไปนานละ ชีวิตดี,เพจนี้ ชายแทร่สันดานนี้เลย คนด่าเป็นหมื่นเปนแสนก็หน้าหนา แนะนำให้กดรีพอตแล้วบล็อคไปค่ะ เราบล็อคไปนานละ ชีวิตดี,2025-11-29 08:18:55,"['เพจ', 'นี้', ' ', 'ชาย', 'แทร่', 'สันดาน', 'นี้', 'เลย', ' ', 'คน', 'ด่า', 'เป็น', 'หมื่น', 'เปน', 'แสน', 'ก็', 'หน้าหนา', ' ', 'แนะนำ', 'ให้', 'กด', 'รี', 'พอ', 'ต', 'แล้ว', 'บล็อค', 'ไป', 'ค่ะ', ' ', 'เรา', 'บล็อค', 'ไป', 'นาน', 'ละ', ' ', 'ชีวิต', 'ดี']"
1986257784787378338,twitter,post,https://x.com/myzpeach_/status/1986257784787378338,text,2025-11-06T02:22:13.000Z,selenium_x_scraper_v1,ใจบาง,ใจบาง,2025-11-29 08:18:55,"['ใจ', 'บาง']"
1986370467788431376,twitter,post,https://x.com/Keywordsx_999/status/1986370467788431376,text,2025-11-06T09:49:59.000Z,selenium_x_scraper_v1,ตามคุณภาพการอบรบสั่งสอนของครอบครัว,ตามคุณภาพการอบรบสั่งสอนของครอบครัว,2025-11-29 08:18:55,"['ตาม', 'คุณภาพ', 'กา', 'รอบ', 'รบ', 'สั่งสอน', 'ของ', 'ครอบครัว']"
1986018978775634279,twitter,post,https://x.com/bamb00yong/status/1986018978775634279,text,2025-11-05T10:33:17.000Z,selenium_x_scraper_v1,เราบล็อคไปแล้วเรียบร้อยค่ะ ตั้งแต่เห็นเม้นนี้,เราบล็อคไปแล้วเรียบร้อยค่ะ ตั้งแต่เห็นเม้นนี้,2025-11-29 08:18:55,"['เรา', 'บล็อค', 'ไป', 'แล้ว', 'เรียบร้อย', 'ค่ะ', ' ', 'ตั้งแต่', 'เห็น', 'เม้น', 'นี้']"
1986009747544506800,twitter,post,https://x.com/1Mlightyeariix6/status/1986009747544506800,text,2025-11-05T09:56:36.000Z,selenium_x_scraper_v1,ฮาวทูด่าเจ็บโดยไม่มีคำหยาบ ค่ดบียอนด์,ฮาวทูด่าเจ็บโดยไม่มีคำหยาบ ค่ดบียอนด์,2025-11-29 08:18:55,"['หัวเราะ', 'ว', 'ทู', 'ด่า', 'เจ็บ', 'โดย', 'ไม่', 'มี', 'คำหยาบ', ' ', 'ค่ด', 'บี', 'ยอนด์']"
1986053312781992029,twitter,post,https://x.com/tongcjt/status/1986053312781992029,text,2025-11-05T12:49:43.000Z,selenium_x_scraper_v1,เพจนี้ก็ชายแทร่ อีกเพจก็โวคจนเพี้ยน ,เพจนี้ก็ชายแทร่ อีกเพจก็โวคจนเพี้ยน ,2025-11-29 08:18:55,"['เพจ', 'นี้', 'ก็', 'ชาย', 'แทร่', ' ', 'อีก', 'เพจ', 'ก็', 'โว', 'คจน', 'เพี้ยน']"
1986240042940178874,twitter,post,https://x.com/K_Goodmann/status/1986240042940178874,text,2025-11-06T01:11:43.000Z,selenium_x_scraper_v1,ก็ถูกของลุงแก,ก็ถูกของลุงแก,2025-11-29 08:18:55,"['ก็', 'ถูก', 'ของ', 'ลุง', 'แก']"
1986348653393682867,twitter,post,https://x.com/IARM27556/status/1986348653393682867,text,2025-11-06T08:23:18.000Z,selenium_x_scraper_v1,เพจนี้เคยเขียนโพสต์ใส่ร้ายป้ายสีคนอื่นก็ทำมาแล้ว,เพจนี้เคยเขียนโพสต์ใส่ร้ายป้ายสีคนอื่นก็ทำมาแล้ว,2025-11-29 08:18:55,"['เพจ', 'นี้', 'เคย', 'เขียน', 'โพสต์', 'ใส่ร้ายป้ายสี', 'คนอื่น', 'ก็', 'ทำ', 'มา', 'แล้ว']"
1986356651935563883,twitter,post,https://x.com/rosemiyuki_/status/1986356651935563883,text,2025-11-06T08:55:05.000Z,selenium_x_scraper_v1,ต่ำสุดของสันดานมนุษย์,ต่ำสุดของสันดานมนุษย์,2025-11-29 08:18:55,"['ต่ำสุด', 'ของ', 'สันดาน', 'มนุษย์']"
1985993491298857132,twitter,post,https://x.com/jojoeyox/status/1985993491298857132,text,2025-11-05T08:52:00.000Z,selenium_x_scraper_v1,มันคงคึกคะนอง,มันคงคึกคะนอง,2025-11-29 08:18:55,"['มัน', 'คง', 'คึกคะนอง']"
1986001908746866765,twitter,post,https://x.com/annsppsmmmy/status/1986001908746866765,text,2025-11-05T09:25:27.000Z,selenium_x_scraper_v1,แอดมินชายแท้ ความคิดต่ำตม,แอดมินชายแท้ ความคิดต่ำตม,2025-11-29 08:18:55,"['แอดมิน', 'ชาย', 'แท้', ' ', 'ความคิด', 'ต่ำ', 'ตม']"
1985966649137312007,twitter,post,https://x.com/Packet33688/status/1985966649137312007,text,2025-11-05T07:05:21.000Z,selenium_x_scraper_v1,"No comment on clout chasing, engagement loving or viral craving FB pages here , 

แต่ด่าได้โหดมาก  “สวัติการลาคลอด“55555 ซึ่งมันไม่ make sense ด้วยซ้ำ 

แต่มันตลกดี  นับถือๆ ขอเอาไปใช้บ้าง 56","No comment on clout chasing, engagement loving or viral craving FB pages here , 

แต่ด่าได้โหดมาก  “สวัติการลาคลอด“55555 ซึ่งมันไม่ make sense ด้วยซ้ำ 

แต่มันตลกดี  นับถือๆ ขอเอาไปใช้บ้าง 56",2025-11-29 08:18:55,"['no', ' ', 'comment', ' ', 'on', ' ', 'clout', ' ', 'chasing', ',', ' ', 'engagement', ' ', 'loving', ' ', 'or', ' ', 'viral', ' ', 'craving', ' ', 'fb', ' ', 'pages', ' ', 'here', ' ', ',', ' ', 'แต่', 'ด่า', 'ได้', 'โหด', 'มาก', ' ', 'ส', 'วัติ', 'การ', 'ลาคลอด', ' ', 'หัวเราะ', ' ', 'ซึ่ง', 'มัน', 'ไม่', ' ', 'make', ' ', 'sense', ' ', 'ด้วยซ้ำ', ' ', 'แต่', 'มัน', 'ตลก', 'ดี', ' ', 'นับถือ', 'ๆ', ' ', 'ขอ', 'เอา', 'ไป', 'ใช้', 'บ้าง', ' ', '56']"
1986031924511658448,twitter,post,https://x.com/Quavoarahi/status/1986031924511658448,text,2025-11-05T11:24:44.000Z,selenium_x_scraper_v1,ตั๋วลาว,ตั๋วลาว,2025-11-29 08:18:55,"['ตั๋ว', 'ลาว']"
1986042644410286288,twitter,post,https://x.com/promiseyouv/status/1986042644410286288,text,2025-11-05T12:07:19.000Z,selenium_x_scraper_v1,ใช่เพจเดียวกันกับตั๋วร้อนป้อบคอร์นชีสไหมคะ,ใช่เพจเดียวกันกับตั๋วร้อนป้อบคอร์นชีสไหมคะ,2025-11-29 08:18:55,"['ใช่', 'เพจ', 'เดียวกัน', 'กับ', 'ตั๋ว', 'ร้อน', 'ป้อ', 'บ', 'คอร์น', 'ชีส', 'ไหม', 'คะ']"
1986213911235076457,twitter,post,https://x.com/pauly89038/status/1986213911235076457,text,2025-11-05T23:27:53.000Z,selenium_x_scraper_v1,เพจส้นตีนลูกกะหรี่แบบนั้นชั้นบล็อกไปนานแล้วค่ะ,เพจส้นตีนลูกกะหรี่แบบนั้นชั้นบล็อกไปนานแล้วค่ะ,2025-11-29 08:18:55,"['เพจ', 'ส้นตีน', 'ลูก', 'กะหรี่', 'แบบ', 'นั้น', 'ชั้น', 'บล็อก', 'ไป', 'นาน', 'แล้ว', 'ค่ะ']"
1985963964346552803,twitter,post,https://x.com/PhVicc/status/1985963964346552803,text,2025-11-05T06:54:41.000Z,selenium_x_scraper_v1,ลบเม้นไปละดิ,ลบเม้นไปละดิ,2025-11-29 08:18:55,"['ลบ', 'เม้น', 'ไป', 'ละ', 'ดิ']"
1986272371733569883,twitter,post,https://x.com/Smolyuumii/status/1986272371733569883,text,2025-11-06T03:20:11.000Z,selenium_x_scraper_v1,"ทำงานวันแรก หัวหน้าถามว่าเปนเกหรือ lgbt งี้ป่าว เพราะเหนเงียบๆ ไม่ค่อยพูด
ทำมาหนึ่งเดือน พี่ ผญ อีกแผนกบอกนึกว่าไม่มองหญิง
กุ","ทำงานวันแรก หัวหน้าถามว่าเปนเกหรือ lgbt งี้ป่าว เพราะเหนเงียบๆ ไม่ค่อยพูด
ทำมาหนึ่งเดือน พี่ ผญ อีกแผนกบอกนึกว่าไม่มองหญิง
กุ",2025-11-29 08:18:55,"['ทำงาน', 'วัน', 'แรก', ' ', 'หัวหน้า', 'ถาม', 'ว่า', 'เปน', 'เก', 'หรือ', ' ', 'lgbt', ' ', 'งี้', 'ป่าว', ' ', 'เพราะ', 'เห', 'น', 'เงียบๆ', ' ', 'ไม่ค่อย', 'พูด', ' ', 'ทำ', 'มา', 'หนึ่ง', 'เดือน', ' ', 'พี่', ' ', 'ผญ', ' ', 'อีก', 'แผนก', 'บอก', 'นึก', 'ว่า', 'ไม่', 'มอง', 'หญิง', ' ', 'กุ']"
1986084355199111546,twitter,post,https://x.com/tnsjja_/status/1986084355199111546,text,2025-11-05T14:53:04.000Z,selenium_x_scraper_v1,กุยอมไปนอนกับเพื่อนที่เปนเก มันเสือกมาคิดว่ากุมีใจแล้วบอกว่ากุ gay panic และมาฉวยโอกาสกุอีก จากที่กุเปิดกว้าง ตอนนี้กุโคตร trauma จนจะกลายเปนโฮโมโฟบ:face_with_bags_under_eyes:,กุยอมไปนอนกับเพื่อนที่เปนเก มันเสือกมาคิดว่ากุมีใจแล้วบอกว่ากุ gay panic และมาฉวยโอกาสกุอีก จากที่กุเปิดกว้าง ตอนนี้กุโคตร trauma จนจะกลายเปนโฮโมโฟบ🫩,2025-11-29 08:18:55,"['กุ', 'ยอม', 'ไป', 'นอน', 'กับ', 'เพื่อน', 'ที่', 'เปน', 'เก', ' ', 'มัน', 'เสือก', 'มา', 'คิด', 'ว่า', 'กุ', 'มีใจ', 'แล้ว', 'บอ', 'กว่า', 'กุ', ' ', 'gay', ' ', 'panic', ' ', 'และ', 'มา', 'ฉวยโอกาส', 'กุ', 'อีก', ' ', 'จาก', 'ที่', 'กุ', 'เปิดกว้าง', ' ', 'ตอนนี้', 'กุ', 'โคตร', ' ', 'trauma', ' ', 'จน', 'จะ', 'กลาย', 'เปน', 'โฮ', 'โม', 'โฟบ', ' ', 'face', ' ', 'with', ' ', 'bags', ' ', 'under', ' ', 'eyes']"
1986511335790948365,twitter,post,https://x.com/Daisy_Belliis_P/status/1986511335790948365,text,2025-11-06T19:09:44.000Z,selenium_x_scraper_v1,เคยเจอคลิปต่างชาติในติ๊กต๊อก ผู้ชายสวยมาก ผมยาวสีทอง เขาตัดพ้อว่าผช.ชอบชมเขาแปลกๆ ประมาณว่า คุณสวยมาก ผมไม่ได้เป็นเกย์ แต่ถ้าจะเป็นเกย์ก็อยากจีบคุณ หรือมีกระทั่ง คุณสวยมาก อยากขข. ผช.นี่มัน แล้วสุดท้ายเขาบอกว่าเขาชอบผู้หญิง รบกวนผู้หญิงอย่าถามว่าเขาเป็นเกย์ไหม เศร้า,เคยเจอคลิปต่างชาติในติ๊กต๊อก ผู้ชายสวยมาก ผมยาวสีทอง เขาตัดพ้อว่าผช.ชอบชมเขาแปลกๆ ประมาณว่า คุณสวยมาก ผมไม่ได้เป็นเกย์ แต่ถ้าจะเป็นเกย์ก็อยากจีบคุณ หรือมีกระทั่ง คุณสวยมาก อยากขข. ผช.นี่มัน แล้วสุดท้ายเขาบอกว่าเขาชอบผู้หญิง รบกวนผู้หญิงอย่าถามว่าเขาเป็นเกย์ไหม เศร้า,2025-11-29 08:18:55,"['เคย', 'เจอ', 'คลิป', 'ต่างชาติ', 'ใน', 'ติ๊ก', 'ต๊อก', ' ', 'ผู้ชาย', 'สวย', 'มาก', ' ', 'ผม', 'ยา', 'วสี', 'ทอง', ' ', 'เขา', 'ตัดพ้อ', 'ว่า', 'ผช.', 'ชอบ', 'ชม', 'เขา', 'แปลก', 'ๆ', ' ', 'ประมาณ', 'ว่า', ' ', 'คุณ', 'สวย', 'มาก', ' ', 'ผม', 'ไม่', 'ได้', 'เป็น', 'เกย์', ' ', 'แต่', 'ถ้า', 'จะ', 'เป็น', 'เกย์', 'ก็', 'อยาก', 'จีบ', 'คุณ', ' ', 'หรือ', 'มี', 'กระทั่ง', ' ', 'คุณ', 'สวย', 'มาก', ' ', 'อยาก', 'ขข', '.', ' ', 'ผช.', 'นี่', 'มัน', ' ', 'แล้ว', 'สุดท้าย', 'เขา', 'บอ', 'กว่า', 'เขา', 'ชอบ', 'ผู้หญิง', ' ', 'รบกวน', 'ผู้หญิง', 'อย่า', 'ถาม', 'ว่า', 'เขา', 'เป็น', 'เกย์', 'ไหม', ' ', 'เศร้า']"
1986283902303150228,twitter,post,https://x.com/pviiwii/status/1986283902303150228,text,2025-11-06T04:06:00.000Z,selenium_x_scraper_v1,ชั้นคือผญที่ชอบผชซอฟๆมาก สเปค,ชั้นคือผญที่ชอบผชซอฟๆมาก สเปค,2025-11-29 08:18:55,"['ชั้น', 'คือ', 'ผญ', 'ที่', 'ชอบ', 'ผชซอฟๆ', 'มาก', ' ', 'สเปค']"
1986240017455530358,twitter,post,https://x.com/Fofoyaya2/status/1986240017455530358,text,2025-11-06T01:11:37.000Z,selenium_x_scraper_v1,ปัญหาของคนที่รูปร่างภายนอกต่างจากเพศอ่า ผชหน้าสวยผิวสวย ยังไงก็โดนหาว่าเป็นเกย์ ผญโครงร่างใหญ่ไม่มีสะโพก ไม่มีหน้าอก ยังไงก็โดนว่าเป็นทอม,ปัญหาของคนที่รูปร่างภายนอกต่างจากเพศอ่า ผชหน้าสวยผิวสวย ยังไงก็โดนหาว่าเป็นเกย์ ผญโครงร่างใหญ่ไม่มีสะโพก ไม่มีหน้าอก ยังไงก็โดนว่าเป็นทอม,2025-11-29 08:18:55,"['ปัญหา', 'ของ', 'คน', 'ที่', 'รูปร่าง', 'ภายนอก', 'ต่าง', 'จาก', 'เพศ', 'อ่า', ' ', 'ผช', 'หน้า', 'สวย', 'ผิว', 'สวย', ' ', 'ยังไง', 'ก็', 'โดน', 'หาว่า', 'เป็น', 'เกย์', ' ', 'ผญ', 'โครงร่าง', 'ใหญ่', 'ไม่', 'มี', 'สะโพก', ' ', 'ไม่', 'มี', 'หน้าอก', ' ', 'ยังไง', 'ก็', 'โดน', 'ว่า', 'เป็น', 'ทอม']"
1986270314377191909,twitter,post,https://x.com/tsunomarudplami/status/1986270314377191909,text,2025-11-06T03:12:00.000Z,selenium_x_scraper_v1,ถึงบอกว่ายุค Y เฟื่องฟู แต่ประเด็นสังคม LGBTQ+ ไม่ได้ดีขึ้นอย่างที่คิด ก็แค่เทรนนึงของวงการบันเทิง ทุนนิยม,ถึงบอกว่ายุค Y เฟื่องฟู แต่ประเด็นสังคม LGBTQ+ ไม่ได้ดีขึ้นอย่างที่คิด ก็แค่เทรนนึงของวงการบันเทิง ทุนนิยม,2025-11-29 08:18:55,"['ถึง', 'บอ', 'กว่า', 'ยุค', ' ', 'y', ' ', 'เฟื่องฟู', ' ', 'แต่', 'ประเด็น', 'สังคม', ' ', 'lgbtq', ' ', 'ไม่', 'ได้', 'ดีขึ้น', 'อย่าง', 'ที่', 'คิด', ' ', 'ก็', 'แค่', 'เท', 'รน', 'นึง', 'ของ', 'วงการ', 'บันเทิง', ' ', 'ทุนนิยม']"
1986430705799479461,twitter,post,https://x.com/asashihayate/status/1986430705799479461,text,2025-11-06T13:49:21.000Z,selenium_x_scraper_v1,อันนี้ไม่เกี่ยวกับจขทว.แต่เรื่องคล้าย ๆ กัน ชั้นเจอผชที่เป็นดาวตตคนนึง (ที่ไม่แน่ใจว่าเขาเป็นสเตรทหรือเกนะ) ดูนุ่มนิ่มซอฟท์ ๆ หน้าหวานแบบนี้แหละ แล้วมีผชอีกคนชอบเขามาก ๆ เอาคลิปดาวตตคนนั้นไปตัดแล้วใส่ #mlm จนคนในเม้นสับสนว่าผชดาวตตอะเป็นเกมั้ย บางคนก็เข้าใจไปเลยเขาเป็นเก ,อันนี้ไม่เกี่ยวกับจขทว.แต่เรื่องคล้าย ๆ กัน ชั้นเจอผชที่เป็นดาวตตคนนึง (ที่ไม่แน่ใจว่าเขาเป็นสเตรทหรือเกนะ) ดูนุ่มนิ่มซอฟท์ ๆ หน้าหวานแบบนี้แหละ แล้วมีผชอีกคนชอบเขามาก ๆ เอาคลิปดาวตตคนนั้นไปตัดแล้วใส่ #mlm จนคนในเม้นสับสนว่าผชดาวตตอะเป็นเกมั้ย บางคนก็เข้าใจไปเลยเขาเป็นเก ,2025-11-29 08:18:55,"['อันนี้', 'ไม่', 'เกี่ยวกับ', 'จขทว', '.', 'แต่', 'เรื่อง', 'คล้าย ๆ', ' ', 'กัน', ' ', 'ชั้น', 'เจอ', 'ผช', 'ที่', 'เป็น', 'ดา', 'วต', 'ตคน', 'นึง', ' ', 'ที่', 'ไม่', 'แน่ใจ', 'ว่า', 'เขา', 'เป็น', 'ส', 'เต', 'รท', 'หรือ', 'เก', 'นะ', ' ', 'ดู', 'นุ่มนิ่ม', 'ซอฟท์', ' ', 'ๆ', ' ', 'หน้าหวาน', 'แบบ', 'นี้แหละ', ' ', 'แล้ว', 'มี', 'ผช', 'อีก', 'คน', 'ชอบ', 'เขา', 'มาก', ' ', 'ๆ', ' ', 'เอา', 'คลิป', 'ดา', 'วต', 'ตคน', 'นั้น', 'ไป', 'ตัด', 'แล้ว', 'ใส่', ' ', 'จน', 'คนใน', 'เม้น', 'สับสน', 'ว่า', 'ผช', 'ดา', 'วต', 'ต', 'อะ', 'เป็น', 'เก', 'มั้ย', ' ', 'บางคน', 'ก็', 'เข้าใจ', 'ไป', 'เลย', 'เขา', 'เป็น', 'เก']"
1986235669384208624,twitter,post,https://x.com/mwwn5684171/status/1986235669384208624,text,2025-11-06T00:54:20.000Z,selenium_x_scraper_v1,ถูก รำคานมาก เสร่อest,ถูก รำคานมาก เสร่อest,2025-11-29 08:18:55,"['ถูก', ' ', 'รำ', 'คาน', 'มาก', ' ', 'เสร่อ', 'est']"
1986228942819500397,twitter,post,https://x.com/nongyurika/status/1986228942819500397,text,2025-11-06T00:27:36.000Z,selenium_x_scraper_v1,อีพวกเชียร์เก คือไม่มีกาลเทศะมาก,อีพวกเชียร์เก คือไม่มีกาลเทศะมาก,2025-11-29 08:18:55,"['อี', 'พวก', 'เชียร์', 'เก', ' ', 'คือ', 'ไม่', 'มี', 'กาลเทศะ', 'มาก']"
1986279939453427955,twitter,post,https://x.com/disappearm_/status/1986279939453427955,text,2025-11-06T03:50:15.000Z,selenium_x_scraper_v1,พูดได้หรอพี่จี้ ,พูดได้หรอพี่จี้ ,2025-11-29 08:18:55,"['พูด', 'ได้', 'หรอ', 'พี่', 'จี้']"
1986196803889537446,twitter,post,https://x.com/BencatMeow/status/1986196803889537446,text,2025-11-05T22:19:54.000Z,selenium_x_scraper_v1,,,2025-11-29 08:18:55,[]
1986426122930934209,twitter,post,https://x.com/lovekasuma/status/1986426122930934209,text,2025-11-06T13:31:08.000Z,selenium_x_scraper_v1,อันนี้ขอพูดบรรทัดสุดท้าย จะยกมาเทียบอาจต้องระวังนิดนึง การที่ไปบอกเกย์ให้กลับเปนสเตรทนี่ถ้าสนิทแซวๆกันยังพอได้ แต่ประวัติศาสตร์ที่ผ่านมามันคนละเรื่องกับที่สาววายทำเด้อ อย่างน้อยเกย์โดนจับไปรักษาเยอะ หรือโดนกดดันจากอำนาจสังคมงี้ จะตำหนิอะไรก็ว่าไป แต่ควรระวังเทียบอะไรทำนองนี้,อันนี้ขอพูดบรรทัดสุดท้าย จะยกมาเทียบอาจต้องระวังนิดนึง การที่ไปบอกเกย์ให้กลับเปนสเตรทนี่ถ้าสนิทแซวๆกันยังพอได้ แต่ประวัติศาสตร์ที่ผ่านมามันคนละเรื่องกับที่สาววายทำเด้อ อย่างน้อยเกย์โดนจับไปรักษาเยอะ หรือโดนกดดันจากอำนาจสังคมงี้ จะตำหนิอะไรก็ว่าไป แต่ควรระวังเทียบอะไรทำนองนี้,2025-11-29 08:18:55,"['อันนี้', 'ขอ', 'พูด', 'บรรทัด', 'สุดท้าย', ' ', 'จะ', 'ยก', 'มา', 'เทียบ', 'อาจ', 'ต้อง', 'ระวัง', 'นิดนึง', ' ', 'การ', 'ที่', 'ไป', 'บอก', 'เกย์', 'ให้', 'กลับ', 'เปนส', 'เต', 'รท', 'นี่', 'ถ้า', 'สนิท', 'แซว', 'ๆ', 'กัน', 'ยัง', 'พอได้', ' ', 'แต่', 'ประวัติศาสตร์', 'ที่ผ่านมา', 'มัน', 'คนละเรื่อง', 'กับ', 'ที่', 'สาว', 'วาย', 'ทำ', 'เด้อ', ' ', 'อย่าง', 'น้อย', 'เกย์', 'โดน', 'จับ', 'ไป', 'รักษา', 'เยอะ', ' ', 'หรือ', 'โดน', 'กดดัน', 'จาก', 'อำนาจ', 'สังคม', 'งี้', ' ', 'จะ', 'ตำหนิ', 'อะไร', 'ก็', 'ว่า', 'ไป', ' ', 'แต่', 'ควรระวัง', 'เทียบ', 'อะไร', 'ทำนอง', 'นี้']"
