id,platform,platform_type,url,content_type,timestamp,scraper_module,text,raw_text,scrape_date,tokens
1948263726743728548,twitter,post,https://x.com/Tim8666/status/1948263726743728548,text,2025-07-24T06:07:24.000Z,selenium_x_scraper_v1,อยากให้พวกเฟม ทวิตไป ตา3 อีสัส รกโลก #น้ําท่วมน่าน #กองทัพบก https://t.co/mnVzYqFhEm,อยากให้พวกเฟม ทวิตไป ตา3 อีสัส รกโลก #น้ําท่วมน่าน #กองทัพบก https://t.co/mnVzYqFhEm,2025-10-23 17:59:34,"['อยาก', 'ให้', 'พวก', 'เฟม', ' ', 'ทวิ', 'ต', 'ไป', ' ', 'ตา', '3', ' ', 'อี', 'สัส', ' ', 'รกโลก', ' ', 'น้ํา', 'ท่วม', 'น่าน', ' ', 'กองทัพบก']"
1948232814815498397,twitter,post,https://x.com/Tim8666/status/1948232814815498397,text,2025-07-24T04:04:34.000Z,selenium_x_scraper_v1,ไม่ควรnormalize,ไม่ควรnormalize,2025-10-23 17:59:34,"['ไม่', 'ควร', 'normalize']"
1948232668035912127,twitter,post,https://x.com/Tim8666/status/1948232668035912127,text,2025-07-24T04:03:59.000Z,selenium_x_scraper_v1,And there’s this one group that never got laid,And there’s this one group that never got laid,2025-10-23 17:59:34,"['and', ' ', 'there', ' ', 's', ' ', 'this', ' ', 'one', ' ', 'group', ' ', 'that', ' ', 'never', ' ', 'got', ' ', 'laid']"
1947169935815524724,twitter,post,https://x.com/jjookklong3/status/1947169935815524724,text,2025-07-21T05:41:04.000Z,selenium_x_scraper_v1,"คลิปต้นทางเรื่องเด็กได้เงินวันละ 9 พันบาท คำถามคือ
- อ้างว่าทำคอนเท้นต์ เป็นการแสดง แล้วสังคมได้อะไรจากการแสดงที่บอกว่าได้เงินจากพ่อแม่วันละ 9 พัน
- อาจจะได้จริงๆ พ่อแม่ทำงานอะไร สรรพากรควรรีบตรวจสอบรายได้ไหม?","คลิปต้นทางเรื่องเด็กได้เงินวันละ 9 พันบาท คำถามคือ
- อ้างว่าทำคอนเท้นต์ เป็นการแสดง แล้วสังคมได้อะไรจากการแสดงที่บอกว่าได้เงินจากพ่อแม่วันละ 9 พัน
- อาจจะได้จริงๆ พ่อแม่ทำงานอะไร สรรพากรควรรีบตรวจสอบรายได้ไหม?",2025-10-23 17:59:34,"['คลิป', 'ต้นทาง', 'เรื่อง', 'เด็ก', 'ได้เงิน', 'วัน', 'ละ', ' ', '9', ' ', 'พัน', 'บาท', ' ', 'คำถาม', 'คือ', ' ', 'อ้างว่า', 'ทำ', 'คอน', 'เท้นต์', ' ', 'เป็น', 'การแสดง', ' ', 'แล้ว', 'สังคม', 'ได้', 'อะไร', 'จาก', 'การแสดง', 'ที่', 'บอ', 'กว่า', 'ได้เงิน', 'จาก', 'พ่อแม่', 'วัน', 'ละ', ' ', '9', ' ', 'พัน', ' ', 'อาจจะ', 'ได้', 'จริงๆ', ' ', 'พ่อแม่', 'ทำงาน', 'อะไร', ' ', 'สรรพากร', 'ควร', 'รีบ', 'ตรวจสอบ', 'รายได้', 'ไหม', '?']"
1947442965766672607,twitter,post,https://x.com/buddhafavorite/status/1947442965766672607,text,2025-07-21T23:45:59.000Z,selenium_x_scraper_v1,"แล้วถ้าเขาได้วันละ 9,000 จริงๆไปเสือกอะไรกับเขาอ่ะ เคยตั้งคำถามกับตัวเองบ้างมั้ยว่าเป็นคนประเภทไหนที่อยากไปสาระแนเรื่องการเงินชาวบ้าน","แล้วถ้าเขาได้วันละ 9,000 จริงๆไปเสือกอะไรกับเขาอ่ะ เคยตั้งคำถามกับตัวเองบ้างมั้ยว่าเป็นคนประเภทไหนที่อยากไปสาระแนเรื่องการเงินชาวบ้าน",2025-10-23 17:59:34,"['แล้ว', 'ถ้า', 'เขา', 'ได้', 'วัน', 'ละ', ' ', '9,000', ' ', 'จริงๆ', 'ไป', 'เสือก', 'อะไร', 'กับ', 'เขา', 'อ่ะ', ' ', 'เคย', 'ตั้งคำถาม', 'กับ', 'ตัวเอง', 'บ้าง', 'มั้ย', 'ว่า', 'เป็น', 'คน', 'ประเภท', 'ไหน', 'ที่', 'อยาก', 'ไป', 'สาระแน', 'เรื่อง', 'การเงิน', 'ชาวบ้าน']"
1947485405584269440,twitter,post,https://x.com/Tim8666/status/1947485405584269440,text,2025-07-22T02:34:37.000Z,selenium_x_scraper_v1,โง่ดีอีควาย,โง่ดีอีควาย,2025-10-23 17:59:34,"['โง่', 'ดี', 'อี', 'ควาย']"
1947310184977814003,twitter,post,https://x.com/hatandbox/status/1947310184977814003,text,2025-07-21T14:58:22.000Z,selenium_x_scraper_v1,"ไซออนิสต์รอบที่6,697,368,786 https://x.com/_idgafutch/sta/_idgafutch/status/1947304609141096572…","ไซออนิสต์รอบที่6,697,368,786 https://x.com/_idgafutch/sta/_idgafutch/status/1947304609141096572…",2025-10-23 17:59:34,"['ไซ', 'ออ', 'นิสต์', 'รอบ', 'ที่', '6,697,368,786']"
1947485227154346413,twitter,post,https://x.com/Tim8666/status/1947485227154346413,text,2025-07-22T02:33:55.000Z,selenium_x_scraper_v1,มันโง่จิงๆนะ เหมือน ท่องคำเดิมๆ critical thinking ต่ำ,มันโง่จิงๆนะ เหมือน ท่องคำเดิมๆ critical thinking ต่ำ,2025-10-23 17:59:34,"['มัน', 'โง่', 'จิงๆ', 'นะ', ' ', 'เหมือน', ' ', 'ท่อง', 'คำ', 'เดิม', 'ๆ', ' ', 'critical', ' ', 'thinking', ' ', 'ต่ำ']"
1947233214004899967,twitter,post,https://x.com/Tim8666/status/1947233214004899967,text,2025-07-21T09:52:30.000Z,selenium_x_scraper_v1,Rent free in ninja head,Rent free in ninja head,2025-10-23 17:59:34,"['rent', ' ', 'free', ' ', 'in', ' ', 'ninja', ' ', 'head']"
1947033904600453188,twitter,post,https://x.com/sarahcstock/status/1947033904600453188,text,2025-07-20T20:40:31.000Z,selenium_x_scraper_v1,America didn’t exist before white people created it so yeah,America didn’t exist before white people created it so yeah,2025-10-23 17:59:34,"['america', ' ', 'didn', ' ', 't', ' ', 'exist', ' ', 'before', ' ', 'white', ' ', 'people', ' ', 'created', ' ', 'it', ' ', 'so', ' ', 'yeah']"
1947147605563355186,twitter,post,https://x.com/Tim8666/status/1947147605563355186,text,2025-07-21T04:12:20.000Z,selenium_x_scraper_v1,Retarded feminist. This bitch is prolly fat ashell,Retarded feminist. This bitch is prolly fat ashell,2025-10-23 17:59:34,"['retarded', ' ', 'feminist', '.', ' ', 'this', ' ', 'bitch', ' ', 'is', ' ', 'prolly', ' ', 'fat', ' ', 'ashell']"
1947104870122852609,twitter,post,https://x.com/Tim8666/status/1947104870122852609,text,2025-07-21T01:22:31.000Z,selenium_x_scraper_v1,take a fucking jokes dumb fuck. U thought u did something,take a fucking jokes dumb fuck. U thought u did something,2025-10-23 17:59:34,"['take', ' ', 'a', ' ', 'fucking', ' ', 'jokes', ' ', 'dumb', ' ', 'fuck', '.', ' ', 'u', ' ', 'thought', ' ', 'u', ' ', 'did', ' ', 'something']"
1946773041746149583,twitter,post,https://x.com/jesuismoobin/status/1946773041746149583,text,2025-07-20T03:23:57.000Z,selenium_x_scraper_v1,"ตัวอย่างการชอบเสพคอนเทนต์ ""ย่อยง่าย"" ก็เช่น ที่ ปวศ ปลอมของ the standard แพร่หลายจนชิบหายแบบทุกวันนี้ไง เป็นอะไรกันวะ กระเพาะทางใจไม่ดีเหรอถึงต้องเสพของย่อยง่าย พวกมึงเคี้ยวบ้างก็ได้","ตัวอย่างการชอบเสพคอนเทนต์ ""ย่อยง่าย"" ก็เช่น ที่ ปวศ ปลอมของ the standard แพร่หลายจนชิบหายแบบทุกวันนี้ไง เป็นอะไรกันวะ กระเพาะทางใจไม่ดีเหรอถึงต้องเสพของย่อยง่าย พวกมึงเคี้ยวบ้างก็ได้",2025-10-23 17:59:34,"['ตัวอย่าง', 'การ', 'ชอบ', 'เสพ', 'คอนเทนต์', ' ', 'ย่อย', 'ง่าย', ' ', 'ก็', 'เช่น', ' ', 'ที่', ' ', 'ปวศ', ' ', 'ปลอม', 'ของ', ' ', 'the', ' ', 'standard', ' ', 'แพร่หลาย', 'จน', 'ชิบหาย', 'แบบ', 'ทุกวันนี้', 'ไง', ' ', 'เป็น', 'อะไร', 'กัน', 'วะ', ' ', 'กระเพาะ', 'ทาง', 'ใจไม่ดี', 'เหรอ', 'ถึง', 'ต้อง', 'เสพ', 'ของ', 'ย่อย', 'ง่าย', ' ', 'พวก', 'มึง', 'เคี้ยว', 'บ้าง', 'ก็ได้']"
1946547854756938193,twitter,post,https://x.com/HumansNoContext/status/1946547854756938193,text,2025-07-19T12:29:08.000Z,selenium_x_scraper_v1,Best thing to happen to the internet in years,Best thing to happen to the internet in years,2025-10-23 17:59:34,"['best', ' ', 'thing', ' ', 'to', ' ', 'happen', ' ', 'to', ' ', 'the', ' ', 'internet', ' ', 'in', ' ', 'years']"
1946784415037972768,twitter,post,https://x.com/Tim8666/status/1946784415037972768,text,2025-07-20T04:09:08.000Z,selenium_x_scraper_v1,Cope harder,Cope harder,2025-10-23 17:59:34,"['cope', ' ', 'harder']"
1946522553482383815,twitter,post,https://x.com/abcdek67/status/1946522553482383815,text,2025-07-19T10:48:36.000Z,selenium_x_scraper_v1,ปืนไม่เหมาะกับการเป็นพิธีกรเดอะเฟสเลย เข้าใจว่าตัวพ่อด้านเเฟชั่น แต่ด้านพิธีกรคือ #thefacethailand6,ปืนไม่เหมาะกับการเป็นพิธีกรเดอะเฟสเลย เข้าใจว่าตัวพ่อด้านเเฟชั่น แต่ด้านพิธีกรคือ #thefacethailand6,2025-10-23 17:59:34,"['ปืน', 'ไม่', 'เหมาะกับ', 'การ', 'เป็น', 'พิธีกร', 'เดอะ', 'เฟส', 'เลย', ' ', 'เข้าใจ', 'ว่า', 'ตัว', 'พ่อ', 'ด้าน', 'เเฟชั่น', ' ', 'แต่', 'ด้าน', 'พิธีกร', 'คือ']"
1946581627221819654,twitter,post,https://x.com/Tim8666/status/1946581627221819654,text,2025-07-19T14:43:20.000Z,selenium_x_scraper_v1,Fuck all taylor swiff fans. Yall are stupid as fuck,Fuck all taylor swiff fans. Yall are stupid as fuck,2025-10-23 17:59:34,"['fuck', ' ', 'all', ' ', 'taylor', ' ', 'swiff', ' ', 'fans', '.', ' ', 'yall', ' ', 'are', ' ', 'stupid', ' ', 'as', ' ', 'fuck']"
1946522747674513891,twitter,post,https://x.com/sankyou_ts/status/1946522747674513891,text,2025-07-19T10:49:22.000Z,selenium_x_scraper_v1,เชื่อยังว่าทำไมพิธีกรต้องเป็น “ผู้ชาย” เพื่อทำให้รายการเกิดความ balnce พอเมื่อกี๊พิธีกรร้องไห้ รายการดูเป็นไมค์หมดหนี้ไปเลย และกติกาดั้งเดิมที่ดีอยู่แล้ว ก็อย่าหาเปลี่ยนนักเลย มันอ่อม มันบ้ง #thefacethailand6,เชื่อยังว่าทำไมพิธีกรต้องเป็น “ผู้ชาย” เพื่อทำให้รายการเกิดความ balnce พอเมื่อกี๊พิธีกรร้องไห้ รายการดูเป็นไมค์หมดหนี้ไปเลย และกติกาดั้งเดิมที่ดีอยู่แล้ว ก็อย่าหาเปลี่ยนนักเลย มันอ่อม มันบ้ง #thefacethailand6,2025-10-23 17:59:34,"['เชื่อ', 'ยัง', 'ว่า', 'ทำไม', 'พิธีกร', 'ต้อง', 'เป็น', ' ', 'ผู้ชาย', ' ', 'เพื่อ', 'ทำให้', 'รายการ', 'เกิด', 'ความ', ' ', 'balnce', ' ', 'พอ', 'เมื่อ', 'กี๊', 'พิธีกร', 'ร้องไห้', ' ', 'รายการ', 'ดู', 'เป็น', 'ไมค์', 'หมด', 'หนี้', 'ไป', 'เลย', ' ', 'และ', 'กติกา', 'ดั้งเดิม', 'ที่', 'ดี', 'อยู่แล้ว', ' ', 'ก็', 'อย่า', 'หา', 'เปลี่ยน', 'นัก', 'เลย', ' ', 'มัน', 'อ่อม', ' ', 'มัน', 'บ้ง']"
1946535438770176387,twitter,post,https://x.com/Tim8666/status/1946535438770176387,text,2025-07-19T11:39:48.000Z,selenium_x_scraper_v1,เป็นกำลังใจให้คับ,เป็นกำลังใจให้คับ,2025-10-23 17:59:34,"['เป็น', 'กำลังใจ', 'ให้', 'คับ']"
1946502720174899223,twitter,post,https://x.com/tjaa_soo/status/1946502720174899223,text,2025-07-19T09:29:47.000Z,selenium_x_scraper_v1,สรุปคือใช่นะคะ เราเลิกกับเขาแล้วค่ะ,สรุปคือใช่นะคะ เราเลิกกับเขาแล้วค่ะ,2025-10-23 17:59:34,"['สรุป', 'คือ', 'ใช่', 'นะคะ', ' ', 'เรา', 'เลิก', 'กับ', 'เขา', 'แล้ว', 'ค่ะ']"
1946535174294176039,twitter,post,https://x.com/Tim8666/status/1946535174294176039,text,2025-07-19T11:38:45.000Z,selenium_x_scraper_v1,แต่ถ้าละครไป แบบss3 ก็ตลกอ่า อันปจบดูbalanceกว่าss3มาก,แต่ถ้าละครไป แบบss3 ก็ตลกอ่า อันปจบดูbalanceกว่าss3มาก,2025-10-23 17:59:34,"['แต่', 'ถ้า', 'ละคร', 'ไป', ' ', 'แบบ', 'ss', '3', ' ', 'ก็', 'ตลก', 'อ่า', ' ', 'อัน', 'ปจบ', 'ดู', 'balance', 'กว่า', 'ss', '3', 'มาก']"
1946523841645424878,twitter,post,https://x.com/liketsukki/status/1946523841645424878,text,2025-07-19T10:53:43.000Z,selenium_x_scraper_v1,บางคนเป็นไรอะ พิธีกรร้องไห้ก็ด่า บอกน่าจะเอาชายแท้แมนๆ มาจะได้ไม่ร้องไห้ ปี 2025 แล้วยังเป็นโฮโมโฟบกันอีกเหรอคะ 5555555555 คนเราจะร้องไห้หรือไม่ร้องมันเกี่ยวกับเพศตรงไหน #thefacethailand6,บางคนเป็นไรอะ พิธีกรร้องไห้ก็ด่า บอกน่าจะเอาชายแท้แมนๆ มาจะได้ไม่ร้องไห้ ปี 2025 แล้วยังเป็นโฮโมโฟบกันอีกเหรอคะ 5555555555 คนเราจะร้องไห้หรือไม่ร้องมันเกี่ยวกับเพศตรงไหน #thefacethailand6,2025-10-23 17:59:34,"['บางคน', 'เป็นไร', 'อะ', ' ', 'พิธีกร', 'ร้องไห้', 'ก็', 'ด่า', ' ', 'บอก', 'น่าจะ', 'เอา', 'ชาย', 'แท้', 'แมน', 'ๆ', ' ', 'มา', 'จะ', 'ได้', 'ไม่', 'ร้องไห้', ' ', 'ปี', ' ', '2025', ' ', 'แล้ว', 'ยัง', 'เป็น', 'โฮ', 'โม', 'โฟบ', 'กัน', 'อีก', 'เหรอ', 'คะ', ' ', 'หัวเราะ', ' ', 'คนเรา', 'จะ', 'ร้องไห้', 'หรือไม่', 'ร้อง', 'มัน', 'เกี่ยวกับ', 'เพศ', 'ตรงไหน']"
1946534895041307093,twitter,post,https://x.com/Tim8666/status/1946534895041307093,text,2025-07-19T11:37:38.000Z,selenium_x_scraper_v1,มึงอะเป็นไร คนด่าก็กะเทยทั้งนั้น ไม่ต้องโยนคำมั่วๆ homophobeะ่อมึง,มึงอะเป็นไร คนด่าก็กะเทยทั้งนั้น ไม่ต้องโยนคำมั่วๆ homophobeะ่อมึง,2025-10-23 17:59:34,"['มึง', 'อะ', 'เป็นไร', ' ', 'คน', 'ด่า', 'ก็', 'กะเทย', 'ทั้งนั้น', ' ', 'ไม่ต้อง', 'โยน', 'คำ', 'มั่ว', 'ๆ', ' ', 'homophobe', 'ะ่อ', 'มึง']"
1946534715407692014,twitter,post,https://x.com/Tim8666/status/1946534715407692014,text,2025-07-19T11:36:55.000Z,selenium_x_scraper_v1,พิธีกรไม่ผ่าน #thefacethailand6,พิธีกรไม่ผ่าน #thefacethailand6,2025-10-23 17:59:34,"['พิธีกร', 'ไม่', 'ผ่าน']"
1946534299085230437,twitter,post,https://x.com/Tim8666/status/1946534299085230437,text,2025-07-19T11:35:16.000Z,selenium_x_scraper_v1,แอดมินpage tpn เป้นไรอะ น่ารำคาญ เค้าจะอ่านเม้นไม่ได้อ่านมึงจ้า #thefacethailand6 @TPNGLOBAL_,แอดมินpage tpn เป้นไรอะ น่ารำคาญ เค้าจะอ่านเม้นไม่ได้อ่านมึงจ้า #thefacethailand6 @TPNGLOBAL_,2025-10-23 17:59:34,"['แอดมิน', 'page', ' ', 'tpn', ' ', 'เป้', 'น', 'ไร', 'อะ', ' ', 'น่ารำคาญ', ' ', 'เค้า', 'จะ', 'อ่าน', 'เม้น', 'ไม่', 'ได้', 'อ่าน', 'มึง', 'จ้า']"
1946283975884066944,twitter,post,https://x.com/Tim8666/status/1946283975884066944,text,2025-07-18T19:00:34.000Z,selenium_x_scraper_v1,They are trying so hard to guilt tip people and make everything a competition. Fuck Palestine!,They are trying so hard to guilt tip people and make everything a competition. Fuck Palestine!,2025-10-23 17:59:34,"['they', ' ', 'are', ' ', 'trying', ' ', 'so', ' ', 'hard', ' ', 'to', ' ', 'guilt', ' ', 'tip', ' ', 'people', ' ', 'and', ' ', 'make', ' ', 'everything', ' ', 'a', ' ', 'competition', '.', ' ', 'fuck', ' ', 'palestine', '!']"
1946265584511094944,twitter,post,https://x.com/Tim8666/status/1946265584511094944,text,2025-07-18T17:47:29.000Z,selenium_x_scraper_v1,she does,she does,2025-10-23 17:59:34,"['she', ' ', 'does']"
1946262255739511212,twitter,post,https://x.com/Tim8666/status/1946262255739511212,text,2025-07-18T17:34:16.000Z,selenium_x_scraper_v1,สรุปจะ feminist หรือเกาะผช fucking  lane ชาวเนต มันอุบาต,สรุปจะ feminist หรือเกาะผช fucking  lane ชาวเนต มันอุบาต,2025-10-23 17:59:34,"['สรุป', 'จะ', ' ', 'feminist', ' ', 'หรือ', 'เกาะ', 'ผช', ' ', 'fucking', ' ', 'lane', ' ', 'ชาว', 'เนต', ' ', 'มัน', 'อุ', 'บาต']"
1946181508378538135,twitter,post,https://x.com/Bubola/status/1946181508378538135,text,2025-07-18T12:13:24.000Z,selenium_x_scraper_v1,J.K. Rowling,J.K. Rowling,2025-10-23 17:59:34,"['j', '.k.', ' ', 'rowling']"
1946173434687533525,twitter,post,https://x.com/On_Jeppi/status/1946173434687533525,text,2025-07-18T11:41:19.000Z,selenium_x_scraper_v1,คนแบบหล่อน distribute อะไรให้สังคมน้อ,คนแบบหล่อน distribute อะไรให้สังคมน้อ,2025-10-23 17:59:34,"['คน', 'แบบ', 'หล่อน', ' ', 'distribute', ' ', 'อะไร', 'ให้', 'สังคม', 'น้อ']"
1946175101407514743,twitter,post,https://x.com/On_Jeppi/status/1946175101407514743,text,2025-07-18T11:47:57.000Z,selenium_x_scraper_v1,ใช่ค่ะ ตั้งใจเขียนผิด อยากรู้จะฉลาดทันคนไหม,ใช่ค่ะ ตั้งใจเขียนผิด อยากรู้จะฉลาดทันคนไหม,2025-10-23 17:59:34,"['ใช่', 'ค่ะ', ' ', 'ตั้งใจ', 'เขียน', 'ผิด', ' ', 'อยากรู้', 'จะ', 'ฉลาด', 'ทันคน', 'ไหม']"
1946199562202313158,twitter,post,https://x.com/Tim8666/status/1946199562202313158,text,2025-07-18T13:25:08.000Z,selenium_x_scraper_v1,จริงๆตัวมึงโง่ค้า เลิกแถอะไรควายๆ มันดูตลก ชีวิตจิงมึงพูดภาษาอังกฤษไม่ได้หรอก,จริงๆตัวมึงโง่ค้า เลิกแถอะไรควายๆ มันดูตลก ชีวิตจิงมึงพูดภาษาอังกฤษไม่ได้หรอก,2025-10-23 17:59:34,"['จริงๆ', 'ตัว', 'มึง', 'โง่', 'ค้า', ' ', 'เลิก', 'แถ', 'อะไร', 'ควาย', 'ๆ', ' ', 'มัน', 'ดู', 'ตลก', ' ', 'ชีวิต', 'จิง', 'มึง', 'พูด', 'ภาษาอังกฤษ', 'ไม่', 'ได้', 'หรอก']"
1945494206883188789,twitter,post,https://x.com/sangamsharma03/status/1945494206883188789,text,2025-07-16T14:42:19.000Z,selenium_x_scraper_v1,True,True,2025-10-23 17:59:34,['true']
1945354744001912941,twitter,post,https://x.com/hesiiod_/status/1945354744001912941,text,2025-07-16T05:28:08.000Z,selenium_x_scraper_v1,ขอพื้นที่ให้เด็กผู้ชายหน่อย,ขอพื้นที่ให้เด็กผู้ชายหน่อย,2025-10-23 17:59:34,"['ขอ', 'พื้นที่', 'ให้', 'เด็กผู้ชาย', 'หน่อย']"
1945776341946691752,twitter,post,https://x.com/Tim8666/status/1945776341946691752,text,2025-07-17T09:23:25.000Z,selenium_x_scraper_v1,สงสารตัวมึงเองดีแล้วค่าา,สงสารตัวมึงเองดีแล้วค่าา,2025-10-23 17:59:34,"['สงสาร', 'ตัว', 'มึง', 'เอง', 'ดีแล้ว', 'ค่า', 'า']"
1945560432548483251,twitter,post,https://x.com/DOKMAIPLASTI_C/status/1945560432548483251,text,2025-07-16T19:05:28.000Z,selenium_x_scraper_v1,"สรุปให้จากการที่เป็นคนที่โต้เถียงกับจขทวนี่มาทั้งวัน
1.ชีคุยกับคนในวง 
2.คนในวงบอกว่าเป็นพี่น้อง แต่ชีไม่ยอมรับ
3.ชีโทรจิกเขา บอกว่าอยากได้ความชัดเจน
4.ชีโทรไปจิก แต่ผชไม่ได้รับ ผญ ที่เป็นคนคุยผชเลยรับแทน ก็คุยกัน

ต่อ https://x.com/thers____/stat/thers____/status/1945084136592425273…","สรุปให้จากการที่เป็นคนที่โต้เถียงกับจขทวนี่มาทั้งวัน
1.ชีคุยกับคนในวง 
2.คนในวงบอกว่าเป็นพี่น้อง แต่ชีไม่ยอมรับ
3.ชีโทรจิกเขา บอกว่าอยากได้ความชัดเจน
4.ชีโทรไปจิก แต่ผชไม่ได้รับ ผญ ที่เป็นคนคุยผชเลยรับแทน ก็คุยกัน

ต่อ https://x.com/thers____/stat/thers____/status/1945084136592425273…",2025-10-23 17:59:34,"['สรุป', 'ให้', 'จาก', 'การ', 'ที่', 'เป็น', 'คน', 'ที่', 'โต้เถียง', 'กับ', 'จขทว', 'นี่', 'มา', 'ทั้งวัน', ' ', '1', '.', 'ชี', 'คุย', 'กับ', 'คนใน', 'วง', ' ', '2', '.', 'คนใน', 'วง', 'บอ', 'กว่า', 'เป็น', 'พี่น้อง', ' ', 'แต่', 'ชี', 'ไม่', 'ยอมรับ', ' ', '3', '.', 'ชี', 'โทร', 'จิก', 'เขา', ' ', 'บอ', 'กว่า', 'อยาก', 'ได้ความ', 'ชัดเจน', ' ', '4', '.', 'ชี', 'โทร', 'ไป', 'จิก', ' ', 'แต่', 'ผช', 'ไม่', 'ได้รับ', ' ', 'ผญ', ' ', 'ที่', 'เป็น', 'คน', 'คุย', 'ผ', 'ชเล', 'ย', 'รับ', 'แทน', ' ', 'ก็', 'คุย', 'กัน', ' ', 'ต่อ']"
