id,platform,platform_type,url,content_type,timestamp,scraper_module,text,raw_text,scrape_date,tokens
1979849772174582215,twitter,post,https://x.com/mpDyiis/status/1979849772174582215,text,2025-10-19T09:59:04.000Z,selenium_x_scraper_v1,ชันมีลุงคนนึงเหมือนกัน ฮีไม่เคยชมชันเลย แต่ให้เงินชันตลอด ฟีลแบบ เกรดดีก๋ให้ ซื้ิขนมให้ ไรงี้ วันที่ชั้นทำหัวทองใส่ชุดไทยก็บอกว่าเหมือนยายแก่หัวหงอก วันที่ชันแต่งหน้าดอลลี่อายก้ว่าชันแต่งหน้ทไม่สวย วันที่ชั้นแต่ตัวสวยที่สุดแล้วก่มั่นใจ ฮีบอกว่าไม่สวย กุไม่เข้าใจจริง ๆ เห้อ,ชันมีลุงคนนึงเหมือนกัน ฮีไม่เคยชมชันเลย แต่ให้เงินชันตลอด ฟีลแบบ เกรดดีก๋ให้ ซื้ิขนมให้ ไรงี้ วันที่ชั้นทำหัวทองใส่ชุดไทยก็บอกว่าเหมือนยายแก่หัวหงอก วันที่ชันแต่งหน้าดอลลี่อายก้ว่าชันแต่งหน้ทไม่สวย วันที่ชั้นแต่ตัวสวยที่สุดแล้วก่มั่นใจ ฮีบอกว่าไม่สวย กุไม่เข้าใจจริง ๆ เห้อ,2025-11-29 08:18:55,"['ชัน', 'มี', 'ลุง', 'คน', 'นึง', 'เหมือนกัน', ' ', 'ฮี', 'ไม่', 'เคย', 'ชม', 'ชัน', 'เลย', ' ', 'แต่', 'ให้เงิน', 'ชัน', 'ตลอด', ' ', 'ฟี', 'ล', 'แบบ', ' ', 'เกรด', 'ดี', 'ก๋', 'ให้', ' ', 'ซื้ิ', 'ขนม', 'ให้', ' ', 'ไร', 'งี้', ' ', 'วันที่', 'ชั้น', 'ทำ', 'หัว', 'ทอง', 'ใส่', 'ชุด', 'ไทย', 'ก็', 'บอ', 'กว่า', 'เหมือน', 'ยายแก่', 'หัวหงอก', ' ', 'วันที่', 'ชัน', 'แต่งหน้า', 'ดอลลี่', 'อาย', 'ก้', 'ว่า', 'ชัน', 'แต่ง', 'หน้ท', 'ไม่', 'สวย', ' ', 'วันที่', 'ชั้นแต่', 'ตัว', 'สวย', 'ที่สุด', 'แล้ว', 'ก่', 'มั่นใจ', ' ', 'ฮี', 'บอ', 'กว่า', 'ไม่', 'สวย', ' ', 'กุ', 'ไม่', 'เข้าใจ', 'จริง ๆ', ' ', 'เห้อ']"
1980220279533302193,twitter,post,https://x.com/tueytueytueiy/status/1980220279533302193,text,2025-10-20T10:31:20.000Z,selenium_x_scraper_v1,อันนี้คือพูดถึงน้องชายใช่ไหม,อันนี้คือพูดถึงน้องชายใช่ไหม,2025-11-29 08:18:55,"['อันนี้', 'คือ', 'พูดถึง', 'น้องชาย', 'ใช่ไหม']"
1980162114611519694,twitter,post,https://x.com/Bazophil/status/1980162114611519694,text,2025-10-20T06:40:12.000Z,selenium_x_scraper_v1,มนุษย์ปากหมาเพศหญิง ก็ได้เห็นในทวิตบ่อย ๆ นะ,มนุษย์ปากหมาเพศหญิง ก็ได้เห็นในทวิตบ่อย ๆ นะ,2025-11-29 08:18:55,"['มนุษย์', 'ปากหมา', 'เพศหญิง', ' ', 'ก็ได้', 'เห็น', 'ใน', 'ทวิ', 'ต', 'บ่อย ๆ', ' ', 'นะ']"
1980177758933377337,twitter,post,https://x.com/djlwjl_AJ/status/1980177758933377337,text,2025-10-20T07:42:22.000Z,selenium_x_scraper_v1,Bruh,Bruh,2025-11-29 08:18:55,['bruh']
1980297466059935832,twitter,post,https://x.com/PatSRy_Ch/status/1980297466059935832,text,2025-10-20T15:38:02.000Z,selenium_x_scraper_v1,"มนุษย์เพศชาย รุ่นลุง
มนุษย์ลุง","มนุษย์เพศชาย รุ่นลุง
มนุษย์ลุง",2025-11-29 08:18:55,"['มนุษย์', 'เพศชาย', ' ', 'รุ่น', 'ลุง', ' ', 'มนุษย์', 'ลุง']"
1980185237381587085,twitter,post,https://x.com/mignon982/status/1980185237381587085,text,2025-10-20T08:12:05.000Z,selenium_x_scraper_v1,พ่อฉันเปน55555 ตอนมอต้นประกวดร้องเพลงและกลับมาเล่าให้พ่อฟัง พ่อบอกว่าร้องไม่ดีไปประกวดทำไม และฉันร้องไห้หนักมาก และแม่เดินมาปลอบใจว่าแค่ลงประกวดแม่ก็ภูมิใจแล้ว,พ่อฉันเปน55555 ตอนมอต้นประกวดร้องเพลงและกลับมาเล่าให้พ่อฟัง พ่อบอกว่าร้องไม่ดีไปประกวดทำไม และฉันร้องไห้หนักมาก และแม่เดินมาปลอบใจว่าแค่ลงประกวดแม่ก็ภูมิใจแล้ว,2025-11-29 08:18:55,"['พ่อ', 'ฉัน', 'เปน', 'หัวเราะ', ' ', 'ตอน', 'มอ', 'ต้น', 'ประกวด', 'ร้องเพลง', 'และ', 'กลับมา', 'เล่า', 'ให้', 'พ่อ', 'ฟัง', ' ', 'พ่อ', 'บอ', 'กว่า', 'ร้อง', 'ไม่', 'ดี', 'ไป', 'ประกวด', 'ทำไม', ' ', 'และ', 'ฉัน', 'ร้องไห้', 'หนัก', 'มาก', ' ', 'และ', 'แม่', 'เดิน', 'มา', 'ปลอบใจ', 'ว่า', 'แค่', 'ลง', 'ประกวด', 'แม่', 'ก็', 'ภูมิใจ', 'แล้ว']"
1980081827340861772,twitter,post,https://x.com/ka_mung/status/1980081827340861772,text,2025-10-20T01:21:10.000Z,selenium_x_scraper_v1,แล้วน้องชายเค้าเพศไรอ่า,แล้วน้องชายเค้าเพศไรอ่า,2025-11-29 08:18:55,"['แล้ว', 'น้องชาย', 'เค้า', 'เพศ', 'ไร', 'อ่า']"
1979753205191020899,twitter,post,https://x.com/thekingofotaku/status/1979753205191020899,text,2025-10-18T06:34:43.000Z,selenium_x_scraper_v1,"ถ้าคนในครอบครัวบ้านไหนเห็นลูกสาวแต่งแบบเจนิสวันนั้น
มึงคิดว่าเขาจะให้ลูกสาวเขาออกจากบ้านไหม คิดสิคิด เจนิส
พ่อแม่เธออาจไม่อายเจนิส
แต่พ่อแม่ครอบครัวส่วนใหญ่เขาอาจจะอายแทบแทรกแผ่นดิน ที่มีลูกสาวแต่งตัวแบบนั้นในที่สาธารณะก็ได้","ถ้าคนในครอบครัวบ้านไหนเห็นลูกสาวแต่งแบบเจนิสวันนั้น
มึงคิดว่าเขาจะให้ลูกสาวเขาออกจากบ้านไหม คิดสิคิด เจนิส
พ่อแม่เธออาจไม่อายเจนิส
แต่พ่อแม่ครอบครัวส่วนใหญ่เขาอาจจะอายแทบแทรกแผ่นดิน ที่มีลูกสาวแต่งตัวแบบนั้นในที่สาธารณะก็ได้",2025-11-29 08:18:55,"['ถ้า', 'คนใน', 'ครอบครัว', 'บ้าน', 'ไหน', 'เห็น', 'ลูกสาว', 'แต่ง', 'แบบ', 'เจ', 'นิ', 'ส', 'วันนั้น', ' ', 'มึง', 'คิด', 'ว่า', 'เขา', 'จะ', 'ให้', 'ลูกสาว', 'เขา', 'ออกจาก', 'บ้าน', 'ไหม', ' ', 'คิด', 'สิ', 'คิด', ' ', 'เจ', 'นิ', 'ส', ' ', 'พ่อแม่', 'เธอ', 'อาจ', 'ไม่', 'อาย', 'เจ', 'นิ', 'ส', ' ', 'แต่', 'พ่อแม่', 'ครอบครัว', 'ส่วนใหญ่', 'เขา', 'อาจจะ', 'อาย', 'แทบ', 'แทรกแผ่นดิน', ' ', 'ที่', 'มี', 'ลูกสาว', 'แต่งตัว', 'แบบ', 'นั้น', 'ใน', 'ที่สาธารณะ', 'ก็ได้']"
1980141781854658887,twitter,post,https://x.com/thekingofotaku/status/1980141781854658887,text,2025-10-20T05:19:24.000Z,selenium_x_scraper_v1,กระแสตีกลับแบ้ว,กระแสตีกลับแบ้ว,2025-11-29 08:18:55,"['กระแส', 'ตีกลับ', 'แบ้', 'ว']"
1980172832807203030,twitter,post,https://x.com/thekingofotaku/status/1980172832807203030,text,2025-10-20T07:22:47.000Z,selenium_x_scraper_v1,เคี๊ยกๆๆ มีคนคิดเหมือนกูวะ,เคี๊ยกๆๆ มีคนคิดเหมือนกูวะ,2025-11-29 08:18:55,"['เคี๊ยกๆๆ', ' ', 'มี', 'คน', 'คิด', 'เหมือน', 'กู', 'วะ']"
1979872849444901023,twitter,post,https://x.com/_qstarly/status/1979872849444901023,text,2025-10-19T11:30:46.000Z,selenium_x_scraper_v1,ควาทคิดแปลกๆ เลยไปส่อง เห็นทวิตที่ปักหมุดไว้ ร้องโอโหเลย พังมาก,ควาทคิดแปลกๆ เลยไปส่อง เห็นทวิตที่ปักหมุดไว้ ร้องโอโหเลย พังมาก,2025-11-29 08:18:55,"['ค', 'วาท', 'คิด', 'แปลก', 'ๆ', ' ', 'เลย', 'ไป', 'ส่อง', ' ', 'เห็น', 'ทวิ', 'ต', 'ที่', 'ปัก', 'หมุด', 'ไว้', ' ', 'ร้อง', 'โอ', 'โห', 'เลย', ' ', 'พัง', 'มาก']"
1979905154968113292,twitter,post,https://x.com/thekingofotaku/status/1979905154968113292,text,2025-10-19T13:39:08.000Z,selenium_x_scraper_v1,"อย่างน้อยกูก็อาบน้ำวะ 
ใครจะบ้าไม่อาบน้ำไม่แปรงฟันได้5วัน
เหมือนใครบางคน","อย่างน้อยกูก็อาบน้ำวะ 
ใครจะบ้าไม่อาบน้ำไม่แปรงฟันได้5วัน
เหมือนใครบางคน",2025-11-29 08:18:55,"['อย่าง', 'น้อย', 'กู', 'ก็', 'อาบน้ำ', 'วะ', ' ', 'ใคร', 'จะ', 'บ้า', 'ไม่', 'อาบน้ำ', 'ไม่', 'แปรงฟัน', 'ได้', '5', 'วัน', ' ', 'เหมือน', 'ใคร', 'บางคน']"
1979870720516927598,twitter,post,https://x.com/peripeper31551/status/1979870720516927598,text,2025-10-19T11:22:18.000Z,selenium_x_scraper_v1,"อีกหนึ่งอย่างคือทำเพื่อการกุศลค่ะ มันไม่ได้โป๊อะไรเลยแถมมีระบบเซฟตี้ที่ดีด้วยซ้ำค่ะ โลกมันทันสมัยแล้วค่ะ

เค้าก็แต่งกันทุกบ้านนะ ที่บ้านเธอไม่แต่งอาจเพราะอยู่ไกลปืนเที่ยง","อีกหนึ่งอย่างคือทำเพื่อการกุศลค่ะ มันไม่ได้โป๊อะไรเลยแถมมีระบบเซฟตี้ที่ดีด้วยซ้ำค่ะ โลกมันทันสมัยแล้วค่ะ

เค้าก็แต่งกันทุกบ้านนะ ที่บ้านเธอไม่แต่งอาจเพราะอยู่ไกลปืนเที่ยง",2025-11-29 08:18:55,"['อีก', 'หนึ่ง', 'อย่าง', 'คือ', 'ทำ', 'เพื่อ', 'การกุศล', 'ค่ะ', ' ', 'มัน', 'ไม่', 'ได้', 'โป๊', 'อะไร', 'เลย', 'แถม', 'มีระบบ', 'เซฟตี้', 'ที่', 'ดี', 'ด้วยซ้ำ', 'ค่ะ', ' ', 'โลก', 'มัน', 'ทันสมัย', 'แล้ว', 'ค่ะ', ' ', 'เค้า', 'ก็', 'แต่ง', 'กัน', 'ทุก', 'บ้าน', 'นะ', ' ', 'ที่', 'บ้าน', 'เธอ', 'ไม่', 'แต่ง', 'อาจ', 'เพราะ', 'อยู่', 'ไกลปืนเที่ยง']"
1979871451932237975,twitter,post,https://x.com/thekingofotaku/status/1979871451932237975,text,2025-10-19T11:25:13.000Z,selenium_x_scraper_v1,ก็เพราะยังมีบางบ้านที่เขาอบรมลูกสาวได้ดีไง,ก็เพราะยังมีบางบ้านที่เขาอบรมลูกสาวได้ดีไง,2025-11-29 08:18:55,"['ก็', 'เพราะ', 'ยังมี', 'บาง', 'บ้าน', 'ที่', 'เขา', 'อบรม', 'ลูกสาว', 'ได้ดี', 'ไง']"
1979967861700583691,twitter,post,https://x.com/5livesfox/status/1979967861700583691,text,2025-10-19T17:48:18.000Z,selenium_x_scraper_v1,"ก็ไม่ใช่หน้าที่เจนิสที่ต้องมาดูแลลูกคนอื่นค่ะ  พ่อแม่เค้าสั่งสอนเองก็ถูกแล้ว
เจนิสเค้าก็ไม่ได้พูดด้วยว่าให้ใส่ตามเขา ถ้าคนที่เค้าโตแล้วเค้าคิดเองได้ค่ะถ้าเป็นเด็กที่ยังไม่บรรลุนิติภาวะพ่อแม่ดูแลก็ถูกต้องแล้วค่ะ","ก็ไม่ใช่หน้าที่เจนิสที่ต้องมาดูแลลูกคนอื่นค่ะ  พ่อแม่เค้าสั่งสอนเองก็ถูกแล้ว
เจนิสเค้าก็ไม่ได้พูดด้วยว่าให้ใส่ตามเขา ถ้าคนที่เค้าโตแล้วเค้าคิดเองได้ค่ะถ้าเป็นเด็กที่ยังไม่บรรลุนิติภาวะพ่อแม่ดูแลก็ถูกต้องแล้วค่ะ",2025-11-29 08:18:55,"['ก็', 'ไม่', 'ใช่', 'หน้าที่', 'เจ', 'นิ', 'ส', 'ที่', 'ต้อง', 'มา', 'ดูแล', 'ลูก', 'คนอื่น', 'ค่ะ', ' ', 'พ่อแม่', 'เค้า', 'สั่งสอน', 'เอง', 'ก็', 'ถูก', 'แล้ว', ' ', 'เจ', 'นิ', 'ส', 'เค้า', 'ก็', 'ไม่', 'ได้', 'พูด', 'ด้วยว่า', 'ให้', 'ใส่', 'ตาม', 'เขา', ' ', 'ถ้า', 'คน', 'ที่', 'เค้า', 'โต', 'แล้ว', 'เค้า', 'คิด', 'เอง', 'ได้', 'ค่ะ', 'ถ้า', 'เป็น', 'เด็ก', 'ที่', 'ยัง', 'ไม่', 'บรรลุนิติภาวะ', 'พ่อแม่', 'ดู', 'แลก็ถูก', 'ต้อง', 'แล้ว', 'ค่ะ']"
1979969567830262008,twitter,post,https://x.com/thekingofotaku/status/1979969567830262008,text,2025-10-19T17:55:05.000Z,selenium_x_scraper_v1,ก็ใช่ไง แล้วมาเถียงไรกูเนี่ย,ก็ใช่ไง แล้วมาเถียงไรกูเนี่ย,2025-11-29 08:18:55,"['ก็', 'ใช่', 'ไง', ' ', 'แล้ว', 'มา', 'เถียง', 'ไร', 'กู', 'เนี่ย']"
1979892886394315250,twitter,post,https://x.com/aannieecchann/status/1979892886394315250,text,2025-10-19T12:50:23.000Z,selenium_x_scraper_v1,เป็นกุอายที่มีลูกแบบมึงมากกว่า,เป็นกุอายที่มีลูกแบบมึงมากกว่า,2025-11-29 08:18:55,"['เป็น', 'กุ', 'อาย', 'ที่', 'มีลูก', 'แบบ', 'มึง', 'มากกว่า']"
1979893030778966262,twitter,post,https://x.com/thekingofotaku/status/1979893030778966262,text,2025-10-19T12:50:57.000Z,selenium_x_scraper_v1,เรื่องมึงเลย,เรื่องมึงเลย,2025-11-29 08:18:55,"['เรื่อง', 'มึง', 'เลย']"
1979870192768516585,twitter,post,https://x.com/bbkppktmhy/status/1979870192768516585,text,2025-10-19T11:20:12.000Z,selenium_x_scraper_v1,ในหัวคุณคิดอะไรคะ ตามความคิดตัวเองให้ทันด้วย พ่อแม่ใครจะคิดอะไรก็เรื่องของคนอื่นค่ะ ความคิดคุณทำตัวคุณเดือดร้อนเอง ให้คนอื่นสำรวม คุมความคิดจิตใจตัวเองให้สำรวมให้ได้ก็พอค่ะ,ในหัวคุณคิดอะไรคะ ตามความคิดตัวเองให้ทันด้วย พ่อแม่ใครจะคิดอะไรก็เรื่องของคนอื่นค่ะ ความคิดคุณทำตัวคุณเดือดร้อนเอง ให้คนอื่นสำรวม คุมความคิดจิตใจตัวเองให้สำรวมให้ได้ก็พอค่ะ,2025-11-29 08:18:55,"['ใน', 'หัว', 'คุณ', 'คิด', 'อะไร', 'คะ', ' ', 'ตาม', 'ความคิด', 'ตัวเอง', 'ให้', 'ทัน', 'ด้วย', ' ', 'พ่อแม่', 'ใคร', 'จะ', 'คิด', 'อะไร', 'ก็', 'เรื่อง', 'ของ', 'คนอื่น', 'ค่ะ', ' ', 'ความคิด', 'คุณ', 'ทำตัว', 'คุณ', 'เดือดร้อน', 'เอง', ' ', 'ให้', 'คนอื่น', 'สำรวม', ' ', 'คุม', 'ความคิด', 'จิตใจ', 'ตัวเอง', 'ให้', 'สำรวม', 'ให้ได้', 'ก็', 'พอ', 'ค่ะ']"
1979871090378994020,twitter,post,https://x.com/thekingofotaku/status/1979871090378994020,text,2025-10-19T11:23:46.000Z,selenium_x_scraper_v1,"ก็ถึงได้บอก ว่า มีพ่อแม่คนอื่นเขาอายที่ลูกแต่งวาบหวิว
ส่วนพ่อแม่เจนิสจะไม่อายนั่นก็เรื่องของเขา 
ไม่ได้เข้าใจยากเลยน่ะ
มึงจะบิดสารอะไร","ก็ถึงได้บอก ว่า มีพ่อแม่คนอื่นเขาอายที่ลูกแต่งวาบหวิว
ส่วนพ่อแม่เจนิสจะไม่อายนั่นก็เรื่องของเขา 
ไม่ได้เข้าใจยากเลยน่ะ
มึงจะบิดสารอะไร",2025-11-29 08:18:55,"['ก็', 'ถึง', 'ได้', 'บอก', ' ', 'ว่า', ' ', 'มี', 'พ่อแม่', 'คนอื่น', 'เขา', 'อาย', 'ที่', 'ลูก', 'แต่ง', 'วาบหวิว', ' ', 'ส่วน', 'พ่อแม่', 'เจ', 'นิ', 'ส', 'จะ', 'ไม่', 'อาย', 'นั่น', 'ก็', 'เรื่อง', 'ของ', 'เขา', ' ', 'ไม่', 'ได้', 'เข้าใจยาก', 'เลย', 'น่ะ', ' ', 'มึง', 'จะ', 'บิด', 'สาร', 'อะไร']"
1980240351207301482,twitter,post,https://x.com/num_nim54/status/1980240351207301482,text,2025-10-20T11:51:05.000Z,selenium_x_scraper_v1,โครตอุบาดอะอิเหี้ย,โครตอุบาดอะอิเหี้ย,2025-11-29 08:18:55,"['โค', 'รต', 'อุ', 'บาด', 'อะ', 'อิ', 'เหี้ย']"
1980240725557293391,twitter,post,https://x.com/thekingofotaku/status/1980240725557293391,text,2025-10-20T11:52:34.000Z,selenium_x_scraper_v1,"ยังไง ?
ก็แค่อยากเห็นบิกินี่
อุบาทว์ไงวะ?","ยังไง ?
ก็แค่อยากเห็นบิกินี่
อุบาทว์ไงวะ?",2025-11-29 08:18:55,"['ยังไง', ' ', '?', ' ', 'ก็', 'แค่', 'อยาก', 'เห็น', 'บิกินี่', ' ', 'อุบาทว์', 'ไง', 'วะ', '?']"
1980244971967123584,twitter,post,https://x.com/num_nim54/status/1980244971967123584,text,2025-10-20T12:09:27.000Z,selenium_x_scraper_v1,มันอุบาทว์ทุกอย่างเหมือนโรคจิตอะจะไปอยากเห็นเขาใส่บิกินี่,มันอุบาทว์ทุกอย่างเหมือนโรคจิตอะจะไปอยากเห็นเขาใส่บิกินี่,2025-11-29 08:18:55,"['มัน', 'อุบาทว์', 'ทุกอย่าง', 'เหมือน', 'โรคจิต', 'อะ', 'จะ', 'ไป', 'อยาก', 'เห็น', 'เขา', 'ใส่', 'บิกินี่']"
1980245530816209375,twitter,post,https://x.com/thekingofotaku/status/1980245530816209375,text,2025-10-20T12:11:40.000Z,selenium_x_scraper_v1,"แล้วทำไมวะ?
ถ่ายบิกินี่ลงphotobook ?
โลกจะแตกเหรอ
ก็บิกินี่ไง
เออถ้ากูอยากเห็นมิวสิคใส่บิกินี่ในที่สาธารณะให้มิงสิคอับอายผู้คน ว่าไปอย่าง","แล้วทำไมวะ?
ถ่ายบิกินี่ลงphotobook ?
โลกจะแตกเหรอ
ก็บิกินี่ไง
เออถ้ากูอยากเห็นมิวสิคใส่บิกินี่ในที่สาธารณะให้มิงสิคอับอายผู้คน ว่าไปอย่าง",2025-11-29 08:18:55,"['แล้ว', 'ทำไม', 'วะ', '?', ' ', 'ถ่าย', 'บิกินี่', 'ลง', 'photobook', ' ', '?', ' ', 'โลก', 'จะ', 'แตก', 'เหรอ', ' ', 'ก็', 'บิกินี่', 'ไง', ' ', 'เออ', 'ถ้า', 'กู', 'อยาก', 'เห็น', 'มิวสิค', 'ใส่', 'บิกินี่', 'ใน', 'ที่สาธารณะ', 'ให้', 'มิ', 'ง', 'สิ', 'ค', 'อับอาย', 'ผู้คน', ' ', 'ว่า', 'ไป', 'อย่าง']"
1980250866583278027,twitter,post,https://x.com/num_nim54/status/1980250866583278027,text,2025-10-20T12:32:52.000Z,selenium_x_scraper_v1,งั้นเจนิสใส่ชุดนั่งวินไปทำงานมันทำไมวะ จักรวาลจะระเบิดอ่อ,งั้นเจนิสใส่ชุดนั่งวินไปทำงานมันทำไมวะ จักรวาลจะระเบิดอ่อ,2025-11-29 08:18:55,"['งั้น', 'เจ', 'นิ', 'ส', 'ใส่', 'ชุด', 'นั่ง', 'วิน', 'ไป', 'ทำงาน', 'มัน', 'ทำไม', 'วะ', ' ', 'จักรวาล', 'จะ', 'ระเบิด', 'อ่อ']"
