id,platform,platform_type,url,content_type,timestamp,scraper_module,text,raw_text,scrape_date,tokens
1988100338164134364,twitter,post,https://x.com/GrandAboveAll/status/1988100338164134364,text,2025-11-11T04:23:52.000Z,selenium_x_scraper_v1,สร้างจากนวนิยาย โดยกะเทยKingแต่งหญิงแมน ๆ ครัช,สร้างจากนวนิยาย โดยกะเทยKingแต่งหญิงแมน ๆ ครัช,2025-11-29 08:18:55,"['สร้าง', 'จาก', 'นวนิยาย', ' ', 'โดย', 'กะเทย', 'king', 'แต่ง', 'หญิง', 'แมน', ' ', 'ๆ', ' ', 'ค', 'รัช']"
1987900380211229026,twitter,post,https://x.com/TheDuke955/status/1987900380211229026,text,2025-11-10T15:09:18.000Z,selenium_x_scraper_v1,จ๊อกลดาเวอร์ พวกจะเทย,จ๊อกลดาเวอร์ พวกจะเทย,2025-11-29 08:18:55,"['จ๊อก', 'ลดา', 'เวอร์', ' ', 'พวก', 'จะ', 'เท', 'ย']"
1987857848970481703,twitter,post,https://x.com/suphichphchrrt1/status/1987857848970481703,text,2025-11-10T12:20:18.000Z,selenium_x_scraper_v1,ผู้ชายชอบกระเทยนับเป็นเสรทครับ,ผู้ชายชอบกระเทยนับเป็นเสรทครับ,2025-11-29 08:18:55,"['ผู้ชาย', 'ชอบ', 'กระ', 'เท', 'ย', 'นับ', 'เป็น', 'เส', 'รท', 'ครับ']"
1988447336406851695,twitter,post,https://x.com/Yuna57254070023/status/1988447336406851695,text,2025-11-12T03:22:43.000Z,selenium_x_scraper_v1,เราเป็น จขพ โพสต์นี้นะคะ ขอแจ้งว่ามันคือเรื่องจริงค่ะ แต่เราคงไม่ต้องลงหลักฐานอะไรเนอะเพราะว่า ต้นโพสต์เราลงถามในกลุ่มปิดที่เป็นกลุ่มพูดคุยสอบถาม แล้วก็เราไม่ควรเอารสนิยมของตัวเองมาตัดสินคนนะคะ ,เราเป็น จขพ โพสต์นี้นะคะ ขอแจ้งว่ามันคือเรื่องจริงค่ะ แต่เราคงไม่ต้องลงหลักฐานอะไรเนอะเพราะว่า ต้นโพสต์เราลงถามในกลุ่มปิดที่เป็นกลุ่มพูดคุยสอบถาม แล้วก็เราไม่ควรเอารสนิยมของตัวเองมาตัดสินคนนะคะ ,2025-11-29 08:18:55,"['เรา', 'เป็น', ' ', 'จขพ', ' ', 'โพสต์', 'นี้', 'นะคะ', ' ', 'ขอ', 'แจ้ง', 'ว่า', 'มัน', 'คือ', 'เรื่องจริง', 'ค่ะ', ' ', 'แต่', 'เรา', 'คง', 'ไม่ต้อง', 'ลง', 'หลักฐาน', 'อะไร', 'เนอะ', 'เพราะว่า', ' ', 'ต้น', 'โพสต์', 'เรา', 'ลง', 'ถาม', 'ใน', 'กลุ่ม', 'ปิด', 'ที่', 'เป็น', 'กลุ่ม', 'พูดคุย', 'สอบถาม', ' ', 'แล้วก็', 'เรา', 'ไม่', 'ควร', 'เอา', 'รสนิยม', 'ของ', 'ตัวเอง', 'มา', 'ตัดสิน', 'คน', 'นะคะ']"
1987948623821500521,twitter,post,https://x.com/YouDeadAssBitch/status/1987948623821500521,text,2025-11-10T18:21:00.000Z,selenium_x_scraper_v1,",นี่คือข่มขืนนี่",",นี่คือข่มขืนนี่",2025-11-29 08:18:55,"[',', 'นี่', 'คือ', 'ข่มขืน', 'นี่']"
1988375529838477633,twitter,post,https://x.com/kaewnam4949/status/1988375529838477633,text,2025-11-11T22:37:23.000Z,selenium_x_scraper_v1,สมน้ำหน้ามันค่ะ,สมน้ำหน้ามันค่ะ,2025-11-29 08:18:55,"['สมน้ำหน้า', 'มัน', 'ค่ะ']"
1988091615328772278,twitter,post,https://x.com/TPotchana/status/1988091615328772278,text,2025-11-11T03:49:12.000Z,selenium_x_scraper_v1,เปลี่ยนเกให้เป็นกาย ,เปลี่ยนเกให้เป็นกาย ,2025-11-29 08:18:55,"['เปลี่ยน', 'เก', 'ให้', 'เป็น', 'กาย']"
1988267651374997893,twitter,post,https://x.com/WirotChimw68798/status/1988267651374997893,text,2025-11-11T15:28:42.000Z,selenium_x_scraper_v1,ดีใจด้วยที่คุณเหมือนกระเทย จนเกย์เชื่อ,ดีใจด้วยที่คุณเหมือนกระเทย จนเกย์เชื่อ,2025-11-29 08:18:55,"['ดีใจ', 'ด้วย', 'ที่', 'คุณ', 'เหมือน', 'กระ', 'เท', 'ย', ' ', 'จน', 'เกย์', 'เชื่อ']"
1988218980453212446,twitter,post,https://x.com/bitzhzh/status/1988218980453212446,text,2025-11-11T12:15:18.000Z,selenium_x_scraper_v1,ถ้าเกย์กินกี อาจจะไม่ใช่เกย์แล้วหละ,ถ้าเกย์กินกี อาจจะไม่ใช่เกย์แล้วหละ,2025-11-29 08:18:55,"['ถ้า', 'เกย์', 'กิน', 'กี', ' ', 'อาจจะ', 'ไม่', 'ใช่', 'เกย์', 'แล้วหละ']"
1988124423535349946,twitter,post,https://x.com/KChun37033/status/1988124423535349946,text,2025-11-11T05:59:34.000Z,selenium_x_scraper_v1,เสื้อ JungT,เสื้อ JungT,2025-11-29 08:18:55,"['เสื้อ', ' ', 'jungt']"
1987821998790336809,twitter,post,https://x.com/soheeoh69/status/1987821998790336809,text,2025-11-10T09:57:51.000Z,selenium_x_scraper_v1,น่าจะไบรุก ได้ทั้ง หญิง กระเทย อาจจะรวม เกย์รับน่ารักๆด้วย ถ้าตัดเกย์รับออกคือชายแท้กินงู,น่าจะไบรุก ได้ทั้ง หญิง กระเทย อาจจะรวม เกย์รับน่ารักๆด้วย ถ้าตัดเกย์รับออกคือชายแท้กินงู,2025-11-29 08:18:55,"['น่าจะ', 'ไบ', 'รุก', ' ', 'ได้', 'ทั้ง', ' ', 'หญิง', ' ', 'กระ', 'เท', 'ย', ' ', 'อาจจะ', 'รวม', ' ', 'เกย์', 'รับ', 'น่ารัก', 'ๆ', 'ด้วย', ' ', 'ถ้า', 'ตัด', 'เกย์', 'รับ', 'ออก', 'คือ', 'ชาย', 'แท้', 'กิน', 'งู']"
1988248037412749722,twitter,post,https://x.com/Shy_Yed_Shy/status/1988248037412749722,text,2025-11-11T14:10:46.000Z,selenium_x_scraper_v1,แล้วเกย์รุกที่ชอบเย็ดทรานซ์แปลงเป็นชายที่ยังมีกีล่ะ ?,แล้วเกย์รุกที่ชอบเย็ดทรานซ์แปลงเป็นชายที่ยังมีกีล่ะ ?,2025-11-29 08:18:55,"['แล้ว', 'เกย์', 'รุก', 'ที่', 'ชอบ', 'เย็ด', 'ทรานซ์', 'แปลง', 'เป็น', 'ชาย', 'ที่', 'ยังมี', 'กี', 'ล่ะ', ' ', '?']"
1988044643779617212,twitter,post,https://x.com/gay2straigbyred/status/1988044643779617212,text,2025-11-11T00:42:33.000Z,selenium_x_scraper_v1,เกย์อยากรุมชะนีทักมาทวิตนี้ได้เลยน้าา,เกย์อยากรุมชะนีทักมาทวิตนี้ได้เลยน้าา,2025-11-29 08:18:55,"['เกย์', 'อยาก', 'รุม', 'ชะนี', 'ทัก', 'มา', 'ทวิ', 'ต', 'นี้', 'ได้', 'เลย', 'น้า', 'า']"
1987917130898248117,twitter,post,https://x.com/NTP09388242/status/1987917130898248117,text,2025-11-10T16:15:52.000Z,selenium_x_scraper_v1,"[แท้100%]เสื้อ Stussy รุ่น Fuzzy Dice SS Tee AU พร้อมส่งUnisex

พิกัด : https://s.shopee.co.th/8zvGgn62vA","[แท้100%]เสื้อ Stussy รุ่น Fuzzy Dice SS Tee AU พร้อมส่งUnisex

พิกัด : https://s.shopee.co.th/8zvGgn62vA",2025-11-29 08:18:55,"['แท้', '100', ' ', 'เสื้อ', ' ', 'stussy', ' ', 'รุ่น', ' ', 'fuzzy', ' ', 'dice', ' ', 'ss', ' ', 'tee', ' ', 'au', ' ', 'พร้อม', 'ส่ง', 'unisex', ' ', 'พิกัด']"
1988056784347811974,twitter,post,https://x.com/iamluckygirJT/status/1988056784347811974,text,2025-11-11T01:30:48.000Z,selenium_x_scraper_v1,งง นะ น้อง LGBTQ ก็เป็นรุก ทรงแบบ ช แท้ น้องก็ไม่นี่ กับพี่สาวสองหรือสาวแท้นะ เขาฟีลอยากกับเคะ ด้วยกันเท่านั้นอ่ะ แต่งจอยเปล่าน้อออ,งง นะ น้อง LGBTQ ก็เป็นรุก ทรงแบบ ช แท้ น้องก็ไม่นี่ กับพี่สาวสองหรือสาวแท้นะ เขาฟีลอยากกับเคะ ด้วยกันเท่านั้นอ่ะ แต่งจอยเปล่าน้อออ,2025-11-29 08:18:55,"['งง', ' ', 'นะ', ' ', 'น้อง', ' ', 'lgbtq', ' ', 'ก็', 'เป็น', 'รุก', ' ', 'ทรง', 'แบบ', ' ', 'ช', ' ', 'แท้', ' ', 'น้อง', 'ก็', 'ไม่', 'นี่', ' ', 'กับ', 'พี่สาว', 'สอง', 'หรือ', 'สาว', 'แท้', 'นะ', ' ', 'เขา', 'ฟี', 'ล', 'อยาก', 'กับ', 'เคะ', ' ', 'ด้วยกัน', 'เท่านั้น', 'อ่ะ', ' ', 'แต่ง', 'จอ', 'ย', 'เปล่า', 'น้อออ']"
1988077603706785920,twitter,post,https://x.com/nuntawatcnx/status/1988077603706785920,text,2025-11-11T02:53:32.000Z,selenium_x_scraper_v1,หญิงแท้ ไม่ควรนะค่ะ เอาไปประหาร อีห่าาาาา,หญิงแท้ ไม่ควรนะค่ะ เอาไปประหาร อีห่าาาาา,2025-11-29 08:18:55,"['หญิง', 'แท้', ' ', 'ไม่', 'ควร', 'นะ', 'ค่ะ', ' ', 'เอา', 'ไป', 'ประหาร', ' ', 'อี', 'ห่า', 'าาาา']"
1987982108288315826,twitter,post,https://x.com/CLSR_pound/status/1987982108288315826,text,2025-11-10T20:34:04.000Z,selenium_x_scraper_v1,เป็นไปไม่ได้ ฟ้าผ่าอีห่า เกย์เค้าไม่แตะสาวเลยจ่ะ มีนมมาก็คือปัดตุ้บ!! จบ,เป็นไปไม่ได้ ฟ้าผ่าอีห่า เกย์เค้าไม่แตะสาวเลยจ่ะ มีนมมาก็คือปัดตุ้บ!! จบ,2025-11-29 08:18:55,"['เป็นไปไม่ได้', ' ', 'ฟ้าผ่า', 'อี', 'ห่า', ' ', 'เกย์', 'เค้า', 'ไม่', 'แตะ', 'สาว', 'เลย', 'จ่ะ', ' ', 'มี', 'นม', 'มา', 'ก็', 'คือ', 'ปัด', 'ตุ้บ', '!', ' ', 'จบ']"
1987891571862467035,twitter,post,https://x.com/TheSCN7/status/1987891571862467035,text,2025-11-10T14:34:18.000Z,selenium_x_scraper_v1,เสวดี,เสวดี,2025-11-29 08:18:55,"['เส', 'วดี']"
1987835766207311923,twitter,post,https://x.com/g_sarang25602/status/1987835766207311923,text,2025-11-10T10:52:33.000Z,selenium_x_scraper_v1,ขออนุญาตนะคะ,ขออนุญาตนะคะ,2025-11-29 08:18:55,"['ขออนุญาต', 'นะคะ']"
1988227692777664848,twitter,post,https://x.com/ubon5665/status/1988227692777664848,text,2025-11-11T12:49:56.000Z,selenium_x_scraper_v1,แย่มาก,แย่มาก,2025-11-29 08:18:55,['แย่มาก']
1988161405401657577,twitter,post,https://x.com/SKhiawsaar89259/status/1988161405401657577,text,2025-11-11T08:26:31.000Z,selenium_x_scraper_v1,"OMG  
KATHY AMREZ 3B CREAM GOLD แป้งทิ้นสูตรโกล์ด หน้าเด้ง5g. (สินค้าเดี่ยว) ในราคา ฿189 ที่ Shopee https://s.shopee.co.th/3LIvcdILtA","OMG  
KATHY AMREZ 3B CREAM GOLD แป้งทิ้นสูตรโกล์ด หน้าเด้ง5g. (สินค้าเดี่ยว) ในราคา ฿189 ที่ Shopee https://s.shopee.co.th/3LIvcdILtA",2025-11-29 08:18:55,"['omg', ' ', 'kathy', ' ', 'amrez', ' ', '3', 'b', ' ', 'cream', ' ', 'gold', ' ', 'แป้ง', 'ทิ้น', 'สูตร', 'โก', 'ล์ด', ' ', 'หน้า', 'เด้ง', '5', 'g', '.', ' ', 'สินค้า', 'เดี่ยว', ' ', 'ใน', 'ราคา', ' ', '฿', '189', ' ', 'ที่', ' ', 'shopee']"
1988176752355799224,twitter,post,https://x.com/WaXrarak25616/status/1988176752355799224,text,2025-11-11T09:27:30.000Z,selenium_x_scraper_v1,เลี่ยหู้มากค่ะ รับไม่ได้ค่-,เลี่ยหู้มากค่ะ รับไม่ได้ค่-,2025-11-29 08:18:55,"['เลี่ยหู้', 'มาก', 'ค่ะ', ' ', 'รับ', 'ไม่', 'ได้', 'ค่']"
1987919258010218811,twitter,post,https://x.com/pirachpp/status/1987919258010218811,text,2025-11-10T16:24:19.000Z,selenium_x_scraper_v1,เกย์รุกเหี้ยที่ไหน เห็นหีแล้วควยรุกวะ. มึงก็ตอแหลตามประสาหญิงจริงๆ,เกย์รุกเหี้ยที่ไหน เห็นหีแล้วควยรุกวะ. มึงก็ตอแหลตามประสาหญิงจริงๆ,2025-11-29 08:18:55,"['เกย์', 'รุก', 'เหี้ย', 'ที่ไหน', ' ', 'เห็น', 'หี', 'แล้ว', 'ควย', 'รุก', 'วะ', '.', ' ', 'มึง', 'ก็', 'ตอแหล', 'ตามประสา', 'หญิง', 'จริงๆ']"
1987877653572104266,twitter,post,https://x.com/Alis96740682/status/1987877653572104266,text,2025-11-10T13:39:00.000Z,selenium_x_scraper_v1,ตั้งคำนิยามกันขึ้นมาให้วุ่นวาย แค่มนุษย์2 คน,ตั้งคำนิยามกันขึ้นมาให้วุ่นวาย แค่มนุษย์2 คน,2025-11-29 08:18:55,"['ตั้ง', 'คำนิยาม', 'กัน', 'ขึ้น', 'มา', 'ให้', 'วุ่นวาย', ' ', 'แค่', 'มนุษย์', '2', ' ', 'คน']"
1987902603683045882,twitter,post,https://x.com/bperaya38/status/1987902603683045882,text,2025-11-10T15:18:08.000Z,selenium_x_scraper_v1,ขนาดผมยาวมีนมมีงู ยังชอบเย็ดกับเกย์เลย 55555,ขนาดผมยาวมีนมมีงู ยังชอบเย็ดกับเกย์เลย 55555,2025-11-29 08:18:55,"['ขนาด', 'ผม', 'ยาว', 'มี', 'นม', 'มี', 'งู', ' ', 'ยัง', 'ชอบ', 'เย็ด', 'กับ', 'เกย์', 'เลย', ' ', 'หัวเราะ']"
1987913437540995191,twitter,post,https://x.com/Eaaaw/status/1987913437540995191,text,2025-11-10T16:01:11.000Z,selenium_x_scraper_v1,ใช่ครับต้องมีงูครับเกย์ถึงจะสนใจ ถ้ามีกี เกย์ไม่เอาครับ,ใช่ครับต้องมีงูครับเกย์ถึงจะสนใจ ถ้ามีกี เกย์ไม่เอาครับ,2025-11-29 08:18:55,"['ใช่', 'ครับ', 'ต้อง', 'มี', 'งู', 'ครับ', 'เกย์', 'ถึง', 'จะ', 'สนใจ', ' ', 'ถ้า', 'มี', 'กี', ' ', 'เกย์', 'ไม่', 'เอา', 'ครับ']"
1987910763944841365,twitter,post,https://x.com/beebee2275/status/1987910763944841365,text,2025-11-10T15:50:34.000Z,selenium_x_scraper_v1,เดี่ยวนี้มันความลื่นไหลทางเพศเยอะค่ะเพื่อนเราก็คบกับพี่กะเทยผมยาวมีงูตอนนี้แพลนจะแต่งกันแล้วด้วยย แต่กรณีในโพสต์นี่ก็คิดว่าอาจจะการละคร,เดี่ยวนี้มันความลื่นไหลทางเพศเยอะค่ะเพื่อนเราก็คบกับพี่กะเทยผมยาวมีงูตอนนี้แพลนจะแต่งกันแล้วด้วยย แต่กรณีในโพสต์นี่ก็คิดว่าอาจจะการละคร,2025-11-29 08:18:55,"['เดี่ยว', 'นี้', 'มัน', 'ความ', 'ลื่นไหล', 'ทางเพศ', 'เยอะ', 'ค่ะ', 'เพื่อน', 'เรา', 'ก็', 'คบ', 'กับ', 'พี่', 'กะเทย', 'ผม', 'ยาว', 'มี', 'งู', 'ตอนนี้', 'แพลน', 'จะ', 'แต่ง', 'กัน', 'แล้วด้วย', 'ย', ' ', 'แต่', 'กรณี', 'ใน', 'โพสต์', 'นี่', 'ก็', 'คิด', 'ว่า', 'อาจจะ', 'การละคร']"
1987934062615622007,twitter,post,https://x.com/mukamuka1988/status/1987934062615622007,text,2025-11-10T17:23:09.000Z,selenium_x_scraper_v1,เพื่อนนี่เกย์รุก เยเย่ได้หมดทั้งเกย์ ทั้งกี กะเทยเยกียังมี อะไรก็เกิดขึ้นได้บนโลกนี้อะเธอ ,เพื่อนนี่เกย์รุก เยเย่ได้หมดทั้งเกย์ ทั้งกี กะเทยเยกียังมี อะไรก็เกิดขึ้นได้บนโลกนี้อะเธอ ,2025-11-29 08:18:55,"['เพื่อน', 'นี่', 'เกย์', 'รุก', ' ', 'เย', 'เย่', 'ได้', 'หมด', 'ทั้ง', 'เกย์', ' ', 'ทั้ง', 'กี', ' ', 'กะเทย', 'เย', 'กี', 'ยังมี', ' ', 'อะไร', 'ก็', 'เกิดขึ้น', 'ได้', 'บน', 'โลก', 'นี้', 'อะ', 'เธอ']"
1987984499469345270,twitter,post,https://x.com/losgirl1nternet/status/1987984499469345270,text,2025-11-10T20:43:34.000Z,selenium_x_scraper_v1,ไม่ละครค่ะ ต้นทางมีการเอาทั้งคลิปเสียง ทั้งรูปของเกย์คนนั้นมาเม้นในคอมเม้นค่ะ (ปิดหน้าไว้แล้ว),ไม่ละครค่ะ ต้นทางมีการเอาทั้งคลิปเสียง ทั้งรูปของเกย์คนนั้นมาเม้นในคอมเม้นค่ะ (ปิดหน้าไว้แล้ว),2025-11-29 08:18:55,"['ไม่', 'ละคร', 'ค่ะ', ' ', 'ต้นทาง', 'มี', 'การ', 'เอา', 'ทั้ง', 'คลิป', 'เสียง', ' ', 'ทั้ง', 'รูป', 'ของ', 'เกย์', 'คน', 'นั้น', 'มา', 'เม้น', 'ใน', 'คอม', 'เม้น', 'ค่ะ', ' ', 'ปิดหน้า', 'ไว้', 'แล้ว']"
1988094367425503367,twitter,post,https://x.com/DogWitz/status/1988094367425503367,text,2025-11-11T04:00:08.000Z,selenium_x_scraper_v1,มันมีนะครับเยอะด้วย คลิปที่เกย์ไปเยกับ ทรานส์แมนที่มีกี ละนี่ชอบดูมาก 55,มันมีนะครับเยอะด้วย คลิปที่เกย์ไปเยกับ ทรานส์แมนที่มีกี ละนี่ชอบดูมาก 55,2025-11-29 08:18:55,"['มัน', 'มี', 'นะ', 'ครับ', 'เยอะ', 'ด้วย', ' ', 'คลิป', 'ที่', 'เกย์', 'ไป', 'เย', 'กับ', ' ', 'ทรานส์', 'แมน', 'ที่', 'มี', 'กี', ' ', 'ละ', 'นี่', 'ชอบ', 'ดู', 'มาก', ' ', '55']"
1988047343527276727,twitter,post,https://x.com/Ta1y8/status/1988047343527276727,text,2025-11-11T00:53:17.000Z,selenium_x_scraper_v1,พูดถู้กกกกกก เกแท้ไม่ยุ่งทางไหนยกเว้นเกกันเองกับชายแท้ ถ้าเผลอตัวให้ญ.ไม่ว่าจะสเตรทกะเทยทรานส์เลสอะไรใดๆก็ตามคือไม่ใช่ละ เกปล๊อม,พูดถู้กกกกกก เกแท้ไม่ยุ่งทางไหนยกเว้นเกกันเองกับชายแท้ ถ้าเผลอตัวให้ญ.ไม่ว่าจะสเตรทกะเทยทรานส์เลสอะไรใดๆก็ตามคือไม่ใช่ละ เกปล๊อม,2025-11-29 08:18:55,"['พูด', 'ถู้กกกกกก', ' ', 'เก', 'แท้', 'ไม่', 'ยุ่ง', 'ทาง', 'ไหน', 'ยกเว้น', 'เก', 'กันเอง', 'กับ', 'ชาย', 'แท้', ' ', 'ถ้า', 'เผลอตัว', 'ให้', 'ญ', '.', 'ไม่', 'ว่า', 'จะ', 'ส', 'เต', 'รท', 'กะเทย', 'ทรานส์', 'เลส', 'อะไร', 'ใดๆ', 'ก็ตาม', 'คือ', 'ไม่', 'ใช่', 'ละ', ' ', 'เก', 'ปล๊อม']"
1988060547737416129,twitter,post,https://x.com/undeath131/status/1988060547737416129,text,2025-11-11T01:45:45.000Z,selenium_x_scraper_v1,แบบนี้ต้องเรียกไบ,แบบนี้ต้องเรียกไบ,2025-11-29 08:18:55,"['แบบนี้', 'ต้อง', 'เรียก', 'ไบ']"
1988250552753643675,twitter,post,https://x.com/ramlop_69/status/1988250552753643675,text,2025-11-11T14:20:46.000Z,selenium_x_scraper_v1,เกย์เยกีเยอะมากนะช่วงนี้ แต่ส่วนมากก็แค่เรื่อง sex นี่ล่ะ ถ้าพัฒนาความสัมพันธ์ถึงขั้นแฟน เหมือนว่าเขาก็ยังชอบเกย์ชอบผู้ชาย แค่เยกีได้ อะไรประมาณนั้น,เกย์เยกีเยอะมากนะช่วงนี้ แต่ส่วนมากก็แค่เรื่อง sex นี่ล่ะ ถ้าพัฒนาความสัมพันธ์ถึงขั้นแฟน เหมือนว่าเขาก็ยังชอบเกย์ชอบผู้ชาย แค่เยกีได้ อะไรประมาณนั้น,2025-11-29 08:18:55,"['เกย์', 'เย', 'กี', 'เยอะ', 'มาก', 'นะ', 'ช่วงนี้', ' ', 'แต่', 'ส่วนมาก', 'ก็', 'แค่', 'เรื่อง', ' ', 'sex', ' ', 'นี่', 'ล่ะ', ' ', 'ถ้า', 'พัฒนา', 'ความสัมพันธ์', 'ถึงขั้น', 'แฟน', ' ', 'เหมือนว่า', 'เขา', 'ก็', 'ยัง', 'ชอบ', 'เกย์', 'ชอบ', 'ผู้ชาย', ' ', 'แค่', 'เย', 'กี', 'ได้', ' ', 'อะไร', 'ประมาณ', 'นั้น']"
