id,platform,platform_type,url,content_type,timestamp,scraper_module,text,raw_text,scrape_date,tokens
1635284845965488128,twitter,post,https://x.com/crta_me/status/1635284845965488128,text,2023-03-13T14:21:04.000Z,selenium_x_scraper_v1,ผมไปฟิตเนสกับเพื่อนอาทิตย์ล่ะสองสามครั้งอยู่แล้ว เพราะงั้นบอกเลยว่าไม่ยากแค่มีระเบียบวินัยก็พอ,ผมไปฟิตเนสกับเพื่อนอาทิตย์ล่ะสองสามครั้งอยู่แล้ว เพราะงั้นบอกเลยว่าไม่ยากแค่มีระเบียบวินัยก็พอ,2025-10-23 17:59:34,"['ผม', 'ไป', 'ฟิตเนส', 'กับ', 'เพื่อน', 'อาทิตย์', 'ล่ะ', 'สอง', 'สาม', 'ครั้ง', 'อยู่แล้ว', ' ', 'เพราะ', 'งั้น', 'บอก', 'เลย', 'ว่า', 'ไม่', 'ยาก', 'แค่', 'มี', 'ระเบียบวินัย', 'ก็', 'พอ']"
1635273635312316417,twitter,post,https://x.com/chubbyBaddiexx/status/1635273635312316417,text,2023-03-13T13:36:31.000Z,selenium_x_scraper_v1,นี่แค่ส่วนนึงยังไม่ใช่ทั้งหมดของการทำงานแบบนี้นะ แจ้งให้ทราบเผื่อคิดเองไม่เป็นอีก,นี่แค่ส่วนนึงยังไม่ใช่ทั้งหมดของการทำงานแบบนี้นะ แจ้งให้ทราบเผื่อคิดเองไม่เป็นอีก,2025-10-23 17:59:34,"['นี่', 'แค่', 'ส่วน', 'นึง', 'ยัง', 'ไม่', 'ใช่', 'ทั้งหมด', 'ของ', 'การทำงาน', 'แบบนี้', 'นะ', ' ', 'แจ้งให้ทราบ', 'เผื่อ', 'คิด', 'เอง', 'ไม่', 'เป็น', 'อีก']"
1635284419291529220,twitter,post,https://x.com/crta_me/status/1635284419291529220,text,2023-03-13T14:19:22.000Z,selenium_x_scraper_v1,แต่โดยรวมหลักๆแล้วมันก็คือการขายคลิปโป็ไม่ใช่หรอครับ ?,แต่โดยรวมหลักๆแล้วมันก็คือการขายคลิปโป็ไม่ใช่หรอครับ ?,2025-10-23 17:59:34,"['แต่', 'โดยรวม', 'หลัก', 'ๆ', 'แล้ว', 'มัน', 'ก็', 'คือ', 'การ', 'ขาย', 'คลิป', 'โป', '็', 'ไม่', 'ใช่', 'หรอ', 'ครับ', ' ', '?']"
1634833797387796481,twitter,post,https://x.com/karenkawaii251/status/1634833797387796481,text,2023-03-12T08:28:45.000Z,selenium_x_scraper_v1,ยังไม่ตาย แต่เจียนแล้วว ยังมีทริปถ่ายรูปอยู่เรื่อยๆค่ะ แต่ร่างกายไม่ค่อยอำนวยเลย ต้องพักยาวมากๆ ส่วนมากมีแต่งานอัพในแอคล็อค,ยังไม่ตาย แต่เจียนแล้วว ยังมีทริปถ่ายรูปอยู่เรื่อยๆค่ะ แต่ร่างกายไม่ค่อยอำนวยเลย ต้องพักยาวมากๆ ส่วนมากมีแต่งานอัพในแอคล็อค,2025-10-23 17:59:34,"['ยัง', 'ไม่', 'ตาย', ' ', 'แต่', 'เจียน', 'แล้ว', 'ว', ' ', 'ยังมี', 'ทริป', 'ถ่ายรูป', 'อยู่', 'เรื่อยๆ', 'ค่ะ', ' ', 'แต่', 'ร่างกาย', 'ไม่ค่อย', 'อำนวย', 'เลย', ' ', 'ต้อง', 'พัก', 'ยาว', 'มาก', 'ๆ', ' ', 'ส่วนมาก', 'มี', 'แต่', 'งาน', 'อัพ', 'ใน', 'แอ', 'ค', 'ล็อค']"
1635159577703641088,twitter,post,https://x.com/karenkawaii251/status/1635159577703641088,text,2023-03-13T06:03:17.000Z,selenium_x_scraper_v1,"คุณทำงานหรือเรียนอยู่คะนี่อยากรู้ และทุกวันนี้ทำพ่อแม่ภูมิใจหรือยัง ถ้ายังค่อยมากระแหนะกระแหนคนอื่นเนอะ ถ้าทำสำเร็จก็ยินดีด้วยค่ะ 
ส่วนพ่อแม่เราไม่ว่าอยู่แล้ว เพราะเราประสบความสำเร็จไปแล้วค่ะ มาถึงที่หมายแล้ว นี่มาทำเล่นๆ ตามความชอบเฉยๆ ","คุณทำงานหรือเรียนอยู่คะนี่อยากรู้ และทุกวันนี้ทำพ่อแม่ภูมิใจหรือยัง ถ้ายังค่อยมากระแหนะกระแหนคนอื่นเนอะ ถ้าทำสำเร็จก็ยินดีด้วยค่ะ 
ส่วนพ่อแม่เราไม่ว่าอยู่แล้ว เพราะเราประสบความสำเร็จไปแล้วค่ะ มาถึงที่หมายแล้ว นี่มาทำเล่นๆ ตามความชอบเฉยๆ ",2025-10-23 17:59:34,"['คุณ', 'ทำงาน', 'หรือ', 'เรียน', 'อยู่', 'คะ', 'นี่', 'อยากรู้', ' ', 'และ', 'ทุกวันนี้', 'ทำ', 'พ่อแม่', 'ภูมิใจ', 'หรือยัง', ' ', 'ถ้า', 'ยัง', 'ค่อย', 'มา', 'กระแหนะกระแหน', 'คนอื่น', 'เนอะ', ' ', 'ถ้า', 'ทำสำเร็จ', 'ก็', 'ยินดี', 'ด้วย', 'ค่ะ', ' ', 'ส่วน', 'พ่อแม่', 'เรา', 'ไม่', 'ว่า', 'อยู่แล้ว', ' ', 'เพราะ', 'เรา', 'ประสบความสำเร็จ', 'ไป', 'แล้ว', 'ค่ะ', ' ', 'มาถึง', 'ที่หมาย', 'แล้ว', ' ', 'นี่', 'มา', 'ทำเล่นๆ', ' ', 'ตาม', 'ความชอบ', 'เฉย', 'ๆ']"
1635225910797557760,twitter,post,https://x.com/crta_me/status/1635225910797557760,text,2023-03-13T10:26:52.000Z,selenium_x_scraper_v1,พี่ทำเล่นๆทำไมต้องเก็บเงินด้วยอะครับ ? ทำเล่นๆหรือทำเป็นอาชีพ,พี่ทำเล่นๆทำไมต้องเก็บเงินด้วยอะครับ ? ทำเล่นๆหรือทำเป็นอาชีพ,2025-10-23 17:59:34,"['พี่', 'ทำเล่นๆ', 'ทำไม', 'ต้อง', 'เก็บ', 'เงิน', 'ด้วย', 'อะ', 'ครับ', ' ', '?', ' ', 'ทำเล่นๆ', 'หรือ', 'ทำเป็น', 'อาชีพ']"
1634941163068354561,twitter,post,https://x.com/karenkawaii251/status/1634941163068354561,text,2023-03-12T15:35:23.000Z,selenium_x_scraper_v1,วันนี้แอคล็อคมีอารายยย,วันนี้แอคล็อคมีอารายยย,2025-10-23 17:59:34,"['วันนี้', 'แอ', 'ค', 'ล็อค', 'มี', 'อา', 'ราย', 'ยย']"
1634984362856026113,twitter,post,https://x.com/crta_me/status/1634984362856026113,text,2023-03-12T18:27:03.000Z,selenium_x_scraper_v1,ทำแบบนี้ไม่กลัวผิดกฎหมายเหรอครับ,ทำแบบนี้ไม่กลัวผิดกฎหมายเหรอครับ,2025-10-23 17:59:34,"['ทำ', 'แบบนี้', 'ไม่', 'กลัว', 'ผิดกฎหมาย', 'เหรอ', 'ครับ']"
1633533761173475328,twitter,post,https://x.com/munchkin_annaa/status/1633533761173475328,text,2023-03-08T18:22:52.000Z,selenium_x_scraper_v1,ถ้างานแบบนี้เรียกว่า Low skill แล้วคุณทำได้ไหมล่ะคะ ถ่ายรูปอัพรูปทุกวัน และต้องได้เงินด้วยนะ ความสามารถของแต่ละคนไม่เหมือนกัน อย่าเอาความถนัดของตัวเองไปตัดสินงานที่ถนัดของคนอื่นน้า,ถ้างานแบบนี้เรียกว่า Low skill แล้วคุณทำได้ไหมล่ะคะ ถ่ายรูปอัพรูปทุกวัน และต้องได้เงินด้วยนะ ความสามารถของแต่ละคนไม่เหมือนกัน อย่าเอาความถนัดของตัวเองไปตัดสินงานที่ถนัดของคนอื่นน้า,2025-10-23 17:59:34,"['ถ้า', 'งาน', 'แบบนี้', 'เรียก', 'ว่า', ' ', 'low', ' ', 'skill', ' ', 'แล้ว', 'คุณ', 'ทำได้', 'ไหม', 'ล่ะ', 'คะ', ' ', 'ถ่ายรูป', 'อัพ', 'รูป', 'ทุกวัน', ' ', 'และ', 'ต้อง', 'ได้เงิน', 'ด้วย', 'นะ', ' ', 'ความสามารถ', 'ของ', 'แต่ละคน', 'ไม่', 'เหมือนกัน', ' ', 'อย่า', 'เอา', 'ความถนัด', 'ของ', 'ตัวเอง', 'ไป', 'ตัดสิน', 'งาน', 'ที่', 'ถนัด', 'ของ', 'คนอื่น', 'น้า']"
1633587805552279553,twitter,post,https://x.com/crta_me/status/1633587805552279553,text,2023-03-08T21:57:38.000Z,selenium_x_scraper_v1,ถ่ายรูปอัพรูปนี่มันยากแล้วเหรอครับ ?,ถ่ายรูปอัพรูปนี่มันยากแล้วเหรอครับ ?,2025-10-23 17:59:34,"['ถ่ายรูป', 'อัพ', 'รูป', 'นี่', 'มัน', 'ยาก', 'แล้ว', 'เหรอ', 'ครับ', ' ', '?']"
1633483776239239171,twitter,post,https://x.com/crta_me/status/1633483776239239171,text,2023-03-08T15:04:15.000Z,selenium_x_scraper_v1,ผมแค่มาเตือนเฉยๆว่าการเผยแพร่สื่อลามกลงในระบบคอมพิวเตอร์มันผิดกฎหมาย ปล.ถ้าพ่อแม่คุณภูมิใจก็ดีแล้วครับ low skill workers ไม่ใช่ไม่ดีนะครับหาเงินกับพวกโง่ๆได้ง่ายดี,ผมแค่มาเตือนเฉยๆว่าการเผยแพร่สื่อลามกลงในระบบคอมพิวเตอร์มันผิดกฎหมาย ปล.ถ้าพ่อแม่คุณภูมิใจก็ดีแล้วครับ low skill workers ไม่ใช่ไม่ดีนะครับหาเงินกับพวกโง่ๆได้ง่ายดี,2025-10-23 17:59:34,"['ผม', 'แค่', 'มา', 'เตือน', 'เฉย', 'ๆ', 'ว่าการ', 'เผยแพร่', 'สื่อลามก', 'ลง', 'ใน', 'ระบบ', 'คอมพิวเตอร์', 'มัน', 'ผิดกฎหมาย', ' ', 'ปล.', 'ถ้า', 'พ่อ', 'แม่คุณ', 'ภูมิใจ', 'ก็', 'ดีแล้ว', 'ครับ', ' ', 'low', ' ', 'skill', ' ', 'workers', ' ', 'ไม่', 'ใช่', 'ไม่', 'ดี', 'นะ', 'ครับ', 'หาเงิน', 'กับ', 'พวก', 'โง่', 'ๆ', 'ได้', 'ง่าย', 'ดี']"
1633220045198471171,twitter,post,https://x.com/crta_me/status/1633220045198471171,text,2023-03-07T21:36:17.000Z,selenium_x_scraper_v1,ไปหลอกพ่อมุงเถอะ,ไปหลอกพ่อมุงเถอะ,2025-10-23 17:59:34,"['ไป', 'หลอก', 'พ่อ', 'มุง', 'เถอะ']"
1630164856828723202,twitter,post,https://x.com/crta_me/status/1630164856828723202,text,2023-02-27T11:16:03.000Z,selenium_x_scraper_v1,ฝันดีครับ ชายแท้ไปล่ะ อย่าลืมนะครับ รักตัวเองมันยาก,ฝันดีครับ ชายแท้ไปล่ะ อย่าลืมนะครับ รักตัวเองมันยาก,2025-10-23 17:59:34,"['ฝันดี', 'ครับ', ' ', 'ชาย', 'แท้', 'ไป', 'ล่ะ', ' ', 'อย่า', 'ลืม', 'นะ', 'ครับ', ' ', 'รัก', 'ตัวเอง', 'มัน', 'ยาก']"
1630164724422938629,twitter,post,https://x.com/crta_me/status/1630164724422938629,text,2023-02-27T11:15:31.000Z,selenium_x_scraper_v1,จะรักอะไรก็รักได้ แต่รักตัวเองมันยาก,จะรักอะไรก็รักได้ แต่รักตัวเองมันยาก,2025-10-23 17:59:34,"['จะ', 'รัก', 'อะไร', 'ก็', 'รัก', 'ได้', ' ', 'แต่', 'รัก', 'ตัวเอง', 'มัน', 'ยาก']"
1630164650431221760,twitter,post,https://x.com/crta_me/status/1630164650431221760,text,2023-02-27T11:15:14.000Z,selenium_x_scraper_v1,แต่ก่อนผมจะกล่าวอำลา ขอให้ผมได้พูดเตือนอะไรซักหน่อยนะครับ,แต่ก่อนผมจะกล่าวอำลา ขอให้ผมได้พูดเตือนอะไรซักหน่อยนะครับ,2025-10-23 17:59:34,"['แต่ก่อน', 'ผม', 'จะ', 'กล่าว', 'อำลา', ' ', 'ขอให้', 'ผม', 'ได้', 'พูด', 'เตือน', 'อะไร', 'ซัก', 'หน่อย', 'นะ', 'ครับ']"
1630164285195431939,twitter,post,https://x.com/crta_me/status/1630164285195431939,text,2023-02-27T11:13:47.000Z,selenium_x_scraper_v1,แต่ก็ดีครับ ผมชายแท้ขอตัวลา,แต่ก็ดีครับ ผมชายแท้ขอตัวลา,2025-10-23 17:59:34,"['แต่', 'ก็ดี', 'ครับ', ' ', 'ผม', 'ชาย', 'แท้', 'ขอตัว', 'ลา']"
1630164212260696065,twitter,post,https://x.com/crta_me/status/1630164212260696065,text,2023-02-27T11:13:29.000Z,selenium_x_scraper_v1,6 โมงนี่ดึกแล้วเหรอ ?,6 โมงนี่ดึกแล้วเหรอ ?,2025-10-23 17:59:34,"['6', ' ', 'โมง', 'นี่', 'ดึก', 'แล้ว', 'เหรอ', ' ', '?']"
1630164121680478211,twitter,post,https://x.com/crta_me/status/1630164121680478211,text,2023-02-27T11:13:08.000Z,selenium_x_scraper_v1,มีอะไรเหรอครับ,มีอะไรเหรอครับ,2025-10-23 17:59:34,"['มี', 'อะไร', 'เหรอ', 'ครับ']"
1630163918743289856,twitter,post,https://x.com/crta_me/status/1630163918743289856,text,2023-02-27T11:12:19.000Z,selenium_x_scraper_v1,ผมชายแท้ก็ยังไม่บอกว่าคุณเป็นแบบนั้นเลยครับ ,ผมชายแท้ก็ยังไม่บอกว่าคุณเป็นแบบนั้นเลยครับ ,2025-10-23 17:59:34,"['ผม', 'ชาย', 'แท้', 'ก็', 'ยัง', 'ไม่', 'บอ', 'กว่า', 'คุณ', 'เป็น', 'แบบ', 'นั้น', 'เลย', 'ครับ']"
1630163792134025217,twitter,post,https://x.com/crta_me/status/1630163792134025217,text,2023-02-27T11:11:49.000Z,selenium_x_scraper_v1,ผมชายแท้เองครับ e na ngo,ผมชายแท้เองครับ e na ngo,2025-10-23 17:59:34,"['ผม', 'ชาย', 'แท้', 'เอง', 'ครับ', ' ', 'e', ' ', 'na', ' ', 'ngo']"
1630163624852598784,twitter,post,https://x.com/crta_me/status/1630163624852598784,text,2023-02-27T11:11:09.000Z,selenium_x_scraper_v1,,,2025-10-23 17:59:34,[]
1630163394929258496,twitter,post,https://x.com/crta_me/status/1630163394929258496,text,2023-02-27T11:10:14.000Z,selenium_x_scraper_v1,มันเป็นปัญเจกอะครับ ถ้าโง่พออาจจะคิดว่าเหมือนกันทุกคน,มันเป็นปัญเจกอะครับ ถ้าโง่พออาจจะคิดว่าเหมือนกันทุกคน,2025-10-23 17:59:34,"['มัน', 'เป็น', 'ปัญ', 'เจ', 'ก', 'อะ', 'ครับ', ' ', 'ถ้า', 'โง่', 'พอ', 'อาจจะ', 'คิด', 'ว่า', 'เหมือนกัน', 'ทุกคน']"
1630163229237465088,twitter,post,https://x.com/crta_me/status/1630163229237465088,text,2023-02-27T11:09:35.000Z,selenium_x_scraper_v1,ครับผมชายแท้,ครับผมชายแท้,2025-10-23 17:59:34,"['ครับผม', 'ชาย', 'แท้']"
1630163159234543617,twitter,post,https://x.com/crta_me/status/1630163159234543617,text,2023-02-27T11:09:18.000Z,selenium_x_scraper_v1,,,2025-10-23 17:59:34,[]
1630163077453975552,twitter,post,https://x.com/crta_me/status/1630163077453975552,text,2023-02-27T11:08:59.000Z,selenium_x_scraper_v1,จริงครับ,จริงครับ,2025-10-23 17:59:34,"['จริง', 'ครับ']"
1630163035737456643,twitter,post,https://x.com/crta_me/status/1630163035737456643,text,2023-02-27T11:08:49.000Z,selenium_x_scraper_v1,ครับผมขอเครียญงานแปปนึง จะได้หลับยาวๆ,ครับผมขอเครียญงานแปปนึง จะได้หลับยาวๆ,2025-10-23 17:59:34,"['ครับผม', 'ขอ', 'เครียญ', 'งาน', 'แป', 'ป', 'นึง', ' ', 'จะ', 'ได้', 'หลับ', 'ยาว', 'ๆ']"
1630162870871937024,twitter,post,https://x.com/crta_me/status/1630162870871937024,text,2023-02-27T11:08:10.000Z,selenium_x_scraper_v1,ก็เช่นพวก ตุ๊ด กระเทย ไงครับเป็นพวกวิปริตผิดเพศ ไม่เหมือนชายแท้อย่างเรา เกิดมาถูกเพศ,ก็เช่นพวก ตุ๊ด กระเทย ไงครับเป็นพวกวิปริตผิดเพศ ไม่เหมือนชายแท้อย่างเรา เกิดมาถูกเพศ,2025-10-23 17:59:34,"['ก็', 'เช่น', 'พวก', ' ', 'ตุ๊ด', ' ', 'กระ', 'เท', 'ย', ' ', 'ไง', 'ครับ', 'เป็น', 'พวก', 'วิปริต', 'ผิดเพศ', ' ', 'ไม่', 'เหมือน', 'ชาย', 'แท้', 'อย่าง', 'เรา', ' ', 'เกิด', 'มา', 'ถูก', 'เพศ']"
1630162595650076673,twitter,post,https://x.com/crta_me/status/1630162595650076673,text,2023-02-27T11:07:04.000Z,selenium_x_scraper_v1,เพราะเขาเกิดมาไม่ถูกเพศไงครับ คอมมอนเซ้น,เพราะเขาเกิดมาไม่ถูกเพศไงครับ คอมมอนเซ้น,2025-10-23 17:59:34,"['เพราะ', 'เขา', 'เกิด', 'มา', 'ไม่', 'ถูก', 'เพศ', 'ไง', 'ครับ', ' ', 'คอม', 'มอน', 'เซ้น']"
1630162399604121600,twitter,post,https://x.com/crta_me/status/1630162399604121600,text,2023-02-27T11:06:17.000Z,selenium_x_scraper_v1,ขึ้นอยู่กับสิ่งที่ชายแท้อย่างพวกเราคิดครับ,ขึ้นอยู่กับสิ่งที่ชายแท้อย่างพวกเราคิดครับ,2025-10-23 17:59:34,"['ขึ้นอยู่กับ', 'สิ่ง', 'ที่', 'ชาย', 'แท้', 'อย่าง', 'พวกเรา', 'คิด', 'ครับ']"
1630162261389225984,twitter,post,https://x.com/crta_me/status/1630162261389225984,text,2023-02-27T11:05:44.000Z,selenium_x_scraper_v1,ไม่ครับชายแท้ไม่เคยโง่อยู่แล้ว,ไม่ครับชายแท้ไม่เคยโง่อยู่แล้ว,2025-10-23 17:59:34,"['ไม่', 'ครับ', 'ชาย', 'แท้', 'ไม่', 'เคย', 'โง่', 'อยู่แล้ว']"
1630161968308047872,twitter,post,https://x.com/crta_me/status/1630161968308047872,text,2023-02-27T11:04:34.000Z,selenium_x_scraper_v1,6 โมงแล้วครับ คนจะหลับจะนอน,6 โมงแล้วครับ คนจะหลับจะนอน,2025-10-23 17:59:34,"['6', ' ', 'โมง', 'แล้ว', 'ครับ', ' ', 'คน', 'จะ', 'หลับ', 'จะ', 'นอน']"
1630161876817678336,twitter,post,https://x.com/crta_me/status/1630161876817678336,text,2023-02-27T11:04:13.000Z,selenium_x_scraper_v1,ผมไม่ชอบนะครับ ไม่ใช่พวกผิดเพศด้วยสิ,ผมไม่ชอบนะครับ ไม่ใช่พวกผิดเพศด้วยสิ,2025-10-23 17:59:34,"['ผม', 'ไม่', 'ชอบ', 'นะ', 'ครับ', ' ', 'ไม่', 'ใช่', 'พวก', 'ผิดเพศ', 'ด้วย', 'สิ']"
1630161784123572224,twitter,post,https://x.com/crta_me/status/1630161784123572224,text,2023-02-27T11:03:50.000Z,selenium_x_scraper_v1,nvm ผมยินดีอยู่แล้ว,nvm ผมยินดีอยู่แล้ว,2025-10-23 17:59:34,"['nvm', ' ', 'ผม', 'ยินดี', 'อยู่แล้ว']"
1630161644109324288,twitter,post,https://x.com/crta_me/status/1630161644109324288,text,2023-02-27T11:03:17.000Z,selenium_x_scraper_v1,ถ้าเอาไปลงสีก็อาจจะมีครับ,ถ้าเอาไปลงสีก็อาจจะมีครับ,2025-10-23 17:59:34,"['ถ้า', 'เอา', 'ไป', 'ลงสี', 'ก็', 'อาจจะ', 'มี', 'ครับ']"
1630161409136013314,twitter,post,https://x.com/crta_me/status/1630161409136013314,text,2023-02-27T11:02:21.000Z,selenium_x_scraper_v1,ทองแดงมีหลายความหมายครับ ขึ้นอยู่กับบริบทของผู้สื่อสาร และความฉลาดของผู้รับสาร,ทองแดงมีหลายความหมายครับ ขึ้นอยู่กับบริบทของผู้สื่อสาร และความฉลาดของผู้รับสาร,2025-10-23 17:59:34,"['ทองแดง', 'มี', 'หลาย', 'ความหมาย', 'ครับ', ' ', 'ขึ้นอยู่กับ', 'บริบท', 'ของ', 'ผู้', 'สื่อสาร', ' ', 'และ', 'ความ', 'ฉลาด', 'ของ', 'ผู้รับสาร']"
1630161259223216131,twitter,post,https://x.com/crta_me/status/1630161259223216131,text,2023-02-27T11:01:45.000Z,selenium_x_scraper_v1,ผมเอาออกไม่เป็นขอโทษด้วยคับ,ผมเอาออกไม่เป็นขอโทษด้วยคับ,2025-10-23 17:59:34,"['ผม', 'เอา', 'ออก', 'ไม่', 'เป็น', 'ขอโทษ', 'ด้วย', 'คับ']"
1630160970491510785,twitter,post,https://x.com/crta_me/status/1630160970491510785,text,2023-02-27T11:00:36.000Z,selenium_x_scraper_v1,แต่ก็ยินดีที่ได้รู้จักครับ คนใต้กินหลากหลาย,แต่ก็ยินดีที่ได้รู้จักครับ คนใต้กินหลากหลาย,2025-10-23 17:59:34,"['แต่', 'ก็', 'ยินดี', 'ที่', 'ได้', 'รู้จัก', 'ครับ', ' ', 'คนใต้', 'กิน', 'หลากหลาย']"
1630160871799533568,twitter,post,https://x.com/crta_me/status/1630160871799533568,text,2023-02-27T11:00:13.000Z,selenium_x_scraper_v1,ภาคใต้ไม่มีชายแท้นะครับ มีแต่พวกทองแดง,ภาคใต้ไม่มีชายแท้นะครับ มีแต่พวกทองแดง,2025-10-23 17:59:34,"['ภาคใต้', 'ไม่', 'มี', 'ชาย', 'แท้', 'นะ', 'ครับ', ' ', 'มี', 'แต่', 'พวก', 'ทองแดง']"
1630160775653519363,twitter,post,https://x.com/crta_me/status/1630160775653519363,text,2023-02-27T10:59:50.000Z,selenium_x_scraper_v1,สวัสดีครับ,สวัสดีครับ,2025-10-23 17:59:34,"['สวัสดี', 'ครับ']"
