id,platform,platform_type,url,content_type,timestamp,scraper_module,text,raw_text,scrape_date,tokens
1972529944300486969,twitter,post,https://x.com/RN980711/status/1972529944300486969,text,2025-09-29T05:12:41.000Z,selenium_x_scraper_v1,เคยเจอเหตุการคือผญ.เดินอยู่ข้างหน้าเดินช้า เราปกติก็เดินเร็วพอพยายามจะแซงเจอเขาเดินเร็วเฉย กลายเป็นเราต้องกลับมาเดินช้าแทนเดินเพซปกติเดี๋ยวโดนหาว่าเป็นโรคจิตเดินตามอีก ละพวกบอกทำไมไม่ขอทางคือปกติเราintrovertก็ไม่ถนัดจะตะโกนบอก เขาไม่หันมาบอกให้ไปก่อนบ้างละจะรีบเดินแซงเลย ,เคยเจอเหตุการคือผญ.เดินอยู่ข้างหน้าเดินช้า เราปกติก็เดินเร็วพอพยายามจะแซงเจอเขาเดินเร็วเฉย กลายเป็นเราต้องกลับมาเดินช้าแทนเดินเพซปกติเดี๋ยวโดนหาว่าเป็นโรคจิตเดินตามอีก ละพวกบอกทำไมไม่ขอทางคือปกติเราintrovertก็ไม่ถนัดจะตะโกนบอก เขาไม่หันมาบอกให้ไปก่อนบ้างละจะรีบเดินแซงเลย ,2025-11-08 17:05:14,"['เคย', 'เจอ', 'เหตุ', 'การ', 'คือ', 'ผญ.', 'เดิน', 'อยู่', 'ข้างหน้า', 'เดิน', 'ช้า', ' ', 'เรา', 'ปกติ', 'ก็', 'เดิน', 'เร็ว', 'พอ', 'พยายาม', 'จะ', 'แซง', 'เจอ', 'เขา', 'เดิน', 'เร็ว', 'เฉย', ' ', 'กลายเป็น', 'เรา', 'ต้อง', 'กลับมา', 'เดิน', 'ช้า', 'แทน', 'เดิน', 'เพ', 'ซ', 'ปกติ', 'เดี๋ยว', 'โดน', 'หาว่า', 'เป็น', 'โรคจิต', 'เดินตาม', 'อีก', ' ', 'ละ', 'พวก', 'บอก', 'ทำไม', 'ไม่', 'ขอทาง', 'คือ', 'ปกติ', 'เรา', 'introvert', 'ก็', 'ไม่', 'ถนัด', 'จะ', 'ตะโกน', 'บอก', ' ', 'เขา', 'ไม่', 'หันมา', 'บอก', 'ให้', 'ไป', 'ก่อน', 'บ้าง', 'ละ', 'จะ', 'รีบ', 'เดิน', 'แซง', 'เลย']"
1972526558008209587,twitter,post,https://x.com/CSrichampa37261/status/1972526558008209587,text,2025-09-29T04:59:13.000Z,selenium_x_scraper_v1,"แล้วจะเดินไปให้รำบากคนอื่นทำไมกลัวก็นอนยุบ่านถนนเป็นของสาธารณะใคร
จะเดินก็ได้อย่ามาอ้างนั้นนี้","แล้วจะเดินไปให้รำบากคนอื่นทำไมกลัวก็นอนยุบ่านถนนเป็นของสาธารณะใคร
จะเดินก็ได้อย่ามาอ้างนั้นนี้",2025-11-08 17:05:14,"['แล้', 'วจะ', 'เดิน', 'ไป', 'ให้', 'รำ', 'บาก', 'คนอื่น', 'ทำไม', 'กลัว', 'ก็', 'นอน', 'ยุ', 'บ่า', 'น', 'ถนน', 'เป็น', 'ของ', 'สาธารณะ', 'ใคร', ' ', 'จะ', 'เดิน', 'ก็ได้', 'อย่า', 'มา', 'อ้าง', 'นั้น', 'นี้']"
1972806299164479994,twitter,post,https://x.com/pwanmax555/status/1972806299164479994,text,2025-09-29T23:30:49.000Z,selenium_x_scraper_v1,"เคยเดินตาม ญ ผมพยามเว้นระยะห่าง อยู่ๆเค้าเดินช้าผมเลยชลอไม่กล้าเข้าไกล้ พอเค้าเดินปกติผมก็เดินต่อ
ซักพักเค้าวิ่ง ผมกลับหลังหันเลยมีปัญหาแน่ๆ ","เคยเดินตาม ญ ผมพยามเว้นระยะห่าง อยู่ๆเค้าเดินช้าผมเลยชลอไม่กล้าเข้าไกล้ พอเค้าเดินปกติผมก็เดินต่อ
ซักพักเค้าวิ่ง ผมกลับหลังหันเลยมีปัญหาแน่ๆ ",2025-11-08 17:05:14,"['เคย', 'เดินตาม', ' ', 'ญ', ' ', 'ผม', 'พยาม', 'เว้น', 'ระยะห่าง', ' ', 'อยู่', 'ๆ', 'เค้า', 'เดิน', 'ช้า', 'ผม', 'เลย', 'ชล', 'อ', 'ไม่', 'กล้า', 'เข้า', 'ไก', 'ล้', ' ', 'พอ', 'เค้า', 'เดิน', 'ปกติ', 'ผม', 'ก็', 'เดิน', 'ต่อ', ' ', 'ซัก', 'พัก', 'เค้า', 'วิ่ง', ' ', 'ผม', 'กลับหลังหัน', 'เลย', 'มีปัญหา', 'แน่ๆ']"
1972173554264559643,twitter,post,https://x.com/erban91/status/1972173554264559643,text,2025-09-28T05:36:31.000Z,selenium_x_scraper_v1,คือผู้ชายก็ระแวงนะตอนนี้เวลาไปวิ่งก็ไม่กล้าวิ่งตามผู้หญิง จะพยายามแซง แต่ถ้าเจอผู้หญิงสายวิ่งไวก็พยายามห่างให้นางไปไกลๆก่อน เป็นผู้ชายอยู่ยากชิบหาย,คือผู้ชายก็ระแวงนะตอนนี้เวลาไปวิ่งก็ไม่กล้าวิ่งตามผู้หญิง จะพยายามแซง แต่ถ้าเจอผู้หญิงสายวิ่งไวก็พยายามห่างให้นางไปไกลๆก่อน เป็นผู้ชายอยู่ยากชิบหาย,2025-11-08 17:05:14,"['คือ', 'ผู้ชาย', 'ก็', 'ระแวง', 'นะ', 'ตอนนี้', 'เวลา', 'ไป', 'วิ่ง', 'ก็', 'ไม่', 'กล้า', 'วิ่ง', 'ตาม', 'ผู้หญิง', ' ', 'จะ', 'พยายาม', 'แซง', ' ', 'แต่', 'ถ้า', 'เจอ', 'ผู้หญิง', 'สาย', 'วิ่ง', 'ไว', 'ก็', 'พยายาม', 'ห่าง', 'ให้', 'นาง', 'ไป', 'ไกลๆ', 'ก่อน', ' ', 'เป็น', 'ผู้ชาย', 'อยู่', 'ยาก', 'ชิบหาย']"
1972247015825506361,twitter,post,https://x.com/Ajrt2001/status/1972247015825506361,text,2025-09-28T10:28:25.000Z,selenium_x_scraper_v1,ก็มึงมัวแต่ถ่ายคลิปแล้วก็เดินช้าเป็นเต่าแบบนี้ไงใครจะไปเดินต่อหลังมึง,ก็มึงมัวแต่ถ่ายคลิปแล้วก็เดินช้าเป็นเต่าแบบนี้ไงใครจะไปเดินต่อหลังมึง,2025-11-08 17:05:14,"['ก็', 'มึง', 'มัวแต่', 'ถ่าย', 'คลิป', 'แล้วก็', 'เดิน', 'ช้า', 'เป็น', 'เต่า', 'แบบนี้', 'ไง', 'ใคร', 'จะ', 'ไป', 'เดิน', 'ต่อ', 'หลัง', 'มึง']"
1972698619179569321,twitter,post,https://x.com/kongtitchuu/status/1972698619179569321,text,2025-09-29T16:22:56.000Z,selenium_x_scraper_v1,"เรื่องนร่ตะไม่อะไรเลยถ้าใช้คำว่าแนะนำว่า   

เพราะว่าพอใช้คำว่าควรมีจิตสำนึก ทั้งๆที่เค้าก็เดินคุณก็เดิน แต่คุณกลับต่อว่าเขากลายเป็น แยกแยะถูกผิด แลกแยะผิดชอบชั่วดี ไม่ได้มันก็หนักเกิน","เรื่องนร่ตะไม่อะไรเลยถ้าใช้คำว่าแนะนำว่า   

เพราะว่าพอใช้คำว่าควรมีจิตสำนึก ทั้งๆที่เค้าก็เดินคุณก็เดิน แต่คุณกลับต่อว่าเขากลายเป็น แยกแยะถูกผิด แลกแยะผิดชอบชั่วดี ไม่ได้มันก็หนักเกิน",2025-11-08 17:05:14,"['เรื่อง', 'นร่', 'ตะ', 'ไม่', 'อะไร', 'เลย', 'ถ้า', 'ใช้', 'คำ', 'ว่า', 'แนะนำ', 'ว่า', ' ', 'เพราะว่า', 'พอใช้', 'คำ', 'ว่า', 'ควร', 'มี', 'จิตสำนึก', ' ', 'ทั้งๆ', 'ที่', 'เค้า', 'ก็', 'เดิน', 'คุณ', 'ก็', 'เดิน', ' ', 'แต่', 'คุณ', 'กลับ', 'ต่อว่า', 'เขา', 'กลายเป็น', ' ', 'แยกแยะ', 'ถูก', 'ผิด', ' ', 'แลก', 'แยะ', 'ผิด', 'ชอบ', 'ชั่ว', 'ดี', ' ', 'ไม่', 'ได้', 'มัน', 'ก็', 'หนัก', 'เกิน']"
1972449656467849549,twitter,post,https://x.com/HideakiTak1zawa/status/1972449656467849549,text,2025-09-28T23:53:39.000Z,selenium_x_scraper_v1,หญิงแท้ใกล้ฉัน,หญิงแท้ใกล้ฉัน,2025-11-08 17:05:14,"['หญิง', 'แท้', 'ใกล้', 'ฉัน']"
1972244423112351935,twitter,post,https://x.com/MeehPakMah/status/1972244423112351935,text,2025-09-28T10:18:07.000Z,selenium_x_scraper_v1,ผมคนนึงที่เวลาเจอผู้หญิงเดินอยู่ข้างหน้าแล้วรู้สึกหนักใจ ไม่รู่จะทำไงดีเคยจะเดินเร็วเพื่อแซงนางก็ดันเร่งเดินไม่ให้แซงอีก บางทีต้องไปนั่งตามป้ายรถหรือไม่ก็เซเว่นรอให้เดินไปไกลๆก่อนค่อยเดินต่อ ,ผมคนนึงที่เวลาเจอผู้หญิงเดินอยู่ข้างหน้าแล้วรู้สึกหนักใจ ไม่รู่จะทำไงดีเคยจะเดินเร็วเพื่อแซงนางก็ดันเร่งเดินไม่ให้แซงอีก บางทีต้องไปนั่งตามป้ายรถหรือไม่ก็เซเว่นรอให้เดินไปไกลๆก่อนค่อยเดินต่อ ,2025-11-08 17:05:14,"['ผม', 'คน', 'นึง', 'ที่', 'เวลา', 'เจอ', 'ผู้หญิง', 'เดิน', 'อยู่', 'ข้างหน้า', 'แล้ว', 'รู้สึก', 'หนักใจ', ' ', 'ไม่', 'รู่', 'จะ', 'ทำ', 'ไง', 'ดี', 'เคย', 'จะ', 'เดิน', 'เร็ว', 'เพื่อ', 'แซง', 'นาง', 'ก็', 'ดัน', 'เร่ง', 'เดิน', 'ไม่', 'ให้', 'แซง', 'อีก', ' ', 'บางที', 'ต้อง', 'ไป', 'นั่ง', 'ตาม', 'ป้าย', 'รถ', 'หรือไม่', 'ก็', 'เซเว่น', 'รอ', 'ให้', 'เดิน', 'ไป', 'ไกลๆ', 'ก่อน', 'ค่อย', 'เดิน', 'ต่อ']"
1972232989695476042,twitter,post,https://x.com/gharutus87/status/1972232989695476042,text,2025-09-28T09:32:41.000Z,selenium_x_scraper_v1,ก็เข้าใจได้นะ เดี๋ยวนี้ สังคม มันโหดร้าย เราผู้ชายอยู่ลำบาก จะนั่ง จะนอน จะเดิน จะวิ่ง แม่งต้องดู จังหวะจะโค่น ให้ดี,ก็เข้าใจได้นะ เดี๋ยวนี้ สังคม มันโหดร้าย เราผู้ชายอยู่ลำบาก จะนั่ง จะนอน จะเดิน จะวิ่ง แม่งต้องดู จังหวะจะโค่น ให้ดี,2025-11-08 17:05:14,"['ก็', 'เข้าใจ', 'ได้', 'นะ', ' ', 'เดี๋ยวนี้', ' ', 'สังคม', ' ', 'มัน', 'โหดร้าย', ' ', 'เรา', 'ผู้ชาย', 'อยู่', 'ลำบาก', ' ', 'จะ', 'นั่ง', ' ', 'จะ', 'นอน', ' ', 'จะ', 'เดิน', ' ', 'จะ', 'วิ่ง', ' ', 'แม่', 'ง', 'ต้อง', 'ดู', ' ', 'จังหวะ', 'จะ', 'โค่น', ' ', 'ให้', 'ดี']"
1972205051646214653,twitter,post,https://x.com/PhaserLycanz/status/1972205051646214653,text,2025-09-28T07:41:40.000Z,selenium_x_scraper_v1,น้องต้องเปลี่ยนมาเดินถอยหลัง หรือไม่ก็หยุดให้มันเดินแซง,น้องต้องเปลี่ยนมาเดินถอยหลัง หรือไม่ก็หยุดให้มันเดินแซง,2025-11-08 17:05:14,"['น้อง', 'ต้อง', 'เปลี่ยน', 'มา', 'เดิน', 'ถอยหลัง', ' ', 'หรือไม่', 'ก็', 'หยุด', 'ให้', 'มัน', 'เดิน', 'แซง']"
1972184503969042865,twitter,post,https://x.com/kimjeny_BP/status/1972184503969042865,text,2025-09-28T06:20:01.000Z,selenium_x_scraper_v1,แทนที่จะรีบเดินกลับบ้าน,แทนที่จะรีบเดินกลับบ้าน,2025-11-08 17:05:14,"['แทนที่จะ', 'รีบ', 'เดิน', 'กลับบ้าน']"
1972600138528170280,twitter,post,https://x.com/nixza851876/status/1972600138528170280,text,2025-09-29T09:51:36.000Z,selenium_x_scraper_v1,ศูนย์กลางจักรวาลมาก5555555  ใครเดินตามคงคิดว่าเขาจ้องจะเย็ดมันอย่างเดียว655565,ศูนย์กลางจักรวาลมาก5555555  ใครเดินตามคงคิดว่าเขาจ้องจะเย็ดมันอย่างเดียว655565,2025-11-08 17:05:14,"['ศูนย์กลาง', 'จักรวาล', 'มาก', 'หัวเราะ', ' ', 'ใคร', 'เดินตาม', 'คง', 'คิด', 'ว่า', 'เขา', 'จ้อง', 'จะ', 'เย็ด', 'มัน', 'อย่าง', 'เดียว', '6', 'หัวเราะ', '65']"
1972271946965659857,twitter,post,https://x.com/bakery1man/status/1972271946965659857,text,2025-09-28T12:07:29.000Z,selenium_x_scraper_v1,ปสด.  โลกหมุนรอบตัวเองอีก1,ปสด.  โลกหมุนรอบตัวเองอีก1,2025-11-08 17:05:14,"['ปสด', '.', ' ', 'โลก', 'หมุนรอบ', 'ตัวเอง', 'อีก', '1']"
1972873489746124919,twitter,post,https://x.com/TarSomMudWa/status/1972873489746124919,text,2025-09-30T03:57:48.000Z,selenium_x_scraper_v1,ทำไมไม่หยุดเดินแล้วให้คนข้างหลังเดินขึ้นหน้าไปหรือก็เดินเร็วไปเลยถ้ากลัว ทำไมต้องมาสั่งให้คนอื่นเดินอย่างที่ต้องการ ทำที่ตัวเองไม่ง่ายกว่าหรอ,ทำไมไม่หยุดเดินแล้วให้คนข้างหลังเดินขึ้นหน้าไปหรือก็เดินเร็วไปเลยถ้ากลัว ทำไมต้องมาสั่งให้คนอื่นเดินอย่างที่ต้องการ ทำที่ตัวเองไม่ง่ายกว่าหรอ,2025-11-08 17:05:14,"['ทำไม', 'ไม่', 'หยุด', 'เดิน', 'แล้ว', 'ให้', 'คน', 'ข้างหลัง', 'เดิน', 'ขึ้นหน้า', 'ไป', 'หรือ', 'ก็', 'เดิน', 'เร็ว', 'ไป', 'เลย', 'ถ้า', 'กลัว', ' ', 'ทำไม', 'ต้อง', 'มา', 'สั่ง', 'ให้', 'คนอื่น', 'เดิน', 'อย่าง', 'ที่', 'ต้องการ', ' ', 'ทำ', 'ที่', 'ตัวเอง', 'ไม่', 'ง่าย', 'กว่า', 'หรอ']"
1972490958672695361,twitter,post,https://x.com/looz1454689/status/1972490958672695361,text,2025-09-29T02:37:46.000Z,selenium_x_scraper_v1,มีปัญหาไรแก้ที่ผู้ชายไว้ก่อน ตลก,มีปัญหาไรแก้ที่ผู้ชายไว้ก่อน ตลก,2025-11-08 17:05:14,"['มีปัญหา', 'ไร', 'แก้', 'ที่', 'ผู้ชาย', 'ไว้', 'ก่อน', ' ', 'ตลก']"
1972223403588559311,twitter,post,https://x.com/CHIBIRIB12/status/1972223403588559311,text,2025-09-28T08:54:36.000Z,selenium_x_scraper_v1,เหมือนสวย,เหมือนสวย,2025-11-08 17:05:14,"['เหมือน', 'สวย']"
1972535156746617290,twitter,post,https://x.com/JUNE_JUNE7B/status/1972535156746617290,text,2025-09-29T05:33:23.000Z,selenium_x_scraper_v1,เซฟตัวเองครับ ไม่ต้องรอให้คนอื่นยื่นมาให้นะความปลอดภัยอะ หัดป้องกันตัวเองบ้าง,เซฟตัวเองครับ ไม่ต้องรอให้คนอื่นยื่นมาให้นะความปลอดภัยอะ หัดป้องกันตัวเองบ้าง,2025-11-08 17:05:14,"['เซฟ', 'ตัวเอง', 'ครับ', ' ', 'ไม่ต้อง', 'รอ', 'ให้', 'คนอื่น', 'ยื่น', 'มา', 'ให้', 'นะ', 'ความปลอดภัย', 'อะ', ' ', 'หัด', 'ป้องกัน', 'ตัวเอง', 'บ้าง']"
1972706589615563163,twitter,post,https://x.com/mawin666_/status/1972706589615563163,text,2025-09-29T16:54:36.000Z,selenium_x_scraper_v1,ก็คือ ถ้าจะเดินแซง เดินแซงไม่ได้เลย? เวลาจะแซงก็ต้องเดินให้เร็วกว่าถึงจะแซง? พอเดินให้เร็วกว่า ก็เหมือนไปตามมึงอีก? เอาเหี้ยไรคิด หลงตัวเองชิบหาย ถ้ากลัวมาก มึงก็ไม่ควรออกมากลางคืนคนเดียวอีโง่ ควรอยู่บ้าน ไม่มึงก็นั่งวิน นั่งแกรปสิ ปัญญาอ่อนชิบหาย -_-,ก็คือ ถ้าจะเดินแซง เดินแซงไม่ได้เลย? เวลาจะแซงก็ต้องเดินให้เร็วกว่าถึงจะแซง? พอเดินให้เร็วกว่า ก็เหมือนไปตามมึงอีก? เอาเหี้ยไรคิด หลงตัวเองชิบหาย ถ้ากลัวมาก มึงก็ไม่ควรออกมากลางคืนคนเดียวอีโง่ ควรอยู่บ้าน ไม่มึงก็นั่งวิน นั่งแกรปสิ ปัญญาอ่อนชิบหาย -_-,2025-11-08 17:05:14,"['ก็', 'คือ', ' ', 'ถ้า', 'จะ', 'เดิน', 'แซง', ' ', 'เดิน', 'แซง', 'ไม่', 'ได้', 'เลย', '?', ' ', 'เวลา', 'จะ', 'แซง', 'ก็', 'ต้อง', 'เดิน', 'ให้', 'เร็ว', 'กว่า', 'ถึง', 'จะ', 'แซง', '?', ' ', 'พอ', 'เดิน', 'ให้', 'เร็ว', 'กว่า', ' ', 'ก็', 'เหมือน', 'ไป', 'ตาม', 'มึง', 'อีก', '?', ' ', 'เอา', 'เหี้ย', 'ไร', 'คิด', ' ', 'หลงตัวเอง', 'ชิบหาย', ' ', 'ถ้า', 'กลัว', 'มาก', ' ', 'มึง', 'ก็', 'ไม่', 'ควร', 'ออกมา', 'กลางคืน', 'คนเดียว', 'อี', 'โง่', ' ', 'ควร', 'อยู่', 'บ้าน', ' ', 'ไม่', 'มึง', 'ก็', 'นั่ง', 'วิน', ' ', 'นั่ง', 'แก', 'รป', 'สิ', ' ', 'ปัญญาอ่อน', 'ชิบหาย']"
1972304844942909512,twitter,post,https://x.com/H6351M/status/1972304844942909512,text,2025-09-28T14:18:13.000Z,selenium_x_scraper_v1,บางทีเจอยายแก่เดินช้า ไอ้เราเดินตามหลังแม่งก็หันมามองแบบหวาดระแวงอยู่นั่นแหละ จะแซงก็ไม่กล้ากลัวพอเข้าใกล้แล้วนางกรี๊ดเดี๋ยวกูงานเข้า เลยต้องหยุดรอให้ระยะห่าง10เมตรแล้วค่อยเดินต่อ,บางทีเจอยายแก่เดินช้า ไอ้เราเดินตามหลังแม่งก็หันมามองแบบหวาดระแวงอยู่นั่นแหละ จะแซงก็ไม่กล้ากลัวพอเข้าใกล้แล้วนางกรี๊ดเดี๋ยวกูงานเข้า เลยต้องหยุดรอให้ระยะห่าง10เมตรแล้วค่อยเดินต่อ,2025-11-08 17:05:14,"['บางที', 'เจอ', 'ยายแก่', 'เดิน', 'ช้า', ' ', 'ไอ้', 'เรา', 'เดิน', 'ตามหลัง', 'แม่', 'ง', 'ก็', 'หันมา', 'มอง', 'แบบ', 'หวาดระแวง', 'อยู่', 'นั่นแหละ', ' ', 'จะ', 'แซง', 'ก็', 'ไม่', 'กล้า', 'กลัว', 'พอ', 'เข้าใกล้', 'แล้ว', 'นาง', 'กรี๊ด', 'เดี๋ยว', 'กู', 'งาน', 'เข้า', ' ', 'เลย', 'ต้อง', 'หยุด', 'รอ', 'ให้', 'ระยะห่าง', '10', 'เมตร', 'แล้ว', 'ค่อย', 'เดิน', 'ต่อ']"
