id,platform,platform_type,url,content_type,timestamp,scraper_module,text,raw_text,scrape_date,tokens
1989775705576747451,twitter,post,https://x.com/j_ramrada/status/1989775705576747451,text,2025-11-15T19:21:11.000Z,selenium_x_scraper_v1,ที่ลาว เคสแบบนี้เยอะมาก แทบจะทุกบ้านที่เอาเด็กๆมาเป็นเมียตั้งแต่อายุน้อยๆ  บางคนพ่อแม่ขาย  ต้องจำใจอยู่กับอีพวกแก่ๆพวกนี้ บางคนก็โดนทำร้าย ไม่สามารถหนีได้ไปที่ไหนก็ไม่ได้เพราะไม่มีความรู้ ไม่มีใครช่วยได้,ที่ลาว เคสแบบนี้เยอะมาก แทบจะทุกบ้านที่เอาเด็กๆมาเป็นเมียตั้งแต่อายุน้อยๆ  บางคนพ่อแม่ขาย  ต้องจำใจอยู่กับอีพวกแก่ๆพวกนี้ บางคนก็โดนทำร้าย ไม่สามารถหนีได้ไปที่ไหนก็ไม่ได้เพราะไม่มีความรู้ ไม่มีใครช่วยได้,2025-11-29 08:18:55,"['ที่', 'ลาว', ' ', 'เคส', 'แบบนี้', 'เยอะ', 'มาก', ' ', 'แทบจะ', 'ทุก', 'บ้าน', 'ที่', 'เอา', 'เด็ก', 'ๆ', 'มา', 'เป็น', 'เมีย', 'ตั้งแต่', 'อายุ', 'น้อย', 'ๆ', ' ', 'บางคน', 'พ่อแม่', 'ขาย', ' ', 'ต้อง', 'จำใจ', 'อยู่', 'กับ', 'อี', 'พวก', 'แก่ๆ', 'พวก', 'นี้', ' ', 'บางคน', 'ก็', 'โดน', 'ทำร้าย', ' ', 'ไม่', 'สามารถ', 'หนี', 'ได้', 'ไป', 'ที่ไหน', 'ก็', 'ไม่', 'ได้', 'เพราะ', 'ไม่', 'มีความรู้', ' ', 'ไม่', 'มี', 'ใคร', 'ช่วย', 'ได้']"
1989307962158895541,twitter,post,https://x.com/waintawaros/status/1989307962158895541,text,2025-11-14T12:22:32.000Z,selenium_x_scraper_v1,แปลกยังไงไม่รู้ แต่ช่วงวัยมันห่างกันเกินไป สืบดีๆ เผื่อมีอะไรที่มากกว่านี้,แปลกยังไงไม่รู้ แต่ช่วงวัยมันห่างกันเกินไป สืบดีๆ เผื่อมีอะไรที่มากกว่านี้,2025-11-29 08:18:55,"['แปลก', 'ยังไง', 'ไม่', 'รู้', ' ', 'แต่', 'ช่วง', 'วัย', 'มัน', 'ห่าง', 'กัน', 'เกินไป', ' ', 'สืบ', 'ดี', 'ๆ', ' ', 'เผื่อ', 'มี', 'อะไร', 'ที่', 'มากกว่า', 'นี้']"
1989289510220529986,twitter,post,https://x.com/AHCILA_027/status/1989289510220529986,text,2025-11-14T11:09:13.000Z,selenium_x_scraper_v1,อาจจะไม่ได้เอาตอน8ขวบก็ได้นะ น่ากลัวว่าจะเอาก่อน8ขวบไหมทำมาเรื่อยๆจนจังหวะเมนส์มาครั้งแรก,อาจจะไม่ได้เอาตอน8ขวบก็ได้นะ น่ากลัวว่าจะเอาก่อน8ขวบไหมทำมาเรื่อยๆจนจังหวะเมนส์มาครั้งแรก,2025-11-29 08:18:55,"['อาจจะ', 'ไม่', 'ได้', 'เอา', 'ตอน', '8', 'ขวบ', 'ก็ได้', 'นะ', ' ', 'น่ากลัว', 'ว่า', 'จะ', 'เอา', 'ก่อน', '8', 'ขวบ', 'ไหม', 'ทำ', 'มา', 'เรื่อยๆ', 'จน', 'จังหวะ', 'เมนส์', 'มา', 'ครั้งแรก']"
1989507686585778621,twitter,post,https://x.com/CanNngkh/status/1989507686585778621,text,2025-11-15T01:36:10.000Z,selenium_x_scraper_v1,มันก็ไม่เหมาะสมนะ แต่เข้าใจนะว่าเด็กทางลาวบางหมู่บ้านยากจนมากบางทีอาจไม่มีพ่อแม่ด้วยเลยต้องหาที่พึ่ง สุดท้ายก็เป็นแบบนี้,มันก็ไม่เหมาะสมนะ แต่เข้าใจนะว่าเด็กทางลาวบางหมู่บ้านยากจนมากบางทีอาจไม่มีพ่อแม่ด้วยเลยต้องหาที่พึ่ง สุดท้ายก็เป็นแบบนี้,2025-11-29 08:18:55,"['มัน', 'ก็', 'ไม่', 'เหมาะสม', 'นะ', ' ', 'แต่', 'เข้าใจ', 'นะ', 'ว่า', 'เด็ก', 'ทาง', 'ลาว', 'บาง', 'หมู่บ้าน', 'ยากจน', 'มาก', 'บางที', 'อาจ', 'ไม่', 'มี', 'พ่อแม่', 'ด้วย', 'เลย', 'ต้องหา', 'ที่พึ่ง', ' ', 'สุดท้าย', 'ก็', 'เป็น', 'แบบนี้']"
1989398132111937706,twitter,post,https://x.com/NanthaXudm/status/1989398132111937706,text,2025-11-14T18:20:50.000Z,selenium_x_scraper_v1,ตำรวจเข้าจับกุมตัวชายสูงวัยรึยังคะ น้องอายุ12เอง ถ้าให้เรียนต่อก็น่าจะทันนะคะ,ตำรวจเข้าจับกุมตัวชายสูงวัยรึยังคะ น้องอายุ12เอง ถ้าให้เรียนต่อก็น่าจะทันนะคะ,2025-11-29 08:18:55,"['ตำรวจ', 'เข้า', 'จับกุม', 'ตัว', 'ชาย', 'สูงวัย', 'รึ', 'ยัง', 'คะ', ' ', 'น้อง', 'อายุ', '12', 'เอง', ' ', 'ถ้า', 'ให้', 'เรียนต่อ', 'ก็', 'น่าจะ', 'ทัน', 'นะคะ']"
1989675158395826569,twitter,post,https://x.com/NfPhone51591/status/1989675158395826569,text,2025-11-15T12:41:38.000Z,selenium_x_scraper_v1,เคยเข้าไปดูคลิปค่ะ  ตอนน้องมาอยู่ด้วยก่อนมีลูกน่าจะอายุ12  ตอนนี้น้องน่าจะ20+แล้ว  มีคนคอมเมนท์ใต้คลิปอยู่ว่าทำไมถึงไม่บอกอายุน้องตามจริง   น้องร่างกายผอมแห้ง  เป็นลม ขาดสารอาหาร  เจ้าของช่องก็ช่วยเหลือค่ะ พาไปหาหมอเข้าน้ำเกลือ และชื้อข้าวของต่างๆให้  และทำที่พักให้ใหม่ด้วย,เคยเข้าไปดูคลิปค่ะ  ตอนน้องมาอยู่ด้วยก่อนมีลูกน่าจะอายุ12  ตอนนี้น้องน่าจะ20+แล้ว  มีคนคอมเมนท์ใต้คลิปอยู่ว่าทำไมถึงไม่บอกอายุน้องตามจริง   น้องร่างกายผอมแห้ง  เป็นลม ขาดสารอาหาร  เจ้าของช่องก็ช่วยเหลือค่ะ พาไปหาหมอเข้าน้ำเกลือ และชื้อข้าวของต่างๆให้  และทำที่พักให้ใหม่ด้วย,2025-11-29 08:18:55,"['เคย', 'เข้า', 'ไปดู', 'คลิป', 'ค่ะ', ' ', 'ตอน', 'น้อง', 'มา', 'อยู่', 'ด้วย', 'ก่อน', 'มีลูก', 'น่าจะ', 'อายุ', '12', ' ', 'ตอนนี้', 'น้อง', 'น่าจะ', '20', ' ', 'แล้ว', ' ', 'มี', 'คน', 'คอมเมนท์', 'ใต้', 'คลิป', 'อยู่', 'ว่า', 'ทำไม', 'ถึง', 'ไม่', 'บอก', 'อายุ', 'น้อง', 'ตามจริง', ' ', 'น้อง', 'ร่างกาย', 'ผอมแห้ง', ' ', 'เป็นลม', ' ', 'ขาดสารอาหาร', ' ', 'เจ้าของ', 'ช่อง', 'ก็', 'ช่วยเหลือ', 'ค่ะ', ' ', 'พา', 'ไปหา', 'หมอ', 'เข้า', 'น้ำเกลือ', ' ', 'และ', 'ชื้อ', 'ข้าวของ', 'ต่างๆ', 'ให้', ' ', 'และ', 'ทำ', 'ที่พัก', 'ให้', 'ใหม่', 'ด้วย']"
1989479928476381263,twitter,post,https://x.com/pooh_pavel/status/1989479928476381263,text,2025-11-14T23:45:52.000Z,selenium_x_scraper_v1,จะส่งของจะบริจาคอะไรอยากให้ทุกคนดูดีๆ เห็นเขาว่าส่วนมากส่งไปลาวมักไปไม่ถึง,จะส่งของจะบริจาคอะไรอยากให้ทุกคนดูดีๆ เห็นเขาว่าส่วนมากส่งไปลาวมักไปไม่ถึง,2025-11-29 08:18:55,"['จะ', 'ส่ง', 'ของ', 'จะ', 'บริจาค', 'อะไร', 'อยาก', 'ให้', 'ทุกคน', 'ดูดี', 'ๆ', ' ', 'เห็น', 'เขา', 'ว่า', 'ส่วนมาก', 'ส่ง', 'ไป', 'ลาว', 'มัก', 'ไป', 'ไม่', 'ถึง']"
1989342591138332830,twitter,post,https://x.com/5b917817f2554d5/status/1989342591138332830,text,2025-11-14T14:40:08.000Z,selenium_x_scraper_v1,นั่นล่ะคับประเทศด้อยพัฒนา,นั่นล่ะคับประเทศด้อยพัฒนา,2025-11-29 08:18:55,"['นั่น', 'ล่ะ', 'คับ', 'ประเทศด้อยพัฒนา']"
1989526348940153043,twitter,post,https://x.com/EveEve_BJ/status/1989526348940153043,text,2025-11-15T02:50:19.000Z,selenium_x_scraper_v1,จริงนางประมาณ 16-17 ค่ะ เขาไม่รู้อายุเพราะไม่ได้เรียนนักสือ เราดูคลิป จะมียายข้างบ้านบอกมาอีกที ว่าไม่ใช่ 12 แต่ก็เด็กมากจริงๆแหละ น่าสงสารมาก,จริงนางประมาณ 16-17 ค่ะ เขาไม่รู้อายุเพราะไม่ได้เรียนนักสือ เราดูคลิป จะมียายข้างบ้านบอกมาอีกที ว่าไม่ใช่ 12 แต่ก็เด็กมากจริงๆแหละ น่าสงสารมาก,2025-11-29 08:18:55,"['จริง', 'นาง', 'ประมาณ', ' ', '16', ' ', '17', ' ', 'ค่ะ', ' ', 'เขา', 'ไม่', 'รู้', 'อายุ', 'เพราะ', 'ไม่', 'ได้', 'เรียน', 'นัก', 'สือ', ' ', 'เรา', 'ดู', 'คลิป', ' ', 'จะ', 'มี', 'ยาย', 'ข้าง', 'บ้าน', 'บอก', 'มา', 'อีกที', ' ', 'ว่า', 'ไม่', 'ใช่', ' ', '12', ' ', 'แต่', 'ก็', 'เด็ก', 'มาก', 'จริงๆ', 'แหละ', ' ', 'น่าสงสาร', 'มาก']"
1989485496771416314,twitter,post,https://x.com/suhabibi2844/status/1989485496771416314,text,2025-11-15T00:07:59.000Z,selenium_x_scraper_v1,ดูผัวหน้าเกี้ยมาก กน้าหื่น อยากเอาตรีนปะทะหน้ามัน,ดูผัวหน้าเกี้ยมาก กน้าหื่น อยากเอาตรีนปะทะหน้ามัน,2025-11-29 08:18:55,"['ดู', 'ผัว', 'หน้า', 'เกี้ย', 'มาก', ' ', 'ก', 'น้า', 'หื่น', ' ', 'อยาก', 'เอา', 'ตรี', 'น', 'ปะทะ', 'หน้า', 'มัน']"
1989365476292743487,twitter,post,https://x.com/JomponQ/status/1989365476292743487,text,2025-11-14T16:11:04.000Z,selenium_x_scraper_v1,WTF is wrong with him?,WTF is wrong with him?,2025-11-29 08:18:55,"['wtf', ' ', 'is', ' ', 'wrong', ' ', 'with', ' ', 'him', '?']"
1989337524746240207,twitter,post,https://x.com/oilmilo/status/1989337524746240207,text,2025-11-14T14:20:00.000Z,selenium_x_scraper_v1,ระยำมากไอ้เหี้ยโคตรเกลียดอะไรแบบนี้,ระยำมากไอ้เหี้ยโคตรเกลียดอะไรแบบนี้,2025-11-29 08:18:55,"['ระยำ', 'มาก', 'ไอ้', 'เหี้ย', 'โคตร', 'เกลียด', 'อะไร', 'แบบนี้']"
1989505152538349945,twitter,post,https://x.com/NG_Tss/status/1989505152538349945,text,2025-11-15T01:26:06.000Z,selenium_x_scraper_v1,เห็นคนลาวทำคลิปจีนซื้อเด็ก10-12ปี ไม่ใช่แต่งไม่ใช่สู่ขอนะ ใช้คำว่าซื้อไปจีน น่าสงสารมากขายลูกกันเป็นว่าเล่น,เห็นคนลาวทำคลิปจีนซื้อเด็ก10-12ปี ไม่ใช่แต่งไม่ใช่สู่ขอนะ ใช้คำว่าซื้อไปจีน น่าสงสารมากขายลูกกันเป็นว่าเล่น,2025-11-29 08:18:55,"['เห็น', 'คน', 'ลาว', 'ทำ', 'คลิป', 'จีน', 'ซื้อ', 'เด็ก', '10', ' ', '12', 'ปี', ' ', 'ไม่', 'ใช่', 'แต่ง', 'ไม่', 'ใช่', 'สู่ขอ', 'นะ', ' ', 'ใช้', 'คำ', 'ว่า', 'ซื้อ', 'ไป', 'จีน', ' ', 'น่าสงสาร', 'มาก', 'ขาย', 'ลูก', 'กัน', 'เป็นว่าเล่น']"
1989293605832507839,twitter,post,https://x.com/mangayuriGL/status/1989293605832507839,text,2025-11-14T11:25:29.000Z,selenium_x_scraper_v1,พวกเปโดแม่งเหี้ย,พวกเปโดแม่งเหี้ย,2025-11-29 08:18:55,"['พวก', 'เป', 'โด', 'แม่', 'ง', 'เหี้ย']"
1989346044585640356,twitter,post,https://x.com/ywdtsny1/status/1989346044585640356,text,2025-11-14T14:53:51.000Z,selenium_x_scraper_v1,ตอนดูรู้สึกสงสารน้องเหลือเกิน อย่างว่าแหละประเทศที่ด้อยการพัฒนา,ตอนดูรู้สึกสงสารน้องเหลือเกิน อย่างว่าแหละประเทศที่ด้อยการพัฒนา,2025-11-29 08:18:55,"['ตอน', 'ดู', 'รู้สึก', 'สงสาร', 'น้อง', 'เหลือเกิน', ' ', 'อย่างว่า', 'แหละ', 'ประเทศ', 'ที่', 'ด้อย', 'การพัฒนา']"
1989561243317723206,twitter,post,https://x.com/anfil192552/status/1989561243317723206,text,2025-11-15T05:08:59.000Z,selenium_x_scraper_v1,คือถามจริงตำรวจไม่มีประโยชน์อะไรหน่อยหรอถึงปล่อยน้องเขาเป็นแบบนี้คือไม่มีการคุ้มครองอะไรเลยว่างั้น?แล้วอีเปโด้นี้แม่งไม่มีประโยชน์อะไรเลยอ่ะจะมาอ้างทีหลัวว่าสติไม่ดีกุคงไม่เชื่อแล้วอ่ะ,คือถามจริงตำรวจไม่มีประโยชน์อะไรหน่อยหรอถึงปล่อยน้องเขาเป็นแบบนี้คือไม่มีการคุ้มครองอะไรเลยว่างั้น?แล้วอีเปโด้นี้แม่งไม่มีประโยชน์อะไรเลยอ่ะจะมาอ้างทีหลัวว่าสติไม่ดีกุคงไม่เชื่อแล้วอ่ะ,2025-11-29 08:18:55,"['คือ', 'ถาม', 'จริง', 'ตำรวจ', 'ไม่', 'มีประโยชน์', 'อะไร', 'หน่อย', 'หรอ', 'ถึง', 'ปล่อย', 'น้อง', 'เขา', 'เป็น', 'แบบนี้', 'คือ', 'ไม่', 'มี', 'การ', 'คุ้มครอง', 'อะไร', 'เลย', 'ว่า', 'งั้น', '?', 'แล้ว', 'อี', 'เปโด้', 'นี้', 'แม่', 'ง', 'ไม่', 'มีประโยชน์', 'อะไร', 'เลย', 'อ่ะ', 'จะ', 'มา', 'อ้าง', 'ที', 'หลัว', 'ว่า', 'สติไม่ดี', 'กุ', 'คง', 'ไม่', 'เชื่อ', 'แล้ว', 'อ่ะ']"
1989311053042262033,twitter,post,https://x.com/04022OOx/status/1989311053042262033,text,2025-11-14T12:34:49.000Z,selenium_x_scraper_v1,อันนี้แย่นะแต่ก็เออพอไหวแหละ แต่อีที่เอาลูกในไส้ตัวเองตั้งแต่เด็กๆ เอาจนมีลูก แล้วบังคับให้ไปทำแท้งด้วย อันนี้เชี้ยกว่าธรณีสามารถสูบลงได้เลยชาวโลกเห็นด้วย,อันนี้แย่นะแต่ก็เออพอไหวแหละ แต่อีที่เอาลูกในไส้ตัวเองตั้งแต่เด็กๆ เอาจนมีลูก แล้วบังคับให้ไปทำแท้งด้วย อันนี้เชี้ยกว่าธรณีสามารถสูบลงได้เลยชาวโลกเห็นด้วย,2025-11-29 08:18:55,"['อันนี้', 'แย่', 'นะ', 'แต่', 'ก็', 'เออ', 'พอ', 'ไหว', 'แหละ', ' ', 'แต่', 'อี', 'ที่', 'เอา', 'ลูกในไส้', 'ตัวเอง', 'ตั้งแต่', 'เด็ก', 'ๆ', ' ', 'เอา', 'จน', 'มีลูก', ' ', 'แล้ว', 'บังคับ', 'ให้', 'ไป', 'ทำแท้ง', 'ด้วย', ' ', 'อันนี้', 'เชี้ย', 'กว่า', 'ธรณี', 'สามารถ', 'สูบ', 'ลง', 'ได้', 'เลย', 'ชาวโลก', 'เห็นด้วย']"
1989312174158922152,twitter,post,https://x.com/maew_yaoo/status/1989312174158922152,text,2025-11-14T12:39:16.000Z,selenium_x_scraper_v1,อ่านแล้วหดหู่ใจมากค่ะ ,อ่านแล้วหดหู่ใจมากค่ะ ,2025-11-29 08:18:55,"['อ่าน', 'แล้ว', 'หดหู่ใจ', 'มาก', 'ค่ะ']"
1990025541903392820,twitter,post,https://x.com/gutried/status/1990025541903392820,text,2025-11-16T11:53:56.000Z,selenium_x_scraper_v1,อ่านเม้นอีกคลิปบอกอายุ ยี่สิบกว่าแล้วนะคะ ได้เสียกับผัวแก่คนนี้ตอนอายุ12 อยู่ด้วยกันประมาณ3ปี ถึงมีลูก ในคลิปของแม่บุญมีของอีกช่อง,อ่านเม้นอีกคลิปบอกอายุ ยี่สิบกว่าแล้วนะคะ ได้เสียกับผัวแก่คนนี้ตอนอายุ12 อยู่ด้วยกันประมาณ3ปี ถึงมีลูก ในคลิปของแม่บุญมีของอีกช่อง,2025-11-29 08:18:55,"['อ่าน', 'เม้น', 'อีก', 'คลิป', 'บอก', 'อายุ', ' ', 'ยี่สิบ', 'กว่า', 'แล้ว', 'นะคะ', ' ', 'ได้เสีย', 'กับ', 'ผัว', 'แก่', 'คน', 'นี้', 'ตอน', 'อายุ', '12', ' ', 'อยู่', 'ด้วยกัน', 'ประมาณ', '3', 'ปี', ' ', 'ถึง', 'มีลูก', ' ', 'ใน', 'คลิป', 'ของ', 'แม่', 'บุญ', 'มี', 'ของ', 'อีก', 'ช่อง']"
1989311922676863400,twitter,post,https://x.com/arm33628152/status/1989311922676863400,text,2025-11-14T12:38:16.000Z,selenium_x_scraper_v1,รัฐบาลคอมมิวนิสต์ลาวไม่มีกฎหมายพรากผู้เยาว์เหรอ,รัฐบาลคอมมิวนิสต์ลาวไม่มีกฎหมายพรากผู้เยาว์เหรอ,2025-11-29 08:18:55,"['รัฐบาล', 'คอมมิวนิสต์', 'ลาว', 'ไม่', 'มี', 'กฎหมาย', 'พรากผู้เยาว์', 'เหรอ']"
1989524099002241218,twitter,post,https://x.com/poq6543210/status/1989524099002241218,text,2025-11-15T02:41:23.000Z,selenium_x_scraper_v1,อย่าเอามาตรฐานตนเองไปขีดเส้นคนอื่น ในดินแดนห่างไกลของลาวที่คนอยู่อย่างลำบาก การมีชีวิตรอดนั้นคือสิ่งสำคัญ,อย่าเอามาตรฐานตนเองไปขีดเส้นคนอื่น ในดินแดนห่างไกลของลาวที่คนอยู่อย่างลำบาก การมีชีวิตรอดนั้นคือสิ่งสำคัญ,2025-11-29 08:18:55,"['อย่า', 'เอา', 'มาตรฐาน', 'ตนเอง', 'ไป', 'ขีดเส้น', 'คนอื่น', ' ', 'ใน', 'ดินแดน', 'ห่างไกล', 'ของ', 'ลาว', 'ที่', 'คน', 'อยู่', 'อย่าง', 'ลำบาก', ' ', 'การ', 'มีชีวิตรอด', 'นั้น', 'คือ', 'สิ่ง', 'สำคัญ']"
1989279346159431740,twitter,post,https://x.com/Aoucamy_lovely/status/1989279346159431740,text,2025-11-14T10:28:49.000Z,selenium_x_scraper_v1,เฮ้อ.,เฮ้อ.,2025-11-29 08:18:55,"['เฮ้อ', '.']"
1989509131406119325,twitter,post,https://x.com/CanNngkh/status/1989509131406119325,text,2025-11-15T01:41:54.000Z,selenium_x_scraper_v1,กูนี้โครตเกลียดอีพวกเกิดมาแบบสบายมีเงินใช้ หรือนั่งพิมพ์สบายๆในห้องแอร์ แล้วก็มาเหยียดคนอื่นไม่มองถึงความลำบากของเขาถ้าเลือกได้เขาคงไม่เอาผัวตั้งแต่เด็ก,กูนี้โครตเกลียดอีพวกเกิดมาแบบสบายมีเงินใช้ หรือนั่งพิมพ์สบายๆในห้องแอร์ แล้วก็มาเหยียดคนอื่นไม่มองถึงความลำบากของเขาถ้าเลือกได้เขาคงไม่เอาผัวตั้งแต่เด็ก,2025-11-29 08:18:55,"['กู', 'นี้', 'โค', 'รต', 'เกลียด', 'อี', 'พวก', 'เกิด', 'มา', 'แบบ', 'สบาย', 'มีเงิน', 'ใช้', ' ', 'หรือ', 'นั่ง', 'พิมพ์', 'สบาย', 'ๆ', 'ใน', 'ห้อง', 'แอร์', ' ', 'แล้วก็', 'มา', 'เหยียด', 'คนอื่น', 'ไม่', 'มอง', 'ถึง', 'ความลำบาก', 'ของ', 'เขา', 'ถ้า', 'เลือก', 'ได้', 'เขา', 'คง', 'ไม่', 'เอา', 'ผัว', 'ตั้งแต่', 'เด็ก']"
1989296151418589290,twitter,post,https://x.com/AlanWakeDevlin/status/1989296151418589290,text,2025-11-14T11:35:36.000Z,selenium_x_scraper_v1,น่าปาหิน รุมกระทืบให้ตายมากกว่าไอ้ฟักในเรื่องคำพิพากษาอีก ,น่าปาหิน รุมกระทืบให้ตายมากกว่าไอ้ฟักในเรื่องคำพิพากษาอีก ,2025-11-29 08:18:55,"['น่า', 'ปา', 'หิน', ' ', 'รุม', 'กระทืบ', 'ให้', 'ตาย', 'มากกว่า', 'ไอ้', 'ฟัก', 'ใน', 'เรื่อง', 'คำพิพากษา', 'อีก']"
