id,platform,platform_type,url,content_type,timestamp,scraper_module,text,raw_text,scrape_date,tokens
1973990299447013785,twitter,post,https://x.com/jxl0089x/status/1973990299447013785,text,2025-10-03T05:55:37.000Z,selenium_x_scraper_v1,ผช ดีดี มันมีเยอะนะ แต่มึงอาจจะไม่เคยเจอ (อาจจะเพราะยังไม่สวยพอ),ผช ดีดี มันมีเยอะนะ แต่มึงอาจจะไม่เคยเจอ (อาจจะเพราะยังไม่สวยพอ),2025-10-23 17:59:34,"['ผช', ' ', 'ดี', 'ดี', ' ', 'มัน', 'มี', 'เย', 'อะนะ', ' ', 'แต่', 'มึง', 'อาจจะ', 'ไม่', 'เคย', 'เจอ', ' ', 'อาจจะ', 'เพราะ', 'ยัง', 'ไม่', 'สวย', 'พอ']"
1973989188795248936,twitter,post,https://x.com/jxl0089x/status/1973989188795248936,text,2025-10-03T05:51:12.000Z,selenium_x_scraper_v1,"กุอาจจะไม่ดีนะ
แต่สังคมรอบข้างกุผช ดีทุกคน 
ไม่รู้ว่าพวกผญ ที่โกรธเกลียด ผช มึงโต มาจากสังคมไหนวะ555","กุอาจจะไม่ดีนะ
แต่สังคมรอบข้างกุผช ดีทุกคน 
ไม่รู้ว่าพวกผญ ที่โกรธเกลียด ผช มึงโต มาจากสังคมไหนวะ555",2025-10-23 17:59:34,"['กุ', 'อาจจะ', 'ไม่', 'ดี', 'นะ', ' ', 'แต่', 'สังคม', 'รอบข้าง', 'กุ', 'ผช', ' ', 'ดี', 'ทุกคน', ' ', 'ไม่', 'รู้', 'ว่า', 'พวก', 'ผญ', ' ', 'ที่', 'โกรธ', 'เกลียด', ' ', 'ผช', ' ', 'มึง', 'โต', ' ', 'มาจาก', 'สังคม', 'ไหน', 'วะ', 'หัวเราะ']"
1973853002823078297,twitter,post,https://x.com/bacon1hamcheese/status/1973853002823078297,text,2025-10-02T20:50:02.000Z,selenium_x_scraper_v1,ที่ที่แต่ผญ จะเรียกว่านรกได้ยังไงนะ สวรรค์แท้ๆ,ที่ที่แต่ผญ จะเรียกว่านรกได้ยังไงนะ สวรรค์แท้ๆ,2025-10-23 17:59:34,"['ที่', 'ที่', 'แต่', 'ผญ', ' ', 'จะ', 'เรียก', 'ว่า', 'นรก', 'ได้', 'ยังไง', 'นะ', ' ', 'สวรรค์', 'แท้ๆ']"
1973980384825401501,twitter,post,https://x.com/jxl0089x/status/1973980384825401501,text,2025-10-03T05:16:13.000Z,selenium_x_scraper_v1,แล้วสาวๆ แสตท จะยังสวรรค์มั้ยครับ ,แล้วสาวๆ แสตท จะยังสวรรค์มั้ยครับ ,2025-10-23 17:59:34,"['แล้ว', 'สาว', 'ๆ', ' ', 'แส', 'ตท', ' ', 'จะ', 'ยัง', 'สวรรค์', 'มั้ย', 'ครับ']"
1973980297533534498,twitter,post,https://x.com/jxl0089x/status/1973980297533534498,text,2025-10-03T05:15:52.000Z,selenium_x_scraper_v1,ทำไมสังคมพี่ ผช มันแย่ขนาดนั้นหรอ ,ทำไมสังคมพี่ ผช มันแย่ขนาดนั้นหรอ ,2025-10-23 17:59:34,"['ทำไม', 'สังคม', 'พี่', ' ', 'ผช', ' ', 'มัน', 'แย่', 'ขนาด', 'นั้น', 'หรอ']"
1973422384331022411,twitter,post,https://x.com/tawsirikul92149/status/1973422384331022411,text,2025-10-01T16:18:55.000Z,selenium_x_scraper_v1,จริง ผู้ชายแบบนี้เขาเรียกกระหรี่ แรดจนเก็บความเงี่ยนไม่อยู่ สงสารแม่มันเนอะ คลอดออกมาให้แม่เจ็บหีเปล่าๆ สันดาน ไปขายตัวในซ่องเหอะ เอาเงินมาตอบแทนบุญคุณแม่ที่คลอดเด็กชั้นต่ำแบบพวกมึงออกมา อีผู้ชายสันดานกระหรี่ทั้งหลาย,จริง ผู้ชายแบบนี้เขาเรียกกระหรี่ แรดจนเก็บความเงี่ยนไม่อยู่ สงสารแม่มันเนอะ คลอดออกมาให้แม่เจ็บหีเปล่าๆ สันดาน ไปขายตัวในซ่องเหอะ เอาเงินมาตอบแทนบุญคุณแม่ที่คลอดเด็กชั้นต่ำแบบพวกมึงออกมา อีผู้ชายสันดานกระหรี่ทั้งหลาย,2025-10-23 17:59:34,"['จริง', ' ', 'ผู้ชาย', 'แบบนี้', 'เขา', 'เรียก', 'กระ', 'หรี่', ' ', 'แรด', 'จน', 'เก็บความ', 'เงี่ยน', 'ไม่', 'อยู่', ' ', 'สงสาร', 'แม่', 'มัน', 'เนอะ', ' ', 'คลอด', 'ออกมา', 'ให้', 'แม่', 'เจ็บ', 'หี', 'เปล่าๆ', ' ', 'สันดาน', ' ', 'ไป', 'ขายตัว', 'ใน', 'ซ่อง', 'เหอะ', ' ', 'เอา', 'เงิน', 'มา', 'ตอบแทน', 'บุญ', 'คุณแม่', 'ที่', 'คลอด', 'เด็ก', 'ชั้นต่ำ', 'แบบ', 'พวก', 'มึง', 'ออกมา', ' ', 'อี', 'ผู้ชาย', 'สันดาน', 'กระ', 'หรี่', 'ทั้งหลาย']"
1973942986397692061,twitter,post,https://x.com/jxl0089x/status/1973942986397692061,text,2025-10-03T02:47:36.000Z,selenium_x_scraper_v1,เก็บกดอะไรหรอ55555,เก็บกดอะไรหรอ55555,2025-10-23 17:59:34,"['เก็บกด', 'อะไร', 'หรอ', 'หัวเราะ']"
1973665972612637023,twitter,post,https://x.com/phuhyailee/status/1973665972612637023,text,2025-10-02T08:26:51.000Z,selenium_x_scraper_v1,นรกที่แต่ผู้หญิงไม่มีผู้ชายเลยงั้นเหรอ? บ้าเอ้ยจะทำยังไงกันดีล่ะเนี้ย ฮือออ~~,นรกที่แต่ผู้หญิงไม่มีผู้ชายเลยงั้นเหรอ? บ้าเอ้ยจะทำยังไงกันดีล่ะเนี้ย ฮือออ~~,2025-10-23 17:59:34,"['นรก', 'ที่', 'แต่', 'ผู้หญิง', 'ไม่', 'มี', 'ผู้ชาย', 'เลย', 'งั้น', 'เหรอ', '?', ' ', 'บ้า', 'เอ้ย', 'จะ', 'ทำ', 'ยังไง', 'กัน', 'ดี', 'ล่ะ', 'เนี้ย', ' ', 'ฮือ', 'ออ']"
1973624338881679573,twitter,post,https://x.com/wwcloudyboo/status/1973624338881679573,text,2025-10-02T05:41:25.000Z,selenium_x_scraper_v1,ถ้าในนรกมีแต่ผู้หญิง ก็รู้สึกว่าน่าจะปลอดภัยกว่าโลกที่อยู่ปัจจุบันอีกนะ เลสโกทูเฮล55555,ถ้าในนรกมีแต่ผู้หญิง ก็รู้สึกว่าน่าจะปลอดภัยกว่าโลกที่อยู่ปัจจุบันอีกนะ เลสโกทูเฮล55555,2025-10-23 17:59:34,"['ถ้า', 'ใน', 'นรก', 'มี', 'แต่', 'ผู้หญิง', ' ', 'ก็', 'รู้สึก', 'ว่า', 'น่าจะ', 'ปลอดภัย', 'กว่า', 'โลก', 'ที่อยู่', 'ปัจจุบัน', 'อีก', 'นะ', ' ', 'เลส', 'โก', 'ทู', 'เฮ', 'ล', 'หัวเราะ']"
1973673806448500871,twitter,post,https://x.com/jxl0089x/status/1973673806448500871,text,2025-10-02T08:57:59.000Z,selenium_x_scraper_v1,สังคมที่โตมา โหดร้ายกับผญขนาดนั้นเลยหรอ ,สังคมที่โตมา โหดร้ายกับผญขนาดนั้นเลยหรอ ,2025-10-23 17:59:34,"['สังคม', 'ที่', 'โตมา', ' ', 'โหดร้าย', 'กับ', 'ผญ', 'ขนาด', 'นั้น', 'เลย', 'หรอ']"
1973654995313762452,twitter,post,https://x.com/jxl0089x/status/1973654995313762452,text,2025-10-02T07:43:14.000Z,selenium_x_scraper_v1,ละเกย์คือรังเกียจ พวกผญ มากนะ เค้ารู้ตัวกันมั้ย ,ละเกย์คือรังเกียจ พวกผญ มากนะ เค้ารู้ตัวกันมั้ย ,2025-10-23 17:59:34,"['ละ', 'เกย์', 'คือ', 'รังเกียจ', ' ', 'พวก', 'ผญ', ' ', 'มาก', 'นะ', ' ', 'เค้า', 'รู้ตัว', 'กัน', 'มั้ย']"
1973253603000471974,twitter,post,https://x.com/madd0gfromhell/status/1973253603000471974,text,2025-10-01T05:08:14.000Z,selenium_x_scraper_v1,แอบคริ้น+ เวทนา นิด ๆ เวลาเหนผญอยากไดผัววิสวะ obsess ยุกะวิสว่ะ  เหมือนยังเชือในแฟนตาซีบางอย่าง ยิ่งยุคนีที่ผชหล่อไม่ไดหาไดจากแค่ไม่กี่คนะ อีกแลวอ่า,แอบคริ้น+ เวทนา นิด ๆ เวลาเหนผญอยากไดผัววิสวะ obsess ยุกะวิสว่ะ  เหมือนยังเชือในแฟนตาซีบางอย่าง ยิ่งยุคนีที่ผชหล่อไม่ไดหาไดจากแค่ไม่กี่คนะ อีกแลวอ่า,2025-10-23 17:59:34,"['แอบ', 'ค', 'ริ้น', ' ', 'เวทนา', ' ', 'นิด', ' ', 'ๆ', ' ', 'เวลา', 'เห', 'นผญ', 'อยาก', 'ได', 'ผัว', 'วิ', 'สวะ', ' ', 'obsess', ' ', 'ยุ', 'กะ', 'วิ', 'ส', 'ว่ะ', ' ', 'เหมือน', 'ยัง', 'เชือ', 'ใน', 'แฟนตาซี', 'บางอย่าง', ' ', 'ยิ่ง', 'ยุค', 'นี', 'ที่', 'ผช', 'หล่อ', 'ไม่', 'ได', 'หา', 'ได', 'จาก', 'แค่', 'ไม่', 'กี่', 'ค', 'นะ', ' ', 'อีก', 'แล', 'ว', 'อ่า']"
1973653085571698777,twitter,post,https://x.com/jxl0089x/status/1973653085571698777,text,2025-10-02T07:35:38.000Z,selenium_x_scraper_v1,แล้วมึงมีผัวมั้ยก่อน,แล้วมึงมีผัวมั้ยก่อน,2025-10-23 17:59:34,"['แล้ว', 'มึง', 'มี', 'ผัว', 'มั้ย', 'ก่อน']"
1973063219317977199,twitter,post,https://x.com/marsilynrh/status/1973063219317977199,text,2025-09-30T16:31:43.000Z,selenium_x_scraper_v1,ถ้าบอกว่าออกแบบเพื่อความสบายคล่องตัวแล้วทำไมผู้ชายไม่ได้ใส่บ้าง,ถ้าบอกว่าออกแบบเพื่อความสบายคล่องตัวแล้วทำไมผู้ชายไม่ได้ใส่บ้าง,2025-10-23 17:59:34,"['ถ้า', 'บอ', 'กว่า', 'ออกแบบ', 'เพื่อ', 'ความ', 'สบาย', 'คล่องตัว', 'แล้ว', 'ทำไม', 'ผู้ชาย', 'ไม่', 'ได้', 'ใส่', 'บ้าง']"
1973651107034571244,twitter,post,https://x.com/jxl0089x/status/1973651107034571244,text,2025-10-02T07:27:47.000Z,selenium_x_scraper_v1,มึงโดน sh มาเยอะมากขนาดนั้นเลยหรอวะ sensitive จัด55555,มึงโดน sh มาเยอะมากขนาดนั้นเลยหรอวะ sensitive จัด55555,2025-10-23 17:59:34,"['มึง', 'โดน', ' ', 'sh', ' ', 'มา', 'เยอะ', 'มาก', 'ขนาด', 'นั้น', 'เลย', 'หรอ', 'วะ', ' ', 'sensitive', ' ', 'จัด', 'หัวเราะ']"
1973650498688520676,twitter,post,https://x.com/jxl0089x/status/1973650498688520676,text,2025-10-02T07:25:22.000Z,selenium_x_scraper_v1,"แต่พอผช ล้อผญ ไม่ได้เลยนะ 
อย่าที่ผช เสียเปรียบก็เฉยๆงี้หรอ","แต่พอผช ล้อผญ ไม่ได้เลยนะ 
อย่าที่ผช เสียเปรียบก็เฉยๆงี้หรอ",2025-10-23 17:59:34,"['แต่', 'พอ', 'ผช', ' ', 'ล้อ', 'ผญ', ' ', 'ไม่', 'ได้', 'เลย', 'นะ', ' ', 'อย่า', 'ที่', 'ผช', ' ', 'เสียเปรียบ', 'ก็', 'เฉย', 'ๆ', 'งี้', 'หรอ']"
1973650718767857861,twitter,post,https://x.com/jxl0089x/status/1973650718767857861,text,2025-10-02T07:26:14.000Z,selenium_x_scraper_v1,*อะไร,*อะไร,2025-10-23 17:59:34,['อะไร']
1967208860051280208,twitter,post,https://x.com/lessthanmetre/status/1967208860051280208,text,2025-09-14T12:48:35.000Z,selenium_x_scraper_v1,นมเล็กกับจู๋เล็กมันก็ควบคุมไม่ได้เหมือนกันอะ เกิดมาก็เป็นงี้ ไม่มีใครชอบให้โดนล้อหรอกทั้งญทั้งช ไอพวกชอบล้อจู๋เล็ก ๆ ในเอ้กแบบไร้สาเหตุนี่ก็เลิกเหอะ,นมเล็กกับจู๋เล็กมันก็ควบคุมไม่ได้เหมือนกันอะ เกิดมาก็เป็นงี้ ไม่มีใครชอบให้โดนล้อหรอกทั้งญทั้งช ไอพวกชอบล้อจู๋เล็ก ๆ ในเอ้กแบบไร้สาเหตุนี่ก็เลิกเหอะ,2025-10-23 17:59:34,"['นม', 'เล็ก', 'กับ', 'จู๋', 'เล็ก', 'มัน', 'ก็', 'ควบคุม', 'ไม่', 'ได้', 'เหมือนกัน', 'อะ', ' ', 'เกิด', 'มา', 'ก็', 'เป็น', 'งี้', ' ', 'ไม่', 'มี', 'ใคร', 'ชอบ', 'ให้', 'โดน', 'ล้อ', 'หรอก', 'ทั้ง', 'ญ', 'ทั้ง', 'ช', ' ', 'ไอ', 'พวก', 'ชอบ', 'ล้อ', 'จู๋', 'เล็ก', ' ', 'ๆ', ' ', 'ใน', 'เอ้', 'ก', 'แบบ', 'ไร้', 'สาเหตุ', 'นี่', 'ก็', 'เลิก', 'เหอะ']"
1973650303464681839,twitter,post,https://x.com/jxl0089x/status/1973650303464681839,text,2025-10-02T07:24:35.000Z,selenium_x_scraper_v1,"ผญไทย นมเล็ก ก้นก็ไม่มี 
ไม่เห็นมีใครว่า","ผญไทย นมเล็ก ก้นก็ไม่มี 
ไม่เห็นมีใครว่า",2025-10-23 17:59:34,"['ผญ', 'ไทย', ' ', 'นม', 'เล็ก', ' ', 'ก้น', 'ก็', 'ไม่', 'มี', ' ', 'ไม่', 'เห็น', 'มี', 'ใคร', 'ว่า']"
1973246247885844902,twitter,post,https://x.com/forgetmenot_zen/status/1973246247885844902,text,2025-10-01T04:39:01.000Z,selenium_x_scraper_v1,อันนี้ขำไม่ออก ผญเหมือนจะสามารถเลือกชีวิตตัวเองได้แต่จริงๆ แล้วไม่,อันนี้ขำไม่ออก ผญเหมือนจะสามารถเลือกชีวิตตัวเองได้แต่จริงๆ แล้วไม่,2025-10-23 17:59:34,"['อันนี้', 'ขำ', 'ไม่', 'ออก', ' ', 'ผญ', 'เหมือน', 'จะ', 'สามารถ', 'เลือก', 'ชีวิต', 'ตัวเอง', 'ได้', 'แต่', 'จริงๆ', ' ', 'แล้ว', 'ไม่']"
1973650009104273494,twitter,post,https://x.com/jxl0089x/status/1973650009104273494,text,2025-10-02T07:23:25.000Z,selenium_x_scraper_v1,Victim card please ,Victim card please ,2025-10-23 17:59:34,"['victim', ' ', 'card', ' ', 'please']"
1973600264117792853,twitter,post,https://x.com/jxl0089x/status/1973600264117792853,text,2025-10-02T04:05:45.000Z,selenium_x_scraper_v1,โอ้ยยย ดราม่าอะไรหนัก ชีวิตมึงโดนกดมาทั้งชีวิตเลยหรอวะ5555,โอ้ยยย ดราม่าอะไรหนัก ชีวิตมึงโดนกดมาทั้งชีวิตเลยหรอวะ5555,2025-10-23 17:59:34,"['โอ้ย', 'ยย', ' ', 'ดราม่า', 'อะไร', 'หนัก', ' ', 'ชีวิต', 'มึง', 'โดน', 'กด', 'มา', 'ทั้ง', 'ชีวิต', 'เลย', 'หรอ', 'วะ', 'หัวเราะ']"
1972778403859448052,twitter,post,https://x.com/ap1ym0/status/1972778403859448052,text,2025-09-29T21:39:58.000Z,selenium_x_scraper_v1,จะยิงโดนแน่หรอคะ เป้าหมายมันเล็กนะ,จะยิงโดนแน่หรอคะ เป้าหมายมันเล็กนะ,2025-10-23 17:59:34,"['จะ', 'ยิง', 'โดน', 'แน่', 'หรอ', 'คะ', ' ', 'เป้าหมาย', 'มัน', 'เล็ก', 'นะ']"
1973458943788851332,twitter,post,https://x.com/ap1ym0/status/1973458943788851332,text,2025-10-01T18:44:11.000Z,selenium_x_scraper_v1,อ้าวเตงหายไปไหน เตงกลับมา เตงอย่าไป โถ่ น่าเสียดายที่อายุสั้น ไม่น่าเลย เพิ่งเห็นกันอยู่หลัดๆ เห้อ,อ้าวเตงหายไปไหน เตงกลับมา เตงอย่าไป โถ่ น่าเสียดายที่อายุสั้น ไม่น่าเลย เพิ่งเห็นกันอยู่หลัดๆ เห้อ,2025-10-23 17:59:34,"['อ้าว', 'เต', 'ง', 'หาย', 'ไป', 'ไหน', ' ', 'เต', 'งก', 'ลับ', 'มา', ' ', 'เต', 'งอ', 'ย่า', 'ไป', ' ', 'โถ่', ' ', 'น่าเสียดาย', 'ที่', 'อายุสั้น', ' ', 'ไม่น่าเลย', ' ', 'เพิ่ง', 'เห็น', 'กัน', 'อยู่', 'หลัดๆ', ' ', 'เห้อ']"
1973593673016418772,twitter,post,https://x.com/jxl0089x/status/1973593673016418772,text,2025-10-02T03:39:33.000Z,selenium_x_scraper_v1,กุมาละ อิอ้วนน55555,กุมาละ อิอ้วนน55555,2025-10-23 17:59:34,"['กุ', 'มา', 'ละ', ' ', 'อิ', 'อ้วน', 'น', 'หัวเราะ']"
1973411913037127976,twitter,post,https://x.com/yumoiur/status/1973411913037127976,text,2025-10-01T15:37:18.000Z,selenium_x_scraper_v1,เพดผู้ไม่อยู่แม้กระทั่งในplan Aดัวยซ้ำ  https://x.com/jxl0089/status/jxl0089/status/1973382223123431634…,เพดผู้ไม่อยู่แม้กระทั่งในplan Aดัวยซ้ำ  https://x.com/jxl0089/status/jxl0089/status/1973382223123431634…,2025-10-23 17:59:34,"['เพ', 'ด', 'ผู้', 'ไม่', 'อยู่', 'แม้กระทั่ง', 'ใน', 'plan', ' ', 'a', 'ดัวย', 'ซ้ำ']"
1973593274368823798,twitter,post,https://x.com/jxl0089x/status/1973593274368823798,text,2025-10-02T03:37:58.000Z,selenium_x_scraper_v1,ทอมก็จะเป็น เมนก็จะมา,ทอมก็จะเป็น เมนก็จะมา,2025-10-23 17:59:34,"['ทอม', 'ก็', 'จะ', 'เป็น', ' ', 'เมน', 'ก็', 'จะ', 'มา']"
1973444278832734278,twitter,post,https://x.com/tanhyong2007/status/1973444278832734278,text,2025-10-01T17:45:55.000Z,selenium_x_scraper_v1,อ่าว หนีซะแล้วหรอ นึกว่าจะสืบเรื่องของนี่เยอะกว่านี้หน่อย โถ่เอ้ย แค่เข้าแอ็คไปดูตรงสื่อก็รู้แล้ว วันๆ สุดท้ายก็วนอยู่แค่เรื่องมีแฟนหรือไม่มีแฟน พราวอะไรขนาดนั้น ความภูมิใจเดียวที่มีสินะ,อ่าว หนีซะแล้วหรอ นึกว่าจะสืบเรื่องของนี่เยอะกว่านี้หน่อย โถ่เอ้ย แค่เข้าแอ็คไปดูตรงสื่อก็รู้แล้ว วันๆ สุดท้ายก็วนอยู่แค่เรื่องมีแฟนหรือไม่มีแฟน พราวอะไรขนาดนั้น ความภูมิใจเดียวที่มีสินะ,2025-10-23 17:59:34,"['อ่าว', ' ', 'หนี', 'ซะ', 'แล้ว', 'หรอ', ' ', 'นึก', 'ว่า', 'จะ', 'สืบ', 'เรื่อง', 'ของ', 'นี่', 'เยอะ', 'กว่า', 'นี้', 'หน่อย', ' ', 'โถ่', 'เอ้ย', ' ', 'แค่', 'เข้า', 'แอ็ค', 'ไปดู', 'ตรง', 'สื่อ', 'ก็', 'รู้', 'แล้ว', ' ', 'วัน', 'ๆ', ' ', 'สุดท้าย', 'ก็', 'วน', 'อยู่', 'แค่', 'เรื่อง', 'มี', 'แฟน', 'หรือไม่', 'มี', 'แฟน', ' ', 'พราว', 'อะไร', 'ขนาด', 'นั้น', ' ', 'ความภูมิใจ', 'เดียว', 'ที่', 'มี', 'สิ', 'นะ']"
1973591302576152816,twitter,post,https://x.com/jxl0089x/status/1973591302576152816,text,2025-10-02T03:30:08.000Z,selenium_x_scraper_v1,กุมาละ มึง โพสไรของมึงงงง,กุมาละ มึง โพสไรของมึงงงง,2025-10-23 17:59:34,"['กุ', 'มา', 'ละ', ' ', 'มึง', ' ', 'โพส', 'ไร', 'ของ', 'มึง', 'งง', 'ง']"
1973499496157028417,twitter,post,https://x.com/bsrnlyppcy04/status/1973499496157028417,text,2025-10-01T21:25:20.000Z,selenium_x_scraper_v1,มาไม่ทันได้ตอบ ลบเม้นไปละ,มาไม่ทันได้ตอบ ลบเม้นไปละ,2025-10-23 17:59:34,"['มา', 'ไม่', 'ทัน', 'ได้', 'ตอบ', ' ', 'ลบ', 'เม้น', 'ไป', 'ละ']"
1973591215460463063,twitter,post,https://x.com/jxl0089x/status/1973591215460463063,text,2025-10-02T03:29:47.000Z,selenium_x_scraper_v1,มาละจ้า ตอบมาๆ,มาละจ้า ตอบมาๆ,2025-10-23 17:59:34,"['มา', 'ละ', 'จ้า', ' ', 'ตอบ', 'มา', 'ๆ']"
1977080463899701267,twitter,post,https://x.com/nuknikklgku/status/1977080463899701267,text,2025-10-11T18:34:49.000Z,selenium_x_scraper_v1,ละล่าสุดบอกผู้หญิงใส่ชุดว่ายน้ำ one piece ดูดีกว่าดูมีอะไรให้หน้าค้นหา (เพราะไม่เปิดหมดแบบบิกินี่) ฟังแล้วแบบ ew,ละล่าสุดบอกผู้หญิงใส่ชุดว่ายน้ำ one piece ดูดีกว่าดูมีอะไรให้หน้าค้นหา (เพราะไม่เปิดหมดแบบบิกินี่) ฟังแล้วแบบ ew,2025-10-23 17:59:34,"['ละ', 'ล่าสุด', 'บอก', 'ผู้หญิง', 'ใส่', 'ชุดว่ายน้ำ', ' ', 'one', ' ', 'piece', ' ', 'ดู', 'ดีกว่า', 'ดู', 'มี', 'อะไร', 'ให้หน้า', 'ค้นหา', ' ', 'เพราะ', 'ไม่', 'เปิด', 'หมด', 'แบบ', 'บิกินี่', ' ', 'ฟัง', 'แล้ว', 'แบบ', ' ', 'ew']"
1977167887552200991,twitter,post,https://x.com/Itsme9160049100/status/1977167887552200991,text,2025-10-12T00:22:13.000Z,selenium_x_scraper_v1,โคตรหลงตัวเอง ชายแทร่ ลัทธิชายเป็นใหญ่ หลุดมาจากศตวรรษไหนวะเนี่ย,โคตรหลงตัวเอง ชายแทร่ ลัทธิชายเป็นใหญ่ หลุดมาจากศตวรรษไหนวะเนี่ย,2025-10-23 17:59:34,"['โคตร', 'หลงตัวเอง', ' ', 'ชาย', 'แทร่', ' ', 'ลัทธิ', 'ชาย', 'เป็นใหญ่', ' ', 'หลุด', 'มาจาก', 'ศตวรรษ', 'ไหน', 'วะ', 'เนี่ย']"
