id,platform,platform_type,url,content_type,timestamp,scraper_module,text,raw_text,scrape_date,tokens
1986597531992879483,twitter,post,https://x.com/LuXiaga/status/1986597531992879483,text,2025-11-07T00:52:15.000Z,selenium_x_scraper_v1,ความสัมพันธ์มนุษย์ บางที ใช้ใจมากกว่าสมอง,ความสัมพันธ์มนุษย์ บางที ใช้ใจมากกว่าสมอง,2025-11-29 08:18:55,"['ความสัมพันธ์', 'มนุษย์', ' ', 'บางที', ' ', 'ใช้', 'ใจ', 'มากกว่า', 'สมอง']"
1986998429202194495,twitter,post,https://x.com/yakinikulovers_/status/1986998429202194495,text,2025-11-08T03:25:16.000Z,selenium_x_scraper_v1,ห้าาา ทวิตนี้คือตบเตือนสติ,ห้าาา ทวิตนี้คือตบเตือนสติ,2025-11-29 08:18:55,"['ห้า', 'าา', ' ', 'ทวิ', 'ต', 'นี้', 'คือ', 'ตบ', 'เตือนสติ']"
1986581806708396219,twitter,post,https://x.com/EKatsuaykern/status/1986581806708396219,text,2025-11-06T23:49:46.000Z,selenium_x_scraper_v1,นี่ว่าพูดอ่ะพูดได้ แต่คิดว่าถ้าเจอเองนี่ก็น่าจะโง่เองด้วยเหมือนกัน 55555 เหมือนเราให้คำปรึกษาคนอื่นได้ แต่จะโง่เรื่องของตัวเองอ่ะ,นี่ว่าพูดอ่ะพูดได้ แต่คิดว่าถ้าเจอเองนี่ก็น่าจะโง่เองด้วยเหมือนกัน 55555 เหมือนเราให้คำปรึกษาคนอื่นได้ แต่จะโง่เรื่องของตัวเองอ่ะ,2025-11-29 08:18:55,"['นี่', 'ว่า', 'พูด', 'อ่ะ', 'พูด', 'ได้', ' ', 'แต่', 'คิด', 'ว่า', 'ถ้า', 'เจอ', 'เอง', 'นี่', 'ก็', 'น่าจะ', 'โง่', 'เอง', 'ด้วย', 'เหมือนกัน', ' ', 'หัวเราะ', ' ', 'เหมือน', 'เรา', 'ให้คำปรึกษา', 'คนอื่น', 'ได้', ' ', 'แต่', 'จะ', 'โง่', 'เรื่อง', 'ของ', 'ตัวเอง', 'อ่ะ']"
1986442315414839456,twitter,post,https://x.com/jellyfishxsunf/status/1986442315414839456,text,2025-11-06T14:35:28.000Z,selenium_x_scraper_v1,แรงมากเหมือนโดนตบหน้า แต่เลิกแล้วค่ะ ไอห่านั่นนอกจากนิสัยเสียแล้วยังกล้านอกใจกุอีก แม่งเอ้ยเลิกกันแล้วเหมือนได้ตัวเองคืนมา คนรอบข้างทุกคนดีใจกันหมด,แรงมากเหมือนโดนตบหน้า แต่เลิกแล้วค่ะ ไอห่านั่นนอกจากนิสัยเสียแล้วยังกล้านอกใจกุอีก แม่งเอ้ยเลิกกันแล้วเหมือนได้ตัวเองคืนมา คนรอบข้างทุกคนดีใจกันหมด,2025-11-29 08:18:55,"['แรง', 'มาก', 'เหมือน', 'โดน', 'ตบหน้า', ' ', 'แต่', 'เลิก', 'แล้ว', 'ค่ะ', ' ', 'ไอ', 'ห่า', 'นั่น', 'นอกจาก', 'นิสัย', 'เสียแล้ว', 'ยัง', 'กล้า', 'นอกใจ', 'กุ', 'อีก', ' ', 'แม่', 'ง', 'เอ้ย', 'เลิกกัน', 'แล้ว', 'เหมือน', 'ได้', 'ตัวเอง', 'คืน', 'มา', ' ', 'คน', 'รอบข้าง', 'ทุกคน', 'ดีใจ', 'กัน', 'หมด']"
1986449644327739446,twitter,post,https://x.com/yakpenhmawa/status/1986449644327739446,text,2025-11-06T15:04:36.000Z,selenium_x_scraper_v1,เค้าลืมประเด็นโดน play victim นู่นนี่นั่นกันไปหมดแล้วหรอ งง,เค้าลืมประเด็นโดน play victim นู่นนี่นั่นกันไปหมดแล้วหรอ งง,2025-11-29 08:18:55,"['เค้า', 'ลืม', 'ประเด็น', 'โดน', ' ', 'play', ' ', 'victim', ' ', 'นู่น', 'นี่', 'นั่น', 'กัน', 'ไป', 'หมด', 'แล้ว', 'หรอ', ' ', 'งง']"
1986470482057810059,twitter,post,https://x.com/inkinkoil/status/1986470482057810059,text,2025-11-06T16:27:24.000Z,selenium_x_scraper_v1,นี่ก็เคย เคยแบบรู้ตัวด้วยนะ รับรู้ด้านตรรกะและเหตุผลหมดว่าผชคนนั้นมันเหี้ยยังไง จะส่งผลเสียอะไร มันปากหวานเพื่ออะไร ถ้าคบต่อคงไม่รอดแน่ รู้หมด แต่พอความรักบังตาอะ เอาความรู้สึกมานำเหตุผลเลย ยังกะโยนสมองทิ้ง,นี่ก็เคย เคยแบบรู้ตัวด้วยนะ รับรู้ด้านตรรกะและเหตุผลหมดว่าผชคนนั้นมันเหี้ยยังไง จะส่งผลเสียอะไร มันปากหวานเพื่ออะไร ถ้าคบต่อคงไม่รอดแน่ รู้หมด แต่พอความรักบังตาอะ เอาความรู้สึกมานำเหตุผลเลย ยังกะโยนสมองทิ้ง,2025-11-29 08:18:55,"['นี่', 'ก็', 'เคย', ' ', 'เคย', 'แบบ', 'รู้ตัว', 'ด้วย', 'นะ', ' ', 'รับรู้', 'ด้าน', 'ตรรกะ', 'และ', 'เหตุผล', 'หมด', 'ว่า', 'ผชคน', 'นั้น', 'มัน', 'เหี้ย', 'ยังไง', ' ', 'จะ', 'ส่ง', 'ผลเสีย', 'อะไร', ' ', 'มัน', 'ปากหวาน', 'เพื่อ', 'อะไร', ' ', 'ถ้า', 'คบ', 'ต่อ', 'คง', 'ไม่', 'รอด', 'แน่', ' ', 'รู้', 'หมด', ' ', 'แต่', 'พอ', 'ความรัก', 'บังตา', 'อะ', ' ', 'เอา', 'ความรู้สึก', 'มา', 'นำ', 'เหตุผล', 'เลย', ' ', 'ยังกะ', 'โยน', 'สมอง', 'ทิ้ง']"
1986532247751827685,twitter,post,https://x.com/daisymiemie/status/1986532247751827685,text,2025-11-06T20:32:50.000Z,selenium_x_scraper_v1,อยากแท็กเพื่อนจัง,อยากแท็กเพื่อนจัง,2025-11-29 08:18:55,"['อยาก', 'แท็ก', 'เพื่อน', 'จัง']"
1986423458939740201,twitter,post,https://x.com/aalpkool_/status/1986423458939740201,text,2025-11-06T13:20:33.000Z,selenium_x_scraper_v1,นี่เพิ่งมีแฟนคนแรก ละโชคดีมากที่แฟนกล้าพูด กล้าเตือนในสิ่งที่เราทำนิสัยไม่น่ารักอะ ดีที่กล้าพูดเรื่องทุกเรื่องกัน มันเลยทำให้ทึกอย่างในตอนนี้ราบรื่นมากๆ,นี่เพิ่งมีแฟนคนแรก ละโชคดีมากที่แฟนกล้าพูด กล้าเตือนในสิ่งที่เราทำนิสัยไม่น่ารักอะ ดีที่กล้าพูดเรื่องทุกเรื่องกัน มันเลยทำให้ทึกอย่างในตอนนี้ราบรื่นมากๆ,2025-11-29 08:18:55,"['นี่', 'เพิ่ง', 'มี', 'แฟน', 'คน', 'แรก', ' ', 'ละ', 'โชค', 'ดีมาก', 'ที่', 'แฟน', 'กล้า', 'พูด', ' ', 'กล้า', 'เตือน', 'ใน', 'สิ่ง', 'ที่', 'เรา', 'ทำ', 'นิสัย', 'ไม่', 'น่ารัก', 'อะ', ' ', 'ดี', 'ที่', 'กล้า', 'พูด', 'เรื่อง', 'ทุก', 'เรื่อง', 'กัน', ' ', 'มัน', 'เลย', 'ทำให้', 'ทึก', 'อย่าง', 'ใน', 'ตอนนี้', 'ราบรื่น', 'มาก', 'ๆ']"
1986437752582472108,twitter,post,https://x.com/maewna825/status/1986437752582472108,text,2025-11-06T14:17:21.000Z,selenium_x_scraper_v1,ก้ถุก 100%,ก้ถุก 100%,2025-11-29 08:18:55,"['ก้ถุก', ' ', '100']"
1986447324730847717,twitter,post,https://x.com/jellyjully107/status/1986447324730847717,text,2025-11-06T14:55:23.000Z,selenium_x_scraper_v1,คนฉลาดก็คือคนฉลาดแหล่ะ แค่ตอนมีความรัก ความรักมันบังตาแค่นั้นเอง คือรู้ทุกปัญหาปรึกษาทุกคน ความเห็นเป็นเอกฉันท์ แต่สุดท้ายก็รักเค้าอิดอก กูค่ตจะเอือมเพื่อนแต่ละคน,คนฉลาดก็คือคนฉลาดแหล่ะ แค่ตอนมีความรัก ความรักมันบังตาแค่นั้นเอง คือรู้ทุกปัญหาปรึกษาทุกคน ความเห็นเป็นเอกฉันท์ แต่สุดท้ายก็รักเค้าอิดอก กูค่ตจะเอือมเพื่อนแต่ละคน,2025-11-29 08:18:55,"['คน', 'ฉลาด', 'ก็', 'คือ', 'คน', 'ฉลาด', 'แห', 'ล่ะ', ' ', 'แค่', 'ตอน', 'มี', 'ความรัก', ' ', 'ความรัก', 'มัน', 'บังตา', 'แค่นั้น', 'เอง', ' ', 'คือ', 'รู้', 'ทุก', 'ปัญหา', 'ปรึกษา', 'ทุกคน', ' ', 'ความเห็น', 'เป็นเอกฉันท์', ' ', 'แต่', 'สุดท้าย', 'ก็', 'รัก', 'เค้า', 'อิด', 'อก', ' ', 'กู', 'ค่ต', 'จะ', 'เอือม', 'เพื่อน', 'แต่ละคน']"
1986482733787521532,twitter,post,https://x.com/purplegerbet/status/1986482733787521532,text,2025-11-06T17:16:05.000Z,selenium_x_scraper_v1,ไม่เกี่ยวนะ การรับมือกับความสัมพันธ์ปสด.เป็นสกิลอย่างนึง ขึ้นอยู่กับความคิด ประสบการณ์ ความรู้สึก หลายอย่าง แต่ไม่เกี่ยวกับความฉลาดเลย,ไม่เกี่ยวนะ การรับมือกับความสัมพันธ์ปสด.เป็นสกิลอย่างนึง ขึ้นอยู่กับความคิด ประสบการณ์ ความรู้สึก หลายอย่าง แต่ไม่เกี่ยวกับความฉลาดเลย,2025-11-29 08:18:55,"['ไม่', 'เกี่ยว', 'นะ', ' ', 'การ', 'รับมือ', 'กับ', 'ความสัมพันธ์', 'ปสด', '.', 'เป็น', 'สกิล', 'อย่าง', 'นึง', ' ', 'ขึ้นอยู่กับ', 'ความคิด', ' ', 'ประสบการณ์', ' ', 'ความรู้สึก', ' ', 'หลายอย่าง', ' ', 'แต่', 'ไม่', 'เกี่ยวกับ', 'ความ', 'ฉลาด', 'เลย']"
1986413551901417483,twitter,post,https://x.com/oaemoamp/status/1986413551901417483,text,2025-11-06T12:41:11.000Z,selenium_x_scraper_v1,เคยคิดว่านี่เป็นสาเหตุนึงที่ทำให้หลายคนเลือกเป็นโสดมั้ยวะ 555555555 เพราะทุกครั้งที่ฮีลตัวเองขึ้นมาจากการไปชอบพอกับใครซักคน ถามตัวเองตลอดทำไมตอนนั้นทำแบบนั้น นังโง่ววว 555555555 รู้สึกไม่อยากให้ตัวเองกลับไปเป็นคนแบบนั้นอีก อาย ,เคยคิดว่านี่เป็นสาเหตุนึงที่ทำให้หลายคนเลือกเป็นโสดมั้ยวะ 555555555 เพราะทุกครั้งที่ฮีลตัวเองขึ้นมาจากการไปชอบพอกับใครซักคน ถามตัวเองตลอดทำไมตอนนั้นทำแบบนั้น นังโง่ววว 555555555 รู้สึกไม่อยากให้ตัวเองกลับไปเป็นคนแบบนั้นอีก อาย ,2025-11-29 08:18:55,"['เคย', 'คิด', 'ว่า', 'นี่', 'เป็นสาเหตุ', 'นึง', 'ที่', 'ทำให้', 'หลาย', 'คน', 'เลือก', 'เป็นโสด', 'มั้ย', 'วะ', ' ', 'หัวเราะ', ' ', 'เพราะ', 'ทุกครั้งที่', 'ฮี', 'ล', 'ตัวเอง', 'ขึ้น', 'มาจาก', 'การ', 'ไป', 'ชอบ', 'พอกับ', 'ใคร', 'ซัก', 'คน', ' ', 'ถาม', 'ตัวเอง', 'ตลอด', 'ทำไม', 'ตอนนั้น', 'ทำ', 'แบบ', 'นั้น', ' ', 'นัง', 'โง่', 'ววว', ' ', 'หัวเราะ', ' ', 'รู้สึก', 'ไม่', 'อยาก', 'ให้', 'ตัวเอง', 'กลับ', 'ไป', 'เป็น', 'คน', 'แบบ', 'นั้น', 'อีก', ' ', 'อาย']"
1986466476250046967,twitter,post,https://x.com/nonbonkaan/status/1986466476250046967,text,2025-11-06T16:11:29.000Z,selenium_x_scraper_v1,ก็แค่คนปรับตัวเฉยๆ เวลาคบใครคงไม่มีใครเป็นตัวเองได้100%มั้ง  มันต้องนึกถึงคนข้างๆด้วย ถึงเวลามันหาเหตุผลไม่ค่อยได้หรอก ความรู้สึกมันนำก่อน สติใครสติมัน,ก็แค่คนปรับตัวเฉยๆ เวลาคบใครคงไม่มีใครเป็นตัวเองได้100%มั้ง  มันต้องนึกถึงคนข้างๆด้วย ถึงเวลามันหาเหตุผลไม่ค่อยได้หรอก ความรู้สึกมันนำก่อน สติใครสติมัน,2025-11-29 08:18:55,"['ก็', 'แค่', 'คน', 'ปรับตัว', 'เฉย', 'ๆ', ' ', 'เวลา', 'คบ', 'ใคร', 'คง', 'ไม่', 'มี', 'ใคร', 'เป็น', 'ตัวเอง', 'ได้', '100', ' ', 'มั้ง', ' ', 'มัน', 'ต้อง', 'นึกถึง', 'คน', 'ข้างๆ', 'ด้วย', ' ', 'ถึง', 'เวลา', 'มัน', 'หา', 'เหตุผล', 'ไม่ค่อย', 'ได้', 'หรอก', ' ', 'ความรู้สึก', 'มัน', 'นำ', 'ก่อน', ' ', 'สติ', 'ใคร', 'สติ', 'มัน']"
1986468941649326413,twitter,post,https://x.com/mookki_/status/1986468941649326413,text,2025-11-06T16:21:17.000Z,selenium_x_scraper_v1,อยู่กับคนโง่ เราจะโง่ตามเค้าโดยไม่ตั้งคำถามอะไรเลยจริง,อยู่กับคนโง่ เราจะโง่ตามเค้าโดยไม่ตั้งคำถามอะไรเลยจริง,2025-11-29 08:18:55,"['อยู่', 'กับ', 'คนโง่', ' ', 'เรา', 'จะ', 'โง่', 'ตาม', 'เค้า', 'โดย', 'ไม่', 'ตั้งคำถาม', 'อะไร', 'เลย', 'จริง']"
1987173631894692109,twitter,post,https://x.com/lotsory/status/1987173631894692109,text,2025-11-08T15:01:28.000Z,selenium_x_scraper_v1,กุเค้นนนนน,กุเค้นนนนน,2025-11-29 08:18:55,"['กุ', 'เค้น', 'นนนน']"
1987535972226273519,twitter,post,https://x.com/auanholland/status/1987535972226273519,text,2025-11-09T15:01:17.000Z,selenium_x_scraper_v1,พิสดารพิลึกแบบเราดูสิจะมีใครมาทำให้เราเสียตัวตนได้,พิสดารพิลึกแบบเราดูสิจะมีใครมาทำให้เราเสียตัวตนได้,2025-11-29 08:18:55,"['พิสดาร', 'พิลึก', 'แบบ', 'เรา', 'ดู', 'สิ', 'จะ', 'มี', 'ใคร', 'มา', 'ทำให้', 'เรา', 'เสีย', 'ตัวตน', 'ได้']"
1986633500565619154,twitter,post,https://x.com/bbemySeptember/status/1986633500565619154,text,2025-11-07T03:15:11.000Z,selenium_x_scraper_v1,ก็พอจะเห็นภาพของตัวเองอยู่ในตอนนั้น ก็เรามันพวกไอ้ต้าวบูชาความรัก,ก็พอจะเห็นภาพของตัวเองอยู่ในตอนนั้น ก็เรามันพวกไอ้ต้าวบูชาความรัก,2025-11-29 08:18:55,"['ก็', 'พอ', 'จะ', 'เห็นภาพ', 'ของ', 'ตัวเอง', 'อยู่', 'ใน', 'ตอนนั้น', ' ', 'ก็', 'เรา', 'มัน', 'พวก', 'ไอ้', 'ต้าว', 'บูชา', 'ความรัก']"
1986443350090915849,twitter,post,https://x.com/intothemoodx/status/1986443350090915849,text,2025-11-06T14:39:35.000Z,selenium_x_scraper_v1,โดนตบหน้า,โดนตบหน้า,2025-11-29 08:18:55,"['โดน', 'ตบหน้า']"
1986823684091523077,twitter,post,https://x.com/2705jc/status/1986823684091523077,text,2025-11-07T15:50:54.000Z,selenium_x_scraper_v1,ถุก,ถุก,2025-11-29 08:18:55,['ถุก']
1986458387035685062,twitter,post,https://x.com/nurada_tytn/status/1986458387035685062,text,2025-11-06T15:39:20.000Z,selenium_x_scraper_v1,ทุกวันนี้เห็นชีวิตคนอื่นเตือนตัวเองตลอด กูอย่าโง่ กูต้องมีสติ กูอย่าทน,ทุกวันนี้เห็นชีวิตคนอื่นเตือนตัวเองตลอด กูอย่าโง่ กูต้องมีสติ กูอย่าทน,2025-11-29 08:18:55,"['ทุกวันนี้', 'เห็น', 'ชีวิต', 'คนอื่น', 'เตือน', 'ตัวเอง', 'ตลอด', ' ', 'กู', 'อย่า', 'โง่', ' ', 'กู', 'ต้อง', 'มีสติ', ' ', 'กู', 'อย่า', 'ทน']"
1986667074316607774,twitter,post,https://x.com/pxllinz/status/1986667074316607774,text,2025-11-07T05:28:35.000Z,selenium_x_scraper_v1,ฉลาดการใช้ชีวิต แต่เรื่องความรักไม่ได้เอาสมองมาคิดไง (ด่าตัวเอง) 555,ฉลาดการใช้ชีวิต แต่เรื่องความรักไม่ได้เอาสมองมาคิดไง (ด่าตัวเอง) 555,2025-11-29 08:18:55,"['ฉลาด', 'การ', 'ใช้ชีวิต', ' ', 'แต่', 'เรื่อง', 'ความรัก', 'ไม่', 'ได้', 'เอา', 'สมอง', 'มา', 'คิด', 'ไง', ' ', 'ด่า', 'ตัวเอง', ' ', 'หัวเราะ']"
1986434860530253899,twitter,post,https://x.com/mamha55/status/1986434860530253899,text,2025-11-06T14:05:51.000Z,selenium_x_scraper_v1,ละเวลากุเห็นใครโดนแฟนเอาเปรียบนะ กุพูด ล้อมันคำเดียว รักเค้า,ละเวลากุเห็นใครโดนแฟนเอาเปรียบนะ กุพูด ล้อมันคำเดียว รักเค้า,2025-11-29 08:18:55,"['ละ', 'เวลา', 'กุ', 'เห็น', 'ใคร', 'โดน', 'แฟน', 'เอาเปรียบ', 'นะ', ' ', 'กุ', 'พูด', ' ', 'ล้อ', 'มัน', 'คำ', 'เดียว', ' ', 'รัก', 'เค้า']"
1986813447812837485,twitter,post,https://x.com/lunadelure/status/1986813447812837485,text,2025-11-07T15:10:13.000Z,selenium_x_scraper_v1,แหม่มันก็มีช่วงโง่บ้าง ก็รักเขา เป็นโง่เป้นง่อยบ้างก็สนุกดีคุณ,แหม่มันก็มีช่วงโง่บ้าง ก็รักเขา เป็นโง่เป้นง่อยบ้างก็สนุกดีคุณ,2025-11-29 08:18:55,"['แหม่', 'มัน', 'ก็', 'มี', 'ช่วง', 'โง่', 'บ้าง', ' ', 'ก็', 'รัก', 'เขา', ' ', 'เป็น', 'โง่', 'เป้', 'น', 'ง่อย', 'บ้าง', 'ก็', 'สนุก', 'ดี', 'คุณ']"
1986448183992758543,twitter,post,https://x.com/ImBgb/status/1986448183992758543,text,2025-11-06T14:58:48.000Z,selenium_x_scraper_v1,เพราะพอมีแฟน มันก็จะมีเรื่องความรู้สึกเพิ่มขึ้นมา และอีความรู้สึกพึงใจ เสน่หานี่แหละที่ทำให้ตรรกะ เหตุผลอ่อนกำลังลง,เพราะพอมีแฟน มันก็จะมีเรื่องความรู้สึกเพิ่มขึ้นมา และอีความรู้สึกพึงใจ เสน่หานี่แหละที่ทำให้ตรรกะ เหตุผลอ่อนกำลังลง,2025-11-29 08:18:55,"['เพราะ', 'พอ', 'มี', 'แฟน', ' ', 'มัน', 'ก็', 'จะ', 'มีเรื่อง', 'ความรู้สึก', 'เพิ่มขึ้น', 'มา', ' ', 'และ', 'อี', 'ความรู้สึก', 'พึงใจ', ' ', 'เสน่หา', 'นี่แหละ', 'ที่', 'ทำให้', 'ตรรกะ', ' ', 'เหตุผล', 'อ่อนกำลัง', 'ลง']"
1986792138877862393,twitter,post,https://x.com/loserluvwinner/status/1986792138877862393,text,2025-11-07T13:45:33.000Z,selenium_x_scraper_v1,5555555555555 ฉลาดขนาดไหนก้เอาชนะฮอโมนไม่ได้ เชื่อนี่,5555555555555 ฉลาดขนาดไหนก้เอาชนะฮอโมนไม่ได้ เชื่อนี่,2025-11-29 08:18:55,"['หัวเราะ', ' ', 'ฉลาด', 'ขนาด', 'ไหน', 'ก้', 'เอาชนะ', 'ฮอ', 'โมน', 'ไม่', 'ได้', ' ', 'เชื่อ', 'นี่']"
1986457206661763492,twitter,post,https://x.com/steam_me/status/1986457206661763492,text,2025-11-06T15:34:39.000Z,selenium_x_scraper_v1,จริง มาก กูเหี้ยมาก ทิ้งตัวตนสุดๆ กว่าจะปรับ กลับมาได้ ก็ยังไม่100 แค่ก็นะมันพยยได้อะถ้าดื้ออยากจะอยู่,จริง มาก กูเหี้ยมาก ทิ้งตัวตนสุดๆ กว่าจะปรับ กลับมาได้ ก็ยังไม่100 แค่ก็นะมันพยยได้อะถ้าดื้ออยากจะอยู่,2025-11-29 08:18:55,"['จริง', ' ', 'มาก', ' ', 'กู', 'เหี้ย', 'มาก', ' ', 'ทิ้ง', 'ตัวตน', 'สุด', 'ๆ', ' ', 'กว่า', 'จะ', 'ปรับ', ' ', 'กลับมา', 'ได้', ' ', 'ก็', 'ยัง', 'ไม่', '100', ' ', 'แค่', 'ก็', 'นะ', 'มัน', 'พยย', 'ได้', 'อะ', 'ถ้า', 'ดื้อ', 'อยาก', 'จะ', 'อยู่']"
