id,platform,platform_type,url,content_type,timestamp,scraper_module,text,raw_text,scrape_date,tokens
1988177725195247752,twitter,post,https://x.com/nopup6/status/1988177725195247752,text,2025-11-11T09:31:22.000Z,selenium_x_scraper_v1,"มีนะ แต่สัก100คนเอาที่รุกเพียวๆ จะมีไม่เกิน10คน ที่เยดกะเทยแปลงได้
แต่ถ้าไบ100คนน่าจะมี 20-30คนที่ทำได้
ไหนจะพวกเด็กNร้านนวด 50-80%ทำได้หมดเพื่อเงิน
แต่สำหรับผมไม่เอาไม่มีทาง
แต่เพื่อนผมเป็นโบทนะ เคยเป็นกะเทยหัวโปกมาก่อน นางเคยลองกับผญ.แท้ครั้งนึง","มีนะ แต่สัก100คนเอาที่รุกเพียวๆ จะมีไม่เกิน10คน ที่เยดกะเทยแปลงได้
แต่ถ้าไบ100คนน่าจะมี 20-30คนที่ทำได้
ไหนจะพวกเด็กNร้านนวด 50-80%ทำได้หมดเพื่อเงิน
แต่สำหรับผมไม่เอาไม่มีทาง
แต่เพื่อนผมเป็นโบทนะ เคยเป็นกะเทยหัวโปกมาก่อน นางเคยลองกับผญ.แท้ครั้งนึง",2025-11-29 08:18:55,"['มี', 'นะ', ' ', 'แต่', 'สัก', '100', 'คน', 'เอา', 'ที่', 'รุก', 'เพียว', 'ๆ', ' ', 'จะ', 'มี', 'ไม่', 'เกิน', '10', 'คน', ' ', 'ที่', 'เย', 'ด', 'กะเทย', 'แปลง', 'ได้', ' ', 'แต่', 'ถ้า', 'ไบ', '100', 'คน', 'น่าจะ', 'มี', ' ', '20', ' ', '30', 'คน', 'ที่', 'ทำได้', ' ', 'ไหนจะ', 'พวก', 'เด็ก', 'n', 'ร้าน', 'นวด', ' ', '50', ' ', '80', ' ', 'ทำได้', 'หมด', 'เพื่อ', 'เงิน', ' ', 'แต่', 'สำหรับ', 'ผม', 'ไม่', 'เอา', 'ไม่', 'มีทาง', ' ', 'แต่', 'เพื่อน', 'ผม', 'เป็น', 'โบ', 'ท', 'นะ', ' ', 'เคย', 'เป็น', 'กะเทย', 'หัว', 'โปก', 'มา', 'ก่อน', ' ', 'นาง', 'เคย', 'ลอง', 'กับ', 'ผญ.', 'แท้', 'ครั้ง', 'นึง']"
1987987766526046549,twitter,post,https://x.com/Iamkevins18/status/1987987766526046549,text,2025-11-10T20:56:33.000Z,selenium_x_scraper_v1,เกย์รุก เยกระเทย เยผู้หญิง มีจริง บางทีก็เกย์รับ เกย์สาวไปเยกระเทย เยสาวแท้ก็มีเยอะเลยครับ ในทวิตนี่แหละ,เกย์รุก เยกระเทย เยผู้หญิง มีจริง บางทีก็เกย์รับ เกย์สาวไปเยกระเทย เยสาวแท้ก็มีเยอะเลยครับ ในทวิตนี่แหละ,2025-11-29 08:18:55,"['เกย์', 'รุก', ' ', 'เย', 'กระ', 'เท', 'ย', ' ', 'เย', 'ผู้หญิง', ' ', 'มี', 'จริง', ' ', 'บางที', 'ก็', 'เกย์', 'รับ', ' ', 'เกย์', 'สาว', 'ไป', 'เย', 'กระ', 'เท', 'ย', ' ', 'เย', 'สาว', 'แท้', 'ก็', 'มี', 'เยอะ', 'เลย', 'ครับ', ' ', 'ใน', 'ทวิ', 'ต', 'นี่แหละ']"
1988055652401586187,twitter,post,https://x.com/bigfanofstp/status/1988055652401586187,text,2025-11-11T01:26:18.000Z,selenium_x_scraper_v1,โอ้ยย สำคัญตัวไรเบอร์นั้น5555555555555 ก็ไปด่าคนอื่นเขาก่อน เขาก็ต้องด่ากลับอยู่ละ ถ้าพิมพ์ปกติใครเค้าจะมารุมด่ามึง ให้พ่อแม่พาไปพบจิตแพทย์หน่อยเหอะ พิมพ์ได้ขนาดนี้ไม่ปกติแล้ว,โอ้ยย สำคัญตัวไรเบอร์นั้น5555555555555 ก็ไปด่าคนอื่นเขาก่อน เขาก็ต้องด่ากลับอยู่ละ ถ้าพิมพ์ปกติใครเค้าจะมารุมด่ามึง ให้พ่อแม่พาไปพบจิตแพทย์หน่อยเหอะ พิมพ์ได้ขนาดนี้ไม่ปกติแล้ว,2025-11-29 08:18:55,"['โอ้ย', 'ย', ' ', 'สำคัญ', 'ตัวไร', 'เบอร์', 'นั้น', 'หัวเราะ', ' ', 'ก็', 'ไป', 'ด่า', 'คนอื่น', 'เขา', 'ก่อน', ' ', 'เขา', 'ก็', 'ต้อง', 'ด่ากลับ', 'อยู่', 'ละ', ' ', 'ถ้า', 'พิมพ์', 'ปกติ', 'ใคร', 'เค้า', 'จะ', 'มา', 'รุม', 'ด่า', 'มึง', ' ', 'ให้', 'พ่อแม่', 'พา', 'ไป', 'พบ', 'จิตแพทย์', 'หน่อย', 'เหอะ', ' ', 'พิมพ์', 'ได้ขนาด', 'นี้', 'ไม่', 'ปกติ', 'แล้ว']"
1988060578909483135,twitter,post,https://x.com/0kinii/status/1988060578909483135,text,2025-11-11T01:45:53.000Z,selenium_x_scraper_v1,จากที่เห็นคุณมาสองสาม reply ก็รู้เลยว่าเป็นคนที่มีสติปัญญาอยู่ในระดับต่ำตมและไร้การศึกษาดีนะครับ เหนื่อยใจแทนคนรอบข้างคุณนะที่ต้องปฏิสัมพันธ์กับคนแบบคุณ หรือว่าคุณทำแบบนี้แค่ในออนไลน์เพราะคิดว่าไม่มีใครรู้จักและตามตัวได้? ความคิดแบบนี้มันน่าสมเพชมากเลยนะครับ :),จากที่เห็นคุณมาสองสาม reply ก็รู้เลยว่าเป็นคนที่มีสติปัญญาอยู่ในระดับต่ำตมและไร้การศึกษาดีนะครับ เหนื่อยใจแทนคนรอบข้างคุณนะที่ต้องปฏิสัมพันธ์กับคนแบบคุณ หรือว่าคุณทำแบบนี้แค่ในออนไลน์เพราะคิดว่าไม่มีใครรู้จักและตามตัวได้? ความคิดแบบนี้มันน่าสมเพชมากเลยนะครับ :),2025-11-29 08:18:55,"['จาก', 'ที่', 'เห็น', 'คุณ', 'มา', 'สอง', 'สาม', ' ', 'reply', ' ', 'ก็', 'รู้', 'เลย', 'ว่า', 'เป็น', 'คน', 'ที่', 'มีสติปัญญา', 'อยู่', 'ใน', 'ระดับ', 'ต่ำ', 'ตม', 'และ', 'ไร้', 'การศึกษา', 'ดี', 'นะ', 'ครับ', ' ', 'เหนื่อยใจ', 'แทน', 'คน', 'รอบข้าง', 'คุณ', 'นะ', 'ที่', 'ต้อง', 'ปฏิสัมพันธ์', 'กับ', 'คน', 'แบบ', 'คุณ', ' ', 'หรือว่า', 'คุณ', 'ทำ', 'แบบนี้', 'แค่', 'ใน', 'ออนไลน์', 'เพราะ', 'คิด', 'ว่า', 'ไม่', 'มี', 'ใคร', 'รู้จัก', 'และ', 'ตามตัว', 'ได้', '?', ' ', 'ความคิด', 'แบบนี้', 'มัน', 'น่าสมเพช', 'มาก', 'เลย', 'นะ', 'ครับ']"
1988042872227270905,twitter,post,https://x.com/glfanboy/status/1988042872227270905,text,2025-11-11T00:35:31.000Z,selenium_x_scraper_v1,นี่ไม่รู้จริงๆ เหรอ ว่าสิ่งที่ตัวเองกำลังทำ คำที่ใช้ มันเกินคำว่าแซะแล้วนะ หรือชีวิตไม่เอาอะไรแล้วจริงๆ,นี่ไม่รู้จริงๆ เหรอ ว่าสิ่งที่ตัวเองกำลังทำ คำที่ใช้ มันเกินคำว่าแซะแล้วนะ หรือชีวิตไม่เอาอะไรแล้วจริงๆ,2025-11-29 08:18:55,"['นี่', 'ไม่', 'รู้', 'จริงๆ', ' ', 'เหรอ', ' ', 'ว่า', 'สิ่ง', 'ที่', 'ตัวเอง', 'กำลัง', 'ทำ', ' ', 'คำ', 'ที่', 'ใช้', ' ', 'มัน', 'เกิน', 'คำ', 'ว่า', 'แซะ', 'แล้ว', 'นะ', ' ', 'หรือ', 'ชีวิต', 'ไม่', 'เอา', 'อะไร', 'แล้ว', 'จริงๆ']"
1988103421191426112,twitter,post,https://x.com/sonick33/status/1988103421191426112,text,2025-11-11T04:36:07.000Z,selenium_x_scraper_v1,"เอาไปใช้หลังขึ้นศาลนะ

ตามที่ข้าพเจ้า ได้กระทำความผิดฐานหมื่นประมาทด้วยการโฆษณา และพรบ.คอม ต่อ  xxx ซึ่งทำให้ได้รับความเสื่อมเสียชื่อเสียง อับอาย และถูกดูหมิ่น
ขณะนี้ข้าพเจ้าได้รู้สึกสำนึกผิดในการกระทำดังกล่าว จึงได้ทำการโพสต์ข้อความนี้เพื่อแสดงความขอโทษ และรู้สึกสำนึกผิด ….","เอาไปใช้หลังขึ้นศาลนะ

ตามที่ข้าพเจ้า ได้กระทำความผิดฐานหมื่นประมาทด้วยการโฆษณา และพรบ.คอม ต่อ  xxx ซึ่งทำให้ได้รับความเสื่อมเสียชื่อเสียง อับอาย และถูกดูหมิ่น
ขณะนี้ข้าพเจ้าได้รู้สึกสำนึกผิดในการกระทำดังกล่าว จึงได้ทำการโพสต์ข้อความนี้เพื่อแสดงความขอโทษ และรู้สึกสำนึกผิด ….",2025-11-29 08:18:55,"['เอา', 'ไป', 'ใช้', 'หลัง', 'ขึ้นศาล', 'นะ', ' ', 'ตามที่', 'ข้าพเจ้า', ' ', 'ได้', 'กระทำความผิด', 'ฐาน', 'หมื่น', 'ประมาท', 'ด้วย', 'การ', 'โฆษณา', ' ', 'และ', 'พรบ.', 'คอม', ' ', 'ต่อ', ' ', 'xxx', ' ', 'ซึ่ง', 'ทำให้', 'ได้รับ', 'ความเสื่อม', 'เสียชื่อเสียง', ' ', 'อับอาย', ' ', 'และ', 'ถูก', 'ดูหมิ่น', ' ', 'ขณะนี้', 'ข้าพเจ้า', 'ได้', 'รู้สึก', 'สำนึกผิด', 'ใน', 'การกระทำ', 'ดังกล่าว', ' ', 'จึง', 'ได้', 'ทำการ', 'โพสต์', 'ข้อความ', 'นี้', 'เพื่อ', 'แสดง', 'ความ', 'ขอโทษ', ' ', 'และ', 'รู้สึก', 'สำนึกผิด', ' ', '.']"
1988110155016532063,twitter,post,https://x.com/BuvBboo_o/status/1988110155016532063,text,2025-11-11T05:02:52.000Z,selenium_x_scraper_v1,พี่ชายอยากมีบ้านฟรี,พี่ชายอยากมีบ้านฟรี,2025-11-29 08:18:55,"['พี่ชาย', 'อยาก', 'มี', 'บ้าน', 'ฟรี']"
1988165453446013214,twitter,post,https://x.com/bambi_9799/status/1988165453446013214,text,2025-11-11T08:42:37.000Z,selenium_x_scraper_v1,กูให้เลยไม่ถึงป.2,กูให้เลยไม่ถึงป.2,2025-11-29 08:18:55,"['กู', 'ให้', 'เลย', 'ไม่', 'ถึง', 'ป.', '2']"
1988164020965437557,twitter,post,https://x.com/m_rungsinee/status/1988164020965437557,text,2025-11-11T08:36:55.000Z,selenium_x_scraper_v1,อะไรของมึง หลอนก็ไปนอน,อะไรของมึง หลอนก็ไปนอน,2025-11-29 08:18:55,"['อะไร', 'ของ', 'มึง', ' ', 'หลอน', 'ก็', 'ไป', 'นอน']"
1988170570274664743,twitter,post,https://x.com/sugarcoatmezz/status/1988170570274664743,text,2025-11-11T09:02:57.000Z,selenium_x_scraper_v1,พูดแบบนี้รู้เลยว่าตอนเด็กที่บ้านใช้มือหรือใช้ตีนไกวเปล อิสัด,พูดแบบนี้รู้เลยว่าตอนเด็กที่บ้านใช้มือหรือใช้ตีนไกวเปล อิสัด,2025-11-29 08:18:55,"['พูด', 'แบบนี้', 'รู้', 'เลย', 'ว่า', 'ตอน', 'เด็ก', 'ที่', 'บ้าน', 'ใช้', 'มือ', 'หรือ', 'ใช้', 'ตีน', 'ไกว', 'เปล', ' ', 'อิ', 'สัด']"
1988388612409634954,twitter,post,https://x.com/Tharis20383544/status/1988388612409634954,text,2025-11-11T23:29:22.000Z,selenium_x_scraper_v1,อนู่ดีๆไม่ว่าดี ดันอยากประวัติเสีย 55555เออดี จะรอดูว่ะ  มึงมันดื้อดี ไปให้สุดเเล้วจบที่ขึ้นศาลนะ,อนู่ดีๆไม่ว่าดี ดันอยากประวัติเสีย 55555เออดี จะรอดูว่ะ  มึงมันดื้อดี ไปให้สุดเเล้วจบที่ขึ้นศาลนะ,2025-11-29 08:18:55,"['อนู่', 'ดี', 'ๆ', 'ไม่', 'ว่า', 'ดี', ' ', 'ดัน', 'อยาก', 'ประวัติ', 'เสีย', ' ', 'หัวเราะ', 'เออ', 'ดี', ' ', 'จะ', 'รอ', 'ดู', 'ว่ะ', ' ', 'มึง', 'มัน', 'ดื้อ', 'ดี', ' ', 'ไป', 'ให้', 'สุด', 'เเล้วจบ', 'ที่', 'ขึ้นศาล', 'นะ']"
1988302192718352884,twitter,post,https://x.com/bnybubii/status/1988302192718352884,text,2025-11-11T17:45:58.000Z,selenium_x_scraper_v1,หรอ,หรอ,2025-11-29 08:18:55,['หรอ']
1988089167092576468,twitter,post,https://x.com/11CKKMM/status/1988089167092576468,text,2025-11-11T03:39:29.000Z,selenium_x_scraper_v1,ไปหาหมอเถอะ ปกติมั้ยนิ,ไปหาหมอเถอะ ปกติมั้ยนิ,2025-11-29 08:18:55,"['ไปหา', 'หมอ', 'เถอะ', ' ', 'ปกติ', 'มั้ย', 'นิ']"
1988056697601143270,twitter,post,https://x.com/chaokonklom/status/1988056697601143270,text,2025-11-11T01:30:27.000Z,selenium_x_scraper_v1,ป่วยก็ไปรักษา ไม่ใช่มาทำตัวเป็นผีบ้าแบบนี้ เหมือนตอนท้องแม่ไม่ได้กินของมีประโยชน์ เผลอๆที่พิมพ์แบบนั้นเอาเรื่องจริงของตัวเองมาพิมพ์รึเปล่าคะ?,ป่วยก็ไปรักษา ไม่ใช่มาทำตัวเป็นผีบ้าแบบนี้ เหมือนตอนท้องแม่ไม่ได้กินของมีประโยชน์ เผลอๆที่พิมพ์แบบนั้นเอาเรื่องจริงของตัวเองมาพิมพ์รึเปล่าคะ?,2025-11-29 08:18:55,"['ป่วย', 'ก็', 'ไป', 'รักษา', ' ', 'ไม่', 'ใช่', 'มา', 'ทำตัว', 'เป็น', 'ผี', 'บ้า', 'แบบนี้', ' ', 'เหมือน', 'ตอน', 'ท้อง', 'แม่', 'ไม่', 'ได้', 'กิน', 'ของ', 'มีประโยชน์', ' ', 'เผลอ', 'ๆ', 'ที่', 'พิมพ์', 'แบบ', 'นั้น', 'เอา', 'เรื่องจริง', 'ของ', 'ตัวเอง', 'มา', 'พิมพ์', 'รึเปล่า', 'คะ', '?']"
1988247911532986844,twitter,post,https://x.com/5livesfox/status/1988247911532986844,text,2025-11-11T14:10:16.000Z,selenium_x_scraper_v1,อ่านแล้วสงสัยมากเลยค่ะชีวิตมีความสุขบ้างมั้ยคะ,อ่านแล้วสงสัยมากเลยค่ะชีวิตมีความสุขบ้างมั้ยคะ,2025-11-29 08:18:55,"['อ่าน', 'แล้ว', 'สงสัย', 'มาก', 'เลย', 'ค่ะ', 'ชีวิต', 'มีความสุข', 'บ้าง', 'มั้ย', 'คะ']"
1987979145373249976,twitter,post,https://x.com/banana62628/status/1987979145373249976,text,2025-11-10T20:22:17.000Z,selenium_x_scraper_v1,ด่าขนาดนี้น่าจะรวยมาก คนโดนด่าได้หลายตังเลย,ด่าขนาดนี้น่าจะรวยมาก คนโดนด่าได้หลายตังเลย,2025-11-29 08:18:55,"['ด่า', 'ขนาด', 'นี้', 'น่าจะ', 'รวย', 'มาก', ' ', 'คน', 'โดน', 'ด่า', 'ได้', 'หลาย', 'ตัง', 'เลย']"
1988125378242900127,twitter,post,https://x.com/MoustriousX/status/1988125378242900127,text,2025-11-11T06:03:22.000Z,selenium_x_scraper_v1,กลับโม่งเถอะหังเอ้ยย,กลับโม่งเถอะหังเอ้ยย,2025-11-29 08:18:55,"['กลับ', 'โม่ง', 'เถอะ', 'หัง', 'เอ้ย', 'ย']"
1987772794449596566,twitter,post,https://x.com/YingPatthara/status/1987772794449596566,text,2025-11-10T05:13:30.000Z,selenium_x_scraper_v1,ผู้ชายห้ามถูกต้องตัวผู้หญิง เลยต้องหาเด็กชายที่หนวดยังไม่ขึ้นมาทดแทน อัฟกานิสถานนี่เค้าแน่จริงๆ,ผู้ชายห้ามถูกต้องตัวผู้หญิง เลยต้องหาเด็กชายที่หนวดยังไม่ขึ้นมาทดแทน อัฟกานิสถานนี่เค้าแน่จริงๆ,2025-11-29 08:18:55,"['ผู้ชาย', 'ห้าม', 'ถูกต้อง', 'ตัว', 'ผู้หญิง', ' ', 'เลย', 'ต้องหา', 'เด็กชาย', 'ที่', 'หนวด', 'ยัง', 'ไม่', 'ขึ้น', 'มา', 'ทดแทน', ' ', 'อัฟกานิสถาน', 'นี่', 'เค้า', 'แน่', 'จริงๆ']"
1987925222377615514,twitter,post,https://x.com/santitigersun/status/1987925222377615514,text,2025-11-10T16:48:01.000Z,selenium_x_scraper_v1,อ่านเจอ เด็กวัยรุ่นผู้ชายที่ฐายะยากจนจะถูกขาย เอาไปเป็นนักเต้นนุกแสดง หลังจากจบการแสดง หลายๆคนก็จะมีงานต่อ มันไม่ผิดหลักกฎหมายของอิส...หรือครับ เพราะเคยมีข่าวนายกบางประเทศ โดนจับขังคุก,อ่านเจอ เด็กวัยรุ่นผู้ชายที่ฐายะยากจนจะถูกขาย เอาไปเป็นนักเต้นนุกแสดง หลังจากจบการแสดง หลายๆคนก็จะมีงานต่อ มันไม่ผิดหลักกฎหมายของอิส...หรือครับ เพราะเคยมีข่าวนายกบางประเทศ โดนจับขังคุก,2025-11-29 08:18:55,"['อ่าน', 'เจอ', ' ', 'เด็กวัยรุ่น', 'ผู้ชาย', 'ที่', 'ฐา', 'ยะ', 'ยากจน', 'จะ', 'ถูก', 'ขาย', ' ', 'เอา', 'ไป', 'เป็น', 'นัก', 'เต้น', 'นุ', 'ก', 'แสดง', ' ', 'หลังจาก', 'จบ', 'การแสดง', ' ', 'หลาย', 'ๆคน', 'ก็', 'จะ', 'มี', 'งาน', 'ต่อ', ' ', 'มัน', 'ไม่', 'ผิด', 'หลักกฎหมาย', 'ของ', 'อิส', '...', 'หรือ', 'ครับ', ' ', 'เพราะ', 'เคย', 'มี', 'ข่าว', 'นายก', 'บาง', 'ประเทศ', ' ', 'โดน', 'จับ', 'ขัง', 'คุก']"
1988155252244459585,twitter,post,https://x.com/Rainyday6001669/status/1988155252244459585,text,2025-11-11T08:02:04.000Z,selenium_x_scraper_v1,เคยอ่านงานเขียนของนางแบบที่เป็นมุสลิม-แอฟริกาคนนึง นางบอกว่าโดนญาติข่มขืน แต่ข่มขืนทางทวารหนักหนัก ญาติบอกไม่บาป ไม่ตกศาสนา ไม่ถือว่าเสียความบริสุทธิ์ นี่อึ้งไปเลย,เคยอ่านงานเขียนของนางแบบที่เป็นมุสลิม-แอฟริกาคนนึง นางบอกว่าโดนญาติข่มขืน แต่ข่มขืนทางทวารหนักหนัก ญาติบอกไม่บาป ไม่ตกศาสนา ไม่ถือว่าเสียความบริสุทธิ์ นี่อึ้งไปเลย,2025-11-29 08:18:55,"['เคย', 'อ่าน', 'งานเขียน', 'ของ', 'นางแบบ', 'ที่', 'เป็น', 'มุสลิม', ' ', 'แอฟริกา', 'คน', 'นึง', ' ', 'นาง', 'บอ', 'กว่า', 'โดน', 'ญาติ', 'ข่มขืน', ' ', 'แต่', 'ข่มขืน', 'ทาง', 'ทวารหนัก', 'หนัก', ' ', 'ญาติ', 'บอก', 'ไม่', 'บาป', ' ', 'ไม่', 'ตก', 'ศาสนา', ' ', 'ไม่', 'ถือว่า', 'เสียความบริสุทธิ์', ' ', 'นี่', 'อึ้ง', 'ไป', 'เลย']"
1988203483305275560,twitter,post,https://x.com/ParadaSi16/status/1988203483305275560,text,2025-11-11T11:13:44.000Z,selenium_x_scraper_v1,เเน่เรื่องความ มือถือสาก ปากถือศีล อ่ะนะ บอกศาสนาไม่มีเพศที่สาม เเต่หาผู้ชายด้วยกันมาบำเรอกาม ทุเรศ,เเน่เรื่องความ มือถือสาก ปากถือศีล อ่ะนะ บอกศาสนาไม่มีเพศที่สาม เเต่หาผู้ชายด้วยกันมาบำเรอกาม ทุเรศ,2025-11-29 08:18:55,"['เเน่', 'เรื่อง', 'ความ', ' ', 'มือถือสาก ปากถือศีล', ' ', 'อ่ะ', 'นะ', ' ', 'บอก', 'ศาสนา', 'ไม่', 'มี', 'เพศ', 'ที่สาม', ' ', 'เเต่', 'หา', 'ผู้ชาย', 'ด้วยกัน', 'มา', 'บำเรอ', 'กาม', ' ', 'ทุเรศ']"
1987962309759955377,twitter,post,https://x.com/cdbung/status/1987962309759955377,text,2025-11-10T19:15:23.000Z,selenium_x_scraper_v1,แล้วสวยด้วยนะ555,แล้วสวยด้วยนะ555,2025-11-29 08:18:55,"['แล้ว', 'สวย', 'ด้วย', 'นะ', 'หัวเราะ']"
