id,platform,platform_type,url,content_type,timestamp,scraper_module,text,raw_text,scrape_date,tokens
1972108458205077996,twitter,post,https://x.com/nidchavee1/status/1972108458205077996,text,2025-09-28T01:17:51.000Z,selenium_x_scraper_v1,"ตรูว่าน้องเค้าคิดถูกแล้วนะ ถ้าคบคนผิด เสียเวลาเปล่าๆ 
นี่เสียไป 15 ปี 
ทุกวันนี้ ดูแลตัวเองสารพัด เพื่อตัวเราเองด้วยแระ 
แฟน/ผัว ไม่มีก็ได้ ถ้ามีแล้วไม่ได้ดี หรือมีความสุขมากกว่า การอยู่คนเดียว รักตัวเองดีที่สุดแล้ว","ตรูว่าน้องเค้าคิดถูกแล้วนะ ถ้าคบคนผิด เสียเวลาเปล่าๆ 
นี่เสียไป 15 ปี 
ทุกวันนี้ ดูแลตัวเองสารพัด เพื่อตัวเราเองด้วยแระ 
แฟน/ผัว ไม่มีก็ได้ ถ้ามีแล้วไม่ได้ดี หรือมีความสุขมากกว่า การอยู่คนเดียว รักตัวเองดีที่สุดแล้ว",2025-11-08 17:05:14,"['ตรู', 'ว่า', 'น้อง', 'เค้า', 'คิด', 'ถูก', 'แล้ว', 'นะ', ' ', 'ถ้า', 'คบ', 'คน', 'ผิด', ' ', 'เสียเวลา', 'เปล่าๆ', ' ', 'นี่', 'เสีย', 'ไป', ' ', '15', ' ', 'ปี', ' ', 'ทุกวันนี้', ' ', 'ดูแลตัวเอง', 'สารพัด', ' ', 'เพื่อ', 'ตัวเรา', 'เอง', 'ด้วย', 'แระ', ' ', 'แฟน', ' ', 'ผัว', ' ', 'ไม่', 'มี', 'ก็ได้', ' ', 'ถ้า', 'มี', 'แล้ว', 'ไม่', 'ได้ดี', ' ', 'หรือ', 'มีความสุข', 'มากกว่า', ' ', 'การ', 'อยู่', 'คนเดียว', ' ', 'รัก', 'ตัวเอง', 'ดี', 'ที่สุด', 'แล้ว']"
1971872650554495105,twitter,post,https://x.com/KhunRueanka/status/1971872650554495105,text,2025-09-27T09:40:50.000Z,selenium_x_scraper_v1,diva,diva,2025-11-08 17:05:14,['diva']
1972164069374546201,twitter,post,https://x.com/cxswtiip/status/1972164069374546201,text,2025-09-28T04:58:49.000Z,selenium_x_scraper_v1,ผชที่มาดิ้นทรง losers 100%,ผชที่มาดิ้นทรง losers 100%,2025-11-08 17:05:14,"['ผช', 'ที่มา', 'ดิ้น', 'ทรง', ' ', 'losers', ' ', '100']"
1971910896873361638,twitter,post,https://x.com/nnswift13/status/1971910896873361638,text,2025-09-27T12:12:48.000Z,selenium_x_scraper_v1,คนในเม้น = ตัวอย่างของผีบ้าผีบอ,คนในเม้น = ตัวอย่างของผีบ้าผีบอ,2025-11-08 17:05:14,"['คนใน', 'เม้น', ' ', 'ตัวอย่าง', 'ของ', 'ผี', 'บ้า', 'ผี', 'บอ']"
1971978524270776473,twitter,post,https://x.com/apy246/status/1971978524270776473,text,2025-09-27T16:41:32.000Z,selenium_x_scraper_v1,พากันคิดว่าตัวเองไม่แฟร์ที่ต้องจ่ายค่าสินสอดเพราะว่าผู้หญิงไม่ซิง หรือเคยมีคู่นอนหลายคน เอาจริงๆเหรื้องสินสอดการแต่งงานอะไรเนี่ย คนเรามันคบกันถึงขั้นจะลงหลักปักฐานแต่ถ้ายังรู้สึกไม่แฟร์ที่แฟนเคยผ่านชายอื่นมา แล้วจะไปแต่งทำไมวะ กูตลก แล้วอะไรที่ไม่แฟร์,พากันคิดว่าตัวเองไม่แฟร์ที่ต้องจ่ายค่าสินสอดเพราะว่าผู้หญิงไม่ซิง หรือเคยมีคู่นอนหลายคน เอาจริงๆเหรื้องสินสอดการแต่งงานอะไรเนี่ย คนเรามันคบกันถึงขั้นจะลงหลักปักฐานแต่ถ้ายังรู้สึกไม่แฟร์ที่แฟนเคยผ่านชายอื่นมา แล้วจะไปแต่งทำไมวะ กูตลก แล้วอะไรที่ไม่แฟร์,2025-11-08 17:05:14,"['พา', 'กัน', 'คิด', 'ว่า', 'ตัวเอง', 'ไม่', 'แฟร์', 'ที่', 'ต้อง', 'จ่าย', 'ค่า', 'สินสอด', 'เพราะว่า', 'ผู้หญิง', 'ไม่', 'ซิง', ' ', 'หรือ', 'เคย', 'มี', 'คู่นอน', 'หลาย', 'คน', ' ', 'เอา', 'จริงๆ', 'เห', 'รื้อ', 'ง', 'สินสอด', 'การ', 'แต่งงาน', 'อะไร', 'เนี่ย', ' ', 'คนเรา', 'มัน', 'คบ', 'กัน', 'ถึงขั้น', 'จะ', 'ลงหลักปักฐาน', 'แต่', 'ถ้า', 'ยัง', 'รู้สึก', 'ไม่', 'แฟร์', 'ที่', 'แฟน', 'เคย', 'ผ่าน', 'ชาย', 'อื่น', 'มา', ' ', 'แล้', 'วจะ', 'ไป', 'แต่ง', 'ทำไม', 'วะ', ' ', 'กู', 'ตลก', ' ', 'แล้ว', 'อะไร', 'ที่', 'ไม่', 'แฟร์']"
1971979743634596124,twitter,post,https://x.com/apy246/status/1971979743634596124,text,2025-09-27T16:46:23.000Z,selenium_x_scraper_v1,เรื่อง***,เรื่อง***,2025-11-08 17:05:14,['เรื่อง']
1971979640094052739,twitter,post,https://x.com/apy246/status/1971979640094052739,text,2025-09-27T16:45:58.000Z,selenium_x_scraper_v1,เห็นชอบเมคฟันว่าให้ชวนคนที่คบก่อนๆมาหาร ขอทาย พวกที่คิดแบบนี้คือไม่ใช่กลุ่มคนที่สามารถหาสินสอดได้ เพราะว่ามันแปลกที่คนกำลังจะแต่งงานแล้วมีข้อกังขาเรื่องนี้อยู่แล้วเดี๋ยวนี้คนส่วนใหญ่ที่แต่งงานกันคือ อยู่กันก่อนแล้วสร้างไปด้วยกัน หรือบางทีถ้าแต่งเอาหน้าเอาตามันก็มีบริการเช่าสินสอด,เห็นชอบเมคฟันว่าให้ชวนคนที่คบก่อนๆมาหาร ขอทาย พวกที่คิดแบบนี้คือไม่ใช่กลุ่มคนที่สามารถหาสินสอดได้ เพราะว่ามันแปลกที่คนกำลังจะแต่งงานแล้วมีข้อกังขาเรื่องนี้อยู่แล้วเดี๋ยวนี้คนส่วนใหญ่ที่แต่งงานกันคือ อยู่กันก่อนแล้วสร้างไปด้วยกัน หรือบางทีถ้าแต่งเอาหน้าเอาตามันก็มีบริการเช่าสินสอด,2025-11-08 17:05:14,"['เห็นชอบ', 'เมค', 'ฟัน', 'ว่า', 'ให้', 'ชวน', 'คน', 'ที่', 'คบ', 'ก่อน', 'ๆ', 'มา', 'หาร', ' ', 'ขอ', 'ทาย', ' ', 'พวก', 'ที่', 'คิด', 'แบบนี้', 'คือ', 'ไม่', 'ใช่', 'กลุ่มคน', 'ที่', 'สามารถ', 'หา', 'สินสอด', 'ได้', ' ', 'เพราะว่า', 'มัน', 'แปลกที่', 'คน', 'กำลังจะ', 'แต่งงาน', 'แล้ว', 'มี', 'ข้อกังขา', 'เรื่อง', 'นี้', 'อยู่แล้ว', 'เดี๋ยวนี้', 'คน', 'ส่วนใหญ่', 'ที่', 'แต่งงาน', 'กัน', 'คือ', ' ', 'อยู่', 'กัน', 'ก่อน', 'แล้ว', 'สร้าง', 'ไป', 'ด้วยกัน', ' ', 'หรือ', 'บางที', 'ถ้า', 'แต่ง', 'เอาหน้า', 'เอา', 'ตา', 'มัน', 'ก็', 'มี', 'บริการ', 'เช่า', 'สินสอด']"
1971980423204135188,twitter,post,https://x.com/apy246/status/1971980423204135188,text,2025-09-27T16:49:05.000Z,selenium_x_scraper_v1,แล้วอีกอย่างนึงคือ พวกนี้เกลียดผู้หญิงจริงๆ จะเป็นยังไงมันก็เกลียด เกลียดผู้หญิงอ้วน เกลียดผู้หญิงมีลูกติด เกลียดผู้หญิงที่มีความมั่นใจ เกลียดผู้หญิงที่ก้าวหน้ากว่า (เคยอ่านเจอเม้นนึงในกลุ่มนั้นแหละ ว่าองค์กรที่เอาผู้หญิงขึ้นเป็นหัวหน้าส่วนใหญ่มีแต่ปัญหาจุกจิก),แล้วอีกอย่างนึงคือ พวกนี้เกลียดผู้หญิงจริงๆ จะเป็นยังไงมันก็เกลียด เกลียดผู้หญิงอ้วน เกลียดผู้หญิงมีลูกติด เกลียดผู้หญิงที่มีความมั่นใจ เกลียดผู้หญิงที่ก้าวหน้ากว่า (เคยอ่านเจอเม้นนึงในกลุ่มนั้นแหละ ว่าองค์กรที่เอาผู้หญิงขึ้นเป็นหัวหน้าส่วนใหญ่มีแต่ปัญหาจุกจิก),2025-11-08 17:05:14,"['แล้ว', 'อีก', 'อย่าง', 'นึง', 'คือ', ' ', 'พวก', 'นี้', 'เกลียด', 'ผู้หญิง', 'จริงๆ', ' ', 'จะ', 'เป็น', 'ยังไง', 'มัน', 'ก็', 'เกลียด', ' ', 'เกลียด', 'ผู้หญิง', 'อ้วน', ' ', 'เกลียด', 'ผู้หญิง', 'มี', 'ลูกติด', ' ', 'เกลียด', 'ผู้หญิง', 'ที่', 'มี', 'ความมั่นใจ', ' ', 'เกลียด', 'ผู้หญิง', 'ที่', 'ก้าวหน้า', 'กว่า', ' ', 'เคย', 'อ่าน', 'เจอ', 'เม้น', 'นึง', 'ใน', 'กลุ่ม', 'นั้นแหละ', ' ', 'ว่า', 'องค์กร', 'ที่', 'เอา', 'ผู้หญิง', 'ขึ้น', 'เป็น', 'หัวหน้า', 'ส่วนใหญ่', 'มี', 'แต่', 'ปัญหา', 'จุกจิก']"
1971981158469832907,twitter,post,https://x.com/apy246/status/1971981158469832907,text,2025-09-27T16:52:00.000Z,selenium_x_scraper_v1,พอละเดี๋ยวยาว ดีไม่ดีโพสต์นี้อาจโดนแคปไปแขวนในกลุ่มกระจอกนั่นอีก มันพูดคุยได้แค่ในกลุ่มนั้นอะแหละ เพราะความคิดอุบาทว์คุยข้างนอกไม่ได้ทัวร์ลงแล้วด่ากันไม่ทัน เดี๋ยวก็พากันแคปไปเม้ามอยในกะลานั่น เคยเห็นโพสต์ถามกันว่าช่วงนี้มีใครออกศึกบ่อยมั่ง,พอละเดี๋ยวยาว ดีไม่ดีโพสต์นี้อาจโดนแคปไปแขวนในกลุ่มกระจอกนั่นอีก มันพูดคุยได้แค่ในกลุ่มนั้นอะแหละ เพราะความคิดอุบาทว์คุยข้างนอกไม่ได้ทัวร์ลงแล้วด่ากันไม่ทัน เดี๋ยวก็พากันแคปไปเม้ามอยในกะลานั่น เคยเห็นโพสต์ถามกันว่าช่วงนี้มีใครออกศึกบ่อยมั่ง,2025-11-08 17:05:14,"['พอ', 'ละ', 'เดี๋ยว', 'ยาว', ' ', 'ดีไม่ดี', 'โพสต์', 'นี้', 'อาจ', 'โดน', 'แคป', 'ไป', 'แขวน', 'ใน', 'กลุ่ม', 'กระจอก', 'นั่น', 'อีก', ' ', 'มัน', 'พูดคุย', 'ได้', 'แค่', 'ใน', 'กลุ่ม', 'นั้น', 'อะ', 'แหละ', ' ', 'เพราะ', 'ความคิด', 'อุบาทว์', 'คุย', 'ข้างนอก', 'ไม่', 'ได้', 'ทัวร์', 'ลง', 'แล้ว', 'ด่า', 'กัน', 'ไม่', 'ทัน', ' ', 'เดี๋ยว', 'ก็', 'พา', 'กัน', 'แคป', 'ไป', 'เม้า', 'มอ', 'ย', 'ใน', 'กะลา', 'นั่น', ' ', 'เคย', 'เห็น', 'โพสต์', 'ถาม', 'กัน', 'ว่า', 'ช่วงนี้', 'มี', 'ใคร', 'ออกศึก', 'บ่อย', 'มั่ง']"
1971981327714210053,twitter,post,https://x.com/apy246/status/1971981327714210053,text,2025-09-27T16:52:40.000Z,selenium_x_scraper_v1,ศึกที่หมายถึงการไปคอมเม้นด่าผู้หญิงข้างนอกกะลา55555,ศึกที่หมายถึงการไปคอมเม้นด่าผู้หญิงข้างนอกกะลา55555,2025-11-08 17:05:14,"['ศึก', 'ที่', 'หมายถึง', 'การ', 'ไป', 'คอม', 'เม้น', 'ด่า', 'ผู้หญิง', 'ข้างนอก', 'กะลา', 'หัวเราะ']"
1972130162763616611,twitter,post,https://x.com/Mr_Whathapened/status/1972130162763616611,text,2025-09-28T02:44:05.000Z,selenium_x_scraper_v1,ไม่ได้อยากเดินใกล้ พรี่แฮปแค่จะเดินแซงครับ พอเร่งฝีเท้าจะเดินแซง เดี๋ยวก็คิดว่าพรี่แฮปไล่ตามอีกทำไงอะ เอาใจยากจัง,ไม่ได้อยากเดินใกล้ พรี่แฮปแค่จะเดินแซงครับ พอเร่งฝีเท้าจะเดินแซง เดี๋ยวก็คิดว่าพรี่แฮปไล่ตามอีกทำไงอะ เอาใจยากจัง,2025-11-08 17:05:14,"['ไม่', 'ได้', 'อยาก', 'เดิน', 'ใกล้', ' ', 'พ', 'รี่', 'แฮ', 'ป', 'แค่', 'จะ', 'เดิน', 'แซง', 'ครับ', ' ', 'พอ', 'เร่งฝีเท้า', 'จะ', 'เดิน', 'แซง', ' ', 'เดี๋ยว', 'ก็', 'คิด', 'ว่า', 'พ', 'รี่', 'แฮ', 'ป', 'ไล่ตาม', 'อีก', 'ทำ', 'ไง', 'อะ', ' ', 'เอาใจ', 'ยาก', 'จัง']"
1972133414024499588,twitter,post,https://x.com/Mr_Whathapened/status/1972133414024499588,text,2025-09-28T02:57:01.000Z,selenium_x_scraper_v1,พรี่แฮปดูคลิปแล้วก็ห๊ะ??? กูผิดอะไร,พรี่แฮปดูคลิปแล้วก็ห๊ะ??? กูผิดอะไร,2025-11-08 17:05:14,"['พ', 'รี่', 'แฮ', 'ป', 'ดู', 'คลิป', 'แล้วก็', 'ห๊ะ', '?', ' ', 'กู', 'ผิด', 'อะไร']"
1972374940293947890,twitter,post,https://x.com/Rwest1llfriend/status/1972374940293947890,text,2025-09-28T18:56:45.000Z,selenium_x_scraper_v1,ก้ไม่แปลกที่เขาจะระแวงเปล่าวะครับ เพราะมันก้น่ากลัวจริงๆ กล่าวออกมาอย่างกับจะไม่ให้เขาระวังตัวเลยเหอะ ขนาดผมเป็นผชยังเข้าใจผญ.หลายๆคนในเรื่องนี้ไม่ใช้แค่กับคุณในคลิป,ก้ไม่แปลกที่เขาจะระแวงเปล่าวะครับ เพราะมันก้น่ากลัวจริงๆ กล่าวออกมาอย่างกับจะไม่ให้เขาระวังตัวเลยเหอะ ขนาดผมเป็นผชยังเข้าใจผญ.หลายๆคนในเรื่องนี้ไม่ใช้แค่กับคุณในคลิป,2025-11-08 17:05:14,"['ก้', 'ไม่', 'แปลกที่', 'เขา', 'จะ', 'ระแวง', 'เปล่า', 'วะ', 'ครับ', ' ', 'เพราะ', 'มัน', 'ก้', 'น่ากลัว', 'จริงๆ', ' ', 'กล่าว', 'ออกมา', 'อย่าง', 'กับ', 'จะ', 'ไม่', 'ให้', 'เขา', 'ระวังตัว', 'เลย', 'เหอะ', ' ', 'ขนาด', 'ผม', 'เป็น', 'ผช', 'ยัง', 'เข้าใจ', 'ผญ.', 'หลาย', 'ๆ', 'คนใน', 'เรื่อง', 'นี้', 'ไม่', 'ใช้', 'แค่', 'กับ', 'คุณ', 'ใน', 'คลิป']"
1972205362557395318,twitter,post,https://x.com/Millymonn777/status/1972205362557395318,text,2025-09-28T07:42:54.000Z,selenium_x_scraper_v1,ที่เขาพูดก้ถูกแล้วอะ ถ้าเดินใกล้ในระยะที่ทำคนอื่นไม่สบายใจได้ก้แปลว่าใกล้พอจะแซงได้ แต่ไม่แซงไง,ที่เขาพูดก้ถูกแล้วอะ ถ้าเดินใกล้ในระยะที่ทำคนอื่นไม่สบายใจได้ก้แปลว่าใกล้พอจะแซงได้ แต่ไม่แซงไง,2025-11-08 17:05:14,"['ที่', 'เขา', 'พูด', 'ก้', 'ถูก', 'แล้ว', 'อะ', ' ', 'ถ้า', 'เดิน', 'ใกล้', 'ใน', 'ระยะ', 'ที่', 'ทำ', 'คนอื่น', 'ไม่', 'สบายใจ', 'ได้', 'ก้', 'แปล', 'ว่า', 'ใกล้', 'พอ', 'จะ', 'แซง', 'ได้', ' ', 'แต่', 'ไม่', 'แซง', 'ไง']"
1972409502415888852,twitter,post,https://x.com/goszhllai/status/1972409502415888852,text,2025-09-28T21:14:05.000Z,selenium_x_scraper_v1,เพราะมันไม่มีใครรู้เจตนาของคนที่เดินด้วยหรอก เป็นใครก็ไม่รู้แล้วตอนกลางคืน พอเขาเห็นว่าเริ่มเดินเร็วขึ้นเขาก็ต้องระแวง,เพราะมันไม่มีใครรู้เจตนาของคนที่เดินด้วยหรอก เป็นใครก็ไม่รู้แล้วตอนกลางคืน พอเขาเห็นว่าเริ่มเดินเร็วขึ้นเขาก็ต้องระแวง,2025-11-08 17:05:14,"['เพราะ', 'มัน', 'ไม่', 'มี', 'ใคร', 'รู้', 'เจตนา', 'ของ', 'คน', 'ที่', 'เดิน', 'ด้วย', 'หรอก', ' ', 'เป็น', 'ใคร', 'ก็', 'ไม่', 'รู้', 'แล้ว', 'ตอนกลางคืน', ' ', 'พอ', 'เขา', 'เห็น', 'ว่า', 'เริ่ม', 'เดิน', 'เร็ว', 'ขึ้น', 'เขา', 'ก็', 'ต้อง', 'ระแวง']"
1972507048631025914,twitter,post,https://x.com/After_2U/status/1972507048631025914,text,2025-09-29T03:41:42.000Z,selenium_x_scraper_v1,สภาพ... ในเมนชั่นคือกุเจอผชดีๆที่มีสติจริงๆ เข้าใจผญคือ 000.1% นอกนั้นคืออออออ 555,สภาพ... ในเมนชั่นคือกุเจอผชดีๆที่มีสติจริงๆ เข้าใจผญคือ 000.1% นอกนั้นคืออออออ 555,2025-11-08 17:05:14,"['สภาพ', '...', ' ', 'ใน', 'เมน', 'ชั่น', 'คือ', 'กุ', 'เจอ', 'ผช', 'ดี', 'ๆ', 'ที่', 'มีสติ', 'จริงๆ', ' ', 'เข้าใจ', 'ผญ', 'คือ', ' ', '000.1', ' ', 'นอกนั้น', 'คือ', 'ออ', 'ออ', 'อ', ' ', 'หัวเราะ']"
1972188155106447667,twitter,post,https://x.com/naynoipta/status/1972188155106447667,text,2025-09-28T06:34:32.000Z,selenium_x_scraper_v1,เข้าใจผญ.ที่กลัว คุณระแวงไว้ก็ดีแล้วคับ แต่ก็ต้องเข้าใจผช.ด้วยบางทีมันก็หาจังหวะแซงยาก อยากให้ผญ.อย่าอยู่ที่เปลี่ยวนานๆ รีบเดินหาที่ที่มีคนอยู่เยอะดีกว่า,เข้าใจผญ.ที่กลัว คุณระแวงไว้ก็ดีแล้วคับ แต่ก็ต้องเข้าใจผช.ด้วยบางทีมันก็หาจังหวะแซงยาก อยากให้ผญ.อย่าอยู่ที่เปลี่ยวนานๆ รีบเดินหาที่ที่มีคนอยู่เยอะดีกว่า,2025-11-08 17:05:14,"['เข้าใจ', 'ผญ.', 'ที่', 'กลัว', ' ', 'คุณ', 'ระแวง', 'ไว้', 'ก็', 'ดีแล้ว', 'คับ', ' ', 'แต่', 'ก็', 'ต้อง', 'เข้าใจ', 'ผช.', 'ด้วย', 'บางที', 'มัน', 'ก็', 'หา', 'จังหวะ', 'แซง', 'ยาก', ' ', 'อยาก', 'ให้', 'ผญ.', 'อย่า', 'อยู่', 'ที่', 'เปลี่ยว', 'นานๆ', ' ', 'รีบ', 'เดิน', 'หา', 'ที่', 'ที่', 'มี', 'คน', 'อยู่', 'เยอะ', 'ดีกว่า']"
