id,platform,platform_type,url,content_type,timestamp,scraper_module,text,raw_text,scrape_date,tokens
1976478157306986779,twitter,post,https://x.com/jxl0089x/status/1976478157306986779,text,2025-10-10T02:41:28.000Z,selenium_x_scraper_v1,"ไอเจ๊นี้ ทำการบ้านดีมาก5555
ใครไปหักอกเจ๊เค้าวะ น่าสงสาร","ไอเจ๊นี้ ทำการบ้านดีมาก5555
ใครไปหักอกเจ๊เค้าวะ น่าสงสาร",2025-10-23 17:59:34,"['ไอ', 'เจ๊', 'นี้', ' ', 'ทำการบ้าน', 'ดีมาก', 'หัวเราะ', ' ', 'ใคร', 'ไป', 'หักอก', 'เจ๊', 'เค้า', 'วะ', ' ', 'น่าสงสาร']"
1976476442205811006,twitter,post,https://x.com/jxl0089x/status/1976476442205811006,text,2025-10-10T02:34:39.000Z,selenium_x_scraper_v1,"""ผญสวยทุกคน"" ","""ผญสวยทุกคน"" ",2025-10-23 17:59:34,"['ผญ', 'สวย', 'ทุกคน']"
1976467549996056822,twitter,post,https://x.com/imshittingmyslf/status/1976467549996056822,text,2025-10-10T01:59:19.000Z,selenium_x_scraper_v1,5555555555วิธีเอาชนะคนปากแจ๋วหรอวะ สาววายอยู่เหนือทุกสิ่ง,5555555555วิธีเอาชนะคนปากแจ๋วหรอวะ สาววายอยู่เหนือทุกสิ่ง,2025-10-23 17:59:34,"['หัวเราะ', 'วิธี', 'เอาชนะ', 'คน', 'ปาก', 'แจ๋ว', 'หรอ', 'วะ', ' ', 'สาว', 'วาย', 'อยู่', 'เหนือ', 'ทุกสิ่ง']"
1976475939912683907,twitter,post,https://x.com/jxl0089x/status/1976475939912683907,text,2025-10-10T02:32:39.000Z,selenium_x_scraper_v1,เหนื่อยใจกับสาววาย,เหนื่อยใจกับสาววาย,2025-10-23 17:59:34,"['เหนื่อยใจ', 'กับ', 'สาว', 'วาย']"
1976475775659540726,twitter,post,https://x.com/jxl0089x/status/1976475775659540726,text,2025-10-10T02:32:00.000Z,selenium_x_scraper_v1,มันไปเคะได้ยังไงง คิดไปเองป้ะ,มันไปเคะได้ยังไงง คิดไปเองป้ะ,2025-10-23 17:59:34,"['มัน', 'ไป', 'เคะ', 'ได้', 'ยังไง', 'ง', ' ', 'คิด', 'ไป', 'เอง', 'ป้ะ']"
1976472779370397781,twitter,post,https://x.com/soalynn/status/1976472779370397781,text,2025-10-10T02:20:06.000Z,selenium_x_scraper_v1,อีโง้ คำแค่นี้ก็ไม่รู้,อีโง้ คำแค่นี้ก็ไม่รู้,2025-10-23 17:59:34,"['อี', 'โง้', ' ', 'คำ', 'แค่นี้', 'ก็', 'ไม่', 'รู้']"
1976474511378874583,twitter,post,https://x.com/jxl0089x/status/1976474511378874583,text,2025-10-10T02:26:59.000Z,selenium_x_scraper_v1,อ่าวว ต้องรู้ทุกคำบนโลกเลยไง้,อ่าวว ต้องรู้ทุกคำบนโลกเลยไง้,2025-10-23 17:59:34,"['อ่าว', 'ว', ' ', 'ต้อง', 'รู้', 'ทุก', 'คำ', 'บน', 'โลก', 'เลย', 'ไง้']"
1976363643332854026,twitter,post,https://x.com/shannaroyo/status/1976363643332854026,text,2025-10-09T19:06:26.000Z,selenium_x_scraper_v1,หละเป็นเหี้ยอะไรต้องอยากทะเลาะกับผู้หญิงอะ55555555 กลิ่นรับร่านขี้วีนแรงมากกกกกกกก,หละเป็นเหี้ยอะไรต้องอยากทะเลาะกับผู้หญิงอะ55555555 กลิ่นรับร่านขี้วีนแรงมากกกกกกกก,2025-10-23 17:59:34,"['หละ', 'เป็น', 'เหี้ย', 'อะไร', 'ต้อง', 'อยาก', 'ทะเลาะ', 'กับ', 'ผู้หญิง', 'อะ', 'หัวเราะ', ' ', 'กลิ่น', 'รับ', 'ร่าน', 'ขี้', 'วีน', 'แรง', 'มา', 'กก', 'กก', 'กก', 'กก']"
1976472865664110625,twitter,post,https://x.com/jxl0089x/status/1976472865664110625,text,2025-10-10T02:20:26.000Z,selenium_x_scraper_v1,"รับร่านขี้วีน แรงนะ5555
ชายแท้ โว้ยย","รับร่านขี้วีน แรงนะ5555
ชายแท้ โว้ยย",2025-10-23 17:59:34,"['รับ', 'ร่าน', 'ขี้', 'วีน', ' ', 'แรง', 'นะ', 'หัวเราะ', ' ', 'ชาย', 'แท้', ' ', 'โว้ย', 'ย']"
1976472253647982599,twitter,post,https://x.com/jxl0089x/status/1976472253647982599,text,2025-10-10T02:18:01.000Z,selenium_x_scraper_v1,ไม่อยากมีหีอ่ะ ต้องปวดท้องประจำเดือนทุกเดือน ,ไม่อยากมีหีอ่ะ ต้องปวดท้องประจำเดือนทุกเดือน ,2025-10-23 17:59:34,"['ไม่', 'อยาก', 'มี', 'หี', 'อ่ะ', ' ', 'ต้อง', 'ปวดท้อง', 'ประจำเดือน', 'ทุก', 'เดือน']"
1976389021581681074,twitter,post,https://x.com/missmaryjins/status/1976389021581681074,text,2025-10-09T20:47:16.000Z,selenium_x_scraper_v1,เพื่อนหรือผัว,เพื่อนหรือผัว,2025-10-23 17:59:34,"['เพื่อน', 'หรือ', 'ผัว']"
1976471888819032372,twitter,post,https://x.com/jxl0089x/status/1976471888819032372,text,2025-10-10T02:16:34.000Z,selenium_x_scraper_v1,"เพื่อนค้าบบบ ผชเค้าก็เป็นเพื่อนกันได้เนอะ
นี้ก็จะให้เป็น เคะเมะ ตลอด","เพื่อนค้าบบบ ผชเค้าก็เป็นเพื่อนกันได้เนอะ
นี้ก็จะให้เป็น เคะเมะ ตลอด",2025-10-23 17:59:34,"['เพื่อน', 'ค้าบ', 'บบ', ' ', 'ผช', 'เค้า', 'ก็', 'เป็นเพื่อน', 'กัน', 'ได้', 'เนอะ', ' ', 'นี้', 'ก็', 'จะ', 'ให้', 'เป็น', ' ', 'เคะ', 'เมะ', ' ', 'ตลอด']"
1976471197518049728,twitter,post,https://x.com/jxl0089x/status/1976471197518049728,text,2025-10-10T02:13:49.000Z,selenium_x_scraper_v1,"ซึนอะไรอีก สรรหาคำมากๆ 
กุต้องไปเสิชอีก","ซึนอะไรอีก สรรหาคำมากๆ 
กุต้องไปเสิชอีก",2025-10-23 17:59:34,"['ซึน', 'อะไร', 'อีก', ' ', 'สรรหา', 'คำ', 'มาก', 'ๆ', ' ', 'กุ', 'ต้อง', 'ไป', 'เสิช', 'อีก']"
1976420233557705004,twitter,post,https://x.com/F4ONGSHII/status/1976420233557705004,text,2025-10-09T22:51:18.000Z,selenium_x_scraper_v1,เป้นเกก้บอกว่าเป้นเก,เป้นเกก้บอกว่าเป้นเก,2025-10-23 17:59:34,"['เป้', 'น', 'เก', 'ก้', 'บอ', 'กว่า', 'เป้', 'น', 'เก']"
1976440202127344117,twitter,post,https://x.com/jinjinnite7951/status/1976440202127344117,text,2025-10-10T00:10:39.000Z,selenium_x_scraper_v1,นี้กะยังไม่ได้ว่าไรเลยแกกก,นี้กะยังไม่ได้ว่าไรเลยแกกก,2025-10-23 17:59:34,"['นี้', 'กะ', 'ยัง', 'ไม่', 'ได้', 'ว่า', 'ไร', 'เลย', 'แก', 'กก']"
1976470409777406438,twitter,post,https://x.com/jxl0089x/status/1976470409777406438,text,2025-10-10T02:10:41.000Z,selenium_x_scraper_v1,หาว่าร้อนตัวอีก,หาว่าร้อนตัวอีก,2025-10-23 17:59:34,"['หาว่า', 'ร้อนตัว', 'อีก']"
1976470140675039551,twitter,post,https://x.com/jxl0089x/status/1976470140675039551,text,2025-10-10T02:09:37.000Z,selenium_x_scraper_v1,"อะไรคือตัวบอกว่า มึงแมนกว่ากุหรอ
ประจำเดือนป้ะ ","อะไรคือตัวบอกว่า มึงแมนกว่ากุหรอ
ประจำเดือนป้ะ ",2025-10-23 17:59:34,"['อะไร', 'คือ', 'ตัว', 'บอ', 'กว่า', ' ', 'มึง', 'แมน', 'กว่า', 'กุ', 'หรอ', ' ', 'ประจำเดือน', 'ป้ะ']"
1976223937542705517,twitter,post,https://x.com/ncxhtet1817/status/1976223937542705517,text,2025-10-09T09:51:17.000Z,selenium_x_scraper_v1,อยากอมควยใจจะขาดเลยดิ สภาพพพพพอเป็นผู้ชายก็โอเคค้าบ ผมขอโทษด้วย,อยากอมควยใจจะขาดเลยดิ สภาพพพพพอเป็นผู้ชายก็โอเคค้าบ ผมขอโทษด้วย,2025-10-23 17:59:34,"['อยาก', 'อม', 'ควย', 'ใจจะขาด', 'เลย', 'ดิ', ' ', 'สภาพ', 'พพพพอ', 'เป็น', 'ผู้ชาย', 'ก็', 'โอเค', 'ค้าบ', ' ', 'ผม', 'ขอโทษ', 'ด้วย']"
1976447416204402714,twitter,post,https://x.com/ncxhtet1817/status/1976447416204402714,text,2025-10-10T00:39:19.000Z,selenium_x_scraper_v1,แหกตูดหาควบเร็วหนุ่มถ้าอยากได้ขนาดนั้น,แหกตูดหาควบเร็วหนุ่มถ้าอยากได้ขนาดนั้น,2025-10-23 17:59:34,"['แหก', 'ตูด', 'หา', 'ควบ', 'เร็ว', 'หนุ่ม', 'ถ้า', 'อยาก', 'ได้ขนาด', 'นั้น']"
1976450454692458732,twitter,post,https://x.com/jxl0089x/status/1976450454692458732,text,2025-10-10T00:51:23.000Z,selenium_x_scraper_v1,"นี่ก็พิมเสียวเกิ้น 
อ่านจบแล้ว ต่อได้เลยครับ ","นี่ก็พิมเสียวเกิ้น 
อ่านจบแล้ว ต่อได้เลยครับ ",2025-10-23 17:59:34,"['นี่', 'ก็', 'พิม', 'เสียว', 'เกิ้น', ' ', 'อ่าน', 'จบ', 'แล้ว', ' ', 'ต่อ', 'ได้', 'เลย', 'ครับ']"
1976308777025667241,twitter,post,https://x.com/jxl0089x/status/1976308777025667241,text,2025-10-09T15:28:25.000Z,selenium_x_scraper_v1,แค่เสิช เกเร เลยดิ้,แค่เสิช เกเร เลยดิ้,2025-10-23 17:59:34,"['แค่', 'เสิช', ' ', 'เกเร', ' ', 'เลย', 'ดิ้']"
1976306810442461383,twitter,post,https://x.com/jxl0089x/status/1976306810442461383,text,2025-10-09T15:20:36.000Z,selenium_x_scraper_v1,ก้ไปเสิชมาาา ,ก้ไปเสิชมาาา ,2025-10-23 17:59:34,"['ก้', 'ไป', 'เสิช', 'มา', 'าา']"
1976304687017288036,twitter,post,https://x.com/jxl0089x/status/1976304687017288036,text,2025-10-09T15:12:10.000Z,selenium_x_scraper_v1,ละตอบกลับมาทำไม? ,ละตอบกลับมาทำไม? ,2025-10-23 17:59:34,"['ละ', 'ตอบ', 'กลับมา', 'ทำไม', '?']"
1976252988294640002,twitter,post,https://x.com/jengsudx2/status/1976252988294640002,text,2025-10-09T11:46:44.000Z,selenium_x_scraper_v1,นี่หยิกแก้ม มาจู๋เร้กไร อ่อนไหวนะเราอ่ะ,นี่หยิกแก้ม มาจู๋เร้กไร อ่อนไหวนะเราอ่ะ,2025-10-23 17:59:34,"['นี่', 'หยิก', 'แก้ม', ' ', 'มา', 'จู๋', 'เร้ก', 'ไร', ' ', 'อ่อนไหว', 'นะ', 'เรา', 'อ่ะ']"
1976302212440789429,twitter,post,https://x.com/jxl0089x/status/1976302212440789429,text,2025-10-09T15:02:20.000Z,selenium_x_scraper_v1,คำด่าที่ไม่มีคำด่า สรรหาคำนะมึงอะ,คำด่าที่ไม่มีคำด่า สรรหาคำนะมึงอะ,2025-10-23 17:59:34,"['คำด่า', 'ที่', 'ไม่', 'มี', 'คำด่า', ' ', 'สรรหา', 'คำ', 'นะ', 'มึง', 'อะ']"
1976299534323155230,twitter,post,https://x.com/jxl0089x/status/1976299534323155230,text,2025-10-09T14:51:41.000Z,selenium_x_scraper_v1,เปลี่ยนรูปไรร,เปลี่ยนรูปไรร,2025-10-23 17:59:34,"['เปลี่ยนรูป', 'ไร', 'ร']"
1976246664370569232,twitter,post,https://x.com/buddyboujwazee/status/1976246664370569232,text,2025-10-09T11:21:36.000Z,selenium_x_scraper_v1,มึงจะจีบกูหรอ,มึงจะจีบกูหรอ,2025-10-23 17:59:34,"['มึง', 'จะ', 'จีบ', 'กู', 'หรอ']"
1976297752746131496,twitter,post,https://x.com/jxl0089x/status/1976297752746131496,text,2025-10-09T14:44:36.000Z,selenium_x_scraper_v1,จีบอะไร อย่าตลกก,จีบอะไร อย่าตลกก,2025-10-23 17:59:34,"['จีบ', 'อะไร', ' ', 'อย่า', 'ตลก', 'ก']"
1976296938124316997,twitter,post,https://x.com/jxl0089x/status/1976296938124316997,text,2025-10-09T14:41:22.000Z,selenium_x_scraper_v1,ด่ากุพอทน จับกุเป็นเคะ พอเลย ,ด่ากุพอทน จับกุเป็นเคะ พอเลย ,2025-10-23 17:59:34,"['ด่า', 'กุ', 'พอ', 'ทน', ' ', 'จับ', 'กุ', 'เป็น', 'เคะ', ' ', 'พอ', 'เลย']"
1976235459631251560,twitter,post,https://x.com/jxl0089x/status/1976235459631251560,text,2025-10-09T10:37:04.000Z,selenium_x_scraper_v1,"ไม่เคยให้ค่ากลุ่มแมนมินิส
พี่เป็นคนดี ก็ขอให้เจอผชดีดีครับ ถ้าชอบผญ ก็ขอให้เจอผญ ดีดี ละกัน","ไม่เคยให้ค่ากลุ่มแมนมินิส
พี่เป็นคนดี ก็ขอให้เจอผชดีดีครับ ถ้าชอบผญ ก็ขอให้เจอผญ ดีดี ละกัน",2025-10-23 17:59:34,"['ไม่', 'เคย', 'ให้', 'ค่า', 'กลุ่ม', 'แมน', 'มินิ', 'ส', ' ', 'พี่', 'เป็น', 'คนดี', ' ', 'ก็', 'ขอให้', 'เจอ', 'ผช', 'ดี', 'ดี', 'ครับ', ' ', 'ถ้า', 'ชอบ', 'ผญ', ' ', 'ก็', 'ขอให้', 'เจอ', 'ผญ', ' ', 'ดี', 'ดี', ' ', 'ละ', 'กัน']"
1976233843230376259,twitter,post,https://x.com/annoyedmonday/status/1976233843230376259,text,2025-10-09T10:30:39.000Z,selenium_x_scraper_v1,วันๆไม่กะทำไรเลยเหรอ มึงเอาเวลามาทำเรื่องไร้สาระเกินไปละนะกับโซเชียลเนี่ย อะไรปล่อยได้ก้ปล่อยนะในฐานะที่กุเป้นพี่ก้ต้องขอเอ้ดดุเขตหน่อย ชีวิตเรานะมึงบางทีก็ต้องออกไปใช้ชีวิตบ้างเวลาว่างอยู่กับเพื่อนบ้าง นั่งด่าคนในเน็ตแค่โดนด่าควยเล้กเนี่ยเดี๋ยวสมองฝ่อพอดีดิ,วันๆไม่กะทำไรเลยเหรอ มึงเอาเวลามาทำเรื่องไร้สาระเกินไปละนะกับโซเชียลเนี่ย อะไรปล่อยได้ก้ปล่อยนะในฐานะที่กุเป้นพี่ก้ต้องขอเอ้ดดุเขตหน่อย ชีวิตเรานะมึงบางทีก็ต้องออกไปใช้ชีวิตบ้างเวลาว่างอยู่กับเพื่อนบ้าง นั่งด่าคนในเน็ตแค่โดนด่าควยเล้กเนี่ยเดี๋ยวสมองฝ่อพอดีดิ,2025-10-23 17:59:34,"['วัน', 'ๆ', 'ไม่', 'กะ', 'ทำ', 'ไร', 'เลย', 'เหรอ', ' ', 'มึง', 'เอา', 'เวลา', 'มา', 'ทำ', 'เรื่องไร้สาระ', 'เกินไป', 'ละ', 'นะ', 'กับ', 'โซเชียล', 'เนี่ย', ' ', 'อะไร', 'ปล่อย', 'ได้', 'ก้', 'ปล่อย', 'นะ', 'ใน', 'ฐานะ', 'ที่', 'กุ', 'เป้', 'น', 'พี่', 'ก้', 'ต้อง', 'ขอ', 'เอ้', 'ด', 'ดุ', 'เขต', 'หน่อย', ' ', 'ชีวิต', 'เรา', 'นะ', 'มึง', 'บางที', 'ก็', 'ต้อง', 'ออก', 'ไป', 'ใช้ชีวิต', 'บ้าง', 'เวลาว่าง', 'อยู่', 'กับ', 'เพื่อน', 'บ้าง', ' ', 'นั่ง', 'ด่า', 'คนใน', 'เน็ต', 'แค่', 'โดน', 'ด่า', 'ควย', 'เล้ก', 'เนี่ย', 'เดี๋ยว', 'สมองฝ่อ', 'พอดี', 'ดิ']"
1976234122852053165,twitter,post,https://x.com/jxl0089x/status/1976234122852053165,text,2025-10-09T10:31:46.000Z,selenium_x_scraper_v1,"เออออๆขอบใจพี่ วันนี้กุว่างพอดี
เดี๋ยวก็ออกไปหาไรทำละ","เออออๆขอบใจพี่ วันนี้กุว่างพอดี
เดี๋ยวก็ออกไปหาไรทำละ",2025-10-23 17:59:34,"['เออออ', 'ๆ', 'ขอบใจ', 'พี่', ' ', 'วันนี้', 'กุ', 'ว่าง', 'พอดี', ' ', 'เดี๋ยว', 'ก็', 'ออก', 'ไปหา', 'ไร', 'ทำ', 'ละ']"
1976232632120902057,twitter,post,https://x.com/jxl0089x/status/1976232632120902057,text,2025-10-09T10:25:50.000Z,selenium_x_scraper_v1,"ผมเห็นมีแต่ ผญด่าผช 
คุณเคยเข้าไปพิมปกป้องอะไรมั้ยล่ะ","ผมเห็นมีแต่ ผญด่าผช 
คุณเคยเข้าไปพิมปกป้องอะไรมั้ยล่ะ",2025-10-23 17:59:34,"['ผม', 'เห็น', 'มี', 'แต่', ' ', 'ผญ', 'ด่า', 'ผช', ' ', 'คุณ', 'เคย', 'เข้าไป', 'พิม', 'ปกป้อง', 'อะไร', 'มั้ย', 'ล่ะ']"
1976231816261755379,twitter,post,https://x.com/annoyedmonday/status/1976231816261755379,text,2025-10-09T10:22:36.000Z,selenium_x_scraper_v1,ออกตัวก่อนเลยอ่อ เออๆ เรื่องบอดี้เชมมิ่งมันก็มีทุกเพศแหละกุว่า ใครเสร่อก้โดนด่าตามระเบียบ แต่กุไม่เข้าใจว่าคนแบบน้องชายไมโดนด่าเยอะจัง อย่างกับทุกคนเห็นว่ามึงเสร่ออย่างงั้นอะ ทำไมเป้นงั้นล่ะ,ออกตัวก่อนเลยอ่อ เออๆ เรื่องบอดี้เชมมิ่งมันก็มีทุกเพศแหละกุว่า ใครเสร่อก้โดนด่าตามระเบียบ แต่กุไม่เข้าใจว่าคนแบบน้องชายไมโดนด่าเยอะจัง อย่างกับทุกคนเห็นว่ามึงเสร่ออย่างงั้นอะ ทำไมเป้นงั้นล่ะ,2025-10-23 17:59:34,"['ออกตัว', 'ก่อน', 'เลย', 'อ่อ', ' ', 'เออ', 'ๆ', ' ', 'เรื่อง', 'บอดี้', 'เชม', 'มิ่ง', 'มัน', 'ก็', 'มี', 'ทุก', 'เพศ', 'แหละ', 'กุ', 'ว่า', ' ', 'ใคร', 'เสร่อ', 'ก้', 'โดน', 'ด่า', 'ตามระเบียบ', ' ', 'แต่', 'กุ', 'ไม่', 'เข้าใจ', 'ว่า', 'คน', 'แบบ', 'น้องชาย', 'ไม', 'โดน', 'ด่า', 'เยอะ', 'จัง', ' ', 'อย่าง', 'กับ', 'ทุกคน', 'เห็น', 'ว่า', 'มึง', 'เสร่อ', 'อย่าง', 'งั้น', 'อะ', ' ', 'ทำไม', 'เป้', 'น', 'งั้น', 'ล่ะ']"
1976232327102726242,twitter,post,https://x.com/jxl0089x/status/1976232327102726242,text,2025-10-09T10:24:38.000Z,selenium_x_scraper_v1,"ไอเหี้ยพี่ มึงหลอกด่ากุ ป้ะเนี้ย
ผมชอบด่ากับพวกเฟม อยู่ละ พิมได้ทั้งวันถ้าว่าง","ไอเหี้ยพี่ มึงหลอกด่ากุ ป้ะเนี้ย
ผมชอบด่ากับพวกเฟม อยู่ละ พิมได้ทั้งวันถ้าว่าง",2025-10-23 17:59:34,"['ไอ', 'เหี้ย', 'พี่', ' ', 'มึง', 'หลอก', 'ด่า', 'กุ', ' ', 'ป้ะเนี้ย', ' ', 'ผม', 'ชอบ', 'ด่า', 'กับ', 'พวก', 'เฟม', ' ', 'อยู่', 'ละ', ' ', 'พิม', 'ได้', 'ทั้งวัน', 'ถ้า', 'ว่าง']"
1976231997262660048,twitter,post,https://x.com/jxl0089x/status/1976231997262660048,text,2025-10-09T10:23:19.000Z,selenium_x_scraper_v1,ผญ ก้มี privilage ครับ ต่างคนต่างมี,ผญ ก้มี privilage ครับ ต่างคนต่างมี,2025-10-23 17:59:34,"['ผญ', ' ', 'ก้', 'มี', ' ', 'privilage', ' ', 'ครับ', ' ', 'ต่าง', 'คน', 'ต่าง', 'มี']"
1976231467891224763,twitter,post,https://x.com/snowslandontop_/status/1976231467891224763,text,2025-10-09T10:21:13.000Z,selenium_x_scraper_v1,เก่งกับผญ แต่มาเงียบกับผู้ชาย อึ้ยไก่จัดว่ะ,เก่งกับผญ แต่มาเงียบกับผู้ชาย อึ้ยไก่จัดว่ะ,2025-10-23 17:59:34,"['เก่ง', 'กับ', 'ผญ', ' ', 'แต่', 'มา', 'เงียบ', 'กับ', 'ผู้ชาย', ' ', 'อึ้ย', 'ไก่', 'จัด', 'ว่ะ']"
1976231681540710671,twitter,post,https://x.com/jxl0089x/status/1976231681540710671,text,2025-10-09T10:22:04.000Z,selenium_x_scraper_v1,ก็กุไม่ได้อยากด่า ผช ,ก็กุไม่ได้อยากด่า ผช ,2025-10-23 17:59:34,"['ก็', 'กุ', 'ไม่', 'ได้', 'อยาก', 'ด่า', ' ', 'ผช']"
1976230027260743727,twitter,post,https://x.com/jinjinnite7951/status/1976230027260743727,text,2025-10-09T10:15:29.000Z,selenium_x_scraper_v1,ไม่เฉลยจ้า จับได้เฉลยๆ,ไม่เฉลยจ้า จับได้เฉลยๆ,2025-10-23 17:59:34,"['ไม่', 'เฉลย', 'จ้า', ' ', 'จับได้', 'เฉลย', 'ๆ']"
1976231282964344936,twitter,post,https://x.com/jxl0089x/status/1976231282964344936,text,2025-10-09T10:20:29.000Z,selenium_x_scraper_v1,จับได้อะไร ผมไม่ได้ชอบผช,จับได้อะไร ผมไม่ได้ชอบผช,2025-10-23 17:59:34,"['จับได้', 'อะไร', ' ', 'ผม', 'ไม่', 'ได้', 'ชอบ', 'ผช']"
1976230504006549777,twitter,post,https://x.com/annoyedmonday/status/1976230504006549777,text,2025-10-09T10:17:23.000Z,selenium_x_scraper_v1,ไม่แต่ว่า ที่น้องชายออกมาปกป้องคนจุ๋เล้กอะ อันนี้มีใครขอให้ทำปะหรือเสนอหน้ามาเองเพราะทริกเก้อส่วนตัวคับ,ไม่แต่ว่า ที่น้องชายออกมาปกป้องคนจุ๋เล้กอะ อันนี้มีใครขอให้ทำปะหรือเสนอหน้ามาเองเพราะทริกเก้อส่วนตัวคับ,2025-10-23 17:59:34,"['ไม่', 'แต่ว่า', ' ', 'ที่', 'น้องชาย', 'ออกมา', 'ปกป้อง', 'คน', 'จุ๋เล้ก', 'อะ', ' ', 'อันนี้', 'มี', 'ใคร', 'ขอให้', 'ทำ', 'ปะ', 'หรือ', 'เสนอหน้า', 'มา', 'เอง', 'เพราะ', 'ท', 'ริก', 'เก้อ', 'ส่วนตัว', 'คับ']"
