id,platform,platform_type,url,content_type,timestamp,scraper_module,text,raw_text,scrape_date,tokens
1974005923363590397,twitter,post,https://x.com/68rain_bow/status/1974005923363590397,text,2025-10-03T06:57:42.000Z,selenium_x_scraper_v1,เคยเจอเหมือนกันคับ เยอะด้วย แต่เราก็ด่าไปที่ตัวบุคคลอ่ะ ไม่ได้คิดว่าผชจะด่าแรงกว่าผญ หรือผญจะดูออกส่วนผชดูไม่ออกอะไรงี้ อันนี้ค่อนข้างจะแบ่งเพศอยู่นะแเพฟีลแบบมีความคิดว่าเพศไหนต้องนิสัยแบบไหน,เคยเจอเหมือนกันคับ เยอะด้วย แต่เราก็ด่าไปที่ตัวบุคคลอ่ะ ไม่ได้คิดว่าผชจะด่าแรงกว่าผญ หรือผญจะดูออกส่วนผชดูไม่ออกอะไรงี้ อันนี้ค่อนข้างจะแบ่งเพศอยู่นะแเพฟีลแบบมีความคิดว่าเพศไหนต้องนิสัยแบบไหน,2025-11-08 17:05:14,"['เคย', 'เจอ', 'เหมือนกัน', 'คับ', ' ', 'เยอะ', 'ด้วย', ' ', 'แต่', 'เรา', 'ก็', 'ด่า', 'ไป', 'ที่', 'ตัว', 'บุคคล', 'อ่ะ', ' ', 'ไม่', 'ได้คิด', 'ว่า', 'ผช', 'จะ', 'ด่า', 'แรง', 'กว่า', 'ผญ', ' ', 'หรือ', 'ผญ', 'จะ', 'ดูออก', 'ส่วน', 'ผช', 'ดู', 'ไม่', 'ออก', 'อะไร', 'งี้', ' ', 'อันนี้', 'ค่อนข้างจะ', 'แบ่ง', 'เพศ', 'อยู่', 'นะ', 'แ', 'เพ', 'ฟี', 'ล', 'แบบ', 'มี', 'ความคิด', 'ว่า', 'เพศ', 'ไหน', 'ต้อง', 'นิสัย', 'แบบ', 'ไหน']"
1974002493622530514,twitter,post,https://x.com/voicibo/status/1974002493622530514,text,2025-10-03T06:44:04.000Z,selenium_x_scraper_v1,"""ผญ.ด้วยกันดูออก"" คืออ จ้าาาา","""ผญ.ด้วยกันดูออก"" คืออ จ้าาาา",2025-11-08 17:05:14,"['ผญ.', 'ด้วยกัน', 'ดูออก', ' ', 'คือ', 'อ', ' ', 'จ้า', 'าาา']"
1974003887804985542,twitter,post,https://x.com/68rain_bow/status/1974003887804985542,text,2025-10-03T06:49:36.000Z,selenium_x_scraper_v1,ผช.จริงๆก็ดูออก แต่อยู่ที่มันจะกะโปกทำตัวเป็นอาหวังมั้ยแค่นั้นแหละ5555 เพื่อนผชดีๆด่าหมดแหละถ้าผญทำตัวไม่ดีใส่อ่ะ,ผช.จริงๆก็ดูออก แต่อยู่ที่มันจะกะโปกทำตัวเป็นอาหวังมั้ยแค่นั้นแหละ5555 เพื่อนผชดีๆด่าหมดแหละถ้าผญทำตัวไม่ดีใส่อ่ะ,2025-11-08 17:05:14,"['ผช.', 'จริงๆ', 'ก็', 'ดูออก', ' ', 'แต่', 'อยู่', 'ที่', 'มัน', 'จะ', 'กะ', 'โปก', 'ทำตัว', 'เป็น', 'อา', 'หวัง', 'มั้ย', 'แค่', 'นั้นแหละ', 'หัวเราะ', ' ', 'เพื่อน', 'ผช', 'ดี', 'ๆ', 'ด่า', 'หมด', 'แหละ', 'ถ้า', 'ผญ', 'ทำตัว', 'ไม่', 'ดี', 'ใส่', 'อ่ะ']"
1973954380841038225,twitter,post,https://x.com/68rain_bow/status/1973954380841038225,text,2025-10-03T03:32:53.000Z,selenium_x_scraper_v1,(อิงจากที่บอกว่าผชด่าเจ็บกว่า)* นิ้วเบียดชห.,(อิงจากที่บอกว่าผชด่าเจ็บกว่า)* นิ้วเบียดชห.,2025-11-08 17:05:14,"['อิง', 'จาก', 'ที่', 'บอ', 'กว่า', 'ผช', 'ด่า', 'เจ็บ', 'กว่า', ' ', 'นิ้ว', 'เบียด', 'ชห', '.']"
1973993122175541523,twitter,post,https://x.com/dearaquelle/status/1973993122175541523,text,2025-10-03T06:06:50.000Z,selenium_x_scraper_v1,"จำทวีตนึงได้ 

เจอแก๊งผู้ชายไม่นินทา 
1 ไม่สนิทพอ
2 ชีเป็นหัวข้อ","จำทวีตนึงได้ 

เจอแก๊งผู้ชายไม่นินทา 
1 ไม่สนิทพอ
2 ชีเป็นหัวข้อ",2025-11-08 17:05:14,"['จำ', 'ทวีต', 'นึง', 'ได้', ' ', 'เจอ', 'แก๊ง', 'ผู้ชาย', 'ไม่', 'นินทา', ' ', '1', ' ', 'ไม่', 'สนิท', 'พอ', ' ', '2', ' ', 'ชี', 'เป็น', 'หัวข้อ']"
1973982617440825839,twitter,post,https://x.com/voicibo/status/1973982617440825839,text,2025-10-03T05:25:05.000Z,selenium_x_scraper_v1,pick me girl-shit is one thing แต่ก็ยอมรับเถอะว่ากลุ่มเพื่อนผญแม่งก็ท็อกซิกได้ขนาดนั้นจริงๆและโว้ย ไม่ใช่แค่นินทา แต่กูจะพูดอะไรทีเหมือนกูเดินบนเปลือกไข่ ไปไหนด้วยกันผชสนใจกูเยอะกว่าเด่นกว่าก็ไม่ได้ ทะเลาะกันทีเงียบใส่แต่เอากูไปพูดเสียๆหายให้ทุกคนฟัง ใครไหวมึงคบ กูจะอยู่กับกะเทย,pick me girl-shit is one thing แต่ก็ยอมรับเถอะว่ากลุ่มเพื่อนผญแม่งก็ท็อกซิกได้ขนาดนั้นจริงๆและโว้ย ไม่ใช่แค่นินทา แต่กูจะพูดอะไรทีเหมือนกูเดินบนเปลือกไข่ ไปไหนด้วยกันผชสนใจกูเยอะกว่าเด่นกว่าก็ไม่ได้ ทะเลาะกันทีเงียบใส่แต่เอากูไปพูดเสียๆหายให้ทุกคนฟัง ใครไหวมึงคบ กูจะอยู่กับกะเทย,2025-11-08 17:05:14,"['pick', ' ', 'me', ' ', 'girl', ' ', 'shit', ' ', 'is', ' ', 'one', ' ', 'thing', ' ', 'แต่', 'ก็', 'ยอมรับ', 'เถอะ', 'ว่า', 'กลุ่ม', 'เพื่อน', 'ผญ', 'แม่', 'ง', 'ก็', 'ท็อก', 'ซิก', 'ได้ขนาด', 'นั้น', 'จริงๆ', 'และ', 'โว้ย', ' ', 'ไม่', 'ใช่', 'แค่', 'นินทา', ' ', 'แต่', 'กู', 'จะ', 'พูด', 'อะไร', 'ที', 'เหมือน', 'กู', 'เดิน', 'บน', 'เปลือกไข่', ' ', 'ไป', 'ไหน', 'ด้วยกัน', 'ผช', 'สนใจ', 'กู', 'เยอะ', 'กว่า', 'เด่น', 'กว่า', 'ก็', 'ไม่', 'ได้', ' ', 'ทะเลาะ', 'กัน', 'ที', 'เงียบ', 'ใส่', 'แต่', 'เอา', 'กู', 'ไป', 'พูด', 'เสีย', 'ๆ', 'หาย', 'ให้', 'ทุก', 'คนฟัง', ' ', 'ใคร', 'ไหว', 'มึง', 'คบ', ' ', 'กู', 'จะ', 'อยู่', 'กับ', 'กะเทย']"
1973979785887166521,twitter,post,https://x.com/gellowgene/status/1973979785887166521,text,2025-10-03T05:13:50.000Z,selenium_x_scraper_v1,คนที่คิดว่าผู้ชายไม่ขี้นินทา แสดงว่าไม่เคยอยู่ในวงเหล้ากับคนเหล่านี้ค่ะ,คนที่คิดว่าผู้ชายไม่ขี้นินทา แสดงว่าไม่เคยอยู่ในวงเหล้ากับคนเหล่านี้ค่ะ,2025-11-08 17:05:14,"['คน', 'ที่', 'คิด', 'ว่า', 'ผู้ชาย', 'ไม่', 'ขี้', 'นินทา', ' ', 'แสดงว่า', 'ไม่', 'เคย', 'อยู่', 'ใน', 'วง', 'เหล้า', 'กับ', 'คน', 'เหล่านี้', 'ค่ะ']"
1974070536058921242,twitter,post,https://x.com/Le_neelle/status/1974070536058921242,text,2025-10-03T11:14:26.000Z,selenium_x_scraper_v1,ทวิตนี้มันเข้าใจยากตรงไหน คือไม่ว่าจะเพศชญมันก็ขี้นินทาทั้งคู่ ผชขี้อิจฉาก็มีผญก็มี เพราะพวกมึงเป็นคนไทยอะมันเป็นรากเหง้าสันดานขี้เม้ามึงอยู่ละจ้า แต่การบอกว่าเพศหญิงเป็นเพศเดียวที่ขี้นินทานี่แปลกจ้า ทีพวกมึงฟังสตรีมเม่อ/พอดแคสโบรเล่าเรื่องคนรู้จัก นี่ก็นับว่านินทาแต่ได้ตังไง,ทวิตนี้มันเข้าใจยากตรงไหน คือไม่ว่าจะเพศชญมันก็ขี้นินทาทั้งคู่ ผชขี้อิจฉาก็มีผญก็มี เพราะพวกมึงเป็นคนไทยอะมันเป็นรากเหง้าสันดานขี้เม้ามึงอยู่ละจ้า แต่การบอกว่าเพศหญิงเป็นเพศเดียวที่ขี้นินทานี่แปลกจ้า ทีพวกมึงฟังสตรีมเม่อ/พอดแคสโบรเล่าเรื่องคนรู้จัก นี่ก็นับว่านินทาแต่ได้ตังไง,2025-11-08 17:05:14,"['ทวิ', 'ต', 'นี้', 'มัน', 'เข้าใจยาก', 'ตรงไหน', ' ', 'คือ', 'ไม่', 'ว่า', 'จะ', 'เพศ', 'ชญ', 'มัน', 'ก็', 'ขี้', 'นินทา', 'ทั้งคู่', ' ', 'ผช', 'ขี้อิจฉา', 'ก็', 'มี', 'ผญ', 'ก็', 'มี', ' ', 'เพราะ', 'พวก', 'มึง', 'เป็น', 'คนไทย', 'อะ', 'มัน', 'เป็น', 'รากเหง้า', 'สันดาน', 'ขี้', 'เม้า', 'มึง', 'อยู่', 'ละ', 'จ้า', ' ', 'แต่', 'การ', 'บอ', 'กว่า', 'เพศหญิง', 'เป็น', 'เพศ', 'เดียว', 'ที่', 'ขี้', 'นินทา', 'นี่', 'แปลก', 'จ้า', ' ', 'ที', 'พวก', 'มึง', 'ฟัง', 'สตรีม', 'เม่อ', ' ', 'พอ', 'ด', 'แค', 'ส', 'โบ', 'ร', 'เล่าเรื่อง', 'คนรู้จัก', ' ', 'นี่', 'ก็', 'นับว่า', 'นินทา', 'แต่', 'ได้', 'ตัง', 'ไง']"
1973958012688851304,twitter,post,https://x.com/softcreambaby/status/1973958012688851304,text,2025-10-03T03:47:19.000Z,selenium_x_scraper_v1,แล้วคนประเภทนี้เวลามีปัญหาไม่เคยมาพูดตรงๆ เลือกที่จะโพสต์ด่าลงโซเชี่ยล ไม่ก็เอาไปนินทากับเพื่อนแล้วให้เพื่อนมาด่าเราแทน คนตรงๆตัวจริง เขาไม่จำเป็นต้องตั้งสเตตัสแบบนี้ค่ะ เดินมาพูดเคลียร์กันแปปเดียวจบ,แล้วคนประเภทนี้เวลามีปัญหาไม่เคยมาพูดตรงๆ เลือกที่จะโพสต์ด่าลงโซเชี่ยล ไม่ก็เอาไปนินทากับเพื่อนแล้วให้เพื่อนมาด่าเราแทน คนตรงๆตัวจริง เขาไม่จำเป็นต้องตั้งสเตตัสแบบนี้ค่ะ เดินมาพูดเคลียร์กันแปปเดียวจบ,2025-11-08 17:05:14,"['แล้ว', 'คน', 'ประเภท', 'นี้', 'เวลา', 'มีปัญหา', 'ไม่', 'เคย', 'มา', 'พูดตรงๆ', ' ', 'เลือก', 'ที่จะ', 'โพสต์', 'ด่า', 'ลง', 'โซ', 'เชี่ยล', ' ', 'ไม่', 'ก็', 'เอา', 'ไป', 'นินทา', 'กับ', 'เพื่อน', 'แล้ว', 'ให้', 'เพื่อน', 'มา', 'ด่า', 'เรา', 'แทน', ' ', 'คน', 'ตรงๆ', 'ตัวจริง', ' ', 'เขา', 'ไม่', 'จำเป็นต้อง', 'ตั้ง', 'สเตตัส', 'แบบนี้', 'ค่ะ', ' ', 'เดิน', 'มา', 'พูด', 'เคลียร์', 'กัน', 'แป', 'ป', 'เดียว', 'จบ']"
1974320136455925845,twitter,post,https://x.com/conanspirits/status/1974320136455925845,text,2025-10-04T03:46:16.000Z,selenium_x_scraper_v1,ประโยคที่เบสิคที่สุดคือ เพราะงี้แหละเลยคบแต่เพื่อน ผช  ปล.ทำไมเพื่อน ผช ที่นี่เจอนินทาแรงกว่ากลุ่ม ผญ นี่อีกค่าา,ประโยคที่เบสิคที่สุดคือ เพราะงี้แหละเลยคบแต่เพื่อน ผช  ปล.ทำไมเพื่อน ผช ที่นี่เจอนินทาแรงกว่ากลุ่ม ผญ นี่อีกค่าา,2025-11-08 17:05:14,"['ประโยค', 'ที่', 'เบ', 'สิ', 'ค', 'ที่สุด', 'คือ', ' ', 'เพราะ', 'งี้', 'แห', 'ละเลย', 'คบ', 'แต่', 'เพื่อน', ' ', 'ผช', ' ', 'ปล.', 'ทำไม', 'เพื่อน', ' ', 'ผช', ' ', 'ที่นี่', 'เจอ', 'นินทา', 'แรง', 'กว่า', 'กลุ่ม', ' ', 'ผญ', ' ', 'นี่', 'อีก', 'ค่า', 'า']"
1974593413904470027,twitter,post,https://x.com/CAMELKUKU/status/1974593413904470027,text,2025-10-04T21:52:10.000Z,selenium_x_scraper_v1,การเป็น“คน”ชอบพูดตรงๆ จริงใจ ใครอยากจะเป็นก็เป็นได้เลยนะ ไม่จำเป็นต้องมีโคโมโซมXYการันตี นิสัยชอบนินทามันคือนิสัยของคนจริงๆ สามารถเกิดขึ้นได้ทุกเพศ เลิกnormให้เป็นนิสัยเฉพาะเพศใดเพศหนึ่งทีเถอะ,การเป็น“คน”ชอบพูดตรงๆ จริงใจ ใครอยากจะเป็นก็เป็นได้เลยนะ ไม่จำเป็นต้องมีโคโมโซมXYการันตี นิสัยชอบนินทามันคือนิสัยของคนจริงๆ สามารถเกิดขึ้นได้ทุกเพศ เลิกnormให้เป็นนิสัยเฉพาะเพศใดเพศหนึ่งทีเถอะ,2025-11-08 17:05:14,"['การ', 'เป็น', ' ', 'คน', ' ', 'ชอบ', 'พูดตรงๆ', ' ', 'จริงใจ', ' ', 'ใคร', 'อยาก', 'จะ', 'เป็น', 'ก็', 'เป็นได้', 'เลย', 'นะ', ' ', 'ไม่', 'จำเป็นต้อง', 'มี', 'โค', 'โม', 'โซม', 'xy', 'การันตี', ' ', 'นิสัย', 'ชอบ', 'นินทา', 'มัน', 'คือ', 'นิสัย', 'ของ', 'คน', 'จริงๆ', ' ', 'สามารถ', 'เกิดขึ้น', 'ได้', 'ทุก', 'เพศ', ' ', 'เลิก', 'norm', 'ให้', 'เป็นนิสัย', 'เฉพาะ', 'เพศ', 'ใด', 'เพศ', 'หนึ่ง', 'ที', 'เถอะ']"
1974425287095140744,twitter,post,https://x.com/kuhlabswn/status/1974425287095140744,text,2025-10-04T10:44:06.000Z,selenium_x_scraper_v1,"ถ้าผู้หญิงพิมพ์แบบนี้คือมีแค่ไม่กี่กรณี ถ้าไม่ฟังเขามา ก็ไม่สนิทกับผู้ชายในกลุ่ม อีกกรณีคือสนิทแต่เป็นเมียเพื่อน 

การนินทาคนคือของอร่อย เพศไหนมันก็ทำครับ 

เผลอๆ ไอ่ที่บอกว่าไม่เคยได้ยินนั้นแหละ คือตัวโดน","ถ้าผู้หญิงพิมพ์แบบนี้คือมีแค่ไม่กี่กรณี ถ้าไม่ฟังเขามา ก็ไม่สนิทกับผู้ชายในกลุ่ม อีกกรณีคือสนิทแต่เป็นเมียเพื่อน 

การนินทาคนคือของอร่อย เพศไหนมันก็ทำครับ 

เผลอๆ ไอ่ที่บอกว่าไม่เคยได้ยินนั้นแหละ คือตัวโดน",2025-11-08 17:05:14,"['ถ้า', 'ผู้หญิง', 'พิมพ์', 'แบบนี้', 'คือ', 'มี', 'แค่', 'ไม่', 'กี่', 'กรณี', ' ', 'ถ้า', 'ไม่', 'ฟัง', 'เขา', 'มา', ' ', 'ก็', 'ไม่', 'สนิท', 'กับ', 'ผู้ชาย', 'ใน', 'กลุ่ม', ' ', 'อีก', 'กรณี', 'คือ', 'สนิท', 'แต่', 'เป็น', 'เมีย', 'เพื่อน', ' ', 'การนินทา', 'คน', 'คือ', 'ของ', 'อร่อย', ' ', 'เพศ', 'ไหน', 'มัน', 'ก็', 'ทำ', 'ครับ', ' ', 'เผลอ', 'ๆ', ' ', 'ไอ่', 'ที่', 'บอ', 'กว่า', 'ไม่', 'เคย', 'ได้ยิน', 'นั้นแหละ', ' ', 'คือ', 'ตัว', 'โดน']"
1974038295811076452,twitter,post,https://x.com/merimerrigold/status/1974038295811076452,text,2025-10-03T09:06:20.000Z,selenium_x_scraper_v1,บางคนบอกว่าคบเพื่อนผู้ชายไม่ปวดหัว เพราะกับผู้ชายมึงทำสันดานเอาอกเอาใจมันค่ะ แต่กับเพื่อนผู้หญิงดูถูกเขาทำตัวเป็นพิกมีกดเหยียดสารพัด ผู้หญิงด้วยกันเขาไม่เอา เลยต้องหนีไปคบเพื่อนผู้ชายแทน,บางคนบอกว่าคบเพื่อนผู้ชายไม่ปวดหัว เพราะกับผู้ชายมึงทำสันดานเอาอกเอาใจมันค่ะ แต่กับเพื่อนผู้หญิงดูถูกเขาทำตัวเป็นพิกมีกดเหยียดสารพัด ผู้หญิงด้วยกันเขาไม่เอา เลยต้องหนีไปคบเพื่อนผู้ชายแทน,2025-11-08 17:05:14,"['บางคน', 'บอ', 'กว่า', 'คบ', 'เพื่อน', 'ผู้ชาย', 'ไม่', 'ปวดหัว', ' ', 'เพราะ', 'กับ', 'ผู้ชาย', 'มึง', 'ทำ', 'สันดาน', 'เอาอกเอาใจ', 'มัน', 'ค่ะ', ' ', 'แต่', 'กับ', 'เพื่อน', 'ผู้หญิง', 'ดูถูก', 'เขา', 'ทำตัว', 'เป็น', 'พิก', 'มี', 'กด', 'เหยียด', 'สารพัด', ' ', 'ผู้หญิง', 'ด้วยกัน', 'เขา', 'ไม่', 'เอา', ' ', 'เลย', 'ต้อง', 'หนี', 'ไป', 'คบ', 'เพื่อน', 'ผู้ชาย', 'แทน']"
1973989872248782965,twitter,post,https://x.com/intothebackroom/status/1973989872248782965,text,2025-10-03T05:53:55.000Z,selenium_x_scraper_v1,จากปสก. ผู้ชายจำนวนมากก็นินทา ขี้เม้า ชอบเรื่องชาวบ้าน และ % ที่จะพูดถึงคนอื่นในเชิงเซ็กชวลมีเยอะกว่าผู้หญิงพอสมควร (นับแค่ปสก.ส่วนตัวนะ) พวกกลุ่มแชทที่รวมตัวกันเยอะๆเพื่อส่งวาร์ป พิมคุกคามกันเป็นปกติ จะเห็นเป็นผช.มากกว่า แล้วมีผญ.บางคนอยู่ในแชท เพื่อไรไม่ทราบ งง,จากปสก. ผู้ชายจำนวนมากก็นินทา ขี้เม้า ชอบเรื่องชาวบ้าน และ % ที่จะพูดถึงคนอื่นในเชิงเซ็กชวลมีเยอะกว่าผู้หญิงพอสมควร (นับแค่ปสก.ส่วนตัวนะ) พวกกลุ่มแชทที่รวมตัวกันเยอะๆเพื่อส่งวาร์ป พิมคุกคามกันเป็นปกติ จะเห็นเป็นผช.มากกว่า แล้วมีผญ.บางคนอยู่ในแชท เพื่อไรไม่ทราบ งง,2025-11-08 17:05:14,"['จาก', 'ปส', 'ก.', ' ', 'ผู้ชาย', 'จำนวนมาก', 'ก็', 'นินทา', ' ', 'ขี้', 'เม้า', ' ', 'ชอบ', 'เรื่อง', 'ชาวบ้าน', ' ', 'และ', ' ', 'ที่จะ', 'พูดถึง', 'คนอื่น', 'ใน', 'เชิง', 'เซ็กชวล', 'มี', 'เยอะ', 'กว่า', 'ผู้หญิง', 'พอสมควร', ' ', 'นับ', 'แค่', 'ปส', 'ก.', 'ส่วนตัว', 'นะ', ' ', 'พวก', 'กลุ่ม', 'แชท', 'ที่', 'รวมตัวกัน', 'เยอะ', 'ๆ', 'เพื่อ', 'ส่ง', 'วาร์ป', ' ', 'พิม', 'คุกคาม', 'กัน', 'เป็นปกติ', ' ', 'จะ', 'เห็น', 'เป็น', 'ผช.', 'มากกว่า', ' ', 'แล้ว', 'มี', 'ผญ.', 'บางคน', 'อยู่', 'ใน', 'แชท', ' ', 'เพื่อ', 'ไร', 'ไม่', 'ทราบ', ' ', 'งง']"
1974063865274249740,twitter,post,https://x.com/jujunize/status/1974063865274249740,text,2025-10-03T10:47:56.000Z,selenium_x_scraper_v1,เราก็ไม่คบเพื่อนผู้หญิงค่ะ เพื่อนผู้ชายก็ไม่คบ ไม่มีใครเอากูสังคมรังเกียจ,เราก็ไม่คบเพื่อนผู้หญิงค่ะ เพื่อนผู้ชายก็ไม่คบ ไม่มีใครเอากูสังคมรังเกียจ,2025-11-08 17:05:14,"['เรา', 'ก็', 'ไม่', 'คบ', 'เพื่อน', 'ผู้หญิง', 'ค่ะ', ' ', 'เพื่อน', 'ผู้ชาย', 'ก็', 'ไม่', 'คบ', ' ', 'ไม่', 'มี', 'ใคร', 'เอา', 'กู', 'สังคม', 'รังเกียจ']"
