id,platform,platform_type,url,content_type,timestamp,scraper_module,text,raw_text,scrape_date,tokens
1981185843172954553,twitter,post,https://x.com/Blazing12/status/1981185843172954553,text,2025-10-23T02:28:08.000Z,selenium_x_scraper_v1,เรื่องสงครามโลกครั้งที่ 2 ที่ญี่ปุ่นไปทำตัวเลวๆ ใส่ชาวบ้านเค้าคนญี่ปุ่นไม่ได้เรียนเลยค่ะ ตอนเราเรียนมหาวิทยาลัย วิชาเลือกภาษาญี่ปุ่น อาจารย์คนญี่ปุ่นอายุประมาณ 28-30 ปี เค้าไม่เคยรู้เรื่องพวกนี้เลย เค้ารู้แค่ว่าแพ้สงครามเพราะอาวุธสู้อเมริกาไม่ได้ ,เรื่องสงครามโลกครั้งที่ 2 ที่ญี่ปุ่นไปทำตัวเลวๆ ใส่ชาวบ้านเค้าคนญี่ปุ่นไม่ได้เรียนเลยค่ะ ตอนเราเรียนมหาวิทยาลัย วิชาเลือกภาษาญี่ปุ่น อาจารย์คนญี่ปุ่นอายุประมาณ 28-30 ปี เค้าไม่เคยรู้เรื่องพวกนี้เลย เค้ารู้แค่ว่าแพ้สงครามเพราะอาวุธสู้อเมริกาไม่ได้ ,2025-11-29 08:18:55,"['เรื่อง', 'สงครามโลก', 'ครั้ง', 'ที่', ' ', '2', ' ', 'ที่', 'ญี่ปุ่น', 'ไป', 'ทำตัว', 'เลว', 'ๆ', ' ', 'ใส่', 'ชาวบ้าน', 'เค้า', 'คนญี่ปุ่น', 'ไม่', 'ได้', 'เรียน', 'เลย', 'ค่ะ', ' ', 'ตอน', 'เรา', 'เรียน', 'มหาวิทยาลัย', ' ', 'วิชาเลือก', 'ภาษา', 'ญี่ปุ่น', ' ', 'อาจารย์', 'คนญี่ปุ่น', 'อายุ', 'ประมาณ', ' ', '28', ' ', '30', ' ', 'ปี', ' ', 'เค้า', 'ไม่', 'เคย', 'รู้เรื่อง', 'พวก', 'นี้', 'เลย', ' ', 'เค้า', 'รู้', 'แค่', 'ว่า', 'แพ้', 'สงคราม', 'เพราะ', 'อาวุธ', 'สู้', 'อเมริกา', 'ไม่', 'ได้']"
1980929600990662965,twitter,post,https://x.com/findingpillow1/status/1980929600990662965,text,2025-10-22T09:29:55.000Z,selenium_x_scraper_v1,นางเป็นหุ่นเชิดของชายแทร่คนนึงที่อยู่เบื้องหลังการเมืองญี่ปุ่นทุกยุค,นางเป็นหุ่นเชิดของชายแทร่คนนึงที่อยู่เบื้องหลังการเมืองญี่ปุ่นทุกยุค,2025-11-29 08:18:55,"['นาง', 'เป็น', 'หุ่นเชิด', 'ของ', 'ชาย', 'แทร่คน', 'นึง', 'ที่อยู่', 'เบื้องหลัง', 'การเมือง', 'ญี่ปุ่น', 'ทุก', 'ยุค']"
1980902889565700392,twitter,post,https://x.com/timelesswind/status/1980902889565700392,text,2025-10-22T07:43:46.000Z,selenium_x_scraper_v1,รู้สึกแบบ หรือนี่คือ A very successful case ของความปิตาธิปไตยกันนะ,รู้สึกแบบ หรือนี่คือ A very successful case ของความปิตาธิปไตยกันนะ,2025-11-29 08:18:55,"['รู้สึก', 'แบบ', ' ', 'หรือ', 'นี่', 'คือ', ' ', 'a', ' ', 'very', ' ', 'successful', ' ', 'case', ' ', 'ของ', 'ความ', 'ปิตาธิปไตย', 'กัน', 'นะ']"
1980962572892614735,twitter,post,https://x.com/positive_attid/status/1980962572892614735,text,2025-10-22T11:40:56.000Z,selenium_x_scraper_v1,ต่อต้านนามสกุลผญหรอ ปิตาดีดีนี่เอง อยากให้ตระกูลผญหายไป เหลือแต่ตระกูลผชไปดิ ไม่แปลกใจถ้าคนจะแต่งฝานน้อยลฃนะ ดูเหมือนเรื่องเล็กหรอ จริงๆเรื่องใหญ่มาก,ต่อต้านนามสกุลผญหรอ ปิตาดีดีนี่เอง อยากให้ตระกูลผญหายไป เหลือแต่ตระกูลผชไปดิ ไม่แปลกใจถ้าคนจะแต่งฝานน้อยลฃนะ ดูเหมือนเรื่องเล็กหรอ จริงๆเรื่องใหญ่มาก,2025-11-29 08:18:55,"['ต่อต้าน', 'นามสกุล', 'ผญ', 'หรอ', ' ', 'ปิตา', 'ดี', 'ดี', 'นี่เอง', ' ', 'อยาก', 'ให้', 'ตระกูล', 'ผญ', 'หาย', 'ไป', ' ', 'เหลือ', 'แต่', 'ตระกูล', 'ผช', 'ไป', 'ดิ', ' ', 'ไม่', 'แปลกใจ', 'ถ้า', 'คน', 'จะ', 'แต่ง', 'ฝาน', 'น้อย', 'ลฃ', 'นะ', ' ', 'ดูเหมือน', 'เรื่องเล็ก', 'หรอ', ' ', 'จริงๆ', 'เรื่องใหญ่', 'มาก']"
1980907676650659854,twitter,post,https://x.com/callmeaqueenn/status/1980907676650659854,text,2025-10-22T08:02:48.000Z,selenium_x_scraper_v1,เค้ามาจากพรรคอนุรักษ์นิยม ที่ชนะได้น่าจะเพราะเดี๋ยวนี้กระแสต่อต้านผู้อพยพ มุมมองประชาชนก็คงอยากให้จัดการปัญหานี้ก่อนเรื่องอื่นไว้ทีหลัง,เค้ามาจากพรรคอนุรักษ์นิยม ที่ชนะได้น่าจะเพราะเดี๋ยวนี้กระแสต่อต้านผู้อพยพ มุมมองประชาชนก็คงอยากให้จัดการปัญหานี้ก่อนเรื่องอื่นไว้ทีหลัง,2025-11-29 08:18:55,"['เค้า', 'มาจาก', 'พรรค', 'อนุรักษ์นิยม', ' ', 'ที่', 'ชนะ', 'ได้', 'น่าจะ', 'เพราะ', 'เดี๋ยวนี้', 'กระแส', 'ต่อต้าน', 'ผู้อพยพ', ' ', 'มุมมอง', 'ประชาชน', 'ก็', 'คง', 'อยาก', 'ให้', 'จัดการ', 'ปัญหา', 'นี้', 'ก่อน', 'เรื่อง', 'อื่น', 'ไว้', 'ทีหลัง']"
1980849748958679475,twitter,post,https://x.com/am_isomeone/status/1980849748958679475,text,2025-10-22T04:12:37.000Z,selenium_x_scraper_v1,หัวโบราณจัดดดดด,หัวโบราณจัดดดดด,2025-11-29 08:18:55,"['หัวโบราณ', 'จัด', 'ดดดด']"
1981261132896837839,twitter,post,https://x.com/Coach_Ping/status/1981261132896837839,text,2025-10-23T07:27:18.000Z,selenium_x_scraper_v1,แต่คุณสามีของนางใช้นามสกุลภรรยานะครับ ทาคาอิจิเป็นนามสกุลนายกหญิง,แต่คุณสามีของนางใช้นามสกุลภรรยานะครับ ทาคาอิจิเป็นนามสกุลนายกหญิง,2025-11-29 08:18:55,"['แต่', 'คุณ', 'สามี', 'ของ', 'นาง', 'ใช้', 'นามสกุล', 'ภรรยา', 'นะ', 'ครับ', ' ', 'ทา', 'คา', 'อิ', 'จิ', 'เป็น', 'นามสกุล', 'นายก', 'หญิง']"
1980946864838148511,twitter,post,https://x.com/mrjosbush/status/1980946864838148511,text,2025-10-22T10:38:31.000Z,selenium_x_scraper_v1,เพราะคนญี่ปุ่นรู้ว่าไม่มีปัญหาอะไร ร้ายเท่าผู้อพยพทำลายประเทศ,เพราะคนญี่ปุ่นรู้ว่าไม่มีปัญหาอะไร ร้ายเท่าผู้อพยพทำลายประเทศ,2025-11-29 08:18:55,"['เพราะ', 'คนญี่ปุ่น', 'รู้', 'ว่า', 'ไม่', 'มีปัญหา', 'อะไร', ' ', 'ร้าย', 'เท่า', 'ผู้อพยพ', 'ทำลาย', 'ประเทศ']"
1980936591184196083,twitter,post,https://x.com/wryaaaah/status/1980936591184196083,text,2025-10-22T09:57:42.000Z,selenium_x_scraper_v1,มาถึงจุดนี้ก้อโทษพวกโว๊คเถอะ รับแต่ผู้อพยพจนปท.จะพังเอา,มาถึงจุดนี้ก้อโทษพวกโว๊คเถอะ รับแต่ผู้อพยพจนปท.จะพังเอา,2025-11-29 08:18:55,"['มาถึง', 'จุด', 'นี้', 'ก้อ', 'โทษ', 'พวก', 'โว๊ค', 'เถอะ', ' ', 'รับ', 'แต่', 'ผู้อพยพ', 'จน', 'ปท.', 'จะ', 'พัง', 'เอา']"
1981457901802983623,twitter,post,https://x.com/wsxnko39/status/1981457901802983623,text,2025-10-23T20:29:12.000Z,selenium_x_scraper_v1,ไม่ได้ห้ามผู้หญิงใช้นามสกุลเดิมนะ แต่ถ้าแต่งงานแล้วต้องใช้นามสกุลเดียวกัน (เวลาเรียกชื่ออีกฝ่ายใช้นามสกุล) ถ้าอยากใช้นามสกุลฝ่ายหญิง ผู้ชายก็เป็นฝ่ายเปลี่ยนนามสกุลแทน,ไม่ได้ห้ามผู้หญิงใช้นามสกุลเดิมนะ แต่ถ้าแต่งงานแล้วต้องใช้นามสกุลเดียวกัน (เวลาเรียกชื่ออีกฝ่ายใช้นามสกุล) ถ้าอยากใช้นามสกุลฝ่ายหญิง ผู้ชายก็เป็นฝ่ายเปลี่ยนนามสกุลแทน,2025-11-29 08:18:55,"['ไม่', 'ได้', 'ห้าม', 'ผู้หญิง', 'ใช้', 'นามสกุล', 'เดิม', 'นะ', ' ', 'แต่', 'ถ้า', 'แต่งงาน', 'แล้ว', 'ต้อง', 'ใช้', 'นามสกุล', 'เดียวกัน', ' ', 'เวลา', 'เรียกชื่อ', 'อีก', 'ฝ่าย', 'ใช้', 'นามสกุล', ' ', 'ถ้า', 'อยาก', 'ใช้', 'นามสกุล', 'ฝ่าย', 'หญิง', ' ', 'ผู้ชาย', 'ก็', 'เป็น', 'ฝ่าย', 'เปลี่ยน', 'นามสกุล', 'แทน']"
1980924350967738522,twitter,post,https://x.com/Singhabangkok/status/1980924350967738522,text,2025-10-22T09:09:03.000Z,selenium_x_scraper_v1,ยังไม่รู้จักมากาแรต แทชเชอร์สินะ,ยังไม่รู้จักมากาแรต แทชเชอร์สินะ,2025-11-29 08:18:55,"['ยัง', 'ไม่', 'รู้จัก', 'มา', 'กา', 'แร', 'ต', ' ', 'แทชเชอร์', 'สิ', 'นะ']"
1980904950927671346,twitter,post,https://x.com/PeanutcoManga/status/1980904950927671346,text,2025-10-22T07:51:58.000Z,selenium_x_scraper_v1,ก็มาจากพรรคสาย conservative  ขวัญใจชาวเกาะก็จะไทป์แนวๆนี้อยู่แล้ว  ยิ่งกระแสเรื่องต่อต้านผู้อพยพกำลังแรงได้ที่,ก็มาจากพรรคสาย conservative  ขวัญใจชาวเกาะก็จะไทป์แนวๆนี้อยู่แล้ว  ยิ่งกระแสเรื่องต่อต้านผู้อพยพกำลังแรงได้ที่,2025-11-29 08:18:55,"['ก็', 'มาจาก', 'พรรค', 'สาย', ' ', 'conservative', ' ', 'ขวัญใจ', 'ชาวเกาะ', 'ก็', 'จะ', 'ไท', 'ป์', 'แนว', 'ๆ', 'นี้', 'อยู่แล้ว', ' ', 'ยิ่ง', 'กระแส', 'เรื่อง', 'ต่อต้าน', 'ผู้อพยพ', 'กำลัง', 'แรง', 'ได้ที่']"
1981064263080038785,twitter,post,https://x.com/SomruedeeC/status/1981064263080038785,text,2025-10-22T18:25:01.000Z,selenium_x_scraper_v1,กลไกความไม่เท่าเทียมของหญิงชายที่จะอยู่ได้ยืนยาว ก็คือคนที่โดนกดขี่เห็นดีเห็นงามยินยอมพร้อมใจ  โดยเฉพาะแม่สอนลูกสาวให้สำนึกว่าตัวเองด้อยกว่าผู้ชายต้องพึ่งพาผู้ชาย เชิดชูลูกชาย  มันถึงได้ไม่เท่าเทียมมาเป็นร้อยเป็นพันปีไง,กลไกความไม่เท่าเทียมของหญิงชายที่จะอยู่ได้ยืนยาว ก็คือคนที่โดนกดขี่เห็นดีเห็นงามยินยอมพร้อมใจ  โดยเฉพาะแม่สอนลูกสาวให้สำนึกว่าตัวเองด้อยกว่าผู้ชายต้องพึ่งพาผู้ชาย เชิดชูลูกชาย  มันถึงได้ไม่เท่าเทียมมาเป็นร้อยเป็นพันปีไง,2025-11-29 08:18:55,"['กลไก', 'ความ', 'ไม่', 'เท่าเทียม', 'ของ', 'หญิง', 'ชาย', 'ที่จะ', 'อยู่', 'ได้', 'ยืนยาว', ' ', 'ก็', 'คือ', 'คน', 'ที่', 'โดน', 'กดขี่', 'เห็นดีเห็นงาม', 'ยินยอมพร้อมใจ', ' ', 'โดยเฉพาะ', 'แม่', 'สอน', 'ลูกสาว', 'ให้', 'สำนึก', 'ว่า', 'ตัวเอง', 'ด้อย', 'กว่า', 'ผู้ชาย', 'ต้อง', 'พึ่งพา', 'ผู้ชาย', ' ', 'เชิดชู', 'ลูกชาย', ' ', 'มัน', 'ถึง', 'ได้', 'ไม่', 'เท่าเทียม', 'มา', 'เป็นร้อยเป็นพัน', 'ปี', 'ไง']"
1980962347184542056,twitter,post,https://x.com/positive_attid/status/1980962347184542056,text,2025-10-22T11:40:02.000Z,selenium_x_scraper_v1,ต่อต้านผญมีสิทธิ์ใช้นามสกุลเดิม โอ้ย อิควายเอ้ย รู้สึกเจอะวกเนรคุณ โอ้ยยย หงุดหงิดด,ต่อต้านผญมีสิทธิ์ใช้นามสกุลเดิม โอ้ย อิควายเอ้ย รู้สึกเจอะวกเนรคุณ โอ้ยยย หงุดหงิดด,2025-11-29 08:18:55,"['ต่อต้าน', 'ผญ', 'มีสิทธิ์', 'ใช้', 'นามสกุล', 'เดิม', ' ', 'โอ้ย', ' ', 'อิ', 'ควาย', 'เอ้ย', ' ', 'รู้สึก', 'เจอะ', 'วก', 'เนรคุณ', ' ', 'โอ้ย', 'ยย', ' ', 'หงุดหงิด', 'ด']"
1980936452780527758,twitter,post,https://x.com/Mimi486046/status/1980936452780527758,text,2025-10-22T09:57:09.000Z,selenium_x_scraper_v1,ถ้างั้นก็เป็นแค่หุ่นเชิด เห้อ,ถ้างั้นก็เป็นแค่หุ่นเชิด เห้อ,2025-11-29 08:18:55,"['ถ้า', 'งั้น', 'ก็', 'เป็น', 'แค่', 'หุ่นเชิด', ' ', 'เห้อ']"
1980971248692924424,twitter,post,https://x.com/MsParkjijoy/status/1980971248692924424,text,2025-10-22T12:15:25.000Z,selenium_x_scraper_v1,"จุดยืนคล้ายเมียอดีตประธานาธิบดียุนซอกยอล
ถูกใจสาย conservative","จุดยืนคล้ายเมียอดีตประธานาธิบดียุนซอกยอล
ถูกใจสาย conservative",2025-11-29 08:18:55,"['จุดยืน', 'คล้าย', 'เมีย', 'อดีต', 'ประธานาธิบดี', 'ยุ', 'น', 'ซอก', 'ยอ', 'ล', ' ', 'ถูกใจ', 'สาย', ' ', 'conservative']"
1980961492964188313,twitter,post,https://x.com/YouDeadAssBitch/status/1980961492964188313,text,2025-10-22T11:36:39.000Z,selenium_x_scraper_v1,ทำไมถึงคิดว่าผู้หญิงต้องสนับสนุนความเท่าเทียม by default อ่ะ เอาตรงๆ ในประวัติศาสตร์ผู้หญิงเองเป็นตัวลัครสำคัญในการขวางความเท่าเทียมอยู่เรื่อยๆนะ,ทำไมถึงคิดว่าผู้หญิงต้องสนับสนุนความเท่าเทียม by default อ่ะ เอาตรงๆ ในประวัติศาสตร์ผู้หญิงเองเป็นตัวลัครสำคัญในการขวางความเท่าเทียมอยู่เรื่อยๆนะ,2025-11-29 08:18:55,"['ทำไม', 'ถึง', 'คิด', 'ว่า', 'ผู้หญิง', 'ต้อง', 'สนับสนุน', 'ความเท่าเทียม', ' ', 'by', ' ', 'default', ' ', 'อ่ะ', ' ', 'เอา', 'ตรงๆ', ' ', 'ใน', 'ประวัติศาสตร์', 'ผู้หญิง', 'เอง', 'เป็นตัว', 'ลัคร', 'สำคัญ', 'ใน', 'การ', 'ขวาง', 'ความเท่าเทียม', 'อยู่', 'เรื่อยๆ', 'นะ']"
1981716060240785668,twitter,post,https://x.com/Eittikorn/status/1981716060240785668,text,2025-10-24T13:35:01.000Z,selenium_x_scraper_v1,พอผู้หญิงทำอะไรแนวนี้ก็ป้ายสีไปเลยว่าเป็นปิตา ทั้งๆ ที่เธอเป็นผู้หญิง ที่อาจจะมายืนอยู่บนตำแหน่งนี้โดยความสามารถและคนรอบข้าง แนวคิดแบบป้ายสี ช หรือ ญ เป็นปิตา คือผลกระทบจากแนวคิด critical theory ที่สร้างเหตุผลเชิงอำนาจมาป้ายสีคน โดยไม่คำนึงความสามารถ นโยบาย หรือใดๆ ของบุคคลนั้นๆ,พอผู้หญิงทำอะไรแนวนี้ก็ป้ายสีไปเลยว่าเป็นปิตา ทั้งๆ ที่เธอเป็นผู้หญิง ที่อาจจะมายืนอยู่บนตำแหน่งนี้โดยความสามารถและคนรอบข้าง แนวคิดแบบป้ายสี ช หรือ ญ เป็นปิตา คือผลกระทบจากแนวคิด critical theory ที่สร้างเหตุผลเชิงอำนาจมาป้ายสีคน โดยไม่คำนึงความสามารถ นโยบาย หรือใดๆ ของบุคคลนั้นๆ,2025-11-29 08:18:55,"['พอ', 'ผู้หญิง', 'ทำ', 'อะไร', 'แนว', 'นี้', 'ก็', 'ป้ายสี', 'ไป', 'เลย', 'ว่า', 'เป็น', 'ปิตา', ' ', 'ทั้งๆ ที่', 'เธอ', 'เป็น', 'ผู้หญิง', ' ', 'ที่', 'อาจจะ', 'มา', 'ยืน', 'อยู่', 'บน', 'ตำแหน่ง', 'นี้', 'โดย', 'ความสามารถ', 'และ', 'คน', 'รอบข้าง', ' ', 'แนวคิด', 'แบบ', 'ป้ายสี', ' ', 'ช', ' ', 'หรือ', ' ', 'ญ', ' ', 'เป็น', 'ปิตา', ' ', 'คือ', 'ผลกระทบ', 'จาก', 'แนวคิด', ' ', 'critical', ' ', 'theory', ' ', 'ที่', 'สร้าง', 'เหตุผล', 'เชิง', 'อำนาจ', 'มา', 'ป้ายสี', 'คน', ' ', 'โดย', 'ไม่', 'คำนึง', 'ความสามารถ', ' ', 'นโยบาย', ' ', 'หรือ', 'ใดๆ', ' ', 'ของ', 'บุคคล', 'นั้นๆ']"
1980969988472389649,twitter,post,https://x.com/retiaa2/status/1980969988472389649,text,2025-10-22T12:10:24.000Z,selenium_x_scraper_v1,พอมีข้อมูลให้อ่านไหมคะทำไม ไม่รู้เรื่องนี้เลย คือข่าวไม่ค่อยมีคนเอามาบอกนะ,พอมีข้อมูลให้อ่านไหมคะทำไม ไม่รู้เรื่องนี้เลย คือข่าวไม่ค่อยมีคนเอามาบอกนะ,2025-11-29 08:18:55,"['พอ', 'มี', 'ข้อมูล', 'ให้', 'อ่าน', 'ไหม', 'คะ', 'ทำไม', ' ', 'ไม่', 'รู้เรื่อง', 'นี้', 'เลย', ' ', 'คือ', 'ข่าว', 'ไม่ค่อย', 'มี', 'คน', 'เอา', 'มา', 'บอก', 'นะ']"
1980943886014128266,twitter,post,https://x.com/Popp201988/status/1980943886014128266,text,2025-10-22T10:26:41.000Z,selenium_x_scraper_v1,เขาเป็นผญ. แค่ทางด้านร่างกาย แต่อย่างอื่นคือผช.,เขาเป็นผญ. แค่ทางด้านร่างกาย แต่อย่างอื่นคือผช.,2025-11-29 08:18:55,"['เขา', 'เป็น', 'ผญ.', ' ', 'แค่', 'ทาง', 'ด้าน', 'ร่างกาย', ' ', 'แต่', 'อย่าง', 'อื่น', 'คือ', 'ผช.']"
1980976631431999799,twitter,post,https://x.com/KietChaiyo/status/1980976631431999799,text,2025-10-22T12:36:48.000Z,selenium_x_scraper_v1,ก็นางไม่ได้เข้ามาทำ woman empowering นี่ เขามาเคลียร์พวกถ่วง กัดกินประเทศ,ก็นางไม่ได้เข้ามาทำ woman empowering นี่ เขามาเคลียร์พวกถ่วง กัดกินประเทศ,2025-11-29 08:18:55,"['ก็', 'นาง', 'ไม่', 'ได้', 'เข้ามา', 'ทำ', ' ', 'woman', ' ', 'empowering', ' ', 'นี่', ' ', 'เขา', 'มา', 'เคลียร์', 'พวก', 'ถ่วง', ' ', 'กัด', 'กิน', 'ประเทศ']"
1982580357410259100,twitter,post,https://x.com/SYeoman8417/status/1982580357410259100,text,2025-10-26T22:49:26.000Z,selenium_x_scraper_v1,可到付,可到付,2025-11-29 08:18:55,[]
1981352354227331238,twitter,post,https://x.com/Packet33688/status/1981352354227331238,text,2025-10-23T13:29:47.000Z,selenium_x_scraper_v1,"Let’s see it from at least a Japan media outlet. 
One believes could totally be irrelevant to a government policy. If one beliefs dictates all we call it fascism with dictatorial leader. 

I don’t think Japan is quite there yet. Or so it seems","Let’s see it from at least a Japan media outlet. 
One believes could totally be irrelevant to a government policy. If one beliefs dictates all we call it fascism with dictatorial leader. 

I don’t think Japan is quite there yet. Or so it seems",2025-11-29 08:18:55,"['let', ' ', 's', ' ', 'see', ' ', 'it', ' ', 'from', ' ', 'at', ' ', 'least', ' ', 'a', ' ', 'japan', ' ', 'media', ' ', 'outlet', '.', ' ', 'one', ' ', 'believes', ' ', 'could', ' ', 'totally', ' ', 'be', ' ', 'irrelevant', ' ', 'to', ' ', 'a', ' ', 'government', ' ', 'policy', '.', ' ', 'if', ' ', 'one', ' ', 'beliefs', ' ', 'dictates', ' ', 'all', ' ', 'we', ' ', 'call', ' ', 'it', ' ', 'fascism', ' ', 'with', ' ', 'dictatorial', ' ', 'leader', '.', ' ', 'i', ' ', 'don', ' ', 't', ' ', 'think', ' ', 'japan', ' ', 'is', ' ', 'quite', ' ', 'there', ' ', 'yet', '.', ' ', 'or', ' ', 'so', ' ', 'it', ' ', 'seems']"
