id,platform,platform_type,url,content_type,timestamp,scraper_module,text,raw_text,scrape_date,tokens
1891670506912256503,twitter,post,https://x.com/evil_witch0104/status/1891670506912256503,text,2025-02-18T02:06:09.000Z,selenium_x_scraper_v1,ทุกคนมีสิทธิ์เลือกค่ะ แต่ตัวเองก็ต้องดูแลตัวเองให้สะอาดด้วย ไม่ใช่สภาพเหม็นเหงื่อ ไม่ค่อยอาบน้ำแปรงฟัน ไม่รักษาความสะอาดแต่อยากได้แฟนสวยปานนางฟ้า ตัวหอมขาวสะอาด แถมชี้นิ้วสั่งให้ผู้หญิงไปกำจัดขนนิ้วงี้ ขนหลังงี้ทั้งที่ขนมันคือกลไกธรรมขาติของร่างกายมัรไม่ได้น่าเกลียดอะไนขนาดนั้น,ทุกคนมีสิทธิ์เลือกค่ะ แต่ตัวเองก็ต้องดูแลตัวเองให้สะอาดด้วย ไม่ใช่สภาพเหม็นเหงื่อ ไม่ค่อยอาบน้ำแปรงฟัน ไม่รักษาความสะอาดแต่อยากได้แฟนสวยปานนางฟ้า ตัวหอมขาวสะอาด แถมชี้นิ้วสั่งให้ผู้หญิงไปกำจัดขนนิ้วงี้ ขนหลังงี้ทั้งที่ขนมันคือกลไกธรรมขาติของร่างกายมัรไม่ได้น่าเกลียดอะไนขนาดนั้น,2025-11-08 17:05:14,"['ทุกคน', 'มีสิทธิ์', 'เลือก', 'ค่ะ', ' ', 'แต่', 'ตัวเอง', 'ก็', 'ต้อง', 'ดูแลตัวเอง', 'ให้', 'สะอาด', 'ด้วย', ' ', 'ไม่', 'ใช่', 'สภาพ', 'เหม็น', 'เหงื่อ', ' ', 'ไม่ค่อย', 'อาบน้ำ', 'แปรงฟัน', ' ', 'ไม่', 'รักษา', 'ความสะอาด', 'แต่', 'อยากได้', 'แฟน', 'สวย', 'ปาน', 'นางฟ้า', ' ', 'ตัว', 'หอม', 'ขาวสะอาด', ' ', 'แถม', 'ชี้นิ้ว', 'สั่ง', 'ให้', 'ผู้หญิง', 'ไป', 'กำจัด', 'ขน', 'นิ้ว', 'งี้', ' ', 'ขน', 'หลัง', 'งี้', 'ทั้งที่', 'ขน', 'มัน', 'คือ', 'กลไก', 'ธรรม', 'ขา', 'ติ', 'ของ', 'ร่างกาย', 'มัร', 'ไม่', 'ได้', 'น่าเกลียด', 'อะ', 'ไน', 'ขนาด', 'นั้น']"
1891734234353578025,twitter,post,https://x.com/crta_me/status/1891734234353578025,text,2025-02-18T06:19:22.000Z,selenium_x_scraper_v1,ก็เขาชอบแบบนี้ทำไม่ได้ก็แยกกันไปครับ ไม่ใช่มาด่าผู้ชาย ตรรกะแปลกๆ,ก็เขาชอบแบบนี้ทำไม่ได้ก็แยกกันไปครับ ไม่ใช่มาด่าผู้ชาย ตรรกะแปลกๆ,2025-11-08 17:05:14,"['ก็', 'เขา', 'ชอบ', 'แบบนี้', 'ทำ', 'ไม่', 'ได้', 'ก็', 'แยกกัน', 'ไป', 'ครับ', ' ', 'ไม่', 'ใช่', 'มา', 'ด่า', 'ผู้ชาย', ' ', 'ตรรกะ', 'แปลก', 'ๆ']"
1891564806944997469,twitter,post,https://x.com/crta_me/status/1891564806944997469,text,2025-02-17T19:06:08.000Z,selenium_x_scraper_v1,จะให้เฟียสประสาทแดกแบบป้าเหรอครับ,จะให้เฟียสประสาทแดกแบบป้าเหรอครับ,2025-11-08 17:05:14,"['จะ', 'ให้', 'เฟียส', 'ประสาท', 'แดก', 'แบบ', 'ป้า', 'เหรอ', 'ครับ']"
1891498018819498212,twitter,post,https://x.com/evil_witch0104/status/1891498018819498212,text,2025-02-17T14:40:44.000Z,selenium_x_scraper_v1,อีผู้ชายญี่ปุ่นเคยถึงขนาดเลิกขอเดตกับสาวเพราะนางมีขนนิ้วอ่ะ อิชั้นแบบ WTF เป็นไรมากมั้ยหนุ่ม ละสภาพผู้ชายญี่ปุ่นที่ออกมาพูดว่าชอบสาวแบบผิวเนียนไร้ขน สวยแบบนั้น แบบนี้คิดดูว่ามีกี่ % ที่ดูแลตัวเองอ่ะ,อีผู้ชายญี่ปุ่นเคยถึงขนาดเลิกขอเดตกับสาวเพราะนางมีขนนิ้วอ่ะ อิชั้นแบบ WTF เป็นไรมากมั้ยหนุ่ม ละสภาพผู้ชายญี่ปุ่นที่ออกมาพูดว่าชอบสาวแบบผิวเนียนไร้ขน สวยแบบนั้น แบบนี้คิดดูว่ามีกี่ % ที่ดูแลตัวเองอ่ะ,2025-11-08 17:05:14,"['อี', 'ผู้ชาย', 'ญี่ปุ่น', 'เคย', 'ถึงขนาด', 'เลิก', 'ขอ', 'เดต', 'กับ', 'สาว', 'เพราะ', 'นาง', 'มี', 'ขน', 'นิ้ว', 'อ่ะ', ' ', 'อิ', 'ชั้น', 'แบบ', ' ', 'wtf', ' ', 'เป็นไร', 'มาก', 'มั้ย', 'หนุ่ม', ' ', 'ละ', 'สภาพ', 'ผู้ชาย', 'ญี่ปุ่น', 'ที่', 'ออกมา', 'พูดว่า', 'ชอบ', 'สาว', 'แบบ', 'ผิวเนียน', 'ไร้', 'ขน', ' ', 'สวย', 'แบบ', 'นั้น', ' ', 'แบบนี้', 'คิดดู', 'ว่า', 'มี', 'กี่', ' ', 'ที่', 'ดูแลตัวเอง', 'อ่ะ']"
1891564599037562962,twitter,post,https://x.com/crta_me/status/1891564599037562962,text,2025-02-17T19:05:18.000Z,selenium_x_scraper_v1,ผู้ชายก็มีสิทธิ์เลือกไหมครับ,ผู้ชายก็มีสิทธิ์เลือกไหมครับ,2025-11-08 17:05:14,"['ผู้ชาย', 'ก็', 'มีสิทธิ์', 'เลือก', 'ไหม', 'ครับ']"
1891156765707735470,twitter,post,https://x.com/premyuda_pt/status/1891156765707735470,text,2025-02-16T16:04:43.000Z,selenium_x_scraper_v1,เห็นดำๆปะ ใช่ค่ะ ถอดเกงในละ5555 เมาง่าาา อ่ะชนๆๆ ,เห็นดำๆปะ ใช่ค่ะ ถอดเกงในละ5555 เมาง่าาา อ่ะชนๆๆ ,2025-11-08 17:05:14,"['เห็น', 'ดำ', 'ๆ', 'ปะ', ' ', 'ใช่', 'ค่ะ', ' ', 'ถอด', 'เก', 'ง', 'ใน', 'ละ', 'หัวเราะ', ' ', 'เมา', 'ง่า', 'าา', ' ', 'อ่ะ', 'ชน', 'ๆๆ']"
1891177911140434178,twitter,post,https://x.com/crta_me/status/1891177911140434178,text,2025-02-16T17:28:45.000Z,selenium_x_scraper_v1,เคยเจอตัวจริงแล้วทั้งอ้วนทั้งดำสิวเต็มหน้า รูปในเอกนี่แต่งเอาทั้งนั้น,เคยเจอตัวจริงแล้วทั้งอ้วนทั้งดำสิวเต็มหน้า รูปในเอกนี่แต่งเอาทั้งนั้น,2025-11-08 17:05:14,"['เคย', 'เจอ', 'ตัวจริง', 'แล้ว', 'ทั้ง', 'อ้วน', 'ทั้ง', 'ดำ', 'สิว', 'เต็ม', 'หน้า', ' ', 'รูป', 'ใน', 'เอก', 'นี่', 'แต่ง', 'เอา', 'ทั้งนั้น']"
1884294199362900177,twitter,post,https://x.com/poppyne612/status/1884294199362900177,text,2025-01-28T17:35:20.000Z,selenium_x_scraper_v1,คนยุคนี้มันสะกดผิดเยอะจังง่ะ หรือยุคไหนๆก็ผิด คือมันผิดแบบ การศึกษาขั้นพื้นฐานเข้าไม่ถึง เช่น โรงศพ ร่องเรือ กุจะกรี๊ด,คนยุคนี้มันสะกดผิดเยอะจังง่ะ หรือยุคไหนๆก็ผิด คือมันผิดแบบ การศึกษาขั้นพื้นฐานเข้าไม่ถึง เช่น โรงศพ ร่องเรือ กุจะกรี๊ด,2025-11-08 17:05:14,"['คน', 'ยุค', 'นี้', 'มัน', 'สะกด', 'ผิด', 'เยอะ', 'จัง', 'ง่ะ', ' ', 'หรือ', 'ยุค', 'ไหน', 'ๆ', 'ก็', 'ผิด', ' ', 'คือ', 'มัน', 'ผิด', 'แบบ', ' ', 'การศึกษา', 'ขั้นพื้นฐาน', 'เข้า', 'ไม่', 'ถึง', ' ', 'เช่น', ' ', 'โรง', 'ศพ', ' ', 'ร่อง', 'เรือ', ' ', 'กุ', 'จะ', 'กรี๊ด']"
1885378625580785756,twitter,post,https://x.com/crta_me/status/1885378625580785756,text,2025-01-31T17:24:27.000Z,selenium_x_scraper_v1,แล้วเขาไปทำพ่อใครตายรึเปล่า ถ้ายังพอรู้ความหมายก็มองข้ามไปก็ พวกประสาทใน x มาแนวนี้กันหมดสุมหัวห่าเรื่องด่าขาวบ้าน,แล้วเขาไปทำพ่อใครตายรึเปล่า ถ้ายังพอรู้ความหมายก็มองข้ามไปก็ พวกประสาทใน x มาแนวนี้กันหมดสุมหัวห่าเรื่องด่าขาวบ้าน,2025-11-08 17:05:14,"['แล้ว', 'เขา', 'ไป', 'ทำ', 'พ่อ', 'ใคร', 'ตาย', 'รึเปล่า', ' ', 'ถ้า', 'ยัง', 'พอ', 'รู้', 'ความหมาย', 'ก็', 'มองข้าม', 'ไป', 'ก็', ' ', 'พวก', 'ประสาท', 'ใน', ' ', 'x', ' ', 'มา', 'แนว', 'นี้', 'กัน', 'หมด', 'สุมหัว', 'ห่า', 'เรื่อง', 'ด่า', 'ขาว', 'บ้าน']"
1884900985870680306,twitter,post,https://x.com/getar125/status/1884900985870680306,text,2025-01-30T09:46:29.000Z,selenium_x_scraper_v1,มีเพื่อนคนนึง มันไปแฝงตัวอยู่กลุ่มสลิ่ม แรกๆ ชอบแคปโพสสลิ่มมาให้เพื่อนเอาฮา ไปๆ มาๆ แม่งเชื่อสลิ่มซะเอง คือการเอาตัวไปอยู่ในสภาพแวดล้อมที่มีคนคิดเหมือนๆ กัน ได้รับชุดข้อมูลเดิมๆ ซ้ำๆ มันทำให้ความคิดคนมันเป๋ได้อะ ไม่งั้นพวกปฏิบัติการ IO มันจะยังมีอยู่เหรอ,มีเพื่อนคนนึง มันไปแฝงตัวอยู่กลุ่มสลิ่ม แรกๆ ชอบแคปโพสสลิ่มมาให้เพื่อนเอาฮา ไปๆ มาๆ แม่งเชื่อสลิ่มซะเอง คือการเอาตัวไปอยู่ในสภาพแวดล้อมที่มีคนคิดเหมือนๆ กัน ได้รับชุดข้อมูลเดิมๆ ซ้ำๆ มันทำให้ความคิดคนมันเป๋ได้อะ ไม่งั้นพวกปฏิบัติการ IO มันจะยังมีอยู่เหรอ,2025-11-08 17:05:14,"['มี', 'เพื่อน', 'คน', 'นึง', ' ', 'มัน', 'ไป', 'แฝงตัว', 'อยู่', 'กลุ่ม', 'สลิ่ม', ' ', 'แรก', 'ๆ', ' ', 'ชอบ', 'แคป', 'โพส', 'สลิ่ม', 'มา', 'ให้', 'เพื่อน', 'เอา', 'หัวเราะ', ' ', 'ไปๆ มาๆ', ' ', 'แม่', 'ง', 'เชื่อ', 'สลิ่ม', 'ซะ', 'เอง', ' ', 'คือ', 'การ', 'เอา', 'ตัว', 'ไป', 'อยู่', 'ใน', 'สภาพแวดล้อม', 'ที่', 'มี', 'คน', 'คิด', 'เหมือน', 'ๆ', ' ', 'กัน', ' ', 'ได้รับ', 'ชุด', 'ข้อมูล', 'เดิม', 'ๆ', ' ', 'ซ้ำๆ', ' ', 'มัน', 'ทำให้', 'ความคิด', 'คน', 'มัน', 'เป๋', 'ได้', 'อะ', ' ', 'ไม่งั้น', 'พวก', 'ปฏิบัติการ', ' ', 'io', ' ', 'มัน', 'จะ', 'ยังมี', 'อยู่', 'เหรอ']"
1885040362965917746,twitter,post,https://x.com/crta_me/status/1885040362965917746,text,2025-01-30T19:00:19.000Z,selenium_x_scraper_v1,แต่ก็ดีกว่าพวกสามกีบไร้อนาคตนะครับ,แต่ก็ดีกว่าพวกสามกีบไร้อนาคตนะครับ,2025-11-08 17:05:14,"['แต่', 'ก็', 'ดีกว่า', 'พวก', 'สาม', 'กีบ', 'ไร้', 'อนาคต', 'นะ', 'ครับ']"
1884876440560455877,twitter,post,https://x.com/elurvia4/status/1884876440560455877,text,2025-01-30T08:08:57.000Z,selenium_x_scraper_v1,เดินผ่านกลุ่ม ผช กลุ่มนึงในมอ แม่งตะโกนมาว่า ทำไมน่าเย็ดจัง  นี่เลยหันไปมองสรุปมันมองนี่ทั้งโต๊ะ  น่ากัว,เดินผ่านกลุ่ม ผช กลุ่มนึงในมอ แม่งตะโกนมาว่า ทำไมน่าเย็ดจัง  นี่เลยหันไปมองสรุปมันมองนี่ทั้งโต๊ะ  น่ากัว,2025-11-08 17:05:14,"['เดินผ่าน', 'กลุ่ม', ' ', 'ผช', ' ', 'กลุ่ม', 'นึง', 'ใน', 'มอ', ' ', 'แม่', 'ง', 'ตะโกน', 'มา', 'ว่า', ' ', 'ทำไม', 'น่า', 'เย็ด', 'จัง', ' ', 'นี่', 'เลย', 'หันไป', 'มอง', 'สรุป', 'มัน', 'มอง', 'นี่', 'ทั้ง', 'โต๊ะ', ' ', 'น่า', 'กัว']"
1885040010786988207,twitter,post,https://x.com/crta_me/status/1885040010786988207,text,2025-01-30T18:58:55.000Z,selenium_x_scraper_v1,แต่งเรื่องเพราะอยากได้รับความสนใจเหรอครับ,แต่งเรื่องเพราะอยากได้รับความสนใจเหรอครับ,2025-11-08 17:05:14,"['แต่งเรื่อง', 'เพราะ', 'อยาก', 'ได้รับ', 'ความสนใจ', 'เหรอ', 'ครับ']"
1884311437226697014,twitter,post,https://x.com/imajukq/status/1884311437226697014,text,2025-01-28T18:43:50.000Z,selenium_x_scraper_v1,งงที่แบบว่ายอมให้ ผช.จับตัวยอมให้ผช ถึงเนื้อถึงตัว = หมดเสน่ห์ ดูไม่แพงสรุปตัดสินคุณค่าผู้หญิงจากการให้ผู้ชายจับตัวหรอ บางคนพิมแล้วคิดหรือป่าวว่าที่ตัวเองพิมออกมาคือแกกำลังกดผู้หญิงอยู่นะ สรุปแล้วคุณค่าผูหญิงอยู่ตรงไหน กลายเป็นกดผู้หญิงเพราะอินเกิน,งงที่แบบว่ายอมให้ ผช.จับตัวยอมให้ผช ถึงเนื้อถึงตัว = หมดเสน่ห์ ดูไม่แพงสรุปตัดสินคุณค่าผู้หญิงจากการให้ผู้ชายจับตัวหรอ บางคนพิมแล้วคิดหรือป่าวว่าที่ตัวเองพิมออกมาคือแกกำลังกดผู้หญิงอยู่นะ สรุปแล้วคุณค่าผูหญิงอยู่ตรงไหน กลายเป็นกดผู้หญิงเพราะอินเกิน,2025-11-08 17:05:14,"['งง', 'ที่', 'แบบ', 'ว่า', 'ยอมให้', ' ', 'ผช.', 'จับตัว', 'ยอมให้', 'ผช', ' ', 'ถึง', 'เนื้อ', 'ถึง', 'ตัว', ' ', 'หมด', 'เสน่ห์', ' ', 'ดู', 'ไม่', 'แพง', 'สรุป', 'ตัดสิน', 'คุณค่า', 'ผู้หญิง', 'จาก', 'การ', 'ให้', 'ผู้ชาย', 'จับตัว', 'หรอ', ' ', 'บางคน', 'พิม', 'แล้ว', 'คิด', 'หรือ', 'ป่าว', 'ว่าที่', 'ตัวเอง', 'พิม', 'ออกมา', 'คือ', 'แก', 'กำลัง', 'กด', 'ผู้หญิง', 'อยู่', 'นะ', ' ', 'สรุป', 'แล้ว', 'คุณค่า', 'ผู', 'หญิง', 'อยู่', 'ตรงไหน', ' ', 'กลายเป็น', 'กด', 'ผู้หญิง', 'เพราะ', 'อิน', 'เกิน']"
1884897828327272847,twitter,post,https://x.com/imajukq/status/1884897828327272847,text,2025-01-30T09:33:56.000Z,selenium_x_scraper_v1,คนค่ะพี่ไม่ใช่ปลาตามตลาดสดเนอะ,คนค่ะพี่ไม่ใช่ปลาตามตลาดสดเนอะ,2025-11-08 17:05:14,"['คน', 'ค่ะ', 'พี่', 'ไม่', 'ใช่', 'ปลา', 'ตาม', 'ตลาดสด', 'เนอะ']"
1885039752891789617,twitter,post,https://x.com/crta_me/status/1885039752891789617,text,2025-01-30T18:57:54.000Z,selenium_x_scraper_v1,ระหว่างปลาที่โดนจับจนเนื้อเละแล้วกับปลาที่สภาพดี ทั้งคู่เป็นปลาเหมือนกัน แต่สุดท้ายคนเราก็เลือกกินปลาสภาพดี ผู้หญิงง่ายๆใครก็ชอบ แต่ไม่มีใครอยากได้เป็นแม่ของลูก,ระหว่างปลาที่โดนจับจนเนื้อเละแล้วกับปลาที่สภาพดี ทั้งคู่เป็นปลาเหมือนกัน แต่สุดท้ายคนเราก็เลือกกินปลาสภาพดี ผู้หญิงง่ายๆใครก็ชอบ แต่ไม่มีใครอยากได้เป็นแม่ของลูก,2025-11-08 17:05:14,"['ระหว่าง', 'ปลา', 'ที่', 'โดน', 'จับ', 'จน', 'เนื้อ', 'เละ', 'แล้ว', 'กับ', 'ปลา', 'ที่', 'สภาพ', 'ดี', ' ', 'ทั้งคู่', 'เป็น', 'ปลา', 'เหมือนกัน', ' ', 'แต่', 'สุดท้าย', 'คนเรา', 'ก็', 'เลือก', 'กิน', 'ปลา', 'สภาพ', 'ดี', ' ', 'ผู้หญิง', 'ง่ายๆ', 'ใคร', 'ก็', 'ชอบ', ' ', 'แต่', 'ไม่', 'มี', 'ใคร', 'อยากได้', 'เป็น', 'แม่', 'ของ', 'ลูก']"
1882125305093214660,twitter,post,https://x.com/crta_me/status/1882125305093214660,text,2025-01-22T17:56:55.000Z,selenium_x_scraper_v1,ไม่คิดกลับกันว่าพ่อแม่ไม่อยากให้ลูกตัวเองเป็นไอ้ขี้แพ้มั่งเหรอครับ พ่อแม่ที่ประสบความสำเร็จก็มีเยอะแยะไป แต่เด็กสมัยนี้ชอบเล่นบทเหยื่อ ไม่เคยโทษตัวเองไม่ว่าจะเรื่องอะไร,ไม่คิดกลับกันว่าพ่อแม่ไม่อยากให้ลูกตัวเองเป็นไอ้ขี้แพ้มั่งเหรอครับ พ่อแม่ที่ประสบความสำเร็จก็มีเยอะแยะไป แต่เด็กสมัยนี้ชอบเล่นบทเหยื่อ ไม่เคยโทษตัวเองไม่ว่าจะเรื่องอะไร,2025-11-08 17:05:14,"['ไม่', 'คิด', 'กลับกัน', 'ว่า', 'พ่อแม่', 'ไม่', 'อยาก', 'ให้', 'ลูก', 'ตัวเอง', 'เป็น', 'ไอ้', 'ขี้', 'แพ้', 'มั่ง', 'เหรอ', 'ครับ', ' ', 'พ่อแม่', 'ที่', 'ประสบความสำเร็จ', 'ก็', 'มี', 'เยอะแยะ', 'ไป', ' ', 'แต่', 'เด็ก', 'สมัยนี้', 'ชอบ', 'เล่น', 'บท', 'เหยื่อ', ' ', 'ไม่', 'เคย', 'โทษ', 'ตัวเอง', 'ไม่', 'ว่า', 'จะ', 'เรื่อง', 'อะไร']"
1881981394550936013,twitter,post,https://x.com/wshnn_/status/1881981394550936013,text,2025-01-22T08:25:04.000Z,selenium_x_scraper_v1,ขอบคุณที่สังคมนี้ไม่ได้หาผู้ใหญ่แบบนี้ได้ทั่วไปนะคะ แก่แต่มึง ดีแต่มึงนั่นแหละ,ขอบคุณที่สังคมนี้ไม่ได้หาผู้ใหญ่แบบนี้ได้ทั่วไปนะคะ แก่แต่มึง ดีแต่มึงนั่นแหละ,2025-11-08 17:05:14,"['ขอบคุณ', 'ที่', 'สังคม', 'นี้', 'ไม่', 'ได้', 'หา', 'ผู้ใหญ่', 'แบบนี้', 'ได้', 'ทั่วไป', 'นะคะ', ' ', 'แก่', 'แต่', 'มึง', ' ', 'ดีแต่', 'มึง', 'นั่นแหละ']"
1882059979450200542,twitter,post,https://x.com/wshnn_/status/1882059979450200542,text,2025-01-22T13:37:20.000Z,selenium_x_scraper_v1,ไม่เป็นไรค่ะ จะเก็บเงินเยอะๆไว้ทำกายภาพ ขอบคุณที่หวังดี แต่กองไว้ตรงนั้น,ไม่เป็นไรค่ะ จะเก็บเงินเยอะๆไว้ทำกายภาพ ขอบคุณที่หวังดี แต่กองไว้ตรงนั้น,2025-11-08 17:05:14,"['ไม่เป็นไร', 'ค่ะ', ' ', 'จะ', 'เก็บ', 'เงิน', 'เยอะ', 'ๆ', 'ไว้', 'ทำ', 'กายภาพ', ' ', 'ขอบคุณ', 'ที่', 'หวังดี', ' ', 'แต่', 'กอง', 'ไว้', 'ตรงนั้น']"
1882116691431473251,twitter,post,https://x.com/crta_me/status/1882116691431473251,text,2025-01-22T17:22:41.000Z,selenium_x_scraper_v1,แค่ออกไปแตะหญ้าบ้าง วิ่งเบาๆวันละ 30นาทีก็พอแล้วครับ,แค่ออกไปแตะหญ้าบ้าง วิ่งเบาๆวันละ 30นาทีก็พอแล้วครับ,2025-11-08 17:05:14,"['แค่', 'ออก', 'ไป', 'แตะ', 'หญ้า', 'บ้าง', ' ', 'วิ่ง', 'เบา', 'ๆ', 'วัน', 'ละ', ' ', '30', 'นาที', 'ก็', 'พอแล้ว', 'ครับ']"
