id,platform,platform_type,url,content_type,timestamp,scraper_module,text,raw_text,scrape_date,tokens
1955956229823713772,twitter,post,https://x.com/crta_me/status/1955956229823713772,text,2025-08-14T11:34:39.000Z,selenium_x_scraper_v1,หมายถึงพี่ทำอะไรด้วยตัวเองไม่ได้เลยใช่ไหมคะ ก็เลยรอเงินจากผู้ชาย และด่าผู้ชายในทวิตขำๆ นี่ถือเป็นขี้แพ้ไหมคะ,หมายถึงพี่ทำอะไรด้วยตัวเองไม่ได้เลยใช่ไหมคะ ก็เลยรอเงินจากผู้ชาย และด่าผู้ชายในทวิตขำๆ นี่ถือเป็นขี้แพ้ไหมคะ,2025-11-08 17:05:14,"['หมายถึง', 'พี่', 'ทำ', 'อะไร', 'ด้วยตัวเอง', 'ไม่', 'ได้', 'เลย', 'ใช่ไหม', 'คะ', ' ', 'ก็', 'เลย', 'รอ', 'เงิน', 'จาก', 'ผู้ชาย', ' ', 'และ', 'ด่า', 'ผู้ชาย', 'ใน', 'ทวิ', 'ต', 'ขำ', 'ๆ', ' ', 'นี่', 'ถือเป็น', 'ขี้', 'แพ้', 'ไหม', 'คะ']"
1955950509719961743,twitter,post,https://x.com/folder022/status/1955950509719961743,text,2025-08-14T11:11:55.000Z,selenium_x_scraper_v1,รู้ป่ะว่าคนที่เมนชั่นหลายเมนชั่นแสดงว่าเป็นพวกขี้แพ้กำลังโมโหแต่ไม่มีปัญญาทำอะไร,รู้ป่ะว่าคนที่เมนชั่นหลายเมนชั่นแสดงว่าเป็นพวกขี้แพ้กำลังโมโหแต่ไม่มีปัญญาทำอะไร,2025-11-08 17:05:14,"['รู้', 'ป่ะ', 'ว่า', 'คน', 'ที่', 'เมน', 'ชั่น', 'หลาย', 'เมน', 'ชั่น', 'แสดงว่า', 'เป็น', 'พวก', 'ขี้', 'แพ้', 'กำลัง', 'โมโห', 'แต่', 'ไม่', 'มี', 'ปัญญา', 'ทำ', 'อะไร']"
1955951543288782978,twitter,post,https://x.com/crta_me/status/1955951543288782978,text,2025-08-14T11:16:02.000Z,selenium_x_scraper_v1,คล้ายๆคนที่โพสด่าคนอื่นทุกวันในทวิตไหมคะ,คล้ายๆคนที่โพสด่าคนอื่นทุกวันในทวิตไหมคะ,2025-11-08 17:05:14,"['คล้ายๆ', 'คน', 'ที่', 'โพส', 'ด่า', 'คนอื่น', 'ทุกวัน', 'ใน', 'ทวิ', 'ต', 'ไหม', 'คะ']"
1955597723392229598,twitter,post,https://x.com/folder022/status/1955597723392229598,text,2025-08-13T11:50:05.000Z,selenium_x_scraper_v1,แอบอยากสุ่มสมัครงานไปอาสาเหลาดินสอให้ผู้ชายหน้าม่อชอบวางท่าพูดจาหมาไม่แดกในออฟฟิสแล้วแกล้งสะดุดล้มตอนยื่นให้เลยเผลอแทงไปที่ควยมันอะ <3 this is my เสน่ห์,แอบอยากสุ่มสมัครงานไปอาสาเหลาดินสอให้ผู้ชายหน้าม่อชอบวางท่าพูดจาหมาไม่แดกในออฟฟิสแล้วแกล้งสะดุดล้มตอนยื่นให้เลยเผลอแทงไปที่ควยมันอะ <3 this is my เสน่ห์,2025-11-08 17:05:14,"['แอบ', 'อยาก', 'สุ่ม', 'สมัครงาน', 'ไป', 'อาสา', 'เหลา', 'ดินสอ', 'ให้', 'ผู้ชาย', 'หน้า', 'ม่อ', 'ชอบ', 'วางท่า', 'พูดจา', 'หมา', 'ไม่', 'แดก', 'ใน', 'ออฟ', 'ฟิส', 'แล้ว', 'แกล้ง', 'สะดุด', 'ล้ม', 'ตอน', 'ยื่น', 'ให้', 'เลย', 'เผลอ', 'แทง', 'ไป', 'ที่', 'ควย', 'มัน', 'อะ', ' ', '3', ' ', 'this', ' ', 'is', ' ', 'my', ' ', 'เสน่ห์']"
1955944254469202147,twitter,post,https://x.com/crta_me/status/1955944254469202147,text,2025-08-14T10:47:04.000Z,selenium_x_scraper_v1,โรคจิตไหมคะ,โรคจิตไหมคะ,2025-11-08 17:05:14,"['โรคจิต', 'ไหม', 'คะ']"
1955606672430510219,twitter,post,https://x.com/folder022/status/1955606672430510219,text,2025-08-13T12:25:38.000Z,selenium_x_scraper_v1, นึกถึงผัวตอนคุยกับทอมเด็กที่ทำงานแล้วมันพูดแต่เรื่องกินเหล้า หลีผู้หญิง นอกใจเมีย แล้วมันตัดบทชวนไปออกกำลังกาย, นึกถึงผัวตอนคุยกับทอมเด็กที่ทำงานแล้วมันพูดแต่เรื่องกินเหล้า หลีผู้หญิง นอกใจเมีย แล้วมันตัดบทชวนไปออกกำลังกาย,2025-11-08 17:05:14,"['นึกถึง', 'ผัว', 'ตอน', 'คุย', 'กับ', 'ทอม', 'เด็ก', 'ที่ทำงาน', 'แล้ว', 'มัน', 'พูด', 'แต่', 'เรื่อง', 'กิน', 'เหล้า', ' ', 'หลี', 'ผู้หญิง', ' ', 'นอกใจ', 'เมีย', ' ', 'แล้ว', 'มัน', 'ตัดบท', 'ชวน', 'ไป', 'ออกกำลังกาย']"
1955944164417528189,twitter,post,https://x.com/crta_me/status/1955944164417528189,text,2025-08-14T10:46:43.000Z,selenium_x_scraper_v1,ด่าผัวเหมือนด่าชายแท้เลยค่ะ,ด่าผัวเหมือนด่าชายแท้เลยค่ะ,2025-11-08 17:05:14,"['ด่า', 'ผัว', 'เหมือน', 'ด่า', 'ชาย', 'แท้', 'เลย', 'ค่ะ']"
1955613228563943507,twitter,post,https://x.com/folder022/status/1955613228563943507,text,2025-08-13T12:51:41.000Z,selenium_x_scraper_v1,ดี ไม่พูดเยอะ,ดี ไม่พูดเยอะ,2025-11-08 17:05:14,"['ดี', ' ', 'ไม่', 'พูด', 'เยอะ']"
1955944053499105516,twitter,post,https://x.com/crta_me/status/1955944053499105516,text,2025-08-14T10:46:16.000Z,selenium_x_scraper_v1,ใช้ของถูกๆจะดีเหรอคะ,ใช้ของถูกๆจะดีเหรอคะ,2025-11-08 17:05:14,"['ใช้', 'ของ', 'ถูกๆ', 'จะ', 'ดี', 'เหรอ', 'คะ']"
1955613316988182704,twitter,post,https://x.com/folder022/status/1955613316988182704,text,2025-08-13T12:52:02.000Z,selenium_x_scraper_v1,เป็นแบรนด์ที่ทำสินค้าออกมาดีมาก แต่เจ้าของแบรนด์เพี้ยนนิดๆ,เป็นแบรนด์ที่ทำสินค้าออกมาดีมาก แต่เจ้าของแบรนด์เพี้ยนนิดๆ,2025-11-08 17:05:14,"['เป็น', 'แบรนด์', 'ที่', 'ทำ', 'สินค้า', 'ออกมา', 'ดีมาก', ' ', 'แต่', 'เจ้าของ', 'แบรนด์', 'เพี้ยน', 'นิดๆ']"
1955943954727518640,twitter,post,https://x.com/crta_me/status/1955943954727518640,text,2025-08-14T10:45:53.000Z,selenium_x_scraper_v1,รู้ได้ไงคะเคยเจอเจ้าของเหรอ,รู้ได้ไงคะเคยเจอเจ้าของเหรอ,2025-11-08 17:05:14,"['รู้', 'ได้', 'ไง', 'คะ', 'เคย', 'เจอ', 'เจ้าของ', 'เหรอ']"
1955625367005434126,twitter,post,https://x.com/folder022/status/1955625367005434126,text,2025-08-13T13:39:55.000Z,selenium_x_scraper_v1,ชั้นจะเอาลูกเกดที่คัดออกมาจากคอนเฟคคาราแมวไปแขวนไว้ให้กระรอกอ้วนกิน แต่มันจะลงมาที่ต้นไม้ชั้นแล้วกิ่งหักอีกไหมอีอ้วน,ชั้นจะเอาลูกเกดที่คัดออกมาจากคอนเฟคคาราแมวไปแขวนไว้ให้กระรอกอ้วนกิน แต่มันจะลงมาที่ต้นไม้ชั้นแล้วกิ่งหักอีกไหมอีอ้วน,2025-11-08 17:05:14,"['ชั้น', 'จะ', 'เอา', 'ลูกเกด', 'ที่', 'คัดออก', 'มาจาก', 'คอน', 'เฟค', 'คา', 'รา', 'แมว', 'ไป', 'แขวน', 'ไว้', 'ให้', 'กระรอก', 'อ้วน', 'กิน', ' ', 'แต่', 'มัน', 'จะ', 'ลงมา', 'ที่', 'ต้นไม้', 'ชั้น', 'แล้ว', 'กิ่ง', 'หัก', 'อีก', 'ไหม', 'อี', 'อ้วน']"
1955943912385962218,twitter,post,https://x.com/crta_me/status/1955943912385962218,text,2025-08-14T10:45:43.000Z,selenium_x_scraper_v1,กระรอกน่าจะผอมกว่าพี่ไหมคะ,กระรอกน่าจะผอมกว่าพี่ไหมคะ,2025-11-08 17:05:14,"['กระรอก', 'น่าจะ', 'ผอม', 'กว่า', 'พี่', 'ไหม', 'คะ']"
1955900394800079229,twitter,post,https://x.com/folder022/status/1955900394800079229,text,2025-08-14T07:52:47.000Z,selenium_x_scraper_v1,จริง เดี๋ยวนี้คนใช้น่าหน้าสลับกันเยอะมาก โครตหน้ารำคาญ อยากให้คัดหน้าน่า จำนวน 20 น่ากระดาษอะ,จริง เดี๋ยวนี้คนใช้น่าหน้าสลับกันเยอะมาก โครตหน้ารำคาญ อยากให้คัดหน้าน่า จำนวน 20 น่ากระดาษอะ,2025-11-08 17:05:14,"['จริง', ' ', 'เดี๋ยวนี้', 'คนใช้', 'น่า', 'หน้า', 'สลับ', 'กัน', 'เยอะ', 'มาก', ' ', 'โค', 'รต', 'หน้า', 'รำคาญ', ' ', 'อยาก', 'ให้', 'คัด', 'หน้า', 'น่า', ' ', 'จำนวน', ' ', '20', ' ', 'น่า', 'กระดาษ', 'อะ']"
1955943761579794816,twitter,post,https://x.com/crta_me/status/1955943761579794816,text,2025-08-14T10:45:07.000Z,selenium_x_scraper_v1,น่ารำคาญ ยังพิพม์ผิดเลยงะ,น่ารำคาญ ยังพิพม์ผิดเลยงะ,2025-11-08 17:05:14,"['น่ารำคาญ', ' ', 'ยัง', 'พิพม์', 'ผิด', 'เลย', 'งะ']"
1955912032001380393,twitter,post,https://x.com/folder022/status/1955912032001380393,text,2025-08-14T08:39:02.000Z,selenium_x_scraper_v1,จะฝนตกทั้งวันทั้งคืนหรือร้อนหีระเบิดกูก็เกลียดพอกัน,จะฝนตกทั้งวันทั้งคืนหรือร้อนหีระเบิดกูก็เกลียดพอกัน,2025-11-08 17:05:14,"['จะ', 'ฝนตก', 'ทั้งวันทั้งคืน', 'หรือ', 'ร้อน', 'หี', 'ระเบิด', 'กู', 'ก็', 'เกลียด', 'พอกัน']"
1955860400492441815,twitter,post,https://x.com/ninnin_fomost/status/1955860400492441815,text,2025-08-14T05:13:52.000Z,selenium_x_scraper_v1,อย่างน้อยเขาก้มีความสามารถในการพูดภาษานะคะ ฝรั่งเขาถึงสนใจ แล้วผญ.ที่มาขายตัว ก้มี 2 ประเภทไงคะ 1.เขาไม่มีเงินจริงๆ ถึงมาทำอะไรแบบนี้ 2.เขาง่าย ก้แค่นั้นอะค่ะ แล้วทำไมทีหนูเหมารวมด่าผช.พี่ก้ดิ้นจังอ่าา หรือพี่ก้รับไม่ได้เหมือนกัน,อย่างน้อยเขาก้มีความสามารถในการพูดภาษานะคะ ฝรั่งเขาถึงสนใจ แล้วผญ.ที่มาขายตัว ก้มี 2 ประเภทไงคะ 1.เขาไม่มีเงินจริงๆ ถึงมาทำอะไรแบบนี้ 2.เขาง่าย ก้แค่นั้นอะค่ะ แล้วทำไมทีหนูเหมารวมด่าผช.พี่ก้ดิ้นจังอ่าา หรือพี่ก้รับไม่ได้เหมือนกัน,2025-11-08 17:05:14,"['อย่าง', 'น้อย', 'เขา', 'ก้', 'มี', 'ความสามารถ', 'ใน', 'การ', 'พูด', 'ภาษา', 'นะคะ', ' ', 'ฝรั่ง', 'เขา', 'ถึง', 'สนใจ', ' ', 'แล้ว', 'ผญ.', 'ที่มา', 'ขายตัว', ' ', 'ก้', 'มี', ' ', '2', ' ', 'ประเภท', 'ไง', 'คะ', ' ', '1', '.', 'เขา', 'ไม่', 'มีเงิน', 'จริงๆ', ' ', 'ถึง', 'มา', 'ทำ', 'อะไร', 'แบบนี้', ' ', '2', '.', 'เขา', 'ง่าย', ' ', 'ก้', 'แค่นั้น', 'อะ', 'ค่ะ', ' ', 'แล้ว', 'ทำไม', 'ที', 'หนู', 'เหมา', 'รวม', 'ด่า', 'ผช.', 'พี่', 'ก้', 'ดิ้น', 'จัง', 'อ่า', 'า', ' ', 'หรือ', 'พี่', 'ก้', 'รับ', 'ไม่', 'ได้', 'เหมือนกัน']"
1955862104172630255,twitter,post,https://x.com/crta_me/status/1955862104172630255,text,2025-08-14T05:20:38.000Z,selenium_x_scraper_v1,แล้วทำไมคุณน้องดิ้นเฉพาะตอนที่ผู้หญิงโดนเหมารวมอะครับ ทำไมตอนผู้ชายโดนไม่เห็นดิ้นเลยนี่งง ?,แล้วทำไมคุณน้องดิ้นเฉพาะตอนที่ผู้หญิงโดนเหมารวมอะครับ ทำไมตอนผู้ชายโดนไม่เห็นดิ้นเลยนี่งง ?,2025-11-08 17:05:14,"['แล้ว', 'ทำไม', 'คุณ', 'น้อง', 'ดิ้น', 'เฉพาะ', 'ตอนที่', 'ผู้หญิง', 'โดน', 'เหมา', 'รวม', 'อะ', 'ครับ', ' ', 'ทำไม', 'ตอน', 'ผู้ชาย', 'โดน', 'ไม่', 'เห็น', 'ดิ้น', 'เลย', 'นี่', 'งง', ' ', '?']"
1955858359984513407,twitter,post,https://x.com/ninnin_fomost/status/1955858359984513407,text,2025-08-14T05:05:45.000Z,selenium_x_scraper_v1,แน่นอนค่ะว่าไม่ แต่พี่ก้เหมารวมเพศหญิงเหมือนกันนิคะ จะมาบอกว่าแค่เพศหญิงหนูด้วยอะค่ะ เพศพวกพี่ยังเหมารวมว่าโง่ ต้องเกาะผช. ทั้งๆที่ฝั่งเพศพี่ก้มีแมงดาเกาะผญ.หากินอยู่เลยอ่าาาา,แน่นอนค่ะว่าไม่ แต่พี่ก้เหมารวมเพศหญิงเหมือนกันนิคะ จะมาบอกว่าแค่เพศหญิงหนูด้วยอะค่ะ เพศพวกพี่ยังเหมารวมว่าโง่ ต้องเกาะผช. ทั้งๆที่ฝั่งเพศพี่ก้มีแมงดาเกาะผญ.หากินอยู่เลยอ่าาาา,2025-11-08 17:05:14,"['แน่นอน', 'ค่ะ', 'ว่า', 'ไม่', ' ', 'แต่', 'พี่', 'ก้', 'เหมา', 'รวม', 'เพศหญิง', 'เหมือนกัน', 'นิ', 'คะ', ' ', 'จะ', 'มา', 'บอ', 'กว่า', 'แค่', 'เพศหญิง', 'หนู', 'ด้วย', 'อะ', 'ค่ะ', ' ', 'เพศ', 'พวก', 'พี่', 'ยัง', 'เหมา', 'รวม', 'ว่า', 'โง่', ' ', 'ต้อง', 'เกาะ', 'ผช.', ' ', 'ทั้งๆ', 'ที่', 'ฝั่ง', 'เพศ', 'พี่', 'ก้', 'มี', 'แมงดา', 'เกาะ', 'ผญ.', 'หากิน', 'อยู่เลย', 'อ่า', 'าาา']"
1955859445730435258,twitter,post,https://x.com/crta_me/status/1955859445730435258,text,2025-08-14T05:10:04.000Z,selenium_x_scraper_v1,เหมารวมด่าผู้ชายโอเค แต่เหมารวมด่าผู้หญิงคุณน้องรับไม่ได้เหรอคะ  แล้วที่ว่าแมงดา ผู้หญิงเกาะผู้ชายกินมีเยอะกว่าเป็นร้อยเท่า เกาะฝรั่งขายตัวทำแอดล็อกสารพันค่ะ,เหมารวมด่าผู้ชายโอเค แต่เหมารวมด่าผู้หญิงคุณน้องรับไม่ได้เหรอคะ  แล้วที่ว่าแมงดา ผู้หญิงเกาะผู้ชายกินมีเยอะกว่าเป็นร้อยเท่า เกาะฝรั่งขายตัวทำแอดล็อกสารพันค่ะ,2025-11-08 17:05:14,"['เหมา', 'รวม', 'ด่า', 'ผู้ชาย', 'โอเค', ' ', 'แต่', 'เหมา', 'รวม', 'ด่า', 'ผู้หญิง', 'คุณ', 'น้อง', 'รับ', 'ไม่', 'ได้', 'เหรอ', 'คะ', ' ', 'แล้ว', 'ที่ว่า', 'แมงดา', ' ', 'ผู้หญิง', 'เกาะ', 'ผู้ชาย', 'กิน', 'มี', 'เยอะ', 'กว่า', 'เป็น', 'ร้อย', 'เท่า', ' ', 'เกาะ', 'ฝรั่ง', 'ขายตัว', 'ทำ', 'แอด', 'ล็อก', 'สารพัน', 'ค่ะ']"
1955541102309806446,twitter,post,https://x.com/folder022/status/1955541102309806446,text,2025-08-13T08:05:05.000Z,selenium_x_scraper_v1,me and my gf,me and my gf,2025-11-08 17:05:14,"['me', ' ', 'and', ' ', 'my', ' ', 'gf']"
1955855404933529923,twitter,post,https://x.com/crta_me/status/1955855404933529923,text,2025-08-14T04:54:01.000Z,selenium_x_scraper_v1,ผิดเพศ,ผิดเพศ,2025-11-08 17:05:14,['ผิดเพศ']
1955551151946162442,twitter,post,https://x.com/folder022/status/1955551151946162442,text,2025-08-13T08:45:01.000Z,selenium_x_scraper_v1,ถ้าชีวิตยังต้องข้องเกี่ยวกับชายแท้ก็หุบปากบ้างเวลาพวกมันโดนด่า มาเถียงแทนทำไมอีบ้า remember who the real enemy is,ถ้าชีวิตยังต้องข้องเกี่ยวกับชายแท้ก็หุบปากบ้างเวลาพวกมันโดนด่า มาเถียงแทนทำไมอีบ้า remember who the real enemy is,2025-11-08 17:05:14,"['ถ้า', 'ชีวิต', 'ยัง', 'ต้อง', 'ข้อง', 'เกี่ยวกับ', 'ชาย', 'แท้', 'ก็', 'หุบปาก', 'บ้าง', 'เวลา', 'พวก', 'มัน', 'โดน', 'ด่า', ' ', 'มา', 'เถียง', 'แทน', 'ทำไม', 'อี', 'บ้า', ' ', 'remember', ' ', 'who', ' ', 'the', ' ', 'real', ' ', 'enemy', ' ', 'is']"
1955855346582622642,twitter,post,https://x.com/crta_me/status/1955855346582622642,text,2025-08-14T04:53:47.000Z,selenium_x_scraper_v1,พ่อพี่ก็เป็นศัตรูของพี่เหรอคะถึงว่า…,พ่อพี่ก็เป็นศัตรูของพี่เหรอคะถึงว่า…,2025-11-08 17:05:14,"['พ่อ', 'พี่', 'ก็', 'เป็น', 'ศัตรู', 'ของ', 'พี่', 'เหรอ', 'คะ', 'ถึงว่า']"
1955553510730432856,twitter,post,https://x.com/folder022/status/1955553510730432856,text,2025-08-13T08:54:24.000Z,selenium_x_scraper_v1,หวังให้ชายแท้ปีศาจนรกเห็นทวิตกูแล้วไปผูกคอให้มันจบๆ แต่คนที่วิ่งมาทุบหัวตัวเองให้กูดูคนแรกคือ ผู้หญิง ?,หวังให้ชายแท้ปีศาจนรกเห็นทวิตกูแล้วไปผูกคอให้มันจบๆ แต่คนที่วิ่งมาทุบหัวตัวเองให้กูดูคนแรกคือ ผู้หญิง ?,2025-11-08 17:05:14,"['หวัง', 'ให้', 'ชาย', 'แท้', 'ปีศาจ', 'นรก', 'เห็น', 'ทวิ', 'ต', 'กู', 'แล้วไป', 'ผูก', 'คอ', 'ให้', 'มัน', 'จบ', 'ๆ', ' ', 'แต่', 'คน', 'ที่', 'วิ่ง', 'มา', 'ทุบ', 'หัว', 'ตัวเอง', 'ให้', 'กู', 'ดู', 'คน', 'แรก', 'คือ', ' ', 'ผู้หญิง', ' ', '?']"
1955855156593221787,twitter,post,https://x.com/crta_me/status/1955855156593221787,text,2025-08-14T04:53:02.000Z,selenium_x_scraper_v1,คนฉลาดๆเขาไม่เล่นทวิตนี่คะ,คนฉลาดๆเขาไม่เล่นทวิตนี่คะ,2025-11-08 17:05:14,"['คน', 'ฉลาด', 'ๆ', 'เขา', 'ไม่', 'เล่น', 'ทวิ', 'ต', 'นี่', 'คะ']"
1955841109164528038,twitter,post,https://x.com/crta_me/status/1955841109164528038,text,2025-08-14T03:57:12.000Z,selenium_x_scraper_v1,ดีกว่าพวกลาบในทวิตนะคะ โพสไปจกข้าวคั่วไป,ดีกว่าพวกลาบในทวิตนะคะ โพสไปจกข้าวคั่วไป,2025-11-08 17:05:14,"['ดีกว่า', 'พวก', 'ลาบ', 'ใน', 'ทวิ', 'ต', 'นะคะ', ' ', 'โพส', 'ไป', 'จก', 'ข้าวคั่ว', 'ไป']"
