id,platform,platform_type,url,content_type,timestamp,scraper_module,text,raw_text,scrape_date,tokens
1630076557422383105,twitter,post,https://x.com/nodnodifyoumw/status/1630076557422383105,text,2023-02-27T05:25:11.000Z,selenium_x_scraper_v1,@MakeItAQuote,@MakeItAQuote,2025-10-23 17:59:34,[]
1630079164488482816,twitter,post,https://x.com/crta_me/status/1630079164488482816,text,2023-02-27T05:35:32.000Z,selenium_x_scraper_v1,ระหว่างโดนพี่รักตัวเองมันยาก เบียวหมูกรอบใส่นะครับ,ระหว่างโดนพี่รักตัวเองมันยาก เบียวหมูกรอบใส่นะครับ,2025-10-23 17:59:34,"['ระหว่าง', 'โดน', 'พี่', 'รัก', 'ตัวเอง', 'มัน', 'ยาก', ' ', 'เบียว', 'หมูกรอบ', 'ใส่', 'นะ', 'ครับ']"
1630051000391450625,twitter,post,https://x.com/holysaturnalia/status/1630051000391450625,text,2023-02-27T03:43:38.000Z,selenium_x_scraper_v1,ขอบคุณที่แจ้งให้ทราบนะครับว่าทวิตแมสแล้ว ขอให้ทุกคนในสังคมไทยตระหนักและรับรู้ว่าในประเทศนี้มีคนอีกมากที่ยังไม่สามารถรักตัวเองได้ เพราะฉะนั้นเรามาสร้างสังคมใหม่ที่ไม่เหมือนรุ่นก่อน ๆ กันดีกว่าเนอะ ใจดีและส่งความรักให้คนรอบข้างเยอะ ๆ เพราะพวกเรารู้ดีว่ารักตัวเองมันยากขนาดไหน,ขอบคุณที่แจ้งให้ทราบนะครับว่าทวิตแมสแล้ว ขอให้ทุกคนในสังคมไทยตระหนักและรับรู้ว่าในประเทศนี้มีคนอีกมากที่ยังไม่สามารถรักตัวเองได้ เพราะฉะนั้นเรามาสร้างสังคมใหม่ที่ไม่เหมือนรุ่นก่อน ๆ กันดีกว่าเนอะ ใจดีและส่งความรักให้คนรอบข้างเยอะ ๆ เพราะพวกเรารู้ดีว่ารักตัวเองมันยากขนาดไหน,2025-10-23 17:59:34,"['ขอบคุณ', 'ที่', 'แจ้งให้ทราบ', 'นะ', 'ครับ', 'ว่า', 'ทวิ', 'ต', 'แมส', 'แล้ว', ' ', 'ขอให้', 'ทุก', 'คนใน', 'สังคม', 'ไทย', 'ตระหนัก', 'และ', 'รับรู้', 'ว่า', 'ในประเทศ', 'นี้', 'มี', 'คน', 'อีก', 'มาก', 'ที่', 'ยัง', 'ไม่', 'สามารถ', 'รัก', 'ตัวเอง', 'ได้', ' ', 'เพราะฉะนั้น', 'เรา', 'มา', 'สร้าง', 'สังคม', 'ใหม่', 'ที่', 'ไม่', 'เหมือน', 'รุ่น', 'ก่อน', ' ', 'ๆ', ' ', 'กัน', 'ดีกว่า', 'เนอะ', ' ', 'ใจดี', 'และ', 'ส่ง', 'ความรัก', 'ให้', 'คน', 'รอบข้าง', 'เยอะ', ' ', 'ๆ', ' ', 'เพราะ', 'พวกเรา', 'รู้ดี', 'ว่า', 'รัก', 'ตัวเอง', 'มัน', 'ยาก', 'ขนาด', 'ไหน']"
1630078351141642240,twitter,post,https://x.com/crta_me/status/1630078351141642240,text,2023-02-27T05:32:18.000Z,selenium_x_scraper_v1,ดีใจด้วยครับมีตั้ง2000วิวแน่ะ แมสสุดๆ ปล.อย่าลืมนะครับ รักตัวเองมันยาก,ดีใจด้วยครับมีตั้ง2000วิวแน่ะ แมสสุดๆ ปล.อย่าลืมนะครับ รักตัวเองมันยาก,2025-10-23 17:59:34,"['ดีใจ', 'ด้วย', 'ครับ', 'มี', 'ตั้ง', '2000', 'วิว', 'แน่ะ', ' ', 'แมส', 'สุด', 'ๆ', ' ', 'ปล.', 'อย่า', 'ลืม', 'นะ', 'ครับ', ' ', 'รัก', 'ตัวเอง', 'มัน', 'ยาก']"
1630076861773656067,twitter,post,https://x.com/crta_me/status/1630076861773656067,text,2023-02-27T05:26:23.000Z,selenium_x_scraper_v1,ชายแท้ไม่ดีตรงไหนครับ ดีกว่าพวกผิดเพศล่ะกัน,ชายแท้ไม่ดีตรงไหนครับ ดีกว่าพวกผิดเพศล่ะกัน,2025-10-23 17:59:34,"['ชาย', 'แท้', 'ไม่', 'ดี', 'ตรงไหน', 'ครับ', ' ', 'ดีกว่า', 'พวก', 'ผิดเพศ', 'ล่ะ', 'กัน']"
1630076283010023425,twitter,post,https://x.com/crta_me/status/1630076283010023425,text,2023-02-27T05:24:05.000Z,selenium_x_scraper_v1,รักตัวเองมันยาก จังเลยครับพี่ ผมรักตัวเองไม่เป็น โอ่ไม่นะ,รักตัวเองมันยาก จังเลยครับพี่ ผมรักตัวเองไม่เป็น โอ่ไม่นะ,2025-10-23 17:59:34,"['รัก', 'ตัวเอง', 'มัน', 'ยาก', ' ', 'จัง', 'เลย', 'ครับ', 'พี่', ' ', 'ผม', 'รัก', 'ตัวเอง', 'ไม่', 'เป็น', ' ', 'โอ่', 'ไม่', 'นะ']"
1630053381111951360,twitter,post,https://x.com/holysaturnalia/status/1630053381111951360,text,2023-02-27T03:53:05.000Z,selenium_x_scraper_v1,พี่รู้เปล่า จริง ๆ แล้วประเทศไทยสร้างขึ้นบนหมูกรอบ,พี่รู้เปล่า จริง ๆ แล้วประเทศไทยสร้างขึ้นบนหมูกรอบ,2025-10-23 17:59:34,"['พี่', 'รู้', 'เปล่า', ' ', 'จริง ๆ', ' ', 'แล้ว', 'ประเทศ', 'ไทย', 'สร้าง', 'ขึ้น', 'บน', 'หมูกรอบ']"
1630075736181866497,twitter,post,https://x.com/crta_me/status/1630075736181866497,text,2023-02-27T05:21:55.000Z,selenium_x_scraper_v1,ผมว่าไม่น่าจะใช่นะ เพราะแบบนั้นคนเป็นมุสลิมคงจะอยู่ไม่ได้แน่นอน,ผมว่าไม่น่าจะใช่นะ เพราะแบบนั้นคนเป็นมุสลิมคงจะอยู่ไม่ได้แน่นอน,2025-10-23 17:59:34,"['ผม', 'ว่า', 'ไม่', 'น่าจะ', 'ใช่', 'นะ', ' ', 'เพราะ', 'แบบ', 'นั้น', 'คน', 'เป็น', 'มุสลิม', 'คงจะ', 'อยู่', 'ไม่', 'ได้', 'แน่นอน']"
1630053281404952576,twitter,post,https://x.com/holysaturnalia/status/1630053281404952576,text,2023-02-27T03:52:41.000Z,selenium_x_scraper_v1,พี่ชอบเพลงป๊อปมั้ย ผมชอบเพลงป๊อปมาก หรือพี่ชอบเพลงสรรเสริฐพระบารมี,พี่ชอบเพลงป๊อปมั้ย ผมชอบเพลงป๊อปมาก หรือพี่ชอบเพลงสรรเสริฐพระบารมี,2025-10-23 17:59:34,"['พี่', 'ชอบ', 'เพลง', 'ป๊อป', 'มั้ย', ' ', 'ผม', 'ชอบ', 'เพลง', 'ป๊อป', 'มาก', ' ', 'หรือ', 'พี่', 'ชอบ', 'เพลง', 'สรร', 'เส', 'ริ', 'ฐ', 'พระ', 'บารมี']"
1630075315228930048,twitter,post,https://x.com/crta_me/status/1630075315228930048,text,2023-02-27T05:20:15.000Z,selenium_x_scraper_v1,ผมชอบแนว phonk รึไม่ก็ bossa nova ครับ,ผมชอบแนว phonk รึไม่ก็ bossa nova ครับ,2025-10-23 17:59:34,"['ผม', 'ชอบ', 'แนว', ' ', 'phonk', ' ', 'รึ', 'ไม่', 'ก็', ' ', 'bossa', ' ', 'nova', ' ', 'ครับ']"
1630051931661139968,twitter,post,https://x.com/holysaturnalia/status/1630051931661139968,text,2023-02-27T03:47:20.000Z,selenium_x_scraper_v1,พรี่รู้ได้ไงว่าผมเป็นหมาป่าเดียวดาย ,พรี่รู้ได้ไงว่าผมเป็นหมาป่าเดียวดาย ,2025-10-23 17:59:34,"['พ', 'รี่', 'รู้', 'ได้', 'ไง', 'ว่า', 'ผม', 'เป็น', 'หมาป่า', 'เดียวดาย']"
1630074960306913280,twitter,post,https://x.com/crta_me/status/1630074960306913280,text,2023-02-27T05:18:50.000Z,selenium_x_scraper_v1,ผมไม่รู้จักฟามรักเพราะไม่มีใครเคยสอน อย่าให้ใครมาทำร้ายเลาดาย ไม่ช่ายเรื่องยากทีจาลักตัวเอง,ผมไม่รู้จักฟามรักเพราะไม่มีใครเคยสอน อย่าให้ใครมาทำร้ายเลาดาย ไม่ช่ายเรื่องยากทีจาลักตัวเอง,2025-10-23 17:59:34,"['ผม', 'ไม่', 'รู้จัก', 'ฟาม', 'รัก', 'เพราะ', 'ไม่', 'มี', 'ใคร', 'เคย', 'สอน', ' ', 'อย่า', 'ให้', 'ใคร', 'มา', 'ทำร้าย', 'เลา', 'ดาย', ' ', 'ไม่', 'ช่าย', 'เรื่อง', 'ยาก', 'ที', 'จา', 'ลัก', 'ตัวเอง']"
1629779042290503680,twitter,post,https://x.com/bitchqueen_1998/status/1629779042290503680,text,2023-02-26T09:42:58.000Z,selenium_x_scraper_v1,เคยอ่านเจอมาว่าถ้าเด็กถูกพ่อแม่ทรีตเหมือนไม่รักเขา เขาจะไม่มีวันรักตัวเองหรือเชื่อว่าตัวเองจะถูกรัก (properly + healthy) ได้เลยถ้าไม่สามารถฮีลเรื่องนี้ได้ เพราะขนาดพ่อแม่ที่ให้กำเนิดและเลี้ยงมายังไม่รัก คนอื่นจะรักเราได้ไง,เคยอ่านเจอมาว่าถ้าเด็กถูกพ่อแม่ทรีตเหมือนไม่รักเขา เขาจะไม่มีวันรักตัวเองหรือเชื่อว่าตัวเองจะถูกรัก (properly + healthy) ได้เลยถ้าไม่สามารถฮีลเรื่องนี้ได้ เพราะขนาดพ่อแม่ที่ให้กำเนิดและเลี้ยงมายังไม่รัก คนอื่นจะรักเราได้ไง,2025-10-23 17:59:34,"['เคย', 'อ่าน', 'เจอ', 'มา', 'ว่า', 'ถ้า', 'เด็ก', 'ถูก', 'พ่อแม่', 'ท', 'รีต', 'เหมือน', 'ไม่', 'รัก', 'เขา', ' ', 'เขา', 'จะ', 'ไม่', 'มี', 'วัน', 'รัก', 'ตัวเอง', 'หรือ', 'เชื่อ', 'ว่า', 'ตัวเอง', 'จะ', 'ถู', 'กรัก', ' ', 'properly', ' ', 'healthy', ' ', 'ได้', 'เลย', 'ถ้า', 'ไม่', 'สามารถ', 'ฮี', 'ล', 'เรื่อง', 'นี้', 'ได้', ' ', 'เพราะ', 'ขนาด', 'พ่อแม่', 'ที่', 'ให้กำเนิด', 'และ', 'เลี้ยง', 'มายัง', 'ไม่', 'รัก', ' ', 'คนอื่น', 'จะ', 'รัก', 'เรา', 'ได้', 'ไง']"
1629779050070941696,twitter,post,https://x.com/bitchqueen_1998/status/1629779050070941696,text,2023-02-26T09:43:00.000Z,selenium_x_scraper_v1,ยิ่งประเภททำตามที่พ่อแม่บอกทุกอย่าง เรียนดีประพฤติตัวดีตามสแตนดาร์ดที่พ่อแม่ตั้งไว้ทุกข้อแต่ก็ยังไม่ถูกรัก แม่งยิ่งเชื่อว่า there must be something wrong with me โตมาจะเป็นคนไล่ล่า validation หรือพวก don’t give a fuck ก็อีกเรื่อง ไม่มีเด็กคนไหนสมควรเจออะไรแบบนี้,ยิ่งประเภททำตามที่พ่อแม่บอกทุกอย่าง เรียนดีประพฤติตัวดีตามสแตนดาร์ดที่พ่อแม่ตั้งไว้ทุกข้อแต่ก็ยังไม่ถูกรัก แม่งยิ่งเชื่อว่า there must be something wrong with me โตมาจะเป็นคนไล่ล่า validation หรือพวก don’t give a fuck ก็อีกเรื่อง ไม่มีเด็กคนไหนสมควรเจออะไรแบบนี้,2025-10-23 17:59:34,"['ยิ่ง', 'ประเภท', 'ทำ', 'ตามที่', 'พ่อแม่', 'บอก', 'ทุกอย่าง', ' ', 'เรียน', 'ดี', 'ประพฤติ', 'ตัวดี', 'ตาม', 'สแตนดาร์ด', 'ที่', 'พ่อแม่', 'ตั้ง', 'ไว้', 'ทุก', 'ข้อ', 'แต่', 'ก็', 'ยัง', 'ไม่', 'ถู', 'กรัก', ' ', 'แม่', 'ง', 'ยิ่ง', 'เชื่อ', 'ว่า', ' ', 'there', ' ', 'must', ' ', 'be', ' ', 'something', ' ', 'wrong', ' ', 'with', ' ', 'me', ' ', 'โตมา', 'จะ', 'เป็น', 'คน', 'ไล่ล่า', ' ', 'validation', ' ', 'หรือ', 'พวก', ' ', 'don', ' ', 't', ' ', 'give', ' ', 'a', ' ', 'fuck', ' ', 'ก็', 'อีก', 'เรื่อง', ' ', 'ไม่', 'มี', 'เด็ก', 'คน', 'ไหน', 'สมควร', 'เจอ', 'อะไร', 'แบบนี้']"
1629923602618548224,twitter,post,https://x.com/crta_me/status/1629923602618548224,text,2023-02-26T19:17:24.000Z,selenium_x_scraper_v1,เก่งจังเลยครับไทยcumอังกฤษcumด้วย,เก่งจังเลยครับไทยcumอังกฤษcumด้วย,2025-10-23 17:59:34,"['เก่ง', 'จัง', 'เลย', 'ครับ', 'ไทย', 'cum', 'อังกฤษ', 'cum', 'ด้วย']"
1629857808412991488,twitter,post,https://x.com/jekyll________/status/1629857808412991488,text,2023-02-26T14:55:57.000Z,selenium_x_scraper_v1,ทำไมเบียวจังครับ รักษาตัวดี ๆ ด้วยนะครับดูจากรีพลายนี่น่าจะมีศัตรูเยอะนะครับ,ทำไมเบียวจังครับ รักษาตัวดี ๆ ด้วยนะครับดูจากรีพลายนี่น่าจะมีศัตรูเยอะนะครับ,2025-10-23 17:59:34,"['ทำไม', 'เบียว', 'จัง', 'ครับ', ' ', 'รักษาตัว', 'ดี ๆ', ' ', 'ด้วย', 'นะ', 'ครับ', 'ดู', 'จา', 'กรี', 'พลาย', 'นี่', 'น่าจะ', 'มี', 'ศัตรู', 'เย', 'อะนะ', 'ครับ']"
1629898336278052864,twitter,post,https://x.com/crta_me/status/1629898336278052864,text,2023-02-26T17:37:00.000Z,selenium_x_scraper_v1,ผมเบียวตรงไหนครับพี่,ผมเบียวตรงไหนครับพี่,2025-10-23 17:59:34,"['ผม', 'เบียว', 'ตรงไหน', 'ครับ', 'พี่']"
1628780013561724928,twitter,post,https://x.com/pi0yr1/status/1628780013561724928,text,2023-02-23T15:33:11.000Z,selenium_x_scraper_v1,อดีตลบได้น้า แต่เราเซฟทัน #เกียมอุดม,อดีตลบได้น้า แต่เราเซฟทัน #เกียมอุดม,2025-10-23 17:59:34,"['อดีต', 'ลบ', 'ได้', 'น้า', ' ', 'แต่', 'เรา', 'เซฟ', 'ทัน', ' ', 'เกีย', 'ม', 'อุดม']"
1629538178171547648,twitter,post,https://x.com/crta_me/status/1629538178171547648,text,2023-02-25T17:45:51.000Z,selenium_x_scraper_v1,น้องเขาก็ขอโทษไปแล้วเจ้าของโพสยังไม่เลิกแขวนให้คนมาด่าอีก นิสัยแย่มาก,น้องเขาก็ขอโทษไปแล้วเจ้าของโพสยังไม่เลิกแขวนให้คนมาด่าอีก นิสัยแย่มาก,2025-10-23 17:59:34,"['น้อง', 'เขา', 'ก็', 'ขอโทษ', 'ไป', 'แล้ว', 'เจ้าของ', 'โพส', 'ยัง', 'ไม่', 'เลิก', 'แขวน', 'ให้', 'คน', 'มา', 'ด่า', 'อีก', ' ', 'นิสัย', 'แย่มาก']"
1629142363393368065,twitter,post,https://x.com/pi0yr1/status/1629142363393368065,text,2023-02-24T15:33:02.000Z,selenium_x_scraper_v1,ตายแระ เนื่องจากเป็นช่วงสอบไฟนอล จึงไม่ทราบว่าแมสเบอร์นี้ ดังนั้นดิฉันขอ disclaimer ว่า เด็กเตรียมก็มีคนดีดีค่ะ เช่น เรา ^^ ทุกที่มีคนดีก็มีคนแย่หมดค่ะ (แต่นี่แย่ไปค่ะเจ้ จบ)ดังนั้น ทวิตนี้จึงมีเพื่อด่าคนนิสัยแบบนี้เท่านั้นค่ะ ไม่มีเจตนาไม่ดีต่อสถานศึกษา โปรดด่าเฉพาะบุคคล พับไมค์,ตายแระ เนื่องจากเป็นช่วงสอบไฟนอล จึงไม่ทราบว่าแมสเบอร์นี้ ดังนั้นดิฉันขอ disclaimer ว่า เด็กเตรียมก็มีคนดีดีค่ะ เช่น เรา ^^ ทุกที่มีคนดีก็มีคนแย่หมดค่ะ (แต่นี่แย่ไปค่ะเจ้ จบ)ดังนั้น ทวิตนี้จึงมีเพื่อด่าคนนิสัยแบบนี้เท่านั้นค่ะ ไม่มีเจตนาไม่ดีต่อสถานศึกษา โปรดด่าเฉพาะบุคคล พับไมค์,2025-10-23 17:59:34,"['ตาย', 'แระ', ' ', 'เนื่องจาก', 'เป็นช่วง', 'สอบ', 'ไฟ', 'นอ', 'ล', ' ', 'จึง', 'ไม่', 'ทราบ', 'ว่า', 'แมส', 'เบอร์', 'นี้', ' ', 'ดังนั้น', 'ดิฉัน', 'ขอ', ' ', 'disclaimer', ' ', 'ว่า', ' ', 'เด็ก', 'เตรียม', 'ก็', 'มี', 'คนดี', 'ดี', 'ค่ะ', ' ', 'เช่น', ' ', 'เรา', ' ', 'ทุกที่', 'มี', 'คนดี', 'ก็', 'มี', 'คน', 'แย่', 'หมด', 'ค่ะ', ' ', 'แต่', 'นี่', 'แย่', 'ไป', 'ค่ะ', 'เจ้', ' ', 'จบ', ' ', 'ดังนั้น', ' ', 'ทวิ', 'ต', 'นี้', 'จึง', 'มี', 'เพื่อ', 'ด่า', 'คน', 'นิสัย', 'แบบนี้', 'เท่านั้น', 'ค่ะ', ' ', 'ไม่', 'มี', 'เจตนา', 'ไม่', 'ดี', 'ต่อ', 'สถานศึกษา', ' ', 'โปรด', 'ด่า', 'เฉพาะบุคคล', ' ', 'พับ', 'ไมค์']"
1629426499672756225,twitter,post,https://x.com/crta_me/status/1629426499672756225,text,2023-02-25T10:22:05.000Z,selenium_x_scraper_v1,แอบด่าอยู่แต่ในทวิตอย่าคิดว่าจะตามไม่เจอนะครับ,แอบด่าอยู่แต่ในทวิตอย่าคิดว่าจะตามไม่เจอนะครับ,2025-10-23 17:59:34,"['แอบ', 'ด่า', 'อยู่', 'แต่', 'ใน', 'ทวิ', 'ตอ', 'ย่า', 'คิด', 'ว่า', 'จะ', 'ตาม', 'ไม่', 'เจอ', 'นะ', 'ครับ']"
1629426317950349312,twitter,post,https://x.com/crta_me/status/1629426317950349312,text,2023-02-25T10:21:22.000Z,selenium_x_scraper_v1,เอาคลิปวิดีโอของคนอื่นมาเผยแพร่โดยไม่ได้รับความยินยอมจากเจ้าตัว ระวังจะมีปัญหานะครับ ขอเตือนเอาไว้ก่อนทั้งผมและน้องเขาไม่โอเครเหมือนกัน,เอาคลิปวิดีโอของคนอื่นมาเผยแพร่โดยไม่ได้รับความยินยอมจากเจ้าตัว ระวังจะมีปัญหานะครับ ขอเตือนเอาไว้ก่อนทั้งผมและน้องเขาไม่โอเครเหมือนกัน,2025-10-23 17:59:34,"['เอา', 'คลิป', 'วิดีโอ', 'ของ', 'คนอื่น', 'มา', 'เผยแพร่', 'โดย', 'ไม่', 'ได้รับ', 'ความยินยอม', 'จาก', 'เจ้าตัว', ' ', 'ระวัง', 'จะ', 'มีปัญหา', 'นะ', 'ครับ', ' ', 'ขอ', 'เตือน', 'เอาไว้', 'ก่อน', 'ทั้ง', 'ผม', 'และ', 'น้อง', 'เขา', 'ไม่', 'โอเค', 'ร', 'เหมือนกัน']"
1625693257211744256,twitter,post,https://x.com/crta_me/status/1625693257211744256,text,2023-02-15T03:07:31.000Z,selenium_x_scraper_v1,สัตว์เขาจะไปรู้อะไร เขาตายไปแล้วยังมาด่ามาว่าเขาอีก สมแล้วที่ชอบวาดอะไรต่ำๆอย่าง การสมสู่กันเองภายในครอบครัว,สัตว์เขาจะไปรู้อะไร เขาตายไปแล้วยังมาด่ามาว่าเขาอีก สมแล้วที่ชอบวาดอะไรต่ำๆอย่าง การสมสู่กันเองภายในครอบครัว,2025-10-23 17:59:34,"['สัตว์', 'เขา', 'จะ', 'ไป', 'รู้', 'อะไร', ' ', 'เขา', 'ตาย', 'ไป', 'แล้ว', 'ยัง', 'มา', 'ด่า', 'มา', 'ว่า', 'เขา', 'อีก', ' ', 'สม', 'แล้ว', 'ที่', 'ชอบ', 'วาด', 'อะไร', 'ต่ำ', 'ๆ', 'อย่าง', ' ', 'การสมสู่', 'กันเอง', 'ภายใน', 'ครอบครัว']"
