id,platform,platform_type,url,content_type,timestamp,scraper_module,text,raw_text,scrape_date,tokens
1945712826892611585,twitter,post,https://x.com/Tim8666/status/1945712826892611585,text,2025-07-17T05:11:02.000Z,selenium_x_scraper_v1,เป็นซึมเศร้าเพราะจีบผชไม่ติด กุงงมาก อีห่า https://x.com/thers____/stat/thers____/status/1945084136592425273…,เป็นซึมเศร้าเพราะจีบผชไม่ติด กุงงมาก อีห่า https://x.com/thers____/stat/thers____/status/1945084136592425273…,2025-10-23 17:59:34,"['เป็น', 'ซึมเศร้า', 'เพราะ', 'จีบ', 'ผช', 'ไม่', 'ติด', ' ', 'กุ', 'งง', 'มาก', ' ', 'อี', 'ห่า']"
1945655090003775920,twitter,post,https://x.com/Tim8666/status/1945655090003775920,text,2025-07-17T01:21:36.000Z,selenium_x_scraper_v1,british gays are fucking stupid,british gays are fucking stupid,2025-10-23 17:59:34,"['british', ' ', 'gays', ' ', 'are', ' ', 'fucking', ' ', 'stupid']"
1945503056679809178,twitter,post,https://x.com/Tim8666/status/1945503056679809178,text,2025-07-16T15:17:29.000Z,selenium_x_scraper_v1,Liberal gays are always really this stupid https://x.com/firebornnn/sta/firebornnn/status/1945191089817690211…,Liberal gays are always really this stupid https://x.com/firebornnn/sta/firebornnn/status/1945191089817690211…,2025-10-23 17:59:34,"['liberal', ' ', 'gays', ' ', 'are', ' ', 'always', ' ', 'really', ' ', 'this', ' ', 'stupid']"
1945409803653919138,twitter,post,https://x.com/anthraxxxx/status/1945409803653919138,text,2025-07-16T09:06:55.000Z,selenium_x_scraper_v1,Korean tourist assaults Vietnamese women at Hanoi photo booth after getting impatient at having to wait. She thought she could get away with this shit in Vietnam.,Korean tourist assaults Vietnamese women at Hanoi photo booth after getting impatient at having to wait. She thought she could get away with this shit in Vietnam.,2025-10-23 17:59:34,"['korean', ' ', 'tourist', ' ', 'assaults', ' ', 'vietnamese', ' ', 'women', ' ', 'at', ' ', 'hanoi', ' ', 'photo', ' ', 'booth', ' ', 'after', ' ', 'getting', ' ', 'impatient', ' ', 'at', ' ', 'having', ' ', 'to', ' ', 'wait', '.', ' ', 'she', ' ', 'thought', ' ', 'she', ' ', 'could', ' ', 'get', ' ', 'away', ' ', 'with', ' ', 'this', ' ', 'shit', ' ', 'in', ' ', 'vietnam', '.']"
1945341738559922439,twitter,post,https://x.com/pprettyinred/status/1945341738559922439,text,2025-07-16T04:36:27.000Z,selenium_x_scraper_v1,พึ่งเคยเห็นคนใช้อีโมจิ แทนขนตา ทุเรดที่สุดเท่าที่มีการรวมตัวอีโมจิมาอะ 5555555555555555555555555555,พึ่งเคยเห็นคนใช้อีโมจิ แทนขนตา ทุเรดที่สุดเท่าที่มีการรวมตัวอีโมจิมาอะ 5555555555555555555555555555,2025-10-23 17:59:34,"['พึ่ง', 'เคย', 'เห็น', 'คนใช้', 'อี', 'โมจิ', ' ', 'แทน', 'ขน', 'ตา', ' ', 'ทุ', 'เร', 'ด', 'ที่สุด', 'เท่าที่', 'มี', 'การ', 'รวมตัว', 'อี', 'โมจิ', 'มา', 'อะ', ' ', 'หัวเราะ']"
1944957170585624804,twitter,post,https://x.com/YingPatthara/status/1944957170585624804,text,2025-07-15T03:08:19.000Z,selenium_x_scraper_v1,อารมณ์คนญี่ปุ่นตอนนี้,อารมณ์คนญี่ปุ่นตอนนี้,2025-10-23 17:59:34,"['อารมณ์', 'คนญี่ปุ่น', 'ตอนนี้']"
1944546176981954580,twitter,post,https://x.com/RedSkullxxx/status/1944546176981954580,text,2025-07-13T23:55:11.000Z,selenium_x_scraper_v1,กระบะจะแซง แต่ซาเล้งเลี้ยว เลยหักกลับ + ขับเร็วถนนลื่น ใครผิด,กระบะจะแซง แต่ซาเล้งเลี้ยว เลยหักกลับ + ขับเร็วถนนลื่น ใครผิด,2025-10-23 17:59:34,"['กระบะ', 'จะ', 'แซง', ' ', 'แต่', 'ซาเล้ง', 'เลี้ยว', ' ', 'เลย', 'หัก', 'กลับ', ' ', 'ขับ', 'เร็ว', 'ถนน', 'ลื่น', ' ', 'ใคร', 'ผิด']"
1944695403322233247,twitter,post,https://x.com/Sarnaxt/status/1944695403322233247,text,2025-07-14T09:48:09.000Z,selenium_x_scraper_v1,ไม่เกี่ยวหรอกว่าขับเร็ว\ช้า ทำไมไม่โทษซาเล้งอ่ะที่ัมันเลี้ยวไม่ดูว่ามีรถมาหรือเปล่า อย่าใช้ตรรกะแบบนี้ก็คงมีเหตุตลอดดิ ปัญญาอ่อน,ไม่เกี่ยวหรอกว่าขับเร็ว\ช้า ทำไมไม่โทษซาเล้งอ่ะที่ัมันเลี้ยวไม่ดูว่ามีรถมาหรือเปล่า อย่าใช้ตรรกะแบบนี้ก็คงมีเหตุตลอดดิ ปัญญาอ่อน,2025-10-23 17:59:34,"['ไม่', 'เกี่ยว', 'หรอ', 'กว่า', 'ขับ', 'เร็ว', ' ', 'ช้า', ' ', 'ทำไม', 'ไม่', 'โทษ', 'ซาเล้ง', 'อ่ะ', 'ที่', 'ั', 'มัน', 'เลี้ยว', 'ไม่', 'ดู', 'ว่า', 'มี', 'รถ', 'มา', 'หรือเปล่า', ' ', 'อย่า', 'ใช้', 'ตรรกะ', 'แบบนี้', 'ก็', 'คง', 'มี', 'เหตุ', 'ตลอด', 'ดิ', ' ', 'ปัญญาอ่อน']"
1944936601408430526,twitter,post,https://x.com/Tim8666/status/1944936601408430526,text,2025-07-15T01:46:35.000Z,selenium_x_scraper_v1,โง่จังเลยอีดอก,โง่จังเลยอีดอก,2025-10-23 17:59:34,"['โง่', 'จัง', 'เลย', 'อีดอก']"
1944935885814030396,twitter,post,https://x.com/Tim8666/status/1944935885814030396,text,2025-07-15T01:43:44.000Z,selenium_x_scraper_v1,ยืนยันว่าหลังเรียนจบหายเพี้ยน โดยเฉพาะเบียวอักษรบนทวิต,ยืนยันว่าหลังเรียนจบหายเพี้ยน โดยเฉพาะเบียวอักษรบนทวิต,2025-10-23 17:59:34,"['ยืนยัน', 'ว่า', 'หลัง', 'เรียนจบ', 'หาย', 'เพี้ยน', ' ', 'โดยเฉพาะ', 'เบียว', 'อักษร', 'บน', 'ทวิ', 'ต']"
1944418361066094881,twitter,post,https://x.com/aesetthetone/status/1944418361066094881,text,2025-07-13T15:27:17.000Z,selenium_x_scraper_v1,คหสต ไม่ใช่แค่อักษรอะ สายสังคมทุกคณะต้องมีคนเพี้ยน จากใจคนเรียนสายสังคม ยิ่งพวกเรียนเก่ง เถียงอ.ทุกคาบนะ โคตรเพี้ยน เหมือนมั่นว่าตัวเองเก่งมาก ร้อนวิชา ทำงานกับใครก็ยากเพราะไม่ฟังเขา มันจะต้องเก่ง ต้องแตกต่างจากคนอื่น identity ยอดฮิตคือ เกลียดเพลงและหนังแมสๆ ชอบอะไรนอกกระแส,คหสต ไม่ใช่แค่อักษรอะ สายสังคมทุกคณะต้องมีคนเพี้ยน จากใจคนเรียนสายสังคม ยิ่งพวกเรียนเก่ง เถียงอ.ทุกคาบนะ โคตรเพี้ยน เหมือนมั่นว่าตัวเองเก่งมาก ร้อนวิชา ทำงานกับใครก็ยากเพราะไม่ฟังเขา มันจะต้องเก่ง ต้องแตกต่างจากคนอื่น identity ยอดฮิตคือ เกลียดเพลงและหนังแมสๆ ชอบอะไรนอกกระแส,2025-10-23 17:59:34,"['คหสต', ' ', 'ไม่', 'ใช่', 'แค่', 'อักษร', 'อะ', ' ', 'สาย', 'สังคม', 'ทุก', 'คณะ', 'ต้อง', 'มี', 'คน', 'เพี้ยน', ' ', 'จาก', 'ใจ', 'คน', 'เรียน', 'สาย', 'สังคม', ' ', 'ยิ่ง', 'พวก', 'เรียน', 'เก่ง', ' ', 'เถียง', 'อ.', 'ทุก', 'คาบ', 'นะ', ' ', 'โคตร', 'เพี้ยน', ' ', 'เหมือน', 'มั่น', 'ว่า', 'ตัวเอง', 'เก่ง', 'มาก', ' ', 'ร้อนวิชา', ' ', 'ทำงาน', 'กับ', 'ใคร', 'ก็', 'ยาก', 'เพราะ', 'ไม่', 'ฟัง', 'เขา', ' ', 'มัน', 'จะ', 'ต้อง', 'เก่ง', ' ', 'ต้อง', 'แตกต่าง', 'จาก', 'คนอื่น', ' ', 'identity', ' ', 'ยอดฮิต', 'คือ', ' ', 'เกลียด', 'เพลง', 'และ', 'หนัง', 'แมส', 'ๆ', ' ', 'ชอบ', 'อะไร', 'นอก', 'กระแส']"
1944510432976241145,twitter,post,https://x.com/MadsPosting/status/1944510432976241145,text,2025-07-13T21:33:09.000Z,selenium_x_scraper_v1,,,2025-10-23 17:59:34,[]
1944032461429813603,twitter,post,https://x.com/luvumorena/status/1944032461429813603,text,2025-07-12T13:53:51.000Z,selenium_x_scraper_v1,ไม่มีพ่อไม่มีแม่ค่ะ ตอนพิมไปบอกสาวก็นอนอยู่ข้างๆเรา,ไม่มีพ่อไม่มีแม่ค่ะ ตอนพิมไปบอกสาวก็นอนอยู่ข้างๆเรา,2025-10-23 17:59:34,"['ไม่', 'มี', 'พ่อ', 'ไม่', 'มี', 'แม่', 'ค่ะ', ' ', 'ตอน', 'พิม', 'ไป', 'บอก', 'สาว', 'ก็', 'นอน', 'อยู่', 'ข้างๆ', 'เรา']"
1944032190050042351,twitter,post,https://x.com/luvumorena/status/1944032190050042351,text,2025-07-12T13:52:47.000Z,selenium_x_scraper_v1,อัพเดทค่ะ ตอนนี้เลิกกันแล้วนะคะ จับได้ว่าเขานอกใจไปคุยกับเพื่อนในสาขาตัวเอง ปลดล็อคทุกคำถามที่ติดในใจแล้วค่ะ,อัพเดทค่ะ ตอนนี้เลิกกันแล้วนะคะ จับได้ว่าเขานอกใจไปคุยกับเพื่อนในสาขาตัวเอง ปลดล็อคทุกคำถามที่ติดในใจแล้วค่ะ,2025-10-23 17:59:34,"['อัพเดท', 'ค่ะ', ' ', 'ตอนนี้', 'เลิกกัน', 'แล้ว', 'นะคะ', ' ', 'จับได้', 'ว่า', 'เขา', 'นอกใจ', 'ไป', 'คุย', 'กับ', 'เพื่อน', 'ใน', 'สาขา', 'ตัวเอง', ' ', 'ปลด', 'ล็อค', 'ทุก', 'คำถาม', 'ที่', 'ติด', 'ใน', 'ใจ', 'แล้ว', 'ค่ะ']"
1944398690887569536,twitter,post,https://x.com/Tim8666/status/1944398690887569536,text,2025-07-13T14:09:07.000Z,selenium_x_scraper_v1,Colonial mindsetสุดๆโง่แท้,Colonial mindsetสุดๆโง่แท้,2025-10-23 17:59:34,"['colonial', ' ', 'mindset', 'สุด', 'ๆ', 'โง่', 'แท้']"
1944398249822916841,twitter,post,https://x.com/Tim8666/status/1944398249822916841,text,2025-07-13T14:07:22.000Z,selenium_x_scraper_v1,เลิกงับ,เลิกงับ,2025-10-23 17:59:34,"['เลิก', 'งับ']"
1944261466837987426,twitter,post,https://x.com/Tim8666/status/1944261466837987426,text,2025-07-13T05:03:50.000Z,selenium_x_scraper_v1,ผอมได้จากการจงใจผ่ากระเพาะ อีห่า กล้าสอนคนอื่น,ผอมได้จากการจงใจผ่ากระเพาะ อีห่า กล้าสอนคนอื่น,2025-10-23 17:59:34,"['ผอม', 'ได้', 'จาก', 'การ', 'จงใจ', 'ผ่า', 'กระเพาะ', ' ', 'อี', 'ห่า', ' ', 'กล้า', 'สอน', 'คนอื่น']"
1944029562557317278,twitter,post,https://x.com/realMaalouf/status/1944029562557317278,text,2025-07-12T13:42:20.000Z,selenium_x_scraper_v1,"The police in Germany are not joking around Palestinian protesters anymore!

Do you agree with their response?","The police in Germany are not joking around Palestinian protesters anymore!

Do you agree with their response?",2025-10-23 17:59:34,"['the', ' ', 'police', ' ', 'in', ' ', 'germany', ' ', 'are', ' ', 'not', ' ', 'joking', ' ', 'around', ' ', 'palestinian', ' ', 'protesters', ' ', 'anymore', '!', ' ', 'do', ' ', 'you', ' ', 'agree', ' ', 'with', ' ', 'their', ' ', 'response', '?']"
1943234334200103223,twitter,post,https://x.com/Tim8666/status/1943234334200103223,text,2025-07-10T09:02:23.000Z,selenium_x_scraper_v1,หลับสองวัน แทบจะเปนไปไม่ได้เลยเอาจิง,หลับสองวัน แทบจะเปนไปไม่ได้เลยเอาจิง,2025-10-23 17:59:34,"['หลับ', 'สอง', 'วัน', ' ', 'แทบจะ', 'เปน', 'ไป', 'ไม่', 'ได้', 'เลย', 'เอา', 'จิง']"
1943182849290424405,twitter,post,https://x.com/Tim8666/status/1943182849290424405,text,2025-07-10T05:37:48.000Z,selenium_x_scraper_v1,มึงจะไม่ให้ผญ hold accountable หีแตดไรเลยบ้างหรอ,มึงจะไม่ให้ผญ hold accountable หีแตดไรเลยบ้างหรอ,2025-10-23 17:59:34,"['มึง', 'จะ', 'ไม่', 'ให้', 'ผญ', ' ', 'hold', ' ', 'accountable', ' ', 'หี', 'แตด', 'ไร', 'เลย', 'บ้าง', 'หรอ']"
1942097195081077143,twitter,post,https://x.com/CanaaniteSoul/status/1942097195081077143,text,2025-07-07T05:43:48.000Z,selenium_x_scraper_v1,She’s fucking evil and no one can convince me otherwise she’s the fucking worst,She’s fucking evil and no one can convince me otherwise she’s the fucking worst,2025-10-23 17:59:34,"['she', ' ', 's', ' ', 'fucking', ' ', 'evil', ' ', 'and', ' ', 'no', ' ', 'one', ' ', 'can', ' ', 'convince', ' ', 'me', ' ', 'otherwise', ' ', 'she', ' ', 's', ' ', 'the', ' ', 'fucking', ' ', 'worst']"
1942147134989480034,twitter,post,https://x.com/Tim8666/status/1942147134989480034,text,2025-07-07T09:02:14.000Z,selenium_x_scraper_v1,ทำไมกุรู้เลยวะ อีเหี้ยเอ้ย แตะไม่ได้ด้วยนะ จะโดนด่าอิจฉา คนสำเร้จไว ในวัย20กว่าๆ อีสัส,ทำไมกุรู้เลยวะ อีเหี้ยเอ้ย แตะไม่ได้ด้วยนะ จะโดนด่าอิจฉา คนสำเร้จไว ในวัย20กว่าๆ อีสัส,2025-10-23 17:59:34,"['ทำไม', 'กุ', 'รู้', 'เลย', 'วะ', ' ', 'อี', 'เหี้ย', 'เอ้ย', ' ', 'แตะ', 'ไม่', 'ได้', 'ด้วย', 'นะ', ' ', 'จะ', 'โดน', 'ด่า', 'อิจฉา', ' ', 'คน', 'สำ', 'เร้จ', 'ไว', ' ', 'ใน', 'วัย', '20', 'กว่า', 'ๆ', ' ', 'อี', 'สัส']"
1941953567880794575,twitter,post,https://x.com/RealPostFolder/status/1941953567880794575,text,2025-07-06T20:13:04.000Z,selenium_x_scraper_v1,,,2025-10-23 17:59:34,[]
1942066424316322183,twitter,post,https://x.com/Tim8666/status/1942066424316322183,text,2025-07-07T03:41:32.000Z,selenium_x_scraper_v1,หรือจริงๆคนปกป้องคือคนสติปกติ ไม่ได้ทำแอคโง่ๆที่มีคนฟอลคนเดียว เพราะรู้ว่าทัศนคติตัวเองเหี้ยโพสแบบนี้ในแอคจิงจะโดนเพื่อนเลิกคบ,หรือจริงๆคนปกป้องคือคนสติปกติ ไม่ได้ทำแอคโง่ๆที่มีคนฟอลคนเดียว เพราะรู้ว่าทัศนคติตัวเองเหี้ยโพสแบบนี้ในแอคจิงจะโดนเพื่อนเลิกคบ,2025-10-23 17:59:34,"['หรือ', 'จริงๆ', 'คน', 'ปกป้อง', 'คือ', 'คน', 'สติ', 'ปกติ', ' ', 'ไม่', 'ได้', 'ทำ', 'แอ', 'ค', 'โง่', 'ๆ', 'ที่', 'มี', 'คน', 'ฟอ', 'ล', 'คนเดียว', ' ', 'เพราะ', 'รู้', 'ว่า', 'ทัศนคติ', 'ตัวเอง', 'เหี้ย', 'โพส', 'แบบนี้', 'ใน', 'แอ', 'ค', 'จิง', 'จะ', 'โดน', 'เพื่อน', 'เลิกคบ']"
1941334912222757245,twitter,post,https://x.com/neptuneloki/status/1941334912222757245,text,2025-07-05T03:14:45.000Z,selenium_x_scraper_v1,unfortunately i’d be trying everyday to find an ick so i wouldn’t fall in love w him,unfortunately i’d be trying everyday to find an ick so i wouldn’t fall in love w him,2025-10-23 17:59:34,"['unfortunately', ' ', 'i', ' ', 'd', ' ', 'be', ' ', 'trying', ' ', 'everyday', ' ', 'to', ' ', 'find', ' ', 'an', ' ', 'ick', ' ', 'so', ' ', 'i', ' ', 'wouldn', ' ', 't', ' ', 'fall', ' ', 'in', ' ', 'love', ' ', 'w', ' ', 'him']"
1941718527167119450,twitter,post,https://x.com/Tim8666/status/1941718527167119450,text,2025-07-06T04:39:06.000Z,selenium_x_scraper_v1,คนในทวิตประสาทแดกแบบอีเหี่ยนีเยอะมาก กุว้าวสุดๆ,คนในทวิตประสาทแดกแบบอีเหี่ยนีเยอะมาก กุว้าวสุดๆ,2025-10-23 17:59:34,"['คนใน', 'ทวิ', 'ต', 'ประสาท', 'แดก', 'แบบ', 'อี', 'เหี่ยนี', 'เยอะ', 'มาก', ' ', 'กุ', 'ว้าว', 'สุด', 'ๆ']"
1940521910770581537,twitter,post,https://x.com/MissJoyfulLife/status/1940521910770581537,text,2025-07-02T21:24:11.000Z,selenium_x_scraper_v1,คนอิโดนีเซียดั้งเดิมไม่ใช่มุสลิม แต่ก่อนเค้าก็แต่งกันแบบนี้ พวกมรึงอ่ะมาทีหลัง อยู่ๆ ก็ถูกสั่งสอนให้เอาผ้าคลุมทั้งตัวซะงั้น ยังจะมีหน้าไปมองเค้าแปลกๆ อีก ,คนอิโดนีเซียดั้งเดิมไม่ใช่มุสลิม แต่ก่อนเค้าก็แต่งกันแบบนี้ พวกมรึงอ่ะมาทีหลัง อยู่ๆ ก็ถูกสั่งสอนให้เอาผ้าคลุมทั้งตัวซะงั้น ยังจะมีหน้าไปมองเค้าแปลกๆ อีก ,2025-10-23 17:59:34,"['คน', 'อิ', 'โด', 'นีเซีย', 'ดั้งเดิม', 'ไม่', 'ใช่', 'มุสลิม', ' ', 'แต่ก่อน', 'เค้า', 'ก็', 'แต่ง', 'กัน', 'แบบนี้', ' ', 'พวก', 'มรึง', 'อ่ะ', 'มา', 'ทีหลัง', ' ', 'อยู่', 'ๆ', ' ', 'ก็', 'ถูก', 'สั่งสอน', 'ให้', 'เอา', 'ผ้าคลุม', 'ทั้งตัว', 'ซะงั้น', ' ', 'ยัง', 'จะ', 'มีหน้า', 'ไป', 'มอง', 'เค้า', 'แปลก', 'ๆ', ' ', 'อีก']"
1940958523443368181,twitter,post,https://x.com/Tim8666/status/1940958523443368181,text,2025-07-04T02:19:07.000Z,selenium_x_scraper_v1,มึงน่าจะโง่จิงนะ คนจีนเคยโดนฆ่าบ้างเผ่าพันธ์ จนต้องย้ายไปออสเตรเลีย ศึกษาประวัติศาสตร์บ้างจ้า ไม่ใช่โง่เปนควายแบบนี้,มึงน่าจะโง่จิงนะ คนจีนเคยโดนฆ่าบ้างเผ่าพันธ์ จนต้องย้ายไปออสเตรเลีย ศึกษาประวัติศาสตร์บ้างจ้า ไม่ใช่โง่เปนควายแบบนี้,2025-10-23 17:59:34,"['มึง', 'น่าจะ', 'โง่', 'จิง', 'นะ', ' ', 'คนจีน', 'เคย', 'โดน', 'ฆ่า', 'บ้าง', 'เผ่า', 'พันธ์', ' ', 'จน', 'ต้อง', 'ย้าย', 'ไป', 'ออสเตรเลีย', ' ', 'ศึกษา', 'ประวัติศาสตร์', 'บ้าง', 'จ้า', ' ', 'ไม่', 'ใช่', 'โง่', 'เปน', 'ควาย', 'แบบนี้']"
1940948478030741871,twitter,post,https://x.com/Tim8666/status/1940948478030741871,text,2025-07-04T01:39:12.000Z,selenium_x_scraper_v1,ก็คนดูอายุ 15-17 มึงจะให้เค้าทำอะไร ตัวเองเรียนจบแล้วก็ควรหุบปากปะ อีห่า ประสาทแดก โลกไม่ไ่ด้หมุนรอยมึงเหมือนกันค่าา,ก็คนดูอายุ 15-17 มึงจะให้เค้าทำอะไร ตัวเองเรียนจบแล้วก็ควรหุบปากปะ อีห่า ประสาทแดก โลกไม่ไ่ด้หมุนรอยมึงเหมือนกันค่าา,2025-10-23 17:59:34,"['ก็', 'คนดู', 'อายุ', ' ', '15', ' ', '17', ' ', 'มึง', 'จะ', 'ให้', 'เค้า', 'ทำ', 'อะไร', ' ', 'ตัวเอง', 'เรียนจบ', 'แล้วก็', 'ควร', 'หุบปาก', 'ปะ', ' ', 'อี', 'ห่า', ' ', 'ประสาท', 'แดก', ' ', 'โลก', 'ไม่', 'ไ่ด้', 'หมุน', 'รอย', 'มึง', 'เหมือนกัน', 'ค่า', 'า']"
1940790968720281970,twitter,post,https://x.com/thegaywhostrayd/status/1940790968720281970,text,2025-07-03T15:13:19.000Z,selenium_x_scraper_v1,Rainbow retardation summarized,Rainbow retardation summarized,2025-10-23 17:59:34,"['rainbow', ' ', 'retardation', ' ', 'summarized']"
1940603079893963127,twitter,post,https://x.com/RedSkullxxx/status/1940603079893963127,text,2025-07-03T02:46:43.000Z,selenium_x_scraper_v1,ไม่ใช่นักเรียน แต่เป็นบุคคลภายนอก,ไม่ใช่นักเรียน แต่เป็นบุคคลภายนอก,2025-10-23 17:59:34,"['ไม่', 'ใช่', 'นักเรียน', ' ', 'แต่', 'เป็น', 'บุคคลภายนอก']"
1940141755028193298,twitter,post,https://x.com/GoldingBF/status/1940141755028193298,text,2025-07-01T20:13:35.000Z,selenium_x_scraper_v1,Facts ,Facts ,2025-10-23 17:59:34,['facts']
1940216258085147075,twitter,post,https://x.com/Tim8666/status/1940216258085147075,text,2025-07-02T01:09:38.000Z,selenium_x_scraper_v1,อันนี้คือ assume เอง มั่วๆโง่ๆละ,อันนี้คือ assume เอง มั่วๆโง่ๆละ,2025-10-23 17:59:34,"['อันนี้', 'คือ', ' ', 'assume', ' ', 'เอง', ' ', 'มั่ว', 'ๆ', 'โง่', 'ๆ', 'ละ']"
1940092609017622972,twitter,post,https://x.com/Tim8666/status/1940092609017622972,text,2025-07-01T16:58:17.000Z,selenium_x_scraper_v1,They would be killed by radical islam. Cope harder you dumb fuck,They would be killed by radical islam. Cope harder you dumb fuck,2025-10-23 17:59:34,"['they', ' ', 'would', ' ', 'be', ' ', 'killed', ' ', 'by', ' ', 'radical', ' ', 'islam', '.', ' ', 'cope', ' ', 'harder', ' ', 'you', ' ', 'dumb', ' ', 'fuck']"
1939846778586538230,twitter,post,https://x.com/Rothmus/status/1939846778586538230,text,2025-07-01T00:41:27.000Z,selenium_x_scraper_v1,,,2025-10-23 17:59:34,[]
1939480261608997326,twitter,post,https://x.com/checkmatthtv/status/1939480261608997326,text,2025-06-30T00:25:02.000Z,selenium_x_scraper_v1,eu depois da bruxa me transformar em um elefante na tailandia,eu depois da bruxa me transformar em um elefante na tailandia,2025-10-23 17:59:34,"['eu', ' ', 'depois', ' ', 'da', ' ', 'bruxa', ' ', 'me', ' ', 'transformar', ' ', 'em', ' ', 'um', ' ', 'elefante', ' ', 'na', ' ', 'tailandia']"
1939415536317698408,twitter,post,https://x.com/bottomjail/status/1939415536317698408,text,2025-06-29T20:07:51.000Z,selenium_x_scraper_v1,,,2025-10-23 17:59:34,[]
