id,platform,platform_type,url,content_type,timestamp,scraper_module,text,raw_text,scrape_date,tokens
1989506137436426487,twitter,post,https://x.com/Atta2486/status/1989506137436426487,text,2025-11-15T01:30:01.000Z,selenium_x_scraper_v1,สปป หลายๆอย่างยังช้ากว่าเราครับ เจริญก็แค่เวียงจันทร์ กับเมืองบางเมือง,สปป หลายๆอย่างยังช้ากว่าเราครับ เจริญก็แค่เวียงจันทร์ กับเมืองบางเมือง,2025-11-29 08:18:55,"['สปป', ' ', 'หลาย', 'ๆ', 'อย่าง', 'ยัง', 'ช้า', 'กว่า', 'เรา', 'ครับ', ' ', 'เจริญ', 'ก็', 'แค่', 'เวียง', 'จันทร์', ' ', 'กับ', 'เมือง', 'บาง', 'เมือง']"
1989956106253427156,twitter,post,https://x.com/tikkii010101/status/1989956106253427156,text,2025-11-16T07:18:01.000Z,selenium_x_scraper_v1,อันนี้ว่าโหดแล้วเคยเห็นพ่อแม่ขายลูกสาวอายุ 12-13 ให้คนจีน แล้วเด็กร้องไม่อยากไปโคตรหดหู่,อันนี้ว่าโหดแล้วเคยเห็นพ่อแม่ขายลูกสาวอายุ 12-13 ให้คนจีน แล้วเด็กร้องไม่อยากไปโคตรหดหู่,2025-11-29 08:18:55,"['อันนี้', 'ว่า', 'โหด', 'แล้ว', 'เคย', 'เห็น', 'พ่อแม่', 'ขาย', 'ลูกสาว', 'อายุ', ' ', '12', ' ', '13', ' ', 'ให้', 'คนจีน', ' ', 'แล้ว', 'เด็ก', 'ร้อง', 'ไม่', 'อยาก', 'ไป', 'โคตร', 'หดหู่']"
1989636622170870149,twitter,post,https://x.com/puis_pui/status/1989636622170870149,text,2025-11-15T10:08:31.000Z,selenium_x_scraper_v1,ตำรวจจับยังพรากผู้เยาว์นะมึงไอ้แก่,ตำรวจจับยังพรากผู้เยาว์นะมึงไอ้แก่,2025-11-29 08:18:55,"['ตำรวจ', 'จับ', 'ยัง', 'พรากผู้เยาว์', 'นะ', 'มึง', 'ไอ้', 'แก่']"
1989280291484270791,twitter,post,https://x.com/XFXS1414765/status/1989280291484270791,text,2025-11-14T10:32:35.000Z,selenium_x_scraper_v1,มึง มันไม่ใช่ Child Abuse หรอ แบบนี้ ,มึง มันไม่ใช่ Child Abuse หรอ แบบนี้ ,2025-11-29 08:18:55,"['มึง', ' ', 'มัน', 'ไม่', 'ใช่', ' ', 'child', ' ', 'abuse', ' ', 'หรอ', ' ', 'แบบนี้']"
1989340516111294780,twitter,post,https://x.com/selena_ddew/status/1989340516111294780,text,2025-11-14T14:31:53.000Z,selenium_x_scraper_v1,สงสารเด็กจัง ทำไมต้องมาเจอไรแบบนี้ด้วยนะ,สงสารเด็กจัง ทำไมต้องมาเจอไรแบบนี้ด้วยนะ,2025-11-29 08:18:55,"['สงสาร', 'เด็ก', 'จัง', ' ', 'ทำไม', 'ต้อง', 'มา', 'เจอ', 'ไร', 'แบบนี้', 'ด้วย', 'นะ']"
1989309312695484532,twitter,post,https://x.com/JJ8332/status/1989309312695484532,text,2025-11-14T12:27:54.000Z,selenium_x_scraper_v1,สงสารน้องจัง,สงสารน้องจัง,2025-11-29 08:18:55,"['สงสาร', 'น้อง', 'จัง']"
1989391626603827665,twitter,post,https://x.com/jame999555/status/1989391626603827665,text,2025-11-14T17:54:59.000Z,selenium_x_scraper_v1,"อิ่มๆจุกๆช่วงนี้ 
อย่าเข้าไปดูเพิ่มยอดวิวกันสิ","อิ่มๆจุกๆช่วงนี้ 
อย่าเข้าไปดูเพิ่มยอดวิวกันสิ",2025-11-29 08:18:55,"['อิ่มๆ', 'จุก', 'ๆ', 'ช่วงนี้', ' ', 'อย่า', 'เข้า', 'ไปดู', 'เพิ่ม', 'ยอด', 'วิว', 'กัน', 'สิ']"
1989398728311283923,twitter,post,https://x.com/Geekzilla5/status/1989398728311283923,text,2025-11-14T18:23:12.000Z,selenium_x_scraper_v1,ปกตินะ มุสลิมแต่งกับเมียเด็ก 9ขวบ,ปกตินะ มุสลิมแต่งกับเมียเด็ก 9ขวบ,2025-11-29 08:18:55,"['ปกติ', 'นะ', ' ', 'มุสลิม', 'แต่ง', 'กับ', 'เมีย', 'เด็ก', ' ', '9', 'ขวบ']"
1989306119249170701,twitter,post,https://x.com/kppkkth/status/1989306119249170701,text,2025-11-14T12:15:13.000Z,selenium_x_scraper_v1,คยกันตอน12 ตอนนี้21แล้ว,คยกันตอน12 ตอนนี้21แล้ว,2025-11-29 08:18:55,"['คย', 'กัน', 'ตอน', '12', ' ', 'ตอนนี้', '21', 'แล้ว']"
1989315596685848836,twitter,post,https://x.com/Pinic47661134/status/1989315596685848836,text,2025-11-14T12:52:52.000Z,selenium_x_scraper_v1,ขอข้ามประเด็นเปโด คุณแม่วัยใส พรากผู้เยาว์ เคสแบบนี้ยูทูปเบอร์ลาวชอบเอามาลง ขอรับเงินบริจาค คนที่ดูส่วนใหญ่ก็คนไทย บริจาคให้ บางคู่ไม่ทำมาหากินรอเงินบริจาคอย่างเดียว,ขอข้ามประเด็นเปโด คุณแม่วัยใส พรากผู้เยาว์ เคสแบบนี้ยูทูปเบอร์ลาวชอบเอามาลง ขอรับเงินบริจาค คนที่ดูส่วนใหญ่ก็คนไทย บริจาคให้ บางคู่ไม่ทำมาหากินรอเงินบริจาคอย่างเดียว,2025-11-29 08:18:55,"['ขอ', 'ข้าม', 'ประเด็น', 'เป', 'โด', ' ', 'คุณแม่', 'วัย', 'ใส', ' ', 'พรากผู้เยาว์', ' ', 'เคส', 'แบบนี้', 'ยู', 'ทู', 'ป', 'เบอร์', 'ลาว', 'ชอบ', 'เอา', 'มา', 'ลง', ' ', 'ขอรับ', 'เงินบริจาค', ' ', 'คน', 'ที่', 'ดู', 'ส่วนใหญ่', 'ก็', 'คนไทย', ' ', 'บริจาค', 'ให้', ' ', 'บาง', 'คู่', 'ไม่', 'ทำมาหากิน', 'รอ', 'เงินบริจาค', 'อย่าง', 'เดียว']"
1989371374797037577,twitter,post,https://x.com/CatisCats/status/1989371374797037577,text,2025-11-14T16:34:31.000Z,selenium_x_scraper_v1,ละแววตาผู้หญิงคือเศร้ามาก สงสารเขาอะ เด็กที่เกิดมาอีก เกลียดคนแก่แบบนี้ที่สุด,ละแววตาผู้หญิงคือเศร้ามาก สงสารเขาอะ เด็กที่เกิดมาอีก เกลียดคนแก่แบบนี้ที่สุด,2025-11-29 08:18:55,"['ละ', 'แววตา', 'ผู้หญิง', 'คือ', 'เศร้า', 'มาก', ' ', 'สงสาร', 'เขา', 'อะ', ' ', 'เด็ก', 'ที่เกิด', 'มา', 'อีก', ' ', 'เกลียด', 'คนแก่', 'แบบนี้', 'ที่สุด']"
1989348323569062103,twitter,post,https://x.com/priyanku001/status/1989348323569062103,text,2025-11-14T15:02:55.000Z,selenium_x_scraper_v1,"“เรื่องนี้น่ากลัวมากจริงๆ…
ผู้ใหญ่ควรปกป้องเด็ก แต่กลับทำร้ายเด็กเอง มันยอมรับไม่ได้เลย
ขอให้เด็กได้รับการช่วยเหลือและความปลอดภัยโดยเร็วที่สุด”","“เรื่องนี้น่ากลัวมากจริงๆ…
ผู้ใหญ่ควรปกป้องเด็ก แต่กลับทำร้ายเด็กเอง มันยอมรับไม่ได้เลย
ขอให้เด็กได้รับการช่วยเหลือและความปลอดภัยโดยเร็วที่สุด”",2025-11-29 08:18:55,"['เรื่อง', 'นี้', 'น่ากลัว', 'มาก', 'จริงๆ', ' ', 'ผู้ใหญ่', 'ควร', 'ปกป้อง', 'เด็ก', ' ', 'แต่กลับ', 'ทำร้าย', 'เด็ก', 'เอง', ' ', 'มัน', 'ยอมรับ', 'ไม่', 'ได้', 'เลย', ' ', 'ขอให้', 'เด็ก', 'ได้รับ', 'การ', 'ช่วยเหลือ', 'และ', 'ความปลอดภัย', 'โดยเร็ว', 'ที่สุด']"
