id,platform,platform_type,url,content_type,timestamp,scraper_module,text,raw_text,scrape_date,tokens
1985203475798704421,twitter,post,https://x.com/WN7171/status/1985203475798704421,text,2025-11-03T04:32:46.000Z,selenium_x_scraper_v1,เรามีองค์ความรู้มากขึ้นในเรื่องต่างๆ เรื่องที่ต้องระมัดระวัง ที่แน่ๆ เรื่องที่ไม่ควรแตะเพราะมันกระทบจิตใจผู้อื่นคือเรื่องศาสนา รายได้ และเพศ ก็ในเมื่อรู้แล้วทำไมไม่เลี่ยงล่ะคะ ทุกคนมีปมในใจ หนูเชื่อว่าคุณพี่ก็มีเรื่องที่ไม่อยากให้คนล้อเหมือนกันแหละ ใจเขาใจเราเนอะ,เรามีองค์ความรู้มากขึ้นในเรื่องต่างๆ เรื่องที่ต้องระมัดระวัง ที่แน่ๆ เรื่องที่ไม่ควรแตะเพราะมันกระทบจิตใจผู้อื่นคือเรื่องศาสนา รายได้ และเพศ ก็ในเมื่อรู้แล้วทำไมไม่เลี่ยงล่ะคะ ทุกคนมีปมในใจ หนูเชื่อว่าคุณพี่ก็มีเรื่องที่ไม่อยากให้คนล้อเหมือนกันแหละ ใจเขาใจเราเนอะ,2025-11-29 08:18:55,"['เรา', 'มี', 'องค์ความรู้', 'มากขึ้น', 'ใน', 'เรื่อง', 'ต่างๆ', ' ', 'เรื่อง', 'ที่', 'ต้อง', 'ระมัดระวัง', ' ', 'ที่', 'แน่ๆ', ' ', 'เรื่อง', 'ที่', 'ไม่', 'ควร', 'แตะ', 'เพราะ', 'มัน', 'กระทบ', 'จิตใจ', 'ผู้อื่น', 'คือ', 'เรื่อง', 'ศาสนา', ' ', 'รายได้', ' ', 'และ', 'เพศ', ' ', 'ก็', 'ใน', 'เมื่อ', 'รู้', 'แล้ว', 'ทำไม', 'ไม่', 'เลี่ยง', 'ล่ะ', 'คะ', ' ', 'ทุกคน', 'มี', 'ปม', 'ใน', 'ใจ', ' ', 'หนู', 'เชื่อ', 'ว่า', 'คุณ', 'พี่', 'ก็', 'มีเรื่อง', 'ที่', 'ไม่', 'อยาก', 'ให้', 'คน', 'ล้อ', 'เหมือนกัน', 'แหละ', ' ', 'ใจ', 'เขา', 'ใจ', 'เรา', 'เนอะ']"
1985232545924202787,twitter,post,https://x.com/OongSeal/status/1985232545924202787,text,2025-11-03T06:28:17.000Z,selenium_x_scraper_v1,ชายหญิงทั่วไป  ก็โดนล้อ  แบบเหมารวมได้ ยิ่งผู้ชายโดนด่าเหมารวมออกบ่อย  ก็มาจากเฟมทวิตในเน็ตนี่แหละ  คือคนทั่วไปก็โดนล้อโดนด่าแบบเหมารวมได้  แต่จะมีแค่บางกลุ่มที่ถูกล้อแบบเหมารวมไม่ได้  ต้อง PC ทันที,ชายหญิงทั่วไป  ก็โดนล้อ  แบบเหมารวมได้ ยิ่งผู้ชายโดนด่าเหมารวมออกบ่อย  ก็มาจากเฟมทวิตในเน็ตนี่แหละ  คือคนทั่วไปก็โดนล้อโดนด่าแบบเหมารวมได้  แต่จะมีแค่บางกลุ่มที่ถูกล้อแบบเหมารวมไม่ได้  ต้อง PC ทันที,2025-11-29 08:18:55,"['ชาย', 'หญิง', 'ทั่วไป', ' ', 'ก็', 'โดน', 'ล้อ', ' ', 'แบบ', 'เหมา', 'รวม', 'ได้', ' ', 'ยิ่ง', 'ผู้ชาย', 'โดน', 'ด่า', 'เหมา', 'รวม', 'ออก', 'บ่อย', ' ', 'ก็', 'มาจาก', 'เฟม', 'ทวิ', 'ต', 'ใน', 'เน็ต', 'นี่แหละ', ' ', 'คือ', 'คน', 'ทั่วไป', 'ก็', 'โดน', 'ล้อ', 'โดน', 'ด่า', 'แบบ', 'เหมา', 'รวม', 'ได้', ' ', 'แต่', 'จะ', 'มี', 'แค่', 'บาง', 'กลุ่ม', 'ที่', 'ถูก', 'ล้อแบบ', 'เหมา', 'รวม', 'ไม่', 'ได้', ' ', 'ต้อง', ' ', 'pc', ' ', 'ทันที']"
1985424010948297015,twitter,post,https://x.com/Beam_tck/status/1985424010948297015,text,2025-11-03T19:09:06.000Z,selenium_x_scraper_v1,จนนนน ปทมีสมรสเท่าเทียมเเล้ว ก็ยังเสร่อใช้คำอุบาทว์เหมือนสังคมที่มึงโตมา อีกอย่างเห็นในรูปโชว์ถย คือรณรงค์ใส่ถย กันโรคติดต่อ แต่เสร่อชูโชว์สูงเชียว เจริญเถอะ ปยอ,จนนนน ปทมีสมรสเท่าเทียมเเล้ว ก็ยังเสร่อใช้คำอุบาทว์เหมือนสังคมที่มึงโตมา อีกอย่างเห็นในรูปโชว์ถย คือรณรงค์ใส่ถย กันโรคติดต่อ แต่เสร่อชูโชว์สูงเชียว เจริญเถอะ ปยอ,2025-11-29 08:18:55,"['จน', 'นนน', ' ', 'ปท', 'มี', 'สมรส', 'เท่าเทียม', 'เเล้ว', ' ', 'ก็', 'ยัง', 'เสร่อ', 'ใช้', 'คำ', 'อุบาทว์', 'เหมือน', 'สังคม', 'ที่', 'มึง', 'โตมา', ' ', 'อีก', 'อย่าง', 'เห็น', 'ใน', 'รูป', 'โชว์', 'ถย', ' ', 'คือ', 'รณรงค์', 'ใส่', 'ถย', ' ', 'กัน', 'โรคติดต่อ', ' ', 'แต่', 'เสร่อ', 'ชู', 'โชว์', 'สูง', 'เชียว', ' ', 'เจริญ', 'เถอะ', ' ', 'ปยอ']"
1985016956035154315,twitter,post,https://x.com/park120816/status/1985016956035154315,text,2025-11-02T16:11:36.000Z,selenium_x_scraper_v1,ละไหน บอก สนับสนุน LGBT บอกไทยเปิดกว้าง ก็ไม่?? พาดหัวข่าว ได้สันดาร ชายแท้จริงๆ,ละไหน บอก สนับสนุน LGBT บอกไทยเปิดกว้าง ก็ไม่?? พาดหัวข่าว ได้สันดาร ชายแท้จริงๆ,2025-11-29 08:18:55,"['ละ', 'ไหน', ' ', 'บอก', ' ', 'สนับสนุน', ' ', 'lgbt', ' ', 'บอก', 'ไทย', 'เปิดกว้าง', ' ', 'ก็', 'ไม่', '?', ' ', 'พาดหัวข่าว', ' ', 'ได้', 'สัน', 'ดาร', ' ', 'ชาย', 'แท้', 'จริงๆ']"
1985165018065989756,twitter,post,https://x.com/goyard234/status/1985165018065989756,text,2025-11-03T01:59:57.000Z,selenium_x_scraper_v1,"ปีหลังมาเห็นพยายามควบคุมกันดีกว่ายุคก่อนๆ
ข่าวโดดตึกก็ไม่ใช้คำว่าโดดตึก ใช้คำว่าพลัดตก มันเซฟใจญาติปกป้องผู้เสียชีวิตดีนะ
มีข่าวLGBTQ+ก็ไม่ค่อยมีพาดหัวสาวทอมทำร้ายแฟนอะไรงี้เท่าไหร่แล้ว

มีสนข.เดียวนั้นแหละที่พยายามตามโลกให้ทันเสิร์ฟทุกแพตฟอร์มแต่ทัศนคติการทำข่าวยังล้าหลังอยู่มาก","ปีหลังมาเห็นพยายามควบคุมกันดีกว่ายุคก่อนๆ
ข่าวโดดตึกก็ไม่ใช้คำว่าโดดตึก ใช้คำว่าพลัดตก มันเซฟใจญาติปกป้องผู้เสียชีวิตดีนะ
มีข่าวLGBTQ+ก็ไม่ค่อยมีพาดหัวสาวทอมทำร้ายแฟนอะไรงี้เท่าไหร่แล้ว

มีสนข.เดียวนั้นแหละที่พยายามตามโลกให้ทันเสิร์ฟทุกแพตฟอร์มแต่ทัศนคติการทำข่าวยังล้าหลังอยู่มาก",2025-11-29 08:18:55,"['ปี', 'หลัง', 'มา', 'เห็น', 'พยายาม', 'ควบคุม', 'กัน', 'ดีกว่า', 'ยุค', 'ก่อน', 'ๆ', ' ', 'ข่าว', 'โดด', 'ตึก', 'ก็', 'ไม่', 'ใช้', 'คำ', 'ว่า', 'โดด', 'ตึก', ' ', 'ใช้', 'คำ', 'ว่า', 'พลัดตก', ' ', 'มัน', 'เซฟ', 'ใจ', 'ญาติ', 'ปกป้อง', 'ผู้เสียชีวิต', 'ดี', 'นะ', ' ', 'มี', 'ข่าว', 'lgbtq', ' ', 'ก็', 'ไม่ค่อย', 'มี', 'พาดหัว', 'สาว', 'ทอม', 'ทำร้าย', 'แฟน', 'อะไร', 'งี้', 'เท่าไหร่', 'แล้ว', ' ', 'มี', 'สน', 'ข', '.', 'เดียว', 'นั้นแหละ', 'ที่', 'พยายาม', 'ตาม', 'โลก', 'ให้', 'ทัน', 'เสิร์ฟ', 'ทุก', 'แพ', 'ต', 'ฟอร์ม', 'แต่', 'ทัศนคติ', 'การ', 'ทำ', 'ข่าว', 'ยัง', 'ล้าหลัง', 'อยู่', 'มาก']"
1985284965232476299,twitter,post,https://x.com/PeachPeach_Z/status/1985284965232476299,text,2025-11-03T09:56:35.000Z,selenium_x_scraper_v1,ใช้คำเชี่ยมากกก,ใช้คำเชี่ยมากกก,2025-11-29 08:18:55,"['ใช้', 'คำ', 'เชี่ย', 'มาก', 'กก']"
1984958707009220651,twitter,post,https://x.com/hlblb/status/1984958707009220651,text,2025-11-02T12:20:09.000Z,selenium_x_scraper_v1,ความชายแท้ขี้เหยียดที่ถูกปลูกฝังมาตั้งแต่เตรียมนายร้อย คนคิดชื่อ ‘ปฏิบัติการเหมืองทอง’ คือสาบานว่าผ่านสมองแล้ว? / แล้วชายแท้ชอบเล่นใหญ่มาก ขอให้ได้ควงปืน (มีรายงานว่าในปาร์ตี้อาวุธด้วยเหรอ??) / มั่นใจมากว่าเจ้าพนักงานหญิงและ LGBT ในหน่วยนี้คือโดนกดโคตรต่ำเหมือนในหนังซองแดงฯแน่นอน,ความชายแท้ขี้เหยียดที่ถูกปลูกฝังมาตั้งแต่เตรียมนายร้อย คนคิดชื่อ ‘ปฏิบัติการเหมืองทอง’ คือสาบานว่าผ่านสมองแล้ว? / แล้วชายแท้ชอบเล่นใหญ่มาก ขอให้ได้ควงปืน (มีรายงานว่าในปาร์ตี้อาวุธด้วยเหรอ??) / มั่นใจมากว่าเจ้าพนักงานหญิงและ LGBT ในหน่วยนี้คือโดนกดโคตรต่ำเหมือนในหนังซองแดงฯแน่นอน,2025-11-29 08:18:55,"['ความ', 'ชาย', 'แท้', 'ขี้', 'เหยียด', 'ที่', 'ถูก', 'ปลูกฝัง', 'มา', 'ตั้งแต่', 'เตรียม', 'นายร้อย', ' ', 'คน', 'คิด', 'ชื่อ', ' ', 'ปฏิบัติการ', 'เหมือง', 'ทอง', ' ', 'คือ', 'สาบาน', 'ว่า', 'ผ่าน', 'สมอง', 'แล้ว', '?', ' ', 'แล้ว', 'ชาย', 'แท้', 'ชอบ', 'เล่น', 'ใหญ่', 'มาก', ' ', 'ขอ', 'ให้ได้', 'ควง', 'ปืน', ' ', 'มี', 'รายงาน', 'ว่า', 'ใน', 'ปาร์ตี้', 'อาวุธ', 'ด้วย', 'เหรอ', '?', ' ', 'มั่น', 'ใจมา', 'กว่า', 'เจ้าพนักงาน', 'หญิง', 'และ', ' ', 'lgbt', ' ', 'ใน', 'หน่วย', 'นี้', 'คือ', 'โดน', 'กด', 'โคตร', 'ต่ำ', 'เหมือน', 'ใน', 'หนัง', 'ซอง', 'แดง', 'ฯ', 'แน่นอน']"
1984967585050533899,twitter,post,https://x.com/danaitr_/status/1984967585050533899,text,2025-11-02T12:55:25.000Z,selenium_x_scraper_v1,เล่นยาผิดที่เจตนา ปั่นประเด็นผิดที่สำนึก,เล่นยาผิดที่เจตนา ปั่นประเด็นผิดที่สำนึก,2025-11-29 08:18:55,"['เล่น', 'ยา', 'ผิดที่', 'เจตนา', ' ', 'ปั่น', 'ประเด็น', 'ผิดที่', 'สำนึก']"
1985003392780161330,twitter,post,https://x.com/space_fAim/status/1985003392780161330,text,2025-11-02T15:17:43.000Z,selenium_x_scraper_v1,จริง สรุปอะไรมันเป็นภัยกับสังคมนี้มากกว่า,จริง สรุปอะไรมันเป็นภัยกับสังคมนี้มากกว่า,2025-11-29 08:18:55,"['จริง', ' ', 'สรุป', 'อะไร', 'มัน', 'เป็น', 'ภัย', 'กับ', 'สังคม', 'นี้', 'มากกว่า']"
1985156099021152578,twitter,post,https://x.com/pheemphxt/status/1985156099021152578,text,2025-11-03T01:24:31.000Z,selenium_x_scraper_v1,ก็มันตีกระแสง่ายหนิ ใส่lgbtq+เข้ามาคนก็มุงละ,ก็มันตีกระแสง่ายหนิ ใส่lgbtq+เข้ามาคนก็มุงละ,2025-11-29 08:18:55,"['ก็', 'มัน', 'ตี', 'กระแส', 'ง่าย', 'หนิ', ' ', 'ใส่', 'lgbtq', ' ', 'เข้ามา', 'คน', 'ก็', 'มุง', 'ละ']"
1985217744846118951,twitter,post,https://x.com/TiiTY_KH/status/1985217744846118951,text,2025-11-03T05:29:28.000Z,selenium_x_scraper_v1,อยากรู้เหมือนกันว่าถ้าเป็นปาร์ตี้เล่นยาชายหญิง ตำรวจหรือนักข่าวจะปั่นข่าวว่าอะไร จงยกตัวอย่าง 10 คะแนน,อยากรู้เหมือนกันว่าถ้าเป็นปาร์ตี้เล่นยาชายหญิง ตำรวจหรือนักข่าวจะปั่นข่าวว่าอะไร จงยกตัวอย่าง 10 คะแนน,2025-11-29 08:18:55,"['อยากรู้', 'เหมือนกัน', 'ว่า', 'ถ้า', 'เป็น', 'ปาร์ตี้', 'เล่น', 'ยา', 'ชาย', 'หญิง', ' ', 'ตำรวจ', 'หรือ', 'นักข่าว', 'จะ', 'ปั่น', 'ข่าว', 'ว่า', 'อะไร', ' ', 'จง', 'ยกตัวอย่าง', ' ', '10', ' ', 'คะแนน']"
1984946787652931884,twitter,post,https://x.com/Goodstuff420th/status/1984946787652931884,text,2025-11-02T11:32:47.000Z,selenium_x_scraper_v1,ตอนแรกอ่านข่าว นึกว่า เหมืองทองจริงๆ เห้อ.. มาจากพวกตกโลกอีกแล้ว,ตอนแรกอ่านข่าว นึกว่า เหมืองทองจริงๆ เห้อ.. มาจากพวกตกโลกอีกแล้ว,2025-11-29 08:18:55,"['ตอนแรก', 'อ่าน', 'ข่าว', ' ', 'นึก', 'ว่า', ' ', 'เหมือง', 'ทอง', 'จริงๆ', ' ', 'เห้อ', '..', ' ', 'มาจาก', 'พวก', 'ตก', 'โลก', 'อีกแล้ว']"
1984979817402642626,twitter,post,https://x.com/mydearest1001/status/1984979817402642626,text,2025-11-02T13:44:02.000Z,selenium_x_scraper_v1,Disgusting,Disgusting,2025-11-29 08:18:55,['disgusting']
1985140993684062554,twitter,post,https://x.com/angoonDee/status/1985140993684062554,text,2025-11-03T00:24:29.000Z,selenium_x_scraper_v1,มีคนพูดสักที เห็นเมื่อวานมีคนเจอยาเสพยาแค่ไม่กี่คน แต่ยา pop อะไรนั่นต้องดูว่าใครจัดหา,มีคนพูดสักที เห็นเมื่อวานมีคนเจอยาเสพยาแค่ไม่กี่คน แต่ยา pop อะไรนั่นต้องดูว่าใครจัดหา,2025-11-29 08:18:55,"['มี', 'คนพูด', 'สักที', ' ', 'เห็น', 'เมื่อวาน', 'มี', 'คน', 'เจอ', 'ยา', 'เสพ', 'ยา', 'แค่', 'ไม่', 'กี่', 'คน', ' ', 'แต่', 'ยา', ' ', 'pop', ' ', 'อะไร', 'นั่น', 'ต้อง', 'ดู', 'ว่า', 'ใคร', 'จัดหา']"
1985246462494814454,twitter,post,https://x.com/ka_mung/status/1985246462494814454,text,2025-11-03T07:23:35.000Z,selenium_x_scraper_v1,ตำรวจแจ้งสื่อแบบนี้จริงดิ,ตำรวจแจ้งสื่อแบบนี้จริงดิ,2025-11-29 08:18:55,"['ตำรวจ', 'แจ้ง', 'สื่อ', 'แบบนี้', 'จริง', 'ดิ']"
1985366593917075749,twitter,post,https://x.com/saladESH/status/1985366593917075749,text,2025-11-03T15:20:56.000Z,selenium_x_scraper_v1,"ตำรวจหรือสื่อ?
เอาดีๆ นะ","ตำรวจหรือสื่อ?
เอาดีๆ นะ",2025-11-29 08:18:55,"['ตำรวจ', 'หรือ', 'สื่อ', '?', ' ', 'เอา', 'ดี', 'ๆ', ' ', 'นะ']"
1984961736399814999,twitter,post,https://x.com/aoikotori/status/1984961736399814999,text,2025-11-02T12:32:11.000Z,selenium_x_scraper_v1,แรงมาก ตำรวจเหยียดเพศนะแบบนี้,แรงมาก ตำรวจเหยียดเพศนะแบบนี้,2025-11-29 08:18:55,"['แรง', 'มาก', ' ', 'ตำรวจ', 'เหยียด', 'เพศ', 'นะ', 'แบบนี้']"
1984981021318885797,twitter,post,https://x.com/mymnpl/status/1984981021318885797,text,2025-11-02T13:48:49.000Z,selenium_x_scraper_v1,สภาพตำรวจไทยอ่าเนาะ,สภาพตำรวจไทยอ่าเนาะ,2025-11-29 08:18:55,"['สภาพ', 'ตำรวจ', 'ไทย', 'อ่า', 'เนาะ']"
1984884342389358861,twitter,post,https://x.com/zanyama_/status/1984884342389358861/photo/1,text,2025-11-02T07:24:39.000Z,selenium_x_scraper_v1,"แย่ไปหมด ตั้งแต่ จนท ที่ตั้งชืีอปฏิบัติการ คนเขียนข่าว และคนคอมเม้น 

แยกให้ออกนะครับระหว่าง LGBTQ+ กับการเล่นยา สองอย่างนี้แยกกัน คนเล่นยาไม่ต้องเป็น LGBTQ+ และเป็น LGBTQ+ ไม่จำเป็นต้องเล่นยา

ถ้าเอามาเหมารวม หรือเอามาเล่นโจ๊ก ก็ควรทบทวนทัศนคติใหม่ว่าเหมาะสมกับยุคปัจจุบันหรือยัง","แย่ไปหมด ตั้งแต่ จนท ที่ตั้งชืีอปฏิบัติการ คนเขียนข่าว และคนคอมเม้น 

แยกให้ออกนะครับระหว่าง LGBTQ+ กับการเล่นยา สองอย่างนี้แยกกัน คนเล่นยาไม่ต้องเป็น LGBTQ+ และเป็น LGBTQ+ ไม่จำเป็นต้องเล่นยา

ถ้าเอามาเหมารวม หรือเอามาเล่นโจ๊ก ก็ควรทบทวนทัศนคติใหม่ว่าเหมาะสมกับยุคปัจจุบันหรือยัง",2025-11-29 08:18:55,"['แย่', 'ไป', 'หมด', ' ', 'ตั้งแต่', ' ', 'จน', 'ท', ' ', 'ที่ตั้ง', 'ชืีอ', 'ปฏิบัติการ', ' ', 'คนเขียนข่าว', ' ', 'และ', 'คน', 'คอม', 'เม้น', ' ', 'แยก', 'ให้', 'ออก', 'นะ', 'ครับ', 'ระหว่าง', ' ', 'lgbtq', ' ', 'กับ', 'การ', 'เล่น', 'ยา', ' ', 'สอง', 'อย่างนี้', 'แยกกัน', ' ', 'คน', 'เล่น', 'ยา', 'ไม่ต้อง', 'เป็น', ' ', 'lgbtq', ' ', 'และ', 'เป็น', ' ', 'lgbtq', ' ', 'ไม่', 'จำเป็นต้อง', 'เล่น', 'ยา', ' ', 'ถ้า', 'เอา', 'มา', 'เหมา', 'รวม', ' ', 'หรือ', 'เอา', 'มา', 'เล่น', 'โจ๊ก', ' ', 'ก็', 'ควร', 'ทบทวน', 'ทัศนคติ', 'ใหม่', 'ว่า', 'เหมาะสม', 'กับ', 'ยุคปัจจุบัน', 'หรือยัง']"
1984968430962000070,twitter,post,https://x.com/iamthebestnaka/status/1984968430962000070,text,2025-11-02T12:58:47.000Z,selenium_x_scraper_v1,เราว่ากลุ่มนี้เหมือนทํางานเอาหน้าเพื่อโปรโมทให้ตํารวจดูดีในสายตาประชาชน แต่ไม่อะ คนที่ฉลาดมันดูออกว่าอันเนี้ยมันคือการโฆษณา มันเหมือนตํารวจดารามากกว่า,เราว่ากลุ่มนี้เหมือนทํางานเอาหน้าเพื่อโปรโมทให้ตํารวจดูดีในสายตาประชาชน แต่ไม่อะ คนที่ฉลาดมันดูออกว่าอันเนี้ยมันคือการโฆษณา มันเหมือนตํารวจดารามากกว่า,2025-11-29 08:18:55,"['เรา', 'ว่า', 'กลุ่ม', 'นี้', 'เห', 'มือ', 'นท', 'ํา', 'งาน', 'เอาหน้า', 'เพื่อ', 'โปรโมท', 'ให้', 'ตํารวจ', 'ดูดี', 'ใน', 'สายตา', 'ประชาชน', ' ', 'แต่', 'ไม่', 'อะ', ' ', 'คน', 'ที่', 'ฉลาด', 'มัน', 'ดูออก', 'ว่า', 'อัน', 'เนี้ย', 'มัน', 'คือ', 'การ', 'โฆษณา', ' ', 'มัน', 'เหมือน', 'ตํารวจ', 'ดารา', 'มากกว่า']"
1984962608446001461,twitter,post,https://x.com/airzlittleone/status/1984962608446001461,text,2025-11-02T12:35:39.000Z,selenium_x_scraper_v1,ถุงยางมันเกี่ยวอะไร,ถุงยางมันเกี่ยวอะไร,2025-11-29 08:18:55,"['ถุงยาง', 'มัน', 'เกี่ยว', 'อะไร']"
