id,platform,platform_type,url,content_type,timestamp,scraper_module,text,raw_text,scrape_date,tokens
1980499366231323076,twitter,post,https://x.com/thekingofotaku/status/1980499366231323076,text,2025-10-21T05:00:19.000Z,selenium_x_scraper_v1,"ความสวยก็คือความสวย
การแต่งตัวโป๊ในที่สาธารณะก็คือการแต่งตัวโป๊ แยกแยะ","ความสวยก็คือความสวย
การแต่งตัวโป๊ในที่สาธารณะก็คือการแต่งตัวโป๊ แยกแยะ",2025-11-29 08:18:55,"['ความ', 'สวย', 'ก็', 'คือ', 'ความ', 'สวย', ' ', 'การ', 'แต่งตัว', 'โป๊', 'ใน', 'ที่สาธารณะ', 'ก็', 'คือ', 'การ', 'แต่งตัว', 'โป๊', ' ', 'แยกแยะ']"
1980393139300073620,twitter,post,https://x.com/_chanyoly/status/1980393139300073620,text,2025-10-20T21:58:12.000Z,selenium_x_scraper_v1,โอ้ยเดี๋ยวนี้ทวิตมันเริ่ดนะ ทวิตอยู่บ้านแต่ทำไมได้กลิ่นเหม็นเปรี้ยวอะ ,โอ้ยเดี๋ยวนี้ทวิตมันเริ่ดนะ ทวิตอยู่บ้านแต่ทำไมได้กลิ่นเหม็นเปรี้ยวอะ ,2025-11-29 08:18:55,"['โอ้ย', 'เดี๋ยวนี้', 'ทวิ', 'ต', 'มัน', 'เริ่ด', 'นะ', ' ', 'ทวิ', 'ตอ', 'ยู่', 'บ้าน', 'แต่', 'ทำไม', 'ได้กลิ่น', 'เหม็นเปรี้ยว', 'อะ']"
1980401293471731952,twitter,post,https://x.com/_chanyoly/status/1980401293471731952,text,2025-10-20T22:30:37.000Z,selenium_x_scraper_v1,โอ้ยเจ็บมาก สมกับเป็นราชาโอตาคุลูสเซอร์ วันๆสั่งสอนคนนั้นคนนี้ไปทั่ว หัดดูสภาพตัวมึงบ้างนะ นอกจากน้ำไม่อาบสันดานยังเสียอีก  เหน็นเปรี้ยวๆ,โอ้ยเจ็บมาก สมกับเป็นราชาโอตาคุลูสเซอร์ วันๆสั่งสอนคนนั้นคนนี้ไปทั่ว หัดดูสภาพตัวมึงบ้างนะ นอกจากน้ำไม่อาบสันดานยังเสียอีก  เหน็นเปรี้ยวๆ,2025-11-29 08:18:55,"['โอ้ย', 'เจ็บ', 'มาก', ' ', 'สม', 'กับ', 'เป็น', 'ราชา', 'โอ', 'ตา', 'คุ', 'ลูส', 'เซอร์', ' ', 'วัน', 'ๆ', 'สั่งสอน', 'คน', 'นั้น', 'คน', 'นี้', 'ไป', 'ทั่ว', ' ', 'หัด', 'ดู', 'สภาพ', 'ตัว', 'มึง', 'บ้าง', 'นะ', ' ', 'นอกจาก', 'น้ำ', 'ไม่', 'อาบ', 'สันดาน', 'ยัง', 'เสีย', 'อีก', ' ', 'เหน็น', 'เปรี้ยว', 'ๆ']"
1980404980646608978,twitter,post,https://x.com/thekingofotaku/status/1980404980646608978,text,2025-10-20T22:45:16.000Z,selenium_x_scraper_v1,ไปบอกเจนิสมึงนู้นเรื่องอาบน้ำ,ไปบอกเจนิสมึงนู้นเรื่องอาบน้ำ,2025-11-29 08:18:55,"['ไป', 'บอก', 'เจ', 'นิ', 'ส', 'มึง', 'นู้น', 'เรื่อง', 'อาบน้ำ']"
1980390048827855337,twitter,post,https://x.com/mimo_jang/status/1980390048827855337,text,2025-10-20T21:45:56.000Z,selenium_x_scraper_v1,ตัดควยช่วยชาติ,ตัดควยช่วยชาติ,2025-11-29 08:18:55,"['ตัด', 'ควย', 'ช่วย', 'ชาติ']"
1980392523932794897,twitter,post,https://x.com/thekingofotaku/status/1980392523932794897,text,2025-10-20T21:55:46.000Z,selenium_x_scraper_v1,ควยมึงเหรอ?,ควยมึงเหรอ?,2025-11-29 08:18:55,"['ควย', 'มึง', 'เหรอ', '?']"
1980381704469770491,twitter,post,https://x.com/LKnnAkk/status/1980381704469770491,text,2025-10-20T21:12:46.000Z,selenium_x_scraper_v1,เบียวขอจริงไอ้นี่55555555,เบียวขอจริงไอ้นี่55555555,2025-11-29 08:18:55,"['เบียวขอ', 'จริง', 'ไอ้', 'นี่', 'หัวเราะ']"
1980386792370290916,twitter,post,https://x.com/thekingofotaku/status/1980386792370290916,text,2025-10-20T21:32:59.000Z,selenium_x_scraper_v1,เถียงไม่ได้ล่ะสิ,เถียงไม่ได้ล่ะสิ,2025-11-29 08:18:55,"['เถียง', 'ไม่', 'ได้', 'ล่ะ', 'สิ']"
1980378894143484329,twitter,post,https://x.com/jh96_bot/status/1980378894143484329,text,2025-10-20T21:01:36.000Z,selenium_x_scraper_v1,เด็กแถวบ้านบางคนยิ่งกว่าเจนิสอี๊ก,เด็กแถวบ้านบางคนยิ่งกว่าเจนิสอี๊ก,2025-11-29 08:18:55,"['เด็ก', 'แถว', 'บ้าน', 'บางคน', 'ยิ่งกว่า', 'เจ', 'นิ', 'ส', 'อี๊', 'ก']"
1980379053598363895,twitter,post,https://x.com/thekingofotaku/status/1980379053598363895,text,2025-10-20T21:02:14.000Z,selenium_x_scraper_v1,นั่นไง ก็ดาราเป็นแบบอย่างให้เด็กมันทำตาม,นั่นไง ก็ดาราเป็นแบบอย่างให้เด็กมันทำตาม,2025-11-29 08:18:55,"['นั่นไง', ' ', 'ก็', 'ดารา', 'เป็น', 'แบบอย่าง', 'ให้', 'เด็ก', 'มัน', 'ทำตาม']"
1980370648267645014,twitter,post,https://x.com/sttrose/status/1980370648267645014,text,2025-10-20T20:28:50.000Z,selenium_x_scraper_v1,ชีrage baitป้ะคำพูดคำจาไม่เหมือนคนแบบเคยใช้ชีวิต แต่ถ้าไม่ก้คือ ประหลาดดี turnขวาเพราะแค่คนอื่นพูดจาไมาถูกใจ อีดอก5555 โดนinfluence ง่ายเนอะ อุดมการณ์ก้แค่ตัวอักษร,ชีrage baitป้ะคำพูดคำจาไม่เหมือนคนแบบเคยใช้ชีวิต แต่ถ้าไม่ก้คือ ประหลาดดี turnขวาเพราะแค่คนอื่นพูดจาไมาถูกใจ อีดอก5555 โดนinfluence ง่ายเนอะ อุดมการณ์ก้แค่ตัวอักษร,2025-11-29 08:18:55,"['ชี', 'rage', ' ', 'bait', 'ป้ะ', 'คำพูดคำจา', 'ไม่', 'เหมือน', 'คน', 'แบบ', 'เคย', 'ใช้ชีวิต', ' ', 'แต่', 'ถ้า', 'ไม่', 'ก้', 'คือ', ' ', 'ประหลาด', 'ดี', ' ', 'turn', 'ขวา', 'เพราะ', 'แค่', 'คนอื่น', 'พูดจา', 'ไมา', 'ถูกใจ', ' ', 'อีดอก', 'หัวเราะ', ' ', 'โดน', 'influence', ' ', 'ง่าย', 'เนอะ', ' ', 'อุดมการณ์', 'ก้', 'แค่', 'ตัวอักษร']"
1980374967343804445,twitter,post,https://x.com/thekingofotaku/status/1980374967343804445,text,2025-10-20T20:46:00.000Z,selenium_x_scraper_v1,"ใช่ พวกมึงแม่งกดดันคุกคามคนฝั่งขวา 
ยังไม่รู้ตัวอีกเหรอ","ใช่ พวกมึงแม่งกดดันคุกคามคนฝั่งขวา 
ยังไม่รู้ตัวอีกเหรอ",2025-11-29 08:18:55,"['ใช่', ' ', 'พวก', 'มึง', 'แม่', 'งก', 'ด', 'ดัน', 'คุกคาม', 'คน', 'ฝั่ง', 'ขวา', ' ', 'ยัง', 'ไม่', 'รู้ตัว', 'อีก', 'เหรอ']"
1980353734321586403,twitter,post,https://x.com/thekingofotaku/status/1980353734321586403,text,2025-10-20T19:21:38.000Z,selenium_x_scraper_v1,"แล้วไง
อยากตอบ
พวกมึงก็หยุดดิ","แล้วไง
อยากตอบ
พวกมึงก็หยุดดิ",2025-11-29 08:18:55,"['แล้ว', 'ไง', ' ', 'อยาก', 'ตอบ', ' ', 'พวก', 'มึง', 'ก็', 'หยุด', 'ดิ']"
1980350586819367199,twitter,post,https://x.com/phattarnitfilm/status/1980350586819367199,text,2025-10-20T19:09:07.000Z,selenium_x_scraper_v1,งั้นกูก็สร้างแอคหลุมมาเม้นก็ได้ดิ หาแนวร่วมม~,งั้นกูก็สร้างแอคหลุมมาเม้นก็ได้ดิ หาแนวร่วมม~,2025-11-29 08:18:55,"['งั้น', 'กู', 'ก็', 'สร้าง', 'แอ', 'ค', 'หลุม', 'มา', 'เม้น', 'ก็ได้', 'ดิ', ' ', 'หา', 'แนวร่วม', 'ม']"
1980351610070135215,twitter,post,https://x.com/thekingofotaku/status/1980351610070135215,text,2025-10-20T19:13:11.000Z,selenium_x_scraper_v1,ทำกันอยู่ไม่ใช่หรอ?,ทำกันอยู่ไม่ใช่หรอ?,2025-11-29 08:18:55,"['ทำ', 'กัน', 'อยู่', 'ไม่', 'ใช่', 'หรอ', '?']"
1980319272288284781,twitter,post,https://x.com/thekingofotaku/status/1980319272288284781,text,2025-10-20T17:04:41.000Z,selenium_x_scraper_v1,"ก็ผิดปกติทั้งคู่ๆ 
ทั้งคนแต่งตัวโป๊
และคนคุกคาม
พวกมึงจะถามอะไรโง่ๆอีกนานไหม
รำคาญชิบหาย
กูเริ่มรู้สึกอยากทำลายพวกเด็กเปรต ๆและประเทศนี้ให้จบๆ แล้วสร้างใหม่
แล้ววะ
รำคาญจัด มันมีเด็กแบบพวกมึงเกิดมาได้ไงวะ พ่นแต่เรื่องโง่ๆ สิทธิเสรีบ้าบออะไร ที่หาเรื่องตลอดเวลา","ก็ผิดปกติทั้งคู่ๆ 
ทั้งคนแต่งตัวโป๊
และคนคุกคาม
พวกมึงจะถามอะไรโง่ๆอีกนานไหม
รำคาญชิบหาย
กูเริ่มรู้สึกอยากทำลายพวกเด็กเปรต ๆและประเทศนี้ให้จบๆ แล้วสร้างใหม่
แล้ววะ
รำคาญจัด มันมีเด็กแบบพวกมึงเกิดมาได้ไงวะ พ่นแต่เรื่องโง่ๆ สิทธิเสรีบ้าบออะไร ที่หาเรื่องตลอดเวลา",2025-11-29 08:18:55,"['ก็', 'ผิดปกติ', 'ทั้งคู่', 'ๆ', ' ', 'ทั้งคน', 'แต่งตัว', 'โป๊', ' ', 'และ', 'คน', 'คุกคาม', ' ', 'พวก', 'มึง', 'จะ', 'ถาม', 'อะไร', 'โง่', 'ๆ', 'อีก', 'นาน', 'ไหม', ' ', 'รำคาญ', 'ชิบหาย', ' ', 'กู', 'เริ่ม', 'รู้สึก', 'อยาก', 'ทำลาย', 'พวก', 'เด็ก', 'เปรต', ' ', 'ๆ', 'และ', 'ประเทศ', 'นี้', 'ให้', 'จบ', 'ๆ', ' ', 'แล้ว', 'สร้าง', 'ใหม่', ' ', 'แล้ว', 'วะ', ' ', 'รำคาญ', 'จัด', ' ', 'มัน', 'มี', 'เด็ก', 'แบบ', 'พวก', 'มึง', 'เกิด', 'มา', 'ได้', 'ไง', 'วะ', ' ', 'พ่น', 'แต่', 'เรื่อง', 'โง่', 'ๆ', ' ', 'สิทธิ', 'เสรี', 'บ้าบอ', 'อะไร', ' ', 'ที่', 'หาเรื่อง', 'ตลอดเวลา']"
1980348989057941765,twitter,post,https://x.com/phattarnitfilm/status/1980348989057941765,text,2025-10-20T19:02:46.000Z,selenium_x_scraper_v1,อ่านไม่จบหรือไง กูบอกว่าคนแก่เบียวๆ,อ่านไม่จบหรือไง กูบอกว่าคนแก่เบียวๆ,2025-11-29 08:18:55,"['อ่าน', 'ไม่', 'จบ', 'หรือไง', ' ', 'กู', 'บอ', 'กว่า', 'คนแก่', 'เบียวๆ']"
1980349204448129150,twitter,post,https://x.com/thekingofotaku/status/1980349204448129150,text,2025-10-20T19:03:38.000Z,selenium_x_scraper_v1,แล้ว,แล้ว,2025-11-29 08:18:55,['แล้ว']
1980346809789862269,twitter,post,https://x.com/phattarnitfilm/status/1980346809789862269,text,2025-10-20T18:54:07.000Z,selenium_x_scraper_v1,อยู่บนโลกแคบๆต่อไปเถ๊อะ เบียวตั้งแต่โพสต์ปักหมุดละ  มีการให้ไปดูต้นโพสต์ว่าคนเห็นด้วยกับตัวเองเยอะแยะ คนรีโพสต์ความย้อนแย้งของมึงเป็นหมื่นค่ะ,อยู่บนโลกแคบๆต่อไปเถ๊อะ เบียวตั้งแต่โพสต์ปักหมุดละ  มีการให้ไปดูต้นโพสต์ว่าคนเห็นด้วยกับตัวเองเยอะแยะ คนรีโพสต์ความย้อนแย้งของมึงเป็นหมื่นค่ะ,2025-11-29 08:18:55,"['อยู่', 'บน', 'โลก', 'แคบ', 'ๆ', 'ต่อไป', 'เถ๊', 'อะ', ' ', 'เบียว', 'ตั้งแต่', 'โพสต์', 'ปัก', 'หมุด', 'ละ', ' ', 'มี', 'การ', 'ให้', 'ไปดู', 'ต้น', 'โพสต์', 'ว่า', 'คน', 'เห็นด้วย', 'กับ', 'ตัวเอง', 'เยอะแยะ', ' ', 'คน', 'รี', 'โพสต์', 'ความ', 'ย้อน', 'แย้ง', 'ของ', 'มึง', 'เป็น', 'หมื่น', 'ค่ะ']"
1980349135154032842,twitter,post,https://x.com/thekingofotaku/status/1980349135154032842,text,2025-10-20T19:03:21.000Z,selenium_x_scraper_v1,"มึงนี่เป็นเอามากกับยอดรี
กูสร้างแอคหลุมสักร้อยแอคมากดยอดรีไม่ใช่เรื่องยากอะไรเลยสัส
เป็นเอามาก 
สาระสำคัญมันอยู่ที่ข้อความว้อย","มึงนี่เป็นเอามากกับยอดรี
กูสร้างแอคหลุมสักร้อยแอคมากดยอดรีไม่ใช่เรื่องยากอะไรเลยสัส
เป็นเอามาก 
สาระสำคัญมันอยู่ที่ข้อความว้อย",2025-11-29 08:18:55,"['มึง', 'นี่', 'เป็นเอามาก', 'กับ', 'ยอด', 'รี', ' ', 'กู', 'สร้าง', 'แอ', 'ค', 'หลุม', 'สัก', 'ร้อย', 'แอ', 'ค', 'มา', 'กด', 'ยอด', 'รี', 'ไม่', 'ใช่', 'เรื่อง', 'ยาก', 'อะไร', 'เลย', 'สัส', ' ', 'เป็นเอามาก', ' ', 'สาระสำคัญ', 'มัน', 'อยู่', 'ที่', 'ข้อความ', 'ว้อย']"
1980331206823772330,twitter,post,https://x.com/thekingofotaku/status/1980331206823772330,text,2025-10-20T17:52:07.000Z,selenium_x_scraper_v1,"หาแสงอะไรของมึง
กูพิมในเพจข่าวมติชน
กูไม่ได้ไปพิมในแอคเจนิสเลย
นึกไม่ถึงว่าเจนิสจะมาตอบในนี้ด้วยซ้ำ
ถ้ากูอยากหาแสงจริง
กูไปท้าทายต่อหน้าเลยไม่ดีกว่าเหรอ
ใครจะอยากเป็น someone แบบมึง","หาแสงอะไรของมึง
กูพิมในเพจข่าวมติชน
กูไม่ได้ไปพิมในแอคเจนิสเลย
นึกไม่ถึงว่าเจนิสจะมาตอบในนี้ด้วยซ้ำ
ถ้ากูอยากหาแสงจริง
กูไปท้าทายต่อหน้าเลยไม่ดีกว่าเหรอ
ใครจะอยากเป็น someone แบบมึง",2025-11-29 08:18:55,"['หา', 'แสง', 'อะไร', 'ของ', 'มึง', ' ', 'กู', 'พิม', 'ใน', 'เพจ', 'ข่าว', 'มติชน', ' ', 'กู', 'ไม่', 'ได้', 'ไป', 'พิม', 'ใน', 'แอ', 'ค', 'เจ', 'นิ', 'ส', 'เลย', ' ', 'นึกไม่ถึง', 'ว่า', 'เจ', 'นิ', 'ส', 'จะ', 'มา', 'ตอบ', 'ใน', 'นี้', 'ด้วยซ้ำ', ' ', 'ถ้า', 'กู', 'อยาก', 'หา', 'แสง', 'จริง', ' ', 'กู', 'ไป', 'ท้าทาย', 'ต่อหน้า', 'เลย', 'ไม่', 'ดีกว่า', 'เหรอ', ' ', 'ใคร', 'จะ', 'อยาก', 'เป็น', ' ', 'someone', ' ', 'แบบ', 'มึง']"
1980348293239697786,twitter,post,https://x.com/phattarnitfilm/status/1980348293239697786,text,2025-10-20T19:00:00.000Z,selenium_x_scraper_v1,ดูแล้วว น้อยกว่ายอดรีความย้อนแย้งของแกอีก,ดูแล้วว น้อยกว่ายอดรีความย้อนแย้งของแกอีก,2025-11-29 08:18:55,"['ดู', 'แล้ว', 'ว', ' ', 'น้อยกว่า', 'ยอด', 'รี', 'ความ', 'ย้อน', 'แย้ง', 'ของ', 'แก', 'อีก']"
1980348790054998151,twitter,post,https://x.com/thekingofotaku/status/1980348790054998151,text,2025-10-20T19:01:59.000Z,selenium_x_scraper_v1,"มึงเป็นอะไรนักหนากับยอดรี?
ยอดรีมันช่วยทำให้สิ่งนั้นถูกขึ้นมาหรือไง
บ้าอะไรกับยอดรี","มึงเป็นอะไรนักหนากับยอดรี?
ยอดรีมันช่วยทำให้สิ่งนั้นถูกขึ้นมาหรือไง
บ้าอะไรกับยอดรี",2025-11-29 08:18:55,"['มึง', 'เป็น', 'อะไร', 'นักหนา', 'กับ', 'ยอด', 'รี', '?', ' ', 'ยอด', 'รี', 'มัน', 'ช่วย', 'ทำให้', 'สิ่ง', 'นั้น', 'ถูก', 'ขึ้น', 'มา', 'หรือไง', ' ', 'บ้า', 'อะไร', 'กับ', 'ยอด', 'รี']"
1980340337060245878,twitter,post,https://x.com/njmmee21/status/1980340337060245878,text,2025-10-20T18:28:23.000Z,selenium_x_scraper_v1,เผื่อเค้าอ่านหนังสือไม่ครบ  นี่ว่านี่ก็ไม่ได้พูดถึงแต่เหยื่อผญ นะ,เผื่อเค้าอ่านหนังสือไม่ครบ  นี่ว่านี่ก็ไม่ได้พูดถึงแต่เหยื่อผญ นะ,2025-11-29 08:18:55,"['เผื่อ', 'เค้า', 'อ่านหนังสือ', 'ไม่', 'ครบ', ' ', 'นี่', 'ว่า', 'นี่', 'ก็', 'ไม่', 'ได้', 'พูดถึง', 'แต่', 'เหยื่อ', 'ผญ', ' ', 'นะ']"
1980347179949781114,twitter,post,https://x.com/njmmee21/status/1980347179949781114,text,2025-10-20T18:55:35.000Z,selenium_x_scraper_v1,คนที่โดนชายแท้คุกคาม เช่น เด็ก ที่ไม่แต่ตัวโป๊ เช่นผญ.ที่เป็นนีกเรียน เช่นคนแก่ เช่นคนที่เเต่ตัวธรรมดา ก็โดนมาแล้ว คนพวกนี้ต้องทำยังไงคะ ถ้สแต่ตัวโป๊ผิด เเต่ตัวมิดชิดก็โดนคุกคาม,คนที่โดนชายแท้คุกคาม เช่น เด็ก ที่ไม่แต่ตัวโป๊ เช่นผญ.ที่เป็นนีกเรียน เช่นคนแก่ เช่นคนที่เเต่ตัวธรรมดา ก็โดนมาแล้ว คนพวกนี้ต้องทำยังไงคะ ถ้สแต่ตัวโป๊ผิด เเต่ตัวมิดชิดก็โดนคุกคาม,2025-11-29 08:18:55,"['คน', 'ที่', 'โดน', 'ชาย', 'แท้', 'คุกคาม', ' ', 'เช่น', ' ', 'เด็ก', ' ', 'ที่', 'ไม่', 'แต่', 'ตัว', 'โป๊', ' ', 'เช่น', 'ผญ.', 'ที่', 'เป็น', 'นีก', 'เรียน', ' ', 'เช่น', 'คนแก่', ' ', 'เช่น', 'คน', 'ที่', 'เเต่', 'ตัว', 'ธรรมดา', ' ', 'ก็', 'โดน', 'มา', 'แล้ว', ' ', 'คน', 'พวก', 'นี้', 'ต้อง', 'ทำ', 'ยังไง', 'คะ', ' ', 'ถ้ส', 'แต่', 'ตัว', 'โป๊', 'ผิด', ' ', 'เเต่', 'ตัว', 'มิดชิด', 'ก็', 'โดน', 'คุกคาม']"
1980348431525900462,twitter,post,https://x.com/thekingofotaku/status/1980348431525900462,text,2025-10-20T19:00:33.000Z,selenium_x_scraper_v1,"ก็จัดการคนคุกคามดิ
ถามแปลกๆ","ก็จัดการคนคุกคามดิ
ถามแปลกๆ",2025-11-29 08:18:55,"['ก็', 'จัด', 'การคน', 'คุกคาม', 'ดิ', ' ', 'ถาม', 'แปลก', 'ๆ']"
1980348323744870706,twitter,post,https://x.com/thekingofotaku/status/1980348323744870706,text,2025-10-20T19:00:08.000Z,selenium_x_scraper_v1,ผิดดิ มึงจะแถไรอีก?,ผิดดิ มึงจะแถไรอีก?,2025-11-29 08:18:55,"['ผิด', 'ดิ', ' ', 'มึง', 'จะ', 'แถ', 'ไร', 'อีก', '?']"
1980346723659837682,twitter,post,https://x.com/njmmee21/status/1980346723659837682,text,2025-10-20T18:53:46.000Z,selenium_x_scraper_v1,ชายแท้มันก็แบบนี่,ชายแท้มันก็แบบนี่,2025-11-29 08:18:55,"['ชาย', 'แท้', 'มัน', 'ก็', 'แบบ', 'นี่']"
1980348254622806158,twitter,post,https://x.com/thekingofotaku/status/1980348254622806158,text,2025-10-20T18:59:51.000Z,selenium_x_scraper_v1,เออ อันไหนคุกคามก็จัดไป,เออ อันไหนคุกคามก็จัดไป,2025-11-29 08:18:55,"['เออ', ' ', 'อัน', 'ไหน', 'คุกคาม', 'ก็', 'จัด', 'ไป']"
1980346701048377605,twitter,post,https://x.com/njmmee21/status/1980346701048377605,text,2025-10-20T18:53:41.000Z,selenium_x_scraper_v1,มีอีกเยอะเลยนะคะ,มีอีกเยอะเลยนะคะ,2025-11-29 08:18:55,"['มี', 'อีก', 'เยอะ', 'เลย', 'นะคะ']"
1980348169021190321,twitter,post,https://x.com/thekingofotaku/status/1980348169021190321,text,2025-10-20T18:59:31.000Z,selenium_x_scraper_v1,อืม ก็จัดไปสิ,อืม ก็จัดไปสิ,2025-11-29 08:18:55,"['อืม', ' ', 'ก็', 'จัด', 'ไป', 'สิ']"
