id,platform,platform_type,url,content_type,timestamp,scraper_module,text,raw_text,scrape_date,tokens
1987453271406268605,twitter,post,https://x.com/Sunjiberry/status/1987453271406268605,text,2025-11-09T09:32:39.000Z,selenium_x_scraper_v1,กุเหนื่อยกับผญแบบนี้,กุเหนื่อยกับผญแบบนี้,2025-11-29 08:18:55,"['กุ', 'เหนื่อย', 'กับ', 'ผญ', 'แบบนี้']"
1987464631510843525,twitter,post,https://x.com/panpanmap/status/1987464631510843525,text,2025-11-09T10:17:48.000Z,selenium_x_scraper_v1,ต้องรอให้เฟมทวิตตัดริบบิ้นให้อีกละเหรอ,ต้องรอให้เฟมทวิตตัดริบบิ้นให้อีกละเหรอ,2025-11-29 08:18:55,"['ต้อง', 'รอ', 'ให้', 'เฟม', 'ทวิ', 'ต', 'ตัด', 'ริบบิ้น', 'ให้', 'อีก', 'ละ', 'เหรอ']"
1987467181244953071,twitter,post,https://x.com/04BHX/status/1987467181244953071,text,2025-11-09T10:27:56.000Z,selenium_x_scraper_v1,อุบาดมากกหญิงแท้,อุบาดมากกหญิงแท้,2025-11-29 08:18:55,"['อุ', 'บาด', 'มา', 'กก', 'หญิง', 'แท้']"
1987447818064437746,twitter,post,https://x.com/QueenXinee/status/1987447818064437746,text,2025-11-09T09:10:59.000Z,selenium_x_scraper_v1,แต่มีคนแคปจากในจ๊อกโดนแคปไปด่าเหมารวม LGBTQ สุด,แต่มีคนแคปจากในจ๊อกโดนแคปไปด่าเหมารวม LGBTQ สุด,2025-11-29 08:18:55,"['แต่', 'มี', 'คน', 'แคป', 'จาก', 'ใน', 'จ๊อก', 'โดน', 'แคป', 'ไป', 'ด่า', 'เหมา', 'รวม', ' ', 'lgbtq', ' ', 'สุด']"
1987548924622811164,twitter,post,https://x.com/slamandcr/status/1987548924622811164,text,2025-11-09T15:52:45.000Z,selenium_x_scraper_v1,ตัดริบบิ้นให้แล้วนะ ด่าได้เลยคร่าบ,ตัดริบบิ้นให้แล้วนะ ด่าได้เลยคร่าบ,2025-11-29 08:18:55,"['ตัด', 'ริบบิ้น', 'ให้', 'แล้ว', 'นะ', ' ', 'ด่า', 'ได้', 'เลย', 'คร่า', 'บ']"
1987427504622346391,twitter,post,https://x.com/redkindle_ment/status/1987427504622346391,text,2025-11-09T07:50:16.000Z,selenium_x_scraper_v1,นอกเรื่องทำไมร้องสักได้อะ เป็นเยาวชนอยู่ไม่ใช่หรอ,นอกเรื่องทำไมร้องสักได้อะ เป็นเยาวชนอยู่ไม่ใช่หรอ,2025-11-29 08:18:55,"['นอกเรื่อง', 'ทำไม', 'ร้อง', 'สัก', 'ได้', 'อะ', ' ', 'เป็น', 'เยาวชน', 'อยู่', 'ไม่', 'ใช่', 'หรอ']"
1987373335332987211,twitter,post,https://x.com/SeaNoopy/status/1987373335332987211,text,2025-11-09T04:15:01.000Z,selenium_x_scraper_v1,คนพวกนี้โคตรอุบาวท์อ่ะ น่ารังเกียจ,คนพวกนี้โคตรอุบาวท์อ่ะ น่ารังเกียจ,2025-11-29 08:18:55,"['คน', 'พวก', 'นี้', 'โคตร', 'อุ', 'บาวท์', 'อ่ะ', ' ', 'น่ารังเกียจ']"
1987409040096534584,twitter,post,https://x.com/GorJessicaSY/status/1987409040096534584,text,2025-11-09T06:36:54.000Z,selenium_x_scraper_v1,มายท่านใด,มายท่านใด,2025-11-29 08:18:55,"['มาย', 'ท่าน', 'ใด']"
1987753947088712097,twitter,post,https://x.com/Lindilorn/status/1987753947088712097,text,2025-11-10T05:27:26.000Z,selenium_x_scraper_v1,รอลิงก์ค่ะ ไม่รู้มาจากไหนจะไปด่าให้โลกแตกได้ไง งง,รอลิงก์ค่ะ ไม่รู้มาจากไหนจะไปด่าให้โลกแตกได้ไง งง,2025-11-29 08:18:55,"['รอ', 'ลิงก์', 'ค่ะ', ' ', 'ไม่', 'รู้', 'มาจาก', 'ไหนจะ', 'ไป', 'ด่า', 'ให้', 'โลก', 'แตก', 'ได้', 'ไง', ' ', 'งง']"
1987402397040451624,twitter,post,https://x.com/mickeymew_w/status/1987402397040451624,text,2025-11-09T06:10:30.000Z,selenium_x_scraper_v1,อุบาด,อุบาด,2025-11-29 08:18:55,"['อุ', 'บาด']"
1987415355925643668,twitter,post,https://x.com/leeeliiily/status/1987415355925643668,text,2025-11-09T07:01:59.000Z,selenium_x_scraper_v1,กุกัวอ่ะ,กุกัวอ่ะ,2025-11-29 08:18:55,"['กุ', 'กัว', 'อ่ะ']"
1987438150789234878,twitter,post,https://x.com/npkp_s/status/1987438150789234878,text,2025-11-09T08:32:34.000Z,selenium_x_scraper_v1,อุบาทชิบหาย,อุบาทชิบหาย,2025-11-29 08:18:55,"['อุบาท', 'ชิบหาย']"
1987381851150045685,twitter,post,https://x.com/asunclewishes/status/1987381851150045685,text,2025-11-09T04:48:51.000Z,selenium_x_scraper_v1,เชี่ยไรวะเนี่ย ,เชี่ยไรวะเนี่ย ,2025-11-29 08:18:55,"['เชี่ย', 'ไร', 'วะ', 'เนี่ย']"
1987433818530402449,twitter,post,https://x.com/ApyPploy/status/1987433818530402449,text,2025-11-09T08:15:21.000Z,selenium_x_scraper_v1,อุบาย,อุบาย,2025-11-29 08:18:55,['อุบาย']
1987466940257120425,twitter,post,https://x.com/Pm2_Pom/status/1987466940257120425,text,2025-11-09T10:26:58.000Z,selenium_x_scraper_v1,เจออันที่อ่านรู้เรื่อง เข้าใจง่าย และตอบข้อสงสัยของคำว่า queerbaiting ได้ละ ใครยังไม่เก็ทว่าคือไร ส่งผลไง ลองเข้ามาอ่านๆ,เจออันที่อ่านรู้เรื่อง เข้าใจง่าย และตอบข้อสงสัยของคำว่า queerbaiting ได้ละ ใครยังไม่เก็ทว่าคือไร ส่งผลไง ลองเข้ามาอ่านๆ,2025-11-29 08:18:55,"['เจอ', 'อัน', 'ที่', 'อ่าน', 'รู้เรื่อง', ' ', 'เข้าใจง่าย', ' ', 'และ', 'ตอบ', 'ข้อสงสัย', 'ของ', 'คำ', 'ว่า', ' ', 'queerbaiting', ' ', 'ได้', 'ละ', ' ', 'ใคร', 'ยัง', 'ไม่', 'เก็ท', 'ว่า', 'คือ', 'ไร', ' ', 'ส่งผล', 'ไง', ' ', 'ลอง', 'เข้ามา', 'อ่าน', 'ๆ']"
1987779128062529557,twitter,post,https://x.com/overl00kcarpet/status/1987779128062529557,text,2025-11-10T07:07:29.000Z,selenium_x_scraper_v1,อัตลักษณ์ของเควียร์ไม่อาจถูกกระเทือนได้ด้วยสินค้าอย่าง BL GL หรอก สื่อทั้งเกย์ไม่เกย์นั้นมีทั้งแนวแฟนตาซี แนวเอาใจตลาด ประชดสังคม จริงจัง เบาสมอง แนวทดลอง ฯลฯ เกย์คนหนึ่งไม่ได้รู้สึกมีส่วนร่วมกับหนังเกย์ทุกเรื่องอยู่แล้ว BL GL ยิ่งเป็นแค่ sub genre หรือ cult กลุ่มหนึ่งก็เท่านั้น,อัตลักษณ์ของเควียร์ไม่อาจถูกกระเทือนได้ด้วยสินค้าอย่าง BL GL หรอก สื่อทั้งเกย์ไม่เกย์นั้นมีทั้งแนวแฟนตาซี แนวเอาใจตลาด ประชดสังคม จริงจัง เบาสมอง แนวทดลอง ฯลฯ เกย์คนหนึ่งไม่ได้รู้สึกมีส่วนร่วมกับหนังเกย์ทุกเรื่องอยู่แล้ว BL GL ยิ่งเป็นแค่ sub genre หรือ cult กลุ่มหนึ่งก็เท่านั้น,2025-11-29 08:18:55,"['อัตลักษณ์', 'ของ', 'เควียร์', 'ไม่', 'อาจ', 'ถูก', 'กระเทือน', 'ได้', 'ด้วย', 'สินค้า', 'อย่าง', ' ', 'bl', ' ', 'gl', ' ', 'หรอก', ' ', 'สื่อ', 'ทั้ง', 'เกย์', 'ไม่', 'เกย์', 'นั้น', 'มี', 'ทั้ง', 'แนว', 'แฟนตาซี', ' ', 'แนว', 'เอาใจ', 'ตลาด', ' ', 'ประชด', 'สังคม', ' ', 'จริงจัง', ' ', 'เบาสมอง', ' ', 'แนว', 'ทดลอง', ' ', 'ฯลฯ', ' ', 'เกย์', 'คน', 'หนึ่ง', 'ไม่', 'ได้', 'รู้สึก', 'มีส่วน', 'ร่วมกับ', 'หนัง', 'เกย์', 'ทุก', 'เรื่อง', 'อยู่แล้ว', ' ', 'bl', ' ', 'gl', ' ', 'ยิ่ง', 'เป็น', 'แค่', ' ', 'sub', ' ', 'genre', ' ', 'หรือ', ' ', 'cult', ' ', 'กลุ่ม', 'หนึ่ง', 'ก็', 'เท่านั้น']"
1987480334104154437,twitter,post,https://x.com/PPnashi/status/1987480334104154437,text,2025-11-09T11:20:11.000Z,selenium_x_scraper_v1,"นี่เปนคนในคอมมูและเปนสาววายด้วย
แต่ไม่ไหวกะวงการวายบ้านเราจิง คือทำไมต้องฟิกคู่ (แย่ไปกว่านั้นคือฟิกโพ) คือ เค้าเปน นสด.แปลว่ามันควรจะเล่นได้กะทุกคนและทุกบท 
เบื่อมากเวลาแบบจิ้นไม่ตรงคู่ แล้วโดน สว ปสด โวย แกเค้าเปน นสด การที่เค้ามีเคมีหลากหลายควรยินดี คู่จิ้นไม่ได้เปนผัวเมีย","นี่เปนคนในคอมมูและเปนสาววายด้วย
แต่ไม่ไหวกะวงการวายบ้านเราจิง คือทำไมต้องฟิกคู่ (แย่ไปกว่านั้นคือฟิกโพ) คือ เค้าเปน นสด.แปลว่ามันควรจะเล่นได้กะทุกคนและทุกบท 
เบื่อมากเวลาแบบจิ้นไม่ตรงคู่ แล้วโดน สว ปสด โวย แกเค้าเปน นสด การที่เค้ามีเคมีหลากหลายควรยินดี คู่จิ้นไม่ได้เปนผัวเมีย",2025-11-29 08:18:55,"['นี่', 'เปน', 'คนใน', 'คอม', 'มู', 'และ', 'เปน', 'สาว', 'วาย', 'ด้วย', ' ', 'แต่', 'ไม่', 'ไห', 'วกะ', 'วงการ', 'วาย', 'บ้าน', 'เรา', 'จิง', ' ', 'คือ', 'ทำไม', 'ต้อง', 'ฟิก', 'คู่', ' ', 'แย่', 'ไป', 'กว่า', 'นั้น', 'คือ', 'ฟิก', 'โพ', ' ', 'คือ', ' ', 'เค้า', 'เปน', ' ', 'นสด', '.', 'แปล', 'ว่า', 'มัน', 'ควรจะ', 'เล่น', 'ได้', 'กะ', 'ทุกคน', 'และ', 'ทุก', 'บท', ' ', 'เบื่อ', 'มาก', 'เวลา', 'แบบ', 'จิ้น', 'ไม่', 'ตรง', 'คู่', ' ', 'แล้ว', 'โดน', ' ', 'สว', ' ', 'ปสด', ' ', 'โวย', ' ', 'แก', 'เค้า', 'เปน', ' ', 'นสด', ' ', 'การ', 'ที่', 'เค้า', 'มี', 'เคมี', 'หลากหลาย', 'ควร', 'ยินดี', ' ', 'คู่', 'จิ้น', 'ไม่', 'ได้', 'เปน', 'ผัวเมีย']"
1987793690887418324,twitter,post,https://x.com/Leisure60191507/status/1987793690887418324,text,2025-11-10T08:05:21.000Z,selenium_x_scraper_v1,เอาจริงๆ อ่าน x มา เราก็อึดอัดชาวเควียร์บางกลุ่ม ที่ชอบอ้างว่าคอมมูเควียร์รำคาญสาววายนะ มองอีกมุมนึงมันก็เหมารวมไปอ่ะ บางคนก็เฉยๆ บางคนก็เสพวายด้วยซ้ำ,เอาจริงๆ อ่าน x มา เราก็อึดอัดชาวเควียร์บางกลุ่ม ที่ชอบอ้างว่าคอมมูเควียร์รำคาญสาววายนะ มองอีกมุมนึงมันก็เหมารวมไปอ่ะ บางคนก็เฉยๆ บางคนก็เสพวายด้วยซ้ำ,2025-11-29 08:18:55,"['เอา', 'จริงๆ', ' ', 'อ่าน', ' ', 'x', ' ', 'มา', ' ', 'เรา', 'ก็', 'อึดอัด', 'ชาว', 'เควียร์', 'บาง', 'กลุ่ม', ' ', 'ที่', 'ชอบ', 'อ้างว่า', 'คอม', 'มูเควียร์', 'รำคาญ', 'สาว', 'วาย', 'นะ', ' ', 'มอง', 'อีก', 'มุม', 'นึง', 'มัน', 'ก็', 'เหมา', 'รวม', 'ไป', 'อ่ะ', ' ', 'บางคน', 'ก็', 'เฉย', 'ๆ', ' ', 'บางคน', 'ก็', 'เสพ', 'วาย', 'ด้วยซ้ำ']"
1987476704261214239,twitter,post,https://x.com/spectre7r/status/1987476704261214239,text,2025-11-09T11:05:46.000Z,selenium_x_scraper_v1,"ใช่ ๆ ละมันแบบ if you can only act with one person, are you really an actor or just half of a brand? ต้องมาเป็นคู่ ฟิกซ์คู่ พอจิ้นขายดีก็ไม่กล้าแยก การแสดงกลายเป็นแฟนเซอร์วิส ไม่สนเรื่องราวแต่สนว่าจะมีโมเมนต์ไหม สาววายต้องยอมรับว่าคนที่เป็นนักแสดงหลาย ๆ คนก็เควียร์เบทจริง ๆ อะ","ใช่ ๆ ละมันแบบ if you can only act with one person, are you really an actor or just half of a brand? ต้องมาเป็นคู่ ฟิกซ์คู่ พอจิ้นขายดีก็ไม่กล้าแยก การแสดงกลายเป็นแฟนเซอร์วิส ไม่สนเรื่องราวแต่สนว่าจะมีโมเมนต์ไหม สาววายต้องยอมรับว่าคนที่เป็นนักแสดงหลาย ๆ คนก็เควียร์เบทจริง ๆ อะ",2025-11-29 08:18:55,"['ใช่', ' ', 'ๆ', ' ', 'ละ', 'มัน', 'แบบ', ' ', 'if', ' ', 'you', ' ', 'can', ' ', 'only', ' ', 'act', ' ', 'with', ' ', 'one', ' ', 'person', ',', ' ', 'are', ' ', 'you', ' ', 'really', ' ', 'an', ' ', 'actor', ' ', 'or', ' ', 'just', ' ', 'half', ' ', 'of', ' ', 'a', ' ', 'brand', '?', ' ', 'ต้อง', 'มา', 'เป็น', 'คู่', ' ', 'ฟิกซ์', 'คู่', ' ', 'พอ', 'จิ้น', 'ขายดี', 'ก็', 'ไม่', 'กล้า', 'แยก', ' ', 'การแสดง', 'กลายเป็น', 'แฟน', 'เซอร์วิส', ' ', 'ไม่', 'สน', 'เรื่องราว', 'แต่', 'สน', 'ว่า', 'จะ', 'มี', 'โมเมนต์', 'ไหม', ' ', 'สาว', 'วาย', 'ต้อง', 'ยอมรับ', 'ว่า', 'คน', 'ที่', 'เป็น', 'นักแสดง', 'หลาย', ' ', 'ๆ', ' ', 'คน', 'ก็', 'เควียร์เบท', 'จริง ๆ', ' ', 'อะ']"
1987468935349064179,twitter,post,https://x.com/Brain_food_4me/status/1987468935349064179,text,2025-11-09T10:34:54.000Z,selenium_x_scraper_v1,“เควียร์เบต ยังเป็นการลดทอน อัตลักษณ์และตัวตนของผู้คนในชุมชน เพื่อผลประโยชน์ทางการตลาดเพียงอย่างเดียว โดยไม่ได้เล็งเห็นว่า มันคืออันตราย และย้อนกลับมาทำร้ายชุมชนในระยะยาว”,“เควียร์เบต ยังเป็นการลดทอน อัตลักษณ์และตัวตนของผู้คนในชุมชน เพื่อผลประโยชน์ทางการตลาดเพียงอย่างเดียว โดยไม่ได้เล็งเห็นว่า มันคืออันตราย และย้อนกลับมาทำร้ายชุมชนในระยะยาว”,2025-11-29 08:18:55,"['เควียร์เบต', ' ', 'ยัง', 'เป็นการ', 'ลดทอน', ' ', 'อัตลักษณ์', 'และ', 'ตัวตน', 'ของ', 'ผู้', 'คนใน', 'ชุมชน', ' ', 'เพื่อ', 'ผลประโยชน์', 'ทาง', 'การตลาด', 'เพียง', 'อย่าง', 'เดียว', ' ', 'โดย', 'ไม่', 'ได้', 'เล็งเห็น', 'ว่า', ' ', 'มัน', 'คือ', 'อันตราย', ' ', 'และ', 'ย้อน', 'กลับมา', 'ทำร้าย', 'ชุมชน', 'ใน', 'ระยะยาว']"
1987596271344066802,twitter,post,https://x.com/FungPearce/status/1987596271344066802,text,2025-11-09T19:00:53.000Z,selenium_x_scraper_v1,เป็นคู่พาทเนอร์กันเป็นเควียด้วยกันทั้งคู่ได้แต่ห้ามแสดงความรักต่อกันนะจะถูกแปะป้ายว่า ขายจิ้นเควียเบททันที ต่อให้จะมีบทดีท้าทายการแสดงก็ห้ามชอบกันจริงๆนะเว้ยเพราะมันจะส่งผลเสียต่ออัตลักษณ์ชุมชนเควียเค้า กุเป็นเควียเองก็ห้ามเซฟจิ้นนะเว้ยมันผิดกฏหมาย!!,เป็นคู่พาทเนอร์กันเป็นเควียด้วยกันทั้งคู่ได้แต่ห้ามแสดงความรักต่อกันนะจะถูกแปะป้ายว่า ขายจิ้นเควียเบททันที ต่อให้จะมีบทดีท้าทายการแสดงก็ห้ามชอบกันจริงๆนะเว้ยเพราะมันจะส่งผลเสียต่ออัตลักษณ์ชุมชนเควียเค้า กุเป็นเควียเองก็ห้ามเซฟจิ้นนะเว้ยมันผิดกฏหมาย!!,2025-11-29 08:18:55,"['เป็น', 'คู่', 'พาท', 'เนอร์', 'กัน', 'เป็น', 'เควีย', 'ด้วยกัน', 'ทั้งคู่', 'ได้', 'แต่', 'ห้าม', 'แสดง', 'ความรัก', 'ต่อกัน', 'นะ', 'จะ', 'ถูก', 'แปะ', 'ป้าย', 'ว่า', ' ', 'ขาย', 'จิ้น', 'เควียเบท', 'ทันที', ' ', 'ต่อให้', 'จะ', 'มี', 'บท', 'ดี', 'ท้าทาย', 'การแสดง', 'ก็', 'ห้าม', 'ชอบ', 'กัน', 'จริงๆ', 'นะ', 'เว้ย', 'เพราะ', 'มัน', 'จะ', 'ส่ง', 'ผลเสีย', 'ต่อ', 'อัตลักษณ์', 'ชุมชน', 'เควีย', 'เค้า', ' ', 'กุ', 'เป็น', 'เควีย', 'เอง', 'ก็', 'ห้าม', 'เซฟ', 'จิ้น', 'นะ', 'เว้ย', 'มัน', 'ผิดก', 'ฏ', 'หมาย', '!']"
1987470513552408806,twitter,post,https://x.com/sunnywish13/status/1987470513552408806,text,2025-11-09T10:41:10.000Z,selenium_x_scraper_v1,นี่ก็ไม่ชอบการขายจิ้นเหมือนกัน การชิป (โดนเฉพาะคนจริง) ไม่ควรออกมาอยู่บนดินแต่แรกอยู่แล้ว มันควรเป็นแฟนๆ เล่นกันสนุกๆ ค่ายไม่ควรเข้ามายุ่ง และแฟนก็ไม่ควรไปสนับสนุนการ queerbait ที่สคริปต์โดยค่ายด้วย  (เพราะถ้าแฟนยังสนับสนุนอะไรพวกนี้ ด่าค่ายไปก็ไม่มีประโยชน์),นี่ก็ไม่ชอบการขายจิ้นเหมือนกัน การชิป (โดนเฉพาะคนจริง) ไม่ควรออกมาอยู่บนดินแต่แรกอยู่แล้ว มันควรเป็นแฟนๆ เล่นกันสนุกๆ ค่ายไม่ควรเข้ามายุ่ง และแฟนก็ไม่ควรไปสนับสนุนการ queerbait ที่สคริปต์โดยค่ายด้วย  (เพราะถ้าแฟนยังสนับสนุนอะไรพวกนี้ ด่าค่ายไปก็ไม่มีประโยชน์),2025-11-29 08:18:55,"['นี่', 'ก็', 'ไม่', 'ชอบ', 'การ', 'ขาย', 'จิ้น', 'เหมือนกัน', ' ', 'การ', 'ชิป', ' ', 'โดน', 'เฉพาะ', 'คนจริง', ' ', 'ไม่', 'ควร', 'ออกมา', 'อยู่', 'บน', 'ดิน', 'แต่แรก', 'อยู่แล้ว', ' ', 'มัน', 'ควร', 'เป็น', 'แฟน', 'ๆ', ' ', 'เล่น', 'กัน', 'สนุก', 'ๆ', ' ', 'ค่าย', 'ไม่', 'ควร', 'เข้ามา', 'ยุ่ง', ' ', 'และ', 'แฟน', 'ก็', 'ไม่', 'ควร', 'ไป', 'สนับสนุน', 'การ', ' ', 'queerbait', ' ', 'ที่', 'สคริปต์', 'โดย', 'ค่าย', 'ด้วย', ' ', 'เพราะ', 'ถ้า', 'แฟน', 'ยัง', 'สนับสนุน', 'อะไร', 'พวก', 'นี้', ' ', 'ด่า', 'ค่าย', 'ไป', 'ก็', 'ไม่', 'มีประโยชน์']"
1987765969717260347,twitter,post,https://x.com/myminlibeb_/status/1987765969717260347,text,2025-11-10T06:15:12.000Z,selenium_x_scraper_v1,คนในคอมมูต้องออกมาพูดรอบที่ล้านแปด สาววายมันจะเถียงเขาทำไมนักหนาวะ ข้องใจ ,คนในคอมมูต้องออกมาพูดรอบที่ล้านแปด สาววายมันจะเถียงเขาทำไมนักหนาวะ ข้องใจ ,2025-11-29 08:18:55,"['คนใน', 'คอม', 'มู', 'ต้อง', 'ออกมา', 'พูด', 'รอบ', 'ที่', 'ล้าน', 'แปด', ' ', 'สาว', 'วาย', 'มัน', 'จะ', 'เถียง', 'เขา', 'ทำไม', 'นักหนา', 'วะ', ' ', 'ข้องใจ']"
