id,platform,platform_type,url,content_type,timestamp,scraper_module,text,raw_text,scrape_date,tokens
1986121892202504588,twitter,post,https://x.com/im_not_hehe/status/1986121892202504588,text,2025-11-05T17:22:14.000Z,selenium_x_scraper_v1,จริงๆก็ต่าง บริบทเหมือนว่าจะเหมือนกัน แต่มันไม่เหมือน แต่ก็น่ารำคาญเหมือนกัน เข้าใจได้,จริงๆก็ต่าง บริบทเหมือนว่าจะเหมือนกัน แต่มันไม่เหมือน แต่ก็น่ารำคาญเหมือนกัน เข้าใจได้,2025-11-29 08:18:55,"['จริงๆ', 'ก็', 'ต่าง', ' ', 'บริบท', 'เหมือนว่า', 'จะ', 'เหมือนกัน', ' ', 'แต่', 'มัน', 'ไม่', 'เหมือน', ' ', 'แต่', 'ก็', 'น่ารำคาญ', 'เหมือนกัน', ' ', 'เข้าใจ', 'ได้']"
1986299512655401439,twitter,post,https://x.com/mynamesaranka/status/1986299512655401439,text,2025-11-06T05:08:02.000Z,selenium_x_scraper_v1,เชียให้คนอื่นเปนเกทำไม ชอบเกขนาดนั้นสามารถเปนเองได้เลย,เชียให้คนอื่นเปนเกทำไม ชอบเกขนาดนั้นสามารถเปนเองได้เลย,2025-11-29 08:18:55,"['เชีย', 'ให้', 'คนอื่น', 'เปน', 'เก', 'ทำไม', ' ', 'ชอบ', 'เก', 'ขนาด', 'นั้น', 'สามารถ', 'เปน', 'เอง', 'ได้', 'เลย']"
1985701102697025671,twitter,post,https://x.com/miramikao/status/1985701102697025671,text,2025-11-05T03:03:46.000Z,selenium_x_scraper_v1,"จาก ""ผชซอฟๆโดนถามว่าเป็นป่ะเนี่ย""
ชั้นเจอคลิปผชไวป์นิ่มๆลงหน้าตัวเองเชิงตัดพ้อว่าโสดเพราะเกมาจีบ ไปจีบยิ๋งยิ๋งก็ตัดสินว่าเปนเก แต่เขาเปนสเตรท แล้วเปิดเจอคอมเม้นแบบ เชียร์อัพให้เป็นเกย์ๆๆๆๆๆอยู่นั่น คือมันต่างอะไรกับที่เกย์โดนเชียร์ให้เป็นสเตรท https://x.com/miramikao/stat/miramikao/status/1985701102697025671…","จาก ""ผชซอฟๆโดนถามว่าเป็นป่ะเนี่ย""
ชั้นเจอคลิปผชไวป์นิ่มๆลงหน้าตัวเองเชิงตัดพ้อว่าโสดเพราะเกมาจีบ ไปจีบยิ๋งยิ๋งก็ตัดสินว่าเปนเก แต่เขาเปนสเตรท แล้วเปิดเจอคอมเม้นแบบ เชียร์อัพให้เป็นเกย์ๆๆๆๆๆอยู่นั่น คือมันต่างอะไรกับที่เกย์โดนเชียร์ให้เป็นสเตรท https://x.com/miramikao/stat/miramikao/status/1985701102697025671…",2025-11-29 08:18:55,"['จาก', ' ', 'ผชซอฟๆ', 'โดน', 'ถาม', 'ว่า', 'เป็น', 'ป่ะ', 'เนี่ย', ' ', 'ชั้น', 'เจอ', 'คลิป', 'ผช', 'ไว', 'ป์', 'นิ่ม', 'ๆลง', 'หน้า', 'ตัวเอง', 'เชิง', 'ตัดพ้อ', 'ว่า', 'โสด', 'เพราะ', 'เก', 'มา', 'จีบ', ' ', 'ไป', 'จีบ', 'ยิ๋งยิ๋ง', 'ก็', 'ตัดสิน', 'ว่า', 'เปน', 'เก', ' ', 'แต่', 'เขา', 'เปนส', 'เต', 'รท', ' ', 'แล้ว', 'เปิด', 'เจอ', 'คอม', 'เม้น', 'แบบ', ' ', 'เชียร์', 'อัพ', 'ให้', 'เป็น', 'เกย์', 'ๆๆๆๆๆ', 'อยู่', 'นั่น', ' ', 'คือ', 'มัน', 'ต่าง', 'อะไร', 'กับ', 'ที่', 'เกย์', 'โดน', 'เชียร์', 'ให้', 'เป็น', 'ส', 'เต', 'รท']"
1985905853984395303,twitter,post,https://x.com/niGhtAPR/status/1985905853984395303,text,2025-11-04T13:30:10.000Z,selenium_x_scraper_v1,"จาก ""ผชซอฟๆโดนถามว่าเป็นป่ะเนี่ย""
ชั้นเจอคลิปผชไวป์นิ่มๆลงหน้าตัวเองเชิงตัดพ้อว่าโสดเพราะเกมาจีบ ไปจีบยิ๋งยิ๋งก็ตัดสินว่าเปนเก แต่เขาเปนสเตรท แล้วเปิดเจอคอมเม้นแบบ เชียร์อัพให้เป็นเกย์ๆๆๆๆๆอยู่นั่น คือมันต่างอะไรกับที่เกย์โดนเชียร์ให้เป็นสเตรท","จาก ""ผชซอฟๆโดนถามว่าเป็นป่ะเนี่ย""
ชั้นเจอคลิปผชไวป์นิ่มๆลงหน้าตัวเองเชิงตัดพ้อว่าโสดเพราะเกมาจีบ ไปจีบยิ๋งยิ๋งก็ตัดสินว่าเปนเก แต่เขาเปนสเตรท แล้วเปิดเจอคอมเม้นแบบ เชียร์อัพให้เป็นเกย์ๆๆๆๆๆอยู่นั่น คือมันต่างอะไรกับที่เกย์โดนเชียร์ให้เป็นสเตรท",2025-11-29 08:18:55,"['จาก', ' ', 'ผชซอฟๆ', 'โดน', 'ถาม', 'ว่า', 'เป็น', 'ป่ะ', 'เนี่ย', ' ', 'ชั้น', 'เจอ', 'คลิป', 'ผช', 'ไว', 'ป์', 'นิ่ม', 'ๆลง', 'หน้า', 'ตัวเอง', 'เชิง', 'ตัดพ้อ', 'ว่า', 'โสด', 'เพราะ', 'เก', 'มา', 'จีบ', ' ', 'ไป', 'จีบ', 'ยิ๋งยิ๋ง', 'ก็', 'ตัดสิน', 'ว่า', 'เปน', 'เก', ' ', 'แต่', 'เขา', 'เปนส', 'เต', 'รท', ' ', 'แล้ว', 'เปิด', 'เจอ', 'คอม', 'เม้น', 'แบบ', ' ', 'เชียร์', 'อัพ', 'ให้', 'เป็น', 'เกย์', 'ๆๆๆๆๆ', 'อยู่', 'นั่น', ' ', 'คือ', 'มัน', 'ต่าง', 'อะไร', 'กับ', 'ที่', 'เกย์', 'โดน', 'เชียร์', 'ให้', 'เป็น', 'ส', 'เต', 'รท']"
1986170911536632031,twitter,post,https://x.com/puzzle2127/status/1986170911536632031,text,2025-11-05T20:37:01.000Z,selenium_x_scraper_v1,อย่าว่าแต่ผู้ชายเลย เราเป็นผู้หญิง แต่มีนิสัยท่าทางแมนๆ ยังโดนยุให้คบผู้หญิงด้วยกันเลย แล้วยังมีมาพูดอีกนะว่าถ้าเราเป็นผู้ชายคงจะดีกว่านี้ แต่ประเด็นคือเราเป็นสเตรทไง ไม่เคยสนใจเพศเดียวกันเลยสักนิด,อย่าว่าแต่ผู้ชายเลย เราเป็นผู้หญิง แต่มีนิสัยท่าทางแมนๆ ยังโดนยุให้คบผู้หญิงด้วยกันเลย แล้วยังมีมาพูดอีกนะว่าถ้าเราเป็นผู้ชายคงจะดีกว่านี้ แต่ประเด็นคือเราเป็นสเตรทไง ไม่เคยสนใจเพศเดียวกันเลยสักนิด,2025-11-29 08:18:55,"['อย่า', 'ว่าแต่', 'ผู้ชาย', 'เลย', ' ', 'เรา', 'เป็น', 'ผู้หญิง', ' ', 'แต่', 'มี', 'นิสัย', 'ท่าทาง', 'แมน', 'ๆ', ' ', 'ยัง', 'โดน', 'ยุ', 'ให้', 'คบ', 'ผู้หญิง', 'ด้วยกัน', 'เลย', ' ', 'แล้ว', 'ยังมี', 'มา', 'พูด', 'อีก', 'นะ', 'ว่า', 'ถ้า', 'เรา', 'เป็น', 'ผู้ชาย', 'คงจะ', 'ดีกว่า', 'นี้', ' ', 'แต่', 'ประเด็น', 'คือ', 'เรา', 'เป็น', 'ส', 'เต', 'รท', 'ไง', ' ', 'ไม่', 'เคย', 'สนใจ', 'เพศ', 'เดียวกัน', 'เลย', 'สักนิด']"
1986057549763039437,twitter,post,https://x.com/twistatwita/status/1986057549763039437,text,2025-11-05T13:06:33.000Z,selenium_x_scraper_v1,เห็นด้วยยย  อารมณ์ด้วยกับพวกซีรีส์แนวconvertชายแท้เป็นเกย์ Ewww มากก,เห็นด้วยยย  อารมณ์ด้วยกับพวกซีรีส์แนวconvertชายแท้เป็นเกย์ Ewww มากก,2025-11-29 08:18:55,"['เห็นด้วย', 'ยย', ' ', 'อารมณ์', 'ด้วย', 'กับ', 'พวก', 'ซีรีส์', 'แนว', 'convert', 'ชาย', 'แท้', 'เป็น', 'เกย์', ' ', 'ewww', ' ', 'มา', 'กก']"
1985967815057424703,twitter,post,https://x.com/miramikao/status/1985967815057424703,text,2025-11-05T07:09:59.000Z,selenium_x_scraper_v1,ขออนุญาตแปะบทความนะคะ เพราะเห็นหลายคนพูดว่ามันเป็น stereotypes ไม่ใช่ queerbait แต่ในความจริง 2 สิ่งนี้มันแยกออกจากกันไม่ได้ค่ะ นั่นเป็นเหตุผลว่าทำไมสื่อ queerbait ถึงส่งผลต่อภาพจำของเควียร์ในชีวิตจริง,ขออนุญาตแปะบทความนะคะ เพราะเห็นหลายคนพูดว่ามันเป็น stereotypes ไม่ใช่ queerbait แต่ในความจริง 2 สิ่งนี้มันแยกออกจากกันไม่ได้ค่ะ นั่นเป็นเหตุผลว่าทำไมสื่อ queerbait ถึงส่งผลต่อภาพจำของเควียร์ในชีวิตจริง,2025-11-29 08:18:55,"['ขออนุญาต', 'แปะ', 'บทความ', 'นะคะ', ' ', 'เพราะ', 'เห็น', 'หลาย', 'คน', 'พูดว่า', 'มัน', 'เป็น', ' ', 'stereotypes', ' ', 'ไม่', 'ใช่', ' ', 'queerbait', ' ', 'แต่', 'ใน', 'ความจริง', ' ', '2', ' ', 'สิ่ง', 'นี้', 'มัน', 'แยก', 'ออก', 'จากกัน', 'ไม่', 'ได้', 'ค่ะ', ' ', 'นั่น', 'เป็น', 'เหตุผล', 'ว่า', 'ทำไม', 'สื่อ', ' ', 'queerbait', ' ', 'ถึง', 'ส่งผล', 'ต่อ', 'ภาพ', 'จำ', 'ของ', 'เควียร์', 'ใน', 'ชีวิตจริง']"
1985967820283527521,twitter,post,https://x.com/miramikao/status/1985967820283527521,text,2025-11-05T07:10:00.000Z,selenium_x_scraper_v1,“ฉกฉวยมาทำเงิน แต่ไม่สนับสนุน” ชวนรู้จัก Queerbaiting การตลาดที่ลดทอน LGBTQ+ ให้เป็นแค่คอนเทนต์,“ฉกฉวยมาทำเงิน แต่ไม่สนับสนุน” ชวนรู้จัก Queerbaiting การตลาดที่ลดทอน LGBTQ+ ให้เป็นแค่คอนเทนต์,2025-11-29 08:18:55,"['ฉกฉวย', 'มา', 'ทำเงิน', ' ', 'แต่', 'ไม่', 'สนับสนุน', ' ', 'ชวน', 'รู้จัก', ' ', 'queerbaiting', ' ', 'การตลาด', 'ที่', 'ลดทอน', ' ', 'lgbtq', ' ', 'ให้', 'เป็น', 'แค่', 'คอนเทนต์']"
1985967825186669014,twitter,post,https://x.com/miramikao/status/1985967825186669014,text,2025-11-05T07:10:01.000Z,selenium_x_scraper_v1,Queerbaiting การตลาดที่ลดทอนอัตลักษณ์ทางเพศ และเสียงสะท้อนจากความหลากหลาย - Varasarnpress,Queerbaiting การตลาดที่ลดทอนอัตลักษณ์ทางเพศ และเสียงสะท้อนจากความหลากหลาย - Varasarnpress,2025-11-29 08:18:55,"['queerbaiting', ' ', 'การตลาด', 'ที่', 'ลดทอน', 'อัตลักษณ์', 'ทางเพศ', ' ', 'และ', 'เสียงสะท้อน', 'จาก', 'ความหลากหลาย', ' ', 'varasarnpress']"
1985967829146021905,twitter,post,https://x.com/miramikao/status/1985967829146021905,text,2025-11-05T07:10:02.000Z,selenium_x_scraper_v1,แปะเท่านี้พอค่ะ ทุกคนคงมีกูเกิลอยู่แล้ว,แปะเท่านี้พอค่ะ ทุกคนคงมีกูเกิลอยู่แล้ว,2025-11-29 08:18:55,"['แปะ', 'เท่านี้', 'พอ', 'ค่ะ', ' ', 'ทุกคน', 'คง', 'มี', 'กูเกิล', 'อยู่แล้ว']"
1985909131862306969,twitter,post,https://x.com/Feliko_Ph/status/1985909131862306969,text,2025-11-05T03:16:48.000Z,selenium_x_scraper_v1,ผมเคยโดนถามแบบนี้ในชีวิตจริง ตอนโดนคนที่ไม่ได้สนิทมาถามผมก็รู้สึกแปลกๆ ไม่ค่อยโอเคเลยครับ,ผมเคยโดนถามแบบนี้ในชีวิตจริง ตอนโดนคนที่ไม่ได้สนิทมาถามผมก็รู้สึกแปลกๆ ไม่ค่อยโอเคเลยครับ,2025-11-29 08:18:55,"['ผม', 'เคย', 'โดน', 'ถาม', 'แบบนี้', 'ใน', 'ชีวิตจริง', ' ', 'ตอน', 'โดน', 'คน', 'ที่', 'ไม่', 'ได้', 'สนิท', 'มา', 'ถาม', 'ผม', 'ก็', 'รู้สึก', 'แปลก', 'ๆ', ' ', 'ไม่ค่อย', 'โอเค', 'เลย', 'ครับ']"
1985919690120839551,twitter,post,https://x.com/miramikao/status/1985919690120839551,text,2025-11-05T03:58:45.000Z,selenium_x_scraper_v1,ประสบการณ์ร่วมค่ะ เคยโดนถามเหมือนกันว่าเป็นทอมรึป่าว แบบนี่เป็นรุกแน่เลย อะไรแบบนั้น ซึ่งมันก็ไม่ค่อยโอเคเท่าไหร่ ส่วนนึงเป็นผลจากสื่อที่สร้าง stereotype ออกสู่สังคมมั้งคะ,ประสบการณ์ร่วมค่ะ เคยโดนถามเหมือนกันว่าเป็นทอมรึป่าว แบบนี่เป็นรุกแน่เลย อะไรแบบนั้น ซึ่งมันก็ไม่ค่อยโอเคเท่าไหร่ ส่วนนึงเป็นผลจากสื่อที่สร้าง stereotype ออกสู่สังคมมั้งคะ,2025-11-29 08:18:55,"['ประสบการณ์', 'ร่วม', 'ค่ะ', ' ', 'เคย', 'โดน', 'ถาม', 'เหมือนกัน', 'ว่า', 'เป็น', 'ทอม', 'รึ', 'ป่าว', ' ', 'แบบ', 'นี่', 'เป็น', 'รุก', 'แน่', 'เลย', ' ', 'อะไร', 'แบบ', 'นั้น', ' ', 'ซึ่ง', 'มัน', 'ก็', 'ไม่ค่อย', 'โอเค', 'เท่าไหร่', ' ', 'ส่วน', 'นึง', 'เป็นผล', 'จาก', 'สื่อ', 'ที่', 'สร้าง', ' ', 'stereotype', ' ', 'ออก', 'สู่', 'สังคม', 'มั้ง', 'คะ']"
1986033051001126930,twitter,post,https://x.com/NowL0ading/status/1986033051001126930,text,2025-11-05T11:29:12.000Z,selenium_x_scraper_v1,แก เรื่องนี้ในวงการเกย์ ชายรักชาย มันเป็นมานานแล้ว พึ่งรู้หรือว่า เกย์รับ มันเป็นประชากรชั้นต่ำกว่า เกย์รุก ยิ่งออกสาวคือประชากรชั้นล่าง มันไม่ได้พึ่งเกิดเพราะ ซีรีส์วาย,แก เรื่องนี้ในวงการเกย์ ชายรักชาย มันเป็นมานานแล้ว พึ่งรู้หรือว่า เกย์รับ มันเป็นประชากรชั้นต่ำกว่า เกย์รุก ยิ่งออกสาวคือประชากรชั้นล่าง มันไม่ได้พึ่งเกิดเพราะ ซีรีส์วาย,2025-11-29 08:18:55,"['แก', ' ', 'เรื่อง', 'นี้', 'ใน', 'วงการ', 'เกย์', ' ', 'ชาย', 'รัก', 'ชาย', ' ', 'มัน', 'เป็นมา', 'นาน', 'แล้ว', ' ', 'พึ่ง', 'รู้', 'หรือว่า', ' ', 'เกย์', 'รับ', ' ', 'มัน', 'เป็น', 'ประชากร', 'ชั้น', 'ต่ำกว่า', ' ', 'เกย์', 'รุก', ' ', 'ยิ่ง', 'ออก', 'สาว', 'คือ', 'ประชากร', 'ชั้นล่าง', ' ', 'มัน', 'ไม่', 'ได้', 'พึ่ง', 'เกิด', 'เพราะ', ' ', 'ซีรีส์', 'วาย']"
1985936254945673387,twitter,post,https://x.com/Yan9Ke/status/1985936254945673387,text,2025-11-05T05:04:34.000Z,selenium_x_scraper_v1,นี่ก็เคยโดนค่ะแต่คิดว่าอิพวกถามอะเสร่อ,นี่ก็เคยโดนค่ะแต่คิดว่าอิพวกถามอะเสร่อ,2025-11-29 08:18:55,"['นี่', 'ก็', 'เคย', 'โดน', 'ค่ะ', 'แต่', 'คิด', 'ว่า', 'อิ', 'พวก', 'ถาม', 'อะ', 'เสร่อ']"
1986030861834424737,twitter,post,https://x.com/nuttyp462/status/1986030861834424737,text,2025-11-05T11:20:30.000Z,selenium_x_scraper_v1,"เคยมีแฟนดูห้าวทั้งคู่ เราก็ห้าวเขาก็ห้าวเป็นคนไม่ค่อยแต่งตัวด้วยกันทั้งคู่ชอบง่ายๆ สบายๆ แต่มีคนถามว่าใครเป็นผัวเป็นเมีย,แหะ","เคยมีแฟนดูห้าวทั้งคู่ เราก็ห้าวเขาก็ห้าวเป็นคนไม่ค่อยแต่งตัวด้วยกันทั้งคู่ชอบง่ายๆ สบายๆ แต่มีคนถามว่าใครเป็นผัวเป็นเมีย,แหะ",2025-11-29 08:18:55,"['เคย', 'มี', 'แฟน', 'ดู', 'ห้าว', 'ทั้งคู่', ' ', 'เรา', 'ก็', 'ห้าว', 'เขา', 'ก็', 'ห้าว', 'เป็น', 'คน', 'ไม่ค่อย', 'แต่งตัว', 'ด้วยกัน', 'ทั้งคู่', 'ชอบ', 'ง่ายๆ', ' ', 'สบาย', 'ๆ', ' ', 'แต่', 'มี', 'คน', 'ถาม', 'ว่า', 'ใคร', 'เป็น', 'ผัว', 'เป็น', 'เมีย', ',', 'แหะ']"
1986580141653553629,twitter,post,https://x.com/yuzupxr/status/1986580141653553629,text,2025-11-06T23:43:09.000Z,selenium_x_scraper_v1,เราเป็นไบที่ชอบผู้หญิงมากกว่า เราเคยมีแฟนเป็นผู้หญิงแล้วเราก็เป็นรุกค่ะ แต่เพื่อน(บางคน และไม่ค่อนสนิท)ชอบบอกว่าเป็นรุกจริงหรอ? เพราะเราชอบแต่งหน้าแบบหวาน น่ารักๆ ก็เลยงงว่าเดี๋ยวนี้มันแบ่งรุกรับกันจากหน้าตาหรอ รุกรับมันไม่ใช่ความชอบตอนมีsexแล้วหรอ?,เราเป็นไบที่ชอบผู้หญิงมากกว่า เราเคยมีแฟนเป็นผู้หญิงแล้วเราก็เป็นรุกค่ะ แต่เพื่อน(บางคน และไม่ค่อนสนิท)ชอบบอกว่าเป็นรุกจริงหรอ? เพราะเราชอบแต่งหน้าแบบหวาน น่ารักๆ ก็เลยงงว่าเดี๋ยวนี้มันแบ่งรุกรับกันจากหน้าตาหรอ รุกรับมันไม่ใช่ความชอบตอนมีsexแล้วหรอ?,2025-11-29 08:18:55,"['เรา', 'เป็น', 'ไบ', 'ที่', 'ชอบ', 'ผู้หญิง', 'มากกว่า', ' ', 'เรา', 'เคย', 'มี', 'แฟน', 'เป็น', 'ผู้หญิง', 'แล้ว', 'เรา', 'ก็', 'เป็น', 'รุก', 'ค่ะ', ' ', 'แต่', 'เพื่อน', ' ', 'บางคน', ' ', 'และ', 'ไม่', 'ค่อน', 'สนิท', ' ', 'ชอบ', 'บอ', 'กว่า', 'เป็น', 'รุก', 'จริง', 'หรอ', '?', ' ', 'เพราะ', 'เรา', 'ชอบ', 'แต่งหน้า', 'แบบ', 'หวาน', ' ', 'น่ารัก', 'ๆ', ' ', 'ก็', 'เลย', 'งง', 'ว่า', 'เดี๋ยวนี้', 'มัน', 'แบ่ง', 'รุ', 'กรับ', 'กัน', 'จาก', 'หน้าตา', 'หรอ', ' ', 'รุ', 'กรับ', 'มัน', 'ไม่', 'ใช่', 'ความชอบ', 'ตอน', 'มี', 'sex', 'แล้ว', 'หรอ', '?']"
1986309875178348763,twitter,post,https://x.com/arakfanboy/status/1986309875178348763,text,2025-11-06T05:49:12.000Z,selenium_x_scraper_v1,ปัญหาเหล่านี้เกิดขึ้นไม่ใช่มาจากซีรีส์วายเลย คิดดูเอา,ปัญหาเหล่านี้เกิดขึ้นไม่ใช่มาจากซีรีส์วายเลย คิดดูเอา,2025-11-29 08:18:55,"['ปัญหา', 'เหล่านี้', 'เกิดขึ้น', 'ไม่', 'ใช่', 'มาจาก', 'ซีรีส์', 'วาย', 'เลย', ' ', 'คิดดู', 'เอา']"
1985925354599694840,twitter,post,https://x.com/Feliko_Ph/status/1985925354599694840,text,2025-11-05T04:21:15.000Z,selenium_x_scraper_v1,เราต้องให้กำลังใจกันเองแล้วครับ,เราต้องให้กำลังใจกันเองแล้วครับ,2025-11-29 08:18:55,"['เรา', 'ต้อง', 'ให้กำลังใจ', 'กันเอง', 'แล้ว', 'ครับ']"
