id,platform,platform_type,url,content_type,timestamp,scraper_module,text,raw_text,scrape_date,tokens
1976228839266148780,twitter,post,https://x.com/borntoberonme/status/1976228839266148780,text,2025-10-09T10:10:46.000Z,selenium_x_scraper_v1,เห้ย นางมีลูกเล่น,เห้ย นางมีลูกเล่น,2025-10-23 17:59:34,"['เห้ย', ' ', 'นาง', 'มี', 'ลูกเล่น']"
1976229338749284375,twitter,post,https://x.com/jxl0089x/status/1976229338749284375,text,2025-10-09T10:12:45.000Z,selenium_x_scraper_v1,ลูกเล่นอะไรร?,ลูกเล่นอะไรร?,2025-10-23 17:59:34,"['ลูกเล่น', 'อะไร', 'ร', '?']"
1976227514013057215,twitter,post,https://x.com/zzzzhana/status/1976227514013057215,text,2025-10-09T10:05:30.000Z,selenium_x_scraper_v1,เพ้อเจ้อ แปะรุปมาสะ เร็วๆ อย่าอยุ่แต่ในโลกจินตนาการได้ไหม จะวิจารหน้าให้ เรวๆ ,เพ้อเจ้อ แปะรุปมาสะ เร็วๆ อย่าอยุ่แต่ในโลกจินตนาการได้ไหม จะวิจารหน้าให้ เรวๆ ,2025-10-23 17:59:34,"['เพ้อเจ้อ', ' ', 'แปะ', 'รุ', 'ป', 'มา', 'สะ', ' ', 'เร็ว', 'ๆ', ' ', 'อย่า', 'อยุ่', 'แต่', 'ใน', 'โลก', 'จินตนาการ', 'ได้', 'ไหม', ' ', 'จะ', 'วิจาร', 'หน้า', 'ให้', ' ', 'เร', 'วๆ']"
1976228411623493698,twitter,post,https://x.com/zzzzhana/status/1976228411623493698,text,2025-10-09T10:09:04.000Z,selenium_x_scraper_v1,,,2025-10-23 17:59:34,[]
1976228816570736663,twitter,post,https://x.com/jxl0089x/status/1976228816570736663,text,2025-10-09T10:10:41.000Z,selenium_x_scraper_v1,"เหอะๆ ชมผญว่า สวย ทุกคน
แต่ด่าผช หน้าเหี้ย","เหอะๆ ชมผญว่า สวย ทุกคน
แต่ด่าผช หน้าเหี้ย",2025-10-23 17:59:34,"['เหอะ', 'ๆ', ' ', 'ชม', 'ผญ', 'ว่า', ' ', 'สวย', ' ', 'ทุกคน', ' ', 'แต่', 'ด่า', 'ผช', ' ', 'หน้า', 'เหี้ย']"
1976228010404741477,twitter,post,https://x.com/annoyedmonday/status/1976228010404741477,text,2025-10-09T10:07:28.000Z,selenium_x_scraper_v1,จิง ไม่ได้นอยไร แต่ที่น้องชายบอกผชทุกคนคือเพื่อน อันนี้ถามคนอื่นยัง อันนี้กุก้อยากรุ่เฉยๆไม่ได้จะอะไรนะแบบ มึงมีเพื่อนหราเงี้ย,จิง ไม่ได้นอยไร แต่ที่น้องชายบอกผชทุกคนคือเพื่อน อันนี้ถามคนอื่นยัง อันนี้กุก้อยากรุ่เฉยๆไม่ได้จะอะไรนะแบบ มึงมีเพื่อนหราเงี้ย,2025-10-23 17:59:34,"['จิง', ' ', 'ไม่', 'ได้', 'นอ', 'ย', 'ไร', ' ', 'แต่', 'ที่', 'น้องชาย', 'บอก', 'ผช', 'ทุกคน', 'คือ', 'เพื่อน', ' ', 'อันนี้', 'ถาม', 'คนอื่น', 'ยัง', ' ', 'อันนี้', 'กุ', 'ก้อ', 'ยาก', 'รุ่', 'เฉย', 'ๆ', 'ไม่', 'ได้', 'จะ', 'อะไร', 'นะ', 'แบบ', ' ', 'มึง', 'มี', 'เพื่อน', 'หรา', 'เงี้ย']"
1976228615823172066,twitter,post,https://x.com/jxl0089x/status/1976228615823172066,text,2025-10-09T10:09:53.000Z,selenium_x_scraper_v1,"ผมมีเพื่อน เยอะมาก อันนี้ไม่โม้ แล้วนิสัยดีทุกคน 
ผมเลยมีคติมองผช ทุกคนเป็นเพื่อนผม แค่นั้น ส่วนจะไม่มองผมเป็นเพื่อนก็แล้วแต่","ผมมีเพื่อน เยอะมาก อันนี้ไม่โม้ แล้วนิสัยดีทุกคน 
ผมเลยมีคติมองผช ทุกคนเป็นเพื่อนผม แค่นั้น ส่วนจะไม่มองผมเป็นเพื่อนก็แล้วแต่",2025-10-23 17:59:34,"['ผม', 'มี', 'เพื่อน', ' ', 'เยอะ', 'มาก', ' ', 'อันนี้', 'ไม่', 'โม้', ' ', 'แล้ว', 'นิสัย', 'ดี', 'ทุกคน', ' ', 'ผม', 'เลย', 'มี', 'คติ', 'มอง', 'ผช', ' ', 'ทุกคน', 'เป็นเพื่อน', 'ผม', ' ', 'แค่นั้น', ' ', 'ส่วน', 'จะ', 'ไม่', 'มอง', 'ผม', 'เป็นเพื่อน', 'ก็แล้วแต่']"
1976217264216330726,twitter,post,https://x.com/islandwindo/status/1976217264216330726,text,2025-10-09T09:24:46.000Z,selenium_x_scraper_v1,,,2025-10-23 17:59:34,[]
1976227749833707638,twitter,post,https://x.com/islandwindo/status/1976227749833707638,text,2025-10-09T10:06:26.000Z,selenium_x_scraper_v1,เห็นหมกมุ่นเรื่องจู๋ พูดแต่เรื่องจู๋ ใช่แน่หรอคับ,เห็นหมกมุ่นเรื่องจู๋ พูดแต่เรื่องจู๋ ใช่แน่หรอคับ,2025-10-23 17:59:34,"['เห็น', 'หมกมุ่น', 'เรื่อง', 'จู๋', ' ', 'พูด', 'แต่', 'เรื่อง', 'จู๋', ' ', 'ใช่', 'แน่', 'หรอ', 'คับ']"
1976228294367510738,twitter,post,https://x.com/jxl0089x/status/1976228294367510738,text,2025-10-09T10:08:36.000Z,selenium_x_scraper_v1,เอออ หมกมุ่น ละยุ่งอะไร,เอออ หมกมุ่น ละยุ่งอะไร,2025-10-23 17:59:34,"['เอ', 'ออ', ' ', 'หมกมุ่น', ' ', 'ละ', 'ยุ่ง', 'อะไร']"
1976189577229668604,twitter,post,https://x.com/salmon208__/status/1976189577229668604,text,2025-10-09T07:34:45.000Z,selenium_x_scraper_v1,นี่มาของนิยาม เก่งแต่กับผู้หญิงมาก พอเจอผู้ชายแล้วหางลู่ หูตก คิกๆ,นี่มาของนิยาม เก่งแต่กับผู้หญิงมาก พอเจอผู้ชายแล้วหางลู่ หูตก คิกๆ,2025-10-23 17:59:34,"['นี่', 'มา', 'ของ', 'นิยาม', ' ', 'เก่ง', 'แต่', 'กับ', 'ผู้หญิง', 'มาก', ' ', 'พอ', 'เจอ', 'ผู้ชาย', 'แล้ว', 'หาง', 'ลู่', ' ', 'หู', 'ตก', ' ', 'คิกๆ']"
1976227544669303215,twitter,post,https://x.com/jxl0089x/status/1976227544669303215,text,2025-10-09T10:05:37.000Z,selenium_x_scraper_v1,เอออๆขอโทษๆ แซวเล่นน,เอออๆขอโทษๆ แซวเล่นน,2025-10-23 17:59:34,"['เอ', 'ออ', 'ๆ', 'ขอโทษ', 'ๆ', ' ', 'แซว', 'เล่น', 'น']"
1976226938244223214,twitter,post,https://x.com/annoyedmonday/status/1976226938244223214,text,2025-10-09T10:03:13.000Z,selenium_x_scraper_v1,เหนื่อยก็พัก กุโอเค มันก้ไม่ใช่ปมอะไร เวลากุเห้นอิโมจิ  มันก้ไม่ได้รุ้สึกไรมึง จิง มันมีคนเคยบอกว่าคนที่ควยใหย่อะเวลาเห้นอิโมจิ  แม่วจะขำๆกัน แต่กุไม่รุ้กรณีน้อวชายนี่ร้อนควยเหมือนหมางี้ได้ไง แอบเซอไพ้ แต่ก้ดีใจอะที่ช่วยเป้นเดือดเป้นร้อนแทนให้,เหนื่อยก็พัก กุโอเค มันก้ไม่ใช่ปมอะไร เวลากุเห้นอิโมจิ  มันก้ไม่ได้รุ้สึกไรมึง จิง มันมีคนเคยบอกว่าคนที่ควยใหย่อะเวลาเห้นอิโมจิ  แม่วจะขำๆกัน แต่กุไม่รุ้กรณีน้อวชายนี่ร้อนควยเหมือนหมางี้ได้ไง แอบเซอไพ้ แต่ก้ดีใจอะที่ช่วยเป้นเดือดเป้นร้อนแทนให้,2025-10-23 17:59:34,"['เหนื่อย', 'ก็', 'พัก', ' ', 'กุ', 'โอเค', ' ', 'มัน', 'ก้', 'ไม่', 'ใช่', 'ปม', 'อะไร', ' ', 'เวลา', 'กุ', 'เห้นอิ', 'โมจิ', ' ', 'มัน', 'ก้', 'ไม่', 'ได้', 'รุ้', 'สึก', 'ไร', 'มึง', ' ', 'จิง', ' ', 'มัน', 'มี', 'คน', 'เคย', 'บอ', 'กว่า', 'คน', 'ที่', 'ควย', 'ใหย่', 'อะ', 'เวลา', 'เห้นอิ', 'โมจิ', ' ', 'แม่', 'วจะ', 'ขำ', 'ๆ', 'กัน', ' ', 'แต่', 'กุ', 'ไม่', 'รุ้', 'กรณี', 'น้อว', 'ชาย', 'นี่', 'ร้อน', 'ควย', 'เหมือน', 'หมา', 'งี้', 'ได้', 'ไง', ' ', 'แอบ', 'เซ', 'อไพ้', ' ', 'แต่', 'ก้', 'ดีใจ', 'อะ', 'ที่', 'ช่วย', 'เป้', 'น', 'เดือด', 'เป้', 'น', 'ร้อน', 'แทน', 'ให้']"
1976227245619638297,twitter,post,https://x.com/jxl0089x/status/1976227245619638297,text,2025-10-09T10:04:26.000Z,selenium_x_scraper_v1,"ก็กุบอกละไงพี่ ผช ทุกคน คือเพื่อน แม้จะจู๋เล็กเหมือนพี่ก็ตาม
แต่พี่เจ๋งวะ ไม่รู้สึกอะไรจริงอ่ะ","ก็กุบอกละไงพี่ ผช ทุกคน คือเพื่อน แม้จะจู๋เล็กเหมือนพี่ก็ตาม
แต่พี่เจ๋งวะ ไม่รู้สึกอะไรจริงอ่ะ",2025-10-23 17:59:34,"['ก็', 'กุ', 'บอก', 'ละ', 'ไง', 'พี่', ' ', 'ผช', ' ', 'ทุกคน', ' ', 'คือ', 'เพื่อน', ' ', 'แม้', 'จะ', 'จู๋', 'เล็ก', 'เหมือน', 'พี่', 'ก็ตาม', ' ', 'แต่', 'พี่', 'เจ๋ง', 'วะ', ' ', 'ไม่', 'รู้สึก', 'อะไร', 'จริง', 'อ่ะ']"
1976226856778011039,twitter,post,https://x.com/islandwindo/status/1976226856778011039,text,2025-10-09T10:02:53.000Z,selenium_x_scraper_v1,ใครจะอ้อนควยเหมือนพี่,ใครจะอ้อนควยเหมือนพี่,2025-10-23 17:59:34,"['ใคร', 'จะ', 'อ้อน', 'ควย', 'เหมือน', 'พี่']"
1976226964399870309,twitter,post,https://x.com/jxl0089x/status/1976226964399870309,text,2025-10-09T10:03:19.000Z,selenium_x_scraper_v1,พี่ไม่เคยอ้อนครับบ ชายแท้,พี่ไม่เคยอ้อนครับบ ชายแท้,2025-10-23 17:59:34,"['พี่', 'ไม่', 'เคย', 'อ้อน', 'ครับ', 'บ', ' ', 'ชาย', 'แท้']"
1976199640623219054,twitter,post,https://x.com/zzzzhana/status/1976199640623219054,text,2025-10-09T08:14:44.000Z,selenium_x_scraper_v1,ครับพี่ คิดว่าหล่อเพราะแม่ค้าเรียก 555+,ครับพี่ คิดว่าหล่อเพราะแม่ค้าเรียก 555+,2025-10-23 17:59:34,"['ครับ', 'พี่', ' ', 'คิด', 'ว่า', 'หล่อ', 'เพราะ', 'แม่ค้า', 'เรียก', ' ', 'หัวเราะ']"
1976226589429157916,twitter,post,https://x.com/zzzzhana/status/1976226589429157916,text,2025-10-09T10:01:50.000Z,selenium_x_scraper_v1,เห้อ เพ้อเจ้อ,เห้อ เพ้อเจ้อ,2025-10-23 17:59:34,"['เห้อ', ' ', 'เพ้อเจ้อ']"
1976226847273984103,twitter,post,https://x.com/jxl0089x/status/1976226847273984103,text,2025-10-09T10:02:51.000Z,selenium_x_scraper_v1,เรื่องของหนูเถอะ จะไปเถียงกับคนอื่นต่อ,เรื่องของหนูเถอะ จะไปเถียงกับคนอื่นต่อ,2025-10-23 17:59:34,"['เรื่อง', 'ของ', 'หนู', 'เถอะ', ' ', 'จะ', 'ไป', 'เถียง', 'กับ', 'คนอื่น', 'ต่อ']"
1976226611310755938,twitter,post,https://x.com/jxl0089x/status/1976226611310755938,text,2025-10-09T10:01:55.000Z,selenium_x_scraper_v1,แล้วผู้ชาย เป็นหมามั่งงงง,แล้วผู้ชาย เป็นหมามั่งงงง,2025-10-23 17:59:34,"['แล้ว', 'ผู้ชาย', ' ', 'เป็น', 'หมา', 'มั่ง', 'งง', 'ง']"
1976226137698406606,twitter,post,https://x.com/annoyedmonday/status/1976226137698406606,text,2025-10-09T10:00:02.000Z,selenium_x_scraper_v1,ก็จริงของน้องชาย5555555555,ก็จริงของน้องชาย5555555555,2025-10-23 17:59:34,"['ก็', 'จริง', 'ของ', 'น้องชาย', 'หัวเราะ']"
1976226328950239491,twitter,post,https://x.com/jxl0089x/status/1976226328950239491,text,2025-10-09T10:00:47.000Z,selenium_x_scraper_v1,โหห เหลือจะเชื่อ ผมจู๋ใหญ่ ต้องมาปกป้อง ไอนี่จากคนจู๋เล็กๆแบบพวกพี่อ่ะ,โหห เหลือจะเชื่อ ผมจู๋ใหญ่ ต้องมาปกป้อง ไอนี่จากคนจู๋เล็กๆแบบพวกพี่อ่ะ,2025-10-23 17:59:34,"['โห', 'ห', ' ', 'เหลือ', 'จะ', 'เชื่อ', ' ', 'ผม', 'จู๋', 'ใหญ่', ' ', 'ต้อง', 'มา', 'ปกป้อง', ' ', 'ไอ', 'นี่', 'จาก', 'คน', 'จู๋', 'เล็ก', 'ๆ', 'แบบ', 'พวก', 'พี่', 'อ่ะ']"
1976225771330076861,twitter,post,https://x.com/annoyedmonday/status/1976225771330076861,text,2025-10-09T09:58:35.000Z,selenium_x_scraper_v1,ก้กุจะล้อ ,ก้กุจะล้อ ,2025-10-23 17:59:34,"['ก้', 'กุ', 'จะ', 'ล้อ']"
1976226032660451647,twitter,post,https://x.com/jxl0089x/status/1976226032660451647,text,2025-10-09T09:59:37.000Z,selenium_x_scraper_v1,พี่ก็ ,พี่ก็ ,2025-10-23 17:59:34,"['พี่', 'ก็']"
1976225544959295777,twitter,post,https://x.com/islandwindo/status/1976225544959295777,text,2025-10-09T09:57:41.000Z,selenium_x_scraper_v1,ไม่สน ชีวิตไม่ได้หมุนรอบควย,ไม่สน ชีวิตไม่ได้หมุนรอบควย,2025-10-23 17:59:34,"['ไม่', 'สน', ' ', 'ชีวิต', 'ไม่', 'ได้', 'หมุนรอบ', 'ควย']"
1976225940679057752,twitter,post,https://x.com/jxl0089x/status/1976225940679057752,text,2025-10-09T09:59:15.000Z,selenium_x_scraper_v1,"ก็อย่าให้เห็น อ้อนควยน้าา 
พ่อจะฟาดให้ 555555","ก็อย่าให้เห็น อ้อนควยน้าา 
พ่อจะฟาดให้ 555555",2025-10-23 17:59:34,"['ก็', 'อย่า', 'ให้', 'เห็น', ' ', 'อ้อน', 'ควย', 'น้า', 'า', ' ', 'พ่อ', 'จะ', 'ฟาด', 'ให้', ' ', 'หัวเราะ']"
1976225476046881233,twitter,post,https://x.com/lovely_ekss/status/1976225476046881233,text,2025-10-09T09:57:24.000Z,selenium_x_scraper_v1,เล็ก ๆ งั้นก็ไม่ต้องงัดออกมา เก็บไว้เสียบเบ็ดตตอนกปลาเถอะ,เล็ก ๆ งั้นก็ไม่ต้องงัดออกมา เก็บไว้เสียบเบ็ดตตอนกปลาเถอะ,2025-10-23 17:59:34,"['เล็ก', ' ', 'ๆ', ' ', 'งั้น', 'ก็', 'ไม่ต้อง', 'งัด', 'ออกมา', ' ', 'เก็บ', 'ไว้', 'เสียบ', 'เบ็ด', 'ต', 'ตอ', 'นก', 'ปลา', 'เถอะ']"
1976225823368806908,twitter,post,https://x.com/jxl0089x/status/1976225823368806908,text,2025-10-09T09:58:47.000Z,selenium_x_scraper_v1,555555555 ชอบอ่ะ เม้นนี้ผมยอม สร้างสรรค์สุดๆ,555555555 ชอบอ่ะ เม้นนี้ผมยอม สร้างสรรค์สุดๆ,2025-10-23 17:59:34,"['หัวเราะ', ' ', 'ชอบ', 'อ่ะ', ' ', 'เม้น', 'นี้', 'ผม', 'ยอม', ' ', 'สร้างสรรค์', 'สุด', 'ๆ']"
1976224028076671188,twitter,post,https://x.com/annoyedmonday/status/1976224028076671188,text,2025-10-09T09:51:39.000Z,selenium_x_scraper_v1,ก็สนุก,ก็สนุก,2025-10-23 17:59:34,"['ก็', 'สนุก']"
1976225608863719579,twitter,post,https://x.com/jxl0089x/status/1976225608863719579,text,2025-10-09T09:57:56.000Z,selenium_x_scraper_v1,แต่ผมน่าจะจู๋ใหญ่กว่าพี่นะ,แต่ผมน่าจะจู๋ใหญ่กว่าพี่นะ,2025-10-23 17:59:34,"['แต่', 'ผม', 'น่าจะ', 'จู๋', 'ใหญ่', 'กว่า', 'พี่', 'นะ']"
1976222908591767908,twitter,post,https://x.com/Ravenmelonia/status/1976222908591767908,text,2025-10-09T09:47:12.000Z,selenium_x_scraper_v1,ใครเพื่อนมึง,ใครเพื่อนมึง,2025-10-23 17:59:34,"['ใคร', 'เพื่อน', 'มึง']"
1976223868714188971,twitter,post,https://x.com/jxl0089x/status/1976223868714188971,text,2025-10-09T09:51:01.000Z,selenium_x_scraper_v1,เหอะ ขยันตามมาว่าเนอะ ที่บ้านไม่มีใครคุยด้วยหรอ,เหอะ ขยันตามมาว่าเนอะ ที่บ้านไม่มีใครคุยด้วยหรอ,2025-10-23 17:59:34,"['เหอะ', ' ', 'ขยัน', 'ตามมา', 'ว่า', 'เนอะ', ' ', 'ที่', 'บ้าน', 'ไม่', 'มี', 'ใคร', 'คุย', 'ด้วย', 'หรอ']"
1976216340966035678,twitter,post,https://x.com/16Svgdelulu/status/1976216340966035678,text,2025-10-09T09:21:06.000Z,selenium_x_scraper_v1,"“I hate feminists” bro, you hate showers too apparently 445555555","“I hate feminists” bro, you hate showers too apparently 445555555",2025-10-23 17:59:34,"['i', ' ', 'hate', ' ', 'feminists', ' ', 'bro', ',', ' ', 'you', ' ', 'hate', ' ', 'showers', ' ', 'too', ' ', 'apparently', ' ', '44', 'หัวเราะ']"
1976222931773686267,twitter,post,https://x.com/16Svgdelulu/status/1976222931773686267,text,2025-10-09T09:47:18.000Z,selenium_x_scraper_v1,ประชด,ประชด,2025-10-23 17:59:34,['ประชด']
1976223437657080193,twitter,post,https://x.com/jxl0089x/status/1976223437657080193,text,2025-10-09T09:49:18.000Z,selenium_x_scraper_v1,อ๋อออ. 5555,อ๋อออ. 5555,2025-10-23 17:59:34,"['อ๋อ', 'ออ', '.', ' ', 'หัวเราะ']"
1976196939080486921,twitter,post,https://x.com/cnkdrs/status/1976196939080486921,text,2025-10-09T08:04:00.000Z,selenium_x_scraper_v1,เพื่อนหรือผัว,เพื่อนหรือผัว,2025-10-23 17:59:34,"['เพื่อน', 'หรือ', 'ผัว']"
1976222639111929908,twitter,post,https://x.com/cnkdrs/status/1976222639111929908,text,2025-10-09T09:46:08.000Z,selenium_x_scraper_v1,ฟินขนาดนี้ สงสัยติดใจจนต้องหาอะไรมายัดตูดทุกวัน,ฟินขนาดนี้ สงสัยติดใจจนต้องหาอะไรมายัดตูดทุกวัน,2025-10-23 17:59:34,"['ฟิน', 'ขนาด', 'นี้', ' ', 'สงสัย', 'ติดใจ', 'จน', 'ต้องหา', 'อะไร', 'มา', 'ยัด', 'ตูด', 'ทุกวัน']"
1976223228109652413,twitter,post,https://x.com/jxl0089x/status/1976223228109652413,text,2025-10-09T09:48:28.000Z,selenium_x_scraper_v1,"พูดจาน่าเกลียดวะ...
ก็มีบางไม่ทุกวัน","พูดจาน่าเกลียดวะ...
ก็มีบางไม่ทุกวัน",2025-10-23 17:59:34,"['พูดจา', 'น่าเกลียด', 'วะ', '...', ' ', 'ก็', 'มี', 'บาง', 'ไม่', 'ทุกวัน']"
1976222177054871640,twitter,post,https://x.com/zzzzhana/status/1976222177054871640,text,2025-10-09T09:44:18.000Z,selenium_x_scraper_v1,น่ารักอยุ่ล้ะ ครอบครัวแกมีแต่คนน่าเชี่ยๆหรออ ออกมาดูโลกน้าาาอย่ามัวแต่นอนอ้วนเกาพุงน้ำไม่อาบซดมาม่าหน้าคอม,น่ารักอยุ่ล้ะ ครอบครัวแกมีแต่คนน่าเชี่ยๆหรออ ออกมาดูโลกน้าาาอย่ามัวแต่นอนอ้วนเกาพุงน้ำไม่อาบซดมาม่าหน้าคอม,2025-10-23 17:59:34,"['น่ารัก', 'อยุ่ล้ะ', ' ', 'ครอบครัว', 'แก', 'มี', 'แต่', 'คน', 'น่า', 'เชี่ยๆ', 'หรอ', 'อ', ' ', 'ออกมา', 'ดู', 'โลก', 'น้า', 'าา', 'อย่า', 'มัวแต่', 'นอน', 'อ้วน', 'เกา', 'พุง', 'น้ำ', 'ไม่', 'อาบ', 'ซด', 'มาม่า', 'หน้า', 'คอม']"
1976223051873497524,twitter,post,https://x.com/jxl0089x/status/1976223051873497524,text,2025-10-09T09:47:46.000Z,selenium_x_scraper_v1,"เหอะๆ ไม่ใช่พวก ติ๋มๆนอนอ้วน ชว หน้าคอม ละกันนะ
สังคมผญ ดีเนอะ ทำไมยังเห็นแอบนินทากันละครับ","เหอะๆ ไม่ใช่พวก ติ๋มๆนอนอ้วน ชว หน้าคอม ละกันนะ
สังคมผญ ดีเนอะ ทำไมยังเห็นแอบนินทากันละครับ",2025-10-23 17:59:34,"['เหอะ', 'ๆ', ' ', 'ไม่', 'ใช่', 'พวก', ' ', 'ติ๋มๆ', 'นอน', 'อ้วน', ' ', 'ชว', ' ', 'หน้า', 'คอม', ' ', 'ละ', 'กัน', 'นะ', ' ', 'สังคม', 'ผญ', ' ', 'ดี', 'เนอะ', ' ', 'ทำไม', 'ยัง', 'เห็น', 'แอบ', 'นินทา', 'กัน', 'ละ', 'ครับ']"
1976222652332437700,twitter,post,https://x.com/jxl0089x/status/1976222652332437700,text,2025-10-09T09:46:11.000Z,selenium_x_scraper_v1,แม่บอกภูมิใจทุกวัน สงสารอะไร555,แม่บอกภูมิใจทุกวัน สงสารอะไร555,2025-10-23 17:59:34,"['แม่', 'บอก', 'ภูมิใจ', 'ทุกวัน', ' ', 'สงสาร', 'อะไร', 'หัวเราะ']"
1976221614841921784,twitter,post,https://x.com/annoyedmonday/status/1976221614841921784,text,2025-10-09T09:42:04.000Z,selenium_x_scraper_v1,คับ ,คับ ,2025-10-23 17:59:34,['คับ']
1976222500112695508,twitter,post,https://x.com/jxl0089x/status/1976222500112695508,text,2025-10-09T09:45:35.000Z,selenium_x_scraper_v1,อ่าว จะล้อจู๋กันเอง ทำไมวะพี่ งง,อ่าว จะล้อจู๋กันเอง ทำไมวะพี่ งง,2025-10-23 17:59:34,"['อ่าว', ' ', 'จะ', 'ล้อ', 'จู๋', 'กันเอง', ' ', 'ทำไม', 'วะ', 'พี่', ' ', 'งง']"
