id,platform,platform_type,url,content_type,timestamp,scraper_module,text,raw_text,scrape_date,tokens
1990057440721900025,twitter,post,https://x.com/iAkky55555/status/1990057440721900025,text,2025-11-16T14:00:42.000Z,selenium_x_scraper_v1,"ทำไมเราเงินเดือน 65,000 ปันผลหุ้นส่วนปีละ 3 ล้าน แต่หาแฟนไม่ได้ซักคน คือคนที่มาชอบกูก็ไม่ชอบเขา แต่คนที่กูชอบเขา เขาก็ไม่สนใจ เฮ้อๆๆๆๆ","ทำไมเราเงินเดือน 65,000 ปันผลหุ้นส่วนปีละ 3 ล้าน แต่หาแฟนไม่ได้ซักคน คือคนที่มาชอบกูก็ไม่ชอบเขา แต่คนที่กูชอบเขา เขาก็ไม่สนใจ เฮ้อๆๆๆๆ",2025-11-29 08:18:55,"['ทำไม', 'เรา', 'เงินเดือน', ' ', '65,000', ' ', 'ปันผล', 'หุ้นส่วน', 'ปี', 'ละ', ' ', '3', ' ', 'ล้าน', ' ', 'แต่', 'หา', 'แฟน', 'ไม่', 'ได้', 'ซัก', 'คน', ' ', 'คือ', 'คน', 'ที่มา', 'ชอบ', 'กู', 'ก็', 'ไม่', 'ชอบ', 'เขา', ' ', 'แต่', 'คน', 'ที่', 'กู', 'ชอบ', 'เขา', ' ', 'เขา', 'ก็', 'ไม่', 'สนใจ', ' ', 'เฮ้อ', 'ๆๆๆๆ']"
1990094642168173043,twitter,post,https://x.com/Noobmas52558341/status/1990094642168173043,text,2025-11-16T16:28:31.000Z,selenium_x_scraper_v1,ก็ส่วนใหญ่เป็นงั้น ขี้แพ้ เสร่อแดก,ก็ส่วนใหญ่เป็นงั้น ขี้แพ้ เสร่อแดก,2025-11-29 08:18:55,"['ก็', 'ส่วนใหญ่', 'เป็น', 'งั้น', ' ', 'ขี้', 'แพ้', ' ', 'เสร่อ', 'แดก']"
1989993824605905088,twitter,post,https://x.com/Summer_Romancez/status/1989993824605905088,text,2025-11-16T09:47:54.000Z,selenium_x_scraper_v1,พอกัน,พอกัน,2025-11-29 08:18:55,['พอกัน']
1990338815630983604,twitter,post,https://x.com/thintiwasin/status/1990338815630983604,text,2025-11-17T08:38:47.000Z,selenium_x_scraper_v1,น่าจะหมายถึงพ่อตัวเองคนเดียวนะ ที่ลูเซอร์อะ,น่าจะหมายถึงพ่อตัวเองคนเดียวนะ ที่ลูเซอร์อะ,2025-11-29 08:18:55,"['น่าจะ', 'หมายถึง', 'พ่อ', 'ตัวเอง', 'คนเดียว', 'นะ', ' ', 'ที่', 'ลู', 'เซอร์', 'อะ']"
1989974975198146767,twitter,post,https://x.com/asabadahey/status/1989974975198146767,text,2025-11-16T08:33:00.000Z,selenium_x_scraper_v1,คนไม่ใช่อะไรก็ผิดอยู่แล้ว,คนไม่ใช่อะไรก็ผิดอยู่แล้ว,2025-11-29 08:18:55,"['คน', 'ไม่', 'ใช่', 'อะไร', 'ก็', 'ผิด', 'อยู่แล้ว']"
1990090025741295685,twitter,post,https://x.com/SayfaWi/status/1990090025741295685,text,2025-11-16T16:10:10.000Z,selenium_x_scraper_v1,ก็ผู้หญิงไทยมันขี้แพ้อะ เลยมีแต่ความคิดทรงนี้ แล้วมาบอกทุกคนก็อยากเลือกสิ่งที่ดีที่สุดให้ตัวเอง แต่ทุกคนในที่นี้คือเพศตัวเองแค่นั้นแหละจ้าที่ทำได้,ก็ผู้หญิงไทยมันขี้แพ้อะ เลยมีแต่ความคิดทรงนี้ แล้วมาบอกทุกคนก็อยากเลือกสิ่งที่ดีที่สุดให้ตัวเอง แต่ทุกคนในที่นี้คือเพศตัวเองแค่นั้นแหละจ้าที่ทำได้,2025-11-29 08:18:55,"['ก็', 'ผู้หญิง', 'ไทย', 'มัน', 'ขี้', 'แพ้', 'อะ', ' ', 'เลย', 'มี', 'แต่', 'ความคิด', 'ทรง', 'นี้', ' ', 'แล้ว', 'มา', 'บอก', 'ทุกคน', 'ก็', 'อยาก', 'เลือก', 'สิ่ง', 'ที่', 'ดี', 'ที่สุด', 'ให้', 'ตัวเอง', ' ', 'แต่', 'ทุกคน', 'ในที่นี้', 'คือ', 'เพศ', 'ตัวเอง', 'แค่', 'นั้นแหละ', 'จ้า', 'ที่', 'ทำได้']"
1989900439786262581,twitter,post,https://x.com/Suwatleerat/status/1989900439786262581,text,2025-11-16T03:36:50.000Z,selenium_x_scraper_v1,มีแต่คนโง่ หาผัว สุดท้ายมีลูก มีภาระ มีหนี้ที่ผัวพามาให้ แถมเป็นsingle mom น้ำตาร่วงตลอดชีวิต,มีแต่คนโง่ หาผัว สุดท้ายมีลูก มีภาระ มีหนี้ที่ผัวพามาให้ แถมเป็นsingle mom น้ำตาร่วงตลอดชีวิต,2025-11-29 08:18:55,"['มี', 'แต่', 'คนโง่', ' ', 'หา', 'ผัว', ' ', 'สุดท้าย', 'มีลูก', ' ', 'มี', 'ภาระ', ' ', 'มี', 'หนี้', 'ที่', 'ผัว', 'พา', 'มา', 'ให้', ' ', 'แถม', 'เป็น', 'single', ' ', 'mom', ' ', 'น้ำตา', 'ร่วง', 'ตลอดชีวิต']"
1990081884957688260,twitter,post,https://x.com/sayvrrn/status/1990081884957688260,text,2025-11-16T15:37:49.000Z,selenium_x_scraper_v1,ตรรกะส้นตีนอะไรของมึง,ตรรกะส้นตีนอะไรของมึง,2025-11-29 08:18:55,"['ตรรกะ', 'ส้นตีน', 'อะไร', 'ของ', 'มึง']"
1990159847409737733,twitter,post,https://x.com/LarkwellVispy/status/1990159847409737733,text,2025-11-16T20:47:37.000Z,selenium_x_scraper_v1,การโพสอะไรดีๆ มีเหตุผลแล้วโดนด่าคือมีเยอะมากเป็นเรื่องปกติไปแล้ว เหมือนคนมันอยากทำไรก็ได้บนโลกโซเชียว,การโพสอะไรดีๆ มีเหตุผลแล้วโดนด่าคือมีเยอะมากเป็นเรื่องปกติไปแล้ว เหมือนคนมันอยากทำไรก็ได้บนโลกโซเชียว,2025-11-29 08:18:55,"['การ', 'โพส', 'อะไร', 'ดี', 'ๆ', ' ', 'มีเหตุผล', 'แล้ว', 'โดน', 'ด่า', 'คือ', 'มี', 'เยอะ', 'มาก', 'เป็นเรื่อง', 'ปกติ', 'ไป', 'แล้ว', ' ', 'เหมือน', 'คน', 'มัน', 'อยาก', 'ทำ', 'ไร', 'ก็ได้', 'บน', 'โลก', 'โซ', 'เชียว']"
1990471694600057284,twitter,post,https://x.com/kkurtmack/status/1990471694600057284,text,2025-11-17T17:26:47.000Z,selenium_x_scraper_v1,สุดท้าย ผู้หญิง จะเอาผัว อยากให้เอาผัวอายุมาก ๆ หน่อย พวกเรื่องปวดหัวปัญญาอ่อนฉบับชายไทยวัยเห่อหมอย จะหายไปเกือบ 90%,สุดท้าย ผู้หญิง จะเอาผัว อยากให้เอาผัวอายุมาก ๆ หน่อย พวกเรื่องปวดหัวปัญญาอ่อนฉบับชายไทยวัยเห่อหมอย จะหายไปเกือบ 90%,2025-11-29 08:18:55,"['สุดท้าย', ' ', 'ผู้หญิง', ' ', 'จะ', 'เอา', 'ผัว', ' ', 'อยาก', 'ให้', 'เอา', 'ผัว', 'อายุ', 'มาก', ' ', 'ๆ', ' ', 'หน่อย', ' ', 'พวก', 'เรื่อง', 'ปวดหัว', 'ปัญญาอ่อน', 'ฉบับ', 'ชาย', 'ไทย', 'วัย', 'เห่อ', 'หมอย', ' ', 'จะ', 'หาย', 'ไป', 'เกือบ', ' ', '90']"
1989949361556730252,twitter,post,https://x.com/monika3235/status/1989949361556730252,text,2025-11-16T06:51:13.000Z,selenium_x_scraper_v1,ผู้ชายไทยรวมพ่อเธอด่วยหรือเปล่าค่ะ,ผู้ชายไทยรวมพ่อเธอด่วยหรือเปล่าค่ะ,2025-11-29 08:18:55,"['ผู้ชาย', 'ไทย', 'รวม', 'พ่อ', 'เธอ', 'ด่วย', 'หรือเปล่า', 'ค่ะ']"
1989774715817484315,twitter,post,https://x.com/aleipmll_stu/status/1989774715817484315,text,2025-11-15T19:17:15.000Z,selenium_x_scraper_v1,วาทะกากๆของอีพวก ผญ จงเลือก ผช ที่นี่นับปะ,วาทะกากๆของอีพวก ผญ จงเลือก ผช ที่นี่นับปะ,2025-11-29 08:18:55,"['วาทะ', 'กาก', 'ๆ', 'ของ', 'อี', 'พวก', ' ', 'ผญ', ' ', 'จง', 'เลือก', ' ', 'ผช', ' ', 'ที่นี่', 'นับ', 'ปะ']"
1990134671980589428,twitter,post,https://x.com/hmcr848511/status/1990134671980589428,text,2025-11-16T19:07:35.000Z,selenium_x_scraper_v1,"ด่าญมีผัวรวยว่า gold digger? ก็เห็นแต่ผู้หญิงด่ากันเอง ก็นะอยู่ในสังคมแบบไหนก็คงเห็นสิ่งนั้นบ่อยแหละ 
ในtiktokผู้ชายให้เงินผู้หญิง แล้วมีผู้หญิงมาไล่คอมเมนต์ อยากได้แบบนี้ กูยังเปย์ผัวตัวเองอยู่เลย อยากได้บ้าง ยังมีเป็นร้อยคอมเมนต์ ผู้หญิงพวกนั้นคุณนับเป็นloserด้วยมั้ย?","ด่าญมีผัวรวยว่า gold digger? ก็เห็นแต่ผู้หญิงด่ากันเอง ก็นะอยู่ในสังคมแบบไหนก็คงเห็นสิ่งนั้นบ่อยแหละ 
ในtiktokผู้ชายให้เงินผู้หญิง แล้วมีผู้หญิงมาไล่คอมเมนต์ อยากได้แบบนี้ กูยังเปย์ผัวตัวเองอยู่เลย อยากได้บ้าง ยังมีเป็นร้อยคอมเมนต์ ผู้หญิงพวกนั้นคุณนับเป็นloserด้วยมั้ย?",2025-11-29 08:18:55,"['ด่า', 'ญ', 'มี', 'ผัว', 'รวย', 'ว่า', ' ', 'gold', ' ', 'digger', '?', ' ', 'ก็', 'เห็น', 'แต่', 'ผู้หญิง', 'ด่า', 'กันเอง', ' ', 'ก็', 'นะ', 'อยู่', 'ใน', 'สังคม', 'แบบ', 'ไหน', 'ก็', 'คง', 'เห็น', 'สิ่ง', 'นั้น', 'บ่อย', 'แหละ', ' ', 'ใน', 'tiktok', 'ผู้ชาย', 'ให้เงิน', 'ผู้หญิง', ' ', 'แล้ว', 'มี', 'ผู้หญิง', 'มา', 'ไล่', 'คอมเมนต์', ' ', 'อยากได้', 'แบบนี้', ' ', 'กู', 'ยัง', 'เปย์', 'ผัว', 'ตัวเอง', 'อยู่เลย', ' ', 'อยากได้', 'บ้าง', ' ', 'ยังมี', 'เป็น', 'ร้อย', 'คอมเมนต์', ' ', 'ผู้หญิง', 'พวก', 'นั้น', 'คุณ', 'นับ', 'เป็น', 'loser', 'ด้วย', 'มั้ย', '?']"
1989900570308862424,twitter,post,https://x.com/sportero25/status/1989900570308862424,text,2025-11-16T03:37:21.000Z,selenium_x_scraper_v1,เราไม่อิจฉา แต่สงสารนะ ตอนอยู่ยุโรป สงสารหญิงไทยมาก แต่ละคนที่ไป ไมรู้ขุดทองหรือขุดขี้  มันคือคนใช้ชัดๆ  แต่เขาก็อดทนเพื่อจะได้เศษเงินเลี้ยงครอบครัว,เราไม่อิจฉา แต่สงสารนะ ตอนอยู่ยุโรป สงสารหญิงไทยมาก แต่ละคนที่ไป ไมรู้ขุดทองหรือขุดขี้  มันคือคนใช้ชัดๆ  แต่เขาก็อดทนเพื่อจะได้เศษเงินเลี้ยงครอบครัว,2025-11-29 08:18:55,"['เรา', 'ไม่', 'อิจฉา', ' ', 'แต่', 'สงสาร', 'นะ', ' ', 'ตอน', 'อยู่', 'ยุโรป', ' ', 'สงสาร', 'หญิง', 'ไทย', 'มาก', ' ', 'แต่ละคน', 'ที่', 'ไป', ' ', 'ไม', 'รู้', 'ขุด', 'ทอง', 'หรือ', 'ขุด', 'ขี้', ' ', 'มัน', 'คือ', 'คนใช้', 'ชัด', 'ๆ', ' ', 'แต่', 'เขา', 'ก็', 'อดทน', 'เพื่อ', 'จะ', 'ได้', 'เศษ', 'เงิน', 'เลี้ยง', 'ครอบครัว']"
1989958844601294894,twitter,post,https://x.com/underdaseaaaaaa/status/1989958844601294894,text,2025-11-16T07:28:54.000Z,selenium_x_scraper_v1,ผมว่าใครก็ตามที่โพสต์หาแฟนในเฟซก็โดนล้อโดนด่าหมดมั้งครับทั้งผชผญ แล้วแต่พวกทรามมันจะหามาด่าได้มันเอาทุกประเด็นที่จะแซะได้แหละ,ผมว่าใครก็ตามที่โพสต์หาแฟนในเฟซก็โดนล้อโดนด่าหมดมั้งครับทั้งผชผญ แล้วแต่พวกทรามมันจะหามาด่าได้มันเอาทุกประเด็นที่จะแซะได้แหละ,2025-11-29 08:18:55,"['ผม', 'ว่า', 'ใครก็ตาม', 'ที่', 'โพสต์', 'หา', 'แฟน', 'ใน', 'เฟซ', 'ก็', 'โดน', 'ล้อ', 'โดน', 'ด่า', 'หมด', 'มั้ง', 'ครับ', 'ทั้ง', 'ผชผญ', ' ', 'แล้วแต่', 'พวก', 'ทราม', 'มัน', 'จะ', 'หา', 'มา', 'ด่า', 'ได้', 'มัน', 'เอา', 'ทุก', 'ประเด็น', 'ที่จะ', 'แซะ', 'ได้', 'แหละ']"
1990117233436086585,twitter,post,https://x.com/kobie_lufis/status/1990117233436086585,text,2025-11-16T17:58:17.000Z,selenium_x_scraper_v1,ผู้ชาย ลูเซอร์ มีจริงมั้ยเถียง แต่ๆๆ ผู้หญิงเกาะแดกกก็มีอยู่จริง เช่น คบกันไม่ทันไรซัพพอร์ทได้มั้ย ซัพพ็อร์เหี้ยรัยก่อน อยากได้ไม่หาเองก่อนล่ะ นี่ยังไม่ทันไรแบมือขอ พอไม่ได้ก็เอาไปวิจารย์ หาแฟนรึหาคนเกาะแดก,ผู้ชาย ลูเซอร์ มีจริงมั้ยเถียง แต่ๆๆ ผู้หญิงเกาะแดกกก็มีอยู่จริง เช่น คบกันไม่ทันไรซัพพอร์ทได้มั้ย ซัพพ็อร์เหี้ยรัยก่อน อยากได้ไม่หาเองก่อนล่ะ นี่ยังไม่ทันไรแบมือขอ พอไม่ได้ก็เอาไปวิจารย์ หาแฟนรึหาคนเกาะแดก,2025-11-29 08:18:55,"['ผู้ชาย', ' ', 'ลู', 'เซอร์', ' ', 'มี', 'จริง', 'มั้ย', 'เถียง', ' ', 'แต่', 'ๆๆ', ' ', 'ผู้หญิง', 'เกาะ', 'แด', 'กก', 'ก็', 'มี', 'อยู่', 'จริง', ' ', 'เช่น', ' ', 'คบ', 'กัน', 'ไม่', 'ทัน', 'ไร', 'ซัพพอร์ท', 'ได้', 'มั้ย', ' ', 'ซัพ', 'พ็อร์', 'เหี้ย', 'รัย', 'ก่อน', ' ', 'อยากได้', 'ไม่', 'หา', 'เอง', 'ก่อน', 'ล่ะ', ' ', 'นี่', 'ยัง', 'ไม่', 'ทัน', 'ไร', 'แบมือ', 'ขอ', ' ', 'พอ', 'ไม่', 'ได้', 'ก็', 'เอา', 'ไป', 'วิ', 'จารย์', ' ', 'หา', 'แฟน', 'รึ', 'หา', 'คน', 'เกาะ', 'แดก']"
1990088053621461444,twitter,post,https://x.com/DYokenolf/status/1990088053621461444,text,2025-11-16T16:02:20.000Z,selenium_x_scraper_v1,ปัญหาคืออะไรรู้มั้ย กุจะบอกให้ คือคนชอบเสือกเรื่องคนอื่นแล้วเสร่อไปวิจารณ์เค้า ทั้งๆที่ชีวิตมันก็คนละแบบกัน มีให่เกร่อโซเชียลไปหมด,ปัญหาคืออะไรรู้มั้ย กุจะบอกให้ คือคนชอบเสือกเรื่องคนอื่นแล้วเสร่อไปวิจารณ์เค้า ทั้งๆที่ชีวิตมันก็คนละแบบกัน มีให่เกร่อโซเชียลไปหมด,2025-11-29 08:18:55,"['ปัญหา', 'คือ', 'อะไร', 'รู้', 'มั้ย', ' ', 'กุ', 'จะ', 'บอก', 'ให้', ' ', 'คือ', 'คน', 'ชอบ', 'เสือก', 'เรื่อง', 'คนอื่น', 'แล้ว', 'เสร่อ', 'ไป', 'วิจารณ์', 'เค้า', ' ', 'ทั้งๆ', 'ที่', 'ชีวิต', 'มัน', 'ก็', 'คนละ', 'แบบ', 'กัน', ' ', 'มี', 'ให่', 'เกร่อ', 'โซเชียล', 'ไป', 'หมด']"
1989748820582994335,twitter,post,https://x.com/MaDiHah96/status/1989748820582994335,text,2025-11-15T04:15:53.000Z,selenium_x_scraper_v1,เจอในเฟส ผญมีผัวแถวๆอาหรับหรือดูไบนี่แหละ ผัวขับซุปเปอร์คาร์ ก็โพสอวดผัวปกติ โดนแคปเอาไปแขวนในกลุ่มพวกผชลูซเซอร์ แต่ล่ะตัวมาเม้นบอกประเทศแถวนั้นรถแบบนี้ไม่แพงนะ ไม่เห็นจะแพงเลยบลาๆ โธ่ไอ้ควาย ไม่แพงแล้วมึงมีปัญญาซื้อไหมล่ะ บางตัวนั่งพิมพ์อยู่ในห้องเช่าโง่ๆสภาพจน กูเหลือจะเชื่อ,เจอในเฟส ผญมีผัวแถวๆอาหรับหรือดูไบนี่แหละ ผัวขับซุปเปอร์คาร์ ก็โพสอวดผัวปกติ โดนแคปเอาไปแขวนในกลุ่มพวกผชลูซเซอร์ แต่ล่ะตัวมาเม้นบอกประเทศแถวนั้นรถแบบนี้ไม่แพงนะ ไม่เห็นจะแพงเลยบลาๆ โธ่ไอ้ควาย ไม่แพงแล้วมึงมีปัญญาซื้อไหมล่ะ บางตัวนั่งพิมพ์อยู่ในห้องเช่าโง่ๆสภาพจน กูเหลือจะเชื่อ,2025-11-29 08:18:55,"['เจอ', 'ใน', 'เฟส', ' ', 'ผญ', 'มี', 'ผัว', 'แถวๆ', 'อาหรับ', 'หรือ', 'ดูไบ', 'นี่แหละ', ' ', 'ผัว', 'ขับ', 'ซุปเปอร์', 'คาร์', ' ', 'ก็', 'โพส', 'อวด', 'ผัว', 'ปกติ', ' ', 'โดน', 'แคป', 'เอา', 'ไป', 'แขวน', 'ใน', 'กลุ่ม', 'พวก', 'ผชลูซ', 'เซอร์', ' ', 'แต่', 'ล่ะ', 'ตัว', 'มา', 'เม้น', 'บอก', 'ประเทศ', 'แถว', 'นั้น', 'รถ', 'แบบนี้', 'ไม่', 'แพง', 'นะ', ' ', 'ไม่เห็นจะ', 'แพง', 'เลย', 'บ', 'ลา', 'ๆ', ' ', 'โธ่', 'ไอ้', 'ควาย', ' ', 'ไม่', 'แพง', 'แล้ว', 'มึง', 'มี', 'ปัญญา', 'ซื้อ', 'ไหม', 'ล่ะ', ' ', 'บาง', 'ตัว', 'นั่ง', 'พิมพ์', 'อยู่', 'ใน', 'ห้องเช่า', 'โง่', 'ๆ', 'สภา', 'พจน', ' ', 'กู', 'เหลือ', 'จะ', 'เชื่อ']"
1990074214087287196,twitter,post,https://x.com/chompoo_queen/status/1990074214087287196,text,2025-11-16T15:07:21.000Z,selenium_x_scraper_v1,คนไม่มีปัญญามักจะบอกว่าไม่ชอบสิ่งนั้นๆ  แล้วพูดด้อยค่า,คนไม่มีปัญญามักจะบอกว่าไม่ชอบสิ่งนั้นๆ  แล้วพูดด้อยค่า,2025-11-29 08:18:55,"['คน', 'ไม่', 'มี', 'ปัญญา', 'มักจะ', 'บอ', 'กว่า', 'ไม่', 'ชอบ', 'สิ่ง', 'นั้นๆ', ' ', 'แล้ว', 'พูด', 'ด้อยค่า']"
1990040523365855481,twitter,post,https://x.com/hoysuay/status/1990040523365855481,text,2025-11-16T12:53:28.000Z,selenium_x_scraper_v1,เจอเหมือนกันว่าเขา gold digger เกาะผชกิน ผชไม่จริงจัง มั่นหน้า ฮัลโหลเขาแต่งงานกันแล้วจ้า,เจอเหมือนกันว่าเขา gold digger เกาะผชกิน ผชไม่จริงจัง มั่นหน้า ฮัลโหลเขาแต่งงานกันแล้วจ้า,2025-11-29 08:18:55,"['เจอ', 'เหมือนกัน', 'ว่า', 'เขา', ' ', 'gold', ' ', 'digger', ' ', 'เกาะ', 'ผช', 'กิน', ' ', 'ผช', 'ไม่', 'จริงจัง', ' ', 'มั่น', 'หน้า', ' ', 'ฮัลโหล', 'เขา', 'แต่งงาน', 'กัน', 'แล้ว', 'จ้า']"
1990242103830675652,twitter,post,https://x.com/home_evev/status/1990242103830675652,text,2025-11-17T02:14:29.000Z,selenium_x_scraper_v1,กลุ่มนี้แขวนผญ.บ่อยมาก แล้วรุมเม้นด่าอย่างแย่,กลุ่มนี้แขวนผญ.บ่อยมาก แล้วรุมเม้นด่าอย่างแย่,2025-11-29 08:18:55,"['กลุ่ม', 'นี้', 'แขวน', 'ผญ.', 'บ่อย', 'มาก', ' ', 'แล้ว', 'รุม', 'เม้น', 'ด่า', 'อย่าง', 'แย่']"
1990277522949599396,twitter,post,https://x.com/PichyUnchari/status/1990277522949599396,text,2025-11-17T04:35:13.000Z,selenium_x_scraper_v1,แค่คุณเป็นผู้ชายรวยโลกก็ใจดีกับคุณ  ,แค่คุณเป็นผู้ชายรวยโลกก็ใจดีกับคุณ  ,2025-11-29 08:18:55,"['แค่', 'คุณ', 'เป็น', 'ผู้ชาย', 'รวย', 'โลก', 'ก็', 'ใจดี', 'กับ', 'คุณ']"
1990266293107507650,twitter,post,https://x.com/yuhoo_natthida/status/1990266293107507650,text,2025-11-17T03:50:36.000Z,selenium_x_scraper_v1,รู้เลยกลุ่มไหน มีแค่ไม่กี่กลุ่มหรอกอิพวกนี้,รู้เลยกลุ่มไหน มีแค่ไม่กี่กลุ่มหรอกอิพวกนี้,2025-11-29 08:18:55,"['รู้', 'เลย', 'กลุ่ม', 'ไหน', ' ', 'มี', 'แค่', 'ไม่', 'กี่', 'กลุ่ม', 'หรอก', 'อิ', 'พวก', 'นี้']"
