id,platform,platform_type,url,content_type,timestamp,scraper_module,text,raw_text,scrape_date,tokens
1968972070269694093,twitter,post,https://x.com/birinbe/status/1968972070269694093,text,2025-09-19T09:34:57.000Z,selenium_x_scraper_v1,แล้วของคุณล่ะ?,แล้วของคุณล่ะ?,2025-11-08 17:05:14,"['แล้ว', 'ของ', 'คุณ', 'ล่ะ', '?']"
1968972572046831792,twitter,post,https://x.com/crta_me/status/1968972572046831792,text,2025-09-19T09:36:57.000Z,selenium_x_scraper_v1,ไม่ขอค่ะแล้วคุณก็ไม่ขอเช่นกันเห็นไหมคะว่าถ้าไม่ได้เอาไปใช้เชิงพาณิชย์ มันก็ไม่ผิด,ไม่ขอค่ะแล้วคุณก็ไม่ขอเช่นกันเห็นไหมคะว่าถ้าไม่ได้เอาไปใช้เชิงพาณิชย์ มันก็ไม่ผิด,2025-11-08 17:05:14,"['ไม่', 'ขอ', 'ค่ะ', 'แล้ว', 'คุณ', 'ก็', 'ไม่', 'ขอ', 'เช่นกัน', 'เห็น', 'ไหม', 'คะ', 'ว่า', 'ถ้า', 'ไม่', 'ได้', 'เอา', 'ไป', 'ใช้', 'เชิงพาณิชย์', ' ', 'มัน', 'ก็', 'ไม่', 'ผิด']"
1968971067138953379,twitter,post,https://x.com/birinbe/status/1968971067138953379,text,2025-09-19T09:30:58.000Z,selenium_x_scraper_v1,ปกติโตมาในสังคมที่หล่อหลอมให้เอาของคนอื่นไปโดยไม่ขอ หรือขออนุญาตก่อนเหรอคะ,ปกติโตมาในสังคมที่หล่อหลอมให้เอาของคนอื่นไปโดยไม่ขอ หรือขออนุญาตก่อนเหรอคะ,2025-11-08 17:05:14,"['ปกติ', 'โตมา', 'ใน', 'สังคม', 'ที่', 'หล่อหลอม', 'ให้', 'เอา', 'ของ', 'คนอื่น', 'ไป', 'โดย', 'ไม่', 'ขอ', ' ', 'หรือ', 'ขออนุญาต', 'ก่อน', 'เหรอ', 'คะ']"
1968971638738727358,twitter,post,https://x.com/crta_me/status/1968971638738727358,text,2025-09-19T09:33:15.000Z,selenium_x_scraper_v1,งั้นรูปโปรคุณได้ขอเจ้าของก่อนที่จะเอาตั้งไหมคะ ?,งั้นรูปโปรคุณได้ขอเจ้าของก่อนที่จะเอาตั้งไหมคะ ?,2025-11-08 17:05:14,"['งั้น', 'รูป', 'โปร', 'คุณ', 'ได้', 'ขอ', 'เจ้าของ', 'ก่อนที่จะ', 'เอา', 'ตั้ง', 'ไหม', 'คะ', ' ', '?']"
1968945664584265962,twitter,post,https://x.com/jaylerqz/status/1968945664584265962,text,2025-09-19T07:50:02.000Z,selenium_x_scraper_v1,จำเป็นดิ ใครบอกไม่ต้องขออะ รูปมันมีเจ้าของ,จำเป็นดิ ใครบอกไม่ต้องขออะ รูปมันมีเจ้าของ,2025-11-08 17:05:14,"['จำเป็น', 'ดิ', ' ', 'ใคร', 'บอก', 'ไม่ต้อง', 'ขอ', 'อะ', ' ', 'รูป', 'มัน', 'มีเจ้าของ']"
1968968907357659314,twitter,post,https://x.com/crta_me/status/1968968907357659314,text,2025-09-19T09:22:23.000Z,selenium_x_scraper_v1,มันก็ไม่ได้เอาไปใช้ในเชิงพาณิชย์นี่คะ,มันก็ไม่ได้เอาไปใช้ในเชิงพาณิชย์นี่คะ,2025-11-08 17:05:14,"['มัน', 'ก็', 'ไม่', 'ได้', 'เอา', 'ไป', 'ใช้', 'ใน', 'เชิงพาณิชย์', 'นี่', 'คะ']"
1968965554640699815,twitter,post,https://x.com/Nawaa34/status/1968965554640699815,text,2025-09-19T09:09:04.000Z,selenium_x_scraper_v1,ของคนอื่นยังไงก็ต้องขออนุญาตมีสิทธิ์อะไรถึงเอาไปใช้โดยไม่ขอ เขาเอาเรื่องขึ้นมาเดี๋ยวก็บอกรู้เท่าไม่ถึงการ คิดดีๆ คิดทบทวนอีกทีค่ะ ศึกษากฏหมายและเรื่องลิขสิทธิ์เยอะๆ นะคะก่อนพิมพ์,ของคนอื่นยังไงก็ต้องขออนุญาตมีสิทธิ์อะไรถึงเอาไปใช้โดยไม่ขอ เขาเอาเรื่องขึ้นมาเดี๋ยวก็บอกรู้เท่าไม่ถึงการ คิดดีๆ คิดทบทวนอีกทีค่ะ ศึกษากฏหมายและเรื่องลิขสิทธิ์เยอะๆ นะคะก่อนพิมพ์,2025-11-08 17:05:14,"['ของ', 'คนอื่น', 'ยังไง', 'ก็', 'ต้อง', 'ขออนุญาต', 'มีสิทธิ์', 'อะไร', 'ถึง', 'เอา', 'ไป', 'ใช้', 'โดย', 'ไม่', 'ขอ', ' ', 'เขา', 'เอาเรื่อง', 'ขึ้น', 'มา', 'เดี๋ยว', 'ก็', 'บอก', 'รู้เท่าไม่ถึงการ', ' ', 'คิด', 'ดี', 'ๆ', ' ', 'คิดทบทวน', 'อีกที', 'ค่ะ', ' ', 'ศึกษา', 'กฏ', 'หมาย', 'และ', 'เรื่อง', 'ลิขสิทธิ์', 'เยอะ', 'ๆ', ' ', 'นะคะ', 'ก่อน', 'พิมพ์']"
1968968578738077710,twitter,post,https://x.com/crta_me/status/1968968578738077710,text,2025-09-19T09:21:05.000Z,selenium_x_scraper_v1,ก็ไม่ได้เชิงพาณิชย์นี่คะ,ก็ไม่ได้เชิงพาณิชย์นี่คะ,2025-11-08 17:05:14,"['ก็', 'ไม่', 'ได้', 'เชิงพาณิชย์', 'นี่', 'คะ']"
1968525565855678518,twitter,post,https://x.com/crta_me/status/1968525565855678518,text,2025-09-18T04:00:42.000Z,selenium_x_scraper_v1,พิสูจน์ได้ไหมคะว่าเอไอไปขโมยงานใครมา ? อย่าสักแต่พูดให้ร้ายคนอื่น,พิสูจน์ได้ไหมคะว่าเอไอไปขโมยงานใครมา ? อย่าสักแต่พูดให้ร้ายคนอื่น,2025-11-08 17:05:14,"['พิสูจน์', 'ได้', 'ไหม', 'คะ', 'ว่า', 'เอ', 'ไอ', 'ไป', 'ขโมย', 'งาน', 'ใคร', 'มา', ' ', '?', ' ', 'อย่า', 'สัก', 'แต่', 'พูด', 'ให้ร้าย', 'คนอื่น']"
1963436939559776741,twitter,post,https://x.com/crta_me/status/1963436939559776741,text,2025-09-04T03:00:19.000Z,selenium_x_scraper_v1,มันก็แค่เป็นสื่ออย่างนึงนี่คะ หนูยังไม่เคยเห็นใครปสด.ไปด่าพวกฆาตกรในหนังเลย อย่างฮานิบาลไรงี้อะ ทำไมพวกเขาแยกแยะได้แต่พวกพี่ทำไม่ได้อะ นี่งง,มันก็แค่เป็นสื่ออย่างนึงนี่คะ หนูยังไม่เคยเห็นใครปสด.ไปด่าพวกฆาตกรในหนังเลย อย่างฮานิบาลไรงี้อะ ทำไมพวกเขาแยกแยะได้แต่พวกพี่ทำไม่ได้อะ นี่งง,2025-11-08 17:05:14,"['มัน', 'ก็', 'แค่', 'เป็น', 'สื่อ', 'อย่าง', 'นึง', 'นี่', 'คะ', ' ', 'หนู', 'ยัง', 'ไม่', 'เคย', 'เห็น', 'ใคร', 'ปสด', '.', 'ไป', 'ด่า', 'พวก', 'ฆาตกร', 'ใน', 'หนัง', 'เลย', ' ', 'อย่าง', 'หัวเราะ', 'นิ', 'บาล', 'ไร', 'งี้', 'อะ', ' ', 'ทำไม', 'พวกเขา', 'แยกแยะ', 'ได้', 'แต่', 'พวก', 'พี่', 'ทำ', 'ไม่', 'ได้', 'อะ', ' ', 'นี่', 'งง']"
1963434269055107139,twitter,post,https://x.com/crta_me/status/1963434269055107139,text,2025-09-04T02:49:43.000Z,selenium_x_scraper_v1,สาววายดุร้ายเหมือนพี่ทุกคนเลยไหมคะ,สาววายดุร้ายเหมือนพี่ทุกคนเลยไหมคะ,2025-11-08 17:05:14,"['สาว', 'วาย', 'ดุร้าย', 'เหมือน', 'พี่', 'ทุกคน', 'เลย', 'ไหม', 'คะ']"
1963274285000032517,twitter,post,https://x.com/crta_me/status/1963274285000032517,text,2025-09-03T16:14:00.000Z,selenium_x_scraper_v1,ถ้าพี่รับเรื่องดราม่าหรือมีความรุนแรงแม้เพียงนิดนึงไม่ได้ พี่เลิกดูอนิเมะแล้วดูแต่ดิชนี่ย์ไม่ก็พิกซ่า ดีกว่าไหมคะ น่าจะเหมาะสมกว่าน้า,ถ้าพี่รับเรื่องดราม่าหรือมีความรุนแรงแม้เพียงนิดนึงไม่ได้ พี่เลิกดูอนิเมะแล้วดูแต่ดิชนี่ย์ไม่ก็พิกซ่า ดีกว่าไหมคะ น่าจะเหมาะสมกว่าน้า,2025-11-08 17:05:14,"['ถ้า', 'พี่', 'รับ', 'เรื่อง', 'ดราม่า', 'หรือ', 'มี', 'ความรุนแรง', 'แม้', 'เพียง', 'นิดนึง', 'ไม่', 'ได้', ' ', 'พี่', 'เลิก', 'ดู', 'อนิเมะ', 'แล้ว', 'ดู', 'แต่', 'ดิ', 'ชนี่ย์', 'ไม่', 'ก็', 'พิก', 'ซ่า', ' ', 'ดีกว่า', 'ไหม', 'คะ', ' ', 'น่าจะ', 'เหมาะสม', 'กว่า', 'น้า']"
1960905743772615122,twitter,post,https://x.com/crta_me/status/1960905743772615122,text,2025-08-28T03:22:15.000Z,selenium_x_scraper_v1,อยากได้คนเก่งค่ะ ไม่ใช่อวดเก่ง,อยากได้คนเก่งค่ะ ไม่ใช่อวดเก่ง,2025-11-08 17:05:14,"['อยากได้', 'คนเก่ง', 'ค่ะ', ' ', 'ไม่', 'ใช่', 'อวดเก่ง']"
1960715792258908217,twitter,post,https://x.com/Treasure_sheart/status/1960715792258908217,text,2025-08-27T14:47:27.000Z,selenium_x_scraper_v1,พูดเรื่องผ้าอนามัย เมื่อไหร่บางคนจะเข้าใจว่าความยาวผ้าอนามัยไม่ได้แปลว่าหีใหญ่หรือเล็ก บางทีแค่กลัวเลอะไง,พูดเรื่องผ้าอนามัย เมื่อไหร่บางคนจะเข้าใจว่าความยาวผ้าอนามัยไม่ได้แปลว่าหีใหญ่หรือเล็ก บางทีแค่กลัวเลอะไง,2025-11-08 17:05:14,"['พูด', 'เรื่อง', 'ผ้าอนามัย', ' ', 'เมื่อไหร่', 'บางคน', 'จะ', 'เข้าใจ', 'ว่าความ', 'ยาว', 'ผ้าอนามัย', 'ไม่', 'ได้', 'แปล', 'ว่า', 'หี', 'ใหญ่', 'หรือ', 'เล็ก', ' ', 'บางที', 'แค่', 'กลัว', 'เลอะ', 'ไง']"
1960905212169769043,twitter,post,https://x.com/crta_me/status/1960905212169769043,text,2025-08-28T03:20:09.000Z,selenium_x_scraper_v1,คือขำไม่ได้เลยเหรอคะ,คือขำไม่ได้เลยเหรอคะ,2025-11-08 17:05:14,"['คือ', 'ขำ', 'ไม่', 'ได้', 'เลย', 'เหรอ', 'คะ']"
1960733940844782090,twitter,post,https://x.com/bratandbutter/status/1960733940844782090,text,2025-08-27T15:59:34.000Z,selenium_x_scraper_v1,จะบอกว่าหลายคนยังขำกับข่าวอะไรแบบนี้นะ แต่นี่รู้สึกหดหู่มากอะ รสนิยมแบบนี้มันไม่ปกติ มึงป่วยจิตจ้า แล้วสัตว์พวกนี้มันพูด มันฟ้องอะไรไม่ได้ ก็ต้องมนุษย์กันเองนี่แหละที่ช่วยกันสังเกต ช่วยกันประณาม ลงโทษคนเหี้ยๆพวกนี้,จะบอกว่าหลายคนยังขำกับข่าวอะไรแบบนี้นะ แต่นี่รู้สึกหดหู่มากอะ รสนิยมแบบนี้มันไม่ปกติ มึงป่วยจิตจ้า แล้วสัตว์พวกนี้มันพูด มันฟ้องอะไรไม่ได้ ก็ต้องมนุษย์กันเองนี่แหละที่ช่วยกันสังเกต ช่วยกันประณาม ลงโทษคนเหี้ยๆพวกนี้,2025-11-08 17:05:14,"['จะ', 'บอ', 'กว่า', 'หลาย', 'คน', 'ยัง', 'ขำ', 'กับ', 'ข่าว', 'อะไร', 'แบบนี้', 'นะ', ' ', 'แต่', 'นี่', 'รู้สึก', 'หดหู่', 'มาก', 'อะ', ' ', 'รสนิยม', 'แบบนี้', 'มัน', 'ไม่', 'ปกติ', ' ', 'มึง', 'ป่วย', 'จิต', 'จ้า', ' ', 'แล้ว', 'สัตว์', 'พวก', 'นี้', 'มัน', 'พูด', ' ', 'มัน', 'ฟ้อง', 'อะไร', 'ไม่', 'ได้', ' ', 'ก็', 'ต้อง', 'มนุษย์', 'กันเอง', 'นี่แหละ', 'ที่', 'ช่วยกัน', 'สังเกต', ' ', 'ช่วยกัน', 'ประณาม', ' ', 'ลงโทษ', 'คน', 'เหี้ย', 'ๆ', 'พวก', 'นี้']"
1960905065843318805,twitter,post,https://x.com/crta_me/status/1960905065843318805,text,2025-08-28T03:19:34.000Z,selenium_x_scraper_v1,แต่เขาก็ไม่ได้ทำใครเดือดร้อนไหมคะดีกว่า ขข. คนอื่น,แต่เขาก็ไม่ได้ทำใครเดือดร้อนไหมคะดีกว่า ขข. คนอื่น,2025-11-08 17:05:14,"['แต่', 'เขา', 'ก็', 'ไม่', 'ได้', 'ทำ', 'ใคร', 'เดือดร้อน', 'ไหม', 'คะ', 'ดีกว่า', ' ', 'ขข', '.', ' ', 'คนอื่น']"
1960162407596396558,twitter,post,https://x.com/Nat03102/status/1960162407596396558,text,2025-08-26T02:08:30.000Z,selenium_x_scraper_v1,"แฟนอนุมัติให้มีเดี่ยวได้แล้ววว
ชายเดี่ยวถ้าไม่แนะนำตัวให้เรารู้จัก
แต่จะนัดเอาอย่างเดี่ยวขอบล็อกนะคะ
และก็ชายเดี่ยวถ้าซัพพอร์ตไม่ได้ก็นอน
ดูอยู่ที่บ้านนะคะไม่ต้องทักมา ขก.บล็อก 
พูดคุยแลกเปลี่ยนประสบการณ์ทักมาพูดคุยได้คะหาเพื่อนแบบมิตรภาพคุยกันได้นาน","แฟนอนุมัติให้มีเดี่ยวได้แล้ววว
ชายเดี่ยวถ้าไม่แนะนำตัวให้เรารู้จัก
แต่จะนัดเอาอย่างเดี่ยวขอบล็อกนะคะ
และก็ชายเดี่ยวถ้าซัพพอร์ตไม่ได้ก็นอน
ดูอยู่ที่บ้านนะคะไม่ต้องทักมา ขก.บล็อก 
พูดคุยแลกเปลี่ยนประสบการณ์ทักมาพูดคุยได้คะหาเพื่อนแบบมิตรภาพคุยกันได้นาน",2025-11-08 17:05:14,"['แฟน', 'อนุมัติ', 'ให้', 'มี', 'เดี่ยว', 'ได้', 'แล้ว', 'วว', ' ', 'ชาย', 'เดี่ยว', 'ถ้า', 'ไม่', 'แนะนำตัว', 'ให้', 'เรา', 'รู้จัก', ' ', 'แต่', 'จะ', 'นัด', 'เอาอย่าง', 'เดี่ยว', 'ขอ', 'บล็อก', 'นะคะ', ' ', 'และ', 'ก็', 'ชาย', 'เดี่ยว', 'ถ้า', 'ซัพพอร์ต', 'ไม่', 'ได้', 'ก็', 'นอน', ' ', 'ดู', 'อยู่', 'ที่', 'บ้าน', 'นะคะ', 'ไม่ต้อง', 'ทัก', 'มา', ' ', 'ข', 'ก.', 'บล็อก', ' ', 'พูดคุย', 'แลกเปลี่ยน', 'ประสบการณ์', 'ทัก', 'มา', 'พูดคุย', 'ได้', 'คะ', 'หา', 'เพื่อน', 'แบบ', 'มิตรภาพ', 'คุย', 'กัน', 'ได้', 'นาน']"
1960605136432370070,twitter,post,https://x.com/Nat03102/status/1960605136432370070,text,2025-08-27T07:27:45.000Z,selenium_x_scraper_v1,มีงานทำคะแต่ไม่ได้ให้ใครมาเอาฟรี,มีงานทำคะแต่ไม่ได้ให้ใครมาเอาฟรี,2025-11-08 17:05:14,"['มี', 'งาน', 'ทำ', 'คะ', 'แต่', 'ไม่', 'ได้', 'ให้', 'ใคร', 'มา', 'เอา', 'ฟรี']"
1960652970623950960,twitter,post,https://x.com/crta_me/status/1960652970623950960,text,2025-08-27T10:37:50.000Z,selenium_x_scraper_v1,นี่คืองานของพี่เหรอคะ,นี่คืองานของพี่เหรอคะ,2025-11-08 17:05:14,"['นี่', 'คือ', 'งาน', 'ของ', 'พี่', 'เหรอ', 'คะ']"
1959646374557094355,twitter,post,https://x.com/Fuwadaiji/status/1959646374557094355,text,2025-08-24T15:57:58.000Z,selenium_x_scraper_v1,"เอาจริงนักวาดดิจิตอลโคตรสู้กับ ai ชิบหายเลยนะ แล้วสกิลการตรวจจับอะไรแบบนี้ของกุต่ำมาก กุโดนดราม่ามา 2 กระทงละ คือ 1. แชร์งานอาร์ตมาร์เก็ตที่ใช้รูปโปรโมตเป็น ai ในแอคนั้น กะ 2. เป็นแอดมินกลุ่มวาดรูปสมาชิกหลักแสนทำไมไม่แบน ai

กุขอโทษ กุวาดงานมือมาทั้งชีวิต กุไม่รู้จริง ๆ","เอาจริงนักวาดดิจิตอลโคตรสู้กับ ai ชิบหายเลยนะ แล้วสกิลการตรวจจับอะไรแบบนี้ของกุต่ำมาก กุโดนดราม่ามา 2 กระทงละ คือ 1. แชร์งานอาร์ตมาร์เก็ตที่ใช้รูปโปรโมตเป็น ai ในแอคนั้น กะ 2. เป็นแอดมินกลุ่มวาดรูปสมาชิกหลักแสนทำไมไม่แบน ai

กุขอโทษ กุวาดงานมือมาทั้งชีวิต กุไม่รู้จริง ๆ",2025-11-08 17:05:14,"['เอาจริง', 'นัก', 'วาด', 'ดิจิตอล', 'โคตร', 'สู้', 'กับ', ' ', 'ai', ' ', 'ชิบหาย', 'เลย', 'นะ', ' ', 'แล้ว', 'สกิ', 'ลการ', 'ตรวจจับ', 'อะไร', 'แบบนี้', 'ของ', 'กุ', 'ต่ำ', 'มาก', ' ', 'กุ', 'โดน', 'ดราม่า', 'มา', ' ', '2', ' ', 'กระทง', 'ละ', ' ', 'คือ', ' ', '1', '.', ' ', 'แชร์', 'งาน', 'อาร์ต', 'มาร์เก็ต', 'ที่', 'ใช้', 'รูป', 'โปรโมต', 'เป็น', ' ', 'ai', ' ', 'ใน', 'แอ', 'ค', 'นั้น', ' ', 'กะ', ' ', '2', '.', ' ', 'เป็น', 'แอดมิน', 'กลุ่ม', 'วาดรูป', 'สมาชิก', 'หลัก', 'แสน', 'ทำไม', 'ไม่', 'แบน', ' ', 'ai', ' ', 'กุ', 'ขอโทษ', ' ', 'กุ', 'วาด', 'งาน', 'มือ', 'มา', 'ทั้ง', 'ชีวิต', ' ', 'กุ', 'ไม่', 'รู้', 'จริง ๆ']"
1960003056369897928,twitter,post,https://x.com/Fuwadaiji/status/1960003056369897928,text,2025-08-25T15:35:18.000Z,selenium_x_scraper_v1,อ่อ ขอบคุณที่แจ้งให้ทราบนะคะ,อ่อ ขอบคุณที่แจ้งให้ทราบนะคะ,2025-11-08 17:05:14,"['อ่อ', ' ', 'ขอบคุณ', 'ที่', 'แจ้งให้ทราบ', 'นะคะ']"
1960542735297077461,twitter,post,https://x.com/crta_me/status/1960542735297077461,text,2025-08-27T03:19:47.000Z,selenium_x_scraper_v1,เลยด้อยค่างานคนอื่นเถอะค่ะ ถ้างานคุณโดนด้อยค่ามั้งจะรู้สึกยังไง,เลยด้อยค่างานคนอื่นเถอะค่ะ ถ้างานคุณโดนด้อยค่ามั้งจะรู้สึกยังไง,2025-11-08 17:05:14,"['เลย', 'ด้อยค่า', 'งาน', 'คนอื่น', 'เถอะ', 'ค่ะ', ' ', 'ถ้า', 'งาน', 'คุณ', 'โดน', 'ด้อยค่า', 'มั้ง', 'จะ', 'รู้สึก', 'ยังไง']"
1960239444641943958,twitter,post,https://x.com/InfraDom/status/1960239444641943958,text,2025-08-26T07:14:37.000Z,selenium_x_scraper_v1,"""หนังสำหรับเด็กไม่ควรใส่ LGBT+ เข้ามา เพราะเดี๋ยวทำให้เด็กที่ดูเกิดความสับสน""

นี่คือวิธีการบอกคนอื่นว่าคุณเป็น Homophobe โดยที่ไม่พูดออกมาตรงๆ ว่าเป็น Homophobe อ่ะครับ","""หนังสำหรับเด็กไม่ควรใส่ LGBT+ เข้ามา เพราะเดี๋ยวทำให้เด็กที่ดูเกิดความสับสน""

นี่คือวิธีการบอกคนอื่นว่าคุณเป็น Homophobe โดยที่ไม่พูดออกมาตรงๆ ว่าเป็น Homophobe อ่ะครับ",2025-11-08 17:05:14,"['หนัง', 'สำหรับ', 'เด็ก', 'ไม่', 'ควร', 'ใส่', ' ', 'lgbt', ' ', 'เข้ามา', ' ', 'เพราะ', 'เดี๋ยว', 'ทำให้', 'เด็ก', 'ที่', 'ดู', 'เกิด', 'ความ', 'สับสน', ' ', 'นี่', 'คือ', 'วิธีการ', 'บอก', 'คนอื่น', 'ว่า', 'คุณ', 'เป็น', ' ', 'homophobe', ' ', 'โดยที่', 'ไม่', 'พูด', 'ออกมา', 'ตรงๆ', ' ', 'ว่า', 'เป็น', ' ', 'homophobe', ' ', 'อ่ะ', 'ครับ']"
1958083341217067454,twitter,post,https://x.com/crta_me/status/1958083341217067454,text,2025-08-20T08:27:02.000Z,selenium_x_scraper_v1,#ตำรวจสอบสวนกลางCIB,#ตำรวจสอบสวนกลางCIB,2025-11-08 17:05:14,"['ตำรวจ', 'สอบสวน', 'กลาง', 'cib']"
