id,platform,platform_type,url,content_type,timestamp,scraper_module,text,raw_text,scrape_date,tokens
1987687750565585124,twitter,post,https://x.com/lizhi1998/status/1987687750565585124,text,2025-11-10T01:04:23.000Z,selenium_x_scraper_v1,คนใหม่แอบคล้ายพ. อยู่นะ การแต่งตัว ไลฟ์สไตล์ มีค.เซ็กซี่ ฟิลๆเดียวกัน แต่คนใหม่โปรไฟล์เริ่ดเลยแหละ  ตอนนี้ต.กับพ.อาจจะเป็นพี่น้องที่ดีต่อกันก็ได้ เพราะงานวันเกิดล่าสุดยังแนบชิดกันอยู่แต่ก็ทำคนงงเยอะอยู่55555,คนใหม่แอบคล้ายพ. อยู่นะ การแต่งตัว ไลฟ์สไตล์ มีค.เซ็กซี่ ฟิลๆเดียวกัน แต่คนใหม่โปรไฟล์เริ่ดเลยแหละ  ตอนนี้ต.กับพ.อาจจะเป็นพี่น้องที่ดีต่อกันก็ได้ เพราะงานวันเกิดล่าสุดยังแนบชิดกันอยู่แต่ก็ทำคนงงเยอะอยู่55555,2025-11-29 08:18:55,"['คน', 'ใหม่', 'แอบ', 'คล้าย', 'พ', '.', ' ', 'อยู่', 'นะ', ' ', 'การ', 'แต่งตัว', ' ', 'ไลฟ์สไตล์', ' ', 'มี', 'ค', '.', 'เซ็กซี่', ' ', 'ฟิลๆ', 'เดียวกัน', ' ', 'แต่', 'คน', 'ใหม่', 'โปรไฟล์', 'เริ่ด', 'เลย', 'แหละ', ' ', 'ตอนนี้', 'ต.', 'กับ', 'พ', '.', 'อาจจะ', 'เป็น', 'พี่น้อง', 'ที่', 'ดี', 'ต่อกัน', 'ก็ได้', ' ', 'เพราะ', 'งาน', 'วันเกิด', 'ล่าสุด', 'ยัง', 'แนบชิด', 'กัน', 'อยู่', 'แต่', 'ก็', 'ทำ', 'คน', 'งง', 'เยอะ', 'อยู่', 'หัวเราะ']"
1987693069429538886,twitter,post,https://x.com/_Akirasan01/status/1987693069429538886,text,2025-11-10T01:25:31.000Z,selenium_x_scraper_v1,ผู้หญิงเขาคิดกันแบบนั้นจริงหรือนี่,ผู้หญิงเขาคิดกันแบบนั้นจริงหรือนี่,2025-11-29 08:18:55,"['ผู้หญิง', 'เขา', 'คิด', 'กัน', 'แบบ', 'นั้น', 'จริง', 'หรือ', 'นี่']"
1987747414342828089,twitter,post,https://x.com/fuminksj/status/1987747414342828089,text,2025-11-10T05:01:28.000Z,selenium_x_scraper_v1,เอิ่ม เคยติ่งฮีและแก๊งแรปตัวพ่อเมืองไทย สมัยนางคบ ลดป ครอบครัวผชไม่ไก่กานะคะ เรียกว่าเปนไฮโซได้เลย ไอเทมแต่ละอย่าง แล้วก่อนหน้าฮีก็เปนคนมีชื่อเสียงระดับนึง มาข่าวเสียช่วงเลิก ลดป ที่ไม่ใส่ใจผญ บลาๆ แล้วมาเสียหนักตอนคบมัม พ คนเลยคิดว่านางกระจอกมั้ง,เอิ่ม เคยติ่งฮีและแก๊งแรปตัวพ่อเมืองไทย สมัยนางคบ ลดป ครอบครัวผชไม่ไก่กานะคะ เรียกว่าเปนไฮโซได้เลย ไอเทมแต่ละอย่าง แล้วก่อนหน้าฮีก็เปนคนมีชื่อเสียงระดับนึง มาข่าวเสียช่วงเลิก ลดป ที่ไม่ใส่ใจผญ บลาๆ แล้วมาเสียหนักตอนคบมัม พ คนเลยคิดว่านางกระจอกมั้ง,2025-11-29 08:18:55,"['เอิ่ม', ' ', 'เคย', 'ติ่ง', 'ฮี', 'และ', 'แก๊ง', 'แร', 'ป', 'ตัว', 'พ่อเมือง', 'ไทย', ' ', 'สมัย', 'นาง', 'คบ', ' ', 'ลด', 'ป', ' ', 'ครอบครัว', 'ผช', 'ไม่', 'ไก่', 'กา', 'นะคะ', ' ', 'เรียก', 'ว่า', 'เปน', 'ไฮโซ', 'ได้', 'เลย', ' ', 'ไอเทม', 'แต่ละ', 'อย่าง', ' ', 'แล้ว', 'ก่อนหน้า', 'ฮี', 'ก็', 'เปนคน', 'มีชื่อเสียง', 'ระดับ', 'นึง', ' ', 'มา', 'ข่าว', 'เสีย', 'ช่วง', 'เลิก', ' ', 'ลด', 'ป', ' ', 'ที่', 'ไม่', 'ใส่ใจ', 'ผญ', ' ', 'บ', 'ลา', 'ๆ', ' ', 'แล้ว', 'มา', 'เสียหนัก', 'ตอน', 'คบ', 'มัม', ' ', 'พ', ' ', 'คน', 'เลย', 'คิด', 'ว่า', 'นาง', 'กระจอก', 'มั้ง']"
1987586146994679809,twitter,post,https://x.com/Arahatosumma/status/1987586146994679809,text,2025-11-09T18:20:39.000Z,selenium_x_scraper_v1,ผู้หญิงก็ชอบความท้าทายน๊าา เจ้าชู้จริงหรอขนาดไหนหรอ ยิ่งเจ็บยิ่งรักยิ่งหนียิ่งอยากตามยิ่งเห็นผู้หญิงรอบตัวเขาแล้วเราสามารถเอาเขากลับมาได้ยิ่งรู้สึกชนะ ช่วงหนึ่งสเปคแบบนี้เลย,ผู้หญิงก็ชอบความท้าทายน๊าา เจ้าชู้จริงหรอขนาดไหนหรอ ยิ่งเจ็บยิ่งรักยิ่งหนียิ่งอยากตามยิ่งเห็นผู้หญิงรอบตัวเขาแล้วเราสามารถเอาเขากลับมาได้ยิ่งรู้สึกชนะ ช่วงหนึ่งสเปคแบบนี้เลย,2025-11-29 08:18:55,"['ผู้หญิง', 'ก็', 'ชอบ', 'ความ', 'ท้าทาย', 'น๊าา', ' ', 'เจ้าชู้', 'จริง', 'หรอ', 'ขนาด', 'ไหน', 'หรอ', ' ', 'ยิ่ง', 'เจ็บ', 'ยิ่ง', 'รัก', 'ยิ่ง', 'หนี', 'ยิ่ง', 'อยาก', 'ตาม', 'ยิ่ง', 'เห็น', 'ผู้หญิง', 'รอบตัว', 'เขา', 'แล้ว', 'เรา', 'สามารถ', 'เอา', 'เขา', 'กลับมา', 'ได้', 'ยิ่ง', 'รู้สึก', 'ชนะ', ' ', 'ช่วง', 'หนึ่ง', 'สเปค', 'แบบนี้', 'เลย']"
1987688681101271441,twitter,post,https://x.com/Kkhimts/status/1987688681101271441,text,2025-11-10T01:08:05.000Z,selenium_x_scraper_v1,เพราะอะไรไม่รู้  ฉันก็แพ้นาง,เพราะอะไรไม่รู้  ฉันก็แพ้นาง,2025-11-29 08:18:55,"['เพราะอะไร', 'ไม่', 'รู้', ' ', 'ฉัน', 'ก็', 'แพ้', 'นาง']"
1987737053598249454,twitter,post,https://x.com/Hmmkitty/status/1987737053598249454,text,2025-11-10T04:20:18.000Z,selenium_x_scraper_v1,"คนรวยชีวิตมันน่าเบื่อค่าาา
เจอผชเก่ง ชอบควบคุม เอาแต่ใจ
ผชสายนักร้องเอาใจเก่ง พูดหวาน มีเสน่ห สนุกเฮฮา เซกซี่ยั่วยวนสาว ฟีลบาร์โฮสอะ 
แถมสมองหลั่งโดปามีนพุ่งแรงเลยเสพติดพวก toxic อะ มันตื่นเต้นเร้าใจแบบรถไฟเหาะดี
คนเคยเจอ bad boy น่าจะเกท","คนรวยชีวิตมันน่าเบื่อค่าาา
เจอผชเก่ง ชอบควบคุม เอาแต่ใจ
ผชสายนักร้องเอาใจเก่ง พูดหวาน มีเสน่ห สนุกเฮฮา เซกซี่ยั่วยวนสาว ฟีลบาร์โฮสอะ 
แถมสมองหลั่งโดปามีนพุ่งแรงเลยเสพติดพวก toxic อะ มันตื่นเต้นเร้าใจแบบรถไฟเหาะดี
คนเคยเจอ bad boy น่าจะเกท",2025-11-29 08:18:55,"['คนรวย', 'ชีวิต', 'มัน', 'น่าเบื่อ', 'ค่า', 'าา', ' ', 'เจอ', 'ผช', 'เก่ง', ' ', 'ชอบ', 'ควบคุม', ' ', 'เอาแต่ใจ', ' ', 'ผช', 'สาย', 'นักร้อง', 'เอาใจ', 'เก่ง', ' ', 'พูด', 'หวาน', ' ', 'มี', 'เส', 'น่ห', ' ', 'สนุก', 'เฮ', 'หัวเราะ', ' ', 'เซ', 'ก', 'ซี่', 'ยั่วยวน', 'สาว', ' ', 'ฟี', 'ล', 'บาร์', 'โฮ', 'ส', 'อะ', ' ', 'แถม', 'สมอง', 'หลั่ง', 'โดปามีน', 'พุ่ง', 'แรง', 'เลย', 'เสพติด', 'พวก', ' ', 'toxic', ' ', 'อะ', ' ', 'มัน', 'ตื่นเต้น', 'เร้าใจ', 'แบบ', 'รถไฟ', 'เหาะ', 'ดี', ' ', 'คน', 'เคย', 'เจอ', ' ', 'bad', ' ', 'boy', ' ', 'น่าจะ', 'เกท']"
1987775432792711378,twitter,post,https://x.com/lastnightaasfun/status/1987775432792711378,text,2025-11-10T06:52:48.000Z,selenium_x_scraper_v1,นี่ว่าเรื่องปกติมากขนาดนักกีฬายังมีแฟนเป็นนางแบบนางงามดีกรีดีๆกันเต็มเลยดีเจทำไมจะไม่ได้นะเค้าต้องคู่กับใครล่ะทีนี้,นี่ว่าเรื่องปกติมากขนาดนักกีฬายังมีแฟนเป็นนางแบบนางงามดีกรีดีๆกันเต็มเลยดีเจทำไมจะไม่ได้นะเค้าต้องคู่กับใครล่ะทีนี้,2025-11-29 08:18:55,"['นี่', 'ว่า', 'เรื่อง', 'ปกติ', 'มาก', 'ขนาด', 'นักกีฬา', 'ยังมี', 'แฟน', 'เป็น', 'นางแบบ', 'นางงาม', 'ดีกรี', 'ดี', 'ๆ', 'กัน', 'เต็ม', 'เลย', 'ดีเจ', 'ทำไม', 'จะ', 'ไม่', 'ได้', 'นะ', 'เค้า', 'ต้อง', 'คู่', 'กับ', 'ใคร', 'ล่ะ', 'ทีนี้']"
1987590448370860034,twitter,post,https://x.com/udoinwell/status/1987590448370860034,text,2025-11-09T18:37:45.000Z,selenium_x_scraper_v1,เหมือน pete davidson,เหมือน pete davidson,2025-11-29 08:18:55,"['เหมือน', ' ', 'pete', ' ', 'davidson']"
1987567352305881147,twitter,post,https://x.com/faahmbby/status/1987567352305881147,text,2025-11-09T17:05:58.000Z,selenium_x_scraper_v1,ผญชอบผชแบบนี้กันหรอ พวกเรดแฟล้ก พวกที่มีประวัติ แต่ก็เคยฟังมาว่าถ้าได้เปนแฟนกับผชแบบนี้อาจทำให้ผญบางคนรุ้สึกชนะที่คุมผชแบบนี้ได้ (แต่จริงๆไม่),ผญชอบผชแบบนี้กันหรอ พวกเรดแฟล้ก พวกที่มีประวัติ แต่ก็เคยฟังมาว่าถ้าได้เปนแฟนกับผชแบบนี้อาจทำให้ผญบางคนรุ้สึกชนะที่คุมผชแบบนี้ได้ (แต่จริงๆไม่),2025-11-29 08:18:55,"['ผญ', 'ชอบ', 'ผช', 'แบบนี้', 'กัน', 'หรอ', ' ', 'พวก', 'เร', 'ดแฟล้ก', ' ', 'พวก', 'ที่', 'มีประวัติ', ' ', 'แต่', 'ก็', 'เคย', 'ฟัง', 'มา', 'ว่า', 'ถ้า', 'ได้', 'เปน', 'แฟน', 'กับ', 'ผช', 'แบบนี้', 'อาจ', 'ทำให้', 'ผญ', 'บางคน', 'รุ้', 'สึก', 'ชนะ', 'ที่', 'คุม', 'ผช', 'แบบนี้', 'ได้', ' ', 'แต่', 'จริงๆ', 'ไม่']"
1988125108293312743,twitter,post,https://x.com/thisishuman80/status/1988125108293312743,text,2025-11-11T06:02:18.000Z,selenium_x_scraper_v1,สายตา ปากหวาน งี้มั้ง,สายตา ปากหวาน งี้มั้ง,2025-11-29 08:18:55,"['สายตา', ' ', 'ปากหวาน', ' ', 'งี้', 'มั้ง']"
1987773547146825887,twitter,post,https://x.com/eyebaysong/status/1987773547146825887,text,2025-11-10T06:45:19.000Z,selenium_x_scraper_v1,ผญ.หลายคนชอบ red flag ไม่รู้ตัว อันนี้เรื่องจริง รู้ว่ามันไม่ดีแต่มันใจเต้น ยอมรับว่ากุก็เป็น แต่ปัจจุบันไม่เอาละ ตอนมันแดงมากๆ กุก็ไม่ไหวอะ จะตายเอา เลือกเขียวๆเถอะทุกคน มันเฮลตี้และดีต่อใจน้าา,ผญ.หลายคนชอบ red flag ไม่รู้ตัว อันนี้เรื่องจริง รู้ว่ามันไม่ดีแต่มันใจเต้น ยอมรับว่ากุก็เป็น แต่ปัจจุบันไม่เอาละ ตอนมันแดงมากๆ กุก็ไม่ไหวอะ จะตายเอา เลือกเขียวๆเถอะทุกคน มันเฮลตี้และดีต่อใจน้าา,2025-11-29 08:18:55,"['ผญ.', 'หลาย', 'คน', 'ชอบ', ' ', 'red', ' ', 'flag', ' ', 'ไม่', 'รู้ตัว', ' ', 'อันนี้', 'เรื่องจริง', ' ', 'รู้', 'ว่า', 'มัน', 'ไม่', 'ดีแต่', 'มัน', 'ใจเต้น', ' ', 'ยอมรับ', 'ว่า', 'กุ', 'ก็', 'เป็น', ' ', 'แต่', 'ปัจจุบัน', 'ไม่', 'เอาละ', ' ', 'ตอน', 'มัน', 'แดง', 'มาก', 'ๆ', ' ', 'กุ', 'ก็', 'ไม่', 'ไหว', 'อะ', ' ', 'จะ', 'ตาย', 'เอา', ' ', 'เลือก', 'เขียว', 'ๆ', 'เถอะ', 'ทุกคน', ' ', 'มัน', 'เฮลตี้', 'และ', 'ดี', 'ต่อ', 'ใจ', 'น้า', 'า']"
1988127136864235737,twitter,post,https://x.com/whatdaxpc/status/1988127136864235737,text,2025-11-11T06:10:21.000Z,selenium_x_scraper_v1,ผช.ธงแดง/ท้อกซิคทรีตผญ.ดีจริง รู้ว่าควรพูดอะไรยังไงให้ถูกใจเรา ปากหวานมาก แต่นานๆไปก็นั่นแหละค่ะ,ผช.ธงแดง/ท้อกซิคทรีตผญ.ดีจริง รู้ว่าควรพูดอะไรยังไงให้ถูกใจเรา ปากหวานมาก แต่นานๆไปก็นั่นแหละค่ะ,2025-11-29 08:18:55,"['ผช.', 'ธง', 'แดง', ' ', 'ท้อ', 'ก', 'ซิ', 'คท', 'รีต', 'ผญ.', 'ดีจริง', ' ', 'รู้', 'ว่า', 'ควร', 'พูด', 'อะไร', 'ยังไง', 'ให้', 'ถูกใจ', 'เรา', ' ', 'ปากหวาน', 'มาก', ' ', 'แต่', 'นานๆ', 'ไป', 'ก็', 'นั่นแหละ', 'ค่ะ']"
1987573493630919079,twitter,post,https://x.com/phater852/status/1987573493630919079,text,2025-11-09T17:30:22.000Z,selenium_x_scraper_v1,คือผชผ่านผญมาเยอะ  เเต่ก็อยากมีผญที่อยากได้อยู่,คือผชผ่านผญมาเยอะ  เเต่ก็อยากมีผญที่อยากได้อยู่,2025-11-29 08:18:55,"['คือ', 'ผช', 'ผ่าน', 'ผญ', 'มา', 'เยอะ', ' ', 'เเต่', 'ก็', 'อยาก', 'มี', 'ผญ', 'ที่', 'อยากได้', 'อยู่']"
1987709441098354813,twitter,post,https://x.com/janegisnothappy/status/1987709441098354813,text,2025-11-10T02:30:35.000Z,selenium_x_scraper_v1,หรือ ผญ เขาก็คบเฉยๆ ถึงเวลาเขาอาจจะไม่ได้อยากจะแต่งกับ ผช แบบนี้ก็ได้นะ,หรือ ผญ เขาก็คบเฉยๆ ถึงเวลาเขาอาจจะไม่ได้อยากจะแต่งกับ ผช แบบนี้ก็ได้นะ,2025-11-29 08:18:55,"['หรือ', ' ', 'ผญ', ' ', 'เขา', 'ก็', 'คบ', 'เฉย', 'ๆ', ' ', 'ถึง', 'เวลา', 'เขา', 'อาจจะ', 'ไม่', 'ได้', 'อยาก', 'จะ', 'แต่ง', 'กับ', ' ', 'ผช', ' ', 'แบบนี้', 'ก็ได้', 'นะ']"
1987593350640541775,twitter,post,https://x.com/readingyoyo/status/1987593350640541775,text,2025-11-09T18:49:17.000Z,selenium_x_scraper_v1,แล้วคิกว่าต้องได้ระดับไหนอ่ะ ?,แล้วคิกว่าต้องได้ระดับไหนอ่ะ ?,2025-11-29 08:18:55,"['แล้ว', 'คิก', 'ว่า', 'ต้อง', 'ได้', 'ระดับ', 'ไหน', 'อ่ะ', ' ', '?']"
1987898202860011602,twitter,post,https://x.com/pakpakdesu/status/1987898202860011602,text,2025-11-10T15:00:39.000Z,selenium_x_scraper_v1,คอมเม้นไปในทาง Men is trash ข่าาาาาาาา,คอมเม้นไปในทาง Men is trash ข่าาาาาาาา,2025-11-29 08:18:55,"['คอม', 'เม้น', 'ไป', 'ใน', 'ทาง', ' ', 'men', ' ', 'is', ' ', 'trash', ' ', 'ข่า', 'าาาาาาา']"
1987712822420353127,twitter,post,https://x.com/happibirdday/status/1987712822420353127,text,2025-11-10T02:44:01.000Z,selenium_x_scraper_v1,ดูผชสะก่อนทรงไม่ทำดา,ดูผชสะก่อนทรงไม่ทำดา,2025-11-29 08:18:55,"['ดู', 'ผช', 'สะ', 'ก่อน', 'ทรง', 'ไม่', 'ทำ', 'ดา']"
1988046437490606091,twitter,post,https://x.com/NAAN8_8/status/1988046437490606091,text,2025-11-11T00:49:41.000Z,selenium_x_scraper_v1,เออจริงไม่ธรรมดาสักคน,เออจริงไม่ธรรมดาสักคน,2025-11-29 08:18:55,"['เออ', 'จริง', 'ไม่', 'ธรรมดา', 'สัก', 'คน']"
1987673841301385546,twitter,post,https://x.com/Sawitamei/status/1987673841301385546,text,2025-11-10T00:09:07.000Z,selenium_x_scraper_v1,ถ้าจะให้พูดตามตรง หน้าตาเขาก็ดีอยู่แล้ว มีชื่อเสียง คงจะคารมอีกอะ มึงก็รู้ว่าคนไทยชอบแบดบอย,ถ้าจะให้พูดตามตรง หน้าตาเขาก็ดีอยู่แล้ว มีชื่อเสียง คงจะคารมอีกอะ มึงก็รู้ว่าคนไทยชอบแบดบอย,2025-11-29 08:18:55,"['ถ้า', 'จะ', 'ให้', 'พูด', 'ตามตรง', ' ', 'หน้าตา', 'เขา', 'ก็ดี', 'อยู่แล้ว', ' ', 'มีชื่อเสียง', ' ', 'คงจะ', 'คารม', 'อีก', 'อะ', ' ', 'มึง', 'ก็', 'รู้', 'ว่า', 'คนไทย', 'ชอบ', 'แบด', 'บอย']"
1987638029608181865,twitter,post,https://x.com/Yayaky11/status/1987638029608181865,text,2025-11-09T21:46:49.000Z,selenium_x_scraper_v1,หน้สตาก็มีผลนะ ถึงจะไม่หล่อก็ดูดีระดับหนึ่ง คนชอบเทสนี้  แบดๆ,หน้สตาก็มีผลนะ ถึงจะไม่หล่อก็ดูดีระดับหนึ่ง คนชอบเทสนี้  แบดๆ,2025-11-29 08:18:55,"['หน้ส', 'ตา', 'ก็', 'มีผล', 'นะ', ' ', 'ถึง', 'จะ', 'ไม่', 'หล่อ', 'ก็', 'ดูดี', 'ระดับ', 'หนึ่ง', ' ', 'คน', 'ชอบ', 'เท', 'ส', 'นี้', ' ', 'แบด', 'ๆ']"
1987596358103236884,twitter,post,https://x.com/Cpp_ppC/status/1987596358103236884,text,2025-11-09T19:01:14.000Z,selenium_x_scraper_v1,แนว Love bombingรึป่าว บวกกับมีความเป็นตัวเองสูงผญเลยรู้สึกอยากเป็นฝ่ายเข้าหาด้วย,แนว Love bombingรึป่าว บวกกับมีความเป็นตัวเองสูงผญเลยรู้สึกอยากเป็นฝ่ายเข้าหาด้วย,2025-11-29 08:18:55,"['แนว', ' ', 'love', ' ', 'bombing', 'รึ', 'ป่าว', ' ', 'บวก', 'กับ', 'มี', 'ความ', 'เป็น', 'ตัวเอง', 'สูง', 'ผญ', 'เลย', 'รู้สึก', 'อยาก', 'เป็น', 'ฝ่าย', 'เข้าหา', 'ด้วย']"
1987324813321597348,twitter,post,https://x.com/BeautyDiaryNews/status/1987324813321597348/photo/1,text,2025-11-09T01:02:12.000Z,selenium_x_scraper_v1,ทำไมฮีได้แฟนระดับนี้ตลอดเลยนะ นางเอกดีกรีนางงาม นางเอกระดับตำนาน ไฮโซ เพราะอะไรอ่ะ,ทำไมฮีได้แฟนระดับนี้ตลอดเลยนะ นางเอกดีกรีนางงาม นางเอกระดับตำนาน ไฮโซ เพราะอะไรอ่ะ,2025-11-29 08:18:55,"['ทำไม', 'ฮี', 'ได้', 'แฟน', 'ระดับ', 'นี้', 'ตลอด', 'เลย', 'นะ', ' ', 'นางเอก', 'ดีกรี', 'นางงาม', ' ', 'นางเอก', 'ระดับ', 'ตำนาน', ' ', 'ไฮโซ', ' ', 'เพราะอะไร', 'อ่ะ']"
1987585631673843804,twitter,post,https://x.com/maerisamb/status/1987585631673843804,text,2025-11-09T18:18:36.000Z,selenium_x_scraper_v1,พวกนี้คารมดีปากหวานค่ะ พูดจาเอาใจเก่ง อ้อนมาก แล้วผู้หญิงเก่งๆแกร่งๆรวยๆเค้าก็ชอบพวกbad boyเพราะถ้าเค้าคุมได้มันคือความภูมิใจค่ะก็ชั้นมีดีไงเลยคุมอยู่,พวกนี้คารมดีปากหวานค่ะ พูดจาเอาใจเก่ง อ้อนมาก แล้วผู้หญิงเก่งๆแกร่งๆรวยๆเค้าก็ชอบพวกbad boyเพราะถ้าเค้าคุมได้มันคือความภูมิใจค่ะก็ชั้นมีดีไงเลยคุมอยู่,2025-11-29 08:18:55,"['พวก', 'นี้', 'คารม', 'ดี', 'ปากหวาน', 'ค่ะ', ' ', 'พูดจา', 'เอาใจ', 'เก่ง', ' ', 'อ้อน', 'มาก', ' ', 'แล้ว', 'ผู้หญิง', 'เก่ง', 'ๆ', 'แกร่ง', 'ๆ', 'รวย', 'ๆ', 'เค้า', 'ก็', 'ชอบ', 'พวก', 'bad', ' ', 'boy', 'เพราะ', 'ถ้า', 'เค้า', 'คุม', 'ได้', 'มัน', 'คือ', 'ความภูมิใจ', 'ค่ะ', 'ก็', 'ชั้น', 'มี', 'ดี', 'ไง', 'เลย', 'คุม', 'อยู่']"
