id,platform,platform_type,url,content_type,timestamp,scraper_module,text,raw_text,scrape_date,tokens
1974385637173440579,twitter,post,https://x.com/jxl0089x/status/1974385637173440579,text,2025-10-04T08:06:32.000Z,selenium_x_scraper_v1,แต่ไม่เคยคิดว่าตัวเองเป็น ภาระสังคมครับ 555555,แต่ไม่เคยคิดว่าตัวเองเป็น ภาระสังคมครับ 555555,2025-10-23 17:59:34,"['แต่', 'ไม่', 'เคย', 'คิด', 'ว่า', 'ตัวเอง', 'เป็น', ' ', 'ภาระ', 'สังคม', 'ครับ', ' ', 'หัวเราะ']"
1973300959351914579,twitter,post,https://x.com/mingyueee/status/1973300959351914579,text,2025-10-01T08:16:25.000Z,selenium_x_scraper_v1,อีนี่ทำให้เปิดโลกมากกก มันด่าเหยื่อ เบลมเหยื่อที่ถูกขข ถูกฆ่าได้ แต่พอโดนด่า จู๋เล็ก แม่งบอกไม่แฟร์กับสังคม พวกผมทำไรผิด ทำไมต้องล้อ,อีนี่ทำให้เปิดโลกมากกก มันด่าเหยื่อ เบลมเหยื่อที่ถูกขข ถูกฆ่าได้ แต่พอโดนด่า จู๋เล็ก แม่งบอกไม่แฟร์กับสังคม พวกผมทำไรผิด ทำไมต้องล้อ,2025-10-23 17:59:34,"['อี', 'นี่', 'ทำให้', 'เปิดโลก', 'มาก', 'กก', ' ', 'มัน', 'ด่า', 'เหยื่อ', ' ', 'เบล', 'ม', 'เหยื่อ', 'ที่', 'ถูก', 'ขข', ' ', 'ถูก', 'ฆ่า', 'ได้', ' ', 'แต่', 'พอ', 'โดน', 'ด่า', ' ', 'จู๋', 'เล็ก', ' ', 'แม่', 'งบ', 'อก', 'ไม่', 'แฟร์', 'กับ', 'สังคม', ' ', 'พวกผม', 'ทำ', 'ไร', 'ผิด', ' ', 'ทำไม', 'ต้อง', 'ล้อ']"
1974170844655165794,twitter,post,https://x.com/mingyueee/status/1974170844655165794,text,2025-10-03T17:53:02.000Z,selenium_x_scraper_v1,ก็จู๋เล็กไง ล้อไม่ได้หรอ จู๋เล็กๆ,ก็จู๋เล็กไง ล้อไม่ได้หรอ จู๋เล็กๆ,2025-10-23 17:59:34,"['ก็', 'จู๋', 'เล็ก', 'ไง', ' ', 'ล้อ', 'ไม่', 'ได้', 'หรอ', ' ', 'จู๋', 'เล็ก', 'ๆ']"
1974347371741073462,twitter,post,https://x.com/jxl0089x/status/1974347371741073462,text,2025-10-04T05:34:29.000Z,selenium_x_scraper_v1,เจ็บใจวะ  ระวังแฟนคุณในอนาคตจะจู๋เล็กนะ,เจ็บใจวะ  ระวังแฟนคุณในอนาคตจะจู๋เล็กนะ,2025-10-23 17:59:34,"['เจ็บใจ', 'วะ', ' ', 'ระวัง', 'แฟน', 'คุณ', 'ในอนาคต', 'จะ', 'จู๋', 'เล็ก', 'นะ']"
1974061483144413567,twitter,post,https://x.com/malbevul/status/1974061483144413567,text,2025-10-03T10:38:28.000Z,selenium_x_scraper_v1,จากใจคนให้บริการนะคะ น้ำเสียงเจ้าของแย่กว่าพนักงานอีกค่ะ แล้วนี่ก็เลยไปดูว่าในตนเขาพูดถึงยังไงกัน สรุป อาจเป็นกูนี่แหละที่ผิดเอง,จากใจคนให้บริการนะคะ น้ำเสียงเจ้าของแย่กว่าพนักงานอีกค่ะ แล้วนี่ก็เลยไปดูว่าในตนเขาพูดถึงยังไงกัน สรุป อาจเป็นกูนี่แหละที่ผิดเอง,2025-10-23 17:59:34,"['จาก', 'ใจ', 'คน', 'ให้บริการ', 'นะคะ', ' ', 'น้ำเสียง', 'เจ้าของ', 'แย่', 'กว่า', 'พนักงาน', 'อีก', 'ค่ะ', ' ', 'แล้ว', 'นี่', 'ก็', 'เลย', 'ไปดู', 'ว่า', 'ใน', 'ตน', 'เขา', 'พูดถึง', 'ยังไง', 'กัน', ' ', 'สรุป', ' ', 'อาจ', 'เป็น', 'กู', 'นี่แหละ', 'ที่', 'ผิด', 'เอง']"
1974127055613931782,twitter,post,https://x.com/Maimyui_mui/status/1974127055613931782,text,2025-10-03T14:59:02.000Z,selenium_x_scraper_v1,ขนาดนั้นแหละ พวกชายแท้บางคนเหยียดเก่งยังกับอะไร ล้อพวกกูนู่นนี่ บูลลี่ไปหมด สภาพตัวเองยังมอมแมมไม่ดูแลตัวเองอยู่เลย และอิพวกที่มาล้อๆกุแต่ละคนสุดท้ายก็จะมาพึ่งกูตอนต้องการไรสักอย่างอยู่ดี ให้กุสอนนู่นนี่ให้บ้างละ,ขนาดนั้นแหละ พวกชายแท้บางคนเหยียดเก่งยังกับอะไร ล้อพวกกูนู่นนี่ บูลลี่ไปหมด สภาพตัวเองยังมอมแมมไม่ดูแลตัวเองอยู่เลย และอิพวกที่มาล้อๆกุแต่ละคนสุดท้ายก็จะมาพึ่งกูตอนต้องการไรสักอย่างอยู่ดี ให้กุสอนนู่นนี่ให้บ้างละ,2025-10-23 17:59:34,"['ขนาด', 'นั้นแหละ', ' ', 'พวก', 'ชาย', 'แท้', 'บางคน', 'เหยียด', 'เก่ง', 'ยังกับ', 'อะไร', ' ', 'ล้อ', 'พวก', 'กู', 'นู่น', 'นี่', ' ', 'บูล', 'ลี่', 'ไป', 'หมด', ' ', 'สภาพ', 'ตัวเอง', 'ยัง', 'มอมแมม', 'ไม่', 'ดูแลตัวเอง', 'อยู่เลย', ' ', 'และ', 'อิ', 'พวก', 'ที่มา', 'ล้อ', 'ๆ', 'กุ', 'แต่ละคน', 'สุดท้าย', 'ก็', 'จะ', 'มา', 'พึ่ง', 'กู', 'ตอน', 'ต้องการ', 'ไร', 'สัก', 'อย่าง', 'อยู่ดี', ' ', 'ให้', 'กุ', 'สอน', 'นู่น', 'นี่', 'ให้', 'บ้าง', 'ละ']"
1974131159274828150,twitter,post,https://x.com/jxl0089x/status/1974131159274828150,text,2025-10-03T15:15:20.000Z,selenium_x_scraper_v1,ผมไม่เคยเจอ ผช แบบนั้นนะ พี่อยุ่สังคมไหนหรอ,ผมไม่เคยเจอ ผช แบบนั้นนะ พี่อยุ่สังคมไหนหรอ,2025-10-23 17:59:34,"['ผม', 'ไม่', 'เคย', 'เจอ', ' ', 'ผช', ' ', 'แบบ', 'นั้น', 'นะ', ' ', 'พี่', 'อยุ่', 'สังคม', 'ไหน', 'หรอ']"
1974123341176057865,twitter,post,https://x.com/jxl0089x/status/1974123341176057865,text,2025-10-03T14:44:16.000Z,selenium_x_scraper_v1,ใครทำน้องครับ ,ใครทำน้องครับ ,2025-10-23 17:59:34,"['ใคร', 'ทำ', 'น้อง', 'ครับ']"
1974058758985629935,twitter,post,https://x.com/bacon1hamcheese/status/1974058758985629935,text,2025-10-03T10:27:39.000Z,selenium_x_scraper_v1,อ้อ แสตท คือ สเตรท ...นี่ก็สเตรทค่ะ ที่ที่มีแต่ผญก็คือสวรรค์ เรื่องsexนี่ไม่ใช่เรื่องสำคัญในชีวิต .. อดข้าวดอกหนาเจ้าจะตาย มิตายดอกเพราะอดเสน่หา,อ้อ แสตท คือ สเตรท ...นี่ก็สเตรทค่ะ ที่ที่มีแต่ผญก็คือสวรรค์ เรื่องsexนี่ไม่ใช่เรื่องสำคัญในชีวิต .. อดข้าวดอกหนาเจ้าจะตาย มิตายดอกเพราะอดเสน่หา,2025-10-23 17:59:34,"['อ้อ', ' ', 'แส', 'ตท', ' ', 'คือ', ' ', 'ส', 'เต', 'รท', ' ', '...', 'นี่', 'ก็', 'ส', 'เต', 'รท', 'ค่ะ', ' ', 'ที่', 'ที่', 'มี', 'แต่', 'ผญ', 'ก็', 'คือ', 'สวรรค์', ' ', 'เรื่อง', 'sex', 'นี่', 'ไม่', 'ใช่', 'เรื่องสำคัญ', 'ใน', 'ชีวิต', ' ', '..', ' ', 'อด', 'ข้าว', 'ดอก', 'หนา', 'เจ้า', 'จะ', 'ตาย', ' ', 'มิ', 'ตาย', 'ดอก', 'เพราะ', 'อด', 'เสน่หา']"
1974122225902178637,twitter,post,https://x.com/jxl0089x/status/1974122225902178637,text,2025-10-03T14:39:50.000Z,selenium_x_scraper_v1,อ่าค้าบบๆ ,อ่าค้าบบๆ ,2025-10-23 17:59:34,"['อ่า', 'ค้าบ', 'บๆ']"
1974035440555716928,twitter,post,https://x.com/jxl0089x/status/1974035440555716928,text,2025-10-03T08:54:59.000Z,selenium_x_scraper_v1,"ผญ ออกมาพูดเพื่อ ผช pick me girl
ผช ออกมาพูดเพื่อ ผญ อาหวัง 
55555555555","ผญ ออกมาพูดเพื่อ ผช pick me girl
ผช ออกมาพูดเพื่อ ผญ อาหวัง 
55555555555",2025-10-23 17:59:34,"['ผญ', ' ', 'ออกมา', 'พูด', 'เพื่อ', ' ', 'ผช', ' ', 'pick', ' ', 'me', ' ', 'girl', ' ', 'ผช', ' ', 'ออกมา', 'พูด', 'เพื่อ', ' ', 'ผญ', ' ', 'อา', 'หวัง', ' ', 'หัวเราะ']"
1974079284215263247,twitter,post,https://x.com/ume_noto/status/1974079284215263247,text,2025-10-03T11:49:12.000Z,selenium_x_scraper_v1,ยังไม่มีคำไหนเลยนะที่ผญพูดเพื่อผู้ชายอ่ะจากต้นทวิตมีเเต่ว่าผู้หญิงกันเองว่ามีเเต่คนชอบนินทา เราไม่ใช่คนเเบบนั้นเลยนะ ไม่อยากคบเพื่อนผู้หญิงเลยอ่ะมีตรงไหนที่เขาพูดเพื่อผู้ชายด้วยหรอหรือพูดเเนวๆเพื่อนผช.ดีกว่าเพื่อนผญ.หรองี้มันไม่เรียกว่าเป็นการยกอีกฝ่ายสูงขึ้นเเละกดอีกฝ่ายต่ำลงหรอ,ยังไม่มีคำไหนเลยนะที่ผญพูดเพื่อผู้ชายอ่ะจากต้นทวิตมีเเต่ว่าผู้หญิงกันเองว่ามีเเต่คนชอบนินทา เราไม่ใช่คนเเบบนั้นเลยนะ ไม่อยากคบเพื่อนผู้หญิงเลยอ่ะมีตรงไหนที่เขาพูดเพื่อผู้ชายด้วยหรอหรือพูดเเนวๆเพื่อนผช.ดีกว่าเพื่อนผญ.หรองี้มันไม่เรียกว่าเป็นการยกอีกฝ่ายสูงขึ้นเเละกดอีกฝ่ายต่ำลงหรอ,2025-10-23 17:59:34,"['ยัง', 'ไม่', 'มี', 'คำ', 'ไหน', 'เลย', 'นะ', 'ที่', 'ผญ', 'พูด', 'เพื่อ', 'ผู้ชาย', 'อ่ะ', 'จาก', 'ต้น', 'ทวิ', 'ต', 'มี', 'เเต่', 'ว่า', 'ผู้หญิง', 'กันเอง', 'ว่า', 'มี', 'เเต่คน', 'ชอบ', 'นินทา', ' ', 'เรา', 'ไม่', 'ใช่', 'คน', 'เเบบ', 'นั้น', 'เลย', 'นะ', ' ', 'ไม่', 'อยาก', 'คบ', 'เพื่อน', 'ผู้หญิง', 'เลย', 'อ่ะ', 'มี', 'ตรงไหน', 'ที่', 'เขา', 'พูด', 'เพื่อ', 'ผู้ชาย', 'ด้วย', 'หรอ', 'หรือ', 'พูด', 'เเนวๆ', 'เพื่อน', 'ผช.', 'ดี', 'กว่าเพื่อน', 'ผญ.', 'หรอ', 'งี้', 'มัน', 'ไม่', 'เรียก', 'ว่า', 'เป็นการ', 'ยก', 'อีก', 'ฝ่าย', 'สูง', 'ขึ้น', 'เ', 'เละ', 'กด', 'อีก', 'ฝ่าย', 'ต่ำ', 'ลง', 'หรอ']"
1974122010738663449,twitter,post,https://x.com/jxl0089x/status/1974122010738663449,text,2025-10-03T14:38:59.000Z,selenium_x_scraper_v1,แล้วพูดถึงคนที่เห็นต่างจากคุณว่า pick me ได้หรอ,แล้วพูดถึงคนที่เห็นต่างจากคุณว่า pick me ได้หรอ,2025-10-23 17:59:34,"['แล้ว', 'พูดถึง', 'คน', 'ที่', 'เห็น', 'ต่าง', 'จาก', 'คุณ', 'ว่า', ' ', 'pick', ' ', 'me', ' ', 'ได้', 'หรอ']"
1974116265343189026,twitter,post,https://x.com/Ffffffwwwww1/status/1974116265343189026,text,2025-10-03T14:16:09.000Z,selenium_x_scraper_v1,ก็สวรรค์นะ เสตรทไม่ได้รักควยขนาดนั้น,ก็สวรรค์นะ เสตรทไม่ได้รักควยขนาดนั้น,2025-10-23 17:59:34,"['ก็', 'สวรรค์', 'นะ', ' ', 'เสต', 'รท', 'ไม่', 'ได้', 'รัก', 'ควย', 'ขนาด', 'นั้น']"
1974121050553385441,twitter,post,https://x.com/jxl0089x/status/1974121050553385441,text,2025-10-03T14:35:10.000Z,selenium_x_scraper_v1,เจ็บอะไร?,เจ็บอะไร?,2025-10-23 17:59:34,"['เจ็บ', 'อะไร', '?']"
1974046614550417757,twitter,post,https://x.com/bacon1hamcheese/status/1974046614550417757,text,2025-10-03T09:39:23.000Z,selenium_x_scraper_v1,ถ้ามี 2 ที่ให้เลือก ที่1มีแต่ผญ ที่1มีแต่ผช ก็เลือกที่ที่มีแต่ผญค่ะ,ถ้ามี 2 ที่ให้เลือก ที่1มีแต่ผญ ที่1มีแต่ผช ก็เลือกที่ที่มีแต่ผญค่ะ,2025-10-23 17:59:34,"['ถ้า', 'มี', ' ', '2', ' ', 'ที่', 'ให้', 'เลือก', ' ', 'ที่', '1', 'มี', 'แต่', 'ผญ', ' ', 'ที่', '1', 'มี', 'แต่', 'ผช', ' ', 'ก็', 'เลือก', 'ที่', 'ที่', 'มี', 'แต่', 'ผญ', 'ค่ะ']"
1974049948917510474,twitter,post,https://x.com/jxl0089x/status/1974049948917510474,text,2025-10-03T09:52:38.000Z,selenium_x_scraper_v1,ผมหมายถึง ผู้หญิง แสตทครับ ,ผมหมายถึง ผู้หญิง แสตทครับ ,2025-10-23 17:59:34,"['ผม', 'หมายถึง', ' ', 'ผู้หญิง', ' ', 'แส', 'ตท', 'ครับ']"
1974034637430403236,twitter,post,https://x.com/jxl0089x/status/1974034637430403236,text,2025-10-03T08:51:48.000Z,selenium_x_scraper_v1,อย่าเรียกว่า นินทาเลย เรียกว่าด่าแรงๆ พูดตรงๆ ไม่มีตอแหล ลับหลังใส่กันเหมือนผญ แน่นอน ,อย่าเรียกว่า นินทาเลย เรียกว่าด่าแรงๆ พูดตรงๆ ไม่มีตอแหล ลับหลังใส่กันเหมือนผญ แน่นอน ,2025-10-23 17:59:34,"['อย่า', 'เรียก', 'ว่า', ' ', 'นินทา', 'เลย', ' ', 'เรียก', 'ว่า', 'ด่า', 'แรง', 'ๆ', ' ', 'พูดตรงๆ', ' ', 'ไม่', 'มี', 'ตอแหล', ' ', 'ลับหลัง', 'ใส่', 'กัน', 'เหมือน', 'ผญ', ' ', 'แน่นอน']"
1973459119442108887,twitter,post,https://x.com/yumoiur/status/1973459119442108887,text,2025-10-01T18:44:53.000Z,selenium_x_scraper_v1,แอคมันบินหรือมันบล้อคกุวะ,แอคมันบินหรือมันบล้อคกุวะ,2025-10-23 17:59:34,"['แอ', 'ค', 'มัน', 'บิน', 'หรือ', 'มัน', 'บ', 'ล้อ', 'ค', 'กุ', 'วะ']"
1974030251501011183,twitter,post,https://x.com/jxl0089x/status/1974030251501011183,text,2025-10-03T08:34:22.000Z,selenium_x_scraper_v1,แอคบิน ไอควายย,แอคบิน ไอควายย,2025-10-23 17:59:34,"['แอ', 'ค', 'บิน', ' ', 'ไอ', 'ควาย', 'ย']"
1974023811000652123,twitter,post,https://x.com/jxl0089x/status/1974023811000652123,text,2025-10-03T08:08:46.000Z,selenium_x_scraper_v1,ทั่งไปคือ คนทั่วๆไป ที่มองว่าสวยหน่ะ,ทั่งไปคือ คนทั่วๆไป ที่มองว่าสวยหน่ะ,2025-10-23 17:59:34,"['ทั่ง', 'ไป', 'คือ', ' ', 'คน', 'ทั่วๆ', 'ไป', ' ', 'ที่', 'มองว่า', 'สวย', 'ห', 'น่ะ']"
1974022624855605528,twitter,post,https://x.com/jxl0089x/status/1974022624855605528,text,2025-10-03T08:04:03.000Z,selenium_x_scraper_v1,"standard ทั่วไป
ขาย หมวย อึม ตัวเล็ก
ถ้าตามนี้ก็สวย แต่ถ้าไม่ก็อาจจะยัง","standard ทั่วไป
ขาย หมวย อึม ตัวเล็ก
ถ้าตามนี้ก็สวย แต่ถ้าไม่ก็อาจจะยัง",2025-10-23 17:59:34,"['standard', ' ', 'ทั่วไป', ' ', 'ขาย', ' ', 'หมวย', ' ', 'อึ', 'ม', ' ', 'ตัวเล็ก', ' ', 'ถ้า', 'ตาม', 'นี้', 'ก็', 'สวย', ' ', 'แต่', 'ถ้า', 'ไม่', 'ก็', 'อาจจะ', 'ยัง']"
1974021068311646563,twitter,post,https://x.com/jxl0089x/status/1974021068311646563,text,2025-10-03T07:57:52.000Z,selenium_x_scraper_v1,"นี้ก้ชมไปเรื่อย สวยแบบ beauty standard ดิ
ไม่ใช่สวยแบบผญอวยกันเอง","นี้ก้ชมไปเรื่อย สวยแบบ beauty standard ดิ
ไม่ใช่สวยแบบผญอวยกันเอง",2025-10-23 17:59:34,"['นี้', 'ก้ชม', 'ไป', 'เรื่อย', ' ', 'สวย', 'แบบ', ' ', 'beauty', ' ', 'standard', ' ', 'ดิ', ' ', 'ไม่', 'ใช่', 'สวย', 'แบบ', 'ผญ', 'อวย', 'กันเอง']"
1974015604911976460,twitter,post,https://x.com/jxl0089x/status/1974015604911976460,text,2025-10-03T07:36:10.000Z,selenium_x_scraper_v1,"อะไรคือ ลอยๆหรอ 
คุณว่ามันจริงมั้ย ช่วยแสดงความเห็นหน่อย","อะไรคือ ลอยๆหรอ 
คุณว่ามันจริงมั้ย ช่วยแสดงความเห็นหน่อย",2025-10-23 17:59:34,"['อะไร', 'คือ', ' ', 'ลอยๆ', 'หรอ', ' ', 'คุณ', 'ว่า', 'มัน', 'จริง', 'มั้ย', ' ', 'ช่วย', 'แสดง', 'ความเห็น', 'หน่อย']"
1972894574847922267,twitter,post,https://x.com/hxlldxy/status/1972894574847922267,text,2025-09-30T05:21:35.000Z,selenium_x_scraper_v1,โลกมันไม่ได้โหดร้ายหรอกแต่ ผญ.บางคนเหมือนเกิดมาพร้อมSkillการเอาตัวรอดติดลบ มันใช้สมองคิดให้มากกว่านั้นไม่ได้ละหรอ,โลกมันไม่ได้โหดร้ายหรอกแต่ ผญ.บางคนเหมือนเกิดมาพร้อมSkillการเอาตัวรอดติดลบ มันใช้สมองคิดให้มากกว่านั้นไม่ได้ละหรอ,2025-10-23 17:59:34,"['โลก', 'มัน', 'ไม่', 'ได้', 'โหดร้าย', 'หรอก', 'แต่', ' ', 'ผญ.', 'บางคน', 'เหมือน', 'เกิด', 'มา', 'พร้อม', 'skill', 'การเอาตัวรอด', 'ติดลบ', ' ', 'มัน', 'ใช้', 'สมอง', 'คิด', 'ให้', 'มากกว่า', 'นั้น', 'ไม่', 'ได้', 'ละ', 'หรอ']"
1973375583829762092,twitter,post,https://x.com/kimD60010/status/1973375583829762092,text,2025-10-01T13:12:57.000Z,selenium_x_scraper_v1,สงสัยว่าคุณไม่เคยคิดจะเป็นคนที่ดีขึ้นบ้างหรอ มัวแต่ด่าผญ ถ้าคุณมองคนเท่ากัน เลิกใช้ชีวิตอยู่แต่ในทวิตเตอร์เพื่อด่าคน ชีวิตมันจะมีความสุขกว่านี้นะ ตอนมีลูกเวลาสอนเขาจะได้ไม่ใส่อคติตัวเองลงไปด้วย ถ้าลูกโตไปแล้วเกลียดคุณ เดี๋ยวแก่ขึ้นคุณจะ regret มันจริงๆ,สงสัยว่าคุณไม่เคยคิดจะเป็นคนที่ดีขึ้นบ้างหรอ มัวแต่ด่าผญ ถ้าคุณมองคนเท่ากัน เลิกใช้ชีวิตอยู่แต่ในทวิตเตอร์เพื่อด่าคน ชีวิตมันจะมีความสุขกว่านี้นะ ตอนมีลูกเวลาสอนเขาจะได้ไม่ใส่อคติตัวเองลงไปด้วย ถ้าลูกโตไปแล้วเกลียดคุณ เดี๋ยวแก่ขึ้นคุณจะ regret มันจริงๆ,2025-10-23 17:59:34,"['สงสัย', 'ว่า', 'คุณ', 'ไม่', 'เคย', 'คิด', 'จะ', 'เป็น', 'คน', 'ที่', 'ดีขึ้น', 'บ้าง', 'หรอ', ' ', 'มัวแต่', 'ด่า', 'ผญ', ' ', 'ถ้า', 'คุณ', 'มอง', 'คน', 'เท่ากัน', ' ', 'เลิก', 'ใช้ชีวิต', 'อยู่', 'แต่', 'ใน', 'ทวิตเตอร์', 'เพื่อ', 'ด่า', 'คน', ' ', 'ชีวิต', 'มัน', 'จะ', 'มีความสุข', 'กว่า', 'นี้', 'นะ', ' ', 'ตอน', 'มีลูก', 'เวลา', 'สอน', 'เขา', 'จะ', 'ได้', 'ไม่', 'ใส่', 'อคติ', 'ตัวเอง', 'ลง', 'ไป', 'ด้วย', ' ', 'ถ้า', 'ลูก', 'โต', 'ไป', 'แล้ว', 'เกลียด', 'คุณ', ' ', 'เดี๋ยว', 'แก่', 'ขึ้น', 'คุณ', 'จะ', ' ', 'regret', ' ', 'มัน', 'จริงๆ']"
1973996170403000622,twitter,post,https://x.com/jxl0089x/status/1973996170403000622,text,2025-10-03T06:18:56.000Z,selenium_x_scraper_v1,DM หาผมหน่อยสิ คุณคิม,DM หาผมหน่อยสิ คุณคิม,2025-10-23 17:59:34,"['dm', ' ', 'หา', 'ผม', 'หน่อย', 'สิ', ' ', 'คุณ', 'คิม']"
1973719233361322007,twitter,post,https://x.com/tanhyong2007/status/1973719233361322007,text,2025-10-02T11:58:29.000Z,selenium_x_scraper_v1,คนพิมพ์ :,คนพิมพ์ :,2025-10-23 17:59:34,"['คน', 'พิมพ์']"
1973990957180661781,twitter,post,https://x.com/jxl0089x/status/1973990957180661781,text,2025-10-03T05:58:13.000Z,selenium_x_scraper_v1,"อ่ะเครครับ เจ๊ 55555
เก่งงที่สุดดดด","อ่ะเครครับ เจ๊ 55555
เก่งงที่สุดดดด",2025-10-23 17:59:34,"['อ่ะ', 'เค', 'ร', 'ครับ', ' ', 'เจ๊', ' ', 'หัวเราะ', ' ', 'เก่', 'งง', 'ที่สุด', 'ดดด']"
