id,platform,platform_type,url,content_type,timestamp,scraper_module,text,raw_text,scrape_date,tokens
1882075156811760035,twitter,post,https://x.com/InfinixSma19165/status/1882075156811760035,text,2025-01-22T14:37:39.000Z,selenium_x_scraper_v1,เพราะว่ามัวอ่านหนังสือไงคะ ตรรกะเลยโตมาเพี้ยนแบบพี่ดีใจด้วยค่ะที่หาตัวเองไวแต่น้องๆหนูไม่มีโอกาสค้นหาตัวเองด้วยซ้ ำวัยนี้ควรได้เล่นกับเพื่อนบ้างค่ะ,เพราะว่ามัวอ่านหนังสือไงคะ ตรรกะเลยโตมาเพี้ยนแบบพี่ดีใจด้วยค่ะที่หาตัวเองไวแต่น้องๆหนูไม่มีโอกาสค้นหาตัวเองด้วยซ้ ำวัยนี้ควรได้เล่นกับเพื่อนบ้างค่ะ,2025-11-08 17:05:14,"['เพราะว่า', 'มัว', 'อ่านหนังสือ', 'ไง', 'คะ', ' ', 'ตรรกะ', 'เลย', 'โตมา', 'เพี้ยน', 'แบบ', 'พี่', 'ดีใจ', 'ด้วย', 'ค่ะ', 'ที่', 'หา', 'ตัวเอง', 'ไว', 'แต่', 'น้องๆ', 'หนู', 'ไม่', 'มีโอกาส', 'ค้นหา', 'ตัวเอง', 'ด้วย', 'ซ้', ' ', 'ำ', 'วัย', 'นี้', 'ควร', 'ได้', 'เล่น', 'กับ', 'เพื่อน', 'บ้าง', 'ค่ะ']"
1882115218706510273,twitter,post,https://x.com/crta_me/status/1882115218706510273,text,2025-01-22T17:16:50.000Z,selenium_x_scraper_v1,ไม่มีเงินไม่มีการศึกษาหางานทำไม่ได้ เพื่อนที่ว่านี่จะมาเลี้ยงเราไหม,ไม่มีเงินไม่มีการศึกษาหางานทำไม่ได้ เพื่อนที่ว่านี่จะมาเลี้ยงเราไหม,2025-11-08 17:05:14,"['ไม่', 'มีเงิน', 'ไม่', 'มี', 'การศึกษา', 'หา', 'งาน', 'ทำ', 'ไม่', 'ได้', ' ', 'เพื่อน', 'ที่ว่า', 'นี่', 'จะ', 'มา', 'เลี้ยง', 'เรา', 'ไหม']"
1881737310347427937,twitter,post,https://x.com/marovereese/status/1881737310347427937,text,2025-01-21T16:15:10.000Z,selenium_x_scraper_v1,แต่ในบรรดาอินฟลู นายอาร์มโคตร normal guy ไม่เล่นมุก misogynistic หรือ sexual ไม่ชายแท้เหยียดเพศ anti woke publicly เพื่อเปิด pandora’s box อ่ะ hes just a human คนนึง แต่ชายแท้ของจริงต้องลูกเพจแว่นออพติมัส แบบอยู่ ๆ ก็เล่นมุกเหยียดเพศเพราะหิวไลค์ทั้งที่ต้นโพสต์ไม่เกี่ยวเห้ไรเลย,แต่ในบรรดาอินฟลู นายอาร์มโคตร normal guy ไม่เล่นมุก misogynistic หรือ sexual ไม่ชายแท้เหยียดเพศ anti woke publicly เพื่อเปิด pandora’s box อ่ะ hes just a human คนนึง แต่ชายแท้ของจริงต้องลูกเพจแว่นออพติมัส แบบอยู่ ๆ ก็เล่นมุกเหยียดเพศเพราะหิวไลค์ทั้งที่ต้นโพสต์ไม่เกี่ยวเห้ไรเลย,2025-11-08 17:05:14,"['แต่', 'ใน', 'บรรดา', 'อิน', 'ฟลู', ' ', 'นาย', 'อาร์ม', 'โคตร', ' ', 'normal', ' ', 'guy', ' ', 'ไม่', 'เล่น', 'มุก', ' ', 'misogynistic', ' ', 'หรือ', ' ', 'sexual', ' ', 'ไม่', 'ชาย', 'แท้', 'เหยียด', 'เพศ', ' ', 'anti', ' ', 'woke', ' ', 'publicly', ' ', 'เพื่อ', 'เปิด', ' ', 'pandora', ' ', 's', ' ', 'box', ' ', 'อ่ะ', ' ', 'hes', ' ', 'just', ' ', 'a', ' ', 'human', ' ', 'คน', 'นึง', ' ', 'แต่', 'ชาย', 'แท้', 'ของจริง', 'ต้อง', 'ลูก', 'เพจ', 'แว่น', 'ออ', 'พ', 'ติ', 'มัส', ' ', 'แบบ', 'อยู่ ๆ', ' ', 'ก็', 'เล่น', 'มุก', 'เหยียด', 'เพศ', 'เพราะ', 'หิว', 'ไลค์', 'ทั้งที่', 'ต้น', 'โพสต์', 'ไม่', 'เกี่ยว', 'เห้', 'ไร', 'เลย']"
1882036933494464628,twitter,post,https://x.com/crta_me/status/1882036933494464628,text,2025-01-22T12:05:46.000Z,selenium_x_scraper_v1,ทำไมต้องพิมพ์ไทยคำอังกฤษคำครับ,ทำไมต้องพิมพ์ไทยคำอังกฤษคำครับ,2025-11-08 17:05:14,"['ทำไม', 'ต้อง', 'พิมพ์', 'ไทย', 'คำ', 'อังกฤษ', 'คำ', 'ครับ']"
1881965190817923182,twitter,post,https://x.com/xikhxkkhaekmae1/status/1881965190817923182,text,2025-01-22T07:20:41.000Z,selenium_x_scraper_v1,ฮัลโหลวววว เดกประถมค่าา อายุไม่เกิน13สมัยคุรพรี่ไม่ใช่นั่งเล่นหมากเก็บอยู่หราค้า รึตอนนั้นนั่งอ่านฟิสิกมอปลายอยู่,ฮัลโหลวววว เดกประถมค่าา อายุไม่เกิน13สมัยคุรพรี่ไม่ใช่นั่งเล่นหมากเก็บอยู่หราค้า รึตอนนั้นนั่งอ่านฟิสิกมอปลายอยู่,2025-11-08 17:05:14,"['ฮัลโหล', 'วววว', ' ', 'เดก', 'ประถม', 'ค่า', 'า', ' ', 'อายุ', 'ไม่', 'เกิน', '13', 'สมัย', 'คุ', 'รพ', 'รี่', 'ไม่', 'ใช่', 'นั่งเล่น', 'หมากเก็บ', 'อยู่', 'หรา', 'ค้า', ' ', 'รึ', 'ตอนนั้น', 'นั่ง', 'อ่าน', 'ฟิ', 'สิ', 'กม', 'อป', 'ลาย', 'อยู่']"
1882035566457540979,twitter,post,https://x.com/crta_me/status/1882035566457540979,text,2025-01-22T12:00:20.000Z,selenium_x_scraper_v1,ตอน ป.5 ป.6 ผมก็ต้องเตรียมอ่านหนังสือสอบเตรียมเข้าม.ตันแล้วไหม ยิ่งสมัยนี้ลูกก็ต้องพัฒนาให้ดีกว่ายุคพ่อแม่ นั่งเล่นแต่มือถือดูแต่ดาราต่างประเทศจะไปรู้อะไร,ตอน ป.5 ป.6 ผมก็ต้องเตรียมอ่านหนังสือสอบเตรียมเข้าม.ตันแล้วไหม ยิ่งสมัยนี้ลูกก็ต้องพัฒนาให้ดีกว่ายุคพ่อแม่ นั่งเล่นแต่มือถือดูแต่ดาราต่างประเทศจะไปรู้อะไร,2025-11-08 17:05:14,"['ตอน', ' ', 'ป.', '5', ' ', 'ป.', '6', ' ', 'ผม', 'ก็', 'ต้อง', 'เตรียม', 'อ่านหนังสือ', 'สอบ', 'เตรียม', 'เข้า', 'ม.', 'ตัน', 'แล้ว', 'ไหม', ' ', 'ยิ่ง', 'สมัยนี้', 'ลูก', 'ก็', 'ต้อง', 'พัฒนา', 'ให้', 'ดีกว่า', 'ยุค', 'พ่อแม่', ' ', 'นั่งเล่น', 'แต่', 'มือถือ', 'ดู', 'แต่', 'ดารา', 'ต่างประเทศ', 'จะ', 'ไป', 'รู้', 'อะไร']"
1881538234242740455,twitter,post,https://x.com/jypeach0922/status/1881538234242740455,text,2025-01-21T03:04:06.000Z,selenium_x_scraper_v1,สิ่งที่อยากบอกผู้ชายทุกคนที่มีลูกแล้วคิดจะมีชู้คือ ลูกสาวคุณจะไม่มีวันรักและไว้ใจคุณเหมือนเดิม ไม่ว่าตอนนี้คุณจะดีแค่ไหน แต่ในใจลูกจะจำวันที่คุณทำให้เขาผิดหวังไปจนวันตาย,สิ่งที่อยากบอกผู้ชายทุกคนที่มีลูกแล้วคิดจะมีชู้คือ ลูกสาวคุณจะไม่มีวันรักและไว้ใจคุณเหมือนเดิม ไม่ว่าตอนนี้คุณจะดีแค่ไหน แต่ในใจลูกจะจำวันที่คุณทำให้เขาผิดหวังไปจนวันตาย,2025-11-08 17:05:14,"['สิ่ง', 'ที่', 'อยาก', 'บอก', 'ผู้ชาย', 'ทุกคน', 'ที่', 'มีลูก', 'แล้ว', 'คิด', 'จะ', 'มีชู้', 'คือ', ' ', 'ลูกสาว', 'คุณ', 'จะ', 'ไม่', 'มี', 'วัน', 'รัก', 'และ', 'ไว้ใจ', 'คุณ', 'เหมือนเดิม', ' ', 'ไม่', 'ว่า', 'ตอนนี้', 'คุณ', 'จะ', 'ดี', 'แค่', 'ไหน', ' ', 'แต่', 'ใน', 'ใจ', 'ลูก', 'จะ', 'จำ', 'วันที่', 'คุณ', 'ทำให้', 'เขา', 'ผิดหวัง', 'ไป', 'จน', 'วัน', 'ตาย']"
1881765582246461874,twitter,post,https://x.com/crta_me/status/1881765582246461874,text,2025-01-21T18:07:30.000Z,selenium_x_scraper_v1,พ่อก็มีชีวิตเป็นของตัวเองลูกทำให้พ่อผิดหวังเยอะกว่าพ่อทำให้ลูกผิดหวังอีก,พ่อก็มีชีวิตเป็นของตัวเองลูกทำให้พ่อผิดหวังเยอะกว่าพ่อทำให้ลูกผิดหวังอีก,2025-11-08 17:05:14,"['พ่อ', 'ก็', 'มีชีวิต', 'เป็น', 'ของ', 'ตัวเอง', 'ลูก', 'ทำให้', 'พ่อ', 'ผิดหวัง', 'เยอะ', 'กว่า', 'พ่อ', 'ทำให้', 'ลูก', 'ผิดหวัง', 'อีก']"
1881718181783593470,twitter,post,https://x.com/CoCocutepuppy/status/1881718181783593470,text,2025-01-21T14:59:09.000Z,selenium_x_scraper_v1,ไม่ใช่หวังดีต่อลูกหรอกแต่ทำไปเพื่อสนองความต้องการของตัวเอง,ไม่ใช่หวังดีต่อลูกหรอกแต่ทำไปเพื่อสนองความต้องการของตัวเอง,2025-11-08 17:05:14,"['ไม่', 'ใช่', 'หวังดี', 'ต่อ', 'ลูก', 'หรอก', 'แต่', 'ทำ', 'ไป', 'เพื่อ', 'สนองความต้องการ', 'ของ', 'ตัวเอง']"
1881760346693857311,twitter,post,https://x.com/crta_me/status/1881760346693857311,text,2025-01-21T17:46:42.000Z,selenium_x_scraper_v1,แล้วจะให้ลูกตัวเองโง่เล่นเฟสเล่นxทั้งวันเหรอ มีหน้าที่เรียนก็เรียนไป มีหน้าที่แค่อย่างเดียว ไม่สอนก็ด่าพ่อแม่ สอนก็ด่าพ่อแม่ ตีก็ด่า ดุก็ด่า เด็กเจนz ถึงเป็นพวกกระแดะจนถึงทุกวันนี้,แล้วจะให้ลูกตัวเองโง่เล่นเฟสเล่นxทั้งวันเหรอ มีหน้าที่เรียนก็เรียนไป มีหน้าที่แค่อย่างเดียว ไม่สอนก็ด่าพ่อแม่ สอนก็ด่าพ่อแม่ ตีก็ด่า ดุก็ด่า เด็กเจนz ถึงเป็นพวกกระแดะจนถึงทุกวันนี้,2025-11-08 17:05:14,"['แล้', 'วจะ', 'ให้', 'ลูก', 'ตัวเอง', 'โง่', 'เล่น', 'เฟส', 'เล่น', 'x', 'ทั้งวัน', 'เหรอ', ' ', 'มี', 'หน้าที่', 'เรียน', 'ก็', 'เรียน', 'ไป', ' ', 'มี', 'หน้าที่', 'แค่', 'อย่าง', 'เดียว', ' ', 'ไม่', 'สอน', 'ก็', 'ด่า', 'พ่อแม่', ' ', 'สอน', 'ก็', 'ด่า', 'พ่อแม่', ' ', 'ตี', 'ก็', 'ด่า', ' ', 'ดุ', 'ก็', 'ด่า', ' ', 'เด็ก', 'เจน', 'z', ' ', 'ถึง', 'เป็น', 'พวก', 'กระแดะ', 'จนถึง', 'ทุกวันนี้']"
1881527133484306702,twitter,post,https://x.com/MorningNewsTV3/status/1881527133484306702,text,2025-01-21T02:20:00.000Z,selenium_x_scraper_v1,"#เรื่องเล่าเช้านี้ วิจารณ์ห้องน้ำโรงเรียนที่ลำปาง เป็นส้วมรวมแยกเพศ-ไม่มีฉากกั้นห้อง โรงเรียนแจงเป็นห้องน้ำเด็กอนุบาล ผู้ปกครองส่วนใหญ่เห็นด้วย แต่ล่าสุด สพฐ.สั่งแก้ไขแล้ว
#ข่าวช่อง3 #ห้องน้ำเด็กอนุบาล #ลำปาง","#เรื่องเล่าเช้านี้ วิจารณ์ห้องน้ำโรงเรียนที่ลำปาง เป็นส้วมรวมแยกเพศ-ไม่มีฉากกั้นห้อง โรงเรียนแจงเป็นห้องน้ำเด็กอนุบาล ผู้ปกครองส่วนใหญ่เห็นด้วย แต่ล่าสุด สพฐ.สั่งแก้ไขแล้ว
#ข่าวช่อง3 #ห้องน้ำเด็กอนุบาล #ลำปาง",2025-11-08 17:05:14,"['เรื่องเล่า', 'เช้านี้', ' ', 'วิจารณ์', 'ห้องน้ำ', 'โรงเรียน', 'ที่', 'ลำปาง', ' ', 'เป็น', 'ส้วม', 'รวม', 'แยก', 'เพศ', ' ', 'ไม่', 'มี', 'ฉาก', 'กั้น', 'ห้อง', ' ', 'โรงเรียน', 'แจง', 'เป็น', 'ห้องน้ำ', 'เด็ก', 'อนุบาล', ' ', 'ผู้ปกครอง', 'ส่วนใหญ่', 'เห็นด้วย', ' ', 'แต่', 'ล่าสุด', ' ', 'สพฐ', '.', 'สั่ง', 'แก้ไข', 'แล้ว', ' ', 'ข่าว', 'ช่อง', '3', ' ', 'ห้องน้ำ', 'เด็ก', 'อนุบาล', ' ', 'ลำปาง']"
1879597516389499008,twitter,post,https://x.com/crta_me/status/1879597516389499008,text,2025-01-15T18:32:23.000Z,selenium_x_scraper_v1,พวกหญิงแท้ในx ต้องเล่นบทเหยื่อทุกคนเลยสิน่า,พวกหญิงแท้ในx ต้องเล่นบทเหยื่อทุกคนเลยสิน่า,2025-11-08 17:05:14,"['พวก', 'หญิง', 'แท้', 'ใน', 'x', ' ', 'ต้อง', 'เล่น', 'บท', 'เหยื่อ', 'ทุกคน', 'เลย', 'สิ', 'น่า']"
1879441177327665197,twitter,post,https://x.com/UvgtdERt4PWmcjF/status/1879441177327665197,text,2025-01-15T08:11:09.000Z,selenium_x_scraper_v1,อีป้าคนขับรถโคตรสะเพร่า ปิดประตูไม่ดูเด็ก ลากไปไกลกว่า 30 เมตร ถึงรู้สึกตัว,อีป้าคนขับรถโคตรสะเพร่า ปิดประตูไม่ดูเด็ก ลากไปไกลกว่า 30 เมตร ถึงรู้สึกตัว,2025-11-08 17:05:14,"['อี', 'ป้า', 'คนขับรถ', 'โคตร', 'สะเพร่า', ' ', 'ปิดประตู', 'ไม่', 'ดู', 'เด็ก', ' ', 'ลาก', 'ไป', 'ไกล', 'กว่า', ' ', '30', ' ', 'เมตร', ' ', 'ถึง', 'รู้สึกตัว']"
1879596001138475292,twitter,post,https://x.com/crta_me/status/1879596001138475292,text,2025-01-15T18:26:22.000Z,selenium_x_scraper_v1,เอาคลิปคนอื่นมาด่านี่สนุกมากไหมครับ,เอาคลิปคนอื่นมาด่านี่สนุกมากไหมครับ,2025-11-08 17:05:14,"['เอา', 'คลิป', 'คนอื่น', 'มา', 'ด่า', 'นี่', 'สนุก', 'มาก', 'ไหม', 'ครับ']"
1879446440197660697,twitter,post,https://x.com/spiderdevil_kk/status/1879446440197660697,text,2025-01-15T08:32:04.000Z,selenium_x_scraper_v1,ไม่สบายไอจนแต-จะหลุดออกมาเดินเล่นอยู่ละ ,ไม่สบายไอจนแต-จะหลุดออกมาเดินเล่นอยู่ละ ,2025-11-08 17:05:14,"['ไม่', 'สบาย', 'ไอ', 'จน', 'แต', ' ', 'จะ', 'หลุด', 'ออกมา', 'เดินเล่น', 'อยู่', 'ละ']"
1879583089153982631,twitter,post,https://x.com/crta_me/status/1879583089153982631,text,2025-01-15T17:35:04.000Z,selenium_x_scraper_v1,รับเว็บพนันด้วยดีเลยครับจะได้แจ้งตำรวจทีเดียว ไปขายเสียวต่อในคะ,รับเว็บพนันด้วยดีเลยครับจะได้แจ้งตำรวจทีเดียว ไปขายเสียวต่อในคะ,2025-11-08 17:05:14,"['รับ', 'เว็บ', 'พนัน', 'ด้วยดี', 'เลย', 'ครับ', 'จะ', 'ได้', 'แจ้งตำรวจ', 'ทีเดียว', ' ', 'ไป', 'ขาย', 'เสียว', 'ต่อ', 'ใน', 'คะ']"
1879580377288990922,twitter,post,https://x.com/crta_me/status/1879580377288990922,text,2025-01-15T17:24:17.000Z,selenium_x_scraper_v1,พ่อแม่ภูมิใจไหมคัฟ อะไรฟรีๆเขาก็ดูกันหมดแหละ,พ่อแม่ภูมิใจไหมคัฟ อะไรฟรีๆเขาก็ดูกันหมดแหละ,2025-11-08 17:05:14,"['พ่อแม่', 'ภูมิใจ', 'ไหม', 'คัฟ', ' ', 'อะไร', 'ฟรี', 'ๆ', 'เขา', 'ก็', 'ดู', 'กัน', 'หมด', 'แหละ']"
1766864971965800935,twitter,post,https://x.com/crta_me/status/1766864971965800935,text,2024-03-10T16:33:30.000Z,selenium_x_scraper_v1,แล้วไปยุ่งไรเขาครับ aiมันก็เครื่องมืออันหนึ่ง ให้ดูที่เจตนาของคนทำดีกว่า สักแต่ด่าคนอื่นไปวันๆ,แล้วไปยุ่งไรเขาครับ aiมันก็เครื่องมืออันหนึ่ง ให้ดูที่เจตนาของคนทำดีกว่า สักแต่ด่าคนอื่นไปวันๆ,2025-11-08 17:05:14,"['แล้วไป', 'ยุ่ง', 'ไร', 'เขา', 'ครับ', ' ', 'ai', 'มัน', 'ก็', 'เครื่องมือ', 'อัน', 'หนึ่ง', ' ', 'ให้', 'ดู', 'ที่', 'เจตนา', 'ของ', 'คน', 'ทำ', 'ดีกว่า', ' ', 'สัก', 'แต่', 'ด่า', 'คนอื่น', 'ไป', 'วัน', 'ๆ']"
1761755964007727242,twitter,post,https://x.com/peachmoonn/status/1761755964007727242,text,2024-02-25T14:12:08.000Z,selenium_x_scraper_v1,มีใครเห็นข่าวนี้มั้ย เจอคอมเม้นต่างชาติบอกมีคนฉีดน้ำใส่เครื่องนี้ แล้วแก๊งแมวมีมที่เป็นไวรัลโดนฆ่าหมดแล้ว ,มีใครเห็นข่าวนี้มั้ย เจอคอมเม้นต่างชาติบอกมีคนฉีดน้ำใส่เครื่องนี้ แล้วแก๊งแมวมีมที่เป็นไวรัลโดนฆ่าหมดแล้ว ,2025-11-08 17:05:14,"['มี', 'ใคร', 'เห็น', 'ข่าว', 'นี้', 'มั้ย', ' ', 'เจอ', 'คอม', 'เม้น', 'ต่างชาติ', 'บอก', 'มี', 'คน', 'ฉีด', 'น้ำ', 'ใส่', 'เครื่อง', 'นี้', ' ', 'แล้ว', 'แก๊ง', 'แมว', 'มีม', 'ที่', 'เป็น', 'ไวรัล', 'โดน', 'ฆ่า', 'หมด', 'แล้ว']"
1761782174829965492,twitter,post,https://x.com/peachmoonn/status/1761782174829965492,text,2024-02-25T15:56:17.000Z,selenium_x_scraper_v1,เราไม่อยากลบโพสต์นี้ เพราะอยากกระจายข่าวให้มากที่สุดค่ะ ขอบคุณ คุณ M&M เจ้าของต้นทวิต และคุณ Tarot to you ที่ช่วยกระจายข่าวให้นะคะ เพื่อให้คนที่เก่งภาษาช่วยอัพเดทข้อมูลที่ชัดเจนอีกทีนึงค่ะ ,เราไม่อยากลบโพสต์นี้ เพราะอยากกระจายข่าวให้มากที่สุดค่ะ ขอบคุณ คุณ M&M เจ้าของต้นทวิต และคุณ Tarot to you ที่ช่วยกระจายข่าวให้นะคะ เพื่อให้คนที่เก่งภาษาช่วยอัพเดทข้อมูลที่ชัดเจนอีกทีนึงค่ะ ,2025-11-08 17:05:14,"['เรา', 'ไม่', 'อยาก', 'ลบ', 'โพสต์', 'นี้', ' ', 'เพราะ', 'อยาก', 'กระจาย', 'ข่าว', 'ให้', 'มาก', 'ที่สุด', 'ค่ะ', ' ', 'ขอบคุณ', ' ', 'คุณ', ' ', 'm', ' ', 'm', ' ', 'เจ้าของ', 'ต้น', 'ทวิ', 'ต', ' ', 'และ', 'คุณ', ' ', 'tarot', ' ', 'to', ' ', 'you', ' ', 'ที่', 'ช่วย', 'กระจาย', 'ข่าว', 'ให้', 'นะคะ', ' ', 'เพื่อให้', 'คน', 'ที่', 'เก่ง', 'ภาษา', 'ช่วย', 'อัพเดท', 'ข้อมูล', 'ที่', 'ชัดเจน', 'อีกที', 'นึง', 'ค่ะ']"
1761807140925411431,twitter,post,https://x.com/crta_me/status/1761807140925411431,text,2024-02-25T17:35:29.000Z,selenium_x_scraper_v1,ไม่อยากลบหรือหิวแสงครับ,ไม่อยากลบหรือหิวแสงครับ,2025-11-08 17:05:14,"['ไม่', 'อยาก', 'ลบ', 'หรือ', 'หิว', 'แสง', 'ครับ']"
1754916394259644742,twitter,post,https://x.com/crta_me/status/1754916394259644742,text,2024-02-06T17:14:07.000Z,selenium_x_scraper_v1,แค่เป็นตุ๊ดก็น่ากลัวพอแล้ว,แค่เป็นตุ๊ดก็น่ากลัวพอแล้ว,2025-11-08 17:05:14,"['แค่', 'เป็น', 'ตุ๊ด', 'ก็', 'น่ากลัว', 'พอแล้ว']"
1750053667552841801,twitter,post,https://x.com/crta_me/status/1750053667552841801,text,2024-01-24T07:11:23.000Z,selenium_x_scraper_v1,อายุเท่าไหร่ลงก็ผิดกฏหมายอะครับ งานชั้นต่ำ,อายุเท่าไหร่ลงก็ผิดกฏหมายอะครับ งานชั้นต่ำ,2025-11-08 17:05:14,"['อายุ', 'เท่าไหร่', 'ลง', 'ก็', 'ผิดก', 'ฏ', 'หมาย', 'อะ', 'ครับ', ' ', 'งาน', 'ชั้นต่ำ']"
